segmentnr	original	analyzed	translated
['PA_ja_35:0.1']	Jātaka	jātaka 	Birth Stories
['PA_ja_35:0.2']	Ekakanipāta	eka ka nipāta 	The Collection of Birth Stories (Ekakanipāta)
['PA_ja_35:0.3']	Kulāvakavagga	kulāvaka vagga 	The Chapter on the Cave (Kulāvakavagga)
['PA_ja_35:0.4']	5. Vaṭṭakajātaka	vaṭṭaka jātaka 	The Birth Story of Vaṭṭaka
['PA_ja_35:1.1']	“Santi pakkhā apatanā,	santi pakkhāḥ a patanā 	“There are wings that do not fly,
['PA_ja_35:1.2']	santi pādā avañcanā;	santi pādāḥ avañcanā 	there are feet that do not walk;
['PA_ja_35:1.3']	Mātāpitā ca nikkhantā,	mātā pitā ca nikkhantā 	Mother and father have gone out,
['PA_ja_35:1.4']	jātaveda paṭikkamā”ti.	jātaveda paṭikkamāti 	Jātaveda, please return.”
['PA_ja_35:2.1']	Vaṭṭakajātakaṁ pañcamaṁ.	vaṭṭaka jātakam pañcama 	The Birth Story of Vaṭṭaka, the fifth.
