segmentnr	original	analyzed	folio	translated
['PA_mil_3.5.4:0.1']	Milindapañha	milindapañha 	0	The Questions of King Milinda
['PA_mil_3.5.4:0.2']	Buddhavagga	buddha vagga 	0	The Buddha
['PA_mil_3.5.4:0.3']	4. Dhammadiṭṭhapañha	dhamma diṭṭhapañha 	0	The Question about Seeing the Dhamma
['PA_mil_3.5.4:1.1']	Rājā āha—	rājā āha 	1	The King said:
['PA_mil_3.5.4:1.2']	“bhante nāgasena, dhammo tayā diṭṭho”ti.	bhante nāgasena dhammo tayā diṭṭho ti 	1	“Revered Nāgasena, was the Dhamma seen by you?”
['PA_mil_3.5.4:1.3']	“Buddhanettiyā kho, mahārāja, buddhapaññattiyā yāvajīvaṁ sāvakehi vattitabban”ti.	buddha nettiyā kho mahā rāja buddha paññattiyā yāvajīvam sāvakehi vattitabbanti 	1	“The Buddha’s way, great king, the Buddha’s description, should be followed by disciples as long as life lasts.”
['PA_mil_3.5.4:2.1']	“Kallosi, bhante nāgasenā”ti.	kallosi bhante nāgasena ati 	2	“You are dexterous, revered Nāgasena.”
['PA_mil_3.5.4:3.1']	Dhammadiṭṭhapañho catuttho.	dhammadiṭṭhapañho catuttho 	3	The fourth question
