segmentnr	original	analyzed	folio	translated
['PA_patthana_21.33:0.1']	Paṭṭhānapakaraṇa	paṭṭhāna pakaraṇa 	0	The Paṭṭhāna Treatise
['PA_patthana_21.33:0.2']	Dhammapaccanīyānuloma (4), Dukatikapaṭṭhānapāḷi (3)	dhamma paccanīya anuloma duka tika paṭṭhāna pāḷi 	0	The Dhamma Paccanīyānuloma, Dukatikapaṭṭhānapāḷi
['PA_patthana_21.33:0.3']	21.33. Hetuduka, Atītattika	hetuduka atītattika 	0	.. Hetu-duka, Atītattika
['PA_patthana_21.33:1.1']	Nahetu napaccuppanno dhammo hetussa paccuppannassa dhammassa ārammaṇapaccayena paccayo. (Saṅkhittaṁ.)	na hetu na paccuppannaḥ dhammaḥ hetussa paccuppannassa dhammassa ārammaṇa paccayena paccayaḥ saṅkhitta 	1	A dhamma that is not a root condition and that is not a past dhamma is a condition, by way of object condition, for a root condition that is a present dhamma. (Abbreviated.)
['PA_patthana_21.33:2.1']	Ārammaṇe nava, adhipatiyā nava, anantare samanantare nava, upanissaye nava, natthiyā vigate nava.	ārammaṇe nava adhipatiyā nava anantare samanantare nava upanissaye nava natthiyā vigate nava 	2	In the object nine, in the predominance nine, in the immediately preceding nine, in the support nine, in the absence nine, in the disappearance nine.
