segmentnr	original	analyzed	folio	translated
['PA_thag_1.5:0.1']	Theragāthā 1.5	theragāthā 	0	Verses of the Elders
['PA_thag_1.5:0.2']	Ekakanipāta	eka ka nipāta 	0	The Collection of Ones
['PA_thag_1.5:0.3']	Paṭhamavagga	paṭhama vagga 	0	First Section
['PA_thag_1.5:0.4']	Dabbattheragāthā	dabbatthera gāthā 	0	Dabba the Elder
['PA_thag_1.5:1.1']	“Yo duddamiyo damena danto,	yaḥ duddamiyaḥ damena 	1	The one who is tamed by the one hard to tame,
['PA_thag_1.5:1.2']	Dabbo santusito vitiṇṇakaṅkho;	dabbaḥ santusitaḥ vitiṇṇa kaṅkhaḥ 	1	Dabba, content, his doubts cut off,
['PA_thag_1.5:1.3']	Vijitāvī apetabheravo hi,	vijitāvī apeta bheravaḥ hi 	1	The victor, his fear removed,
['PA_thag_1.5:1.4']	Dabbo so parinibbuto ṭhitatto”ti.	dabbaḥ saḥ parinibbutaḥ ṭhita ttaḥ ti 	1	Dabba, he is fully extinguished, his work done.
['PA_thag_1.5:1.5']	Itthaṁ sudaṁ āyasmā dabbo thero gāthaṁ abhāsitthāti.	ittham sudam āyasmā dabbaḥ theraḥ gātham abhāsittha ati 	1	Thus the elder Dabba spoke this verse.
