segmentnr	original	analyzed	folio	translated
['PA_thag_1.68:0.1']	Theragāthā 1.68	theragāthā 	0	Verses of the Elders 
['PA_thag_1.68:0.2']	Ekakanipāta	eka ka nipāta 	0	The Collection of Ones 
['PA_thag_1.68:0.3']	Sattamavagga	sattama vagga 	0	The Seventh Chapter 
['PA_thag_1.68:0.4']	Ekudāniyattheragāthā	ekudāniyattheragāthā 	0	Ekudāniya 
['PA_thag_1.68:1.1']	“Adhicetaso appamajjato,	adhicetasaḥ appamajjataḥ 	1	For one of lofty mind, not negligent, 
['PA_thag_1.68:1.2']	Munino monapathesu sikkhato;	muninaḥ mona pathesu sikkhataḥ 	1	training in the sage’s way of life, 
['PA_thag_1.68:1.3']	Sokā na bhavanti tādino,	sokāḥ na bhavanti tādinaḥ 	1	sorrow does not arise for the one who is patient, 
['PA_thag_1.68:1.4']	Upasantassa sadā satīmato”ti.	upasantassa sadā satīmataḥ ti 	1	for the one who is peaceful, always mindful. 
['PA_thag_1.68:1.5']	… Ekudāniyo thero ….	ekudāniyaḥ theraḥ 	1	… the elder Ekudāniya …
