segmentnr	original	analyzed	translated
['PA_thag_1.42:0.1']	Theragāthā 1.42	theragāthā 	Verses of the Elders
['PA_thag_1.42:0.2']	Ekakanipāta	eka ka nipāta 	The Collection of Ones
['PA_thag_1.42:0.3']	Pañcamavagga	pañcama vagga 	The Fifth Chapter
['PA_thag_1.42:0.4']	Khadiravaniyattheragāthā	     	Khadiravaniya
['PA_thag_1.42:1.1']	“Cāle upacāle sīsūpacāle (…),	cāle upacāle sīsūpacāle 	“Shaking, trembling, shaking the head,
['PA_thag_1.42:1.2']	Patissatā nu kho viharatha;	patissatā nu kho viharatha 	Dwelling mindfully,
['PA_thag_1.42:1.3']	Āgato vo vālaṁ viya vedhī”ti.	āgataḥ vaḥ vālam viya vedhi iti 	The arrow has come to you like a hair.”
['PA_thag_1.42:1.4']	… Khadiravaniyo thero ….	khadira vaniyaḥ theraḥ 	… the elder Khadiravaniya …
