segmentnr	original	analyzed	translated
['PA_thag_1.111:0.1']	Theragāthā 1.111	theragāthā 	Verses of the Elders
['PA_thag_1.111:0.2']	Ekakanipāta	eka ka nipāta 	The Collection of Ones
['PA_thag_1.111:0.3']	Dvādasamavagga	dvādasama vagga 	The Twelfth Chapter
['PA_thag_1.111:0.4']	Jentattheragāthā	jentattheragāthā 	Jenta 
['PA_thag_1.111:1.1']	“Duppabbajjaṁ ve duradhivāsā gehā,	duppabbajjam ve duradhivāsāḥ gehā 	“Going forth is hard, living at home is hard, 
['PA_thag_1.111:1.2']	Dhammo gambhīro duradhigamā bhogā;	dhammo gambhīraḥ duradhigamāḥ bhogāḥ 	The Dhamma is deep, wealth is hard to get, 
['PA_thag_1.111:1.3']	Kicchā vutti no itarītareneva,	itarītarena iva 	It’s hard to make a living by any other means, 
['PA_thag_1.111:1.4']	Yuttaṁ cintetuṁ satatamaniccatan”ti.	yuttam cintetum 	It’s fitting to always think of impermanence.” 
['PA_thag_1.111:1.5']	… Jento thero ….	jentaḥ theraḥ 	… the elder Jenta …
