segmentnr	original	analyzed
PA_anya-e09_02n:357_0	Vissajjanā – kāsīsu bhante kīṭāgirismiṃ kāsīnaṃ nigame assajipunabbasuke bhikkhū	vissajjanā kāsīsu bhante kīṭāgirismim kāsīnam nigame assajipunabbasuke bhikkhū 
PA_anya-e09_02n:357_1	ārabbha bhāsitaṃ. Assajipunabbasukā bhante bhikkhū bhikkhūhi sahadhammikaṃ vuccamānā	ārabbha bhāsitam assajipu nabbasukāḥ bhante bhikkhū bhikkhūhi sahadhammikam vuccamānā 
PA_anya-e09_02n:357_2	evamāhaṃsu “mayaṃ kho āvuso sāyañceva bhuñjāma pāto ca divā ca vikāle, te mayaṃ sāyañceva	evam āhaṃsu mayam khalu āvuso sāyam ca iva bhuñjāma pāto ca divā ca vikāle te mayam sāyam ca iva 
PA_anya-e09_02n:357_3	bhuñjamānā pāto ca divā ca vikāle appābādhatañca sañjānāma appātaṅkatañca lahuṭṭhānañca	bhuñjamānā ca divā ca vikāle appa ābādha tañca sañjānāma appa ātaṅka tañca lahu ṭṭhānañca 
PA_anya-e09_02n:357_4	balañca phāsuvihārañca, te mayaṃ kiṃ sandiṭṭhikaṃ hitvā kālikaṃ anudhāvissāma, sāyañceva	balañca phāsu vihārañca te mayam kim sandiṭṭhikam hitvā kālikam anudhāvissāma sāyam ca iva 
PA_anya-e09_02n:357_5	mayaṃ bhuñjissāma pāto ca divā ca vikāle”ti. Tasmiṃ bhante vatthusmiṃ bhāsitaṃ.	mayam bhuñjissāma pāto ca divā ca vikāla iti tasmim bhante vatthusmim bhāsitam 
PA_anya-e09_02n:358	Tevijjavacchasutta	tevijjavacchasutta 
PA_anya-e09_02n:359	Pucchā – tevijjavacchasuttaṃ panāvuso bhagavatā kattha kaṃ ārabbha kismiṃ vatthusmiṃ bhāsitaṃ.	pucchā tevijjavaccha suttam pana āvuso bhagavatā kattha kam ārabbha kismim vatthusmim bhāsitam 
PA_anya-e09_02n:360_0	Vissajjanā – vesāliyaṃ bhante vacchagottaṃ paribbājakaṃ ārabbha bhāsitaṃ. Vacchagotto	vissajjanā vesāliyam bhante vacchagottam paribbājakam ārabbha bhāsitam vacchagotto 
PA_anya-e09_02n:360_1	bhante paribbājako bhagavantaṃ etadavoca “sutaṃ me bhante samaṇo gotamo sabbaññū	bhante paribbājakaḥ bhagavantam etat avoca sutam me bhante samaṇaḥ gotamaḥ sabbaññū 
PA_anya-e09_02n:360_2	sabbadassāvī aparisesaṃ ñāṇadassanaṃ paṭijānāti, carato ca me tiṭṭhato ca suttassa	sabba dassāvī aparisesam ñāṇa dassanam paṭijānāti carataḥ ca me tiṭṭhataḥ ca suttassa 
PA_anya-e09_02n:360_3	ca jāgarassa ca satataṃ samitaṃ ñāṇadassanaṃ paccupaṭṭhita”nti. Ye te bhante evamāhaṃsu	ca jāgarassa ca satatam samitam ñāṇa dassanam paccupaṭṭhitanti ye te bhante evam āhaṃsu 
PA_anya-e09_02n:360_4	“samaṇo gotamo sabbaññū sabbadassāvī aparisesaṃ ñāṇadassanaṃ paṭijānāti, carato ca	samaṇaḥ gotamaḥ sabbaññū sabba dassāvī aparisesam ñāṇa dassanam paṭijānāti carataḥ ca 
PA_anya-e09_02n:360_5	me tiṭṭhato ca suttassa ca jāgarassa ca satataṃ samitaṃ ñāṇadassanaṃ paccupaṭṭhita”nti.	me tiṭṭhataḥ ca suttassa ca jāgarassa ca satatam samitam ñāṇa dassanam paccupaṭṭhitanti 
PA_anya-e09_02n:360_6	Kacci te bhante bhagavato vuttavādino, na ca bhagavantaṃ abhūtena abbhācikkhanti,	kacci te bhante bhagavataḥ vutta vādinaḥ na ca bhagavantam abhūtena abbhācikkhanti 
PA_anya-e09_02n:360_7	dhammassa cānudhammaṃ byākaronti, na ca koci sahadhammiko vādānuvādo gārayhaṃ ṭhānaṃ	dhammassa ca anudhammam byākaronti na ca koci sahadhammikaḥ vādānuvādaḥ gārayham ṭhānam 
PA_anya-e09_02n:360_8	āgacchatī”ti. Tasmiṃ bhante vatthusmiṃ bhāsitaṃ.	āgacchati iti tasmim bhante vatthusmim bhāsitam 
PA_anya-e09_02n:361	Aggivacchasutta	aggivacchasutta 
PA_anya-e09_02n:362	Pucchā – aggivacchasuttaṃ panāvuso kattha kaṃ ārabbha kismiṃ vatthusmiṃ bhāsitaṃ.	pucchā aggivaccha suttam pana āvuso kattha kam ārabbha kismim vatthusmim bhāsitam 
PA_anya-e09_02n:363_0	Vissajjanā – sāvatthiyaṃ bhante vacchagottaṃ paribbājakaṃ bhāsitaṃ. Vacchagotto bhante	vissajjanā sāvatthiyam bhante vacchagottam paribbājakam bhāsitam vacchagottaḥ bhante 
PA_anya-e09_02n:363_1	paribbājako bhagavantaṃ upasaṅkamitvā “kiṃ nu kho bho gotama ‘sassato loko idameva	paribbājakaḥ bhagavantam upasaṅkamitvā kim nu kho bho gotama sassataḥ lokaḥ idam eva 
PA_anya-e09_02n:363_2	saccaṃ moghamañña’nti evaṃdiṭṭhi bhavaṃ gotamo”ti evamādikaṃ pañhaṃ apucchi. Tasmiṃ	saccam mogham aññanti evaṃdiṭṭhi bhavam gotama iti evamādikam pañham apucchi tasmin 
PA_anya-e09_02n:363_3	bhante vatthusmiṃ bhāsitaṃ.	bhante vatthusmim bhāsitam 
PA_anya-e09_02n:364	Mahāvacchasutta	mahāvaccha sutta 
PA_anya-e09_02n:365	Pucchā – mahāvacchasuttaṃ panāvuso bhagavatā kattha kaṃ ārabbha kismiṃ vatthusmiṃ bhāsitaṃ.	pucchā mahāvaccha suttam pana āvuso bhagavatā kattha kam ārabbha kismim vatthusmim bhāsitam 
PA_anya-e09_02n:366_0	Vissajjanā – rājagahe bhante vacchagottaṃyeva paribbājakaṃ ārabbha bhāsitaṃ. Vacchagotto	vissajjanā rājagahe bhante vacchagottam yā iva paribbājakam ārabbha bhāsitam 
PA_anya-e09_02n:366_1	bhante paribbājako bhagavantaṃ upasaṅkamitvā etadavoca “dīgharattāhaṃ bhotā gotamena	bhante paribbājakaḥ bhagavantam upasaṅkamitvā etat avoca dīgharattā aham bhotā gotamena 
PA_anya-e09_02n:366_2	sahakathī, sādhu me bhavaṃ gotamo saṃkhittena kusalākusalaṃ desetū”ti. Tasmiṃ bhante	saha kathī sādhu me bhavam gotamaḥ saṃkhittena kusala akusalam desetu uti tasmin bhante 
PA_anya-e09_02n:366_3	vatthusmiṃ bhāsitaṃ.	vatthusmin bhāsitam 
PA_anya-e09_02n:367	Pucchā – evaṃ vutte kho āvuso vacchagotto paribbājako imasmiṃ dhammavinaye pasanno hutvā kīdisaṃ pasannākāraṃ akāsi, kathañcassa dhammābhisamayo ahosi.	pucchā evam vutte kho āvuso vaccha gottaḥ paribbājakaḥ imasmin dhamma vinaye pasannaḥ hutvā kīdisam pasanna ākāram akāsi katham ca assa dhamma abhisamayaḥ ahosi 
PA_anya-e09_02n:368_0	Vissajjanā – evaṃ vutte bhante vacchagotto paribbājako “sace hi bho gotama imaṃ dhammaṃ	vissajjanā evam vutte bhante vaccha gottaḥ paribbājako sace hi bho gotamaḥ imam dhammaṃ 
PA_anya-e09_02n:368_1	bhavaṃyeva gotamo ārādhako abhavissa, no ca kho bhikkhū ārādhakā abhavissaṃsu, evamidaṃ	bhavaṃyā iva gotamaḥ ārādhakaḥ abhavissa no ca kho bhikkhū ārādhakāḥ abhavissaṃsu evam idam 
PA_anya-e09_02n:368_2	brahmacariyaṃ aparipūraṃ abhavissa tenaṅgenā”ti evamādinā imasmiṃ dhammavinaye pasanno	brahmacariyam a paripūram abhavissa tena aṅgena ati evamādinā imasmin dhamma vinaye pasannaḥ 
PA_anya-e09_02n:368_3	pasannākāramakāsi. Yāva arahattañcassa dhammābhisamayo ahosi.	pasanna ākāram akāsi yāva arahattañca assa dhamma abhisamayaḥ ahosi 
PA_anya-e09_02n:369	Dīghanakhasutta	dīgha nakha sutta 
PA_anya-e09_02n:370	Pucchā – dīghanakhasuttaṃ panāvuso bhagavatā kattha kaṃ ārabbha kismiṃ vatthusmiṃ bhāsitaṃ.	pucchā dīghanakha suttam pana āvuso bhagavatā kattha kam ārabbha kismim vatthusmim bhāsitam 
PA_anya-e09_02n:371_0	Vissajjanā – rājagahe bhante dīghanakhaṃ paribbājakaṃ ārabbha bhāsitaṃ. Dīghanakho	vissajjanā rājagahe bhante dīghanakham paribbājakam ārabbha bhāsitam dīghanakhaḥ 
PA_anya-e09_02n:371_1	bhante paribbājako bhagavantaṃ upasaṅkamitvā etadavoca “ahañhi bho gotama evaṃvādī	bhante paribbājakaḥ bhagavantam upasaṅkamitvā etat avoca aham hi bho gotamaḥ evaṃvādī 
PA_anya-e09_02n:371_2	evaṃdiṭṭhi sabbaṃ me nakkhamatī”ti. Tasmiṃ bhante vatthusmiṃ bhāsitaṃ.	evaṃdiṭṭhi sabbam me na khamati iti tasmim bhante vatthusmim bhāsitam 
PA_anya-e09_02n:372	Pucchā – imasmiṃ ca panāvuso veyyākaraṇasmiṃ bhaññamāne kesaṃ puggalānaṃ visesādhigamo ahosi.	pucchā imasmim ca pana āvuso veyyākaraṇasmim bhaññamāne kesam puggalānam visesa adhigamaḥ ahosi 
PA_anya-e09_02n:373_0	Vissajjanā – imasmiñca pana bhante veyyākaraṇasmiṃ bhaññamāne āyasmato sāriputtassa	vissajjanā imasmin ca pana bhante veyyākaraṇasmiṃ bhaññamāne āyasmataḥ sāriputtassa 
PA_anya-e09_02n:373_1	anupādāya āsavehi cittaṃ vimucci, dīghanakhassa pana paribbājakassa tasmiṃyeva āsane	an upādāya āsavehi cittam vimucci dīghanakhassa pana paribbājakassa tasmiṃ yeva āsane 
PA_anya-e09_02n:373_2	virajaṃ vītamalaṃ dhammacakkhuṃ udapādi yaṃkiñci samudayadhammaṃ, sabbaṃ taṃ nirodhadhamma”nti.	virajam vīta malam dhamma cakkhum udapādi yaṃ kiñci samudaya dhammam sabbam tat nirodha dhamman ti 
PA_anya-e09_02n:374	Māgaṇḍiyasutta	māgaṇḍiyasutta 
PA_anya-e09_02n:375	Pucchā – māgaṇḍiyasuttaṃ panāvuso bhagavatā kattha kaṃ ārabbha kismiṃ vatthusmiṃ bhāsitaṃ.	pucchā māgaṇḍiya suttam pana āvuso bhagavatā kattha kam ārabbha kismim vatthusmim bhāsitam 
PA_anya-e09_02n:376_0	Vissajjanā – kurūsu bhante kammāsadhamme nāma kurūnaṃ nigame bhāradvāja gottassa	vissajjanā kurūsu bhante kammāsadhamme nāma kurūnam nigame bhāradvāja gottassa 
PA_anya-e09_02n:376_1	brāhmaṇassa agyāgāre tiṇasanthārake māgaṇḍiyaṃ paribbājakaṃ ārabbha bhāsitaṃ. Māgaṇḍiyo	brāhmaṇassa agyāgāre tiṇa santhārake māgaṇḍiyam paribbājakam ārabbha bhāsitam māgaṇḍiyaḥ 
PA_anya-e09_02n:376_2	bhante paribbājako bhagavantaṃ “bhūnahu samaṇo gotamo”ti vadesi, tasmiṃ bhante vaṭṭhusmiṃ bhāsitaṃ.	bhante paribbājakaḥ bhagavantam bhūnahu samaṇaḥ gotamaḥ iti vadesi tasmim bhante vaṭṭhusmim bhāsitam 
PA_anya-e09_02n:377	Pucchā – kathañcāvuso bhagavā tattha māgaṇḍiyassa paribbājakassa samanuyuñjitvā samanuyuñjitvā dhammaṃ desesi.	pucchā kathañca āvuso bhagavā tattha māgaṇḍiyassa paribbājakassa samanuyuñjitvā samanuyuñjitvā dhammaṃ desesi 
PA_anya-e09_02n:378_0	Vissajjanā – “cakkhuṃ kho māgaṇḍiya rūpārataṃ rūpasammuditaṃ, taṃ tathāgatassa dantaṃ	vissajjanā cakkhum kho māgaṇḍiya rūpa āratam rūpa sammuditam tam tathāgatassa dantam 
PA_anya-e09_02n:378_1	guttaṃ rakkhitaṃ saṃvutaṃ, tassa ca saṃvarāya dhammaṃ desetī”ti evamādinā bhante	guttam rakkhitam saṃvutam tassa ca saṃvarāya dhammaṃ deseti iti evamādinā bhante 
PA_anya-e09_02n:378_2	tattha bhagavā māgaṇḍiyassa paribbājakassa samanuyuñjitvā samanuyuñjitvā dhammaṃ desesi.	tattha bhagavā māgaṇḍiyassa paribbājakassa samanuyuñjitvā samanuyuñjitvā dhammaṃ desesi 
PA_anya-e09_02n:379	Pucchā – evaṃ kho āvuso māgaṇḍiyena paribbājakena “nakiñci bho gotamā”ti yathābhūtaṃ paṭissute kathaṃ bhagavā attanopi na kiñci kenacipi vattabbataṃ pakāsesi.	pucchā evam kho āvuso māgaṇḍiyena paribbājakena na kiñci bho gotama ati yathābhūtam paṭissute katham bhagavā attanaḥ api na kiñci kenacipi vattabbatam pakāsesi 
PA_anya-e09_02n:380_0	Vissajjanā – evaṃ kho bhante māgaṇḍiyena paribbājakena nakiñci bhogotamāti yathābhūtaṃ	vissajjanā evam kho bhante māgaṇḍiyena paribbājakena na kiñci bhogotama ati yathābhūtam 
PA_anya-e09_02n:380_1	paṭissute “ahaṃ kho pana māgaṇḍiya pubbe agāriyabhūto samāno pañcahi kāmaguṇehi samappito	paṭissute aham kho pana māgaṇḍiya pubbe agāriya bhūtaḥ samāno pañcahi kāmaguṇehi samappitaḥ 
PA_anya-e09_02n:380_2	samaṅgībhūto paricāresiṃ cakkhuviññeyyahi rūpehi iṭṭhehi manāpehi piyarūpehi kāmūpasaṃhitehi	samaṅgībhūtaḥ paricāresim cakkhu viññeyyahi rūpehi iṭṭhehi manāpehi piya rūpehi kāma upasaṃhitehi 
PA_anya-e09_02n:380_3	rajanīyehī”ti evamādinā bhagavā attanopi na kiñci kenacipi vattabbataṃ pakāsesi.	rajanīyehi iti evamādinā bhagavā attanaḥ api na kiñci kenacipi vattabbatam pakāsesi 
PA_anya-e09_02n:381	Pucchā – imasmiṃ sutte pariyosānapucchaṃ pucchissāmi imañca panāvuso dhammadesanaṃ sutvā māgaṇḍiyo paribbājako imasmiṃ dhammavinaye pasanno hutvā kīdisaṃ pasannākāramakāsi.	pucchā imasmim sutte pariyosāna puccham pucchissāmi imam ca pana āvuso dhamma desanam sutvā māgaṇḍiyaḥ paribbājakaḥ imasmim dhamma vinaye pasannaḥ hutvā kīdisam pasanna ākāram akāsi 
PA_anya-e09_02n:382_0	Vissajjanā – imaṃ ca pana bhante dhammadesanaṃ sutvā māgaṇḍiyo paribbājako ‘abhikkantaṃ	vissajjanā imam ca pana bhante dhamma desanam sutvā māgaṇḍiyaḥ paribbājakaḥ abhikkantam 
PA_anya-e09_02n:382_1	bho gotama abhikkantaṃ bho gotamā”ti evamādinā imasmiṃ dhammavinaye pasanno pasannākāramakāsi.	bho gotama abhikkantam bho gotama ati evamādinā imasmin dhamma vinaye pasannaḥ pasanna ākāram akāsi 
PA_anya-e09_02n:383	Sandakasutta	sandaka sutta 
PA_anya-e09_02n:384	Pucchā – sandakasuttaṃ panāvuso kattha kaṃ ārabbha kismiṃ vatthusmiṃ kena bhāsitaṃ.	pucchā sandaka suttam pana āvuso kattha kam ārabbha kismim vatthusmim kena bhāsitam 
PA_anya-e09_02n:385_0	Vissajjanā – kosambiyaṃ bhante sandakaṃ paribbājakaṃ ārabbha āyasmatā ānandattherena	vissajjanā kosambiyam bhante sandakam paribbājakam ārabbha āyasmatā ānanda therena 
PA_anya-e09_02n:385_1	dhammabhaṇḍāgārikena bhāsitaṃ. Sandako bhante paribbājako āyasmantaṃ ānandaṃ etadavoca	dhammabhaṇḍāgārikena bhāsitam sandakaḥ bhante paribbājakaḥ āyasmantam ānandam etat avoca 
PA_anya-e09_02n:385_2	“sādhuvata bhavantaṃyeva ānandaṃ paṭibhātu sake ācariya ke dhammikathā”ti, tasmiṃ	sādhuvata bhavantam yā iva ānandam paṭibhātu sake ācariya ke dhammi kathā ati tasmin 
PA_anya-e09_02n:385_3	bhante vatthusmiṃ bhāsitaṃ.	bhante vatthusmim bhāsitam 
PA_anya-e09_02n:386	Pucchā – kathañcāvuso tattha cattāro abrahmacariyavāsā āyasmatā ānandattherena dhammabhaṇḍāgārikena vicāretvā pakāsitā.	pucchā kathañca āvuso tattha cattāro abrahmacariya vāsāḥ āyasmatā ānanda therena dhammabhaṇḍāgārikena vicāretvā pakāsitā 
PA_anya-e09_02n:387_0	Vissajjanā – idha sandaka ekacco satthā evaṃvādī hoti evaṃdiṭṭhi natthi dinnaṃ, natthi	vissajjanā idha sandake ekaccaḥ satthā evaṃvādī hoti evaṃdiṭṭhi natthi dinnam natthi 
PA_anya-e09_02n:387_1	yiṭṭhaṃ, natthi hutaṃ, natthi sukatadukkaṭānaṃ kammānaṃ phalaṃvipāko, natthi ayaṃloko,	yiṭṭham natthi hutam natthi su kata dukkaṭānam kammānam phalaṃ vipākaḥ natthi ayaṃ loko 
PA_anya-e09_02n:387_2	natthi paroloko, natthi mātā, natthi pitā, natthi sattā opapātikāti	natthi parolokaḥ natthi mātā natthi pitā natthi sattā opapātikā ati 
PA_anya-e09_02n:388	Evamādinā bhante tattha āyasmatā ānandattherena dhammabhaṇḍāgārikena cattāro abrahmacariyavāsā vicāretvā pakāsitā.	evamādinā bhante tattha āyasmatā ānanda therena dhammabhaṇḍāgārikena cattāraḥ abrahmacariya vāsāḥ vicāretvā pakāsitā 
PA_anya-e09_02n:389	Pucchā – kathañcāvuso tattha cattāri anassāsikāni brahmacariyāni āyasmatā ānandattherena dhammabhaṇḍāgārikena vicāretvā pakāsitāni.	pucchā katham ca āvuso tattha cattāri anassāsikāni brahmacariyāni āyasmatā ānanda therena dhammabhaṇḍāgārikena vicāretvā pakāsitāni 
PA_anya-e09_02n:390_0	Vissajjanā – idha sandaka ekacco satthā sabbaññū sabbadassāvī aparisesaṃ ñāṇadassanaṃ	vissajjanā idha sandakaḥ ekaccaḥ satthā sabbaññū sabba dassāvī aparisesam ñāṇa dassanam 
PA_anya-e09_02n:390_1	paṭijānāti “carato ca me tiṭṭhato ca suttassa ca jāgarassa ca satataṃ samitaṃ ñāṇadassanaṃ	paṭijānāti carataḥ ca me tiṭṭhataḥ ca suttassa ca jāgarassa ca satatam samitam ñāṇa dassanam 
PA_anya-e09_02n:390_2	paccupaṭṭhita”nti evamādinā bhante tattha āyasmatā ānandattherena dhammabhaṇḍāgārikena	paccupaṭṭhita nti evamādinā bhante tattha āyasmatā ānanda therena dhammabhaṇḍa āgārikena 
PA_anya-e09_02n:390_3	cattāri anassāsikāni brahmacariyāni vibhajitvā pakāsitāni.	cattāri anassāsikāni brahmacariyāni vibhajitvā pakāsitāni 
PA_anya-e09_02n:391	Pucchā – atha	pucchā atha 
PA_anya-e09_02n:392	Kho āvuso sandako paribbājako āyasmantaṃ ānandattheraṃ kathaṃ pucchi, tathañcassāyasmānandatthero byākāsi.	kho āvuso sandakaḥ paribbājakaḥ āyasmantam ānanda ttheram katham pucchi tathat ca assa āyasmā ānanda ttheraḥ byākāsi 
PA_anya-e09_02n:393_0	Vissajjanā – atha kho bhante sandako paribbājako “so pana bho ānanda satthā kiṃvādī	vissajjanā atha kho bhante sandakaḥ paribbājako saḥ pana bho ānanda satthā kiṃvādī 
PA_anya-e09_02n:393_1	kiṃ akkhāyī”ti evamādinā āyasmantaṃ ānandattheraṃ pucchi, āyasmā ca bhante ānandatthero	kim akkhāyi iti evamādinā āyasmantam ānanda ttheram pucchi āyasmā ca bhante ānanda tthero 
PA_anya-e09_02n:393_2	“idha sandaka tathāgato loke uppajjati arahaṃ sammāsambuddho vijjācaraṇasampanno”ti	idha sandaka tathāgataḥ loke uppajjati araham sammāsambuddhaḥ vijjā caraṇa sampannaḥ ti 
PA_anya-e09_02n:393_3	evamādinā sandakassa paribbājakassa vibhajitvā vibhajitvā byākāsi.	evamādinā sandakassa paribbājakassa vibhajitvā vibhajitvā byākāsi 
PA_anya-e09_02n:394	Pucchā – imañca panāvuso dhammadesanaṃ sutvā sandako paribbājako imasmiṃ dhammavinaye pasanno kīdisaṃ pasannākāramakāsi.	pucchā imam ca pana āvuso dhamma desanam sutvā sandakaḥ paribbājakaḥ imasmin dhamma vinaye pasannaḥ kīdisam pasanna ākāram akāsi 
PA_anya-e09_02n:395_0	Vissajjanā – imañca bhante dhammadesanaṃ sutvā sandako paribbājako “acchariyaṃ bho	vissajjanā imam ca bhante dhamma desanam sutvā sandakaḥ paribbājakaḥ acchariyam bho 
PA_anya-e09_02n:395_1	ānanda, abbhutaṃ bho ānanda, na ca nāma sadhammokkaṃsanā bhavissati, na paradhammavambhanā,	ānanda abbhutam bho ānanda na ca nāma sadhamma ukkaṃsanā bhavissati na para dhamma vambhanā 
PA_anya-e09_02n:395_2	āyatane ca dhammadesanā, tāva bahukā ca niyyātāro paññāyissantī”ti evamādinā imasmiṃ	āyatane ca dhamma desanā tāva bahukā ca niyyātāro paññāyissanti iti evamādinā imasmin 
PA_anya-e09_02n:395_3	dhammavinaye pasanno pasannākāramakāsi.	dhamma vinaye pasannaḥ pasanna ākāram akāsi 
PA_anya-e09_02n:396	Mahāsakuludāyīsutta	mahāsakuludāyīsutta 
PA_anya-e09_02n:397	Pucchā – mahāsakuludāyisuttaṃ panāvuso bhagavatā kattha kaṃ ārabbha kismiṃ vatthusmiṃ bhāsitaṃ.	pucchā mahā sakuludāyi suttam pana āvuso bhagavatā kattha kam ārabbha kismim vatthusmim bhāsitam 
PA_anya-e09_02n:398_0	Vissajjanā – rājagahe bhante sakuludāyiṃ paribbājakaṃ ārabbha bhāsitaṃ. Sakuludāyī	vissajjanā rājagahe bhante sa kuludāyim paribbājakam ārabbha bhāsitam sa kuludāyī 
PA_anya-e09_02n:398_1	bhante paribbājako purimāni divasāni purimatarāni kotūhalasālāyaṃ nānātitthiyānaṃ	bhante paribbājako purimāni divasāni purimatarāni kotūhalasālāyam nānā titthiyānam 
PA_anya-e09_02n:398_2	samaṇabrāhmaṇānaṃ yāvatako ahosi bhagavantañca cha ca satthāro ārabbha kathāsallāpo,	samaṇa brāhmaṇānam yāvatakaḥ ahosi bhagavantam ca cha ca satthāraḥ ārabbha kathā sallāpaḥ 
PA_anya-e09_02n:398_3	taṃ sabbaṃ bhagavato ārocesi. Tasmiṃ bhante vatthusmiṃ bhāsitaṃ.	tam sabbam bhagavataḥ ārocesi tasmim bhante vatthusmim bhāsitam 
PA_anya-e09_02n:399	Samaṇamuṇḍikasutta	samaṇa muṇḍika sutta 
PA_anya-e09_02n:400	Pucchā – samaṇamuṇḍikasuttaṃ panāvuso bhagavatā kattha kaṃ ārabbha kismiṃ vatthusmiṃ bhāsitaṃ.	pucchā samaṇamuṇḍika suttam pana āvuso bhagavatā kattha kam ārabbha kismim vatthusmim bhāsitam 
PA_anya-e09_02n:401_0	Vissajjanā – sāvatthiyaṃ bhante uggāhamāna paribbājakaṃ samaṇamuṇḍikāputtaṃ ārabbha	vissajjanā sāvatthiyam bhante uggāhamāna paribbājakam samaṇa muṇḍikā puttam ārabbha 
PA_anya-e09_02n:401_1	bhāsitaṃ. Uggāhamāno bhante paribbājako samaṇamuṇḍikāputto pañcakaṅgaṃ tapatiṃ etadavoca	bhāsitam uggāhamānaḥ bhante paribbājakaḥ samaṇamuṇḍikāputto pañcakaṅgam tapatim etat avoca 
PA_anya-e09_02n:401_2	“catūhi kho ahaṃ gahapati dhammehi samannāgataṃ purisapuggalaṃ paññapemi sampannakusalaṃ	catūhi kho aham gahapati dhammehi samannāgatam purisa puggalam paññapemi sampanna kusalam 
PA_anya-e09_02n:401_3	paramakusalaṃ uttamapattipattaṃ samaṇaṃ ayojjha”nti, tasmiṃ bhante vatthusmiṃ bhāsitaṃ.	parama kusalam uttama patti pattam samaṇam a yojjhanti tasmin bhante vatthusmin bhāsitam 
PA_anya-e09_02n:402	Cūḷasakuludāyīsutta	cūḷasakuludāyīsutta 
PA_anya-e09_02n:403	Pucchā – cūḷasakuludāyīsuttaṃ panāvuso bhagavatā kattha kaṃ ārabbha kismiṃ vatthusmiṃ bhāsitaṃ.	pucchā cūḷasakuludāyīsuttam pana āvuso bhagavatā kattha kam ārabbha kismim vatthusmim bhāsitam 
PA_anya-e09_02n:404_0	Vissajjanā – rājagahe bhante sakuludāyiṃ paribbājakaṃ ārabbha bhāsitaṃ, sakuludāyī	vissajjanā rājagahe bhante sa kuludāyim paribbājakam ārabbha bhāsitam sa kuludāyī 
PA_anya-e09_02n:404_1	bhante paribbājako bhagavantaṃ etadavoca “yadāhaṃ bhante imaṃ parisaṃ anupasaṅkanto	bhante paribbājakaḥ bhagavantam etat avoca yadā aham bhante imam parisam an upasaṅkantaḥ 
PA_anya-e09_02n:404_2	homi, athāyaṃ parisā anekavihitaṃ tiracchānakathaṃ kathenti nisinnā hoti. Yadā ca	atha ayam parisā aneka vihitam tiracchāna katham kathenti nisinnāḥ yadā ca 
PA_anya-e09_02n:404_3	kho ahaṃ bhante imaṃ parisaṃ upasaṅkamanto homi, athāyaṃ parisā mamaññeva mukhaṃ	kho aham bhante imam parisam upasaṅkamantaḥ homi atha ayam parisā mamaññā iva mukham 
PA_anya-e09_02n:404_4	ullokentī nisinnā hoti ‘yaṃ no samaṇo udāyī dhammaṃ bhāsissati, taṃ sossāmā’ti, yadā	ullokentī nisinnā hoti yam naḥ samaṇaḥ udāyī dhammam bhāsissati tam sossāma ati yadā 
PA_anya-e09_02n:404_5	pana bhante bhagavā imaṃ parisaṃ upasaṅkanto hoti, athāhañceva ayañca parisā bhagavato	pana bhante bhagavā imam parisam upasaṅkantaḥ hoti atha aham ca iva ayam ca parisā bhagavato 
PA_anya-e09_02n:404_6	mukhaṃ ullokentā nisinnā homa yaṃ no bhagavā dhammaṃ bhāsissati, taṃ sossāmā”ti,	mukham ullokentāḥ nisinnāḥ homa yam naḥ bhagavā dhammam bhāsissati tam sossāma ati 
PA_anya-e09_02n:404_7	tasmiṃ bhante vatthusmiṃ bhāsitaṃ.	tasmin bhante vatthusmin bhāsitam 
PA_anya-e09_02n:405	Vekhanasasutta	vekhanasa sutta 
PA_anya-e09_02n:406	Pucchā – vekhanasasuttaṃ panāvuso bhagavatā kattha kaṃ ārabbha kismiṃ vatthusmiṃ bhāsitaṃ.	pucchā vekhanasa suttam pana āvuso bhagavatā kattha kam ārabbha kismim vatthusmim bhāsitam 
PA_anya-e09_02n:407_0	Vissajjanā – sāvatthiyaṃ bhante vekhanasaṃ paribbājakaṃ ārabbha bhāsitaṃ, vekhanaso	vissajjanā sāvatthiyam bhante vekhanasam paribbājakam ārabbha bhāsitam vekhanasaḥ 
PA_anya-e09_02n:407_1	bhante paribbājako bhagavato santike udānaṃ udānesi “ayaṃ paramo vaṇṇo ayaṃ paramo	bhante paribbājakaḥ bhagavato santike udānam udānesi ayam paramaḥ vaṇṇaḥ ayam paramaḥ 
PA_anya-e09_02n:407_2	vaṇṇo”ti, tasmiṃ bhante vatthusmiṃ bhāsitaṃ.	vaṇṇoti tasmin bhante vatthusmin bhāsitam 
PA_anya-e09_02n:408	Ghaṭikārasutta	ghaṭikārasutta 
PA_anya-e09_02n:409	Pucchā – ghaṭikārasuttaṃ panāvuso bhagavatā kattha kaṃ ārabbha kismiṃ vatthusmiṃ bhāsitaṃ.	pucchā ghaṭikāra suttam pana āvuso bhagavatā kattha kam ārabbha kismim vatthusmim bhāsitam 
PA_anya-e09_02n:410_0	Vissajjanā – kosalesu bhante ghaṭikārassa kumbhakārassa gharavatthupadese āyasmantaṃ	vissajjanā kosalesu bhante ghaṭikārassa kumbhakārassa ghara vatthu padese āyasmantam 
PA_anya-e09_02n:410_1	ānandaṃ ārabbha bhāsitaṃ. Bhagavā bhante tasmiṃ bhūmipadese sitaṃ pātvākāsi, āyasmā	ānandam ārabbha bhāsitam bhagavā bhante tasmin bhūmi padese sitam āyasmā 
PA_anya-e09_02n:410_2	ca ānando bhagavantaṃ etadavoca “ko nu kho bhante hetu ko paccayo bhagavato sitassa	ca ānandaḥ bhagavantam etat avoca kaḥ nu kho bhante hetu kaḥ paccayaḥ bhagavato sitassa 
PA_anya-e09_02n:410_3	pātukammāya, na akāraṇena tathāgatā sitaṃ pātukarontī”ti, tasmiṃ bhante vatthusmiṃ bhāsitaṃ.	pātukammāya na akāraṇena tathāgatāḥ sitam pātukaronti iti tasmin bhante vatthusmin bhāsitam 
PA_anya-e09_02n:411	Raṭṭhapālasutta	raṭṭhapāla sutta 
PA_anya-e09_02n:412	Pucchā – raṭṭhapālasuttaṃ panāvuso kattha kaṃ ārabbha kismiṃ vatthusmiṃ kena bhāsitaṃ.	pucchā raṭṭhapāla suttam pana āvuso kattha kam ārabbha kismim vatthusmim kena bhāsitam 
PA_anya-e09_02n:413_0	Vissajjanā – kurūsu bhante rājānaṃ korabyaṃ ārabbha āyasmatā raṭṭhapālattherena bhāsitaṃ.	vissajjanā kurūsu bhante rājānam korabyam ārabbha āyasmatā raṭṭhapāla therena bhāsitam 
PA_anya-e09_02n:413_1	Rājā bhante korabyo āyasmantaṃ raṭṭhapālaṃ etadavoca “cattārimāni bho raṭṭhapāla	rājā bhante korabyaḥ āyasmantam raṭṭhapālam etat avoca cattārimāni bho raṭṭhapāla 
PA_anya-e09_02n:413_2	pārijuññāni, yehi pārijuññehi samannāgatā idhekacce kesamassuṃ ohāretvā kāsāyāni	pārijuññāni yehi pārijuññehi samannāgatāḥ idha ekacce kesa massum ohāretvā kāsāyāni 
PA_anya-e09_02n:413_3	vatthāni acchādetvā agārasmā anāgāriyaṃ pabbajantī”ti evamādikaṃ vacanaṃ avoca, tasmiṃ	vatthāni a chādetvā agārasmai anāgāriyam pabbajanti iti evamādikam vacanam avoca tasmin 
PA_anya-e09_02n:413_4	bhante vatthusmiṃ bhāsitaṃ.	bhante vatthusmim bhāsitam 
