segmentnr	original	analyzed
PA_anya-e09_02n:145_5	hīno gāmmo pothujjaniko anariyo anattasaṃhito, evamādinā bhante bhagavato paṭhamā dhammadesanā ahosi.	hīnaḥ gāmmaḥ pothujjanikaḥ an ariyaḥ anatta saṃhitaḥ evamādinā bhante bhagavato paṭhamā dhamma desanā ahosi 
PA_anya-e09_02n:146	Sabbābhibhū sabbavidūhamasmi,	sabba abhibhū sabba vid ūham asmi 
PA_anya-e09_02n:147	Sabbadhammesu anūpalitto;	sabba dhammesu an upalittaḥ 
PA_anya-e09_02n:148	Sabbañjaho taṇhākkhaye vimutto,	sabbañjaho taṇhā khaye vimutto 
PA_anya-e09_02n:149	Sayaṃ abhiññāya kamuddiseyyaṃ.	sayam abhiññāya kam uddiseyyam 
PA_anya-e09_02n:150	Pucchā – kathañcāvuso bhagavā pāsarāsiupamāya taṃ desanaṃ pariniṭṭhāpesi.	pucchā kathañca āvuso bhagavā pāsarāsi upamāya tam desanam pariniṭṭhāpesi 
PA_anya-e09_02n:151_0	Vissajjanā – pañcime bhikkhave kāmaguṇā, katame pañca, cakkhuviññeyyā rūpā iṭṭhā	vissajjanā pañcime bhikkhave kāma guṇā katame pañca cakkhu viññeyyāḥ rūpāḥ iṭṭhā 
PA_anya-e09_02n:151_1	kantā manāpā piyarūpā kāmūpasaṃhitā rajanīyā. Sotaviññeyyā saddā. Ghānaviññeyyā gandhā.	kantā manāpā piya rūpā kāma upasaṃhitā rajanīyā sota viññeyyā saddā ghāna viññeyyā gandhā 
PA_anya-e09_02n:151_2	Jivhāviññeyyā rasā. Kāyaviññeyyā phoṭṭhabbā iṭṭhā kantā manāpā piyarūpā kāmūpasaṃhitā	jivhā viññeyyāḥ rasāḥ kāya viññeyyāḥ phoṭṭhabbāḥ iṭṭhā kantā manāpā piya rūpā kāma upasaṃhitā 
PA_anya-e09_02n:151_3	rajanīyā. Ime kho bhikkhave pañca kāmaguṇā. Ye hi keci bhikkhave samaṇā vā brāhmaṇā	rajanīyāḥ ime kho bhikkhave pañca kāmaguṇāḥ ye hi keci bhikkhave samaṇāḥ vā brāhmaṇāḥ 
PA_anya-e09_02n:151_4	vā ime kāmaguṇe gathitā mucchitā ajjhopannā anādīnavadassāvino anissaraṇapaññā paribhuñjanti,	vā ime kāma guṇe gathitāḥ mucchitāḥ ajjhopannāḥ anādīnava dassāvinaḥ a nissaraṇa paññā paribhuñjanti 
PA_anya-e09_02n:151_5	te evamassu veditabbā “anayamāpannā byāsanamāpannā yathākāmakaraṇīyā pāpimato”, evamādinā	te evam assu veditabbāḥ anayam āpannā byāsanam āpannā yathākāma karaṇīyā pāpimataḥ evamādinā 
PA_anya-e09_02n:151_6	bhante bhagavā pāsarāsiupamāya dhammadesanaṃ pariniṭṭhāpesi.	bhante bhagavā pāsarāsi upamāya dhamma desanam pariniṭṭhāpesi 
PA_anya-e09_02n:152	Cūḷahatthipadopamasutta	cūḷa hatthi pada upama sutta 
PA_anya-e09_02n:153	Pucchā – tenāvuso jānatā…pe… sammāsambuddhena cūḷahatthipadopamasuttaṃ kattha kaṃ ārabbha kismiṃ vatthusmiṃ bhāsitaṃ.	pucchā tena āvuso jānatāpe sammāsambuddhena cūḷahatthipadopama suttam kattha kam ārabbha kismim vatthusmim bhāsitam 
PA_anya-e09_02n:154_0	Vissajjanā – sāvatthiyaṃ bhante jāṇussoṇiṃ brāhmaṇaṃ ārabbha bhāsitaṃ. Jāṇussoṇi	vissajjanā sāvatthiyam bhante jāṇussoṇim brāhmaṇam ārabbha bhāsitam jāṇussoṇi 
PA_anya-e09_02n:154_1	bhante brāhmaṇo bhagavantaṃ upasaṅkamitvā yāvatako ahosi pilotikena paribbājakena	bhante brāhmaṇaḥ bhagavantam upasaṅkamitvā yāvatakaḥ ahosi pilotikena paribbājakena 
PA_anya-e09_02n:154_2	saddhiṃ kathāsallāpo, taṃ sabbaṃ bhagavato ārocesi, tasmiṃ bhante vatthusmiṃ bhāsitaṃ.	saddhim kathā sallāpaḥ tam sabbam bhagavataḥ ārocesi tasmim bhante vatthusmim bhāsitam 
PA_anya-e09_02n:155	Pucchā – kathañcāvuso bhagavā hatthipadopamaṃ vitthārena paripūretvā desesi.	pucchā katham ca āvuso bhagavā hatthi pada upamam vitthārena paripūretvā desesi 
PA_anya-e09_02n:156_0	Vissajjanā – “na kho brāhmaṇa ettāvatā hatthipadopamo vitthārena paripūro hoti, api	vissajjanā na kho brāhmaṇaḥ ettāvatā hatthi pada upamaḥ vitthārena paripūraḥ hoti api 
PA_anya-e09_02n:156_1	ca brāhmaṇa yathā hatthipadopamo vitthārena paripūro hoti, taṃ suṇāhi sādhukaṃ manasikarohi	ca brāhmaṇa yathā hatthi pada upamaḥ vitthārena paripūraḥ hoti tam suṇāhi sādhukam manasikarohi 
PA_anya-e09_02n:156_2	bhāsissāmī”ti, evamādinā bhante bhagavā hatthipadopamaṃ paripūretvā brāhmaṇassa jāṇussoṇissa desesi.	bhāsissāmi iti evamādinā bhante bhagavā hatthi pada upamam paripūretvā brāhmaṇassa jāṇussoṇissa desesi 
PA_anya-e09_02n:157	Mahāhatthipadopamasutta	mahāhatthipadopamasutta 
PA_anya-e09_02n:158	Pucchā – mahāhatthipadopamasuttaṃ panāvuso kattha kaṃ ārabbha kena bhāsitaṃ.	pucchā mahāhatthipadopama suttam pana āvuso kattha kam ārabbha kena bhāsitam 
PA_anya-e09_02n:159	Vissajjanā – sāvatthiyaṃ bhante sambahule bhikkhū ārabbha āyasmatā sāriputtattherena dhammasenāpatinā bhāsitaṃ.	vissajjanā sāvatthiyam bhante sambahule bhikkhū ārabbha āyasmatā sāriputta therena dhamma senāpatinā bhāsitam 
PA_anya-e09_02n:160	Mahāsāropamasutta	mahāsāropamasutta 
PA_anya-e09_02n:161	Pucchā – mahāsāropamasuttaṃ panāvuso bhagavatā kattha kaṃ ārabbha kismiṃ vatthusmiṃ bhāsitaṃ.	pucchā mahāsāropama suttam pana āvuso bhagavatā kattha kam ārabbha kismim vatthusmim bhāsitam 
PA_anya-e09_02n:162	Vissajjanā – rājagahe bhante devadattaṃ ārabbha bhāsitaṃ, devadatto bhante saṅghaṃ bhinditvā ruhiruppādakammaṃ katvā acirapakkanto hoti, tasmiṃ bhante vatthusmiṃ bhāsitaṃ.	vissajjanā rājagahe bhante devadattam ārabbha bhāsitam devadattaḥ bhante saṅgham bhinditvā ruhira uppāda kammam katvā acira pakkantaḥ hoti tasmim bhante vatthusmim bhāsitam 
PA_anya-e09_02n:163	Cūḷasāropamasutta	cūḍasāra upama sutta 
PA_anya-e09_02n:164	Pucchā – cūḷasāropamasuttaṃ panāvuso bhagavatā kattha kaṃ ārabbha kismiṃ vatthusmiṃ bhāsitaṃ.	pucchā cūḷasāropama suttam pana āvuso bhagavatā kattha kam ārabbha kismim vatthusmim bhāsitam 
PA_anya-e09_02n:165	Vissajjanā – sāvatthiyaṃ bhante piṅgalakocchaṃ brāhmaṇaṃ ārabbha bhāsitaṃ, piṅgalakoccho bhante brāhmaṇo bhagavantaṃ upasaṅkamitvā pañhaṃ pucchi, tasmiṃ bhante vatthusmiṃ bhāsitaṃ.	vissajjanā sāvatthiyam bhante piṅgalakoccham brāhmaṇam ārabbha bhāsitam piṅgalakocchaḥ bhante brāhmaṇaḥ bhagavantam upasaṅkamitvā pañham pucchi tasmim bhante vatthusmim bhāsitam 
PA_anya-e09_02n:166	Cūḷagosiṅgasutta	cūḷagosiṅgasutta 
PA_anya-e09_02n:167	Pucchā – cūḷagosiṅgasuttaṃ panāvuso bhagavatā kattha kena saddhiṃ bhāsitaṃ.	pucchā cūḷagosiṅga suttam pana āvuso bhagavatā kattha kena saddhim bhāsitam 
PA_anya-e09_02n:168	Vissajjanā – nābhike bhante gosiṅgasālavanadāye āyasmatā anuruddhattherena saddhiṃ bhāsitaṃ.	vissajjanā nābhike bhante gosiṅgasālavana dāye āyasmatā anuruddha ttherena saddhim bhāsitam 
PA_anya-e09_02n:169	Mahāgosiṅgasutta	mahāgosiṅgasutta 
PA_anya-e09_02n:170	Pucchā – mahāgosiṅgasuttaṃ panāvuso bhagavatā kattha kena saddhiṃ bhāsitaṃ.	pucchā mahāgosiṅga suttam pana āvuso bhagavatā kattha kena saddhim bhāsitam 
PA_anya-e09_02n:171	Vissajjanā – gosiṅgasālavanadāye bhante āyasmatā ca sāriputtattherena dhammasenāpatinā āyasmatā ca mahāmoggallānattherena saddhiṃ bhāsitaṃ.	vissajjanā gosiṅga sāla vana dāye bhante āyasmatā ca sāriputta therena dhamma senāpatinā āyasmatā ca mahāmoggallāna ttherena saddhim bhāsitam 
PA_anya-e09_02n:172	Mahāgopālakasutta	mahāgopālaka sutta 
PA_anya-e09_02n:173	Pucchā – mahāgopālakasuttaṃ panāvuso bhagavatā kattha kaṃ ārabbha bhāsitaṃ.	pucchā mahāgopālaka suttam pana āvuso bhagavatā kattha kam ārabbha bhāsitam 
PA_anya-e09_02n:174	Vissajjanā – sāvatthiyaṃ bhante sambahule bhikkhū ārabbha bhāsitaṃ.	vissajjanā sāvatthiyam bhante sambahule bhikkhū ārabbha bhāsitam 
PA_anya-e09_02n:175	Cūḷagopālakasutta	cūḷa gopālaka sutta 
PA_anya-e09_02n:176	Pucchā – cūḷagopālakasuttaṃ panāvuso bhagavatā kattha kaṃ ārabbha bhāsitaṃ.	pucchā cūḷagopālaka suttam pana āvuso bhagavatā kattha kam ārabbha bhāsitam 
PA_anya-e09_02n:177	Vissajjanā – vajjīsu bhante ukkacelāyaṃ gaṅgāya nadiyā tīre sambahule bhikkhū ārabbha bhāsitaṃ.	vissajjanā vajjīsu bhante ukka celāyam gaṅgāya nadiyā tīre sambahule bhikkhū ārabbha bhāsitam 
PA_anya-e09_02n:178	Cūḷasaccakasutta	cūḷa saccaka sutta 
PA_anya-e09_02n:179	Pucchā – tenāvuso jānatā…pe… sammāsambuddhena cūḷasaccakasuttaṃ kattha kaṃ ārabbha kismiṃ vatthusmiṃ bhāsitaṃ.	pucchā tena āvuso jānatāpe sammāsambuddhena cūḷasaccaka suttam kattha kam ārabbha kismim vatthusmim bhāsitam 
PA_anya-e09_02n:180_0	Vissajjanā – vesāliyaṃ bhante saccakaṃ nigaṇṭhaputtaṃ ārabbha bhāsitaṃ, saccako nigaṇṭhaputto	vissajjanā vesāliyam bhante saccakam nigaṇṭha puttam ārabbha bhāsitam saccakaḥ nigaṇṭha putto 
PA_anya-e09_02n:180_1	mahatiyā licchaviparisāya saddhiṃ yena bhagavā tenupasaṅkami, upasaṅkamitvā bhagavantaṃ	mahatiyā licchavi parisāya saddhim yena bhagavā tena upasaṅkami upasaṅkamitvā bhagavantam 
PA_anya-e09_02n:180_2	etadavoca “kathaṃ pana bhavaṃ gotamo sāvake vineti, kathaṃ bhāgā ca pana bhoto gotamassa	etat avoca katham pana bhavam gotamaḥ sāvake vineti katham bhāgā ca pana bhoto gotamassa 
PA_anya-e09_02n:180_3	sāvakesu anusāsanī bahulā pavattatī”ti, atha bhante bhagavatā aniccavāde ca anattavāde	sāvakesu anusāsanī bahulā pavattati iti atha bhante bhagavatā anicca vāde ca anatta vāde 
PA_anya-e09_02n:180_4	ca pakāsite saccako nigaṇṭhaputto pathavīupamaṃ dassetvā attano attavādaṃ pakāsesi,	ca pakāsite saccakaḥ nigaṇṭha putto pathavī upamam dassetvā attanaḥ atta vādam pakāsesi 
PA_anya-e09_02n:180_5	tasmiṃ bhante vatthusmiṃ bhāsitaṃ.	tasmin bhante vatthusmin bhāsitam 
PA_anya-e09_02n:181	Pucchā – evaṃ āvuso saccakena nigaṇṭhaputtena mahāpathavīupamaṃ dassetvā attavāde pakāsite kathaṃ bhagavā taṃ attavādaṃ puna patiṭṭhāpetvā samanuyuñji samanugāhi samanubhāsi.	pucchā evam āvuso saccakena nigaṇṭha puttena mahā pathavī upamam dassetvā atta vāde pakāsite katham bhagavā tam atta vādam puna patiṭṭhāpetvā samanuyuñji samanugāhi samanubhāsi 
PA_anya-e09_02n:182_0	Vissajjanā – “nanu tvaṃ aggivessana evaṃ vadesi, rūpaṃ me attā, vedanā me attā, saññā	vissajjanā nanu tvam aggivessana evam vadesi rūpam me attā vedanā me attā saññā 
PA_anya-e09_02n:182_1	me attā, saṅkhārā me attā, viññāṇaṃ me attā”ti, evaṃ kho bhante bhagavā saccakaṃ	me attā saṅkhārāḥ me attā viññāṇam me attā ati evam kho bhante bhagavā saccakam 
PA_anya-e09_02n:182_2	nigaṇṭhaputtaṃ taṃ attavādaṃ patiṭṭhāpesi. Patiṭṭhāpetvā ca pana bhante bhagavā “tena	nigaṇṭha puttam tam atta vādam patiṭṭhāpesi patiṭṭhāpetvā ca pana bhante bhagavā tena 
PA_anya-e09_02n:182_3	hi aggivessana taññevettha paṭipucchissāmi, yathā te khameyya, tathā taṃ byākareyyāsī”ti	hi aggivessana tat na eva ittha paṭipucchissāmi yathā te khameyya tathā tam byākareyyāsi iti 
PA_anya-e09_02n:182_4	evamādinā bhante bhagavā saccakaṃ nigaṇṭhaputtaṃ samanuyuñji samanugāhi samanubhāsi.	evamādinā bhante bhagavā saccakam nigaṇṭha puttam samanuyuñji samanugāhi samanubhāsi 
PA_anya-e09_02n:183	Pucchā – evaṃ kho āvuso saccake nigaṇṭhaputte tuṇhībhūte adhomukhe pajjhāyante appaṭibhāne nisinne dummukho nāma licchaviputto bhagavantaṃ kiṃ vacanaṃ avoca.	pucchā evam kho āvuso saccake nigaṇṭha putte tuṇhībhūte adhomukhe pajjhāyante appaṭibhāne nisinne dummukhaḥ nāma licchavi puttaḥ bhagavantam kim vacanam avoca 
PA_anya-e09_02n:184_0	Vissajjanā – evaṃ bhante saccake nigaṇṭhaputte tuṇhībhūte maṅkubhūte pattakkhandhe	vissajjanā evam bhante saccake nigaṇṭha putte tuṇhībhūte maṅku bhūte patta kkhandhe 
PA_anya-e09_02n:184_1	adhomukhe pajjhāyante appaṭibhāne dummukho licchaviputto bhagavantaṃ etadavoca “upamā	adhomukhe pajjhāyante appaṭibhāne dummukhaḥ licchavi puttaḥ bhagavantam etat avoca upamā 
PA_anya-e09_02n:184_2	maṃ bhagavā paṭibhātī”ti.	mam bhagavā paṭibhāti iti 
PA_anya-e09_02n:185	Pucchā – atha kho āvuso saccako nigaṇṭhaputto bhagavantaṃ kīdisaṃ pañhaṃ pucchi, kathañca taṃ bhagavā byākāsi.	pucchā atha kho āvuso saccakaḥ nigaṇṭha puttaḥ bhagavantam kīdisam pañham pucchi kathañca tam bhagavā byākāsi 
PA_anya-e09_02n:186_0	Vissajjanā – atha kho bhante saccako nigaṇṭhaputto dummukhaṃ licchaviṃ apasādetvā	vissajjanā atha kho bhante saccakaḥ nigaṇṭha puttaḥ dummukham licchavim apasādetvā 
PA_anya-e09_02n:186_1	bhagavantaṃ sekhañca asekhañca pañhaṃ pucchi, bhagavā ca bhante “idha aggivessana	bhagavantam sekhan ca a sekhan ca pañham pucchi bhagavā ca bhante idha aggivessana 
PA_anya-e09_02n:186_2	mama sāvako yaṃ kiñci rūpaṃ atītānāgatapaccuppannaṃ ajjhattaṃ vā bahiddhā vā oḷārikaṃ	mama sāvakaḥ yam kiñci rūpam atīta anāgata paccuppannam ajjhattam vā bahiddhā vā oḷārikam 
PA_anya-e09_02n:186_3	vā sukhumaṃ vā hīnaṃ vā paṇītaṃ vā yaṃ dūre santike vā” evamādinā sekhañca asekhañca	vā sukhumam vā hīnam vā paṇītam vā yam dūre santike vā evamādinā sekhan ca a sekhan ca 
PA_anya-e09_02n:186_4	puggalaṃ vibhajitvā byākāsi.	puggalam vibhajitvā 
PA_anya-e09_02n:187	Buddho so bhagavā bodhāya dhammaṃ deseti.	buddhaḥ saḥ bhagavā bodhāya dhammam deseti 
PA_anya-e09_02n:188	Danto so bhagavā damathāya dhammaṃ deseti.	dantaḥ so bhagavā damathāya dhammam deseti 
PA_anya-e09_02n:189	Santo so bhagavā samathāya dhammaṃ deseti.	santaḥ so bhagavā samathāya dhammaṃ deseti 
PA_anya-e09_02n:190	Tiṇṇo so bhagavā taraṇāya dhammaṃ deseti.	tiṇṇaḥ saḥ bhagavā taraṇāya dhammam deseti 
PA_anya-e09_02n:191	Parinibbuto so bhagavā parinibbānāya dhammaṃ deseti.	parinibbutaḥ saḥ bhagavā parinibbānāya dhammam deseti 
PA_anya-e09_02n:192	Mahāsaccakasutta	mahāsaccaka sutta 
PA_anya-e09_02n:193	Pucchā – mahāsaccakasuttaṃ panāvuso bhagavatā kattha kaṃ ārabbha kismiṃ vatthusmiṃ bhāsitaṃ.	pucchā mahāsaccaka suttam pana āvuso bhagavatā kattha kam ārabbha kismim vatthusmim bhāsitam 
PA_anya-e09_02n:194_0	Vissajjanā – vesāliyaṃ bhante saccakaṃyeva nigaṇṭhaputtaṃ ārabbha bhāsitaṃ. Saccako	vissajjanā vesāliyam bhante saccakam yeva nigaṇṭha puttam ārabbha bhāsitam 
PA_anya-e09_02n:194_1	bhante nigaṇṭhaputto aparadivase bhagavantaṃ upasaṅkamitvā bhagavato sāvake āsajja	bhante nigaṇṭha puttaḥ apara divase bhagavantam upasaṅkamitvā bhagavataḥ sāvake āsajja 
PA_anya-e09_02n:194_2	bhāvanādvayapaṭisaṃyuttaṃ vācaṃ bhāsati, tasmiṃ bhante vatthusmiṃ bhāsitaṃ.	bhāvanā dvaya paṭisaṃyuttam vācam bhāsati tasmim bhante vatthusmim bhāsitam 
PA_anya-e09_02n:195	Pucchā – kathañcāvuso bhagavā saccakaṃ nigaṇṭhaputtaṃ paṭipucchitvā bhāvanādvayaṃ vibhajja kathesi.	pucchā katham ca āvuso bhagavā saccakam nigaṇṭha puttam paṭipucchitvā bhāvanā dvayam vibhajja kathesi 
PA_anya-e09_02n:196_0	Vissajjanā – atha kho bhante bhagavā “kinti pana te aggivessana kāyabhāvanā sutā”ti	vissajjanā atha kho bhante bhagavā kinti pana te aggivessana kāya bhāvanā sutā ati 
PA_anya-e09_02n:196_1	evamādinā saccakaṃ nigaṇṭhaputtaṃ paṭipucchitvā, kathañca aggivessana abhāvitakāyo	evamādinā saccakam nigaṇṭha puttam paṭipucchitvā katham ca aggivessana abhāvita kāyaḥ 
PA_anya-e09_02n:196_2	ca hoti abhāvitacitto ca evamādinā bhāvanādvayaṃ vibhajitvā byākāsi.	ca ca evamādinā bhāvanā dvayam vibhajitvā 
PA_anya-e09_02n:197_0	Pucchā – atha kho āvuso saccako nigaṇṭhaputto bhagavantaṃ kiṃ vacanaṃ avoca, kathañca	pucchā atha kho āvuso saccakaḥ nigaṇṭha puttaḥ bhagavantam kim vacanam avoca kathañca 
PA_anya-e09_02n:197_1	bhagavā padhānakāle attanāanubhūtapubbā paramukkaṃsagatā sukhadukkhavedanāyo pakāsesi,	bhagavā padhāna kāle attanā a anubhūta pubbā paramukkaṃsa gatā sukha dukkha vedanāyaḥ pakāsesi 
PA_anya-e09_02n:197_2	yāpi bhagavato cittaṃ na pariyādāya aṭṭhaṃsu.	yā api bhagavato cittam na pariyādāya aṭṭhaṃsu 
PA_anya-e09_02n:198_0	Vissajjanā – atha kho bhante saccako nigaṇṭhaputto bhagavantaṃ etadavoca “na hi nūna	vissajjanā atha kho bhante saccakaḥ nigaṇṭha puttaḥ bhagavantam etat avoca na hi nūna 
PA_anya-e09_02n:198_1	bhoto gotamassa uppajjati, tathā rūpā sukhāvedanā, yathārūpā uppannā sukhāvedanā	bhoto gotamassa uppajjati tathā rūpā sukhā vedanā yathārūpā uppannā sukhā vedanā 
PA_anya-e09_02n:198_2	cittaṃ pariyādāya tiṭṭheyya, na hi nūna bhoto gotamassa uppajjati tathārūpā dukkhā	cittam pariyādāya tiṭṭheyya na hi nūna bhoto gotamassa uppajjati tathārūpā dukkhā 
PA_anya-e09_02n:198_3	vedanā, yathārūpā uppannā dukkhā vedanā cittaṃ pariyādāya tiṭṭheyyā”ti atha kho bhagavā	vedanā yathārūpā uppannā dukkhā vedanā cittam pariyādāya tiṭṭheyya atha kho bhagavā 
PA_anya-e09_02n:198_4	“kiñhi no siyā aggivessana, idha me aggivessena pubbeva sambodhā anabhisambuddhassa	kim hi no siyā aggivessana idha me aggivessena pubbā iva sambodhā an abhisambuddhassa 
PA_anya-e09_02n:198_5	bodhisattasseva sato etadahosi, evamādinā bhante bhagavā padhānakāle attanānubhūtapubbā	bodhisattassa iva sataḥ etat ahosi evamādinā bhante bhagavā padhāna kāle attanā anubhūta pubbā 
PA_anya-e09_02n:198_6	paramukkaṃsagatā sukhadukkhavedanāyo vitthārena, yāpi bhagavato cittaṃ na pariyādāya aṭṭhaṃsu.	param ukkaṃsa gatā sukha dukkha vedanāyaḥ vitthārena yā api bhagavato cittam na pariyādāya aṭṭhaṃsu 
PA_anya-e09_02n:199	Cūḷataṇhāsaṅkhayasutta	cūḷa taṇhā saṅkhaya sutta 
PA_anya-e09_02n:200	Pucchā – tenāvuso bhagavatā jānatā…pe… sammāsambuddhena cūḷataṇhāsaṅkhayasuttaṃ kattha kaṃ ārabbha kismiṃ vatthusmiṃ bhāsitaṃ.	pucchā tena āvuso bhagavatā jānatāpe sammāsambuddhena cūḷataṇhāsaṅkhaya suttam kattha kam ārabbha kismim vatthusmim bhāsitam 
PA_anya-e09_02n:201_0	Vissajjanā – sāvatthiyaṃ bhante sakkaṃ devānamindaṃ ārabbha bhāsitaṃ. Sakko bhante	vissajjanā sāvatthiyam bhante sakkam devānamindam ārabbha bhāsitam sakkaḥ bhante 
PA_anya-e09_02n:201_1	devānamindo bhagavantaṃ upasaṅkamitvā etadavoca “kittāvatānukho bhante bhikkhu saṃkhittena	devānamindaḥ bhagavantam upasaṅkamitvā etat avoca kittāvatā anukho bhante bhikkhu saṃkhittena 
PA_anya-e09_02n:201_2	taṇhāsaṅkhayavimutto hoti accantaniṭṭho accantayogakkhemi accantabrahmacārī accantapariyosāno	taṇhā saṅkhaya vimuttaḥ hoti accanta niṭṭhaḥ accanta yogakkhemi accanta brahmacārī accanta pariyosāno 
PA_anya-e09_02n:201_3	seṭṭho devamanussāna”nti. Tasmiṃ bhante vatthusmiṃ bhāsitaṃ.	seṭṭhaḥ deva manussānam ti tasmim bhante vatthusmim bhāsitam 
PA_anya-e09_02n:202	Kittāvatā nu kho bhante bhikkhu saṃkhittena taṇhāsaṅkhayavimutto hoti accantaniṭṭho accantayogakkhemī accantabrahmacārī accantapariyāsāno seṭṭho devamanussānaṃ –	kittāvatā nu kho bhante bhikkhu saṃkhittena taṇhā saṅkhaya vimuttaḥ hoti accanta niṭṭhaḥ accanta yogakkhemī accanta brahmacārī accanta pariyāsāno seṭṭhaḥ deva manussānam 
PA_anya-e09_02n:203	Mahātaṇhāsaṅkhayasutta	mahātaṇhāsaṅkhayasutta 
PA_anya-e09_02n:204	Pucchā – mahātaṇhāsaṅkhayasuttaṃ panāvuso bhagavatā kattha kaṃ ārabbha kismiṃ vatthusmiṃ bhāsitaṃ.	pucchā mahātaṇhāsaṅkhaya suttam pana āvuso bhagavatā kattha kam ārabbha kismim vatthusmim bhāsitam 
PA_anya-e09_02n:205_0	Vissajjanā – sāvatthiyaṃ bhante sātiṃ bhikkhuṃ kevaṭṭaputtaṃ ārabbha bhāsitaṃ. Sātissa	vissajjanā sāvatthiyam bhante sātim bhikkhum kevaṭṭa puttam ārabbha bhāsitam sātissa 
PA_anya-e09_02n:205_1	bhante bhikkhuno kevaṭṭaputtassa evarūpaṃ pāpakaṃ diṭṭhigataṃ uppannaṃ hoti “tathāhaṃ	bhante bhikkhuno kevaṭṭa puttassa evarūpam pāpakam diṭṭhigatam uppannam hoti tathā aham 
PA_anya-e09_02n:205_2	bhagavatā dhammaṃ desitaṃ ājānāmi, yathā tadevidaṃ viññāṇaṃ sandhāvati saṃsarati	bhagavatā dhammam desitam ājānāmi yathā tat eva idam viññāṇam sandhāvati saṃsarati 
PA_anya-e09_02n:205_3	anañña”nti. Tasmiṃ bhante vatthusmiṃ bhāsitaṃ.	anaññanti tasmim bhante vatthusmim bhāsitam 
PA_anya-e09_02n:206	Pucchā – atha kho āvuso bhagavā kathaṃ bhikkhū āmantetvā ca paṭipucchitvā ca anattabhāvadīpikaṃ dhammakathaṃ kathesi.	pucchā atha kho āvuso bhagavā katham bhikkhū āmantetvā ca paṭipucchitvā ca anatta bhāva dīpikam dhamma katham kathesi 
PA_anya-e09_02n:207_0	Vissajjanā – atha bhante bhagavā bhikkhū “taṃ kiṃ maññatha bhikkhave, apināyaṃ sāti	vissajjanā atha bhante bhagavā bhikkhū tam kim maññatha bhikkhave apinā ayam sā ati 
PA_anya-e09_02n:207_1	bhikkhu kevaṭṭaputto usmīkatopi ismiṃ dhammavinaye”ti āmantetvā, tumhepi me bhikkhave	bhikkhu kevaṭṭa putto usmīkataḥ api ismin dhamma vinaye ti āmantetvā tumhe pi me bhikkhave 
PA_anya-e09_02n:207_2	evaṃ dhammaṃ desitaṃ ājānāthatyādinā bhikkhū paṭipucchitvā ca yaṃ yadeva bhikkhave	evam dhammam desitam ājānātha tyādinā bhikkhū paṭipucchitvā ca yam yat eva bhikkhave 
PA_anya-e09_02n:207_3	paccayaṃ paṭicca uppajjati viññāṇaṃ, tena teneva viññāṇaṃ tveva saṅkhyaṃ gacchati,	paccayam paṭicca uppajjati viññāṇam tena tena iva viññāṇam tu eva saṅkhyam gacchati 
PA_anya-e09_02n:207_4	cakkhuñca paṭicca rūpe ca uppajjati viññāṇaṃ cakkhuviññāṇaṃ tveva saṅkhyaṃ gacchati,	cakkhuñca paṭicca rūpe ca uppajjati viññāṇam cakkhu viññāṇam tu eva saṅkhyam gacchati 
PA_anya-e09_02n:207_5	evamādinā bhante anattatādīpikaṃ dhammiṃ kathaṃ kathesi.	evamādinā bhante anatta tā dīpikam dhammim katham kathesi 
PA_anya-e09_02n:208	Mahāassapurasutta	mahāassapura sutta 
PA_anya-e09_02n:209	Pucchā – mahāassapurasuttaṃ panāvuso bhagavatā kattha kaṃ ārabbha kismiṃ vatthusmiṃ bhāsitaṃ.	pucchā mahāassapura suttam pana āvuso bhagavatā kattha kam ārabbha kismim vatthusmim bhāsitam 
PA_anya-e09_02n:210_0	Vissajjanā – aṅgesu bhante assapure nāma aṅgānaṃ nigame bahū manusse saddhe pasanne	vissajjanā aṅgesu bhante assapure nāma aṅgānam nigame bahū manusse saddhe pasanne 
PA_anya-e09_02n:210_1	ārabbbha bhāsitaṃ. Bahū bhante manussā saddhā pasannā bhikkhusaṅghaṃ sakkaccaṃ upaṭṭhahiṃsu,	ārabbha bhāsitam bahū bhante manussā saddhā pasannā bhikkhu saṅgham sakkaccam upaṭṭhahiṃsu 
PA_anya-e09_02n:210_2	sabbakālañca ratanattayapaṭisaṃyuttaṃ vaṇṇakathaṃyeva kathayiṃsu. Tasmiṃ bhante vatthusmiṃ bhāsitaṃ.	sabbakālam ca vaṇṇa kathaṃyā iva kathayiṃsu tasmim bhante vatthusmim bhāsitam 
PA_anya-e09_02n:211	Pucchā – katame āvuso tattha bhagavatā dhammā samaṇakaraṇā ca brāhmaṇakaraṇā ca uttaruttari paṇītapaṇītā desitā.	pucchā katame āvuso tattha bhagavatā dhammā samaṇa karaṇā ca brāhmaṇa karaṇā ca uttaruttari paṇīta paṇītā desitā 
PA_anya-e09_02n:212_0	Vissajjanā – hirottappā parisuddhakāyasamācāro parisuddhavacīsamācāro parisuddhamanosamācāro	vissajjanā hirottappā parisuddha kāya samācāro parisuddha vacī samācāro parisuddha manaḥ samācāro 
PA_anya-e09_02n:212_1	parisuddhājīvo indriyesu guttadvāratā bhojanemattaññutā jāgariyānuyogo satisampajaññaṃ	parisuddha ājīvaḥ indriyesu gutta dvāra tā bhojanemattaññu tā jāgariya anuyogaḥ sati sampajaññam 
PA_anya-e09_02n:212_2	nīvaraṇappahānaṃ cattāri ca jhānāni tisso ca vijjā ime kho bhante tattha bhagavatā	nīvaraṇa ppahānam cattāri ca jhānāni tissaḥ ca vijjāḥ ime kho bhante tattha bhagavatā 
PA_anya-e09_02n:212_3	samaṇakaraṇā ca brāhmaṇakaraṇā ca uttaruttari paṇītapaṇītā dhammā desitā.	samaṇa karaṇā ca brāhmaṇa karaṇā ca uttaruttari paṇīta paṇītāḥ dhammāḥ desitā 
PA_anya-e09_02n:213	Cūḷaassapurasutta	cūḍa assa pura sutta 
PA_anya-e09_02n:214	Pucchā – cūḷaassapurasuttaṃ panāvuso bhagavatā katta kaṃ ārabbha bhāsitaṃ.	pucchā cūḷaassapura suttam pana āvuso bhagavatā katta kam ārabbha bhāsitam 
PA_anya-e09_02n:215	Vissajjanā – tasmiṃyeva bhante assapure nigame teyeva manusse saddhe pasanne ārabbha bhāsitaṃ, tasmiṃyeva bhante vatthusmiṃ bhāsitaṃ.	vissajjanā tasmin yeva bhante assapure nigame te yeva manusse saddhe pasanne ārabbha bhāsitam tasmiṃ yeva bhante vatthusmim bhāsitam 
PA_anya-e09_02n:216	Pucchā – kathañcāvuso tattha bhagavatā samaṇasāmīcippaṭipadā ca assamaṇasāmīcippaṭipadā ca vibhajitvā desitā.	pucchā katham ca āvuso tattha bhagavatā samaṇa sāmīci paṭipadā ca assamaṇa sāmīci paṭipadā ca vibhajitvā desitā 
PA_anya-e09_02n:217_0	Vissajjanā – “kathañca bhikkhave bhikkhu na samaṇasāmīcippaṭipadaṃ paṭipanno hoti,	vissajjanā katham ca bhikkhave bhikkhu na samaṇa sāmīci paṭipadam paṭipannaḥ hoti 
PA_anya-e09_02n:217_1	yassa kassaci bhikkhave bhikkhuno abhijjhālussa abhijjhā appahīnā hoti, byāpannacittassa	yassa kassaci bhikkhave bhikkhuno abhijjhālussa abhijjhā appahīnā hoti byāpanna cittassa 
