segmentnr	original	analyzed
PA_anya-e11_02n:305_83	jānāmī”ti āha. “Yadi dhammaṃ jānāsi, mayhaṃ dhammakathaṃ kathethā”ti āha. “Ahaṃ tuyhaṃ	jānāmi iti āha yadi dhammam jānāsi mayham dhamma katham kathetha ati āha aham tuyham 
PA_anya-e11_02n:305_84	dhammaṃ kathessāmi, tvaṃ mayhaṃ kīdisaṃ dhammakathikassa sakkāraṃ karissasī”ti āha.	dhammam kathessāmi tvam mayham kīdisam dhamma kathikassa sakkāram karissasi iti āha 
PA_anya-e11_02n:305_85	“Evaṃ sante mayhaṃ dhammaṃ kathetvā pacchā mayhaṃ sarīre maṃsaṃ khādissasī”ti āha.	evam sante mayham dhammam kathetvā pacchā mayham sarīre maṃsam khādissasi iti āha 
PA_anya-e11_02n:305_86	“Ahaṃ mahārāja chāto hutvā dhammaṃ kathetuṃ na sakkomī”ti āha. “Yadi tumhe paṭhamaṃ	aham mahā rāja chātaḥ hutvā dhammam kathetum na sakkomi iti āha yadi tumhe paṭhamam 
PA_anya-e11_02n:305_87	maṃsaṃ khādatha, dhammaṃ ko suṇissatī”ti āha. Puna so rakkhaso “nāhaṃ dhammaṃ desetuṃ	maṃsam khādatha dhammam kaḥ suṇissati iti āha puna so rakkhasaḥ na aham dhammam desetuṃ 
PA_anya-e11_02n:305_88	sakkomī”ti. Puna rājā “mayhaṃ dhammapaṭilābhañca tumhākaṃ maṃsapaṭilābhañca tumhe	sakkomi iti punar rājā mayham dhamma paṭilābham ca tumhākam maṃsa paṭilābham ca tumhe 
PA_anya-e11_02n:305_89	jānitvā mayhaṃ dhammaṃ desethā”ti āha. Atha sakko devarājā “sādhu hothā”ti vatvā	jānitvā mayham dhammam desetha ati āha atha sakkaḥ devarājā sādhu hotha ati vatvā 
PA_anya-e11_02n:305_90	avidūre ṭhāne ubbedhena tigāvutamattaṃ mahantaṃ añjanapabbataṃ māpetvā evamāha… “sace	avidūre ṭhāne ubbedhena tiga avuta mattam mahantam añjana pabbatam māpetvā evam āha sace 
PA_anya-e11_02n:305_91	mahārāja imaṃ pabbatamuddhaniṃ ārūyha ākāsā uppatitvā tvaṃ mama mukhe patissasi,	mahā rāja imam pabbata muddhanim ārūyha ākāsā uppatitvā tvam mama mukhe patissasi 
PA_anya-e11_02n:305_92	ahaṃ te ākāsagatakāle dhammaṃ desessāmi, evaṃ sante tuyhañca dhammappalābho mayhañca	aham te ākāsa gata kāle dhammam desessāmi evam sante tuyham ca dhamma ppalābhaḥ mayham ca 
PA_anya-e11_02n:305_93	maṃsapaṭilābho bhavissatī”ti āha. Tassa kathaṃ sutvā dhammasoṇḍakamahārājā “anamatagge	maṃsa paṭilābhaḥ bhavissati iti āha tassa katham sutvā dhammasoṇḍaka mahā rājā anamatagge 
PA_anya-e11_02n:305_94	saṃsāre puriso hutvā adhammasamaṅgī hutvā adhammasseva atthāya pāṇātipāto adinnādāno	saṃsāre purisaḥ hutvā adhamma samaṅgī hutvā adhammassa iva atthāya pāṇa atipātaḥ a dinna ādānaḥ 
PA_anya-e11_02n:305_95	kāmesumicchācāro sūkariko orabbhiko sākuṇi ko coro paradāriko taṃ gahetvā sīsacchinnānaṃ	kāmesum icchā ācāraḥ sūkarikaḥ orabbhikaḥ sākuṇikaḥ coraḥ paradārikaḥ tam gahetvā 
PA_anya-e11_02n:305_96	lohitaṃ catūsu mahāsamuddesu udakatopi bahutaraṃ mātāpituādīnampi manāpānaṃ atthāya	lohitam catūsu mahā samuddesu udakataḥ api bahutaram mātā pitu ādīnam atthāya 
PA_anya-e11_02n:305_97	rodantānaṃ assu catūsumahāsamuddesu udakatopi bahutaraṃ, imaṃ pana sarīraṃ dhammassa	rodantānam catusu mahā samuddesu udakataḥ pi bahutaram imam pana sarīram dhammassa 
PA_anya-e11_02n:305_98	atthāya vikkiṇāmi taṃ mahapphalañca manāpañcā”ti cintetvā “sādhu mārisa evaṃ karomī”ti	atthāya vikkiṇāmi tam mahapphalam ca manāpam ca ati cintetvā sādhu mārisa evam karomi iti 
PA_anya-e11_02n:305_99	pabbataṃ ārūyha pabbatagge ṭhito “mama rajjena saddhiṃ mayhaṃ sajīvasarīraṃ saddhammassatthāya	pabbatam ārūyha pabbata agge ṭhitaḥ mama rajjena saddhim mayham sa jīva sarīram saddhammaḥ satthāya 
PA_anya-e11_02n:305_100	dassāmī”ti somanasso hutvā “dhammaṃ kathethā”ti saddhammatthāya jīvitaṃ pariccajitvā	dassāmi iti somanassaḥ hutvā dhammam kathetha ati saddhamma atthāya jīvitam pariccajitvā 
PA_anya-e11_02n:305_101	ākāsato uppatitvā dhammaṃ kathethāti āha. Atha sakko devarājā sakattabhāvena sabbālaṅkārehi	ākāsataḥ uppatitvā dhammam kathetha iti āha atha sakkaḥ devarājā sa kattabhāvena sabba alaṅkārehi 
PA_anya-e11_02n:305_102	paṭimaṇḍito ativiya sotuṃ somanasso ākāsato patantaṃ dibbaphassena parāmasanto urena	paṭimaṇḍitaḥ ativiya sotum somanassaḥ ākāsataḥ patantam dibba phassena parāmasantaḥ urena 
PA_anya-e11_02n:305_103	paṭiggaṇhitvā devalokaṃ netvā paṇḍukambalasilāsane nisīdāpetvā mālāgandhādīhi pūjetvā	paṭiggaṇhitvā deva lokam netvā paṇḍu kambala silā āsane nisīdāpetvā mālā gandha ādīhi pūjetvā 
PA_anya-e11_02n:305_104	dhammasoṇḍakamahārājassa dhammaṃ desento imaṃ gāthamāha.	dhammasoṇḍaka mahā rājassa dhammam desentaḥ imam gātham āha 
PA_anya-e11_02n:306	“Aniccā vata saṅkhārā, uppādavayadhammino;	aniccāḥ vata saṅkhārāḥ uppāda vaya dhammino 
PA_anya-e11_02n:307	Uppajjitvā nirujjhanti, tesaṃ vūpasamo sukho”ti.	uppajjitvā nirujjhanti tesam vūpasamaḥ sukhaḥ ti 
PA_anya-e11_02n:308_0	Evaṃ sakko dhammasoṇḍakamahārājassa dhammaṃ desetvā devalokasampattiṃ dassetvā devalokato	evam sakkaḥ dhammasoṇḍaka mahā rājassa dhammam desetvā deva loka sampattim dassetvā deva lokato 
PA_anya-e11_02n:308_1	ānetvā sakarajje patiṭṭhāpetvā appamādena ovaditvā devalokameva agamāsi evaṃ saddhammasavanassāpi	ānetvā saka rajje patiṭṭhāpetvā appamādena ovaditvā deva lokam eva agamāsi evam saddhamma savanassa api 
PA_anya-e11_02n:308_2	dullabhabhāvo veditabbo. Evaṃ pariyattiantaradhānena paṭipatti paṭivedhāpi antaradhāyanti.	dullabha bhāvaḥ veditabbaḥ evam pariyatti antaradhānena paṭipatti paṭivedhā api antaradhāyanti 
PA_anya-e11_02n:308_3	Ettha ca tīṇi parinibbānāni veditabbāni katamāni tīṇi parinibbānāni. Kilesaparinibbānaṃ,	ettha ca tīṇi parinibbānāni veditabbāni katamāni tīṇi parinibbānāni kilesa parinibbānam 
PA_anya-e11_02n:308_4	khandhaparinibbānaṃ, dhātuparinibbānanti. Tattha kilesaparinibbānaṃ bodhimaṇḍeyeva	khandha parinibbānam dhātu parinibbānanti tattha kilesa parinibbānam 
PA_anya-e11_02n:308_5	hoti, bhagavā hi bodhimaṇḍeyeva vīriyapādehi sīlapathaviyaṃ patiṭṭhāya saddhāhatthena	hoti bhagavā hi bodhimaṇḍeya iva vīriya pādehi sīla pathaviyam patiṭṭhāya saddhā hatthena 
PA_anya-e11_02n:308_6	kammakkhayakaraṃ ñāṇapharasuṃ gahetvā sabbo lobhadosamohaviparītamanasikāraahirīkānottappakodhūpanāhamakkhapaḷāsa-	kamma khaya karam ñāṇa pharasum gahetvā sabbaḥ lobha dosa moha viparīta manasikāra a hirīkāna uttappa kodha upanāha makkha paḷāsa 
PA_anya-e11_02n:308_7	issāmacchariyamāyāsāṭheyyathambhasārambhamānāti mānamadapamādataṇhā’vijjātividhākusalamūladuccaritasaṃkilesamalavisamasaññāvitakka	māna mada apamāda taṇhā vid jāti vidhā kusala mūla duccarita saṃkilesa mala visama saññā vitakka 
PA_anya-e11_02n:308_8	papañcacatubbidhavipariyesaāsavaganthaoghayogā’gatiganthu’ pādānapañcacetokhilavinibandhanīvaraṇā’bhinandana	pā dāna pañca cetaḥ khila vinibandhanī varaṇa abhinandana 
PA_anya-e11_02n:308_9	chavivādamūlataṇhākāyasattānusaya aṭṭhamicchattanavataṇhāmūlakadasākusalakammapatha	cha vivāda mūla taṇhā kāya satta anusaya 
PA_anya-e11_02n:308_10	dvāsaṭṭhidiṭṭhigata aṭṭhasatataṇhāvicaritappa bheda sabbadarathapariḷāhakilesasatasahassāni,	aṭṭha sata taṇhā vicarita ppa bheda 
PA_anya-e11_02n:308_11	saṅkhepato vā pañca kilesaabhisaṅkhārakhandhamaccudevaputtamāre asesato hatā vihatā	saṅkhepataḥ vā pañca kilesa abhisaṅkhāra khandha maccu deva putta māre asesataḥ hatā vihatā 
PA_anya-e11_02n:308_12	anabhāvaṃkatā tasmā sabbepi kilesā bodhimaṇḍeyeva nibbānaṃ nirodhaṃ gacchantīti kilesanibbānaṃ	anabhāvaṃkatā tasmā sabbe pi kilesāḥ bodhimaṇḍeya iva nibbānam nirodham gacchanti iti kilesa nibbānam 
PA_anya-e11_02n:308_13	bodhimaṇḍeyeva hoti ettha ca bodhīti arahattamaggaññāṇaṃ adhippetaṃ tathā hi sabbesampi	bodhimaṇḍeyā iva hoti ettha ca bodhī iti arahatta magga ññāṇam adhippetam tathā hi sabbesam pi 
PA_anya-e11_02n:308_14	buddhapaccekabuddhaariyasāvakānaṃ arahattamaggakkhaṇeyeva sabbepi kilesā asesaṃ nirodhaṃ	buddha paccekabuddha ariyasāvakānam arahatta magga kkhaṇe yeva sabbe pi kilesāḥ asesam nirodham 
PA_anya-e11_02n:308_15	nibbānaṃ gacchanti tepi buddhā ugghaṭitaviññūvibhajjitaññūneyyavasena tividhā honti	nibbānam gacchanti te pi buddhāḥ ugghaṭita viññū vibhajjita ññūneyya vasena tividhāḥ honti 
PA_anya-e11_02n:308_16	vuttañhetaṃ jātattakīsotattakīnidāne.	vuttam ha etam jātattakī sotattakī nidāne 
PA_anya-e11_02n:309	“Ugghaṭitaññunāmako, vibhajjitaññuno duve;	ugghaṭitaññu nāmakaḥ vibhajjitaññunaḥ duve 
PA_anya-e11_02n:310	Tatiyo neyyo nāmena, bodhisatto tidhā mato.	tatiyaḥ neyyaḥ nāmena bodhisatto tidhā mato 
PA_anya-e11_02n:311	Ugghaṭitaññubodhisatto, paññādhikoti nāmaso;	paññādhiko ti 
PA_anya-e11_02n:312	Vibhajjitaññubodhisatto, vutto vīriyādhiko.	vibhajjitaññu bodhisattaḥ vuttaḥ vīriya adhikaḥ 
PA_anya-e11_02n:313	Mato neyyo saddhādhiko nāma, bodhisattā ime tayo;	mataḥ saddhādhikaḥ nāma bodhisattāḥ ime tayo 
PA_anya-e11_02n:314	Kappeca satasahasse, caturo ca asaṅkhyeyye.	sata sahasse caturaḥ ca asaṅkhyeyye 
PA_anya-e11_02n:315	Pūretvā bodhisambhāre, laddhabyākaraṇo pure;	pūretvā bodhi sambhāre laddha byākaraṇaḥ pure 
PA_anya-e11_02n:316	Ugghaṭitaññubodhisatto, patto sambodhimuttamaṃ.	pattaḥ sambodhim uttamam 
PA_anya-e11_02n:317	Aṭṭhame ca asaṅkhyeyye, kappe ca satasahasse;	aṭṭhame ca asaṅkhyeyye kappe ca sata sahasse 
PA_anya-e11_02n:318	Pūretvā bodhisambhāre, laddhabyākaraṇo pure.	pūretvā bodhi sambhāre laddha byākaraṇaḥ pure 
PA_anya-e11_02n:319	Vipañcitaññubodhisatto, patto sambodhimuttamaṃ;	vipañcitaññu bodhisatto pattaḥ sambodhim uttamam 
PA_anya-e11_02n:320	Neyyo tu bodhisatto ca, soḷase asaṅkhyeyye.	tu bodhisatto ca soḷase asaṅkhyeyye 
PA_anya-e11_02n:321	Kappe ca satasahasse, laddhabyākaraṇo pure;	kappe ca sata sahasse laddha byākaraṇaḥ pure 
PA_anya-e11_02n:322	Pūretvā bodhisambhāre, patto sambodhimuttama” nti.	pūretvā bodhi sambhāre patto sambodhim uttama nti 
PA_anya-e11_02n:323_0	Suttanipātaapadānaṭṭhakathāsu pana “buddhānaṃ ānanda heṭṭhimaparicchedena cattāri	sutta nipāta apadāna aṭṭhakathāsu pana buddhānam ānanda heṭṭhima paricchedena cattāri 
PA_anya-e11_02n:323_1	asaṅkhyeyyāni kappasatasahassañca, majjhimaparicchedena aṭṭha asaṅkhyeyyāni kappasatasahassañca,	asaṅkhyeyyāni kappa sata sahassañca majjhima paricchedena aṭṭha asaṅkhyeyyāni kappa sata sahassañca 
PA_anya-e11_02n:323_2	uparimaparicchedena soḷasāsaṅkhyyeyyāni kappasatasahassañca. Eteca paññādhikasaddhādhikavīriyādhikavasena	uparima paricchedena soḷasa asaṅkhyeyyāni kappa sata sahassam ca ete ca paññā adhika saddhā adhika vīriya adhika vasena 
PA_anya-e11_02n:323_3	veditabbāti vuttaṃ tesu paññādhiko cattāri asaṅkhyeyyāni kappasatasahassañca, saddhādhiko	veditabbā iti vuttam tesu paññā adhiko cattāri asaṅkhyeyyāni kappa sata sahassañca saddhā adhiko 
PA_anya-e11_02n:323_4	aṭṭhaasaṅkheyyeyyāni kappasatasahassañca, vīriyādhiko soḷasaasaṅkhyeyyāni kappasatasahassañcāti	aṭṭha asaṅkheyyeyyāni kappa sata sahassam ca vīriya adhikaḥ soḷasa asaṅkhyeyyāni kappa sata sahassam ca ati 
PA_anya-e11_02n:323_5	veditabbaṃ. Tattha paññādhiko yonigativiññāṇaṭṭhitisattāvāsesu saṃsarantopi paññābahullavasena	veditabbam tattha paññā adhikaḥ yoni gati viññāṇa ṭṭhiti sattā vāsesu saṃsarantaḥ api paññā bahulla vasena 
PA_anya-e11_02n:323_6	sampannajjhāsaya sambhavato khippaññeva tassa sambodhi. Saddhādhiko pana mandapaññattā	sampanna jjhāsaya sambhavataḥ khippaññā iva tassa sambodhi saddhā adhikaḥ pana manda paññattā 
PA_anya-e11_02n:323_7	assaddahitabbepi saddahati, tasmā tassa mandaññeva sambodhi. Vīriyādhiko pana ubhayamando	a ssaddahitabbe pi saddahati tasmā tassa mandaññā iva vīriya adhiko pana ubhaya mando 
PA_anya-e11_02n:323_8	assaddahitabbampi saddahati, akattabbampi karoti, rājā passenadīkosalo yathā so hi	a ssaddahitabbam pi saddahati a kattabbam pi karoti rājā passenadīkosalaḥ yathā saḥ hi 
PA_anya-e11_02n:323_9	sabbaññubuddhe dharamāneyeva agamanīyampi paradāraṃ gantuṃ cittaṃ uppādetvā paraṃ	sabbaññu buddhe a gamanīyam pi para dāram gantum cittam uppādetvā param 
PA_anya-e11_02n:323_10	jīvitā voropetuṃ āraddho nerayikānaṃ viravantānaṃ du-sa-na-soti saddampi sutvā ativimūḷho	jīvitā voropetum āraddhaḥ nerayikānam viravantānam dusanasā iti saddampi sutvā ati vimūḍhaḥ 
PA_anya-e11_02n:323_11	sabbaññubuddhaṃ ṭhapetvā micchādiṭṭhibrāhmaṇaṃ pucchitvā tassa vacanena sabbajanānaṃ	sabbaññu buddham ṭhapetvā micchādiṭṭhi brāhmaṇam pucchitvā tassa vacanena sabba janānam 
PA_anya-e11_02n:323_12	yaññatthāya dukkhaṃ uppādesi ko panavādo anuppanne buddhe, tathā hi esa kassapabhagavato	yaññatthāya dukkham uppādesi kaḥ pana vādaḥ an uppanne buddhe tathā hi esa kassapa bhagavataḥ 
PA_anya-e11_02n:323_13	sāsanantaradhānena andhabhūte loke bārāṇasiyaṃ rājā hutvāpi nigrodharukkhadevatāya	andha bhūte loke bārāṇasiyam rājā hutvā api nigrodha rukkha devatāya 
PA_anya-e11_02n:323_14	yaññatthāya ekasatarājāno mahesīhi saddhiṃ māretuṃ āraddho. Evaṃ vīriyādhiko ubhayamando,	yaññatthāya eka sata rājānaḥ mahesīhi saddhim māretum āraddhaḥ evam vīriya adhikaḥ ubhaya mandaḥ 
PA_anya-e11_02n:323_15	tasmā tassa sambodhi atimandoti evaṃ paññādhikasaddhādhikavīriyādhikavasena kālassāpi	tasmā tassa sambodhi ati mandaḥ ti evam paññā adhika saddhā adhika vīriya adhika vasena kālassa api 
PA_anya-e11_02n:323_16	rassadīghabhāvo veditabboti. Pacchimanayoeva pasaṃsitabboti ayamettha amhākaṃ attanomati.	rassa dīgha bhāvaḥ veditabbo ti pacchima nayo eva pasaṃsitabbo ti ayam ettha amhākam 
PA_anya-e11_02n:323_17	Khandhaparinibbānaṃ pana kusinārāya upavattane mallānaṃ sālavane yamakasālānamantare	khandha parinibbānam pana kusinārāya upavattane mallānam sālavane yamaka sālānam antare 
PA_anya-e11_02n:323_18	vesākhapuṇṇamadivase paccūsasamaye ekūnavīsatiyā cuticittesu mettāpubbabhāgassa somanassañāṇasampayuttaasaṅkhārikakusalacittasadisena	vesākha puṇṇama divase paccūsa samaye ekūnavīsatiyā cuti cittesu mettā pubba bhāgassa somanassa ñāṇa sampayutta asaṅkhārika kusala citta sadisena 
PA_anya-e11_02n:323_19	mahāvipākacittena abyākatena carimakaṃ katvā katthaci bhave paṭisandhiviññāṇassa	mahā vipāka cittena abyākatena carimakam katvā katthaci bhave paṭisandhi viññāṇassa 
PA_anya-e11_02n:323_20	anantarapaccayo hutvā kammataṇhākilesehi anupādāno sabbupadhipaṭinissaggo upādinnakakkhandhapariccāgo	anantara paccayaḥ hutvā kamma taṇhā kilesehi anupādānaḥ sabba upadhi paṭinissaggo upādinnaka khandha pariccāgo 
PA_anya-e11_02n:323_21	hotīti veditabbaṃ. Vitthāro pana dīghanikāye mahāvagge mahāparinibbānasuttavaṇṇanāyaṃ	hoti iti veditabbam vitthāraḥ pana dīgha nikāye mahā vagge mahāparinibbāna sutta vaṇṇanāyam 
PA_anya-e11_02n:323_22	oloketabbo. Tattha videsaṃ gacchanto puriso sabbaṃ ñātijanaṃ āliṅgetvā sīse cumbitvā	oloketabbaḥ tattha videsam gacchantaḥ puriso sabbam ñāti janam āliṅgetvā sīse cumbitvā 
PA_anya-e11_02n:323_23	gacchati viya bhagavāpi nibbānapuraṃ pavisanto sabbepi catuvīsatikoṭisatasahassasamāpattiyo	gacchati viya bhagavā api nibbāna puram pavisantaḥ sabbe pi catuvīsati koṭi sata sahassa samāpattiyo 
PA_anya-e11_02n:323_24	anavasesaṃ samāpajjitvā yāva saññāvedayitaṃ, tatopi vuṭṭhāya yāva nevasaññānāsaññāyatanaṃ	anavasesam samāpajjitvā yāva saññā vedayitam tatas pi vuṭṭhāya yāva nevasaññānāsaññāyatanam 
PA_anya-e11_02n:323_25	samāpajjitvā vuṭṭhāya jhānaṅgāni paccavekkhitvā bhavaṅgacittena abyākatena dukkhasaccena	samāpajjitvā vuṭṭhāya jhāna aṅgāni paccavekkhitvā bhavaṅga cittena abyākatena dukkha saccena 
PA_anya-e11_02n:323_26	parinibbāyi. Pāḷiyaṃ pana “catutthajjhānā vuṭṭhahitvā samanantarā bhagavā parinibbāyī”ti	parinibbāyi pāḷiyam pana catuttha jhānā vuṭṭhahitvā samanantarā bhagavā parinibbāyi iti 
PA_anya-e11_02n:323_27	vuttaṃ tattha dve samanantarā jhānasamanantarā, paccavekkhaṇasamanantarāti. Tattha	vuttam tattha dve samanantarā jhāna samanantarā paccavekkhaṇa samanantarā ti tattha 
PA_anya-e11_02n:323_28	jhānā vuṭṭhāya bhavaṅgaṃ otiṇṇassa tattheva parinibbānaṃ jhānasamanantaraṃ nāma.	jhānā vuṭṭhāya bhavaṅgam otiṇṇassa tattha eva parinibbānam jhāna samanantaram nāma 
PA_anya-e11_02n:323_29	Jhānā vuṭṭhahitvā puna jhānaṅgāni paccavekkhitvā bhavaṅgaṃ otiṇṇassa tattheva parinibbānaṃ	jhānā vuṭṭhahitvā puna jhāna aṅgāni paccavekkhitvā bhavaṅgam otiṇṇassa tattha eva parinibbānaṃ 
PA_anya-e11_02n:323_30	paccavekkhaṇasamanantaraṃ nāma. Bhagavā pana jhānasamanantarā apari nibbāyittā paccavekkhaṇasamanantarameva	paccavekkhaṇa samanantaram nāma bhagavā pana jhāna samanantarā apari nibbāyittā paccavekkhaṇa samanantaram eva 
PA_anya-e11_02n:323_31	parinibbāyīti veditabbaṃ, tenevāha “bhagavā pana jhānaṃ samāpajjitvā jhānā vuṭṭhāya	parinibbāyi iti veditabbam tena iva āha bhagavā pana jhānam samāpajjitvā jhānā vuṭṭhāya 
PA_anya-e11_02n:323_32	jhānaṅgāni paccavekkhitvā bhavaṅgacittena abyākatena dukkhasaccena parinibbāyī”ti.	jhāna aṅgāni paccavekkhitvā bhavaṅga cittena abyākatena dukkha saccena parinibbāyi iti 
PA_anya-e11_02n:323_33	Ettha bhagavato parinibbānacittassa kiṃ ārammaṇaṃ kammaṃ vā hoti, udāhu kammanimittagatinimittāni,	ettha bhagavataḥ parinibbāna cittassa kim ārammaṇam kammam vā hoti udāhu kamma nimitta gati nimittāni 
PA_anya-e11_02n:323_34	atha nibbānanti apare evaṃ vadanti.	atha nibbānam ti apare evam vadanti 
PA_anya-e11_02n:324	Nāhu assāsapassāsā, ṭhitacittassa tādino;	na ahu assāsa passāsā ṭhita cittassa tādinaḥ 
PA_anya-e11_02n:325	Anejo santi’mārabbha, yaṃkāla’makarī muni.	santim ārabbha muni 
PA_anya-e11_02n:326	Asallīnena cittena, vedanaṃ ajjhavāsayi;	a sat līnena cittena vedanam ajjhavāsayi 
PA_anya-e11_02n:327	Pajjotasse’va nibbānaṃ, vimokkho cetaso ahū’ti.	pajjotassa iva nibbānam vimokkhaḥ cetasaḥ ahū ti 
PA_anya-e11_02n:328_0	Imissāgāthāya “yaṃ yo muni anejo santi nibbānaṃ ārabbha kālaṃ akarī”ti yojetvā bhagavato	imissā āgāthāya yam yaḥ muni anejaḥ santi nibbānam ārabbha kālam akari iti yojetvā bhagavataḥ 
PA_anya-e11_02n:328_1	parinibbānacittassa nibbānārammaṇanti tamayuttaṃ, paṭisandhibhavaṅgacutīnaṃ nibbānārammaṇassa	parinibbāna cittassa nibbāna ārammaṇan ti tam ayuttam paṭisandhi bhavaṅga cutīnam nibbāna ārammaṇassa 
PA_anya-e11_02n:328_2	anārahattā “nibbānaṃ gotrabhussa vodānassa maggassa ārammaṇapaccayenapaccayo, nibbānaṃ	anāraha ttā nibbānam gotrabhussa vodānassa maggassa ārammaṇa paccayena paccayaḥ nibbānam 
PA_anya-e11_02n:328_3	phalassa āvajjanāyā”ti paṭṭhānapāḷiyā javanaāvajjanānameva adhippetattā tasmā ettha	phalassa āvajjanāya ati paṭṭhāna pāḷiyā javana āvajjanānam eva adhippeta ttā tasmai ettha 
PA_anya-e11_02n:328_4	“yaṃ yo muni phalasamāpattiyā anejo anejasaṅkhāto taṇhārahito santiṃ nibbānaṃ ārabbha	yam yaḥ muni phala samāpattiyā anejaḥ aneja saṅkhāto taṇhā rahitaḥ santim nibbānam ārabbha 
PA_anya-e11_02n:328_5	ārammaṇaṃ katvā kālaṃ asītivassaparimāṇaṃ akari atikkamī”ti yojanā kātabbā. Keci	ārammaṇam katvā kālam asīti vassa parimāṇam akari atikkami iti yojanā kātabbā keci 
PA_anya-e11_02n:328_6	pana evaṃ vadanti… “katthaci pana anuppajjamānassa khīṇāsavassa yathopaṭṭhitaṃ nāmarūpadhammādikameva	pana evam vadanti katthaci pana anuppajjamānassa khīṇāsavassa yathā upaṭṭhitam nāma rūpa dhamma ādikam eva 
PA_anya-e11_02n:328_7	cutipariyosānānaṃ gocarabhāvaṃ gacchati, na kamma-kammanimittādayo”ti vuttattā kammanittagatinimittāni	cuti pariyosānānam gocara bhāvam gacchati na kamma kamma nimitta ādayaḥ ti vutta ttā kamma nitta gati nimittāni 
PA_anya-e11_02n:328_8	arahato cuticittassa ārammaṇabhāvaṃ na gacchantīti tampi ayuttameva ayañhetthattho	arahataḥ cuti cittassa ārammaṇa bhāvam na gacchanti iti tat pi ayuttam eva ayam ha itthatthaḥ 
PA_anya-e11_02n:328_9	katthaci pana bhave anuppajjamānassa khīṇāsavassa arahato yathā yathā yena yena pakārena	katthaci pana bhave an uppajjamānassa khīṇāsavassa arahataḥ yathā yathā yena yena pakārena 
PA_anya-e11_02n:328_10	upaṭṭhitaṃ nāmarūpadhammādikameva cutipariyosānaṃ āvajjanajavanacittānaṃ gocarabhāvaṃ	upaṭṭhitam nāma rūpa dhamma ādikam eva cuti pariyosānam āvajjana javana cittānam gocara bhāvam 
PA_anya-e11_02n:328_11	gacchati, puna bhavābhinibbattiyā abhāvato. Kiṃ kāraṇaṃ bhūtāni kammakammanimittagatinimittāni	gacchati puna bhava abhinibbattiyāḥ abhāvataḥ kim kāraṇam bhūtāni kamma kamma nimitta gati nimittāni 
PA_anya-e11_02n:328_12	gocarabhāvaṃ na gacchantīti. Cuticittassa pana paṭisandhicittena gahitaṃ atītārammaṇameva	gocara bhāvam na gacchanti iti cuti cittassa pana paṭisandhi cittena gahitam atīta ārammaṇam eva 
PA_anya-e11_02n:328_13	gocarabhāvaṃ gacchati. “Nāmarūpādikamevā ti ettha nāma”nti cittacetasikanibbānaṃ	gocara bhāvam gacchati nāma rūpa ādikam evā ti ettha nāmanti citta cetasika nibbānam 
PA_anya-e11_02n:328_14	rūpanti aṭṭhārasavidhaṃ rūpaṃ saṅgaṇhāti. Nāmañca rūpañca nāmarūpā. Nāmarūpā ca te	aṭṭhārasavidham rūpam saṅgaṇhāti nāman ca rūpam ca nāma rūpāḥ nāma rūpā ca te 
PA_anya-e11_02n:328_15	dhammā ceti tathā. Te ādi yesaṃ teti nāmarūpadhammādi tameva nāmarūpadhammādikaṃ.	dhammā ca iti tathā te ādi yesam te iti nāma rūpa dhamma ādi tam eva nāma rūpa dhamma ādikam 
PA_anya-e11_02n:328_16	Ādisaddena cha paññattiyo saṅgaṇhāti, tena nibbānampi arahato maraṇāsannakāle kriyajavanassapi	ādi saddena cha paññattiyaḥ saṅgaṇhāti tena nibbānam pi arahataḥ maraṇa āsanna kāle kriya javanassa api 
PA_anya-e11_02n:328_17	ārammaṇabhāvo bhaveyyāti amhākaṃ khanti vīmaṃsitvā pana gahetabbaṃ. Bhagavato nibbānacittassa	ārammaṇa bhāvaḥ bhaveyyāti amhākam khanti vīmaṃsitvā pana gahetabbam bhagavataḥ nibbāna cittassa 
PA_anya-e11_02n:328_18	pana tusitapurato cavitvā sirīmahāmāyāya kucchimhi vasitapaṭisandhicittena gahitārammaṇameva	pana tusita puratas cavitvā sirī mahāmāyāya kucchimhi vasita paṭisandhi cittena gahita ārammaṇam eva 
PA_anya-e11_02n:328_19	ārammaṇaṃ hotīti daṭṭhabbaṃ tañca kho gatinimittameva, na kammakammanimittāni. Yuttitopi	ārammaṇam hoti iti daṭṭhabbam tat ca kho gati nimittam eva na kamma kamma nimittāni yuttitaḥ pi 
PA_anya-e11_02n:328_20	āgamatopi gatinimittameva yujjati tathā hi tusitapureyeva setaketudevaputto hutvā	āgamataḥ api gati nimittam eva yujjati tathā hi setaketu deva puttaḥ hutvā 
PA_anya-e11_02n:328_21	dibbagaṇanāya cattāri sahassāni, manussagaṇanāya sattapaññāsavassakoṭi,saṭṭhivassasatasahassāni	dibba gaṇanāya cattāri sahassāni manussa gaṇanāya satta paññāsa vassa koṭi saṭṭhi vassa sata sahassāni 
PA_anya-e11_02n:328_22	ṭhatvā pariyosāne pañca pubbanimittāni disvā suddhāvāse arahantabrahmunā dasahi cakkavāḷasahassehi	ṭhatvā pariyosāne pañca pubba nimittāni disvā suddhāvāse arahanta brahmunā dasahi cakkavāḷa sahassehi 
PA_anya-e11_02n:328_23	āgamma devatāvisesehi ca.	āgamma devatā visesehi ca 
PA_anya-e11_02n:329	“Kālo deva mahāvīra, uppajja mātukucchayaṃ;	kālaḥ deva mahāvīraḥ uppajja mātukucchayam 
PA_anya-e11_02n:330	Sadevakaṃ tārayanto, bujjhassu amataṃ pada”nti.	sa devakam tārayantaḥ bujjhassu amatam padanti 
PA_anya-e11_02n:331_0	Yāciyamāno “kālaṃ dīpañca desañca, kulaṃ mātarameva cā”ti vuttāni pañca mahāvilokanāni	kālam dīpam ca desam ca kulam mātaram eva ca ati vuttāni pañca mahā vilokanāni 
PA_anya-e11_02n:331_1	viloketvā tusitapurato cavitvā āsāḷhīpuṇṇamāyaṃ uttarāsāḷhanakkhatteneva saddhiṃ	viloketvā tusita puratas cavitvā āsāḷhīpuṇṇamāyam uttarāsāḷha nakkhattena iva saddhim 
PA_anya-e11_02n:331_2	ekūnavīsatiyā paṭisandhicittesu mettāpubbabhāgamassa somanassañāṇasampayuttaasaṅkhārikakusalacittassa	ekūnavīsatiyā paṭisandhi cittesu mettā pubba bhāgamassa somanassa ñāṇa sampayutta asaṅkhārika kusala cittassa 
PA_anya-e11_02n:331_3	sadisena mahāvipākacittena paṭisandhiṃ aggahesi. Tadārammaṇāsannavīthito pubbabhāge	sadisena mahā vipāka cittena paṭisandhim aggahesi tad ārammaṇa āsanna vīthitaḥ pubba bhāge 
