segmentnr	original	folio	analyzed
PA_an_2:39.2.1	Yasmiṁ, bhikkhave, samaye rājāno balavanto honti, corā tasmiṁ samaye dubbalā honti.	39	
PA_an_2:39.2.2	Tasmiṁ, bhikkhave, samaye rañño phāsu hoti atiyātuṁ vā niyyātuṁ vā paccantime vā janapade anusaññātuṁ.	39	
PA_an_2:39.2.3	Brāhmaṇagahapatikānampi tasmiṁ samaye phāsu hoti atiyātuṁ vā niyyātuṁ vā bāhirāni vā kammantāni paṭivekkhituṁ.	39	
PA_an_2:39.2.4	Evamevaṁ kho, bhikkhave, yasmiṁ samaye pesalā bhikkhū balavanto honti, pāpabhikkhū tasmiṁ samaye dubbalā honti.	39	
PA_an_2:39.2.5	Tasmiṁ, bhikkhave, samaye pāpabhikkhū tuṇhībhūtā tuṇhībhūtāva saṅghamajjhe saṅkasāyanti, yena vā pana tena pakkamanti.	39	
PA_an_2:39.2.6	Tayidaṁ, bhikkhave, hoti bahujanahitāya bahujanasukhāya, bahuno janassa atthāya hitāya sukhāya devamanussānan”ti.	39	
PA_an_2:40.1.1	“Dvinnāhaṁ, bhikkhave, micchāpaṭipattiṁ na vaṇṇemi, gihissa vā pabbajitassa vā.	40	
PA_an_2:40.1.2	Gihī vā, bhikkhave, pabbajito vā micchāpaṭipanno micchāpaṭipattādhikaraṇahetu na ārādhako hoti ñāyaṁ dhammaṁ kusalaṁ.	40	
PA_an_2:40.2.1	Dvinnāhaṁ, bhikkhave, sammāpaṭipattiṁ vaṇṇemi, gihissa vā pabbajitassa vā.	40	
PA_an_2:40.2.2	Gihī vā, bhikkhave, pabbajito vā sammāpaṭipanno sammāpaṭipattādhikaraṇahetu ārādhako hoti ñāyaṁ dhammaṁ kusalan”ti.	40	
PA_an_2:41.1.1_0	“Ye te, bhikkhave, bhikkhū duggahitehi suttantehi byañjanappatirūpakehi atthañca	41	
PA_an_2:41.1.1_1	dhammañca paṭibāhanti te, bhikkhave, bhikkhū bahujanāhitāya paṭipannā bahujanāsukhāya,	41	
PA_an_2:41.1.1_2	bahuno janassa anatthāya ahitāya dukkhāya devamanussānaṁ.	41	
PA_an_2:41.1.2	Bahuñca te, bhikkhave, bhikkhū apuññaṁ pasavanti, te cimaṁ saddhammaṁ antaradhāpenti.	41	
PA_an_2:41.2.1_0	Ye te, bhikkhave, bhikkhū suggahitehi suttantehi byañjanappatirūpakehi atthañca dhammañca	41	
PA_an_2:41.2.1_1	anulomenti te, bhikkhave, bhikkhū bahujanahitāya paṭipannā bahujanasukhāya, bahuno	41	
PA_an_2:41.2.1_2	janassa atthāya hitāya sukhāya devamanussānaṁ.	41	
PA_an_2:41.2.2	Bahuñca te, bhikkhave, bhikkhū puññaṁ pasavanti, te cimaṁ saddhammaṁ ṭhapentī”ti.	41	
PA_an_2:41.2.3	Samacittavaggo catuttho.	41	
PA_an_2:42.0.1	Aṅguttara Nikāya 2	42	
PA_an_2:42.0.2	5. Parisavagga	42	
PA_an_2:42.1.1	“Dvemā, bhikkhave, parisā.	42	
PA_an_2:42.1.2	Katamā dve?	42	
PA_an_2:42.1.3	Uttānā ca parisā gambhīrā ca parisā.	42	
PA_an_2:42.1.4	Katamā ca, bhikkhave, uttānā parisā?	42	
PA_an_2:42.1.5	Idha, bhikkhave, yassaṁ parisāyaṁ bhikkhū uddhatā honti unnaḷā capalā mukharā vikiṇṇavācā muṭṭhassatī asampajānā asamāhitā vibbhantacittā pākatindriyā.	42	
PA_an_2:42.1.6	Ayaṁ vuccati, bhikkhave, uttānā parisā.	42	
PA_an_2:42.2.1	Katamā ca, bhikkhave, gambhīrā parisā?	42	
PA_an_2:42.2.2	Idha, bhikkhave, yassaṁ parisāyaṁ bhikkhū anuddhatā honti anunnaḷā acapalā amukharā avikiṇṇavācā upaṭṭhitassatī sampajānā samāhitā ekaggacittā saṁvutindriyā.	42	
PA_an_2:42.2.3	Ayaṁ vuccati, bhikkhave, gambhīrā parisā.	42	
PA_an_2:42.2.4	Imā kho, bhikkhave, dve parisā.	42	
PA_an_2:42.2.5	Etadaggaṁ, bhikkhave, imāsaṁ dvinnaṁ parisānaṁ yadidaṁ gambhīrā parisā”ti.	42	
PA_an_2:43.1.1	“Dvemā, bhikkhave, parisā.	43	
PA_an_2:43.1.2	Katamā dve?	43	
PA_an_2:43.1.3	Vaggā ca parisā samaggā ca parisā.	43	
PA_an_2:43.1.4	Katamā ca, bhikkhave, vaggā parisā?	43	
PA_an_2:43.1.5	Idha, bhikkhave, yassaṁ parisāyaṁ bhikkhū bhaṇḍanajātā kalahajātā vivādāpannā aññamaññaṁ mukhasattīhi vitudantā viharanti.	43	
PA_an_2:43.1.6	Ayaṁ vuccati, bhikkhave, vaggā parisā.	43	
PA_an_2:43.2.1	Katamā ca, bhikkhave, samaggā parisā?	43	
PA_an_2:43.2.2	Idha, bhikkhave, yassaṁ parisāyaṁ bhikkhū samaggā sammodamānā avivadamānā khīrodakībhūtā aññamaññaṁ piyacakkhūhi sampassantā viharanti.	43	
PA_an_2:43.2.3	Ayaṁ vuccati, bhikkhave, samaggā parisā.	43	
PA_an_2:43.2.4	Imā kho, bhikkhave, dve parisā.	43	
PA_an_2:43.2.5	Etadaggaṁ, bhikkhave, imāsaṁ dvinnaṁ parisānaṁ yadidaṁ samaggā parisā”ti.	43	
PA_an_2:44.1.1	“Dvemā, bhikkhave, parisā.	44	
PA_an_2:44.1.2	Katamā dve?	44	
PA_an_2:44.1.3	Anaggavatī ca parisā aggavatī ca parisā.	44	
PA_an_2:44.1.4	Katamā ca, bhikkhave, anaggavatī parisā?	44	
PA_an_2:44.1.5_0	Idha, bhikkhave, yassaṁ parisāyaṁ therā bhikkhū bāhulikā honti sāthalikā, okkamane	44	
PA_an_2:44.1.5_1	pubbaṅgamā, paviveke nikkhittadhurā, na vīriyaṁ ārabhanti appattassa pattiyā anadhigatassa	44	
PA_an_2:44.1.5_2	adhigamāya asacchikatassa sacchikiriyāya.	44	
PA_an_2:44.1.6	Tesaṁ pacchimā janatā diṭṭhānugatiṁ āpajjati.	44	
PA_an_2:44.1.7	Sāpi hoti bāhulikā sāthalikā, okkamane pubbaṅgamā, paviveke nikkhittadhurā, na vīriyaṁ ārabhati appattassa pattiyā anadhigatassa adhigamāya asacchikatassa sacchikiriyāya.	44	
PA_an_2:44.1.8	Ayaṁ vuccati, bhikkhave, anaggavatī parisā.	44	
PA_an_2:44.2.1	Katamā ca, bhikkhave, aggavatī parisā?	44	
PA_an_2:44.2.2_0	Idha, bhikkhave, yassaṁ parisāyaṁ therā bhikkhū na bāhulikā honti na sāthalikā, okkamane	44	
PA_an_2:44.2.2_1	nikkhittadhurā, paviveke pubbaṅgamā, vīriyaṁ ārabhanti appattassa pattiyā anadhigatassa	44	
PA_an_2:44.2.2_2	adhigamāya asacchikatassa sacchikiriyāya.	44	
PA_an_2:44.2.3	Tesaṁ pacchimā janatā diṭṭhānugatiṁ āpajjati.	44	
PA_an_2:44.2.4	Sāpi hoti na bāhulikā na sāthalikā, okkamane nikkhittadhurā, paviveke pubbaṅgamā, vīriyaṁ ārabhati appattassa pattiyā anadhigatassa adhigamāya asacchikatassa sacchikiriyāya.	44	
PA_an_2:44.2.5	Ayaṁ vuccati, bhikkhave, aggavatī parisā.	44	
PA_an_2:44.2.6	Imā kho, bhikkhave, dve parisā.	44	
PA_an_2:44.2.7	Etadaggaṁ, bhikkhave, imāsaṁ dvinnaṁ parisānaṁ yadidaṁ aggavatī parisā”ti.	44	
PA_an_2:45.1.1	“Dvemā, bhikkhave, parisā.	45	
PA_an_2:45.1.2	Katamā dve?	45	
PA_an_2:45.1.3	Anariyā ca parisā ariyā ca parisā.	45	
PA_an_2:45.1.4	Katamā ca, bhikkhave, anariyā parisā?	45	
PA_an_2:45.1.5_0	Idha, bhikkhave, yassaṁ parisāyaṁ bhikkhū ‘idaṁ dukkhan’ti yathābhūtaṁ nappajānanti,	45	
PA_an_2:45.1.5_1	‘ayaṁ dukkhasamudayo’ti yathābhūtaṁ nappajānanti, ‘ayaṁ dukkhanirodho’ti yathābhūtaṁ	45	
PA_an_2:45.1.5_2	nappajānanti, ‘ayaṁ dukkhanirodhagāminī paṭipadā’ti yathābhūtaṁ nappajānanti.	45	
PA_an_2:45.1.6	Ayaṁ vuccati, bhikkhave, anariyā parisā.	45	
PA_an_2:45.2.1	Katamā ca, bhikkhave, ariyā parisā?	45	
PA_an_2:45.2.2_0	Idha, bhikkhave, yassaṁ parisāyaṁ bhikkhū ‘idaṁ dukkhan’ti yathābhūtaṁ pajānanti,	45	
PA_an_2:45.2.2_1	‘ayaṁ dukkhasamudayo’ti yathābhūtaṁ pajānanti, ‘ayaṁ dukkhanirodho’ti yathābhūtaṁ	45	
PA_an_2:45.2.2_2	pajānanti, ‘ayaṁ dukkhanirodhagāminī paṭipadā’ti yathābhūtaṁ pajānanti.	45	
PA_an_2:45.2.3	Ayaṁ vuccati, bhikkhave, ariyā parisā.	45	
PA_an_2:45.2.4	Imā kho, bhikkhave, dve parisā.	45	
PA_an_2:45.2.5	Etadaggaṁ, bhikkhave, imāsaṁ dvinnaṁ parisānaṁ yadidaṁ ariyā parisā”ti.	45	
PA_an_2:46.1.1	“Dvemā, bhikkhave, parisā.	46	
PA_an_2:46.1.2	Katamā dve?	46	
PA_an_2:46.1.3	Parisākasaṭo ca parisāmaṇḍo ca.	46	
PA_an_2:46.1.4	Katamo ca, bhikkhave, parisākasaṭo?	46	
PA_an_2:46.1.5	Idha, bhikkhave, yassaṁ parisāyaṁ bhikkhū chandāgatiṁ gacchanti, dosāgatiṁ gacchanti, mohāgatiṁ gacchanti, bhayāgatiṁ gacchanti.	46	
PA_an_2:46.1.6	Ayaṁ vuccati, bhikkhave, parisākasaṭo.	46	
PA_an_2:46.2.1	Katamo ca, bhikkhave, parisāmaṇḍo?	46	
PA_an_2:46.2.2	Idha, bhikkhave, yassaṁ parisāyaṁ bhikkhū na chandāgatiṁ gacchanti, na dosāgatiṁ gacchanti, na mohāgatiṁ gacchanti, na bhayāgatiṁ gacchanti.	46	
PA_an_2:46.2.3	Ayaṁ vuccati, bhikkhave, parisāmaṇḍo.	46	
PA_an_2:46.2.4	Imā kho, bhikkhave, dve parisā.	46	
PA_an_2:46.2.5	Etadaggaṁ, bhikkhave, imāsaṁ dvinnaṁ parisānaṁ yadidaṁ parisāmaṇḍo”ti.	46	
PA_an_2:47.1.1	“Dvemā, bhikkhave, parisā.	47	
PA_an_2:47.1.2	Katamā dve?	47	
PA_an_2:47.1.3	Okkācitavinītā parisā nopaṭipucchāvinītā, paṭipucchāvinītā parisā nookkācitavinītā.	47	
PA_an_2:47.1.4	Katamā ca, bhikkhave, okkācitavinītā parisā nopaṭipucchāvinītā?	47	
PA_an_2:47.1.5_0	Idha, bhikkhave, yassaṁ parisāyaṁ bhikkhū ye te suttantā tathāgatabhāsitā gambhīrā	47	
PA_an_2:47.1.5_1	gambhīratthā lokuttarā suññatāpaṭisaṁyuttā tesu bhaññamānesu na sussūsanti na sotaṁ	47	
PA_an_2:47.1.5_2	odahanti na aññā cittaṁ upaṭṭhapenti na ca te dhamme uggahetabbaṁ pariyāpuṇitabbaṁ maññanti.	47	
PA_an_2:47.1.6_0	Ye pana te suttantā kavitā kāveyyā cittakkharā cittabyañjanā bāhirakā sāvakabhāsitā	47	
PA_an_2:47.1.6_1	tesu bhaññamānesu sussūsanti sotaṁ odahanti aññā cittaṁ upaṭṭhapenti, te dhamme uggahetabbaṁ	47	
PA_an_2:47.1.6_2	pariyāpuṇitabbaṁ maññanti, te ca taṁ dhammaṁ pariyāpuṇitvā na ceva aññamaññaṁ paṭipucchanti	47	
PA_an_2:47.1.6_3	na ca paṭivicaranti:	47	
PA_an_2:47.1.7	‘idaṁ kathaṁ, imassa ko attho’ti?	47	
PA_an_2:47.1.8	Te avivaṭañceva na vivaranti, anuttānīkatañca na uttānīkaronti, anekavihitesu ca kaṅkhāṭhāniyesu dhammesu kaṅkhaṁ na paṭivinodenti.	47	
PA_an_2:47.1.9	Ayaṁ vuccati, bhikkhave, okkācitavinītā parisā no paṭipucchāvinītā.	47	
PA_an_2:47.2.1	Katamā ca, bhikkhave, paṭipucchāvinītā parisā nookkācitavinītā?	47	
PA_an_2:47.2.2_0	Idha, bhikkhave, yassaṁ parisāyaṁ bhikkhū ye te suttantā kavitā kāveyyā cittakkharā	47	
PA_an_2:47.2.2_1	cittabyañjanā bāhirakā sāvakabhāsitā tesu bhaññamānesu na sussūsanti na sotaṁ odahanti	47	
PA_an_2:47.2.2_2	na aññā cittaṁ upaṭṭhapenti, na ca te dhamme uggahetabbaṁ pariyāpuṇitabbaṁ maññanti.	47	
PA_an_2:47.2.3_0	Ye pana te suttantā tathāgatabhāsitā gambhīrā gambhīratthā lokuttarā suññatāpaṭisaṁyuttā	47	
PA_an_2:47.2.3_1	tesu bhaññamānesu sussūsanti sotaṁ odahanti aññā cittaṁ upaṭṭhapenti, te ca dhamme	47	
PA_an_2:47.2.3_2	uggahetabbaṁ pariyāpuṇitabbaṁ maññanti.	47	
PA_an_2:47.2.4	Te taṁ dhammaṁ pariyāpuṇitvā aññamaññaṁ paṭipucchanti paṭivicaranti:	47	
PA_an_2:47.2.5	‘idaṁ kathaṁ, imassa ko attho’ti?	47	
PA_an_2:47.2.6	Te avivaṭañceva vivaranti, anuttānīkatañca uttānīkaronti, anekavihitesu ca kaṅkhāṭhāniyesu dhammesu kaṅkhaṁ paṭivinodenti.	47	
PA_an_2:47.2.7	Ayaṁ vuccati, bhikkhave, paṭipucchāvinītā parisā nookkācitavinītā.	47	
PA_an_2:47.2.8	Imā kho, bhikkhave, dve parisā.	47	
PA_an_2:47.2.9	Etadaggaṁ, bhikkhave, imāsaṁ dvinnaṁ parisānaṁ yadidaṁ paṭipucchāvinītā parisā nookkācitavinītā”ti.	47	
PA_an_2:48.1.1	“Dvemā, bhikkhave, parisā.	48	
PA_an_2:48.1.2	Katamā dve?	48	
PA_an_2:48.1.3	Āmisagaru parisā no saddhammagaru, saddhammagaru parisā no āmisagaru.	48	
PA_an_2:48.1.4	Katamā ca, bhikkhave, āmisagaru parisā no saddhammagaru?	48	
PA_an_2:48.1.5	Idha, bhikkhave, yassaṁ parisāyaṁ bhikkhū gihīnaṁ odātavasanānaṁ sammukhā aññamaññassa vaṇṇaṁ bhāsanti:	48	
PA_an_2:48.1.6_0	‘asuko bhikkhu ubhatobhāgavimutto, asuko paññāvimutto, asuko kāyasakkhī, asuko diṭṭhippatto,	48	
PA_an_2:48.1.6_1	asuko saddhāvimutto, asuko dhammānusārī, asuko saddhānusārī, asuko sīlavā kalyāṇadhammo,	48	
PA_an_2:48.1.6_2	asuko dussīlo pāpadhammo’ti.	48	
PA_an_2:48.1.7	Te tena lābhaṁ labhanti.	48	
PA_an_2:48.1.8	Te taṁ lābhaṁ labhitvā gathitā mucchitā ajjhopannā anādīnavadassāvino anissaraṇapaññā paribhuñjanti.	48	
PA_an_2:48.1.9	Ayaṁ vuccati, bhikkhave, āmisagaru parisā no saddhammagaru.	48	
PA_an_2:48.2.1	Katamā ca, bhikkhave, saddhammagaru parisā noāmisagaru?	48	
PA_an_2:48.2.2	Idha, bhikkhave, yassaṁ parisāyaṁ bhikkhū gihīnaṁ odātavasanānaṁ sammukhā aññamaññassa vaṇṇaṁ na bhāsanti:	48	
PA_an_2:48.2.3_0	‘asuko bhikkhu ubhatobhāgavimutto, asuko paññāvimutto, asuko kāyasakkhī, asuko diṭṭhippatto,	48	
PA_an_2:48.2.3_1	asuko saddhāvimutto, asuko dhammānusārī, asuko saddhānusārī, asuko sīlavā kalyāṇadhammo,	48	
PA_an_2:48.2.3_2	asuko dussīlo pāpadhammo’ti.	48	
PA_an_2:48.2.4	Te tena lābhaṁ labhanti.	48	
PA_an_2:48.2.5	Te taṁ lābhaṁ labhitvā agathitā amucchitā anajjhosannā ādīnavadassāvino nissaraṇapaññā paribhuñjanti.	48	
PA_an_2:48.2.6	Ayaṁ vuccati, bhikkhave, saddhammagaru parisā noāmisagaru.	48	
PA_an_2:48.2.7	Imā kho, bhikkhave, dve parisā.	48	
PA_an_2:48.2.8	Etadaggaṁ, bhikkhave, imāsaṁ dvinnaṁ parisānaṁ yadidaṁ saddhammagaru parisā noāmisagarū”ti.	48	
PA_an_2:49.1.1	“Dvemā, bhikkhave, parisā.	49	
PA_an_2:49.1.2	Katamā dve?	49	
PA_an_2:49.1.3	Visamā ca parisā samā ca parisā.	49	
PA_an_2:49.1.4	Katamā ca, bhikkhave, visamā parisā?	49	
PA_an_2:49.1.5_0	Idha, bhikkhave, yassaṁ parisāyaṁ adhammakammāni pavattanti dhammakammāni nappavattanti,	49	
PA_an_2:49.1.5_1	avinayakammāni pavattanti vinayakammāni nappavattanti, adhammakammāni dippanti dhammakammāni	49	
PA_an_2:49.1.5_2	na dippanti, avinayakammāni dippanti vinayakammāni na dippanti.	49	
PA_an_2:49.1.6	Ayaṁ vuccati, bhikkhave, visamā parisā. (…)	49	
PA_an_2:49.2.1	Katamā ca, bhikkhave, samā parisā?	49	
PA_an_2:49.2.2_0	Idha, bhikkhave, yassaṁ parisāyaṁ dhammakammāni pavattanti adhammakammāni nappavattanti,	49	
PA_an_2:49.2.2_1	vinayakammāni pavattanti avinayakammāni nappavattanti, dhammakammāni dippanti adhammakammāni	49	
PA_an_2:49.2.2_2	na dippanti, vinayakammāni dippanti avinayakammāni na dippanti.	49	
PA_an_2:49.2.3	Ayaṁ vuccati, bhikkhave, samā parisā. (…)	49	
PA_an_2:49.2.4	Imā kho, bhikkhave, dve parisā.	49	
PA_an_2:49.2.5	Etadaggaṁ, bhikkhave, imāsaṁ dvinnaṁ parisānaṁ yadidaṁ samā parisā”ti.	49	
PA_an_2:50.1.1	“Dvemā, bhikkhave, parisā.	50	
PA_an_2:50.1.2	Katamā dve?	50	
PA_an_2:50.1.3	Adhammikā ca parisā dhammikā ca parisā …pe… imā kho, bhikkhave, dve parisā.	50	
PA_an_2:50.1.4	Etadaggaṁ, bhikkhave, imāsaṁ dvinnaṁ parisānaṁ yadidaṁ dhammikā parisā”ti.	50	
PA_an_2:51.1.1	“Dvemā, bhikkhave, parisā.	51	
PA_an_2:51.1.2	Katamā dve?	51	
PA_an_2:51.1.3	Adhammavādinī ca parisā dhammavādinī ca parisā.	51	
PA_an_2:51.1.4	Katamā ca, bhikkhave, adhammavādinī parisā?	51	
PA_an_2:51.1.5	Idha, bhikkhave, yassaṁ parisāyaṁ bhikkhū adhikaraṇaṁ ādiyanti dhammikaṁ vā adhammikaṁ vā.	51	
PA_an_2:51.1.6	Te taṁ adhikaraṇaṁ ādiyitvā na ceva aññamaññaṁ saññāpenti na ca saññattiṁ upagacchanti, na ca nijjhāpenti na ca nijjhattiṁ upagacchanti.	51	
PA_an_2:51.1.7	Te asaññattibalā anijjhattibalā appaṭinissaggamantino tameva adhikaraṇaṁ thāmasā parāmāsā abhinivissa voharanti:	51	
PA_an_2:51.1.8	‘idameva saccaṁ moghamaññan’ti.	51	
PA_an_2:51.1.9	Ayaṁ vuccati, bhikkhave, adhammavādinī parisā.	51	
PA_an_2:51.2.1	Katamā ca, bhikkhave, dhammavādinī parisā?	51	
PA_an_2:51.2.2	Idha, bhikkhave, yassaṁ parisāyaṁ bhikkhū adhikaraṇaṁ ādiyanti dhammikaṁ vā adhammikaṁ vā.	51	
PA_an_2:51.2.3	Te taṁ adhikaraṇaṁ ādiyitvā aññamaññaṁ saññāpenti ceva saññattiñca upagacchanti, nijjhāpenti ceva nijjhattiñca upagacchanti.	51	
PA_an_2:51.2.4	Te saññattibalā nijjhattibalā paṭinissaggamantino, na tameva adhikaraṇaṁ thāmasā parāmāsā abhinivissa voharanti:	51	
PA_an_2:51.2.5	‘idameva saccaṁ moghamaññan’ti.	51	
PA_an_2:51.2.6	Ayaṁ vuccati, bhikkhave, dhammavādinī parisā.	51	
PA_an_2:51.2.7	Imā kho, bhikkhave, dve parisā.	51	
PA_an_2:51.2.8	Etadaggaṁ, bhikkhave, imāsaṁ dvinnaṁ parisānaṁ yadidaṁ dhammavādinī parisā”ti.	51	
PA_an_2:51.2.9	Parisavaggo pañcamo.	51	
PA_an_2:51.3.0	Tassuddānaṁ	51	
PA_an_2:51.3.1	Uttānā vaggā aggavatī,	51	
PA_an_2:51.3.2	Ariyā kasaṭo ca pañcamo;	51	
PA_an_2:51.3.3	Okkācitaāmisañceva,	51	
PA_an_2:51.3.4	Visamā adhammādhammiyena cāti.	51	
PA_an_2:51.3.5	Paṭhamo paṇṇāsako samatto.	51	
PA_an_2:52.0.1	Aṅguttara Nikāya 2	52	
PA_an_2:52.0.2	6. Puggalavagga	52	
PA_an_2:52.1.1	“Dveme, bhikkhave, puggalā loke uppajjamānā uppajjanti bahujanahitāya bahujanasukhāya, bahuno janassa atthāya hitāya sukhāya devamanussānaṁ.	52	
PA_an_2:52.1.2	Katame dve?	52	
PA_an_2:52.1.3	Tathāgato ca arahaṁ sammāsambuddho, rājā ca cakkavattī.	52	
PA_an_2:52.1.4	Ime kho, bhikkhave, dve puggalā loke uppajjamānā uppajjanti bahujanahitāya bahujanasukhāya, bahuno janassa atthāya hitāya sukhāya devamanussānan”ti.	52	
PA_an_2:53.1.1	“Dveme, bhikkhave, puggalā loke uppajjamānā uppajjanti acchariyamanussā.	53	
PA_an_2:53.1.2	Katame dve?	53	
PA_an_2:53.1.3	Tathāgato ca arahaṁ sammāsambuddho, rājā ca cakkavattī.	53	
PA_an_2:53.1.4	Ime kho, bhikkhave, dve puggalā loke uppajjamānā uppajjanti acchariyamanussā”ti.	53	
PA_an_2:54.1.1	“Dvinnaṁ, bhikkhave, puggalānaṁ kālakiriyā bahuno janassa anutappā hoti.	54	
PA_an_2:54.1.2	Katamesaṁ dvinnaṁ?	54	
PA_an_2:54.1.3	Tathāgatassa ca arahato sammāsambuddhassa, rañño ca cakkavattissa.	54	
PA_an_2:54.1.4	Imesaṁ kho, bhikkhave, dvinnaṁ puggalānaṁ kālakiriyā bahuno janassa anutappā hotī”ti.	54	
PA_an_2:55.1.1	“Dveme, bhikkhave, thūpārahā.	55	
PA_an_2:55.1.2	Katame dve?	55	
PA_an_2:55.1.3	Tathāgato ca arahaṁ sammāsambuddho, rājā ca cakkavattī.	55	
PA_an_2:55.1.4	Ime kho, bhikkhave, dve thūpārahā”ti.	55	
PA_an_2:56.1.1	“Dveme, bhikkhave, buddhā.	56	
PA_an_2:56.1.2	Katame dve?	56	
PA_an_2:56.1.3	Tathāgato ca arahaṁ sammāsambuddho, paccekabuddho ca.	56	
PA_an_2:56.1.4	Ime kho, bhikkhave, dve buddhā”ti.	56	
PA_an_2:57.1.1	“Dveme, bhikkhave, asaniyā phalantiyā na santasanti.	57	
PA_an_2:57.1.2	Katame dve?	57	
PA_an_2:57.1.3	Bhikkhu ca khīṇāsavo, hatthājānīyo ca.	57	
PA_an_2:57.1.4	Ime kho, bhikkhave, dve asaniyā phalantiyā na santasantī”ti.	57	
PA_an_2:58.1.1	“Dveme, bhikkhave, asaniyā phalantiyā na santasanti.	58	
PA_an_2:58.1.2	Katame dve?	58	
PA_an_2:58.1.3	Bhikkhu ca khīṇāsavo, assājānīyo ca.	58	
PA_an_2:58.1.4	Ime kho, bhikkhave, dve asaniyā phalantiyā na santasantī”ti.	58	
PA_an_2:59.1.1	“Dveme, bhikkhave, asaniyā phalantiyā na santasanti.	59	
PA_an_2:59.1.2	Katame dve?	59	
PA_an_2:59.1.3	Bhikkhu ca khīṇāsavo, sīho ca migarājā.	59	
PA_an_2:59.1.4	Ime kho, bhikkhave, dve asaniyā phalantiyā na santasantī”ti.	59	
PA_an_2:60.1.1	“Dveme, bhikkhave, atthavase sampassamānā kiṁpurisā mānusiṁ vācaṁ na bhāsanti.	60	
PA_an_2:60.1.2	Katame dve?	60	
PA_an_2:60.1.3	Mā ca musā bhaṇimhā, mā ca paraṁ abhūtena abbhācikkhimhāti.	60	
PA_an_2:60.1.4	Ime kho, bhikkhave, dve atthavase sampassamānā kiṁpurisā mānusiṁ vācaṁ na bhāsantī”ti.	60	
PA_an_2:61.1.1	“Dvinnaṁ dhammānaṁ, bhikkhave, atitto appaṭivāno mātugāmo kālaṁ karoti.	61	
PA_an_2:61.1.2	Katamesaṁ dvinnaṁ?	61	
PA_an_2:61.1.3	Methunasamāpattiyā ca vijāyanassa ca.	61	
PA_an_2:61.1.4	Imesaṁ kho, bhikkhave, dvinnaṁ dhammānaṁ atitto appaṭivāno mātugāmo kālaṁ karotī”ti.	61	
PA_an_2:62.1.1	“Asantasannivāsañca vo, bhikkhave, desessāmi santasannivāsañca.	62	
PA_an_2:62.1.2	Taṁ suṇātha, sādhukaṁ manasi karotha, bhāsissāmī”ti.	62	
PA_an_2:62.1.3	“Evaṁ, bhante”ti kho te bhikkhū bhagavato paccassosuṁ.	62	
PA_an_2:62.1.4	Bhagavā etadavoca:	62	
PA_an_2:62.2.1	“Kathañca, bhikkhave, asantasannivāso hoti, kathañca asanto sannivasanti?	62	
PA_an_2:62.2.2	Idha, bhikkhave, therassa bhikkhuno evaṁ hoti:	62	
PA_an_2:62.2.3	‘theropi maṁ na vadeyya, majjhimopi maṁ na vadeyya, navopi maṁ na vadeyya;	62	
PA_an_2:62.2.4	therampāhaṁ na vadeyyaṁ, majjhimampāhaṁ na vadeyyaṁ, navampāhaṁ na vadeyyaṁ.	62	
PA_an_2:62.2.5	Thero cepi maṁ vadeyya ahitānukampī maṁ vadeyya no hitānukampī, noti naṁ vadeyyaṁ viheṭheyyaṁ passampissa nappaṭikareyyaṁ.	62	
PA_an_2:62.2.6	Majjhimo cepi maṁ vadeyya …pe… navo cepi maṁ vadeyya, ahitānukampī maṁ vadeyya no hitānukampī, noti naṁ vadeyyaṁ viheṭheyyaṁ passampissa nappaṭikareyyaṁ’.	62	
PA_an_2:62.2.7	Majjhimassapi bhikkhuno evaṁ hoti …pe… navassapi bhikkhuno evaṁ hoti:	62	
PA_an_2:62.2.8	‘theropi maṁ na vadeyya, majjhimopi maṁ na vadeyya, navopi maṁ na vadeyya;	62	
PA_an_2:62.2.9	therampāhaṁ na vadeyyaṁ, majjhimampāhaṁ na vadeyyaṁ, navampāhaṁ na vadeyyaṁ.	62	
PA_an_2:62.2.10	Thero cepi maṁ vadeyya ahitānukampī maṁ vadeyya no hitānukampī noti naṁ vadeyyaṁ viheṭheyyaṁ passampissa nappaṭikareyyaṁ.	62	
PA_an_2:62.2.11	Majjhimo cepi maṁ vadeyya … navo cepi maṁ vadeyya ahitānukampī maṁ vadeyya no hitānukampī, noti naṁ vadeyyaṁ viheṭheyyaṁ passampissa nappaṭikareyyaṁ’.	62	
PA_an_2:62.2.12	Evaṁ kho, bhikkhave, asantasannivāso hoti, evañca asanto sannivasanti.	62	
PA_an_2:62.3.1	Kathañca, bhikkhave, santasannivāso hoti, kathañca santo sannivasanti?	62	
PA_an_2:62.3.2	Idha, bhikkhave, therassa bhikkhuno evaṁ hoti:	62	
PA_an_2:62.3.3	‘theropi maṁ vadeyya, majjhimopi maṁ vadeyya, navopi maṁ vadeyya;	62	
PA_an_2:62.3.4	therampāhaṁ vadeyyaṁ, majjhimampāhaṁ vadeyyaṁ, navampāhaṁ vadeyyaṁ.	62	
PA_an_2:62.3.5	Thero cepi maṁ vadeyya hitānukampī maṁ vadeyya no ahitānukampī, sādhūti naṁ vadeyyaṁ na naṁ viheṭheyyaṁ passampissa paṭikareyyaṁ.	62	
PA_an_2:62.3.6	Majjhimo cepi maṁ vadeyya …pe… navo cepi maṁ vadeyya hitānukampī maṁ vadeyya no ahitānukampī, sādhūti naṁ vadeyyaṁ na naṁ viheṭheyyaṁ passampissa paṭikareyyaṁ’.	62	
PA_an_2:62.3.7	Majjhimassapi bhikkhuno evaṁ hoti …pe… navassapi bhikkhuno evaṁ hoti:	62	
PA_an_2:62.3.8	‘theropi maṁ vadeyya, majjhimopi maṁ vadeyya, navopi maṁ vadeyya;	62	
PA_an_2:62.3.9	therampāhaṁ vadeyyaṁ, majjhimampāhaṁ vadeyyaṁ, navampāhaṁ vadeyyaṁ.	62	
PA_an_2:62.3.10	Thero cepi maṁ vadeyya hitānukampī maṁ vadeyya no ahitānukampī, sādhūti naṁ vadeyyaṁ na naṁ viheṭheyyaṁ passampissa paṭikareyyaṁ.	62	
PA_an_2:62.3.11	Majjhimo cepi maṁ vadeyya …pe… navo cepi maṁ vadeyya hitānukampī maṁ vadeyya no ahitānukampī, sādhūti naṁ vadeyyaṁ na naṁ viheṭheyyaṁ passampissa paṭikareyyaṁ’.	62	
PA_an_2:62.3.12	Evaṁ kho, bhikkhave, santasannivāso hoti, evañca santo sannivasantī”ti.	62	
PA_an_2:63.1.1	“Yasmiṁ, bhikkhave, adhikaraṇe ubhato vacīsaṁsāro diṭṭhipaḷāso cetaso āghāto appaccayo anabhiraddhi ajjhattaṁ avūpasantaṁ hoti, tasmetaṁ, bhikkhave, adhikaraṇe pāṭikaṅkhaṁ:	63	
PA_an_2:63.1.2	‘dīghattāya kharattāya vāḷattāya saṁvattissati, bhikkhū ca na phāsuṁ viharissanti’.	63	
PA_an_2:63.2.1	Yasmiñca kho, bhikkhave, adhikaraṇe ubhato vacīsaṁsāro diṭṭhipaḷāso cetaso āghāto appaccayo anabhiraddhi ajjhattaṁ suvūpasantaṁ hoti, tasmetaṁ, bhikkhave, adhikaraṇe pāṭikaṅkhaṁ:	63	
PA_an_2:63.2.2	‘na dīghattāya kharattāya vāḷattāya saṁvattissati, bhikkhū ca phāsuṁ viharissantī’”ti.	63	
PA_an_2:63.2.3	Puggalavaggo paṭhamo.	63	
PA_an_2:64.0.1	Aṅguttara Nikāya 2	64	
PA_an_2:64.0.2	7. Sukhavagga	64	
PA_an_2:64.1.1	“Dvemāni, bhikkhave, sukhāni.	64	
PA_an_2:64.1.2	Katamāni dve?	64	
PA_an_2:64.1.3	Gihisukhañca pabbajitasukhañca.	64	
PA_an_2:64.1.4	Imāni kho, bhikkhave, dve sukhāni.	64	
PA_an_2:64.1.5	Etadaggaṁ, bhikkhave, imesaṁ dvinnaṁ sukhānaṁ yadidaṁ pabbajitasukhan”ti.	64	
PA_an_2:65.1.1	“Dvemāni, bhikkhave, sukhāni.	65	
PA_an_2:65.1.2	Katamāni dve?	65	
PA_an_2:65.1.3	Kāmasukhañca nekkhammasukhañca.	65	
PA_an_2:65.1.4	Imāni kho, bhikkhave, dve sukhāni.	65	
PA_an_2:65.1.5	Etadaggaṁ, bhikkhave, imesaṁ dvinnaṁ sukhānaṁ yadidaṁ nekkhammasukhan”ti.	65	
PA_an_2:66.1.1	“Dvemāni, bhikkhave, sukhāni.	66	
PA_an_2:66.1.2	Katamāni dve?	66	
PA_an_2:66.1.3	Upadhisukhañca nirupadhisukhañca.	66	
PA_an_2:66.1.4	Imāni kho, bhikkhave, dve sukhāni.	66	
PA_an_2:66.1.5	Etadaggaṁ, bhikkhave, imesaṁ dvinnaṁ sukhānaṁ yadidaṁ nirupadhisukhan”ti.	66	
PA_an_2:67.1.1	“Dvemāni, bhikkhave, sukhāni.	67	
PA_an_2:67.1.2	Katamāni dve?	67	
PA_an_2:67.1.3	Sāsavasukhañca anāsavasukhañca.	67	
PA_an_2:67.1.4	Imāni kho, bhikkhave, dve sukhāni.	67	
PA_an_2:67.1.5	Etadaggaṁ, bhikkhave, imesaṁ dvinnaṁ sukhānaṁ yadidaṁ anāsavasukhan”ti.	67	
PA_an_2:68.1.1	“Dvemāni, bhikkhave, sukhāni.	68	
PA_an_2:68.1.2	Katamāni dve?	68	
PA_an_2:68.1.3	Sāmisañca sukhaṁ nirāmisañca sukhaṁ.	68	
PA_an_2:68.1.4	Imāni kho, bhikkhave, dve sukhāni.	68	
PA_an_2:68.1.5	Etadaggaṁ, bhikkhave, imesaṁ dvinnaṁ sukhānaṁ yadidaṁ nirāmisaṁ sukhan”ti.	68	
PA_an_2:69.1.1	“Dvemāni, bhikkhave, sukhāni.	69	
PA_an_2:69.1.2	Katamāni dve?	69	
PA_an_2:69.1.3	Ariyasukhañca anariyasukhañca.	69	
PA_an_2:69.1.4	Imāni kho, bhikkhave, dve sukhāni.	69	
PA_an_2:69.1.5	Etadaggaṁ, bhikkhave, imesaṁ dvinnaṁ sukhānaṁ yadidaṁ ariyasukhan”ti.	69	
PA_an_2:70.1.1	“Dvemāni, bhikkhave, sukhāni.	70	
PA_an_2:70.1.2	Katamāni dve?	70	
PA_an_2:70.1.3	Kāyikañca sukhaṁ cetasikañca sukhaṁ.	70	
PA_an_2:70.1.4	Imāni kho, bhikkhave, dve sukhāni.	70	
PA_an_2:70.1.5	Etadaggaṁ, bhikkhave, imesaṁ dvinnaṁ sukhānaṁ yadidaṁ cetasikaṁ sukhan”ti.	70	
PA_an_2:71.1.1	“Dvemāni, bhikkhave, sukhāni.	71	
PA_an_2:71.1.2	Katamāni dve?	71	
PA_an_2:71.1.3	Sappītikañca sukhaṁ nippītikañca sukhaṁ.	71	
PA_an_2:71.1.4	Imāni kho, bhikkhave, dve sukhāni.	71	
