segmentnr	original	folio	analyzed
PA_atk-s05_19a:312_6	vuttaṃ. Anuppāde ñāṇaṃ paṭisandhivasena anuppādabhūte taṃtaṃmaggavajjhakilesānaṃ	312	
PA_atk-s05_19a:312_7	anuppādapariyosāne uppanne ariyaphale ñāṇa”nti vuttaṃ. Idha pana ubhayampi arahattaphalañāṇavaseneva	312	
PA_atk-s05_19a:312_8	vibhattaṃ. Tenevāha – “imāni dve ñāṇāni aññātāvindriya”nti, “ārammaṇasaṅketena dve	312	
PA_atk-s05_19a:312_9	nāmāni labbhantī”ti ca.	312	
PA_atk-s05_19a:313_0	Aññindriyaṃ heṭṭhimesu tīsu phalesu, uparimesu ca tīsu maggesu uppattiyā punappunaṃ	313	
PA_atk-s05_19a:313_1	uppajjamānampi anaññātaññassāmītindriyaṃ viya paṭhamaphaluppattiyā aggaphaluppattiyā	313	
PA_atk-s05_19a:313_2	anuppādanirodhena nirujjhatīti āha – “yañca anaññātaññassāmītindriya”ntiādi. Etena	313	
PA_atk-s05_19a:313_3	pahātabbadhammā viya dassanabhāvanāhi aggaphaluppattiyā tadavasesaphaladhammāpi anuppādanirodhena	313	
PA_atk-s05_19a:313_4	nirujjhanti. Ko pana vādo tebhūmakadhammānanti dasseti, ekā paññā aññātāvindriyattā.	313	
PA_atk-s05_19a:313_5	Yadi ekā, kathaṃ dvidhā vuttāti āha “api cā”tiādi. Ārammaṇasaṅketenāti khaye anuppādeti	313	
PA_atk-s05_19a:313_6	imāya ārammaṇasamaññāya. Sā pajānanaṭṭhena paññāti yā pubbe sotānaṃ pidhānakiccā	313	
PA_atk-s05_19a:313_7	vuttā paññā, sā pajānanasabhāvena paññā. Itarā pana yathādiṭṭhaṃ yathāgahitaṃ ārammaṇaṃ	313	
PA_atk-s05_19a:313_8	apilāpanaṭṭhena ogāhanaṭṭhena satīti.	313	
PA_atk-s05_19a:314_0	13. Evaṃ “paññā ceva sati cā”ti padassa atthaṃ vivaritvā idāni “nāmarūpa”nti padassa	314	
PA_atk-s05_19a:314_1	atthaṃ vivaranto “tattha ye pañcupādānakkhandhā, idaṃ nāmarūpa”nti āha. Nāmarūpañca	314	
PA_atk-s05_19a:314_2	vibhāgena dassento sukhaggahaṇatthaṃ pākaṭanāmarūpameva vibhāvetuṃ “tattha ye”tiādimāha.	314	
PA_atk-s05_19a:314_3	Taggahaṇeneva hi sahacaraṇādinā tadaññe cittacetasikā rūpadhammā ca gahitā hontīti.	314	
PA_atk-s05_19a:314_4	Nāmaggahaṇena cettha khandhattayameva gahitanti “nāmarūpaṃ viññāṇasampayutta”nti	314	
PA_atk-s05_19a:314_5	vuttaṃ. Taṃ pana rūpaṃ sampayuttanti? Nayidaṃ sampayuttapaccayavasena vuttaṃ. Pacurajanassa	314	
PA_atk-s05_19a:314_6	pana avibhāgena gahaṇīyasabhāvaṃ sandhāya vuttanti daṭṭhabbaṃ.	314	
PA_atk-s05_19a:315_0	Gāthāya anupādisesā nibbānadhātu pucchitāti taṃ caturiddhipādamukhena ariyamaggādhigamena	315	
PA_atk-s05_19a:315_1	pattabbanti dassento iddhipādabhāvanāmūlabhūtāni indriyāni satipaññāhi niddhāretuṃ	315	
PA_atk-s05_19a:315_2	“tattha sati ca paññā ca cattāri indriyānī”ti āha. Kusalākusalānaṃ dhammānaṃ gatiyo	315	
PA_atk-s05_19a:315_3	samanvesamānā sati sijjhantī ekantena samādhiṃ nipphādeti. Satiggahaṇena cettha pariyuṭṭhānappahānaṃ	315	
PA_atk-s05_19a:315_4	idhādhippetanti āha – “sati dve indriyāni, satindriyañca samādhindriyañcā”ti. Tathā	315	
PA_atk-s05_19a:315_5	anusayasamugghātavidhāyinī paññā sijjhamānā na vinā catubbidhasammappadhānavīriyaṃ	315	
PA_atk-s05_19a:315_6	sijjhatīti vuttaṃ – “paññā dve indriyāni paññindriyañca vīriyindriyañcā”ti.	315	
PA_atk-s05_19a:316_0	Yā imesu catūsu indriyesūti imesu satiādīsu catūsu indriyesu nissayapaccayatāya adhiṭṭhānabhūtesu	316	
PA_atk-s05_19a:316_1	taṃsahajātā eva yā saddahanā. “Imehi catūhi indriyehī”tipi pāḷi, tassā imehi catūhi	316	
PA_atk-s05_19a:316_2	indriyehi sampayuttāti vacanaseso, ārammaṇe abhippasādalakkhaṇā saddhā kattukāmatāsabhāvassa	316	
PA_atk-s05_19a:316_3	chandassa visesapaccayo hotīti āha – “yā saddhādhipateyyā cittekaggatā, ayaṃ chandasamādhī”ti.	316	
PA_atk-s05_19a:316_4	Samāhite citteti vipassanāsamādhinā samāhite citte. Idaṃ pahānanti vikkhambhanappahānasādhako	316	
PA_atk-s05_19a:316_5	samādhi pahānanti vutto pajahati etenāti katvā. “Padhāna”ntipi pāṭho, aggoti attho.	316	
PA_atk-s05_19a:316_6	Tathā hi “samādhi ekodī”ti vuccati.	316	
PA_atk-s05_19a:317_0	“Assāsapassāsā”tiādinā kāyavacīcittasaṅkhārasīsena taṃsamuṭṭhāpakā vīriyasaṅkhārāva	317	
PA_atk-s05_19a:317_1	gahitā. Te hi yāva bhāvanānipphatti tāva ekarasena saraṇato saṅkappetabbato ca sarasaṅkappā”ti	317	
PA_atk-s05_19a:317_2	vuttā “evaṃ me bhāvanā hotū”ti yathā icchitā, tathā pavattiyā hetubhāvato. Tadubhayanti	317	
PA_atk-s05_19a:317_3	chandasamādhisaṅkhātañca padhānasaṅkhārasaṅkhātañca vīriyanti taṃ ubhayaṃ. Ubhayameva	317	
PA_atk-s05_19a:317_4	hi upacāravasena aññaṃ viya katvā “chandasamādhippadhānasaṅkhārasamannāgataṃ iddhipāda”nti	317	
PA_atk-s05_19a:317_5	vuttaṃ. Abhinnampi hi upacāravasena bhinnaṃ viya katvā voharanti, yathā “silāputtakassa sarīra”nti.	317	
PA_atk-s05_19a:318_0	Tattha ijjhatīti iddhi, samijjhati nipphajjatīti attho. Ijjhanti vā tāya sattā iddhā	318	
PA_atk-s05_19a:318_1	vuddhā ukkaṃsagatā hontīti iddhi, pajjati etenāti pādo, paṭhamena atthena iddhi eva	318	
PA_atk-s05_19a:318_2	pādo iddhipādo, iddhikoṭṭhāsoti attho. Dutiyena atthena iddhiyā pādo patiṭṭhā adhigamūpāyoti	318	
PA_atk-s05_19a:318_3	iddhipādo. Tena hi uparūparivisesasaṅkhātaṃ iddhiṃ pajjanti pāpuṇanti. Vivekanissitanti	318	
PA_atk-s05_19a:318_4	tadaṅgavivekanissitaṃ samucchedavivekanissitaṃ nissaraṇavivekanissitañca iddhipādaṃ	318	
PA_atk-s05_19a:318_5	bhāvetīti attho. Tathā hi ayaṃ iddhipādabhāvanānuyutto yogī vipassanākkhaṇe kiccato	318	
PA_atk-s05_19a:318_6	tadaṅgavivekanissitaṃ ajjhāsayato nissaraṇavivekanissitaṃ. Maggakkhaṇe pana kiccato	318	
PA_atk-s05_19a:318_7	samucchedavivekanissitaṃ ārammaṇato nissaraṇavivekanissitaṃ iddhipādaṃ bhāvetīti.	318	
PA_atk-s05_19a:318_8	Esa nayo virāganissitantiādīsu.	318	
PA_atk-s05_19a:319_0	Vivekattā eva hi virāgādayo, kevalañcettha vossaggo duvidho pariccāgavossaggo ca	319	
PA_atk-s05_19a:319_1	pakkhandanavossaggo cāti. Tattha pariccāgavossaggo vipassanākkhaṇe tadaṅgavasena,	319	
PA_atk-s05_19a:319_2	maggakkhaṇe samucchedavasena kilesappahānaṃ. Pakkhandanavossaggo vipassanākkhaṇe	319	
PA_atk-s05_19a:319_3	tanninnabhāvena, maggakkhaṇe ārammaṇakaraṇavasena nibbānapakkhandanaṃ. Tadubhayampi	319	
PA_atk-s05_19a:319_4	imasmiṃ lokiyalokuttaramissake atthasaṃvaṇṇanānaye yujjati. Tathā hi ayaṃ paṭhamiddhipādo	319	
PA_atk-s05_19a:319_5	yathāvuttena pakārena kilese pariccajati nibbānañca pakkhandati. Vossaggapariṇāminti	319	
PA_atk-s05_19a:319_6	iminā pana vacanena vossaggatthaṃ pariṇamantaṃ pariṇatañca paripaccantaṃ paripakkañcāti	319	
PA_atk-s05_19a:319_7	attho. Ayañhi iddhipādabhāvanānuyutto yogī yathā paṭhamo iddhipādo kilesapariccāgavossaggatthaṃ	319	
PA_atk-s05_19a:319_8	nibbānapakkhandanavossaggatthañca paripaccati, yathā ca paripakko hoti, tathā naṃ	319	
PA_atk-s05_19a:319_9	bhāvetīti. Sesiddhipādesupi eseva nayo. Ayaṃ pana viseso – yathā chandaṃ jeṭṭhakaṃ	319	
PA_atk-s05_19a:319_10	katvā pavattito samādhi chandasamādhi. Evaṃ vīriyaṃ cittaṃ vīmaṃsaṃ jeṭṭhakaṃ katvā	3191	
PA_atk-s05_19a:319_11	pavattito samādhi vīmaṃsāsamādhīti.	3191	
PA_atk-s05_19a:320_0	14. Na kevalaṃ catutthaiddhipādo eva samādhiñāṇamūlako, atha kho sabbopīti dassetuṃ	320	
PA_atk-s05_19a:320_1	“sabbo samādhi ñāṇamūlako ñāṇapubbaṅgamo ñāṇānuparivattī”ti vuttaṃ. Yadi evaṃ kasmā	320	
PA_atk-s05_19a:320_2	so eva vīmaṃsāsamādhīti vuttoti? Vīmaṃsaṃ jeṭṭhakaṃ katvā pavattitattāti vuttovāyamattho.	320	
PA_atk-s05_19a:320_3	Tattha pubbabhāgapaññāya ñāṇamūlako. Adhigamapaññāya ñāṇapubbaṅgamo. Paccavekkhaṇapaññāya	320	
PA_atk-s05_19a:320_4	ñāṇānuparivatti. Atha vā pubbabhāgapaññāya ñāṇamūlako. Upacārapaññāya ñāṇapubbaṅgamo.	320	
PA_atk-s05_19a:320_5	Appanāpaññāya ñāṇānuparivatti. Upacārapaññāya vā ñāṇamūlako. Appanāpaññāya ñāṇapubbaṅgamo.	320	
PA_atk-s05_19a:320_6	Abhiññāpaññāya ñāṇānuparivattīti veditabbaṃ.	320	
PA_atk-s05_19a:321_0	Yathā pureti yathā samādhissa pubbenivāsānussatiñāṇānuparivattibhāvena pure pubbe	321	
PA_atk-s05_19a:321_1	atītāsu jātīsu asaṅkhyeyyesupi saṃvaṭṭavivaṭṭesu attano paresañca khandhaṃ khandhūpanibaddhañca	321	
PA_atk-s05_19a:321_2	duppaṭivijjhaṃ nāma natthi, tathā pacchā samādhissa anāgataṃsañāṇānuparivattibhāvena	321	
PA_atk-s05_19a:321_3	anāgatāsu jātīsu asaṅkhyeyyesupi saṃvaṭṭavivaṭṭesu attano paresañca khandhaṃ khandhūpanibaddhañca	321	
PA_atk-s05_19a:321_4	duppaṭivijjhaṃ nāma natthīti attho.	321	
PA_atk-s05_19a:322_0	Yathā pacchāti yathā samādhissa cetopariyañāṇānuparivattibhāvena anāgatesu sattasu	322	
PA_atk-s05_19a:322_1	divasesu parasattānaṃ cittaṃ duppaṭivijjhaṃ nāma natthi, tathā pure atītesu sattasu	322	
PA_atk-s05_19a:322_2	divasesu parasattānaṃ cittaṃ duppaṭivijjhaṃ nāma natthīti attho. Yathā divāti yathā	322	
PA_atk-s05_19a:322_3	divasabhāge sūriyālokena andhakārassa vidhamitattā cakkhumantānaṃ sattānaṃ āpāthagataṃ	322	
PA_atk-s05_19a:322_4	cakkhuviññeyyaṃ rūpaṃ suviññeyyaṃ. Tathā rattinti tathā rattibhāge caturaṅgasamannāgatepi	322	
PA_atk-s05_19a:322_5	andhakāre vattamāne samādhissa dibbacakkhuñāṇānuparivattitāya duppaṭivijjhaṃ rūpāyatanaṃ natthi.	322	
PA_atk-s05_19a:323_0	Yathā rattiṃ tathā divāti yathā ca rattiyaṃ tathā divāpi atisukhumaṃ kenaci tirohitaṃ	323	
PA_atk-s05_19a:323_1	yañca atidūre, taṃ sabbarūpaṃ duppaṭivijjhaṃ nāma natthi. Yathā ca rūpāyatane vuttaṃ,	323	
PA_atk-s05_19a:323_2	tathā samādhissa dibbasotañāṇānuparivattitāya saddāyatane ca netabbaṃ. Tenevāha “iti	323	
PA_atk-s05_19a:323_3	vivaṭena cetasā”tiādi. Tattha apariyonaddhenāti abhiññāñāṇassa pāribandhakakilesehi	323	
PA_atk-s05_19a:323_4	anajjhotthaṭena, apariyonaddhattā eva sappabhāsaṃ cittaṃ. Eteneva samādhissa iddhividhañāṇānuparivattitāpi	323	
PA_atk-s05_19a:323_5	vuttā evāti daṭṭhabbaṃ. Pañcindriyānīti iddhipādasampayuttāni sekkhassa pañcindriyāni	323	
PA_atk-s05_19a:323_6	adhippetānīti āha “kusalānī”ti. Cittasahabhūnītiādi tesaṃ viññāṇanirodhena nirodhadassanatthaṃ	323	
PA_atk-s05_19a:323_7	āraddhaṃ. Tathā “nāmarūpañcā”tiādi. Tenetaṃ dasseti “na kevalaṃ pañcindriyāni eva,	323	
PA_atk-s05_19a:323_8	atha kho nāmarūpañca viññāṇahetukaṃ viññāṇassa nirodhā nirujjhatī”ti.	323	
PA_atk-s05_19a:324_0	Tassāti viññāṇassa. Hetūti taṇhāavijjādiko. Anāhāranti padassa atthavivaraṇaṃ. Anabhinanditanti	324	
PA_atk-s05_19a:324_1	abhinandanabhūtāya taṇhāya pahīnattā eva apatthitaṃ. Tato eva appaṭisandhikaṃ viññāṇaṃ	324	
PA_atk-s05_19a:324_2	taṃ nirujjhati. Yathā ca viññāṇaṃ, evaṃ nāmarūpampi viññāṇasaṅkhātassa hetuno paccayassa	324	
PA_atk-s05_19a:324_3	ca abhāvā tappaccayānaṃ saṅkhārādīnaṃ abhāvā ahetu appaccayaṃ. Sesaṃ pākaṭameva.	324	
PA_atk-s05_19a:324_4	Pucchāvissajjanavicayopi vuttanayānusārena veditabbo.	324	
PA_atk-s05_19a:325_0	Evaṃ anusandhipucchampi dassetvā heṭṭhā sattādhiṭṭhānā dhammādhiṭṭhānā ca pucchā	325	
PA_atk-s05_19a:325_1	visuṃ visuṃ dassitāti idāni tā saha dassetuṃ “ye ca saṅkhātadhammāse”tiādi āraddhaṃ.	325	
PA_atk-s05_19a:325_2	Tatthāyaṃ padattho – saṅkhātadhammāti aniccādivasena parivīmaṃsitadhammā, arahataṃ	325	
PA_atk-s05_19a:325_3	etaṃ adhivacanaṃ. Sekkhāti sīlādīni sikkhamānā avasesā ariyapuggalā. Puthūti bahū	325	
PA_atk-s05_19a:325_4	sattajanā. Tesaṃ me nipako iriyaṃ, puṭṭho pabrūhīti tesaṃ sekhāsekhānaṃ nipako paṇḍito	325	
PA_atk-s05_19a:325_5	tvaṃ bhagavā paṭipattiṃ puṭṭho me brūhīti. Sesaṃ pāḷivaseneva viññāyati.	325	
PA_atk-s05_19a:326	15. Kissāti kissa hetu, kena kāraṇenāti attho. Sekhāsekhavipassanā pubbaṅgamappahānayogenāti sekhe asekhe vipassanāpubbaṅgamappahāne ca pucchanayogena, pucchāvidhināti attho.	32	
PA_atk-s05_19a:327_0	Vissajjanagāthāyaṃ kāmesu nābhigijjheyyāti vatthukāmesu kilesakāmena na abhigijjheyya.	327	
PA_atk-s05_19a:327_1	Manasānāvilo siyāti byāpādavitakkādayo kāyaduccaritādayo ca manaso āvilabhāvakare	327	
PA_atk-s05_19a:327_2	dhamme pajahanto cittena anāvilo bhaveyya. Yasmā pana asekkho aniccatādivasena sabbadhammānaṃ	327	
PA_atk-s05_19a:327_3	paritulitattā kusalo sabbadhammesu kāyānupassanāsatiādīhi ca sato sabbakilesānaṃ	327	
PA_atk-s05_19a:327_4	bhinnattā uttamabhikkhubhāvaṃ patto ca hutvā sabbairiyāpathesu pavattati, tasmā “kusalo…pe…	327	
PA_atk-s05_19a:327_5	paribbaje”ti āhāti ayaṃ saṅkhepattho.	327	
PA_atk-s05_19a:328_0	Tattha yaṃ pucchāgāthāyaṃ “nipako”ti padaṃ vuttaṃ, taṃ bhagavantaṃ sandhāya vuttaṃ,	328	
PA_atk-s05_19a:328_1	bhagavato ca nepakkaṃ ukkaṃsapāramippattaṃ anāvaraṇañāṇadassanena dīpetabbanti anāvaraṇañāṇaṃ	328	
PA_atk-s05_19a:328_2	tāva kammadvārabhedehi vibhajitvā sekhāsekhapaṭipadaṃ dassetuṃ “bhagavato sabbaṃ	328	
PA_atk-s05_19a:328_3	kāyakamma”ntiādi vuttaṃ. Tena sabbattha appaṭihatañāṇadassanena tathāgatassa sekhāsekhapaṭipattidesanākosallameva	328	
PA_atk-s05_19a:328_4	vibhāveti. Tattha ko cāti kva ca, kasmiṃ visayeti attho. Taṃ visayaṃ dasseti “yaṃ	328	
PA_atk-s05_19a:328_5	anicce dukkhe anattani cā”ti. Idaṃ vuttaṃ hoti – ñāṇadassanaṃ nāma uppajjamānaṃ “sabbaṃ	328	
PA_atk-s05_19a:328_6	saṅkhataṃ aniccaṃ dukkhaṃ sabbe dhammā anattā”ti uppajjati, tassa pana tasmiṃ visaye	328	
PA_atk-s05_19a:328_7	yena appavatti, so paṭighātoti, etena lakkhaṇattayappaṭivedhassa durabhisambhavataṃ	328	
PA_atk-s05_19a:328_8	anaññasādhāraṇatañca dasseti. Lakkhaṇattayavibhāvanena hi bhagavato catusaccappaṭivedhaṃ	328	
PA_atk-s05_19a:328_9	sammāsambodhiñca paṇḍitā paṭijānanti.	328	
PA_atk-s05_19a:329_0	Aññāṇaṃ adassananti taṃ paṭighātaṃ sarūpato dasseti. Chaḷārammaṇasabhāvappaṭicchādako	329	
PA_atk-s05_19a:329_1	hi sammoho ñāṇadassanassa paṭighātoti. Yasmiṃ visaye ñāṇadassanaṃ uppattirahaṃ, tattheva	329	
PA_atk-s05_19a:329_2	tassa paṭighātena bhavitabbanti āha – “yaṃ anicce dukkhe anattani cā”ti. Yathā idha	329	
PA_atk-s05_19a:329_3	purisotiādi upamādassanaṃ. Tatridaṃ opammasaṃsandanaṃ – puriso viya sabbo loko, tārakarūpāni	329	
PA_atk-s05_19a:329_4	viya cha ārammaṇāni, tassa purisassa tārakarūpānaṃ dassanaṃ viya lokassa cakkhuviññāṇādīhi	329	
PA_atk-s05_19a:329_5	yathārahaṃ chaḷārammaṇajānanaṃ, tassa purisassa tārakarūpāni passantassāpi “ettakāni	329	
PA_atk-s05_19a:329_6	satāni, ettakāni sahassānī”tiādinā gaṇanasaṅketena ajānanaṃ viya lokassa rūpādiārammaṇaṃ	329	
PA_atk-s05_19a:329_7	kathañci jānantassāpi aniccādilakkhaṇattayānavabodhoti. Sesaṃ pākaṭameva.	329	
PA_atk-s05_19a:330_0	Idāni yehi padehi bhagavatā āyasmato ajitassa sekhāsekhapaṭipadā vuttā, tesaṃ padānaṃ	330	
PA_atk-s05_19a:330_1	atthaṃ vibhajituṃ “tattha sekhenā”tiādimāha. Tattha tatthāti nipātamattaṃ, tasmiṃ	330	
PA_atk-s05_19a:330_2	vā vissajjane. Sekhenāti sikkhā etassa sīlanti sekho, tena sekhena. Dvīsu dhammesūti	330	
PA_atk-s05_19a:330_3	duvidhesu dhammesūti adhippāyo. Pariyuṭṭhānīyesūti dosena pariyuṭṭhitena yattha parivattitabbaṃ,	330	
PA_atk-s05_19a:330_4	tesu āghātavatthūsūti attho. “Paṭighaṭṭhānīyesū”tipi pāṭho, soyevattho.	330	
PA_atk-s05_19a:331_0	Ettha ca gedhapaṭisedhacodanāyaṃ gedhanimitto doso gedhe sati hotīti tatopi cittassa	331	
PA_atk-s05_19a:331_1	rakkhitabbatā niddhāretvā vuttā. Yasmā pana bhagavatā “kāmesu nābhigijjheyyā”ti vuttaṃ,	331	
PA_atk-s05_19a:331_2	tasmā “tattha yā icchā”tiādinā gedhavasena niddeso kato. Atha vā dosato cittassa	331	
PA_atk-s05_19a:331_3	rakkhitabbatā gāthāya dutiyapādena vuttāyevāti daṭṭhabbā. Dutiyapādena hi sesakilesavodānadhammā	331	
PA_atk-s05_19a:331_4	dassitā. Tathā hi uppannānuppannabhedato sammāvāyāmassa visayabhāvena sabbe saṃkilesavodānadhamme	331	
PA_atk-s05_19a:331_5	catudhā vibhajitvā sammappadhānamukhena sekhapaṭipadaṃ matthakaṃ pāpetvā dassetuṃ	331	
PA_atk-s05_19a:331_6	“sekho abhigijjhanto”tiādi vuttaṃ. Tattha anāvilasaṅkappoti āvilānaṃ kāmasaṅkappādīnaṃ	331	
PA_atk-s05_19a:331_7	abhāvena anāvilasaṅkappo. Tato eva ca anabhigijjhanto vāyamati, vīriyaṃ pavatteti.	331	
PA_atk-s05_19a:331_8	Kathaṃ vāyamatīti āha – “so anuppannāna”ntiādi.	331	
PA_atk-s05_19a:332_0	Tattha soti uttarivisesatthāya paṭipajjamāno sekkho. Anuppannānanti anibbattānaṃ.	332	
PA_atk-s05_19a:332_1	Pāpakānanti lāmakānaṃ. Akusalānaṃ dhammānanti akosallasambhūtānaṃ dhammānaṃ. Anuppādāyāti	332	
PA_atk-s05_19a:332_2	na uppādanatthāya. Chandaṃ janetīti kattukamyatāsaṅkhātaṃ kusalacchandaṃ uppādeti.	332	
PA_atk-s05_19a:332_3	Vāyamatīti payogaparakkamaṃ karoti. Vīriyaṃ ārabhatīti kāyikacetasikavīriyaṃ karoti.	332	
PA_atk-s05_19a:332_4	Cittaṃ paggaṇhātīti teneva sahajātavīriyena cittaṃ ukkhipati. Padahatīti padhānavīriyaṃ	332	
PA_atk-s05_19a:332_5	karoti. Vāyamatītiādīni pana cattāri padāni āsevanābhāvanābahulīkammasātaccakiriyāhi	332	
PA_atk-s05_19a:332_6	yojetabbāni. Uppannānaṃ pāpakānanti anuppannāti avattabbataṃ āpannānaṃ pāpadhammānaṃ.	332	
PA_atk-s05_19a:332_7	Pahānāyāti pajahanatthāya. Anuppannānaṃ kusalānanti anibbattānaṃ kosallasambhūtānaṃ	332	
PA_atk-s05_19a:332_8	dhammānaṃ. Uppādāyāti uppādanatthāya. Uppannānanti nibbattānaṃ. Ṭhitiyāti ṭhitatthaṃ.	332	
PA_atk-s05_19a:332_9	Asammosāyāti anassanatthaṃ. Bhiyyobhāvāyāti punappunaṃ bhāvāya. Vepullāyāti vipulabhāvāya.	332	
PA_atk-s05_19a:332_10	Bhāvanāyāti vaḍḍhiyā. Pāripūriyāti paripūraṇatthāyāti ayaṃ tāva padattho.	3321	
PA_atk-s05_19a:333_0	16. “Katame anuppannā”tiādi akusaladhammā kusaladhammā ca yādisā anuppannā yādisā	333	
PA_atk-s05_19a:333_1	ca uppannā, te dassetuṃ āraddhaṃ. Tattha ime anuppannāti ime kāmavitakkādayo asamudācāravasena	333	
PA_atk-s05_19a:333_2	vā ananubhūtārammaṇavasena vā anuppannā nāma. Aññathā hi anamatagge saṃsāre anuppannā	333	
PA_atk-s05_19a:333_3	nāma akusalā dhammā natthi. Vitakkattayaggahaṇañcettha nidassanamattaṃ daṭṭhabbaṃ.	333	
PA_atk-s05_19a:333_4	Akusalamūlānīti anusayā eva sabbesaṃ akusalānaṃ mūlabhāvato evaṃ vuttā, na lobhādayo	333	
PA_atk-s05_19a:333_5	eva. Ime uppannā anusayā bhūmiladdhuppannā asamugghāṭituppannātiādiuppannapariyāyasabbhāvato	333	
PA_atk-s05_19a:333_6	nāmavasena uppannā nāma, na vattamānabhāvenāti attho. Ime anuppannā kusalā dhammāti	333	
PA_atk-s05_19a:333_7	ime sotāpannassa saddhādayo sotāpattiphalasacchikiriyāya paṭipannassa anuppannā kusalā	333	
PA_atk-s05_19a:333_8	dhammā nāma, ko pana vādo puthujjanānanti dasseti. Kusalasaddo cettha bāhitikasutte	333	
PA_atk-s05_19a:333_9	viya anavajjapariyāyo daṭṭhabbo. Ime uppannā kusalā dhammāti ime paṭhamamagge saddhādayo	333	
PA_atk-s05_19a:333_10	sotāpattiphalasacchikiriyāya paṭipannassa uppannā kusalā dhammā nāma.	3331	
PA_atk-s05_19a:334_0	Satipaṭṭhānabhāvanāya suniggahito kāmavitakkoti āha – “yena kāmavitakkaṃ vāreti,	334	
PA_atk-s05_19a:334_1	idaṃ satindriya”nti. Anavajjasukhapadaṭṭhānena avikkhepena cetodukkhasannissayo vikkhepapaccayo	334	
PA_atk-s05_19a:334_2	byāpādavitakko suniggahitoti vuttaṃ – “yena byāpādavitakkaṃ vāreti, idaṃ samādhindriya”nti.	334	
PA_atk-s05_19a:334_3	Kusalesu dhammesu āraddhavīriyo parāparādhaṃ sukhena sahatīti vīriyena vihiṃsāvitakko	334	
PA_atk-s05_19a:334_4	suniggahitoti āha – “yena vihiṃsāvitakkaṃ vāreti, idaṃ vīriyindriya”nti. Samādhiādīnampi	334	
PA_atk-s05_19a:334_5	yathāsakaṃpaṭipakkhappahānaṃ paññavantasseva ijjhatīti imamatthaṃ dassento āha –	334	
PA_atk-s05_19a:334_6	“yena uppannuppanne”tiādi.	334	
PA_atk-s05_19a:335_0	Etesaṃ yathāniddhāritānaṃ pañcannaṃ indriyānaṃ savisaye jeṭṭhakabhāvaṃ dassetuṃ “saddhindriyaṃ	335	
PA_atk-s05_19a:335_1	kattha daṭṭhabba”ntiādi vuttaṃ. Taṃ suviññeyyameva. Imesañca saddhādīnaṃ sekhānaṃ	335	
PA_atk-s05_19a:335_2	indriyānaṃ nibbattiyā sabbepi sekhā dhammā matthakappattā hontīti dassento “evaṃ	335	
PA_atk-s05_19a:335_3	sekho”tiādinā sekhapaṭipadaṃ nigameti.	335	
PA_atk-s05_19a:336_0	17. Evaṃ sekhapaṭipadaṃ vibhajitvā idāni asekhapaṭipadaṃ vibhajituṃ “kusalo sabbadhammāna”ntiādimāha.	336	
PA_atk-s05_19a:336_1	Tattha sabbadhammānanti iminā padena vuttadhamme tāva vibhajitvā tattha asekkhassa	336	
PA_atk-s05_19a:336_2	kosallaṃ dassetuṃ “loko nāmā”tiādi vuttaṃ. Taṃ vuttatthameva. Kilesalokena bhavaloko	336	
PA_atk-s05_19a:336_3	samudāgacchatīti kāmāvacaradhammaṃ nissāya rūpārūpāvacaradhamme samudāgametīti attho.	336	
PA_atk-s05_19a:336_4	Soti so mahaggatadhammesu, parittamahaggatadhammesu vā ṭhito. Indriyāni nibbattetīti	336	
PA_atk-s05_19a:336_5	sīlasamādhayo nibbedhabhāgiye katvā vimuttiparipācanīyāni saddhādīni indriyāni uppādeti.	336	
PA_atk-s05_19a:336_6	Indriyesu bhāviyamānesūti yathāvuttaindriyesu vaḍḍhiyamānesu rūpārūpapariggahādivasena	336	
PA_atk-s05_19a:336_7	neyyassa pariññā bhavati.	336	
PA_atk-s05_19a:337_0	Dassanapariññāti ñātapariññā. Bhāvanāpariññāti tīraṇapariññā pahānapariññā ca. “Sā	337	
PA_atk-s05_19a:337_1	duvidhenā”tiādinā saṅkhepato vuttamatthaṃ “yadā hi sekho”tiādinā vivarati. Tattha	337	
PA_atk-s05_19a:337_2	“nibbidāsahagatehi saññāmanasikārehī”ti iminā balavavipassanaṃ dasseti. Yadā hi sekhoti	337	
PA_atk-s05_19a:337_3	cettha sikkhanasīlatāya kalyāṇaputhujjanopi sekhapadena saṅgahitoti katvā “dve dhammā	337	
PA_atk-s05_19a:337_4	kosallaṃ gacchanti dassanakosallañcā”tiādi vuttaṃ. Ayamettha adhippāyo – yadā kalyāṇaputhujjano	337	
PA_atk-s05_19a:337_5	pubbabhāgasikkhaṃ sikkhanto nibbidāsahagatehi saññāmanasikārehi ñeyyaṃ parijānāti,	337	
PA_atk-s05_19a:337_6	tadā tassa te vipassanādhammā dassanakosallaṃ paṭhamamaggañāṇaṃ gacchanti sampāpuṇanti	337	
PA_atk-s05_19a:337_7	tena saddhiṃ ghaṭenti. Yadā pana sotāpannādisekho vuttanayena neyyaṃ parijānāti,	337	
PA_atk-s05_19a:337_8	tadā tassa te vipassanādhammā bhāvanākosallaṃ gacchantīti.	337	
PA_atk-s05_19a:338_0	Taṃ ñāṇanti yā pubbe neyyassa pariññā vuttā, taṃ neyyaparijānanañāṇaṃ. Pañcavidhena	338	
PA_atk-s05_19a:338_1	veditabbanti visayabhedena tassa bhedaṃ dasseti. Dhammānaṃ salakkhaṇe ñāṇanti rūpārūpadhammānaṃ	338	
PA_atk-s05_19a:338_2	kakkhaḷaphusanādisalakkhaṇe ñāṇaṃ. Taṃ pana yasmā sabbaṃ neyyaṃ hetuhetuphalabhedato	338	
PA_atk-s05_19a:338_3	duvidhameva hoti, tasmā “dhammapaṭisambhidā ca atthapaṭisambhidā cā”ti niddiṭṭhaṃ.	338	
PA_atk-s05_19a:339_0	Pariññāti tīraṇapariññā adhippetā. Yasmā panassa rūpārūpadhamme salakkhaṇato paccayato	339	
PA_atk-s05_19a:339_1	ca abhijānitvā kusalādivibhāgehi te pariggahetvā aniccādivasena jānanā hoti, tasmā	339	
PA_atk-s05_19a:339_2	“evaṃ abhijānitvā yā parijānanā, idaṃ kusala”ntiādi vuttaṃ. Tattha evaṃgahitāti evaṃ	339	
PA_atk-s05_19a:339_3	aniccādito kalāpasammasanādivasena gahitā sammasitā. Idaṃ phalaṃ nibbattentīti idaṃ	339	
PA_atk-s05_19a:339_4	udayabbayañāṇādikaṃ phalaṃ paṭipāṭiyā uppādenti, nimittassa kattubhāvena upacaraṇato	339	
PA_atk-s05_19a:339_5	yathā ariyabhāvakarāni saccāni ariyasaccānīti. Tesanti udayabbayañāṇādīnaṃ. Evaṃgahitānanti	339	
PA_atk-s05_19a:339_6	evaṃpavattitānaṃ. Ayaṃ atthoti ayaṃ saccānaṃ anubodhapaṭivedho attho. Yathā hi pariññāpaññā	339	
PA_atk-s05_19a:339_7	sammasitabbadhamme sammasanadhamme tattha sammasanākāraṃ parijānāti, evaṃ sammasanaphalampi	339	
PA_atk-s05_19a:339_8	parijānātīti katvā ayaṃ nayo dassito.	339	
PA_atk-s05_19a:340_0	Ye akusalāti samudayasaccamāha. Sabbe hi akusalā samudayapakkhiyāti. Ye kusalāti	340	
PA_atk-s05_19a:340_1	maggadhammā sammādiṭṭhiādayo. Yadipi phaladhammāpi sacchikātabbā, catusaccappaṭivedhassa	340	
PA_atk-s05_19a:340_2	pana adhippetattā “katame dhammā sacchikātabbā, yaṃ asaṅkhata”nti vuttaṃ. Atthakusaloti	340	
PA_atk-s05_19a:340_3	paccayuppannesu atthesu kusalo. Dhammakusaloti paccayadhammesu kusalo. Pāḷiatthapāḷidhammā	340	
PA_atk-s05_19a:340_4	vā atthadhammā. Kalyāṇatākusaloti yuttatākusalo, catunayakovidoti attho, desanāyuttikusalo	340	
PA_atk-s05_19a:340_5	vā. Phalatākusaloti khīṇāsavaphalakusalo. “Āyakusalo”tiādīsu āyoti vaḍḍhi. Sā anatthahānito	340	
PA_atk-s05_19a:340_6	aṭṭhuppattito ca duvidhā. Apāyāti avaḍḍhi. Sāpi atthahānito anaṭṭhuppattito ca duvidhā.	340	
PA_atk-s05_19a:340_7	Upāyoti sattānaṃ accāyike kicce vā bhaye vā uppanne tassa tikicchanasamatthaṃ ṭhānuppattikāraṇaṃ,	340	
