segmentnr	original	analyzed
PA_anya-e11_02n:89_0	Anusāvanasampatti nāma vatthu saṅghapuggalānaṃ aparāmasanāni, sāvanāya hāpanaṃ, akāle	anusāvana sampatti nāma vatthu saṅgha puggalānam a parāmasanāni sāvanāya hāpanam akāle 
PA_anya-e11_02n:89_1	sāvananti ime pañca anusāvanadose vajjetvā kathanaṃ anusāvanasampatti nāma. Tattha	sāvananti ime pañca anusāvana dose vajjetvā kathanam anusāvana sampatti nāma tattha 
PA_anya-e11_02n:89_2	vatthādīnaṃ aparāmasanāni ñattiyaṃ vuttasadisāneva. Tīsu pana anusāvanāsu yattha	vattha ādīnam a parāmasanāni ñattiyam vutta sadisāna iva tīsu pana anusāvanāsu 
PA_anya-e11_02n:89_3	katthaci etesaṃ aparāmasanaṃ aparāmasanameva. Sabbena sabbaṃ pana kammavācaṃ avatvā	katthaci etesam a parāmasanam a parāmasanam eva sabbena sabbam pana kamma vācam a vatvā 
PA_anya-e11_02n:89_4	catukkhattuṃ ñattikittanameva vā kammavācabbhantarepi cattāri byañjanāni kopetvā	catu khattum ñatti kittanam eva vā cattāri byañjanāni kopetvā 
PA_anya-e11_02n:89_5	vā akkharassa vā padassa vā duruccāraṇaṃ vā katvā sāvanaṃ sāvanāya hāpanaṃ nāma,	vā akkharassa vā padassa vā duruccāraṇam vā katvā sāvanam sāvanāya hāpanam nāma 
PA_anya-e11_02n:89_6	tathā hi sithiladhanitavimuttaniggahitavasena cattāri byañjanāni antokammavācāya	tathā hi sithila dhanita vimutta niggahita vasena cattāri byañjanāni antokamma vācāya 
PA_anya-e11_02n:89_7	kammaṃ kopenti. Tattha “suṇātu me ti sithile vattabbe suṇāthu me”ti vacanaṃ sithile	kammam kopenti tattha suṇātu me ti sithile vattabbe suṇāthu me iti vacanam sithile 
PA_anya-e11_02n:89_8	dhanitaṃ nāma. “Bhante”ti vattabbe bhanteti vacanaṃ dhanite sithilaṃ nāma. “Suṇātu	dhanitam nāma bhante iti vattabbe bhante iti vacanam dhanite sithilam nāma suṇātu 
PA_anya-e11_02n:89_9	esā ñattī”ti vattabbe “suṇantu esaṃ ñattī”ti vacanaṃ vimutte niggahitaṃ nāma. “Pattakalla”nti	esā ñattī iti vattabbe suṇantu esam ñattī iti vacanam vimutte niggahitam nāma patta kallanti 
PA_anya-e11_02n:89_10	vattabbe “pattakallā”ti vacanaṃ niggahite vimuttaṃ nāma. Evaṃ imāni cattāri byañjanāni	vattabbe pattakallā ati vacanam niggahite vimuttam nāma evam imāni cattāri byañjanāni 
PA_anya-e11_02n:89_11	antokammavācāya kammaṃ dūsenti. Imāni cattāri akopetvā vadantenāpi aññasmiṃ akkhare	antokamma vācāya kammam dūsenti imāni cattāri a kopetvā vadantena api aññasmin akkhare 
PA_anya-e11_02n:89_12	vattabbe aññaṃ akkharaṃ vadanto duruttaṃ karoti nāma. Itaresu dīgharassādīsu chasu	vattabbe aññam akkharam vadantaḥ duruttam karoti nāma itaresu dīgha rassa ādīsu chasu 
PA_anya-e11_02n:89_13	ṭhānesu dīghaṭṭhāne dīghaṃ, rassaṭṭhāne rassamevāti evaṃ yathāṭhāne taṃ tadeva akkharaṃ	ṭhānesu dīgha ṭṭhāne dīgham rassa ṭṭhāne rassam eva ati evam yathāṭhāne tam tat eva akkharam 
PA_anya-e11_02n:89_14	bhāsantena anukkamāgataṃ paveṇiṃ avināsetvā kammavācā kātabbā. Sace pana evaṃ akatvā	bhāsantena anukkama āgatam paveṇim a vināsetvā kamma vācā kātabbā sace pana evam a katvā 
PA_anya-e11_02n:89_15	dīghe vattabbe rassaṃ, rasse vattabbe dīghaṃ vadati, tathā garuke vattabbe lahukaṃ,	dīghe vattabbe rassam rasse vattabbe dīgham vadati tathā garuke vattabbe lahukam 
PA_anya-e11_02n:89_16	lahuke vattabbe garukaṃ vadati. Sambandhe vā vattabbe vavatthitaṃ, vavatthite vā	lahuke vattabbe garukam vadati sambandhe vā vattabbe vavatthitam vavatthite vā 
PA_anya-e11_02n:89_17	vattabbe sambandhaṃ vadati, evampi kammavācā na kuppati. Imāni cha byañjanāni kammaṃ	vattabbe sambandham vadati evam pi kamma vācā na kuppati imāni cha byañjanāni kammaṃ 
PA_anya-e11_02n:89_18	na kopenti. Idameva ācariyānaṃ samānakathā. Apare pana idāni byañjanāni antokammavācāya	na kopenti idam eva ācariyānam samāna kathā apare pana idāni byañjanāni antokamma vācāya 
PA_anya-e11_02n:89_19	kammaṃ dūsentīti vadanti, evaṃ sati anupasampannāva bahutarā bhaveyyuṃ, vīmaṃsitvā	kammam dūsenti iti vadanti evam sati anupasampannā ava bahutarāḥ bhaveyyum vīmaṃsitvā 
PA_anya-e11_02n:89_20	pana gahetabbaṃ. Suṭṭhutarā vā kammavācā sikkhitabbā. Sāvanāya anokāse paṭhamaṃ ñattiṃ	pana gahetabbam suṭṭhutarā vā kamma vācā sikkhitabbā sāvanāya anokāse paṭhamam ñattim 
PA_anya-e11_02n:89_21	aṭṭhapetvā anusāvanaṃ akāle sāvanaṃ nāma. Iti imehi dosehi vimuttāya anusāvanāya	aṭṭhapetvā anusāvanam akāle sāvanam nāma iti imehi dosehi vimuttāya anusāvanāya 
PA_anya-e11_02n:89_22	sampannaṃ anusāvanasampattisampannaṃ nāma. Yadi pattacīvararahitaṃ puggalaṃ upasampādeti,	sampannam anusāvana sampatti sampannam nāma yadi patta cīvara rahitam puggalam upasampādeti 
PA_anya-e11_02n:89_23	“paripuṇṇassa pattacīvara”nti anusāvanāya katattā kammakopo na hoti, kārakasaṅgho	paripuṇṇassa patta cīvaranti anusāvanāya kata ttā kamma kopaḥ na hoti kāraka saṅgho 
PA_anya-e11_02n:89_24	pana sātisāro tenevāha vimativinodaniyampi pattacīvarānaṃ abhāvepi’paripuṇṇassa pattacīvara’nti	pana sa atisāraḥ tena iva āha patta cīvarānaṃ abhāve pi paripuṇṇassa 
PA_anya-e11_02n:89_25	kammavācāya sāvitattā kammakopaṃ avatvā dukkaṭameva vuttanti. Sace anupajjhāyako	kamma vācāya sāvita ttā kamma kopam avatvā dukkaṭam eva vuttan ti sace anupajjhāyakaḥ 
PA_anya-e11_02n:89_26	upasampādeti, “itthannāmassa upasampadāpekkho, itthannāmena upajjhāyenā”ti vā upajjhāyaṃ	upasampādeti itthannāmassa upasampada apekkhaḥ itthannāmena upajjhāyena ati vā upajjhāyam 
PA_anya-e11_02n:89_27	sāveti, sūpasampannova hoti. Upajjhāyaṃ na sāveti nupasampanno. Vakkhati hi vimativinodaniyaṃ	sāveti su upasampannaḥ va hoti upajjhāyam na sāveti n upasampannaḥ vakkhati hi vimati vinodaniyam 
PA_anya-e11_02n:89_28	“kammaṃ na kuppatīti idaṃ upajjhāyābhāvepi itthannāmassa upasampadāpekkho itthannāmena	kammam na kuppati iti idam upajjhāya abhāve pi itthannāmassa upasampada apekkhaḥ itthannāmena 
PA_anya-e11_02n:89_29	upajjhāyenā”ti matassa vā vibbhamantassa vā purāṇaupajjhāyassa vā yassa kassaci avijjamānassāpi	upajjhāyena ati matassa vā vibbhamantassa vā purāṇa upajjhāyassa vā yassa kassaci a vijjamānassa api 
PA_anya-e11_02n:89_30	nāmena sabbattha upajjhāyakittanassa katattā vuttaṃ. Yadi hi upajjhāyakittanaṃ na	nāmena sabbattha upajjhāya kittanassa kata ttā vuttam yadi hi upajjhāya kittanam na 
PA_anya-e11_02n:89_31	kareyya,’puggalaṃ na parāmasatī’ti vuttakammavipattieva siyā, teneva pāḷiyaṃ “anupajjhāyakanti	kareyya puggalam na parāmasati iti vutta kamma vipatti eva siyā tena iva pāḷiyam anupajjhāyakam ti 
PA_anya-e11_02n:89_32	vutta”nti. Sace saṅghupajjhāyena gaṇupajjhāyena upasampādeti, kārakasaṅgho sātisāro,	vuttam ti sace saṅgha upajjhāyena gaṇa upajjhāyena upasampādeti kāraka saṅghaḥ sa atisāraḥ 
PA_anya-e11_02n:89_33	kammaṃ pana na kuppati, vakkhati hi vimativinodaniyaṃ “saṅghena upajjhāyenā”ti ayaṃ	kammam pana na kuppati vakkhati hi vimati vinodaniyam saṅghena upajjhāyena ati ayaṃ 
PA_anya-e11_02n:89_34	itthannāmo saṅghassa upasampadāpekkho, itthannāmo saṅghaṃ upasampadaṃ yācati. Saṅghena	itthannāmaḥ saṅghassa upasampada apekkhaḥ itthannāmaḥ saṅgham upasampadam yācati saṅghena 
PA_anya-e11_02n:89_35	upajjhāyenā”ti evaṃ kammavācāya saṅghameva upajjhāyaṃ kittetvāti attho. Evaṃ’gaṇena	upajjhāyena ati evam kamma vācāya saṅgham eva upajjhāyam kittetvā ati atthaḥ evaṃgaṇena 
PA_anya-e11_02n:89_36	upajjhāyenā’ti etthāpi ayaṃ itthannāmogaṇassa upasampadāpekkho’ti ādinā yojanā veditabbā.	upajjhāyena ati ettha api ayam itthannāma gaṇassa upasampada apekkhaḥ iti ādinā yojanā veditabbā 
PA_anya-e11_02n:89_37	Evaṃ vuttepi kammaṃ na kuppati eva, dukkaṭasseva vuttattā, aññathā so ca puggalo	evam vutte api kammam na kuppati eva dukkaṭassa iva vuttattā aññathā saḥ ca puggalo 
PA_anya-e11_02n:89_38	anupasampannoti vadeyyā’ti. Sace paṇḍakādinā anupasampannakena upajjhāyena upasampādeti,	anupasampannaḥ iti vadeyyā ati sace paṇḍaka ādinā anupasampannakena upajjhāyena upasampādeti 
PA_anya-e11_02n:89_39	te vajjetvā pañcavaggādigaṇo hatthapāsaṃ avijahitvā pūrati, kammaṃ na kuppati, kārakasaṅgho	te vajjetvā pañcavagga ādi gaṇaḥ hattha pāsam a vijahitvā pūrati kammam na kuppati kāraka saṅghaḥ 
PA_anya-e11_02n:89_40	pana sātisāro tena vuttaṃ vimativinodaniyaṃ “paṇḍakādīhi upajjhāyehi kariyamānesu	pana sa atisāraḥ tena vuttam vimati vinodaniyam paṇḍaka ādīhi upajjhāyehi kariyamānesu 
PA_anya-e11_02n:89_41	paṇḍakādikena vināva pañcavaggādigaṇo pūrati, kammaṃ na kuppati. Itarathā kuppatī”ti.	paṇḍaka ādikena pūrati kammam na kuppati itarathā kuppati iti 
PA_anya-e11_02n:89_42	Sace cattāro ācariyā ekato anusāventi, ettha pana kathanti vuccate, sabbaaṭṭhakathāsu	sace cattāraḥ ācariyāḥ ekatas anusāventi ettha pana katham iti vuccate sabba aṭṭhakathāsu 
PA_anya-e11_02n:89_43	dvīhi vā tīhi vā ācariyehi visuṃ visuṃ ekena ekassāti ekappahāreneva dve tisso vā	dvīhi vā tīhi vā ācariyehi visum visum ekena ekassa ati eka pahārena iva dve tissaḥ vā 
PA_anya-e11_02n:89_44	kammavācā kātabbā. Sace pana nānācariyā nānupajjhāyā honti, tissatthero sumanattherassa	kamma vācā kātabbā sace pana nānā ācariyāḥ na an upajjhāyāḥ honti tissattheraḥ sumana ttherassa 
PA_anya-e11_02n:89_45	saddhivihārikaṃ, sumanatthero tissattherassa saddhivihārikaṃ anusāveti, gaṇapūrakā	saddhivihārikam sumana thero tissa therassa saddhivihārikam anusāveti gaṇapūrakā 
PA_anya-e11_02n:89_46	honti vaṭṭati. Sace pana nānupajjhāyā honti, eko ācariyo hoti, natveva’nānupajjhāyenā’ti	honti vaṭṭati sace pana na an upajjhāyāḥ honti ekaḥ ācariyaḥ hoti na tvā iva na an upajjhāyena ati 
PA_anya-e11_02n:89_47	paṭikkhittattā na vaṭṭatīti ettakameva vuttaṃ. Catunnaṃ pana janānaṃ vicāraṇakathāya	paṭikkhitta ttā na vaṭṭati iti ettakam eva vuttam catunnam pana janānam vicāraṇa kathāya 
PA_anya-e11_02n:89_48	nāpi kammavipattichāyā dissati, tathāpi na kattabbameva, sabbaaṭṭhakathāsu avicāritattā.	nā api kamma vipatti chāyā dissati tathā api na kattabbam eva sabba aṭṭhakathāsu avicārita ttā 
PA_anya-e11_02n:89_49	Sace vatthālaṅkārādisahitaparūḷhakesamassuṃ upasampādeti, sūpasampannova hoti, pacchā	sace vattha alaṅkāra ādi sahita parūḍha kesa massum upasampādeti su upasampannaḥ uva hoti pacchā 
PA_anya-e11_02n:89_50	kesamassuṃ ohāretvā kāsāyāni vatthāni acchādetuṃ vaṭṭati terasavatthuvimuttattā sampatti	kesa massum ohāretvā kāsāyāni vatthāni acchādetum vaṭṭati terasa vatthu vimutta ttā sampatti 
PA_anya-e11_02n:89_51	yevetthapamāṇattā ca.	ca 
PA_anya-e11_02n:90	Anusāvanasampattikathā niṭṭhitā.	anusāvana sampatti kathā niṭṭhitā 
PA_anya-e11_02n:91	Idāni sīmavisodhaniṃ nāma, nānāganthasamāhanti imissā gāthāya saṃvaṇṇanākkamo anuppatto.	idāni sīmavisodhanim nāma nānā gantha samāhanti imissā gāthāya saṃvaṇṇanā kkamaḥ an uppatto 
PA_anya-e11_02n:92	Paññāva sabbañeyyesu, dayā yassa mahesino;	paññā ava sabba ñeyyesu dayā yassa mahesino 
PA_anya-e11_02n:93	Anantesupi sattesu, pavattittha yathāruci.	anantesu pi sattesu pavattittha yathāruci 
PA_anya-e11_02n:94	Tāya ussāhito satthā, bhikkhūnaṃ hitakāraṇaṃ;	tāya ussāhitaḥ satthā bhikkhūnam hita kāraṇam 
PA_anya-e11_02n:95	Yaṃ sīmaṃ anujānāti, tattha pañho pavattati.	yam sīmam anujānāti tattha pañhaḥ pavattati 
PA_anya-e11_02n:96	Dveḷhakā saṃsayā honti, dese sabbattha bhikkhavo;	dveḷhakā saṃsayāḥ honti dese sabbattha bhikkhavo 
PA_anya-e11_02n:97	Ganthāpi visamā honti, attanomatikāraṇā.	ganthā api visamāḥ honti attanomati kāraṇā 
PA_anya-e11_02n:98	Yadi me īdisaṃ vādaṃ, sutvāvupekkhako bhave;	yadi me īdisam vādam sutvā upekkhakaḥ bhave 
PA_anya-e11_02n:99	Pabbajjā nipphalā mayhaṃ, vare sambuddhasāsane;	pabbajjāḥ nipphalāḥ mayham vare sambuddha sāsane 
PA_anya-e11_02n:100	Gambhīro nipuṇo attho, sabbaññujinagocaro.	gambhīraḥ nipuṇaḥ atthaḥ sabbaññu jina gocaraḥ 
PA_anya-e11_02n:101	Sāriputto mahāpañño, therassapi avisayo;	sāriputto mahā pañño therassa api avisayo 
PA_anya-e11_02n:102	Kathaṃ tvaṃ sakkuṇeyyāsi, sabbaññujinagocare;	katham tvam sakkuṇeyyā asi sabbaññu jina gocare 
PA_anya-e11_02n:103	Iti me upavadeyyuṃ, dharateva mahāmuni.	iti me upavadeyyum dharatā iva mahā muni 
PA_anya-e11_02n:104	Pāliphullo mahāsālo, ucco merunagūpamo;	pāliphullaḥ mahā sālaḥ uccaḥ meru nagu upamaḥ 
PA_anya-e11_02n:105	Parinibbānakālamhi, sambuddho iccamabravi.	parinibbāna kālamhi sambuddhaḥ iccam abravi 
PA_anya-e11_02n:106	Mā tvaṃ ānanda rodasi, mā tvaṃ ānanda socasi;	mā tvam ānanda rodasi mā tvam ānanda socasi 
PA_anya-e11_02n:107	Ahamekova nibbāyi, dharanteva bahū buddhā.	aham ekaḥ iva nibbāyi dharantā iva bahū buddhā 
PA_anya-e11_02n:108	Sambuddhā caturāsīti, sahassāni imāni te;	sambuddhā caturāsīti sahassāni imāni te 
PA_anya-e11_02n:109	Ovadissanti tvaṃ bhikkhu, katapuññosi hohisi.	ovadissanti tvam bhikkhu kata puññaḥ asi hohisi 
PA_anya-e11_02n:110	Vare sāṭṭhakathe pāḷi, ṭhite sabbaññugocare;	vare sa aṭṭha kathe pāḷi ṭhite sabbaññu gocare 
PA_anya-e11_02n:111	Nibbutopi sambuddho, asuññova pajaṃ imaṃ.	nibbutaḥ api sambuddhaḥ asuññaḥ va pajam imam 
PA_anya-e11_02n:112	Evāhaṃ cintayitvāna, rattidivaṃ atandito;	eva aham cintayitvāna rattidivam a tanditaḥ 
PA_anya-e11_02n:113	Dharanteyeva sambuddhe, bhinnavādo avisayo.	sambuddhe bhinna vādaḥ a visayaḥ 
PA_anya-e11_02n:114	Taṃ vādaṃ bhindayitvāna, jahitvā vattanomatiṃ;	tam vādam jahitvā 
PA_anya-e11_02n:115	Vissajjissamahaṃ dāni, ciraṃ saddhammasuddhiyāti.	vissajjissam aham dāni ciram saddhamma suddhiyā ati 
PA_anya-e11_02n:116_0	Tattha sīmavisodhani'nti sīmavipattijahanaṃ sīmavipattiṃ pahāya sampattilakkhaṇappakāsakaṃ	tattha sīma visodhanin ti sīma vipatti jahanam sīma vipattim pahāya sampatti lakkhaṇa ppakāsakam 
PA_anya-e11_02n:116_1	pakaraṇaṃ karissanti attho. Tattha sīmāti pannarasavidhā sīmā. Katame pannarasa.	pakaraṇam karissanti tattha sīmā ati pannarasavidhā sīmā katame pannarasa 
PA_anya-e11_02n:116_2	Khaṇḍasīmā, upacārasīmā, samānasaṃvāsasīmā, avippavāsasīmā, lābhasīmā, gāmasīmā,	khaṇḍa sīmā upacāra sīmā samāna saṃvāsa sīmā avippavāsa sīmā lābha sīmā gāma sīmā 
PA_anya-e11_02n:116_3	nigamasīmā, nagarasīmā, abbhantarasīmā, udakukkhepasīmā, janapadasīmā, raṭṭhasīmā,	nigama sīmā nagara sīmā abbhantara sīmā udakukkhepa sīmā janapada sīmā raṭṭha sīmā 
PA_anya-e11_02n:116_4	rajjasīmā, dīpasīmā, cakkavāḷasīmā’ti. Tattha khaṇḍasīmā nāma pabbajjupasampadādīnaṃ	rajja sīmā dīpa sīmā cakkavāḷa sīmā ti tattha khaṇḍa sīmā nāma pabbajja upasampad ādīnam 
PA_anya-e11_02n:116_5	saṅghakammānaṃ sukhakaraṇatthaṃ mahāsīmāya vā gāmakhette vā khaṇḍitvā paricchinditvā	saṅgha kammānam sukha karaṇa attham mahā sīmāya vā gāma khette vā khaṇḍitvā paricchinditvā 
PA_anya-e11_02n:116_6	sammatā. Tassāvitthāro ''paṭhamaṃ nimittā kittetabbā''ti ādinā dvāsattatippabhedāya	paṭhamam nimittā ādinā dvāsattati pabhedāya 
PA_anya-e11_02n:116_7	samantapāsādikāya vinayaṭṭhakathāya mahāvagge vutto, idha vuttopi tatheva vutto bhaveyya,	samantapāsādikāya vinaya ṭṭhakathāya mahā vagge vuttaḥ idha vuttaḥ api tathā iva vuttaḥ bhaveyya 
PA_anya-e11_02n:116_8	tasmā na vakkhāma, duviññeyyaṭṭhānameva kiñciṭhānaṃ nīharitvā pākaṭaṃ karissāma.	tasmā na vakkhāma du viññeyya ṭṭhānam eva kiñci ṭhānam nīharitvā pākaṭam karissāma 
PA_anya-e11_02n:116_9	Tattha sace pana heṭṭhā uparimassa sīmāparicchedassa parato anto leṇaṃ hoti, bahi	tattha sace pana heṭṭhā uparimassa sīmā paricchedassa paratas antar leṇam hoti bahi 
PA_anya-e11_02n:116_10	sīmā na otarati. Athāpi uparimassa sīmāparicchedassa orato bahi leṇaṃ hoti, antosīmā	sīmā na otarati atha api uparimassa sīmā paricchedassa oratas bahi leṇam hoti antosīmā 
PA_anya-e11_02n:116_11	na otaratīti ime dve ekatthā byañjanameva nānaṃ. Ayañhetthatthouparimassa sīmāparicchedassa	na otarati iti ime dve ekatthā byañjanam eva sīmā paricchedassa 
PA_anya-e11_02n:116_12	orimabhāgato heṭṭhā pabbatapāde umaṅgasaṇṭhānena pabbatapasse vijjhitvā leṇaṃ hoti,	orima bhāgataḥ heṭṭhā pabbata pāde umaṅga saṇṭhānena pabbata passe vijjhitvā leṇam hoti 
PA_anya-e11_02n:116_13	sīmāparicchedassa parato leṇe ca leṇassa bahibhūte heṭṭhā pabbate ca bhūmibhāge sīmā	sīmā paricchedassa paratas leṇe ca leṇassa bahibhūte heṭṭhā pabbate ca bhūmi bhāge sīmā 
PA_anya-e11_02n:116_14	na otarati, leṇassa upariyeva sīmā hotīti. Tassa uparimassa sīmāparicchedassa orimabhāgato	na otarati leṇassa upariyā iva sīmā hoti iti tassa uparimassa sīmā paricchedassa orima bhāgato 
PA_anya-e11_02n:116_15	bahibhūte heṭṭhā pabbatapāde umaṅgasaṇṭhānena vijjhitvā pabbatapasse leṇaṃ athāpi	bahibhūte heṭṭhā pabbata pāde umaṅga saṇṭhānena vijjhitvā pabbata passe leṇam atha api 
PA_anya-e11_02n:116_16	hoti, leṇe ca leṇassa parabhūte heṭṭhā pabbate ca bhūmibhāge sīmā na otarati, leṇassa	hoti leṇe ca leṇassa parabhūte heṭṭhā pabbate ca bhūmi bhāge sīmā na otarati leṇassa 
PA_anya-e11_02n:116_17	uparibhāge va sīmā hotīti. Esā ca vicāraṇā vimativinodaniyampi katā. Anto ti pabbatassa	upari bhāge sīmā hoti iti esā ca vicāraṇā vimati vinodaniyam pi katā antaḥ ti pabbatassa 
PA_anya-e11_02n:116_18	anto, pabbatamūleti attho. Tameva antosaddaṃ sīmāparicchedena visesetuṃ “uparimassa	antar pabbata mūle ti attho tam eva antar saddam sīmā paricchedena visesetum uparimassa 
PA_anya-e11_02n:116_19	sīmāparicchedassa parato”ti vuttaṃ. Pabbatapādaṃ pana apekkhitvā “orato”ti vattabbepi	sīmā paricchedassa paratas ti vuttam pabbata pādam pana apekkhitvā oratas ti vattabbe pi 
PA_anya-e11_02n:116_20	sīmānissayaṃ pabbataggaṃ sandhāya “parato”ti vuttanti daṭṭhabbaṃ teneva bahileṇanti	sīmānissayam pabbata aggam sandhāya paratas ti vuttan ti daṭṭhabbam tena iva bahi leṇam ti 
PA_anya-e11_02n:116_21	ettha bahisaddaṃ visesento “uparimassa sīmāparicchedassa orato”ti āha. Bahi sīmā	ettha bahi saddam visesento uparimassa sīmā paricchedassa orataḥ ti āha bahi sīmā 
PA_anya-e11_02n:116_22	na otaratīti ettha bahī ti pabbatapādeleṇaṃ sandhāya vuttaṃ. Leṇassa bahibhūte upari	na otarati iti ettha bahi ti pabbata pāda leṇam sandhāya vuttam leṇassa bahi bhūte upari 
PA_anya-e11_02n:116_23	sīmāparicchedassa heṭṭhābhāge sīmā na otaratīti attho. Antosīmāti leṇassa ca pabbatapādassa	sīmā paricchedassa heṭṭhā bhāge sīmā na otarati iti attho antosīmā ati leṇassa ca pabbata pādassa 
PA_anya-e11_02n:116_24	ca anto attano otaraṇārahaṭṭhāne na otaratīti attho. Bahi sīmā na otaratīti attho,	ca antar attanaḥ otaraṇa raha ṭṭhāne na otarati iti attho bahi sīmā na otarati iti attho 
PA_anya-e11_02n:116_25	sīmā na otaratī ti cettha attano otaraṇārahaṭṭhāne leṇabhāvena sīmā sabbathā “anotaraṇameva	sīmā naḥ otarati ti ca ittha attanaḥ otaraṇa araha ṭṭhāne leṇa bhāvena sīmā sabbathā anotaraṇam eva 
PA_anya-e11_02n:116_26	dassitanti gahetabbaṃ. Tattha pi anotaraṇanti uparieva sīmā hotī”ti vimativinodanī.	dassitanti gahetabbam tattha pi upari eva sīmā hoti iti vimati vinodanī 
PA_anya-e11_02n:116_27	Keci pana veḷususiro viya susirameva leṇanti vadanti, taṃ ayuttaṃ.	keci pana veḷu susiraḥ viya susiram eva vadanti tat ayuttam 
PA_anya-e11_02n:117_0	Upacārasīmā nāma gāmāraññanigamādivasā yāva brahmalokā tesaṃ tesaṃ sattānaṃ nivāsagehassa	upacārasīmāḥ nāma gāma arañña nigama ādivasāḥ yāva brahmalokā tesam tesam sattānam nivāsa gehassa 
PA_anya-e11_02n:117_1	vā devavimānakapparukkhādīnaṃ vā upacārārahaṭṭhānameva upacārasīmā te idha nādhippetā,	vā deva vimāna kappa rukkha ādīnam vā upacāra araha ṭṭhānam eva upacāra sīmā te idha na adhippetā 
PA_anya-e11_02n:117_2	bhikkhūnaṃ avisayatāya. Yaṃ pana padesaṃ paricchinditvā pariveṇaṃ katvā pākārādiparikkhittaṃ	bhikkhūnam avisaya tāya yam pana padesam paricchinditvā pariveṇam katvā pākāra ādi parikkhittam 
PA_anya-e11_02n:117_3	vā katvā aparikkhittepi upacārārahaṭṭhānaṃ paricchinditvā vā yasmiṃ padese bhikkhū	vā katvā a parikkhitte api upacāra araha ṭṭhānam paricchinditvā vā yasmin padese bhikkhū 
PA_anya-e11_02n:117_4	vasanti, ayameva upacārasīmāti adhippetā. Bhikkhūnaṃ vassūpagamanakathinatthārakaraṇaṭṭhānattā,	vasanti ayam eva upacāra sīmā ti adhippetā bhikkhūnam 
PA_anya-e11_02n:117_5	tathā hi “kathinatthatasīmāya”nti upacārasīmaṃ sandhāya vuttaṃ, khandhasīmāya tatruppādābhāvatoti	tathā hi upacāra sīmam sandhāya vuttam khandha sīmāya tatra uppāda abhāvato ti 
PA_anya-e11_02n:117_6	tīsupi gaṇṭhipadesu vuttaṃ. Tatruppādenā bhatanti vihārasantakena khettavatthuādinā	tīsu pi gaṇṭhi padesu vuttam vihāra santakena khetta vatthu ādinā 
PA_anya-e11_02n:117_7	ābhataṃ kiñci saṅghikaṃ cīvaraṃ uppajjati, taṃ tesaṃ kathinatthārakabhikkhūnaṃ yeva	ābhatam kiñci saṅghikam cīvaram uppajjati tam tesam kathinatthāraka bhikkhūnam yeva 
PA_anya-e11_02n:117_8	bhavissatīti yojanā kātabbā. Khettavatthuādinā ti ettha ādisaddena matakacīvaraṃ	bhavissati iti yojanā kātabbā khetta vatthu ādinā ti ettha ādi saddena mataka cīvaram 
PA_anya-e11_02n:117_9	vā hotu saṃghaṃ uddissa dinnaṃ vā saṅghikena vā ti mahāaṭṭhakathāyaṃ vuttaṃ. Tasmiṃ	vā hotu saṃgham uddissa dinnam vā saṅghikena vā ti mahā aṭṭhakathāyam vuttam tasmin 
PA_anya-e11_02n:117_10	upacārasīme pavattacīvaraṃ sabbaṃ saṅgaṇhāti, teneva “tena kho pana samayena aññatarena	upacāra sīme pavatta cīvaram sabbam saṅgaṇhāti tena iva tena kho pana samayena aññatarena 
PA_anya-e11_02n:117_11	upāsakena saṅghaṃ uddissa vihāro kārito hoti, so tassa vihārassa kate ubhatosaṅghassa	upāsakena saṅgham uddissa vihāraḥ kāritaḥ hoti saḥ tassa vihārassa kate ubhatosaṅghassa 
PA_anya-e11_02n:117_12	akālacīvaraṃ dātukāmo hoti. Tena kho pana samayena ubhatosaṅghassa kathinaṃ atthataṃ	akāla cīvaram dātu kāmo hoti tena kho pana samayena ubhato saṅghassa kathinam 
PA_anya-e11_02n:117_13	hoti. Atha kho so upāsako saṅghaṃ upasaṅkamitvā kathinuddhāraṃ yācī”ti imasmiṃ vatthusmiṃ	hoti atha kho saḥ upāsakaḥ saṅgham upasaṅkamitvā kathin uddhāram yāci iti imasmin vatthusmin 
PA_anya-e11_02n:117_14	ānisaṃsapasambhanatthaṃ kathinuddhāraṃ bhagavatā paññattaṃ, teneva thullanandā bhikkhunī	ānisaṃsa pasambhana attham kathin uddhāram bhagavatā paññattam tena iva thullanandā bhikkhunī 
PA_anya-e11_02n:117_15	ānisaṃsaṃ appaṭippassambhentā cīvaraṃ amhākaṃ bhavissatīti kathinuddhāraṃ paṭibāhi,	ānisaṃsam appaṭippassambhentā cīvaram amhākam bhavissati iti kathin uddhāram paṭibāhi 
PA_anya-e11_02n:117_16	tasmā kathinatthatasīmāyaṃ anuddhaṭe kathine yāva phagguṇapuṇṇamā pañca māsā etthantare	an uddhaṭe kathine yāva phagguṇa puṇṇamā pañca māsāḥ etthantare 
PA_anya-e11_02n:117_17	matakacīvaraṃ vā hotu cātuddisaṃ saṅghaṃ uddissa matānaṃ ñātijanānaṃ vā, bhikkhāpaññattiyā	mataka cīvaram vā hotu cātuddisam saṅgham uddissa matānam ñāti janānam vā bhikkhā paññattiyā 
PA_anya-e11_02n:117_18	vā vihāramahādikiccena vā yenakenaci ākārena saṅghikaṃ cīvaraṃ dinnaṃ hoti, taṃ sabbaṃ	vā vihāra mahā ādi kiccena vā yena kenacid ākārena saṅghikam cīvaram dinnam hoti tam sabbam 
PA_anya-e11_02n:117_19	tesaṃ kathinatthārakabhikkhūnaṃyeva hoti. Chinnavassānaṃ vā pacchimikāya upagatānaṃ	tesam kathinatthāraka bhikkhūnam yeva hoti chinna vassānam vā pacchimikāya upagatānam 
PA_anya-e11_02n:117_20	vā tattha sampattānaṃ sīmaṭṭhakabhikkhūnaṃ vā na hoti. Ajānitvā ce gaṇhanti dātabbameva.	vā tattha sampattānam sīmaṭṭhaka bhikkhūnam vā na hoti a jānitvā ce gaṇhanti dātabbam eva 
PA_anya-e11_02n:117_21	Yadi taṃ cīvaraṃ taṇḍulādikhādanīyabhojanaṃ karoti, itaresampi hotiyeva. Kasmāti	yadi tam cīvaram taṇḍula ādi khādanīya bhojanam karoti itaresam pi kasmāt iti 
PA_anya-e11_02n:117_22	ce ānisaṃsa vigatattā. Teneva gaṇapūraṇavasena sampattānaṃ chinnaṃ vassānaṃ vā pacchimikāya	ce tena iva gaṇa pūraṇa vasena sampattānam chinnam vassānam vā pacchimikāya 
PA_anya-e11_02n:117_23	upagatānaṃ vā aññasmiṃ vihāre vutthavassanaṃ vā khādanīyabhojanīyādīni pāpuṇanti.	upagatānam vā aññasmim vihāre vuttha vassanam vā khādanīya bhojanīya ādīni pāpuṇanti 
