segmentnr	original	analyzed
PA_anya-e11_02n:177_131	etadeva sanniṭṭhānaṃ vuttaṃ vimativinodaniyaṃ pana yattha khuddake araññe mahantehi	etat eva sanniṭṭhānam vuttam vimati vinodaniyam pana yattha khuddake araññe mahantehi 
PA_anya-e11_02n:177_132	vā bhikkhūhi paripuṇṇatāya vaggakammasaṅkābhāvena sattabbhantarasīmāpekkhā natthi,	vā bhikkhūhi paripuṇṇa tāya vagga kamma saṅkā abhāvena satta bbhantara sīmā apekkhā natthi 
PA_anya-e11_02n:177_133	tattha satthabbhantarasīmā na uppajjati, kevalāraññasīmāyeva tattha saṅghena kammaṃ	tattha sattha abbhantara sīmā na uppajjati kevala arañña sīmāya iva tattha saṅghena kammaṃ 
PA_anya-e11_02n:177_134	kātabbaṃ nadīādīsupi eseva nayo vakkhati hi sace nadī nātidīghā hoti, pabhavato paṭṭhāya	kātabbam nadī ādīsu pi esā iva nayaḥ vakkhati hi sace nadī na ati dīghā hoti pabhavataḥ paṭṭhāya 
PA_anya-e11_02n:177_135	yāvamukhadvārā sabbattha saṅgho nisīdati, udakukkhepasīmākammaṃ natthī’ti ādi ca	yāvamukha dvārā sabbattha saṅghaḥ nisīdati udakukkhepa sīmākammam natthi iti ādi ca 
PA_anya-e11_02n:177_136	ubhayatthāpi ca. Yassaṃ disāyaṃ sattabbhantarassa vā udakukkhepassa vā okāso nappahoti,	ubhayattha api ca disā ayam okāsaḥ nappahoti 
PA_anya-e11_02n:177_137	tattha kathaṃ minanaṃ khipanaṃ vā bhaveyya, gāmakhettādīsu pavisanato akhette sīmā	tattha katham minanam khipanam vā bhaveyya gāma khetta ādīsu pavisanataḥ akhette sīmā 
PA_anya-e11_02n:177_138	paviṭṭhā nāmātisīmā vipajjeyya, apekkhāya sīmuppattiyaṃ pana yato pahoti, tattha	paviṭṭhā nāma ati sīmā vipajjeyya apekkhāya sīmuppattiyam pana yatas pahoti tattha 
PA_anya-e11_02n:177_139	sattabbhantaraudakukkhepasīmā sayameva paripuṇṇā jāyanti. Yato pana nappahoti, tattha	satta abbhantara audakukkhepa sīmā sayam eva paripuṇṇāḥ jāyanti yatas pana tattha 
PA_anya-e11_02n:177_140	attano khettappamāṇeneva jāyanti, na bahīti vuttaṃ, ettha ca’sīmāpekkhāya sattabbhantaraudakukkhepasīmā	attanaḥ khetta ppamāṇena iva jāyanti na bahi iti vuttam ettha ca sīmā apekkhāya satta bbhantarā udakukkhepa sīmā 
PA_anya-e11_02n:177_141	sayameva paripuṇṇā jāyantī’ti vuttattā udakukkhepaṃ vināyeva apekkhāya sīmāya udakukkhepasīmā	sayam eva paripuṇṇāḥ jāyanti iti vutta ttā udakukkhepam vināya iva apekkhāya sīmāya udakukkhepa sīmā 
PA_anya-e11_02n:177_142	uppajjatī’ti atthaṃ vadanti, taṃ ayuttarūpaṃ viya dissati. Kasmāti ce pāḷinayavirodhato	uppajjati iti attham vadanti tam ayutta rūpam viya dissati kasmā iti ce pāḷi naya virodhato 
PA_anya-e11_02n:177_143	vimativinodaniyaṃ parato vuttavacanenāpi virodhato ca. Idañca vacanaṃ ācariyassa	vimati vinodaniyam paratas vutta vacanena api virodhato ca idam ca vacanam ācariyassa 
PA_anya-e11_02n:177_144	kesañci puggalānaṃ vādappakāsanatthaṃ vuttaṃ bhaveyya. Kasmā parato vuttavacanena	kesañci puggalānam vāda ppakāsana attham vuttam bhaveyya kasmā paratas vutta vacanena 
PA_anya-e11_02n:177_145	aghaṭiyattā ca pāḷiyaṭṭhakathāṭīkāvacanehipi virujjhanato ca, taṃ parato vaṇṇayissāma.	ca virujjhanataḥ ca tam paratas vaṇṇayissāma 
PA_anya-e11_02n:177_146	Yathā ca loke vatiṃ aparikkhipitvā “idaṃ vatiyā ṭhāna”nti ca yathā ca naṅgalakoṭiyā	yathā ca loke vatim a parikkhipitvā idam vatiyā ca yathā ca naṅgala koṭiyā 
PA_anya-e11_02n:177_147	akasitvā “idaṃ kasikaṭṭhāna”nti ca yathā ca vatthuṃ karontā manussā kudhārīpharasuādinā	a kasitvā idam kasika ṭṭhānan ti ca yathā ca vatthum karontā manussā 
PA_anya-e11_02n:177_148	rukkhe acchinditvā “idaṃ mama kudhāripatanaṭṭhāna”nti ca yathā ca dāttena alāyitvā	rukkhe a chinditvā idam mama kudhāri patana ṭṭhānan ti ca yathā ca dāttena alāyitvā 
PA_anya-e11_02n:177_149	“idaṃ mama lāyitaṭṭhāna”nti ca na sakkā vattuṃ, evameva udakaṃ vā vālikaṃ vā hatthena	idam mama lāyita ṭṭhānan ti ca na sakkā vattum evam eva udakam vā vālikam vā hatthena 
PA_anya-e11_02n:177_150	akhipitvā “ayameko udakukkhepoti ca, udakapatanaṭṭhānanti ca na sakkā vattuṃ. Ettha	a khipitvā ayam ekaḥ udakukkhepo ti ca udaka patana ṭhānan ti ca na sakkā vattum ettha 
PA_anya-e11_02n:177_151	ca dve bhikkhū evaṃ vivādaṃ karonti vimativinodaniyaṃ “yattha khuddake araññe mahantehi	ca dve bhikkhū evam vivādam karonti vimati vinodaniyam yattha khuddake araññe mahantehi 
PA_anya-e11_02n:177_152	bhikkhūhi paripuṇṇatāya vaggakammasaṅkābhāvena sattabbhantarasīmāpekkhā natthi, tattha	bhikkhūhi paripuṇṇa tāya vagga kamma saṅkā abhāvena satta bbhantara sīmā apekkhā natthi tattha 
PA_anya-e11_02n:177_153	sattabbhantarasīmā na uppajjati, kevalāraññasīmāyeva tattha saṅghena kammaṃ kattabbaṃ	sattabbhantara sīmā na uppajjati kevala arañña sīmāya iva tattha saṅghena kammam kattabbam 
PA_anya-e11_02n:177_154	nadī ādīsupi eseva nayo. Vakkhati hi sace nadī nātidīghā hoti. Pabhavato paṭṭhāya	nadī ādīsu pi esā iva nayaḥ vakkhati hi sace nadī na ati dīghā hoti pabhavataḥ paṭṭhāya 
PA_anya-e11_02n:177_155	yāva mukhadvārā sabbattha saṅgho nisīdati, udakukkhepasīmākammaṃ natthī’tiādiṃ, iminā	yāva mukha dvārā sabbattha saṅghaḥ nisīdati udakukkhepa sīmākammam natthi itiādim iminā 
PA_anya-e11_02n:177_156	eva vacanena vaggakammaparihāratthaṃ sīmāpekkhāya sati eva udakukkhepasīmā sattabbhantarasīmā	eva vacanena vagga kamma parihāra attham sīmā apekkhāya sati eva udakukkhepa sīmā satta abbhantara sīmā 
PA_anya-e11_02n:177_157	uppajjanti, nāsatīti daṭṭhabba’nti vuttattā udakukkhepaṃ vināva parisapariyantato	uppajjanti na asati iti daṭṭhabban ti vutta ttā udakukkhepam vinā ava 
PA_anya-e11_02n:177_158	paṭṭhāya sīmāpekkhāya saheva udakukkhepasīmā uppajjati tasmā udakukkhepena payojanaṃ	paṭṭhāya sīmā apekkhāya saha iva udakukkhepa sīmā uppajjati tasmai udakukkhepena payojanam 
PA_anya-e11_02n:177_159	natthevāti te evaṃ vattabbā “mā sappurisā evaṃ vadeyyātha ācariyavarañca mā abbhācikkhatha	nattha iva ati te evam vattabbā mā sappurisāḥ evam vadeyyātha ācariya varam ca mā abbhācikkhatha 
PA_anya-e11_02n:177_160	idañca vacanaṃ ācariyavarassa neyyavacanaṃ, paratopi ācariyavaro sanniṭṭhānaṃ vakkhati	idam ca vacanam ācariya varassa neyya vacanam paratas pi ācariya varaḥ sanniṭṭhānam vakkhati 
PA_anya-e11_02n:177_161	vinayaṭṭhakathāsuceva sāratthadīpaniyañca vuttavacanehipi tava vacanaṃ asaṃsandeva,	vinaya ṭṭhakathāsu ca iva vutta vacanehi pi tava vacanam 
PA_anya-e11_02n:177_162	vimativinodaniyameva parato vuttavacanenāpi na ghaṭiyati. Kathaṃ neyyavacanaṃ hotīti.	vimati vinoda niyam eva paratas vutta vacanena api na katham neyya vacanam hoti iti 
PA_anya-e11_02n:177_163	“Sīmāpekkhāya sati eva…pe… nassatī”ti ettha sīmāpekkhāya vinā maggagamananhānādi	sīmā apekkhāya sati ettha sīmā apekkhāya vinā 
PA_anya-e11_02n:177_164	atthehi bhikkhūhi araññe vā nadīādīsupivā paviṭṭhakkhaṇeyeva nuppajjati, sīmāpekkhāya	atthehi bhikkhūhi araññe vā paviṭṭha kkhaṇe yeva nu ppajjati sīma apekkhāya 
PA_anya-e11_02n:177_165	satieva araññe samantā sattabbhantarā’ti paññattasikkhāpadānurūpaṃ abbhantarasīmā	sati eva araññe samantā satta abbhantarā ti paññatta sikkhāpada anurūpam abbhantara sīmā 
PA_anya-e11_02n:177_166	uppajjati’ nadīsamuddajātassaresupi majjhimassa purisassa samantā udakukkhe’pāti	uppajjati majjhimassa purisassa samantā 
PA_anya-e11_02n:177_167	paññatta sikkhāpadānurūpaṃ udakukkhepena saha udakukkhepasīmā uppajjati, na udakukkhepena	paññatta sikkhāpada anurūpam udakukkhepena saha udakukkhepa sīmā uppajjati na udakukkhepena 
PA_anya-e11_02n:177_168	vināti ayaṃ neyyattho. Nāsatītiettha udakukkhepena vināti atthopi na labbhate. Evañca	vinā ti ayam na iyyatthaḥ na asati iti ettha udakukkhepena vinā ati atthaḥ pi na labbhate evam ca 
PA_anya-e11_02n:177_169	sati vimativinodaniyaṃ yeva puna tatthāti lokavohārasiddhāsu etāsu nadīādīsu tīsu	sati loka vohāra siddhāsu etāsu nadī ādīsu tīsu 
PA_anya-e11_02n:177_170	abaddhasīmāsu punavaggakammaparihāratthaṃ sāsanavohārasiddhāya abaddhasīmāya paricchedaṃ	abaddha sīmāsu punavagga kamma parihāra attham sāsana vohāra siddhāya abaddha sīmāya paricchedam 
PA_anya-e11_02n:177_171	dassentoti adhippāyo. Pāḷiyaṃ “yaṃ majjhimassa purisassā”ti ādīsu udakaṃ ukkhipitvā	dassento ti adhippāyaḥ pāḷiyam yam majjhimassa purisassa āti ādīsu udakam ukkhipitvā 
PA_anya-e11_02n:177_172	khipiyati etthāti udakukkhepo, udakassa pathanokāso, tasmā udakukkhepā. Ayañhettha	ettha ati udakukkhepaḥ udakassa pathanokāsaḥ tasmai udakukkhepāḥ ayam ha ittha 
PA_anya-e11_02n:177_173	padasambandhavasena attho… “parisa pariyantato paṭṭhāya samantā yāva majjhimassa	pada sambandha vasena attho parisa pariyantataḥ paṭṭhāya samantā yāva majjhimassa 
PA_anya-e11_02n:177_174	purisassa udakukkhepo udakapatanaṭṭhānaṃ, tāva yaṃ taṃ paricchinnaṃ ṭṭhānaṃ, ayaṃ	purisassa udakukkhepaḥ udaka patana ṭhānam tāva yam tam paricchinnam ṭṭhānam ayam 
PA_anya-e11_02n:177_175	tattha nadīādīsu aparā samānasaṃvāsā udakukkhepasīmā”ti vuttaatthapadehipi samānaṃ	tattha nadī ādīsu aparā samāna saṃvāsā udakukkhepa sīmā iti vutta attha padehi pi samānam 
PA_anya-e11_02n:177_176	bhaveyya ācariyameva hi kecipana samantā abbhantaraṃ minitvā paricchedakaraṇeneva	bhaveyya hi samantā abbhantaram minitvā pariccheda karaṇena iva 
PA_anya-e11_02n:177_177	sīmā sañjāyati, na sayamevāti vadanti, taṃ na gahetabbhantyādinā kecivādaṃ paṭikkhipitvā	sīmā sañjāyati na sayam eva ati vadanti tam na keci vādam paṭikkhipitvā 
PA_anya-e11_02n:177_178	minanakhipane dosaṃ dassetvā ca yaṃ panettha abbhantaraminanappamāṇassa vālikādikhipanakammassa	minana khipane dosam dassetvā ca yam pana ittha abbhantara minana ppamāṇassa vālikā ādi khipana kammassa 
PA_anya-e11_02n:177_179	ca dassanaṃ, taṃ sayaṃjātasīmānaṃ ṭhitaṭṭhānaparicchedadassanatthaṃ kataṃ, gāmūpacāragharūpacārajānanatthaṃ	ca dassanam tam sayaṃjāta sīmānam ṭhita ṭṭhāna pariccheda dassana attham katam gāma upacāra ghara upacāra jānana attham 
PA_anya-e11_02n:177_180	leḍḍusuppādikhipanavijānanadassanaṃ viya, teneva mātikāṭṭhakathāyaṃ sīmaṃ vā bandhanti	leḍḍu suppa ādi khipana vijānana dassanam viya tena iva sīmam vā bandhanti 
PA_anya-e11_02n:177_181	udakukkhepaṃ vā pariccheda’nti vuttaṃ, evaṃ katepi tassa paricchedassa pabhavato	uda kukkhepam vā paricchedanti vuttam evam kate pi tassa paricchedassa pabhavato 
PA_anya-e11_02n:177_182	ñātuṃ asakkuṇeyyattena thūlato ñatvā antotiṭṭhantehi nirāsaṅkaṭṭhāne ṭhātabbaṃ aññaṃ	ñātum thūlataḥ ñatvā antotiṭṭhantehi nirāsaṅka ṭṭhāne ṭhātabbam aññam 
PA_anya-e11_02n:177_183	bahikarontehi atidūre nirāsaṅkaṭṭhāne pesetabbanti vā, tasmā yathā vuttasīmāpekkhavaseneva	bahi karontehi atidūre nirāsaṅka ṭṭhāne pesetabbanti vā tasmai yathā vutta sīmā apekkha vasena iva 
PA_anya-e11_02n:177_184	tāsaṃ sattabbhantaraudakukkhepasīmānaṃ uppatti, tabbigamena vināso ca gahetabboti	tāsam uppatti tad vigamena vināsaḥ ca gahetabbaḥ ti 
PA_anya-e11_02n:177_185	amhākaṃ khanti, vīmaṃsitvā gahetabbaṃ, añño vā pakāro ito yuttataro gavesitabbo’ti	amhākam khanti vīmaṃsitvā gahetabbam aññaḥ vā pakāraḥ itas yuttataraḥ gavesitabbaḥ ti 
PA_anya-e11_02n:177_186	āha. Vīmaṃsitvā gahetabbaṃ. Añño vā pakāro ito yuttataro gavesitabbo’ti iminā ācariyassa	āha vīmaṃsitvā gahetabbam aññaḥ vā pakāraḥ itas yuttataraḥ gavesitabbaḥ ti iminā ācariyassa 
PA_anya-e11_02n:177_187	vacanena imassa vacanassa attanomatibhāvañca ācariyassa apaṭisambhidāpattabhāvañca	vacanena imassa vacanassa attanomati bhāvañca ācariyassa a paṭisambhidā patta bhāvañca 
PA_anya-e11_02n:177_188	dasseti. Idañca vacanaṃ na bhagavato paccakkhavacanaṃ, nāpidhammasaṅgāhakattherānaṃ	dasseti idam ca vacanam na bhagavato paccakkha vacanam na api dhammasaṅgāhaka ttherānam 
PA_anya-e11_02n:177_189	vacanaṃ, tissopi saṅgītiyo anārūḷhā, nāpi aṭṭhakathāya saṃvaṇṇanācariyassa vādappakāsanameva	vacanam tissaḥ api saṅgītiyaḥ an ārūḷhāḥ na api aṭṭhakathāya saṃvaṇṇanā cariyassa vāda pakāsanam eva 
PA_anya-e11_02n:177_190	tasmā asallakkhitabbameva sāratthadīpaniyampi sace nadī nātidīghā hotīti imissā saṃvaṇṇanādhikāre	tasmā a sat lakkhitabbam eva sāra attha dīpaniyam pi sace nadī na ati dīghā hoti iti imissā saṃvaṇṇanā adhikāre 
PA_anya-e11_02n:177_191	udakukkhepasīmā kammaṃ natthīti yasmā sabbopi nadīpadeso bhikkhūhi ajjhotthaṭo, tasmā	udakukkhepa sīmā kammam natthi iti yasmā sabbaḥ api nadī padesaḥ bhikkhūhi ajjhotthaṭaḥ tasmā 
PA_anya-e11_02n:177_192	samantato nadiyā abhāvā udakukkhepena payojanaṃ natthī’ti vuttaṃ tathā hi samantato	samantataḥ nadiyāḥ abhāvā udakukkhepena payojanam natthi iti vuttam tathā hi samantataḥ 
PA_anya-e11_02n:177_193	nadiyā abhāvā udakukkhepena payojanaṃ natthī’tiimassa anvayavasena vā atthāpattivasena	nadiyāḥ abhāvā udakukkhepena payojanam natthi iti imassa anvaya vasena vā attha āpatti vasena 
PA_anya-e11_02n:177_194	vā samantato nadiyā bhāve sati udakukkhepena payojanaṃ attheva vaggakammaparihāratthanti	vā samantataḥ nadiyāḥ bhāve sati udakukkhepena payojanam atthā iva vagga kamma parihāra atthan ti 
PA_anya-e11_02n:177_195	attho labbhate mātikāṭṭhakathāya līnatthappakāsaniyampi “samantā udakukkhepaparicchedo	atthaḥ labbhate mātikā aṭṭhakathāya samantā udakukkhepa paricchedaḥ 
PA_anya-e11_02n:177_196	kātabboti pahonakaṭṭhānaṃ sandhāya vuttaṃ yattha pana kunnadiyaṃ nappahoti. Tattha	kātabbaḥ iti pahonaka ṭṭhānam sandhāya vuttam yattha pana kunnadiyam na pahoti tattha 
PA_anya-e11_02n:177_197	pahonakaṭṭhāne udakukkhepaparicchedo kātabbo’tivuttaṃ. Udakukkhepaparicchedo kātabbo’ti	pahonaka ṭṭhāne udakukkhepa paricchedaḥ kātabbaḥ iti vuttam udakukkhepa paricchedaḥ kātabbaḥ iti 
PA_anya-e11_02n:177_198	iminā vacanena sīmāpekkhāya saha udakukkhepaṃ vinā attano sabhāveneva nuppajjatīti	iminā vacanena sīmā apekkhāya saha udakukkhepam vinā attanaḥ sabhāvena iva nuppajjati iti 
PA_anya-e11_02n:177_199	viññāyati, tathā hi udakukkhepaparicchedake kattāre asati kathaṃ udakukkhepaparicchedo	viññāyati tathā hi udakukkhepa paricchedake kattāre asati katham udakukkhepa paricchedaḥ 
PA_anya-e11_02n:177_200	kātabbo bhaveyya tasmā “vaggakammaparihāratthaṃ sīmāpekkhāya sati eva udakukkhepasattabbhantarasīmā	kātabbaḥ bhaveyya tasmai vagga kamma parihāra attham sīmā apekkhāya sati eva udakukkhepa satta bbhantara sīmā 
PA_anya-e11_02n:177_201	uppajjanti, nāsatī’ti idaṃ vacanaṃ sāratthadīpaniyañca mātikāṭṭhakathāyañca vuttavacanehi	uppajjanti na asati iti idam vacanam sāratthadīpaniyam ca mātikāṭṭhakathāyam ca vutta vacanehi 
PA_anya-e11_02n:177_202	aññamaññaviruddhaṃ viya dissati vimativinodaniyaṃyeva ca “mahoghena pana unnataṭṭhānato	aññam añña viruddham viya dissati ca mahā oghena pana unnata ṭṭhānato 
PA_anya-e11_02n:177_203	ninnaṭṭhāne patantena khato khuddako vā mahanto vā lakkhaṇayutto jātassarova etthāpi	ninna ṭṭhāne patantena khataḥ khuddakaḥ vā mahantaḥ vā lakkhaṇa yuttaḥ ettha api 
PA_anya-e11_02n:177_204	khuddake udakukkhepakiccaṃ natthi samudde pana sabbathā udakukkhepasīmāyameva kammaṃ	khuddake udakukkhepa kiccam natthi samudde pana sabbathā udakukkhepa sīmāyam eva kammam 
PA_anya-e11_02n:177_205	kātabbaṃ, sodhetuṃ dukkarattā”ti vuttaṃ tathā hi ayamācariyavaro pubbe “vaggakammaparihāratthaṃ	kātabbam sodhetum dukkara ttā iti vuttam tathā hi ayam ācariya varaḥ pubbe vagga kamma parihāra attham 
PA_anya-e11_02n:177_206	sīmāpekkhāya sati eva udakukkhepasattabbhantarasīmā uppajjanti, nāsatī”ti vatvā parato	sīmā apekkhāya sati eva udakukkhepa satta abbhantara sīmāḥ uppajjanti na asati iti vatvā paratas 
PA_anya-e11_02n:177_207	kathamācariyavarena “etthāpi khuddake udakukkhepakiccaṃ natthi”tyādivacanamuccate,	katham ācariya varena ettha api khuddake udakukkhepa kiccam na tthi ityādi vacanam uccate 
PA_anya-e11_02n:177_208	tatthāyaṃ viggaho udakaṃ ukkhipitvā khipīyati etthāti udakukkhepo udakassa patanokāso	tattha ayam viggahaḥ udakam ukkhipitvā khipīyati ettha ati udakukkhepaḥ udakassa patana ukāsaḥ 
PA_anya-e11_02n:177_209	kintuṃ, ṭhānaṃ karitabbaṃ kiccaṃ kara karaṇeti dhātu riccapaccayo yaṃ. “Ajjeva kiccaṃ	kintum ṭhānam karitabbam kiccam kara karaṇa iti dhātu ricca paccayaḥ yam ajja iva kiccam 
PA_anya-e11_02n:177_210	ātappa”nti yathā, udakukkhepassa kiccaṃ karaṇaṃ udakukkhepakiccaṃ. Samudde panā ti	ātappanti yathā udakukkhepassa kiccam karaṇam udakukkhepa kiccam samudde pana ti 
PA_anya-e11_02n:177_211	ettha pana saddo visesattho, pakkhantaratthotipi apare visesatthe pana nadījātassaresu	ettha pana saddo visesa atthaḥ pakkhantara tthaḥ ti pi apare visesa atthe pana nadī jātassaresu 
PA_anya-e11_02n:177_212	mahantesu udakukkhepasīmāyameva kātabbaṃ, khuddake pana kevale nadījātassarepi kātabbaṃ	mahantesu udakukkhepa sīmāyam eva kātabbam khuddake pana kevale kātabbam 
PA_anya-e11_02n:177_213	samudde pana visesato udakukkhepasīmāyameva kātabbanti ayaṃ pana saddassa visesattho.	samudde pana visesataḥ udakukkhepa sīmāyam eva kātabban ti ayam pana saddassa visesa attho 
PA_anya-e11_02n:177_214	Sabbathā ti sabbena sabbaṃ. Udakukkhepasīmāyamevā ti ettha evakāro sanniṭṭhānattho,	sabbathā ti sabbena sabbam udakukkhepa sīmā ayam eva ti ettha evakāraḥ sanniṭṭhāna atthaḥ 
PA_anya-e11_02n:177_215	udakukkhepasīmāyameva kammaṃ kātabbaṃ, na samuddasīmāya kadācīti attho yujjateva.	udakukkhepa sīmāyam eva kammam kātabbam na samudda sīmāya kadāci iti atthaḥ yujjatā iva 
PA_anya-e11_02n:177_216	Nadījātassaresu pana mahantesu udakukkhepasīmāya kātabbaṃ, khuddake nadījātassareyeva	nadī jātassaresu pana mahantesu udakukkhepa sīmāya kātabbam khuddake 
PA_anya-e11_02n:177_217	na kātabbanti ayaṃ attho sāmatthiyato labbhateva nadījātassaresu khuddakamahantabhāvena	na kātabban ti ayam atthaḥ sāmatthiyataḥ labbhate iva nadī jātassaresu khuddaka mahanta bhāvena 
PA_anya-e11_02n:177_218	nadījātassaraudakukkhepāti dve dve sīmā labbhanti samudde pana kasmā samuddaudakukkhepavasena	dve dve sīmāḥ labbhanti samudde pana kasmā samudda odakukkhepa vasena 
PA_anya-e11_02n:177_219	dve na labbhantīti samudde pana kasmā samuddaudakukkhepavasena dve na labbhantīti	dve na labbhanti iti samudde pana kasmā samudda odakukkhepa vasena dve na labbhanti iti 
PA_anya-e11_02n:177_220	codanaṃ manasisandhāyāha “sodhetuṃ dukkarattā”ti. Tattha sodhetuṃ dukkarattā ti samuddassa	codanam manasisandhāya āha sodhetum dukkara ttā ati tattha sodhetum dukkara ttā ti samuddassa 
PA_anya-e11_02n:177_221	atimahantabhāvena samuddamotiṇṇe bhikkhū hatthapāsanayanaṃ vā bahisamuddakaraṇaṃ	ati mahanta bhāvena samudda motiṇṇe bhikkhū hattha pāsa nayanam vā bahi samudda karaṇam 
PA_anya-e11_02n:177_222	vā kātuṃ atidukkaraṃ tasmā sabbathā sabbena sabbaṃ udakukkhepasīmāyameva kātabbanti	vā kātum ati dukkaram tasmā sabbathā sabbena sabbam udakukkhepa sīmāyam eva kātabbanti 
PA_anya-e11_02n:177_223	ayamācariyavarassa adhippāyo. Yadi vaggakammaparihāratthaṃ sīmāpekkhāya sati eva	ayam ācariya varassa adhippāyaḥ yadi vagga kamma parihāra attham sīmā apekkhāya sati eva 
PA_anya-e11_02n:177_224	udakukkhepasīmā uppajjeyya, evaṃ sati samuddamotiṇṇe bhikkhusamūheva hatthapāsato	udakukkhepa sīmā uppajjeyya evam sati samudda motiṇṇe bhikkhu samūha iva hattha pāsataḥ 
PA_anya-e11_02n:177_225	bahi kareyya, evañca sati sodhetuṃ dukkarattā’ti hetupadampi niratthakaṃ bhaveyya	bahi kareyya evam ca sati sodhetum hetu padam pi niratthakam bhaveyya 
PA_anya-e11_02n:177_226	na panevaṃ sakkā vattuṃ, tena ñāyati “vaggakammaparihāratthaṃ udakukkhepapayojana”nti.	na pana evam sakkā vattum tena ñāyati vagga kamma parihāra attham udakukkhepa payojanam ti 
PA_anya-e11_02n:177_227	Apica tesaṃ ācariyānaṃ adhippāyena “mayaṃ udakukkhepasīmāya na karoma, kevalaṃ samuddeyeva	apica tesam ācariyānam adhippāyena mayam udakukkhepa sīmāya na karoma kevalam 
PA_anya-e11_02n:177_228	karomā”ti icchamāne sati kathaṃ karissanti. Tasmā tesaṃ matena sīmāpekkhāya saheva	karoma iti icchamāne sati katham karissanti tasmā tesam matena sīmā apekkhāya saha iva 
PA_anya-e11_02n:177_229	udakukkhepasīmāya sambhavato gatagataṭṭhāne udakukkhepasīmā bhaveyya evañca sati	udakukkhepa sīmāya sambhavataḥ gata gata ṭṭhāne udakukkhepa sīmā bhaveyya evam ca sati 
PA_anya-e11_02n:177_230	“samudde pana sabbathā udakukkhepasīmāyameva kammaṃ kātabbaṃ, sodhetuṃ dukkarattā”ti	samudde pana sabbathā udakukkhepa sīmāyam eva kammam kātabbam sodhetum dukkara ttā ati 
PA_anya-e11_02n:177_231	vacanampi niratthakaṃ bhaveyya evañca pana vadeyya… sabbaso samuddasīmāya alabbhamānataṃ	vacanam pi niratthakam bhaveyya evam ca pana vadeyya sabbaso samudda sīmāya a labbha māna tam 
PA_anya-e11_02n:177_232	sandhāya “samudde panā”tyādivacanaṃ ācariyavarena vuttanti tathāpi na vattabbaṃ kasmā	sandhāya samudde pana ati ādi vacanam ācariya varena vuttan ti tathā api na vattabbam kasmā 
PA_anya-e11_02n:177_233	evañca atthe icchamāne sati “samudde pana sabbattha udakukkhe pasīmāva labbhatī”ti	evam ca atthe icchamāne sati samudde pana sabbattha uda kukkhe pasīmā ava labbhati iti 
PA_anya-e11_02n:177_234	vattabbaṃ siyā nanevaṃ vuttaṃ. Athavā pakaraṇādivasena saddatthe vibhajjīyamānepi	vattabbam siyā nanu ivam vuttam athavā pakaraṇa ādi vasena saddatthe 
PA_anya-e11_02n:177_235	virujjhateva kathaṃ saṃyogavasena “savacchaṃ dhenumānehī”ti vutte “gāvī”ti viññāyati,	virujjhatā iva katham saṃyoga vasena sa vaccham dhenu mānehi iti vutte gāvī iti viññāyati 
PA_anya-e11_02n:177_236	na vaḷavā. “Avacchaṃ dhenu”nti vutte gāvīti viññāyati, na vaḷavāti ettha viya kadācipi	na vaḷavā avaccham dhenun ti vutte gāvī iti viññāyati na vaḷavā ti ettha viya kadācipi 
PA_anya-e11_02n:177_237	evasaddena nivattetabbassa samuddassa nadiyamiva nātidīghabhāve alabbhamāne sati	eva saddena nivattetabbassa samuddassa nadiyam iva na ati dīgha bhāve a labbhamāne sati 
PA_anya-e11_02n:177_238	“samudde pana sabbathā udakukkhepasīmāyameva kammaṃ kātabba”nti evakārena avattabbaṃ	samudde pana sabbathā udakukkhepa sīmāyam eva kammam kātabbanti evakārena avattabbam 
PA_anya-e11_02n:177_239	siyā, tathā hi saṃyogavippayogavasena “savacchaṃ dhenuṃ, avacchaṃ dhenu”nti vutte	siyā tathā hi saṃyoga vippayoga vasena savaccham dhenum avaccham dhenum ti vutte 
PA_anya-e11_02n:177_240	gāvīti viññāyati, na vaḷavā. Vaḷavā ca nāma yonimaggassa atisambādhattā vijāyituṃ	gāvī iti viññāyati na vaḷavā vaḷavā ca nāma yoni maggassa atisambādhattā vijāyitum 
PA_anya-e11_02n:177_241	na sakkonti, gabbhassa pariṇatakāle kucchiṃ phāletvā ājaññapotakaṃ gaṇhanti evaṃ	na sakkonti gabbhassa pariṇata kāle kucchim phāletvā ājañña potakam gaṇhanti evam 
PA_anya-e11_02n:177_242	ekagabbheneva maranti tasmā “vaḷavaṃ savaccha”ntivā avaccha”nti vā vattuṃ nārahati	eka gabbhena iva maranti tasmai vaḷavam a vacchanti vā vattum na ārahati 
PA_anya-e11_02n:177_243	evameva kadācipi nātidīghasamuddassapi anupalabbhamānattā taṃ nivattāpakena evasaddena	evam eva kadācipi na ati dīgha samuddassa api an upalabbhamāna ttā tam nivattāpakena eva saddena 
PA_anya-e11_02n:177_244	“samudde pana sabbathā udakukkhepasīmāyameva kammaṃ kātabba”nti apadisituṃ nārahatiyeva	samudde pana sabbathā udakukkhepa sīmāyam eva kammam kātabbanti apadisitum 
PA_anya-e11_02n:177_245	tasmā udakukkhepena sīmā uppajjatīti niṭṭhametthāva gantabbaṃ tena vuttaṃ “evañca	tasmai udakukkhepena sīmā uppajjati iti niṭṭham ettha ava gantabbam tena vuttam evam ca 
PA_anya-e11_02n:177_246	atthe icchamāne sati samudde pana sabbathā udakukkhepasīmāva labbhatīti vattabbaṃ	atthe icchamāne sati samudde pana sabbathā udakukkhepa sīmā ava labbhati iti vattabbam 
PA_anya-e11_02n:177_247	siyā na panevaṃ vutta”nti tena ñāyati vaggakammaparihāratthaṃ vālikādīhi khipananti	siyā na pana evam vuttanti tena ñāyati vagga kamma parihāra attham vālikā ādīhi khipananti 
PA_anya-e11_02n:177_248	apica vimativinodaniyaṃyeva “gacchantiyā pana nāvāya kātuṃ na vaṭṭati. Kasmā udakukkhepamattameva	apica gacchantiyā pana nāvāya kātum na vaṭṭati kasmai uda kukkhepa mattam eva 
PA_anya-e11_02n:177_249	hi sīmā, taṃ nāvā sīghameva atikkameti evaṃ sati aññissā sīmāya ñatti, aññissā anusāvanā	hi sīmā tam nāvā sīgham eva atikkameti evam sati aññissā sīmāya ñatti aññissā anusāvanā 
