segmentnr	original	analyzed
PA_anya-e09_02n:552_5	bhaṇḍanajātā kalahajātā vivādāpannā aññamaññaṃ mukhasattīhi vitudantā viharanti…pe…	bhaṇḍana jātā kalaha jātā vivāda āpannāḥ aññam aññam mukha sattīhi vitudantāḥ viharanti pe 
PA_anya-e09_02n:552_6	bhinnathūpe appaṭisaraṇe’ti. Tassa mayhaṃ bhante evaṃ hoti ‘māheva bhagavato accayena	bhinna thūpe appaṭisaraṇā iti tassa mayham bhante evam hoti mā aha iva bhagavataḥ accayena 
PA_anya-e09_02n:552_7	saṅghe vivādo uppajji, svāssa vivādo bahujanaahitāya bahujanaasukhāya bahuno janassa	saṅghe vivādaḥ uppajji vivādaḥ bahu jana ahitāya bahu jana asukhāya bahunaḥ janassa 
PA_anya-e09_02n:552_8	anatthāya ahitāya dukkhāya devamanussāna’nti”. Tasmiṃ bhante vatthusmiṃ bhāsitaṃ.	anatthāya ahitāya dukkhāya deva manussānam ti tasmim bhante vatthusmim bhāsitam 
PA_anya-e09_02n:553	Sunakkhattasutta	sunakkhattasutta 
PA_anya-e09_02n:554	Pucchā – sunakkhattasuttaṃ panāvuso bhagavatā kattha kaṃ ārabbha kismiṃ vatthusmiṃ bhāsitaṃ.	pucchā sunakkhatta suttam pana āvuso bhagavatā kattha kam ārabbha kismim vatthusmim bhāsitam 
PA_anya-e09_02n:555_0	Vissajjanā – vesāliyaṃ bhante sunakkhattaṃ licchaviputtaṃ ārabbha bhāsitaṃ, sunakkhatto	vissajjanā vesāliyam bhante sunakkhattam licchavi puttam ārabbha bhāsitam sunakkhatto 
PA_anya-e09_02n:555_1	bhante licchaviputto bhagavantaṃ upasaṅkamitvā etadavoca “sutaṃ metaṃ bhante sambahulehi	bhante licchavi puttaḥ bhagavantam upasaṅkamitvā etat avoca sutam mā etam bhante sambahulehi 
PA_anya-e09_02n:555_2	kira bhikkhūhi bhagavato santike aññā byākatā khīṇā jāti, vusitaṃ brahmacariyaṃ,	kira bhikkhūhi bhagavato santike aññā byākatā khīṇā jāti vusitam brahmacariyam 
PA_anya-e09_02n:555_3	kataṃ karaṇīyaṃ, nāparaṃ itthattāyāti pajānāmāti. Kacci te bhante bhikkhū sammadeva	katam karaṇīyam na aparam itthattāya ati pajānāma ati kacci te bhante bhikkhū sammat eva 
PA_anya-e09_02n:555_4	aññaṃ byākaṃsu, udāhu santetthekacce bhikkhū adhimānena aññaṃ byākaṃsū”ti, tasmiṃ	aññam byākaṃsu udāhu santā itthā ekacce bhikkhū adhimānena aññam byākaṃsu iti tasmin 
PA_anya-e09_02n:555_5	bhante vatthusmiṃ bhāsitaṃ.	bhante vatthusmim bhāsitam 
PA_anya-e09_02n:556	Āneñjasappāyasutta	āneñja sappāya sutta 
PA_anya-e09_02n:557	Pucchā – āneñjasappāyasuttaṃ panāvuso bhagavatā kattha kaṃ ārabbha kismiṃ vatthusmiṃ bhāsitaṃ.	pucchā āneñjasappāya suttam pana āvuso bhagavatā kattha kam ārabbha kismim vatthusmim bhāsitam 
PA_anya-e09_02n:558	Vissajjanā – kurūsu bhante kammāsadhamme nāma kurūnaṃ nigame sambahule bhikkhū ārabbha bhāsitaṃ.	vissajjanā kurūsu bhante kammāsadhamme nāma kurūnam nigame sambahule bhikkhū ārabbha bhāsitam 
PA_anya-e09_02n:559	Gaṇakammoggallānasutta	gaṇa kammoggallāna sutta 
PA_anya-e09_02n:560	Pucchā – gaṇakamoggallānasuttaṃ panāvuso bhagavatā kattha kaṃ ārabbha kismiṃ vatthusmiṃ bhāsitaṃ.	pucchā gaṇakamoggallāna suttam pana āvuso bhagavatā kattha kam ārabbha kismim vatthusmim bhāsitam 
PA_anya-e09_02n:561_0	Vissajjanā – sāvatthiyaṃ bhante gaṇakamoggallānaṃ brāhmaṇaṃ ārabbha bhāsitaṃ, gaṇakamoggallāno	vissajjanā sāvatthiyam bhante gaṇakamoggallānam brāhmaṇam ārabbha bhāsitam gaṇakamoggallānaḥ 
PA_anya-e09_02n:561_1	bhante brāhmaṇo bhagavantaṃ upasaṅkamitvā etadavoca “seyyāthāpi bho gotama imassa	bhante brāhmaṇaḥ bhagavantam upasaṅkamitvā etat avoca seyyātha api bho gotamaḥ imassa 
PA_anya-e09_02n:561_2	migāramātupāsādassa dissati anupubbasikkhā anupubbakiriyā anupubbapaṭipadā yadidaṃ	migāra mātu pāsādassa dissati anupubba sikkhā anupubba kiriyā anupubba paṭipadā yat idam 
PA_anya-e09_02n:561_3	yāva pacchimasopānakaḷevarā…pe… sakkā nukho bho gotama imasmimpi dhammavinaye evameva	yāva pacchima sopānaka ḷevarāpe sakkā nu kho bho gotama imasmimpi dhamma vinaye evam eva 
PA_anya-e09_02n:561_4	anupubbasikkhā anupubbakiriyā anupubbapaṭipadā paññapetu”nti, tasmiṃ bhante vatthusmiṃ bhāsitaṃ.	anupubba sikkhāḥ anupubba kiriyāḥ anupubba paṭipadā paññapetunti tasmim bhante vatthusmim bhāsitam 
PA_anya-e09_02n:562	Pucchā – evaṃ vutte kho āvuso gaṇakamoggallāno brāhmaṇo bhagavantaṃ kiṃ avoca, kathañcassa bhagavā byākāsi.	pucchā evam vutte kho āvuso gaṇakamoggallānaḥ brāhmaṇaḥ bhagavantam kim avoca katham ca assa bhagavā byākāsi 
PA_anya-e09_02n:563_0	Vissajjanā – evaṃ vutte bhante gaṇakamoggallāno brāhmaṇo bhagavantaṃ etadavoca “kiṃ	vissajjanā evam vutte bhante gaṇakamoggallānaḥ brāhmaṇaḥ bhagavantam etat avoca kim 
PA_anya-e09_02n:563_1	nu kho bhoto gotamassa sāvakā bhotā gotamena evaṃ ovadīyamānā evaṃ anusāsīyamānā	nu kho bhoto gotamassa sāvakāḥ bhotā gotamena evam ovadīyamānāḥ evam anusāsīyamānāḥ 
PA_anya-e09_02n:563_2	sabbe accantaṃ niṭṭhaṃ nibbānaṃ ārodhenti, udāhu ekacce nārādhentī”ti, bhagavā ca	sabbe accantam niṭṭham nibbānam ārodhenti udāhu ekacce na ārādhenti iti bhagavā ca 
PA_anya-e09_02n:563_3	bhante “appekacce kho brāhmaṇa mama sāvakā mayā evaṃ ovadīyamānā evaṃ anusāsīyamānā	bhante appekacce kho brāhmaṇa mama sāvakāḥ mayā evam ovadīyamānāḥ evam anusāsīyamānā 
PA_anya-e09_02n:563_4	accantaṃ niṭṭhaṃ nibbānaṃ ārādhenti, ekacce nārādhentī”ti evamādinā gaṇakamoggallānassa	accantam niṭṭham nibbānam ārādhenti ekacce na ārādhenti iti evamādinā gaṇaka moggallānassa 
PA_anya-e09_02n:563_5	brāhmaṇassa byākāsi.	brāhmaṇassa byākāsi 
PA_anya-e09_02n:564	Pucchā – imañca panāvuso dhammadesanaṃ sutvā gaṇako moggallāno imasmiṃ dhammavinaye pasanno kīdisaṃ pasannākāramakāsi.	pucchā imam ca pana āvuso dhamma desanam sutvā gaṇakaḥ moggallānaḥ imasmin dhamma vinaye pasannaḥ kīdisam pasanna ākāram akāsi 
PA_anya-e09_02n:565_0	Vissajjanā – imañca pana bhante dhammadesanaṃ sutvā gaṇakamoggallāno brāhmaṇo “ye	vissajjanā imam ca pana bhante dhamma desanam sutvā gaṇakamoggallānaḥ brāhmaṇaḥ ye 
PA_anya-e09_02n:565_1	me bho gotama puggalā asaddhā jīvikatthā na saddhā agārasmā anagāriyaṃ pabbajitā”ti	me bho gotama puggalāḥ asaddhāḥ jīvikatthāḥ na saddhāḥ agārasma anagāriyam pabbajitā ati 
PA_anya-e09_02n:565_2	evamādinā imasmiṃ dhammavinaye pasanno pasannākāramakāsi.	evamādinā imasmin dhamma vinaye pasannaḥ pasanna ākāram akāsi 
PA_anya-e09_02n:566	Gopakamoggallānasutta	gopaka moggallāna sutta 
PA_anya-e09_02n:567	Pucchā – gopakamoggallānasuttaṃ panāvuso kattha kaṃ ārabbha kismiṃ vatthusmiṃ kena bhāsitaṃ.	pucchā gopakamoggallāna suttam pana āvuso kattha kam ārabbha kismim vatthusmim kena bhāsitam 
PA_anya-e09_02n:568_0	Vissajjanā – rājagahe bhante gopakamoggallānaṃ brāhmaṇaṃ ārabbha āyasmatā ānandattherena	vissajjanā rājagahe bhante gopakamoggallānam brāhmaṇam ārabbha āyasmatā ānandattherena 
PA_anya-e09_02n:568_1	dhammabhaṇḍāgārikena bhāsitaṃ, gopakamoggallāno bhante brāhmaṇo āyasmantaṃ ānandaṃ	dhammabhaṇḍāgārikena bhāsitam gopakamoggallānaḥ bhante brāhmaṇaḥ āyasmantam ānandam 
PA_anya-e09_02n:568_2	etadavoca “atthi nu kho bho ānanda ekabhikkhupi tehi dhammehi sabbena sabbaṃ sabbathā	etat avoca atthi nu kho bho ānanda eka bhikkhu pi tehi dhammehi sabbena sabbam sabbathā 
PA_anya-e09_02n:568_3	sabbaṃ samannāgato, yehi dhammehi samannāgato so bhavaṃ gotamo ahosi arahaṃ sammāsambuddho”ti,	sabbam samannāgataḥ yehi dhammehi samannāgataḥ saḥ bhavam gotamaḥ ahosi araham sammāsambuddhaḥ ti 
PA_anya-e09_02n:568_4	tasmiṃ bhante vatthusmiṃ bhāsitaṃ.	tasmin bhante vatthusmin bhāsitam 
PA_anya-e09_02n:569_0	Pucchā – kathañcāvuso tattha āyasmatā ānandattherena dhammabhaṇḍāgārikena bhikkhuno	pucchā kathan ca āvuso tattha āyasmatā ānanda therena dhammabhaṇḍāgārikena bhikkhuno 
PA_anya-e09_02n:569_1	pasādanīyā dhammā pakāsitā, ye tena bhagavatā jānatā passatā arahatā sammāsambuddhena	pasādanīyāḥ dhammāḥ pakāsitāḥ ye tena bhagavatā jānatā passatā arahatā sammāsambuddhena 
PA_anya-e09_02n:569_2	akkhātā. Yehi ca samannāgataṃ bhikkhuṃ aññe bhikkhū sakkareyyuṃ garuṃ kareyyuṃ māneyyuṃ	akkhātā yehi ca samannāgatam bhikkhum aññe bhikkhū sakkareyyum garum kareyyum māneyyum 
PA_anya-e09_02n:569_3	pūjeyyuṃ sakkatvā garuṃ katvā upanissāya vihareyyuṃ.	pūjeyyum sakkatvā garum katvā upanissāya vihareyyum 
PA_anya-e09_02n:570_0	Vissajjanā – idha brāhmaṇa bhikkhu sīlavā hoti, pātimokkhasaṃvarasaṃvuto viharati	vissajjanā idha brāhmaṇa bhikkhu sīlavā hoti pātimokkha saṃvara saṃvutaḥ viharati 
PA_anya-e09_02n:570_1	ācāragocarasampanno aṇumattesu vajjesu bhayadassāvī, samādāya sikkhati sikkhāpadesu,	ācāra gocara sampannaḥ aṇumattesu vajjesu bhaya dassāvī samādāya sikkhati sikkhāpadesu 
PA_anya-e09_02n:570_2	bahussuto hoti sutadharo sutasannicayo, yeme dhammā ādikalyāṇā majjhekalyāṇā pariyosānakalyāṇā	bahu sutaḥ hoti suta dharaḥ suta sannicayaḥ ye me dhammā ādi kalyāṇā majjhe kalyāṇā pariyosāna kalyāṇā 
PA_anya-e09_02n:570_3	sātthaṃ sabyañjanaṃ kevalaparipuṇṇaṃ parisuddhaṃ brahmacariyaṃ abhivadanti, tathārūpassa	sa attham sa byañjanam kevala paripuṇṇam parisuddham brahmacariyam abhivadanti tathārūpassa 
PA_anya-e09_02n:570_4	dhammā bahussutā honti dhātā vacasā paricitā manasānupekkhitā diṭṭhiyā suppaṭividdhāti	dhammāḥ bahu ssutāḥ honti dhātā vacasā paricitāḥ manasā anupekkhitāḥ diṭṭhiyā suppaṭividdhā ati 
PA_anya-e09_02n:570_5	evamādinā bhante tattha āyasmatā ānandattherena dhammabhaṇḍāgārikena dasa pasādanīyā	evamādinā bhante tattha āyasmatā ānanda therena dhammabhaṇḍāgārikena dasa pasādanīyā 
PA_anya-e09_02n:570_6	dhammā pakāsitā. Ye tena bhagatā jānatā passatā arahatā sammāsambuddhena akkhātā,	dhammā pakāsitāḥ ye tena bhagatā jānatā passatā arahatā sammāsambuddhena akkhātā 
PA_anya-e09_02n:570_7	yehi samannāgataṃ bhikkhuṃ etarahi bhikkhū sakkareyyuṃ garuṃ kareyyuṃ māneyyuṃ pūjeyyuṃ	yehi samannāgatam bhikkhum etarahi bhikkhū sakkareyyum garum kareyyum māneyyum pūjeyyum 
PA_anya-e09_02n:570_8	sakkatvā garuṃ katvā upanissāya vihareyyuṃ.	sakkatvā garum katvā upanissāya vihareyyuṃ 
PA_anya-e09_02n:571_0	Pucchā – evaṃ vutte kho āvuso vassakāro brāhmaṇo magadhamahāmatto kīdisaṃ pasaṃsāvacanaṃ	pucchā evam vutte kho āvuso vassakāraḥ brāhmaṇaḥ magadha mahāmatto kīdisam pasaṃsā vacanam 
PA_anya-e09_02n:571_1	kathesi, kathañcassa āyasmā ānandatthero dhammabhaṇḍāgāriko taṃ vacanaṃ paṭisodhetvā pakāsesi.	kathesi katham ca assa āyasman ānanda theraḥ dhammabhaṇḍāgāriko tam vacanam paṭisodhetvā pakāsesi 
PA_anya-e09_02n:572_0	Vissajjanā – evaṃ vutte vassakāro brāhmaṇo magadhamahāmatto upanandaṃ senāpatiṃ āmantesi	vissajjanā evam vutte vassakāraḥ brāhmaṇaḥ magadha mahāmattaḥ upanandam senāpatim āmantesi 
PA_anya-e09_02n:572_1	“taṃ kiṃ maññasi bhavaṃ senāpati, yadi me bhonto sakkātabbaṃ sakkaronti, garuṃ kātabbaṃ	tam kim maññasi bhavam senāpati yadi me bhonto sakkātabbam sakkaronti garum kātabbam 
PA_anya-e09_02n:572_2	garuṃ karonti, mānetabbaṃ mānenti, pūjetabbaṃ pūjentī”ti evamādikaṃ pasaṃsāvacanaṃ	garum karonti mānetabbam mānenti pūjetabbam pūjenti iti evamādikam pasaṃsā vacanam 
PA_anya-e09_02n:572_3	kathesi, āyasmā ca bhante ānando “na ca kho brāhmaṇa so bhagavā sabbaṃ jhānaṃ vaṇṇesi,	kathesi āyasmā ca bhante ānandaḥ na ca kho brāhmaṇa so bhagavā sabbam jhānam vaṇṇesi 
PA_anya-e09_02n:572_4	napi so bhagavā sabbaṃ jhānaṃ na vaṇṇesī”ti evamādinā taṃ vacanaṃ paṭisodhetvā pakāsesi.	na api so bhagavā sabbam jhānam na vaṇṇesi iti evamādinā tam vacanam paṭisodhetvā pakāsesi 
PA_anya-e09_02n:573	Mahāpuṇṇamasutta	mahāpuṇṇama sutta 
PA_anya-e09_02n:574	Pucchā – mahāpuṇṇamasuttaṃ panāvuso bhagavatā kattha kaṃ ārabbha kismiṃ vatthusmiṃ bhāsitaṃ.	pucchā mahāpuṇṇama suttam pana āvuso bhagavatā kattha kam ārabbha kismim vatthusmim bhāsitam 
PA_anya-e09_02n:575	Vissajjanā – sāvatthiyaṃ bhante aññataraṃ saṭṭhimattānaṃ padhānīyabhikkhūnaṃ saṅghattheraṃ bhikkhuṃ ārabbha bhāsitaṃ, aññataro bhante	vissajjanā sāvatthiyam bhante aññataram saṭṭhimattānam padhānīya bhikkhūnam saṅghattheram bhikkhum ārabbha bhāsitaṃ aññataraḥ bhante 
PA_anya-e09_02n:576_0	Saṭṭhimattānaṃ padhānīyabhikkhūnaṃ saṅghatthero bhikkhu uṭṭhāyāsanā ekaṃsaṃ cīvaraṃ	saṭṭhimattānam padhānīya bhikkhūnam saṅgha ttheraḥ bhikkhu uṭṭhāya āsanā eka aṃsam cīvaraṃ 
PA_anya-e09_02n:576_1	katvā yena bhagavā tenañjaliṃ paṇāmetvā bhagavantaṃ etadavoca “puccheyyāhaṃ bhante	katvā yena bhagavā tena añjalim paṇāmetvā bhagavantam etat avoca puccheyya aham bhante 
PA_anya-e09_02n:576_2	bhagavantaṃ kiñcideva desaṃ, sace me bhagavā okāsaṃ karoti pañhassa veyyākaraṇāyā”ti,	bhagavantam kiñcid eva desam sace me bhagavā okāsam karoti pañhassa veyyākaraṇāya ati 
PA_anya-e09_02n:576_3	tasmiṃ bhante vatthusmiṃ bhāsitaṃ.	tasmin bhante vatthusmin bhāsitam 
PA_anya-e09_02n:577	Cūḷapuṇṇamasutta	cūḷapuṇṇama sutta 
PA_anya-e09_02n:578	Pucchā – cūḷapuṇṇamasuttaṃ panāvuso bhagavatā kattha kaṃ ārabbha bhāsitaṃ.	pucchā cūḷapuṇṇama suttam pana āvuso bhagavatā kattha kam ārabbha bhāsitam 
PA_anya-e09_02n:579	Vissajjanā – sāvatthiyaṃ bhante sambahule bhikkhū ārabbha bhāsitaṃ.	vissajjanā sāvatthiyam bhante sambahule bhikkhū ārabbha bhāsitam 
PA_anya-e09_02n:580	Pucchā – kathañcāvuso tattha bhagavatā asappurisaaṅgāni vibhajitvā pakāsitāni.	pucchā kathañca āvuso tattha bhagavatā asappurisa aṅgāni vibhajitvā pakāsitāni 
PA_anya-e09_02n:581_0	Vissajjanā – asappuriso bhikkhave assaddhammasamannāgato hoti, asappurisabhatti hoti,	vissajjanā asappurisaḥ bhikkhave assaddhamma samannāgataḥ hoti asappurisa bhattī hoti 
PA_anya-e09_02n:581_1	asappurisacintī hoti, asappurisamantī hoti, asappurisavāco hoti, asappurisakammanto	a sappurisa cintī hoti a sappurisa mantī hoti a sappurisa vācaḥ hoti a sappurisa kammanto 
PA_anya-e09_02n:581_2	hoti, asappurisadiṭṭhi hoti, asappurisadānaṃ detīti evamādinā bhante tattha bhagavatā	hoti a sappurisa diṭṭhi hoti a sappurisa dānam deti iti evamādinā bhante tattha bhagavatā 
PA_anya-e09_02n:581_3	aṭṭha asappurisaaṅgāni vibhajitvā pakāsitāni.	aṭṭha asappurisa aṅgāni vibhajitvā pakāsitāni 
PA_anya-e09_02n:582	Pucchā – kathaṃ panāvuso bhagavatā tattha sappurisaaṅgāni vibhajitvā pakāsitāni.	pucchā katham pana āvuso bhagavatā tattha sappurisa aṅgāni vibhajitvā pakāsitāni 
PA_anya-e09_02n:583_0	Vissajjanā – sappuriso bhikkhave saddhammasamannāgato hoti, sappurisabhatti hoti,	vissajjanā sappurisaḥ bhikkhave saddhamma samannāgataḥ hoti sappurisa bhattī hoti 
PA_anya-e09_02n:583_1	sappurisacintī hoti, sappurisamantī hoti, sappurisavāco hoti, sappurisakammanto hoti,	sappurisa cintī hoti sappurisa mantī hoti sappurisa vācaḥ hoti sappurisa kammanto hoti 
PA_anya-e09_02n:583_2	sappurisadiṭṭhi hoti, sappurisadānaṃ detīti evamādinā bhante bhagavatā tattha aṭṭhavidhāni	sappurisa diṭṭhi hoti sappurisa dānam deti iti evamādinā bhante bhagavatā tattha aṭṭhavidhāni 
PA_anya-e09_02n:583_3	sappurisaṅgāni vibhajitvā pakāsitāni.	sappurisaṅgāni vibhajitvā pakāsitāni 
PA_anya-e09_02n:584	Anupadasutta	anupada sutta 
PA_anya-e09_02n:585	Pucchā – anupadasuttaṃ panāvuso bhagavatā kattha kaṃ ārabbha kismiṃ vatthusmiṃ bhāsitaṃ.	pucchā anupada suttam pana āvuso bhagavatā kattha kam ārabbha kismim vatthusmim bhāsitam 
PA_anya-e09_02n:586_0	Vissajjanā – sāvatthiyaṃ bhante sambahule bhikkhū ārabbha bhāsitaṃ, sambahulā bhante	vissajjanā sāvatthiyam bhante sambahule bhikkhū ārabbha bhāsitam sambahulāḥ bhante 
PA_anya-e09_02n:586_1	bhikkhū āyasmato sāriputtassa dhammasenāpatissa sabhāgā tasmiṃ samaye sannipatiṃsu,	bhikkhū āyasmataḥ sāriputtassa dhamma senāpatissa sabhāgā tasmin samaye sannipatiṃsu 
PA_anya-e09_02n:586_2	tasmiṃ bhante vatthusmiṃ bhāsitaṃ.	tasmin bhante vatthusmin bhāsitam 
PA_anya-e09_02n:587	Pucchā – kathañcāvuso tattha bhagavatā āyasmato sāriputtassa dhammasenāpatissa anupadadhammavipassanā vitthārena vibhajitvā pakāsitā.	pucchā katham ca āvuso tattha bhagavatā āyasmataḥ sāriputtassa dhamma senāpatissa anupada dhamma vipassanā vitthārena vibhajitvā pakāsitā 
PA_anya-e09_02n:588_0	Vissajjanā – paṇḍito bhikkhave sāriputto mahāpañño bhikkhave sāriputto puthupañño	vissajjanā paṇḍitaḥ bhikkhave sāriputtaḥ mahā paññaḥ bhikkhave sāriputto puthu pañño 
PA_anya-e09_02n:588_1	bhikkhave sāriputto hāsapañño bhikkhave sāriputto tikkhapañño bhikkhave sāriputto	bhikkhave sāriputto hāsa paññaḥ bhikkhave sāriputto tikkha paññaḥ bhikkhave sāriputto 
PA_anya-e09_02n:588_2	javanapañño bhikkhave sāriputto nibbedhikapañño bhikkhave sāriputto sāriputto bhikkhave	javana paññaḥ bhikkhave sāriputto nibbedhika paññaḥ bhikkhave sāriputto sāriputto bhikkhave 
PA_anya-e09_02n:588_3	aḍḍhamāsaṃ anupadadhammavipassanaṃ vipassatīti evamādinā bhante tattha bhagavatā	aḍḍha māsam anupada dhamma vipassanam vipassati iti evamādinā bhante tattha bhagavatā 
PA_anya-e09_02n:588_4	āyasmato sāriputtassa dhammasenāpatissa anupadadhammavipassanā vitthārena pakāsitā.	āyasmataḥ sāriputtassa dhamma senāpatissa anupada dhamma vipassanā vitthārena pakāsitā 
PA_anya-e09_02n:589	Chabbisodhanasutta	chabbisodhana sutta 
PA_anya-e09_02n:590	Pucchā – tenāvuso…pe… sammāsambuddhena chabbisodhanasuttaṃ kattha kaṃ ārabbha bhāsitaṃ.	pucchā tena āvuso upe sammāsambuddhena chabbisodhana suttam kattha kam ārabbha bhāsitam 
PA_anya-e09_02n:591	Vissajjanā – sāvatthiyaṃ bhante sambahule bhikkhū ārabbha bhāsitaṃ.	vissajjanā sāvatthiyam bhante sambahule bhikkhū ārabbha bhāsitam 
PA_anya-e09_02n:592	Sappurisasutta	sappurisa sutta 
PA_anya-e09_02n:593	Pucchā – sappurisasuttaṃ panāvuso bhagavatā kattha kaṃ ārabbha bhāsitaṃ.	pucchā sappurisa suttam pana āvuso bhagavatā kattha kam ārabbha bhāsitam 
PA_anya-e09_02n:594	Vissajjanā – sāvatthiyaṃ bhante sambahule bhikkhū ārabbha bhāsitaṃ.	vissajjanā sāvatthiyam bhante sambahule bhikkhū ārabbha bhāsitam 
PA_anya-e09_02n:595	Sevitabbāsevitabbasutta	sevitabba a sevitabba sutta 
PA_anya-e09_02n:596	Pucchā – sevitabbāsevitabbasuttaṃ panāvuso bhagavatā kattha kaṃ ārabbha kena saddhiṃ bhāsitaṃ.	pucchā sevitabba asevitabba suttam pana āvuso bhagavatā kattha kam ārabbha kena saddhim bhāsitam 
PA_anya-e09_02n:597	Vissajjanā – sāvatthiyaṃ bhante sambahule bhikkhū ārabbha āyasmatā sāriputtattherena dhammasenāpatinā saddhiṃ bhāsitaṃ.	vissajjanā sāvatthiyam bhante sambahule bhikkhū ārabbha āyasmatā sāriputta therena dhamma senāpatinā saddhim bhāsitam 
PA_anya-e09_02n:598	Bahudhātukasutta	bahu dhātuka sutta 
PA_anya-e09_02n:599	Pucchā – bahudhātukasuttaṃ panāvuso kattha kaṃ ārabbha bhāsitaṃ.	pucchā bahudhātuka suttam pana āvuso kattha kam ārabbha bhāsitam 
PA_anya-e09_02n:600	Vissajjanā – sāvatthiyaṃ bhante sambahule bhikkhū ārabbha bhāsitaṃ.	vissajjanā sāvatthiyam bhante sambahule bhikkhū ārabbha bhāsitam 
PA_anya-e09_02n:601	Isigilisutta	isigilisutta 
PA_anya-e09_02n:602	Pucchā – isigilisuttaṃ panāvuso bhagavatā kattha kaṃ ārabbha bhāsitaṃ.	pucchā isigili suttam pana āvuso bhagavatā kattha kam ārabbha bhāsitam 
PA_anya-e09_02n:603	Vissajjanā – rājagahe bhante isigilismiṃ pabbate sambahule bhikkhū ārabbha bhāsitaṃ.	vissajjanā rājagahe bhante isigilismim pabbate sambahule bhikkhū ārabbha bhāsitam 
PA_anya-e09_02n:604	Mahācattārīsakasutta	mahācattārīsakasutta 
PA_anya-e09_02n:605	Pucchā – mahācattārīsakasuttaṃ panāvuso bhagavatā kattha kaṃ ārabbha bhāsitaṃ.	pucchā mahācattārīsaka suttam pana āvuso bhagavatā kattha kam ārabbha bhāsitam 
PA_anya-e09_02n:606	Vissajjanā – sāvatthiyaṃ bhante sambahule bhikkhū ārabbha bhāsitaṃ.	vissajjanā sāvatthiyam bhante sambahule bhikkhū ārabbha bhāsitam 
PA_anya-e09_02n:607	Ānāpānassatisutta	āna apāna ssati sutta 
PA_anya-e09_02n:608	Pucchā – ānāpānassatisuttaṃ panāvuso bhagavatā kattha kaṃ ārabbha kismiṃ vatthusmiṃ bhāsitaṃ.	pucchā āna apāna ssati suttam pana āvuso bhagavatā kattha kam ārabbha kismim vatthusmim bhāsitam 
PA_anya-e09_02n:609_0	Vissajjanā – sāvatthiyaṃ bhante sambahule bhikkhū ārabbha bhāsitaṃ, therā bhante	vissajjanā sāvatthiyam bhante sambahule bhikkhū ārabbha bhāsitam therāḥ bhante 
PA_anya-e09_02n:609_1	bhikkhū nave bhikkhū ovadanti anusāsanti, appekacce therā bhikkhū dasapi bhikkhū	bhikkhū nave bhikkhū ovadanti anusāsanti appekacce therā bhikkhū bhikkhū 
PA_anya-e09_02n:609_2	ovadanti anusāsanti, appekacce therā bhikkhū vīsampi bhikkhū ovadanti anusāsanti,	ovadanti anusāsanti appekacce therāḥ bhikkhū vīsampi bhikkhū ovadanti anusāsanti 
PA_anya-e09_02n:609_3	appekacce therā bhikkhū tiṃsampi bhikkhū ovadanti anusāsanti, appekacce therā bhikkhū	appekacce therāḥ bhikkhū tiṃsam pi bhikkhū ovadanti anusāsanti appekacce therāḥ bhikkhū 
PA_anya-e09_02n:609_4	cattārīsampi bhikkhū ovadanti anusāsanti, te ca bhante navā bhikkhū therehi bhikkhūhi	cattārīsam pi bhikkhū ovadanti anusāsanti te ca bhante navāḥ bhikkhū therehi bhikkhūhi 
PA_anya-e09_02n:609_5	ovadiyamānā anusāsiyamānā uḷāraṃ pubbenāparaṃ visesaṃ jānanti, tasmiṃ bhante vatthusmiṃ bhāsitaṃ.	ovadiyamānāḥ anusāsiyamānāḥ uḷāram pubbena aparam visesam jānanti tasmim bhante vatthusmim bhāsitam 
PA_anya-e09_02n:610	Kāyagatāsatisutta	kāyagata asati sutta 
PA_anya-e09_02n:611	Pucchā – kāyagatāsatisuttaṃ panāvuso bhagavatā kattha kaṃ ārabbha kismiṃ vatthusmiṃ bhāsitaṃ.	pucchā kāya gata asati suttam pana āvuso bhagavatā kattha kam ārabbha kismim vatthusmim bhāsitam 
PA_anya-e09_02n:612_0	Vissajjanā – sāvatthiyaṃ bhante sambahule bhikkhū ārabbha bhāsitaṃ, sambahulānaṃ	vissajjanā sāvatthiyam bhante sambahule bhikkhū ārabbha bhāsitam sambahulānam 
PA_anya-e09_02n:612_1	bhante bhikkhūnaṃ pacchābhattaṃ piṇḍapātapaṭikkantānaṃ upaṭṭhānasālāyaṃ sannisinnānaṃ	bhante bhikkhūnam pacchābhattam piṇḍapāta paṭikkantānam upaṭṭhāna sālāyam sannisinnānam 
PA_anya-e09_02n:612_2	sannipatitānaṃ ayamantarakathā udapādi “acchariyaṃ āvuso, abbhutaṃ āvuso, yāvañcidaṃ	sannipatitānam ayam antara kathā udapādi acchariyam āvuso abbhutam āvuso yāvañcidam 
PA_anya-e09_02n:612_3	tena bhagavatā jānatā passatā arahatā sammāsambuddhena kāyagatāsati bhāvitā bahulīkatā	tena bhagavatā jānatā passatā arahatā sammāsambuddhena kāya gatā asati bhāvitā bahulīkatā 
PA_anya-e09_02n:612_4	mahapphalā vuttā mahānisaṃsā”ti, tasmiṃ bhante vatthusmiṃ bhāsitaṃ.	mahapphalā vuttā mahā nisaṃsā ti tasmim bhante vatthusmim bhāsitam 
PA_anya-e09_02n:613	Saṅkhārūpapattisutta	saṅkhāra upapatti sutta 
PA_anya-e09_02n:614	Pucchā – saṅkhārūpapattisuttaṃ panāvuso bhagavatā kattha kaṃ ārabbha bhāsitaṃ.	pucchā saṅkhāra upapatti suttam pana āvuso bhagavatā kattha kam ārabbha bhāsitam 
PA_anya-e09_02n:615	Vissajjanā – sāvatthiyaṃ bhante sambahule bhikkhū ārabbha bhāsitaṃ.	vissajjanā sāvatthiyam bhante sambahule bhikkhū ārabbha bhāsitam 
PA_anya-e09_02n:616	Pucchā – kathañcāvuso tattha bhagavatā saṅkhārūpapattiyo vibhajitvā pakāsitā.	pucchā kathañca āvuso tattha bhagavatā saṅkhāra upapattiyaḥ vibhajitvā pakāsitā 
PA_anya-e09_02n:617_0	Vissajjanā – idha bhikkhave bhikkhu saddhāya samannāgato hoti, sīlena samannāgato	vissajjanā idha bhikkhave bhikkhu saddhāya samannāgataḥ hoti sīlena samannāgataḥ 
PA_anya-e09_02n:617_1	hoti, sutena samannāgato hoti, cāgena samannāgato hoti, paññāya samannāgato hoti,	hoti sutena samannāgataḥ hoti cāgena samannāgataḥ hoti paññāya samannāgataḥ hoti 
PA_anya-e09_02n:617_2	tassa evaṃ hoti “aho vatāhaṃ kāyassa bhedā paraṃ maraṇā khattiyamahāsālānaṃ sahabyataṃ	tassa evam hoti aho vata aham kāyassa bhedā param maraṇā khattiya mahāsālānam sahabyatam 
PA_anya-e09_02n:617_3	upapajjeyya”nti evamādinā bhante tattha bhagavatā saṅkhārūpapattiyo vibhajitvā pakāsitā.	upapajjeyyanti evamādinā bhante tattha bhagavatā saṅkhāra upapattiyaḥ vibhajitvā pakāsitā 
PA_anya-e09_02n:618	Cūḷasuññatasutta	cūḷa suññata sutta 
PA_anya-e09_02n:619	Pucchā – cūḷasuññatasuttaṃ panāvuso bhagavatā kattha kaṃ ārabbha kismiṃ vatthusmiṃ bhāsitaṃ.	pucchā cūḷasuññata suttam pana āvuso bhagavatā kattha kam ārabbha kismim vatthusmim bhāsitam 
