segmentnr	original	folio	analyzed
PA_atk-s05_19a:530_4	yassa dhammassa yena yena bhāvena visadiso. Tena tena vemattaṃ gacchatīti tena tena	530	
PA_atk-s05_19a:530_5	bhāvena so dhammo tassa dhammassa vemattataṃ visadisattaṃ gacchati, dukkhabhāvena	530	
PA_atk-s05_19a:530_6	samānopi jātiādiko abhinibbattiādibhāvena jarādikassa visiṭṭhataṃ gacchatīti attho.	530	
PA_atk-s05_19a:530_7	Iminā vemattatāya lakkhaṇamāha.	530	
PA_atk-s05_19a:531_0	Idāni tāva ekattavemattatāvisaye niyojetvā dassetuṃ “sutte vā veyyākaraṇe vā”tiādi	531	
PA_atk-s05_19a:531_1	vuttaṃ. Tattha pucchitanti pucchāvasena desitasuttavasena vuttaṃ, na pana adhiṭṭhānahārassa	531	
PA_atk-s05_19a:531_2	pucchāvisayatāya. Sesaṃ uttānameva.	531	
PA_atk-s05_19a:532	Adhiṭṭhānahāravibhaṅgavaṇṇanā niṭṭhitā.	53	
PA_atk-s05_19a:533	15. Parikkhārahāravibhaṅgavaṇṇanā	53	
PA_atk-s05_19a:534_0	49. Tattha katamo parikkhāro hāroti parikkhārahāravibhaṅgo. Tattha yo dhammo yaṃ	534	
PA_atk-s05_19a:534_1	dhammaṃ janayati, tassa so parikkhāroti saṅkhepato parikkhāralakkhaṇaṃ vatvā taṃ	534	
PA_atk-s05_19a:534_2	vibhāgena dassetuṃ “kiṃlakkhaṇo”tiādi vuttaṃ. Tattha hinoti attano phalaṃ paṭikāraṇabhāvaṃ	534	
PA_atk-s05_19a:534_3	gacchatīti hetu. Paṭicca etasmā phalaṃ etīti paccayo. Kiñcāpi hetupaccayasaddehi	534	
PA_atk-s05_19a:534_4	kāraṇameva vuccati, tathāpi tattha visesaṃ vibhāgena dassetuṃ “asādhāraṇalakkhaṇo”tiādi	534	
PA_atk-s05_19a:534_5	vuttaṃ. Sabhāvo hetūti samānabhāvo bījaṃ hetu. Nanu ca bījaṃ aṅkurādisadisaṃ na hotīti?	534	
PA_atk-s05_19a:534_6	No na hoti, aññato hi tādisassa anuppajjanato.	534	
PA_atk-s05_19a:535_0	“Yathā vā panā”tiādināpi udāharaṇantaradassanena hetupaccayānaṃ visesameva vibhāveti.	535	
PA_atk-s05_19a:535_1	Tattha duddhanti khīraṃ. Dadhi bhavatīti ekattanayena abhedopacārena vā vuttaṃ, na	535	
PA_atk-s05_19a:535_2	aññathā. Na hi khīraṃ dadhi hoti. Tenevāha – “na catthi ekakālasamavadhānaṃ duddhassa	535	
PA_atk-s05_19a:535_3	ca dadhissa cā”ti. Atha vā ghaṭe duddhaṃ pakkhittaṃ dadhi bhavati, dadhi tattha kālantare	535	
PA_atk-s05_19a:535_4	jāyati paccayantarasamāyogena, tasmā na catthi ekakālasamavadhānaṃ duddhassa ca dadhissa	535	
PA_atk-s05_19a:535_5	ca rasakhīravipākādīhi bhinnasabhāvattā. Evamevanti yathā hetubhūtassa khīrassa phalabhūtena	535	
PA_atk-s05_19a:535_6	dadhinā na ekakālasamavadhānaṃ, evamaññassāpi hetussa phalena na ekakālasamavadhānaṃ,	535	
PA_atk-s05_19a:535_7	na tathā paccayassa, na hi paccayo ekantena phalena bhinnakālo evāti. Evampi hetupaccayānaṃ	535	
PA_atk-s05_19a:535_8	viseso veditabboti adhippāyo.	535	
PA_atk-s05_19a:536_0	Evaṃ bāhiraṃ hetupaccayavibhāgaṃ dassetvā idāni ajjhattikaṃ dassetuṃ “ayañhi saṃsāro”tiādi	536	
PA_atk-s05_19a:536_1	vuttaṃ. Tattha “avijjā avijjāya hetū”ti vutte kiṃ ekasmiṃ cittuppāde anekā avijjā	536	
PA_atk-s05_19a:536_2	vijjantīti? Āha “purimikā avijjā pacchimikāya avijjāya hetū”ti. Tena ekasmiṃ kāle	536	
PA_atk-s05_19a:536_3	hetuphalānaṃ samavadhānaṃ natthīti etamevatthaṃ samattheti. Tattha “purimikā avijjā”tiādinā	536	
PA_atk-s05_19a:536_4	hetuphalabhūtānaṃ avijjānaṃ vibhāgaṃ dasseti. “Bījaṅkuro viyā”tiādinā imamatthaṃ	536	
PA_atk-s05_19a:536_5	dasseti – yathā bījaṃ aṅkurassa hetu hontaṃ samanantarahetutāya hetu hoti. Yaṃ pana	536	
PA_atk-s05_19a:536_6	bījato phalaṃ nibbattati, tassa bījaṃ paramparahetutāya hetu hoti. Evaṃ avijjāyapi	536	
PA_atk-s05_19a:536_7	hetubhāve daṭṭhabbanti.	536	
PA_atk-s05_19a:537_0	Puna “yathā vā panā”tiādināpi hetupaccayavibhāgameva dasseti. Tattha thālakanti dīpakapallikā.	537	
PA_atk-s05_19a:537_1	Anaggikanti aggiṃ vinā. Dīpetunti jāletuṃ. Iti sabhāvo hetūti evaṃ padīpujjālanādīsu	537	
PA_atk-s05_19a:537_2	aggiādipadīpasadisaṃ kāraṇaṃ sabhāvo hetu. Parabhāvo paccayoti tattheva kapallikāvaṭṭitelādisadiso	537	
PA_atk-s05_19a:537_3	aggito añño sabhāvo paccayo. Ajjhattikoti niyakajjhattiko niyakajjhatte bhavo. Bāhiroti	537	
PA_atk-s05_19a:537_4	tato bahibhūto. Janakoti nibbattako. Pariggāhakoti upatthambhako. Asādhāraṇoti āveṇiko.	537	
PA_atk-s05_19a:537_5	Sādhāraṇoti aññesampi paccayuppannānaṃ samāno.	537	
PA_atk-s05_19a:538_0	Idāni yasmā kāraṇaṃ “parikkhāro”ti vuttaṃ, kāraṇabhāvo ca phalāpekkhāya, tasmā kāraṇassa	538	
PA_atk-s05_19a:538_1	yo kāraṇabhāvo yathā ca so hoti, yañca phalaṃ yo ca tassa viseso, yo ca kāraṇaphalānaṃ	538	
PA_atk-s05_19a:538_2	sambandho, taṃ sabbaṃ vibhāvetuṃ “avupacchedattho”tiādi vuttaṃ. Tattha kāraṇaphalabhāvena	538	
PA_atk-s05_19a:538_3	sambandhatā santati. Ko ca tattha sambandho, ko kāraṇaphalabhāvo ca? So eva avupacchedattho.	538	
PA_atk-s05_19a:538_4	Yo phalabhūto aññassa akāraṇaṃ hutvā nirujjhati, so vupacchinno nāma hoti, yathā	538	
PA_atk-s05_19a:538_5	taṃ arahato cuticittaṃ. Yo pana attano anurūpassa phalassa hetu hutvā nirujjhati,	538	
PA_atk-s05_19a:538_6	so anupacchinno eva nāma hoti, hetuphalasambandhassa vijjamānattāti āha – “avupacchedattho santatiattho”ti.	538	
PA_atk-s05_19a:539_0	Yasmā ca kāraṇato nibbattaṃ phalaṃ nāma, na anibbattaṃ, tasmā “nibbattiattho phalattho”ti	539	
PA_atk-s05_19a:539_1	vuttaṃ. Yasmā pana purimabhavena anantarabhavapaṭisandhānavasena pavattā upapattikkhandhā	539	
PA_atk-s05_19a:539_2	punabbhavo, tasmā vuttaṃ – “paṭisandhiattho punabbhavattho”ti. Tathā yassa puggalassa	539	
PA_atk-s05_19a:539_3	kilesā uppajjanti, taṃ palibundhenti sammā paṭipajjituṃ na denti. Yāva ca maggena	539	
PA_atk-s05_19a:539_4	asamugghātitā, tāva anusenti nāma, tena vuttaṃ – “palibodhattho pariyuṭṭhānattho,	539	
PA_atk-s05_19a:539_5	asamugghātattho anusayattho”ti. Pariññābhisamayavasena pariññāte na kadāci taṃ nāmarūpaṅkurassa	539	
PA_atk-s05_19a:539_6	kāraṇaṃ hessatīti āha – “apariññātattho viññāṇassa bījattho”ti. Yattha avupacchedo	539	
PA_atk-s05_19a:539_7	tattha santatīti yattha rūpārūpappavattiyaṃ yathāvutto avupacchedo, tattha santativohāro.	539	
PA_atk-s05_19a:539_8	Yattha santati tattha nibbattītiādi paccayaparamparadassanaṃ hetuphalasambandhavibhāvanameva.	539	
PA_atk-s05_19a:540_0	“Yathā vā pana cakkhuñca paṭiccā”tiādinā “sabhāvo hetū”ti vuttamevatthaṃ vibhāgena	540	
PA_atk-s05_19a:540_1	dasseti. Tattha sannissayatāyāti upanissayapaccayatāya. Manasikāroti kiriyāmanodhātu.	540	
PA_atk-s05_19a:540_2	Sā hi cakkhuviññāṇassa viññāṇabhāvena samānajātitāya sabhāvo hetu. Saṅkhārā viññāṇassa	540	
PA_atk-s05_19a:540_3	paccayo sabhāvo hetūti puññādiabhisaṅkhārā paṭisandhiviññāṇassa paccayo, tattha yo	540	
PA_atk-s05_19a:540_4	sabhāvo, so hetūti. Saṅkhārāti cettha sabbo lokiyo kusalākusalacittuppādo adhippeto.	540	
PA_atk-s05_19a:540_5	Iminā nayena sesapadesupi attho veditabbo. Evaṃ yo koci upanissayo sabbo so parikkhāroti	540	
PA_atk-s05_19a:540_6	yathāvuttappabhedo yo koci paccayo, so sabbo attano phalassa parikkharaṇato abhisaṅkharaṇato	540	
PA_atk-s05_19a:540_7	parikkhāro. Tassa niddhāretvā kathanaṃ parikkhāro hāroti.	540	
PA_atk-s05_19a:541	Parikkhārahāravibhaṅgavaṇṇanā niṭṭhitā.	54	
PA_atk-s05_19a:542	16. Samāropanahāravibhaṅgavaṇṇanā	54	
PA_atk-s05_19a:543_0	50. Tattha katamo samāropano hāroti samāropanahāravibhaṅgo. Tattha ekasmiṃ padaṭṭhāneti	543	
PA_atk-s05_19a:543_1	yasmiṃ kismiñci ekasmiṃ kāraṇabhūte dhamme suttena gahite. Yattakāni padaṭṭhānāni	543	
PA_atk-s05_19a:543_2	otarantīti yattakāni aññesaṃ kāraṇabhūtāni tasmiṃ dhamme samosaranti. Sabbāni tāni	543	
PA_atk-s05_19a:543_3	samāropayitabbānīti sabbāni tāni padaṭṭhānāni padaṭṭhānabhūtā dhammā sammā niddhāraṇavasena	543	
PA_atk-s05_19a:543_4	ānetvā desanāya āropetabbā, desanāruḷhe viya katvā kathetabbāti attho. Yathā āvaṭṭe	543	
PA_atk-s05_19a:543_5	hāre “ekamhi padaṭṭhāne, pariyesati sesakaṃ padaṭṭhāna”nti vacanato anekesaṃ padaṭṭhānānaṃ	543	
PA_atk-s05_19a:543_6	pariyesanā vuttā, evamidhāpi bahūnaṃ padaṭṭhānānaṃ samāropanā kātabbāti dassento	543	
PA_atk-s05_19a:543_7	“yathā āvaṭṭe hāre”ti āha. Na kevalaṃ padaṭṭhānavaseneva samāropanā, atha kho vevacanabhāvanāpahānavasenapi	543	
PA_atk-s05_19a:543_8	samāropanā kātabbāti dassento “tattha samāropanā catubbidhā”tiādimāha.	543	
PA_atk-s05_19a:544_0	Kasmā panettha padaṭṭhānavevacanāni gahitāni, nanu padaṭṭhānavevacanahāre eva ayamattho	544	
PA_atk-s05_19a:544_1	vibhāvitoti? Saccametaṃ, idha pana padaṭṭhānavevacanaggahaṇaṃ bhāvanāpahānānaṃ adhiṭṭhānavisayadassanatthañceva	544	
PA_atk-s05_19a:544_2	tesaṃ adhivacanavibhāgadassanatthañca. Evañhi bhāvanāpahānāni suviññeyyāni honti	544	
PA_atk-s05_19a:544_3	sukarāni ca paññāpetuṃ. Idaṃ padaṭṭhānanti idaṃ tividhaṃ sucaritaṃ buddhānaṃ sāsanassa	544	
PA_atk-s05_19a:544_4	ovādassa visayādhiṭṭhānabhāvato padaṭṭhānaṃ. Tattha “kāyika”ntiādinā tīhi sucaritehi	544	
PA_atk-s05_19a:544_5	sīlādayo tayo khandhe samathavipassanā tatiyacatutthaphalāni ca niddhāretvā dasseti,	544	
PA_atk-s05_19a:544_6	taṃ suviññeyyameva. Vanīyatīti vanaṃ, vanati, vanute iti vā vanaṃ. Tattha yasmā pañca	544	
PA_atk-s05_19a:544_7	kāmaguṇā kāmataṇhāya, nimittaggāho anubyañjanaggāhassa, ajjhattikabāhirāni āyatanāni	544	
PA_atk-s05_19a:544_8	tappaṭibandhachandarāgādīnaṃ, anusayā ca pariyuṭṭhānānaṃ kāraṇāni honti, tasmā tamatthaṃ	544	
PA_atk-s05_19a:544_9	dassetuṃ “pañca kāmaguṇā”tiādi vuttaṃ.	544	
PA_atk-s05_19a:545_0	51. Ayaṃ vevacanena samāropanāti yo “rāgavirāgā cetovimutti sekkhaphalaṃ, anāgāmiphalaṃ,	545	
PA_atk-s05_19a:545_1	kāmadhātusamatikkamana”nti etehi pariyāyavacanehi tatiyaphalassa niddeso, tathā yo	545	
PA_atk-s05_19a:545_2	“avijjāvirāgā paññāvimutti asekkhaphalaṃ, aggaphalaṃ arahattaṃ, tedhātukasamatikkamana”nti	545	
PA_atk-s05_19a:545_3	etehi pariyāyavacanehi catutthaphalassa niddeso, yo ca “paññindriya”ntiādīhi pariyāyavacanehi	545	
PA_atk-s05_19a:545_4	paññāya niddeso, ayaṃ vevacanehi ca samāropanā.	545	
PA_atk-s05_19a:546_0	Tasmātiha tvaṃ, bhikkhu, kāye kāyānupassī viharāhītiādi lakkhaṇahāravibhaṅgavaṇṇanāyaṃ	546	
PA_atk-s05_19a:546_1	vuttanayena veditabbaṃ. Kevalaṃ tattha ekalakkhaṇattā avuttānampi vuttabhāvadassanavaseneva	546	
PA_atk-s05_19a:546_2	āgataṃ, idha bhāvanāsamāropanavasenāti ayameva viseso. Kāyānupassanā visesato asubhānupassanā	546	
PA_atk-s05_19a:546_3	eva kāmarāgatadekaṭṭhakilesānaṃ ekantapaṭipakkhāti asubhasaññā kabaḷīkārāhārapariññāya	546	
PA_atk-s05_19a:546_4	paribandhakilesā kāmupādānaṃ kāmayogo abhijjhākāyagantho kāmāsavo kāmogho rāgasallaṃ	546	
PA_atk-s05_19a:546_5	rūpadhammapariññāya paṭipakkhakilesā rūpadhammesu rāgo chandāgatigamananti etesaṃ	546	
PA_atk-s05_19a:546_6	pāpadhammānaṃ pahānāya saṃvattatīti imamatthaṃ dasseti “kāye kāyānupassī viharanto”tiādinā.	546	
PA_atk-s05_19a:547	Tathā vedanānupassanā visesato dukkhānupassanāti, sā –	54	
PA_atk-s05_19a:548	“Yo sukhaṃ dukkhato adda, dukkhamaddakkhi sallato;	54	
PA_atk-s05_19a:549	Adukkhamasukhaṃ santaṃ, adakkhi naṃ aniccato”ti. –	54	
PA_atk-s05_19a:550_0	Ādivacanato sabbaṃ vedanaṃ “dukkha”nti passantī sukhasaññāya vedanāhetupariññāya	550	
PA_atk-s05_19a:550_1	paribandhakilesānaṃ gosīlādīhi bhavasuddhi hotīti vedanāssādena pavattassa bhavupādānasaṅkhātassa	550	
PA_atk-s05_19a:550_2	sīlabbatupādānassa vedanāvasena “anatthaṃ me acarī”tiādinayappavattassa byāpādakāyaganthassa	550	
PA_atk-s05_19a:550_3	dosasallassa vedanāssādavaseneva pavattassa bhavayogabhavābhavabhavoghasaṅkhātassa	550	
PA_atk-s05_19a:550_4	bhavarāgassa bhavapariññāya paribandhakakilesānaṃ vedanāvisayassa rāgassa dosāgatigamanassa	550	
PA_atk-s05_19a:550_5	ca pahānāya saṃvattatīti etamatthaṃ dasseti “vedanāsu vedanānupassī”tiādinā.	550	
PA_atk-s05_19a:551_0	Tathā cittānupassanā visesato aniccānupassanāti, sā cittaṃ “anicca”nti passantī tattha	551	
PA_atk-s05_19a:551_1	yebhuyyena sattā niccasaññinoti niccasaññāya viññāṇāhārapariññāya paribandhakilesānaṃ	551	
PA_atk-s05_19a:551_2	niccābhinivesapaṭipakkhato eva diṭṭhupādānaṃ diṭṭhiyogasīlabbataparāmāsakāyaganthadiṭṭhāsavadiṭṭhoghasaṅkhātāya	551	
PA_atk-s05_19a:551_3	diṭṭhiyā niccasaññānimittassa “seyyohamasmī”tiādinayappavattassa mānasallassa saññāpariññāya	551	
PA_atk-s05_19a:551_4	paṭipakkhakilesānaṃ saññāya rāgassa diṭṭhābhinivesassa appahīnattā uppajjanakassa	551	
PA_atk-s05_19a:551_5	bhayāgatigamanassa ca pahānāya saṃvattatīti imamatthaṃ dasseti “citte cittānupassī”tiādinā.	551	
PA_atk-s05_19a:552_0	Tathā dhammānupassanā visesato anattasaññāti, sā saṅkhāresu attasaññāya manosañcetanāhārapariññāya	552	
PA_atk-s05_19a:552_1	paṭipakkhakilesānaṃ sakkāyadiṭṭhiyā “idameva sacca”nti pavattassa micchābhinivesassa	552	
PA_atk-s05_19a:552_2	micchābhinivesahetukāya avijjāyogaavijjāsavaavijjoghamohasallasaṅkhātāya avijjāya	552	
PA_atk-s05_19a:552_3	saṅkhārapariññāya paribandhakilesānaṃ saṅkhāresu rāgassa mohāgatigamanassa ca pahānāya	552	
PA_atk-s05_19a:552_4	saṃvattatīti imamatthaṃ dasseti “dhammesu dhammānupassī viharanto”tiādinā. Sesaṃ uttānameva.	552	
PA_atk-s05_19a:553	Samāropanahāravibhaṅgavaṇṇanā niṭṭhitā.	55	
PA_atk-s05_19a:554	Niṭṭhitā ca hāravibhaṅgavaṇṇanā.	55	
PA_atk-s05_19a:555	1. Desanāhārasampātavaṇṇanā	55	
PA_atk-s05_19a:556_0	Evaṃ suparikammakatāya bhūmiyā nānāvaṇṇāni muttapupphāni pakiranto viya susikkhitasippācariyavicāritesu	556	
PA_atk-s05_19a:556_1	surattasuvaṇṇālaṅkāresu nānāvidharaṃsijālasamujjalāni vividhāni maṇiratanāni bandhanto	556	
PA_atk-s05_19a:556_2	viya mahāpathaviṃ parivattetvā pappaṭakojaṃ khādāpento viya yojanikamadhugaṇḍaṃ pīḷetvā	556	
PA_atk-s05_19a:556_3	sumadhurasaṃ pāyento viya ca āyasmā mahākaccāno nānāsuttapadese udāharanto soḷasa	556	
PA_atk-s05_19a:556_4	hāre vibhajitvā idāni te ekasmiṃyeva sutte yojetvā dassento hārasampātavāraṃ ārabhi.	556	
PA_atk-s05_19a:556_5	Ārabhanto ca yāyaṃ niddesavāre –	556	
PA_atk-s05_19a:558	“Soḷasa hārā paṭhamaṃ, disalocanato disā viloketvā;	55	
PA_atk-s05_19a:559	Saṅkhipiya aṅkusena hi, nayehi tīhi niddise sutta”nti. –	55	
PA_atk-s05_19a:560_0	Gāthā vuttā. Yasmā taṃ hāravibhaṅgavāro nappayojeti, vippakiṇṇavisayattā, nayavicārassa	560	
PA_atk-s05_19a:560_1	ca antaritattā. Anekehi suttapadesehi hārānaṃ vibhāgadassanameva hi hāravibhaṅgavāro.	560	
PA_atk-s05_19a:560_2	Hārasampātavāro pana taṃ payojeti, ekasmiṃyeva suttapadese soḷasa hāre yojetvāva	560	
PA_atk-s05_19a:560_3	tadanantaraṃ nayasamuṭṭhānassa kathitattā. Tasmā “soḷasa hārā paṭhama”nti gāthaṃ	560	
PA_atk-s05_19a:560_4	paccāmasitvā “tassā niddeso kuhiṃ daṭṭhabbo, hārasampāte”ti āha. Tassattho – “tassā	560	
PA_atk-s05_19a:560_5	gāthāya niddeso kattha daṭṭhabbo”ti. Etena suttesu hārānaṃ yojanānayadassanaṃ hārasampātavāroti	560	
PA_atk-s05_19a:560_6	dasseti. Hārasampātapadassa attho vutto eva.	560	
PA_atk-s05_19a:561_0	Arakkhitena cittenāti cakkhudvārādīsu satiārakkhābhāvena aguttena cittena. Micchādiṭṭhihatenāti	561	
PA_atk-s05_19a:561_1	sassatādimicchābhinivesadūsitena. Thinamiddhābhibhūtenāti cittassa kāyassa ca akalyatālakkhaṇehi	561	
PA_atk-s05_19a:561_2	thinamiddhehi ajjhotthaṭena. Vasaṃ mārassa gacchatīti kilesamārādīnaṃ yathākāmaṃ	561	
PA_atk-s05_19a:561_3	karaṇīyo hotīti ayaṃ tāva gāthāya padattho.	561	
PA_atk-s05_19a:562_0	Pamādanti “arakkhitena cittenā”ti idaṃ padaṃ chasu dvāresu sativosaggalakkhaṇaṃ pamādaṃ	562	
PA_atk-s05_19a:562_1	katheti. Taṃ maccuno padanti taṃ pamajjanaṃ guṇamāraṇato maccusaṅkhātassa mārassa	562	
PA_atk-s05_19a:562_2	vasavattanaṭṭhānaṃ, tena “arakkhitena cittena, vasaṃ mārassa gacchatī”ti paṭhamapādaṃ	562	
PA_atk-s05_19a:562_3	catutthapādena sambandhitvā dasseti. So vipallāsoti yaṃ aniccassa khandhapañcakassa	562	
PA_atk-s05_19a:562_4	“nicca”nti dassanaṃ, so vipallāso vipariyesaggāho. Tenevāha – “viparītaggāhalakkhaṇo	562	
PA_atk-s05_19a:562_5	vipallāso”ti. Sabbaṃ vipallāsasāmaññena gahetvā tassa adhiṭṭhānaṃ pucchati “kiṃ vipallāsayatī”ti.	562	
PA_atk-s05_19a:562_6	Sāmaññassa ca viseso adhiṭṭhānabhāvena voharīyatīti āha – “saññaṃ cittaṃ diṭṭhimitī”ti.	562	
PA_atk-s05_19a:562_7	Taṃ “vipallāsayatī”ti padena sambandhitabbaṃ. Tesu saññāvipallāso sabbamuduko, aniccādikassa	562	
PA_atk-s05_19a:562_8	visayassa micchāvasena upaṭṭhitākāraggahaṇamattaṃ migapotakānaṃ tiṇapurisakesu purisoti	562	
PA_atk-s05_19a:562_9	uppannasaññā viya. Cittavipallāso tato balavataro, amaṇiādike visaye maṇiādiākārena	562	
PA_atk-s05_19a:562_10	upaṭṭhahante tathā sanniṭṭhānaṃ viya niccādito sanniṭṭhānamattaṃ. Diṭṭhivipallāso	5621	
PA_atk-s05_19a:562_11	pana sabbabalavataro yaṃ yaṃ ārammaṇaṃ yathā yathā upaṭṭhāti, tathā tathā naṃ sassatādivasena	5621	
PA_atk-s05_19a:562_12	“idameva saccaṃ moghamañña”nti abhinivisanto pavattati. Tattha saññāvipallāso cittavipallāsassa	5621	
PA_atk-s05_19a:562_13	kāraṇaṃ, cittavipallāso diṭṭhivipallāsassa kāraṇaṃ hoti.	5621	
PA_atk-s05_19a:563_0	Idāni vipallāsānaṃ pavattiṭṭhānaṃ visayaṃ dassetuṃ “so kuhiṃ vipallāsayati, catūsu	563	
PA_atk-s05_19a:563_1	attabhāvavatthūsū”ti āha. Tattha attabhāvavatthūsūti pañcasu upādānakkhandhesu. Te	563	
PA_atk-s05_19a:563_2	hi āhito ahaṃ māno etthāti attā, “attā”ti bhavati ettha buddhi vohāro cāti attabhāvo,	563	
PA_atk-s05_19a:563_3	so eva subhādīnaṃ vipallāsassa ca adhiṭṭhānabhāvato vatthu cāti “attabhāvavatthū”ti	563	
PA_atk-s05_19a:563_4	vuccati. “Rūpaṃ attato samanupassatī”tiādinā tesaṃ sabbavipallāsamūlabhūtāya sakkāyadiṭṭhiyā	563	
PA_atk-s05_19a:563_5	pavattiṭṭhānabhāvena attabhāvavatthutaṃ dassetvā puna vipallāsānaṃ pavattiākārena	563	
PA_atk-s05_19a:563_6	saddhiṃ visayaṃ vibhajitvā dassetuṃ “rūpaṃ paṭhamaṃ vipallāsavatthu asubhe subha”nti	563	
PA_atk-s05_19a:563_7	vuttaṃ. Taṃ sabbaṃ suviññeyyaṃ. Puna mūlakāraṇavasena vipallāse vibhajitvā dassetuṃ	563	
PA_atk-s05_19a:563_8	“dve dhammā cittassa saṃkilesā”tiādimāha. Tattha kiñcāpi avijjārahitā taṇhā natthi,	563	
PA_atk-s05_19a:563_9	avijjā ca subhasukhasaññānampi paccayo eva, tathāpi taṇhā etāsaṃ sātisayaṃ paccayoti	563	
PA_atk-s05_19a:563_10	dassetuṃ “taṇhānivutaṃ…pe… dukkhe sukha”nti vuttaṃ. Diṭṭhinivutanti diṭṭhisīsena	5631	
PA_atk-s05_19a:563_11	avijjā vuttāti avijjānivutanti attho. Kāmañcettha taṇhārahitā diṭṭhi natthi, taṇhāpi	5631	
PA_atk-s05_19a:563_12	diṭṭhiyā paccayo eva. Taṇhāpi “niccaṃ attā”ti ayoniso ummujjantānaṃ tathāpavattamicchābhinivesassa	5631	
PA_atk-s05_19a:563_13	moho visesapaccayoti dassetuṃ “diṭṭhinivutaṃ…pe… attā”ti vuttaṃ.	5631	
PA_atk-s05_19a:564_0	Yo diṭṭhivipallāsoti “anicce niccaṃ, anattani attā”ti pavattampi vipallāsadvayaṃ	564	
PA_atk-s05_19a:564_1	sandhāyāha – “so atītaṃ rūpaṃ…pe… atītaṃ viññāṇaṃ attato samanupassatī”ti. Etena	564	
PA_atk-s05_19a:564_2	aṭṭhārasavidhopi pubbantānukappikavādo pacchimānaṃ dvinnaṃ vipallāsānaṃ vasena hotīti	564	
PA_atk-s05_19a:564_3	dasseti. Taṇhāvipallāsoti taṇhāmūlako vipallāso. “Asubhe subhaṃ, dukkhe sukha”nti	564	
PA_atk-s05_19a:564_4	etaṃ vipallāsadvayaṃ sandhāya vadati. Anāgataṃ rūpaṃ abhinandatīti anāgataṃ rūpaṃ	564	
PA_atk-s05_19a:564_5	diṭṭhābhinandanavasena abhinandati. Anāgataṃ vedanaṃ, saññaṃ, saṅkhāre, viññāṇaṃ	564	
PA_atk-s05_19a:564_6	abhinandatīti etthāpi eseva nayo. Etena catucattālīsavidhopi aparantānukappikavādo	564	
PA_atk-s05_19a:564_7	yebhuyyena purimānaṃ dvinnaṃ vipallāsānaṃ vasena hotīti dasseti. Dve dhammā cittassa	564	
PA_atk-s05_19a:564_8	upakkilesāti evaṃ paramasāvajjassa vipallāsassa mūlakāraṇanti visesato dve dhammā	564	
PA_atk-s05_19a:564_9	cittassa upakkilesā taṇhā ca avijjā cāti te sarūpato dasseti. Tāhi visujjhantaṃ cittaṃ	564	
PA_atk-s05_19a:564_10	visujjhatīti paṭipakkhavasenapi tāsaṃ upakkilesabhāvaṃyeva vibhāveti, na hi taṇhāavijjāsu	5641	
PA_atk-s05_19a:564_11	pahīnāsu koci saṃkilesadhammo na pahīyatīti. Yathā ca vipallāsānaṃ mūlakāraṇaṃ taṇhāvijjā,	5641	
PA_atk-s05_19a:564_12	evaṃ sakalassāpi vaṭṭassa mūlakāraṇanti yathānusandhināva gāthaṃ niṭṭhapetuṃ “tesa”ntiādi	5641	
PA_atk-s05_19a:564_13	vuttaṃ. Tattha tesanti yesaṃ arakkhitaṃ cittaṃ micchādiṭṭhihatañca, tesaṃ. “Avijjānīvaraṇāna”ntiādinā	5641	
PA_atk-s05_19a:564_14	mārassa vasagamanena anādimatisaṃsāre saṃsaraṇanti dasseti.	5641	
PA_atk-s05_19a:565_0	Thinamiddhābhibhūtenāti ettha “thinaṃ nāmā”tiādinā thinamiddhānaṃ sarūpaṃ dasseti.	565	
PA_atk-s05_19a:565_1	Tehi cittassa abhibhūtatā suviññeyyāvāti taṃ anāmasitvā kilesamāraggahaṇeneva taṃnimittā	565	
PA_atk-s05_19a:565_2	abhisaṅkhāramārakhandhamāramaccumārā gahitā evāti “kilesamārassa ca sattamārassa	565	
PA_atk-s05_19a:565_3	cā”ti ca-saddena vā tesampi gahaṇaṃ katanti daṭṭhabbaṃ. So hi nivuto saṃsārābhimukhoti	565	
PA_atk-s05_19a:565_4	so māravasaṃ gato, tato eva nivuto kilesehi yāva na mārabandhanaṃ chijjati, tāva	565	
PA_atk-s05_19a:565_5	saṃsārābhimukhova hoti, na visaṅkhārābhimukhoti adhippāyo. Imāni bhagavatā dve saccāni	565	
PA_atk-s05_19a:565_6	desitāni. Kathaṃ desitāni?	565	
PA_atk-s05_19a:566_0	Tattha duvidhā kathā abhidhammanissitā ca suttantanissitā ca. Tāsu abhidhammanissitā	566	
PA_atk-s05_19a:566_1	nāma arakkhitena cittenāti rattampi cittaṃ arakkhitaṃ, duṭṭhampi cittaṃ arakkhitaṃ,	566	
PA_atk-s05_19a:566_2	mūḷhampi cittaṃ arakkhitaṃ. Tattha rattaṃ cittaṃ aṭṭhannaṃ lobhasahagatacittuppādānaṃ	566	
PA_atk-s05_19a:566_3	vasena veditabbaṃ, duṭṭhaṃ cittaṃ dvinnaṃ paṭighacittuppādānaṃ vasena veditabbaṃ,	566	
PA_atk-s05_19a:566_4	mūḷhaṃ cittaṃ dvinnaṃ momūhacittuppādānaṃ vasena veditabbaṃ. Yāva imesaṃ cittuppādānaṃ	566	
PA_atk-s05_19a:566_5	vasena indriyānaṃ agutti agopāyanā apālanā anārakkhā sativosaggo pamādo cittassa	566	
PA_atk-s05_19a:566_6	asaṃvaro, evaṃ arakkhitaṃ cittaṃ hoti. Micchādiṭṭhihataṃ nāma cittaṃ catunnaṃ diṭṭhisampayuttacittuppādānaṃ	566	
PA_atk-s05_19a:566_7	vasena veditabbaṃ, thinamiddhābhibhūtaṃ nāma cittaṃ pañcannaṃ sasaṅkhārikākusalacittuppādānaṃ	566	
PA_atk-s05_19a:566_8	vasena veditabbaṃ. Evaṃ sabbepi aggahitaggahaṇena dvādasa akusalacittuppādā honti.	566	
PA_atk-s05_19a:566_9	Te “katame dhammā akusalā? Yasmiṃ samaye akusalaṃ cittaṃ uppannaṃ hotī”tiādinā cittuppādakaṇḍe	566	
PA_atk-s05_19a:566_10	akusalacittuppādadesanāvasena vitthārato vattabbā. Mārassāti ettha pañca mārā. Tesu	5661	
PA_atk-s05_19a:566_11	kilesamārassa catunnaṃ āsavānaṃ catunnaṃ oghānaṃ catunnaṃ yogānaṃ catunnaṃ ganthānaṃ	5661	
PA_atk-s05_19a:566_12	catunnaṃ upādānānaṃ aṭṭhannaṃ nīvaraṇānaṃ dasannaṃ kilesavatthūnaṃ vasena āsavagocchakādīsu	5661	
PA_atk-s05_19a:566_13	vuttanayena, tathā “jātimado gottamado ārogyamado”tiādinā khuddakavatthuvibhaṅge	5661	
PA_atk-s05_19a:566_14	āgatānaṃ sattannaṃ kilesānañca vasena vibhāgo vattabbo. Ayaṃ tāvettha abhidhammanissitā kathā.	5661	
PA_atk-s05_19a:567_0	Suttantanissitā pana arakkhitena cittenāti cakkhunā rūpaṃ disvā nimittaggāhī hoti	567	
PA_atk-s05_19a:567_1	anubyañjanaggāhī, yatvādhikaraṇamenaṃ cakkhundriyaṃ asaṃvutaṃ viharantaṃ abhijjhādomanassā	567	
PA_atk-s05_19a:567_2	pāpakā akusalā dhammā anvāssaveyyuṃ, tassa saṃvarāya na paṭipajjati, na rakkhati	567	
PA_atk-s05_19a:567_3	cakkhundriyaṃ, cakkhundriye na saṃvaraṃ āpajjati. Sotena …pe… ghānena… jivhāya… kāyena…	567	
PA_atk-s05_19a:567_4	manasā…pe… manindriyena saṃvaraṃ āpajjati. Evaṃ arakkhitaṃ cittaṃ hoti. Micchādiṭṭhihatena	567	
PA_atk-s05_19a:567_5	cāti micchādiṭṭhihataṃ nāma cittaṃ pubbantakappanavasena vā aparantakappanavasena	567	
PA_atk-s05_19a:567_6	vā pubbantāparantakappanavasena vā micchābhinivisantassa ayoniso ummujjantassa “sassato	567	
PA_atk-s05_19a:567_7	lokoti vā…pe… neva hoti na na hoti tathāgato paraṃ maraṇā”ti vā yā diṭṭhi, tāya hataṃ	567	
PA_atk-s05_19a:567_8	upahataṃ. Yā ca kho “imā cattāro sassatavādā…pe… pañca paramadiṭṭhadhammanibbānavādā”ti	567	
