segmentnr	original	analyzed
PA_anya-e11_02n:0	Namo tassa bhagavato arahato sammāsambuddhassa.	namaḥ tassa bhagavataḥ arahataḥ sammāsambuddhassa 
PA_anya-e11_02n:1	Sīmavisodhanī	sīma visodhanī 
PA_anya-e11_02n:2	Varadaṃ varadaṃ aggaṃ, diccaṃ diccaṃva vanajaṃ;	vara dam vara dam aggam diccam diccam va vana jam 
PA_anya-e11_02n:3	Bodhakaṃ bodhakaṃ pāṇaṃ, deva’devaṃ namāma’haṃ.	bodhakam bodhakam pāṇam devadevam namām aham 
PA_anya-e11_02n:4	Santaṃ santaṃ sadā vaṭṭaṃ, pajaṃ’bhave sutaṃ;	santam santam sadā vaṭṭam sutam 
PA_anya-e11_02n:5	Nibbudaṃ nibbudaṃ tāraṃ, dhammavaraṃ namāma’haṃ.	nibbudam nibbudam tāram dhamma varam namām aham 
PA_anya-e11_02n:6	Sutaṃ sutaṃ bhavane yaṃ, natanaṃ natanā’rahaṃ;	sutam sutam bhavane yam natanam natanāraham 
PA_anya-e11_02n:7	Narā’narā sadā’kaṃsu, saṅghavaraṃ namāma’haṃ.	saṅgha varam namām aham 
PA_anya-e11_02n:8	Icceva’maccantanatassaneyyaṃ, natayyamāno ratanattayaṃ yaṃ;	natayyamānaḥ ratanattayam yam 
PA_anya-e11_02n:9	Puññābhivaḍḍhiṃ mahagghaṃ alatthaṃ, tassānubhāvena hatantarāyo.	puñña abhivaḍḍhim mahaggham alattham tassa anubhāvena hata antarāyaḥ 
PA_anya-e11_02n:10	Vinaye sati ṭhite yaṃ, sāsanaṃ saṇṭhitaṃ bhave;	vinaye sati ṭhite yam sāsanam saṇṭhitam bhave 
PA_anya-e11_02n:11	Vinaye sati naṭṭhe yaṃ, vinaṭṭhaṃ sāsanaṃ bhave.	vinaye sati naṭṭhe yam vinaṭṭham sāsanam bhave 
PA_anya-e11_02n:12	Tasmā dittaṃ mame’dāni, jotayitvāna sāsane;	tasmai dittam mama idāni sāsane 
PA_anya-e11_02n:13	Bhinditvā dveḷhakaṃ vādaṃ, ekībhāvaṃ karoma’haṃ.	bhinditvā dveḷhakam vādam ekībhāvam karomaham 
PA_anya-e11_02n:14	Attukkaṃsana-bhāvañca, paravambhanakampica;	attukkaṃsana bhāvam ca paravambhana kampi ca 
PA_anya-e11_02n:15	Tesu cittaṃ apesetvā, sāsanassa suvuḍḍhiyā.	tesu cittam a pesetvā sāsanassa su vuḍḍhiyā 
PA_anya-e11_02n:16	Yadi me īdisaṃ cittaṃ, bhaveyyuṃ pāpasaṅkappā;	yadi me īdisam cittam bhaveyyum pāpa saṅkappā 
PA_anya-e11_02n:17	Paccissaṃ niraye bhayaṃ, hīna’jjhāsayakāraṇā.	niraye bhayam 
PA_anya-e11_02n:18	Sāsanassa sulabhaṃ’va patthayanto satā’cāro;	sāsanassa sulabham iva patthayanto sata ācāro 
PA_anya-e11_02n:19	Saṃsandissamahaṃ dāni, ciraṃ saddhamma’suddhiyā.	saṃsandissam aham dāni ciram saddhamma suddhiyā 
PA_anya-e11_02n:20	Sudullabhaṃ labhitvāna, pabbajjaṃ jinasāsane;	su dullabham labhitvāna pabbajjam jina sāsane 
PA_anya-e11_02n:21	Sambuddhassa varaṃ vādaṃ, katvā dveḷhaka’mekikaṃ.	sambuddhassa varam vādam katvā dveḷhaka mekikam 
PA_anya-e11_02n:22	Sīmavisodhaniṃ nāma, nānāganthasamāhaṭaṃ;	sīmavisodhanim nāma nānā gantha samāhaṭam 
PA_anya-e11_02n:23	Karissaṃ me nisāmentu, sādhavo kavipuṅgavā.	karissam me sādhavaḥ kavi puṅgavā 
PA_anya-e11_02n:24	Pāḷiṃ aṭṭhakathañceva, mātikaṃ padabhājaniṃ;	pāḷim aṭṭhakatham ca iva mātikam pada bhājanim 
PA_anya-e11_02n:25	Ogāhetvāna taṃ sabbaṃ, punappunaṃ asesato.	ogāhetvāna tam sabbam punappunam asesataḥ 
PA_anya-e11_02n:26	Attanomatiganthesu, ṭīkāgaṇṭhipadesuca;	atta no mati ganthesu ṭīkā gaṇṭhi padesu ca 
PA_anya-e11_02n:27	Vinicchayavimatīsu, mātikā’ṭṭhakathāsupi.	vinicchaya vimatīsu mātikā aṭṭhakathāsu pi 
PA_anya-e11_02n:28	Sabbaṃ asesakaṃ katvā, saṃsanditvāna ekato;	sabbam asesakam katvā saṃsanditvānaḥ ekatas 
PA_anya-e11_02n:29	Pavattā vaṇṇanā esā, tosayantī vicakkhaṇeti.	pavattā vaṇṇanā esā tosayantī vicakkhaṇā iti 
PA_anya-e11_02n:30	Buddhuppādo hi dullabho, tato pabbajjā ca upasampadā ca, vuttañhetaṃ	buddhuppādaḥ hi dullabhaḥ tatas pabbajjā ca upasampadā ca vuttam ha etam 
PA_anya-e11_02n:31	Buddho ca dullabho loke, saddhammasavanampi ca;	buddho ca dullabhaḥ loke saddhamma savanam pi ca 
PA_anya-e11_02n:32	Saṅgho ca dullabho loke, sappūrisā’tidullabhā.	saṅghaḥ ca dullabhaḥ loke sappūri sāti dullabhā 
PA_anya-e11_02n:33	Dullabhañca manussattaṃ, buddhuppādo ca dullabho;	dullabham ca manussattam buddhuppādaḥ ca dullabhaḥ 
PA_anya-e11_02n:34	Dullabhā khaṇasampatti, saddhammo paramadullabho’ti.	dullabhā khaṇa sampatti saddhammo parama dullabhaḥ ti 
PA_anya-e11_02n:35	1. Upasampadākaṇḍo	upasampadā kaṇḍo 
PA_anya-e11_02n:36_0	Imasmiñhi ṭhāne ṭhatvā buddhaguṇapaṭisaṃyuttāya kathāya vuccamānāya sādhūnaṃ cittasampahaṃsanañceva,	imasmin hi ṭhāne ṭhatvā buddha guṇa paṭisaṃyuttāya kathāya vuccamānāya sādhūnam citta sampahaṃsanam ca iva 
PA_anya-e11_02n:36_1	imasseva pakaraṇassa anummattavacanabhāvo ca bhaveyya, anummattavacanatte ca siddhe	imassa iva pakaraṇassa anummattavacana bhāvaḥ ca bhaveyya anummattavacana tte ca siddhe 
PA_anya-e11_02n:36_2	sotabbaṃ maññissanti, tasmā buddhaguṇaṃ vaṇṇayissāma. Amhākaṃ kira bhagavā brahmadevabuddhamādiṃ	sotabbam maññissanti tasmai buddha guṇam vaṇṇayissāma amhākam kira bhagavā brahma deva buddha mādim 
PA_anya-e11_02n:36_3	katvā yāva porāṇasakyagotamā manopaṇidhivasena, kaṭṭhavāhanajātakaṃādiṃkatvā yāva	katvā porāṇa sakya gotamāḥ manaḥ upaṇidhi vasena kaṭṭhavāhana jātakam ādiṃkatvā yāva 
PA_anya-e11_02n:36_4	majjhimadīpaṅkarā vācaṅgavasena majjhimadīpaṅkarapādamūlato paṭṭhāya kāyavācaṅgavasena	majjhima dīpaṅkarāḥ vācaṅga vasena majjhima dīpaṅkara pāda mūlataḥ paṭṭhāya kāya vācaṅga vasena 
PA_anya-e11_02n:36_5	sabbaṃ sampiṇḍetvā yāva vessantarattabhāvā vīsati asaṅkhyeyyāni pāramiyo pūrentassa	sabbam sampiṇḍetvā yāva vessanta ratta bhāvāḥ vīsati asaṅkhyeyyāni pāramiyaḥ pūrentassa 
PA_anya-e11_02n:36_6	sabbaññutaññāṇatthāya yeva alaṅkataṃ sīsaṃ chinditvā dentassa sabbaññubodhisattassa	sabbaññu taññāṇa tthāya yā iva alaṅkatam sīsam chinditvā dentassa sabbaññu bodhisattassa 
PA_anya-e11_02n:36_7	sīsaṃ jambudīpavāsīnaṃ uddhanatopi bahutaraṃ, añjitanayanaṃ uppāṭetvā dentassa nayanaṃ	sīsam jambudīpa vāsīnam uddhanataḥ api bahutaram añjita nayanam uppāṭetvā dentassa nayanam 
PA_anya-e11_02n:36_8	ajaṭākāse gaganatale tārāgaṇatopi bahutaraṃ, hadayamaṃsaṃ vā dakkhiṇabāhuṃ vā chinditvā	ajaṭā kāse gagana tale tārā gaṇataḥ api bahutaram hadaya maṃsam vā dakkhiṇa bāhum vā chinditvā 
PA_anya-e11_02n:36_9	dentassa maṃsaṃ chanahuta aṭṭhasa hassādhikasatasahassapamāṇasinerurājatopi bahutaraṃ,	dentassa maṃsam bahutaram 
PA_anya-e11_02n:36_10	lohitaṃ uppāṭetvā dentassa ruhiraṃ catūsu mahāsamuddesu udakatopi bahutaraṃ, maddīsadise	lohitam uppāṭetvā dentassa ruhiram catūsu mahā samuddesu udakataḥ api bahutaram maddī sadise 
PA_anya-e11_02n:36_11	ca bhariye jālīkaṇhājinasadise ca putte paresaṃ dāsatthāya dentassa gaṇanapathaṃ	ca bhariye jālī kaṇha ajina sadise ca putte paresam dāsa tthāya dentassa gaṇana patham 
PA_anya-e11_02n:36_12	vītivattā. Evaṃ pāramiyo pūrentasseva.	vītivattāḥ evam pāramiyaḥ pūrentassa iva 
PA_anya-e11_02n:37	Cintitaṃ sattasaṅkhyeyyaṃ, navasaṅkhyeyya’vācakaṃ;	cintitam satta saṅkhyeyyam nava saṅkhyeyya vācakam 
PA_anya-e11_02n:38	Kāyavācā catukhyātaṃ, buddhattaṃ samupāgamīti.	kāya vācā catu khyātam buddha ttam samupāgami iti 
PA_anya-e11_02n:39_0	Jātattakīsotattakiyā vuttanayena asūro hutvā buddhattaṃ cintentasseva sattaasaṅkhyeyyāni	vutta nayena asūraḥ hutvā buddhattam cintentassa iva satta asaṅkhyeyyāni 
PA_anya-e11_02n:39_1	vītivattāni. Atisūro ahutvā vācāmattameva nava asaṅkhyeyyāni vītivattāni. Atisūro	vītivattāni atisūraḥ a hutvā vācāmattam eva nava asaṅkhyeyyāni vītivattāni atisūraḥ 
PA_anya-e11_02n:39_2	hutvā kāyaṅgavācaṅgavasena pūrentassa cattāri asaṅkhyeyyāni vītivattāni. Imāni cattāri	hutvā kāyaṅga vācaṅga vasena pūrentassa cattāri asaṅkhyeyyāni vītivattāni imāni cattāri 
PA_anya-e11_02n:39_3	asaṅkhyeyyāni dīpaṅkarapādamūlato paṭṭhāya veditabbāni. Satasahassakappamatthake	asaṅkhyeyyāni dīpaṅkara pāda mūlataḥ paṭṭhāya veditabbāni sata sahassa kappa matthake 
PA_anya-e11_02n:39_4	pana ajjhattapāramī pūritāti veditabbā. Vessantarattabhāvena ca sattakamahādānaṃ	pana ajjhatta pāramī pūritā iti veditabbā vessanta ratta bhāvena ca sattaka mahā dānam 
PA_anya-e11_02n:39_5	datvā sattakkhattuṃ pathaviṃ kampetvā vaṅkapabbataṃ gantvā nayanasadise dve putte	datvā satta kkhattum pathavim kampetvā vaṅka pabbatam gantvā nayana sadise dve putte 
PA_anya-e11_02n:39_6	brāhmaṇassa dāsatthāya datvā dutiyadivase brāhmaṇavaṇṇena āgatassa sakkassa devarañño	brāhmaṇassa dāsa tthāya da tvā dutiya divase brāhmaṇa vaṇṇena āgatassa sakkassa deva rañño 
PA_anya-e11_02n:39_7	attasamaṃ maddiṃ nāma bhariyaṃ datvā tasmiṃ bhave aparimeyyāni puññāni katvā tato	attasamam maddim nāma bhariyam da tvā tasmin bhave aparimeyyāni puññāni katvā tatas 
PA_anya-e11_02n:39_8	tusitapuraṃ gantvā tattha yāvatāyukaṃ ṭhatvā dasahi cakkavāḷasahassehi āgantvā devatāvisesehi.	tusitapuram gantvā tattha yāvatāyukam ṭhatvā dasahi cakkavāḷa sahassehi āgantvā devatā visesehi 
PA_anya-e11_02n:40	Kālo deva mahāvīra, uppajja mātukucchiyaṃ;	kālaḥ deva mahāvīraḥ uppajja mātukucchiyam 
PA_anya-e11_02n:41	Sadevakaṃ tārayanto, bujjhassu amataṃ padanti.	sa devakam tārayantaḥ bujjhassu amatam padanti 
PA_anya-e11_02n:42_0	Yāciyamāno kālaṃ dīpañca desañca kulaṃ mātaramevacāti imāni pañca mahāvilokanāni	kālam dīpam ca desam ca kulam mātaram eva ca ati imāni pañca mahā vilokanāni 
PA_anya-e11_02n:42_1	viloketvā tusitapurato cavitvā mahāsammatavaṃsajassa okkākarañño puttānaṃ kusalambhedabhayena	viloketvā tusita puratas cavitvā mahāsammatavaṃsajassa okkākarañño puttānam kusalambheda bhayena 
PA_anya-e11_02n:42_2	bhaginīhiyeva saddhiṃ āvāhakaraṇaṃ sutvā sakyā vata bho rājakumārāti okkākamahārājena	bhaginī hiyā iva saddhim āvāha karaṇam sutvā sakyāḥ vata bho rāja kumārāḥ ati okkāka mahārājena 
PA_anya-e11_02n:42_3	vuttavacanaṃ pavattanimittaṃ katvā sakyāti laddhanāmānaṃ rājūnamabbhantare pavattassa	vutta vacanam pavatta nimittam katvā sakyāti laddha nāmānam rājūnam abbhantare pavattassa 
PA_anya-e11_02n:42_4	suddhodanamahārājassa jeṭṭhamahesiyā sirimahāmāyāya kucchimhi nibbattitvā dasamāsaccayena	suddhodana mahārājassa jeṭṭha mahesiyā sirimahāmāyāya kucchimhi nibbattitvā dasa māsa cayena 
PA_anya-e11_02n:42_5	devadahanagarassa kapilavatthussa ca majjhe lumbinīvane mātukucchito nikkhamitvā	devadaha nagarassa kapilavatthussa ca majjhe lumbinī vane mātukucchitaḥ nikkhamitvā 
PA_anya-e11_02n:42_6	jātakkhaṇeyeva uttarābhimukhaṃ sattapadavītihārena gantvā achambhivācaṃ nicchāretvā	jātakkhaṇeyā iva uttara abhimukham satta padavī tihārena gantvā achambhi vācam nicchāretvā 
PA_anya-e11_02n:42_7	pitaraṃ vandāpetvā anukkamena soḷasavassuddesikakāle rajjasiriṃ anubhavitvā rāhulabhaddassa	pitaram vandāpetvā anukkamena soḷasa vassuddesika kāle rajjasirim anubhavitvā rāhulabhaddassa 
PA_anya-e11_02n:42_8	jātadivase nikkhamitvā chabbassāni dukkaracariyaṃ caritvā vesākhapuṇṇamadivase anuttaraṃ	jāta divase nikkhamitvā cha bassāni dukkara cariyam caritvā vesākha puṇṇama divase anuttaram 
PA_anya-e11_02n:42_9	sammāsambodhiṃ abhisambujjhitvā pañcacattālīsa vassāni devamanussānaṃ ratanadāmaṃ	sammāsambodhim abhisambujjhitvā pañcacattālīsa vassāni deva manussānam ratana dāmam 
PA_anya-e11_02n:42_10	ganthento viya dhammaratanavassaṃ vassāpetvā yāva subhaddaparibbājakavinayanā katabuddhakicce	ganthentaḥ viya dhammaratana vassam vassāpetvā yāva subhadda paribbājaka vinayanā kata buddha kicce 
PA_anya-e11_02n:42_11	kusinārāyaupavaṭṭane mallānaṃ sālavane vesākhapuṇṇamadivase paccūsasamaye anupādisesāya	kusinārāya upavaṭṭane mallānam sālavane vesākhapuṇṇama divase paccūsa samaye an upādisesāya 
PA_anya-e11_02n:42_12	nibbānadhātuyā parinibbute bhagavatilokanāthe subhaddena vuḍḍhapabbajitena “alaṃ	nibbāna dhātuyā parinibbute bhagavati loka nāthe subhaddena vuḍḍha pabbajitena alam 
PA_anya-e11_02n:42_13	āvuso mā socittha mā paridevittha, sumuttā mayaṃ tena mahāsamaṇena, upaddutā ca homa’idaṃ	āvuso mā socittha mā paridevittha su muttā mayam tena mahā samaṇena upaddutā ca 
PA_anya-e11_02n:42_14	vo kappati idaṃ vo na kappatī’ti. Idāni pana mayaṃ yaṃ icchissāma taṃ karissāma,	vaḥ kappati idam vaḥ na kappati iti idāni pana mayam yam icchissāma tam karissāma 
PA_anya-e11_02n:42_15	yaṃ na icchissāma na taṃ karissāmā”ti vuttavacanaṃ sallakkhetvā gaṇapāmokkhānaṃ sattannaṃ	yam naḥ icchissāma na tam karissāma ati vutta vacanam sallakkhetvā gaṇa pāmokkhānam sattannam 
PA_anya-e11_02n:42_16	bhikkhusatasahassānaṃ saṅghatthero āyasmā mahākassapo dhammasaṅgītiṃ katvā parisuddhe	bhikkhu sata sahassānam saṅgha ttheraḥ āyasmā mahākassapaḥ dhamma saṅgītim katvā parisuddhe 
PA_anya-e11_02n:42_17	dhammavinaye tato aparabhāge vassasatassa accayena vesāliyā vajjiputtakā dasavatthūni	dhamma vinaye tatas aparabhāge vassa satassa accayena vesāliyāḥ vajjiputtakāḥ dasa vatthūni 
PA_anya-e11_02n:42_18	dassetvā sāsanavipattiṃ karonte disvā āyasmatā yasattherena kākaṇḍakaputtena samussāhiyamāno	dassetvā sāsana vipattim karonte disvā āyasmatā yasattherena kākaṇḍaka puttena samussāhiyamāno 
PA_anya-e11_02n:42_19	dutiyasaṅgītiṃ katvā tato aparabhāge tathāgatassa parinibbānato dvinnaṃ vassasatānaṃ	dutiya saṅgītim katvā tatas apara bhāge tathāgatassa parinibbānataḥ dvinnam vassa satānam 
PA_anya-e11_02n:42_20	upari aṭṭhārasame vasse dhammāsokonāma rājā sakalajambudīpatale ekarajjābhisekaṃ	upari aṭṭhārasame vasse dhammāsokaḥ nāma rājā sakala jambudīpa tale eka rajja abhisekam 
PA_anya-e11_02n:42_21	pāpuṇitvā buddhasāsane mahantaṃ lābhasakkāraṃ pavattetvā parihīnalābhasakkārā titthiyā	pāpuṇitvā buddha sāsane mahantam lābha sakkāram pavattetvā parihīna lābha sakkārā titthiyā 
PA_anya-e11_02n:42_22	antamaso ghāsacchādanamattampi alabhantā lābhasakkāraṃ patthayamānā sāsane pabbajitvā	antamasaḥ ghāsa chādana mattam pi a labhantā lābha sakkāram patthayamānā sāsane pabbajitvā 
PA_anya-e11_02n:42_23	sakāni sakāni diṭṭhigatāni dīpetvā sāsane mahantaṃ abbudañca malañca pavattesuṃ.	sakāni sakāni diṭṭhi gatāni dīpetvā sāsane mahantam abbudam ca malam ca pavattesuṃ 
PA_anya-e11_02n:42_24	Tadā dhammāsokarañño pattābhisekato sattarasame vasse saṭṭhisatasahassa bhikkhūsu	tadā dhammāsokarañño patta abhisekato sattarasame vasse bhikkhūsu 
PA_anya-e11_02n:42_25	sahassabhikkhuṃ gahetvā moggaliputtatisso nāma saṅghatthero mahāpavāraṇāya parappavādaṃ	sahassa bhikkhum gahetvā moggaliputtatissaḥ nāma saṅgha ttheraḥ mahā pavāraṇāya parappavādam 
PA_anya-e11_02n:42_26	bhinditvā kathāvatthuppakaraṇaṃ desetvā tatiyadhammasaṅgītiṃ katvā parisuddhe dhammavinaye	bhinditvā kathā vatthu pakaraṇam desetvā tatiya dhamma saṅgītim katvā parisuddhe dhamma vinaye 
PA_anya-e11_02n:42_27	sāṭṭhakathebuddhavacane dharanteva pāḷiyaṭṭhakathāsu atthacchāyaṃ gahetvā attano	sa aṭṭhakathe buddha vacane dharantā iva pāḷiya aṭṭhakathāsu attha chāyam gahetvā 
PA_anya-e11_02n:42_28	mativasena nānāganthavisesāni karonti, tesu attanomativasena atthacchāyaṃ gahetvā	mati vasena nānā gantha visesāni karonti tesu attano mati vasena attha chāyam gahetvā 
PA_anya-e11_02n:42_29	kāraṇapatirūpakaṃ katvā vuttavacanaṃ sārato sallakkhetvā sutta-suttānulomaācariyavāde	kāraṇa patirūpakam katvā vutta vacanam sārataḥ sallakkhetvā sutta sutta anuloma ācariya vāde 
PA_anya-e11_02n:42_30	muñcitvā pāḷiyā aṭṭhakathaṃ, aṭṭhakathāya ca pāḷiṃ tabbivaraṇabhūtaṃ sāratthadīpaniñca	muñcitvā pāḷiyāḥ aṭṭhakatham aṭṭhakathāya ca pāḷim tad vivaraṇa bhūtam sārattha dīpanim ca 
PA_anya-e11_02n:42_31	aññāni ca ganthavisesāni asaṃsanditvā attanomatiyāpi pubbāparaṃ asamānetvā vādappakāsanamattameva	aññāni ca gantha visesāni a saṃsanditvā attano matiyā api pubba aparam a samānetvā vāda ppakāsana mattam eva 
PA_anya-e11_02n:42_32	ṭhapetvā garukalahukesu garukeyeva ṭhātabbepi garuke aṭṭhatvā keci bhikkhū nadiyā	ṭhapetvā garuka lahukesu garuke iya iva ṭhātabbe pi garuke a ṭhatvā keci bhikkhū nadiyā 
PA_anya-e11_02n:42_33	udakukkhepaṃ akatvā karonti. Evaṃ sāsane dvidhā bhinnā honti. Idañca bhindanaṃ kosambakakkhandhake	udakukkhepam a katvā karonti evam sāsane dvidhā bhinnāḥ honti idam ca bhindanam kosambaka khandhake 
PA_anya-e11_02n:42_34	bhinnatopi sataguṇena sahassaguṇena balavatarameva sāsanassa vipattikāraṇattā, tathā	bhinnataḥ api sataguṇena sahassaguṇena balavataram eva sāsanassa vipatti kāraṇa ttā tathā 
PA_anya-e11_02n:42_35	hi na idaṃ manussaloke bhikkhūnaṃyeva hoti, bhikkhūnaṃ, upāsakamanussānaṃ, ārakkhakadevatānampi,	hi naḥ idam manussa loke bhikkhūnam yeva hoti bhikkhūnam upāsaka manussānam ārakkhaka devatānam pi 
PA_anya-e11_02n:42_36	tāsaṃ sahāyakānaṃ bhummanissitadevatānampi tāsaṃ sahāyakānaṃ rukkhanissitadevatānampi	tāsam sahāyakānam bhumma nissita devatānam pi tāsam sahāyakānam rukkha nissita devatānam pi 
PA_anya-e11_02n:42_37	tāsaṃsahāyakānaṃ ākāsaṭṭhakadevatānampi, tāsaṃ sahāyakānaṃ cātumahārājikadevatānampi,	tāsam sahāyakānam ākāsaṭṭhaka devatānam pi tāsam sahāyakānam cātumahārājika devatānam pi 
PA_anya-e11_02n:42_38	tāsaṃ sahāyakānaṃ tāvatiṃsadevatānampi, evaṃ mittaparamparavasena chakāmāvacaradevatānampi	tāsam sahāyakānam tāvatiṃsa devatānam pi evam mitta parampara vasena cha kāmāvacara devatānam pi 
PA_anya-e11_02n:42_39	tāsaṃ mittānaṃ brahmapārisajjānampīti evaṃ yāvaakaniṭṭhabrahmalokā ariyapuggale ṭhapetvā	tāsam mittānam brahma pārisajjānam pi iti evam yāva akaniṭṭha brahma lokāḥ ariya puggale ṭhapetvā 
PA_anya-e11_02n:42_40	sabbe puthujjanā devamanussā bhinnā honti, tesaṃ bhinnattā bahu ca pāpaṃ pasavati,	sabbe puthujjanāḥ deva manussāḥ bhinnāḥ honti tesam bhinna ttā bahu ca pāpam pasavati 
PA_anya-e11_02n:42_41	tasmā pāḷiyā aṭṭhakathaṃ, aṭṭhakathāya ca pāḷiṃ saṃsanditvā tāni tāni ganthavisesāni	tasmā pāḷiyā aṭṭhakatham aṭṭhakathāya ca pāḷim saṃsanditvā tāni tāni gantha visesāni 
PA_anya-e11_02n:42_42	ca ekato katvā gaṅgodake na yamunodakaṃ viya missitvā ekībhāvaṃ katvā sīmavisodhaniṃ	ca ekatas katvā gaṅgā udake na yamunā udakam viya missitvā ekībhāvam katvā sīma visodhanim 
PA_anya-e11_02n:42_43	nāma karissāmi, taṃ suṇātha sādhukaṃ manasikarotha dhammarājassa sāvakāti.	nāma karissāmi tam suṇātha sādhukam manasikarotha dhammarājassa sāvaka ati 
PA_anya-e11_02n:43_0	Tattha buddhuppādo dullabho ti buddhassa uppādakālo dullabho tathā hi anuppannakāle	tattha buddha uppādaḥ dullabhaḥ ti buddhassa uppāda kālaḥ dullabhaḥ tathā hi anuppanna kāle 
PA_anya-e11_02n:43_1	buddhe buddhoti saddampi asutvā vītivattānaṃ kappānaṃ gaṇanapathaṃ vītivattā. Buddhakāraṇassa	buddhe buddhaḥ iti saddam pi a sutvā vītivattānam kappānam gaṇana patham vītivattā buddha kāraṇassa 
PA_anya-e11_02n:43_2	dukkarattaṃ heṭṭhā vuttameva.	dukkara ttam heṭṭhā vuttam eva 
PA_anya-e11_02n:44_0	Tato pabbajā ca upasampadācā tiettha topaccayo lāmakatthe, pañcamyatthe vā. Buddhuppādo	tatas pabbajā ca upasampadā ācā ti ettha to paccayaḥ lāmaka atthe pañcamī atthe vā buddhuppādaḥ 
PA_anya-e11_02n:44_1	dullabho, tamanupabbajjā ca upasampadā ca dullabhāyevāti adhippāyo. Yathā ca loke	dullabhaḥ tam anupabbajjā ca upasampadā ca dullabhāya iva ati adhippāyaḥ yathā ca loke 
PA_anya-e11_02n:44_2	kiñcideva mahagghaṃ alabhitabbaṃ labhitvā vā tena sahakārīkāraṇabhūtaṃ appagghampi	kiñcid eva mahaggham a labhitabbam labhitvā vā tena sahakārī kāraṇa bhūtam appaggham pi 
PA_anya-e11_02n:44_3	mahagghaṃ mahagghaṃ dullabhaṃ dullabhanti vuccati, evameva atidullabhaṃ buddhuppādaṃ	mahaggham mahaggham dullabham dullabhanti vuccati evam eva ati dullabham buddhuppādam 
PA_anya-e11_02n:44_4	āgamma tamanupabbajitampi dullabhanti vuccati, yathā ca nidiyā uparimabhāge sattāhavaṭṭalikādibhāvena	āgamma tam anupabbajitam pi dullabhanti vuccati yathā ca nidiyā uparima bhāge satta aha vaṭṭalikā ādi bhāvena 
PA_anya-e11_02n:44_5	udakapūraṇe heṭṭhā kismiñci ṭhāne tarituṃ avisahantā idameva ṭhānaṃ dukkaranti vuccati,	udaka pūraṇe heṭṭhā kismiñci ṭhāne taritum a visahantā idam eva ṭhānam dukkaranti vuccati 
PA_anya-e11_02n:44_6	evameva buddhakāraṇassa dukkarabhāve na tamanupabbajjupasampadāpi dukkaraṃ dullabhanti	evam eva buddha kāraṇassa dukkara bhāve na tam anu pabbajja upasampadā api dukkaram dullabhanti 
PA_anya-e11_02n:44_7	vuccati. Aññathā buddhabhagavato pi pabbajjupasampadabhāvoyeva seṭṭho bhaveyya. Athavā	vuccati aññathā buddha bhagavataḥ pi pabbajja upasampad abhāvaḥ yā iva seṭṭhaḥ bhaveyya athavā 
PA_anya-e11_02n:44_8	kāraṇūpacāravasenāpi evaṃ vuttanti daṭṭhabbaṃ, yathā semhoguḷoti tathā hi guḷassa	kāraṇa upacāra vasena api evam vuttanti daṭṭhabbam yathā semhaḥ guḷaḥ ti tathā hi guḷassa 
PA_anya-e11_02n:44_9	pi vanapaccayā semho ussanno, taṃ jano guḷenasemhoti vattabbepi kāraṇasmiṃ guḷe phalabhūtaṃ	pi vana paccayā semhaḥ ussannaḥ tam janaḥ guḷena semhaḥ ti vattabbe pi kāraṇasmim guḷe phala bhūtam 
PA_anya-e11_02n:44_10	semhaṃ ropetvā semho guḷoti vuccati, evaṃ kāraṇassa dukkarattā dullabhe buddhuppāde	semham ropetvā semhaḥ guḷaḥ ti vuccati evam kāraṇassa dukkara ttā dullabhe buddhuppāde 
PA_anya-e11_02n:44_11	tamanukriyā pabbajjāpi taṃ mūlakāraṇabhūte buddhuppāde ropetvā dullabhā pabbajjāti	tam anukriyā pabbajjā api tam mūla kāraṇa bhūte buddhuppāde ropetvā dullabhā pabbajjā ati 
PA_anya-e11_02n:44_12	vuccati. Buddhuppādakālepi buddhadassanaṃ dullabhameva, anuppannakāle pana pageva,	vuccati buddhuppāda kāle pi buddha dassanam dullabham eva anuppanna kāle pana pagā iva 
PA_anya-e11_02n:44_13	sabbakhaṇesu navamakhaṇattā ca tathā hi milakkhudesaarūpabhūmiasaññasattanirayapetatiracchānabhūmīsu	sabba khaṇesu navama khaṇa ttā ca tathā hi 
PA_anya-e11_02n:44_14	jāyamānesu vā majjhimadese jāyamānopi micchādiṭṭhibhūtā vā, sammādiṭṭhikule jāyamānāpi	jāyamānesu vā majjhima dese jāyamānaḥ api micchādiṭṭhi bhūtā vā sammādiṭṭhi kule jāyamānā api 
PA_anya-e11_02n:44_15	cakkhusota vikalabhāvena aṅgavikalā vā buddhadassanaṃ na arahanti, dassanampi dassanamattameva.	vikala bhāvena aṅga vikalāḥ vā buddha dassanam na arahanti dassanam pi dassana mattam eva 
PA_anya-e11_02n:44_16	Supaṇṇanāgarājādīnaṃ tasmiṃ bhave maggaphalabhāgino na honti, honti cettha.	supaṇṇa nāga rāja ādīnam tasmin bhave magga phala bhāginaḥ na honti honti ca ittha 
PA_anya-e11_02n:45	“Paccantajo arūpino, vikalaṅgo asaññajo;	paccanta jaḥ arūpinaḥ vikalaṅgaḥ asaññajo 
PA_anya-e11_02n:46	Micchādiṭṭhi tiracchāno, peto nerayikopica.	micchā diṭṭhi nerayikaḥ api ca 
PA_anya-e11_02n:47	Ete aṭṭhakkhaṇā vuttā, buddhenādiccabandhunā;	ete aṭṭhakkhaṇāḥ vuttāḥ buddhena adiccabandhunā 
PA_anya-e11_02n:48	Buddhuppādo khaṇo eko, navamoti pavuccatīti”.	buddhuppādaḥ khaṇaḥ ekaḥ navamaḥ ti pavuccati iti 
PA_anya-e11_02n:49_0	Pabbajjā ticettha sāmaññena vuttepi sāmaṇerāva adhippetā, upasampadā cāti visuṃ vuttattā.	pabbajjā ti ca ittha sāmaññena vutte pi sāmaṇerāḥ ava adhippetāḥ upasampadā ca iti visum vutta ttā 
PA_anya-e11_02n:49_1	Sāmaṇerā ca nāma buddhaṃ saraṇaṃ gacchāmityādinā tikkhattuṃ vatvā ubhatosuddhivaseneva	sāmaṇerāḥ ca nāma buddham saraṇam gacchāmi ityādinā tikkhattum vatvā ubhatas suddhi vasena iva 
PA_anya-e11_02n:49_2	sāmaṇerabhūmiyaṃ tiṭṭhanti. Dasasīlāni pana tesaṃ sikkhāpadamattameva. Tāni pāḷivasena	sāmaṇera bhūmiyam tiṭṭhanti dasa sīlāni pana tesam sikkhāpada mattam eva tāni pāḷi vasena 
PA_anya-e11_02n:49_3	asakkonto atthavasena “idañca samādāya vattehī”ti ācikkhitumpi vaṭṭatiyeva. Idha	a sakkontaḥ attha vasena idam ca samādāya vattehi iti ācikkhitum pi vaṭṭatiyā iva idha 
PA_anya-e11_02n:49_4	vattabbaṃ natthi. Upasampadā pana aṭṭhavidhā honti ehibhikkhūpasampadā, saraṇagamanūpasampadā,	vattabbam natthi upasampadā pana aṭṭhavidhāḥ honti ehibhikkhu upasampadā saraṇagamana upasampadā 
PA_anya-e11_02n:49_5	ovāda paṭiggahaṇūpasampadā, pañhābyākaraṇūpasampadā, aṭṭhagarudhammapaṭiggahaṇūpasampadā,	ovāda paṭiggahaṇa upasampadā pañha abyākaraṇa upasampadā aṭṭhagaru dhamma paṭiggahaṇa upasampadā 
