segmentnr	original	analyzed
PA_anya-e09_02n:0	Namo tassa bhagavato arahato sammāsambuddhassa	namaḥ tassa bhagavataḥ arahataḥ sammāsambuddhassa 
PA_anya-e09_02n:1	Suttantapiṭaka	suttantapiṭaka 
PA_anya-e09_02n:2	Majjhimanikāya	majjhima nikāya 
PA_anya-e09_02n:3	Mūlapaṇṇāsapāḷi	mūla paṇṇāsa pāḷi 
PA_anya-e09_02n:4	Saṃgāyanassa pucchā vissajjanā	saṃgāyanassa pucchā vissajjanā 
PA_anya-e09_02n:5	Pucchā – paṭhamamahāsaṃgītikāle āvuso dhammasaṃgāhakā mahākassapādayo mahātheravarā dīghanikāyaṃ saṃgāyitvā tadanantaraṃ kiṃ nāma pāvacanaṃ saṃgāyiṃsu.	pucchā paṭhama mahā saṃgīti kāle āvuso dhamma saṃgāhakāḥ mahākassapa ādayaḥ mahā thera varāḥ dīgha nikāyam saṃgāyitvā tad anantaram kim nāma saṃgāyiṃsu 
PA_anya-e09_02n:6	Vissajjanā – paṭhamamahāsaṃgītikāle bhante dhammasaṃgāhakā mahākassapādayo mahātheravarā dīghanikāyaṃ saṃgāyitvā tadanantaraṃ majjhimaṃ nāma nikāyaṃ saṃgāyiṃsu.	vissajjanā paṭhama mahā saṃgīti kāle bhante dhamma saṃgāhakāḥ mahākassapa ādayaḥ mahā thera varāḥ dīgha nikāyam saṃgāyitvā tad anantaram majjhimam nāma nikāyam saṃgāyiṃsu 
PA_anya-e09_02n:7	Pucchā – majjhimanikāyo nāma āvuso mūlapaṇṇāsako majjhima paṇṇāsako uparipaṇṇāsakoti paṇṇāsakavasena tividho, tattha kataraṃ paṇṇāsakaṃ paṭhamaṃ saṃgāyiṃsu.	pucchā majjhimanikāyaḥ nāma āvuso mūla paṇṇāsakaḥ majjhima paṇṇāsako upari paṇṇāsakaḥ ti paṇṇāsaka vasena tividhaḥ tattha kataram paṇṇāsakam paṭhamam saṃgāyiṃsu 
PA_anya-e09_02n:8	Vissajjanā – tīsu bhante paṇṇāsakesu mūlapaṇṇāsakaṃ nāma pāvacanaṃ dhammasaṃgāhakā mahātheravarā paṭhamaṃ saṃgāyiṃsu.	vissajjanā tīsu bhante paṇṇāsakesu mūlapaṇṇāsakam nāma pāvacanam dhamma saṃgāhakāḥ mahā thera varā paṭhamam saṃgāyiṃsu 
PA_anya-e09_02n:9	Pucchā – mūlapaṇṇāsakepi āvuso pañcavaggā paṇṇāsa ca suttāni, tesu kataraṃ vaggaṃ katarañca suttaṃ paṭhamaṃ saṃgāyiṃsu.	pucchā mūla paṇṇāsake pi āvuso pañca vaggā paṇṇāsa ca suttāni tesu kataram vaggam kataram ca suttam paṭhamam saṃgāyiṃsu 
PA_anya-e09_02n:10	Vissajjanā – mūlapaṇṇāsake bhante pañcasu vaggesu paṭhamaṃ mūlapariyāyavaggaṃ paṇṇāsakesu ca suttesu paṭhamaṃ mūlapariyāyasuttaṃ saṃgāyiṃsu.	vissajjanā mūla paṇṇāsake bhante pañcasu vaggesu paṭhamam mūlapariyāya vaggam paṇṇāsakesu ca suttesu paṭhamam mūlapariyāya suttam saṃgāyiṃsu 
PA_anya-e09_02n:11	Sādhu āvuso mayampi dāni tatoyeva paṭṭhāya saṃgītipubbaṅgamāni pucchāvissajjanakiccāni kātuṃ samārabhāma.	sādhu āvuso mayam pi dāni tatas yeva paṭṭhāya saṃgīti pubbaṅgamāni pucchā vissajjana kiccāni kātum samārabhāma 
PA_anya-e09_02n:12	Mūlapariyāyasutta	mūla pariyāya sutta 
PA_anya-e09_02n:13	Pucchā – tena āvuso bhagavatā jānatā passatā arahatā sammāsambuddhena mūlapariyāyasuttaṃ kattha kaṃ ārabbha kismiṃ vatthusmiṃ bhāsitaṃ.	pucchā tena āvuso bhagavatā jānatā passatā arahatā sammāsambuddhena mūlapariyāya suttam kattha kam ārabbha kismim vatthusmim bhāsitaṃ 
PA_anya-e09_02n:14_0	Vissajjanā – ukkaṭṭhāyaṃ bhante pañcasate brāhmaṇakulā pabbajite ārabbha bhāsitaṃ,	vissajjanā ukkaṭṭhā ayam bhante pañca sate brāhmaṇa kulā pabbajite ārabbha bhāsitam 
PA_anya-e09_02n:14_1	pañcasatā bhante brāhmaṇakulā pabbajitā bhikkhū pariyattiṃ nissāya mānaṃ uppādesuṃ,	pañca satā bhante brāhmaṇa kulā pabbajitāḥ bhikkhū pariyattim nissāya mānam uppādesuṃ 
PA_anya-e09_02n:14_2	tasmiṃ bhante vatthusmiṃ bhāsitaṃ.	tasmin bhante vatthusmin bhāsitam 
PA_anya-e09_02n:15	Pucchā – taṃ panāvuso suttaṃ bhagavatā katihi vārehi katihi ca antogadhapadehi vibhajitvā bhāsitaṃ.	pucchā tam pana āvuso suttam bhagavatā katihi vārehi katihi ca antogadha padehi vibhajitvā bhāsitam 
PA_anya-e09_02n:16	Vissajjanā – taṃ pana bhante mūlapariyāyasuttaṃ bhagavatā aṭṭhahi ca vārehi catuvīsatiyā ca antogadhapadehi vibhajitvā desitaṃ.	vissajjanā tat pana bhante mūla pariyāya suttam bhagavatā aṭṭhahi ca vārehi catuvīsatiyā ca antogadha padehi vibhajitvā desitam 
PA_anya-e09_02n:17	Sabbāsavasutta	sabbāsavasutta 
PA_anya-e09_02n:18	Pucchā – dutiyaṃ panāvuso sabbāsavasuttaṃ bhagavatā kattha kaṃ ārabbha bhāsitaṃ.	pucchā dutiyam pana āvuso sabbāsava suttam bhagavatā kattha kam ārabbha bhāsitam 
PA_anya-e09_02n:19	Vissajjanā – sabbāsavasuttaṃ pana bhante bhagavatā sāvatthiyaṃ sambahule bhikkhū ārabbha bhāsitaṃ.	vissajjanā sabbāsava suttam pana bhante bhagavatā sāvatthiyam sambahule bhikkhū ārabbha bhāsitaṃ 
PA_anya-e09_02n:20	Pucchā – tatthāvuso bhagavatā āsavā katihi pakārehi vibhajitvā dassitā.	pucchā tattha āvuso bhagavatā āsavā katihi pakārehi vibhajitvā dassitā 
PA_anya-e09_02n:21	Vissajjanā – sattahi bhante pakārehi vibhajitvā āsavā bhagavatā pakāsitā.	vissajjanā sattahi bhante pakārehi vibhajitvā āsavā bhagavatā pakāsitā 
PA_anya-e09_02n:22	Dhammadāyādasutta	dhammadāyāda sutta 
PA_anya-e09_02n:23	Pucchā – dhammadāyādasuttaṃ panāvuso bhagavatā kattha kaṃ ārabbha kismiṃ vatthusmiṃ bhāsitaṃ.	pucchā dhammadāyāda suttam pana āvuso bhagavatā kattha kam ārabbha kismim vatthusmim bhāsitam 
PA_anya-e09_02n:24	Vissajjanā – sāvatthiyaṃ bhante sambahule bhikkhū ārabbha bhāsitaṃ, bhagavato ca bhante bhikkhusaṅghassa ca tadā mahālābhasakkāro udapādi, tasmiṃ bhante vatthusmiṃ bhāsitaṃ.	vissajjanā sāvatthiyam bhante sambahule bhikkhū ārabbha bhāsitam bhagavataḥ ca bhante bhikkhu saṅghassa ca tadā mahā lābha sakkāraḥ udapādi tasmim bhante vatthusmim bhāsitam 
PA_anya-e09_02n:25	Pucchā – tatthāvuso dve anusandhayo, tesu paṭhame anusandhimhi kathaṃ bhagavatā bhikkhūnaṃ ovādo dinno.	pucchā tattha āvuso dve anusandhayo tesu paṭhame anusandhimhi katham bhagavatā bhikkhūnam ovādaḥ dinno 
PA_anya-e09_02n:26_0	Vissajjanā – paṭhame bhante anusandhimhi dhammadāyādā me bhikkhave bhavatha mā āmisadāyādā,	vissajjanā paṭhame bhante anusandhimhi dhamma dāyādāḥ me bhikkhave bhavatha mā āmisa dāyādāḥ 
PA_anya-e09_02n:26_1	atthi me tumhesu anukampā, kinti me sāvakā dhammadāyādā bhaveyyuṃ no āmisadāyādāti	atthi me tumhesu anukampā kinti me sāvakā dhamma dāyādāḥ bhaveyyum no āmisa dāyādā ti 
PA_anya-e09_02n:26_2	evamādinā bhagavatā bhikkhūnaṃ ovādo dinno.	evamādinā bhagavatā bhikkhūnam ovādaḥ dinno 
PA_anya-e09_02n:27	Dhammadāyādā me bhikkhave bhavatha mā āmisadāyādā, atthi me tumhesu anukampā kinti me sāvakā dhammadāyādā bhaveyyuṃ, no āmisadāyādā.	dhamma dāyādāḥ me bhikkhave bhavatha mā āmisa dāyādāḥ atthi me tumhesu anukampā kinti me sāvakāḥ dhamma dāyādāḥ bhaveyyuṃ no āmisa dāyādāḥ 
PA_anya-e09_02n:28	Pucchā – dutiye panāvuso anusandhimhi āyasmatā sāriputtattherena dhammasenāpatinā kīdisī dhammadesanā vibhajitvā pakāsitā.	pucchā dutiye pana āvuso anusandhimhi āyasmatā sāriputta therena dhamma senāpatinā kīdisī dhamma desanā vibhajitvā pakāsitā 
PA_anya-e09_02n:29_0	Vissajjanā – dutiye pana bhante anusandhimhi āyasmatā sāriputtattherena dhammasenāpatinā	vissajjanā dutiye pana bhante anusandhimhi āyasmatā sāriputta therena dhamma senāpatinā 
PA_anya-e09_02n:29_1	satthu pavivittassa viharato sāvakānaṃ vivekaṃ ananusikkhataṃ tīhi ṭhānehi gārayutaṃ,	satthu pavivittassa viharataḥ sāvakānam vivekam an anusikkhatam tīhi ṭhānehi gārayutam 
PA_anya-e09_02n:29_2	anusikkhantānañca tīhi ṭhānehi pāsaṃsataṃ, soḷasa ca pāpake dhamme tesañca pahānāya	anusikkhantānam ca tīhi ṭhānehi soḷasa ca pāpake dhamme tesañca pahānāya 
PA_anya-e09_02n:29_3	majjhimā paṭipadā vibhajitvā pakāsitā.	majjhimā paṭipadā vibhajitvā pakāsitā 
PA_anya-e09_02n:30	Bhayabheravasutta	bhayabheravasutta 
PA_anya-e09_02n:31	Pucchā – bhayabheravasuttaṃ panāvuso bhagavatā kattha kaṃ ārabbha kismiṃ vatthusmiṃ bhāsitaṃ.	pucchā bhayabherava suttam pana āvuso bhagavatā kattha kam ārabbha kismim vatthusmim bhāsitam 
PA_anya-e09_02n:32_0	Vissajjanā – sāvatthiyaṃ bhante jāṇussoṇiṃ brāhmaṇaṃ ārabbha bhāsitaṃ, jāṇussoṇi	vissajjanā sāvatthiyam bhante jāṇussoṇim brāhmaṇam ārabbha bhāsitam jāṇussoṇi 
PA_anya-e09_02n:32_1	bhante brāhmaṇo bhagavantaṃ upasaṅkamitvā etadavoca “ye me bho gotama kulaputtā bhavantaṃ	bhante brāhmaṇaḥ bhagavantam upasaṅkamitvā etat avoca ye me bho gotama kula puttāḥ bhavantam 
PA_anya-e09_02n:32_2	gotamaṃ uddissa saddhā agārasmā anagāriyaṃ pabbajitā, bhavaṃ tesaṃ gotamo pubbaṅgamo, bhavaṃ	gotamam uddissa saddhāḥ agārasmai anagāriyam pabbajitāḥ bhavan tesam gotamo pubbaṅgamaḥ bhavan 
PA_anya-e09_02n:33	Tesaṃ gotamo bahukāro, bhavaṃ tesaṃ gotamo samādapetā, bhoto ca pana gotamassa sā janatā diṭṭhānugatiṃ āpajjatī”ti, tasmiṃ bhante vatthusmiṃ bhāsitaṃ.	tesam gotamaḥ bahu kāraḥ bhavam tesam gotamaḥ samādapetā bhoto ca pana gotamassa sā janatā diṭṭha anugatim āpajjati iti tasmim bhante vatthusmim bhāsitam 
PA_anya-e09_02n:34	Anaṅgaṇasutta	anaṅgaṇa sutta 
PA_anya-e09_02n:35	Pucchā – anaṅgaṇasuttaṃ panāvuso kattha kaṃ ārabbha kena bhāsitaṃ.	pucchā anaṅgaṇa suttam pana āvuso kattha kam ārabbha kena bhāsitam 
PA_anya-e09_02n:36	Vissajjanā – sāvatthiyaṃ bhante sambahule bhikkhū ārabbha āyasmatā sāriputtattherena dhammasenāpatinā bhāsitaṃ.	vissajjanā sāvatthiyam bhante sambahule bhikkhū ārabbha āyasmatā sāriputta therena dhamma senāpatinā bhāsitam 
PA_anya-e09_02n:37	Ākaṅkheyyasutta	ākaṅkheyyasutta 
PA_anya-e09_02n:38	Pucchā – ākaṅkheyyasuttaṃ panāvuso bhagavatā kattha kaṃ ārabbha bhāsitaṃ.	pucchā ākaṅkheyya suttam pana āvuso bhagavatā kattha kam ārabbha bhāsitam 
PA_anya-e09_02n:39	Vissajjanā – sāvatthiyaṃ bhante sambahule bhikkhū ārabbha bhāsitaṃ.	vissajjanā sāvatthiyam bhante sambahule bhikkhū ārabbha bhāsitam 
PA_anya-e09_02n:40	Vatthasutta	vattha sutta 
PA_anya-e09_02n:41	Pucchā – vatthasuttaṃ panāvuso bhagavatā kattha kaṃ ārabbha bhāsitaṃ.	pucchā vattha suttam pana āvuso bhagavatā kattha kam ārabbha bhāsitam 
PA_anya-e09_02n:42	Vissajjanā – sāvatthiyaṃ bhante sambahule bhikkhū ārabbha bhāsitaṃ.	vissajjanā sāvatthiyam bhante sambahule bhikkhū ārabbha bhāsitam 
PA_anya-e09_02n:43	Sallekhasutta	sallekha sutta 
PA_anya-e09_02n:44	Pucchā – sallekhasuttaṃ panāvuso bhagavatā kattha kaṃ ārabbha kismiṃ vatthusmiṃ bhāsitaṃ.	pucchā sallekha suttam pana āvuso bhagavatā kattha kam ārabbha kismim vatthusmim bhāsitam 
PA_anya-e09_02n:45_0	Vissajjanā – sāvatthiyaṃ bhante āyasmantaṃ mahācundaṃ ārabbha bhāsitaṃ, āyasmā mahācundo	vissajjanā sāvatthiyam bhante āyasmantam mahācundam ārabbha bhāsitam āyasmā mahācundaḥ 
PA_anya-e09_02n:45_1	bhante bhagavantaṃ upasaṅkamitvā etadavoca “yā imā bhante anekavihitā diṭṭhiyo loke	bhante bhagavantam upasaṅkamitvā etat avoca yāḥ imāḥ bhante aneka vihitāḥ diṭṭhiyaḥ loke 
PA_anya-e09_02n:45_2	uppajjanti, attavādapaṭisaṃyuttā vā lokavādapaṭisaṃyuttā vā, ādimeva nu kho bhante	uppajjanti atta vāda paṭisaṃyuttāḥ vā loka vāda paṭisaṃyuttāḥ vā ādim eva nu kho bhante 
PA_anya-e09_02n:45_3	bhikkhuno manasikaroto evametāsaṃ diṭṭhīnaṃ pahānaṃ hoti, evametāsaṃ diṭṭhīnaṃ paṭinissaggo	bhikkhunaḥ manasikarotaḥ evam etāsam diṭṭhīnam pahānam hoti evam etāsam diṭṭhīnam paṭinissaggo 
PA_anya-e09_02n:45_4	hotī”ti, tasmiṃ bhante vatthusmiṃ bhāsitaṃ.	hoti iti tasmim bhante vatthusmim bhāsitam 
PA_anya-e09_02n:46	Pucchā – tattha ca āvuso kati pariyāyā kati ca antogadhapadāni bhagavatā vibhajitvā pakāsitāni.	pucchā tattha ca āvuso kati pariyāyā kati ca antogadha padāni bhagavatā vibhajitvā pakāsitāni 
PA_anya-e09_02n:47	Vissajjanā – tattha bhante pañca pariyāyā catucattālīsa ca antogadhapadāni bhagavatā vitthārena bhāsitāni.	vissajjanā tattha bhante pañca pariyāyā catucattālīsa ca antogadha padāni bhagavatā vitthārena bhāsitāni 
PA_anya-e09_02n:48	Sammāṭṭhisutta	sammāṭṭhi sutta 
PA_anya-e09_02n:49	Pucchā – sammādiṭṭhisuttaṃ panāvuso kattha kaṃ ārabbha kena bhāsitaṃ.	pucchā sammādiṭṭhi suttam pana āvuso kattha kam ārabbha kena bhāsitam 
PA_anya-e09_02n:50	Vissajjanā – sāvatthiyaṃ bhante sambahule bhikkhū ārabbha āyasmatā sāriputtattherena dhammasenāpatinā bhāsitaṃ.	vissajjanā sāvatthiyam bhante sambahule bhikkhū ārabbha āyasmatā sāriputta therena dhamma senāpatinā bhāsitam 
PA_anya-e09_02n:51	Pucchā – kassa āvuso vacanaṃ.	pucchā kassa āvuso vacanam 
PA_anya-e09_02n:52	Vissajjanā – bhagavato bhante vacanaṃ arahato sammāsambuddhassa.	vissajjanā bhagavataḥ bhante vacanam arahataḥ sammāsambuddhassa 
PA_anya-e09_02n:53	Pucchā – kenāvuso ābhataṃ.	pucchā kena āvuso ābhatam 
PA_anya-e09_02n:54	Vissajjanā – paramparāya bhante ābhataṃ.	vissajjanā paramparāya bhante ābhatam 
PA_anya-e09_02n:55	Mahāsatipaṭṭhānasutta	mahāsatipaṭṭhāna sutta 
PA_anya-e09_02n:56_0	Pucchā – mahāsatipaṭṭhānasuttaṃ panāvuso yogāvacarānaṃ bahupakārattā dīghanikāye	pucchā mahāsati paṭṭhāna suttam pana āvuso yoga avacarānam bahu pakāra ttā dīgha nikāye 
PA_anya-e09_02n:56_1	ca idha cāti dvīsu nikāyesu porāṇakehi saṃgītikārehi dvikkhattuṃ saṃgāyitvā vitthārena	ca idha ca ati dvīsu nikāyesu porāṇakehi saṃgīti kārehi dvi khattum saṃgāyitvā vitthārena 
PA_anya-e09_02n:56_2	patiṭṭhāpitaṃ, taṃ amhehi dīghanikāye yathānuppattavasena pucchitañca vissajjitañca.	patiṭṭhāpitam tam amhehi dīgha nikāye yathā anuppatta vasena pucchitam ca vissajjitam ca 
PA_anya-e09_02n:56_3	Tathāpi yogāvacarānaṃ bahupakārattāyeva taṃ idānipi yathānuppattavasena puna pucchissāmi,	tathā api bahu pakāra ttāya iva tam yathā anuppatta vasena puna pucchissāmi 
PA_anya-e09_02n:56_4	taṃ panetaṃ āvuso mahāsatipaṭṭhānasuttaṃ bhagavatā kattha kaṃ ārabbha bhāsitaṃ.	tam pana itam āvuso mahāsatipaṭṭhāna suttam bhagavatā kattha kam ārabbha bhāsitam 
PA_anya-e09_02n:57	Vissajjanā – kurūsu bhante kammāsadhamme nāma kurūnaṃ nigame sambahule bhikkhū ārabbha bhāsitaṃ.	vissajjanā kurūsu bhante kammāsadhamme nāma kurūnam nigame sambahule bhikkhū ārabbha bhāsitam 
PA_anya-e09_02n:58	Pucchā – kathañcāvuso tattha ānāpānassati kāyānupassanā bhagavatā vibhajitvā pakāsitā.	pucchā katham ca āvuso tattha āna apāna sati kāya anupassanā bhagavatā vibhajitvā pakāsitā 
PA_anya-e09_02n:59_0	Vissajjanā – idha bhikkhave bhikkhu araññagato vā rukkhamūlagato vā suññāgāragato	vissajjanā idha bhikkhave bhikkhu arañña gataḥ vā rukkha mūla gataḥ vā suññāgāra gataḥ 
PA_anya-e09_02n:59_1	vā nisīdati pallaṅkaṃ ābhujitvā ujuṃ kāyaṃ paṇidhāya parimukhaṃ satiṃ upaṭṭhapetvā	vā nisīdati pallaṅkam ābhujitvā ujum kāyam paṇidhāya parimukham satim upaṭṭhapetvā 
PA_anya-e09_02n:59_2	so satova assasati, satova passasati, dīghaṃ vā assasanto ‘dīghaṃ assasāmī’ti pajānāti,	saḥ satas iva assasati satas iva passasati dīgham vai assasantaḥ dīgham assasāmi iti pajānāti 
PA_anya-e09_02n:59_3	dīghaṃ vā passasanto ‘dīghaṃ passasāmī’ti pajānāti, evamādinā bhante tattha ānāpānassati	dīgham vā passasantaḥ dīgham passasāmi iti pajānāti evamādinā bhante tattha 
PA_anya-e09_02n:59_4	kāyānupassanā bhagavatā vibhajitvā pakāsitā.	kāya anupassanā bhagavatā vibhajitvā pakāsitā 
PA_anya-e09_02n:60	Pucchā – kathañcāvuso tattha iriyāpathakāyānupassanā bhagavatā vibhajitvā pakāsitā.	pucchā katham ca āvuso tattha iriyāpatha kāya anupassanā bhagavatā vibhajitvā pakāsitā 
PA_anya-e09_02n:61_0	Vissajjanā – puna caparaṃ bhikkhave bhikkhu gacchanto vā gacchāmīti pajānāti, ṭhito	vissajjanā puna caparam bhikkhave bhikkhu gacchantaḥ vā gacchāmi iti pajānāti ṭhitaḥ 
PA_anya-e09_02n:61_1	vā ṭhitomhīti pajānāti, nisinno vā nisinnomhīti pajānāti, sayāno vā sayānomhīti pajānāti,	vā ṭhitaḥ umhi iti pajānāti nisinnaḥ vā nisinnaḥ umhi iti pajānāti sa yānaḥ vā sa yānaḥ umhi iti pajānāti 
PA_anya-e09_02n:61_2	evamādinā bhante bhagavatā iriyāpathakāyānupassanā bhāvanā vibhajitvā pakāsitā.	evamādinā bhante bhagavatā iriyāpatha kāya anupassanā bhāvanā vibhajitvā pakāsitā 
PA_anya-e09_02n:62	Pucchā – kathañcāvuso tattha sampajaññakāyānupassanā bhagavatā vibhajitvā pakāsitā.	pucchā katham ca āvuso tattha sampajañña kāya anupassanā bhagavatā vibhajitvā pakāsitā 
PA_anya-e09_02n:63_0	Vissajjanā – puna caparaṃ bhikkhave bhikkhu abhikkante paṭikkante sampajānakārī hoti,	vissajjanā puna caparam bhikkhave bhikkhu abhikkante paṭikkante sampajāna kārī hoti 
PA_anya-e09_02n:63_1	ālokite vilokite sampajānakārī hoti, samiñjite pasārite sampajānakārī hoti, saṅghāṭipattacīvaradhāraṇe	ālokite vilokite sampajānakārī hoti samiñjite pasārite sampajānakārī hoti saṅghāṭi patta cīvara dhāraṇe 
PA_anya-e09_02n:63_2	sampajānakārī hoti, asite pīte khāyite sāyite sampajānakārī hoti, uccārapassāvakamme	sampajāna kārī hoti asite pīte khāyite sāyite sampajāna kārī hoti uccāra passāva kamme 
PA_anya-e09_02n:63_3	sampajānakārī hoti, gate ṭhite nisinne sutte jāgarite bhāsite tuṇhībhāve sampajānakārī	sampajāna kārī hoti gate ṭhite nisinne sutte jāgarite bhāsite tuṇhībhāve sampajāna kārī 
PA_anya-e09_02n:63_4	hoti, evamādinā bhante bhagavatā tattha sampajaññakāyānupassanā vibhajitvā pakāsitā.	evamādinā bhante bhagavatā tattha sampajañña kāya anupassanā vibhajitvā pakāsitā 
PA_anya-e09_02n:64	Pucchā – kathañcāvuso tattha paṭikūlamanasikārakāyānupassanā bhagavatā vibhajitvā pakāsitā.	pucchā katham ca āvuso tattha paṭikūla manasikāra kāya anupassanā bhagavatā vibhajitvā pakāsitā 
PA_anya-e09_02n:65_0	Vissajjanā – puna caparaṃ bhikkhave bhikkhu imameva kāyaṃ uddhaṃ pādatalā adho kesamatthakā	vissajjanā puna ca param bhikkhave bhikkhu imam eva kāyam uddham pāda talāḥ adhas kesa matthakā 
PA_anya-e09_02n:65_1	tacapariyantaṃ pūraṃ nānappakārassa asucino paccavekkhati atthi imasmiṃ kāye kesālomā	taca pariyantam pūram nānappakārassa asucino paccavekkhati atthi imasmin kāye kesālomā 
PA_anya-e09_02n:65_2	nakhā dantā taco evamādinā bhante tattha bhagavatā paṭikūlamanasikārakāyānupassanā	nakhā dantā tacaḥ evamādinā bhante tattha bhagavatā paṭikūla manasikāra kāya anupassanā 
PA_anya-e09_02n:65_3	vibhajitvā pakāsitā.	vibhajitvā pakāsitā 
PA_anya-e09_02n:66	Pucchā – kathañcāvuso tattha dhātumanasikārakāyānupassanā bhagavatā vibhajitvā pakāsitā.	pucchā katham ca āvuso tattha dhātu manasikāra kāya anupassanā bhagavatā vibhajitvā pakāsitā 
PA_anya-e09_02n:67_0	Vissajjanā – puna caparaṃ bhikkhave bhikkhu imameva kāyaṃ yathāṭhitaṃ yathāpaṇihitaṃ	vissajjanā puna ca param bhikkhave bhikkhu imam eva kāyam yathā ṭhitam yathā paṇihitam 
PA_anya-e09_02n:67_1	dhātuso paccavekkhati atthi imasmiṃ kāye pathavīdhātu āpodhātu tejodhātu vāyodhātu	dhātuso paccavekkhati atthi imasmin kāye pathavī dhātu āpaḥ dhātu tejaḥ dhātu vāyo dhātu 
PA_anya-e09_02n:67_2	evamādinā bhante bhagavatā dhātumanasikārakāyānupassanā vibhajitvā pakāsitā.	evamādinā bhante bhagavatā dhātu manasikāra kāya anupassanā vibhajitvā pakāsitā 
PA_anya-e09_02n:68	Pucchā – kathañcāvuso tattha nava sivathikakāyānupassanā bhagavatā vibhajitvā pakāsitā.	pucchā katham ca āvuso tattha nava sivathika kāya anupassanā bhagavatā vibhajitvā pakāsitā 
PA_anya-e09_02n:69_0	Vissajjanā – puna caparaṃ bhikkhave bhikkhu seyyathāpi passeyya sarīraṃ sivathikāya	vissajjanā puna caparam bhikkhave bhikkhu seyyathā api passeyya sarīram sivathikāya 
PA_anya-e09_02n:69_1	chaḍḍitaṃ ekāhamataṃ vā dvīhamataṃ vā tīhamataṃ vā uddhumātakaṃ vinīlakaṃ vipubbakajātaṃ	chaḍḍitam eka aha matam vā dvīha matam vā tīha matam vā uddhumātakam vinīlakam vipubbaka jātam 
PA_anya-e09_02n:69_2	so imameva kāyaṃ upasaṃharati “ayampi kho kāyo evaṃdhammo evaṃbhāvī evaṃanatīto”ti	saḥ imam eva kāyam upasaṃharati ayam pi kho kāyaḥ evaṃdhammaḥ evaṃbhāvī evam anatītaḥ iti 
PA_anya-e09_02n:69_3	evamādinā bhante tattha bhagavatā nava sivathikakāyānupassanā bhāvanā vibhajitvā pakāsitā.	evamādinā bhante tattha bhagavatā nava sivathika kāya anupassanāḥ bhāvanā vibhajitvā pakāsitā 
PA_anya-e09_02n:70	Pucchā – kathañcāvuso tattha vedanānupassanā bhagavatā vibhajitvā desitā.	pucchā kathañca āvuso tattha vedanā anupassanā bhagavatā vibhajitvā desitā 
PA_anya-e09_02n:71_0	Vissajjanā – idha bhikkhave bhikkhu sukhaṃ vā vedanaṃ vedayamāno “sukhaṃ vedanaṃ	vissajjanā idha bhikkhave bhikkhu sukham vā vedanam vedayamānaḥ sukham vedanam 
PA_anya-e09_02n:71_1	vedayāmī”ti pajānāti, dukkhaṃ vā vedanaṃ vedayamāno “dukkha vedanaṃ vedayāmī”ti pajānāti,	vedayāmi iti pajānāti dukkham vā vedanam vedayamānaḥ dukkha vedanam vedayāmi iti pajānāti 
PA_anya-e09_02n:71_2	adukkhamasukhaṃ vā vedanaṃ vedayamāno “adukkhamasukhaṃ vedanaṃ vedayāmī”ti pajānāti,	adukkham asukham vā vedanam vedayamānaḥ adukkham asukham vedanam vedayāmi iti pajānāti 
PA_anya-e09_02n:71_3	evamādinā bhante tattha bhagavatā vedanānupassanā vibhajitvā pakāsitā.	evamādinā bhante tattha bhagavatā vedanā anupassanā vibhajitvā pakāsitā 
PA_anya-e09_02n:72	Pucchā – kathañcāvuso tattha cittānupassanā bhagavatā vibhajitvā desitā.	pucchā kathañca āvuso tattha citta anupassanā bhagavatā vibhajitvā desitā 
PA_anya-e09_02n:73_0	Vissajjanā – idha bhikkhave bhikkhu sarāgaṃ vā cittaṃ “sarāgaṃ citta”nti pajānāti,	vissajjanā idha bhikkhave bhikkhu sa rāgam vā cittam sa rāgam cittam iti pajānāti 
PA_anya-e09_02n:73_1	vītarāgaṃ vā cittaṃ “vītarāgaṃ citta”nti pajānāti, sadosaṃ vā vītadosaṃ vā samohaṃ	vīta rāgam vā cittam vīta rāgam cittam iti pajānāti sa dosam vā vīta dosam vā sa moham 
PA_anya-e09_02n:73_2	vā vītamohaṃ vā saṃkhittaṃ vā cittaṃ “saṃkhittaṃ citta”nti pajānāti, vikkhittaṃ vā	vā vīta moham vā saṃkhittam vā cittam saṃkhittam cittam iti pajānāti vikkhittam vā 
PA_anya-e09_02n:73_3	cittaṃ “vikkhittaṃ citta”nti pajānāti, evamādinā tattha bhagavatā cittānupassanā	cittam vikkhittam cittam ti pajānāti evamādinā tattha bhagavatā citta anupassanā 
PA_anya-e09_02n:73_4	vibhajitvā pakāsitā.	vibhajitvā pakāsitā 
PA_anya-e09_02n:74	Pucchā – kathañcāvuso tattha dhammānupassanā bhagavatā vibhajitvā desitā, taṃ saṅkhepamatteneva vissajjehi.	pucchā katham ca āvuso tattha dhamma anupassanā bhagavatā vibhajitvā desitā tam saṅkhepa mattena iva vissajjehi 
PA_anya-e09_02n:75	Vissajjanā – idha bhikkhave bhikkhu dhammesu dhammānupassī viharati, pañcasu nīvaraṇesu evamādinā bhante tattha bhagavatā pañcahi pabbehi dhammānupassanā vibhajitvā pakāsitā.	vissajjanā idha bhikkhave bhikkhu dhammesu dhamma anupassī viharati pañcasu nīvaraṇesu evamādinā bhante tattha bhagavatā pañcahi pabbehi dhamma anupassanā vibhajitvā pakāsitā 
PA_anya-e09_02n:76	Cūḷasīhanādasutta	cūḷa sīhanāda sutta 
PA_anya-e09_02n:77	Pucchā – cūḷanasīhanādasuttaṃ panāvuso bhagavatā kattha kaṃ ārabbha kismiṃ vatthusmiṃ bhāsitaṃ.	pucchā cūḷanasīhanāda suttam pana āvuso bhagavatā kattha kam ārabbha kismim vatthusmim bhāsitam 
PA_anya-e09_02n:78_0	Vissajjanā – sāvatthiyaṃ bhante parihīnalābhasakkāre nānātitthiye ārabbha bhāsitaṃ,	vissajjanā sāvatthiyam bhante parihīna lābha sakkāre nānā titthiye ārabbha bhāsitam 
PA_anya-e09_02n:78_1	nānātitthiyā bhante parihīnalābhasakkārā tesu tesu ṭhānesu parideviṃsu, catasso ca	nānā titthiyāḥ bhante parihīna lābha sakkārā tesu tesu ṭhānesu catasso ca 
PA_anya-e09_02n:78_2	bhante parisā bhagavato ekamatthaṃ ārocesuṃ, tasmiṃ bhante vatthusmiṃ bhāsitaṃ.	bhante parisāḥ bhagavato eka mattham ārocesuṃ tasmin bhante vatthusmin bhāsitam 
PA_anya-e09_02n:79	Mahāsīhanādasutta	mahāsīhanādasutta 
PA_anya-e09_02n:80	Pucchā – tenāvuso bhagavatā jānatā passatā arahatā sammāsambuddhena mahāsīhanādasuttaṃ kattha kaṃ ārabbha kismiṃ vatthusmiṃ bhāsitaṃ.	pucchā tena āvuso bhagavatā jānatā passatā arahatā sammāsambuddhena mahāsīhanāda suttam kattha kam ārabbha kismim vatthusmim bhāsitaṃ 
PA_anya-e09_02n:81_0	Vissajjanā – vesāliyaṃ bhante sunakkhattaṃ licchaviputtaṃ ārabbha bhāsitaṃ, sanukkhatto	vissajjanā vesāliyam bhante sunakkhattam licchavi puttam ārabbha bhāsitam sanukkhatto 
