segmentnr	original	folio	analyzed
PA_atk-s05_19a:787_3	abhisaṅkhāraviññāṇaṃ rūpakkhandhaṃ nissāya tiṭṭhati. Dosasallenāti sahajātena dosasallena.	787	
PA_atk-s05_19a:787_4	Yadā vedanūpagā viññāṇaṭṭhiti vuccati, tadā upanissayakoṭiyāva nandiyā upasittaṃ	787	
PA_atk-s05_19a:787_5	viññāṇaṃ daṭṭhabbaṃ. Vedanāpi domanassavedanāva. Yadā ca upanissayapaccayabhūtena	787	
PA_atk-s05_19a:787_6	dosasallena vedanūpagā viññāṇaṭṭhiti vuccati, tadā sahajātakoṭiyā, upanissayakoṭiyā	787	
PA_atk-s05_19a:787_7	vā nandiyā upasittaṃ viññāṇaṃ daṭṭhabbaṃ. Vedanā pana tissopi tissannaṃ vedanānaṃ	787	
PA_atk-s05_19a:787_8	ārammaṇūpanissayabhāvato. Tattha paṭhamanayo domanassārammaṇassa abhisaṅkhāraviññāṇassa	787	
PA_atk-s05_19a:787_9	vasena vutto. Dutiyo sabbavedanārammaṇassa vasenāpi daṭṭhabbaṃ.	787	
PA_atk-s05_19a:788_0	Mānasallenāti mānasallena sahajātena, upanissayabhūtena vā. Mohasallenāti etthāpi	788	
PA_atk-s05_19a:788_1	eseva nayo. Ettha ca anādimatisaṃsāre itthipurisā rūpābhirāmāti rāgasallavasena paṭhamā	788	
PA_atk-s05_19a:788_2	viññāṇaṭṭhiti yojitā. Sabbāyapi vedanāya dukkhapariyāyasabbhāvato dukkhāya ca doso	788	
PA_atk-s05_19a:788_3	anusetīti dosasallavasena dutiyā, saññāvasena “seyyohamasmī”ti maññanā hotīti mānasallavasena	788	
PA_atk-s05_19a:788_4	tatiyā, saṅkhāresu samūhaghanaṃ dubbinibbhoganti mohasallavasena catutthī viññāṇaṭṭhiti yojitāti daṭṭhabbā.	788	
PA_atk-s05_19a:789_0	Upatthaddhanti olubbhārammaṇabhūtāhi viññāṇaṭṭhitīhi upatthambhitaṃ. Tañca kammanti	789	
PA_atk-s05_19a:789_1	yaṃ “cetanā cetasika”nti pubbe vuttaṃ. Ime ca kilesāti ime ca dasavatthukā kilesā.	789	
PA_atk-s05_19a:789_2	Sesaṃ suviññeyyameva.	789	
PA_atk-s05_19a:790_0	85. Idāni āhārādayo nayānaṃ saṃkilesapakkhe disābhāvena vavatthapetuṃ “imā catasso	790	
PA_atk-s05_19a:790_1	disā”tiādi āraddhaṃ, taṃ uttānameva. Puna kabaḷīkāro āhārotiādi āhārādīsuyeva yassa	790	
PA_atk-s05_19a:790_2	puggalassa upakkilesā, taṃ vibhajitvā dassetuṃ āraddhaṃ. Tattha dasannaṃ suttānanti	790	
PA_atk-s05_19a:790_3	ekadesesu samudāyavohārena vuttaṃ. Samudāyesu hi pavattā samaññā avayavesupi dissati,	790	
PA_atk-s05_19a:790_4	“yathā paṭo daḍḍho, samuddo diṭṭho”ti ca. Eko atthoti ekassa atthassa nipphādanato	790	
PA_atk-s05_19a:790_5	vuttaṃ. Byañjanameva nānanti ettha byañjanaggahaṇena byañjanatthopi gahitoti daṭṭhabbaṃ.	790	
PA_atk-s05_19a:790_6	Dasahipi suttapadehi savatthukā taṇhā vuttā. Taṇhā ca rāgacaritaṃ puggalaṃ khippaṃ	790	
PA_atk-s05_19a:790_7	dūsetīti āha – “ime rāgacaritassa puggalassa upakkilesā”ti. Yathā ca paṭhamadisābhāvena	790	
PA_atk-s05_19a:790_8	vuttadhammā rāgacaritassa upakkilesā, evaṃ dutiyadisābhāvena vuttadhammā dosacaritassa.	790	
PA_atk-s05_19a:790_9	Tatiyacatutthadisābhāvena vuttadhammā yathākkamaṃ diṭṭhicaritassa mandassa tikkhassa	790	
PA_atk-s05_19a:790_10	ca upakkilesā vuttā. Tesaṃ upakkilesabhāvo vuttanayānusārena veditabbo.	7901	
PA_atk-s05_19a:791_0	Āhāravipallāsādayo yadipi sabbehi tīhi vimokkhamukhehi pubbabhāge yathārahaṃ pariññeyyā	791	
PA_atk-s05_19a:791_1	pahātabbā ca. Yassa pana dukkhānupassanā purime āhāradvaye dukkhākārena bahulaṃ pavattati,	791	
PA_atk-s05_19a:791_2	tassa vasena yo ca kabaḷīkāro āhāro, yo ca phasso āhāro, ime appaṇihitena vimokkhamukhena	791	
PA_atk-s05_19a:791_3	pariññaṃ gacchantīti vuttaṃ. Esa nayo sesesu. Evañcetaṃ, na aññathā. Na hi ariyamaggānaṃ	791	
PA_atk-s05_19a:791_4	viya pahātabbesu vimokkhamukhānaṃ pariññeyyapahātabbesu koci niyamo sambhavati. Iti	791	
PA_atk-s05_19a:791_5	sabbe lokavaṭṭānusārino dhammā niyyanti, te lokā tīhi vimokkhamukhehīti nigamanaṃ.	791	
PA_atk-s05_19a:791_6	Tassattho – iti evaṃ vuttappakārā sabbe āhārādayo lokasaṅkhātavaṭṭānusārino dhammā	791	
PA_atk-s05_19a:791_7	te lokabhūtā vaṭṭato niyyanti aniccānupassanādīhi tīhi vimokkhamukhehīti.	791	
PA_atk-s05_19a:792_0	86. Evaṃ saṃkilesapakkhe disābhūtadhamme niddisitvā idāni vodānapakkhe disābhūtadhamme	792	
PA_atk-s05_19a:792_1	dassetuṃ “catasso paṭipadā”tiādi vuttaṃ. Tattha dibbabrahmaariyaāneñjavihāroti cattāro	792	
PA_atk-s05_19a:792_2	vihārā. Mānappahānaālayasamugghātaavijjāpahānabhavūpasamā cattāro acchariyā abbhutā	792	
PA_atk-s05_19a:792_3	dhammā. Saccādhiṭṭhānādīni cattāri adhiṭṭhānāni. Chandasamādhibhāvanādayo catasso	792	
PA_atk-s05_19a:792_4	samādhibhāvanā. Indriyasaṃvaro tapasaṅkhāto puññadhammo bojjhaṅgabhāvanā sabbūpadhipaṭinissaggasaṅkhātaṃ	792	
PA_atk-s05_19a:792_5	nibbānañcāti cattāro sukhabhāgiyā dhammā veditabbāti.	792	
PA_atk-s05_19a:793_0	Paṭhamā paṭipadātiādi paṭipadāsatipaṭṭhānādīnaṃ abhedasandassanaṃ. Yadi evaṃ kasmā	793	
PA_atk-s05_19a:793_1	visuṃ gahaṇaṃ katanti? Dasavatthukassa kilesapuñjassa paṭipakkhabhāvadassanatthaṃ	793	
PA_atk-s05_19a:793_2	paṭipadādidasakaniddeso. Tathā hi vakkhati – “cattāro āhārā tesaṃ paṭipakkho catasso	793	
PA_atk-s05_19a:793_3	paṭipadā”tiādi. Kiñcāpi catūsu satipaṭṭhānesu “idaṃ nāma satipaṭṭhānaṃ imāya eva	793	
PA_atk-s05_19a:793_4	paṭipadāya ijjhatī”ti niyamo natthi, tathāpi paṭhamāya paṭipadāya paṭhamaṃ satipaṭṭhānaṃ	793	
PA_atk-s05_19a:793_5	sambhavatīti sambhavavasena evaṃ vuttaṃ – “paṭhamā paṭipadā, paṭhamaṃ satipaṭṭhāna”nti.	793	
PA_atk-s05_19a:793_6	Yasmā pana āhāravipallāsādīnaṃ viya paṭipadāsatipaṭṭhānādīnaṃ atthato nānattaṃ natthi.	793	
PA_atk-s05_19a:793_7	Satipaṭṭhānāniyeva hi tathā tathā paṭipajjamānāni dukkhāpaṭipadādandhābhiññādināmakāni	793	
PA_atk-s05_19a:793_8	honti, tasmā yathā saṃkilesapakkhe “paṭhame āhāre paṭhamo vipallāso”tiādinā adhikaraṇabhedena	793	
PA_atk-s05_19a:793_9	vuttaṃ, evaṃ adhikaraṇabhedaṃ akatvā “paṭhamā paṭipadā, paṭhamaṃ satipaṭṭhāna”ntiādi	793	
PA_atk-s05_19a:793_10	vuttaṃ. Sesesupi eseva nayo.	7931	
PA_atk-s05_19a:794_0	Andhassa pabbatārohanaṃ viya kadācideva uppajjanakaṃ acchariyaṃ, accharāyoggaṃ acchariyanti	794	
PA_atk-s05_19a:794_1	porāṇā. Abhūtapubbaṃ bhūtanti abbhutaṃ. Ubhayampetaṃ vimhayāvahassa adhivacanaṃ.	794	
PA_atk-s05_19a:794_2	Na hi mānappahānādito aññaṃ durabhisambhavataraṃ vimhanīyañca upalabbhatīti adhitiṭṭhati	794	
PA_atk-s05_19a:794_3	etena, ettha vā adhiṭṭhānamattameva vā tanti adhiṭṭhānaṃ. Saccañca taṃ adhiṭṭhānañca,	794	
PA_atk-s05_19a:794_4	saccassa vā adhiṭṭhānaṃ, saccaṃ adhiṭṭhānaṃ etassāti vā saccādhiṭṭhānaṃ. Sesesupi	794	
PA_atk-s05_19a:794_5	eseva nayo. Samādhi eva bhāvetabbatāya samādhibhāvanā. Sukhaṃ bhajatīti sukhabhāgiyo,	794	
PA_atk-s05_19a:794_6	sukhabhāgassa vā sukhakoṭṭhāsassa hitoti sukhabhāgiyo. Ekassapi sattassa asubhabhāvanādayo	794	
PA_atk-s05_19a:794_7	viya ekadese avattitvā anavasesapariyādānato natthi etissā pamāṇanti appamaññā.	794	
PA_atk-s05_19a:795_0	Paṭhamā paṭipadā bhāvitā bahulīkatā paṭhamaṃ satipaṭṭhānaṃ paripūretīti paṭhamāya	795	
PA_atk-s05_19a:795_1	paṭipadāya bhāvanābahulīkāro paṭhamassa satipaṭṭhānassa bhāvanāpāripūrīti attho.	795	
PA_atk-s05_19a:795_2	Sesapadesupi eseva nayo. Yathā hi ariyamagge bhāvite satipaṭṭhānādayo bodhipakkhiyadhammā	795	
PA_atk-s05_19a:795_3	sabbepi bhāvitā eva honti, evaṃsampadamidaṃ daṭṭhabbaṃ.	795	
PA_atk-s05_19a:796_0	Kāyānupassanāya kāmarāgassa ujuvipaccanīkabhāvato “paṭhamo satipaṭṭhāno bhāvito bahulīkato	796	
PA_atk-s05_19a:796_1	kāmapaṭipakkhaṃ paṭhamaṃ jhānaṃ paripūretī”ti vuttaṃ. Tathā pītipaṭisaṃvedanādivasena	796	
PA_atk-s05_19a:796_2	pavattamānaṃ dutiyaṃ satipaṭṭhānaṃ, sappītikassa dutiyajjhānassa cittassa abhippamodanavasena	796	
PA_atk-s05_19a:796_3	pavattamānaṃ tatiyaṃ satipaṭṭhānaṃ ukkaṃsagatasukhassa tatiyajjhānassa aniccavirāgādivasena	796	
PA_atk-s05_19a:796_4	pavattiyā saṅkhāresu upekkhakaṃ catutthaṃ satipaṭṭhānaṃ upekkhāsatipārisuddhibhāvato	796	
PA_atk-s05_19a:796_5	catutthajjhānassa pāripūriyā saṃvattati.	796	
PA_atk-s05_19a:797_0	Yasmā pana rūpāvacarapaṭhamajjhānaṃ rūpāvacarasamāpattīnaṃ, dutiyajjhānaṃ byāpādavitakkādidūrībhāvena	797	
PA_atk-s05_19a:797_1	brahmavihārānaṃ, tatiyajjhānaṃ pītivirāgena sukhena vipassanāya adhiṭṭhānabhūtaṃ	797	
PA_atk-s05_19a:797_2	ariyavihārānaṃ, catutthajjhānaṃ upekkhāsatipārisuddhiāneñjappattaṃ āneñjavihārānaṃ	797	
PA_atk-s05_19a:797_3	visesato paccayo hoti, tasmā “paṭhamaṃ jhānaṃ bhāvitaṃ bahulīkataṃ paṭhamaṃ vihāraṃ	797	
PA_atk-s05_19a:797_4	paripūretī”tiādi vuttaṃ. Iti yo yassa visesapaccayo, so taṃ paripūretīti vuttoti daṭṭhabbaṃ.	797	
PA_atk-s05_19a:798_0	87. Idāni paṭipadādayo vodānapakkhe disābhāvena vavatthapetuṃ “tattha imā catasso	798	
PA_atk-s05_19a:798_1	disā”tiādi vuttaṃ. Taṃ suviññeyyameva. Puna “paṭhamā paṭipadā”tiādi paṭipadācatukkādīsu	798	
PA_atk-s05_19a:798_2	yena yassa puggalassa vodānaṃ, taṃ vibhajitvā dassetuṃ āraddhaṃ. Taṃ heṭṭhā vuttanayameva.	798	
PA_atk-s05_19a:798_3	Yadipi tīsu vimokkhamukhesu “idaṃ nāma vimokkhamukhaṃ imāya eva paṭipadāya ijjhatī”ti	798	
PA_atk-s05_19a:798_4	niyamo natthi. Yesaṃ pana puggalānaṃ purimāhi dvīhi paṭipadāhi appaṇihitena vimokkhamukhena	798	
PA_atk-s05_19a:798_5	ariyamaggādhigamo. Tathā yassa tatiyāya paṭipadāya suññatavimokkhamukhena, yassa	798	
PA_atk-s05_19a:798_6	ca catutthāya paṭipadāya animittavimokkhamukhena ariyamaggādhigamo, tesaṃ puggalānaṃ	798	
PA_atk-s05_19a:798_7	vasena ayaṃ paṭipadāvimokkhamukhasaṃsandanā. Satipaṭṭhānādīhi vimokkhamukhasaṃsandanāyapi eseva nayo.	798	
PA_atk-s05_19a:799_0	Tesaṃ vikkīḷitanti tesaṃ asantāsanajavaparakkamādivisesayogena sīhānaṃ buddhānaṃ	799	
PA_atk-s05_19a:799_1	paccekabuddhānaṃ buddhasāvakānañca vikkīḷitaṃ viharaṇaṃ. Yadidaṃ āhārādikilesavatthusamatikkamanamukhena	799	
PA_atk-s05_19a:799_2	saparasantāne paṭipadādisampādanā. Idāni āhārādīnaṃ paṭipadādīhi yena samatikkamanaṃ,	799	
PA_atk-s05_19a:799_3	taṃ nesaṃ paṭipakkhabhāvaṃ dassento “cattāro āhārā tesaṃ paṭipakkho catasso paṭipadā”tiādimāha.	799	
PA_atk-s05_19a:799_4	Tattha tesaṃ paṭipakkhabhāvo pahātabbabhāvo pahāyakabhāvo ca āhāraviññāṇaṭṭhitīnañcettha	799	
PA_atk-s05_19a:799_5	pahātabbabhāvo tappaṭibandhachandarāgavasena daṭṭhabbo. Tattha “vikkīḷitaṃ bhāvanā	799	
PA_atk-s05_19a:799_6	sacchikiriyā cā”tiādi tassāyaṃ saṅkhepattho – tesaṃ vikkīḷitanti ettha yadetaṃ vikkīḷitaṃ	799	
PA_atk-s05_19a:799_7	nāma bhāvetabbānaṃ bodhipakkhiyadhammānaṃ bhāvanā, sacchikātabbānaṃ phalanibbānānaṃ	799	
PA_atk-s05_19a:799_8	sacchikiriyā ca. Tathā pahātabbassa dasavatthukassa kilesapuñjassa tadaṅgādivasena	799	
PA_atk-s05_19a:799_9	pahānaṃ byantīkiriyā anavasesananti. Idāni taṃ saṅkhepena dassento “indriyādhiṭṭhānaṃ	799	
PA_atk-s05_19a:799_10	vikkīḷitaṃ vipariyāsānadhiṭṭhāna”nti āha.	7991	
PA_atk-s05_19a:800_0	Indriyādhiṭṭhānanti indriyānaṃ pavattanaṃ bhāvanā sacchikiriyā ca. Vipariyāsānadhiṭṭhānanti	800	
PA_atk-s05_19a:800_1	vipallāsānaṃ apavattanaṃ pahānaṃ anuppādanaṃ. Indriyāni saddhammagocaroti indriyāni	800	
PA_atk-s05_19a:800_2	cettha saddhammassa gocarabhūtāni pavattihetūti adhippetāni saddhindriyādīnīti attho.	800	
PA_atk-s05_19a:800_3	Vipariyāsā kilesagocaroti vipallāsā saṃkilesapakkhassa pavattiṭṭhānaṃ pavattihetūti.	800	
PA_atk-s05_19a:800_4	Ayaṃ vuccati sīhavikkīḷitassa nayassa bhūmīti yāyaṃ “cattāro āhārā”tiādinā saṃkilesapakkhe	800	
PA_atk-s05_19a:800_5	dasannaṃ catukkānaṃ, “catasso paṭipadā”tiādinā vodānapakkhepi dasannaṃ catukkānaṃ	800	
PA_atk-s05_19a:800_6	taṇhācaritādīnaṃ upakkilesavodānavibhāvanāmukhena niddhāraṇā, ayaṃ sīhavikkīḷitassa nayassa bhūmi nāma.	800	
PA_atk-s05_19a:801_0	88. Idāni ugghaṭitaññuādipuggalattayavasena tipukkhalanayassa bhūmiṃ vibhāvetukāmo	801	
PA_atk-s05_19a:801_1	yasmā pana nayānaṃ aññamaññānuppavesassa icchitattā sīhavikkīḷitanayato tipukkhalanayo	801	
PA_atk-s05_19a:801_2	niggacchati, tasmā paṭipadāvibhāgato cattāro puggale sīhavikkīḷitanayassa bhūmiṃ	801	
PA_atk-s05_19a:801_3	niddisitvā tato eva ugghaṭitaññuādipuggalattaye niddhāretuṃ “tattha ye dukkhāya paṭipadāyā”tiādi	801	
PA_atk-s05_19a:801_4	āraddhaṃ. Tattha ime dve puggalāti ime purimānaṃ dvinnaṃ paṭipadānaṃ vasena dve puggalā.	801	
PA_atk-s05_19a:801_5	Esa nayo itaratthāpi. Puna “tattha ye dukkhāya paṭipadāyā”tiādi yathāvuttapuggalacatukkato	801	
PA_atk-s05_19a:801_6	ugghaṭitaññuādipuggalattayaṃ niddhāretuṃ vuttaṃ. Tattha yo sādhāraṇāyāti dukkhāpaṭipadāya	801	
PA_atk-s05_19a:801_7	khippābhiññāya, sukhāpaṭipadāya dandhābhiññāya ca niyyātīti sambandho. Kathaṃ pana	801	
PA_atk-s05_19a:801_8	paṭipadādvayaṃ ekassa sambhavatīti? Nayidamevaṃ daṭṭhabbaṃ. Ekassa puggalassa ekasmiṃ	801	
PA_atk-s05_19a:801_9	dve paṭipadā sambhavantīti. Yathāvuttāsu pana dvīsu paṭipadāsu yo yāya kāyaci niyyāti,	801	
PA_atk-s05_19a:801_10	ayaṃ vipañcitaññūti ayamettha adhippāyo. Yasmā pana aṭṭhasāliniyaṃ paṭipadā calati	8011	
PA_atk-s05_19a:801_11	na calatīti vicāraṇāyaṃ “calatī”ti vuttaṃ, tasmā ekassapi puggalassa jhānantaramaggantaresu	8011	
PA_atk-s05_19a:801_12	paṭipadābhedo icchitovāti.	8011	
PA_atk-s05_19a:802_0	“Tattha bhagavā”tiādinā desanāvibhāgehipi tameva puggalavibhāgaṃ vibhāveti. Taṃ heṭṭhā	802	
PA_atk-s05_19a:802_1	vuttanayameva. Tattha adhicittanti adhicittasikkhañcāti ca-saddo luttaniddiṭṭho.	802	
PA_atk-s05_19a:802_2	Tena adhicittasikkhañca adhipaññāsikkhañca vipañcitaññussa paññapetīti attho. Adhisīlanti	802	
PA_atk-s05_19a:802_3	etthāpi eseva nayo. Adhisīlasikkhaṃ adhicittasikkhaṃ adhipaññāsikkhañcāti yojetabbaṃ.	802	
PA_atk-s05_19a:803	Cattāri hutvā tīṇi bhavantīti liṅgavipallāsena vuttaṃ, cattāro puggalā hutvā tayo puggalā hontīti attho.	80	
PA_atk-s05_19a:804	Ayaṃ saṃkilesoti ayaṃ akusalamūlādidvādasattikasaṅgaho saṃkilissati etenāti saṃkilesoti katvā. Idaṃ vodānanti etthāpi eseva nayo.	80	
PA_atk-s05_19a:805	Tīṇi hutvā dve bhavantīti nandiyāvaṭṭanayassa disābhūtadhammadassanatthaṃ vuttaṃ. Tenevāha – “taṇhā ca avijjā cā”tiādi, taṃ sabbaṃ suviññeyyameva.	80	
PA_atk-s05_19a:806_0	Kasmā panettha nayānaṃ uddesānukkamena niddeso na katoti? Nayānaṃ nayehi sambhavadassanatthaṃ.	806	
PA_atk-s05_19a:806_1	Paṭhamanayato hi puggalādhiṭṭhānavasena tatiyanayassa, tatiyanayato ca dutiyanayassa	806	
PA_atk-s05_19a:806_2	sambhavoti imassa visesassa dassanatthaṃ paṭhamanayānantaraṃ tatiyanayo, tatiyanayānantarañca	806	
PA_atk-s05_19a:806_3	dutiyanayo niddiṭṭho. Dhammādhiṭṭhānavasena pana tatiyanayato dutiyanayo, dutiyanayato	806	
PA_atk-s05_19a:806_4	paṭhamanayopi sambhavatīti imassa visesassa dassanatthaṃ ante “taṇhā ca avijjā cā”tiādinā	806	
PA_atk-s05_19a:806_5	paṭhamanayassa bhūmi dassitā. Teneva hi “cattāri hutvā tīṇi bhavanti, tīṇi hutvā	806	
PA_atk-s05_19a:806_6	dve bhavantī”ti vuttaṃ. Yadi evaṃ “dve hutvā cattāri bhavanti, dve hutvā tīṇi bhavanti,	806	
PA_atk-s05_19a:806_7	tīṇi hutvā cattāri bhavantī”ti ayampi nayo vattabbo siyāti? Saccametaṃ, ayaṃ pana	806	
PA_atk-s05_19a:806_8	nayo atthato dassito evāti katvā na vutto. Yasmā tiṇṇaṃ atthanayānaṃ aññamaññaṃ anuppaveso	806	
PA_atk-s05_19a:806_9	icchito, sati ca anuppavese tato viniggamopi sambhavati evāti. Ayañca attho peṭakopadesena vibhāvetabbo.	806	
PA_atk-s05_19a:807_0	Tatthāyaṃ ādito paṭṭhāya vibhāvanā – cattāro puggalā taṇhācarito duvidho mudindriyo	807	
PA_atk-s05_19a:807_1	tikkhindriyo ca. Tathā diṭṭhicaritoti. Tattha taṇhācarito mudindriyo dukkhāya paṭipadāya	807	
PA_atk-s05_19a:807_2	dandhābhiññāya niyyāti, tikkhindriyo dukkhāya paṭipadāya khippābhiññāya niyyāti,	807	
PA_atk-s05_19a:807_3	diṭṭhicarito pana mudindriyo sukhāya paṭipadāya dandhābhiññāya niyyāti, tikkhindriyo	807	
PA_atk-s05_19a:807_4	sukhāya paṭipadāya khippābhiññāya niyyāti. Iti imāsu paṭipadāsu yathārahaṃ ṭhitehi	807	
PA_atk-s05_19a:807_5	taṇhācaritadiṭṭhicaritehi cattāro āhārā tappaṭibandhachandarāgappahānena pahātabbā.	807	
PA_atk-s05_19a:807_6	Cattāro satipaṭṭhāne bhāvetvā cattāro vipallāsā daṭṭhabbāti sabbo yathāvuttanayo anugantabbo.	807	
PA_atk-s05_19a:808_0	Tatthāyaṃ pāḷi – tattha ye diṭṭhicaritā sattā, te kāmesu dosadiṭṭhī, na ca ye kāmesu	808	
PA_atk-s05_19a:808_1	anusayā samūhatā, te attakilamathānuyogamanuyuttā viharanti. Tesaṃ satthā vā dhammaṃ	808	
PA_atk-s05_19a:808_2	deseti aññataro vā garuṭṭhāniyo sabrahmacārī “kāmehi natthi attho”ti, te ca pubbeyeva	808	
PA_atk-s05_19a:808_3	kāmehi anatthikā, iti kāme appakasirena paṭinissajjanti, te cetasikena dukkhena anajjhositā.	808	
PA_atk-s05_19a:808_4	Tena vuccati “sukhā paṭipadā”ti. Ye pana taṇhācaritā sattā, te kāmesu ajjhositā,	808	
PA_atk-s05_19a:808_5	tesaṃ satthā vā dhammaṃ deseti aññataro vā bhikkhu “kāmehi natthi attho”ti, te piyarūpaṃ	808	
PA_atk-s05_19a:808_6	dukkhena paṭinissajjanti. Tena vuccati “dukkhā paṭipadā”ti. Iti ime sabbe sattā dvīsu	808	
PA_atk-s05_19a:808_7	paṭipadāsu samosaraṇaṃ gacchanti dukkhāyañca sukhāyañca.	808	
PA_atk-s05_19a:809_0	Tattha ye diṭṭhicaritā sattā, te dvidhā tikkhindriyā ca mudindriyā ca. Tattha ye	809	
PA_atk-s05_19a:809_1	diṭṭhicaritā sattā tikkhindriyā, te sukhena paṭinissajjanti, khippañca abhisamenti.	809	
PA_atk-s05_19a:809_2	Tena vuccati – “sukhā paṭipadā khippābhiññā”ti. Tattha ye diṭṭhicaritā sattā mudindriyā	809	
PA_atk-s05_19a:809_3	paṭhamaṃ tikkhindriyaṃ upādāya dandhataraṃ abhisamenti, te sukhena paṭinissajjanti,	809	
PA_atk-s05_19a:809_4	dandhañca abhisamenti. Tena vuccati – “sukhā paṭipadā dandhābhiññā”ti. Tattha taṇhācaritā	809	
PA_atk-s05_19a:809_5	sattā duvidhā tikkhindriyā ca mudindriyā ca. Tattha ye taṇhācaritā sattā tikkhindriyā,	809	
PA_atk-s05_19a:809_6	te dukkhena paṭinissajjanti, khippañca abhisamenti. Tena vuccati – “dukkhā paṭipadā	809	
PA_atk-s05_19a:809_7	khippābhiññā”ti. Tattha ye taṇhācaritā sattā mudindriyā paṭhamaṃ tikkhindriyaṃ upādāya	809	
PA_atk-s05_19a:809_8	dandhataraṃ abhisamenti, te dukkhena paṭinissajjanti, dandhañca abhisamenti. Tena	809	
PA_atk-s05_19a:809_9	vuccati – “dukkhā paṭipadā dandhābhiññā”ti. Imā catasso paṭipadāyo apañcamā achaṭṭhā.	809	
PA_atk-s05_19a:809_10	Ye hi keci nibbutā nibbāyanti nibbāyissanti vā imāhi catūhi paṭipadāhi anaññāhi,	8091	
PA_atk-s05_19a:809_11	ayaṃ paṭipadā catukkamaggena kilese niddisati. Yā catukkamaggena ariyadhammesu niddisitabbā,	8091	
PA_atk-s05_19a:809_12	ayaṃ vuccati sīhavikkīḷito nāma nayo.	8091	
PA_atk-s05_19a:810	Tatrime cattāro āhārā, cattāro vipallāsā upādānā yogā ganthā āsavā oghā sallā viññāṇaṭṭhitiyo agatigamanānīti evaṃ imāni sabbāni dasa padāni. Ayaṃ suttassa saṃsandanā.	81	
PA_atk-s05_19a:811	Cattāro āhārā, tattha yo ca kabaḷīkāro āhāro, yo ca phasso āhāro, ime taṇhācaritena pahātabbā. Tattha yo ca manosañcetanāhāro, yo ca viññāṇāhāro, ime diṭṭhicaritena pahātabbā.	81	
PA_atk-s05_19a:812_0	Tattha paṭhamo āhāro paṭhamo vipallāso, dutiyo āhāro dutiyo vipallāso, tatiyo āhāro	812	
PA_atk-s05_19a:812_1	tatiyo vipallāso, catuttho āhāro catuttho vipallāso, ime cattāro vipallāsā apañcamā	812	
PA_atk-s05_19a:812_2	achaṭṭhā. Idañca pamāṇā cattāro āhārā.	812	
PA_atk-s05_19a:813_0	Tattha paṭhame vipallāse ṭhito kāme upādiyati, idaṃ kāmupādānaṃ. Dutiye vipallāse	813	
PA_atk-s05_19a:813_1	ṭhito anāgataṃ bhavaṃ upādiyati, idaṃ sīlabbatupādānaṃ. Tatiye vipallāse ṭhito viparītadiṭṭhiṃ	813	
PA_atk-s05_19a:813_2	upādiyati, idaṃ diṭṭhupādānaṃ. Catutthe vipallāse ṭhito khandhe attato upādiyati,	813	
PA_atk-s05_19a:813_3	idaṃ attavādupādānaṃ.	813	
PA_atk-s05_19a:814_0	Tattha kāmupādāne ṭhito kāme abhijjhāya ganthati, ayaṃ abhijjhākāyagantho. Sīlabbatupādāne	814	
PA_atk-s05_19a:814_1	ṭhito byāpādaṃ ganthati, ayaṃ byāpādakāyagantho. Diṭṭhupādāne ṭhito parāmāsaṃ ganthati,	814	
PA_atk-s05_19a:814_2	ayaṃ parāmāsakāyagantho. Attavādupādāne ṭhito papañcento ganthati, ayaṃ idaṃsaccābhinivesakāyagantho.	814	
PA_atk-s05_19a:815_0	Tassa ganthaganthitā kilesā āsavanti. Kiṃ pana vuccati āsavantīti? Vippaṭisārā. Ye	815	
PA_atk-s05_19a:815_1	vippaṭisārā, te anusayā. Tattha abhijjhākāyaganthena kāmāsavo, byāpādakāyaganthena	815	
PA_atk-s05_19a:815_2	bhavāsavo, parāmāsakāyaganthena diṭṭhāsavo, idaṃsaccābhinivesakāyaganthena avijjāsavo.	815	
PA_atk-s05_19a:816	Te cattāro āsavā vepullaṃ gatā oghā honti, tena vuccanti “oghā”ti. Tattha kāmāsavo kāmogho, bhavāsavo bhavogho, avijjāsavo avijjogho, diṭṭhāsavo diṭṭhogho.	81	
PA_atk-s05_19a:817_0	Te cattāro oghā āsayamanupaviṭṭhā anusayasahagatā vuccanti sallāti hadayamāhacca	817	
PA_atk-s05_19a:817_1	tiṭṭhanti. Tattha kāmogho rāgasallaṃ, bhavogho dosasallaṃ, avijjogho mohasallaṃ,	817	
PA_atk-s05_19a:817_2	diṭṭhogho diṭṭhisallaṃ.	817	
PA_atk-s05_19a:818_0	Imehi catūhi sallehi pariyādinnaṃ viññāṇaṃ catūsu dhammesu tiṭṭhati rūpe vedanāya	818	
PA_atk-s05_19a:818_1	saññāya saṅkhāresu. Imā catasso viññāṇaṭṭhitiyo. Tattha rāgasallena nandūpasecanaṃ	818	
PA_atk-s05_19a:818_2	rūpūpagaṃ viññāṇaṃ tiṭṭhati. Dosasallena vedanūpagaṃ. Mohasallena saññūpagaṃ. Diṭṭhisallena	818	
PA_atk-s05_19a:818_3	nandūpasecanaṃ saṅkhārūpagaṃ viññāṇaṃ tiṭṭhati.	818	
PA_atk-s05_19a:819_0	Catūhi viññāṇaṭṭhitīhi catubbidhaṃ agatiṃ gacchanti chandā dosā bhayā mohā. Rāgena	819	
PA_atk-s05_19a:819_1	chandā agatiṃ gacchati, dosena dosā agatiṃ gacchati, mohena mohā agatiṃ gacchati,	819	
PA_atk-s05_19a:819_2	diṭṭhiyā bhayā agatiṃ gacchati, iti imāni ca kammāni ime ca kilesā ayaṃ saṃsārahetu.	819	
PA_atk-s05_19a:820_0	Tatthimā catasso disā kabaḷīkāro āhāro “asubhe subha”nti vipallāso kāmupādānaṃ kāmayogo	820	
PA_atk-s05_19a:820_1	abhijjhākāyagantho kāmāsavo kāmogho rāgasallaṃ rūpūpagā viññāṇaṭṭhiti chandā agatigamanaṃ, ayaṃ paṭhamā disā.	820	
PA_atk-s05_19a:821	Phasso āhāro “dukkhe sukha”nti vipallāso sīlabbatupādānaṃ bhavayogo byāpādakāyagantho bhavāsavo bhavogho dosasallaṃ vedanūpagā viññāṇaṭṭhiti dosā agatigamanaṃ, ayaṃ dutiyā disā.	82	
PA_atk-s05_19a:822_0	Manosañcetanāhāro “anattani attā”ti vipallāso diṭṭhupādānaṃ diṭṭhiyogo parāmāsakāyagantho	822	
PA_atk-s05_19a:822_1	diṭṭhāsavo diṭṭhogho diṭṭhisallaṃ saññūpagā viññāṇaṭṭhiti bhayā agatigamanaṃ, ayaṃ tatiyā disā.	822	
PA_atk-s05_19a:823_0	Viññāṇāhāro “anicce nicca”nti vipallāso attavādupādānaṃ avijjāyogo idaṃsaccābhinivesokāyagantho	823	
PA_atk-s05_19a:823_1	avijjāsavo avijjogho mohasallaṃ saṅkhārūpagā viññāṇaṭṭhiti mohā agatigamanaṃ, ayaṃ	823	
PA_atk-s05_19a:823_2	catutthī disā. Iti imesaṃ dasannaṃ suttānaṃ paṭhamena padena paṭhamāya disāya ālokanaṃ,	823	
PA_atk-s05_19a:823_3	dutiyena padena dutiyāya disāya, tatiyena padena tatiyāya disāya, catutthena padena	823	
PA_atk-s05_19a:823_4	catutthiyā disāya ālokanaṃ, ayaṃ vuccati disā ālokanā. Iminā nayena sabbe kilesā	823	
PA_atk-s05_19a:823_5	catūsu padesu pakkhipitabbā. Ayaṃ akusalapakkho.	823	
PA_atk-s05_19a:824_0	Catasso paṭipadā, cattāri jhānāni, cattāro satipaṭṭhānā, cattāro vihārā dibbo brahmā	824	
PA_atk-s05_19a:824_1	ariyo āneñjo, cattāro sammappadhānā, cattāro acchariyā abbhutā dhammā, cattāro adhiṭṭhānā,	824	
PA_atk-s05_19a:824_2	cattāro samādhayo chandasamādhi vīriyasamādhi cittasamādhi vīmaṃsāsamādhi, cattāro	824	
PA_atk-s05_19a:824_3	dhammā sukhabhāgiyā nāññatra bojjhaṅgā nāññatra tapasā nāññatra indriyasaṃvarā nāññatra	824	
PA_atk-s05_19a:824_4	sabbanissaggā, cattāri appamāṇāni.	824	
PA_atk-s05_19a:825_0	Tattha dukkhā paṭipadā dandhābhiññā bhāviyamānā bahulīkariyamānā paṭhamaṃ jhānaṃ	825	
PA_atk-s05_19a:825_1	paripūreti, paṭhamaṃ jhānaṃ paripuṇṇaṃ paṭhamaṃ satipaṭṭhānaṃ paripūreti, paṭhamaṃ	825	
PA_atk-s05_19a:825_2	satipaṭṭhānaṃ paripuṇṇaṃ paṭhamaṃ vihāraṃ paripūreti, paṭhamo vihāro paripuṇṇo paṭhamaṃ	825	
