segmentnr	original	analyzed
PA_bu-vb_np2:0.1	Theravāda Vinaya	thera vāda vinaya 
PA_bu-vb_np2:0.2	Mahāvibhaṅga	mahāvibhaṅga 
PA_bu-vb_np2:0.3	Nissaggiyakaṇḍa	nissaggiya kaṇḍa 
PA_bu-vb_np2:0.4	Cīvaravagga	cīvara vagga 
PA_bu-vb_np2:0.5	2. Udosita(dutiyakathina)sikkhāpada	udosita dutiya kathina sikkhāpada 
PA_bu-vb_np2:1.1	Tena samayena buddho bhagavā sāvatthiyaṁ viharati jetavane anāthapiṇḍikassa ārāme.	tena samayena buddhaḥ bhagavā sāvatthiyam viharati jetavane anāthapiṇḍikassa ārāme 
PA_bu-vb_np2:1.2	Tena kho pana samayena bhikkhū bhikkhūnaṁ hatthe cīvaraṁ nikkhipitvā santaruttarena janapadacārikaṁ pakkamanti.	tena kho pana samayena bhikkhū bhikkhūnam hatthe cīvaram nikkhipitvā santaruttarena janapada cārikam pakkamanti 
PA_bu-vb_np2:1.3	Tāni cīvarāni ciraṁ nikkhittāni kaṇṇakitāni honti.	tāni cīvarāni ciram nikkhittāni kaṇṇakitāni honti 
PA_bu-vb_np2:1.4	Tāni bhikkhū otāpenti.	tāni bhikkhū otāpenti 
PA_bu-vb_np2:1.5	Addasā kho āyasmā ānando senāsanacārikaṁ āhiṇḍanto te bhikkhū tāni cīvarāni otāpente.	addasā kho āyasmai ānandaḥ senāsana cārikam āhiṇḍantaḥ te bhikkhū tāni cīvarāni otāpente 
PA_bu-vb_np2:1.6	Disvāna yena te bhikkhū tenupasaṅkami; upasaṅkamitvā te bhikkhū etadavoca—	disvāna yena te bhikkhū tena upasaṅkami upasaṅkamitvā te bhikkhū etat avoca 
PA_bu-vb_np2:1.7	“kassimāni, āvuso, cīvarāni kaṇṇakitānī”ti?	kassa imāni āvuso cīvarāni kaṇṇakitāni iti 
PA_bu-vb_np2:1.8	Atha kho te bhikkhū āyasmato ānandassa etamatthaṁ ārocesuṁ.	atha kho te bhikkhū āyasmataḥ ānandassa etam attham ārocesu 
PA_bu-vb_np2:1.9	Āyasmā ānando ujjhāyati khiyyati vipāceti—	āyasmai ānandaḥ ujjhāyati khiyyati vipāca iti 
PA_bu-vb_np2:1.10	“kathañhi nāma bhikkhū bhikkhūnaṁ hatthe cīvaraṁ nikkhipitvā santaruttarena janapadacārikaṁ pakkamissantī”ti.	katham hi nāma bhikkhū bhikkhūnam hatthe cīvaram nikkhipitvā santaruttarena janapada cārikam pakkamissanti iti 
PA_bu-vb_np2:1.11	Atha kho āyasmā ānando te bhikkhū anekapariyāyena vigarahitvā bhagavato etamatthaṁ ārocesi …pe…	atha kho āyasman ānandaḥ te bhikkhū aneka pariyāyena vigarahitvā bhagavato etam attham ārocesi pe 
PA_bu-vb_np2:1.12	“saccaṁ kira, bhikkhave, bhikkhū bhikkhūnaṁ hatthe cīvaraṁ nikkhipitvā santaruttarena janapadacārikaṁ pakkamantī”ti?	saccam kira bhikkhave bhikkhū bhikkhūnam hatthe cīvaram nikkhipitvā santaruttarena janapada cārikam pakkamanti iti 
PA_bu-vb_np2:1.13	“Saccaṁ, bhagavā”ti.	sat ca bhagavān ati 
PA_bu-vb_np2:1.14	Vigarahi buddho bhagavā …pe…	vigarahi buddhaḥ bhagavān pe 
PA_bu-vb_np2:1.15	kathañhi nāma te, bhikkhave, moghapurisā bhikkhūnaṁ hatthe cīvaraṁ nikkhipitvā santaruttarena janapadacārikaṁ pakkamissanti.	katham hi nāma te bhikkhave moghapurisāḥ bhikkhūnam hatthe cīvaram nikkhipitvā santaruttarena janapada cārikam pakkamissanti 
PA_bu-vb_np2:1.16	Netaṁ, bhikkhave, appasannānaṁ vā pasādāya …pe…	na ita bhikkhave appasannānam vā pasādāya pe 
PA_bu-vb_np2:1.17	evañca pana, bhikkhave, imaṁ sikkhāpadaṁ uddiseyyātha—	evam ca pana bhikkhave imam sikkhāpadam uddiseyyātha 
PA_bu-vb_np2:1.18.1	“Niṭṭhitacīvarasmiṁ bhikkhunā ubbhatasmiṁ kathine ekarattampi ce bhikkhu ticīvarena vippavaseyya, nissaggiyaṁ pācittiyan”ti.	niṭṭhita cīvarasmim bhikkhunā ubbhatasmim kathine eka rattam pi ce bhikkhu ti cīvarena vippavaseyya nissaggiyam pācittiyam ti 
PA_bu-vb_np2:1.19	Evañcidaṁ bhagavatā bhikkhūnaṁ sikkhāpadaṁ paññattaṁ hoti.	evañca idam bhagavatā bhikkhūnam sikkhāpadam paññattam hoti 
PA_bu-vb_np2:2.1	Tena kho pana samayena aññataro bhikkhu kosambiyaṁ gilāno hoti.	tena kho pana samayena aññataraḥ bhikkhu kosambiyam gilānaḥ hoti 
PA_bu-vb_np2:2.2	Ñātakā tassa bhikkhuno santike dūtaṁ pāhesuṁ—	ñātakā tassa bhikkhuno santike dūtam pāhesu 
PA_bu-vb_np2:2.3	“āgacchatu bhadanto, mayaṁ, upaṭṭhahissāmā”ti.	āgacchatu bhadantaḥ mayaḥ upaṭṭhahissāma ati 
PA_bu-vb_np2:2.4	Bhikkhūpi evamāhaṁsu—“gacchāvuso, ñātakā taṁ upaṭṭhahissantī”ti.	bhikkhū api evam āha sugaccha āvuso ñātakā tam upaṭṭhahissanti iti 
PA_bu-vb_np2:2.5	So evamāha—	sā u evam āha 
PA_bu-vb_np2:2.6	“bhagavatāvuso, sikkhāpadaṁ paññattaṁ—	bhagavatā āvuso sikkhāpadam paññatta 
PA_bu-vb_np2:2.7	‘na ticīvarena vippavasitabban’ti.	na ti cīvarena vippavasitabbanti 
PA_bu-vb_np2:2.8	Ahañcamhi gilāno.	aham ca amhi gilānaḥ 
PA_bu-vb_np2:2.9	Na sakkomi ticīvaraṁ ādāya pakkamituṁ.	na sakkomi ti cīvaram ādāya pakkamitu 
PA_bu-vb_np2:2.10	Nāhaṁ gamissāmī”ti.	na aham gamissāmi iti 
PA_bu-vb_np2:2.11	Bhagavato etamatthaṁ ārocesuṁ.	bhagavato etam attham ārocesu 
PA_bu-vb_np2:2.12	Atha kho bhagavā etasmiṁ nidāne etasmiṁ pakaraṇe dhammiṁ kathaṁ katvā bhikkhū āmantesi—	atha kho bhagavā etasmim nidāne etasmim pakaraṇe dhammim katham katvā bhikkhū āmantesi 
PA_bu-vb_np2:2.13	“anujānāmi, bhikkhave, gilānassa bhikkhuno ticīvarena avippavāsasammutiṁ dātuṁ.	anujānāmi bhikkhave gilānassa bhikkhuno ti cīvarena a vippavāsa sammutim dātu 
PA_bu-vb_np2:2.14	Evañca pana, bhikkhave, dātabbā.	evam ca pana bhikkhave dātabbā 
PA_bu-vb_np2:2.15	Tena gilānena bhikkhunā saṅghaṁ upasaṅkamitvā ekaṁsaṁ uttarāsaṅgaṁ karitvā vuḍḍhānaṁ bhikkhūnaṁ pāde vanditvā ukkuṭikaṁ nisīditvā añjaliṁ paggahetvā evamassa vacanīyo—	tena gilānena bhikkhunā saṅgham upasaṅkamitvā ekasam uttarāsaṅgam karitvā vuḍḍhānam bhikkhūnam pāde vanditvā ukkuṭikam nisīditvā añjalim paggahetvā evam assa vacanīyaḥ 
PA_bu-vb_np2:2.16	‘ahaṁ, bhante, gilāno.	aha bhante gilānaḥ 
PA_bu-vb_np2:2.17	Na sakkomi ticīvaraṁ ādāya pakkamituṁ.	na sakkomi ti cīvaram ādāya pakkamitu 
PA_bu-vb_np2:2.18	Sohaṁ, bhante, saṅghaṁ ticīvarena avippavāsasammutiṁ yācāmī’ti.	sā uha bhante saṅgham ti cīvarena a vippavāsa sammutim yācāmi iti 
PA_bu-vb_np2:2.19	Dutiyampi yācitabbā.	dutiyam pi yācitabbā 
PA_bu-vb_np2:2.20	Tatiyampi yācitabbā.	tatiyam pi yācitabbā 
PA_bu-vb_np2:2.21	Byattena bhikkhunā paṭibalena saṅgho ñāpetabbo—	byattena bhikkhunā paṭibalena saṅghaḥ ñāpetabbaḥ 
PA_bu-vb_np2:2.22	‘Suṇātu me, bhante, saṅgho.	suṇātu me bhante saṅghaḥ 
PA_bu-vb_np2:2.23	Ayaṁ itthannāmo bhikkhu gilāno.	ayam itthannāmaḥ bhikkhu gilānaḥ 
PA_bu-vb_np2:2.24	Na sakkoti ticīvaraṁ ādāya pakkamituṁ.	na sakkoti ti cīvaram ādāya pakkamitu 
PA_bu-vb_np2:2.25	So saṅghaṁ ticīvarena avippavāsasammutiṁ yācati.	saḥ saṅgham ti cīvarena a vippavāsa sammutim yācati 
PA_bu-vb_np2:2.26	Yadi saṅghassa pattakallaṁ, saṅgho itthannāmassa bhikkhuno ticīvarena avippavāsasammutiṁ dadeyya.	yadi saṅghassa pattakalla saṅghaḥ itthannāmassa bhikkhuno ti cīvarena a vippavāsa sammutim dadeyya 
PA_bu-vb_np2:2.27	Esā ñatti.	esā ñatti 
PA_bu-vb_np2:2.28	Suṇātu me, bhante, saṅgho.	suṇātu me bhante saṅghaḥ 
PA_bu-vb_np2:2.29	Ayaṁ itthannāmo bhikkhu gilāno.	ayam itthannāmaḥ bhikkhu gilānaḥ 
PA_bu-vb_np2:2.30	Na sakkoti ticīvaraṁ ādāya pakkamituṁ.	na sakkoti ti cīvaram ādāya pakkamitu 
PA_bu-vb_np2:2.31	So saṅghaṁ ticīvarena avippavāsasammutiṁ yācati.	saḥ saṅgham ti cīvarena a vippavāsa sammutim yācati 
PA_bu-vb_np2:2.32	Saṅgho itthannāmassa bhikkhuno ticīvarena avippavāsasammutiṁ deti.	saṅghaḥ itthannāmassa bhikkhuno ti cīvarena a vippavāsa sammutim deti 
PA_bu-vb_np2:2.33	Yassāyasmato khamati itthannāmassa bhikkhuno ticīvarena avippavāsasammutiyā dānaṁ, so tuṇhassa;	yassa ayasmataḥ khamati itthannāmassa bhikkhuno ti cīvarena a vippavāsa sammutiyā so tuṇhassa 
PA_bu-vb_np2:2.34	yassa nakkhamati, so bhāseyya.	yassa na khamati saḥ bhāseyya 
PA_bu-vb_np2:2.35	Dinnā saṅghena itthannāmassa bhikkhuno ticīvarena avippavāsasammuti.	dinnā saṅghena itthannāmassa bhikkhuno ti cīvarena a vippavāsa sammuti 
PA_bu-vb_np2:2.36	Khamati saṅghassa, tasmā tuṇhī,	khamati saṅghassa tasmā tuṇhī 
PA_bu-vb_np2:2.37	evametaṁ dhārayāmī’ti.	evam etam dhārayāmi iti 
PA_bu-vb_np2:2.38	Evañca pana, bhikkhave, imaṁ sikkhāpadaṁ uddiseyyātha—	evam ca pana bhikkhave imam sikkhāpadam uddiseyyātha 
PA_bu-vb_np2:2.39.1	“Niṭṭhitacīvarasmiṁ bhikkhunā ubbhatasmiṁ kathine ekarattampi ce bhikkhu ticīvarena vippavaseyya, aññatra bhikkhusammutiyā, nissaggiyaṁ pācittiyan”ti.	niṭṭhita cīvarasmim bhikkhunā ubbhatasmim kathine eka rattam pi ce bhikkhu ti cīvarena vippavaseyya aññatra bhikkhu sammutiyā nissaggiyam pācittiyam ti 
PA_bu-vb_np2:3.1.1	Niṭṭhitacīvarasminti	niṭṭhita cīvarasmin ti 
PA_bu-vb_np2:3.1.2	bhikkhuno cīvaraṁ kataṁ vā hoti naṭṭhaṁ vā vinaṭṭhaṁ vā daḍḍhaṁ vā cīvarāsā vā upacchinnā.	bhikkhuno cīvaram katam vā hoti naṭṭham vā vinaṭṭham vā daḍḍham vā cīvara āsā vā upacchinnā 
PA_bu-vb_np2:3.1.3	Ubbhatasmiṁ kathineti	ubbhatasmin kathinā iti 
PA_bu-vb_np2:3.1.4	aṭṭhannaṁ mātikānaṁ aññatarāya mātikāya ubbhataṁ hoti, saṅghena vā antarā ubbhataṁ hoti.	aṭṭhannam mātikānam aññatarāya mātikāya ubbhatam hoti saṅghena vā antarā ubbhatam hoti 
PA_bu-vb_np2:3.1.5	Ekarattampi ce bhikkhu ticīvarena vippavaseyyāti	eka rattam pi ce bhikkhu ti cīvarena vippavaseyya ati 
PA_bu-vb_np2:3.1.6	saṅghāṭiyā vā uttarāsaṅgena vā antaravāsakena vā.	saṅghāṭiyā vā uttarāsaṅgena vā antaravāsakena vā 
PA_bu-vb_np2:3.1.7	Aññatra bhikkhusammutiyāti	aññatra bhikkhu sammutiyā ti 
PA_bu-vb_np2:3.1.8	ṭhapetvā bhikkhusammutiṁ.	ṭhapetvā bhikkhu sammuti 
PA_bu-vb_np2:3.1.9	Nissaggiyaṁ hotīti	nissaggiyam hoti iti 
PA_bu-vb_np2:3.1.10	saha aruṇuggamanā nissaggiyaṁ hoti.	saha aruṇuggamanā nissaggiyam hoti 
PA_bu-vb_np2:3.1.11	Nissajjitabbaṁ saṅghassa vā gaṇassa vā puggalassa vā.	nissajjitabbam saṅghassa vā gaṇassa vā puggalassa vā 
PA_bu-vb_np2:3.1.12	Evañca pana, bhikkhave, nissajjitabbaṁ	evam ca pana bhikkhave 
PA_bu-vb_np2:3.1.13	…pe…	pe 
PA_bu-vb_np2:3.1.14	“idaṁ me, bhante, cīvaraṁ rattivippavutthaṁ aññatra bhikkhusammutiyā nissaggiyaṁ,	idam me bhante cīvaram ratti vippavuttham aññatra bhikkhu sammutiyā 
PA_bu-vb_np2:3.1.15	imāhaṁ saṅghassa nissajjāmī”ti …pe…	imā aham saṅghassa nissajjāmi iti pe 
PA_bu-vb_np2:3.1.16	dadeyyāti …pe…	dadeyyā ati pe 
PA_bu-vb_np2:3.1.17	dadeyyunti …pe…	pe 
PA_bu-vb_np2:3.1.18	āyasmato dammīti.	āyasmataḥ dammi iti 
PA_bu-vb_np2:3.2.1	Gāmo ekūpacāro nānūpacāro.	ekūpacāraḥ na anūpacāraḥ 
PA_bu-vb_np2:3.2.2	Nivesanaṁ ekūpacāraṁ nānūpacāraṁ.	nivesanam ekūpacāram 
PA_bu-vb_np2:3.2.3	Udosito ekūpacāro nānūpacāro.	ekūpacāraḥ na anūpacāraḥ 
PA_bu-vb_np2:3.2.4	Aṭṭo ekūpacāro nānūpacāro.	ekūpacāraḥ na anūpacāraḥ 
PA_bu-vb_np2:3.2.5	Māḷo ekūpacāro nānūpacāro.	māḷaḥ ekūpacāraḥ na anūpacāraḥ 
PA_bu-vb_np2:3.2.6	Pāsādo ekūpacāro nānūpacāro.	pāsādaḥ ekūpacāraḥ na anūpacāraḥ 
PA_bu-vb_np2:3.2.7	Hammiyaṁ ekūpacāraṁ nānūpacāraṁ.	ekūpacāram 
PA_bu-vb_np2:3.2.8	Nāvā ekūpacārā nānūpacārā.	nāvā ekūpacārā na anūpacārā 
PA_bu-vb_np2:3.2.9	Sattho ekūpacāro nānūpacāro.	sattho ekūpacāraḥ na anūpacāraḥ 
PA_bu-vb_np2:3.2.10	Khettaṁ ekūpacāraṁ nānūpacāraṁ.	khettam ekūpacāram 
PA_bu-vb_np2:3.2.11	Dhaññakaraṇaṁ ekūpacāraṁ nānūpacāraṁ.	dhañña karaṇam ekūpacāram 
PA_bu-vb_np2:3.2.12	Ārāmo ekūpacāro nānūpacāro.	ārāmaḥ ekūpacāraḥ na anūpacāraḥ 
PA_bu-vb_np2:3.2.13	Vihāro ekūpacāro nānūpacāro.	vihāraḥ ekūpacāraḥ na anūpacāraḥ 
PA_bu-vb_np2:3.2.14	Rukkhamūlaṁ ekūpacāraṁ nānūpacāraṁ.	rukkha mūlam ekūpacāram 
PA_bu-vb_np2:3.2.15	Ajjhokāso ekūpacāro nānūpacāro.	ajjhokāsaḥ eka upacāraḥ na anūpacāraḥ 
PA_bu-vb_np2:3.3.1	Gāmo ekūpacāro nāma	ekūpacāraḥ nāma 
PA_bu-vb_np2:3.3.2	ekakulassa gāmo hoti parikkhitto ca. Antogāme cīvaraṁ nikkhipitvā antogāme vatthabbaṁ.	eka kulassa gāmaḥ hoti parikkhittaḥ ca antogāme cīvaram nikkhipitvā antogāme 
PA_bu-vb_np2:3.3.3	Aparikkhitto hoti, yasmiṁ ghare cīvaraṁ nikkhittaṁ hoti tasmiṁ ghare vatthabbaṁ, hatthapāsā vā na vijahitabbaṁ.	a parikkhittaḥ hoti yasmin ghare cīvaram nikkhittam hoti tasmin ghare hattha pāsā vā na vijahitabba 
PA_bu-vb_np2:3.3.4	Nānākulassa gāmo hoti parikkhitto ca. Yasmiṁ ghare cīvaraṁ nikkhittaṁ hoti tasmiṁ ghare vatthabbaṁ sabhāye vā dvāramūle vā, hatthapāsā vā na vijahitabbaṁ.	nānā kulassa gāmaḥ hoti parikkhittaḥ ca yasmin ghare cīvaram nikkhittam hoti tasmin ghare vatthabbam sabhāye vā dvāra mūle vā hattha pāsā vā na vijahitabba 
PA_bu-vb_np2:3.3.5	Sabhāyaṁ gacchantena hatthapāse cīvaraṁ nikkhipitvā sabhāye vā vatthabbaṁ dvāramūle vā, hatthapāsā vā na vijahitabbaṁ.	sabhāyam gacchantena hattha pāse cīvaram nikkhipitvā sabhāye vā vatthabbam dvāra mūle vā hattha pāsā vā na vijahitabba 
PA_bu-vb_np2:3.3.6	Sabhāye cīvaraṁ nikkhipitvā sabhāye vā vatthabbaṁ dvāramūle vā, hatthapāsā vā na vijahitabbaṁ.	sabhāye cīvaram nikkhipitvā sabhāye vā vatthabbam dvāra mūle vā hattha pāsā vā na vijahitabba 
PA_bu-vb_np2:3.3.7	Aparikkhitto hoti, yasmiṁ ghare cīvaraṁ nikkhittaṁ hoti tasmiṁ ghare vatthabbaṁ, hatthapāsā vā na vijahitabbaṁ.	a parikkhittaḥ hoti yasmin ghare cīvaram nikkhittam hoti tasmin ghare hattha pāsā vā na vijahitabba 
PA_bu-vb_np2:3.4.1	Ekakulassa nivesanaṁ hoti parikkhittañca, nānāgabbhā nānāovarakā. Antonivesane cīvaraṁ nikkhipitvā antonivesane vatthabbaṁ.	eka kulassa nivesanam hoti parikkhittam ca nānā gabbhāḥ nānā ovarakāḥ antonivesane cīvaram nikkhipitvā antonivesane 
PA_bu-vb_np2:3.4.2	Aparikkhittaṁ hoti, yasmiṁ gabbhe cīvaraṁ nikkhittaṁ hoti tasmiṁ gabbhe vatthabbaṁ, hatthapāsā vā na vijahitabbaṁ.	a parikkhittam hoti yasmin gabbhe cīvaram nikkhittam hoti tasmin gabbhe hattha pāsāḥ vā na vijahitabba 
PA_bu-vb_np2:3.4.3	Nānākulassa nivesanaṁ hoti parikkhittañca, nānāgabbhā nānāovarakā. Yasmiṁ gabbhe cīvaraṁ nikkhittaṁ hoti tasmiṁ gabbhe vatthabbaṁ dvāramūle vā, hatthapāsā vā na vijahitabbaṁ.	nānā kulassa nivesanam hoti parikkhittam ca nānā gabbhāḥ nānā ovarakāḥ yasmin gabbhe cīvaram nikkhittam hoti tasmin gabbhe vatthabbam dvāra mūle vā hattha pāsā vā na vijahitabba 
PA_bu-vb_np2:3.4.4	Aparikkhittaṁ hoti, yasmiṁ gabbhe cīvaraṁ nikkhittaṁ hoti tasmiṁ gabbhe vatthabbaṁ, hatthapāsā vā na vijahitabbaṁ.	a parikkhittam hoti yasmin gabbhe cīvaram nikkhittam hoti tasmin gabbhe hattha pāsāḥ vā na vijahitabba 
PA_bu-vb_np2:3.5.1	Ekakulassa udosito hoti parikkhitto ca, nānāgabbhā nānāovarakā. Antoudosite cīvaraṁ nikkhipitvā antoudosite vatthabbaṁ.	eka kulassa udositaḥ hoti parikkhittaḥ ca nānā gabbhāḥ nānā ovarakāḥ antar udosite cīvaram nikkhipitvā antar udosite 
PA_bu-vb_np2:3.5.2	Aparikkhitto hoti, yasmiṁ gabbhe cīvaraṁ nikkhittaṁ hoti tasmiṁ gabbhe vatthabbaṁ, hatthapāsā vā na vijahitabbaṁ.	a parikkhittaḥ hoti yasmin gabbhe cīvaram nikkhittam hoti tasmin gabbhe hattha pāsā vā na vijahitabba 
PA_bu-vb_np2:3.5.3	Nānākulassa udosito hoti parikkhitto ca, nānāgabbhā nānāovarakā. Yasmiṁ gabbhe cīvaraṁ nikkhittaṁ hoti tasmiṁ gabbhe vatthabbaṁ dvāramūle vā, hatthapāsā vā na vijahitabbaṁ.	nānā kulassa udositaḥ hoti parikkhittaḥ ca nānā gabbhāḥ nānā ovarakāḥ yasmin gabbhe cīvaram nikkhittam hoti tasmin gabbhe vatthabbam dvāra mūle vā hattha pāsā vā na vijahitabba 
PA_bu-vb_np2:3.5.4	Aparikkhitto hoti, yasmiṁ gabbhe cīvaraṁ nikkhittaṁ hoti tasmiṁ gabbhe vatthabbaṁ, hatthapāsā vā na vijahitabbaṁ.	a parikkhittaḥ hoti yasmin gabbhe cīvaram nikkhittam hoti tasmin gabbhe hattha pāsā vā na vijahitabba 
PA_bu-vb_np2:3.6.1	Ekakulassa aṭṭo hoti, antoaṭṭe cīvaraṁ nikkhipitvā antoaṭṭe vatthabbaṁ.	eka kulassa aṭṭaḥ hoti antoaṭṭe cīvaram nikkhipitvā antoaṭṭe 
PA_bu-vb_np2:3.6.2	Nānākulassa aṭṭo hoti, nānāgabbhā nānāovarakā. Yasmiṁ gabbhe cīvaraṁ nikkhittaṁ hoti tasmiṁ gabbhe vatthabbaṁ dvāramūle vā, hatthapāsā vā na vijahitabbaṁ.	nānā kulassa aṭṭaḥ hoti nānā gabbhāḥ nānā ovarakāḥ yasmin gabbhe cīvaram nikkhittam hoti tasmin gabbhe vatthabbam dvāra mūle vā hattha pāsā vā na vijahitabba 
PA_bu-vb_np2:3.7.1	Ekakulassa māḷo hoti, antomāḷe cīvaraṁ nikkhipitvā antomāḷe vatthabbaṁ.	eka kulassa māḷaḥ hoti antomāḷe cīvaram nikkhipitvā antomāḷe 
PA_bu-vb_np2:3.7.2	Nānākulassa māḷo hoti nānāgabbhā nānāovarakā, yasmiṁ gabbhe cīvaraṁ nikkhittaṁ hoti tasmiṁ gabbhe vatthabbaṁ dvāramūle vā, hatthapāsā vā na vijahitabbaṁ.	nānā kulassa māḷaḥ hoti nānā gabbhāḥ nānā ovarakāḥ yasmin gabbhe cīvaram nikkhittam hoti tasmin gabbhe vatthabbam dvāra mūle vā hattha pāsā vā na vijahitabba 
PA_bu-vb_np2:3.8.1	Ekakulassa pāsādo hoti, antopāsāde cīvaraṁ nikkhipitvā antopāsāde vatthabbaṁ.	eka kulassa pāsādaḥ hoti antopāsāde cīvaram nikkhipitvā antopāsāde 
PA_bu-vb_np2:3.8.2	Nānākulassa pāsādo hoti, nānāgabbhā nānāovarakā. Yasmiṁ gabbhe cīvaraṁ nikkhittaṁ hoti tasmiṁ gabbhe vatthabbaṁ dvāramūle vā, hatthapāsā vā na vijahitabbaṁ.	nānā kulassa pāsādaḥ hoti nānā gabbhāḥ nānā ovarakāḥ yasmin gabbhe cīvaram nikkhittam hoti tasmin gabbhe vatthabbam dvāra mūle vā hattha pāsā vā na vijahitabba 
PA_bu-vb_np2:3.9.1	Ekakulassa hammiyaṁ hoti, antohammiye cīvaraṁ nikkhipitvā antohammiye vatthabbaṁ.	eka kulassa hammiyam hoti antohammiye cīvaram nikkhipitvā antohammiye 
PA_bu-vb_np2:3.9.2	Nānākulassa hammiyaṁ hoti, nānāgabbhā nānāovarakā. Yasmiṁ gabbhe cīvaraṁ nikkhittaṁ hoti tasmiṁ gabbhe vatthabbaṁ dvāramūle vā, hatthapāsā vā na vijahitabbaṁ.	nānā kulassa hammiyam hoti nānā gabbhā nānā ovarakā yasmin gabbhe cīvaram nikkhittam hoti tasmin gabbhe vatthabbam dvāra mūle vā hattha pāsā vā na vijahitabba 
PA_bu-vb_np2:3.10.1	Ekakulassa nāvā hoti. Antonāvāya cīvaraṁ nikkhipitvā antonāvāya vatthabbaṁ.	eka kulassa nāvā hoti antonāvāya cīvaram nikkhipitvā antonāvāya 
PA_bu-vb_np2:3.10.2	Nānākulassa nāvā hoti nānāgabbhā nānāovarakā. Yasmiṁ ovarake cīvaraṁ nikkhittaṁ hoti tasmiṁ ovarake vatthabbaṁ, hatthapāsā vā na vijahitabbaṁ.	nānā kulassa nāvā hoti nānā gabbhā nānā ovarakā yasmin ovarake cīvaram nikkhittam hoti tasmin ovarake hattha pāsā vā na vijahitabba 
PA_bu-vb_np2:3.11.1	Ekakulassa sattho hoti. Satthe cīvaraṁ nikkhipitvā purato vā pacchato vā sattabbhantarā na vijahitabbā, passato abbhantaraṁ na vijahitabbaṁ.	eka kulassa satthaḥ hoti satthe cīvaram nikkhipitvā puratas vā pacchatas vā satta abbhantarā na vijahitabbā passataḥ abbhantaram na vijahitabba 
PA_bu-vb_np2:3.11.2	Nānākulassa sattho hoti, satthe cīvaraṁ nikkhipitvā hatthapāsā na vijahitabbaṁ.	nānā kulassa satthaḥ hoti satthe cīvaram nikkhipitvā hattha pāsā na vijahitabba 
PA_bu-vb_np2:3.12.1	Ekakulassa khettaṁ hoti parikkhittañca. Antokhette cīvaraṁ nikkhipitvā antokhette vatthabbaṁ.	eka kulassa khettam hoti parikkhittam ca antar khette cīvaram nikkhipitvā antar khette 
PA_bu-vb_np2:3.12.2	Aparikkhittaṁ hoti, hatthapāsā na vijahitabbaṁ.	a parikkhittam hoti hattha pāsā na vijahitabba 
PA_bu-vb_np2:3.12.3	Nānākulassa khettaṁ hoti parikkhittañca. Antokhette cīvaraṁ nikkhipitvā dvāramūle vā vatthabbaṁ, hatthapāsā vā na vijahitabbaṁ.	nānā kulassa khettam hoti parikkhittam ca antar khette cīvaram nikkhipitvā dvāra mūle vā hattha pāsā vā na vijahitabba 
PA_bu-vb_np2:3.12.4	Aparikkhittaṁ hoti, hatthapāsā na vijahitabbaṁ.	a parikkhittam hoti hattha pāsā na vijahitabba 
PA_bu-vb_np2:3.13.1	Ekakulassa dhaññakaraṇaṁ hoti parikkhittañca. Antodhaññakaraṇe cīvaraṁ nikkhipitvā antodhaññakaraṇe vatthabbaṁ.	eka kulassa dhañña karaṇam hoti parikkhittam ca antar dhañña karaṇe cīvaram nikkhipitvā antar dhañña karaṇe 
PA_bu-vb_np2:3.13.2	Aparikkhittaṁ hoti, hatthapāsā na vijahitabbaṁ.	a parikkhittam hoti hattha pāsā na vijahitabba 
PA_bu-vb_np2:3.13.3	Nānākulassa dhaññakaraṇaṁ hoti parikkhittañca. Antodhaññakaraṇe cīvaraṁ nikkhipitvā dvāramūle vā vatthabbaṁ, hatthapāsā vā na vijahitabbaṁ.	nānā kulassa dhañña karaṇam hoti parikkhittam ca antar dhañña karaṇe cīvaram nikkhipitvā dvāra mūle vā hattha pāsā vā na vijahitabba 
PA_bu-vb_np2:3.13.4	Aparikkhittaṁ hoti, hatthapāsā na vijahitabbaṁ.	a parikkhittam hoti hattha pāsā na vijahitabba 
PA_bu-vb_np2:3.14.1	Ekakulassa ārāmo hoti parikkhitto ca. Antoārāme cīvaraṁ nikkhipitvā antoārāme vatthabbaṁ.	eka kulassa ārāmaḥ hoti parikkhittaḥ ca antoārāme cīvaram nikkhipitvā antoārāme 
PA_bu-vb_np2:3.14.2	Aparikkhitto hoti, hatthapāsā na vijahitabbaṁ.	a parikkhittaḥ hoti hattha pāsā na vijahitabba 
PA_bu-vb_np2:3.14.3	Nānākulassa ārāmo hoti parikkhitto ca. Antoārāme cīvaraṁ nikkhipitvā dvāramūle vā vatthabbaṁ, hatthapāsā vā na vijahitabbaṁ.	nānā kulassa ārāmaḥ hoti parikkhittaḥ ca antoārāme cīvaram nikkhipitvā dvāra mūle vā hattha pāsā vā na vijahitabba 
PA_bu-vb_np2:3.14.4	Aparikkhitto hoti, hatthapāsā na vijahitabbaṁ.	a parikkhittaḥ hoti hattha pāsā na vijahitabba 
PA_bu-vb_np2:3.15.1	Ekakulassa vihāro hoti parikkhitto ca. Antovihāre cīvaraṁ nikkhipitvā antovihāre vatthabbaṁ.	eka kulassa vihāraḥ hoti parikkhittaḥ ca antovihāre cīvaram nikkhipitvā antovihāre 
PA_bu-vb_np2:3.15.2	Aparikkhitto hoti, yasmiṁ vihāre cīvaraṁ nikkhittaṁ hoti tasmiṁ vihāre vatthabbaṁ, hatthapāsā vā na vijahitabbaṁ.	a parikkhittaḥ hoti yasmin vihāre cīvaram nikkhittam hoti tasmin vihāre hattha pāsā vā na vijahitabba 
PA_bu-vb_np2:3.15.3	Nānākulassa vihāro hoti parikkhitto ca. Yasmiṁ vihāre cīvaraṁ nikkhittaṁ hoti tasmiṁ vihāre vatthabbaṁ dvāramūle vā, hatthapāsā vā na vijahitabbaṁ.	nānā kulassa vihāraḥ hoti parikkhittaḥ ca yasmin vihāre cīvaram nikkhittam hoti tasmin vihāre vatthabbam dvāra mūle vā hattha pāsā vā na vijahitabba 
PA_bu-vb_np2:3.15.4	Aparikkhitto hoti, yasmiṁ vihāre cīvaraṁ nikkhittaṁ hoti tasmiṁ vihāre vatthabbaṁ, hatthapāsā vā na vijahitabbaṁ.	a parikkhittaḥ hoti yasmin vihāre cīvaram nikkhittam hoti tasmin vihāre hattha pāsā vā na vijahitabba 
PA_bu-vb_np2:3.16.1	Ekakulassa rukkhamūlaṁ hoti, yaṁ majjhanhike kāle samantā chāyā pharati, antochāyāya cīvaraṁ nikkhipitvā antochāyāya vatthabbaṁ.	eka kulassa rukkha mūlam hoti yam majjhanhike kāle samantā chāyā pharati antochāyāya cīvaram nikkhipitvā antochāyāya 
PA_bu-vb_np2:3.16.2	Nānākulassa rukkhamūlaṁ hoti, hatthapāsā na vijahitabbaṁ.	nānā kulassa rukkha mūlam hoti hattha pāsā na vijahitabba 
PA_bu-vb_np2:3.17.1	Ajjhokāso ekūpacāro nāma agāmake araññe samantā sattabbhantarā ekūpacāro,	ajjhokāsaḥ ekūpacāraḥ nāma agāmake araññe samantā satta abbhantarā ekūpacāro 
PA_bu-vb_np2:3.17.2	tato paraṁ nānūpacāro.	tatas param na anūpacāraḥ 
PA_bu-vb_np2:3.18.1	Vippavutthe vippavutthasaññī aññatra bhikkhusammutiyā, nissaggiyaṁ pācittiyaṁ.	vippavutthe vippavuttha saññī aññatra bhikkhu sammutiyā nissaggiyam pācittiya 
PA_bu-vb_np2:3.18.2	Vippavutthe vematiko, aññatra bhikkhusammutiyā, nissaggiyaṁ pācittiyaṁ.	vippavutthe vematikaḥ aññatra bhikkhu sammutiyā nissaggiyam pācittiya 
PA_bu-vb_np2:3.18.3	Vippavutthe avippavutthasaññī, aññatra bhikkhusammutiyā, nissaggiyaṁ pācittiyaṁ.	vippavutthe a vippavuttha saññī aññatra bhikkhu sammutiyā nissaggiyam pācittiya 
PA_bu-vb_np2:3.18.4	Appaccuddhaṭe paccuddhaṭasaññī …pe…	ap paccuddhaṭe paccuddhaṭa saññī pe 
PA_bu-vb_np2:3.18.5	avissajjite vissajjitasaññī …	a vissajjite vissajjita saññī 
PA_bu-vb_np2:3.18.6	anaṭṭhe naṭṭhasaññī …	an aṭṭhe naṭṭha saññī 
PA_bu-vb_np2:3.18.7	avinaṭṭhe vinaṭṭhasaññī …	a vinaṭṭhe vinaṭṭha saññī 
PA_bu-vb_np2:3.18.8	adaḍḍhe daḍḍhasaññī …	a daḍḍhe daḍḍha saññī 
PA_bu-vb_np2:3.18.9	avilutte viluttasaññī, aññatra bhikkhusammutiyā, nissaggiyaṁ pācittiyaṁ.	a vilutte vilutta saññī aññatra bhikkhu sammutiyā nissaggiyam pācittiya 
PA_bu-vb_np2:3.18.10	Nissaggiyaṁ cīvaraṁ anissajjitvā paribhuñjati, āpatti dukkaṭassa.	nissaggiyam cīvaram a nissajjitvā paribhuñjati āpatti dukkaṭassa 
PA_bu-vb_np2:3.18.11	Avippavutthe vippavutthasaññī, āpatti dukkaṭassa.	a vippavutthe vippavuttha saññī āpatti dukkaṭassa 
PA_bu-vb_np2:3.18.12	Avippavutthe vematiko, āpatti dukkaṭassa.	a vippavutthe vematikaḥ āpatti dukkaṭassa 
PA_bu-vb_np2:3.18.13	Avippavutthe avippavutthasaññī, anāpatti.	a vippavutthe a vippavuttha saññī anāpatti 
PA_bu-vb_np2:3.19.1	Anāpatti—	anāpatti 
PA_bu-vb_np2:3.19.2	antoaruṇe paccuddharati, vissajjeti, nassati, vinassati, ḍayhati, acchinditvā gaṇhanti, vissāsaṁ gaṇhanti,	antoaruṇe paccuddharati vissajjeti nassati vinassati ḍayhati a chinditvā gaṇhanti vissāsam gaṇhanti 
