segmentnr	original	analyzed
PA_bu-vb_pc8:0.1	Theravāda Vinaya	thera vāda vinaya 
PA_bu-vb_pc8:0.2	Mahāvibhaṅga	mahāvibhaṅga 
PA_bu-vb_pc8:0.3	Pācittiyakaṇḍa	pācittiyakaṇḍa 
PA_bu-vb_pc8:0.4	Musāvādavagga	musā vāda vagga 
PA_bu-vb_pc8:0.5	8. Bhūtārocanasikkhāpada	  
PA_bu-vb_pc8:1.1.1	Tena samayena buddho bhagavā vesāliyaṁ viharati mahāvane kūṭāgārasālāyaṁ.	tena samayena buddhaḥ bhagavā vesāliyam viharati mahā vane kūṭāgāra sālāya 
PA_bu-vb_pc8:1.1.2	Tena kho pana samayena sambahulā sandiṭṭhā sambhattā bhikkhū vaggumudāya nadiyā tīre vassaṁ upagacchiṁsu.	tena kho pana samayena sambahulā sandiṭṭhā sambhattāḥ bhikkhū vaggumudāya nadiyāḥ tīre vassam upagacchisu 
PA_bu-vb_pc8:1.1.3	Tena kho pana samayena vajjī dubbhikkhā hoti—dvīhitikā setaṭṭhikā salākāvuttā, na sukarā uñchena paggahena yāpetuṁ.	tena kho pana samayena vajjī dubbhikkhā hoti dvīhitikā setaṭṭhikā salākāvuttā na sukarā uñchena paggahena yāpetu 
PA_bu-vb_pc8:1.1.4_0	Atha kho tesaṁ bhikkhūnaṁ etadahosi—“etarahi kho vajjī dubbhikkhā—dvīhitikā setaṭṭhikā	atha kho tesam bhikkhūnam etat ahosi etarahi kho vajjī dubbhikkhā dvīhitikā seta ṭṭhikā 
PA_bu-vb_pc8:1.1.4_1	salākāvuttā, na sukarā uñchena paggahena yāpetuṁ. Kena nu kho mayaṁ upāyena samaggā	salākā vuttā na sukarā uñchena paggahena yāpetu kena nu khalu mayam upāyena samaggā 
PA_bu-vb_pc8:1.1.4_2	sammodamānā avivadamānā phāsukaṁ vassaṁ vaseyyāma, na ca piṇḍakena kilameyyāmā”ti?	sammodamānāḥ a vivadamānā phāsukam vassam vaseyyāma na ca piṇḍakena kilameyyāma ati 
PA_bu-vb_pc8:1.1.5	Ekacce evamāhaṁsu—“handa mayaṁ, āvuso, gihīnaṁ kammantaṁ adhiṭṭhema. Evaṁ te amhākaṁ dātuṁ maññissanti.	ekacce evam āha suhanda mayaḥ āvuso gihīnam kammantam adhiṭṭhema evam te amhākam dātum maññissanti 
PA_bu-vb_pc8:1.1.6	Evaṁ mayaṁ samaggā sammodamānā avivadamānā phāsukaṁ vassaṁ vasissāma, na ca piṇḍakena kilamissāmā”ti.	evam mayam samaggā sammodamānā a vivadamānā phāsukam vassam vasissāma na ca piṇḍakena kilamissāma ati 
PA_bu-vb_pc8:1.1.7	Ekacce evamāhaṁsu—“alaṁ, āvuso, kiṁ gihīnaṁ kammantaṁ adhiṭṭhitena?	ekacce evam āha suale āvuso kim gihīnam kammantam adhiṭṭhitena 
PA_bu-vb_pc8:1.1.8	Handa mayaṁ, āvuso, gihīnaṁ dūteyyaṁ harāma. Evaṁ te amhākaṁ dātuṁ maññissanti.	handa mayaḥ āvusaḥ gihīnam dūteyyam harāmaḥ evam te amhākam dātum maññissanti 
PA_bu-vb_pc8:1.1.9	Evaṁ mayaṁ samaggā sammodamānā avivadamānā phāsukaṁ vassaṁ vasissāma, na ca piṇḍakena kilamissāmā”ti.	evam mayam samaggā sammodamānā a vivadamānā phāsukam vassam vasissāma na ca piṇḍakena kilamissāma ati 
PA_bu-vb_pc8:1.1.10	Ekacce evamāhaṁsu—“alaṁ, āvuso; kiṁ gihīnaṁ kammantaṁ adhiṭṭhitena. Kiṁ gihīnaṁ dūteyyaṁ haṭena.	ekacce evam āha suale āvuso kim gihīnam kammantam adhiṭṭhitena kim gihīnam dūteyyam haṭena 
PA_bu-vb_pc8:1.1.11	Handa mayaṁ, āvuso, gihīnaṁ aññamaññassa uttarimanussadhammassa vaṇṇaṁ bhāsissāma—	handa mayaḥ āvuso gihīnam aññamaññassa uttari manussa dhammassa vaṇṇam bhāsissāma 
PA_bu-vb_pc8:1.1.12_0	‘asuko bhikkhu paṭhamassa jhānassa lābhī, asuko bhikkhu dutiyassa jhānassa lābhī,	asukaḥ bhikkhu paṭhamassa jhānassa lābhī asukaḥ bhikkhu dutiyassa jhānassa lābhī 
PA_bu-vb_pc8:1.1.12_1	asuko bhikkhu tatiyassa jhānassa lābhī, asuko bhikkhu catutthassa jhānassa lābhī,	asukaḥ bhikkhu tatiyassa jhānassa lābhī asukaḥ bhikkhu catutthassa jhānassa lābhī 
PA_bu-vb_pc8:1.1.12_2	asuko bhikkhu sotāpanno, asuko bhikkhu sakadāgāmī, asuko bhikkhu anāgāmī, asuko bhikkhu	asukaḥ bhikkhu sotāpannaḥ asukaḥ bhikkhu sakadāgāmī asukaḥ bhikkhu anāgāmī asukaḥ bhikkhu 
PA_bu-vb_pc8:1.1.12_3	arahā, asuko bhikkhu tevijjo, asuko bhikkhu chaḷabhiñño’ti.	arahā asukaḥ bhikkhu tevijjaḥ asukaḥ bhikkhu chaḍabhiñño ti 
PA_bu-vb_pc8:1.1.13	Evaṁ te amhākaṁ dātuṁ maññissanti.	evam te amhākam dātum maññissanti 
PA_bu-vb_pc8:1.1.14	Evaṁ mayaṁ samaggā sammodamānā avivadamānā phāsukaṁ vassaṁ vasissāma, na ca piṇḍakena kilamissāmā”ti.	evam mayam samaggā sammodamānā a vivadamānā phāsukam vassam vasissāma na ca piṇḍakena kilamissāma ati 
PA_bu-vb_pc8:1.1.15	“Eso yeva kho, āvuso, seyyo, yo amhākaṁ gihīnaṁ aññamaññassa uttarimanussadhammassa vaṇṇo bhāsito”ti.	esaḥ yā iva kho āvuso seyyaḥ yaḥ amhākam gihīnam aññamaññassa uttari manussa dhammassa vaṇṇaḥ bhāsito ti 
PA_bu-vb_pc8:1.1.16	Atha kho te bhikkhū gihīnaṁ aññamaññassa uttarimanussadhammassa vaṇṇaṁ bhāsiṁsu—	atha kho te bhikkhū gihīnam aññamaññassa uttari manussa dhammassa vaṇṇam bhāsisu 
PA_bu-vb_pc8:1.1.17	“asuko bhikkhu paṭhamassa jhānassa lābhī …pe… asuko bhikkhu chaḷabhiñño”ti.	asukaḥ bhikkhu paṭhamassa jhānassa lābhī pe asukaḥ bhikkhu chaḷabhiñño ti 
PA_bu-vb_pc8:1.1.18_0	Atha kho te manussā—“lābhā vata no, suladdhaṁ vata no, yesaṁ no evarūpā bhikkhū vassaṁ	atha kho te manussa alābhāḥ vata no su laddham vata no yesam no evarūpāḥ bhikkhū 
PA_bu-vb_pc8:1.1.18_1	upagatā, na vata no ito pubbe evarūpā bhikkhū vassaṁ upagatā, yathayime bhikkhū sīlavanto kalyāṇadhammā”ti.	upagatāḥ na vata no itas pubbe evarūpāḥ bhikkhū vassam upagatāḥ yathā ime bhikkhū sīlavantaḥ kalyāṇa dhammā ti 
PA_bu-vb_pc8:1.1.19	Te na tādisāni bhojanāni attanā bhuñjanti, mātāpitūnaṁ denti puttadārassa denti dāsakammakaraporisassa denti mittāmaccānaṁ denti ñātisālohitānaṁ denti yādisāni bhikkhūnaṁ denti.	te na tādisāni bhojanāni attanā bhuñjanti mātā pitūnam denti putta dārassa denti dāsa kammakara porisassa denti mitta amaccānam denti ñāti sālohitānam denti yādisāni bhikkhūnam denti 
PA_bu-vb_pc8:1.1.20_0	Na tādisāni khādanīyāni sāyanīyāni pānāni attanā khādanti sāyanti pivanti mātāpitūnaṁ	na tādisāni khādanīyāni sāyanīyāni pānāni attanā khādanti sāyanti pivanti mātā pitūna 
PA_bu-vb_pc8:1.1.20_1	denti puttadārassa denti dāsakammakaraporisassa denti mittāmaccānaṁ denti ñātisālohitānaṁ	denti putta dārassa denti dāsa kammakara porisassa denti mitta amaccānam denti ñāti sālohitānam 
PA_bu-vb_pc8:1.1.20_2	denti, yādisāni bhikkhūnaṁ denti.	denti yādisāni bhikkhūnam denti 
PA_bu-vb_pc8:1.1.21	Atha kho te bhikkhū vaṇṇavā ahesuṁ pīṇindriyā pasannamukhavaṇṇā vippasannachavivaṇṇā.	atha kho te bhikkhū vaṇṇavā ahesum pīṇi indriyā pasanna mukha vaṇṇā vippasanna chavi vaṇṇā 
PA_bu-vb_pc8:1.2.1	Āciṇṇaṁ kho panetaṁ vassaṁvuṭṭhānaṁ bhikkhūnaṁ bhagavantaṁ dassanāya upasaṅkamituṁ.	āciṇṇam kho pana etam vassa vuṭṭhānam bhikkhūnam bhagavantam dassanāya upasaṅkamitu 
PA_bu-vb_pc8:1.2.2	Atha kho te bhikkhū vassaṁvuṭṭhā temāsaccayena senāsanaṁ saṁsāmetvā pattacīvaramādāya yena vesālī tena pakkamiṁsu.	atha kho te bhikkhū vassa vuṭṭhāḥ temāsa cayena senāsanam sasāmetvā patta cīvaram ādāya yena vesālī tena pakkamisu 
PA_bu-vb_pc8:1.2.3	Anupubbena yena vesālī mahāvanaṁ kūṭāgārasālā yena bhagavā tenupasaṅkamiṁsu;	anupubbena yena vesālī mahā vanam kūṭāgāra sālā yena bhagavā tena upasaṅkamisu 
PA_bu-vb_pc8:1.2.4	upasaṅkamitvā bhagavantaṁ abhivādetvā ekamantaṁ nisīdiṁsu.	upasaṅkamitvā bhagavantam abhivādetvā ekamantam 
PA_bu-vb_pc8:1.2.5	Tena kho pana samayena disāsu vassaṁvuṭṭhā bhikkhū kisā honti lūkhā dubbaṇṇā uppaṇḍuppaṇḍukajātā dhamanisanthatagattā.	tena kho pana samayena disāsu vassa vuṭṭhāḥ bhikkhū kisāḥ honti lūkhāḥ dubbaṇṇāḥ uppaṇḍu paṇḍuka jātāḥ dhamani santhata gattāḥ 
PA_bu-vb_pc8:1.2.6	Vaggumudātīriyā pana bhikkhū vaṇṇavā honti pīṇindriyā pasannamukhavaṇṇā vippasannachavivaṇṇā.	pana bhikkhū vaṇṇavā honti pīṇi indriyā pasanna mukha vaṇṇā vippasanna chavi vaṇṇā 
PA_bu-vb_pc8:1.2.7	Āciṇṇaṁ kho panetaṁ buddhānaṁ bhagavantānaṁ āgantukehi bhikkhūhi saddhiṁ paṭisammodituṁ.	āciṇṇam kho pana etam buddhānam bhagavantānam āgantukehi bhikkhūhi saddhim paṭisammoditu 
PA_bu-vb_pc8:1.2.8	Atha kho bhagavā vaggumudātīriye bhikkhū etadavoca—	atha kho bhagavā vaggumudātīriye bhikkhū etat avoca 
PA_bu-vb_pc8:1.2.9	“kacci, bhikkhave, khamanīyaṁ, kacci yāpanīyaṁ,	kacci bhikkhave khamanīya kacci yāpanīya 
PA_bu-vb_pc8:1.2.10	kacci samaggā sammodamānā avivadamānā phāsukaṁ vassaṁ vasittha, na ca piṇḍakena kilamitthā”ti?	kacci samaggā sammodamānā a vivadamānā phāsukam vassam vasittha na ca piṇḍakena kilamittha ati 
PA_bu-vb_pc8:1.2.11	“Khamanīyaṁ, bhagavā, yāpanīyaṁ, bhagavā.	khamanīya bhagavā yāpanīya bhagavā 
PA_bu-vb_pc8:1.2.12	Samaggā ca mayaṁ, bhante, sammodamānā avivadamānā phāsukaṁ vassaṁ vasimhā, na ca piṇḍakena kilamimhā”ti.	samaggā ca maya bhante sammodamānā a vivadamānā phāsukam vassam vasimha na ca piṇḍakena kilamimha ati 
PA_bu-vb_pc8:1.2.13	Jānantāpi tathāgatā pucchanti, jānantāpi na pucchanti.	jānantā api tathāgatā pucchanti jānantā api na pucchanti 
PA_bu-vb_pc8:1.2.14	Kālaṁ viditvā pucchanti, kālaṁ viditvā na pucchanti.	kālam viditvā pucchanti kālam viditvā na pucchanti 
PA_bu-vb_pc8:1.2.15	Atthasañhitaṁ tathāgatā pucchanti, no anatthasañhitaṁ.	attha sañhitam tathāgatāḥ pucchanti no anattha sañhita 
PA_bu-vb_pc8:1.2.16	Anatthasañhite setughāto tathāgatānaṁ.	anattha sañhite setu ghāto tathāgatāna 
PA_bu-vb_pc8:1.2.17	Dvīhākārehi buddhā bhagavanto bhikkhū paṭipucchanti—“dhammaṁ vā desessāma, sāvakānaṁ vā sikkhāpadaṁ paññapessāmā”ti.	dvīhākārehi buddhāḥ bhagavantaḥ bhikkhū paṭipucchanti dhammam vā desessāma sāvakānam vā sikkhāpadam paññapessāma ati 
PA_bu-vb_pc8:1.2.18	Atha kho bhagavā vaggumudātīriye bhikkhū etadavoca—“yathā kathaṁ pana tumhe, bhikkhave, samaggā sammodamānā avivadamānā phāsukaṁ vassaṁ vasittha, na ca piṇḍakena kilamitthā”ti?	atha kho bhagavā vaggumudātīriye bhikkhū etat avoca yathā katham pana tumhe bhikkhave samaggāḥ sammodamānāḥ a vivadamānāḥ phāsukam vassam vasittha na ca piṇḍakena kilamittha ati 
PA_bu-vb_pc8:1.2.19	Atha kho te bhikkhū bhagavato etamatthaṁ ārocesuṁ.	atha kho te bhikkhū bhagavataḥ etam attham ārocesu 
PA_bu-vb_pc8:1.2.20	“Kacci pana vo, bhikkhave, bhūtan”ti?	kacci pana vaḥ bhikkhave bhūtanti 
PA_bu-vb_pc8:1.2.21	“Bhūtaṁ, bhagavā”ti.	bhūta bhagavā ati 
PA_bu-vb_pc8:1.2.22	Vigarahi buddho bhagavā …pe…	vigarahi buddhaḥ bhagavān pe 
PA_bu-vb_pc8:1.2.23	kathañhi nāma tumhe, bhikkhave, udarassa kāraṇā gihīnaṁ aññamaññassa uttarimanussadhammassa vaṇṇaṁ bhāsissatha.	katham hi nāma tumhe bhikkhave udarassa kāraṇā gihīnam aññamaññassa uttari manussa dhammassa vaṇṇam bhāsissatha 
PA_bu-vb_pc8:1.2.24	Netaṁ, bhikkhave, appasannānaṁ vā pasādāya …pe…	na ita bhikkhave appasannānam vā pasādāya pe 
PA_bu-vb_pc8:1.2.25	evañca pana, bhikkhave, imaṁ sikkhāpadaṁ uddiseyyātha—	evam ca pana bhikkhave imam sikkhāpadam uddiseyyātha 
PA_bu-vb_pc8:1.2.26.1	“Yo pana bhikkhu anupasampannassa uttarimanussadhammaṁ āroceyya bhūtasmiṁ, pācittiyan”ti.	yaḥ pana bhikkhu an upasampannassa uttari manussa dhammaṃ āroceyya bhūtasmi pācittiyan ti 
PA_bu-vb_pc8:2.1.1	Yo panāti	yaḥ panāti 
PA_bu-vb_pc8:2.1.2	yo yādiso …pe…	yaḥ ya ādisaḥ pe 
PA_bu-vb_pc8:2.1.3	bhikkhūti	bhikkhū ti 
PA_bu-vb_pc8:2.1.4	…pe… ayaṁ imasmiṁ atthe adhippeto bhikkhūti.	pe ayam imasmin atthe adhippetaḥ bhikkhu iti 
PA_bu-vb_pc8:2.1.5	Anupasampanno nāma	anupasampannaḥ nāma 
PA_bu-vb_pc8:2.1.6	bhikkhuñca bhikkhuniñca ṭhapetvā, avaseso anupasampanno nāma.	bhikkhuñca bhikkhuniñca ṭhapetvā avasesaḥ anupasampannaḥ nāma 
PA_bu-vb_pc8:2.1.7	Uttarimanussadhammo nāma	uttarimanussadhammaḥ nāma 
PA_bu-vb_pc8:2.1.8	jhānaṁ, vimokkho, samādhi, samāpatti, ñāṇadassanaṁ, maggabhāvanā, phalasacchikiriyā, kilesappahānaṁ, vinīvaraṇatā cittassa, suññāgāre abhirati.	samādhi samāpatti ñāṇa dassana magga bhāvanā phala sacchikiriyā kilesa ppahāna vinīvaraṇa tā cittassa suññāgāre abhirati 
PA_bu-vb_pc8:2.1.9.1	Jhānanti	jhānanti 
PA_bu-vb_pc8:2.1.10	paṭhamaṁ jhānaṁ, dutiyaṁ jhānaṁ, tatiyaṁ jhānaṁ, catutthaṁ jhānaṁ.	paṭhamam jhāna dutiyam jhāna tatiyam jhāna catuttham jhāna 
PA_bu-vb_pc8:2.1.11	Vimokkhoti	vimokkhaḥ ti 
PA_bu-vb_pc8:2.1.12	suññato vimokkho, animitto vimokkho, appaṇihito vimokkho.	suññataḥ vimokkhaḥ animittaḥ vimokkhaḥ appaṇihitaḥ vimokkhaḥ 
PA_bu-vb_pc8:2.1.13	Samādhīti	samādhi iti 
PA_bu-vb_pc8:2.1.14	suññato samādhi, animitto samādhi, appaṇihito samādhi.	suññataḥ samādhi animitto samādhi appaṇihitaḥ samādhi 
PA_bu-vb_pc8:2.1.15	Samāpattīti	samāpatti iti 
PA_bu-vb_pc8:2.1.16	suññatā samāpatti, animittā samāpatti, appaṇihitā samāpatti.	suñña tā samāpatti animittā samāpatti appaṇihitā samāpatti 
PA_bu-vb_pc8:2.1.17	Ñāṇadassananti	ñāṇa dassana nti 
PA_bu-vb_pc8:2.1.18	tisso vijjā.	tissaḥ vijjā 
PA_bu-vb_pc8:2.1.19	Maggabhāvanāti	magga bhāvanā ti 
PA_bu-vb_pc8:2.1.20	cattāro satipaṭṭhānā, cattāro sammappadhānā, cattāro iddhipādā, pañcindriyāni, pañca balāni, satta bojjhaṅgā, ariyo aṭṭhaṅgiko maggo.	cattāro satipaṭṭhānā cattāro sammappadhānā cattāro iddhipādā pañca indriyāni pañca balāni satta bojjhaṅgāḥ ariyaḥ aṭṭhaṅgikaḥ maggo 
PA_bu-vb_pc8:2.1.21	Phalasacchikiriyāti	phala sacchikiriyā ati 
PA_bu-vb_pc8:2.1.22	sotāpattiphalassa sacchikiriyā, sakadāgāmiphalassa sacchikiriyā, anāgāmiphalassa sacchikiriyā, arahattassa sacchikiriyā.	sotāpatti phalassa sacchikiriyā sakadāgāmi phalassa sacchikiriyā anāgāmi phalassa sacchikiriyā arahattassa sacchikiriyā 
PA_bu-vb_pc8:2.1.23	Kilesappahānanti	kilesa pahānanti 
PA_bu-vb_pc8:2.1.24	rāgassa pahānaṁ, dosassa pahānaṁ, mohassa pahānaṁ.	rāgassa pahāna dosassa pahāna mohassa pahāna 
PA_bu-vb_pc8:2.1.25	Vinīvaraṇatā cittassāti	vinīvaraṇa tā cittassa ati 
PA_bu-vb_pc8:2.1.26	rāgā cittaṁ vinīvaraṇatā, dosā cittaṁ vinīvaraṇatā, mohā cittaṁ vinīvaraṇatā.	cittam vinīvaraṇa tā dosā cittam vinīvaraṇa tā mohā cittam vinīvaraṇa tā 
PA_bu-vb_pc8:2.1.27	Suññāgāre abhiratīti	suñña āgāre abhirati iti 
PA_bu-vb_pc8:2.1.28	paṭhamena jhānena suññāgāre abhirati, dutiyena jhānena suññāgāre abhirati, tatiyena jhānena suññāgāre abhirati, catutthena jhānena suññāgāre abhirati.	paṭhamena jhānena suññāgāre abhirati dutiyena jhānena suññāgāre abhirati tatiyena jhānena suññāgāre abhirati catutthena jhānena suññāgāre abhirati 
PA_bu-vb_pc8:2.2.1	Āroceyyāti	āroceyya iti 
PA_bu-vb_pc8:2.2.2	anupasampannassa—“paṭhamaṁ jhānaṁ samāpajjin”ti bhaṇantassa āpatti pācittiyassa.	an upasampannassa paṭhamam jhānam samāpajjinti bhaṇantassa āpatti pācittiyassa 
PA_bu-vb_pc8:2.2.3	Āroceyyāti	āroceyya iti 
PA_bu-vb_pc8:2.2.4	anupasampannassa—“paṭhamaṁ jhānaṁ samāpajjāmī”ti bhaṇantassa āpatti pācittiyassa.	an upasampannassa paṭhamam jhānam samāpajjāmi iti bhaṇantassa āpatti pācittiyassa 
PA_bu-vb_pc8:2.2.5	Āroceyyāti	āroceyya iti 
PA_bu-vb_pc8:2.2.6	anupasampannassa—“paṭhamaṁ jhānaṁ samāpanno”ti bhaṇantassa āpatti pācittiyassa.	an upasampannassa paṭhamam jhānam samāpannaḥ ti bhaṇantassa āpatti pācittiyassa 
PA_bu-vb_pc8:2.2.7	Āroceyyāti	āroceyya iti 
PA_bu-vb_pc8:2.2.8	anupasampannassa—“paṭhamassa jhānassa lābhimhī”ti bhaṇantassa āpatti pācittiyassa.	an upasampannassa paṭhamassa jhānassa lābhimhi iti bhaṇantassa āpatti pācittiyassa 
PA_bu-vb_pc8:2.2.9	Āroceyyāti	āroceyya iti 
PA_bu-vb_pc8:2.2.10	anupasampannassa—“paṭhamassa jhānassa vasimhī”ti bhaṇantassa āpatti pācittiyassa.	an upasampannassa paṭhamassa jhānassa vasimhi iti bhaṇantassa āpatti pācittiyassa 
PA_bu-vb_pc8:2.2.11	Āroceyyāti	āroceyya iti 
PA_bu-vb_pc8:2.2.12	anupasampannassa—“paṭhamaṁ jhānaṁ sacchikataṁ mayā”ti bhaṇantassa āpatti pācittiyassa.	an upasampannassa paṭhamam jhānam sacchikatam mayā ati bhaṇantassa āpatti pācittiyassa 
PA_bu-vb_pc8:2.2.13.1	Āroceyyāti	āroceyya iti 
PA_bu-vb_pc8:2.2.14	anupasampannassa— “dutiyaṁ jhānaṁ …pe…	anupasampannassa dutiyam jhānam pe 
PA_bu-vb_pc8:2.2.15	tatiyaṁ jhānaṁ …	tatiyam jhānam 
PA_bu-vb_pc8:2.2.16	catutthaṁ jhānaṁ samāpajjiṁ, samāpajjāmi, samāpanno; catutthassa jhānassa lābhimhi, vasimhi; catutthaṁ jhānaṁ sacchikataṁ mayā”ti bhaṇantassa āpatti pācittiyassa.	catuttham jhānam samāpajji samāpajjāmi samāpannaḥ catutthassa jhānassa lābhimhi vasimhi catuttham jhānam sacchikatam mayā ati bhaṇantassa āpatti pācittiyassa 
PA_bu-vb_pc8:2.2.17	Āroceyyāti	āroceyya iti 
PA_bu-vb_pc8:2.2.18	anupasampannassa— “suññataṁ vimokkhaṁ …pe…	an upasampannassa suññatam vimokkham pe 
PA_bu-vb_pc8:2.2.19	animittaṁ vimokkhaṁ …	animittam vimokkham 
PA_bu-vb_pc8:2.2.20	appaṇihitaṁ vimokkhaṁ …	appaṇihitam vimokkham 
PA_bu-vb_pc8:2.2.21	suññataṁ samādhiṁ …	suññatam samādhim 
PA_bu-vb_pc8:2.2.22	animittaṁ samādhiṁ …	animittam samādhim 
PA_bu-vb_pc8:2.2.23	appaṇihitaṁ samādhiṁ samāpajjiṁ, samāpajjāmi, samāpanno; appaṇihitassa samādhissa lābhimhi, vasimhi; appaṇihito samādhi sacchikato mayā”ti bhaṇantassa āpatti pācittiyassa.	appaṇihitam samādhim samāpajji samāpajjāmi samāpannaḥ appaṇihitassa samādhissa lābhimhi vasimhi appaṇihitaḥ samādhi sacchikataḥ mayā ati bhaṇantassa āpatti pācittiyassa 
PA_bu-vb_pc8:2.2.24	Āroceyyāti	āroceyya iti 
PA_bu-vb_pc8:2.2.25	anupasampannassa— “suññataṁ samāpattiṁ …pe…	an upasampannassa suññatam samāpattim pe 
PA_bu-vb_pc8:2.2.26	animittaṁ samāpattiṁ …	animittam samāpattim 
PA_bu-vb_pc8:2.2.27	appaṇihitaṁ samāpattiṁ samāpajjiṁ, samāpajjāmi, samāpanno; appaṇihitāya samāpattiyā lābhimhi, vasimhi; appaṇihitā samāpatti sacchikatā mayā”ti bhaṇantassa āpatti pācittiyassa.	appaṇihitam samāpattim samāpajji samāpajjāmi samāpannaḥ appaṇihitāya samāpattiyāḥ lābhimhi vasimhi appaṇihitā samāpatti sacchikatā mayā ati bhaṇantassa āpatti pācittiyassa 
PA_bu-vb_pc8:2.2.28	Āroceyyāti	āroceyya iti 
PA_bu-vb_pc8:2.2.29	anupasampannassa— “tisso vijjā samāpajjiṁ, samāpajjāmi, samāpanno; tissannaṁ vijjānaṁ lābhimhi, vasimhi; tisso vijjā sacchikatā mayā”ti bhaṇantassa āpatti pācittiyassa.	an upasampannassa tissaḥ vijjā samāpajji samāpajjāmi samāpannaḥ tissannam vijjānam lābhimhi vasimhi tissaḥ vijjā sacchikatā mayā ati bhaṇantassa āpatti pācittiyassa 
PA_bu-vb_pc8:2.2.30	Āroceyyāti	āroceyya iti 
PA_bu-vb_pc8:2.2.31	anupasampannassa— “cattāro satipaṭṭhāne …pe…	anupasampannassa cattāro satipaṭṭhāne pe 
PA_bu-vb_pc8:2.2.32	cattāro sammappadhāne …	cattāro sammappadhāne 
PA_bu-vb_pc8:2.2.33	cattāro iddhipāde samāpajjiṁ, samāpajjāmi, samāpanno; catunnaṁ iddhipādānaṁ lābhimhi, vasimhi; cattāro iddhipādā sacchikatā mayā”ti bhaṇantassa āpatti pācittiyassa.	cattāraḥ iddhipāde samāpajji samāpajjāmi samāpannaḥ catunnam iddhipādānam lābhimhi vasimhi cattāro iddhipādā sacchikatāḥ mayā iti bhaṇantassa āpatti pācittiyassa 
PA_bu-vb_pc8:2.2.34	Āroceyyāti	āroceyya iti 
PA_bu-vb_pc8:2.2.35	anupasampannassa— “pañcindriyāni …pe…	anupasampannassa pañca indriyāni pe 
PA_bu-vb_pc8:2.2.36	pañca balāni samāpajjiṁ, samāpajjāmi, samāpanno; pañcannaṁ balānaṁ lābhimhi, vasimhi; pañca balāni sacchikatāni mayā”ti bhaṇantassa āpatti pācittiyassa.	pañca balāni samāpajji samāpajjāmi samāpannaḥ pañcannam balānam lābhimhi vasimhi pañca balāni sacchikatāni mayā ati bhaṇantassa āpatti pācittiyassa 
PA_bu-vb_pc8:2.2.37	Āroceyyāti	āroceyya iti 
PA_bu-vb_pc8:2.2.38	anupasampannassa— “satta bojjhaṅge samāpajjiṁ, samāpajjāmi, samāpanno; sattannaṁ bojjhaṅgānaṁ lābhimhi, vasimhi; satta bojjhaṅgā sacchikatā mayā”ti bhaṇantassa āpatti pācittiyassa.	anupasampannassa satta bojjhaṅge samāpajji samāpajjāmi samāpannaḥ sattannam bojjhaṅgānam lābhimhi vasimhi satta bojjhaṅgā sacchikatā mayā ati bhaṇantassa āpatti pācittiyassa 
PA_bu-vb_pc8:2.2.39	Āroceyyāti	āroceyya iti 
PA_bu-vb_pc8:2.2.40_0	anupasampannassa— “ariyaṁ aṭṭhaṅgikaṁ maggaṁ samāpajjiṁ, samāpajjāmi, samāpanno;	an upasampannassa ariyam aṭṭhaṅgikam maggam samāpajji samāpajjāmi samāpannaḥ 
PA_bu-vb_pc8:2.2.40_1	ariyassa aṭṭhaṅgikassa maggassa lābhimhi, vasimhi; ariyo aṭṭhaṅgiko maggo sacchikato	ariyassa aṭṭhaṅgikassa maggassa lābhimhi vasimhi ariyaḥ aṭṭhaṅgikaḥ maggo sacchikataḥ 
PA_bu-vb_pc8:2.2.40_2	mayā”ti bhaṇantassa āpatti pācittiyassa.	mayā ati bhaṇantassa āpatti pācittiyassa 
PA_bu-vb_pc8:2.2.41	Āroceyyāti	āroceyya iti 
PA_bu-vb_pc8:2.2.42	anupasampannassa— “sotāpattiphalaṁ …pe…	an upasampannassa sotāpatti phalam pe 
PA_bu-vb_pc8:2.2.43	sakadāgāmiphalaṁ …	sakadāgāmi phalam 
PA_bu-vb_pc8:2.2.44	anāgāmiphalaṁ …	anāgāmi phalam 
PA_bu-vb_pc8:2.2.45	arahattaṁ samāpajjiṁ, samāpajjāmi, samāpanno; arahattassa lābhimhi, vasimhi; arahattaṁ sacchikataṁ mayā”ti bhaṇantassa āpatti pācittiyassa.	arahattam samāpajji samāpajjāmi samāpannaḥ arahattassa lābhimhi vasimhi arahattam sacchikatam mayā ati bhaṇantassa āpatti pācittiyassa 
PA_bu-vb_pc8:2.2.46	Āroceyyāti	āroceyya iti 
PA_bu-vb_pc8:2.2.47	anupasampannassa— “rāgo me catto …pe…	an upasampannassa rāgaḥ me catto pe 
PA_bu-vb_pc8:2.2.48	doso me catto …	dosaḥ me cattaḥ 
PA_bu-vb_pc8:2.2.49	moho me catto, vanto, mutto, pahīno, paṭinissaṭṭho, ukkheṭito, samukkheṭito”ti bhaṇantassa āpatti pācittiyassa.	mohaḥ me cattaḥ vantaḥ muttaḥ pahīnaḥ paṭinissaṭṭhaḥ ukkheṭitaḥ samukkheṭitaḥ ti bhaṇantassa āpatti pācittiyassa 
PA_bu-vb_pc8:2.2.50	Āroceyyāti	āroceyya iti 
PA_bu-vb_pc8:2.2.51	anupasampannassa— “rāgā me cittaṁ vinīvaraṇaṁ …pe…	an upasampannassa rāgāḥ me cittam vinīvaraṇam pe 
PA_bu-vb_pc8:2.2.52	dosā me cittaṁ vinīvaraṇaṁ …	dosāḥ me cittam vinīvaraṇam 
PA_bu-vb_pc8:2.2.53	mohā me cittaṁ vinīvaraṇan”ti bhaṇantassa āpatti pācittiyassa.	mohā me cittam bhaṇantassa āpatti pācittiyassa 
PA_bu-vb_pc8:2.2.54	Āroceyyāti	āroceyya iti 
PA_bu-vb_pc8:2.2.55	anupasampannassa— “suññāgāre paṭhamaṁ jhānaṁ …pe…	an upasampannassa suññāgāre paṭhamam jhānam pe 
PA_bu-vb_pc8:2.2.56	dutiyaṁ jhānaṁ …	dutiyam jhānam 
PA_bu-vb_pc8:2.2.57	tatiyaṁ jhānaṁ …	tatiyam jhānam 
PA_bu-vb_pc8:2.2.58_0	catutthaṁ jhānaṁ samāpajjiṁ, samāpajjāmi, samāpanno; suññāgāre catutthassa jhānassa	catuttham jhānam samāpajji samāpajjāmi samāpanno suññāgāre catutthassa jhānassa 
PA_bu-vb_pc8:2.2.58_1	lābhimhi, vasimhi; suññāgāre catutthaṁ jhānaṁ sacchikataṁ mayā”ti bhaṇantassa āpatti pācittiyassa.	lābhimhi vasimhi suññāgāre catuttham jhānam sacchikatam mayā ati bhaṇantassa āpatti pācittiyassa 
PA_bu-vb_pc8:2.3.1	Āroceyyāti	āroceyya iti 
PA_bu-vb_pc8:2.3.2_0	anupasampannassa— “paṭhamañca jhānaṁ dutiyañca jhānaṁ samāpajjiṁ, samāpajjāmi, samāpanno;	anupasampannassa paṭhamam ca jhānam dutiyañca jhānam samāpajji samāpajjāmi samāpannaḥ 
PA_bu-vb_pc8:2.3.2_1	paṭhamassa ca jhānassa dutiyassa ca jhānassa lābhimhi, vasimhi; paṭhamañca jhānaṁ	paṭhamassa ca jhānassa dutiyassa ca jhānassa lābhimhi vasimhi paṭhamañca jhāna 
PA_bu-vb_pc8:2.3.2_2	dutiyañca jhānaṁ sacchikataṁ mayā”ti bhaṇantassa āpatti pācittiyassa.	dutiyam ca jhānam sacchikatam mayā ati bhaṇantassa āpatti pācittiyassa 
PA_bu-vb_pc8:2.3.3	Āroceyyāti	āroceyya iti 
PA_bu-vb_pc8:2.3.4	anupasampannassa— “paṭhamañca jhānaṁ tatiyañca jhānaṁ …pe…	anupasampannassa paṭhamam ca jhānam tatiyam ca jhānam pe 
PA_bu-vb_pc8:2.3.5_0	paṭhamañca jhānaṁ catutthañca jhānaṁ samāpajjiṁ, samāpajjāmi, samāpanno; paṭhamassa	paṭhamam ca jhānam catutthañca jhānam samāpajji samāpajjāmi samāpannaḥ paṭhamassa 
PA_bu-vb_pc8:2.3.5_1	ca jhānassa catutthassa ca jhānassa lābhimhi, vasimhi; paṭhamañca jhānaṁ catutthañca	ca jhānassa catutthassa ca jhānassa lābhimhi vasimhi paṭhamam ca jhānam catuttham ca 
PA_bu-vb_pc8:2.3.5_2	jhānaṁ sacchikataṁ mayā”ti bhaṇantassa āpatti pācittiyassa.	jhānam sacchikatam mayā iti bhaṇantassa āpatti pācittiyassa 
PA_bu-vb_pc8:2.3.6	Āroceyyāti	āroceyya iti 
PA_bu-vb_pc8:2.3.7	anupasampannassa— “paṭhamañca jhānaṁ suññatañca vimokkhaṁ …pe…	an upasampannassa paṭhamam ca jhānam suññatam ca vimokkham pe 
PA_bu-vb_pc8:2.3.8	animittañca vimokkhaṁ …	animittam ca vimokkham 
PA_bu-vb_pc8:2.3.9	appaṇihitañca vimokkhaṁ …	appaṇihitam ca vimokkham 
PA_bu-vb_pc8:2.3.10	suññatañca samādhiṁ …	suññatañca samādhim 
