segmentnr	original	analyzed
PA_bi-vb_pc61:0.1	Theravāda Vinaya	thera vāda vinaya 
PA_bi-vb_pc61:0.2	Bhikkhunivibhaṅga	bhikkhuni vibhaṅga 
PA_bi-vb_pc61:0.3	Pācittiyakaṇḍa	pācittiyakaṇḍa 
PA_bi-vb_pc61:0.4	Gabbhinivagga	gabbhi nivagga 
PA_bi-vb_pc61:0.5	61. Gabbhinisikkhāpada	gabbhi nisikkhā pada 
PA_bi-vb_pc61:1.1	Tena samayena buddho bhagavā sāvatthiyaṁ viharati jetavane anāthapiṇḍikassa ārāme.	tena samayena buddhaḥ bhagavā sāvatthiyam viharati jetavane anāthapiṇḍikassa ārāme 
PA_bi-vb_pc61:1.2	Tena kho pana samayena bhikkhuniyo gabbhiniṁ vuṭṭhāpenti.	tena kho pana samayena bhikkhuniyaḥ gabbhinim vuṭṭhāpenti 
PA_bi-vb_pc61:1.3	Sā piṇḍāya carati.	sā piṇḍāya carati 
PA_bi-vb_pc61:1.4	Manussā evamāhaṁsu—	manussāḥ evam āhasu 
PA_bi-vb_pc61:1.5	“dethāyyāya bhikkhaṁ, garubhārā ayyā”ti.	detha ayyāya bhikkha garu bhārā ayyā ati 
PA_bi-vb_pc61:1.6	Manussā ujjhāyanti khiyyanti vipācenti—	manussāḥ ujjhāyanti khiyyanti vipācenti 
PA_bi-vb_pc61:1.7	“kathañhi nāma bhikkhuniyo gabbhiniṁ vuṭṭhāpessantī”ti.	katham hi nāma bhikkhuniyaḥ gabbhinim vuṭṭhāpessanti iti 
PA_bi-vb_pc61:1.8	Assosuṁ kho bhikkhuniyo tesaṁ manussānaṁ ujjhāyantānaṁ khiyyantānaṁ vipācentānaṁ.	assosum kho bhikkhuniyaḥ tesam manussānam ujjhāyantānam khiyyantānam vipācentāna 
PA_bi-vb_pc61:1.9	Yā tā bhikkhuniyo appicchā …pe… tā ujjhāyanti khiyyanti vipācenti—	yāḥ tāḥ bhikkhuniyaḥ appicchāḥ pe tāḥ ujjhāyanti khiyyanti vipācenti 
PA_bi-vb_pc61:1.10	“kathañhi nāma bhikkhuniyo gabbhiniṁ vuṭṭhāpessantī”ti …pe…	katham hi nāma bhikkhuniyaḥ gabbhinim vuṭṭhāpessanti iti pe 
PA_bi-vb_pc61:1.11	“saccaṁ kira, bhikkhave, bhikkhuniyo gabbhiniṁ vuṭṭhāpentī”ti?	saccam kira bhikkhave bhikkhuniyaḥ gabbhinim vuṭṭhāpenti iti 
PA_bi-vb_pc61:1.12	“Saccaṁ, bhagavā”ti.	sat ca bhagavān ati 
PA_bi-vb_pc61:1.13	Vigarahi buddho bhagavā …pe…	vigarahi buddhaḥ bhagavān pe 
PA_bi-vb_pc61:1.14	kathañhi nāma, bhikkhave, bhikkhuniyo gabbhiniṁ vuṭṭhāpessanti.	katham hi nāma bhikkhave bhikkhuniyaḥ gabbhinim vuṭṭhāpessanti 
PA_bi-vb_pc61:1.15	Netaṁ, bhikkhave, appasannānaṁ vā pasādāya …pe…	na ita bhikkhave appasannānam vā pasādāya pe 
PA_bi-vb_pc61:1.16	evañca pana, bhikkhave, bhikkhuniyo imaṁ sikkhāpadaṁ uddisantu—	evam ca pana bhikkhave bhikkhuniyaḥ imam sikkhāpadam uddisantu 
PA_bi-vb_pc61:1.17.1	“Yā pana bhikkhunī gabbhiniṁ vuṭṭhāpeyya, pācittiyan”ti.	yā pana bhikkhunī gabbhinim vuṭṭhāpeyya pācittiyan ti 
PA_bi-vb_pc61:2.1.1	Yā panāti	yā panāti 
PA_bi-vb_pc61:2.1.2	yā yādisā …pe…	yā yā disā pe 
PA_bi-vb_pc61:2.1.3	bhikkhunīti	bhikkhunī iti 
PA_bi-vb_pc61:2.1.4	…pe… ayaṁ imasmiṁ atthe adhippetā bhikkhunīti.	pe ayam imasmin atthe adhippetā bhikkhunī iti 
PA_bi-vb_pc61:2.1.5	Gabbhinī nāma	gabbhinī nāma 
PA_bi-vb_pc61:2.1.6	āpannasattā vuccati.	āpannasattā vuccati 
PA_bi-vb_pc61:2.1.7	Vuṭṭhāpeyyāti	vuṭṭhāpeyya ati 
PA_bi-vb_pc61:2.1.8	upasampādeyya.	upasampādeyya 
PA_bi-vb_pc61:2.1.9	“Vuṭṭhāpessāmī”ti gaṇaṁ vā ācariniṁ vā pattaṁ vā cīvaraṁ vā pariyesati, sīmaṁ vā sammannati, āpatti dukkaṭassa.	vuṭṭhāpessāmi iti gaṇam vā ācarinim vā pattam vā cīvaram vā pariyesati sīmam vā sammannati āpatti dukkaṭassa 
PA_bi-vb_pc61:2.1.10	Ñattiyā dukkaṭaṁ.	ñattiyā dukkaṭa 
PA_bi-vb_pc61:2.1.11	Dvīhi kammavācāhi dukkaṭā.	dvīhi kamma vācāhi dukkaṭā 
PA_bi-vb_pc61:2.1.12	Kammavācāpariyosāne upajjhāyāya āpatti pācittiyassa.	kamma vācā pariyosāne upajjhāyāya āpatti pācittiyassa 
PA_bi-vb_pc61:2.1.13	Gaṇassa ca ācariniyā ca āpatti dukkaṭassa.	gaṇassa ca ācariniyā ca āpatti dukkaṭassa 
PA_bi-vb_pc61:2.2.1	Gabbhiniyā gabbhinisaññā vuṭṭhāpeti, āpatti pācittiyassa.	gabbhiniyā gabbhini saññā vuṭṭhāpeti āpatti pācittiyassa 
PA_bi-vb_pc61:2.2.2	Gabbhiniyā vematikā vuṭṭhāpeti, āpatti dukkaṭassa.	gabbhiniyā vematikā vuṭṭhāpeti āpatti dukkaṭassa 
PA_bi-vb_pc61:2.2.3	Gabbhiniyā agabbhinisaññā vuṭṭhāpeti, anāpatti.	gabbhiniyā a gabbhini saññā vuṭṭhāpeti anāpatti 
PA_bi-vb_pc61:2.2.4	Agabbhiniyā gabbhinisaññā, āpatti dukkaṭassa.	a gabbhiniyāḥ gabbhini saññā āpatti dukkaṭassa 
PA_bi-vb_pc61:2.2.5	Agabbhiniyā vematikā, āpatti dukkaṭassa.	a gabbhiniyā vematikā āpatti dukkaṭassa 
PA_bi-vb_pc61:2.2.6	Agabbhiniyā agabbhinisaññā, anāpatti.	a gabbhiniyāḥ a gabbhini saññā anāpatti 
PA_bi-vb_pc61:2.3.1	Anāpatti—	anāpatti 
PA_bi-vb_pc61:2.3.2	gabbhiniṁ agabbhinisaññā vuṭṭhāpeti,	gabbhinim a gabbhini saññā vuṭṭhāpeti 
PA_bi-vb_pc61:2.3.3	agabbhiniṁ agabbhinisaññā vuṭṭhāpeti,	agabbhinim agabbhini saññā vuṭṭhāpeti 
PA_bi-vb_pc61:2.3.4	ummattikāya,	ummattikāya 
PA_bi-vb_pc61:2.3.5	ādikammikāyāti.	ādikammikāya ati 
PA_bi-vb_pc61:2.3.6	Paṭhamasikkhāpadaṁ niṭṭhitaṁ.	paṭhama sikkhāpadam niṭṭhita 
