segmentnr	original	analyzed
PA_bu-vb_ss6:1.6.5	evañca pana, bhikkhave, imaṁ sikkhāpadaṁ uddiseyyātha—	evam ca pana bhikkhave imam sikkhāpadam uddiseyyātha 
PA_bu-vb_ss6:1.6.6.1	“Saññācikāya pana bhikkhunā kuṭiṁ kārayamānena assāmikaṁ attuddesaṁ pamāṇikā kāretabbā. Tatridaṁ pamāṇaṁ—dīghaso dvādasa vidatthiyo, sugatavidatthiyā; tiriyaṁ sattantarā.	saññācikāya pana bhikkhunā kuṭim kārayamānena a ssāmikam attuddesam pamāṇikā kāretabbā dvādasa vidatthiyaḥ sugata vidatthiyā tiriyam satta antarā 
PA_bu-vb_ss6:1.6.7	Bhikkhū abhinetabbā vatthudesanāya. Tehi bhikkhūhi vatthu desetabbaṁ— anārambhaṁ saparikkamanaṁ.	bhikkhū abhinetabbāḥ vatthu desanāya tehi bhikkhūhi vatthu desetabba anārambham sa parikkamana 
PA_bu-vb_ss6:1.6.8	Sārambhe ce bhikkhu vatthusmiṁ aparikkamane saññācikāya kuṭiṁ kāreyya, bhikkhū vā anabhineyya vatthudesanāya, pamāṇaṁ vā atikkāmeyya, saṅghādiseso”ti.	sa ārambhe ce bhikkhu vatthusmim a parikkamane saññācikāya kuṭim kāreyya bhikkhū vā an abhineyya vatthu desanāya pamāṇam vā atikkāmeyya saṅgha ādiseso ti 
PA_bu-vb_ss6:2.1.1	Saññācikā nāma	saññācikā nāma 
PA_bu-vb_ss6:2.1.2	sayaṁ yācitvā purisampi purisatthakarampi goṇampi sakaṭampi vāsimpi parasumpi kuṭhārimpi kudālampi nikhādanampi vallimpi veḷumpi muñjampi pabbajampi tiṇampi mattikampi.	sayam yācitvā purisampi purisatthakarampi goṇampi sakaṭampi vāsimpi parasumpi kuṭhārimpi kudālampi nikhādanampi vallimpi veḷumpi muñjampi pabbajampi tiṇampi mattikampi 
PA_bu-vb_ss6:2.1.3	Kuṭi nāma	kuṭi nāma 
PA_bu-vb_ss6:2.1.4	ullittā vā hoti avalittā vā ullittāvalittā vā.	ullittā vā hoti avalittā vā ullitta avalittā vā 
PA_bu-vb_ss6:2.1.5	Kārayamānenāti	kārayamānena ati 
PA_bu-vb_ss6:2.1.6	karonto vā kārāpento vā.	karontaḥ vā kārāpentaḥ vā 
PA_bu-vb_ss6:2.1.7	Assāmikanti	assāmikam ti 
PA_bu-vb_ss6:2.1.8	na añño koci sāmiko hoti, itthī vā puriso vā gahaṭṭho vā pabbajito vā.	na aññaḥ koci sāmikaḥ hoti itthī vā purisaḥ vā gahaṭṭhaḥ vā pabbajitaḥ vā 
PA_bu-vb_ss6:2.1.9	Attuddesanti	attuddesanti 
PA_bu-vb_ss6:2.1.10	attano atthāya.	attanaḥ atthāya 
PA_bu-vb_ss6:2.1.11	Pamāṇikā kāretabbā.	pamāṇikā kāretabbā 
PA_bu-vb_ss6:2.1.12	Tatridaṁ pamāṇaṁ—dīghaso dvādasa vidatthiyo, sugatavidatthiyāti	dvādasa 
PA_bu-vb_ss6:2.1.13	bāhirimena mānena.	bāhis imena mānena 
PA_bu-vb_ss6:2.1.14	Tiriyaṁ sattantarāti	tiriyam 
PA_bu-vb_ss6:2.1.15	abbhantarimena mānena.	ap bhantar imena mānena 
PA_bu-vb_ss6:2.2.1	Bhikkhū abhinetabbā vatthudesanāyāti	bhikkhū abhinetabbāḥ vatthu desanāya ati 
PA_bu-vb_ss6:2.2.2_0	tena kuṭikārakena bhikkhunā kuṭivatthuṁ sodhetvā saṅghaṁ upasaṅkamitvā ekaṁsaṁ uttarāsaṅgaṁ	tena kuṭikārakena bhikkhunā kuṭi vatthum sodhetvā saṅgham upasaṅkamitvā ekasam uttarāsaṅga 
PA_bu-vb_ss6:2.2.2_1	karitvā vuḍḍhānaṁ bhikkhūnaṁ pāde vanditvā ukkuṭikaṁ nisīditvā añjaliṁ paggahetvā evamassa vacanīyo—	karitvā vuḍḍhānam bhikkhūnam pāde vanditvā ukkuṭikam nisīditvā añjalim paggahetvā evam assa vacanīyaḥ 
PA_bu-vb_ss6:2.2.3	“ahaṁ, bhante, saññācikāya kuṭiṁ kattukāmo assāmikaṁ attuddesaṁ.	aha bhante saññācikāya kuṭim kattu kāmaḥ a sāmikam 
PA_bu-vb_ss6:2.2.4	Sohaṁ, bhante, saṅghaṁ kuṭivatthuolokanaṁ yācāmī”ti.	sā uha bhante saṅgham kuṭi vatthu olokanam yācāmi iti 
PA_bu-vb_ss6:2.2.5	Dutiyampi yācitabbā.	dutiyam pi yācitabbā 
PA_bu-vb_ss6:2.2.6	Tatiyampi yācitabbā.	tatiyam pi yācitabbā 
PA_bu-vb_ss6:2.2.7	Sace sabbo saṅgho ussahati kuṭivatthuṁ oloketuṁ, sabbena saṅghena oloketabbaṁ.	sace sabbaḥ saṅghaḥ ussahati kuṭi vatthum oloketu sabbena saṅghena oloketabba 
PA_bu-vb_ss6:2.2.8	No ce sabbo saṅgho ussahati kuṭivatthuṁ oloketuṁ, ye tattha honti bhikkhū byattā paṭibalā sārambhaṁ anārambhaṁ saparikkamanaṁ aparikkamanaṁ jānituṁ te yācitvā sammannitabbā.	no ce sabbaḥ saṅghaḥ ussahati kuṭi vatthum oloketu ye tattha honti bhikkhū byattā paṭibalā sa ārambham anārambham sa parikkamanam a parikkamanam jānitum te yācitvā sammannitabbā 
PA_bu-vb_ss6:2.2.9	“Evañca pana, bhikkhave, sammannitabbā.	evam ca pana bhikkhave sammannitabbā 
PA_bu-vb_ss6:2.2.10	Byattena bhikkhunā paṭibalena saṅgho ñāpetabbo—	byattena bhikkhunā paṭibalena saṅghaḥ ñāpetabbaḥ 
PA_bu-vb_ss6:2.2.11	‘Suṇātu me, bhante, saṅgho.	suṇātu me bhante saṅghaḥ 
PA_bu-vb_ss6:2.2.12	Ayaṁ itthannāmo bhikkhu saññācikāya kuṭiṁ kattukāmo assāmikaṁ attuddesaṁ.	ayam itthannāmaḥ bhikkhu saññācikāya kuṭim kattu kāmaḥ a sāmikam 
PA_bu-vb_ss6:2.2.13	So saṅghaṁ kuṭivatthuolokanaṁ yācati.	saḥ saṅgham kuṭi vatthu olokanam yācati 
PA_bu-vb_ss6:2.2.14	Yadi saṅghassa pattakallaṁ, saṅgho itthannāmañca itthannāmañca bhikkhū sammanneyya itthannāmassa bhikkhuno kuṭivatthuṁ oloketuṁ.	yadi saṅghassa pattakalla saṅghaḥ itthannāmañca itthannāmañca bhikkhū sammanneyya itthannāmassa bhikkhuno kuṭi vatthum oloketu 
PA_bu-vb_ss6:2.2.15	Esā ñatti.	esā ñatti 
PA_bu-vb_ss6:2.2.16	Suṇātu me, bhante, saṅgho.	suṇātu me bhante saṅghaḥ 
PA_bu-vb_ss6:2.2.17	Ayaṁ itthannāmo bhikkhu saññācikāya kuṭiṁ kattukāmo assāmikaṁ attuddesaṁ.	ayam itthannāmaḥ bhikkhu saññācikāya kuṭim kattu kāmaḥ a sāmikam 
PA_bu-vb_ss6:2.2.18	So saṅghaṁ kuṭivatthuolokanaṁ yācati.	saḥ saṅgham kuṭi vatthu olokanam yācati 
PA_bu-vb_ss6:2.2.19	Saṅgho itthannāmañca itthannāmañca bhikkhū sammannati itthannāmassa bhikkhuno kuṭivatthuṁ oloketuṁ.	saṅghaḥ itthannāmañca itthannāmañca bhikkhū sammannati itthannāmassa bhikkhuno kuṭi vatthum oloketu 
PA_bu-vb_ss6:2.2.20	Yassāyasmato khamati itthannāmassa ca itthannāmassa ca bhikkhūnaṁ sammuti itthannāmassa bhikkhuno kuṭivatthuṁ oloketuṁ, so tuṇhassa;	yassa ayasmataḥ khamati itthannāmassa ca itthannāmassa ca bhikkhūnam sammuti itthannāmassa bhikkhuno kuṭi vatthum oloketu saḥ tuṇhassa 
PA_bu-vb_ss6:2.2.21	yassa nakkhamati, so bhāseyya.	yassa na khamati saḥ bhāseyya 
PA_bu-vb_ss6:2.2.22	Sammatā saṅghena itthannāmo ca itthannāmo ca bhikkhū itthannāmassa bhikkhuno kuṭivatthuṁ oloketuṁ.	sammatā saṅghena itthannāmaḥ ca itthannāmaḥ ca bhikkhū itthannāmassa bhikkhuno kuṭi vatthuṃ oloketu 
PA_bu-vb_ss6:2.2.23	Khamati saṅghassa, tasmā tuṇhī,	khamati saṅghassa tasmā tuṇhī 
PA_bu-vb_ss6:2.2.24	evametaṁ dhārayāmī’”ti.	evam etam dhārayāmi iti 
PA_bu-vb_ss6:2.2.25	Tehi sammatehi bhikkhūhi tattha gantvā kuṭivatthu oloketabbaṁ, sārambhaṁ anārambhaṁ saparikkamanaṁ aparikkamanaṁ jānitabbaṁ.	tehi sammatehi bhikkhūhi tattha gantvā kuṭi vatthu sa ārambham anārambham sa parikkamanam aparikkamanam jānitabba 
PA_bu-vb_ss6:2.2.26	Sace sārambhaṁ hoti aparikkamanaṁ, “mā idha karī”ti vattabbo.	sace sa ārambham hoti aparikkamana mā idha kari iti vattabbo 
PA_bu-vb_ss6:2.2.27	Sace anārambhaṁ hoti saparikkamanaṁ, saṅghassa ārocetabbaṁ—	sace anārambham hoti sa parikkamana saṅghassa ārocetabba 
PA_bu-vb_ss6:2.2.28	“anārambhaṁ saparikkamanan”ti.	an ārambham sa parikkamananti 
PA_bu-vb_ss6:2.2.29	Tena kuṭikārakena bhikkhunā saṅghaṁ upasaṅkamitvā ekaṁsaṁ uttarāsaṅgaṁ karitvā vuḍḍhānaṁ bhikkhūnaṁ pāde vanditvā ukkuṭikaṁ nisīditvā añjaliṁ paggahetvā evamassa vacanīyo—	tena kuṭikārakena bhikkhunā saṅgham upasaṅkamitvā ekasam uttarāsaṅgam karitvā vuḍḍhānam bhikkhūnam pāde vanditvā ukkuṭikam nisīditvā añjalim paggahetvā evam assa vacanīyaḥ 
PA_bu-vb_ss6:2.2.30	“ahaṁ, bhante, saññācikāya kuṭiṁ kattukāmo assāmikaṁ attuddesaṁ.	aha bhante saññācikāya kuṭim kattu kāmaḥ a sāmikam 
PA_bu-vb_ss6:2.2.31	Sohaṁ, bhante, saṅghaṁ kuṭivatthudesanaṁ yācāmī”ti.	sā uha bhante saṅgham kuṭi vatthu desanam yācāmi iti 
PA_bu-vb_ss6:2.2.32	Dutiyampi yācitabbā.	dutiyam pi yācitabbā 
PA_bu-vb_ss6:2.2.33	Tatiyampi yācitabbā.	tatiyam pi yācitabbā 
PA_bu-vb_ss6:2.2.34	“Byattena bhikkhunā paṭibalena saṅgho ñāpetabbo—	byattena bhikkhunā paṭibalena saṅghaḥ ñāpetabbaḥ 
PA_bu-vb_ss6:2.2.35	‘Suṇātu me, bhante, saṅgho.	suṇātu me bhante saṅghaḥ 
PA_bu-vb_ss6:2.2.36	Ayaṁ itthannāmo bhikkhu saññācikāya kuṭiṁ kattukāmo assāmikaṁ attuddesaṁ.	ayam itthannāmaḥ bhikkhu saññācikāya kuṭim kattu kāmaḥ a sāmikam 
PA_bu-vb_ss6:2.2.37	So saṅghaṁ kuṭivatthudesanaṁ yācati.	saḥ saṅgham kuṭivatthu desanam yācati 
PA_bu-vb_ss6:2.2.38	Yadi saṅghassa pattakallaṁ, saṅgho itthannāmassa bhikkhuno kuṭivatthuṁ deseyya.	yadi saṅghassa pattakalla saṅghaḥ itthannāmassa bhikkhuno kuṭi vatthum deseyya 
PA_bu-vb_ss6:2.2.39	Esā ñatti.	esā ñatti 
PA_bu-vb_ss6:2.2.40	Suṇātu me, bhante, saṅgho.	suṇātu me bhante saṅghaḥ 
PA_bu-vb_ss6:2.2.41	Ayaṁ itthannāmo bhikkhu saññācikāya kuṭiṁ kattukāmo assāmikaṁ attuddesaṁ.	ayam itthannāmaḥ bhikkhu saññācikāya kuṭim kattu kāmaḥ a sāmikam 
PA_bu-vb_ss6:2.2.42	So saṅghaṁ kuṭivatthudesanaṁ yācati.	saḥ saṅgham kuṭivatthu desanam yācati 
PA_bu-vb_ss6:2.2.43	Saṅgho itthannāmassa bhikkhuno kuṭivatthuṁ deseti.	saṅghaḥ itthannāmassa bhikkhuno kuṭi vatthum deseti 
PA_bu-vb_ss6:2.2.44	Yassāyasmato khamati itthannāmassa bhikkhuno kuṭivatthussa desanā, so tuṇhassa;	yassa ayasmataḥ khamati itthannāmassa bhikkhuno kuṭi vatthussa desanā saḥ tuṇhassa 
PA_bu-vb_ss6:2.2.45	yassa nakkhamati, so bhāseyya.	yassa na khamati saḥ bhāseyya 
PA_bu-vb_ss6:2.2.46	Desitaṁ saṅghena itthannāmassa bhikkhuno kuṭivatthu.	desitam saṅghena itthannāmassa bhikkhuno kuṭi vatthu 
PA_bu-vb_ss6:2.2.47	Khamati saṅghassa, tasmā tuṇhī,	khamati saṅghassa tasmā tuṇhī 
PA_bu-vb_ss6:2.2.48	evametaṁ dhārayāmī’”ti.	evam etam dhārayāmi iti 
PA_bu-vb_ss6:2.3.1	Sārambhaṁ nāma	sārambham nāma 
PA_bu-vb_ss6:2.3.2_0	kipillikānaṁ vā āsayo hoti, upacikānaṁ vā āsayo hoti, undūrānaṁ vā āsayo hoti, ahīnaṁ	kipillikānam vai āsayaḥ hoti upacikānam vai āsayaḥ hoti undūrānam vai āsayaḥ hoti 
PA_bu-vb_ss6:2.3.2_1	vā āsayo hoti, vicchikānaṁ vā āsayo hoti, satapadīnaṁ vā āsayo hoti, hatthīnaṁ vā	vai āsayaḥ hoti vicchikānam vai āsayaḥ hoti satapadīnam vai āsayaḥ hoti hatthīnam vā 
PA_bu-vb_ss6:2.3.2_2	āsayo hoti, assānaṁ vā āsayo hoti, sīhānaṁ vā āsayo hoti, byagghānaṁ vā āsayo hoti,	āsayaḥ hoti assānam vai āsayaḥ hoti sīhānam vai āsayaḥ hoti byagghānam vai āsayaḥ hoti 
PA_bu-vb_ss6:2.3.2_3	dīpīnaṁ vā āsayo hoti, acchānaṁ vā āsayo hoti, taracchānaṁ vā āsayo hoti, yesaṁ kesañci	dīpīnam vai āsayaḥ hoti acchānam vai āsayaḥ hoti taracchānam vai āsayaḥ hoti 
PA_bu-vb_ss6:2.3.2_4	tiracchānagatānaṁ pāṇānaṁ āsayo hoti,	tiracchāna gatānam pāṇānam āsayaḥ hoti 
PA_bu-vb_ss6:2.3.3_0	pubbaṇṇanissitaṁ vā hoti, aparaṇṇanissitaṁ vā hoti, abbhāghātanissitaṁ vā hoti, āghātananissitaṁ	pubbaṇṇa nissitam vā hoti aparaṇṇa nissitam vā hoti abbhāghāta nissitam vā hoti āghātana nissita 
PA_bu-vb_ss6:2.3.3_1	vā hoti, susānanissitaṁ vā hoti, uyyānanissitaṁ vā hoti, rājavatthunissitaṁ vā hoti,	vā hoti susāna nissitam vā hoti uyyāna nissitam vā hoti rājavatthu nissitam vā hoti 
PA_bu-vb_ss6:2.3.3_2	hatthisālānissitaṁ vā hoti, assasālānissitaṁ vā hoti, bandhanāgāranissitaṁ vā hoti,	hatthi sālā nissitam vā hoti assa sālā nissitam vā hoti bandhanāgāra nissitam vā hoti 
PA_bu-vb_ss6:2.3.3_3	pānāgāranissitaṁ vā hoti, sūnanissitaṁ vā hoti, racchānissitaṁ vā hoti, caccaranissitaṁ	pānāgāra nissitam vā hoti sūna nissitam vā hoti racchā nissitam vā hoti caccara nissita 
PA_bu-vb_ss6:2.3.3_4	vā hoti, sabhānissitaṁ vā hoti, saṁsaraṇanissitaṁ vā hoti.	vā hoti sabhā nissitam vā hoti sa saraṇa nissitam vā hoti 
PA_bu-vb_ss6:2.3.4	Etaṁ sārambhaṁ nāma.	etam sārambham nāma 
PA_bu-vb_ss6:2.3.5	Aparikkamanaṁ nāma	a parikkamanam nāma 
PA_bu-vb_ss6:2.3.6	na sakkā hoti yathāyuttena sakaṭena anuparigantuṁ samantā nisseṇiyā anuparigantuṁ. Etaṁ aparikkamanaṁ nāma.	na sakkā hoti yathā yuttena sakaṭena anuparigantum samantā nisseṇiyā anuparigantu etam aparikkamanam nāma 
PA_bu-vb_ss6:2.3.7	Anārambhaṁ nāma	anārambham nāma 
PA_bu-vb_ss6:2.3.8_0	na kipillikānaṁ vā āsayo hoti, na upacikānaṁ vā āsayo hoti, na undūrānaṁ vā āsayo	na kipillikānam vai āsayaḥ hoti na upacikānam vai āsayaḥ hoti na undūrānam vai āsayaḥ 
PA_bu-vb_ss6:2.3.8_1	hoti, na ahīnaṁ vā āsayo hoti, na vicchikānaṁ vā āsayo hoti, na satapadīnaṁ vā āsayo	hoti na ahīnam vai āsayaḥ hoti na vicchikānam vai āsayaḥ hoti na satapadīnam vai āsayaḥ 
PA_bu-vb_ss6:2.3.8_2	hoti …pe… na saṁsaraṇanissitaṁ vā hoti. Etaṁ anārambhaṁ nāma.	hoti pe na sa saraṇa nissitam vā hoti etam anārambham nāma 
PA_bu-vb_ss6:2.3.9	Saparikkamanaṁ nāma	sa parikkamanam nāma 
PA_bu-vb_ss6:2.3.10	sakkā hoti yathāyuttena sakaṭena anuparigantuṁ, samantā nisseṇiyā anuparigantuṁ. Etaṁ saparikkamanaṁ nāma.	sakkā hoti yathā yuttena sakaṭena anuparigantu samantā nisseṇiyā anuparigantu etam sa parikkamanam nāma 
PA_bu-vb_ss6:2.4.1	Saññācikā nāma	saññācikā nāma 
PA_bu-vb_ss6:2.4.2	sayaṁ yācitvā purisampi purisatthakarampi …pe… mattikampi.	sayam yācitvā purisampi purisatthakarampi pe mattikampi 
PA_bu-vb_ss6:2.4.3	Kuṭi nāma	kuṭi nāma 
PA_bu-vb_ss6:2.4.4	ullittā vā hoti avalittā vā ullittāvalittā vā.	ullittā vā hoti avalittā vā ullitta avalittā vā 
PA_bu-vb_ss6:2.4.5	Kāreyyāti	kāreyyā iti 
PA_bu-vb_ss6:2.4.6	karoti vā kārāpeti vā.	karoti vā kārāpeti vā 
PA_bu-vb_ss6:2.4.7	Bhikkhū vā anabhineyya, vatthudesanāya pamāṇaṁ vā atikkāmeyyāti	bhikkhū vā an abhineyya vatthu desanāya pamāṇam vā atikkāmeyya ati 
PA_bu-vb_ss6:2.4.8	ñattidutiyena kammena kuṭivatthuṁ na desāpetvā, āyāmato vā vitthārato vā antamaso kesaggamattampi atikkāmetvā karoti vā kārāpeti vā, payoge dukkaṭaṁ.	ñatti dutiyena kammena kuṭi vatthum na desāpetvā āyāmataḥ vā vitthārataḥ vā antamaso kesagga mattam pi atikkāmetvā karoti vā kārāpeti vā payoge dukkaṭa 
PA_bu-vb_ss6:2.4.9	Ekaṁ piṇḍaṁ anāgate āpatti thullaccayassa.	ekam piṇḍam anāgate āpatti thullaccayassa 
PA_bu-vb_ss6:2.4.10	Tasmiṁ piṇḍe āgate āpatti saṅghādisesassa.	tasmin piṇḍe āgate āpatti saṅgha ādisesassa 
PA_bu-vb_ss6:2.4.11	Saṅghādisesoti	saṅgha ādi sesaḥ iti 
PA_bu-vb_ss6:2.4.12	…pe… tenapi vuccati “saṅghādiseso”ti.	pe tena api vuccati saṅgha ādiseso ti 
PA_bu-vb_ss6:3.1.1	Bhikkhu kuṭiṁ karoti adesitavatthukaṁ sārambhaṁ aparikkamanaṁ, āpatti saṅghādisesena dvinnaṁ dukkaṭānaṁ.	bhikkhu kuṭim karoti a desita vatthukam sa ārambham a parikkamane āpatti saṅgha ādisesena dvinnam dukkaṭāna 
PA_bu-vb_ss6:3.1.2	Bhikkhu kuṭiṁ karoti adesitavatthukaṁ sārambhaṁ saparikkamanaṁ, āpatti saṅghādisesena dukkaṭassa.	bhikkhu kuṭim karoti a desita vatthukam sa ārambham sa parikkamane āpatti saṅgha ādisesena dukkaṭassa 
PA_bu-vb_ss6:3.1.3	Bhikkhu kuṭiṁ karoti adesitavatthukaṁ anārambhaṁ aparikkamanaṁ, āpatti saṅghādisesena dukkaṭassa.	bhikkhu kuṭim karoti a desita vatthukam anārambham a parikkamane āpatti saṅgha ādisesena dukkaṭassa 
PA_bu-vb_ss6:3.1.4	Bhikkhu kuṭiṁ karoti adesitavatthukaṁ anārambhaṁ saparikkamanaṁ, āpatti saṅghādisesassa.	bhikkhu kuṭim karoti a desita vatthukam anārambham sa parikkamane āpatti saṅgha ādisesassa 
PA_bu-vb_ss6:3.1.5	Bhikkhu kuṭiṁ karoti desitavatthukaṁ sārambhaṁ aparikkamanaṁ, āpatti dvinnaṁ dukkaṭānaṁ.	bhikkhu kuṭim karoti desita vatthukam sa ārambham a parikkamane āpatti dvinnam 
PA_bu-vb_ss6:3.1.6	Bhikkhu kuṭiṁ karoti desitavatthukaṁ sārambhaṁ saparikkamanaṁ, āpatti dukkaṭassa.	bhikkhu kuṭim karoti desita vatthukam sa ārambham sa parikkamane āpatti dukkaṭassa 
PA_bu-vb_ss6:3.1.7	Bhikkhu kuṭiṁ karoti desitavatthukaṁ anārambhaṁ aparikkamanaṁ, āpatti dukkaṭassa.	bhikkhu kuṭim karoti desita vatthukam anārambham a parikkamane āpatti dukkaṭassa 
PA_bu-vb_ss6:3.1.8	Bhikkhu kuṭiṁ karoti desitavatthukaṁ anārambhaṁ saparikkamanaṁ, anāpatti.	bhikkhu kuṭim karoti desita vatthukam anārambham sa parikkamana anāpatti 
PA_bu-vb_ss6:3.2.1	Bhikkhu kuṭiṁ karoti pamāṇātikkantaṁ sārambhaṁ aparikkamanaṁ, āpatti saṅghādisesena dvinnaṁ dukkaṭānaṁ.	bhikkhu kuṭim karoti pamāṇa atikkantam sa ārambham a parikkamane āpatti saṅgha ādisesena dvinnam dukkaṭāna 
PA_bu-vb_ss6:3.2.2	Bhikkhu kuṭiṁ karoti pamāṇātikkantaṁ sārambhaṁ saparikkamanaṁ, āpatti saṅghādisesena dukkaṭassa.	bhikkhu kuṭim karoti pamāṇa atikkantam sa ārambham sa parikkamane āpatti saṅgha ādisesena dukkaṭassa 
PA_bu-vb_ss6:3.2.3	Bhikkhu kuṭiṁ karoti pamāṇātikkantaṁ anārambhaṁ aparikkamanaṁ, āpatti saṅghādisesena dukkaṭassa.	bhikkhu kuṭim karoti pamāṇa atikkantam anārambham a parikkamane āpatti saṅgha ādisesena dukkaṭassa 
PA_bu-vb_ss6:3.2.4	Bhikkhu kuṭiṁ karoti pamāṇātikkantaṁ anārambhaṁ saparikkamanaṁ, āpatti saṅghādisesassa.	bhikkhu kuṭim karoti pamāṇa atikkantam anārambham sa parikkamane āpatti saṅgha ādisesassa 
PA_bu-vb_ss6:3.2.5	Bhikkhu kuṭiṁ karoti pamāṇikaṁ sārambhaṁ aparikkamanaṁ, āpatti dvinnaṁ dukkaṭānaṁ.	bhikkhu kuṭim karoti pamāṇikam sa ārambham a parikkamane āpatti dvinnam 
PA_bu-vb_ss6:3.2.6	Bhikkhu kuṭiṁ karoti pamāṇikaṁ sārambhaṁ saparikkamanaṁ, āpatti dukkaṭassa.	bhikkhu kuṭim karoti pamāṇikam sa ārambham sa parikkamane āpatti dukkaṭassa 
PA_bu-vb_ss6:3.2.7	Bhikkhu kuṭiṁ karoti pamāṇikaṁ anārambhaṁ aparikkamanaṁ, āpatti dukkaṭassa.	bhikkhu kuṭim karoti pamāṇikam anārambham a parikkamane āpatti dukkaṭassa 
PA_bu-vb_ss6:3.2.8	Bhikkhu kuṭiṁ karoti pamāṇikaṁ anārambhaṁ saparikkamanaṁ, anāpatti.	bhikkhu kuṭim karoti pamāṇikam anārambham sa parikkamana anāpatti 
PA_bu-vb_ss6:3.3.1	Bhikkhu kuṭiṁ karoti adesitavatthukaṁ pamāṇātikkantaṁ sārambhaṁ aparikkamanaṁ, āpatti dvinnaṁ saṅghādisesena dvinnaṁ dukkaṭānaṁ.	bhikkhu kuṭim karoti a desita vatthukam pamāṇa atikkantam sa ārambham a parikkamane āpatti dvinnam saṅgha ādisesena dvinnam dukkaṭāna 
PA_bu-vb_ss6:3.3.2	Bhikkhu kuṭiṁ karoti adesitavatthukaṁ pamāṇātikkantaṁ sārambhaṁ saparikkamanaṁ, āpatti dvinnaṁ saṅghādisesena dukkaṭassa.	bhikkhu kuṭim karoti a desita vatthukam pamāṇa atikkantam sa ārambham sa parikkamane āpatti dvinnam saṅgha ādisesena dukkaṭassa 
PA_bu-vb_ss6:3.3.3	Bhikkhu kuṭiṁ karoti adesitavatthukaṁ pamāṇātikkantaṁ anārambhaṁ aparikkamanaṁ, āpatti dvinnaṁ saṅghādisesena dukkaṭassa.	bhikkhu kuṭim karoti a desita vatthukam pamāṇa atikkantam anārambham a parikkamane āpatti dvinnam saṅgha ādisesena dukkaṭassa 
PA_bu-vb_ss6:3.3.4	Bhikkhu kuṭiṁ karoti adesitavatthukaṁ pamāṇātikkantaṁ anārambhaṁ saparikkamanaṁ, āpatti dvinnaṁ saṅghādisesānaṁ.	bhikkhu kuṭim karoti a desita vatthukam pamāṇa atikkantam anārambham sa parikkamane āpatti dvinnam saṅgha adisesāna 
PA_bu-vb_ss6:3.4.1	Bhikkhu kuṭiṁ karoti desitavatthukaṁ pamāṇikaṁ sārambhaṁ aparikkamanaṁ, āpatti dvinnaṁ dukkaṭānaṁ.	bhikkhu kuṭim karoti desita vatthukam pamāṇikam sa ārambham a parikkamane āpatti dvinnam dukkaṭāna 
PA_bu-vb_ss6:3.4.2	Bhikkhu kuṭiṁ karoti desitavatthukaṁ pamāṇikaṁ sārambhaṁ saparikkamanaṁ, āpatti dukkaṭassa.	bhikkhu kuṭim karoti desita vatthukam pamāṇikam sa ārambham sa parikkamane āpatti dukkaṭassa 
PA_bu-vb_ss6:3.4.3	Bhikkhu kuṭiṁ karoti desitavatthukaṁ pamāṇikaṁ anārambhaṁ aparikkamanaṁ, āpatti dukkaṭassa.	bhikkhu kuṭim karoti desita vatthukam pamāṇikam anārambham a parikkamane āpatti dukkaṭassa 
PA_bu-vb_ss6:3.4.4	Bhikkhu kuṭiṁ karoti desitavatthukaṁ pamāṇikaṁ anārambhaṁ saparikkamanaṁ, anāpatti.	bhikkhu kuṭim karoti desita vatthukam pamāṇikam anārambham sa parikkamana anāpatti 
PA_bu-vb_ss6:3.5.1	Bhikkhu samādisati—	bhikkhu samādisati 
PA_bu-vb_ss6:3.5.2	“kuṭiṁ me karothā”ti.	kuṭim me karotha ati 
PA_bu-vb_ss6:3.5.3	Tassa kuṭiṁ karonti adesitavatthukaṁ sārambhaṁ aparikkamanaṁ, āpatti saṅghādisesena dvinnaṁ dukkaṭānaṁ …pe…	tassa kuṭim karonti a desita vatthukam sa ārambham a parikkamane āpatti saṅgha ādisesena dvinnam dukkaṭānam pe 
PA_bu-vb_ss6:3.5.4	sārambhaṁ saparikkamanaṁ, āpatti saṅghādisesena dukkaṭassa …pe…	sa ārambham sa parikkamane āpatti saṅgha ādisesena dukkaṭassa pe 
PA_bu-vb_ss6:3.5.5	anārambhaṁ aparikkamanaṁ, āpatti saṅghādisesena dukkaṭassa …pe…	anārambham a parikkamane āpatti saṅgha ādisesena dukkaṭassa pe 
PA_bu-vb_ss6:3.5.6	anārambhaṁ saparikkamanaṁ, āpatti saṅghādisesassa.	an ārambham sa parikkamane āpatti saṅgha ādisesassa 
PA_bu-vb_ss6:3.5.7	Bhikkhu samādisati—	bhikkhu samādisati 
PA_bu-vb_ss6:3.5.8	“kuṭiṁ me karothā”ti.	kuṭim me karotha ati 
PA_bu-vb_ss6:3.5.9	Tassa kuṭiṁ karonti desitavatthukaṁ sārambhaṁ aparikkamanaṁ, āpatti dvinnaṁ dukkaṭānaṁ …pe…	tassa kuṭim karonti desita vatthukam sa ārambham a parikkamane āpatti dvinnam dukkaṭānam pe 
PA_bu-vb_ss6:3.5.10	sārambhaṁ saparikkamanaṁ, āpatti dukkaṭassa …pe…	sa ārambham sa parikkamane āpatti dukkaṭassa pe 
PA_bu-vb_ss6:3.5.11	anārambhaṁ aparikkamanaṁ, āpatti dukkaṭassa …pe…	anārambham a parikkamane āpatti dukkaṭassa pe 
PA_bu-vb_ss6:3.5.12	anārambhaṁ saparikkamanaṁ, anāpatti.	anārambham sa parikkamana anāpatti 
PA_bu-vb_ss6:3.5.13	Bhikkhu samādisati—	bhikkhu samādisati 
PA_bu-vb_ss6:3.5.14	“kuṭiṁ me karothā”ti.	kuṭim me karotha ati 
PA_bu-vb_ss6:3.5.15	Tassa kuṭiṁ karonti pamāṇātikkantaṁ sārambhaṁ aparikkamanaṁ, āpatti saṅghādisesena dvinnaṁ dukkaṭānaṁ …pe…	tassa kuṭim karonti pamāṇa atikkantam sa ārambham a parikkamane āpatti saṅgha ādisesena dvinnam dukkaṭānam pe 
PA_bu-vb_ss6:3.5.16	sārambhaṁ saparikkamanaṁ, āpatti saṅghādisesena dukkaṭassa …pe…	sa ārambham sa parikkamane āpatti saṅgha ādisesena dukkaṭassa pe 
PA_bu-vb_ss6:3.5.17	anārambhaṁ aparikkamanaṁ, āpatti saṅghādisesena dukkaṭassa …pe…	anārambham a parikkamane āpatti saṅgha ādisesena dukkaṭassa pe 
PA_bu-vb_ss6:3.5.18	anārambhaṁ saparikkamanaṁ, āpatti saṅghādisesassa.	an ārambham sa parikkamane āpatti saṅgha ādisesassa 
PA_bu-vb_ss6:3.5.19	Bhikkhu samādisati—	bhikkhu samādisati 
PA_bu-vb_ss6:3.5.20	“kuṭiṁ me karothā”ti.	kuṭim me karotha ati 
PA_bu-vb_ss6:3.5.21	Tassa kuṭiṁ karonti pamāṇikaṁ sārambhaṁ aparikkamanaṁ, āpatti dvinnaṁ dukkaṭānaṁ …pe…	tassa kuṭim karonti pamāṇikam sa ārambham a parikkamane āpatti dvinnam dukkaṭānam pe 
PA_bu-vb_ss6:3.5.22	sārambhaṁ saparikkamanaṁ, āpatti dukkaṭassa …pe…	sa ārambham sa parikkamane āpatti dukkaṭassa pe 
PA_bu-vb_ss6:3.5.23	anārambhaṁ aparikkamanaṁ, āpatti dukkaṭassa …pe…	anārambham a parikkamane āpatti dukkaṭassa pe 
PA_bu-vb_ss6:3.5.24	anārambhaṁ saparikkamanaṁ, anāpatti.	anārambham sa parikkamana anāpatti 
PA_bu-vb_ss6:3.5.25	Bhikkhu samādisati—	bhikkhu samādisati 
PA_bu-vb_ss6:3.5.26	“kuṭiṁ me karothā”ti.	kuṭim me karotha ati 
PA_bu-vb_ss6:3.5.27	Tassa kuṭiṁ karonti adesitavatthukaṁ pamāṇātikkantaṁ sārambhaṁ aparikkamanaṁ, āpatti dvinnaṁ saṅghādisesena dvinnaṁ dukkaṭānaṁ …pe…	tassa kuṭim karonti a desita vatthukam pamāṇa atikkantam sa ārambham a parikkamane āpatti dvinnam saṅgha ādisesena dvinnam dukkaṭānam pe 
PA_bu-vb_ss6:3.5.28	sārambhaṁ saparikkamanaṁ, āpatti dvinnaṁ saṅghādisesena dukkaṭassa …pe…	sa ārambham sa parikkamane āpatti dvinnam saṅgha ādisesena dukkaṭassa pe 
PA_bu-vb_ss6:3.5.29	anārambhaṁ aparikkamanaṁ, āpatti dvinnaṁ saṅghādisesena dukkaṭassa …pe…	anārambham a parikkamane āpatti dvinnam saṅgha ādisesena dukkaṭassa pe 
PA_bu-vb_ss6:3.5.30	anārambhaṁ saparikkamanaṁ, āpatti dvinnaṁ saṅghādisesānaṁ.	an ārambham sa parikkamane āpatti dvinnam 
PA_bu-vb_ss6:3.5.31	Bhikkhu samādisati—	bhikkhu samādisati 
PA_bu-vb_ss6:3.5.32	“kuṭiṁ me karothā”ti.	kuṭim me karotha ati 
PA_bu-vb_ss6:3.5.33	Tassa kuṭiṁ karonti desitavatthukaṁ pamāṇikaṁ sārambhaṁ aparikkamanaṁ, āpatti dvinnaṁ dukkaṭānaṁ …pe…	tassa kuṭim karonti desita vatthukam pamāṇikam sa ārambham a parikkamane āpatti dvinnam dukkaṭānam pe 
PA_bu-vb_ss6:3.5.34	sārambhaṁ saparikkamanaṁ, āpatti dukkaṭassa …pe…	sa ārambham sa parikkamane āpatti dukkaṭassa pe 
PA_bu-vb_ss6:3.5.35	anārambhaṁ aparikkamanaṁ, āpatti dukkaṭassa …pe…	anārambham a parikkamane āpatti dukkaṭassa pe 
PA_bu-vb_ss6:3.5.36	anārambhaṁ saparikkamanaṁ, anāpatti.	anārambham sa parikkamana anāpatti 
