segmentnr	original	analyzed
PA_bi-vb_pc30:0.1	Theravāda Vinaya	thera vāda vinaya 
PA_bi-vb_pc30:0.2	Bhikkhunivibhaṅga	bhikkhuni vibhaṅga 
PA_bi-vb_pc30:0.3	Pācittiyakaṇḍa	pācittiyakaṇḍa 
PA_bi-vb_pc30:0.4	Naggavagga	nagga vagga 
PA_bi-vb_pc30:0.5	30. Kathinuddhārasikkhāpada	    
PA_bi-vb_pc30:1.1.1	Tena samayena buddho bhagavā sāvatthiyaṁ viharati jetavane anāthapiṇḍikassa ārāme.	tena samayena buddhaḥ bhagavā sāvatthiyam viharati jetavane anāthapiṇḍikassa ārāme 
PA_bi-vb_pc30:1.1.2	Tena kho pana samayena aññatarena upāsakena saṅghaṁ uddissa vihāro kārāpito hoti.	tena kho pana samayena aññatarena upāsakena saṅgham uddissa vihāraḥ kārāpitaḥ hoti 
PA_bi-vb_pc30:1.1.3	So tassa vihārassa mahe ubhatosaṅghassa akālacīvaraṁ dātukāmo hoti.	saḥ tassa vihārassa mahe ubhatas saṅghassa akāla cīvaram dātu kāmaḥ hoti 
PA_bi-vb_pc30:1.1.4	Tena kho pana samayena ubhatosaṅghassa kathinaṁ atthataṁ hoti.	tena kho pana samayena ubhato saṅghassa kathinam atthatam hoti 
PA_bi-vb_pc30:1.1.5	Atha kho so upāsako saṅghaṁ upasaṅkamitvā kathinuddhāraṁ yāci.	atha kho saḥ upāsakaḥ saṅgham upasaṅkamitvā kathin uddhāram yāci 
PA_bi-vb_pc30:1.1.6	Bhagavato etamatthaṁ ārocesuṁ.	bhagavato etam attham ārocesu 
PA_bi-vb_pc30:1.1.7	Atha kho bhagavā etasmiṁ nidāne etasmiṁ pakaraṇe dhammiṁ kathaṁ katvā bhikkhū āmantesi—	atha kho bhagavā etasmim nidāne etasmim pakaraṇe dhammim katham katvā bhikkhū āmantesi 
PA_bi-vb_pc30:1.1.8	“anujānāmi, bhikkhave, kathinaṁ uddharituṁ.	anujānāmi bhikkhave kathinam uddharitu 
PA_bi-vb_pc30:1.1.9	Evañca pana bhikkhave kathinaṁ uddharitabbaṁ.	evam ca pana bhikkhave kathinam uddharitabba 
PA_bi-vb_pc30:1.1.10	Byattena bhikkhunā paṭibalena saṅgho ñāpetabbo—	byattena bhikkhunā paṭibalena saṅghaḥ ñāpetabbaḥ 
PA_bi-vb_pc30:1.1.11	‘Suṇātu me, bhante, saṅgho.	suṇātu me bhante saṅghaḥ 
PA_bi-vb_pc30:1.1.12	Yadi saṅghassa pattakallaṁ, saṅgho kathinaṁ uddhareyya.	yadi saṅghassa pattakalla saṅghaḥ kathinam uddhareyya 
PA_bi-vb_pc30:1.1.13	Esā ñatti.	esā ñatti 
PA_bi-vb_pc30:1.1.14	Suṇātu me, bhante, saṅgho.	suṇātu me bhante saṅghaḥ 
PA_bi-vb_pc30:1.1.15	Saṅgho kathinaṁ uddharati.	saṅghaḥ kathinam uddharati 
PA_bi-vb_pc30:1.1.16	Yassāyasmato khamati kathinassa uddhāro, so tuṇhassa;	yassa ayasmataḥ khamati kathinassa uddhāraḥ saḥ tuṇhassa 
PA_bi-vb_pc30:1.1.17	yassa nakkhamati, so bhāseyya.	yassa na khamati saḥ bhāseyya 
PA_bi-vb_pc30:1.1.18	Ubbhataṁ saṅghena kathinaṁ, khamati saṅghassa, tasmā tuṇhī, evametaṁ dhārayāmī’”ti.	ubbhatam saṅghena khamati saṅghassa tasmai tuṇhī evam etam dhārayāmi iti 
PA_bi-vb_pc30:1.2.1	Atha kho so upāsako bhikkhunisaṅghaṁ upasaṅkamitvā kathinuddhāraṁ yāci.	atha kho saḥ upāsakaḥ bhikkhuni saṅgham upasaṅkamitvā kathin uddhāram yāci 
PA_bi-vb_pc30:1.2.2	Thullanandā bhikkhunī—	thullanandā bhikkhunī 
PA_bi-vb_pc30:1.2.3	“cīvaraṁ amhākaṁ bhavissatī”ti kathinuddhāraṁ paṭibāhi.	cīvaram amhākam bhavissati iti kathin uddhāram paṭibāhi 
PA_bi-vb_pc30:1.2.4	Atha kho so upāsako ujjhāyati khiyyati vipāceti—	atha kho saḥ upāsakaḥ ujjhāyati khiyyati vipāceti 
PA_bi-vb_pc30:1.2.5	“kathañhi nāma bhikkhuniyo amhākaṁ kathinuddhāraṁ na dassantī”ti.	katham hi nāma bhikkhuniyaḥ amhākam kathin uddhāram na dassanti iti 
PA_bi-vb_pc30:1.2.6	Assosuṁ kho bhikkhuniyo tassa upāsakassa ujjhāyantassa khiyyantassa vipācentassa.	assosum kho bhikkhuniyaḥ tassa upāsakassa ujjhāyantassa khiyyantassa vipācentassa 
PA_bi-vb_pc30:1.2.7	Yā tā bhikkhuniyo appicchā …pe… tā ujjhāyanti khiyyanti vipācenti—	yāḥ tāḥ bhikkhuniyaḥ appicchāḥ pe tāḥ ujjhāyanti khiyyanti vipācenti 
PA_bi-vb_pc30:1.2.8	“kathañhi nāma ayyā thullanandā dhammikaṁ kathinuddhāraṁ paṭibāhissatī”ti …pe…	katham hi nāma ayyā thullanandā dhammikam kathinuddhāram paṭibāhissati iti pe 
PA_bi-vb_pc30:1.2.9	“saccaṁ kira, bhikkhave, thullanandā bhikkhunī dhammikaṁ kathinuddhāraṁ paṭibāhatī”ti?	saccam kira bhikkhave thullanandā bhikkhunī dhammikam kathinuddhāram paṭibāhati iti 
PA_bi-vb_pc30:1.2.10	“Saccaṁ, bhagavā”ti.	sat ca bhagavān ati 
PA_bi-vb_pc30:1.2.11	Vigarahi buddho bhagavā …pe…	vigarahi buddhaḥ bhagavān pe 
PA_bi-vb_pc30:1.2.12	kathañhi nāma, bhikkhave, thullanandā bhikkhunī dhammikaṁ kathinuddhāraṁ paṭibāhissati.	katham hi nāma bhikkhave thullanandā bhikkhunī dhammikam kathin uddhāram paṭibāhissati 
PA_bi-vb_pc30:1.2.13	Netaṁ, bhikkhave, appasannānaṁ vā pasādāya …pe…	na ita bhikkhave appasannānam vā pasādāya pe 
PA_bi-vb_pc30:1.2.14	evañca pana, bhikkhave, bhikkhuniyo imaṁ sikkhāpadaṁ uddisantu—	evam ca pana bhikkhave bhikkhuniyaḥ imam sikkhāpadam uddisantu 
PA_bi-vb_pc30:1.2.15.1	“Yā pana bhikkhunī dhammikaṁ kathinuddhāraṁ paṭibāheyya, pācittiyan”ti.	yā pana bhikkhunī dhammikam kathinuddhāram paṭibāheyya pācittiyanti 
PA_bi-vb_pc30:2.1.1	Yā panāti	yā panāti 
PA_bi-vb_pc30:2.1.2	yā yādisā …pe…	yā yā disā pe 
PA_bi-vb_pc30:2.1.3	bhikkhunīti	bhikkhunī iti 
PA_bi-vb_pc30:2.1.4	…pe… ayaṁ imasmiṁ atthe adhippetā bhikkhunīti.	pe ayam imasmin atthe adhippetā bhikkhunī iti 
PA_bi-vb_pc30:2.1.5	Dhammiko nāma kathinuddhāro	dhammikaḥ nāma kathin uddhāraḥ 
PA_bi-vb_pc30:2.1.6	samaggo bhikkhunisaṅgho sannipatitvā uddharati.	samaggaḥ bhikkhuni saṅghaḥ sannipatitvā uddharati 
PA_bi-vb_pc30:2.1.7	Paṭibāheyyāti	paṭibāheyyā iti 
PA_bi-vb_pc30:2.1.8	“kathaṁ idaṁ kathinaṁ na uddhareyyā”ti paṭibāhati, āpatti pācittiyassa.	katham idam kathinam na uddhareyya ati paṭibāhati āpatti pācittiyassa 
PA_bi-vb_pc30:2.1.9.1	Dhammike dhammikasaññā paṭibāhati, āpatti pācittiyassa.	dhammike dhammika saññā paṭibāhati āpatti pācittiyassa 
PA_bi-vb_pc30:2.1.10	Dhammike vematikā paṭibāhati, āpatti dukkaṭassa.	dhammike vematikā paṭibāhati āpatti dukkaṭassa 
PA_bi-vb_pc30:2.1.11	Dhammike adhammikasaññā paṭibāhati, anāpatti.	dhammike adhammika saññā paṭibāhati anāpatti 
PA_bi-vb_pc30:2.1.12	Adhammike dhammikasaññā, āpatti dukkaṭassa.	adhammike dhammika saññā āpatti dukkaṭassa 
PA_bi-vb_pc30:2.1.13	Adhammike vematikā, āpatti dukkaṭassa.	adhammike vematikā āpatti dukkaṭassa 
PA_bi-vb_pc30:2.1.14	Adhammike adhammikasaññā, anāpatti.	adhammike adhammika saññā anāpatti 
PA_bi-vb_pc30:2.2.1	Anāpatti—	anāpatti 
PA_bi-vb_pc30:2.2.2	ānisaṁsaṁ dassetvā paṭibāhati,	ānisasam dassetvā paṭibāhati 
PA_bi-vb_pc30:2.2.3	ummattikāya,	ummattikāya 
PA_bi-vb_pc30:2.2.4	ādikammikāyāti.	ādikammikāya ati 
PA_bi-vb_pc30:2.2.5	Dasamasikkhāpadaṁ niṭṭhitaṁ.	dasama sikkhāpadam niṭṭhita 
PA_bi-vb_pc30:2.2.6	Naggavaggo tatiyo.	nagga vaggaḥ tatiyaḥ 
