segmentnr	original	analyzed
PA_cnd_15:30.7_1	cattagedhassa vantagedhassa muttagedhassa pahīnagedhassa paṭinissaṭṭhagedhassa vītarāgassa	catta gedhassa vanta gedhassa mutta gedhassa pahīna gedhassa paṭinissaṭṭha gedhassa vīta rāgassa 
PA_cnd_15:30.7_2	vigatarāgassa cattarāgassa vantarāgassa muttarāgassa pahīnarāgassa paṭinissaṭṭharāgassāti—	vigata rāgassa catta rāgassa vanta rāgassa mutta rāgassa pahīna rāgassa paṭinissaṭṭha rāgassa ati 
PA_cnd_15:30.8	sabbaso nāmarūpasmiṁ vītagedhassa brāhmaṇa.	sabbasas nāma rūpasmim vīta gedhassa brāhmaṇa 
PA_cnd_15:31.1	Āsavāssa na vijjantīti.	āsavāssa na vijjanti iti 
PA_cnd_15:31.2	Āsavāti cattāro āsavā—	āsavā ti cattāro āsavā 
PA_cnd_15:31.3	kāmāsavo, bhavāsavo, diṭṭhāsavo, avijjāsavo.	kāma āsavaḥ bhava āsavaḥ diṭṭha āsavaḥ avijja āsavaḥ 
PA_cnd_15:31.4	Assāti arahato khīṇāsavassa.	assa ati arahataḥ khīṇāsavassa 
PA_cnd_15:31.5	Na vijjantīti ime āsavā tassa natthi na santi na saṁvijjanti nupalabbhanti pahīnā samucchinnā vūpasantā paṭippassaddhā abhabbuppattikā ñāṇagginā daḍḍhāti—	na vijjanti iti ime āsavā tassa natthi na santi na na upalabbhanti pahīnā samucchinnā vūpasantā paṭippassaddhā abhabbuppattikā ñāṇa agginā daḍḍhā ati 
PA_cnd_15:31.6	āsavāssa na vijjanti.	āsavāssa na vijjanti 
PA_cnd_15:32.1	Yehi maccuvasaṁ vajeti yehi āsavehi maccuno vā vasaṁ gaccheyya, maraṇassa vā vasaṁ gaccheyya, mārapakkhassa vā vasaṁ gaccheyya;	yehi maccu vasam vaja iti yehi āsavehi maccunaḥ vā vasam gaccheyya maraṇassa vā vasam gaccheyya māra pakkhassa vā vasam gaccheyya 
PA_cnd_15:32.2	te āsavā tassa natthi na santi na saṁvijjanti nupalabbhanti pahīnā samucchinnā vūpasantā paṭippassaddhā abhabbuppattikā ñāṇagginā daḍḍhāti—	te āsavā tassa natthi na santi na sa vijjanti na upalabbhanti pahīnā samucchinnā vūpasantā paṭippassaddhā abhabbuppattikā ñāṇa agginā daḍḍhā ati 
PA_cnd_15:32.3	yehi maccuvasaṁ vaje.	yehi maccuvasam vaje 
PA_cnd_15:32.4	Tenāha bhagavā—	tena āha bhagavān 
PA_cnd_15:33.1	“Sabbaso nāmarūpasmiṁ,	sabbasaḥ nāma rūpasmi 
PA_cnd_15:33.2	vītagedhassa brāhmaṇa;	vītagedhassa brāhmaṇa 
PA_cnd_15:33.3	Āsavāssa na vijjanti,	āsavāssa na vijjanti 
PA_cnd_15:33.4	yehi maccuvasaṁ vaje”ti.	yā ihi mat cuvasam vaja iti 
PA_cnd_15:34.1	Saha gāthāpariyosānā …pe…	saha gāthā pariyosānā pe 
PA_cnd_15:34.2	satthā me bhante bhagavā, sāvakohamasmīti.	satthā me bhante bhagavā sāvakaḥ ham asmi iti 
PA_cnd_15:34.3	Jatukaṇṇimāṇavapucchāniddeso ekādasamo.	jatukaṇṇi māṇavapucchā niddesaḥ ekādasamaḥ 
