segmentnr	original	analyzed
PA_dn_34:1.7.31	idhāvuso, bhikkhu satthari sagāravo viharati sappatisso. Dhamme …pe… saṅghe … sikkhāya … appamāde … paṭisanthāre sagāravo viharati sappatisso.	▁idh āvuso ▁bhikkhu ▁satthari ▁sa gārav o ▁viharati ▁sapp ati s so ▁dhamme ▁pe ▁saṃgh e ▁sikkh āya ▁appamād e ▁paṭi sant hār e ▁sa gārav o ▁viharati ▁sapp ati s so
PA_dn_34:1.7.32	Ime cha dhammā visesabhāgiyā.	▁ime ▁cha ▁dhammā ▁vises a bhāgiy ā
PA_dn_34:1.7.33	Katame cha dhammā duppaṭivijjhā?	▁katame ▁cha ▁dhammā ▁du ppaṭi vijj hā
PA_dn_34:1.7.34	Cha nissaraṇiyā dhātuyo—	▁cha ▁ni ssa ra ṇ iyā ▁dhātuyo
PA_dn_34:1.7.35	idhāvuso, bhikkhu evaṁ vadeyya:	▁idh āvuso ▁bhikkhu ▁evaṃ ▁vadeyya
PA_dn_34:1.7.36	‘mettā hi kho me, cetovimutti bhāvitā bahulīkatā yānīkatā vatthukatā anuṭṭhitā paricitā susamāraddhā,	▁mettā ▁hi ▁kho ▁me ▁cetovimutti ▁bhāvit ā ▁bahulīkat ā ▁yā nī kat ā ▁vatthu kat ā ▁anu ṭṭhit ā ▁pari cit ā ▁su sam āraddh ā
PA_dn_34:1.7.37	atha ca pana me byāpādo cittaṁ pariyādāya tiṭṭhatī’ti.	▁atha ▁ca ▁pana ▁me ▁byāpād o ▁cittaṃ ▁pari yā d āya ▁tiṭṭh atīti
PA_dn_34:1.7.38	So ‘mā hevan’tissa vacanīyo ‘māyasmā evaṁ avaca, mā bhagavantaṁ abbhācikkhi. Na hi sādhu bhagavato abbhakkhānaṁ, na hi bhagavā evaṁ vadeyya.	▁so ▁mā ▁ heva nti ssa ▁ vacanīy o ▁mā y asmā ▁evaṃ ▁ava ca ▁mā ▁bhagavantaṃ ▁abbh ā ci kkhi ▁na ▁hi ▁sādhu ▁bhagavato ▁ ab bhakkh ānaṃ ▁na ▁hi ▁bhagavā ▁evaṃ ▁vadeyya
PA_dn_34:1.7.39	Aṭṭhānametaṁ āvuso anavakāso yaṁ mettāya cetovimuttiyā bhāvitāya bahulīkatāya yānīkatāya vatthukatāya anuṭṭhitāya paricitāya susamāraddhāya.	▁ aṭṭhān ametaṃ ▁āvuso ▁ana va kās o ▁yaṃ ▁mett āya ▁cetovimutti yā ▁bhāvit āya ▁bahulīkat āya ▁yā nī kat āya ▁ vatthuk atāya ▁anu ṭṭhit āya ▁pari cit āya ▁su sam āraddh āya
PA_dn_34:1.7.40	Atha ca panassa byāpādo cittaṁ pariyādāya ṭhassatīti, netaṁ ṭhānaṁ vijjati.	▁atha ▁ca ▁pana ssa ▁byāpād o ▁cittaṃ ▁pari yā d āya ▁ṭh assa tīti ▁netaṃ ▁ṭhānaṃ ▁vijjati
PA_dn_34:1.7.41	Nissaraṇaṁ hetaṁ, āvuso, byāpādassa, yadidaṁ mettācetovimuttī’ti.	▁ni ssa raṇaṃ ▁he taṃ ▁āvuso ▁byāpād assa ▁yadidaṃ ▁mettā cet o vimutt īti
PA_dn_34:1.7.42	Idha panāvuso, bhikkhu evaṁ vadeyya:	▁idha ▁panāvuso ▁bhikkhu ▁evaṃ ▁vadeyya
PA_dn_34:1.7.43	‘karuṇā hi kho me cetovimutti bhāvitā bahulīkatā yānīkatā vatthukatā anuṭṭhitā paricitā susamāraddhā.	▁karuṇā ▁hi ▁kho ▁me ▁cetovimutti ▁bhāvit ā ▁bahulīkat ā ▁yā nī kat ā ▁vatthu kat ā ▁anu ṭṭhit ā ▁pari cit ā ▁su sam āraddh ā
PA_dn_34:1.7.44	Atha ca pana me vihesā cittaṁ pariyādāya tiṭṭhatī’ti.	▁atha ▁ca ▁pana ▁me ▁vi he sā ▁cittaṃ ▁pari yā d āya ▁tiṭṭh atīti
PA_dn_34:1.7.45	So: ‘mā hevan’tissa vacanīyo, ‘māyasmā evaṁ avaca, mā bhagavantaṁ abbhācikkhi …pe…	▁so ▁mā ▁ heva nti ssa ▁ vacanīy o ▁mā y asmā ▁evaṃ ▁ava ca ▁mā ▁bhagavantaṃ ▁abbh ā ci kkhi ▁pe
PA_dn_34:1.7.46	nissaraṇaṁ hetaṁ, āvuso, vihesāya, yadidaṁ karuṇācetovimuttī’ti.	▁ni ssa raṇaṃ ▁he taṃ ▁āvuso ▁vi he s āya ▁yadidaṃ ▁karuṇā cet o vimutt īti
PA_dn_34:1.7.47	Idha panāvuso, bhikkhu evaṁ vadeyya:	▁idha ▁panāvuso ▁bhikkhu ▁evaṃ ▁vadeyya
PA_dn_34:1.7.48	‘muditā hi kho me cetovimutti bhāvitā …pe…	▁ mud itā ▁hi ▁kho ▁me ▁cetovimutti ▁bhāvit ā ▁pe
PA_dn_34:1.7.49	atha ca pana me arati cittaṁ pariyādāya tiṭṭhatī’ti.	▁atha ▁ca ▁pana ▁me ▁a rati ▁cittaṃ ▁pari yā d āya ▁tiṭṭh atīti
PA_dn_34:1.7.50	So: ‘mā hevan’tissa vacanīyo ‘māyasmā evaṁ avaca …pe…	▁so ▁mā ▁ heva nti ssa ▁ vacanīy o ▁mā y asmā ▁evaṃ ▁ava ca ▁pe
PA_dn_34:1.7.51	nissaraṇaṁ hetaṁ, āvuso, aratiyā, yadidaṁ muditācetovimuttī’ti.	▁ni ssa raṇaṃ ▁he taṃ ▁āvuso ▁a rati yā ▁yadidaṃ ▁ mud itā cet o vimutt īti
PA_dn_34:1.7.52	Idha panāvuso, bhikkhu evaṁ vadeyya:	▁idha ▁panāvuso ▁bhikkhu ▁evaṃ ▁vadeyya
PA_dn_34:1.7.53	‘upekkhā hi kho me cetovimutti bhāvitā …pe…	▁upekkhā ▁hi ▁kho ▁me ▁cetovimutti ▁bhāvit ā ▁pe
PA_dn_34:1.7.54	atha ca pana me rāgo cittaṁ pariyādāya tiṭṭhatī’ti.	▁atha ▁ca ▁pana ▁me ▁rāg o ▁cittaṃ ▁pari yā d āya ▁tiṭṭh atīti
PA_dn_34:1.7.55	So: ‘mā hevan’tissa vacanīyo ‘māyasmā evaṁ avaca …pe…	▁so ▁mā ▁ heva nti ssa ▁ vacanīy o ▁mā y asmā ▁evaṃ ▁ava ca ▁pe
PA_dn_34:1.7.56	nissaraṇaṁ hetaṁ, āvuso, rāgassa yadidaṁ upekkhācetovimuttī’ti.	▁ni ssa raṇaṃ ▁he taṃ ▁āvuso ▁rāg assa ▁yadidaṃ ▁upekkhā cet o vimutt īti
PA_dn_34:1.7.57	Idha panāvuso, bhikkhu evaṁ vadeyya:	▁idha ▁panāvuso ▁bhikkhu ▁evaṃ ▁vadeyya
PA_dn_34:1.7.58	‘animittā hi kho me cetovimutti bhāvitā …pe…	▁ animitt ā ▁hi ▁kho ▁me ▁cetovimutti ▁bhāvit ā ▁pe
PA_dn_34:1.7.59	atha ca pana me nimittānusāri viññāṇaṁ hotī’ti.	▁atha ▁ca ▁pana ▁me ▁nimitt ānu sār i ▁viññāṇaṃ ▁hotīti
PA_dn_34:1.7.60	So: ‘mā hevan’tissa vacanīyo ‘māyasmā evaṁ avaca …pe…	▁so ▁mā ▁ heva nti ssa ▁ vacanīy o ▁mā y asmā ▁evaṃ ▁ava ca ▁pe
PA_dn_34:1.7.61	nissaraṇaṁ hetaṁ, āvuso, sabbanimittānaṁ yadidaṁ animittā cetovimuttī’ti.	▁ni ssa raṇaṃ ▁he taṃ ▁āvuso ▁sabb animitt ānaṃ ▁yadidaṃ ▁ animitt ā ▁cet o vimutt īti
PA_dn_34:1.7.62	Idha panāvuso, bhikkhu evaṁ vadeyya:	▁idha ▁panāvuso ▁bhikkhu ▁evaṃ ▁vadeyya
PA_dn_34:1.7.63	‘asmīti kho me vigataṁ, ayamahamasmīti na samanupassāmi,	▁a smīti ▁kho ▁me ▁vigat aṃ ▁ayam a hamasmīti ▁na ▁samanupass āmi
PA_dn_34:1.7.64	atha ca pana me vicikicchākathaṅkathāsallaṁ cittaṁ pariyādāya tiṭṭhatī’ti.	▁atha ▁ca ▁pana ▁me ▁vicikicchā kath aṃ kathā sall aṃ ▁cittaṃ ▁pari yā d āya ▁tiṭṭh atīti
PA_dn_34:1.7.65	So: ‘mā hevan’tissa vacanīyo ‘māyasmā evaṁ avaca, mā bhagavantaṁ abbhācikkhi, na hi sādhu bhagavato abbhakkhānaṁ, na hi bhagavā evaṁ vadeyya.	▁so ▁mā ▁ heva nti ssa ▁ vacanīy o ▁mā y asmā ▁evaṃ ▁ava ca ▁mā ▁bhagavantaṃ ▁abbh ā ci kkhi ▁na ▁hi ▁sādhu ▁bhagavato ▁ ab bhakkh ānaṃ ▁na ▁hi ▁bhagavā ▁evaṃ ▁vadeyya
PA_dn_34:1.7.66	Aṭṭhānametaṁ, āvuso, anavakāso yaṁ asmīti vigate ayamahamasmīti asamanupassato.	▁ aṭṭhān ametaṃ ▁āvuso ▁ana va kās o ▁yaṃ ▁a smīti ▁vigat e ▁ayam a hamasmīti ▁as amanu pass ato
PA_dn_34:1.7.67	Atha ca panassa vicikicchākathaṅkathāsallaṁ cittaṁ pariyādāya ṭhassati, netaṁ ṭhānaṁ vijjati.	▁atha ▁ca ▁pana ssa ▁vicikicchā kath aṃ kathā sall aṃ ▁cittaṃ ▁pari yā d āya ▁ṭh assa ti ▁netaṃ ▁ṭhānaṃ ▁vijjati
PA_dn_34:1.7.68	Nissaraṇaṁ hetaṁ, āvuso, vicikicchākathaṅkathāsallassa, yadidaṁ asmimānasamugghāto’ti.	▁ni ssa raṇaṃ ▁he taṃ ▁āvuso ▁vicikicchā kath aṃ kathā sall assa ▁yadidaṃ ▁a smi mān asam u g ghāt oti
PA_dn_34:1.7.69	Ime cha dhammā duppaṭivijjhā.	▁ime ▁cha ▁dhammā ▁du ppaṭi vijj hā
PA_dn_34:1.7.70	Katame cha dhammā uppādetabbā?	▁katame ▁cha ▁dhammā ▁uppād etabbā
PA_dn_34:1.7.71	Cha satatavihārā.	▁cha ▁sa tat avihār ā
PA_dn_34:1.7.72	Idhāvuso, bhikkhu cakkhunā rūpaṁ disvā neva sumano hoti na dummano, upekkhako viharati sato sampajāno.	▁idh āvuso ▁bhikkhu ▁cakkhunā ▁rūpaṃ ▁disvā ▁neva ▁suman o ▁hoti ▁na ▁dum man o ▁u pekkh ako ▁viharati ▁sat o ▁sampajāno
PA_dn_34:1.7.73	Sotena saddaṁ sutvā …pe…	▁ sot ena ▁sadd aṃ ▁sutvā ▁pe
PA_dn_34:1.7.74	ghānena gandhaṁ ghāyitvā …	▁ghān ena ▁gandh aṃ ▁ gh ā y itvā
PA_dn_34:1.7.75	jivhāya rasaṁ sāyitvā …	▁jivhā ya ▁ras aṃ ▁sā y itvā
PA_dn_34:1.7.76	kāyena phoṭṭhabbaṁ phusitvā …	▁kāyena ▁phoṭṭhabb aṃ ▁phus itvā
PA_dn_34:1.7.77	manasā dhammaṁ viññāya neva sumano hoti na dummano, upekkhako viharati sato sampajāno.	▁manasā ▁dhammaṃ ▁vi ññ āya ▁neva ▁suman o ▁hoti ▁na ▁dum man o ▁u pekkh ako ▁viharati ▁sat o ▁sampajāno
PA_dn_34:1.7.78	Ime cha dhammā uppādetabbā.	▁ime ▁cha ▁dhammā ▁uppād etabbā
PA_dn_34:1.7.79	Katame cha dhammā abhiññeyyā?	▁katame ▁cha ▁dhammā ▁abhiññeyy ā
PA_dn_34:1.7.80	Cha anuttariyāni—	▁cha ▁anuttar iy āni
PA_dn_34:1.7.81	dassanānuttariyaṁ, savanānuttariyaṁ, lābhānuttariyaṁ, sikkhānuttariyaṁ, pāricariyānuttariyaṁ, anussatānuttariyaṁ.	▁dassan ān uttar iyaṃ ▁savan ān uttar iyaṃ ▁lābh ān uttar iyaṃ ▁sikkhā n uttar iyaṃ ▁ pāri cariyā n uttar iyaṃ ▁anu ssa tā n uttar iyaṃ
PA_dn_34:1.7.82	Ime cha dhammā abhiññeyyā.	▁ime ▁cha ▁dhammā ▁abhiññeyy ā
PA_dn_34:1.7.83	Katame cha dhammā sacchikātabbā?	▁katame ▁cha ▁dhammā ▁sa cch ikā tabb ā
PA_dn_34:1.7.84	Cha abhiññā—	▁cha ▁abhiññā
PA_dn_34:1.7.85_0	idhāvuso, bhikkhu anekavihitaṁ iddhividhaṁ paccanubhoti—ekopi hutvā bahudhā hoti,	▁idh āvuso ▁bhikkhu ▁aneka vihit aṃ ▁iddhi vidh aṃ ▁pacc anu bh oti e ko pi ▁hutvā ▁bahu dhā ▁hoti
PA_dn_34:1.7.85_1	bahudhāpi hutvā eko hoti; āvibhāvaṁ tirobhāvaṁ; tirokuṭṭaṁ tiropākāraṁ tiropabbataṁ	▁bahu dhā pi ▁hutvā ▁eko ▁hoti ▁āvi bhāv aṃ ▁ ti ro bhāv aṃ ▁ ti ro kuṭ ṭ aṃ ▁ ti rop ākār aṃ ▁ ti rop abba taṃ
PA_dn_34:1.7.85_2	asajjamāno gacchati seyyathāpi ākāse; pathaviyāpi ummujjanimujjaṁ karoti seyyathāpi	▁a sajj amāno ▁gacchati ▁seyyathāpi ▁ākās e ▁pathavi yā pi ▁umm u jj ani mu jj aṃ ▁karoti ▁seyyathāpi
PA_dn_34:1.7.85_3	udake; udakepi abhijjamāne gacchati seyyathāpi pathaviyaṁ; ākāsepi pallaṅkena kamati	▁udak e ▁udak epi ▁abhi jj amān e ▁gacchati ▁seyyathāpi ▁pathavi yaṃ ▁ākās epi ▁ pallaṃk ena ▁kam ati
PA_dn_34:1.7.85_4	seyyathāpi pakkhī sakuṇo; imepi candimasūriye evaṁmahiddhike evaṁmahānubhāve pāṇinā	▁seyyathāpi ▁pakkh ī ▁sak u ṇ o ▁ime pi ▁cand i ma sū riy e ▁evaṃ mahiddhik e ▁evaṃ mah ānubhāv e ▁pāṇ inā
PA_dn_34:1.7.85_5	parāmasati parimajjati; yāva brahmalokāpi kāyena vasaṁ vatteti.	▁parāmas ati ▁pari majj ati ▁yāva ▁brahmalok āpi ▁kāyena ▁vas aṃ ▁vatt eti
PA_dn_34:1.7.86	Dibbāya sotadhātuyā visuddhāya atikkantamānusikāya ubho sadde suṇāti dibbe ca mānuse ca, ye dūre santike ca.	▁dibb āya ▁sota dhātu yā ▁ visuddh āya ▁ atikkant amān u s ikāya ▁ubho ▁sadd e ▁suṇ āti ▁dibb e ▁ca ▁mān u se ▁ca ▁ye ▁ dūr e ▁santike ▁ca
PA_dn_34:1.7.87	Parasattānaṁ parapuggalānaṁ cetasā ceto paricca pajānāti,	▁para satt ānaṃ ▁par apuggal ānaṃ ▁cetasā ▁cet o ▁pari cca ▁pajānāti
PA_dn_34:1.7.88	sarāgaṁ vā cittaṁ sarāgaṁ cittanti pajānāti …pe…	▁sa rāg aṃ ▁vā ▁cittaṃ ▁sa rāg aṃ ▁citt anti ▁pajānāti ▁pe
PA_dn_34:1.7.89	avimuttaṁ vā cittaṁ avimuttaṁ cittanti pajānāti.	▁a vimutt aṃ ▁vā ▁cittaṃ ▁a vimutt aṃ ▁citt anti ▁pajānāti
PA_dn_34:1.7.90	So anekavihitaṁ pubbenivāsaṁ anussarati, seyyathidaṁ—ekampi jātiṁ …pe… iti sākāraṁ sauddesaṁ anekavihitaṁ pubbenivāsaṁ anussarati.	▁so ▁aneka vihit aṃ ▁pubbenivās aṃ ▁anussar ati ▁seyyathidaṃ e kampi ▁jāti ṃ ▁pe ▁iti ▁sā kār aṃ ▁sa uddes aṃ ▁aneka vihit aṃ ▁pubbenivās aṃ ▁anussar ati
PA_dn_34:1.7.91	Dibbena cakkhunā visuddhena atikkantamānusakena satte passati cavamāne upapajjamāne hīne paṇīte suvaṇṇe dubbaṇṇe sugate duggate yathākammūpage satte pajānāti …pe…	▁dibb ena ▁cakkhunā ▁ visuddh ena ▁ atikkant amān u sak ena ▁satt e ▁passati ▁ca va mān e ▁upapajj amān e ▁hīn e ▁paṇīt e ▁su vaṇṇ e ▁du bb a ṇ ṇ e ▁sugat e ▁du ggat e ▁yathā kamm ūpag e ▁satt e ▁pajānāti ▁pe
PA_dn_34:1.7.92	Āsavānaṁ khayā anāsavaṁ cetovimuttiṁ paññāvimuttiṁ diṭṭheva dhamme sayaṁ abhiññā sacchikatvā upasampajja viharati.	▁āsav ānaṃ ▁khay ā ▁an āsav aṃ ▁cetovimutti ṃ ▁paññā vimutti ṃ ▁diṭṭh eva ▁dhamme ▁sayaṃ ▁abhiññā ▁sacchikatvā ▁upasampajja ▁viharati
PA_dn_34:1.7.93	Ime cha dhammā sacchikātabbā.	▁ime ▁cha ▁dhammā ▁sa cch ikā tabb ā
PA_dn_34:1.7.94	Iti ime saṭṭhi dhammā bhūtā tacchā tathā avitathā anaññathā sammā tathāgatena abhisambuddhā.	▁iti ▁ime ▁ saṭṭhi ▁dhammā ▁bhūt ā ▁ta cchā ▁tathā ▁avi ta thā ▁anaññ a thā ▁sammā ▁tathāgat ena ▁abhisambuddh ā
PA_dn_34:1.8.0	7. Satta dhammā	▁satta ▁dhammā
PA_dn_34:1.8.1	Satta dhammā bahukārā …pe… satta dhammā sacchikātabbā.	▁satta ▁dhammā ▁bahu kār ā ▁pe ▁satta ▁dhammā ▁sa cch ikā tabb ā
PA_dn_34:1.8.2	Katame satta dhammā bahukārā?	▁katame ▁satta ▁dhammā ▁bahu kār ā
PA_dn_34:1.8.3	Satta ariyadhanāni—	▁satta ▁ariy a dhan āni
PA_dn_34:1.8.4	saddhādhanaṁ, sīladhanaṁ, hiridhanaṁ, ottappadhanaṁ, sutadhanaṁ, cāgadhanaṁ, paññādhanaṁ.	▁saddhā dhan aṃ ▁sīl a dhan aṃ ▁hi ri dhan aṃ ▁ottapp a dhan aṃ ▁sut a dhan aṃ ▁cā ga dhan aṃ ▁paññā dhan aṃ
PA_dn_34:1.8.5	Ime satta dhammā bahukārā.	▁ime ▁satta ▁dhammā ▁bahu kār ā
PA_dn_34:1.8.6	Katame satta dhammā bhāvetabbā?	▁katame ▁satta ▁dhammā ▁bhāvetabb ā
PA_dn_34:1.8.7	Satta sambojjhaṅgā—	▁satta ▁ sambojjhaṃg ā
PA_dn_34:1.8.8	satisambojjhaṅgo, dhammavicayasambojjhaṅgo, vīriyasambojjhaṅgo, pītisambojjhaṅgo, passaddhisambojjhaṅgo, samādhisambojjhaṅgo, upekkhāsambojjhaṅgo.	▁sati sambojjhaṃg o ▁dhamma vicay a sambojjhaṃg o ▁vīriy a sambojjhaṃg o ▁pīti sambojjhaṃg o ▁ passaddhi sambojjhaṃg o ▁samādhi sambojjhaṃg o ▁upekkhā sambojjhaṃg o
PA_dn_34:1.8.9	Ime satta dhammā bhāvetabbā.	▁ime ▁satta ▁dhammā ▁bhāvetabb ā
PA_dn_34:1.8.10	Katame satta dhammā pariññeyyā?	▁katame ▁satta ▁dhammā ▁pari ññ eyyā
PA_dn_34:1.8.11	Satta viññāṇaṭṭhitiyo—	▁satta ▁viññāṇ aṭṭhiti yo
PA_dn_34:1.8.12	santāvuso, sattā nānattakāyā nānattasaññino, seyyathāpi manussā ekacce ca devā ekacce ca vinipātikā.	▁sant āvuso ▁sattā ▁ nānatt akāy ā ▁ nānatt asaññino ▁seyyathāpi ▁manussā ▁ekacc e ▁ca ▁dev ā ▁ekacc e ▁ca ▁vi nipāt ikā
PA_dn_34:1.8.13	Ayaṁ paṭhamā viññāṇaṭṭhiti.	▁ayaṃ ▁paṭham ā ▁viññāṇ aṭṭhiti
PA_dn_34:1.8.14	Santāvuso, sattā nānattakāyā ekattasaññino, seyyathāpi devā brahmakāyikā paṭhamābhinibbattā.	▁sant āvuso ▁sattā ▁ nānatt akāy ā ▁ekatt asaññino ▁seyyathāpi ▁dev ā ▁brahm akāy ikā ▁paṭham ābhi nibbatt ā
PA_dn_34:1.8.15	Ayaṁ dutiyā viññāṇaṭṭhiti.	▁ayaṃ ▁dutiy ā ▁viññāṇ aṭṭhiti
PA_dn_34:1.8.16	Santāvuso, sattā ekattakāyā nānattasaññino, seyyathāpi devā ābhassarā.	▁sant āvuso ▁sattā ▁ekatt akāy ā ▁ nānatt asaññino ▁seyyathāpi ▁dev ā ▁ ā bh assa rā
PA_dn_34:1.8.17	Ayaṁ tatiyā viññāṇaṭṭhiti.	▁ayaṃ ▁tatiy ā ▁viññāṇ aṭṭhiti
PA_dn_34:1.8.18	Santāvuso, sattā ekattakāyā ekattasaññino, seyyathāpi devā subhakiṇhā.	▁sant āvuso ▁sattā ▁ekatt akāy ā ▁ekatt asaññino ▁seyyathāpi ▁dev ā ▁subh a ki ṇ hā
PA_dn_34:1.8.19	Ayaṁ catutthī viññāṇaṭṭhiti.	▁ayaṃ ▁catutth ī ▁viññāṇ aṭṭhiti
PA_dn_34:1.8.20	Santāvuso, sattā sabbaso rūpasaññānaṁ samatikkamā …pe… ‘ananto ākāso’ti ākāsānañcāyatanūpagā.	▁sant āvuso ▁sattā ▁sabbaso ▁rūp asaññā naṃ ▁sam ati kkam ā ▁pe ▁anant o ▁ākās oti ▁ākāsānañcāyatan ūpag ā
PA_dn_34:1.8.21	Ayaṁ pañcamī viññāṇaṭṭhiti.	▁ayaṃ ▁pañcam ī ▁viññāṇ aṭṭhiti
PA_dn_34:1.8.22	Santāvuso, sattā sabbaso ākāsānañcāyatanaṁ samatikkamma ‘anantaṁ viññāṇan’ti viññāṇañcāyatanūpagā.	▁sant āvuso ▁sattā ▁sabbaso ▁ākāsānañcāyatan aṃ ▁sam ati kkam ma ▁anant aṃ ▁viññāṇ anti ▁viññāṇañcāyatan ūpag ā
PA_dn_34:1.8.23	Ayaṁ chaṭṭhī viññāṇaṭṭhiti.	▁ayaṃ ▁chaṭṭh ī ▁viññāṇ aṭṭhiti
PA_dn_34:1.8.24	Santāvuso, sattā sabbaso viññāṇañcāyatanaṁ samatikkamma ‘natthi kiñcī’ti ākiñcaññāyatanūpagā.	▁sant āvuso ▁sattā ▁sabbaso ▁viññāṇañcāyatan aṃ ▁sam ati kkam ma ▁natthi ▁ki ñc īti ▁ākiñcaññāyatan ūpag ā
PA_dn_34:1.8.25	Ayaṁ sattamī viññāṇaṭṭhiti.	▁ayaṃ ▁sattam ī ▁viññāṇ aṭṭhiti
PA_dn_34:1.8.26	Ime satta dhammā pariññeyyā.	▁ime ▁satta ▁dhammā ▁pari ññ eyyā
PA_dn_34:1.8.27	Katame satta dhammā pahātabbā?	▁katame ▁satta ▁dhammā ▁pahātabb ā
PA_dn_34:1.8.28	Sattānusayā—	▁satt ānusay ā
PA_dn_34:1.8.29	kāmarāgānusayo, paṭighānusayo, diṭṭhānusayo, vicikicchānusayo, mānānusayo, bhavarāgānusayo, avijjānusayo.	▁kāmarāgānusay o ▁paṭighānusay o ▁diṭṭhānusay o ▁vicikicchānusay o ▁mānānusay o ▁bhavarāgānusay o ▁avijjānusay o
PA_dn_34:1.8.30	Ime satta dhammā pahātabbā.	▁ime ▁satta ▁dhammā ▁pahātabb ā
PA_dn_34:1.8.31	Katame satta dhammā hānabhāgiyā?	▁katame ▁satta ▁dhammā ▁h āna bhāgiy ā
PA_dn_34:1.8.32	Satta asaddhammā—	▁satta ▁a saddhamm ā
PA_dn_34:1.8.33	idhāvuso, bhikkhu assaddho hoti, ahiriko hoti, anottappī hoti, appassuto hoti, kusīto hoti, muṭṭhassati hoti, duppañño hoti.	▁idh āvuso ▁bhikkhu ▁ assa ddh o ▁hoti ▁a hi r iko ▁hoti ▁an o t tapp ī ▁hoti ▁appa ssu to ▁hoti ▁ku sī to ▁hoti ▁mu ṭṭh assa ti ▁hoti ▁du ppa ññ o ▁hoti
PA_dn_34:1.8.34	Ime satta dhammā hānabhāgiyā.	▁ime ▁satta ▁dhammā ▁h āna bhāgiy ā
PA_dn_34:1.8.35	Katame satta dhammā visesabhāgiyā?	▁katame ▁satta ▁dhammā ▁vises a bhāgiy ā
PA_dn_34:1.8.36	Satta saddhammā—	▁satta ▁ saddhamm ā
PA_dn_34:1.8.37	idhāvuso, bhikkhu saddho hoti, hirimā hoti, ottappī hoti, bahussuto hoti, āraddhavīriyo hoti, upaṭṭhitassati hoti, paññavā hoti.	▁idh āvuso ▁bhikkhu ▁saddh o ▁hoti ▁hi ri mā ▁hoti ▁ottapp ī ▁hoti ▁bahussut o ▁hoti ▁ āraddh avīriy o ▁hoti ▁upa ṭṭhit assa ti ▁hoti ▁paññ avā ▁hoti
PA_dn_34:1.8.38	Ime satta dhammā visesabhāgiyā.	▁ime ▁satta ▁dhammā ▁vises a bhāgiy ā
PA_dn_34:1.8.39	Katame satta dhammā duppaṭivijjhā?	▁katame ▁satta ▁dhammā ▁du ppaṭi vijj hā
PA_dn_34:1.8.40	Satta sappurisadhammā—	▁satta ▁sappuris adhammā
PA_dn_34:1.8.41	idhāvuso, bhikkhu dhammaññū ca hoti atthaññū ca attaññū ca mattaññū ca kālaññū ca parisaññū ca puggalaññū ca.	▁idh āvuso ▁bhikkhu ▁dhamm aññū ▁ca ▁hoti ▁atth aññū ▁ca ▁att aññū ▁ca ▁ matt aññū ▁ca ▁kāl aññū ▁ca ▁paris aññū ▁ca ▁puggal aññū ▁ca
PA_dn_34:1.8.42	Ime satta dhammā duppaṭivijjhā.	▁ime ▁satta ▁dhammā ▁du ppaṭi vijj hā
PA_dn_34:1.8.43	Katame satta dhammā uppādetabbā?	▁katame ▁satta ▁dhammā ▁uppād etabbā
PA_dn_34:1.8.44	Satta saññā—	▁satta ▁saññā
PA_dn_34:1.8.45	aniccasaññā, anattasaññā, asubhasaññā, ādīnavasaññā, pahānasaññā, virāgasaññā, nirodhasaññā.	▁anicc asaññā ▁anatt asaññā ▁asubh asaññā ▁ādīnav asaññā ▁pahān asaññā ▁virāg asaññā ▁nirodh asaññā
PA_dn_34:1.8.46	Ime satta dhammā uppādetabbā.	▁ime ▁satta ▁dhammā ▁uppād etabbā
PA_dn_34:1.8.47	Katame satta dhammā abhiññeyyā?	▁katame ▁satta ▁dhammā ▁abhiññeyy ā
PA_dn_34:1.8.48	Satta niddasavatthūni—	▁satta ▁nidd a sa vatthūni
PA_dn_34:1.8.49	idhāvuso, bhikkhu sikkhāsamādāne tibbacchando hoti, āyatiñca sikkhāsamādāne avigatapemo.	▁idh āvuso ▁bhikkhu ▁sikkhā sam ā dān e ▁ ti bb a cchand o ▁hoti ▁ āya ti ñca ▁sikkhā sam ā dān e ▁avigat a pe mo
PA_dn_34:1.8.50	Dhammanisantiyā tibbacchando hoti, āyatiñca dhammanisantiyā avigatapemo.	▁dhamma ni santi yā ▁ ti bb a cchand o ▁hoti ▁ āya ti ñca ▁dhamma ni santi yā ▁avigat a pe mo
PA_dn_34:1.8.51	Icchāvinaye tibbacchando hoti, āyatiñca icchāvinaye avigatapemo.	▁icch ā vinay e ▁ ti bb a cchand o ▁hoti ▁ āya ti ñca ▁icch ā vinay e ▁avigat a pe mo
PA_dn_34:1.8.52	Paṭisallāne tibbacchando hoti, āyatiñca paṭisallāne avigatapemo.	▁paṭi sall ān e ▁ ti bb a cchand o ▁hoti ▁ āya ti ñca ▁paṭi sall ān e ▁avigat a pe mo
PA_dn_34:1.8.53	Vīriyārambhe tibbacchando hoti, āyatiñca vīriyārambhe avigatapemo.	▁vīriy ārambh e ▁ ti bb a cchand o ▁hoti ▁ āya ti ñca ▁vīriy ārambh e ▁avigat a pe mo
PA_dn_34:1.8.54	Satinepakke tibbacchando hoti, āyatiñca satinepakke avigatapemo.	▁sati n e pakk e ▁ ti bb a cchand o ▁hoti ▁ āya ti ñca ▁sati n e pakk e ▁avigat a pe mo
PA_dn_34:1.8.55	Diṭṭhipaṭivedhe tibbacchando hoti, āyatiñca diṭṭhipaṭivedhe avigatapemo.	▁diṭṭhi paṭivedh e ▁ ti bb a cchand o ▁hoti ▁ āya ti ñca ▁diṭṭhi paṭivedh e ▁avigat a pe mo
PA_dn_34:1.8.56	Ime satta dhammā abhiññeyyā.	▁ime ▁satta ▁dhammā ▁abhiññeyy ā
PA_dn_34:1.8.57	Katame satta dhammā sacchikātabbā?	▁katame ▁satta ▁dhammā ▁sa cch ikā tabb ā
PA_dn_34:1.8.58	Satta khīṇāsavabalāni—	▁satta ▁khīṇāsav a bal āni
PA_dn_34:1.8.59	idhāvuso, khīṇāsavassa bhikkhuno aniccato sabbe saṅkhārā yathābhūtaṁ sammappaññāya sudiṭṭhā honti.	▁idh āvuso ▁khīṇāsav assa ▁bhikkhuno ▁anicc ato ▁sabbe ▁saṃkhārā ▁yathābhūtaṃ ▁samma ppa ññ āya ▁su diṭṭh ā ▁honti
PA_dn_34:1.8.60_0	Yaṁpāvuso, khīṇāsavassa bhikkhuno aniccato sabbe saṅkhārā yathābhūtaṁ sammappaññāya	▁yaṃ p āvuso ▁khīṇāsav assa ▁bhikkhuno ▁anicc ato ▁sabbe ▁saṃkhārā ▁yathābhūtaṃ ▁samma ppa ññ āya
PA_dn_34:1.8.60_1	sudiṭṭhā honti, idampi khīṇāsavassa bhikkhuno balaṁ hoti, yaṁ balaṁ āgamma khīṇāsavo	▁su diṭṭh ā ▁honti ▁idam pi ▁khīṇāsav assa ▁bhikkhuno ▁bal aṃ ▁hoti ▁yaṃ ▁bal aṃ ▁āgamma ▁khīṇāsav o
PA_dn_34:1.8.60_2	bhikkhu āsavānaṁ khayaṁ paṭijānāti: ‘khīṇā me āsavā’ti.	▁bhikkhu ▁āsav ānaṃ ▁khay aṃ ▁paṭijān āti ▁khīṇā ▁me ▁āsav āti
PA_dn_34:1.8.61	Puna caparaṁ, āvuso, khīṇāsavassa bhikkhuno aṅgārakāsūpamā kāmā yathābhūtaṁ sammappaññāya sudiṭṭhā honti.	▁puna ▁caparaṃ ▁āvuso ▁khīṇāsav assa ▁bhikkhuno ▁ aṃ gār a kās ūpam ā ▁kām ā ▁yathābhūtaṃ ▁samma ppa ññ āya ▁su diṭṭh ā ▁honti
PA_dn_34:1.8.62	Yaṁpāvuso …pe… ‘khīṇā me āsavā’ti.	▁yaṃ p āvuso ▁pe ▁khīṇā ▁me ▁āsav āti
PA_dn_34:1.8.63	Puna caparaṁ, āvuso, khīṇāsavassa bhikkhuno vivekaninnaṁ cittaṁ hoti vivekapoṇaṁ vivekapabbhāraṁ vivekaṭṭhaṁ nekkhammābhirataṁ byantībhūtaṁ sabbaso āsavaṭṭhāniyehi dhammehi.	▁puna ▁caparaṃ ▁āvuso ▁khīṇāsav assa ▁bhikkhuno ▁vivek a ninn aṃ ▁cittaṃ ▁hoti ▁vivek ap o ṇ aṃ ▁vivek a pabbhār aṃ ▁vivek aṭṭh aṃ ▁nekkhamm ābhi rat aṃ ▁b yant ī bhūt aṃ ▁sabbaso ▁āsav aṭṭhān iy ehi ▁dhammehi
PA_dn_34:1.8.64	Yaṁpāvuso …pe… ‘khīṇā me āsavā’ti.	▁yaṃ p āvuso ▁pe ▁khīṇā ▁me ▁āsav āti
PA_dn_34:1.8.65	Puna caparaṁ, āvuso, khīṇāsavassa bhikkhuno cattāro satipaṭṭhānā bhāvitā honti subhāvitā.	▁puna ▁caparaṃ ▁āvuso ▁khīṇāsav assa ▁bhikkhuno ▁cattāro ▁satipaṭṭhān ā ▁bhāvit ā ▁honti ▁su bhāv itā
PA_dn_34:1.8.66	Yaṁpāvuso …pe… ‘khīṇā me āsavā’ti.	▁yaṃ p āvuso ▁pe ▁khīṇā ▁me ▁āsav āti
PA_dn_34:1.8.67	Puna caparaṁ, āvuso, khīṇāsavassa bhikkhuno pañcindriyāni bhāvitāni honti subhāvitāni.	▁puna ▁caparaṃ ▁āvuso ▁khīṇāsav assa ▁bhikkhuno ▁pañc indriy āni ▁bhāvit āni ▁honti ▁su bhāv it āni
PA_dn_34:1.8.68	Yaṁpāvuso …pe… ‘khīṇā me āsavā’ti.	▁yaṃ p āvuso ▁pe ▁khīṇā ▁me ▁āsav āti
PA_dn_34:1.8.69	Puna caparaṁ, āvuso, khīṇāsavassa bhikkhuno satta bojjhaṅgā bhāvitā honti subhāvitā.	▁puna ▁caparaṃ ▁āvuso ▁khīṇāsav assa ▁bhikkhuno ▁satta ▁bojjhaṃg ā ▁bhāvit ā ▁honti ▁su bhāv itā
PA_dn_34:1.8.70	Yaṁpāvuso …pe… ‘khīṇā me āsavā’ti.	▁yaṃ p āvuso ▁pe ▁khīṇā ▁me ▁āsav āti
PA_dn_34:1.8.71	Puna caparaṁ, āvuso, khīṇāsavassa bhikkhuno ariyo aṭṭhaṅgiko maggo bhāvito hoti subhāvito.	▁puna ▁caparaṃ ▁āvuso ▁khīṇāsav assa ▁bhikkhuno ▁ariy o ▁aṭṭhaṃgik o ▁maggo ▁bhāvit o ▁hoti ▁su bhāv ito
