segmentnr	original	analyzed
PA_dn_34:0.1	Dīgha Nikāya 34	▁dīgh a ▁nikāya
PA_dn_34:0.2	Dasuttarasutta	▁ das uttar asutta
PA_dn_34:1.1.1	Evaṁ me sutaṁ—	▁evaṃ ▁me ▁sut aṃ
PA_dn_34:1.1.2	ekaṁ samayaṁ bhagavā campāyaṁ viharati gaggarāya pokkharaṇiyā tīre mahatā bhikkhusaṅghena saddhiṁ pañcamattehi bhikkhusatehi.	▁ekaṃ ▁samay aṃ ▁bhagavā ▁ca m pāy aṃ ▁viharati ▁ga gg a r āya ▁ pokkharaṇi yā ▁ tī re ▁mah atā ▁bhikkhusaṃgh ena ▁saddhiṃ ▁pañca matt ehi ▁bhikkhu sat ehi
PA_dn_34:1.1.3	Tatra kho āyasmā sāriputto bhikkhū āmantesi:	▁tatra ▁kho ▁āyasmā ▁sāriputto ▁bhikkhū ▁āmantesi
PA_dn_34:1.1.4	“āvuso bhikkhave”ti.	▁āvuso ▁bhikkhave ti
PA_dn_34:1.1.5	“Āvuso”ti kho te bhikkhū āyasmato sāriputtassa paccassosuṁ.	▁āvuso ti ▁kho ▁te ▁bhikkhū ▁āyasmato ▁sāriputta ssa ▁pacc ass o su ṃ
PA_dn_34:1.1.6	Āyasmā sāriputto etadavoca:	▁āyasmā ▁sāriputto ▁etadavoca
PA_dn_34:1.1.7	“Dasuttaraṁ pavakkhāmi,	▁d asutta raṃ ▁pa va kkhā mi
PA_dn_34:1.1.8	dhammaṁ nibbānapattiyā;	▁dhammaṃ ▁nibbān a pattiyā
PA_dn_34:1.1.9	Dukkhassantakiriyāya,	▁dukkh assa nt akiriy āya
PA_dn_34:1.1.10	sabbaganthappamocanaṁ.	▁sabba ganth appa mo c anaṃ
PA_dn_34:1.2.0	1. Eko dhammo	▁eko ▁dhammo
PA_dn_34:1.2.1_0	Eko, āvuso, dhammo bahukāro, eko dhammo bhāvetabbo, eko dhammo pariññeyyo, eko dhammo	▁eko ▁āvuso ▁dhammo ▁bahu kāro ▁eko ▁dhammo ▁bhāvetabb o ▁eko ▁dhammo ▁pari ññ eyyo ▁eko ▁dhammo
PA_dn_34:1.2.1_1	pahātabbo, eko dhammo hānabhāgiyo, eko dhammo visesabhāgiyo, eko dhammo duppaṭivijjho,	▁pahātabb o ▁eko ▁dhammo ▁h āna bhāgiy o ▁eko ▁dhammo ▁vises a bhāgiy o ▁eko ▁dhammo ▁du ppaṭi vijj ho
PA_dn_34:1.2.1_2	eko dhammo uppādetabbo, eko dhammo abhiññeyyo, eko dhammo sacchikātabbo.	▁eko ▁dhammo ▁uppād etabbo ▁eko ▁dhammo ▁abhiññeyy o ▁eko ▁dhammo ▁sa cch ikā tabb o
PA_dn_34:1.2.2	Katamo eko dhammo bahukāro?	▁katamo ▁eko ▁dhammo ▁bahu kāro
PA_dn_34:1.2.3	Appamādo kusalesu dhammesu.	▁appamād o ▁kusal esu ▁dhammesu
PA_dn_34:1.2.4	Ayaṁ eko dhammo bahukāro.	▁ayaṃ ▁eko ▁dhammo ▁bahu kāro
PA_dn_34:1.2.5	Katamo eko dhammo bhāvetabbo?	▁katamo ▁eko ▁dhammo ▁bhāvetabb o
PA_dn_34:1.2.6	Kāyagatāsati sātasahagatā.	▁kāya gat ā sati ▁sā ta sahagatā
PA_dn_34:1.2.7	Ayaṁ eko dhammo bhāvetabbo.	▁ayaṃ ▁eko ▁dhammo ▁bhāvetabb o
PA_dn_34:1.2.8	Katamo eko dhammo pariññeyyo?	▁katamo ▁eko ▁dhammo ▁pari ññ eyyo
PA_dn_34:1.2.9	Phasso sāsavo upādāniyo.	▁phass o ▁s āsav o ▁upādān iyo
PA_dn_34:1.2.10	Ayaṁ eko dhammo pariññeyyo.	▁ayaṃ ▁eko ▁dhammo ▁pari ññ eyyo
PA_dn_34:1.2.11	Katamo eko dhammo pahātabbo?	▁katamo ▁eko ▁dhammo ▁pahātabb o
PA_dn_34:1.2.12	Asmimāno.	▁a smi mān o
PA_dn_34:1.2.13	Ayaṁ eko dhammo pahātabbo.	▁ayaṃ ▁eko ▁dhammo ▁pahātabb o
PA_dn_34:1.2.14	Katamo eko dhammo hānabhāgiyo?	▁katamo ▁eko ▁dhammo ▁h āna bhāgiy o
PA_dn_34:1.2.15	Ayoniso manasikāro.	▁a yo ni so ▁ manasikār o
PA_dn_34:1.2.16	Ayaṁ eko dhammo hānabhāgiyo.	▁ayaṃ ▁eko ▁dhammo ▁h āna bhāgiy o
PA_dn_34:1.2.17	Katamo eko dhammo visesabhāgiyo?	▁katamo ▁eko ▁dhammo ▁vises a bhāgiy o
PA_dn_34:1.2.18	Yoniso manasikāro.	▁yoniso ▁ manasikār o
PA_dn_34:1.2.19	Ayaṁ eko dhammo visesabhāgiyo.	▁ayaṃ ▁eko ▁dhammo ▁vises a bhāgiy o
PA_dn_34:1.2.20	Katamo eko dhammo duppaṭivijjho?	▁katamo ▁eko ▁dhammo ▁du ppaṭi vijj ho
PA_dn_34:1.2.21	Ānantariko cetosamādhi.	▁ ā nantar iko ▁cet o samādhi
PA_dn_34:1.2.22	Ayaṁ eko dhammo duppaṭivijjho.	▁ayaṃ ▁eko ▁dhammo ▁du ppaṭi vijj ho
PA_dn_34:1.2.23	Katamo eko dhammo uppādetabbo?	▁katamo ▁eko ▁dhammo ▁uppād etabbo
PA_dn_34:1.2.24	Akuppaṁ ñāṇaṁ.	▁a ku pp aṃ ▁ñāṇaṃ
PA_dn_34:1.2.25	Ayaṁ eko dhammo uppādetabbo.	▁ayaṃ ▁eko ▁dhammo ▁uppād etabbo
PA_dn_34:1.2.26	Katamo eko dhammo abhiññeyyo?	▁katamo ▁eko ▁dhammo ▁abhiññeyy o
PA_dn_34:1.2.27	Sabbe sattā āhāraṭṭhitikā.	▁sabbe ▁sattā ▁āhār aṭṭhiti kā
PA_dn_34:1.2.28	Ayaṁ eko dhammo abhiññeyyo.	▁ayaṃ ▁eko ▁dhammo ▁abhiññeyy o
PA_dn_34:1.2.29	Katamo eko dhammo sacchikātabbo?	▁katamo ▁eko ▁dhammo ▁sa cch ikā tabb o
PA_dn_34:1.2.30	Akuppā cetovimutti.	▁a ku pp ā ▁cetovimutti
PA_dn_34:1.2.31	Ayaṁ eko dhammo sacchikātabbo.	▁ayaṃ ▁eko ▁dhammo ▁sa cch ikā tabb o
PA_dn_34:1.2.32	Iti ime dasa dhammā bhūtā tacchā tathā avitathā anaññathā sammā tathāgatena abhisambuddhā.	▁iti ▁ime ▁dasa ▁dhammā ▁bhūt ā ▁ta cchā ▁tathā ▁avi ta thā ▁anaññ a thā ▁sammā ▁tathāgat ena ▁abhisambuddh ā
PA_dn_34:1.3.0	2. Dve dhammā	▁dve ▁dhammā
PA_dn_34:1.3.1_0	Dve dhammā bahukārā, dve dhammā bhāvetabbā, dve dhammā pariññeyyā, dve dhammā pahātabbā,	▁dve ▁dhammā ▁bahu kār ā ▁dve ▁dhammā ▁bhāvetabb ā ▁dve ▁dhammā ▁pari ññ eyyā ▁dve ▁dhammā ▁pahātabb ā
PA_dn_34:1.3.1_1	dve dhammā hānabhāgiyā, dve dhammā visesabhāgiyā, dve dhammā duppaṭivijjhā, dve dhammā	▁dve ▁dhammā ▁h āna bhāgiy ā ▁dve ▁dhammā ▁vises a bhāgiy ā ▁dve ▁dhammā ▁du ppaṭi vijj hā ▁dve ▁dhammā
PA_dn_34:1.3.1_2	uppādetabbā, dve dhammā abhiññeyyā, dve dhammā sacchikātabbā.	▁uppād etabbā ▁dve ▁dhammā ▁abhiññeyy ā ▁dve ▁dhammā ▁sa cch ikā tabb ā
PA_dn_34:1.3.2	Katame dve dhammā bahukārā?	▁katame ▁dve ▁dhammā ▁bahu kār ā
PA_dn_34:1.3.3	Sati ca sampajaññañca.	▁sati ▁ca ▁ sampajaññ añca
PA_dn_34:1.3.4	Ime dve dhammā bahukārā.	▁ime ▁dve ▁dhammā ▁bahu kār ā
PA_dn_34:1.3.5	Katame dve dhammā bhāvetabbā?	▁katame ▁dve ▁dhammā ▁bhāvetabb ā
PA_dn_34:1.3.6	Samatho ca vipassanā ca.	▁samath o ▁ca ▁vipassanā ▁ca
PA_dn_34:1.3.7	Ime dve dhammā bhāvetabbā.	▁ime ▁dve ▁dhammā ▁bhāvetabb ā
PA_dn_34:1.3.8	Katame dve dhammā pariññeyyā?	▁katame ▁dve ▁dhammā ▁pari ññ eyyā
PA_dn_34:1.3.9	Nāmañca rūpañca.	▁nāma ñca ▁rūp añca
PA_dn_34:1.3.10	Ime dve dhammā pariññeyyā.	▁ime ▁dve ▁dhammā ▁pari ññ eyyā
PA_dn_34:1.3.11	Katame dve dhammā pahātabbā?	▁katame ▁dve ▁dhammā ▁pahātabb ā
PA_dn_34:1.3.12	Avijjā ca bhavataṇhā ca.	▁avijjā ▁ca ▁bhav ataṇhā ▁ca
PA_dn_34:1.3.13	Ime dve dhammā pahātabbā.	▁ime ▁dve ▁dhammā ▁pahātabb ā
PA_dn_34:1.3.14	Katame dve dhammā hānabhāgiyā?	▁katame ▁dve ▁dhammā ▁h āna bhāgiy ā
PA_dn_34:1.3.15	Dovacassatā ca pāpamittatā ca.	▁d ova c assa tā ▁ca ▁pāp a mi tt atā ▁ca
PA_dn_34:1.3.16	Ime dve dhammā hānabhāgiyā.	▁ime ▁dve ▁dhammā ▁h āna bhāgiy ā
PA_dn_34:1.3.17	Katame dve dhammā visesabhāgiyā?	▁katame ▁dve ▁dhammā ▁vises a bhāgiy ā
PA_dn_34:1.3.18	Sovacassatā ca kalyāṇamittatā ca.	▁so va c assa tā ▁ca ▁kalyāṇamitt atā ▁ca
PA_dn_34:1.3.19	Ime dve dhammā visesabhāgiyā.	▁ime ▁dve ▁dhammā ▁vises a bhāgiy ā
PA_dn_34:1.3.20	Katame dve dhammā duppaṭivijjhā?	▁katame ▁dve ▁dhammā ▁du ppaṭi vijj hā
PA_dn_34:1.3.21	Yo ca hetu yo ca paccayo sattānaṁ saṅkilesāya, yo ca hetu yo ca paccayo sattānaṁ visuddhiyā.	▁yo ▁ca ▁hetu ▁yo ▁ca ▁paccayo ▁sattānaṃ ▁saṃkiles āya ▁yo ▁ca ▁hetu ▁yo ▁ca ▁paccayo ▁sattānaṃ ▁visuddhi yā
PA_dn_34:1.3.22	Ime dve dhammā duppaṭivijjhā.	▁ime ▁dve ▁dhammā ▁du ppaṭi vijj hā
PA_dn_34:1.3.23	Katame dve dhammā uppādetabbā?	▁katame ▁dve ▁dhammā ▁uppād etabbā
PA_dn_34:1.3.24	Dve ñāṇāni—	▁dve ▁ñāṇ āni
PA_dn_34:1.3.25	khaye ñāṇaṁ, anuppāde ñāṇaṁ.	▁khay e ▁ñāṇaṃ ▁anuppād e ▁ñāṇaṃ
PA_dn_34:1.3.26	Ime dve dhammā uppādetabbā.	▁ime ▁dve ▁dhammā ▁uppād etabbā
PA_dn_34:1.3.27	Katame dve dhammā abhiññeyyā?	▁katame ▁dve ▁dhammā ▁abhiññeyy ā
PA_dn_34:1.3.28	Dve dhātuyo—	▁dve ▁dhātuyo
PA_dn_34:1.3.29	saṅkhatā ca dhātu asaṅkhatā ca dhātu.	▁saṃkh atā ▁ca ▁dhātu ▁asaṃkhat ā ▁ca ▁dhātu
PA_dn_34:1.3.30	Ime dve dhammā abhiññeyyā.	▁ime ▁dve ▁dhammā ▁abhiññeyy ā
PA_dn_34:1.3.31	Katame dve dhammā sacchikātabbā?	▁katame ▁dve ▁dhammā ▁sa cch ikā tabb ā
PA_dn_34:1.3.32	Vijjā ca vimutti ca.	▁vijjā ▁ca ▁vimutti ▁ca
PA_dn_34:1.3.33	Ime dve dhammā sacchikātabbā.	▁ime ▁dve ▁dhammā ▁sa cch ikā tabb ā
PA_dn_34:1.3.34	Iti ime vīsati dhammā bhūtā tacchā tathā avitathā anaññathā sammā tathāgatena abhisambuddhā.	▁iti ▁ime ▁ vīsati ▁dhammā ▁bhūt ā ▁ta cchā ▁tathā ▁avi ta thā ▁anaññ a thā ▁sammā ▁tathāgat ena ▁abhisambuddh ā
PA_dn_34:1.4.0	3. Tayo dhammā	▁tayo ▁dhammā
PA_dn_34:1.4.1	Tayo dhammā bahukārā, tayo dhammā bhāvetabbā …pe… tayo dhammā sacchikātabbā.	▁tayo ▁dhammā ▁bahu kār ā ▁tayo ▁dhammā ▁bhāvetabb ā ▁pe ▁tayo ▁dhammā ▁sa cch ikā tabb ā
PA_dn_34:1.4.2	Katame tayo dhammā bahukārā?	▁katame ▁tayo ▁dhammā ▁bahu kār ā
PA_dn_34:1.4.3	Sappurisasaṁsevo, saddhammassavanaṁ, dhammānudhammappaṭipatti.	▁sappuris asaṃ se vo ▁saddhamma ssa van aṃ ▁dhammā nu dhamm ap paṭipatti
PA_dn_34:1.4.4	Ime tayo dhammā bahukārā.	▁ime ▁tayo ▁dhammā ▁bahu kār ā
PA_dn_34:1.4.5	Katame tayo dhammā bhāvetabbā?	▁katame ▁tayo ▁dhammā ▁bhāvetabb ā
PA_dn_34:1.4.6	Tayo samādhī—	▁tayo ▁samā dhī
PA_dn_34:1.4.7	savitakko savicāro samādhi, avitakko vicāramatto samādhi, avitakko avicāro samādhi.	▁sa vitakk o ▁sa vicār o ▁samādhi ▁a vitakk o ▁vicār amatt o ▁samādhi ▁a vitakk o ▁a vicār o ▁samādhi
PA_dn_34:1.4.8	Ime tayo dhammā bhāvetabbā.	▁ime ▁tayo ▁dhammā ▁bhāvetabb ā
PA_dn_34:1.4.9	Katame tayo dhammā pariññeyyā?	▁katame ▁tayo ▁dhammā ▁pari ññ eyyā
PA_dn_34:1.4.10	Tisso vedanā—	▁tisso ▁vedanā
PA_dn_34:1.4.11	sukhā vedanā, dukkhā vedanā, adukkhamasukhā vedanā.	▁sukh ā ▁vedanā ▁dukkh ā ▁vedanā ▁adukkhamasukh ā ▁vedanā
PA_dn_34:1.4.12	Ime tayo dhammā pariññeyyā.	▁ime ▁tayo ▁dhammā ▁pari ññ eyyā
PA_dn_34:1.4.13	Katame tayo dhammā pahātabbā?	▁katame ▁tayo ▁dhammā ▁pahātabb ā
PA_dn_34:1.4.14	Tisso taṇhā—	▁tisso ▁taṇhā
PA_dn_34:1.4.15	kāmataṇhā, bhavataṇhā, vibhavataṇhā.	▁kām ataṇhā ▁bhav ataṇhā ▁vi bhav ataṇhā
PA_dn_34:1.4.16	Ime tayo dhammā pahātabbā.	▁ime ▁tayo ▁dhammā ▁pahātabb ā
PA_dn_34:1.4.17	Katame tayo dhammā hānabhāgiyā?	▁katame ▁tayo ▁dhammā ▁h āna bhāgiy ā
PA_dn_34:1.4.18	Tīṇi akusalamūlāni—	▁tīṇi ▁akusal amūl āni
PA_dn_34:1.4.19	lobho akusalamūlaṁ, doso akusalamūlaṁ, moho akusalamūlaṁ.	▁lobh o ▁akusal amūl aṃ ▁dos o ▁akusal amūl aṃ ▁moh o ▁akusal amūl aṃ
PA_dn_34:1.4.20	Ime tayo dhammā hānabhāgiyā.	▁ime ▁tayo ▁dhammā ▁h āna bhāgiy ā
PA_dn_34:1.4.21	Katame tayo dhammā visesabhāgiyā?	▁katame ▁tayo ▁dhammā ▁vises a bhāgiy ā
PA_dn_34:1.4.22	Tīṇi kusalamūlāni—	▁tīṇi ▁kusal amūl āni
PA_dn_34:1.4.23	alobho kusalamūlaṁ, adoso kusalamūlaṁ, amoho kusalamūlaṁ.	▁alobh o ▁kusal amūl aṃ ▁ ados o ▁kusal amūl aṃ ▁a moh o ▁kusal amūl aṃ
PA_dn_34:1.4.24	Ime tayo dhammā visesabhāgiyā.	▁ime ▁tayo ▁dhammā ▁vises a bhāgiy ā
PA_dn_34:1.4.25	Katame tayo dhammā duppaṭivijjhā?	▁katame ▁tayo ▁dhammā ▁du ppaṭi vijj hā
PA_dn_34:1.4.26	Tisso nissaraṇiyā dhātuyo—	▁tisso ▁ni ssa ra ṇ iyā ▁dhātuyo
PA_dn_34:1.4.27	kāmānametaṁ nissaraṇaṁ yadidaṁ nekkhammaṁ, rūpānametaṁ nissaraṇaṁ yadidaṁ arūpaṁ, yaṁ kho pana kiñci bhūtaṁ saṅkhataṁ paṭiccasamuppannaṁ, nirodho tassa nissaraṇaṁ.	▁kām ān ametaṃ ▁ni ssa raṇaṃ ▁yadidaṃ ▁nekkhamm aṃ ▁rūp ān ametaṃ ▁ni ssa raṇaṃ ▁yadidaṃ ▁arūp aṃ ▁yaṃ ▁kho ▁pana ▁kiñci ▁bhūt aṃ ▁ saṃkhat aṃ ▁paṭicca sam uppanna ṃ ▁nirodh o ▁tassa ▁ni ssa raṇaṃ
PA_dn_34:1.4.28	Ime tayo dhammā duppaṭivijjhā.	▁ime ▁tayo ▁dhammā ▁du ppaṭi vijj hā
PA_dn_34:1.4.29	Katame tayo dhammā uppādetabbā?	▁katame ▁tayo ▁dhammā ▁uppād etabbā
PA_dn_34:1.4.30	Tīṇi ñāṇāni—	▁tīṇi ▁ñāṇ āni
PA_dn_34:1.4.31	atītaṁse ñāṇaṁ, anāgataṁse ñāṇaṁ, paccuppannaṁse ñāṇaṁ.	▁atīt aṃ se ▁ñāṇaṃ ▁anāgat aṃ se ▁ñāṇaṃ ▁paccuppann aṃ se ▁ñāṇaṃ
PA_dn_34:1.4.32	Ime tayo dhammā uppādetabbā.	▁ime ▁tayo ▁dhammā ▁uppād etabbā
PA_dn_34:1.4.33	Katame tayo dhammā abhiññeyyā?	▁katame ▁tayo ▁dhammā ▁abhiññeyy ā
PA_dn_34:1.4.34	Tisso dhātuyo—	▁tisso ▁dhātuyo
PA_dn_34:1.4.35	kāmadhātu, rūpadhātu, arūpadhātu.	▁kām adhātu ▁rūp adhātu ▁arūp adhātu
PA_dn_34:1.4.36	Ime tayo dhammā abhiññeyyā.	▁ime ▁tayo ▁dhammā ▁abhiññeyy ā
PA_dn_34:1.4.37	Katame tayo dhammā sacchikātabbā?	▁katame ▁tayo ▁dhammā ▁sa cch ikā tabb ā
PA_dn_34:1.4.38	Tisso vijjā—	▁tisso ▁vijjā
PA_dn_34:1.4.39	pubbenivāsānussatiñāṇaṁ vijjā, sattānaṁ cutūpapāte ñāṇaṁ vijjā, āsavānaṁ khaye ñāṇaṁ vijjā.	▁pubbenivās ā nussati ñāṇ aṃ ▁vijjā ▁sattānaṃ ▁cut ūpa pāt e ▁ñāṇaṃ ▁vijjā ▁āsav ānaṃ ▁khay e ▁ñāṇaṃ ▁vijjā
PA_dn_34:1.4.40	Ime tayo dhammā sacchikātabbā.	▁ime ▁tayo ▁dhammā ▁sa cch ikā tabb ā
PA_dn_34:1.4.41	Iti ime tiṁsa dhammā bhūtā tacchā tathā avitathā anaññathā sammā tathāgatena abhisambuddhā.	▁iti ▁ime ▁tiṃsa ▁dhammā ▁bhūt ā ▁ta cchā ▁tathā ▁avi ta thā ▁anaññ a thā ▁sammā ▁tathāgat ena ▁abhisambuddh ā
PA_dn_34:1.5.0	4. Cattāro dhammā	▁cattāro ▁dhammā
PA_dn_34:1.5.1	Cattāro dhammā bahukārā, cattāro dhammā bhāvetabbā …pe… cattāro dhammā sacchikātabbā.	▁cattāro ▁dhammā ▁bahu kār ā ▁cattāro ▁dhammā ▁bhāvetabb ā ▁pe ▁cattāro ▁dhammā ▁sa cch ikā tabb ā
PA_dn_34:1.5.2	Katame cattāro dhammā bahukārā?	▁katame ▁cattāro ▁dhammā ▁bahu kār ā
PA_dn_34:1.5.3	Cattāri cakkāni—	▁cattāri ▁ cakk āni
PA_dn_34:1.5.4	patirūpadesavāso, sappurisūpanissayo, attasammāpaṇidhi, pubbe ca katapuññatā.	▁pati rū pades avā so ▁sappuris ūpanissay o ▁atta sam mā pa ṇi dhi ▁pubbe ▁ca ▁kat a puññ atā
PA_dn_34:1.5.5	Ime cattāro dhammā bahukārā.	▁ime ▁cattāro ▁dhammā ▁bahu kār ā
PA_dn_34:1.5.6	Katame cattāro dhammā bhāvetabbā?	▁katame ▁cattāro ▁dhammā ▁bhāvetabb ā
PA_dn_34:1.5.7	Cattāro satipaṭṭhānā—	▁cattāro ▁satipaṭṭhān ā
PA_dn_34:1.5.8	idhāvuso, bhikkhu kāye kāyānupassī viharati ātāpī sampajāno satimā vineyya loke abhijjhādomanassaṁ.	▁idh āvuso ▁bhikkhu ▁kāy e ▁kāy ānupassī ▁viharati ▁ātāp ī ▁sampajāno ▁sati mā ▁vi n eyya ▁loke ▁abhijjhā d o man assa ṃ
PA_dn_34:1.5.9	Vedanāsu …pe…	▁vedanā su ▁pe
PA_dn_34:1.5.10	citte …	▁citt e
PA_dn_34:1.5.11	dhammesu dhammānupassī viharati ātāpī sampajāno satimā vineyya loke abhijjhādomanassaṁ.	▁dhammesu ▁dhamm ānupassī ▁viharati ▁ātāp ī ▁sampajāno ▁sati mā ▁vi n eyya ▁loke ▁abhijjhā d o man assa ṃ
PA_dn_34:1.5.12	Ime cattāro dhammā bhāvetabbā.	▁ime ▁cattāro ▁dhammā ▁bhāvetabb ā
PA_dn_34:1.5.13	Katame cattāro dhammā pariññeyyā?	▁katame ▁cattāro ▁dhammā ▁pari ññ eyyā
PA_dn_34:1.5.14	Cattāro āhārā—	▁cattāro ▁āhār ā
PA_dn_34:1.5.15	kabaḷīkāro āhāro oḷāriko vā sukhumo vā, phasso dutiyo, manosañcetanā tatiyā, viññāṇaṁ catutthaṁ.	▁ka b a ḷ ī kāro ▁āhār o ▁oḷārik o ▁vā ▁sukhum o ▁vā ▁phass o ▁dutiy o ▁mano s añce tan ā ▁tatiy ā ▁viññāṇaṃ ▁catutth aṃ
PA_dn_34:1.5.16	Ime cattāro dhammā pariññeyyā.	▁ime ▁cattāro ▁dhammā ▁pari ññ eyyā
PA_dn_34:1.5.17	Katame cattāro dhammā pahātabbā?	▁katame ▁cattāro ▁dhammā ▁pahātabb ā
PA_dn_34:1.5.18	Cattāro oghā—	▁cattāro ▁ o gh ā
PA_dn_34:1.5.19	kāmogho, bhavogho, diṭṭhogho, avijjogho.	▁kām o gh o ▁bhav o gh o ▁diṭṭh o gh o ▁a vijj o gh o
PA_dn_34:1.5.20	Ime cattāro dhammā pahātabbā.	▁ime ▁cattāro ▁dhammā ▁pahātabb ā
PA_dn_34:1.5.21	Katame cattāro dhammā hānabhāgiyā?	▁katame ▁cattāro ▁dhammā ▁h āna bhāgiy ā
PA_dn_34:1.5.22	Cattāro yogā—	▁cattāro ▁yog ā
PA_dn_34:1.5.23	kāmayogo, bhavayogo, diṭṭhiyogo, avijjāyogo.	▁kām a yog o ▁bhav a yog o ▁diṭṭhi yog o ▁avijjā yog o
PA_dn_34:1.5.24	Ime cattāro dhammā hānabhāgiyā.	▁ime ▁cattāro ▁dhammā ▁h āna bhāgiy ā
PA_dn_34:1.5.25	Katame cattāro dhammā visesabhāgiyā?	▁katame ▁cattāro ▁dhammā ▁vises a bhāgiy ā
PA_dn_34:1.5.26	Cattāro visaṁyogā—	▁cattāro ▁vis aṃ yog ā
PA_dn_34:1.5.27	kāmayogavisaṁyogo, bhavayogavisaṁyogo, diṭṭhiyogavisaṁyogo, avijjāyogavisaṁyogo.	▁kām a yog avi saṃ yog o ▁bhav a yog avi saṃ yog o ▁diṭṭhi yog avi saṃ yog o ▁avijjā yog avi saṃ yog o
PA_dn_34:1.5.28	Ime cattāro dhammā visesabhāgiyā.	▁ime ▁cattāro ▁dhammā ▁vises a bhāgiy ā
PA_dn_34:1.5.29	Katame cattāro dhammā duppaṭivijjhā?	▁katame ▁cattāro ▁dhammā ▁du ppaṭi vijj hā
PA_dn_34:1.5.30	Cattāro samādhī—	▁cattāro ▁samā dhī
PA_dn_34:1.5.31	hānabhāgiyo samādhi, ṭhitibhāgiyo samādhi, visesabhāgiyo samādhi, nibbedhabhāgiyo samādhi.	▁h āna bhāgiy o ▁samādhi ▁ṭhit i bhāgiy o ▁samādhi ▁vises a bhāgiy o ▁samādhi ▁nibb e dha bhāgiy o ▁samādhi
PA_dn_34:1.5.32	Ime cattāro dhammā duppaṭivijjhā.	▁ime ▁cattāro ▁dhammā ▁du ppaṭi vijj hā
PA_dn_34:1.5.33	Katame cattāro dhammā uppādetabbā?	▁katame ▁cattāro ▁dhammā ▁uppād etabbā
PA_dn_34:1.5.34	Cattāri ñāṇāni—	▁cattāri ▁ñāṇ āni
PA_dn_34:1.5.35	dhamme ñāṇaṁ, anvaye ñāṇaṁ, pariye ñāṇaṁ, sammutiyā ñāṇaṁ.	▁dhamme ▁ñāṇaṃ ▁an va ye ▁ñāṇaṃ ▁pari ye ▁ñāṇaṃ ▁ sammuti yā ▁ñāṇaṃ
PA_dn_34:1.5.36	Ime cattāro dhammā uppādetabbā.	▁ime ▁cattāro ▁dhammā ▁uppād etabbā
PA_dn_34:1.5.37	Katame cattāro dhammā abhiññeyyā?	▁katame ▁cattāro ▁dhammā ▁abhiññeyy ā
PA_dn_34:1.5.38	Cattāri ariyasaccāni—	▁cattāri ▁ariyasacc āni
PA_dn_34:1.5.39	dukkhaṁ ariyasaccaṁ, dukkhasamudayaṁ ariyasaccaṁ, dukkhanirodhaṁ ariyasaccaṁ, dukkhanirodhagāminī paṭipadā ariyasaccaṁ.	▁dukkhaṃ ▁ariyasacc aṃ ▁dukkhasamuday aṃ ▁ariyasacc aṃ ▁dukkh anirodh aṃ ▁ariyasacc aṃ ▁dukkh anirodh agām inī ▁paṭipadā ▁ariyasacc aṃ
PA_dn_34:1.5.40	Ime cattāro dhammā abhiññeyyā.	▁ime ▁cattāro ▁dhammā ▁abhiññeyy ā
PA_dn_34:1.5.41	Katame cattāro dhammā sacchikātabbā?	▁katame ▁cattāro ▁dhammā ▁sa cch ikā tabb ā
PA_dn_34:1.5.42	Cattāri sāmaññaphalāni—	▁cattāri ▁sāmaññ aphal āni
PA_dn_34:1.5.43	sotāpattiphalaṁ, sakadāgāmiphalaṁ, anāgāmiphalaṁ, arahattaphalaṁ.	▁sotāpattiphal aṃ ▁sakadāgāmi phal aṃ ▁anā gāmi phal aṃ ▁arahattaphal aṃ
PA_dn_34:1.5.44	Ime cattāro dhammā sacchikātabbā.	▁ime ▁cattāro ▁dhammā ▁sa cch ikā tabb ā
PA_dn_34:1.5.45	Iti ime cattārīsadhammā bhūtā tacchā tathā avitathā anaññathā sammā tathāgatena abhisambuddhā.	▁iti ▁ime ▁ca ttā rī s adhammā ▁bhūt ā ▁ta cchā ▁tathā ▁avi ta thā ▁anaññ a thā ▁sammā ▁tathāgat ena ▁abhisambuddh ā
PA_dn_34:1.6.0	5. Pañca dhammā	▁pañca ▁dhammā
PA_dn_34:1.6.1	Pañca dhammā bahukārā …pe… pañca dhammā sacchikātabbā.	▁pañca ▁dhammā ▁bahu kār ā ▁pe ▁pañca ▁dhammā ▁sa cch ikā tabb ā
PA_dn_34:1.6.2	Katame pañca dhammā bahukārā?	▁katame ▁pañca ▁dhammā ▁bahu kār ā
PA_dn_34:1.6.3	Pañca padhāniyaṅgāni—	▁pañca ▁padhān iyaṃ g āni
PA_dn_34:1.6.4	idhāvuso, bhikkhu saddho hoti, saddahati tathāgatassa bodhiṁ:	▁idh āvuso ▁bhikkhu ▁saddh o ▁hoti ▁saddah ati ▁tathāgatassa ▁bodhi ṃ
PA_dn_34:1.6.5	‘itipi so bhagavā arahaṁ sammāsambuddho vijjācaraṇasampanno sugato lokavidū anuttaro purisadammasārathi satthā devamanussānaṁ buddho bhagavā’ti.	▁iti pi ▁so ▁bhagavā ▁araha ṃ ▁sammāsambuddh o ▁vijjā caraṇ asampanno ▁sugat o ▁loka vidū ▁anuttar o ▁puris a da mma sā rath i ▁satthā ▁devamanuss ānaṃ ▁buddho ▁bhagavā ti
PA_dn_34:1.6.6	Appābādho hoti appātaṅko samavepākiniyā gahaṇiyā samannāgato nātisītāya nāccuṇhāya majjhimāya padhānakkhamāya.	▁app ā bādh o ▁hoti ▁app ā taṃ ko ▁sam ave pāk iniyā ▁gahaṇ iyā ▁samannāgato ▁nā ti sī tāya ▁nā cc uṇh āya ▁majjhim āya ▁padhān akkham āya
PA_dn_34:1.6.7	Asaṭho hoti amāyāvī yathābhūtamattānaṁ āvīkattā satthari vā viññūsu vā sabrahmacārīsu.	▁as a ṭ ho ▁hoti ▁ amā yā vī ▁yathā bhūt amatt ānaṃ ▁ ā vī k attā ▁satthari ▁vā ▁viññū su ▁vā ▁sabrahmacārī su
PA_dn_34:1.6.8	Āraddhavīriyo viharati akusalānaṁ dhammānaṁ pahānāya, kusalānaṁ dhammānaṁ upasampadāya, thāmavā daḷhaparakkamo anikkhittadhuro kusalesu dhammesu.	▁ āraddh avīriy o ▁viharati ▁akusal ānaṃ ▁dhammānaṃ ▁pahān āya ▁kusal ānaṃ ▁dhammānaṃ ▁upasampad āya ▁thām avā ▁daḷh a parakkam o ▁ ani kkhitta dhur o ▁kusal esu ▁dhammesu
PA_dn_34:1.6.9	Paññavā hoti udayatthagāminiyā paññāya samannāgato ariyāya nibbedhikāya sammā dukkhakkhayagāminiyā.	▁paññ avā ▁hoti ▁u day atth agām iniyā ▁paññāya ▁samannāgato ▁ariy āya ▁nibb e dh ikāya ▁sammā ▁dukkh akkhay agām iniyā
PA_dn_34:1.6.10	Ime pañca dhammā bahukārā.	▁ime ▁pañca ▁dhammā ▁bahu kār ā
PA_dn_34:1.6.11	Katame pañca dhammā bhāvetabbā?	▁katame ▁pañca ▁dhammā ▁bhāvetabb ā
PA_dn_34:1.6.12	Pañcaṅgiko sammāsamādhi—	▁pañca ṃg iko ▁sammāsamādhi
PA_dn_34:1.6.13	pītipharaṇatā, sukhapharaṇatā, cetopharaṇatā, ālokapharaṇatā, paccavekkhaṇanimittaṁ.	▁pīti p haraṇ atā ▁sukh ap haraṇ atā ▁cet o p haraṇ atā ▁ālok ap haraṇ atā ▁ paccavekkhaṇ animitt aṃ
PA_dn_34:1.6.14	Ime pañca dhammā bhāvetabbā.	▁ime ▁pañca ▁dhammā ▁bhāvetabb ā
PA_dn_34:1.6.15	Katame pañca dhammā pariññeyyā?	▁katame ▁pañca ▁dhammā ▁pari ññ eyyā
PA_dn_34:1.6.16	Pañcupādānakkhandhā—	▁pañc upādān akkhandh ā
PA_dn_34:1.6.17	rūpupādānakkhandho, vedanupādānakkhandho, saññupādānakkhandho, saṅkhārupādānakkhandho viññāṇupādānakkhandho.	▁rūp upādān akkhandh o ▁ vedan upādān akkhandh o ▁saññ upādān akkhandh o ▁saṃkhār upādān akkhandh o ▁viññāṇ upādān akkhandh o
PA_dn_34:1.6.18	Ime pañca dhammā pariññeyyā.	▁ime ▁pañca ▁dhammā ▁pari ññ eyyā
PA_dn_34:1.6.19	Katame pañca dhammā pahātabbā?	▁katame ▁pañca ▁dhammā ▁pahātabb ā
PA_dn_34:1.6.20	Pañca nīvaraṇāni—	▁pañca ▁nīvaraṇ āni
PA_dn_34:1.6.21	kāmacchandanīvaraṇaṁ, byāpādanīvaraṇaṁ, thinamiddhanīvaraṇaṁ, uddhaccakukkuccanīvaraṇaṁ, vicikicchānīvaraṇaṁ.	▁kāmacchand a nīvaraṇ aṃ ▁byāpād a nīvaraṇ aṃ ▁thinamiddh a nīvaraṇ aṃ ▁ uddh a cca kukku cca nīvaraṇ aṃ ▁vicikicchā nīvaraṇ aṃ
PA_dn_34:1.6.22	Ime pañca dhammā pahātabbā.	▁ime ▁pañca ▁dhammā ▁pahātabb ā
PA_dn_34:1.6.23	Katame pañca dhammā hānabhāgiyā?	▁katame ▁pañca ▁dhammā ▁h āna bhāgiy ā
PA_dn_34:1.6.24	Pañca cetokhilā—	▁pañca ▁cet o khil ā
PA_dn_34:1.6.25	idhāvuso, bhikkhu satthari kaṅkhati vicikicchati nādhimuccati na sampasīdati.	▁idh āvuso ▁bhikkhu ▁satthari ▁ kaṃkh ati ▁ vicikicch ati ▁nā dhi mu cc ati ▁na ▁sampa sī d ati
PA_dn_34:1.6.26	Yo so, āvuso, bhikkhu satthari kaṅkhati vicikicchati nādhimuccati na sampasīdati, tassa cittaṁ na namati ātappāya anuyogāya sātaccāya padhānāya.	▁yo ▁so ▁āvuso ▁bhikkhu ▁satthari ▁ kaṃkh ati ▁ vicikicch ati ▁nā dhi mu cc ati ▁na ▁sampa sī d ati ▁tassa ▁cittaṃ ▁na ▁na mati ▁ ā tapp āya ▁anu yog āya ▁sā ta cc āya ▁padhān āya
PA_dn_34:1.6.27	Yassa cittaṁ na namati ātappāya anuyogāya sātaccāya padhānāya.	▁yassa ▁cittaṃ ▁na ▁na mati ▁ ā tapp āya ▁anu yog āya ▁sā ta cc āya ▁padhān āya
PA_dn_34:1.6.28	Ayaṁ paṭhamo cetokhilo.	▁ayaṃ ▁paṭham o ▁cet o khil o
PA_dn_34:1.6.29	Puna caparaṁ, āvuso, bhikkhu dhamme kaṅkhati vicikicchati …pe…	▁puna ▁caparaṃ ▁āvuso ▁bhikkhu ▁dhamme ▁ kaṃkh ati ▁ vicikicch ati ▁pe
PA_dn_34:1.6.30	saṅghe kaṅkhati vicikicchati …pe…	▁saṃgh e ▁ kaṃkh ati ▁ vicikicch ati ▁pe
PA_dn_34:1.6.31	sikkhāya kaṅkhati vicikicchati …pe…	▁sikkh āya ▁ kaṃkh ati ▁ vicikicch ati ▁pe
PA_dn_34:1.6.32_0	sabrahmacārīsu kupito hoti anattamano āhatacitto khilajāto, yo so, āvuso, bhikkhu	▁sabrahmacārī su ▁kupit o ▁hoti ▁anatt aman o ▁āha t acitt o ▁ khil a jāt o ▁yo ▁so ▁āvuso ▁bhikkhu
