segmentnr	original	analyzed
PA_dn_34:2.1.113	‘uppanno kho me ayaṁ appamattako ābādho ṭhānaṁ kho panetaṁ vijjati, yaṁ me ābādho pavaḍḍheyya, handāhaṁ vīriyaṁ ārabhāmi …pe…	▁uppann o ▁kho ▁me ▁ayaṃ ▁appamatt ako ▁ābādh o ▁ṭhānaṃ ▁kho ▁pa net aṃ ▁vijjati ▁yaṃ ▁me ▁ābādh o ▁pa vaḍḍh eyya ▁ han dā haṃ ▁vīriy aṃ ▁ārabh āmi ▁pe
PA_dn_34:2.1.114	idaṁ sattamaṁ ārambhavatthu.	▁idaṃ ▁sattam aṃ ▁ ārambh avatthu
PA_dn_34:2.1.115	Puna caparaṁ, āvuso, bhikkhu gilānā vuṭṭhito hoti aciravuṭṭhito gelaññā.	▁puna ▁caparaṃ ▁āvuso ▁bhikkhu ▁gilān ā ▁vuṭṭhit o ▁hoti ▁acir a vuṭṭh ito ▁ g e la ññā
PA_dn_34:2.1.116	Tassa evaṁ hoti:	▁tassa ▁evaṃ ▁hoti
PA_dn_34:2.1.117_0	‘ahaṁ kho gilānā vuṭṭhito aciravuṭṭhito gelaññā, ṭhānaṁ kho panetaṁ vijjati, yaṁ	▁ahaṃ ▁kho ▁gilān ā ▁vuṭṭhit o ▁acir a vuṭṭh ito ▁ g e la ññā ▁ṭhānaṃ ▁kho ▁pa net aṃ ▁vijjati ▁yaṃ
PA_dn_34:2.1.117_1	me ābādho paccudāvatteyya, handāhaṁ vīriyaṁ ārabhāmi appattassa pattiyā anadhigatassa	▁me ▁ābādh o ▁pacc ud āva tt eyya ▁ han dā haṃ ▁vīriy aṃ ▁ārabh āmi ▁ appatt assa ▁ pattiyā ▁ana dhi gat assa
PA_dn_34:2.1.117_2	adhigamāya asacchikatassa sacchikiriyāyā’ti.	▁adhigam āya ▁a sacc hi kat assa ▁ sacchikiriy āyāti
PA_dn_34:2.1.118	So vīriyaṁ ārabhati appattassa pattiyā anadhigatassa adhigamāya asacchikatassa sacchikiriyāya.	▁so ▁vīriy aṃ ▁ārabh ati ▁ appatt assa ▁ pattiyā ▁ana dhi gat assa ▁adhigam āya ▁a sacc hi kat assa ▁ sacchikiriy āya
PA_dn_34:2.1.119	Idaṁ aṭṭhamaṁ ārambhavatthu.	▁idaṃ ▁aṭṭham aṃ ▁ ārambh avatthu
PA_dn_34:2.1.120	Ime aṭṭha dhammā visesabhāgiyā.	▁ime ▁aṭṭha ▁dhammā ▁vises a bhāgiy ā
PA_dn_34:2.1.121	Katame aṭṭha dhammā duppaṭivijjhā?	▁katame ▁aṭṭha ▁dhammā ▁du ppaṭi vijj hā
PA_dn_34:2.1.122	Aṭṭha akkhaṇā asamayā brahmacariyavāsāya.	▁aṭṭha ▁a kkhaṇ ā ▁ asamay ā ▁ brahmacariy a vās āya
PA_dn_34:2.1.123	Idhāvuso, tathāgato ca loke uppanno hoti arahaṁ sammāsambuddho, dhammo ca desiyati opasamiko parinibbāniko sambodhagāmī sugatappavedito.	▁idh āvuso ▁tathāgato ▁ca ▁loke ▁uppann o ▁hoti ▁araha ṃ ▁sammāsambuddh o ▁dhammo ▁ca ▁des iy ati ▁ o p asam iko ▁ parinibbān iko ▁sam bodh a gāmī ▁sugat appa ved ito
PA_dn_34:2.1.124	Ayañca puggalo nirayaṁ upapanno hoti.	▁ayañca ▁puggalo ▁niray aṃ ▁upapann o ▁hoti
PA_dn_34:2.1.125	Ayaṁ paṭhamo akkhaṇo asamayo brahmacariyavāsāya.	▁ayaṃ ▁paṭham o ▁a kkhaṇ o ▁ asamay o ▁ brahmacariy a vās āya
PA_dn_34:2.1.126	Puna caparaṁ, āvuso, tathāgato ca loke uppanno hoti arahaṁ sammāsambuddho, dhammo ca desiyati opasamiko parinibbāniko sambodhagāmī sugatappavedito.	▁puna ▁caparaṃ ▁āvuso ▁tathāgato ▁ca ▁loke ▁uppann o ▁hoti ▁araha ṃ ▁sammāsambuddh o ▁dhammo ▁ca ▁des iy ati ▁ o p asam iko ▁ parinibbān iko ▁sam bodh a gāmī ▁sugat appa ved ito
PA_dn_34:2.1.127	Ayañca puggalo tiracchānayoniṁ upapanno hoti.	▁ayañca ▁puggalo ▁ tiracchān a yo ni ṃ ▁upapann o ▁hoti
PA_dn_34:2.1.128	Ayaṁ dutiyo akkhaṇo asamayo brahmacariyavāsāya.	▁ayaṃ ▁dutiy o ▁a kkhaṇ o ▁ asamay o ▁ brahmacariy a vās āya
PA_dn_34:2.1.129	Puna caparaṁ …pe…	▁puna ▁caparaṃ ▁pe
PA_dn_34:2.1.130	pettivisayaṁ upapanno hoti.	▁pe t ti visay aṃ ▁upapann o ▁hoti
PA_dn_34:2.1.131	Ayaṁ tatiyo akkhaṇo asamayo brahmacariyavāsāya.	▁ayaṃ ▁tatiy o ▁a kkhaṇ o ▁ asamay o ▁ brahmacariy a vās āya
PA_dn_34:2.1.132	Puna caparaṁ …pe…	▁puna ▁caparaṃ ▁pe
PA_dn_34:2.1.133	aññataraṁ dīghāyukaṁ devanikāyaṁ upapanno hoti.	▁aññatar aṃ ▁dīgh āyuk aṃ ▁deva nikāy aṃ ▁upapann o ▁hoti
PA_dn_34:2.1.134	Ayaṁ catuttho akkhaṇo asamayo brahmacariyavāsāya.	▁ayaṃ ▁catutth o ▁a kkhaṇ o ▁ asamay o ▁ brahmacariy a vās āya
PA_dn_34:2.1.135	Puna caparaṁ …pe…	▁puna ▁caparaṃ ▁pe
PA_dn_34:2.1.136	paccantimesu janapadesu paccājāto hoti milakkhesu aviññātāresu, yattha natthi gati bhikkhūnaṁ bhikkhunīnaṁ upāsakānaṁ upāsikānaṁ.	▁pacc anti m esu ▁janapad esu ▁pacc ā jāt o ▁hoti ▁mi lakkh esu ▁avi ññā tā r esu ▁yattha ▁natthi ▁gati ▁bhikkhūnaṃ ▁bhikkhunī naṃ ▁upāsakā naṃ ▁u pās ikānaṃ
PA_dn_34:2.1.137	Ayaṁ pañcamo akkhaṇo asamayo brahmacariyavāsāya.	▁ayaṃ ▁pañcam o ▁a kkhaṇ o ▁ asamay o ▁ brahmacariy a vās āya
PA_dn_34:2.1.138	Puna caparaṁ …pe…	▁puna ▁caparaṃ ▁pe
PA_dn_34:2.1.139	ayañca puggalo majjhimesu janapadesu paccājāto hoti, so ca hoti micchādiṭṭhiko viparītadassano:	▁ayañca ▁puggalo ▁majjhim esu ▁janapad esu ▁pacc ā jāt o ▁hoti ▁so ▁ca ▁hoti ▁micchādiṭṭhi ko ▁vi par ī t adassan o
PA_dn_34:2.1.140_0	‘natthi dinnaṁ, natthi yiṭṭhaṁ, natthi hutaṁ, natthi sukatadukkaṭānaṁ kammānaṁ phalaṁ	▁natthi ▁dinn aṃ ▁natthi ▁ yi ṭṭh aṃ ▁natthi ▁ hut aṃ ▁natthi ▁su kat aduk kaṭ ānaṃ ▁kamm ānaṃ ▁phalaṃ
PA_dn_34:2.1.140_1	vipāko, natthi ayaṁ loko, natthi paro loko, natthi mātā, natthi pitā, natthi sattā	▁vipāk o ▁natthi ▁ayaṃ ▁lok o ▁natthi ▁par o ▁lok o ▁natthi ▁mātā ▁natthi ▁pitā ▁natthi ▁sattā
PA_dn_34:2.1.140_2	opapātikā, natthi loke samaṇabrāhmaṇā sammaggatā sammāpaṭipannā ye imañca lokaṁ parañca	▁ o pa pāt ikā ▁natthi ▁loke ▁samaṇabrāhmaṇ ā ▁sam magg atā ▁sammā paṭipann ā ▁ye ▁im añca ▁lok aṃ ▁par añca
PA_dn_34:2.1.140_3	lokaṁ sayaṁ abhiññā sacchikatvā pavedentī’ti.	▁lok aṃ ▁sayaṃ ▁abhiññā ▁sacchikatvā ▁pa ved entīti
PA_dn_34:2.1.141	Ayaṁ chaṭṭho akkhaṇo asamayo brahmacariyavāsāya.	▁ayaṃ ▁chaṭṭh o ▁a kkhaṇ o ▁ asamay o ▁ brahmacariy a vās āya
PA_dn_34:2.1.142	Puna caparaṁ …pe…	▁puna ▁caparaṃ ▁pe
PA_dn_34:2.1.143	ayañca puggalo majjhimesu janapadesu paccājāto hoti, so ca hoti duppañño jaḷo eḷamūgo, nappaṭibalo subhāsitadubbhāsitānamatthamaññātuṁ.	▁ayañca ▁puggalo ▁majjhim esu ▁janapad esu ▁pacc ā jāt o ▁hoti ▁so ▁ca ▁hoti ▁du ppa ññ o ▁ja ḷ o ▁ e ḷ am ū go ▁na ppaṭi bal o ▁subh ā sita dubbh āsi tā nam atth amaññ ā tuṃ
PA_dn_34:2.1.144	Ayaṁ sattamo akkhaṇo asamayo brahmacariyavāsāya.	▁ayaṃ ▁sattam o ▁a kkhaṇ o ▁ asamay o ▁ brahmacariy a vās āya
PA_dn_34:2.1.145	Puna caparaṁ …pe…	▁puna ▁caparaṃ ▁pe
PA_dn_34:2.1.146	ayañca puggalo majjhimesu janapadesu paccājāto hoti, so ca hoti paññavā ajaḷo aneḷamūgo, paṭibalo subhāsitadubbhāsitānamatthamaññātuṁ.	▁ayañca ▁puggalo ▁majjhim esu ▁janapad esu ▁pacc ā jāt o ▁hoti ▁so ▁ca ▁hoti ▁paññ avā ▁a ja ḷ o ▁an e ḷ am ū go ▁paṭi bal o ▁subh ā sita dubbh āsi tā nam atth amaññ ā tuṃ
PA_dn_34:2.1.147	Ayaṁ aṭṭhamo akkhaṇo asamayo brahmacariyavāsāya.	▁ayaṃ ▁aṭṭham o ▁a kkhaṇ o ▁ asamay o ▁ brahmacariy a vās āya
PA_dn_34:2.1.148	Ime aṭṭha dhammā duppaṭivijjhā.	▁ime ▁aṭṭha ▁dhammā ▁du ppaṭi vijj hā
PA_dn_34:2.1.149	Katame aṭṭha dhammā uppādetabbā?	▁katame ▁aṭṭha ▁dhammā ▁uppād etabbā
PA_dn_34:2.1.150	Aṭṭha mahāpurisavitakkā—	▁aṭṭha ▁mahā puris a vitakk ā
PA_dn_34:2.1.151	appicchassāyaṁ dhammo, nāyaṁ dhammo mahicchassa.	▁appicch assā yaṃ ▁dhammo ▁nā yaṃ ▁dhammo ▁mah icch assa
PA_dn_34:2.1.152	Santuṭṭhassāyaṁ dhammo, nāyaṁ dhammo asantuṭṭhassa.	▁ santuṭṭh assā yaṃ ▁dhammo ▁nā yaṃ ▁dhammo ▁a santuṭṭh assa
PA_dn_34:2.1.153	Pavivittassāyaṁ dhammo, nāyaṁ dhammo saṅgaṇikārāmassa.	▁pa vi vi tt assā yaṃ ▁dhammo ▁nā yaṃ ▁dhammo ▁saṃ gaṇ ikā rā m assa
PA_dn_34:2.1.154	Āraddhavīriyassāyaṁ dhammo, nāyaṁ dhammo kusītassa.	▁ āraddh avīriy assā yaṃ ▁dhammo ▁nā yaṃ ▁dhammo ▁ku sī t assa
PA_dn_34:2.1.155	Upaṭṭhitasatissāyaṁ dhammo, nāyaṁ dhammo muṭṭhassatissa.	▁upa ṭṭhit a sati ssā yaṃ ▁dhammo ▁nā yaṃ ▁dhammo ▁mu ṭṭh assa ti ssa
PA_dn_34:2.1.156	Samāhitassāyaṁ dhammo, nāyaṁ dhammo asamāhitassa.	▁samāhit assā yaṃ ▁dhammo ▁nā yaṃ ▁dhammo ▁ asamā hita ssa
PA_dn_34:2.1.157	Paññavato ayaṁ dhammo, nāyaṁ dhammo duppaññassa.	▁paññ avat o ▁ayaṃ ▁dhammo ▁nā yaṃ ▁dhammo ▁du ppa ññ assa
PA_dn_34:2.1.158	Nippapañcassāyaṁ dhammo, nāyaṁ dhammo papañcārāmassāti ime aṭṭha dhammā uppādetabbā.	▁ni ppa pañc assā yaṃ ▁dhammo ▁nā yaṃ ▁dhammo ▁pa pañc ārām assāti ▁ime ▁aṭṭha ▁dhammā ▁uppād etabbā
PA_dn_34:2.1.159	Katame aṭṭha dhammā abhiññeyyā?	▁katame ▁aṭṭha ▁dhammā ▁abhiññeyy ā
PA_dn_34:2.1.160	Aṭṭha abhibhāyatanāni—	▁aṭṭha ▁abhi bh āyatan āni
PA_dn_34:2.1.161	ajjhattaṁ rūpasaññī eko bahiddhā rūpāni passati parittāni suvaṇṇadubbaṇṇāni, ‘tāni abhibhuyya jānāmi passāmī’ti—	▁ajjhattaṃ ▁rūp asaññī ▁eko ▁bahiddhā ▁rūp āni ▁passati ▁paritt āni ▁suvaṇṇa du bb a ṇ ṇ āni ▁tāni ▁abhi bhu yy a ▁jānāmi ▁pass āmīti
PA_dn_34:2.1.162	evaṁsaññī hoti.	▁evaṃ saññī ▁hoti
PA_dn_34:2.1.163	Idaṁ paṭhamaṁ abhibhāyatanaṁ.	▁idaṃ ▁paṭhamaṃ ▁abhi bh āyatanaṃ
PA_dn_34:2.1.164	Ajjhattaṁ rūpasaññī eko bahiddhā rūpāni passati appamāṇāni suvaṇṇadubbaṇṇāni, ‘tāni abhibhuyya jānāmi passāmī’ti—	▁ajjhattaṃ ▁rūp asaññī ▁eko ▁bahiddhā ▁rūp āni ▁passati ▁ appamāṇ āni ▁suvaṇṇa du bb a ṇ ṇ āni ▁tāni ▁abhi bhu yy a ▁jānāmi ▁pass āmīti
PA_dn_34:2.1.165	evaṁsaññī hoti.	▁evaṃ saññī ▁hoti
PA_dn_34:2.1.166	Idaṁ dutiyaṁ abhibhāyatanaṁ.	▁idaṃ ▁dutiy aṃ ▁abhi bh āyatanaṃ
PA_dn_34:2.1.167	Ajjhattaṁ arūpasaññī eko bahiddhā rūpāni passati parittāni suvaṇṇadubbaṇṇāni, ‘tāni abhibhuyya jānāmi passāmī’ti—	▁ajjhattaṃ ▁arūp asaññī ▁eko ▁bahiddhā ▁rūp āni ▁passati ▁paritt āni ▁suvaṇṇa du bb a ṇ ṇ āni ▁tāni ▁abhi bhu yy a ▁jānāmi ▁pass āmīti
PA_dn_34:2.1.168	evaṁsaññī hoti.	▁evaṃ saññī ▁hoti
PA_dn_34:2.1.169	Idaṁ tatiyaṁ abhibhāyatanaṁ.	▁idaṃ ▁tatiy aṃ ▁abhi bh āyatanaṃ
PA_dn_34:2.1.170	Ajjhattaṁ arūpasaññī eko bahiddhā rūpāni passati appamāṇāni suvaṇṇadubbaṇṇāni, ‘tāni abhibhuyya jānāmi passāmī’ti—	▁ajjhattaṃ ▁arūp asaññī ▁eko ▁bahiddhā ▁rūp āni ▁passati ▁ appamāṇ āni ▁suvaṇṇa du bb a ṇ ṇ āni ▁tāni ▁abhi bhu yy a ▁jānāmi ▁pass āmīti
PA_dn_34:2.1.171	evaṁsaññī hoti.	▁evaṃ saññī ▁hoti
PA_dn_34:2.1.172	Idaṁ catutthaṁ abhibhāyatanaṁ.	▁idaṃ ▁catutth aṃ ▁abhi bh āyatanaṃ
PA_dn_34:2.1.173	Ajjhattaṁ arūpasaññī eko bahiddhā rūpāni passati nīlāni nīlavaṇṇāni nīlanidassanāni nīlanibhāsāni.	▁ajjhattaṃ ▁arūp asaññī ▁eko ▁bahiddhā ▁rūp āni ▁passati ▁nīl āni ▁nīl avaṇṇ āni ▁nīl a nidassan āni ▁nīl ani bhās āni
PA_dn_34:2.1.174_0	Seyyathāpi nāma umāpupphaṁ nīlaṁ nīlavaṇṇaṁ nīlanidassanaṁ nīlanibhāsaṁ, seyyathā	▁seyyathāpi ▁nāma ▁u mā pupph aṃ ▁nīl aṃ ▁nīl avaṇṇ aṃ ▁nīl a nidassan aṃ ▁nīl ani bhās aṃ ▁seyy a thā
PA_dn_34:2.1.174_1	vā pana taṁ vatthaṁ bārāṇaseyyakaṁ ubhatobhāgavimaṭṭhaṁ nīlaṁ nīlavaṇṇaṁ nīlanidassanaṁ nīlanibhāsaṁ;	▁vā ▁pana ▁taṃ ▁vatth aṃ ▁b ā rā ṇ aseyy akaṃ ▁ubhato bhāg avi ma ṭṭh aṃ ▁nīl aṃ ▁nīl avaṇṇ aṃ ▁nīl a nidassan aṃ ▁nīl ani bhās aṃ
PA_dn_34:2.1.175	evameva ajjhattaṁ arūpasaññī eko bahiddhā rūpāni passati nīlāni nīlavaṇṇāni nīlanidassanāni nīlanibhāsāni, ‘tāni abhibhuyya jānāmi passāmī’ti evaṁsaññī hoti.	▁evameva ▁ajjhattaṃ ▁arūp asaññī ▁eko ▁bahiddhā ▁rūp āni ▁passati ▁nīl āni ▁nīl avaṇṇ āni ▁nīl a nidassan āni ▁nīl ani bhās āni ▁tāni ▁abhi bhu yy a ▁jānāmi ▁pass āmīti ▁evaṃ saññī ▁hoti
PA_dn_34:2.1.176	Idaṁ pañcamaṁ abhibhāyatanaṁ.	▁idaṃ ▁pañcam aṃ ▁abhi bh āyatanaṃ
PA_dn_34:2.1.177	Ajjhattaṁ arūpasaññī eko bahiddhā rūpāni passati pītāni pītavaṇṇāni pītanidassanāni pītanibhāsāni.	▁ajjhattaṃ ▁arūp asaññī ▁eko ▁bahiddhā ▁rūp āni ▁passati ▁ pīt āni ▁ pīt avaṇṇ āni ▁ pīt a nidassan āni ▁ pīt ani bhās āni
PA_dn_34:2.1.178_0	Seyyathāpi nāma kaṇikārapupphaṁ pītaṁ pītavaṇṇaṁ pītanidassanaṁ pītanibhāsaṁ, seyyathā	▁seyyathāpi ▁nāma ▁ka ṇi kār apupph aṃ ▁ pīt aṃ ▁ pīt avaṇṇ aṃ ▁ pīt a nidassan aṃ ▁ pīt ani bhās aṃ ▁seyy a thā
PA_dn_34:2.1.178_1	vā pana taṁ vatthaṁ bārāṇaseyyakaṁ ubhatobhāgavimaṭṭhaṁ pītaṁ pītavaṇṇaṁ pītanidassanaṁ pītanibhāsaṁ;	▁vā ▁pana ▁taṃ ▁vatth aṃ ▁b ā rā ṇ aseyy akaṃ ▁ubhato bhāg avi ma ṭṭh aṃ ▁ pīt aṃ ▁ pīt avaṇṇ aṃ ▁ pīt a nidassan aṃ ▁ pīt ani bhās aṃ
PA_dn_34:2.1.179	evameva ajjhattaṁ arūpasaññī eko bahiddhā rūpāni passati pītāni pītavaṇṇāni pītanidassanāni pītanibhāsāni, ‘tāni abhibhuyya jānāmi passāmī’ti evaṁsaññī hoti.	▁evameva ▁ajjhattaṃ ▁arūp asaññī ▁eko ▁bahiddhā ▁rūp āni ▁passati ▁ pīt āni ▁ pīt avaṇṇ āni ▁ pīt a nidassan āni ▁ pīt ani bhās āni ▁tāni ▁abhi bhu yy a ▁jānāmi ▁pass āmīti ▁evaṃ saññī ▁hoti
PA_dn_34:2.1.180	Idaṁ chaṭṭhaṁ abhibhāyatanaṁ.	▁idaṃ ▁chaṭṭh aṃ ▁abhi bh āyatanaṃ
PA_dn_34:2.1.181	Ajjhattaṁ arūpasaññī eko bahiddhā rūpāni passati lohitakāni lohitakavaṇṇāni lohitakanidassanāni lohitakanibhāsāni.	▁ajjhattaṃ ▁arūp asaññī ▁eko ▁bahiddhā ▁rūp āni ▁passati ▁lohita k āni ▁lohita k avaṇṇ āni ▁lohita ka nidassan āni ▁lohita ka ni bhās āni
PA_dn_34:2.1.182_0	Seyyathāpi nāma bandhujīvakapupphaṁ lohitakaṁ lohitakavaṇṇaṁ lohitakanidassanaṁ lohitakanibhāsaṁ,	▁seyyathāpi ▁nāma ▁bandh u jīv ak apupph aṃ ▁lohita kaṃ ▁lohita k avaṇṇ aṃ ▁lohita ka nidassan aṃ ▁lohita ka ni bhās aṃ
PA_dn_34:2.1.182_1	seyyathā vā pana taṁ vatthaṁ bārāṇaseyyakaṁ ubhatobhāgavimaṭṭhaṁ lohitakaṁ lohitakavaṇṇaṁ	▁seyy a thā ▁vā ▁pana ▁taṃ ▁vatth aṃ ▁b ā rā ṇ aseyy akaṃ ▁ubhato bhāg avi ma ṭṭh aṃ ▁lohita kaṃ ▁lohita k avaṇṇ aṃ
PA_dn_34:2.1.182_2	lohitakanidassanaṁ lohitakanibhāsaṁ;	▁lohita ka nidassan aṃ ▁lohita ka ni bhās aṃ
PA_dn_34:2.1.183	evameva ajjhattaṁ arūpasaññī eko bahiddhā rūpāni passati lohitakāni lohitakavaṇṇāni lohitakanidassanāni lohitakanibhāsāni, ‘tāni abhibhuyya jānāmi passāmī’ti evaṁsaññī hoti.	▁evameva ▁ajjhattaṃ ▁arūp asaññī ▁eko ▁bahiddhā ▁rūp āni ▁passati ▁lohita k āni ▁lohita k avaṇṇ āni ▁lohita ka nidassan āni ▁lohita ka ni bhās āni ▁tāni ▁abhi bhu yy a ▁jānāmi ▁pass āmīti ▁evaṃ saññī ▁hoti
PA_dn_34:2.1.184	Idaṁ sattamaṁ abhibhāyatanaṁ.	▁idaṃ ▁sattam aṃ ▁abhi bh āyatanaṃ
PA_dn_34:2.1.185	Ajjhattaṁ arūpasaññī eko bahiddhā rūpāni passati odātāni odātavaṇṇāni odātanidassanāni odātanibhāsāni.	▁ajjhattaṃ ▁arūp asaññī ▁eko ▁bahiddhā ▁rūp āni ▁passati ▁odāt āni ▁odāt avaṇṇ āni ▁odāt a nidassan āni ▁odāt ani bhās āni
PA_dn_34:2.1.186_0	Seyyathāpi nāma osadhitārakā odātā odātavaṇṇā odātanidassanā odātanibhāsā, seyyathā	▁seyyathāpi ▁nāma ▁ o sa dhi tā ra kā ▁odāt ā ▁odāt avaṇṇ ā ▁odāt a nidassan ā ▁odāt ani bhās ā ▁seyy a thā
PA_dn_34:2.1.186_1	vā pana taṁ vatthaṁ bārāṇaseyyakaṁ ubhatobhāgavimaṭṭhaṁ odātaṁ odātavaṇṇaṁ odātanidassanaṁ odātanibhāsaṁ;	▁vā ▁pana ▁taṃ ▁vatth aṃ ▁b ā rā ṇ aseyy akaṃ ▁ubhato bhāg avi ma ṭṭh aṃ ▁odāt aṃ ▁odāt avaṇṇ aṃ ▁odāt a nidassan aṃ ▁odāt ani bhās aṃ
PA_dn_34:2.1.187	evameva ajjhattaṁ arūpasaññī eko bahiddhā rūpāni passati odātāni odātavaṇṇāni odātanidassanāni odātanibhāsāni, ‘tāni abhibhuyya jānāmi passāmī’ti evaṁsaññī hoti.	▁evameva ▁ajjhattaṃ ▁arūp asaññī ▁eko ▁bahiddhā ▁rūp āni ▁passati ▁odāt āni ▁odāt avaṇṇ āni ▁odāt a nidassan āni ▁odāt ani bhās āni ▁tāni ▁abhi bhu yy a ▁jānāmi ▁pass āmīti ▁evaṃ saññī ▁hoti
PA_dn_34:2.1.188	Idaṁ aṭṭhamaṁ abhibhāyatanaṁ.	▁idaṃ ▁aṭṭham aṃ ▁abhi bh āyatanaṃ
PA_dn_34:2.1.189	Ime aṭṭha dhammā abhiññeyyā.	▁ime ▁aṭṭha ▁dhammā ▁abhiññeyy ā
PA_dn_34:2.1.190	Katame aṭṭha dhammā sacchikātabbā?	▁katame ▁aṭṭha ▁dhammā ▁sa cch ikā tabb ā
PA_dn_34:2.1.191	Aṭṭha vimokkhā—	▁aṭṭha ▁vimokkh ā
PA_dn_34:2.1.192	rūpī rūpāni passati.	▁rūp ī ▁rūp āni ▁passati
PA_dn_34:2.1.193	Ayaṁ paṭhamo vimokkho.	▁ayaṃ ▁paṭham o ▁vimokkh o
PA_dn_34:2.1.194	Ajjhattaṁ arūpasaññī eko bahiddhā rūpāni passati.	▁ajjhattaṃ ▁arūp asaññī ▁eko ▁bahiddhā ▁rūp āni ▁passati
PA_dn_34:2.1.195	Ayaṁ dutiyo vimokkho.	▁ayaṃ ▁dutiy o ▁vimokkh o
PA_dn_34:2.1.196	Subhanteva adhimutto hoti.	▁subh ante va ▁adhi mutt o ▁hoti
PA_dn_34:2.1.197	Ayaṁ tatiyo vimokkho.	▁ayaṃ ▁tatiy o ▁vimokkh o
PA_dn_34:2.1.198	Sabbaso rūpasaññānaṁ samatikkamā paṭighasaññānaṁ atthaṅgamā nānattasaññānaṁ amanasikārā ‘ananto ākāso’ti ākāsānañcāyatanaṁ upasampajja viharati.	▁sabbaso ▁rūp asaññā naṃ ▁sam ati kkam ā ▁paṭi gh asaññā naṃ ▁atthaṃ gam ā ▁ nānatt asaññā naṃ ▁a manasikār ā ▁anant o ▁ākās oti ▁ākāsānañcāyatan aṃ ▁upasampajja ▁viharati
PA_dn_34:2.1.199	Ayaṁ catuttho vimokkho.	▁ayaṃ ▁catutth o ▁vimokkh o
PA_dn_34:2.1.200	Sabbaso ākāsānañcāyatanaṁ samatikkamma ‘anantaṁ viññāṇan’ti viññāṇañcāyatanaṁ upasampajja viharati.	▁sabbaso ▁ākāsānañcāyatan aṃ ▁sam ati kkam ma ▁anant aṃ ▁viññāṇ anti ▁viññāṇañcāyatan aṃ ▁upasampajja ▁viharati
PA_dn_34:2.1.201	Ayaṁ pañcamo vimokkho.	▁ayaṃ ▁pañcam o ▁vimokkh o
PA_dn_34:2.1.202	Sabbaso viññāṇañcāyatanaṁ samatikkamma ‘natthi kiñcī’ti ākiñcaññāyatanaṁ upasampajja viharati.	▁sabbaso ▁viññāṇañcāyatan aṃ ▁sam ati kkam ma ▁natthi ▁ki ñc īti ▁ākiñcaññāyatan aṃ ▁upasampajja ▁viharati
PA_dn_34:2.1.203	Ayaṁ chaṭṭho vimokkho.	▁ayaṃ ▁chaṭṭh o ▁vimokkh o
PA_dn_34:2.1.204	Sabbaso ākiñcaññāyatanaṁ samatikkamma nevasaññānāsaññāyatanaṁ upasampajja viharati.	▁sabbaso ▁ākiñcaññāyatan aṃ ▁sam ati kkam ma ▁nevasaññānāsaññ āyatanaṃ ▁upasampajja ▁viharati
PA_dn_34:2.1.205	Ayaṁ sattamo vimokkho.	▁ayaṃ ▁sattam o ▁vimokkh o
PA_dn_34:2.1.206	Sabbaso nevasaññānāsaññāyatanaṁ samatikkamma saññāvedayitanirodhaṁ upasampajja viharati.	▁sabbaso ▁nevasaññānāsaññ āyatanaṃ ▁sam ati kkam ma ▁saññā ve day it anirodh aṃ ▁upasampajja ▁viharati
PA_dn_34:2.1.207	Ayaṁ aṭṭhamo vimokkho.	▁ayaṃ ▁aṭṭham o ▁vimokkh o
PA_dn_34:2.1.208	Ime aṭṭha dhammā sacchikātabbā.	▁ime ▁aṭṭha ▁dhammā ▁sa cch ikā tabb ā
PA_dn_34:2.1.209	Iti ime asīti dhammā bhūtā tacchā tathā avitathā anaññathā sammā tathāgatena abhisambuddhā.	▁iti ▁ime ▁a sīti ▁dhammā ▁bhūt ā ▁ta cchā ▁tathā ▁avi ta thā ▁anaññ a thā ▁sammā ▁tathāgat ena ▁abhisambuddh ā
PA_dn_34:2.2.0	9. Nava dhammā	▁nava ▁dhammā
PA_dn_34:2.2.1	Nava dhammā bahukārā …pe… nava dhammā sacchikātabbā.	▁nava ▁dhammā ▁bahu kār ā ▁pe ▁nava ▁dhammā ▁sa cch ikā tabb ā
PA_dn_34:2.2.2	Katame nava dhammā bahukārā?	▁katame ▁nava ▁dhammā ▁bahu kār ā
PA_dn_34:2.2.3_0	Nava yonisomanasikāramūlakā dhammā, yonisomanasikaroto pāmojjaṁ jāyati, pamuditassa	▁nava ▁yoniso manasikār amūlak ā ▁dhammā ▁yoniso man asi karo to ▁pāmojj aṃ ▁jā yati ▁pa mud it assa
PA_dn_34:2.2.3_1	pīti jāyati, pītimanassa kāyo passambhati, passaddhakāyo sukhaṁ vedeti, sukhino cittaṁ	▁pīti ▁jā yati ▁pīti man assa ▁kāy o ▁pass am bha ti ▁pass a ddh akāy o ▁sukhaṃ ▁ved eti ▁sukh ino ▁cittaṃ
PA_dn_34:2.2.3_2	samādhiyati, samāhite citte yathābhūtaṁ jānāti passati, yathābhūtaṁ jānaṁ passaṁ	▁samādhi yati ▁samāhit e ▁citt e ▁yathābhūtaṃ ▁jānāti ▁passati ▁yathābhūtaṃ ▁jān aṃ ▁pass aṃ
PA_dn_34:2.2.3_3	nibbindati, nibbindaṁ virajjati, virāgā vimuccati.	▁nibbind ati ▁nibbind aṃ ▁vi rajj ati ▁virāg ā ▁vimucc ati
PA_dn_34:2.2.4	Ime nava dhammā bahukārā.	▁ime ▁nava ▁dhammā ▁bahu kār ā
PA_dn_34:2.2.5	Katame nava dhammā bhāvetabbā?	▁katame ▁nava ▁dhammā ▁bhāvetabb ā
PA_dn_34:2.2.6	Nava pārisuddhipadhāniyaṅgāni—	▁nava ▁ pāri suddhi pa dhān iyaṃ g āni
PA_dn_34:2.2.7_0	sīlavisuddhi pārisuddhipadhāniyaṅgaṁ, cittavisuddhi pārisuddhipadhāniyaṅgaṁ, diṭṭhivisuddhi	▁sīl avi suddhi ▁ pāri suddhi pa dhān iyaṃ g aṃ ▁citta visuddh i ▁ pāri suddhi pa dhān iyaṃ g aṃ ▁diṭṭhi visuddh i
PA_dn_34:2.2.7_1	pārisuddhipadhāniyaṅgaṁ, kaṅkhāvitaraṇavisuddhi pārisuddhipadhāniyaṅgaṁ, maggāmaggañāṇadassanavisuddhi	▁ pāri suddhi pa dhān iyaṃ g aṃ ▁kaṃkhā vi taraṇ avi suddhi ▁ pāri suddhi pa dhān iyaṃ g aṃ ▁magg ā magg añāṇ adassan avi suddhi
PA_dn_34:2.2.7_2	pārisuddhipadhāniyaṅgaṁ, paṭipadāñāṇadassanavisuddhi pārisuddhipadhāniyaṅgaṁ, ñāṇadassanavisuddhi	▁ pāri suddhi pa dhān iyaṃ g aṃ ▁paṭipadā ñāṇ adassan avi suddhi ▁ pāri suddhi pa dhān iyaṃ g aṃ ▁ñāṇ adassan avi suddhi
PA_dn_34:2.2.7_3	pārisuddhipadhāniyaṅgaṁ, paññāvisuddhi pārisuddhipadhāniyaṅgaṁ, vimuttivisuddhi pārisuddhipadhāniyaṅgaṁ.	▁ pāri suddhi pa dhān iyaṃ g aṃ ▁paññā visuddh i ▁ pāri suddhi pa dhān iyaṃ g aṃ ▁vimutti visuddh i ▁ pāri suddhi pa dhān iyaṃ g aṃ
PA_dn_34:2.2.8	Ime nava dhammā bhāvetabbā.	▁ime ▁nava ▁dhammā ▁bhāvetabb ā
PA_dn_34:2.2.9	Katame nava dhammā pariññeyyā?	▁katame ▁nava ▁dhammā ▁pari ññ eyyā
PA_dn_34:2.2.10	Nava sattāvāsā—	▁nava ▁sattā vās ā
PA_dn_34:2.2.11	santāvuso, sattā nānattakāyā nānattasaññino, seyyathāpi manussā ekacce ca devā ekacce ca vinipātikā.	▁sant āvuso ▁sattā ▁ nānatt akāy ā ▁ nānatt asaññino ▁seyyathāpi ▁manussā ▁ekacc e ▁ca ▁dev ā ▁ekacc e ▁ca ▁vi nipāt ikā
PA_dn_34:2.2.12	Ayaṁ paṭhamo sattāvāso.	▁ayaṃ ▁paṭham o ▁sattā vās o
PA_dn_34:2.2.13	Santāvuso, sattā nānattakāyā ekattasaññino, seyyathāpi devā brahmakāyikā paṭhamābhinibbattā.	▁sant āvuso ▁sattā ▁ nānatt akāy ā ▁ekatt asaññino ▁seyyathāpi ▁dev ā ▁brahm akāy ikā ▁paṭham ābhi nibbatt ā
PA_dn_34:2.2.14	Ayaṁ dutiyo sattāvāso.	▁ayaṃ ▁dutiy o ▁sattā vās o
PA_dn_34:2.2.15	Santāvuso, sattā ekattakāyā nānattasaññino, seyyathāpi devā ābhassarā.	▁sant āvuso ▁sattā ▁ekatt akāy ā ▁ nānatt asaññino ▁seyyathāpi ▁dev ā ▁ ā bh assa rā
PA_dn_34:2.2.16	Ayaṁ tatiyo sattāvāso.	▁ayaṃ ▁tatiy o ▁sattā vās o
PA_dn_34:2.2.17	Santāvuso, sattā ekattakāyā ekattasaññino, seyyathāpi devā subhakiṇhā.	▁sant āvuso ▁sattā ▁ekatt akāy ā ▁ekatt asaññino ▁seyyathāpi ▁dev ā ▁subh a ki ṇ hā
PA_dn_34:2.2.18	Ayaṁ catuttho sattāvāso.	▁ayaṃ ▁catutth o ▁sattā vās o
PA_dn_34:2.2.19	Santāvuso, sattā asaññino appaṭisaṁvedino, seyyathāpi devā asaññasattā.	▁sant āvuso ▁sattā ▁ asaññino ▁appaṭi saṃ ved ino ▁seyyathāpi ▁dev ā ▁a saññ as attā
PA_dn_34:2.2.20	Ayaṁ pañcamo sattāvāso.	▁ayaṃ ▁pañcam o ▁sattā vās o
PA_dn_34:2.2.21	Santāvuso, sattā sabbaso rūpasaññānaṁ samatikkamā paṭighasaññānaṁ atthaṅgamā nānattasaññānaṁ amanasikārā ‘ananto ākāso’ti ākāsānañcāyatanūpagā.	▁sant āvuso ▁sattā ▁sabbaso ▁rūp asaññā naṃ ▁sam ati kkam ā ▁paṭi gh asaññā naṃ ▁atthaṃ gam ā ▁ nānatt asaññā naṃ ▁a manasikār ā ▁anant o ▁ākās oti ▁ākāsānañcāyatan ūpag ā
PA_dn_34:2.2.22	Ayaṁ chaṭṭho sattāvāso.	▁ayaṃ ▁chaṭṭh o ▁sattā vās o
PA_dn_34:2.2.23	Santāvuso, sattā sabbaso ākāsānañcāyatanaṁ samatikkamma ‘anantaṁ viññāṇan’ti viññāṇañcāyatanūpagā.	▁sant āvuso ▁sattā ▁sabbaso ▁ākāsānañcāyatan aṃ ▁sam ati kkam ma ▁anant aṃ ▁viññāṇ anti ▁viññāṇañcāyatan ūpag ā
PA_dn_34:2.2.24	Ayaṁ sattamo sattāvāso.	▁ayaṃ ▁sattam o ▁sattā vās o
