segmentnr	original	analyzed
PA_dn_34:1.8.72_0	Yaṁpāvuso, khīṇāsavassa bhikkhuno ariyo aṭṭhaṅgiko maggo bhāvito hoti subhāvito,	▁yaṃ p āvuso ▁khīṇāsav assa ▁bhikkhuno ▁ariy o ▁aṭṭhaṃgik o ▁maggo ▁bhāvit o ▁hoti ▁su bhāv ito
PA_dn_34:1.8.72_1	idampi khīṇāsavassa bhikkhuno balaṁ hoti, yaṁ balaṁ āgamma khīṇāsavo bhikkhu āsavānaṁ khayaṁ paṭijānāti:	▁idam pi ▁khīṇāsav assa ▁bhikkhuno ▁bal aṃ ▁hoti ▁yaṃ ▁bal aṃ ▁āgamma ▁khīṇāsav o ▁bhikkhu ▁āsav ānaṃ ▁khay aṃ ▁paṭijān āti
PA_dn_34:1.8.73	‘khīṇā me āsavā’ti.	▁khīṇā ▁me ▁āsav āti
PA_dn_34:1.8.74	Ime satta dhammā sacchikātabbā.	▁ime ▁satta ▁dhammā ▁sa cch ikā tabb ā
PA_dn_34:1.8.75	Itime sattati dhammā bhūtā tacchā tathā avitathā anaññathā sammā tathāgatena abhisambuddhā.	▁iti me ▁satta ti ▁dhammā ▁bhūt ā ▁ta cchā ▁tathā ▁avi ta thā ▁anaññ a thā ▁sammā ▁tathāgat ena ▁abhisambuddh ā
PA_dn_34:1.8.76	Paṭhamabhāṇavāro niṭṭhito.	▁paṭhama bhā ṇ avāro ▁niṭṭhito
PA_dn_34:2.1.0	8. Aṭṭha dhammā	▁aṭṭha ▁dhammā
PA_dn_34:2.1.1	Aṭṭha dhammā bahukārā …pe… aṭṭha dhammā sacchikātabbā.	▁aṭṭha ▁dhammā ▁bahu kār ā ▁pe ▁aṭṭha ▁dhammā ▁sa cch ikā tabb ā
PA_dn_34:2.1.2	Katame aṭṭha dhammā bahukārā?	▁katame ▁aṭṭha ▁dhammā ▁bahu kār ā
PA_dn_34:2.1.3	Aṭṭha hetū aṭṭha paccayā ādibrahmacariyikāya paññāya appaṭiladdhāya paṭilābhāya paṭiladdhāya bhiyyobhāvāya vepullāya bhāvanāya pāripūriyā saṁvattanti.	▁aṭṭha ▁ hetū ▁aṭṭha ▁paccayā ▁ādi brahmacariy ikāya ▁paññāya ▁appaṭi laddh āya ▁ paṭilābh āya ▁paṭiladdh āya ▁bhiyyo bhāv āya ▁ve pu ll āya ▁bhāvanāya ▁ pāripūri yā ▁saṃvatt anti
PA_dn_34:2.1.4	Katame aṭṭha?	▁katame ▁aṭṭha
PA_dn_34:2.1.5	Idhāvuso, bhikkhu satthāraṁ upanissāya viharati aññataraṁ vā garuṭṭhāniyaṁ sabrahmacāriṁ, yatthassa tibbaṁ hirottappaṁ paccupaṭṭhitaṁ hoti pemañca gāravo ca.	▁idh āvuso ▁bhikkhu ▁satthāraṃ ▁upanissāya ▁viharati ▁aññatar aṃ ▁vā ▁garu ṭṭhān iyaṃ ▁sa brahm acāri ṃ ▁yattha ssa ▁ ti bb aṃ ▁hi ro t tapp aṃ ▁pacc upaṭṭh itaṃ ▁hoti ▁pe m añca ▁ gārav o ▁ca
PA_dn_34:2.1.6	Ayaṁ paṭhamo hetu paṭhamo paccayo ādibrahmacariyikāya paññāya appaṭiladdhāya paṭilābhāya, paṭiladdhāya bhiyyobhāvāya vepullāya bhāvanāya pāripūriyā saṁvattati.	▁ayaṃ ▁paṭham o ▁hetu ▁paṭham o ▁paccayo ▁ādi brahmacariy ikāya ▁paññāya ▁appaṭi laddh āya ▁ paṭilābh āya ▁paṭiladdh āya ▁bhiyyo bhāv āya ▁ve pu ll āya ▁bhāvanāya ▁ pāripūri yā ▁saṃvatt ati
PA_dn_34:2.1.7_0	Taṁ kho pana satthāraṁ upanissāya viharati aññataraṁ vā garuṭṭhāniyaṁ sabrahmacāriṁ,	▁taṃ ▁kho ▁pana ▁satthāraṃ ▁upanissāya ▁viharati ▁aññatar aṃ ▁vā ▁garu ṭṭhān iyaṃ ▁sa brahm acāri ṃ
PA_dn_34:2.1.7_1	yatthassa tibbaṁ hirottappaṁ paccupaṭṭhitaṁ hoti pemañca gāravo ca. Te kālena kālaṁ	▁yattha ssa ▁ ti bb aṃ ▁hi ro t tapp aṃ ▁pacc upaṭṭh itaṃ ▁hoti ▁pe m añca ▁ gārav o ▁ca ▁te ▁kāl ena ▁kālaṃ
PA_dn_34:2.1.7_2	upasaṅkamitvā paripucchati paripañhati:	▁upasaṃkamitvā ▁pari pucch ati ▁pari pañh ati
PA_dn_34:2.1.8	‘idaṁ, bhante, kathaṁ?	▁idaṃ ▁bhante ▁kathaṃ
PA_dn_34:2.1.9	Imassa ko attho’ti?	▁imassa ▁ko ▁attho ti
PA_dn_34:2.1.10	Tassa te āyasmanto avivaṭañceva vivaranti, anuttānīkatañca uttānīkaronti, anekavihitesu ca kaṅkhāṭṭhāniyesu dhammesu kaṅkhaṁ paṭivinodenti.	▁tassa ▁te ▁āyasmant o ▁avi va ṭ añceva ▁vivar anti ▁anu ttā nī kat añca ▁uttān ī karo nti ▁aneka vihit esu ▁ca ▁kaṃkhā ṭṭhān iy esu ▁dhammesu ▁ kaṃkh aṃ ▁paṭi vi no d enti
PA_dn_34:2.1.11	Ayaṁ dutiyo hetu dutiyo paccayo ādibrahmacariyikāya paññāya appaṭiladdhāya paṭilābhāya, paṭiladdhāya bhiyyobhāvāya, vepullāya bhāvanāya pāripūriyā saṁvattati.	▁ayaṃ ▁dutiy o ▁hetu ▁dutiy o ▁paccayo ▁ādi brahmacariy ikāya ▁paññāya ▁appaṭi laddh āya ▁ paṭilābh āya ▁paṭiladdh āya ▁bhiyyo bhāv āya ▁ve pu ll āya ▁bhāvanāya ▁ pāripūri yā ▁saṃvatt ati
PA_dn_34:2.1.12	Taṁ kho pana dhammaṁ sutvā dvayena vūpakāsena sampādeti—kāyavūpakāsena ca cittavūpakāsena ca.	▁taṃ ▁kho ▁pana ▁dhammaṃ ▁sutvā ▁ dvay ena ▁v ūpa kās ena ▁sampād eti kāya v ūpa kās ena ▁ca ▁citta v ūpa kās ena ▁ca
PA_dn_34:2.1.13	Ayaṁ tatiyo hetu tatiyo paccayo ādibrahmacariyikāya paññāya appaṭiladdhāya paṭilābhāya, paṭiladdhāya bhiyyobhāvāya vepullāya bhāvanāya pāripūriyā saṁvattati.	▁ayaṃ ▁tatiy o ▁hetu ▁tatiy o ▁paccayo ▁ādi brahmacariy ikāya ▁paññāya ▁appaṭi laddh āya ▁ paṭilābh āya ▁paṭiladdh āya ▁bhiyyo bhāv āya ▁ve pu ll āya ▁bhāvanāya ▁ pāripūri yā ▁saṃvatt ati
PA_dn_34:2.1.14	Puna caparaṁ, āvuso, bhikkhu sīlavā hoti, pātimokkhasaṁvarasaṁvuto viharati ācāragocarasampanno, aṇumattesu vajjesu bhayadassāvī samādāya sikkhati sikkhāpadesu.	▁puna ▁caparaṃ ▁āvuso ▁bhikkhu ▁sīl avā ▁hoti ▁pātimokkh a saṃvar asaṃ vut o ▁viharati ▁ ācār a gocar asampanno ▁a ṇu matt esu ▁vajj esu ▁bhay a d assā vī ▁samā d āya ▁sikkh ati ▁ sikkhāpade su
PA_dn_34:2.1.15	Ayaṁ catuttho hetu catuttho paccayo ādibrahmacariyikāya paññāya appaṭiladdhāya paṭilābhāya, paṭiladdhāya bhiyyobhāvāya vepullāya bhāvanāya pāripūriyā saṁvattati.	▁ayaṃ ▁catutth o ▁hetu ▁catutth o ▁paccayo ▁ādi brahmacariy ikāya ▁paññāya ▁appaṭi laddh āya ▁ paṭilābh āya ▁paṭiladdh āya ▁bhiyyo bhāv āya ▁ve pu ll āya ▁bhāvanāya ▁ pāripūri yā ▁saṃvatt ati
PA_dn_34:2.1.16_0	Puna caparaṁ, āvuso, bhikkhu bahussuto hoti sutadharo sutasannicayo. Ye te dhammā	▁puna ▁caparaṃ ▁āvuso ▁bhikkhu ▁bahussut o ▁hoti ▁sut a dhar o ▁sut a san ni ca yo ▁ye ▁te ▁dhammā
PA_dn_34:2.1.16_1	ādikalyāṇā majjhekalyāṇā pariyosānakalyāṇā sātthā sabyañjanā kevalaparipuṇṇaṁ parisuddhaṁ	▁ādi kalyāṇ ā ▁majjhe kalyāṇ ā ▁ pariyosān a kalyāṇ ā ▁sā tth ā ▁sa byañjan ā ▁keval a paripuṇṇ aṃ ▁parisuddh aṃ
PA_dn_34:2.1.16_2	brahmacariyaṁ abhivadanti, tathārūpāssa dhammā bahussutā honti dhātā vacasā paricitā	▁brahmacariyaṃ ▁abhi va d anti ▁tathārūp ā ssa ▁dhammā ▁bahussut ā ▁honti ▁dhāt ā ▁va ca sā ▁pari cit ā
PA_dn_34:2.1.16_3	manasānupekkhitā diṭṭhiyā suppaṭividdhā.	▁manasā nu pekkh itā ▁diṭṭhi yā ▁su ppaṭi viddh ā
PA_dn_34:2.1.17	Ayaṁ pañcamo hetu pañcamo paccayo ādibrahmacariyikāya paññāya appaṭiladdhāya paṭilābhāya, paṭiladdhāya bhiyyobhāvāya vepullāya bhāvanāya pāripūriyā saṁvattati.	▁ayaṃ ▁pañcam o ▁hetu ▁pañcam o ▁paccayo ▁ādi brahmacariy ikāya ▁paññāya ▁appaṭi laddh āya ▁ paṭilābh āya ▁paṭiladdh āya ▁bhiyyo bhāv āya ▁ve pu ll āya ▁bhāvanāya ▁ pāripūri yā ▁saṃvatt ati
PA_dn_34:2.1.18	Puna caparaṁ, āvuso, bhikkhu āraddhavīriyo viharati akusalānaṁ dhammānaṁ pahānāya, kusalānaṁ dhammānaṁ upasampadāya, thāmavā daḷhaparakkamo anikkhittadhuro kusalesu dhammesu.	▁puna ▁caparaṃ ▁āvuso ▁bhikkhu ▁ āraddh avīriy o ▁viharati ▁akusal ānaṃ ▁dhammānaṃ ▁pahān āya ▁kusal ānaṃ ▁dhammānaṃ ▁upasampad āya ▁thām avā ▁daḷh a parakkam o ▁ ani kkhitta dhur o ▁kusal esu ▁dhammesu
PA_dn_34:2.1.19	Ayaṁ chaṭṭho hetu chaṭṭho paccayo ādibrahmacariyikāya paññāya appaṭiladdhāya paṭilābhāya, paṭiladdhāya bhiyyobhāvāya vepullāya bhāvanāya pāripūriyā saṁvattati.	▁ayaṃ ▁chaṭṭh o ▁hetu ▁chaṭṭh o ▁paccayo ▁ādi brahmacariy ikāya ▁paññāya ▁appaṭi laddh āya ▁ paṭilābh āya ▁paṭiladdh āya ▁bhiyyo bhāv āya ▁ve pu ll āya ▁bhāvanāya ▁ pāripūri yā ▁saṃvatt ati
PA_dn_34:2.1.20	Puna caparaṁ, āvuso, bhikkhu satimā hoti paramena satinepakkena samannāgato. Cirakatampi cirabhāsitampi saritā anussaritā.	▁puna ▁caparaṃ ▁āvuso ▁bhikkhu ▁sati mā ▁hoti ▁param ena ▁sati n e pakk ena ▁samannāgato ▁cir akat ampi ▁cir a bhās it ampi ▁sar itā ▁anussar itā
PA_dn_34:2.1.21	Ayaṁ sattamo hetu sattamo paccayo ādibrahmacariyikāya paññāya appaṭiladdhāya paṭilābhāya, paṭiladdhāya bhiyyobhāvāya vepullāya bhāvanāya pāripūriyā saṁvattati.	▁ayaṃ ▁sattam o ▁hetu ▁sattam o ▁paccayo ▁ādi brahmacariy ikāya ▁paññāya ▁appaṭi laddh āya ▁ paṭilābh āya ▁paṭiladdh āya ▁bhiyyo bhāv āya ▁ve pu ll āya ▁bhāvanāya ▁ pāripūri yā ▁saṃvatt ati
PA_dn_34:2.1.22	Puna caparaṁ, āvuso, bhikkhu pañcasu upādānakkhandhesu, udayabbayānupassī viharati:	▁puna ▁caparaṃ ▁āvuso ▁bhikkhu ▁pañca su ▁upādān akkhandh esu ▁udayabbay ānupassī ▁viharati
PA_dn_34:2.1.23	‘iti rūpaṁ iti rūpassa samudayo iti rūpassa atthaṅgamo;	▁iti ▁rūpaṃ ▁iti ▁rūp assa ▁samuday o ▁iti ▁rūp assa ▁atthaṃ gam o
PA_dn_34:2.1.24	iti vedanā iti vedanāya samudayo iti vedanāya atthaṅgamo;	▁iti ▁vedanā ▁iti ▁vedanāya ▁samuday o ▁iti ▁vedanāya ▁atthaṃ gam o
PA_dn_34:2.1.25	iti saññā iti saññāya samudayo iti saññāya atthaṅgamo;	▁iti ▁saññā ▁iti ▁saññā ya ▁samuday o ▁iti ▁saññā ya ▁atthaṃ gam o
PA_dn_34:2.1.26	iti saṅkhārā iti saṅkhārānaṁ samudayo iti saṅkhārānaṁ atthaṅgamo;	▁iti ▁saṃkhārā ▁iti ▁saṃkhār ānaṃ ▁samuday o ▁iti ▁saṃkhār ānaṃ ▁atthaṃ gam o
PA_dn_34:2.1.27	iti viññāṇaṁ iti viññāṇassa samudayo iti viññāṇassa atthaṅgamo’ti.	▁iti ▁viññāṇaṃ ▁iti ▁viññāṇ assa ▁samuday o ▁iti ▁viññāṇ assa ▁atthaṃ gam oti
PA_dn_34:2.1.28	Ayaṁ aṭṭhamo hetu aṭṭhamo paccayo ādibrahmacariyikāya paññāya appaṭiladdhāya paṭilābhāya, paṭiladdhāya bhiyyobhāvāya vepullāya bhāvanāya pāripūriyā saṁvattati.	▁ayaṃ ▁aṭṭham o ▁hetu ▁aṭṭham o ▁paccayo ▁ādi brahmacariy ikāya ▁paññāya ▁appaṭi laddh āya ▁ paṭilābh āya ▁paṭiladdh āya ▁bhiyyo bhāv āya ▁ve pu ll āya ▁bhāvanāya ▁ pāripūri yā ▁saṃvatt ati
PA_dn_34:2.1.29	Ime aṭṭha dhammā bahukārā.	▁ime ▁aṭṭha ▁dhammā ▁bahu kār ā
PA_dn_34:2.1.30	Katame aṭṭha dhammā bhāvetabbā?	▁katame ▁aṭṭha ▁dhammā ▁bhāvetabb ā
PA_dn_34:2.1.31	Ariyo aṭṭhaṅgiko maggo seyyathidaṁ—	▁ariy o ▁aṭṭhaṃgik o ▁maggo ▁seyyathidaṃ
PA_dn_34:2.1.32	sammādiṭṭhi, sammāsaṅkappo, sammāvācā, sammākammanto, sammāājīvo, sammāvāyāmo, sammāsati, sammāsamādhi.	▁sammādiṭṭhi ▁sammāsaṃkapp o ▁sammā vāc ā ▁sammā kamm anto ▁sammā ā jīv o ▁sammā vā yā mo ▁sammā sati ▁sammāsamādhi
PA_dn_34:2.1.33	Ime aṭṭha dhammā bhāvetabbā.	▁ime ▁aṭṭha ▁dhammā ▁bhāvetabb ā
PA_dn_34:2.1.34	Katame aṭṭha dhammā pariññeyyā?	▁katame ▁aṭṭha ▁dhammā ▁pari ññ eyyā
PA_dn_34:2.1.35	Aṭṭha lokadhammā—	▁aṭṭha ▁lok adhammā
PA_dn_34:2.1.36	lābho ca, alābho ca, yaso ca, ayaso ca, nindā ca, pasaṁsā ca, sukhañca, dukkhañca.	▁lābh o ▁ca ▁ alābh o ▁ca ▁yas o ▁ca ▁a ya so ▁ca ▁ni nd ā ▁ca ▁pasaṃs ā ▁ca ▁sukh añca ▁dukkh añca
PA_dn_34:2.1.37	Ime aṭṭha dhammā pariññeyyā.	▁ime ▁aṭṭha ▁dhammā ▁pari ññ eyyā
PA_dn_34:2.1.38	Katame aṭṭha dhammā pahātabbā?	▁katame ▁aṭṭha ▁dhammā ▁pahātabb ā
PA_dn_34:2.1.39	Aṭṭha micchattā—	▁aṭṭha ▁ micch attā
PA_dn_34:2.1.40	micchādiṭṭhi, micchāsaṅkappo, micchāvācā, micchākammanto, micchāājīvo, micchāvāyāmo, micchāsati, micchāsamādhi.	▁micchādiṭṭhi ▁micchā saṃ kapp o ▁micchā vāc ā ▁micchā kamm anto ▁micchā ā jīv o ▁micchā vā yā mo ▁micchā sati ▁micchā samādhi
PA_dn_34:2.1.41	Ime aṭṭha dhammā pahātabbā.	▁ime ▁aṭṭha ▁dhammā ▁pahātabb ā
PA_dn_34:2.1.42	Katame aṭṭha dhammā hānabhāgiyā?	▁katame ▁aṭṭha ▁dhammā ▁h āna bhāgiy ā
PA_dn_34:2.1.43	Aṭṭha kusītavatthūni.	▁aṭṭha ▁ku sī ta vatthūni
PA_dn_34:2.1.44	Idhāvuso, bhikkhunā kammaṁ kātabbaṁ hoti,	▁idh āvuso ▁bhikkhunā ▁kammaṃ ▁kātabbaṃ ▁hoti
PA_dn_34:2.1.45	tassa evaṁ hoti:	▁tassa ▁evaṃ ▁hoti
PA_dn_34:2.1.46	‘kammaṁ kho me kātabbaṁ bhavissati, kammaṁ kho pana me karontassa kāyo kilamissati, handāhaṁ nipajjāmī’ti.	▁kammaṃ ▁kho ▁me ▁kātabbaṃ ▁bhavissati ▁kammaṃ ▁kho ▁pana ▁me ▁karont assa ▁kāy o ▁kilam issati ▁ han dā haṃ ▁nipajj āmīti
PA_dn_34:2.1.47	So nipajjati, na vīriyaṁ ārabhati appattassa pattiyā anadhigatassa adhigamāya asacchikatassa sacchikiriyāya.	▁so ▁nipajj ati ▁na ▁vīriy aṃ ▁ārabh ati ▁ appatt assa ▁ pattiyā ▁ana dhi gat assa ▁adhigam āya ▁a sacc hi kat assa ▁ sacchikiriy āya
PA_dn_34:2.1.48	Idaṁ paṭhamaṁ kusītavatthu.	▁idaṃ ▁paṭhamaṃ ▁ku sī t avatthu
PA_dn_34:2.1.49	Puna caparaṁ, āvuso, bhikkhunā kammaṁ kataṁ hoti.	▁puna ▁caparaṃ ▁āvuso ▁bhikkhunā ▁kammaṃ ▁kataṃ ▁hoti
PA_dn_34:2.1.50	Tassa evaṁ hoti:	▁tassa ▁evaṃ ▁hoti
PA_dn_34:2.1.51	‘ahaṁ kho kammaṁ akāsiṁ, kammaṁ kho pana me karontassa kāyo kilanto, handāhaṁ nipajjāmī’ti.	▁ahaṃ ▁kho ▁kammaṃ ▁akāsi ṃ ▁kammaṃ ▁kho ▁pana ▁me ▁karont assa ▁kāy o ▁ki l anto ▁ han dā haṃ ▁nipajj āmīti
PA_dn_34:2.1.52	So nipajjati, na vīriyaṁ ārabhati …pe…	▁so ▁nipajj ati ▁na ▁vīriy aṃ ▁ārabh ati ▁pe
PA_dn_34:2.1.53	idaṁ dutiyaṁ kusītavatthu.	▁idaṃ ▁dutiy aṃ ▁ku sī t avatthu
PA_dn_34:2.1.54	Puna caparaṁ, āvuso, bhikkhunā maggo gantabbo hoti.	▁puna ▁caparaṃ ▁āvuso ▁bhikkhunā ▁maggo ▁gantabb o ▁hoti
PA_dn_34:2.1.55	Tassa evaṁ hoti:	▁tassa ▁evaṃ ▁hoti
PA_dn_34:2.1.56	‘maggo kho me gantabbo bhavissati, maggaṁ kho pana me gacchantassa kāyo kilamissati, handāhaṁ nipajjāmī’ti.	▁maggo ▁kho ▁me ▁gantabb o ▁bhavissati ▁maggaṃ ▁kho ▁pana ▁me ▁gacchant assa ▁kāy o ▁kilam issati ▁ han dā haṃ ▁nipajj āmīti
PA_dn_34:2.1.57	So nipajjati, na vīriyaṁ ārabhati …pe…	▁so ▁nipajj ati ▁na ▁vīriy aṃ ▁ārabh ati ▁pe
PA_dn_34:2.1.58	idaṁ tatiyaṁ kusītavatthu.	▁idaṃ ▁tatiy aṃ ▁ku sī t avatthu
PA_dn_34:2.1.59	Puna caparaṁ, āvuso, bhikkhunā maggo gato hoti.	▁puna ▁caparaṃ ▁āvuso ▁bhikkhunā ▁maggo ▁gato ▁hoti
PA_dn_34:2.1.60	Tassa evaṁ hoti:	▁tassa ▁evaṃ ▁hoti
PA_dn_34:2.1.61	‘ahaṁ kho maggaṁ agamāsiṁ, maggaṁ kho pana me gacchantassa kāyo kilanto, handāhaṁ nipajjāmī’ti.	▁ahaṃ ▁kho ▁maggaṃ ▁agamāsi ṃ ▁maggaṃ ▁kho ▁pana ▁me ▁gacchant assa ▁kāy o ▁ki l anto ▁ han dā haṃ ▁nipajj āmīti
PA_dn_34:2.1.62	So nipajjati, na vīriyaṁ ārabhati …pe…	▁so ▁nipajj ati ▁na ▁vīriy aṃ ▁ārabh ati ▁pe
PA_dn_34:2.1.63	idaṁ catutthaṁ kusītavatthu.	▁idaṃ ▁catutth aṃ ▁ku sī t avatthu
PA_dn_34:2.1.64	Puna caparaṁ, āvuso, bhikkhu gāmaṁ vā nigamaṁ vā piṇḍāya caranto na labhati lūkhassa vā paṇītassa vā bhojanassa yāvadatthaṁ pāripūriṁ.	▁puna ▁caparaṃ ▁āvuso ▁bhikkhu ▁gām aṃ ▁vā ▁ni gam aṃ ▁vā ▁piṇḍāya ▁carant o ▁na ▁labhati ▁lūkh assa ▁vā ▁paṇīt assa ▁vā ▁bhojan assa ▁yāva d atthaṃ ▁ pāripūri ṃ
PA_dn_34:2.1.65	Tassa evaṁ hoti:	▁tassa ▁evaṃ ▁hoti
PA_dn_34:2.1.66	‘ahaṁ kho gāmaṁ vā nigamaṁ vā piṇḍāya caranto nālatthaṁ lūkhassa vā paṇītassa vā bhojanassa yāvadatthaṁ pāripūriṁ, tassa me kāyo kilanto akammañño, handāhaṁ nipajjāmī’ti …pe…	▁ahaṃ ▁kho ▁gām aṃ ▁vā ▁ni gam aṃ ▁vā ▁piṇḍāya ▁carant o ▁nā l atthaṃ ▁lūkh assa ▁vā ▁paṇīt assa ▁vā ▁bhojan assa ▁yāva d atthaṃ ▁ pāripūri ṃ ▁tassa ▁me ▁kāy o ▁ki l anto ▁ akamm a ññ o ▁ han dā haṃ ▁nipajj āmīti ▁pe
PA_dn_34:2.1.67	idaṁ pañcamaṁ kusītavatthu.	▁idaṃ ▁pañcam aṃ ▁ku sī t avatthu
PA_dn_34:2.1.68	Puna caparaṁ, āvuso, bhikkhu gāmaṁ vā nigamaṁ vā piṇḍāya caranto labhati lūkhassa vā paṇītassa vā bhojanassa yāvadatthaṁ pāripūriṁ.	▁puna ▁caparaṃ ▁āvuso ▁bhikkhu ▁gām aṃ ▁vā ▁ni gam aṃ ▁vā ▁piṇḍāya ▁carant o ▁labhati ▁lūkh assa ▁vā ▁paṇīt assa ▁vā ▁bhojan assa ▁yāva d atthaṃ ▁ pāripūri ṃ
PA_dn_34:2.1.69	Tassa evaṁ hoti:	▁tassa ▁evaṃ ▁hoti
PA_dn_34:2.1.70_0	‘ahaṁ kho gāmaṁ vā nigamaṁ vā piṇḍāya caranto alatthaṁ lūkhassa vā paṇītassa vā bhojanassa	▁ahaṃ ▁kho ▁gām aṃ ▁vā ▁ni gam aṃ ▁vā ▁piṇḍāya ▁carant o ▁a l atthaṃ ▁lūkh assa ▁vā ▁paṇīt assa ▁vā ▁bhojan assa
PA_dn_34:2.1.70_1	yāvadatthaṁ pāripūriṁ, tassa me kāyo garuko akammañño, māsācitaṁ maññe, handāhaṁ nipajjāmī’ti.	▁yāva d atthaṃ ▁ pāripūri ṃ ▁tassa ▁me ▁kāy o ▁garuk o ▁ akamm a ññ o ▁mās ā cit aṃ ▁maññ e ▁ han dā haṃ ▁nipajj āmīti
PA_dn_34:2.1.71	So nipajjati …pe…	▁so ▁nipajj ati ▁pe
PA_dn_34:2.1.72	idaṁ chaṭṭhaṁ kusītavatthu.	▁idaṃ ▁chaṭṭh aṃ ▁ku sī t avatthu
PA_dn_34:2.1.73	Puna caparaṁ, āvuso, bhikkhuno uppanno hoti appamattako ābādho, tassa evaṁ hoti:	▁puna ▁caparaṃ ▁āvuso ▁bhikkhuno ▁uppann o ▁hoti ▁appamatt ako ▁ābādh o ▁tassa ▁evaṃ ▁hoti
PA_dn_34:2.1.74	‘uppanno kho me ayaṁ appamattako ābādho atthi kappo nipajjituṁ, handāhaṁ nipajjāmī’ti.	▁uppann o ▁kho ▁me ▁ayaṃ ▁appamatt ako ▁ābādh o ▁atthi ▁kapp o ▁nipajj ituṃ ▁ han dā haṃ ▁nipajj āmīti
PA_dn_34:2.1.75	So nipajjati …pe…	▁so ▁nipajj ati ▁pe
PA_dn_34:2.1.76	idaṁ sattamaṁ kusītavatthu.	▁idaṃ ▁sattam aṃ ▁ku sī t avatthu
PA_dn_34:2.1.77	Puna caparaṁ, āvuso, bhikkhu gilānāvuṭṭhito hoti aciravuṭṭhito gelaññā.	▁puna ▁caparaṃ ▁āvuso ▁bhikkhu ▁gilān ā vuṭṭh ito ▁hoti ▁acir a vuṭṭh ito ▁ g e la ññā
PA_dn_34:2.1.78	Tassa evaṁ hoti:	▁tassa ▁evaṃ ▁hoti
PA_dn_34:2.1.79	‘ahaṁ kho gilānāvuṭṭhito aciravuṭṭhito gelaññā.	▁ahaṃ ▁kho ▁gilān ā vuṭṭh ito ▁acir a vuṭṭh ito ▁ g e la ññā
PA_dn_34:2.1.80	Tassa me kāyo dubbalo akammañño, handāhaṁ nipajjāmī’ti.	▁tassa ▁me ▁kāy o ▁ dubbal o ▁ akamm a ññ o ▁ han dā haṃ ▁nipajj āmīti
PA_dn_34:2.1.81	So nipajjati …pe…	▁so ▁nipajj ati ▁pe
PA_dn_34:2.1.82	idaṁ aṭṭhamaṁ kusītavatthu.	▁idaṃ ▁aṭṭham aṃ ▁ku sī t avatthu
PA_dn_34:2.1.83	Ime aṭṭha dhammā hānabhāgiyā.	▁ime ▁aṭṭha ▁dhammā ▁h āna bhāgiy ā
PA_dn_34:2.1.84	Katame aṭṭha dhammā visesabhāgiyā?	▁katame ▁aṭṭha ▁dhammā ▁vises a bhāgiy ā
PA_dn_34:2.1.85	Aṭṭha ārambhavatthūni.	▁aṭṭha ▁ ārambh a vatthūni
PA_dn_34:2.1.86	Idhāvuso, bhikkhunā kammaṁ kātabbaṁ hoti, tassa evaṁ hoti:	▁idh āvuso ▁bhikkhunā ▁kammaṃ ▁kātabbaṃ ▁hoti ▁tassa ▁evaṃ ▁hoti
PA_dn_34:2.1.87_0	‘kammaṁ kho me kātabbaṁ bhavissati, kammaṁ kho pana me karontena na sukaraṁ buddhānaṁ	▁kammaṃ ▁kho ▁me ▁kātabbaṃ ▁bhavissati ▁kammaṃ ▁kho ▁pana ▁me ▁karont ena ▁na ▁su kar aṃ ▁buddh ānaṃ
PA_dn_34:2.1.87_1	sāsanaṁ manasikātuṁ, handāhaṁ vīriyaṁ ārabhāmi appattassa pattiyā anadhigatassa adhigamāya	▁sāsanaṃ ▁manasi kā tuṃ ▁ han dā haṃ ▁vīriy aṃ ▁ārabh āmi ▁ appatt assa ▁ pattiyā ▁ana dhi gat assa ▁adhigam āya
PA_dn_34:2.1.87_2	asacchikatassa sacchikiriyāyā’ti.	▁a sacc hi kat assa ▁ sacchikiriy āyāti
PA_dn_34:2.1.88	So vīriyaṁ ārabhati appattassa pattiyā anadhigatassa adhigamāya asacchikatassa sacchikiriyāya.	▁so ▁vīriy aṃ ▁ārabh ati ▁ appatt assa ▁ pattiyā ▁ana dhi gat assa ▁adhigam āya ▁a sacc hi kat assa ▁ sacchikiriy āya
PA_dn_34:2.1.89	Idaṁ paṭhamaṁ ārambhavatthu.	▁idaṃ ▁paṭhamaṃ ▁ ārambh avatthu
PA_dn_34:2.1.90	Puna caparaṁ, āvuso, bhikkhunā kammaṁ kataṁ hoti.	▁puna ▁caparaṃ ▁āvuso ▁bhikkhunā ▁kammaṃ ▁kataṃ ▁hoti
PA_dn_34:2.1.91	Tassa evaṁ hoti:	▁tassa ▁evaṃ ▁hoti
PA_dn_34:2.1.92	‘ahaṁ kho kammaṁ akāsiṁ, kammaṁ kho panāhaṁ karonto nāsakkhiṁ buddhānaṁ sāsanaṁ manasikātuṁ, handāhaṁ vīriyaṁ ārabhāmi …pe…	▁ahaṃ ▁kho ▁kammaṃ ▁akāsi ṃ ▁kammaṃ ▁kho ▁panā haṃ ▁karonto ▁nāsakkhi ṃ ▁buddh ānaṃ ▁sāsanaṃ ▁manasi kā tuṃ ▁ han dā haṃ ▁vīriy aṃ ▁ārabh āmi ▁pe
PA_dn_34:2.1.93	idaṁ dutiyaṁ ārambhavatthu.	▁idaṃ ▁dutiy aṃ ▁ ārambh avatthu
PA_dn_34:2.1.94	Puna caparaṁ, āvuso, bhikkhunā maggo gantabbo hoti.	▁puna ▁caparaṃ ▁āvuso ▁bhikkhunā ▁maggo ▁gantabb o ▁hoti
PA_dn_34:2.1.95	Tassa evaṁ hoti:	▁tassa ▁evaṃ ▁hoti
PA_dn_34:2.1.96	‘maggo kho me gantabbo bhavissati, maggaṁ kho pana me gacchantena na sukaraṁ buddhānaṁ sāsanaṁ manasikātuṁ, handāhaṁ vīriyaṁ ārabhāmi …pe…	▁maggo ▁kho ▁me ▁gantabb o ▁bhavissati ▁maggaṃ ▁kho ▁pana ▁me ▁gacchant ena ▁na ▁su kar aṃ ▁buddh ānaṃ ▁sāsanaṃ ▁manasi kā tuṃ ▁ han dā haṃ ▁vīriy aṃ ▁ārabh āmi ▁pe
PA_dn_34:2.1.97	idaṁ tatiyaṁ ārambhavatthu.	▁idaṃ ▁tatiy aṃ ▁ ārambh avatthu
PA_dn_34:2.1.98	Puna caparaṁ, āvuso, bhikkhunā maggo gato hoti.	▁puna ▁caparaṃ ▁āvuso ▁bhikkhunā ▁maggo ▁gato ▁hoti
PA_dn_34:2.1.99	Tassa evaṁ hoti:	▁tassa ▁evaṃ ▁hoti
PA_dn_34:2.1.100	‘ahaṁ kho maggaṁ agamāsiṁ, maggaṁ kho panāhaṁ gacchanto nāsakkhiṁ buddhānaṁ sāsanaṁ manasikātuṁ, handāhaṁ vīriyaṁ ārabhāmi …pe…	▁ahaṃ ▁kho ▁maggaṃ ▁agamāsi ṃ ▁maggaṃ ▁kho ▁panā haṃ ▁gacchant o ▁nāsakkhi ṃ ▁buddh ānaṃ ▁sāsanaṃ ▁manasi kā tuṃ ▁ han dā haṃ ▁vīriy aṃ ▁ārabh āmi ▁pe
PA_dn_34:2.1.101	idaṁ catutthaṁ ārambhavatthu.	▁idaṃ ▁catutth aṃ ▁ ārambh avatthu
PA_dn_34:2.1.102	Puna caparaṁ, āvuso, bhikkhu gāmaṁ vā nigamaṁ vā piṇḍāya caranto na labhati lūkhassa vā paṇītassa vā bhojanassa yāvadatthaṁ pāripūriṁ.	▁puna ▁caparaṃ ▁āvuso ▁bhikkhu ▁gām aṃ ▁vā ▁ni gam aṃ ▁vā ▁piṇḍāya ▁carant o ▁na ▁labhati ▁lūkh assa ▁vā ▁paṇīt assa ▁vā ▁bhojan assa ▁yāva d atthaṃ ▁ pāripūri ṃ
PA_dn_34:2.1.103	Tassa evaṁ hoti:	▁tassa ▁evaṃ ▁hoti
PA_dn_34:2.1.104	‘ahaṁ kho gāmaṁ vā nigamaṁ vā piṇḍāya caranto nālatthaṁ lūkhassa vā paṇītassa vā bhojanassa yāvadatthaṁ pāripūriṁ, tassa me kāyo lahuko kammañño, handāhaṁ vīriyaṁ ārabhāmi …pe…	▁ahaṃ ▁kho ▁gām aṃ ▁vā ▁ni gam aṃ ▁vā ▁piṇḍāya ▁carant o ▁nā l atthaṃ ▁lūkh assa ▁vā ▁paṇīt assa ▁vā ▁bhojan assa ▁yāva d atthaṃ ▁ pāripūri ṃ ▁tassa ▁me ▁kāy o ▁lahu ko ▁kamma ññ o ▁ han dā haṃ ▁vīriy aṃ ▁ārabh āmi ▁pe
PA_dn_34:2.1.105	idaṁ pañcamaṁ ārambhavatthu.	▁idaṃ ▁pañcam aṃ ▁ ārambh avatthu
PA_dn_34:2.1.106	Puna caparaṁ, āvuso, bhikkhu gāmaṁ vā nigamaṁ vā piṇḍāya caranto labhati lūkhassa vā paṇītassa vā bhojanassa yāvadatthaṁ pāripūriṁ.	▁puna ▁caparaṃ ▁āvuso ▁bhikkhu ▁gām aṃ ▁vā ▁ni gam aṃ ▁vā ▁piṇḍāya ▁carant o ▁labhati ▁lūkh assa ▁vā ▁paṇīt assa ▁vā ▁bhojan assa ▁yāva d atthaṃ ▁ pāripūri ṃ
PA_dn_34:2.1.107	Tassa evaṁ hoti:	▁tassa ▁evaṃ ▁hoti
PA_dn_34:2.1.108	‘ahaṁ kho gāmaṁ vā nigamaṁ vā piṇḍāya caranto alatthaṁ lūkhassa vā paṇītassa vā bhojanassa yāvadatthaṁ pāripūriṁ.	▁ahaṃ ▁kho ▁gām aṃ ▁vā ▁ni gam aṃ ▁vā ▁piṇḍāya ▁carant o ▁a l atthaṃ ▁lūkh assa ▁vā ▁paṇīt assa ▁vā ▁bhojan assa ▁yāva d atthaṃ ▁ pāripūri ṃ
PA_dn_34:2.1.109	Tassa me kāyo balavā kammañño, handāhaṁ vīriyaṁ ārabhāmi …pe…	▁tassa ▁me ▁kāy o ▁bal avā ▁kamma ññ o ▁ han dā haṃ ▁vīriy aṃ ▁ārabh āmi ▁pe
PA_dn_34:2.1.110	idaṁ chaṭṭhaṁ ārambhavatthu.	▁idaṃ ▁chaṭṭh aṃ ▁ ārambh avatthu
PA_dn_34:2.1.111	Puna caparaṁ, āvuso, bhikkhuno uppanno hoti appamattako ābādho.	▁puna ▁caparaṃ ▁āvuso ▁bhikkhuno ▁uppann o ▁hoti ▁appamatt ako ▁ābādh o
PA_dn_34:2.1.112	Tassa evaṁ hoti:	▁tassa ▁evaṃ ▁hoti
