segmentnr	original	analyzed
PA_kd_16:7.3_0	“saṅghikaññeva bhagavatā yathāvuḍḍhaṁ anuññātaṁ, no uddissakatan”ti buddhappamukhassa	buddha ppamukhassa 
PA_kd_16:7.3_1	saṅghassa purato purato gantvā maṇḍapepi pariggaṇhanti, santharepi pariggaṇhanti,	saṅghassa puratas puratas gantvā maṇḍape pi pariggaṇhanti santhare pi pariggaṇhanti 
PA_kd_16:7.3_2	okāsepi pariggaṇhanti—	okāse api pariggaṇhanti 
PA_kd_16:7.4	“idaṁ amhākaṁ upajjhāyānaṁ bhavissati, idaṁ amhākaṁ ācariyānaṁ bhavissati, idaṁ amhākaṁ bhavissatī”ti.	idam amhākam upajjhāyānam bhavissati idam amhākam ācariyānam bhavissati idam amhākam bhavissati iti 
PA_kd_16:7.5_0	Atha kho āyasmā sāriputto buddhappamukhassa saṅghassa piṭṭhito piṭṭhito gantvā maṇḍapesu	atha kho āyasmā sāriputtaḥ buddha ppamukhassa saṅghassa piṭṭhitaḥ piṭṭhitaḥ gantvā maṇḍapesu 
PA_kd_16:7.5_1	pariggahitesu, santharesu pariggahitesu, okāsesu pariggahitesu, okāsaṁ alabhamāno	pariggahitesu santharesu pariggahitesu okāsesu pariggahitesu okāsam a labhamānaḥ 
PA_kd_16:7.5_2	aññatarasmiṁ rukkhamūle nisīdi.	aññatarasmiṃ rukkha mūle 
PA_kd_16:7.6	Atha kho bhagavā rattiyā paccūsasamayaṁ paccuṭṭhāya ukkāsi.	atha kho bhagavā rattiyā paccūsa samayam paccuṭṭhāya ukkāsi 
PA_kd_16:7.7	Āyasmāpi sāriputto ukkāsi.	āyasmā api sāriputtaḥ ukkā asi 
PA_kd_16:7.8	“Ko etthā”ti?	kaḥ ettha ati 
PA_kd_16:7.9	“Ahaṁ, bhagavā, sāriputto”ti.	aha bhagavā sāriputto ti 
PA_kd_16:7.10	“Kissa tvaṁ, sāriputta, idha nisinno”ti?	kissa tva sāriputta idha nisinnaḥ ti 
PA_kd_16:7.11	Atha kho āyasmā sāriputto bhagavato etamatthaṁ ārocesi.	atha kho āyasmā sāriputtaḥ bhagavataḥ etam attham ārocesi 
PA_kd_16:7.12	Atha kho bhagavā etasmiṁ nidāne etasmiṁ pakaraṇe bhikkhusaṅghaṁ sannipātāpetvā bhikkhū paṭipucchi—	atha kho bhagavā etasmim nidāne etasmim pakaraṇe bhikkhu saṅgham sannipātāpetvā bhikkhū paṭipucchi 
PA_kd_16:7.13	“saccaṁ kira, bhikkhave, chabbaggiyānaṁ bhikkhūnaṁ antevāsikā bhikkhū—	saccam kira bhikkhave chabbaggiyānam bhikkhūnam antevāsikāḥ bhikkhū 
PA_kd_16:7.14_0	‘saṅghikaññeva bhagavatā yathāvuḍḍhaṁ anuññātaṁ, no uddissakatan’ti buddhappamukhassa	buddha ppamukhassa 
PA_kd_16:7.14_1	saṅghassa purato purato gantvā maṇḍape pariggaṇhanti, santhare pariggaṇhanti, okāse pariggaṇhanti—	saṅghassa puratas puratas gantvā maṇḍape pariggaṇhanti santhare pariggaṇhanti okāse pariggaṇhanti 
PA_kd_16:7.15	idaṁ amhākaṁ upajjhāyānaṁ bhavissati, idaṁ amhākaṁ ācariyānaṁ bhavissati, idaṁ amhākaṁ bhavissatī”ti?	idam amhākam upajjhāyānam bhavissati idam amhākam ācariyānam bhavissati idam amhākam bhavissati iti 
PA_kd_16:7.16	“Saccaṁ, bhagavā”ti …pe…	sat ca bhagavān ati pe 
PA_kd_16:7.17	vigarahitvā …pe…	vigara hitvā pe 
PA_kd_16:7.18	dhammiṁ kathaṁ katvā bhikkhū āmantesi—	dhammim katham katvā bhikkhū āmantesi 
PA_kd_16:7.19	“na, bhikkhave, uddissakatampi yathāvuḍḍhaṁ paṭibāhitabbaṁ.	na bhikkhave uddissa katam api yathāvuḍḍham 
PA_kd_16:7.20	Yo paṭibāheyya, āpatti dukkaṭassā”ti.	yaḥ paṭibāheyya āpatti dukkaṭassa ati 
PA_kd_16:8.0	6. Gihivikataanujānana	gihi vikata anujānana 
PA_kd_16:8.1	Tena kho pana samayena manussā bhattagge antaraghare uccāsayanamahāsayanāni paññapenti, seyyathidaṁ—	tena kho pana samayena manussāḥ bhattagge antaraghare uccāsayana mahāsayanāni paññapenti 
PA_kd_16:8.2_0	āsandiṁ, pallaṅkaṁ, gonakaṁ, cittakaṁ, paṭikaṁ, paṭalikaṁ, tūlikaṁ, vikatikaṁ, uddalomiṁ,	āsandi pallaṅka gonaka cittaka paṭika paṭalika tūlika vikatika uddalomi 
PA_kd_16:8.2_1	ekantalomiṁ, kaṭṭissaṁ, koseyyaṁ, kuttakaṁ, hatthattharaṁ, assattharaṁ, rathattharaṁ,	ekantalomi kaṭṭissa koseyya kuttaka hatthatthara assatthara rathatthara 
PA_kd_16:8.2_2	ajinapaveṇiṁ, kadalimigapavarapaccattharaṇaṁ, sauttaracchadaṁ, ubhatolohitakūpadhānaṁ.	ajina paveṇi kadali miga pavara paccattharaṇa sa uttaracchada ubhatolohita kūpa dhāna 
PA_kd_16:8.3	Bhikkhū kukkuccāyantā nābhinisīdanti.	bhikkhū kukkuccāyantā na abhinisīdanti 
PA_kd_16:8.4	Bhagavato etamatthaṁ ārocesuṁ.	bhagavato etam attham ārocesu 
PA_kd_16:8.5	“Anujānāmi, bhikkhave, ṭhapetvā tīṇi—	anujānāmi bhikkhave ṭhapetvā tīṇi 
PA_kd_16:8.6	āsandiṁ, pallaṅkaṁ, tūlikaṁ—	āsandi pallaṅka tūlika 
PA_kd_16:8.7	gihivikataṁ abhinisīdituṁ, na tveva abhinipajjitun”ti.	gihivikatam abhinisīditu na tu eva abhinipajjitum ti 
PA_kd_16:8.8	Tena kho pana samayena manussā bhattagge antaraghare tūlonaddhaṁ mañcampi pīṭhampi paññapenti.	tena kho pana samayena manussāḥ bhattagge antaraghare tūla unaddham mañcam pi pīṭham pi paññapenti 
PA_kd_16:8.9	Bhikkhū kukkuccāyantā nābhinisīdanti.	bhikkhū kukkuccāyantā na abhinisīdanti 
PA_kd_16:8.10	Bhagavato etamatthaṁ ārocesuṁ.	bhagavato etam attham ārocesu 
PA_kd_16:8.11	“Anujānāmi, bhikkhave, gihivikataṁ abhinisīdituṁ, na tveva abhinipajjitun”ti.	anujānāmi bhikkhave gihi vikatam abhinisīditu na tu eva abhinipajjitum ti 
PA_kd_16:9.0	7. Jetavanavihārānumodanā	jetavana vihāra anumodanā 
PA_kd_16:9.1.1	Atha kho bhagavā anupubbena cārikaṁ caramāno yena sāvatthi tadavasari.	atha kho bhagavā anupubbena cārikam caramānaḥ yena sāvatthi tat avasari 
PA_kd_16:9.1.2	Tatra sudaṁ bhagavā sāvatthiyaṁ viharati jetavane anāthapiṇḍikassa ārāme.	tatra sudam bhagavā sāvatthiyam viharati jetavane anāthapiṇḍikassa ārāme 
PA_kd_16:9.1.3	Atha kho anāthapiṇḍiko gahapati yena bhagavā tenupasaṅkami, upasaṅkamitvā bhagavantaṁ abhivādetvā ekamantaṁ nisīdi.	atha khalu anāthapiṇḍikaḥ gahapati yena bhagavā tena upasaṅkami upasaṅkamitvā bhagavantam abhivādetvā ekamantam nisīdi 
PA_kd_16:9.1.4	Ekamantaṁ nisinno kho anāthapiṇḍiko gahapati bhagavantaṁ etadavoca—	eka mantam nisinnaḥ khalu anāthapiṇḍikaḥ gahapati bhagavantam etat avoca 
PA_kd_16:9.1.5	“adhivāsetu me, bhante, bhagavā svātanāya bhattaṁ saddhiṁ bhikkhusaṅghenā”ti.	adhivāsetu me bhante bhagavā svātanāya bhattam saddhim bhikkhu saṅghena ati 
PA_kd_16:9.1.6	Adhivāsesi bhagavā tuṇhībhāvena.	adhivāsesi bhagavā tuṇhībhāvena 
PA_kd_16:9.1.7	Atha kho anāthapiṇḍiko gahapati bhagavato adhivāsanaṁ viditvā uṭṭhāyāsanā bhagavantaṁ abhivādetvā padakkhiṇaṁ katvā pakkāmi.	atha kho anāthapiṇḍikaḥ gahapati bhagavataḥ adhivāsanam viditvā uṭṭhāya āsanā bhagavantam abhivādetvā padakkhiṇam katvā pakkāmi 
PA_kd_16:9.1.8	Atha kho anāthapiṇḍiko gahapati tassā rattiyā accayena paṇītaṁ khādanīyaṁ bhojanīyaṁ paṭiyādāpetvā bhagavato kālaṁ ārocāpesi—	atha kho anāthapiṇḍikaḥ gahapati tassāḥ rattiyāḥ accayena paṇītam khādanīyam bhojanīyam paṭiyādāpetvā bhagavato kālam ārocāpesi 
PA_kd_16:9.1.9	“kālo, bhante, niṭṭhitaṁ bhattan”ti.	kālaḥ bhante niṭṭhitam bhattanti 
PA_kd_16:9.1.10	Atha kho bhagavā pubbaṇhasamayaṁ nivāsetvā pattacīvaramādāya yena anāthapiṇḍikassa gahapatissa nivesanaṁ tenupasaṅkami, upasaṅkamitvā paññatte āsane nisīdi saddhiṁ bhikkhusaṅghena.	atha kho bhagavā pubbaṇhasamayam nivāsetvā patta cīvaram ādāya yena anāthapiṇḍikassa gahapatissa nivesanam tena upasaṅkami upasaṅkamitvā paññatte āsane nisīdi saddhim bhikkhu saṅghena 
PA_kd_16:9.1.11_0	Atha kho anāthapiṇḍiko gahapati buddhappamukhaṁ bhikkhusaṅghaṁ paṇītena khādanīyena	atha kho anāthapiṇḍikaḥ gahapati buddha ppamukham bhikkhu saṅgham paṇītena khādanīyena 
PA_kd_16:9.1.11_1	bhojanīyena sahatthā santappetvā sampavāretvā, bhagavantaṁ bhuttāviṁ onītapattapāṇiṁ, ekamantaṁ nisīdi.	bhojanīyena sahatthā santappetvā sampavāretvā bhagavantam bhuttāvim onīta patta pāṇi ekamantam nisīdi 
PA_kd_16:9.1.12	Ekamantaṁ nisinno kho anāthapiṇḍiko gahapati bhagavantaṁ etadavoca—	eka mantam nisinnaḥ khalu anāthapiṇḍikaḥ gahapati bhagavantam etat avoca 
PA_kd_16:9.1.13	“kathāhaṁ, bhante, jetavane paṭipajjāmī”ti?	kathā āha bhante jetavane paṭipajjāmi iti 
PA_kd_16:9.1.14	“Tena hi tvaṁ, gahapati, jetavanaṁ āgatānāgatassa cātuddisassa saṅghassa patiṭṭhapehī”ti.	tena hi tva gahapati jetavanam āgata anāgatassa cātuddisassa saṅghassa patiṭṭhapehi iti 
PA_kd_16:9.1.15	“Evaṁ, bhante”ti kho anāthapiṇḍiko gahapati bhagavato paṭissutvā jetavanaṁ āgatānāgatassa cātuddisassa saṅghassa patiṭṭhāpesi.	eva bhante iti kho anāthapiṇḍikaḥ gahapati bhagavataḥ paṭissutvā jetavanam āgata anāgatassa cātuddisassa saṅghassa patiṭṭhāpesi 
PA_kd_16:9.2.1	Atha kho bhagavā anāthapiṇḍikaṁ gahapatiṁ imāhi gāthāhi anumodi—	atha khalu bhagavā anāthapiṇḍikam gahapatim imāhi gāthāhi anumodi 
PA_kd_16:9.2.2	“Sītaṁ uṇhaṁ paṭihanti,	sītam uṇham paṭihanti 
PA_kd_16:9.2.3	tato vāḷamigāni ca;	tatas vāḍamigāni ca 
PA_kd_16:9.2.4	Sarīsape ca makase,	sarīsape ca makase 
PA_kd_16:9.2.5	sisire cāpi vuṭṭhiyo.	sisire ca api vuṭṭhiyaḥ 
PA_kd_16:9.2.6	Tato vātātapo ghoro,	tatas vāta ātapaḥ ghoraḥ 
PA_kd_16:9.2.7	sañjāto paṭihaññati;	sañjātaḥ paṭihaññati 
PA_kd_16:9.2.8	Leṇatthañca sukhatthañca,	leṇattham ca sukhattham ca 
PA_kd_16:9.2.9	jhāyituñca vipassituṁ.	jhāyitum ca vipassitu 
PA_kd_16:9.2.10	Vihāradānaṁ saṅghassa,	vihāra dānam saṅghassa 
PA_kd_16:9.2.11	aggaṁ buddhena vaṇṇitaṁ;	aggam buddhena vaṇṇita 
PA_kd_16:9.2.12	Tasmā hi paṇḍito poso,	tasmā hi paṇḍitaḥ posaḥ 
PA_kd_16:9.2.13	sampassaṁ atthamattano.	sampassam atthamattano 
PA_kd_16:9.2.14	Vihāre kāraye ramme,	vihāre kāraye ramme 
PA_kd_16:9.2.15	vāsayettha bahussute;	vāsayettha bahussute 
PA_kd_16:9.2.16	Tesaṁ annañca pānañca,	tesam annam ca pānam ca 
PA_kd_16:9.2.17	vatthasenāsanāni ca.	vattha senāsanāni ca 
PA_kd_16:9.2.18	Dadeyya ujubhūtesu,	dadeyyaḥ uju bhūtesu 
PA_kd_16:9.2.19	Vippasannena cetasā;	vippasannena cetasā 
PA_kd_16:9.2.20	Te tassa dhammaṁ desenti,	te tassa dhammam desenti 
PA_kd_16:9.2.21	Sabbadukkhāpanūdanaṁ;	sabba dukkha apanūdana 
PA_kd_16:9.2.22	Yaṁ so dhammaṁ idhaññāya,	yam saḥ dhammam idhaññāya 
PA_kd_16:9.2.23	Parinibbāti anāsavo”ti.	parinibbāti anāsavaḥ ti 
PA_kd_16:9.2.24	Atha kho bhagavā anāthapiṇḍikaṁ gahapatiṁ imāhi gāthāhi anumoditvā uṭṭhāyāsanā pakkāmi.	atha khalu bhagavā anāthapiṇḍikam gahapatim imāhi gāthāhi anumoditvā uṭṭhāya āsanā pakkāmi 
PA_kd_16:10.1.0	8. Āsanappaṭibāhanādi	āsana paṭibāhana ādi 
PA_kd_16:10.1.1	Tena kho pana samayena aññatarassa ājīvakasāvakassa mahāmattassa saṅghabhattaṁ hoti.	tena kho pana samayena aññatarassa ājīvaka sāvakassa mahāmattassa saṅgha bhattam hoti 
PA_kd_16:10.1.2	Āyasmā upanando sakyaputto pacchā āgantvā vippakatabhojanaṁ ānantarikaṁ bhikkhuṁ vuṭṭhāpesi.	āyasmā upanandaḥ sakya putto pacchā āgantvā vippakata bhojanam ānantarikam bhikkhum vuṭṭhāpesi 
PA_kd_16:10.1.3	Bhattaggaṁ kolāhalaṁ ahosi.	bhattaggam kolāhalam ahosi 
PA_kd_16:10.1.4	Atha kho so mahāmatto ujjhāyati khiyyati vipāceti—	atha kho saḥ mahā mattaḥ ujjhāyati khiyyati vipāceti 
PA_kd_16:10.1.5	“kathañhi nāma samaṇā sakyaputtiyā pacchā āgantvā vippakatabhojanaṁ ānantarikaṁ bhikkhuṁ vuṭṭhāpessanti.	katham hi nāma samaṇā sakyaputtiyā pacchā āgantvā vippakata bhojanam ānantarikam bhikkhum vuṭṭhāpessanti 
PA_kd_16:10.1.6	Bhattaggaṁ kolāhalaṁ ahosi.	bhattaggam kolāhalam ahosi 
PA_kd_16:10.1.7	Nanu nāma labbhā aññatrāpi nisinnena yāvadatthaṁ bhuñjitun”ti?	nanu nāma labbhā aññatra api nisinnena yāvadattham bhuñjitum ti 
PA_kd_16:10.1.8	Assosuṁ kho bhikkhū tassa mahāmattassa ujjhāyantassa khiyyantassa vipācentassa.	assosum kho bhikkhū tassa mahāmattassa ujjhāyantassa khiyyantassa vipācentassa 
PA_kd_16:10.1.9	Ye te bhikkhū appicchā …pe… te ujjhāyanti khiyyanti vipācenti—	ye te bhikkhū appicchā pe te ujjhāyanti khiyyanti vipācenti 
PA_kd_16:10.1.10	“kathañhi nāma āyasmā upanando sakyaputto pacchā āgantvā vippakatabhojanaṁ ānantarikaṁ bhikkhuṁ vuṭṭhāpessati.	katham hi nāma āyasman upanandaḥ sakya putto pacchā āgantvā vippakata bhojanam ānantarikam bhikkhum vuṭṭhāpessati 
PA_kd_16:10.1.11	Bhattaggaṁ kolāhalaṁ ahosī”ti.	bhattaggam kolāhalam ahosi iti 
PA_kd_16:10.1.12	Atha kho te bhikkhū bhagavato etamatthaṁ ārocesuṁ.	atha kho te bhikkhū bhagavataḥ etam attham ārocesu 
PA_kd_16:10.1.13	“Saccaṁ kira tvaṁ, upananda, pacchā āgantvā vippakatabhojanaṁ ānantarikaṁ bhikkhuṁ vuṭṭhāpesi, bhattaggaṁ kolāhalaṁ ahosī”ti?	saccam kira tvam upananda pacchā āgantvā vippakata bhojanam ānantarikam bhikkhum vuṭṭhāpesi bhatta aggam kolāhalam ahosi iti 
PA_kd_16:10.1.14	“Saccaṁ, bhagavā”ti.	sat ca bhagavān ati 
PA_kd_16:10.1.15	Vigarahi buddho bhagavā …pe…	vigarahi buddhaḥ bhagavān pe 
PA_kd_16:10.1.16	kathañhi nāma tvaṁ, moghapurisa, pacchā āgantvā vippakatabhojanaṁ ānantarikaṁ bhikkhuṁ vuṭṭhāpessasi?	katham hi nāma tva mogha purisa pacchā āgantvā vippakata bhojanam ānantarikam bhikkhum vuṭṭhāpessasi 
PA_kd_16:10.1.17	Bhattaggaṁ kolāhalaṁ ahosi.	bhattaggam kolāhalam ahosi 
PA_kd_16:10.1.18	Netaṁ, moghapurisa, appasannānaṁ vā pasādāya …pe…	neta moghapurisa appasannānam vā pasādāya pe 
PA_kd_16:10.1.19	vigarahitvā …pe…	vigara hitvā pe 
PA_kd_16:10.1.20	dhammiṁ kathaṁ katvā bhikkhū āmantesi—	dhammim katham katvā bhikkhū āmantesi 
PA_kd_16:10.1.21	“na, bhikkhave, vippakatabhojano bhikkhu vuṭṭhāpetabbo.	na bhikkhave vippakata bhojanaḥ bhikkhu vuṭṭhāpetabbaḥ 
PA_kd_16:10.1.22	Yo vuṭṭhāpeyya, āpatti dukkaṭassa.	yaḥ vuṭṭhāpeyya āpatti dukkaṭassa 
PA_kd_16:10.1.23	Sace vuṭṭhāpeti, pavārito ca hoti, ‘gaccha udakaṁ āharā’ti vattabbo.	sace vuṭṭhāpeti pavārito ca hoti gaccha udakam āharāti vattabbo 
PA_kd_16:10.1.24	Evañcetaṁ labhetha, iccetaṁ kusalaṁ.	evañca itam labhetha id ca itam kusala 
PA_kd_16:10.1.25	No ce labhetha, sādhukaṁ sitthāni gilitvā vuḍḍhatarassa bhikkhuno āsanaṁ dātabbaṁ.	no ce labhetha sādhukam sitthāni gilitvā vuḍḍhatarassa bhikkhuno āsanam dātabba 
PA_kd_16:10.1.26	Na tvevāhaṁ, bhikkhave, kenaci pariyāyena vuḍḍhatarassa bhikkhuno āsanaṁ paṭibāhitabbanti vadāmi.	na tu eva āha bhikkhave kenacid pariyāyena vuḍḍhatarassa bhikkhuno āsanam paṭibāhitabbanti vadāmi 
PA_kd_16:10.1.27	Yo paṭibāheyya, āpatti dukkaṭassāti”.	yaḥ paṭibāheyya āpatti dukkaṭassa ati 
PA_kd_16:10.2.1	Tena kho pana samayena chabbaggiyā bhikkhū gilāne bhikkhū vuṭṭhāpenti.	tena kho pana samayena chabbaggiyāḥ bhikkhū gilāne bhikkhū vuṭṭhāpenti 
PA_kd_16:10.2.2	Gilānā evaṁ vadenti—	gilānāḥ evam vadenti 
PA_kd_16:10.2.3	“na mayaṁ, āvuso, sakkoma vuṭṭhātuṁ, gilānāmhā”ti.	na mayaḥ āvuso sakkoma vuṭṭhātu gilānāmha ati 
PA_kd_16:10.2.4	“Mayaṁ āyasmante vuṭṭhāpessāmā”ti pariggahetvā vuṭṭhāpetvā ṭhitake muñcanti.	mayam āyasmante vuṭṭhāpessāma ati pariggahetvā vuṭṭhāpetvā ṭhitake muñcanti 
PA_kd_16:10.2.5	Gilānā mucchitā papatanti.	gilānāḥ mucchitā papatanti 
PA_kd_16:10.2.6	Bhagavato etamatthaṁ ārocesuṁ.	bhagavato etam attham ārocesu 
PA_kd_16:10.2.7	“Na, bhikkhave, gilāno vuṭṭhāpetabbo.	na bhikkhave gilānaḥ vuṭṭhāpetabbaḥ 
PA_kd_16:10.2.8	Yo vuṭṭhāpeyya, āpatti dukkaṭassā”ti.	yaḥ vuṭṭhāpeyya āpatti dukkaṭassa ati 
PA_kd_16:10.2.9	Tena kho pana samayena chabbaggiyā bhikkhū—	tena kho pana samayena chabbaggiyāḥ bhikkhū 
PA_kd_16:10.2.10	“gilānā mayamhā avuṭṭhāpanīyā”ti varaseyyāyo palibuddhenti.	gilānāḥ a vuṭṭhāpanīyā ati 
PA_kd_16:10.2.11	Bhagavato etamatthaṁ ārocesuṁ.	bhagavato etam attham ārocesu 
PA_kd_16:10.2.12	“Anujānāmi, bhikkhave, gilānassa patirūpaṁ seyyaṁ dātun”ti.	anujānāmi bhikkhave gilānassa patirūpam seyyam dātun ti 
PA_kd_16:10.2.13	Tena kho pana samayena chabbaggiyā bhikkhū lesakappena senāsanaṁ paṭibāhanti.	tena kho pana samayena chabbaggiyāḥ bhikkhū lesa kappena senāsanam paṭibāhanti 
PA_kd_16:10.2.14	Bhagavato etamatthaṁ ārocesuṁ.	bhagavato etam attham ārocesu 
PA_kd_16:10.2.15	“Na, bhikkhave, lesakappena senāsanaṁ paṭibāhitabbaṁ.	na bhikkhave lesa kappena senāsanam 
PA_kd_16:10.2.16	Yo paṭibāheyya, āpatti dukkaṭassā”ti.	yaḥ paṭibāheyya āpatti dukkaṭassa ati 
PA_kd_16:11.1.1	Tena kho pana samayena sattarasavaggiyā bhikkhū aññataraṁ paccantimaṁ mahāvihāraṁ paṭisaṅkharonti—	tena kho pana samayena sattarasavaggiyāḥ bhikkhū aññataram paccantimam mahāvihāram paṭisaṅkharonti 
PA_kd_16:11.1.2	“idha mayaṁ vassaṁ vasissāmā”ti.	idha mayam vassam vasissāma ati 
PA_kd_16:11.1.3	Addasaṁsu kho chabbaggiyā bhikkhū sattarasavaggiye bhikkhū vihāraṁ paṭisaṅkharonte.	addasasu kho chabbaggiyāḥ bhikkhū sattarasavaggiye bhikkhū vihāram paṭisaṅkharonte 
PA_kd_16:11.1.4	Disvāna evamāhaṁsu—	disvānaḥ 
PA_kd_16:11.1.5	“ime, āvuso, sattarasavaggiyā bhikkhū vihāraṁ paṭisaṅkharonti.	ime āvuso sattarasavaggiyāḥ bhikkhū vihāram paṭisaṅkharonti 
PA_kd_16:11.1.6	Handa ne vuṭṭhāpessāmā”ti.	handa ne vuṭṭhāpessāma ati 
PA_kd_16:11.1.7	Ekacce evamāhaṁsu—	ekacce evam ahasu 
PA_kd_16:11.1.8	“āgamethāvuso, yāva paṭisaṅkharonti, paṭisaṅkhate vuṭṭhāpessāmā”ti.	āgametha āvuso yāva paṭisaṅkharonti paṭisaṅkhate vuṭṭhāpessāma ati 
PA_kd_16:11.1.9	Atha kho chabbaggiyā bhikkhū sattarasavaggiye bhikkhū etadavocuṁ—	atha kho chabbaggiyāḥ bhikkhū sattarasavaggiye bhikkhū etat avocuḥ 
PA_kd_16:11.1.10	“uṭṭhethāvuso, amhākaṁ vihāro pāpuṇātī”ti.	uṭṭhetha āvuso amhākam vihāro pāpuṇāti iti 
PA_kd_16:11.1.11	“Nanu, āvuso, paṭikacceva ācikkhitabbaṁ?	nanu āvuso paṭikaccā iva ācikkhitabba 
PA_kd_16:11.1.12	Mayañcaññaṁ paṭisaṅkhareyyāmā”ti.	mayam caññam paṭisaṅkhareyyāma ati 
PA_kd_16:11.1.13	“Nanu, āvuso, saṅghiko vihāro”ti?	nanu āvuso saṅghikaḥ vihāraḥ iti 
PA_kd_16:11.1.14	“Āmāvuso, saṅghiko vihāro”ti.	āma āvuso saṅghikaḥ vihāraḥ iti 
PA_kd_16:11.1.15	“Uṭṭhethāvuso, amhākaṁ vihāro pāpuṇātī”ti.	uṭṭhetha āvuso amhākam vihāro pāpuṇāti iti 
PA_kd_16:11.1.16	“Mahallako, āvuso, vihāro;	mahallakaḥ āvuso vihāraḥ 
PA_kd_16:11.1.17	tumhepi vasatha, mayampi vasissāmā”ti.	tumhepi vasatha mayampi vasissāma ati 
PA_kd_16:11.1.18	“Uṭṭhethāvuso, amhākaṁ vihāro pāpuṇātī”ti kupitā anattamanā gīvāyaṁ gahetvā nikkaḍḍhanti.	uṭṭhetha āvuso amhākam vihāraḥ pāpuṇāti iti kupitāḥ anatta manāḥ gīvāyam gahetvā nikkaḍḍhanti 
PA_kd_16:11.1.19	Te nikkaḍḍhiyamānā rodanti.	te nikkaḍḍhiyamānāḥ rodanti 
PA_kd_16:11.1.20	Bhikkhū evamāhaṁsu—	bhikkhū evam āhasu 
PA_kd_16:11.1.21	“kissa tumhe, āvuso, rodathā”ti?	tumhe āvuso rodatha ati 
PA_kd_16:11.1.22	“Ime, āvuso, chabbaggiyā bhikkhū kupitā anattamanā amhe saṅghikā vihārā nikkaḍḍhantī”ti.	ime āvuso chabbaggiyāḥ bhikkhū kupitāḥ anattamanāḥ amhe saṅghikāḥ vihārāḥ nikkaḍḍhanti iti 
PA_kd_16:11.1.23	Ye te bhikkhū appicchā …pe… te ujjhāyanti khiyyanti vipācenti—	ye te bhikkhū appicchā pe te ujjhāyanti khiyyanti vipācenti 
PA_kd_16:11.1.24	“kathañhi nāma chabbaggiyā bhikkhū kupitā anattamanā bhikkhū saṅghikā vihārā nikkaḍḍhissantī”ti.	katham hi nāma chabbaggiyāḥ bhikkhū kupitāḥ anattamanāḥ bhikkhū saṅghikāḥ vihārāḥ nikkaḍḍhissanti iti 
PA_kd_16:11.1.25	Atha kho te bhikkhū bhagavato etamatthaṁ ārocesuṁ …pe…	atha kho te bhikkhū bhagavataḥ etam attham ārocesuṃ pe 
PA_kd_16:11.1.26	“saccaṁ kira, tumhe bhikkhave, kupitā anattamanā saṅghikā vihārā bhikkhū nikkaḍḍhathā”ti?	saccam kira tumhe bhikkhave kupitāḥ anattamanāḥ saṅghikāḥ vihārā bhikkhū nikkaḍḍhatha ati 
PA_kd_16:11.1.27	“Saccaṁ, bhagavā”ti …pe…	sat ca bhagavān ati pe 
PA_kd_16:11.1.28	vigarahitvā …pe…	vigara hitvā pe 
PA_kd_16:11.1.29	dhammiṁ kathaṁ katvā bhikkhū āmantesi—	dhammim katham katvā bhikkhū āmantesi 
PA_kd_16:11.1.30	“na, bhikkhave, kupitena anattamanena bhikkhu saṅghikā vihārā nikkaḍḍhitabbo.	na bhikkhave kupitena anattamanena bhikkhu saṅghikā vihārā nikkaḍḍhitabbo 
PA_kd_16:11.1.31	Yo nikkaḍḍheyya, yathādhammo kāretabbo.	yaḥ nikkaḍḍheyya yathādhammaḥ kāretabbaḥ 
PA_kd_16:11.1.32	Anujānāmi, bhikkhave, senāsanaṁ gāhetun”ti.	anujānāmi bhikkhave senāsanam gāhetun ti 
PA_kd_16:11.2.0	9. Senāsanaggāhāpakasammuti	senāsana ggāhāpaka sammuti 
PA_kd_16:11.2.1	Atha kho bhikkhūnaṁ etadahosi—	atha kho bhikkhūnam etat ahosi 
PA_kd_16:11.2.2	“kena nu kho senāsanaṁ gāhetabban”ti?	kena nu kho senāsanam gāhetabbanti 
PA_kd_16:11.2.3	Bhagavato etamatthaṁ ārocesuṁ …pe…	bhagavato etam attham ārocesuṃ pe 
PA_kd_16:11.2.4	“anujānāmi, bhikkhave, pañcahaṅgehi samannāgataṁ bhikkhuṁ senāsanaggāhāpakaṁ sammannituṁ—	anujānāmi bhikkhave pañca haṅgehi samannāgatam bhikkhum senāsana ggāhāpakam sammannitu 
PA_kd_16:11.2.5	yo na chandāgatiṁ gaccheyya, na dosāgatiṁ gaccheyya, na mohāgatiṁ gaccheyya, na bhayāgatiṁ gaccheyya, gahitāgahitañca jāneyya.	yaḥ na chanda āgatim gaccheyya na dosa āgatim gaccheyya na moha āgatim gaccheyya na bhaya āgatim gaccheyya gahita a gahitam ca jāneyya 
PA_kd_16:11.2.6	Evañca pana, bhikkhave, sammannitabbo—	evam ca pana bhikkhave sammannitabbaḥ 
PA_kd_16:11.2.7	Paṭhamaṁ bhikkhu yācitabbo, yācitvā byattena bhikkhunā paṭibalena saṅgho ñāpetabbo—	paṭhamam bhikkhu yācitabbaḥ yācitvā byattena bhikkhunā paṭibalena saṅghaḥ ñāpetabbaḥ 
PA_kd_16:11.2.8	‘Suṇātu me, bhante, saṅgho.	suṇātu me bhante saṅghaḥ 
PA_kd_16:11.2.9	Yadi saṅghassa pattakallaṁ, saṅgho itthannāmaṁ bhikkhuṁ senāsanaggāhāpakaṁ sammanneyya.	yadi saṅghassa pattakalla saṅghaḥ itthannāmam bhikkhum senāsana ggāhāpakam sammanneyya 
PA_kd_16:11.2.10	Esā ñatti.	esā ñatti 
PA_kd_16:11.2.11	Suṇātu me, bhante, saṅgho.	suṇātu me bhante saṅghaḥ 
PA_kd_16:11.2.12	Saṅgho itthannāmaṁ bhikkhuṁ senāsanaggāhāpakaṁ sammannati.	saṅghaḥ itthannāmam bhikkhum senāsana ggāhāpakam sammannati 
PA_kd_16:11.2.13	Yassāyasmato khamati itthannāmassa bhikkhuno senāsanaggāhāpakassa sammuti, so tuṇhassa;	yassa ayasmataḥ khamati itthannāmassa bhikkhuno senāsana ggāhāpakassa sammuti saḥ tuṇhassa 
PA_kd_16:11.2.14	yassa nakkhamati, so bhāseyya.	yassa na khamati saḥ bhāseyya 
PA_kd_16:11.2.15	Sammato saṅghena itthannāmo bhikkhu senāsanaggāhāpako.	sammataḥ saṅghena itthannāmaḥ bhikkhu senāsana ggāhāpako 
PA_kd_16:11.2.16	Khamati saṅghassa, tasmā tuṇhī, evametaṁ dhārayāmī’”ti.	khamati saṅghassa tasmai tuṇhī evam etam dhārayāmi iti 
PA_kd_16:11.3.1	Atha kho senāsanaggāhāpakānaṁ bhikkhūnaṁ etadahosi—	atha kho senāsana ggāhāpakānam bhikkhūnam etat ahosi 
PA_kd_16:11.3.2	“kathaṁ nu kho senāsanaṁ gāhetabban”ti?	katham nu kho senāsanam gāhetabbanti 
PA_kd_16:11.3.3	Bhagavato etamatthaṁ ārocesuṁ.	bhagavato etam attham ārocesu 
PA_kd_16:11.3.4	“Anujānāmi, bhikkhave, paṭhamaṁ bhikkhū gaṇetuṁ, bhikkhū gaṇetvā seyyā gaṇetuṁ, seyyā gaṇetvā seyyaggena gāhetun”ti.	anujānāmi bhikkhave paṭhamam bhikkhū gaṇetu bhikkhū gaṇetvā seyyā gaṇetu seyyā gaṇetvā seyyaggena gāhetunti 
PA_kd_16:11.3.5	Seyyaggena gāhentā seyyā ussārayiṁsu …pe…	seyyaggena gāhentā seyyā pe 
PA_kd_16:11.3.6	“anujānāmi, bhikkhave, vihāraggena gāhetun”ti.	anujānāmi bhikkhave vihāra aggena gāhetunti 
PA_kd_16:11.3.7	Vihāraggena gāhentā vihārā ussārayiṁsu …pe…	vihāra aggena gāhentā vihārā ussārayisu pe 
PA_kd_16:11.3.8	“anujānāmi, bhikkhave, pariveṇaggena gāhetun”ti.	anujānāmi bhikkhave pariveṇaggena gāhetunti 
PA_kd_16:11.3.9	Pariveṇaggena gāhentā pariveṇā ussārayiṁsu …pe…	pariveṇaggena gāhentā pariveṇā ussārayisu 
PA_kd_16:11.3.10	“anujānāmi, bhikkhave, anubhāgampi dātuṁ.	anujānāmi bhikkhave anubhāgam pi dātu 
PA_kd_16:11.3.11	Gahite anubhāge añño bhikkhu āgacchati, akāmā na dātabbo”ti.	gahite anubhāge aññaḥ bhikkhu āgacchati akāmā na dātabbā uti 
PA_kd_16:11.3.12	Tena kho pana samayena bhikkhū nissīme ṭhitassa senāsanaṁ gāhenti.	tena kho pana samayena bhikkhū nissīme ṭhitassa senāsanam gāhenti 
PA_kd_16:11.3.13	Bhagavato etamatthaṁ ārocesuṁ.	bhagavato etam attham ārocesu 
PA_kd_16:11.3.14	“Na, bhikkhave, nissīme ṭhitassa senāsanaṁ gāhetabbaṁ.	na bhikkhave nissīme ṭhitassa senāsanam 
PA_kd_16:11.3.15	Yo gāheyya, āpatti dukkaṭassā”ti.	yaḥ gāheyya āpatti dukkaṭassa ati 
PA_kd_16:11.3.16	Tena kho pana samayena bhikkhū senāsanaṁ gahetvā sabbakālaṁ paṭibāhanti.	tena kho pana samayena bhikkhū senāsanam gahetvā sabbakālam paṭibāhanti 
