segmentnr	original	analyzed
PA_kd_16:3.10.15	“anujānāmi, bhikkhave, padarasilaṁ nikkhipitun”ti.	anujānāmi bhikkhave padara silam nikkhipitun ti 
PA_kd_16:3.10.16	Udakaṁ santiṭṭhati …pe…	udakam santiṭṭhati pe 
PA_kd_16:3.10.17	“anujānāmi, bhikkhave, udakaniddhamanan”ti.	anujānāmi bhikkhave udaka niddhamananti 
PA_kd_16:3.11.1	Tena kho pana samayena rājā māgadho seniyo bimbisāro saṅghassa atthāya sudhāmattikālepanaṁ pāsādaṁ kāretukāmo hoti.	tena khaḥ pana samayena rājā māgadhaḥ seniyaḥ bimbisāraḥ saṅghassa atthāya sudhā mattikā lepanam pāsādam kāretu kāmaḥ hoti 
PA_kd_16:3.11.2	Atha kho bhikkhūnaṁ etadahosi—	atha kho bhikkhūnam etat ahosi 
PA_kd_16:3.11.3	“kiṁ nu kho bhagavatā chadanaṁ anuññātaṁ, kiṁ ananuññātan”ti.	kim nu kho bhagavatā chadanam anuññāta kim an anuññāta nti 
PA_kd_16:3.11.4	Bhagavato etamatthaṁ ārocesuṁ.	bhagavato etam attham ārocesu 
PA_kd_16:3.11.5	“Anujānāmi, bhikkhave, pañca chadanāni—	anujānāmi bhikkhave pañca chadanāni 
PA_kd_16:3.11.6	iṭṭhakāchadanaṁ, silāchadanaṁ, sudhāchadanaṁ, tiṇacchadanaṁ, paṇṇacchadanan”ti.	iṭṭhakāchadana silāchadana sudhāchadana tiṇacchadana paṇṇacchadana nti 
PA_kd_16:3.11.7	Paṭhamabhāṇavāro niṭṭhito.	paṭhama bhāṇa vāraḥ niṭṭhito 
PA_kd_16:4.1.0	1. Anāthapiṇḍikavatthu	anāthapiṇḍikavatthu 
PA_kd_16:4.1.1	Tena kho pana samayena anāthapiṇḍiko gahapati rājagahakassa seṭṭhissa bhaginipatiko hoti.	tena kho pana samayena anāthapiṇḍikaḥ gahapati rājagahakassa seṭṭhissa bhagini patikaḥ hoti 
PA_kd_16:4.1.2	Atha kho anāthapiṇḍiko gahapati rājagahaṁ agamāsi kenacideva karaṇīyena.	atha khalu anāthapiṇḍikaḥ gahapatiḥ rājagaham agamāsi kenacid eva karaṇīyena 
PA_kd_16:4.1.3	Tena kho pana samayena rājagahakena seṭṭhinā svātanāya buddhappamukho saṅgho nimantito hoti.	tena kho pana samayena rājagahakena seṭṭhinā svātanāya buddha ppamukhaḥ saṅghaḥ nimantitaḥ hoti 
PA_kd_16:4.1.4	Atha kho rājagahako seṭṭhī dāse ca kammakāre ca āṇāpesi—	atha kho rājagahakaḥ seṭṭhī dāse ca kammakāre ca āṇāpesi 
PA_kd_16:4.1.5	“tena hi, bhaṇe, kālasseva uṭṭhāya yāguyo pacatha, bhattāni pacatha, sūpāni sampādetha, uttaribhaṅgāni sampādethā”ti.	tena hi bhaṇe kālassa iva uṭṭhāya pacatha bhattāni pacatha sūpāni sampādetha uttari bhaṅgāni sampādetha ati 
PA_kd_16:4.1.6	Atha kho anāthapiṇḍikassa gahapatissa etadahosi—	atha kho anāthapiṇḍikassa gahapatissa etat ahosi 
PA_kd_16:4.1.7	“pubbe khvāyaṁ gahapati mayi āgate sabbakiccāni nikkhipitvā mamaññeva saddhiṁ paṭisammodati.	pubbe khvā ayam gahapati mayi āgate sabba kiccāni nikkhipitvā mamaññā iva saddhim paṭisammodati 
PA_kd_16:4.1.8	Sodānāyaṁ vikkhittarūpo dāse ca kammakāre ca āṇāpesi—	saḥ udāna ayam vikkhitta rūpaḥ dāse ca kammakāre ca āṇāpesi 
PA_kd_16:4.1.9	‘tena hi, bhaṇe, kālasseva uṭṭhāya yāguyo pacatha, bhattāni pacatha, sūpāni sampādetha, uttaribhaṅgāni sampādethā’ti.	tena hi bhaṇe kālassa iva uṭṭhāya pacatha bhattāni pacatha sūpāni sampādetha uttari bhaṅgāni sampādetha ati 
PA_kd_16:4.1.10	Kiṁ nu kho imassa gahapatissa āvāho vā bhavissati, vivāho vā bhavissati, mahāyañño vā paccupaṭṭhito, rājā vā māgadho seniyo bimbisāro nimantito svātanāya saddhiṁ balakāyenā”ti?	kim nu kho imassa gahapatissa āvāhaḥ vā bhavissati vivāhaḥ vā bhavissati mahāyaññaḥ vā paccupaṭṭhitaḥ rājā vā māgadhaḥ seniyaḥ bimbisāraḥ nimantitaḥ svātanāya saddhim balakāyena ati 
PA_kd_16:4.2.1_0	Atha kho rājagahako seṭṭhī dāse ca kammakāre ca āṇāpetvā yena anāthapiṇḍiko gahapati	atha kho rājagahakaḥ seṭṭhī dāse ca kammakāre ca āṇāpetvā yena anāthapiṇḍikaḥ gahapati 
PA_kd_16:4.2.1_1	tenupasaṅkami, upasaṅkamitvā anāthapiṇḍikena gahapatinā saddhiṁ paṭisammoditvā ekamantaṁ nisīdi.	tena upasaṅkami upasaṅkamitvā anāthapiṇḍikena gahapatinā saddhim paṭisammoditvā ekamantam nisīdi 
PA_kd_16:4.2.2	Ekamantaṁ nisinnaṁ kho rājagahakaṁ seṭṭhiṁ anāthapiṇḍiko gahapati etadavoca—	ekamantam nisinnam khalu rājagahakam seṭṭhim anāthapiṇḍikaḥ gahapati etat avoca 
PA_kd_16:4.2.3	“pubbe kho tvaṁ, gahapati, mayi āgate sabbakiccāni nikkhipitvā mamaññeva saddhiṁ paṭisammodasi.	pubbe kho tva gahapati mayi āgate sabba kiccāni nikkhipitvā mamaññā iva saddhim paṭisammodasi 
PA_kd_16:4.2.4	Sodāni tvaṁ vikkhittarūpo dāse ca kammakāre ca āṇāpesi—	sodāni tvam vikkhitta rūpaḥ dāse ca kammakāre ca āṇāpesi 
PA_kd_16:4.2.5	‘tena hi, bhaṇe, kālasseva uṭṭhāya yāguyo pacatha, bhattāni pacatha, sūpāni sampādetha, uttaribhaṅgāni sampādethā’ti.	tena hi bhaṇe kālassa iva uṭṭhāya pacatha bhattāni pacatha sūpāni sampādetha uttari bhaṅgāni sampādetha ati 
PA_kd_16:4.2.6	Kiṁ nu kho te, gahapati, āvāho vā bhavissati, vivāho vā bhavissati, mahāyañño vā paccupaṭṭhito, rājā vā māgadho seniyo bimbisāro nimantito svātanāya saddhiṁ balakāyenā”ti?	kim nu kho te gahapati āvāhaḥ vā bhavissati vivāhaḥ vā bhavissati mahāyaññaḥ vā paccupaṭṭhitaḥ rājā vā māgadhaḥ seniyaḥ bimbisāraḥ nimantitaḥ svātanāya saddhim balakāyena ati 
PA_kd_16:4.2.7	“Na me, gahapati, āvāho vā bhavissati, nāpi vivāho vā bhavissati, nāpi rājā vā māgadho seniyo bimbisāro nimantito svātanāya saddhiṁ balakāyena;	na me gahapati āvāhaḥ vā bhavissati na api vivāhaḥ vā bhavissati na api rājā vā māgadhaḥ seniyaḥ bimbisāraḥ nimantitaḥ svātanāya saddhim balakāyena 
PA_kd_16:4.2.8	api ca me mahāyañño paccupaṭṭhito;	api ca me mahā yaññaḥ paccupaṭṭhitaḥ 
PA_kd_16:4.2.9	svātanāya buddhappamukho saṅgho nimantito”ti.	svātanāya buddha ppamukho saṅghaḥ nimantito ti 
PA_kd_16:4.2.10	“Buddhoti tvaṁ, gahapati, vadesī”ti?	buddha uti tva gahapati vadesi iti 
PA_kd_16:4.2.11	“Buddho tyāhaṁ, gahapati, vadāmī”ti.	buddhaḥ tya āha gahapati vadāmi iti 
PA_kd_16:4.2.12	“Buddhoti tvaṁ, gahapati, vadesī”ti?	buddha uti tva gahapati vadesi iti 
PA_kd_16:4.2.13	“Buddho tyāhaṁ, gahapati, vadāmī”ti.	buddhaḥ tya āha gahapati vadāmi iti 
PA_kd_16:4.2.14	“Buddhoti tvaṁ, gahapati, vadesī”ti?	buddha uti tva gahapati vadesi iti 
PA_kd_16:4.2.15	“Buddho tyāhaṁ, gahapati, vadāmī”ti.	buddhaḥ tya āha gahapati vadāmi iti 
PA_kd_16:4.2.16	“Ghosopi kho eso, gahapati, dullabho lokasmiṁ yadidaṁ—	ghosaḥ api kho esaḥ gahapati dullabhaḥ lokasmin 
PA_kd_16:4.2.17	buddho buddhoti.	buddhaḥ buddha iti 
PA_kd_16:4.2.18	Sakkā nu kho, gahapati, imaṁ kālaṁ taṁ bhagavantaṁ dassanāya upasaṅkamituṁ arahantaṁ sammāsambuddhan”ti?	sakkā nu kho gahapati imam kālam tam bhagavantam dassanāya upasaṅkamitum arahantam sammāsambuddham ti 
PA_kd_16:4.2.19	“Akālo kho, gahapati, imaṁ kālaṁ taṁ bhagavantaṁ dassanāya upasaṅkamituṁ arahantaṁ sammāsambuddhaṁ.	akālaḥ kho gahapati imam kālam tam bhagavantam dassanāya upasaṅkamitum arahantam sammāsambuddha 
PA_kd_16:4.2.20	Svedāni tvaṁ kālena taṁ bhagavantaṁ dassanāya upasaṅkamissasi arahantaṁ sammāsambuddhan”ti.	svedāni tvam kālena tam bhagavantam dassanāya upasaṅkamissasi arahantam sammāsambuddhan ti 
PA_kd_16:4.2.21	Atha kho anāthapiṇḍiko gahapati—	atha khalu anāthapiṇḍikaḥ gahapati 
PA_kd_16:4.2.22	svedānāhaṁ kālena taṁ bhagavantaṁ dassanāya upasaṅkamissāmi arahantaṁ sammāsambuddhanti—	svedāna aham kālena tam bhagavantam dassanāya upasaṅkamissāmi arahantam sammāsambuddham ti 
PA_kd_16:4.2.23	buddhagatāya satiyā nipajjitvā rattiyā sudaṁ tikkhattuṁ vuṭṭhāsi pabhātaṁ maññamāno.	buddha gatāya satiyā nipajjitvā rattiyā sudam tikkhattum vuṭṭhāsi pabhātam maññamānaḥ 
PA_kd_16:4.3.1	Atha kho anāthapiṇḍiko gahapati yena sivakadvāraṁ tenupasaṅkami.	atha khalu anāthapiṇḍikaḥ gahapati yena sivaka dvāram tena upasaṅkami 
PA_kd_16:4.3.2	Amanussā dvāraṁ vivariṁsu.	amanussāḥ dvāram 
PA_kd_16:4.3.3	Atha kho anāthapiṇḍikassa gahapatissa nagaramhā nikkhantassa āloko antaradhāyi, andhakāro pāturahosi, bhayaṁ chambhitattaṁ lomahaṁso udapādi;	atha kho anāthapiṇḍikassa gahapatissa nagaramhā nikkhantassa ālokaḥ antaradhāyi andhakāraḥ pāturahosi bhayam chambhita ttam loma hasaḥ udapādi 
PA_kd_16:4.3.4	tatova puna nivattitukāmo ahosi.	tatas va punar nivattitu kāmaḥ ahosi 
PA_kd_16:4.3.5	Atha kho sivako yakkho antarahito saddamanussāvesi—	atha kho sivakaḥ yakkhaḥ antarahitaḥ saddam anussāvesi 
PA_kd_16:4.3.6	“Sataṁ hatthī sataṁ assā,	satam hatthī satam assā 
PA_kd_16:4.3.7	Sataṁ assatarīrathā;	satam 
PA_kd_16:4.3.8	Sataṁ kaññāsahassāni,	satam kaññā sahassāni 
PA_kd_16:4.3.9	Āmukkamaṇikuṇḍalā;	āmukka maṇi kuṇḍalā 
PA_kd_16:4.3.10	Ekassa padavītihārassa,	ekassa padavītihārassa 
PA_kd_16:4.3.11	Kalaṁ nāgghanti soḷasiṁ.	kalam nāk hanti soḷasi 
PA_kd_16:4.3.12	Abhikkama gahapati abhikkama gahapati,	abhikkama gahapati abhikkama gahapati 
PA_kd_16:4.3.13	Abhikkantaṁ te seyyo no paṭikkantan”ti.	abhikkantam te seyyaḥ no paṭikkantanti 
PA_kd_16:4.3.14	Atha kho anāthapiṇḍikassa gahapatissa andhakāro antaradhāyi, āloko pāturahosi.	atha kho anāthapiṇḍikassa gahapatissa andhakāraḥ antaradhāyi ālokaḥ pāturahosi 
PA_kd_16:4.3.15	Yaṁ ahosi bhayaṁ chambhitattaṁ lomahaṁso so paṭippassambhi.	yam ahosi bhayam chambhitattam loma hasaḥ saḥ paṭippassambhi 
PA_kd_16:4.3.16	Dutiyampi kho …pe…	dutiyam pi kho pe 
PA_kd_16:4.3.17	tatiyampi kho …	tatiyam pi kho 
PA_kd_16:4.3.18	anāthapiṇḍikassa gahapatissa āloko antaradhāyi, andhakāro pāturahosi, bhayaṁ chambhitattaṁ lomahaṁso udapādi, tatova puna nivattitukāmo ahosi.	anāthapiṇḍikassa gahapatissa ālokaḥ antaradhāyi andhakāraḥ pāturahosi bhayam chambhita ttam loma hasaḥ udapādi tatas va puna nivattitu kāmaḥ ahosi 
PA_kd_16:4.3.19	Tatiyampi kho sivako yakkho antarahito saddamanussāvesi—	tatiyam pi kho sivakaḥ yakkhaḥ antarahitaḥ saddam anussāvesi 
PA_kd_16:4.3.20	“Sataṁ hatthī sataṁ assā,	satam hatthī satam assā 
PA_kd_16:4.3.21	Sataṁ assatarīrathā;	satam 
PA_kd_16:4.3.22	Sataṁ kaññāsahassāni,	satam kaññā sahassāni 
PA_kd_16:4.3.23	Āmukkamaṇikuṇḍalā;	āmukka maṇi kuṇḍalā 
PA_kd_16:4.3.24	Ekassa padavītihārassa,	ekassa padavītihārassa 
PA_kd_16:4.3.25	Kalaṁ nāgghanti soḷasiṁ.	kalam nāk hanti soḷasi 
PA_kd_16:4.3.26	Abhikkama gahapati abhikkama gahapati,	abhikkama gahapati abhikkama gahapati 
PA_kd_16:4.3.27	Abhikkantaṁ te seyyo no paṭikkantan”ti.	abhikkantam te seyyaḥ no paṭikkantanti 
PA_kd_16:4.3.28	Tatiyampi kho anāthapiṇḍikassa gahapatissa andhakāro antaradhāyi, āloko pāturahosi, yaṁ ahosi bhayaṁ chambhitattaṁ lomahaṁso, so paṭippassambhi.	tatiyam pi kho anāthapiṇḍikassa gahapatissa andhakāraḥ antaradhāyi ālokaḥ pāturahosi yam ahosi bhayam chambhita ttam loma haso saḥ paṭippassambhi 
PA_kd_16:4.4.1	Atha kho anāthapiṇḍiko gahapati yena sītavanaṁ tenupasaṅkami.	atha khalu anāthapiṇḍikaḥ gahapati yena sītavanam tena upasaṅkami 
PA_kd_16:4.4.2	Tena kho pana samayena bhagavā rattiyā paccūsasamayaṁ paccuṭṭhāya ajjhokāse caṅkamati.	tena kho pana samayena bhagavā rattiyā paccūsa samayam paccuṭṭhāya ajjhokāse caṅkamati 
PA_kd_16:4.4.3	Addasā kho bhagavā anāthapiṇḍikaṁ gahapatiṁ dūratova āgacchantaṁ.	addasā khalu bhagavā anāthapiṇḍikam gahapatim dūratas u āgacchanta 
PA_kd_16:4.4.4	Disvāna caṅkamā orohitvā paññatte āsane nisīdi.	disvāna caṅkamā orohitvā paññatte āsane nisīdi 
PA_kd_16:4.4.5	Nisajja kho bhagavā anāthapiṇḍikaṁ gahapatiṁ etadavoca—	nisajja khalu bhagavān anāthapiṇḍikam gahapatim etat avoca 
PA_kd_16:4.4.6	“ehi, sudattā”ti.	ehi su datta iti 
PA_kd_16:4.4.7	Atha kho anāthapiṇḍiko gahapati—	atha khalu anāthapiṇḍikaḥ gahapati 
PA_kd_16:4.4.8	“nāmena maṁ bhagavā ālapatī”ti—	nāmena mam bhagavā ālapati iti 
PA_kd_16:4.4.9	haṭṭho udaggo yena bhagavā tenupasaṅkami, upasaṅkamitvā bhagavato pādesu sirasā nipatitvā bhagavantaṁ etadavoca—	haṭṭhaḥ udaggaḥ yena bhagavā tena upasaṅkami upasaṅkamitvā bhagavataḥ pādesu sirasā nipatitvā bhagavantam etat avoca 
PA_kd_16:4.4.10	“kacci, bhante, bhagavā sukhaṁ sayitthā”ti?	kacci bhante bhagavā sukham sayittha iti 
PA_kd_16:4.4.11	“Sabbadā ve sukhaṁ seti,	sabbadā ve sukham seti 
PA_kd_16:4.4.12	brāhmaṇo parinibbuto;	brāhmaṇaḥ parinibbutaḥ 
PA_kd_16:4.4.13	Yo na limpati kāmesu,	yaḥ na limpati kāmesu 
PA_kd_16:4.4.14	sītibhūto nirūpadhi.	sīti bhūtaḥ nirūpadhi 
PA_kd_16:4.4.15	Sabbā āsattiyo chetvā,	sabbāḥ āsattiyaḥ chetvā 
PA_kd_16:4.4.16	vineyya hadaye daraṁ;	vineyya hadaye dara 
PA_kd_16:4.4.17	Upasanto sukhaṁ seti,	upasantaḥ sukham seti 
PA_kd_16:4.4.18	santiṁ pappuyya cetasā”ti.	santim pappuyya cetasā ati 
PA_kd_16:4.5.1	Atha kho bhagavā anāthapiṇḍikassa gahapatissa anupubbiṁ kathaṁ kathesi, seyyathidaṁ—	atha kho bhagavā anāthapiṇḍikassa gahapatissa anupubbim katham kathesi 
PA_kd_16:4.5.2	dānakathaṁ sīlakathaṁ saggakathaṁ, kāmānaṁ ādīnavaṁ okāraṁ saṅkilesaṁ, nekkhamme ānisaṁsaṁ pakāsesi.	dāna katham sīla katham sagga katha kāmānam ādīnavam okāram saṅkilesa nekkhamme ānisasam pakāsesi 
PA_kd_16:4.5.3	Yadā bhagavā aññāsi anāthapiṇḍikaṁ gahapatiṁ kallacittaṁ muducittaṁ vinīvaraṇacittaṁ udaggacittaṁ pasannacittaṁ, atha yā buddhānaṁ sāmukkaṁsikā dhammadesanā taṁ pakāsesi—	yadā bhagavā aññāsi anāthapiṇḍikam gahapatim kalla cittam mudu cittam vinīvaraṇa cittam udagga cittam pasanna citta atha yā buddhānam sāmukkasikā dhamma desanā tam pakāsesi 
PA_kd_16:4.5.4	dukkhaṁ, samudayaṁ, nirodhaṁ, maggaṁ.	dukkha samudaya nirodha magga 
PA_kd_16:4.5.5	Seyyathāpi nāma suddhaṁ vatthaṁ apagatakāḷakaṁ sammadeva rajanaṁ paṭiggaṇheyya;	seyyathā api nāma suddham vattham apagata kāḷakam sammat eva rajanam paṭiggaṇheyya 
PA_kd_16:4.5.6	evameva anāthapiṇḍikassa gahapatissa tasmiṁyeva āsane virajaṁ vītamalaṁ dhammacakkhuṁ udapādi—	evam eva anāthapiṇḍikassa gahapatissa tasmiyā eva āsane virajam vīta malam dhamma cakkhum udapādi 
PA_kd_16:4.5.7	“yaṁ kiñci samudayadhammaṁ sabbaṁ taṁ nirodhadhamman”ti.	yam kiñci samudaya dhammam sabbam tat nirodha dhamman ti 
PA_kd_16:4.5.8_0	Atha kho anāthapiṇḍiko gahapati diṭṭhadhammo pattadhammo viditadhammo pariyogāḷhadhammo	atha kho anāthapiṇḍikaḥ gahapati diṭṭha dhammo patta dhammo vidita dhammo pariyogāḷha dhammo 
PA_kd_16:4.5.8_1	tiṇṇavicikiccho vigatakathaṅkatho vesārajjappatto aparappaccayo satthusāsane bhagavantaṁ etadavoca—	tiṇṇa vicikicchaḥ vigata kathaṅkathaḥ vesārajja ppatto apara ppaccayaḥ satthu sāsane bhagavantam etat avoca 
PA_kd_16:4.5.9	“abhikkantaṁ, bhante, abhikkantaṁ, bhante.	abhikkanta bhante abhikkanta bhante 
PA_kd_16:4.5.10	Seyyathāpi, bhante, nikkujjitaṁ vā ukkujjeyya, paṭicchannaṁ vā vivareyya, mūḷhassa vā maggaṁ ācikkheyya, andhakāre vā telapajjotaṁ dhāreyya—	seyyathā api bhante nikkujjitam vā ukkujjeyya paṭicchannam vā vivareyya mūḷhassa vā maggam ācikkheyya andhakāre vā tela pajjotam dhāreyya 
PA_kd_16:4.5.11	‘cakkhumanto rūpāni dakkhantī’ti;	cakkhumantaḥ rūpāni dakkhanti iti 
PA_kd_16:4.5.12	evamevaṁ bhagavatā anekapariyāyena dhammo pakāsito.	evam evam bhagavatā aneka pariyāyena dhammo pakāsito 
PA_kd_16:4.5.13	Esāhaṁ, bhante, bhagavantaṁ saraṇaṁ gacchāmi, dhammañca, bhikkhusaṅghañca.	esā aha bhante bhagavantam saraṇam gacchāmi dhammañca bhikkhu saṅghañca 
PA_kd_16:4.5.14	Upāsakaṁ maṁ bhagavā dhāretu ajjatagge pāṇupetaṁ saraṇaṁ gataṁ.	upāsakam mam bhagavā dhāretu ajjatagge pāṇa upetam saraṇam gata 
PA_kd_16:4.5.15	Adhivāsetu ca me, bhante, bhagavā svātanāya bhattaṁ saddhiṁ bhikkhusaṅghenā”ti.	adhivāsetu ca me bhante bhagavā svātanāya bhattam saddhim bhikkhu saṅghena ati 
PA_kd_16:4.5.16	Adhivāsesi bhagavā tuṇhībhāvena.	adhivāsesi bhagavā tuṇhībhāvena 
PA_kd_16:4.5.17	Atha kho anāthapiṇḍiko gahapati bhagavato adhivāsanaṁ viditvā uṭṭhāyāsanā bhagavantaṁ abhivādetvā padakkhiṇaṁ katvā pakkāmi.	atha kho anāthapiṇḍikaḥ gahapati bhagavataḥ adhivāsanam viditvā uṭṭhāya āsanā bhagavantam abhivādetvā padakkhiṇam katvā pakkāmi 
PA_kd_16:4.6.1	Assosi kho rājagahako seṭṭhī—	assosi kho rājagahakaḥ seṭṭhī 
PA_kd_16:4.6.2	“anāthapiṇḍikena kira gahapatinā svātanāya buddhappamukho saṅgho nimantito”ti.	anāthapiṇḍikena kira gahapatinā svātanāya buddha ppamukho saṅghaḥ nimantito ti 
PA_kd_16:4.6.3	Atha kho rājagahako seṭṭhī anāthapiṇḍikaṁ gahapatiṁ etadavoca—	atha khalu rājagahakaḥ seṭṭhī anāthapiṇḍikam gahapatim etat avoca 
PA_kd_16:4.6.4	“tayā kira, gahapati, svātanāya buddhappamukho saṅgho nimantito.	tayā kira gahapati svātanāya buddha ppamukhaḥ saṅghaḥ nimantitaḥ 
PA_kd_16:4.6.5	Tvañcāsi āgantuko.	tvañca asi āgantukaḥ 
PA_kd_16:4.6.6	Demi te, gahapati, veyyāyikaṁ yena tvaṁ buddhappamukhassa saṅghassa bhattaṁ kareyyāsī”ti.	demi te gahapati veyyāyikam yena tvam buddha ppamukhassa saṅghassa bhattam kareyyāsi iti 
PA_kd_16:4.6.7	“Alaṁ, gahapati, atthi me veyyāyikaṁ yenāhaṁ buddhappamukhassa saṅghassa bhattaṁ karissāmī”ti.	ala gahapati atthi me veyyāyikam yena aham buddha ppamukhassa saṅghassa bhattam karissāmi iti 
PA_kd_16:4.6.8	Assosi kho rājagahako negamo—	assosi kho rājagahakaḥ negamo 
PA_kd_16:4.6.9	“anāthapiṇḍikena kira gahapatinā svātanāya buddhappamukho saṅgho nimantito”ti.	anāthapiṇḍikena kira gahapatinā svātanāya buddha ppamukho saṅghaḥ nimantito ti 
PA_kd_16:4.6.10	Atha kho rājagahako negamo anāthapiṇḍikaṁ gahapatiṁ etadavoca—	atha khalu rājagahakaḥ negamaḥ anāthapiṇḍikam gahapatim etat avoca 
PA_kd_16:4.6.11	“tayā kira, gahapati, svātanāya buddhappamukho saṅgho nimantito.	tayā kira gahapati svātanāya buddha ppamukhaḥ saṅghaḥ nimantitaḥ 
PA_kd_16:4.6.12	Tvañcāsi āgantuko.	tvañca asi āgantukaḥ 
PA_kd_16:4.6.13	Demi te, gahapati, veyyāyikaṁ yena tvaṁ buddhappamukhassa saṅghassa bhattaṁ kareyyāsī”ti.	demi te gahapati veyyāyikam yena tvam buddha ppamukhassa saṅghassa bhattam kareyyāsi iti 
PA_kd_16:4.6.14	“Alaṁ, ayya;	ala ayya 
PA_kd_16:4.6.15	atthi me veyyāyikaṁ yenāhaṁ buddhappamukhassa saṅghassa bhattaṁ karissāmī”ti.	atthi me veyyāyikam yena aham buddha ppamukhassa saṅghassa bhattam karissāmi iti 
PA_kd_16:4.6.16	Assosi kho rājā māgadho seniyo bimbisāro—	assosi kho rājā māgadhaḥ seniyaḥ bimbisāraḥ 
PA_kd_16:4.6.17	“anāthapiṇḍikena kira gahapatinā svātanāya buddhappamukho saṅgho nimantito”ti.	anāthapiṇḍikena kira gahapatinā svātanāya buddha ppamukho saṅghaḥ nimantito ti 
PA_kd_16:4.6.18	Atha kho rājā māgadho seniyo bimbisāro anāthapiṇḍikaṁ gahapatiṁ etadavoca—	atha khalu rājā māgadhaḥ seniyaḥ bimbisāraḥ anāthapiṇḍikam gahapatim etat avoca 
PA_kd_16:4.6.19	“tayā kira, gahapati, svātanāya buddhappamukho saṅgho nimantito.	tayā kira gahapati svātanāya buddha ppamukhaḥ saṅghaḥ nimantitaḥ 
PA_kd_16:4.6.20	Tvañcāsi āgantuko.	tvañca asi āgantukaḥ 
PA_kd_16:4.6.21	Demi te, gahapati, veyyāyikaṁ yena tvaṁ buddhappamukhassa saṅghassa bhattaṁ kareyyāsī”ti.	demi te gahapati veyyāyikam yena tvam buddha ppamukhassa saṅghassa bhattam kareyyāsi iti 
PA_kd_16:4.6.22	“Alaṁ, deva;	ala deva 
PA_kd_16:4.6.23	atthi me veyyāyikaṁ yenāhaṁ buddhappamukhassa saṅghassa bhattaṁ karissāmī”ti.	atthi me veyyāyikam yena aham buddha ppamukhassa saṅghassa bhattam karissāmi iti 
PA_kd_16:4.7.1	Atha kho anāthapiṇḍiko gahapati tassā rattiyā accayena rājagahakassa seṭṭhissa nivesane paṇītaṁ khādanīyaṁ bhojanīyaṁ paṭiyādāpetvā bhagavato kālaṁ ārocāpesi—	atha kho anāthapiṇḍikaḥ gahapati tassāḥ rattiyāḥ accayena rājagahakassa seṭṭhissa nivesane paṇītam khādanīyam bhojanīyam paṭiyādāpetvā bhagavataḥ kālam ārocāpesi 
PA_kd_16:4.7.2	“kālo, bhante, niṭṭhitaṁ bhattan”ti.	kālaḥ bhante niṭṭhitam bhattanti 
PA_kd_16:4.7.3	Atha kho bhagavā pubbaṇhasamayaṁ nivāsetvā pattacīvaramādāya yena rājagahakassa seṭṭhissa nivesanaṁ tenupasaṅkami, upasaṅkamitvā paññatte āsane nisīdi saddhiṁ bhikkhusaṅghena.	atha kho bhagavā pubbaṇhasamayam nivāsetvā patta cīvaram ādāya yena rājagahakassa seṭṭhissa nivesanam tena upasaṅkami upasaṅkamitvā paññatte āsane nisīdi saddhim bhikkhu saṅghena 
PA_kd_16:4.7.4_0	Atha kho anāthapiṇḍiko gahapati buddhappamukhaṁ bhikkhusaṅghaṁ paṇītena khādanīyena	atha kho anāthapiṇḍikaḥ gahapati buddha ppamukham bhikkhu saṅgham paṇītena khādanīyena 
PA_kd_16:4.7.4_1	bhojanīyena sahatthā santappetvā sampavāretvā, bhagavantaṁ bhuttāviṁ onītapattapāṇiṁ, ekamantaṁ nisīdi.	bhojanīyena sahatthā santappetvā sampavāretvā bhagavantam bhuttāvim onīta patta pāṇi ekamantam nisīdi 
PA_kd_16:4.7.5	Ekamantaṁ nisinno kho anāthapiṇḍiko gahapati bhagavantaṁ etadavoca—	eka mantam nisinnaḥ khalu anāthapiṇḍikaḥ gahapati bhagavantam etat avoca 
PA_kd_16:4.7.6	“adhivāsetu me, bhante, bhagavā sāvatthiyaṁ vassāvāsaṁ saddhiṁ bhikkhusaṅghenā”ti.	adhivāsetu me bhante bhagavā sāvatthiyam vassa āvāsam saddhim bhikkhu saṅghena ati 
PA_kd_16:4.7.7	“Suññāgāre kho, gahapati, tathāgatā abhiramantī”ti.	suññāgāre kho gahapati tathāgatāḥ abhiramanti iti 
PA_kd_16:4.7.8	“Aññātaṁ, bhagavā, aññātaṁ, sugatā”ti.	bhagavā aññāta sugatā ati 
PA_kd_16:4.7.9	Atha kho bhagavā anāthapiṇḍikaṁ gahapatiṁ dhammiyā kathāya sandassetvā samādapetvā samuttejetvā sampahaṁsetvā uṭṭhāyāsanā pakkāmi.	atha kho bhagavā anāthapiṇḍikam gahapatim dhammiyā kathāya sandassetvā samādapetvā samuttejetvā sampahasetvā uṭṭhāya āsanā pakkāmi 
PA_kd_16:4.8.1	Tena kho pana samayena anāthapiṇḍiko gahapati bahumitto hoti bahusahāyo ādeyyavāco.	tena khalu pana samayena anāthapiṇḍikaḥ gahapati bahu mittaḥ hoti bahu sahāyaḥ ādeyya vācaḥ 
PA_kd_16:4.8.2	Atha kho anāthapiṇḍiko gahapati rājagahe taṁ karaṇīyaṁ tīretvā yena sāvatthi tena pakkāmi.	atha kho anāthapiṇḍikaḥ gahapatiḥ rājagahe tam karaṇīyam tīretvā yena sāvatthi tena pakkāmi 
PA_kd_16:4.8.3	Atha kho anāthapiṇḍiko gahapati antarāmagge manusse āṇāpesi—	atha kho anāthapiṇḍikaḥ gahapati antarāmagge manusse āṇāpesi 
PA_kd_16:4.8.4	“ārāme, ayyā, karotha, vihāre patiṭṭhāpetha, dānāni paṭṭhapetha.	ārāme ayyā karotha vihāre patiṭṭhāpetha dānāni paṭṭhapetha 
PA_kd_16:4.8.5	Buddho loke uppanno.	buddhaḥ loke uppannaḥ 
PA_kd_16:4.8.6	So ca mayā bhagavā nimantito iminā maggena āgacchissatī”ti.	saḥ ca mayā bhagavā nimantitaḥ iminā maggena āgacchissati iti 
PA_kd_16:4.8.7	Atha kho te manussā anāthapiṇḍikena gahapatinā uyyojitā ārāme akaṁsu, vihāre patiṭṭhāpesuṁ, dānāni paṭṭhapesuṁ.	atha kho te manussāḥ anāthapiṇḍikena gahapatinā uyyojitāḥ ārāme vihāre patiṭṭhāpesu dānāni paṭṭhapesu 
PA_kd_16:4.8.8	Atha kho anāthapiṇḍiko gahapati sāvatthiṁ gantvā samantā sāvatthiṁ anuvilokesi—	atha kho anāthapiṇḍikaḥ gahapati sāvatthim gantvā samantā sāvatthim anuvilokesi 
PA_kd_16:4.8.9	“kattha nu kho bhagavā vihareyya?	kattha nu khalu bhagavā vihareyya 
PA_kd_16:4.8.10_0	Yaṁ assa gāmato neva atidūre na accāsanne, gamanāgamanasampannaṁ, atthikānaṁ atthikānaṁ	yam assa gāmataḥ na iva atidūre na acca āsanne gamana āgamana sampanna atthikānam atthikāna 
PA_kd_16:4.8.10_1	manussānaṁ abhikkamanīyaṁ, divā appākiṇṇaṁ, rattiṁ appasaddaṁ, appanigghosaṁ, vijanavātaṁ,	manussānam abhikkamanīya divā appa ākiṇṇa rattim appa sadda appa nigghosa vijana vāta 
PA_kd_16:4.8.10_2	manussarāhasseyyakaṁ, paṭisallānasāruppan”ti.	manussa rāhasseyyaka 
PA_kd_16:4.9.1	Addasā kho anāthapiṇḍiko gahapati jetassa kumārassa uyyānaṁ—	addasā kho anāthapiṇḍikaḥ gahapati jetassa kumārassa uyyāna 
PA_kd_16:4.9.2_0	gāmato neva atidūre na accāsanne, gamanāgamanasampannaṁ, atthikānaṁ atthikānaṁ manussānaṁ	gāmataḥ na iva atidūre na acca āsanne gamana āgamana sampanna atthikānam atthikānam manussāna 
PA_kd_16:4.9.2_1	abhikkamanīyaṁ, divā appākiṇṇaṁ, rattiṁ appasaddaṁ, appanigghosaṁ, vijanavātaṁ, manussarāhasseyyakaṁ,	abhikkamanīya divā appa ākiṇṇa rattim appa sadda appa nigghosa vijana vāta manussa rāhasseyyaka 
PA_kd_16:4.9.2_2	paṭisallānasāruppaṁ.	      
PA_kd_16:4.9.3	Disvāna yena jeto kumāro tenupasaṅkami, upasaṅkamitvā jetaṁ kumāraṁ etadavoca—	disvāna yena jeto kumāraḥ tena upasaṅkami upasaṅkamitvā jetam kumāram etat avoca 
