segmentnr	original	analyzed
PA_kd_14:14.25.8	Sādhu, bhante, therā imaṁ adhikaraṇaṁ vūpasamentu dhammena vinayena satthusāsanena, yathayidaṁ adhikaraṇaṁ suvūpasantaṁ assā”ti.	sādhu bhante therāḥ imam adhikaraṇam vūpasamentu dhammena vinayena satthu sāsanena yathayidam adhikaraṇam su vūpasantam assa ati 
PA_kd_14:14.25.9	Atha kho te therā—	atha khalu te therā 
PA_kd_14:14.25.10	yathā sāvatthiyā saṅghena adhikaraṇaṁ vūpasamitaṁ tathā suvūpasantanti—	yathā sāvatthiyā saṅghena adhikaraṇam vūpasamitam tathā 
PA_kd_14:14.25.11	tathā taṁ adhikaraṇaṁ vūpasamesuṁ.	tathā tam adhikaraṇam vūpasamesu 
PA_kd_14:14.25.12	Atha kho te bhikkhū—	atha kho te bhikkhū 
PA_kd_14:14.25.13	asantuṭṭhā sāvatthiyā saṅghassa adhikaraṇavūpasamanena, asantuṭṭhā sambahulānaṁ therānaṁ adhikaraṇavūpasamanena—	asantuṭṭhā sāvatthiyā saṅghassa adhikaraṇa vūpasamanena asantuṭṭhā sambahulānam therānam adhikaraṇa vūpasamanena 
PA_kd_14:14.25.14	assosuṁ kho amukasmiṁ kira āvāse tayo therā viharanti …pe…	assosum kho amukasmin kira āvāse tayaḥ therāḥ viharanti pe 
PA_kd_14:14.25.15	dve therā viharanti …pe…	dve therāḥ viharanti pe 
PA_kd_14:14.25.16	eko thero viharati bahussuto āgatāgamo dhammadharo vinayadharo mātikādharo paṇḍito viyatto medhāvī lajjī kukkuccako sikkhākāmo.	ekaḥ theraḥ viharati bahu sutaḥ āgata āgamaḥ dhamma dharaḥ vinaya dharaḥ mātikā dharaḥ paṇḍitaḥ viyattaḥ medhāvī lajjī kukkuccako sikkhā kāmo 
PA_kd_14:14.25.17	So ce thero imaṁ adhikaraṇaṁ vūpasameyya dhammena vinayena satthusāsanena, evamidaṁ adhikaraṇaṁ suvūpasantaṁ assāti.	saḥ ce theraḥ imam adhikaraṇam vūpasameyya dhammena vinayena satthu sāsanena evam idam adhikaraṇam su vūpasantam assa ati 
PA_kd_14:14.25.18	Atha kho te bhikkhū taṁ āvāsaṁ gantvā taṁ theraṁ etadavocuṁ—	atha kho te bhikkhū tam āvāsam gantvā tam theram etat avocuḥ 
PA_kd_14:14.25.19	“idaṁ, bhante, adhikaraṇaṁ evaṁ jātaṁ, evaṁ samuppannaṁ.	idam bhante adhikaraṇam evam jāta evam samuppanna 
PA_kd_14:14.25.20	Sādhu, bhante, thero imaṁ adhikaraṇaṁ vūpasametu dhammena vinayena satthusāsanena, yathayidaṁ adhikaraṇaṁ suvūpasantaṁ assā”ti.	sādhu bhante theraḥ imam adhikaraṇam vūpasametu dhammena vinayena satthu sāsanena yathayidam adhikaraṇam su vūpasantam assa ati 
PA_kd_14:14.25.21	Atha kho so thero—	atha kho saḥ theraḥ 
PA_kd_14:14.25.22_0	yathā sāvatthiyā saṅghena adhikaraṇaṁ vūpasamitaṁ, yathā sambahulehi therehi adhikaraṇaṁ	yathā sāvatthiyā saṅghena adhikaraṇam yathā sambahulehi therehi 
PA_kd_14:14.25.22_1	vūpasamitaṁ, yathā tīhi therehi adhikaraṇaṁ vūpasamitaṁ, yathā dvīhi therehi adhikaraṇaṁ	vūpasamita yathā tīhi therehi adhikaraṇam vūpasamita yathā dvīhi therehi 
PA_kd_14:14.25.22_2	vūpasamitaṁ, tathā suvūpasantanti—	tathā 
PA_kd_14:14.25.23	tathā taṁ adhikaraṇaṁ vūpasamesi.	tathā tam adhikaraṇam vūpasamesi 
PA_kd_14:14.25.24_0	Atha kho te bhikkhū asantuṭṭhā sāvatthiyā saṅghassa adhikaraṇavūpasamanena, asantuṭṭhā	atha kho te bhikkhū asantuṭṭhā sāvatthiyā saṅghassa adhikaraṇa vūpasamanena asantuṭṭhā 
PA_kd_14:14.25.24_1	sambahulānaṁ therānaṁ adhikaraṇavūpasamanena, asantuṭṭhā tiṇṇaṁ therānaṁ adhikaraṇavūpasamanena,	sambahulānam therānam adhikaraṇa vūpasamanena asantuṭṭhā tiṇṇam therānam adhikaraṇa vūpasamanena 
PA_kd_14:14.25.24_2	asantuṭṭhā dvinnaṁ therānaṁ adhikaraṇavūpasamanena, asantuṭṭhā ekassa therassa adhikaraṇavūpasamanena,	asantuṭṭhāḥ dvinnam therānam adhikaraṇa vūpasamanena asantuṭṭhāḥ ekassa therassa adhikaraṇa vūpasamanena 
PA_kd_14:14.25.24_3	yena bhagavā tenupasaṅkamiṁsu, upasaṅkamitvā bhagavato etamatthaṁ ārocesuṁ …pe…	yena bhagavā tena upasaṅkamisu upasaṅkamitvā bhagavataḥ etam attham ārocesuṃ pe 
PA_kd_14:14.25.25	“Nihatametaṁ, bhikkhave, adhikaraṇaṁ santaṁ vūpasantaṁ suvūpasantaṁ.	nihatam eta bhikkhave adhikaraṇam santam vūpasantam su vūpasanta 
PA_kd_14:14.26.1	Anujānāmi, bhikkhave, tesaṁ bhikkhūnaṁ saññattiyā tayo salākaggāhe—	anujānāmi bhikkhave tesam bhikkhūnam saññattiyā tayo salākaggāhe 
PA_kd_14:14.26.2	gūḷhakaṁ, sakaṇṇajappakaṁ, vivaṭakaṁ.	gūḷhaka sa kaṇṇajappaka vivaṭaka 
PA_kd_14:14.26.3	Kathañca, bhikkhave, gūḷhako salākaggāho hoti?	katham ca bhikkhave gūḷhakaḥ salākaggāhaḥ hoti 
PA_kd_14:14.26.4	Tena salākaggāhāpakena bhikkhunā salākāyo vaṇṇāvaṇṇāyo katvā ekameko bhikkhu upasaṅkamitvā evamassa vacanīyo—	tena salākaggāhāpakena bhikkhunā salākāyaḥ vaṇṇa avaṇṇāyaḥ katvā ekamekaḥ bhikkhu upasaṅkamitvā evam assa vacanīyaḥ 
PA_kd_14:14.26.5	‘ayaṁ evaṁvādissa salākā, ayaṁ evaṁvādissa salākā.	ayam eva vādissa salākā ayam eva vādissa salākā 
PA_kd_14:14.26.6	Yaṁ icchasi taṁ gaṇhāhī’ti.	yam icchasi tam gaṇhāhi iti 
PA_kd_14:14.26.7	Gahite vattabbo—	gahite vattabbaḥ 
PA_kd_14:14.26.8	‘mā ca kassaci dassehī’ti.	mā ca kassaci dassehi iti 
PA_kd_14:14.26.9	Sace jānāti—	sace jānāti 
PA_kd_14:14.26.10	adhammavādī bahutarāti, duggahoti, paccukkaḍḍhitabbaṁ.	adhamma vādī 
PA_kd_14:14.26.11	Sace jānāti—	sace jānāti 
PA_kd_14:14.26.12	dhammavādī bahutarāti, suggahoti, sāvetabbaṁ.	dhamma vādī bahutarā ati suggahā ti 
PA_kd_14:14.26.13	Evaṁ kho, bhikkhave, gūḷhako salākaggāho hoti.	evam kho bhikkhave gūḷhakaḥ salākaggāhaḥ hoti 
PA_kd_14:14.26.14	Kathañca, bhikkhave, sakaṇṇajappako salākaggāho hoti?	katham ca bhikkhave sa kaṇṇajappakaḥ salākaggāhaḥ hoti 
PA_kd_14:14.26.15	Tena salākaggāhāpakena bhikkhunā ekamekassa bhikkhuno upakaṇṇake ārocetabbaṁ—	tena salākaggāhāpakena bhikkhunā ekamekassa bhikkhuno upakaṇṇake ārocetabba 
PA_kd_14:14.26.16	‘ayaṁ evaṁvādissa salākā, ayaṁ evaṁvādissa salākā.	ayam eva vādissa salākā ayam eva vādissa salākā 
PA_kd_14:14.26.17	Yaṁ icchasi taṁ gaṇhāhī’ti.	yam icchasi tam gaṇhāhi iti 
PA_kd_14:14.26.18	Gahite vattabbo—	gahite vattabbaḥ 
PA_kd_14:14.26.19	‘mā ca kassaci ārocehī’ti.	mā ca kassaci ārocehi iti 
PA_kd_14:14.26.20	Sace jānāti—	sace jānāti 
PA_kd_14:14.26.21	adhammavādī bahutarāti, duggahoti, paccukkaḍḍhitabbaṁ.	adhamma vādī 
PA_kd_14:14.26.22	Sace jānāti—	sace jānāti 
PA_kd_14:14.26.23	dhammavādī bahutarāti, suggahoti, sāvetabbaṁ.	dhamma vādī bahutarā ati suggahā ti 
PA_kd_14:14.26.24	Evaṁ kho, bhikkhave, sakaṇṇajappako salākaggāho hoti.	evam kho bhikkhave sa kaṇṇajappakaḥ salākaggāhaḥ hoti 
PA_kd_14:14.26.25	Kathañca, bhikkhave, vivaṭako salākaggāho hoti?	katham ca bhikkhave vivaṭakaḥ salākaggāhaḥ hoti 
PA_kd_14:14.26.26	Sace jānāti—	sace jānāti 
PA_kd_14:14.26.27	dhammavādī bahutarāti, vissaṭṭheneva vivaṭena gāhetabbo.	dhamma vādī bahutarā ati vissaṭṭhena iva vivaṭena gāhetabbaḥ 
PA_kd_14:14.26.28	Evaṁ kho, bhikkhave, vivaṭako salākaggāho hoti.	evam kho bhikkhave vivaṭakaḥ salākaggāhaḥ hoti 
PA_kd_14:14.26.29	Ime kho, bhikkhave, tayo salākaggāhā”ti.	ime kho bhikkhave tayo salākaggāhā ati 
PA_kd_14:14.27.0	9.5. Sativinaya	sati vinaya 
PA_kd_14:14.27.1	“Anuvādādhikaraṇaṁ katihi samathehi sammati?	anuvāda adhikaraṇam katihi samathehi sammati 
PA_kd_14:14.27.2	Anuvādādhikaraṇaṁ catūhi samathehi sammati—	anuvāda adhikaraṇam catūhi samathehi sammati 
PA_kd_14:14.27.3	sammukhāvinayena ca, sativinayena ca, amūḷhavinayena ca, tassapāpiyasikāya ca.	sammukhā vinayena ca sati vinayena ca amūḍha vinayena ca ca 
PA_kd_14:14.27.4	Siyā anuvādādhikaraṇaṁ dve samathe anāgamma—	anuvāda adhikaraṇam dve samathe 
PA_kd_14:14.27.5	amūḷhavinayañca, tassapāpiyasikañca;	a mūḍha vinayañca tassa pāpiyasikañca 
PA_kd_14:14.27.6	dvīhi samathehi sammeyya—	dvīhi samathehi sammeyya 
PA_kd_14:14.27.7	sammukhāvinayena ca, sativinayena cāti?	ca sati vinayena ca ati 
PA_kd_14:14.27.8	Siyātissa vacanīyaṁ.	siyā tissa vacanīya 
PA_kd_14:14.27.9	Yathā kathaṁ viya?	yathā katham 
PA_kd_14:14.27.10	Idha pana, bhikkhave, bhikkhū bhikkhuṁ amūlikāya sīlavipattiyā anuddhaṁsenti.	idha pana bhikkhave bhikkhū bhikkhum amūlikāya sīla vipattiyā anuddhasenti 
PA_kd_14:14.27.11	Tassa kho, bhikkhave, bhikkhuno sativepullappattassa sativinayo dātabbo.	tassa kho bhikkhave bhikkhuno sati vepulla ppattassa sati vinayaḥ dātabbaḥ 
PA_kd_14:14.27.12	Evañca pana, bhikkhave, dātabbo—	evam ca pana bhikkhave dātabbaḥ 
PA_kd_14:14.27.13	Tena, bhikkhave, bhikkhunā saṅghaṁ upasaṅkamitvā ekaṁsaṁ uttarāsaṅgaṁ karitvā …pe…	tena bhikkhave bhikkhunā saṅgham upasaṅkamitvā ekasam uttarāsaṅgam karitvā pe 
PA_kd_14:14.27.14	evamassa vacanīyo—	evam assa vacanīyaḥ 
PA_kd_14:14.27.15	‘maṁ, bhante, bhikkhū amūlikāya sīlavipattiyā anuddhaṁsenti.	ma bhante bhikkhū amūlikāya sīla vipattiyā anuddhasenti 
PA_kd_14:14.27.16	Sohaṁ, bhante, sativepullappatto saṅghaṁ sativinayaṁ yācāmī’ti.	saḥ uha bhante sati vepulla ppattaḥ saṅgham sati vinayam yācāmi iti 
PA_kd_14:14.27.17	Dutiyampi yācitabbo.	dutiyam pi yācitabbo 
PA_kd_14:14.27.18	Tatiyampi yācitabbo.	tatiyam pi yācitabbaḥ 
PA_kd_14:14.27.19	Byattenaṁ bhikkhunā paṭibalena saṅgho ñāpetabbo—	byattenam bhikkhunā paṭibalena saṅghaḥ ñāpetabbaḥ 
PA_kd_14:14.27.20	‘Suṇātu me, bhante, saṅgho.	suṇātu me bhante saṅghaḥ 
PA_kd_14:14.27.21	Bhikkhū itthannāmaṁ bhikkhuṁ amūlikāya sīlavipattiyā anuddhaṁsenti.	bhikkhū itthannāmam bhikkhum amūlikāya sīla vipattiyā anuddhasenti 
PA_kd_14:14.27.22	So sativepullappatto saṅghaṁ sativinayaṁ yācati.	saḥ sati vepulla ppattaḥ saṅgham sati vinayam yācati 
PA_kd_14:14.27.23	Yadi saṅghassa pattakallaṁ, saṅgho itthannāmassa bhikkhuno sativepullappattassa sativinayaṁ dadeyya.	yadi saṅghassa pattakalla saṅghaḥ itthannāmassa bhikkhuno sati vepulla ppattassa sati vinayam dadeyya 
PA_kd_14:14.27.24	Esā ñatti.	esā ñatti 
PA_kd_14:14.27.25	Suṇātu me, bhante, saṅgho.	suṇātu me bhante saṅghaḥ 
PA_kd_14:14.27.26	Bhikkhū itthannāmaṁ bhikkhuṁ amūlikāya sīlavipattiyā anuddhaṁsenti.	bhikkhū itthannāmam bhikkhum amūlikāya sīla vipattiyā anuddhasenti 
PA_kd_14:14.27.27	So sativepullappatto saṅghaṁ sativinayaṁ yācati.	saḥ sati vepulla ppattaḥ saṅgham sati vinayam yācati 
PA_kd_14:14.27.28	Saṅgho itthannāmassa bhikkhuno sativepullappattassa sativinayaṁ deti.	saṅghaḥ itthannāmassa bhikkhuno sati vepulla ppattassa sati vinayam deti 
PA_kd_14:14.27.29	Yassāyasmato khamati itthannāmassa bhikkhuno sativepullappattassa sativinayassa dānaṁ, so tuṇhassa;	yassa ayasmataḥ khamati itthannāmassa bhikkhuno sati vepulla ppattassa sati vinayassa so tuṇhassa 
PA_kd_14:14.27.30	yassa nakkhamati, so bhāseyya.	yassa na khamati saḥ bhāseyya 
PA_kd_14:14.27.31	Dutiyampi etamatthaṁ vadāmi …pe…	dutiyam pi etam attham vadāmi pe 
PA_kd_14:14.27.32	tatiyampi etamatthaṁ vadāmi …pe….	tatiyam pi etam attham vadāmi pe 
PA_kd_14:14.27.33	Dinno saṅghena itthannāmassa bhikkhuno sativepullappattassa sativinayo.	dinnaḥ saṅghena itthannāmassa bhikkhuno sati vepulla ppattassa sati vinayaḥ 
PA_kd_14:14.27.34	Khamati saṅghassa, tasmā tuṇhī, evametaṁ dhārayāmī’ti.	khamati saṅghassa tasmai tuṇhī evam etam dhārayāmi iti 
PA_kd_14:14.27.35	Idaṁ vuccati, bhikkhave, adhikaraṇaṁ vūpasantaṁ.	idam vuccati bhikkhave adhikaraṇam vūpasanta 
PA_kd_14:14.27.36	Kena vūpasantaṁ?	kena vūpasanta 
PA_kd_14:14.27.37	Sammukhāvinayena ca sativinayena ca.	sammukhā vinayena ca sati vinayena ca 
PA_kd_14:14.27.38	Kiñca tattha sammukhāvinayasmiṁ?	kiñca 
PA_kd_14:14.27.39	Saṅghasammukhatā, dhammasammukhatā, vinayasammukhatā, puggalasammukhatā …pe…	saṅgha sammukha tā dhamma sammukha tā vinaya sammukha tā puggala sammukha tā pe 
PA_kd_14:14.27.40	kā ca tattha puggalasammukhatā?	kā ca tattha puggala sammukha tā 
PA_kd_14:14.27.41	Yo ca anuvadati, yañca anuvadati, ubho sammukhībhūtā honti—	yaḥ ca anuvadati yaṃ ca anuvadati ubho sammukhībhūtāḥ honti 
PA_kd_14:14.27.42	ayaṁ tattha puggalasammukhatā.	ayam tattha puggala sammukha tā 
PA_kd_14:14.27.43	Kiñca tattha sativinayasmiṁ?	kiñca 
PA_kd_14:14.27.44	Yā sativinayassa kammassa kiriyā karaṇaṁ upagamanaṁ ajjhupagamanaṁ adhivāsanā appaṭikkosanā—	yā sati vinayassa kammassa kiriyā karaṇam upagamanam ajjhupagamanam adhivāsanā appaṭikkosanā 
PA_kd_14:14.27.45	idaṁ tattha sativinayasmiṁ.	idam 
PA_kd_14:14.27.46	Evaṁ vūpasantañce, bhikkhave, adhikaraṇaṁ kārako ukkoṭeti, ukkoṭanakaṁ pācittiyaṁ;	evam vūpasantam ce bhikkhave adhikaraṇam kārako ukkoṭeti ukkoṭanakam pācittiya 
PA_kd_14:14.27.47	chandadāyako khīyati, khīyanakaṁ pācittiyaṁ.	chanda dāyakaḥ khīyati khīyanakam pācittiya 
PA_kd_14:14.28.0	9.6. Amūḷhavinaya	amūḍha vinaya 
PA_kd_14:14.28.1	Siyā anuvādādhikaraṇaṁ dve samathe anāgamma—	anuvāda adhikaraṇam dve samathe 
PA_kd_14:14.28.2	sativinayañca, tassapāpiyasikañca;	sativinayañca tassapāpiyasikañca 
PA_kd_14:14.28.3	dvīhi samathehi sammeyya—	dvīhi samathehi sammeyya 
PA_kd_14:14.28.4	sammukhāvinayena ca, amūḷhavinayena cāti?	ca amūḍha vinayena ca ati 
PA_kd_14:14.28.5	Siyātissa vacanīyaṁ.	siyā tissa vacanīya 
PA_kd_14:14.28.6	Yathā kathaṁ viya?	yathā katham 
PA_kd_14:14.28.7	Idha pana, bhikkhave, bhikkhu ummattako hoti cittavipariyāsakato.	idha pana bhikkhave bhikkhu ummattakaḥ hoti citta vipariyāsakataḥ 
PA_kd_14:14.28.8	Tena ummattakena cittavipariyāsakatena bahuṁ assāmaṇakaṁ ajjhāciṇṇaṁ hoti bhāsitaparikkantaṁ.	tena ummattakena citta vipariyāsa katena bahum assāmaṇakam ajjhāciṇṇam hoti bhāsita parikkanta 
PA_kd_14:14.28.9	Taṁ bhikkhū ummattakena cittavipariyāsakatena ajjhāciṇṇena āpattiyā codenti—	tam bhikkhū ummattakena citta vipariyāsa katena ajjhāciṇṇena āpattiyā codenti 
PA_kd_14:14.28.10	‘saratāyasmā evarūpiṁ āpattiṁ āpajjitā’ti.	sarata ayasmai evarūpim āpattim āpajjita ati 
PA_kd_14:14.28.11	So evaṁ vadeti—	sā u evam vada iti 
PA_kd_14:14.28.12	‘ahaṁ kho, āvuso, ummattako ahosiṁ cittavipariyāsakato.	aham kho āvuso ummattakaḥ ahosim citta vipariyāsakataḥ 
PA_kd_14:14.28.13	Tena me ummattakena cittavipariyāsakatena bahuṁ assāmaṇakaṁ ajjhāciṇṇaṁ bhāsitaparikkantaṁ.	tena me ummattakena citta vipariyāsa katena bahum assāmaṇakam ajjhāciṇṇam bhāsita parikkanta 
PA_kd_14:14.28.14	Nāhaṁ taṁ sarāmi.	na aham tam sarāmi 
PA_kd_14:14.28.15	Mūḷhena me etaṁ katan’ti.	mūḍhena me etam katanti 
PA_kd_14:14.28.16	Evampi naṁ vuccamānā codenteva—	evam pi nam vuccamānā codentā iva 
PA_kd_14:14.28.17	‘saratāyasmā evarūpiṁ āpattiṁ āpajjitā’ti.	sarata ayasmai evarūpim āpattim āpajjita ati 
PA_kd_14:14.28.18	Tassa kho, bhikkhave, bhikkhuno amūḷhassa amūḷhavinayo dātabbo.	tassa kho bhikkhave bhikkhunaḥ amūḍhassa amūḍha vinayaḥ dātabbaḥ 
PA_kd_14:14.28.19	Evañca pana, bhikkhave, dātabbo—	evam ca pana bhikkhave dātabbaḥ 
PA_kd_14:14.28.20	Tena, bhikkhave, bhikkhunā saṅghaṁ upasaṅkamitvā ekaṁsaṁ uttarāsaṅgaṁ karitvā …pe…	tena bhikkhave bhikkhunā saṅgham upasaṅkamitvā ekasam uttarāsaṅgam karitvā pe 
PA_kd_14:14.28.21	evamassa vacanīyo—	evam assa vacanīyaḥ 
PA_kd_14:14.28.22	‘ahaṁ, bhante, ummattako ahosiṁ cittavipariyāsakato.	aha bhante ummattakaḥ ahosim citta vipariyāsakataḥ 
PA_kd_14:14.28.23	Tena me ummattakena cittavipariyāsakatena bahuṁ assāmaṇakaṁ ajjhāciṇṇaṁ bhāsitaparikkantaṁ.	tena me ummattakena citta vipariyāsa katena bahum assāmaṇakam ajjhāciṇṇam bhāsita parikkanta 
PA_kd_14:14.28.24	Maṁ bhikkhū ummattakena cittavipariyāsakatena ajjhāciṇṇena āpattiyā codenti—	mam bhikkhū ummattakena citta vipariyāsa katena ajjhāciṇṇena āpattiyā codenti 
PA_kd_14:14.28.25	“saratāyasmā evarūpiṁ āpattiṁ āpajjitā”ti.	sarata ayasmai evarūpim āpattim āpajjita ati 
PA_kd_14:14.28.26	Tyāhaṁ evaṁ vadāmi—	tya aham evam vadāmi 
PA_kd_14:14.28.27	“ahaṁ kho, āvuso, ummattako ahosiṁ cittavipariyāsakato.	aham kho āvuso ummattakaḥ ahosim citta vipariyāsakataḥ 
PA_kd_14:14.28.28	Tena me ummattakena cittavipariyāsakatena bahuṁ assāmaṇakaṁ ajjhāciṇṇaṁ bhāsitaparikkantaṁ.	tena me ummattakena citta vipariyāsa katena bahum assāmaṇakam ajjhāciṇṇam bhāsita parikkanta 
PA_kd_14:14.28.29	Nāhaṁ taṁ sarāmi.	na aham tam sarāmi 
PA_kd_14:14.28.30	Mūḷhena me etaṁ katan”ti.	mūḍhena me etam katanti 
PA_kd_14:14.28.31	Evampi maṁ vuccamānā codenteva—	evam pi mama vuccamānā codentā iva 
PA_kd_14:14.28.32	“saratāyasmā evarūpiṁ āpattiṁ āpajjitā”ti.	sarata ayasmai evarūpim āpattim āpajjita ati 
PA_kd_14:14.28.33	“Sohaṁ, bhante, amūḷho saṅghaṁ amūḷhavinayaṁ yācāmī”’ti.	sā uha bhante amūḍhaḥ saṅgham amūḍha vinayam yācāmi iti 
PA_kd_14:14.28.34	Dutiyampi yācitabbo.	dutiyam pi yācitabbo 
PA_kd_14:14.28.35	Tatiyampi yācitabbo.	tatiyam pi yācitabbaḥ 
PA_kd_14:14.28.36	Byattena bhikkhunā paṭibalena saṅgho ñāpetabbo—	byattena bhikkhunā paṭibalena saṅghaḥ ñāpetabbaḥ 
PA_kd_14:14.28.37	‘Suṇātu me, bhante, saṅgho.	suṇātu me bhante saṅghaḥ 
PA_kd_14:14.28.38	Ayaṁ itthannāmo bhikkhu ummattako ahosi cittavipariyāsakato.	ayam itthannāmaḥ bhikkhu ummattakaḥ ahosi citta vipariyāsakataḥ 
PA_kd_14:14.28.39	Tena ummattakena cittavipariyāsakatena bahuṁ assāmaṇakaṁ ajjhāciṇṇaṁ bhāsitaparikkantaṁ.	tena ummattakena citta vipariyāsa katena bahum assāmaṇakam ajjhāciṇṇam bhāsita parikkanta 
PA_kd_14:14.28.40	Taṁ bhikkhū ummattakena cittavipariyāsakatena ajjhāciṇṇena āpattiyā codenti—	tam bhikkhū ummattakena citta vipariyāsa katena ajjhāciṇṇena āpattiyā codenti 
PA_kd_14:14.28.41	“saratāyasmā evarūpiṁ āpattiṁ āpajjitā”ti.	sarata ayasmai evarūpim āpattim āpajjita ati 
PA_kd_14:14.28.42	So evaṁ vadeti—	sā u evam vada iti 
PA_kd_14:14.28.43	“ahaṁ kho, āvuso, ummattako ahosiṁ cittavipariyāsakato.	aham kho āvuso ummattakaḥ ahosim citta vipariyāsakataḥ 
PA_kd_14:14.28.44	Tena me ummattakena cittavipariyāsakatena bahuṁ assāmaṇakaṁ ajjhāciṇṇaṁ bhāsitaparikkantaṁ.	tena me ummattakena citta vipariyāsa katena bahum assāmaṇakam ajjhāciṇṇam bhāsita parikkanta 
PA_kd_14:14.28.45	Nāhaṁ taṁ sarāmi.	na aham tam sarāmi 
PA_kd_14:14.28.46	Mūḷhena me etaṁ katan”ti.	mūḍhena me etam katanti 
PA_kd_14:14.28.47	Evampi naṁ vuccamānā codenteva—	evam pi nam vuccamānā codentā iva 
PA_kd_14:14.28.48	“saratāyasmā evarūpiṁ āpattiṁ āpajjitā”ti.	sarata ayasmai evarūpim āpattim āpajjita ati 
PA_kd_14:14.28.49	So amūḷho saṅghaṁ amūḷhavinayaṁ yācati.	saḥ amūḍhaḥ saṅgham amūḍha vinayam yācati 
PA_kd_14:14.28.50	Yadi saṅghassa pattakallaṁ, saṅgho itthannāmassa bhikkhuno amūḷhassa amūḷhavinayaṁ dadeyya.	yadi saṅghassa pattakalla saṅghaḥ itthannāmassa bhikkhunaḥ amūḍhassa amūḍha vinayam dadeyya 
PA_kd_14:14.28.51	Esā ñatti.	esā ñatti 
PA_kd_14:14.28.52	Suṇātu me, bhante, saṅgho.	suṇātu me bhante saṅghaḥ 
PA_kd_14:14.28.53	Ayaṁ itthannāmo bhikkhu ummattako ahosi cittavipariyāsakato.	ayam itthannāmaḥ bhikkhu ummattakaḥ ahosi citta vipariyāsakataḥ 
PA_kd_14:14.28.54	Tena ummattakena cittavipariyāsakatena bahuṁ assāmaṇakaṁ ajjhāciṇṇaṁ bhāsitaparikkantaṁ.	tena ummattakena citta vipariyāsa katena bahum assāmaṇakam ajjhāciṇṇam bhāsita parikkanta 
PA_kd_14:14.28.55	Taṁ bhikkhū ummattakena cittavipariyāsakatena ajjhāciṇṇena āpattiyā codenti—	tam bhikkhū ummattakena citta vipariyāsa katena ajjhāciṇṇena āpattiyā codenti 
PA_kd_14:14.28.56	“saratāyasmā evarūpiṁ āpattiṁ āpajjitā”ti.	sarata ayasmai evarūpim āpattim āpajjita ati 
PA_kd_14:14.28.57	So evaṁ vadeti—	sā u evam vada iti 
PA_kd_14:14.28.58	“ahaṁ kho, āvuso, ummattako ahosiṁ cittavipariyāsakato.	aham kho āvuso ummattakaḥ ahosim citta vipariyāsakataḥ 
PA_kd_14:14.28.59	Tena me ummattakena cittavipariyāsakatena bahuṁ assāmaṇakaṁ ajjhāciṇṇaṁ bhāsitaparikkantaṁ.	tena me ummattakena citta vipariyāsa katena bahum assāmaṇakam ajjhāciṇṇam bhāsita parikkanta 
PA_kd_14:14.28.60	Nāhaṁ taṁ sarāmi.	na aham tam sarāmi 
PA_kd_14:14.28.61	Mūḷhena me etaṁ katan”ti.	mūḍhena me etam katanti 
PA_kd_14:14.28.62	Evampi naṁ vuccamānā codenteva—	evam pi nam vuccamānā codentā iva 
PA_kd_14:14.28.63	“saratāyasmā evarūpiṁ āpattiṁ āpajjitā”ti.	sarata ayasmai evarūpim āpattim āpajjita ati 
PA_kd_14:14.28.64	So amūḷho saṅghaṁ amūḷhavinayaṁ yācati.	saḥ amūḍhaḥ saṅgham amūḍha vinayam yācati 
PA_kd_14:14.28.65	Saṅgho itthannāmassa bhikkhuno amūḷhassa amūḷhavinayaṁ deti.	saṅghaḥ itthannāmassa bhikkhunaḥ amūḍhassa amūḍha vinayam deti 
PA_kd_14:14.28.66	Yassāyasmato khamati itthannāmassa bhikkhuno amūḷhassa amūḷhavinayassa dānaṁ, so tuṇhassa;	yassa ayasmataḥ khamati itthannāmassa bhikkhuno amūḷhassa amūḍha vinayassa so tuṇhassa 
PA_kd_14:14.28.67	yassa nakkhamati, so bhāseyya.	yassa na khamati saḥ bhāseyya 
PA_kd_14:14.28.68	Dutiyampi etamatthaṁ vadāmi …pe…	dutiyam pi etam attham vadāmi pe 
PA_kd_14:14.28.69	tatiyampi etamatthaṁ vadāmi …pe….	tatiyam pi etam attham vadāmi pe 
PA_kd_14:14.28.70	Dinno saṅghena itthannāmassa bhikkhuno amūḷhassa amūḷhavinayo.	dinnaḥ saṅghena itthannāmassa bhikkhunaḥ amūḍhassa amūḍha vinayaḥ 
PA_kd_14:14.28.71	Khamati saṅghassa, tasmā tuṇhī, evametaṁ dhārayāmī’ti.	khamati saṅghassa tasmai tuṇhī evam etam dhārayāmi iti 
PA_kd_14:14.28.72	Idaṁ vuccati, bhikkhave, adhikaraṇaṁ vūpasantaṁ.	idam vuccati bhikkhave adhikaraṇam vūpasanta 
PA_kd_14:14.28.73	Kena vūpasantaṁ?	kena vūpasanta 
PA_kd_14:14.28.74	Sammukhāvinayena ca, amūḷhavinayena ca.	sammukha avinayena ca amūḍha vinayena ca 
PA_kd_14:14.28.75	Kiñca tattha sammukhāvinayasmiṁ?	kiñca 
PA_kd_14:14.28.76	Saṅghasammukhatā, dhammasammukhatā, vinayasammukhatā, puggalasammukhatā …pe…	saṅgha sammukha tā dhamma sammukha tā vinaya sammukha tā puggala sammukha tā pe 
PA_kd_14:14.28.77	kiñca tattha amūḷhavinayasmiṁ?	kiñca tattha amūḍhavinayasmi 
PA_kd_14:14.28.78	Yā amūḷhavinayassa kammassa kiriyā karaṇaṁ upagamanaṁ ajjhupagamanaṁ adhivāsanā appaṭikkosanā—	yā amūḷha vinayassa kammassa kiriyā karaṇam upagamanam ajjhupagamanam adhivāsanā appaṭikkosanā 
PA_kd_14:14.28.79	idaṁ tattha amūḷhavinayasmiṁ.	idam tattha amūḍha vinayasmi 
PA_kd_14:14.28.80	Evaṁ vūpasantañce, bhikkhave, adhikaraṇaṁ kārako ukkoṭeti, ukkoṭanakaṁ pācittiyaṁ;	evam vūpasantam ce bhikkhave adhikaraṇam kārako ukkoṭeti ukkoṭanakam pācittiya 
PA_kd_14:14.28.81	chandadāyako khīyati, khīyanakaṁ pācittiyaṁ.	chanda dāyakaḥ khīyati khīyanakam pācittiya 
PA_kd_14:14.29.0	9.7. Tassapāpiyasikāvinaya	     
PA_kd_14:14.29.1	Siyā anuvādādhikaraṇaṁ dve samathe anāgamma—	anuvāda adhikaraṇam dve samathe 
PA_kd_14:14.29.2	sativinayañca, amūḷhavinayañca;	sati vinayañca amūḍha vinayañca 
PA_kd_14:14.29.3	dvīhi samathehi sammeyya—	dvīhi samathehi sammeyya 
PA_kd_14:14.29.4	sammukhāvinayena ca, tassapāpiyasikāya cāti?	sammukha avinayena ca ca ati 
PA_kd_14:14.29.5	Siyātissa vacanīyaṁ.	siyā tissa vacanīya 
PA_kd_14:14.29.6	Yathā kathaṁ viya?	yathā katham 
PA_kd_14:14.29.7	Idha pana, bhikkhave, bhikkhu bhikkhuṁ saṅghamajjhe garukāya āpattiyā codeti—	idha pana bhikkhave bhikkhu bhikkhum saṅgha majjhe garukāya āpattiyā codeti 
PA_kd_14:14.29.8	‘saratāyasmā evarūpiṁ garukaṁ āpattiṁ āpajjitā, pārājikaṁ vā pārājikasāmantaṁ vā’ti.	sarata ayasmai evarūpim garukam āpattim āpajjitā pārājikam vā pārājika sāmantam vā ati 
PA_kd_14:14.29.9	So evaṁ vadeti—	sā u evam vada iti 
PA_kd_14:14.29.10	‘na kho ahaṁ, āvuso, sarāmi evarūpiṁ garukaṁ āpattiṁ āpajjitā, pārājikaṁ vā pārājikasāmantaṁ vā’ti.	na khalu aha āvuso sarāmi evarūpim garukam āpattim āpajjitā pārājikam vā pārājika sāmantam vā ati 
PA_kd_14:14.29.11	Tamenaṁ so nibbeṭhentaṁ ativeṭheti—	tam enam saḥ nibbeṭhentam ativeṭheti 
PA_kd_14:14.29.12	‘iṅghāyasmā sādhukameva jānāhi, yadi sarasi evarūpiṁ garukaṁ āpattiṁ āpajjitā, pārājikaṁ vā pārājikasāmantaṁ vā’ti.	sādhukam eva jānāhi yadi sarasi evarūpim garukam āpattim āpajjitā pārājikam vā pārājika sāmantam vā ati 
PA_kd_14:14.29.13	So evaṁ vadeti—	sā u evam vada iti 
PA_kd_14:14.29.14	‘na kho ahaṁ, āvuso, sarāmi evarūpiṁ garukaṁ āpattiṁ āpajjitā, pārājikaṁ vā pārājikasāmantaṁ vā.	na khalu aha āvuso sarāmi evarūpim garukam āpattim āpajjitā pārājikam vā pārājika sāmantam vā 
PA_kd_14:14.29.15	Sarāmi ca kho ahaṁ, āvuso, evarūpiṁ appamattikaṁ āpattiṁ āpajjitā’ti.	sarāmi ca kho aha āvuso evarūpim appamattikam āpattim āpajjitā ati 
