segmentnr	original	analyzed
PA_kd_16:16.2.28	Yo vibhajeyya, āpatti thullaccayassa.	yaḥ vibhajeyya āpatti thullaccayassa 
PA_kd_16:16.2.29	Lohakumbhī, lohabhāṇakaṁ, lohavārako, lohakaṭāhaṁ, vāsī, parasu, kuṭhārī, kudālo, nikhādanaṁ—	loha kumbhī loha bhāṇaka loha vārakaḥ loha kaṭāha vāsī kuṭhārī kudālaḥ nikhādana 
PA_kd_16:16.2.30	idaṁ catutthaṁ avebhaṅgiyaṁ, na vibhajitabbaṁ, saṅghena vā gaṇena vā puggalena vā.	idam catuttham saṅghena vā gaṇena vā puggalena vā 
PA_kd_16:16.2.31	Vibhattampi avibhattaṁ hoti.	vibhattam pi a vibhattam hoti 
PA_kd_16:16.2.32	Yo vibhajeyya, āpatti thullaccayassa.	yaḥ vibhajeyya āpatti thullaccayassa 
PA_kd_16:16.2.33	Vallī, veḷu, muñjaṁ, pabbajaṁ, tiṇaṁ, mattikā, dārubhaṇḍaṁ, mattikābhaṇḍaṁ—	vallī veḷu muñja pabbaja tiṇa mattikā dārubhaṇḍa mattikābhaṇḍa 
PA_kd_16:16.2.34	idaṁ pañcamaṁ avebhaṅgiyaṁ, na vibhajitabbaṁ, saṅghena vā gaṇena vā puggalena vā.	idam pañcamam saṅghena vā gaṇena vā puggalena vā 
PA_kd_16:16.2.35	Vibhattampi avibhattaṁ hoti.	vibhattam pi a vibhattam hoti 
PA_kd_16:16.2.36	Yo vibhajeyya, āpatti thullaccayassa.	yaḥ vibhajeyya āpatti thullaccayassa 
PA_kd_16:16.2.37	Imāni kho, bhikkhave, pañca avebhaṅgiyāni, na vibhajitabbāni, saṅghena vā gaṇena vā puggalena vā.	imāni kho bhikkhave pañca avebhaṅgiyāni na vibhajitabbāni saṅghena vā gaṇena vā puggalena vā 
PA_kd_16:16.2.38	Vibhattānipi avibhattāni honti.	vibhattāni api avibhattāni honti 
PA_kd_16:16.2.39	Yo vibhajeyya, āpatti thullaccayassā”ti.	yaḥ vibhajeyya āpatti thullaccayassa ati 
PA_kd_16:17.1.0	3. Navakammadānakathā	nava kamma dāna kathā 
PA_kd_16:17.1.1	Atha kho bhagavā kīṭāgirismiṁ yathābhirantaṁ viharitvā yena āḷavī tena cārikaṁ pakkāmi.	atha khalu bhagavā kīṭāgirismin yathābhirantam viharitvā yena āḷavī tena cārikam pakkāmi 
PA_kd_16:17.1.2	Anupubbena cārikaṁ caramāno yena āḷavī tadavasari.	anupubbena cārikam caramānaḥ yena āḷavī tat avasari 
PA_kd_16:17.1.3	Tatra sudaṁ bhagavā āḷaviyaṁ viharati aggāḷave cetiye.	tatra sudam bhagavā āḷaviyam viharati aggāḷave cetiye 
PA_kd_16:17.1.4	Tena kho pana samayena āḷavakā bhikkhū evarūpāni navakammāni denti—	tena kho pana samayena āḷavakāḥ bhikkhū evarūpāni nava kammāni denti 
PA_kd_16:17.1.5	piṇḍanikkhepanamattenapi navakammaṁ denti;	piṇḍa nikkhepana mattena api navakammam denti 
PA_kd_16:17.1.6	kuṭṭalepanamattenapi navakammaṁ denti;	kuṭṭa lepana mattena api nava kammam denti 
PA_kd_16:17.1.7	dvāraṭṭhapanamattenapi navakammaṁ denti;	dvāra ṭṭhapana mattena api nava kammam denti 
PA_kd_16:17.1.8	aggaḷavaṭṭikaraṇamattenapi navakammaṁ denti;	aggaḷa vaṭṭi karaṇa mattena api nava kammam denti 
PA_kd_16:17.1.9	ālokasandhikaraṇamattenapi navakammaṁ denti;	āloka sandhi karaṇa mattena api nava kammam denti 
PA_kd_16:17.1.10	setavaṇṇakaraṇamattenapi navakammaṁ denti;	seta vaṇṇa karaṇa mattena api nava kammam denti 
PA_kd_16:17.1.11	kāḷavaṇṇakaraṇamattenapi navakammaṁ denti;	nava kammam denti 
PA_kd_16:17.1.12	gerukaparikammakaraṇamattenapi navakammaṁ denti;	geruka parikamma karaṇa mattena api nava kammam denti 
PA_kd_16:17.1.13	chādanamattenapi navakammaṁ denti;	chādana mattena api nava kammam denti 
PA_kd_16:17.1.14	bandhanamattenapi navakammaṁ denti;	bandhana mattena api nava kammam denti 
PA_kd_16:17.1.15	bhaṇḍikāṭṭhapanamattenapi navakammaṁ denti;	bhaṇḍika aṭṭhapana mattena api navakammam denti 
PA_kd_16:17.1.16	khaṇḍaphullapaṭisaṅkharaṇamattenapi navakammaṁ denti;	khaṇḍa phulla paṭisaṅkharaṇa mattena api nava kammam denti 
PA_kd_16:17.1.17	paribhaṇḍakaraṇamattenapi navakammaṁ denti;	paribhaṇḍa karaṇa mattena api nava kammam denti 
PA_kd_16:17.1.18	vīsativassikampi navakammaṁ denti;	vīsati vassikam pi nava kammam denti 
PA_kd_16:17.1.19	tiṁsavassikampi navakammaṁ denti;	tisa vassikam pi nava kammam denti 
PA_kd_16:17.1.20	yāvajīvikampi navakammaṁ denti;	yāvajīvikam pi nava kammam denti 
PA_kd_16:17.1.21	dhūmakālikampi pariyositaṁ vihāraṁ navakammaṁ denti.	dhūmakālikam pi pariyositam vihāram nava kammam denti 
PA_kd_16:17.1.22	Ye te bhikkhū appicchā …pe… te ujjhāyanti khiyyanti vipācenti—	ye te bhikkhū appicchā pe te ujjhāyanti khiyyanti vipācenti 
PA_kd_16:17.1.23	“kathañhi nāma āḷavakā bhikkhū evarūpāni navakammāni dassanti—	katham hi nāma āḷavakāḥ bhikkhū evarūpāni nava kammāni dassanti 
PA_kd_16:17.1.24	piṇḍanikkhepanamattenapi navakammaṁ dassanti;	piṇḍa nikkhepana mattena api nava kammam dassanti 
PA_kd_16:17.1.25	kuṭṭalepanamattenapi …	kuṭṭa lepana mattena api 
PA_kd_16:17.1.26	dvāraṭṭhapanamattenapi …	dvāra ṭhapana mattena api 
PA_kd_16:17.1.27	aggaḷavaṭṭikaraṇamattenapi …	aggaḷa vaṭṭi karaṇa mattena api 
PA_kd_16:17.1.28	ālokasandhikaraṇamattenapi …	āloka sandhi karaṇa mattena api 
PA_kd_16:17.1.29	setavaṇṇakaraṇamattenapi …	seta vaṇṇa karaṇa mattena api 
PA_kd_16:17.1.30	kāḷavaṇṇakaraṇamattenapi …	kāḷavaṇṇa karaṇa mattena api 
PA_kd_16:17.1.31	gerukaparikammakaraṇamattenapi …	geruka parikamma karaṇam attena api 
PA_kd_16:17.1.32	chādanamattenapi …	chādana mattena api 
PA_kd_16:17.1.33	bandhanamattenapi …	bandhana mattena api 
PA_kd_16:17.1.34	bhaṇḍikāṭṭhapanamattenapi …	bhaṇḍika aṭṭhapana mattena api 
PA_kd_16:17.1.35	khaṇḍaphullapaṭisaṅkharaṇamattenapi …	khaṇḍa phulla paṭi saṅkharaṇa mattena api 
PA_kd_16:17.1.36	paribhaṇḍakaraṇamattenapi …	paribhaṇḍa karaṇa mattena api 
PA_kd_16:17.1.37	vīsativassikampi …	vīsati vassikam pi 
PA_kd_16:17.1.38	tiṁsavassikampi …	tisa vassikam pi 
PA_kd_16:17.1.39	yāvajīvikampi …	yāvajīvikampi 
PA_kd_16:17.1.40	dhūmakālikampi pariyositaṁ vihāraṁ navakammaṁ dassantī”ti.	dhūmakālikam pi pariyositam vihāram nava kammam dassanti iti 
PA_kd_16:17.1.41	Bhagavato etamatthaṁ ārocesuṁ …pe…	bhagavato etam attham ārocesuṃ pe 
PA_kd_16:17.1.42	“saccaṁ kira, bhikkhave …pe…	saccam kira bhikkhave pe 
PA_kd_16:17.1.43	“saccaṁ, bhagavā”ti …pe…	sat ca bhagavān ati pe 
PA_kd_16:17.1.44	vigarahitvā …pe…	vigara hitvā pe 
PA_kd_16:17.1.45	dhammiṁ kathaṁ katvā bhikkhū āmantesi—	dhammim katham katvā bhikkhū āmantesi 
PA_kd_16:17.1.46	“na, bhikkhave, piṇḍanikkhepanamattena navakammaṁ dātabbaṁ …pe…	na bhikkhave piṇḍa nikkhepana mattena nava kammam dātabbam pe 
PA_kd_16:17.1.47	na kuṭṭalepanamattena navakammaṁ dātabbaṁ.	na kuṭṭa lepana mattena nava kammam 
PA_kd_16:17.1.48	Na dvāraṭṭhapanamattena navakammaṁ dātabbaṁ.	na dvāra ṭṭhapana mattena nava kammam 
PA_kd_16:17.1.49	Na aggaḷavaṭṭikaraṇamattena navakammaṁ dātabbaṁ.	na aggaḷa vaṭṭi karaṇa mattena nava kammam 
PA_kd_16:17.1.50	Na ālokasandhikaraṇamattena navakammaṁ dātabbaṁ.	na āloka sandhi karaṇa mattena nava kammam 
PA_kd_16:17.1.51	Na setavaṇṇakaraṇamattena navakammaṁ dātabbaṁ.	na seta vaṇṇa karaṇa mattena nava kammam 
PA_kd_16:17.1.52	Na kāḷavaṇṇakaraṇamattena navakammaṁ dātabbaṁ.	na kāḷavaṇṇa karaṇa mattena nava kammam 
PA_kd_16:17.1.53	Na gerukaparikammakaraṇamattena navakammaṁ dātabbaṁ.	na geruka parikamma karaṇa mattena nava kammam 
PA_kd_16:17.1.54	Na chādanamattena navakammaṁ dātabbaṁ.	na chādana mattena nava kammam 
PA_kd_16:17.1.55	Na bandhanamattena navakammaṁ dātabbaṁ.	na bandhana mattena nava kammam 
PA_kd_16:17.1.56	Na bhaṇḍikāṭṭhapanamattena navakammaṁ dātabbaṁ.	na bhaṇḍika aṭṭhapana mattena nava kammam 
PA_kd_16:17.1.57	Na khaṇḍaphullapaṭisaṅkharaṇamattena navakammaṁ dātabbaṁ.	na khaṇḍa phulla paṭisaṅkharaṇa mattena nava kammam 
PA_kd_16:17.1.58	Na paribhaṇḍakaraṇamattena navakammaṁ dātabbaṁ.	na paribhaṇḍa karaṇa mattena nava kammam 
PA_kd_16:17.1.59	Na vīsativassikaṁ navakammaṁ dātabbaṁ.	na vīsati vassikam nava kammam 
PA_kd_16:17.1.60	Na tiṁsavassikaṁ navakammaṁ dātabbaṁ.	na ti savassikam nava kammam 
PA_kd_16:17.1.61	Na yāvajīvikaṁ navakammaṁ dātabbaṁ.	na yāvajīvikam nava kammam 
PA_kd_16:17.1.62	Na dhūmakālikampi pariyositaṁ vihāraṁ navakammaṁ dātabbaṁ.	na dhūmakālikam pi pariyositam vihāram nava kammam 
PA_kd_16:17.1.63	Yo dadeyya, āpatti dukkaṭassa.	yaḥ dadeyya āpatti dukkaṭassa 
PA_kd_16:17.1.64_0	Anujānāmi, bhikkhave, akataṁ vā vippakataṁ vā navakammaṁ dātuṁ, khuddake vihāre kammaṁ	anujānāmi bhikkhave akatam vā vippakatam vā nava kammam dātu khuddake vihāre kamma 
PA_kd_16:17.1.64_1	oloketvā chappañcavassikaṁ navakammaṁ dātuṁ, aḍḍhayoge kammaṁ oloketvā sattaṭṭhavassikaṁ	oloketvā chappañcavassikam nava kammam dātu aḍḍha yoge kammam oloketvā satta ṭṭha vassika 
PA_kd_16:17.1.64_2	navakammaṁ dātuṁ, mahallake vihāre pāsāde vā kammaṁ oloketvā dasadvādasavassikaṁ	nava kammam dātu mahallake vihāre pāsāde vā kammaṃ oloketvā dasa dvādasa vassika 
PA_kd_16:17.1.64_3	navakammaṁ dātun”ti.	nava kammam dātunti 
PA_kd_16:17.2.1	Tena kho pana samayena bhikkhū sabbe vihāre navakammaṁ denti.	tena kho pana samayena bhikkhū sabbe vihāre navakammam denti 
PA_kd_16:17.2.2	Bhagavato etamatthaṁ ārocesuṁ.	bhagavato etam attham ārocesu 
PA_kd_16:17.2.3	“Na, bhikkhave, sabbe vihāre navakammaṁ dātabbaṁ.	na bhikkhave sabbe vihāre nava kammam dātabba 
PA_kd_16:17.2.4	Yo dadeyya, āpatti dukkaṭassā”ti.	yaḥ dadeyya āpatti dukkaṭassa ati 
PA_kd_16:17.2.5	Tena kho pana samayena bhikkhū ekassa dve denti.	tena kho pana samayena bhikkhū ekassa dve denti 
PA_kd_16:17.2.6	Bhagavato etamatthaṁ ārocesuṁ.	bhagavato etam attham ārocesu 
PA_kd_16:17.2.7	“Na, bhikkhave, ekassa dve dātabbā.	na bhikkhave ekassa dve dātabbā 
PA_kd_16:17.2.8	Yo dadeyya, āpatti dukkaṭassā”ti.	yaḥ dadeyya āpatti dukkaṭassa ati 
PA_kd_16:17.2.9	Tena kho pana samayena bhikkhū navakammaṁ gahetvā aññaṁ vāsenti.	tena kho pana samayena bhikkhū nava kammam gahetvā aññam vāsenti 
PA_kd_16:17.2.10	Bhagavato etamatthaṁ ārocesuṁ.	bhagavato etam attham ārocesu 
PA_kd_16:17.2.11	“Na, bhikkhave, navakammaṁ gahetvā añño vāsetabbo.	na bhikkhave nava kammam gahetvā aññaḥ vāsetabbaḥ 
PA_kd_16:17.2.12	Yo vāseyya, āpatti dukkaṭassā”ti.	yaḥ vā āseyye āpatti dukkaṭassa ati 
PA_kd_16:17.2.13	Tena kho pana samayena bhikkhū navakammaṁ gahetvā saṅghikaṁ paṭibāhenti.	tena kho pana samayena bhikkhū nava kammam gahetvā saṅghikam paṭibāhenti 
PA_kd_16:17.2.14	Bhagavato etamatthaṁ ārocesuṁ.	bhagavato etam attham ārocesu 
PA_kd_16:17.2.15	“Na, bhikkhave, navakammaṁ gahetvā saṅghikaṁ paṭibāhitabbaṁ.	na bhikkhave nava kammam gahetvā saṅghikam 
PA_kd_16:17.2.16	Yo paṭibāheyya, āpatti dukkaṭassa.	yaḥ paṭibāheyya āpatti dukkaṭassa 
PA_kd_16:17.2.17	Anujānāmi, bhikkhave, ekaṁ varaseyyaṁ gahetun”ti.	anujānāmi bhikkhave ekam varaseyyam gahetun ti 
PA_kd_16:17.2.18	Tena kho pana samayena bhikkhū nissīme ṭhitassa navakammaṁ denti.	tena kho pana samayena bhikkhū nissīme ṭhitassa navakammam denti 
PA_kd_16:17.2.19	Bhagavato etamatthaṁ ārocesuṁ.	bhagavato etam attham ārocesu 
PA_kd_16:17.2.20	“Na, bhikkhave, nissīme ṭhitassa navakammaṁ dātabbaṁ.	na bhikkhave nissīme ṭhitassa nava kammam dātabba 
PA_kd_16:17.2.21	Yo dadeyya, āpatti dukkaṭassā”ti.	yaḥ dadeyya āpatti dukkaṭassa ati 
PA_kd_16:17.2.22	Tena kho pana samayena bhikkhū navakammaṁ gahetvā sabbakālaṁ paṭibāhanti.	tena kho pana samayena bhikkhū nava kammam gahetvā sabbakālam paṭibāhanti 
PA_kd_16:17.2.23	Bhagavato etamatthaṁ ārocesuṁ.	bhagavato etam attham ārocesu 
PA_kd_16:17.2.24	“Na, bhikkhave, navakammaṁ gahetvā sabbakālaṁ paṭibāhitabbaṁ.	na bhikkhave nava kammam gahetvā sabbakālam 
PA_kd_16:17.2.25	Yo paṭibāheyya, āpatti dukkaṭassa.	yaḥ paṭibāheyya āpatti dukkaṭassa 
PA_kd_16:17.2.26	Anujānāmi, bhikkhave, vassānaṁ temāsaṁ paṭibāhituṁ, utukālaṁ pana na paṭibāhitun”ti.	anujānāmi bhikkhave vassānam temāsam paṭibāhitu utu kālam pana na paṭibāhitu ti 
PA_kd_16:17.3.1	Tena kho pana samayena bhikkhū navakammaṁ gahetvā pakkamantipi, vibbhamantipi, kālampi karonti;	tena kho pana samayena bhikkhū nava kammam gahetvā pakkamanti pi vibbhamanti pi kālam pi karonti 
PA_kd_16:17.3.2	sāmaṇerāpi paṭijānanti;	paṭijānanti 
PA_kd_16:17.3.3	sikkhaṁ paccakkhātakāpi paṭijānanti;	sikkham paccakkhātakāḥ api paṭijānanti 
PA_kd_16:17.3.4	antimavatthuṁ ajjhāpannakāpi paṭijānanti;	antima vatthum ajjhāpannakāḥ api paṭijānanti 
PA_kd_16:17.3.5	ummattakāpi paṭijānanti;	ummattakāḥ api paṭijānanti 
PA_kd_16:17.3.6	khittacittāpi paṭijānanti;	khitta cittā api paṭijānanti 
PA_kd_16:17.3.7	vedanāṭṭāpi paṭijānanti;	paṭijānanti 
PA_kd_16:17.3.8	āpattiyā adassane ukkhittakāpi paṭijānanti;	āpattiyāḥ a dassane ukkhittakāḥ api paṭijānanti 
PA_kd_16:17.3.9	āpattiyā appaṭikamme ukkhittakāpi paṭijānanti;	āpattiyāḥ appaṭikamme ukkhittakāḥ api paṭijānanti 
PA_kd_16:17.3.10	pāpikāya diṭṭhiyā appaṭinissagge ukkhittakāpi paṭijānanti;	pāpikāya diṭṭhiyā a paṭinissagge ukkhittakāḥ api paṭijānanti 
PA_kd_16:17.3.11	paṇḍakāpi paṭijānanti;	paṇḍakā api paṭijānanti 
PA_kd_16:17.3.12	theyyasaṁvāsakāpi paṭijānanti;	paṭijānanti 
PA_kd_16:17.3.13	titthiyapakkantakāpi paṭijānanti;	titthiya pakkantakāḥ api paṭijānanti 
PA_kd_16:17.3.14	tiracchānagatāpi paṭijānanti;	tiracchāna gatā api paṭijānanti 
PA_kd_16:17.3.15	mātughātakāpi paṭijānanti;	mātughātakāḥ api paṭijānanti 
PA_kd_16:17.3.16	pitughātakāpi paṭijānanti;	pitu ghātakāḥ api paṭijānanti 
PA_kd_16:17.3.17	arahantaghātakāpi paṭijānanti;	paṭijānanti 
PA_kd_16:17.3.18	bhikkhunidūsakāpi paṭijānanti;	bhikkhu nidūsakā api paṭijānanti 
PA_kd_16:17.3.19	saṅghabhedakāpi paṭijānanti;	saṅgha bhedakāḥ api paṭijānanti 
PA_kd_16:17.3.20	lohituppādakāpi paṭijānanti;	lohituppādakā api paṭijānanti 
PA_kd_16:17.3.21	ubhatobyañjanakāpi paṭijānanti.	ubhatobyañjanakā api paṭijānanti 
PA_kd_16:17.3.22	Bhagavato etamatthaṁ ārocesuṁ.	bhagavato etam attham ārocesu 
PA_kd_16:17.3.23	“Idha pana, bhikkhave, bhikkhu navakammaṁ gahetvā pakkamati—	idha pana bhikkhave bhikkhu nava kammam gahetvā pakkamati 
PA_kd_16:17.3.24	mā saṅghassa hāyīti aññassa dātabbaṁ.	mā saṅghassa hāyi iti aññassa dātabba 
PA_kd_16:17.3.25	Idha pana, bhikkhave, bhikkhu navakammaṁ gahetvā vibbhamati …pe…	idha pana bhikkhave bhikkhu nava kammam gahetvā vibbhamati pe 
PA_kd_16:17.3.26_0	kālaṁ karoti, sāmaṇero paṭijānāti, sikkhaṁ paccakkhātako paṭijānāti, antimavatthuṁ	kālam karoti sāmaṇeraḥ paṭijānāti sikkham paccakkhātakaḥ paṭijānāti antima vatthu 
PA_kd_16:17.3.26_1	ajjhāpannako paṭijānāti, ummattako paṭijānāti, khittacitto paṭijānāti, vedanāṭṭo	ajjhāpannakaḥ paṭijānāti ummattakaḥ paṭijānāti khitta cittaḥ paṭijānāti vedanā aṭṭaḥ 
PA_kd_16:17.3.26_2	paṭijānāti, āpattiyā adassane ukkhittako paṭijānāti, āpattiyā appaṭikamme ukkhittako	paṭijānāti āpattiyāḥ a dassane ukkhittako paṭijānāti āpattiyāḥ appaṭikamme ukkhittako 
PA_kd_16:17.3.26_3	paṭijānāti, pāpikāya diṭṭhiyā appaṭinissagge ukkhittako paṭijānāti, paṇḍako paṭijānāti,	paṭijānāti pāpikāya diṭṭhiyā appaṭinissagge ukkhittako paṭijānāti paṇḍako paṭijānāti 
PA_kd_16:17.3.26_4	theyyasaṁvāsako paṭijānāti, titthiyapakkantako paṭijānāti, tiracchānagato paṭijānāti,	theyya savāsako paṭijānāti titthiya pakkantako paṭijānāti tiracchāna gataḥ paṭijānāti 
PA_kd_16:17.3.26_5	mātughātako paṭijānāti, pitughātako paṭijānāti, arahantaghātako paṭijānāti, bhikkhunidūsako	mātu ghātako paṭijānāti pitu ghātako paṭijānāti arahanta ghātako paṭijānāti bhikkhu nidūsako 
PA_kd_16:17.3.26_6	paṭijānāti, saṅghabhedako paṭijānāti, lohituppādako paṭijānāti, ubhatobyañjanako paṭijānāti—	paṭijānāti saṅgha bhedako paṭijānāti lohituppādako paṭijānāti ubhatobyañjanako paṭijānāti 
PA_kd_16:17.3.27	mā saṅghassa hāyīti aññassa dātabbaṁ.	mā saṅghassa hāyi iti aññassa dātabba 
PA_kd_16:17.3.28	Idha pana, bhikkhave, bhikkhu navakammaṁ gahetvā vippakate pakkamati—	idha pana bhikkhave bhikkhu nava kammam gahetvā vippakate pakkamati 
PA_kd_16:17.3.29	mā saṅghassa hāyīti aññassa dātabbaṁ.	mā saṅghassa hāyi iti aññassa dātabba 
PA_kd_16:17.3.30	Idha pana, bhikkhave, bhikkhu navakammaṁ gahetvā vippakate vibbhamati …pe…	idha pana bhikkhave bhikkhu nava kammam gahetvā vippakate vibbhamati pe 
PA_kd_16:17.3.31	ubhatobyañjanako paṭijānāti—	ubhatobyañjanakaḥ paṭijānāti 
PA_kd_16:17.3.32	mā saṅghassa hāyīti aññassa dātabbaṁ.	mā saṅghassa hāyi iti aññassa dātabba 
PA_kd_16:17.3.33	Idha pana, bhikkhave, bhikkhu navakammaṁ gahetvā pariyosite pakkamati—	idha pana bhikkhave bhikkhu nava kammam gahetvā pariyosite pakkamati 
PA_kd_16:17.3.34	tassevetaṁ.	taḥ seveta 
PA_kd_16:17.3.35	Idha pana, bhikkhave, bhikkhu navakammaṁ gahetvā pariyosite vibbhamati …pe…	idha pana bhikkhave bhikkhu nava kammam gahetvā pariyosite vibbhamati pe 
PA_kd_16:17.3.36	kālaṁ karoti, sāmaṇero paṭijānāti, sikkhaṁ paccakkhātako paṭijānāti, antimavatthuṁ ajjhāpannako paṭijānāti—	kālam karoti sāmaṇeraḥ paṭijānāti sikkham paccakkhātakaḥ paṭijānāti antima vatthum ajjhāpannakaḥ paṭijānāti 
PA_kd_16:17.3.37	saṅgho sāmī.	saṅghaḥ sāmī 
PA_kd_16:17.3.38_0	Idha pana, bhikkhave, bhikkhu navakammaṁ gahetvā pariyosite ummattako paṭijānāti,	idha pana bhikkhave bhikkhu nava kammam gahetvā pariyosite ummattakaḥ paṭijānāti 
PA_kd_16:17.3.38_1	khittacitto paṭijānāti, vedanāṭṭo paṭijānāti, āpattiyā adassane ukkhittako paṭijānāti,	khitta cittaḥ paṭijānāti vedanā aṭṭaḥ paṭijānāti āpattiyāḥ adassane ukkhittakaḥ paṭijānāti 
PA_kd_16:17.3.38_2	āpattiyā appaṭikamme ukkhittako paṭijānāti, pāpikāya diṭṭhiyā appaṭinissagge ukkhittako paṭijānāti—	āpattiyāḥ appaṭikamme ukkhittako paṭijānāti pāpikāya diṭṭhiyāḥ appaṭinissagge ukkhittako paṭijānāti 
PA_kd_16:17.3.39	tassevetaṁ.	taḥ seveta 
PA_kd_16:17.3.40_0	Idha pana, bhikkhave, bhikkhu navakammaṁ gahetvā pariyosite paṇḍako paṭijānāti, theyyasaṁvāsako	idha pana bhikkhave bhikkhu nava kammam gahetvā pariyosite paṇḍako paṭijānāti theyya savāsako 
PA_kd_16:17.3.40_1	paṭijānāti, titthiyapakkantako paṭijānāti, tiracchānagato paṭijānāti, mātughātako	paṭijānāti titthiya pakkantako paṭijānāti tiracchāna gato paṭijānāti mātu ghātako 
PA_kd_16:17.3.40_2	paṭijānāti, pitughātako paṭijānāti, arahantaghātako paṭijānāti, bhikkhunidūsako paṭijānāti,	paṭijānāti pitu ghātako paṭijānāti arahanta ghātako paṭijānāti bhikkhu nidūsako paṭijānāti 
PA_kd_16:17.3.40_3	saṅghabhedako paṭijānāti, lohituppādako paṭijānāti, ubhatobyañjanako paṭijānāti—	saṅgha bhedako paṭijānāti lohituppādako paṭijānāti ubhatobyañjanakaḥ paṭijānāti 
PA_kd_16:17.3.41	saṅgho sāmī”ti.	saṅghaḥ sāmī iti 
PA_kd_16:18.1.0	4. Aññatraparibhogapaṭikkhepādi	aññatra paribhoga paṭikkhepa ādi 
PA_kd_16:18.1.1	Tena kho pana samayena bhikkhū aññatarassa upāsakassa vihāraparibhogaṁ senāsanaṁ aññatra paribhuñjanti.	tena kho pana samayena bhikkhū aññatarassa upāsakassa vihāra paribhogam senāsanam aññatra paribhuñjanti 
PA_kd_16:18.1.2	Atha kho so upāsako ujjhāyati khiyyati vipāceti—	atha kho saḥ upāsakaḥ ujjhāyati khiyyati vipāceti 
PA_kd_16:18.1.3	“kathañhi nāma bhadantā aññatra paribhogaṁ aññatra paribhuñjissantī”ti.	katham hi nāma bhadantāḥ aññatra paribhogam aññatra paribhuñjissanti iti 
PA_kd_16:18.1.4	Bhagavato etamatthaṁ ārocesuṁ.	bhagavato etam attham ārocesu 
PA_kd_16:18.1.5	“Na, bhikkhave, aññatra paribhogo aññatra paribhuñjitabbo.	na bhikkhave aññatra paribhogaḥ aññatra paribhuñjitabbo 
PA_kd_16:18.1.6	Yo paribhuñjeyya, āpatti dukkaṭassā”ti.	yaḥ paribhuñjeyya āpatti dukkaṭassa ati 
PA_kd_16:18.1.7	Tena kho pana samayena bhikkhū uposathaggampi sannisajjampi harituṁ kukkuccāyantā chamāya nisīdanti.	tena kho pana samayena bhikkhū uposathaggam pi sannisajjam pi haritum kukkuccāyantā chamāya nisīdanti 
PA_kd_16:18.1.8	Gattānipi cīvarānipi paṁsukitāni honti.	gattānipi cīvarānipi pasukitāni honti 
PA_kd_16:18.1.9	Bhagavato etamatthaṁ ārocesuṁ.	bhagavato etam attham ārocesu 
PA_kd_16:18.1.10	“Anujānāmi, bhikkhave, tāvakālikaṁ haritun”ti.	anujānāmi bhikkhave tāvakālikam haritun ti 
PA_kd_16:18.1.11	Tena kho pana samayena saṅghassa mahāvihāro undriyati.	tena kho pana samayena saṅghassa mahāvihāraḥ undriyati 
PA_kd_16:18.1.12	Bhikkhū kukkuccāyantā senāsanaṁ nātiharanti.	bhikkhū kukkuccāyantā senāsanam na atiharanti 
PA_kd_16:18.1.13	Bhagavato etamatthaṁ ārocesuṁ.	bhagavato etam attham ārocesu 
PA_kd_16:18.1.14	“Anujānāmi, bhikkhave, guttatthāya haritun”ti.	anujānāmi bhikkhave gutta atthāya haritunti 
PA_kd_16:19.1.1	Tena kho pana samayena saṅghassa senāsanaparikkhāriko mahaggho kambalo uppanno hoti.	tena kho pana samayena saṅghassa senāsana parikkhārikaḥ mahagghaḥ kambalaḥ uppannaḥ hoti 
PA_kd_16:19.1.2	Bhagavato etamatthaṁ ārocesuṁ.	bhagavato etam attham ārocesu 
PA_kd_16:19.1.3	“Anujānāmi, bhikkhave, phātikammatthāya parivattetun”ti.	anujānāmi bhikkhave phāti kamma atthāya parivattetun ti 
PA_kd_16:19.1.4	Tena kho pana samayena saṅghassa senāsanaparikkhārikaṁ mahagghaṁ dussaṁ uppannaṁ hoti.	tena kho pana samayena saṅghassa senāsana parikkhārikam mahaggham dussam uppannam hoti 
PA_kd_16:19.1.5	Bhagavato etamatthaṁ ārocesuṁ.	bhagavato etam attham ārocesu 
PA_kd_16:19.1.6	“Anujānāmi, bhikkhave, phātikammatthāya parivattetun”ti.	anujānāmi bhikkhave phāti kamma atthāya parivattetun ti 
PA_kd_16:19.1.7	Tena kho pana samayena saṅghassa acchacammaṁ uppannaṁ hoti.	tena kho pana samayena saṅghassa accha cammam uppannam hoti 
PA_kd_16:19.1.8	Bhagavato etamatthaṁ ārocesuṁ.	bhagavato etam attham ārocesu 
PA_kd_16:19.1.9	“Anujānāmi, bhikkhave, pādapuñchaniṁ kātun”ti.	anujānāmi bhikkhave pāda puñchanim kātunti 
PA_kd_16:19.1.10	Tena kho pana samayena saṅghassa cakkalikaṁ uppannaṁ hoti.	tena kho pana samayena saṅghassa cakkalikam uppannam hoti 
PA_kd_16:19.1.11	Bhagavato etamatthaṁ ārocesuṁ.	bhagavato etam attham ārocesu 
PA_kd_16:19.1.12	“Anujānāmi, bhikkhave, pādapuñchaniṁ kātun”ti.	anujānāmi bhikkhave pāda puñchanim kātunti 
PA_kd_16:19.1.13	Tena kho pana samayena saṅghassa coḷakaṁ uppannaṁ hoti.	tena kho pana samayena saṅghassa coḷakam uppannam hoti 
PA_kd_16:19.1.14	Bhagavato etamatthaṁ ārocesuṁ.	bhagavato etam attham ārocesu 
PA_kd_16:19.1.15	“Anujānāmi, bhikkhave, pādapuñchaniṁ kātun”ti.	anujānāmi bhikkhave pāda puñchanim kātunti 
PA_kd_16:20.1.1	Tena kho pana samayena bhikkhū adhotehi pādehi senāsanaṁ akkamanti.	tena kho pana samayena bhikkhū a dhotehi pādehi senāsanam akkamanti 
PA_kd_16:20.1.2	Senāsanaṁ dussati.	senāsanam dussati 
PA_kd_16:20.1.3	Bhagavato etamatthaṁ ārocesuṁ.	bhagavato etam attham ārocesu 
PA_kd_16:20.1.4	“Na, bhikkhave, adhotehi pādehi senāsanaṁ akkamitabbaṁ.	na bhikkhave a dhotehi pādehi senāsanam 
PA_kd_16:20.1.5	Yo akkameyya, āpatti dukkaṭassā”ti.	yaḥ akkameyya āpatti dukkaṭassa ati 
PA_kd_16:20.1.6	Tena kho pana samayena bhikkhū allehi pādehi senāsanaṁ akkamanti.	tena kho pana samayena bhikkhū allehi pādehi senāsanam akkamanti 
PA_kd_16:20.1.7	Senāsanaṁ dussati.	senāsanam dussati 
PA_kd_16:20.1.8	Bhagavato etamatthaṁ ārocesuṁ.	bhagavato etam attham ārocesu 
PA_kd_16:20.1.9	“Na, bhikkhave, allehi pādehi senāsanaṁ akkamitabbaṁ.	na bhikkhave allehi pādehi senāsanam 
PA_kd_16:20.1.10	Yo akkameyya, āpatti dukkaṭassā”ti.	yaḥ akkameyya āpatti dukkaṭassa ati 
PA_kd_16:20.1.11	Tena kho pana samayena bhikkhū saupāhanā senāsanaṁ akkamanti.	tena kho pana samayena bhikkhū sa upāhanāḥ senāsanam akkamanti 
PA_kd_16:20.1.12	Senāsanaṁ dussati.	senāsanam dussati 
PA_kd_16:20.1.13	Bhagavato etamatthaṁ ārocesuṁ.	bhagavato etam attham ārocesu 
PA_kd_16:20.1.14	“Na, bhikkhave, saupāhanena senāsanaṁ akkamitabbaṁ.	na bhikkhave sa upāhanena senāsanam 
PA_kd_16:20.1.15	Yo akkameyya, āpatti dukkaṭassā”ti.	yaḥ akkameyya āpatti dukkaṭassa ati 
PA_kd_16:20.2.1	Tena kho pana samayena bhikkhū parikammakatāya bhūmiyā niṭṭhubhanti.	tena kho pana samayena bhikkhū parikammakatāya bhūmiyā niṭṭhubhanti 
PA_kd_16:20.2.2	Vaṇṇo dussati.	vaṇṇaḥ dussati 
PA_kd_16:20.2.3	Bhagavato etamatthaṁ ārocesuṁ.	bhagavato etam attham ārocesu 
PA_kd_16:20.2.4	“Na, bhikkhave, parikammakatāya bhūmiyā niṭṭhubhitabbaṁ.	na bhikkhave parikammakatāya bhūmiyā 
