segmentnr	original	analyzed
PA_kd_14:13.3.10_2	ṭhapetvā gihippaṭisaṁyuttaṁ.	ṭhapetvā gihi paṭisayutta 
PA_kd_14:13.3.11	Yassāyasmato khamati amhākaṁ imāsaṁ āpattīnaṁ saṅghamajjhe tiṇavatthārakena desanā, ṭhapetvā thullavajjaṁ, ṭhapetvā gihippaṭisaṁyuttaṁ, so tuṇhassa;	yassa ayasmataḥ khamati amhākam imāsam āpattīnam saṅgha majjhe tiṇavatthārakena desanāḥ ṭhapetvā thullavajja ṭhapetvā gihi paṭisayutta so tuṇhassa 
PA_kd_14:13.3.12	yassa nakkhamati, so bhāseyya.	yassa na khamati saḥ bhāseyya 
PA_kd_14:13.3.13	Desitā amhākaṁ imā āpattiyo saṅghamajjhe tiṇavatthārakena, ṭhapetvā thullavajjaṁ, ṭhapetvā gihippaṭisaṁyuttaṁ.	desitāḥ amhākam imāḥ āpattiyaḥ saṅgha majjhe tiṇavatthārakena ṭhapetvā thullavajja ṭhapetvā gihippaṭisayutta 
PA_kd_14:13.3.14	Khamati saṅghassa, tasmā tuṇhī, evametaṁ dhārayāmī’ti.	khamati saṅghassa tasmai tuṇhī evam etam dhārayāmi iti 
PA_kd_14:13.3.15	Athāparesaṁ ekatopakkhikānaṁ bhikkhūnaṁ byattena bhikkhunā paṭibalena saṅgho ñāpetabbo—	atha aparesam ekatopakkhikānam bhikkhūnam byattena bhikkhunā paṭibalena saṅghaḥ ñāpetabbaḥ 
PA_kd_14:13.3.16	‘Suṇātu me, bhante, saṅgho.	suṇātu me bhante saṅghaḥ 
PA_kd_14:13.3.17	Amhākaṁ bhaṇḍanajātānaṁ kalahajātānaṁ vivādāpannānaṁ viharataṁ bahuṁ assāmaṇakaṁ ajjhāciṇṇaṁ bhāsitaparikkantaṁ.	amhākam bhaṇḍana jātānam kalaha jātānam vivāda āpannānam viharatam bahum assāmaṇakam ajjhāciṇṇam bhāsita parikkanta 
PA_kd_14:13.3.18	Sace mayaṁ imāhi āpattīhi aññamaññaṁ kāressāma, siyāpi taṁ adhikaraṇaṁ kakkhaḷattāya vāḷattāya bhedāya saṁvatteyya.	sace mayam imāhi āpattīhi aññamaññam kāressāma siyā api tam adhikaraṇam kakkhaḷattāya vāḷattāya bhedāya savatteyya 
PA_kd_14:13.3.19_0	Yadi saṅghassa pattakallaṁ, ahaṁ yā ceva imesaṁ āyasmantānaṁ āpatti, yā ca attano	yadi saṅghassa aham yā ca iva imesam āyasmantānam āpatti yā ca attano 
PA_kd_14:13.3.19_1	āpatti, imesañceva āyasmantānaṁ atthāya, attano ca atthāya, saṅghamajjhe tiṇavatthārakena	āpatti imesam ca iva āyasmantānam atthāya attano ca atthāya saṅgha majjhe tiṇavatthārakena 
PA_kd_14:13.3.19_2	deseyyaṁ, ṭhapetvā thullavajjaṁ, ṭhapetvā gihippaṭisaṁyuttaṁ.	deseyya ṭhapetvā thullavajja ṭhapetvā gihippaṭisayutta 
PA_kd_14:13.3.20	Esā ñatti.	esā ñatti 
PA_kd_14:13.3.21	Suṇātu me, bhante, saṅgho.	suṇātu me bhante saṅghaḥ 
PA_kd_14:13.3.22	Amhākaṁ bhaṇḍanajātānaṁ kalahajātānaṁ vivādāpannānaṁ viharataṁ bahuṁ assāmaṇakaṁ ajjhāciṇṇaṁ bhāsitaparikkantaṁ.	amhākam bhaṇḍana jātānam kalaha jātānam vivāda āpannānam viharatam bahum assāmaṇakam ajjhāciṇṇam bhāsita parikkanta 
PA_kd_14:13.3.23	Sace mayaṁ imāhi āpattīhi aññamaññaṁ kāressāma, siyāpi taṁ adhikaraṇaṁ kakkhaḷattāya vāḷattāya bhedāya saṁvatteyya.	sace mayam imāhi āpattīhi aññamaññam kāressāma siyā api tam adhikaraṇam kakkhaḷattāya vāḷattāya bhedāya savatteyya 
PA_kd_14:13.3.24_0	Ahaṁ yā ceva imesaṁ āyasmantānaṁ āpatti, yā ca attano āpatti, imesañceva āyasmantānaṁ	aham yā ca iva imesam āyasmantānam āpatti yā ca attanaḥ āpatti imesam ca iva āyasmantānam 
PA_kd_14:13.3.24_1	atthāya, attano ca atthāya, saṅghamajjhe tiṇavatthārakena desemi, ṭhapetvā thullavajjaṁ,	atthāya attano ca atthāya saṅgha majjhe tiṇavatthārakena desemi ṭhapetvā thullavajja 
PA_kd_14:13.3.24_2	ṭhapetvā gihippaṭisaṁyuttaṁ.	ṭhapetvā gihi paṭisayutta 
PA_kd_14:13.3.25	Yassāyasmato khamati amhākaṁ imāsaṁ āpattīnaṁ saṅghamajjhe tiṇavatthārakena desanā, ṭhapetvā thullavajjaṁ, ṭhapetvā gihippaṭisaṁyuttaṁ, so tuṇhassa;	yassa ayasmataḥ khamati amhākam imāsam āpattīnam saṅgha majjhe tiṇavatthārakena desanāḥ ṭhapetvā thullavajja ṭhapetvā gihi paṭisayutta so tuṇhassa 
PA_kd_14:13.3.26	yassa nakkhamati, so bhāseyya.	yassa na khamati saḥ bhāseyya 
PA_kd_14:13.3.27	Desitā amhākaṁ imā āpattiyo saṅghamajjhe tiṇavatthārakena, ṭhapetvā thullavajjaṁ, ṭhapetvā gihippaṭisaṁyuttaṁ.	desitāḥ amhākam imāḥ āpattiyaḥ saṅgha majjhe tiṇavatthārakena ṭhapetvā thullavajja ṭhapetvā gihippaṭisayutta 
PA_kd_14:13.3.28	Khamati saṅghassa, tasmā tuṇhī, evametaṁ dhārayāmī’ti.	khamati saṅghassa tasmai tuṇhī evam etam dhārayāmi iti 
PA_kd_14:13.4.1	Evañca pana, bhikkhave, te bhikkhū tāhi āpattīhi vuṭṭhitā honti, ṭhapetvā thullavajjaṁ, ṭhapetvā gihippaṭisaṁyuttaṁ, ṭhapetvā diṭṭhāvikammaṁ, ṭhapetvā ye na tattha hontī”ti.	evam ca pana bhikkhave te bhikkhū tāhi āpattīhi vuṭṭhitāḥ honti ṭhapetvā thullavajja ṭhapetvā gihi paṭisayutta ṭhapetvā diṭṭha avikamma ṭhapetvā ye na tattha honti iti 
PA_kd_14:14.1.0	8. Adhikaraṇa	adhikaraṇa 
PA_kd_14:14.1.1_0	Tena kho pana samayena bhikkhūpi bhikkhūhi vivadanti, bhikkhūpi bhikkhunīhi vivadanti,	tena kho pana samayena bhikkhū api bhikkhūhi vivadanti bhikkhū api bhikkhunīhi vivadanti 
PA_kd_14:14.1.1_1	bhikkhuniyopi bhikkhūhi vivadanti, channopi bhikkhu bhikkhunīnaṁ anupakhajja bhikkhūhi	bhikkhuniyaḥ api bhikkhūhi vivadanti channaḥ api bhikkhu bhikkhunīnam an upakhajja bhikkhūhi 
PA_kd_14:14.1.1_2	saddhiṁ vivadati, bhikkhunīnaṁ pakkhaṁ gāheti.	saddhim vivadati bhikkhunīnam pakkham gāheti 
PA_kd_14:14.1.2	Ye te bhikkhū appicchā …pe… te ujjhāyanti khiyyanti vipācenti—	ye te bhikkhū appicchā pe te ujjhāyanti khiyyanti vipācenti 
PA_kd_14:14.1.3	“kathañhi nāma channo bhikkhu bhikkhunīnaṁ anupakhajja bhikkhūhi saddhiṁ vivadissati, bhikkhunīnaṁ pakkhaṁ gāhessatīti.	katham hi nāma channaḥ bhikkhu bhikkhunīnam an upakhajja bhikkhūhi saddhim vivadissati bhikkhunīnam pakkham gāhessati iti 
PA_kd_14:14.1.4	Atha kho te bhikkhū bhagavato etamatthaṁ ārocesuṁ …pe…	atha kho te bhikkhū bhagavataḥ etam attham ārocesuṃ pe 
PA_kd_14:14.1.5	saccaṁ kira, bhikkhave …pe…	saccam kira bhikkhave pe 
PA_kd_14:14.1.6	saccaṁ, bhagavā”ti …pe…	sat ca bhagavān ati pe 
PA_kd_14:14.1.7	vigarahitvā …pe…	vigara hitvā pe 
PA_kd_14:14.1.8	dhammiṁ kathaṁ katvā bhikkhū āmantesi—	dhammim katham katvā bhikkhū āmantesi 
PA_kd_14:14.2.1	“Cattārimāni, bhikkhave, adhikaraṇāni— vivādādhikaraṇaṁ, anuvādādhikaraṇaṁ, āpattādhikaraṇaṁ, kiccādhikaraṇaṁ.	cattārimāni bhikkhave adhikaraṇāni vivāda adhikaraṇa anuvāda adhikaraṇa āpatta adhikaraṇa kiccādhikaraṇa 
PA_kd_14:14.2.2	Tattha katamaṁ vivādādhikaraṇaṁ?	katamam 
PA_kd_14:14.2.3	Idha pana, bhikkhave, bhikkhū vivadanti—	idha pana bhikkhave bhikkhū vivadanti 
PA_kd_14:14.2.4_0	dhammoti vā adhammoti vā, vinayoti vā avinayoti vā, bhāsitaṁ lapitaṁ tathāgatenāti	dhammaḥ iti vā adhammaḥ iti vā vinayo iti vā avinayo iti vā bhāsitam lapitam tathāgatena ati 
PA_kd_14:14.2.4_1	vā abhāsitaṁ alapitaṁ tathāgatenāti vā, āciṇṇaṁ tathāgatenāti vā anāciṇṇaṁ tathāgatenāti	vā a bhāsitam a lapitam tathāgatena ati vā āciṇṇam tathāgatena ati vā an āciṇṇam tathāgatena ati 
PA_kd_14:14.2.4_2	vā, paññattaṁ tathāgatenāti vā apaññattaṁ tathāgatenāti vā, āpattīti vā anāpattīti	vā paññattam tathāgatena ati vā a paññattam tathāgatena ati vā āpatti iti vā anāpatti iti 
PA_kd_14:14.2.4_3	vā, lahukā āpattīti vā garukā āpattīti vā, sāvasesā āpattīti vā anavasesā āpattīti	vā lahukā āpattiḥ iti vā garukā āpattiḥ iti vā sa avasesā āpattiḥ iti vā anavasesā āpattiḥ iti 
PA_kd_14:14.2.4_4	vā, duṭṭhullā āpattīti vā aduṭṭhullā āpattīti vā?	vā duṭṭhullā āpatti iti vā aduṭṭhullā āpatti iti vā 
PA_kd_14:14.2.5	Yaṁ tattha bhaṇḍanaṁ kalaho viggaho vivādo nānāvādo aññathāvādo vipaccatāya vohāro medhagaṁ—	yam tattha bhaṇḍanam kalahaḥ viggahaḥ vivādaḥ nānāvādaḥ aññathāvādaḥ vipacca tāya vohāraḥ medhaga 
PA_kd_14:14.2.6	idaṁ vuccati vivādādhikaraṇaṁ.	idam vuccati vivāda adhikaraṇa 
PA_kd_14:14.2.7	Tattha katamaṁ anuvādādhikaraṇaṁ?	katamam 
PA_kd_14:14.2.8	Idha pana, bhikkhave, bhikkhū bhikkhuṁ anuvadanti sīlavipattiyā vā ācāravipattiyā vā diṭṭhivipattiyā vā ājīvavipattiyā vā.	idha pana bhikkhave bhikkhū bhikkhum anuvadanti sīla vipattiyāḥ vā ācāra vipattiyāḥ vā diṭṭhi vipattiyāḥ vā ājīva vipattiyāḥ vā 
PA_kd_14:14.2.9	Yo tattha anuvādo anuvadanā anullapanā anubhaṇanā anusampavaṅkatā abbhussahanatā anubalappadānaṁ—	yaḥ tattha anuvādaḥ anuvadanā anullapanā anubhaṇanā anusampavaṅka tā abbhussahana tā anubala ppadāna 
PA_kd_14:14.2.10	idaṁ vuccati anuvādādhikaraṇaṁ.	idam vuccati anuvāda adhikaraṇa 
PA_kd_14:14.2.11	Tattha katamaṁ āpattādhikaraṇaṁ?	katamaṃ 
PA_kd_14:14.2.12	Pañcapi āpattikkhandhā āpattādhikaraṇaṁ, sattapi āpattikkhandhā āpattādhikaraṇaṁ—	āpatti kkhandhāḥ āpatta adhikaraṇa satta pi āpatti kkhandhāḥ āpatta adhikaraṇa 
PA_kd_14:14.2.13	idaṁ vuccati āpattādhikaraṇaṁ.	idam vuccati āpatta adhikaraṇa 
PA_kd_14:14.2.14	Tattha katamaṁ kiccādhikaraṇaṁ?	tattha katamam 
PA_kd_14:14.2.15	Yā saṅghassa kiccayatā, karaṇīyatā, apalokanakammaṁ, ñattikammaṁ, ñattidutiyakammaṁ, ñatticatutthakammaṁ—	yā saṅghassa kiccaya tā karaṇīya tā apalokana kamma ñatti kamma ñatti dutiya kamma ñatti catuttha kamma 
PA_kd_14:14.2.16	idaṁ vuccati kiccādhikaraṇaṁ.	idam vuccati kicca adhikaraṇa 
PA_kd_14:14.3.1	Vivādādhikaraṇassa kiṁ mūlaṁ?	vivāda adhikaraṇassa kim 
PA_kd_14:14.3.2	Cha vivādamūlāni vivādādhikaraṇassa mūlaṁ.	vivāda mūlāni vivāda adhikaraṇassa mūla 
PA_kd_14:14.3.3	Tīṇipi akusalamūlāni vivādādhikaraṇassa mūlaṁ, tīṇipi kusalamūlāni vivādādhikaraṇassa mūlaṁ.	tīṇi pi akusala mūlāni vivāda adhikaraṇassa mūla tīṇi pi kusala mūlāni vivāda adhikaraṇassa mūla 
PA_kd_14:14.3.4	Katamāni cha vivādamūlāni vivādādhikaraṇassa mūlaṁ?	katamāni cha vivāda mūlāni vivāda adhikaraṇassa mūla 
PA_kd_14:14.3.5	Idha pana, bhikkhave, bhikkhu kodhano hoti upanāhī.	idha pana bhikkhave bhikkhu kodhanaḥ hoti upanāhī 
PA_kd_14:14.3.6_0	Yo so, bhikkhave, bhikkhu kodhano hoti upanāhī, so sattharipi agāravo viharati appatisso,	yaḥ saḥ bhikkhave bhikkhu kodhanaḥ hoti upanāhī saḥ satthari pi agāravaḥ viharati appatissaḥ 
PA_kd_14:14.3.6_1	dhammepi agāravo viharati appatisso, saṅghepi agāravo viharati appatisso, sikkhāyapi	dhamme api agāravaḥ viharati appatissaḥ saṅghe api agāravaḥ viharati appatissaḥ sikkhāya api 
PA_kd_14:14.3.6_2	na paripūrakārī hoti.	na paripūra kārī hoti 
PA_kd_14:14.3.7	Yo so, bhikkhave, bhikkhu sattharipi agāravo viharati appatisso, dhammepi …pe…	yaḥ saḥ bhikkhave bhikkhu satthari pi agāravaḥ viharati appatissaḥ dhamme pi pe
PA_kd_14:14.3.8	saṅghepi …pe…	saṅghe pi pe 
PA_kd_14:14.3.9	sikkhāyapi na paripūrakārī, so saṅghe vivādaṁ janeti.	na paripūra kārī saḥ saṅghe vivādam janeti 
PA_kd_14:14.3.10	Yo hoti vivādo bahujanāhitāya bahujanāsukhāya bahuno janassa anatthāya ahitāya dukkhāya devamanussānaṁ.	yaḥ hoti vivādaḥ bahu jana ahitāya bahu jana asukhāya bahunaḥ janassa anatthāya ahitāya dukkhāya deva manussāna 
PA_kd_14:14.3.11	Evarūpañce tumhe, bhikkhave, vivādamūlaṁ ajjhattaṁ vā bahiddhā vā samanupasseyyātha, tatra tumhe, bhikkhave, tasseva pāpakassa vivādamūlassa pahānāya vāyameyyātha.	evarūpam ce tumhe bhikkhave vivāda mūlam ajjhattam vā bahiddhā vā samanupasseyyātha tatra tumhe bhikkhave tassa eva pāpakassa vivāda mūlassa pahānāya vā āyameyyātha 
PA_kd_14:14.3.12	Evarūpañce tumhe, bhikkhave, vivādamūlaṁ ajjhattaṁ vā bahiddhā vā na samanupasseyyātha, tatra tumhe, bhikkhave, tasseva pāpakassa vivādamūlassa āyatiṁ anavassavāya paṭipajjeyyātha.	evarūpam ce tumhe bhikkhave vivāda mūlam ajjhattam vā bahiddhā vā na samanupasseyyātha tatra tumhe bhikkhave tassa eva pāpakassa vivāda mūlassa āyatim anavassavāya paṭipajjeyyātha 
PA_kd_14:14.3.13	Evametassa pāpakassa vivādamūlassa pahānaṁ hoti.	evam etassa pāpakassa vivāda mūlassa pahānam hoti 
PA_kd_14:14.3.14	Evametassa pāpakassa vivādamūlassa āyatiṁ anavassavo hoti.	evam etassa pāpakassa vivāda mūlassa āyatim anavassavaḥ hoti 
PA_kd_14:14.3.15	Puna caparaṁ, bhikkhave, bhikkhu makkhī hoti paḷāsī …pe…	puna capara bhikkhave bhikkhu makkhī hoti paḷāsī pe 
PA_kd_14:14.3.16	issukī hoti maccharī, saṭho hoti māyāvī, pāpiccho hoti micchādiṭṭhī, sandiṭṭhiparāmāsī hoti ādhānaggāhī duppaṭinissaggī.	issukī hoti maccharī saṭhaḥ hoti māyāvī pāpa icchaḥ hoti micchādiṭṭhī sandiṭṭhi parāmāsī hoti ādhāna ggāhī duppaṭinissaggī 
PA_kd_14:14.3.17_0	Yo so, bhikkhave, bhikkhu sandiṭṭhiparāmāsī hoti ādhānaggāhī duppaṭinissaggī, so	yaḥ saḥ bhikkhave bhikkhu sandiṭṭhi parāmāsī hoti ādhāna ggāhī duppaṭinissaggī saḥ 
PA_kd_14:14.3.17_1	sattharipi agāravo viharati appatisso, dhammepi agāravo viharati appatisso, saṅghepi	satthari pi agāravaḥ viharati appatissaḥ dhamme pi agāravaḥ viharati appatissaḥ saṅghe pi 
PA_kd_14:14.3.17_2	agāravo viharati appatisso, sikkhāyapi na paripūrakārī hoti.	agāravaḥ viharati appatissaḥ na paripūra kārī hoti 
PA_kd_14:14.3.18	Yo so, bhikkhave, bhikkhu sattharipi agāravo viharati appatisso, dhammepi …pe…	yaḥ saḥ bhikkhave bhikkhu satthari pi agāravaḥ viharati appatissaḥ dhamme pi pe
PA_kd_14:14.3.19	saṅghepi …pe…	saṅghe pi pe 
PA_kd_14:14.3.20	sikkhāyapi na paripūrakārī, so saṅghe vivādaṁ janeti.	na paripūra kārī saḥ saṅghe vivādam janeti 
PA_kd_14:14.3.21	Yo hoti vivādo bahujanāhitāya bahujanāsukhāya bahuno janassa anatthāya ahitāya dukkhāya devamanussānaṁ.	yaḥ hoti vivādaḥ bahu jana ahitāya bahu jana asukhāya bahunaḥ janassa anatthāya ahitāya dukkhāya deva manussāna 
PA_kd_14:14.3.22	Evarūpañce tumhe, bhikkhave, vivādamūlaṁ ajjhattaṁ vā bahiddhā vā samanupasseyyātha, tatra tumhe, bhikkhave, tasseva pāpakassa vivādamūlassa pahānāya vāyameyyātha.	evarūpam ce tumhe bhikkhave vivāda mūlam ajjhattam vā bahiddhā vā samanupasseyyātha tatra tumhe bhikkhave tassa eva pāpakassa vivāda mūlassa pahānāya vā āyameyyātha 
PA_kd_14:14.3.23	Evarūpañce tumhe, bhikkhave, vivādamūlaṁ ajjhattaṁ vā bahiddhā vā na samanupasseyyātha, tatra tumhe, bhikkhave, tasseva pāpakassa vivādamūlassa āyatiṁ anavassavāya paṭipajjeyyātha.	evarūpam ce tumhe bhikkhave vivāda mūlam ajjhattam vā bahiddhā vā na samanupasseyyātha tatra tumhe bhikkhave tassa eva pāpakassa vivāda mūlassa āyatim anavassavāya paṭipajjeyyātha 
PA_kd_14:14.3.24	Evametassa pāpakassa vivādamūlassa pahānaṁ hoti.	evam etassa pāpakassa vivāda mūlassa pahānam hoti 
PA_kd_14:14.3.25	Evametassa pāpakassa vivādamūlassa āyatiṁ anavassavo hoti.	evam etassa pāpakassa vivāda mūlassa āyatim anavassavaḥ hoti 
PA_kd_14:14.3.26	Imāni cha vivādamūlāni vivādādhikaraṇassa mūlaṁ.	imāni cha vivāda mūlāni vivāda adhikaraṇassa mūla 
PA_kd_14:14.4.1	Katamāni tīṇi akusalamūlāni vivādādhikaraṇassa mūlaṁ?	katamāni tīṇi akusala mūlāni vivāda adhikaraṇassa mūla 
PA_kd_14:14.4.2	Idha pana, bhikkhave, bhikkhū luddhacittā vivadanti, duṭṭhacittā vivadanti, mūḷhacittā vivadanti—	idha pana bhikkhave bhikkhū luddha cittāḥ vivadanti duṭṭha cittāḥ vivadanti mūḍha cittāḥ vivadanti 
PA_kd_14:14.4.3_0	dhammoti vā adhammoti vā, vinayoti vā avinayoti vā, bhāsitaṁ lapitaṁ tathāgatenāti	dhammaḥ iti vā adhammaḥ iti vā vinayo iti vā avinayo iti vā bhāsitam lapitam tathāgatena ati 
PA_kd_14:14.4.3_1	vā abhāsitaṁ alapitaṁ tathāgatenāti vā, āciṇṇaṁ tathāgatenāti vā anāciṇṇaṁ tathāgatenāti	vā a bhāsitam a lapitam tathāgatena ati vā āciṇṇam tathāgatena ati vā an āciṇṇam tathāgatena ati 
PA_kd_14:14.4.3_2	vā, paññattaṁ tathāgatenāti vā apaññattaṁ tathāgatenāti vā, āpattīti vā anāpattīti	vā paññattam tathāgatena ati vā a paññattam tathāgatena ati vā āpatti iti vā anāpatti iti 
PA_kd_14:14.4.3_3	vā, lahukā āpattīti vā garukā āpattīti vā, sāvasesā āpattīti vā anavasesā āpattīti	vā lahukā āpattiḥ iti vā garukā āpattiḥ iti vā sa avasesā āpattiḥ iti vā anavasesā āpattiḥ iti 
PA_kd_14:14.4.3_4	vā, duṭṭhullā āpattīti vā aduṭṭhullā āpattīti vā.	vā duṭṭhullā āpatti iti vā aduṭṭhullā āpatti iti vā 
PA_kd_14:14.4.4	Imāni tīṇi akusalamūlāni vivādādhikaraṇassa mūlaṁ.	imāni tīṇi akusala mūlāni vivāda adhikaraṇassa mūla 
PA_kd_14:14.4.5	Katamāni tīṇi kusalamūlāni vivādādhikaraṇassa mūlaṁ?	katamāni tīṇi kusala mūlāni vivāda adhikaraṇassa mūla 
PA_kd_14:14.4.6	Idha pana, bhikkhave, bhikkhū aluddhacittā vivadanti, aduṭṭhacittā vivadanti, amūḷhacittā vivadanti—	idha pana bhikkhave bhikkhū a luddha cittāḥ vivadanti a duṭṭha cittāḥ vivadanti a mūḍha cittāḥ vivadanti 
PA_kd_14:14.4.7	dhammoti vā adhammoti vā …pe…	dhammaḥ ti vā adhammaḥ ti vā pe 
PA_kd_14:14.4.8	duṭṭhullā āpattīti vā aduṭṭhullā āpattīti vā.	duṭṭhullā āpatti iti vā aduṭṭhullā āpatti iti vā 
PA_kd_14:14.4.9	Imāni tīṇi kusalamūlāni vivādādhikaraṇassa mūlaṁ.	imāni tīṇi kusala mūlāni vivāda adhikaraṇassa mūla 
PA_kd_14:14.5.1	“Anuvādādhikaraṇassa kiṁ mūlaṁ?	anuvāda adhikaraṇassa kim 
PA_kd_14:14.5.2	Cha anuvādamūlāni anuvādādhikaraṇassa mūlaṁ.	anuvāda mūlāni anuvāda adhikaraṇassa mūla 
PA_kd_14:14.5.3	Tīṇipi akusalamūlāni anuvādādhikaraṇassa mūlaṁ, tīṇipi kusalamūlāni anuvādādhikaraṇassa mūlaṁ, kāyopi anuvādādhikaraṇassa mūlaṁ, vācāpi anuvādādhikaraṇassa mūlaṁ.	akusala mūlāni anuvāda adhikaraṇassa mūla tīṇi pi kusala mūlāni anuvāda adhikaraṇassa mūla kāyopi anuvāda adhikaraṇassa mūla vācā api anuvāda adhikaraṇassa mūla 
PA_kd_14:14.5.4	Katamāni cha anuvādamūlāni anuvādādhikaraṇassa mūlaṁ?	katamāni cha anuvāda mūlāni anuvāda adhikaraṇassa mūla 
PA_kd_14:14.5.5	Idha pana, bhikkhave, bhikkhu kodhano hoti upanāhī.	idha pana bhikkhave bhikkhu kodhanaḥ hoti upanāhī 
PA_kd_14:14.5.6_0	Yo so, bhikkhave, bhikkhu kodhano hoti upanāhī, so sattharipi agāravo viharati appatisso,	yaḥ saḥ bhikkhave bhikkhu kodhanaḥ hoti upanāhī saḥ satthari pi agāravaḥ viharati appatissaḥ 
PA_kd_14:14.5.6_1	dhammepi agāravo viharati appatisso, saṅghepi agāravo viharati appatisso, sikkhāyapi	dhamme api agāravaḥ viharati appatissaḥ saṅghe api agāravaḥ viharati appatissaḥ sikkhāya api 
PA_kd_14:14.5.6_2	na paripūrakārī hoti.	na paripūra kārī hoti 
PA_kd_14:14.5.7	Yo so, bhikkhave, bhikkhu sattharipi agāravo viharati appatisso, dhammepi …pe…	yaḥ saḥ bhikkhave bhikkhu satthari pi agāravaḥ viharati appatissaḥ dhamme pi pe
PA_kd_14:14.5.8	saṅghepi …pe…	saṅghe pi pe 
PA_kd_14:14.5.9	sikkhāyapi na paripūrakārī, so saṅghe anuvādaṁ janeti.	na paripūra kārī saḥ saṅghe anuvādam janeti 
PA_kd_14:14.5.10	Yo hoti anuvādo bahujanāhitāya bahujanāsukhāya bahuno janassa anatthāya ahitāya dukkhāya devamanussānaṁ.	yaḥ hoti anuvādaḥ bahu jana ahitāya bahu jana asukhāya bahunaḥ janassa anatthāya ahitāya dukkhāya deva manussāna 
PA_kd_14:14.5.11	Evarūpañce tumhe, bhikkhave, anuvādamūlaṁ ajjhattaṁ vā bahiddhā vā samanupasseyyātha, tatra tumhe, bhikkhave, tasseva pāpakassa anuvādamūlassa pahānāya vāyameyyātha.	evarūpam ce tumhe bhikkhave anuvāda mūlam ajjhattam vā bahiddhā vā samanupasseyyātha tatra tumhe bhikkhave tassa eva pāpakassa anuvāda mūlassa pahānāya vā āyameyyātha 
PA_kd_14:14.5.12_0	Evarūpañce tumhe, bhikkhave, anuvādamūlaṁ ajjhattaṁ vā bahiddhā vā na samanupasseyyātha,	evarūpam ce tumhe bhikkhave anuvāda mūlam ajjhattam vā bahiddhā vā na samanupasseyyātha 
PA_kd_14:14.5.12_1	tatra tumhe, bhikkhave, tasseva pāpakassa anuvādamūlassa āyatiṁ anavassavāya paṭipajjeyyātha.	tatra tumhe bhikkhave tassa iva pāpakassa anuvāda mūlassa āyatim anavassavāya paṭipajjeyyātha 
PA_kd_14:14.5.13	Evametassa pāpakassa anuvādamūlassa pahānaṁ hoti.	evam etassa pāpakassa anuvāda mūlassa pahānam hoti 
PA_kd_14:14.5.14	Evametassa pāpakassa anuvādamūlassa āyatiṁ anavassavo hoti.	evam etassa pāpakassa anuvāda mūlassa āyatim anavassavaḥ hoti 
PA_kd_14:14.5.15	Puna caparaṁ, bhikkhave, bhikkhu makkhī hoti paḷāsī …pe…	puna capara bhikkhave bhikkhu makkhī hoti paḷāsī pe 
PA_kd_14:14.5.16	issukī hoti maccharī, saṭho hoti māyāvī, pāpiccho hoti micchādiṭṭhī, sandiṭṭhiparāmāsī hoti ādhānaggāhī duppaṭinissaggī.	issukī hoti maccharī saṭhaḥ hoti māyāvī pāpa icchaḥ hoti micchādiṭṭhī sandiṭṭhi parāmāsī hoti ādhāna ggāhī duppaṭinissaggī 
PA_kd_14:14.5.17_0	Yo so, bhikkhave, bhikkhu sandiṭṭhiparāmāsī hoti ādhānaggāhī duppaṭinissaggī, so	yaḥ saḥ bhikkhave bhikkhu sandiṭṭhi parāmāsī hoti ādhāna ggāhī duppaṭinissaggī saḥ 
PA_kd_14:14.5.17_1	sattharipi agāravo viharati appatisso, dhammepi agāravo viharati appatisso, saṅghepi	satthari pi agāravaḥ viharati appatissaḥ dhamme pi agāravaḥ viharati appatissaḥ saṅghe pi 
PA_kd_14:14.5.17_2	agāravo viharati appatisso, sikkhāyapi na paripūrakārī hoti.	agāravaḥ viharati appatissaḥ na paripūra kārī hoti 
PA_kd_14:14.5.18	Yo so, bhikkhave, bhikkhu sattharipi agāravo viharati appatisso, dhammepi …pe…	yaḥ saḥ bhikkhave bhikkhu satthari pi agāravaḥ viharati appatissaḥ dhamme pi pe
PA_kd_14:14.5.19	saṅghepi …pe…	saṅghe pi pe 
PA_kd_14:14.5.20	sikkhāyapi na paripūrakārī, so saṅghe anuvādaṁ janeti.	na paripūra kārī saḥ saṅghe anuvādam janeti 
PA_kd_14:14.5.21	Yo hoti anuvādo bahujanāhitāya bahujanāsukhāya bahuno janassa anatthāya ahitāya dukkhāya devamanussānaṁ.	yaḥ hoti anuvādaḥ bahu jana ahitāya bahu jana asukhāya bahunaḥ janassa anatthāya ahitāya dukkhāya deva manussāna 
PA_kd_14:14.5.22	Evarūpañce tumhe, bhikkhave, anuvādamūlaṁ ajjhattaṁ vā bahiddhā vā samanupasseyyātha, tatra tumhe, bhikkhave, tasseva pāpakassa anuvādamūlassa pahānāya vāyameyyātha.	evarūpam ce tumhe bhikkhave anuvāda mūlam ajjhattam vā bahiddhā vā samanupasseyyātha tatra tumhe bhikkhave tassa eva pāpakassa anuvāda mūlassa pahānāya vā āyameyyātha 
PA_kd_14:14.5.23_0	Evarūpañce tumhe, bhikkhave, anuvādamūlaṁ ajjhattaṁ vā bahiddhā vā na samanupasseyyātha,	evarūpam ce tumhe bhikkhave anuvāda mūlam ajjhattam vā bahiddhā vā na samanupasseyyātha 
PA_kd_14:14.5.23_1	tatra tumhe, bhikkhave, tasseva pāpakassa anuvādamūlassa āyatiṁ anavassavāya paṭipajjeyyātha.	tatra tumhe bhikkhave tassa iva pāpakassa anuvāda mūlassa āyatim anavassavāya paṭipajjeyyātha 
PA_kd_14:14.5.24	Evametassa pāpakassa anuvādamūlassa pahānaṁ hoti.	evam etassa pāpakassa anuvāda mūlassa pahānam hoti 
PA_kd_14:14.5.25	Evametassa pāpakassa anuvādamūlassa āyatiṁ anavassavo hoti.	evam etassa pāpakassa anuvāda mūlassa āyatim anavassavaḥ hoti 
PA_kd_14:14.5.26	Imāni cha anuvādamūlāni anuvādādhikaraṇassa mūlaṁ.	imāni cha anuvāda mūlāni anuvāda adhikaraṇassa mūla 
PA_kd_14:14.5.27	Katamāni tīṇi akusalamūlāni anuvādādhikaraṇassa mūlaṁ?	katamāni tīṇi akusala mūlāni anuvāda adhikaraṇassa mūla 
PA_kd_14:14.5.28	Idha pana, bhikkhave, bhikkhū bhikkhuṁ luddhacittā anuvadanti, duṭṭhacittā anuvadanti, mūḷhacittā anuvadanti—	idha pana bhikkhave bhikkhū bhikkhum luddha cittāḥ anuvadanti duṭṭha cittāḥ anuvadanti mūḍha cittāḥ anuvadanti 
PA_kd_14:14.5.29	sīlavipattiyā vā, ācāravipattiyā vā, diṭṭhivipattiyā vā, ājīvavipattiyā vā.	sīla vipattiyā vā ācāra vipattiyā vā diṭṭhi vipattiyā vā ājīva vipattiyā vā 
PA_kd_14:14.5.30	Imāni tīṇi akusalamūlāni anuvādādhikaraṇassa mūlaṁ.	imāni tīṇi akusala mūlāni anuvāda adhikaraṇassa mūla 
PA_kd_14:14.5.31	Katamāni tīṇi kusalamūlāni anuvādādhikaraṇassa mūlaṁ?	katamāni tīṇi kusala mūlāni anuvāda adhikaraṇassa mūla 
PA_kd_14:14.5.32	Idha pana, bhikkhave, bhikkhū bhikkhuṁ aluddhacittā anuvadanti, aduṭṭhacittā anuvadanti, amūḷhacittā anuvadanti—	idha pana bhikkhave bhikkhū bhikkhum a luddha cittāḥ anuvadanti a duṭṭha cittāḥ anuvadanti a mūḍha cittāḥ anuvadanti 
PA_kd_14:14.5.33	sīlavipattiyā vā, ācāravipattiyā vā, diṭṭhivipattiyā vā, ājīvavipattiyā vā.	sīla vipattiyā vā ācāra vipattiyā vā diṭṭhi vipattiyā vā ājīva vipattiyā vā 
PA_kd_14:14.5.34	Imāni tīṇi kusalamūlāni anuvādādhikaraṇassa mūlaṁ.	imāni tīṇi kusala mūlāni anuvāda adhikaraṇassa mūla 
PA_kd_14:14.5.35	Katamo kāyo anuvādādhikaraṇassa mūlaṁ?	katamo kāyaḥ anuvāda adhikaraṇassa mūla 
