segmentnr	original	analyzed
PA_mn_89:18.2	atha ca pana no tathā mayi nipaccakāraṁ karonti yathā bhagavati.	atha ca pana no tathā mayi nipaccakāram karonti yathā bhagavati 
PA_mn_89:18.3	Bhūtapubbāhaṁ, bhante, senaṁ abbhuyyāto samāno ime ca isidattapurāṇā thapatayo vīmaṁsamāno aññatarasmiṁ sambādhe āvasathe vāsaṁ upagacchiṁ.	bhūta pubbā āha bhante senam abbhuyyātaḥ samānaḥ ime ca isidatta purāṇāḥ thapatayaḥ aññatarasmin sambādhe āvasathe vāsam upagacchi 
PA_mn_89:18.4	Atha kho, bhante, ime isidattapurāṇā thapatayo bahudeva rattiṁ dhammiyā kathāya vītināmetvā, yato ahosi bhagavā tato sīsaṁ katvā maṁ pādato karitvā nipajjiṁsu.	atha kho bhante ime isidatta purāṇāḥ thapatayaḥ bahu deva rattim dhammiyā kathāya vītināmetvā yatas ahosi bhagavā tatas sīsam katvā mam pādataḥ karitvā nipajjisu 
PA_mn_89:18.5	Tassa mayhaṁ, bhante, etadahosi:	tassa mayha bhante 
PA_mn_89:18.6	‘acchariyaṁ vata bho, abbhutaṁ vata bho.	acchariyam vata bho abbhutam vata bho 
PA_mn_89:18.7	Ime isidattapurāṇā thapatayo mamabhattā mamayānā, ahaṁ nesaṁ jīvikāya dātā, yasassa āhattā;	ime isidatta purāṇā thapatayaḥ mamabhattāḥ mamayānāḥ aham na isam jīvikāya dātā yasassa āhattā 
PA_mn_89:18.8	atha ca pana no tathā mayi nipaccakāraṁ karonti yathā bhagavati.	atha ca pana no tathā mayi nipaccakāram karonti yathā bhagavati 
PA_mn_89:18.9	Addhā ime āyasmanto tassa bhagavato sāsane uḷāraṁ pubbenāparaṁ visesaṁ jānantī’ti.	addhā ime āyasmantaḥ tassa bhagavato sāsane uḷāram pubbena aparam visesam jānanti iti 
PA_mn_89:18.10	Ayampi kho me, bhante, bhagavati dhammanvayo hoti:	ayam pi kho me bhante bhagavati dhamma anvayaḥ hoti 
PA_mn_89:18.11	‘sammāsambuddho bhagavā, svākkhāto bhagavatā dhammo, suppaṭipanno bhagavato sāvakasaṅgho’ti.	sammāsambuddhaḥ bhagavā su ākkhātaḥ bhagavatā dhammo su paṭipannaḥ bhagavataḥ sāvaka saṅghaḥ iti 
PA_mn_89:19.1	Puna caparaṁ, bhante, bhagavāpi khattiyo, ahampi khattiyo;	puna capara bhante bhagavā api khattiyaḥ aham pi khattiyaḥ 
PA_mn_89:19.2	bhagavāpi kosalo, ahampi kosalo;	bhagavā api kosalaḥ aham pi kosalaḥ 
PA_mn_89:19.3	bhagavāpi āsītiko, ahampi āsītiko.	bhagavān api āsītikaḥ aham pi āsītikaḥ 
PA_mn_89:19.4	Yampi, bhante, bhagavāpi khattiyo ahampi khattiyo, bhagavāpi kosalo ahampi kosalo, bhagavāpi āsītiko ahampi āsītiko;	yam pi bhante bhagavā api khattiyaḥ aham pi khattiyaḥ bhagavā api kosalaḥ aham pi kosalaḥ bhagavā api āsītikaḥ aham pi āsītikaḥ 
PA_mn_89:19.5	imināvārahāmevāhaṁ, bhante, bhagavati paramanipaccakāraṁ kātuṁ, mittūpahāraṁ upadaṁsetuṁ.	bhante bhagavati parama nipad cakāram kātu mittūpahāram upadasetu 
PA_mn_89:20.1	Handa ca dāni mayaṁ, bhante, gacchāma;	handa ca dāni maya bhante gacchāma 
PA_mn_89:20.2	bahukiccā mayaṁ bahukaraṇīyā”ti.	bahu kitcā mayam bahu karaṇīyā ati 
PA_mn_89:20.3	“Yassadāni tvaṁ, mahārāja, kālaṁ maññasī”ti.	yaḥ sadāni tva mahā rāja kālam maññasi iti 
PA_mn_89:20.4	Atha kho rājā pasenadi kosalo uṭṭhāyāsanā bhagavantaṁ abhivādetvā padakkhiṇaṁ katvā pakkāmi.	atha kho rājā pasenadi kosalaḥ uṭṭhāya āsanā bhagavantam abhivādetvā padakkhiṇam katvā pakkāmi 
PA_mn_89:21.1	Atha kho bhagavā acirapakkantassa rañño pasenadissa kosalassa bhikkhū āmantesi:	atha kho bhagavā acira pakkantassa raññaḥ pasenadissa kosalassa bhikkhū āmantesi 
PA_mn_89:21.2	“eso, bhikkhave, rājā pasenadi kosalo dhammacetiyāni bhāsitvā uṭṭhāyāsanā pakkanto.	esaḥ bhikkhave rājā pasenadi kosalaḥ dhamma cetiyāni bhāsitvā uṭṭhāya āsanā pakkantaḥ 
PA_mn_89:21.3	Uggaṇhatha, bhikkhave, dhammacetiyāni;	uggaṇhatha bhikkhave dhamma cetiyāni 
PA_mn_89:21.4	pariyāpuṇātha, bhikkhave, dhammacetiyāni;	pariyāpuṇātha bhikkhave dhamma cetiyāni 
PA_mn_89:21.5	dhāretha, bhikkhave, dhammacetiyāni.	dhāretha bhikkhave dhamma cetiyāni 
PA_mn_89:21.6	Atthasaṁhitāni, bhikkhave, dhammacetiyāni ādibrahmacariyakānī”ti.	attha sahitāni bhikkhave dhamma cetiyāni ādi brahmacariyakāni iti 
PA_mn_89:21.7	Idamavoca bhagavā.	idam avoca bhagavān 
PA_mn_89:21.8	Attamanā te bhikkhū bhagavato bhāsitaṁ abhinandunti.	attamanāḥ te bhikkhū bhagavataḥ bhāsitam abhinandunti 
PA_mn_89:21.9	Dhammacetiyasuttaṁ niṭṭhitaṁ navamaṁ.	dhammacetiya suttam niṭṭhitam navama 
