segmentnr	original	analyzed
PA_mn_18:0.1	Majjhima Nikāya 18	▁majjhim a ▁nikāya
PA_mn_18:0.2	Madhupiṇḍikasutta	▁madhu pi ṇḍ i k asutta
PA_mn_18:1.1	Evaṁ me sutaṁ—	▁evaṃ ▁me ▁sut aṃ
PA_mn_18:1.2	ekaṁ samayaṁ bhagavā sakkesu viharati kapilavatthusmiṁ nigrodhārāme.	▁ekaṃ ▁samay aṃ ▁bhagavā ▁ sakk esu ▁viharati ▁kapil avatthu smiṃ ▁ nigrodh ārām e
PA_mn_18:2.1	Atha kho bhagavā pubbaṇhasamayaṁ nivāsetvā pattacīvaramādāya kapilavatthuṁ piṇḍāya pāvisi.	▁atha ▁kho ▁bhagavā ▁pubba ṇ h asamay aṃ ▁nivās etvā ▁patt acīvar amā d āya ▁kapil avatthu ṃ ▁piṇḍāya ▁pāvisi
PA_mn_18:2.2	Kapilavatthusmiṁ piṇḍāya caritvā pacchābhattaṁ piṇḍapātapaṭikkanto yena mahāvanaṁ tenupasaṅkami divāvihārāya.	▁kapil avatthu smiṃ ▁piṇḍāya ▁caritvā ▁pacchā bhatt aṃ ▁piṇḍapāt apaṭi kk anto ▁yena ▁mahāva naṃ ▁tenupasaṃkami ▁divā vihār āya
PA_mn_18:2.3	Mahāvanaṁ ajjhogāhetvā beluvalaṭṭhikāya mūle divāvihāraṁ nisīdi.	▁mahāva naṃ ▁ajjh o gāh etvā ▁b e lu va la ṭṭh ikāya ▁mūl e ▁divā vihār aṃ ▁nisīdi
PA_mn_18:3.1	Daṇḍapāṇipi kho sakko jaṅghāvihāraṁ anucaṅkamamāno anuvicaramāno yena mahāvanaṁ tenupasaṅkami.	▁daṇḍ apā ṇi pi ▁kho ▁sakko ▁ja ṃg hā vihār aṃ ▁anu c aṃ ka m amāno ▁anu vi ca r amāno ▁yena ▁mahāva naṃ ▁tenupasaṃkami
PA_mn_18:3.2	Mahāvanaṁ ajjhogāhetvā yena beluvalaṭṭhikā yena bhagavā tenupasaṅkami; upasaṅkamitvā bhagavatā saddhiṁ sammodi.	▁mahāva naṃ ▁ajjh o gāh etvā ▁yena ▁b e lu va la ṭṭh ikā ▁yena ▁bhagavā ▁tenupasaṃkami ▁upasaṃkamitvā ▁bhagavatā ▁saddhiṃ ▁sam mod i
PA_mn_18:3.3	Sammodanīyaṁ kathaṁ sāraṇīyaṁ vītisāretvā daṇḍamolubbha ekamantaṁ aṭṭhāsi. Ekamantaṁ ṭhito kho daṇḍapāṇi sakko bhagavantaṁ etadavoca:	▁sam mod anīy aṃ ▁kathaṃ ▁sār aṇīy aṃ ▁v īti sār etvā ▁daṇḍ am o lu bbh a ▁ekamantaṃ ▁aṭṭhāsi ▁ekamantaṃ ▁ṭhito ▁kho ▁daṇḍ apā ṇi ▁sakko ▁bhagavantaṃ ▁etadavoca
PA_mn_18:3.4	“kiṁvādī samaṇo kimakkhāyī”ti?	▁kiṃ vād ī ▁samaṇ o ▁ki makkh ā y īti
PA_mn_18:4.1_0	“Yathāvādī kho, āvuso, sadevake loke samārake sabrahmake sassamaṇabrāhmaṇiyā pajāya	▁yathā vād ī ▁kho ▁āvuso ▁sadevak e ▁loke ▁samā r ake ▁sa brahm ake ▁sa s samaṇ a brāhmaṇ iyā ▁pajā ya
PA_mn_18:4.1_1	sadevamanussāya na kenaci loke viggayha tiṭṭhati, yathā ca pana kāmehi visaṁyuttaṁ	▁sa deva manuss āya ▁na ▁kenaci ▁loke ▁vi gg ayh a ▁tiṭṭhati ▁yathā ▁ca ▁pana ▁kām ehi ▁vis aṃ yutta ṃ
PA_mn_18:4.1_2	viharantaṁ taṁ brāhmaṇaṁ akathaṅkathiṁ chinnakukkuccaṁ bhavābhave vītataṇhaṁ saññā nānusenti—	▁vi har antaṃ ▁taṃ ▁brāhmaṇa ṃ ▁ akathaṃ kath iṃ ▁chinn a kukku cc aṃ ▁bhav ā bhav e ▁vīta taṇh aṃ ▁saññā ▁nānu sen ti
PA_mn_18:4.2	evaṁvādī kho ahaṁ, āvuso, evamakkhāyī”ti.	▁evaṃ vād ī ▁kho ▁ahaṃ ▁āvuso ▁eva makkh ā y īti
PA_mn_18:5.1	Evaṁ vutte, daṇḍapāṇi sakko sīsaṁ okampetvā, jivhaṁ nillāḷetvā, tivisākhaṁ nalāṭikaṁ nalāṭe vuṭṭhāpetvā daṇḍamolubbha pakkāmi.	▁evaṃ ▁vutte ▁daṇḍ apā ṇi ▁sakko ▁sīs aṃ ▁ o kamp etvā ▁jivh aṃ ▁ni ll ā ḷ etvā ▁ ti vi sākh aṃ ▁na lā ṭ ikaṃ ▁na lā ṭ e ▁vuṭṭhā petvā ▁daṇḍ am o lu bbh a ▁pakkāmi
PA_mn_18:6.1	Atha kho bhagavā sāyanhasamayaṁ paṭisallānā vuṭṭhito yena nigrodhārāmo tenupasaṅkami; upasaṅkamitvā paññatte āsane nisīdi.	▁atha ▁kho ▁bhagavā ▁sā yan h asamay aṃ ▁paṭi sall ā nā ▁vuṭṭhit o ▁yena ▁ nigrodh ārām o ▁tenupasaṃkami ▁upasaṃkamitvā ▁paññatt e ▁āsan e ▁nisīdi
PA_mn_18:6.2	Nisajja kho bhagavā bhikkhū āmantesi:	▁ni sajj a ▁kho ▁bhagavā ▁bhikkhū ▁āmantesi
PA_mn_18:6.3	“idhāhaṁ, bhikkhave, pubbaṇhasamayaṁ nivāsetvā pattacīvaramādāya kapilavatthuṁ piṇḍāya pāvisiṁ.	▁idh ā haṃ ▁bhikkhave ▁pubba ṇ h asamay aṃ ▁nivās etvā ▁patt acīvar amā d āya ▁kapil avatthu ṃ ▁piṇḍāya ▁pāvisi ṃ
PA_mn_18:6.4	Kapilavatthusmiṁ piṇḍāya caritvā pacchābhattaṁ piṇḍapātapaṭikkanto yena mahāvanaṁ tenupasaṅkamiṁ divāvihārāya.	▁kapil avatthu smiṃ ▁piṇḍāya ▁caritvā ▁pacchā bhatt aṃ ▁piṇḍapāt apaṭi kk anto ▁yena ▁mahāva naṃ ▁tenupasaṃkami ṃ ▁divā vihār āya
PA_mn_18:6.5	Mahāvanaṁ ajjhogāhetvā beluvalaṭṭhikāya mūle divāvihāraṁ nisīdiṁ.	▁mahāva naṃ ▁ajjh o gāh etvā ▁b e lu va la ṭṭh ikāya ▁mūl e ▁divā vihār aṃ ▁nisīdi ṃ
PA_mn_18:6.6	Daṇḍapāṇipi kho, bhikkhave, sakko jaṅghāvihāraṁ anucaṅkamamāno anuvicaramāno yena mahāvanaṁ tenupasaṅkami.	▁daṇḍ apā ṇi pi ▁kho ▁bhikkhave ▁sakko ▁ja ṃg hā vihār aṃ ▁anu c aṃ ka m amāno ▁anu vi ca r amāno ▁yena ▁mahāva naṃ ▁tenupasaṃkami
PA_mn_18:6.7	Mahāvanaṁ ajjhogāhetvā yena beluvalaṭṭhikā yenāhaṁ tenupasaṅkami; upasaṅkamitvā mayā saddhiṁ sammodi.	▁mahāva naṃ ▁ajjh o gāh etvā ▁yena ▁b e lu va la ṭṭh ikā ▁ye nā haṃ ▁tenupasaṃkami ▁upasaṃkamitvā ▁mayā ▁saddhiṃ ▁sam mod i
PA_mn_18:6.8	Sammodanīyaṁ kathaṁ sāraṇīyaṁ vītisāretvā daṇḍamolubbha ekamantaṁ aṭṭhāsi. Ekamantaṁ ṭhito kho, bhikkhave, daṇḍapāṇi sakko maṁ etadavoca:	▁sam mod anīy aṃ ▁kathaṃ ▁sār aṇīy aṃ ▁v īti sār etvā ▁daṇḍ am o lu bbh a ▁ekamantaṃ ▁aṭṭhāsi ▁ekamantaṃ ▁ṭhito ▁kho ▁bhikkhave ▁daṇḍ apā ṇi ▁sakko ▁maṃ ▁etadavoca
PA_mn_18:6.9	‘kiṁvādī samaṇo kimakkhāyī’ti?	▁kiṃ vād ī ▁samaṇ o ▁ki makkh ā y īti
PA_mn_18:6.10	Evaṁ vutte, ahaṁ, bhikkhave, daṇḍapāṇiṁ sakkaṁ etadavocaṁ:	▁evaṃ ▁vutte ▁ahaṃ ▁bhikkhave ▁daṇḍ a pāṇ iṃ ▁sakka ṃ ▁etadavoca ṃ
PA_mn_18:6.11_0	‘yathāvādī kho, āvuso, sadevake loke samārake sabrahmake sassamaṇabrāhmaṇiyā pajāya	▁yathā vād ī ▁kho ▁āvuso ▁sadevak e ▁loke ▁samā r ake ▁sa brahm ake ▁sa s samaṇ a brāhmaṇ iyā ▁pajā ya
PA_mn_18:6.11_1	sadevamanussāya na kenaci loke viggayha tiṭṭhati, yathā ca pana kāmehi visaṁyuttaṁ	▁sa deva manuss āya ▁na ▁kenaci ▁loke ▁vi gg ayh a ▁tiṭṭhati ▁yathā ▁ca ▁pana ▁kām ehi ▁vis aṃ yutta ṃ
PA_mn_18:6.11_2	viharantaṁ taṁ brāhmaṇaṁ akathaṅkathiṁ chinnakukkuccaṁ bhavābhave vītataṇhaṁ saññā nānusenti—	▁vi har antaṃ ▁taṃ ▁brāhmaṇa ṃ ▁ akathaṃ kath iṃ ▁chinn a kukku cc aṃ ▁bhav ā bhav e ▁vīta taṇh aṃ ▁saññā ▁nānu sen ti
PA_mn_18:6.12	evaṁvādī kho ahaṁ, āvuso, evamakkhāyī’ti.	▁evaṃ vād ī ▁kho ▁ahaṃ ▁āvuso ▁eva makkh ā y īti
PA_mn_18:6.13	Evaṁ vutte, bhikkhave, daṇḍapāṇi sakko sīsaṁ okampetvā, jivhaṁ nillāḷetvā, tivisākhaṁ nalāṭikaṁ nalāṭe vuṭṭhāpetvā daṇḍamolubbha pakkāmī”ti.	▁evaṃ ▁vutte ▁bhikkhave ▁daṇḍ apā ṇi ▁sakko ▁sīs aṃ ▁ o kamp etvā ▁jivh aṃ ▁ni ll ā ḷ etvā ▁ ti vi sākh aṃ ▁na lā ṭ ikaṃ ▁na lā ṭ e ▁vuṭṭhā petvā ▁daṇḍ am o lu bbh a ▁ pakk āmīti
PA_mn_18:6.14	Evaṁ vutte, aññataro bhikkhu bhagavantaṁ etadavoca:	▁evaṃ ▁vutte ▁aññatar o ▁bhikkhu ▁bhagavantaṃ ▁etadavoca
PA_mn_18:7.1	“kiṁvādī pana, bhante, bhagavā sadevake loke samārake sabrahmake sassamaṇabrāhmaṇiyā pajāya sadevamanussāya na kenaci loke viggayha tiṭṭhati?	▁kiṃ vād ī ▁pana ▁bhante ▁bhagavā ▁sadevak e ▁loke ▁samā r ake ▁sa brahm ake ▁sa s samaṇ a brāhmaṇ iyā ▁pajā ya ▁sa deva manuss āya ▁na ▁kenaci ▁loke ▁vi gg ayh a ▁tiṭṭhati
PA_mn_18:7.2	Kathañca pana, bhante, bhagavantaṁ kāmehi visaṁyuttaṁ viharantaṁ taṁ brāhmaṇaṁ akathaṅkathiṁ chinnakukkuccaṁ bhavābhave vītataṇhaṁ saññā nānusentī”ti?	▁kathañca ▁pana ▁bhante ▁bhagavantaṃ ▁kām ehi ▁vis aṃ yutta ṃ ▁vi har antaṃ ▁taṃ ▁brāhmaṇa ṃ ▁ akathaṃ kath iṃ ▁chinn a kukku cc aṃ ▁bhav ā bhav e ▁vīta taṇh aṃ ▁saññā ▁nānu s entīti
PA_mn_18:8.1	“Yatonidānaṁ, bhikkhu, purisaṁ papañcasaññāsaṅkhā samudācaranti.	▁yato nidān aṃ ▁bhikkhu ▁puris aṃ ▁pa pañc asaññā saṃ kh ā ▁samu dā ca r anti
PA_mn_18:8.2	Ettha ce natthi abhinanditabbaṁ abhivaditabbaṁ ajjhositabbaṁ.	▁ettha ▁ce ▁natthi ▁abhinand itabbaṃ ▁abhi va d itabbaṃ ▁ajjh o s itabbaṃ
PA_mn_18:8.3_0	Esevanto rāgānusayānaṁ, esevanto paṭighānusayānaṁ, esevanto diṭṭhānusayānaṁ, esevanto	▁eseva nt o ▁rāg ānusay ānaṃ ▁eseva nt o ▁paṭighānusay ānaṃ ▁eseva nt o ▁diṭṭhānusay ānaṃ ▁eseva nt o
PA_mn_18:8.3_1	vicikicchānusayānaṁ, esevanto mānānusayānaṁ, esevanto bhavarāgānusayānaṁ, esevanto	▁vicikicchānusay ānaṃ ▁eseva nt o ▁mānānusay ānaṃ ▁eseva nt o ▁bhavarāgānusay ānaṃ ▁eseva nt o
PA_mn_18:8.3_2	avijjānusayānaṁ, esevanto daṇḍādānasatthādānakalahaviggahavivādatuvaṁtuvaṁpesuññamusāvādānaṁ.	▁avijjānusay ānaṃ ▁eseva nt o ▁daṇḍ ā dān a satth ā dān aka la ha viggah avi vād atu v aṃ tu v aṃ pe suññ amu sā vād ānaṃ
PA_mn_18:8.4	Etthete pāpakā akusalā dhammā aparisesā nirujjhantī”ti.	▁ e tth e te ▁pāpak ā ▁akusalā ▁dhammā ▁apari ses ā ▁ni ru jjh antīti
PA_mn_18:9.1	Idamavoca bhagavā.	▁idam a vo ca ▁bhagavā
PA_mn_18:9.2	Idaṁ vatvāna sugato uṭṭhāyāsanā vihāraṁ pāvisi.	▁idaṃ ▁vatvā na ▁sugat o ▁uṭṭhāyāsanā ▁vihār aṃ ▁pāvisi
PA_mn_18:10.1	Atha kho tesaṁ bhikkhūnaṁ acirapakkantassa bhagavato etadahosi:	▁atha ▁kho ▁tesaṃ ▁bhikkhūnaṃ ▁acir a pakk antassa ▁bhagavato ▁etadahosi
PA_mn_18:10.2	“idaṁ kho no, āvuso, bhagavā saṅkhittena uddesaṁ uddisitvā, vitthārena atthaṁ avibhajitvā, uṭṭhāyāsanā vihāraṁ paviṭṭho:	▁idaṃ ▁kho ▁no ▁āvuso ▁bhagavā ▁saṃkhitt ena ▁uddes aṃ ▁uddis itvā ▁vitthār ena ▁atthaṃ ▁avi bha j itvā ▁uṭṭhāyāsanā ▁vihār aṃ ▁paviṭṭh o
PA_mn_18:10.3	‘yatonidānaṁ, bhikkhu, purisaṁ papañcasaññāsaṅkhā samudācaranti.	▁yato nidān aṃ ▁bhikkhu ▁puris aṃ ▁pa pañc asaññā saṃ kh ā ▁samu dā ca r anti
PA_mn_18:10.4	Ettha ce natthi abhinanditabbaṁ abhivaditabbaṁ ajjhositabbaṁ.	▁ettha ▁ce ▁natthi ▁abhinand itabbaṃ ▁abhi va d itabbaṃ ▁ajjh o s itabbaṃ
PA_mn_18:10.5	Esevanto rāgānusayānaṁ …pe…	▁eseva nt o ▁rāg ānusay ānaṃ ▁pe
PA_mn_18:10.6	etthete pāpakā akusalā dhammā aparisesā nirujjhantī’ti.	▁ e tth e te ▁pāpak ā ▁akusalā ▁dhammā ▁apari ses ā ▁ni ru jjh antīti
PA_mn_18:10.7	Ko nu kho imassa bhagavatā saṅkhittena uddesassa uddiṭṭhassa vitthārena atthaṁ avibhattassa vitthārena atthaṁ vibhajeyyā”ti?	▁ko ▁nu ▁kho ▁imassa ▁bhagavatā ▁saṃkhitt ena ▁uddes assa ▁ud diṭṭh assa ▁vitthār ena ▁atthaṃ ▁a vibhatt assa ▁vitthār ena ▁atthaṃ ▁vibhaj eyyāti
PA_mn_18:10.8	Atha kho tesaṁ bhikkhūnaṁ etadahosi:	▁atha ▁kho ▁tesaṃ ▁bhikkhūnaṃ ▁etadahosi
PA_mn_18:10.9	“ayaṁ kho āyasmā mahākaccāno satthu ceva saṁvaṇṇito sambhāvito ca viññūnaṁ sabrahmacārīnaṁ.	▁ayaṃ ▁kho ▁āyasmā ▁mahā ka cc ā no ▁satthu ▁ceva ▁saṃ vaṇṇ ito ▁sam bhāv ito ▁ca ▁viññū naṃ ▁sabrahmacārī naṃ
PA_mn_18:10.10	Pahoti cāyasmā mahākaccāno imassa bhagavatā saṅkhittena uddesassa uddiṭṭhassa vitthārena atthaṁ avibhattassa vitthārena atthaṁ vibhajituṁ.	▁pah oti ▁cā y asmā ▁mahā ka cc ā no ▁imassa ▁bhagavatā ▁saṃkhitt ena ▁uddes assa ▁ud diṭṭh assa ▁vitthār ena ▁atthaṃ ▁a vibhatt assa ▁vitthār ena ▁atthaṃ ▁vibhaj ituṃ
PA_mn_18:10.11	Yannūna mayaṁ yenāyasmā mahākaccāno tenupasaṅkameyyāma; upasaṅkamitvā āyasmantaṁ mahākaccānaṁ etamatthaṁ paṭipuccheyyāmā”ti.	▁ yan n ūn a ▁mayaṃ ▁ye nā y asmā ▁mahā ka cc ā no ▁te n upasaṃkam eyyā ma ▁upasaṃkamitvā ▁āyasmant aṃ ▁mahā ka cc ānaṃ ▁etamatthaṃ ▁paṭi pucch eyyā m āti
PA_mn_18:11.1	Atha kho te bhikkhū yenāyasmā mahākaccāno tenupasaṅkamiṁsu; upasaṅkamitvā āyasmatā mahākaccānena saddhiṁ sammodiṁsu.	▁atha ▁kho ▁te ▁bhikkhū ▁ye nā y asmā ▁mahā ka cc ā no ▁tenupasaṃkami ṃ su ▁upasaṃkamitvā ▁ āya s mat ā ▁mahā ka cc ān ena ▁saddhiṃ ▁sam mod iṃsu
PA_mn_18:11.2	Sammodanīyaṁ kathaṁ sāraṇīyaṁ vītisāretvā ekamantaṁ nisīdiṁsu. Ekamantaṁ nisinnā kho te bhikkhū āyasmantaṁ mahākaccānaṁ etadavocuṁ:	▁sam mod anīy aṃ ▁kathaṃ ▁sār aṇīy aṃ ▁v īti sār etvā ▁ekamantaṃ ▁nisīd iṃsu ▁ekamantaṃ ▁nisinn ā ▁kho ▁te ▁bhikkhū ▁āyasmant aṃ ▁mahā ka cc ānaṃ ▁et a da vo cu ṃ
PA_mn_18:11.3	“idaṁ kho no, āvuso kaccāna, bhagavā saṅkhittena uddesaṁ uddisitvā vitthārena atthaṁ avibhajitvā uṭṭhāyāsanā vihāraṁ paviṭṭho:	▁idaṃ ▁kho ▁no ▁āvuso ▁ka cc āna ▁bhagavā ▁saṃkhitt ena ▁uddes aṃ ▁uddis itvā ▁vitthār ena ▁atthaṃ ▁avi bha j itvā ▁uṭṭhāyāsanā ▁vihār aṃ ▁paviṭṭh o
PA_mn_18:11.4	‘yatonidānaṁ, bhikkhu, purisaṁ papañcasaññāsaṅkhā samudācaranti.	▁yato nidān aṃ ▁bhikkhu ▁puris aṃ ▁pa pañc asaññā saṃ kh ā ▁samu dā ca r anti
PA_mn_18:11.5	Ettha ce natthi abhinanditabbaṁ abhivaditabbaṁ ajjhositabbaṁ.	▁ettha ▁ce ▁natthi ▁abhinand itabbaṃ ▁abhi va d itabbaṃ ▁ajjh o s itabbaṃ
PA_mn_18:11.6	Esevanto rāgānusayānaṁ …pe…	▁eseva nt o ▁rāg ānusay ānaṃ ▁pe
PA_mn_18:11.7	etthete pāpakā akusalā dhammā aparisesā nirujjhantī’ti.	▁ e tth e te ▁pāpak ā ▁akusalā ▁dhammā ▁apari ses ā ▁ni ru jjh antīti
PA_mn_18:11.8	Tesaṁ no, āvuso kaccāna, amhākaṁ acirapakkantassa bhagavato etadahosi:	▁tesaṃ ▁no ▁āvuso ▁ka cc āna ▁amhākaṃ ▁acir a pakk antassa ▁bhagavato ▁etadahosi
PA_mn_18:11.9	‘idaṁ kho no, āvuso, bhagavā saṅkhittena uddesaṁ uddisitvā vitthārena atthaṁ avibhajitvā uṭṭhāyāsanā vihāraṁ paviṭṭho:	▁idaṃ ▁kho ▁no ▁āvuso ▁bhagavā ▁saṃkhitt ena ▁uddes aṃ ▁uddis itvā ▁vitthār ena ▁atthaṃ ▁avi bha j itvā ▁uṭṭhāyāsanā ▁vihār aṃ ▁paviṭṭh o
PA_mn_18:11.10	“yatonidānaṁ, bhikkhu, purisaṁ papañcasaññāsaṅkhā samudācaranti.	▁yato nidān aṃ ▁bhikkhu ▁puris aṃ ▁pa pañc asaññā saṃ kh ā ▁samu dā ca r anti
PA_mn_18:11.11	Ettha ce natthi abhinanditabbaṁ abhivaditabbaṁ ajjhositabbaṁ.	▁ettha ▁ce ▁natthi ▁abhinand itabbaṃ ▁abhi va d itabbaṃ ▁ajjh o s itabbaṃ
PA_mn_18:11.12	Esevanto rāgānusayānaṁ …pe…	▁eseva nt o ▁rāg ānusay ānaṃ ▁pe
PA_mn_18:11.13	etthete pāpakā akusalā dhammā aparisesā nirujjhantī”’ti.	▁ e tth e te ▁pāpak ā ▁akusalā ▁dhammā ▁apari ses ā ▁ni ru jjh antīti
PA_mn_18:11.14	Ko nu kho imassa bhagavatā saṅkhittena uddesassa uddiṭṭhassa vitthārena atthaṁ avibhattassa vitthārena atthaṁ vibhajeyyāti?	▁ko ▁nu ▁kho ▁imassa ▁bhagavatā ▁saṃkhitt ena ▁uddes assa ▁ud diṭṭh assa ▁vitthār ena ▁atthaṃ ▁a vibhatt assa ▁vitthār ena ▁atthaṃ ▁vibhaj eyyāti
PA_mn_18:11.15	Tesaṁ no, āvuso kaccāna, amhākaṁ etadahosi:	▁tesaṃ ▁no ▁āvuso ▁ka cc āna ▁amhākaṃ ▁etadahosi
PA_mn_18:11.16_0	‘ayaṁ kho āyasmā mahākaccāno satthu ceva saṁvaṇṇito sambhāvito ca viññūnaṁ sabrahmacārīnaṁ,	▁ayaṃ ▁kho ▁āyasmā ▁mahā ka cc ā no ▁satthu ▁ceva ▁saṃ vaṇṇ ito ▁sam bhāv ito ▁ca ▁viññū naṃ ▁sabrahmacārī naṃ
PA_mn_18:11.16_1	pahoti cāyasmā mahākaccāno imassa bhagavatā saṅkhittena uddesassa uddiṭṭhassa vitthārena	▁pah oti ▁cā y asmā ▁mahā ka cc ā no ▁imassa ▁bhagavatā ▁saṃkhitt ena ▁uddes assa ▁ud diṭṭh assa ▁vitthār ena
PA_mn_18:11.16_2	atthaṁ avibhattassa vitthārena atthaṁ vibhajituṁ.	▁atthaṃ ▁a vibhatt assa ▁vitthār ena ▁atthaṃ ▁vibhaj ituṃ
PA_mn_18:11.17	Yannūna mayaṁ yenāyasmā mahākaccāno tenupasaṅkameyyāma; upasaṅkamitvā āyasmantaṁ mahākaccānaṁ etamatthaṁ paṭipuccheyyāmā’ti.	▁ yan n ūn a ▁mayaṃ ▁ye nā y asmā ▁mahā ka cc ā no ▁te n upasaṃkam eyyā ma ▁upasaṃkamitvā ▁āyasmant aṃ ▁mahā ka cc ānaṃ ▁etamatthaṃ ▁paṭi pucch eyyā m āti
PA_mn_18:11.18	Vibhajatāyasmā mahākaccāno”ti.	▁vibhaj atāya s mā ▁mahā ka cc ān oti
PA_mn_18:12.1_0	“Seyyathāpi, āvuso, puriso sāratthiko sāragavesī sārapariyesanaṁ caramāno mahato	▁seyyathāpi ▁āvuso ▁puriso ▁sār atth iko ▁sār a gav e sī ▁sār apari ye san aṃ ▁ca r amāno ▁mah ato
PA_mn_18:12.1_1	rukkhassa tiṭṭhato sāravato atikkammeva mūlaṁ, atikkamma khandhaṁ, sākhāpalāse sāraṁ	▁rukkh assa ▁tiṭṭh ato ▁sār avat o ▁atikkam meva ▁mūl aṃ ▁atikkam ma ▁khandh aṃ ▁ sākh āpa lā se ▁sār aṃ
PA_mn_18:12.1_2	pariyesitabbaṁ maññeyya;	▁pariyes itabbaṃ ▁maññ eyya
PA_mn_18:12.2	evaṁsampadamidaṁ āyasmantānaṁ satthari sammukhībhūte, taṁ bhagavantaṁ atisitvā, amhe etamatthaṁ paṭipucchitabbaṁ maññatha.	▁evaṃ sam pad amid aṃ ▁āyasmant ānaṃ ▁satthari ▁sam mukh ī bhūt e ▁taṃ ▁bhagavantaṃ ▁ati s itvā ▁amh e ▁etamatthaṃ ▁paṭi pucch itabbaṃ ▁maññ atha
PA_mn_18:12.3	So hāvuso, bhagavā jānaṁ jānāti, passaṁ passati, cakkhubhūto ñāṇabhūto dhammabhūto brahmabhūto, vattā pavattā, atthassa ninnetā, amatassa dātā, dhammassāmī tathāgato.	▁so ▁h āvuso ▁bhagavā ▁jān aṃ ▁jānāti ▁pass aṃ ▁passati ▁cakkhu bhūt o ▁ñāṇ a bhūt o ▁dhamma bhūt o ▁brahma bhūt o ▁vatt ā ▁pavatt ā ▁atth assa ▁ ninn e tā ▁amat assa ▁d ā tā ▁dhamma ssā m ī ▁tathāgato
PA_mn_18:12.4	So ceva panetassa kālo ahosi, yaṁ bhagavantaṁyeva etamatthaṁ paṭipuccheyyātha.	▁so ▁ceva ▁pa net assa ▁kāl o ▁ahosi ▁yaṃ ▁bhagavantaṃ yeva ▁etamatthaṃ ▁paṭi pucch eyyātha
PA_mn_18:12.5	Yathā vo bhagavā byākareyya tathā naṁ dhāreyyāthā”ti.	▁yathā ▁vo ▁bhagavā ▁byākar eyya ▁tathā ▁naṃ ▁dhār eyyā thāti
PA_mn_18:13.1	“Addhāvuso kaccāna, bhagavā jānaṁ jānāti, passaṁ passati, cakkhubhūto ñāṇabhūto dhammabhūto brahmabhūto, vattā pavattā, atthassa ninnetā, amatassa dātā, dhammassāmī tathāgato.	▁a ddh āvuso ▁ka cc āna ▁bhagavā ▁jān aṃ ▁jānāti ▁pass aṃ ▁passati ▁cakkhu bhūt o ▁ñāṇ a bhūt o ▁dhamma bhūt o ▁brahma bhūt o ▁vatt ā ▁pavatt ā ▁atth assa ▁ ninn e tā ▁amat assa ▁d ā tā ▁dhamma ssā m ī ▁tathāgato
PA_mn_18:13.2	So ceva panetassa kālo ahosi, yaṁ bhagavantaṁyeva etamatthaṁ paṭipuccheyyāma.	▁so ▁ceva ▁pa net assa ▁kāl o ▁ahosi ▁yaṃ ▁bhagavantaṃ yeva ▁etamatthaṃ ▁paṭi pucch eyyā ma
PA_mn_18:13.3	Yathā no bhagavā byākareyya tathā naṁ dhāreyyāma.	▁yathā ▁no ▁bhagavā ▁byākar eyya ▁tathā ▁naṃ ▁dhār eyyā ma
PA_mn_18:13.4	Api cāyasmā mahākaccāno satthu ceva saṁvaṇṇito sambhāvito ca viññūnaṁ sabrahmacārīnaṁ,	▁api ▁cā y asmā ▁mahā ka cc ā no ▁satthu ▁ceva ▁saṃ vaṇṇ ito ▁sam bhāv ito ▁ca ▁viññū naṃ ▁sabrahmacārī naṃ
PA_mn_18:13.5	pahoti cāyasmā mahākaccāno imassa bhagavatā saṅkhittena uddesassa uddiṭṭhassa vitthārena atthaṁ avibhattassa vitthārena atthaṁ vibhajituṁ.	▁pah oti ▁cā y asmā ▁mahā ka cc ā no ▁imassa ▁bhagavatā ▁saṃkhitt ena ▁uddes assa ▁ud diṭṭh assa ▁vitthār ena ▁atthaṃ ▁a vibhatt assa ▁vitthār ena ▁atthaṃ ▁vibhaj ituṃ
PA_mn_18:13.6	Vibhajatāyasmā mahākaccāno agaruṁ katvā”ti.	▁vibhaj atāya s mā ▁mahā ka cc ā no ▁a garu ṃ ▁katvā ti
PA_mn_18:14.1	“Tena hāvuso, suṇātha, sādhukaṁ manasikarotha, bhāsissāmī”ti.	▁tena ▁h āvuso ▁suṇ ā tha ▁sādhu kaṃ ▁manasi karo tha ▁ bhās issāmīti
PA_mn_18:14.2	“Evamāvuso”ti kho te bhikkhū āyasmato mahākaccānassa paccassosuṁ.	▁evam āvuso ti ▁kho ▁te ▁bhikkhū ▁āyasmato ▁mahā ka cc ān assa ▁pacc ass o su ṃ
PA_mn_18:14.3	Āyasmā mahākaccāno etadavoca:	▁āyasmā ▁mahā ka cc ā no ▁etadavoca
PA_mn_18:15.1	“Yaṁ kho no, āvuso, bhagavā saṅkhittena uddesaṁ uddisitvā vitthārena atthaṁ avibhajitvā uṭṭhāyāsanā vihāraṁ paviṭṭho:	▁yaṃ ▁kho ▁no ▁āvuso ▁bhagavā ▁saṃkhitt ena ▁uddes aṃ ▁uddis itvā ▁vitthār ena ▁atthaṃ ▁avi bha j itvā ▁uṭṭhāyāsanā ▁vihār aṃ ▁paviṭṭh o
PA_mn_18:15.2	‘yatonidānaṁ, bhikkhu, purisaṁ papañcasaññāsaṅkhā samudācaranti.	▁yato nidān aṃ ▁bhikkhu ▁puris aṃ ▁pa pañc asaññā saṃ kh ā ▁samu dā ca r anti
PA_mn_18:15.3	Ettha ce natthi abhinanditabbaṁ abhivaditabbaṁ ajjhositabbaṁ, esevanto rāgānusayānaṁ …pe…	▁ettha ▁ce ▁natthi ▁abhinand itabbaṃ ▁abhi va d itabbaṃ ▁ajjh o s itabbaṃ ▁eseva nt o ▁rāg ānusay ānaṃ ▁pe
PA_mn_18:15.4_0	etthete pāpakā akusalā dhammā aparisesā nirujjhantī’ti, imassa kho ahaṁ, āvuso, bhagavatā	▁ e tth e te ▁pāpak ā ▁akusalā ▁dhammā ▁apari ses ā ▁ni ru jjh antīti ▁imassa ▁kho ▁ahaṃ ▁āvuso ▁bhagavatā
PA_mn_18:15.4_1	saṅkhittena uddesassa uddiṭṭhassa vitthārena atthaṁ avibhattassa evaṁ vitthārena atthaṁ ājānāmi—	▁saṃkhitt ena ▁uddes assa ▁ud diṭṭh assa ▁vitthār ena ▁atthaṃ ▁a vibhatt assa ▁evaṃ ▁vitthār ena ▁atthaṃ ▁ ā jān āmi
PA_mn_18:16.1_0	Cakkhuñcāvuso, paṭicca rūpe ca uppajjati cakkhuviññāṇaṁ, tiṇṇaṁ saṅgati phasso, phassapaccayā	▁cakkhu ñc āvuso ▁paṭicca ▁rūp e ▁ca ▁uppajjati ▁cakkhuviññāṇ aṃ ▁tiṇṇaṃ ▁saṃ gati ▁phass o ▁phass apaccayā
PA_mn_18:16.1_1	vedanā, yaṁ vedeti taṁ sañjānāti, yaṁ sañjānāti taṁ vitakketi, yaṁ vitakketi taṁ	▁vedanā ▁yaṃ ▁ved eti ▁taṃ ▁sañjān āti ▁yaṃ ▁sañjān āti ▁taṃ ▁vitakk eti ▁yaṃ ▁vitakk eti ▁taṃ
PA_mn_18:16.1_2	papañceti, yaṁ papañceti tatonidānaṁ purisaṁ papañcasaññāsaṅkhā samudācaranti atītānāgatapaccuppannesu	▁pa pañc eti ▁yaṃ ▁pa pañc eti ▁tato nidān aṃ ▁puris aṃ ▁pa pañc asaññā saṃ kh ā ▁samu dā ca r anti ▁atīt ā nā gat a pacc u ppann esu
PA_mn_18:16.1_3	cakkhuviññeyyesu rūpesu.	▁cakkhu viññeyy esu ▁rūp esu
PA_mn_18:16.2	Sotañcāvuso, paṭicca sadde ca uppajjati sotaviññāṇaṁ …pe…	▁sota ñc āvuso ▁paṭicca ▁sadd e ▁ca ▁uppajjati ▁sota viññāṇ aṃ ▁pe
PA_mn_18:16.3	ghānañcāvuso, paṭicca gandhe ca uppajjati ghānaviññāṇaṁ …pe…	▁ghān a ñc āvuso ▁paṭicca ▁gandh e ▁ca ▁uppajjati ▁ghān a viññāṇ aṃ ▁pe
PA_mn_18:16.4	jivhañcāvuso, paṭicca rase ca uppajjati jivhāviññāṇaṁ …pe…	▁jivh a ñc āvuso ▁paṭicca ▁ras e ▁ca ▁uppajjati ▁jivhā viññāṇ aṃ ▁pe
PA_mn_18:16.5	kāyañcāvuso, paṭicca phoṭṭhabbe ca uppajjati kāyaviññāṇaṁ …pe…	▁kāya ñc āvuso ▁paṭicca ▁phoṭṭhabb e ▁ca ▁uppajjati ▁kāyaviññāṇ aṃ ▁pe
PA_mn_18:16.6_0	manañcāvuso, paṭicca dhamme ca uppajjati manoviññāṇaṁ, tiṇṇaṁ saṅgati phasso, phassapaccayā	▁man a ñc āvuso ▁paṭicca ▁dhamme ▁ca ▁uppajjati ▁mano viññāṇ aṃ ▁tiṇṇaṃ ▁saṃ gati ▁phass o ▁phass apaccayā
PA_mn_18:16.6_1	vedanā, yaṁ vedeti taṁ sañjānāti, yaṁ sañjānāti taṁ vitakketi, yaṁ vitakketi taṁ	▁vedanā ▁yaṃ ▁ved eti ▁taṃ ▁sañjān āti ▁yaṃ ▁sañjān āti ▁taṃ ▁vitakk eti ▁yaṃ ▁vitakk eti ▁taṃ
PA_mn_18:16.6_2	papañceti, yaṁ papañceti tatonidānaṁ purisaṁ papañcasaññāsaṅkhā samudācaranti atītānāgatapaccuppannesu	▁pa pañc eti ▁yaṃ ▁pa pañc eti ▁tato nidān aṃ ▁puris aṃ ▁pa pañc asaññā saṃ kh ā ▁samu dā ca r anti ▁atīt ā nā gat a pacc u ppann esu
PA_mn_18:16.6_3	manoviññeyyesu dhammesu.	▁mano viññeyy esu ▁dhammesu
PA_mn_18:17.1	So vatāvuso, cakkhusmiṁ sati rūpe sati cakkhuviññāṇe sati phassapaññattiṁ paññāpessatīti—ṭhānametaṁ vijjati.	▁so ▁vat āvuso ▁cakkhu smiṃ ▁sati ▁rūp e ▁sati ▁cakkhuviññāṇ e ▁sati ▁phass a paññatti ṃ ▁paññāp e ssatīti ṭhān ametaṃ ▁vijjati
PA_mn_18:17.2	Phassapaññattiyā sati vedanāpaññattiṁ paññāpessatīti—ṭhānametaṁ vijjati.	▁phass a paññatti yā ▁sati ▁vedanā paññatti ṃ ▁paññāp e ssatīti ṭhān ametaṃ ▁vijjati
