segmentnr	original	analyzed
PA_mn_48:0.1	Majjhima Nikāya 48	▁majjhim a ▁nikāya
PA_mn_48:0.2	Kosambiyasutta	▁ko sa mb iy asutta
PA_mn_48:1.1	Evaṁ me sutaṁ—	▁evaṃ ▁me ▁sut aṃ
PA_mn_48:1.2	ekaṁ samayaṁ bhagavā kosambiyaṁ viharati ghositārāme.	▁ekaṃ ▁samay aṃ ▁bhagavā ▁ko sa mb iyaṃ ▁viharati ▁ ghos it ārām e
PA_mn_48:2.1	Tena kho pana samayena kosambiyaṁ bhikkhū bhaṇḍanajātā kalahajātā vivādāpannā aññamaññaṁ mukhasattīhi vitudantā viharanti.	▁tena ▁kho ▁pana ▁samayena ▁ko sa mb iyaṃ ▁bhikkhū ▁bhaṇḍ ana jāt ā ▁kalah a jāt ā ▁vivād āpan nā ▁aññamaññ aṃ ▁mukh a satt īhi ▁vi tu dant ā ▁viharanti
PA_mn_48:2.2	Te na ceva aññamaññaṁ saññāpenti na ca saññattiṁ upenti, na ca aññamaññaṁ nijjhāpenti, na ca nijjhattiṁ upenti.	▁te ▁na ▁ceva ▁aññamaññ aṃ ▁saññā pe nti ▁na ▁ca ▁saññ att iṃ ▁up enti ▁na ▁ca ▁aññamaññ aṃ ▁ni jjh āpent i ▁na ▁ca ▁ni jjh att iṃ ▁up enti
PA_mn_48:3.1	Atha kho aññataro bhikkhu yena bhagavā tenupasaṅkami; upasaṅkamitvā bhagavantaṁ abhivādetvā ekamantaṁ nisīdi. Ekamantaṁ nisinno kho so bhikkhu bhagavantaṁ etadavoca:	▁atha ▁kho ▁aññatar o ▁bhikkhu ▁yena ▁bhagavā ▁tenupasaṃkami ▁upasaṃkamitvā ▁bhagavantaṃ ▁abhivādetvā ▁ekamantaṃ ▁nisīdi ▁ekamantaṃ ▁nisinno ▁kho ▁so ▁bhikkhu ▁bhagavantaṃ ▁etadavoca
PA_mn_48:3.2_0	“idha, bhante, kosambiyaṁ bhikkhū bhaṇḍanajātā kalahajātā vivādāpannā aññamaññaṁ	▁idha ▁bhante ▁ko sa mb iyaṃ ▁bhikkhū ▁bhaṇḍ ana jāt ā ▁kalah a jāt ā ▁vivād āpan nā ▁aññamaññ aṃ
PA_mn_48:3.2_1	mukhasattīhi vitudantā viharanti, te na ceva aññamaññaṁ saññāpenti, na ca saññattiṁ	▁mukh a satt īhi ▁vi tu dant ā ▁viharanti ▁te ▁na ▁ceva ▁aññamaññ aṃ ▁saññā pe nti ▁na ▁ca ▁saññ att iṃ
PA_mn_48:3.2_2	upenti, na ca aññamaññaṁ nijjhāpenti, na ca nijjhattiṁ upentī”ti.	▁up enti ▁na ▁ca ▁aññamaññ aṃ ▁ni jjh āpent i ▁na ▁ca ▁ni jjh att iṃ ▁up entīti
PA_mn_48:4.1	Atha kho bhagavā aññataraṁ bhikkhuṁ āmantesi:	▁atha ▁kho ▁bhagavā ▁aññatar aṃ ▁bhikkhuṃ ▁āmantesi
PA_mn_48:4.2	“ehi tvaṁ, bhikkhu, mama vacanena te bhikkhū āmantehi:	▁ ehi ▁tvaṃ ▁bhikkhu ▁mama ▁vacan ena ▁te ▁bhikkhū ▁ ā mant ehi
PA_mn_48:4.3	‘satthā vo āyasmante āmantetī’”ti.	▁satthā ▁vo ▁āyasmant e ▁ ā mant etīti
PA_mn_48:4.4	“Evaṁ, bhante”ti kho so bhikkhu bhagavato paṭissutvā yena te bhikkhū tenupasaṅkami; upasaṅkamitvā te bhikkhū etadavoca:	▁evaṃ ▁bhanteti ▁kho ▁so ▁bhikkhu ▁bhagavato ▁paṭi ssu tvā ▁yena ▁te ▁bhikkhū ▁tenupasaṃkami ▁upasaṃkamitvā ▁te ▁bhikkhū ▁etadavoca
PA_mn_48:4.5	“satthā āyasmante āmantetī”ti.	▁satthā ▁āyasmant e ▁ ā mant etīti
PA_mn_48:4.6_0	“Evamāvuso”ti kho te bhikkhū tassa bhikkhuno paṭissutvā yena bhagavā tenupasaṅkamiṁsu;	▁evam āvuso ti ▁kho ▁te ▁bhikkhū ▁tassa ▁bhikkhuno ▁paṭi ssu tvā ▁yena ▁bhagavā ▁tenupasaṃkami ṃ su
PA_mn_48:4.6_1	upasaṅkamitvā bhagavantaṁ abhivādetvā ekamantaṁ nisīdiṁsu. Ekamantaṁ nisinne kho	▁upasaṃkamitvā ▁bhagavantaṃ ▁abhivādetvā ▁ekamantaṃ ▁nisīd iṃsu ▁ekamantaṃ ▁nisinn e ▁kho
PA_mn_48:4.6_2	te bhikkhū bhagavā etadavoca:	▁te ▁bhikkhū ▁bhagavā ▁etadavoca
PA_mn_48:4.7	“saccaṁ kira tumhe, bhikkhave, bhaṇḍanajātā kalahajātā vivādāpannā aññamaññaṁ mukhasattīhi vitudantā viharatha,	▁saccaṃ ▁kira ▁tumhe ▁bhikkhave ▁bhaṇḍ ana jāt ā ▁kalah a jāt ā ▁vivād āpan nā ▁aññamaññ aṃ ▁mukh a satt īhi ▁vi tu dant ā ▁viharat ha
PA_mn_48:4.8	te na ceva aññamaññaṁ saññāpetha, na ca saññattiṁ upetha, na ca aññamaññaṁ nijjhāpetha, na ca nijjhattiṁ upethā”ti?	▁te ▁na ▁ceva ▁aññamaññ aṃ ▁saññā pe tha ▁na ▁ca ▁saññ att iṃ ▁up etha ▁na ▁ca ▁aññamaññ aṃ ▁ni jj hāp etha ▁na ▁ca ▁ni jjh att iṃ ▁up e thāti
PA_mn_48:4.9	“Evaṁ, bhante”.	▁evaṃ ▁bhante
PA_mn_48:5.1	“Taṁ kiṁ maññatha, bhikkhave,	▁taṃ ▁kiṃ ▁maññ atha ▁bhikkhave
PA_mn_48:5.2_0	yasmiṁ tumhe samaye bhaṇḍanajātā kalahajātā vivādāpannā aññamaññaṁ mukhasattīhi vitudantā	▁yasmiṃ ▁tumhe ▁samaye ▁bhaṇḍ ana jāt ā ▁kalah a jāt ā ▁vivād āpan nā ▁aññamaññ aṃ ▁mukh a satt īhi ▁vi tu dant ā
PA_mn_48:5.2_1	viharatha, api nu tumhākaṁ tasmiṁ samaye mettaṁ kāyakammaṁ paccupaṭṭhitaṁ hoti sabrahmacārīsu	▁viharat ha ▁api ▁nu ▁tumhākaṃ ▁tasmiṃ ▁samaye ▁mett aṃ ▁kāyakamm aṃ ▁pacc upaṭṭh itaṃ ▁hoti ▁sabrahmacārī su
PA_mn_48:5.2_2	āvi ceva raho ca, mettaṁ vacīkammaṁ …pe… mettaṁ manokammaṁ paccupaṭṭhitaṁ hoti sabrahmacārīsu	▁āvi ▁ceva ▁raho ▁ca ▁mett aṃ ▁vacī kammaṃ ▁pe ▁mett aṃ ▁mano kammaṃ ▁pacc upaṭṭh itaṃ ▁hoti ▁sabrahmacārī su
PA_mn_48:5.2_3	āvi ceva raho cā”ti?	▁āvi ▁ceva ▁raho ▁cāti
PA_mn_48:5.3	“No hetaṁ, bhante”.	▁no ▁he taṃ ▁bhante
PA_mn_48:5.4_0	“Iti kira, bhikkhave, yasmiṁ tumhe samaye bhaṇḍanajātā kalahajātā vivādāpannā aññamaññaṁ	▁iti ▁kira ▁bhikkhave ▁yasmiṃ ▁tumhe ▁samaye ▁bhaṇḍ ana jāt ā ▁kalah a jāt ā ▁vivād āpan nā ▁aññamaññ aṃ
PA_mn_48:5.4_1	mukhasattīhi vitudantā viharatha, neva tumhākaṁ tasmiṁ samaye mettaṁ kāyakammaṁ paccupaṭṭhitaṁ	▁mukh a satt īhi ▁vi tu dant ā ▁viharat ha ▁neva ▁tumhākaṃ ▁tasmiṃ ▁samaye ▁mett aṃ ▁kāyakamm aṃ ▁pacc upaṭṭh itaṃ
PA_mn_48:5.4_2	hoti sabrahmacārīsu āvi ceva raho ca, na mettaṁ vacīkammaṁ …pe… na mettaṁ manokammaṁ	▁hoti ▁sabrahmacārī su ▁āvi ▁ceva ▁raho ▁ca ▁na ▁mett aṃ ▁vacī kammaṃ ▁pe ▁na ▁mett aṃ ▁mano kammaṃ
PA_mn_48:5.4_3	paccupaṭṭhitaṁ hoti sabrahmacārīsu āvi ceva raho ca.	▁pacc upaṭṭh itaṃ ▁hoti ▁sabrahmacārī su ▁āvi ▁ceva ▁raho ▁ca
PA_mn_48:5.5_0	Atha kiñcarahi tumhe, moghapurisā, kiṁ jānantā kiṁ passantā bhaṇḍanajātā kalahajātā	▁atha ▁ki ñca ra hi ▁tumhe ▁mogh apuris ā ▁kiṃ ▁jānant ā ▁kiṃ ▁passant ā ▁bhaṇḍ ana jāt ā ▁kalah a jāt ā
PA_mn_48:5.5_1	vivādāpannā aññamaññaṁ mukhasattīhi vitudantā viharatha, te na ceva aññamaññaṁ saññāpetha,	▁vivād āpan nā ▁aññamaññ aṃ ▁mukh a satt īhi ▁vi tu dant ā ▁viharat ha ▁te ▁na ▁ceva ▁aññamaññ aṃ ▁saññā pe tha
PA_mn_48:5.5_2	na ca saññattiṁ upetha, na ca aññamaññaṁ nijjhāpetha, na ca nijjhattiṁ upetha?	▁na ▁ca ▁saññ att iṃ ▁up etha ▁na ▁ca ▁aññamaññ aṃ ▁ni jj hāp etha ▁na ▁ca ▁ni jjh att iṃ ▁up etha
PA_mn_48:5.6	Tañhi tumhākaṁ, moghapurisā, bhavissati dīgharattaṁ ahitāya dukkhāyā”ti.	▁tañhi ▁tumhākaṃ ▁mogh apuris ā ▁bhavissati ▁dīgharattaṃ ▁a hi tāya ▁dukkh āyāti
PA_mn_48:6.1	Atha kho bhagavā bhikkhū āmantesi:	▁atha ▁kho ▁bhagavā ▁bhikkhū ▁āmantesi
PA_mn_48:6.2	“chayime, bhikkhave, dhammā sāraṇīyā piyakaraṇā garukaraṇā saṅgahāya avivādāya sāmaggiyā ekībhāvāya saṁvattanti.	▁cha yi me ▁bhikkhave ▁dhammā ▁sār aṇīy ā ▁piy akaraṇ ā ▁garu karaṇ ā ▁saṃgah āya ▁avi vād āya ▁ sāmaggi yā ▁ek ī bhāv āya ▁saṃvatt anti
PA_mn_48:6.3	Katame cha?	▁katame ▁cha
PA_mn_48:6.4	Idha, bhikkhave, bhikkhuno mettaṁ kāyakammaṁ paccupaṭṭhitaṁ hoti sabrahmacārīsu āvi ceva raho ca.	▁idha ▁bhikkhave ▁bhikkhuno ▁mett aṃ ▁kāyakamm aṃ ▁pacc upaṭṭh itaṃ ▁hoti ▁sabrahmacārī su ▁āvi ▁ceva ▁raho ▁ca
PA_mn_48:6.5	Ayampi dhammo sāraṇīyo piyakaraṇo garukaraṇo saṅgahāya avivādāya sāmaggiyā ekībhāvāya saṁvattati.	▁ayampi ▁dhammo ▁sār aṇīy o ▁piy akaraṇ o ▁garu karaṇ o ▁saṃgah āya ▁avi vād āya ▁ sāmaggi yā ▁ek ī bhāv āya ▁saṃvatt ati
PA_mn_48:6.6	Puna caparaṁ, bhikkhave, bhikkhuno mettaṁ vacīkammaṁ paccupaṭṭhitaṁ hoti sabrahmacārīsu āvi ceva raho ca.	▁puna ▁caparaṃ ▁bhikkhave ▁bhikkhuno ▁mett aṃ ▁vacī kammaṃ ▁pacc upaṭṭh itaṃ ▁hoti ▁sabrahmacārī su ▁āvi ▁ceva ▁raho ▁ca
PA_mn_48:6.7	Ayampi dhammo sāraṇīyo piyakaraṇo garukaraṇo saṅgahāya avivādāya sāmaggiyā ekībhāvāya saṁvattati.	▁ayampi ▁dhammo ▁sār aṇīy o ▁piy akaraṇ o ▁garu karaṇ o ▁saṃgah āya ▁avi vād āya ▁ sāmaggi yā ▁ek ī bhāv āya ▁saṃvatt ati
PA_mn_48:6.8	Puna caparaṁ, bhikkhave, bhikkhuno mettaṁ manokammaṁ paccupaṭṭhitaṁ hoti sabrahmacārīsu āvi ceva raho ca.	▁puna ▁caparaṃ ▁bhikkhave ▁bhikkhuno ▁mett aṃ ▁mano kammaṃ ▁pacc upaṭṭh itaṃ ▁hoti ▁sabrahmacārī su ▁āvi ▁ceva ▁raho ▁ca
PA_mn_48:6.9	Ayampi dhammo sāraṇīyo piyakaraṇo garukaraṇo saṅgahāya avivādāya sāmaggiyā ekībhāvāya saṁvattati.	▁ayampi ▁dhammo ▁sār aṇīy o ▁piy akaraṇ o ▁garu karaṇ o ▁saṃgah āya ▁avi vād āya ▁ sāmaggi yā ▁ek ī bhāv āya ▁saṃvatt ati
PA_mn_48:6.10_0	Puna caparaṁ, bhikkhave, bhikkhu ye te lābhā dhammikā dhammaladdhā antamaso pattapariyāpannamattampi,	▁puna ▁caparaṃ ▁bhikkhave ▁bhikkhu ▁ye ▁te ▁lābh ā ▁dhammik ā ▁dhamma laddh ā ▁antamaso ▁patt apariyāpann amatt ampi
PA_mn_48:6.10_1	tathārūpehi lābhehi appaṭivibhattabhogī hoti sīlavantehi sabrahmacārīhi sādhāraṇabhogī.	▁tathārūp ehi ▁lābh ehi ▁appaṭi vibhatt a bhog ī ▁hoti ▁sīl avant ehi ▁sabrahmacārī hi ▁ sādhāraṇ a bhog ī
PA_mn_48:6.11	Ayampi dhammo sāraṇīyo piyakaraṇo garukaraṇo saṅgahāya avivādāya sāmaggiyā ekībhāvāya saṁvattati.	▁ayampi ▁dhammo ▁sār aṇīy o ▁piy akaraṇ o ▁garu karaṇ o ▁saṃgah āya ▁avi vād āya ▁ sāmaggi yā ▁ek ī bhāv āya ▁saṃvatt ati
PA_mn_48:6.12_0	Puna caparaṁ, bhikkhave, bhikkhu yāni tāni sīlāni akhaṇḍāni acchiddāni asabalāni	▁puna ▁caparaṃ ▁bhikkhave ▁bhikkhu ▁yāni ▁tāni ▁sīl āni ▁a khaṇḍ āni ▁a c chidd āni ▁as a bal āni
PA_mn_48:6.12_1	akammāsāni bhujissāni viññuppasatthāni aparāmaṭṭhāni samādhisaṁvattanikāni tathārūpesu	▁ akamm ā s āni ▁ bhu j issā ni ▁viññu ppa satth āni ▁a parāmaṭṭh āni ▁samādhi saṃvattanik āni ▁tathārūp esu
PA_mn_48:6.12_2	sīlesu sīlasāmaññagato viharati sabrahmacārīhi āvi ceva raho ca.	▁sīl esu ▁sīl a sām añña gat o ▁viharati ▁sabrahmacārī hi ▁āvi ▁ceva ▁raho ▁ca
PA_mn_48:6.13	Ayampi dhammo sāraṇīyo piyakaraṇo garukaraṇo saṅgahāya avivādāya sāmaggiyā ekībhāvāya saṁvattati.	▁ayampi ▁dhammo ▁sār aṇīy o ▁piy akaraṇ o ▁garu karaṇ o ▁saṃgah āya ▁avi vād āya ▁ sāmaggi yā ▁ek ī bhāv āya ▁saṃvatt ati
PA_mn_48:6.14_0	Puna caparaṁ, bhikkhave, bhikkhu yāyaṁ diṭṭhi ariyā niyyānikā niyyāti takkarassa	▁puna ▁caparaṃ ▁bhikkhave ▁bhikkhu ▁yā yaṃ ▁diṭṭhi ▁ariy ā ▁ niyyānik ā ▁niyyāt i ▁takk a r assa
PA_mn_48:6.14_1	sammā dukkhakkhayāya tathārūpāya diṭṭhiyā diṭṭhisāmaññagato viharati sabrahmacārīhi āvi ceva raho ca.	▁sammā ▁dukkh akkhay āya ▁tathārūp āya ▁diṭṭhi yā ▁diṭṭhi sām añña gat o ▁viharati ▁sabrahmacārī hi ▁āvi ▁ceva ▁raho ▁ca
PA_mn_48:6.15	Ayampi dhammo sāraṇīyo piyakaraṇo garukaraṇo saṅgahāya avivādāya sāmaggiyā ekībhāvāya saṁvattati.	▁ayampi ▁dhammo ▁sār aṇīy o ▁piy akaraṇ o ▁garu karaṇ o ▁saṃgah āya ▁avi vād āya ▁ sāmaggi yā ▁ek ī bhāv āya ▁saṃvatt ati
PA_mn_48:6.16	Ime kho, bhikkhave, cha sāraṇīyā dhammā piyakaraṇā garukaraṇā saṅgahāya avivādāya sāmaggiyā ekībhāvāya saṁvattanti.	▁ime ▁kho ▁bhikkhave ▁cha ▁sār aṇīy ā ▁dhammā ▁piy akaraṇ ā ▁garu karaṇ ā ▁saṃgah āya ▁avi vād āya ▁ sāmaggi yā ▁ek ī bhāv āya ▁saṃvatt anti
PA_mn_48:7.1	Imesaṁ kho, bhikkhave, channaṁ sāraṇīyānaṁ dhammānaṁ etaṁ aggaṁ etaṁ saṅgāhikaṁ etaṁ saṅghāṭanikaṁ—yadidaṁ yāyaṁ diṭṭhi ariyā niyyānikā niyyāti takkarassa sammā dukkhakkhayāya.	▁imesaṃ ▁kho ▁bhikkhave ▁chann aṃ ▁sār aṇīy ānaṃ ▁dhammānaṃ ▁etaṃ ▁agg aṃ ▁etaṃ ▁saṃ gāh ikaṃ ▁etaṃ ▁saṃgh ā ṭ an ikaṃ ya d idaṃ ▁yā yaṃ ▁diṭṭhi ▁ariy ā ▁ niyyānik ā ▁niyyāt i ▁takk a r assa ▁sammā ▁dukkh akkhay āya
PA_mn_48:7.2	Seyyathāpi, bhikkhave, kūṭāgārassa etaṁ aggaṁ etaṁ saṅgāhikaṁ etaṁ saṅghāṭanikaṁ yadidaṁ kūṭaṁ;	▁seyyathāpi ▁bhikkhave ▁ kūṭ ā gār assa ▁etaṃ ▁agg aṃ ▁etaṃ ▁saṃ gāh ikaṃ ▁etaṃ ▁saṃgh ā ṭ an ikaṃ ▁yadidaṃ ▁ kūṭ aṃ
PA_mn_48:7.3_0	evameva kho, bhikkhave, imesaṁ channaṁ sāraṇīyānaṁ dhammānaṁ etaṁ aggaṁ etaṁ saṅgāhikaṁ	▁evameva ▁kho ▁bhikkhave ▁imesaṃ ▁chann aṃ ▁sār aṇīy ānaṃ ▁dhammānaṃ ▁etaṃ ▁agg aṃ ▁etaṃ ▁saṃ gāh ikaṃ
PA_mn_48:7.3_1	etaṁ saṅghāṭanikaṁ yadidaṁ yāyaṁ diṭṭhi ariyā niyyānikā niyyāti takkarassa sammā dukkhakkhayāya.	▁etaṃ ▁saṃgh ā ṭ an ikaṃ ▁yadidaṃ ▁yā yaṃ ▁diṭṭhi ▁ariy ā ▁ niyyānik ā ▁niyyāt i ▁takk a r assa ▁sammā ▁dukkh akkhay āya
PA_mn_48:8.1	Kathañca, bhikkhave, yāyaṁ diṭṭhi ariyā niyyānikā niyyāti takkarassa sammā dukkhakkhayāya?	▁kathañca ▁bhikkhave ▁yā yaṃ ▁diṭṭhi ▁ariy ā ▁ niyyānik ā ▁niyyāt i ▁takk a r assa ▁sammā ▁dukkh akkhay āya
PA_mn_48:8.2	Idha, bhikkhave, bhikkhu araññagato vā rukkhamūlagato vā suññāgāragato vā iti paṭisañcikkhati:	▁idha ▁bhikkhave ▁bhikkhu ▁araññ agato ▁vā ▁rukkhamūl agato ▁vā ▁su ññā gār agato ▁vā ▁iti ▁paṭi sa ñc ikkh ati
PA_mn_48:8.3	‘atthi nu kho me taṁ pariyuṭṭhānaṁ ajjhattaṁ appahīnaṁ, yenāhaṁ pariyuṭṭhānena pariyuṭṭhitacitto yathābhūtaṁ nappajāneyyaṁ na passeyyan’ti?	▁atthi ▁nu ▁kho ▁me ▁taṃ ▁ pariyuṭṭhān aṃ ▁ajjhattaṃ ▁appahīn aṃ ▁ye nā haṃ ▁ pariyuṭṭhān ena ▁pari yu ṭṭhit acitt o ▁yathābhūtaṃ ▁na ppa jān eyyaṃ ▁na ▁pass eyyanti
PA_mn_48:8.4	Sace, bhikkhave, bhikkhu kāmarāgapariyuṭṭhito hoti, pariyuṭṭhitacittova hoti.	▁sace ▁bhikkhave ▁bhikkhu ▁kāmarāg apari yu ṭṭhit o ▁hoti ▁pari yu ṭṭhit acitt ova ▁hoti
PA_mn_48:8.5	Sace, bhikkhave, bhikkhu byāpādapariyuṭṭhito hoti, pariyuṭṭhitacittova hoti.	▁sace ▁bhikkhave ▁bhikkhu ▁byāpād apari yu ṭṭhit o ▁hoti ▁pari yu ṭṭhit acitt ova ▁hoti
PA_mn_48:8.6	Sace, bhikkhave, bhikkhu thinamiddhapariyuṭṭhito hoti, pariyuṭṭhitacittova hoti.	▁sace ▁bhikkhave ▁bhikkhu ▁thinamiddh apari yu ṭṭhit o ▁hoti ▁pari yu ṭṭhit acitt ova ▁hoti
PA_mn_48:8.7	Sace, bhikkhave, bhikkhu uddhaccakukkuccapariyuṭṭhito hoti, pariyuṭṭhitacittova hoti.	▁sace ▁bhikkhave ▁bhikkhu ▁ uddh a cca kukku cc apari yu ṭṭhit o ▁hoti ▁pari yu ṭṭhit acitt ova ▁hoti
PA_mn_48:8.8	Sace, bhikkhave, bhikkhu vicikicchāpariyuṭṭhito hoti, pariyuṭṭhitacittova hoti.	▁sace ▁bhikkhave ▁bhikkhu ▁vicikicchā pari yu ṭṭhit o ▁hoti ▁pari yu ṭṭhit acitt ova ▁hoti
PA_mn_48:8.9	Sace, bhikkhave, bhikkhu idhalokacintāya pasuto hoti, pariyuṭṭhitacittova hoti.	▁sace ▁bhikkhave ▁bhikkhu ▁idha lok a cint āya ▁pa su to ▁hoti ▁pari yu ṭṭhit acitt ova ▁hoti
PA_mn_48:8.10	Sace, bhikkhave, bhikkhu paralokacintāya pasuto hoti, pariyuṭṭhitacittova hoti.	▁sace ▁bhikkhave ▁bhikkhu ▁para lok a cint āya ▁pa su to ▁hoti ▁pari yu ṭṭhit acitt ova ▁hoti
PA_mn_48:8.11	Sace, bhikkhave, bhikkhu bhaṇḍanajāto kalahajāto vivādāpanno aññamaññaṁ mukhasattīhi vitudanto viharati, pariyuṭṭhitacittova hoti.	▁sace ▁bhikkhave ▁bhikkhu ▁bhaṇḍ ana jāt o ▁kalah a jāt o ▁vivād āpan no ▁aññamaññ aṃ ▁mukh a satt īhi ▁vi tu dant o ▁viharati ▁pari yu ṭṭhit acitt ova ▁hoti
PA_mn_48:8.12	So evaṁ pajānāti:	▁so ▁evaṃ ▁pajānāti
PA_mn_48:8.13	‘natthi kho me taṁ pariyuṭṭhānaṁ ajjhattaṁ appahīnaṁ, yenāhaṁ pariyuṭṭhānena pariyuṭṭhitacitto yathābhūtaṁ nappajāneyyaṁ na passeyyaṁ.	▁natthi ▁kho ▁me ▁taṃ ▁ pariyuṭṭhān aṃ ▁ajjhattaṃ ▁appahīn aṃ ▁ye nā haṃ ▁ pariyuṭṭhān ena ▁pari yu ṭṭhit acitt o ▁yathābhūtaṃ ▁na ppa jān eyyaṃ ▁na ▁pass eyyaṃ
PA_mn_48:8.14	Suppaṇihitaṁ me mānasaṁ saccānaṁ bodhāyā’ti.	▁su ppa ṇi hitaṃ ▁me ▁mān asaṃ ▁sacc ānaṃ ▁ bodh āyāti
PA_mn_48:8.15	Idamassa paṭhamaṁ ñāṇaṁ adhigataṁ hoti ariyaṁ lokuttaraṁ asādhāraṇaṁ puthujjanehi.	▁idam assa ▁paṭhamaṃ ▁ñāṇaṃ ▁adhigat aṃ ▁hoti ▁ariy aṃ ▁lokuttar aṃ ▁a sādhāraṇ aṃ ▁puthujjan ehi
PA_mn_48:9.1	Puna caparaṁ, bhikkhave, ariyasāvako iti paṭisañcikkhati:	▁puna ▁caparaṃ ▁bhikkhave ▁ariyasāvak o ▁iti ▁paṭi sa ñc ikkh ati
PA_mn_48:9.2	‘imaṁ nu kho ahaṁ diṭṭhiṁ āsevanto bhāvento bahulīkaronto labhāmi paccattaṁ samathaṁ, labhāmi paccattaṁ nibbutin’ti?	▁imaṃ ▁nu ▁kho ▁ahaṃ ▁diṭṭhi ṃ ▁āsevan to ▁bhāv ento ▁bahu lī karo nt o ▁labh āmi ▁paccatt aṃ ▁samath aṃ ▁labh āmi ▁paccatt aṃ ▁nibbut i nti
PA_mn_48:9.3	So evaṁ pajānāti:	▁so ▁evaṃ ▁pajānāti
PA_mn_48:9.4	‘imaṁ kho ahaṁ diṭṭhiṁ āsevanto bhāvento bahulīkaronto labhāmi paccattaṁ samathaṁ, labhāmi paccattaṁ nibbutin’ti.	▁imaṃ ▁kho ▁ahaṃ ▁diṭṭhi ṃ ▁āsevan to ▁bhāv ento ▁bahu lī karo nt o ▁labh āmi ▁paccatt aṃ ▁samath aṃ ▁labh āmi ▁paccatt aṃ ▁nibbut i nti
PA_mn_48:9.5	Idamassa dutiyaṁ ñāṇaṁ adhigataṁ hoti ariyaṁ lokuttaraṁ asādhāraṇaṁ puthujjanehi.	▁idam assa ▁dutiy aṃ ▁ñāṇaṃ ▁adhigat aṃ ▁hoti ▁ariy aṃ ▁lokuttar aṃ ▁a sādhāraṇ aṃ ▁puthujjan ehi
PA_mn_48:10.1	Puna caparaṁ, bhikkhave, ariyasāvako iti paṭisañcikkhati:	▁puna ▁caparaṃ ▁bhikkhave ▁ariyasāvak o ▁iti ▁paṭi sa ñc ikkh ati
PA_mn_48:10.2	‘yathārūpāyāhaṁ diṭṭhiyā samannāgato, atthi nu kho ito bahiddhā añño samaṇo vā brāhmaṇo vā tathārūpāya diṭṭhiyā samannāgato’ti?	▁yathā rūp ā yā haṃ ▁diṭṭhi yā ▁samannāgato ▁atthi ▁nu ▁kho ▁ito ▁bahiddhā ▁añño ▁samaṇ o ▁vā ▁brāhmaṇo ▁vā ▁tathārūp āya ▁diṭṭhi yā ▁samannāgato ti
PA_mn_48:10.3	So evaṁ pajānāti:	▁so ▁evaṃ ▁pajānāti
PA_mn_48:10.4	‘yathārūpāyāhaṁ diṭṭhiyā samannāgato, natthi ito bahiddhā añño samaṇo vā brāhmaṇo vā tathārūpāya diṭṭhiyā samannāgato’ti.	▁yathā rūp ā yā haṃ ▁diṭṭhi yā ▁samannāgato ▁natthi ▁ito ▁bahiddhā ▁añño ▁samaṇ o ▁vā ▁brāhmaṇo ▁vā ▁tathārūp āya ▁diṭṭhi yā ▁samannāgato ti
PA_mn_48:10.5	Idamassa tatiyaṁ ñāṇaṁ adhigataṁ hoti ariyaṁ lokuttaraṁ asādhāraṇaṁ puthujjanehi.	▁idam assa ▁tatiy aṃ ▁ñāṇaṃ ▁adhigat aṃ ▁hoti ▁ariy aṃ ▁lokuttar aṃ ▁a sādhāraṇ aṃ ▁puthujjan ehi
PA_mn_48:11.1	Puna caparaṁ, bhikkhave, ariyasāvako iti paṭisañcikkhati:	▁puna ▁caparaṃ ▁bhikkhave ▁ariyasāvak o ▁iti ▁paṭi sa ñc ikkh ati
PA_mn_48:11.2	‘yathārūpāya dhammatāya diṭṭhisampanno puggalo samannāgato, ahampi tathārūpāya dhammatāya samannāgato’ti.	▁yathā rūp āya ▁dhamm atāya ▁diṭṭhi sampann o ▁puggalo ▁samannāgato ▁ah ampi ▁tathārūp āya ▁dhamm atāya ▁samannāgato ti
PA_mn_48:11.3	Kathaṁrūpāya ca, bhikkhave, dhammatāya diṭṭhisampanno puggalo samannāgato?	▁kathaṃ rūp āya ▁ca ▁bhikkhave ▁dhamm atāya ▁diṭṭhi sampann o ▁puggalo ▁samannāgato
PA_mn_48:11.4	Dhammatā esā, bhikkhave, diṭṭhisampannassa puggalassa:	▁dhamm atā ▁esā ▁bhikkhave ▁diṭṭhi sampann assa ▁puggalassa
PA_mn_48:11.5	‘kiñcāpi tathārūpiṁ āpattiṁ āpajjati, yathārūpāya āpattiyā vuṭṭhānaṁ paññāyati, atha kho naṁ khippameva satthari vā viññūsu vā sabrahmacārīsu deseti vivarati uttānīkaroti;	▁kiñcāpi ▁tathārūp iṃ ▁āpattiṃ ▁āpajjati ▁yathā rūp āya ▁āpattiyā ▁vuṭṭhān aṃ ▁paññāya ti ▁atha ▁kho ▁naṃ ▁khipp ameva ▁satthari ▁vā ▁viññū su ▁vā ▁sabrahmacārī su ▁des eti ▁vivar ati ▁uttān ī karo ti
PA_mn_48:11.6	desetvā vivaritvā uttānīkatvā āyatiṁ saṁvaraṁ āpajjati’.	▁des etvā ▁vivar itvā ▁uttān ī kat vā ▁āyatiṃ ▁saṃvar aṃ ▁āpajjati
PA_mn_48:11.7	Seyyathāpi, bhikkhave, daharo kumāro mando uttānaseyyako hatthena vā pādena vā aṅgāraṁ akkamitvā khippameva paṭisaṁharati;	▁seyyathāpi ▁bhikkhave ▁dahar o ▁ kumār o ▁mand o ▁uttān aseyy ako ▁hatth ena ▁vā ▁pād ena ▁vā ▁ aṃ gār aṃ ▁a kkam itvā ▁khipp ameva ▁paṭi saṃ har ati
PA_mn_48:11.8	evameva kho, bhikkhave, dhammatā esā diṭṭhisampannassa puggalassa:	▁evameva ▁kho ▁bhikkhave ▁dhamm atā ▁esā ▁diṭṭhi sampann assa ▁puggalassa
PA_mn_48:11.9	‘kiñcāpi tathārūpiṁ āpattiṁ āpajjati yathārūpāya āpattiyā vuṭṭhānaṁ paññāyati, atha kho naṁ khippameva satthari vā viññūsu vā sabrahmacārīsu deseti vivarati uttānīkaroti;	▁kiñcāpi ▁tathārūp iṃ ▁āpattiṃ ▁āpajjati ▁yathā rūp āya ▁āpattiyā ▁vuṭṭhān aṃ ▁paññāya ti ▁atha ▁kho ▁naṃ ▁khipp ameva ▁satthari ▁vā ▁viññū su ▁vā ▁sabrahmacārī su ▁des eti ▁vivar ati ▁uttān ī karo ti
PA_mn_48:11.10	desetvā vivaritvā uttānīkatvā āyatiṁ saṁvaraṁ āpajjati’.	▁des etvā ▁vivar itvā ▁uttān ī kat vā ▁āyatiṃ ▁saṃvar aṃ ▁āpajjati
PA_mn_48:11.11	So evaṁ pajānāti:	▁so ▁evaṃ ▁pajānāti
PA_mn_48:11.12	‘yathārūpāya dhammatāya diṭṭhisampanno puggalo samannāgato, ahampi tathārūpāya dhammatāya samannāgato’ti.	▁yathā rūp āya ▁dhamm atāya ▁diṭṭhi sampann o ▁puggalo ▁samannāgato ▁ah ampi ▁tathārūp āya ▁dhamm atāya ▁samannāgato ti
PA_mn_48:11.13	Idamassa catutthaṁ ñāṇaṁ adhigataṁ hoti ariyaṁ lokuttaraṁ asādhāraṇaṁ puthujjanehi.	▁idam assa ▁catutth aṃ ▁ñāṇaṃ ▁adhigat aṃ ▁hoti ▁ariy aṃ ▁lokuttar aṃ ▁a sādhāraṇ aṃ ▁puthujjan ehi
PA_mn_48:12.1	Puna caparaṁ, bhikkhave, ariyasāvako iti paṭisañcikkhati:	▁puna ▁caparaṃ ▁bhikkhave ▁ariyasāvak o ▁iti ▁paṭi sa ñc ikkh ati
PA_mn_48:12.2	‘yathārūpāya dhammatāya diṭṭhisampanno puggalo samannāgato, ahampi tathārūpāya dhammatāya samannāgato’ti.	▁yathā rūp āya ▁dhamm atāya ▁diṭṭhi sampann o ▁puggalo ▁samannāgato ▁ah ampi ▁tathārūp āya ▁dhamm atāya ▁samannāgato ti
PA_mn_48:12.3	Kathaṁrūpāya ca, bhikkhave, dhammatāya diṭṭhisampanno puggalo samannāgato?	▁kathaṃ rūp āya ▁ca ▁bhikkhave ▁dhamm atāya ▁diṭṭhi sampann o ▁puggalo ▁samannāgato
PA_mn_48:12.4	Dhammatā esā, bhikkhave, diṭṭhisampannassa puggalassa:	▁dhamm atā ▁esā ▁bhikkhave ▁diṭṭhi sampann assa ▁puggalassa
PA_mn_48:12.5	‘kiñcāpi yāni tāni sabrahmacārīnaṁ uccāvacāni kiṅkaraṇīyāni tattha ussukkaṁ āpanno hoti, atha khvāssa tibbāpekkhā hoti adhisīlasikkhāya adhicittasikkhāya adhipaññāsikkhāya’.	▁kiñcāpi ▁yāni ▁tāni ▁sabrahmacārī naṃ ▁ucc āva c āni ▁kiṃ karaṇīy āni ▁tattha ▁ ussukk aṃ ▁āpann o ▁hoti ▁atha ▁kh vā ssa ▁ ti bb ā pekkh ā ▁hoti ▁adhi sīl as ikkh āya ▁adhi citt as ikkh āya ▁adhi paññā s ikkh āya
PA_mn_48:12.6	Seyyathāpi, bhikkhave, gāvī taruṇavacchā thambañca ālumpati vacchakañca apacinati;	▁seyyathāpi ▁bhikkhave ▁gāv ī ▁taruṇ a va cchā ▁ tha mb añca ▁ ā lu m pati ▁va cch ak añca ▁apa ci na ti
PA_mn_48:12.7	evameva kho, bhikkhave, dhammatā esā diṭṭhisampannassa puggalassa:	▁evameva ▁kho ▁bhikkhave ▁dhamm atā ▁esā ▁diṭṭhi sampann assa ▁puggalassa
PA_mn_48:12.8	‘kiñcāpi yāni tāni sabrahmacārīnaṁ uccāvacāni kiṅkaraṇīyāni tattha ussukkaṁ āpanno hoti, atha khvāssa tibbāpekkhā hoti adhisīlasikkhāya adhicittasikkhāya adhipaññāsikkhāya’.	▁kiñcāpi ▁yāni ▁tāni ▁sabrahmacārī naṃ ▁ucc āva c āni ▁kiṃ karaṇīy āni ▁tattha ▁ ussukk aṃ ▁āpann o ▁hoti ▁atha ▁kh vā ssa ▁ ti bb ā pekkh ā ▁hoti ▁adhi sīl as ikkh āya ▁adhi citt as ikkh āya ▁adhi paññā s ikkh āya
PA_mn_48:12.9	So evaṁ pajānāti:	▁so ▁evaṃ ▁pajānāti
