segmentnr	original	analyzed
PA_mn_18:17.3	Vedanāpaññattiyā sati saññāpaññattiṁ paññāpessatīti—ṭhānametaṁ vijjati.	▁vedanā paññatti yā ▁sati ▁saññā paññatti ṃ ▁paññāp e ssatīti ṭhān ametaṃ ▁vijjati
PA_mn_18:17.4	Saññāpaññattiyā sati vitakkapaññattiṁ paññāpessatīti—ṭhānametaṁ vijjati.	▁saññā paññatti yā ▁sati ▁vitakk a paññatti ṃ ▁paññāp e ssatīti ṭhān ametaṃ ▁vijjati
PA_mn_18:17.5	Vitakkapaññattiyā sati papañcasaññāsaṅkhāsamudācaraṇapaññattiṁ paññāpessatīti—ṭhānametaṁ vijjati.	▁vitakk a paññatti yā ▁sati ▁pa pañc asaññā saṃ kh ā sa mud ā caraṇ a paññatti ṃ ▁paññāp e ssatīti ṭhān ametaṃ ▁vijjati
PA_mn_18:17.6	So vatāvuso, sotasmiṁ sati sadde sati …pe…	▁so ▁vat āvuso ▁sota smiṃ ▁sati ▁sadd e ▁sati ▁pe
PA_mn_18:17.7	ghānasmiṁ sati gandhe sati …pe…	▁ghān asmiṃ ▁sati ▁gandh e ▁sati ▁pe
PA_mn_18:17.8	jivhāya sati rase sati …pe…	▁jivhā ya ▁sati ▁ras e ▁sati ▁pe
PA_mn_18:17.9	kāyasmiṁ sati phoṭṭhabbe sati …pe…	▁kāy asmiṃ ▁sati ▁phoṭṭhabb e ▁sati ▁pe
PA_mn_18:17.10	manasmiṁ sati dhamme sati manoviññāṇe sati phassapaññattiṁ paññāpessatīti—ṭhānametaṁ vijjati.	▁man asmiṃ ▁sati ▁dhamme ▁sati ▁mano viññāṇ e ▁sati ▁phass a paññatti ṃ ▁paññāp e ssatīti ṭhān ametaṃ ▁vijjati
PA_mn_18:17.11	Phassapaññattiyā sati vedanāpaññattiṁ paññāpessatīti—ṭhānametaṁ vijjati.	▁phass a paññatti yā ▁sati ▁vedanā paññatti ṃ ▁paññāp e ssatīti ṭhān ametaṃ ▁vijjati
PA_mn_18:17.12	Vedanāpaññattiyā sati saññāpaññattiṁ paññāpessatīti—ṭhānametaṁ vijjati.	▁vedanā paññatti yā ▁sati ▁saññā paññatti ṃ ▁paññāp e ssatīti ṭhān ametaṃ ▁vijjati
PA_mn_18:17.13	Saññāpaññattiyā sati vitakkapaññattiṁ paññāpessatīti—ṭhānametaṁ vijjati.	▁saññā paññatti yā ▁sati ▁vitakk a paññatti ṃ ▁paññāp e ssatīti ṭhān ametaṃ ▁vijjati
PA_mn_18:17.14	Vitakkapaññattiyā sati papañcasaññāsaṅkhāsamudācaraṇapaññattiṁ paññāpessatīti—ṭhānametaṁ vijjati.	▁vitakk a paññatti yā ▁sati ▁pa pañc asaññā saṃ kh ā sa mud ā caraṇ a paññatti ṃ ▁paññāp e ssatīti ṭhān ametaṃ ▁vijjati
PA_mn_18:18.1	So vatāvuso, cakkhusmiṁ asati rūpe asati cakkhuviññāṇe asati phassapaññattiṁ paññāpessatīti—netaṁ ṭhānaṁ vijjati.	▁so ▁vat āvuso ▁cakkhu smiṃ ▁asati ▁rūp e ▁asati ▁cakkhuviññāṇ e ▁asati ▁phass a paññatti ṃ ▁paññāp e ssatīti net aṃ ▁ṭhānaṃ ▁vijjati
PA_mn_18:18.2	Phassapaññattiyā asati vedanāpaññattiṁ paññāpessatīti—netaṁ ṭhānaṁ vijjati.	▁phass a paññatti yā ▁asati ▁vedanā paññatti ṃ ▁paññāp e ssatīti net aṃ ▁ṭhānaṃ ▁vijjati
PA_mn_18:18.3	Vedanāpaññattiyā asati saññāpaññattiṁ paññāpessatīti—netaṁ ṭhānaṁ vijjati.	▁vedanā paññatti yā ▁asati ▁saññā paññatti ṃ ▁paññāp e ssatīti net aṃ ▁ṭhānaṃ ▁vijjati
PA_mn_18:18.4	Saññāpaññattiyā asati vitakkapaññattiṁ paññāpessatīti—netaṁ ṭhānaṁ vijjati.	▁saññā paññatti yā ▁asati ▁vitakk a paññatti ṃ ▁paññāp e ssatīti net aṃ ▁ṭhānaṃ ▁vijjati
PA_mn_18:18.5	Vitakkapaññattiyā asati papañcasaññāsaṅkhāsamudācaraṇapaññattiṁ paññāpessatīti—netaṁ ṭhānaṁ vijjati.	▁vitakk a paññatti yā ▁asati ▁pa pañc asaññā saṃ kh ā sa mud ā caraṇ a paññatti ṃ ▁paññāp e ssatīti net aṃ ▁ṭhānaṃ ▁vijjati
PA_mn_18:18.6	So vatāvuso, sotasmiṁ asati sadde asati …pe…	▁so ▁vat āvuso ▁sota smiṃ ▁asati ▁sadd e ▁asati ▁pe
PA_mn_18:18.7	ghānasmiṁ asati gandhe asati …pe…	▁ghān asmiṃ ▁asati ▁gandh e ▁asati ▁pe
PA_mn_18:18.8	jivhāya asati rase asati …pe…	▁jivhā ya ▁asati ▁ras e ▁asati ▁pe
PA_mn_18:18.9	kāyasmiṁ asati phoṭṭhabbe asati …pe…	▁kāy asmiṃ ▁asati ▁phoṭṭhabb e ▁asati ▁pe
PA_mn_18:18.10	manasmiṁ asati dhamme asati manoviññāṇe asati phassapaññattiṁ paññāpessatīti—netaṁ ṭhānaṁ vijjati.	▁man asmiṃ ▁asati ▁dhamme ▁asati ▁mano viññāṇ e ▁asati ▁phass a paññatti ṃ ▁paññāp e ssatīti net aṃ ▁ṭhānaṃ ▁vijjati
PA_mn_18:18.11	Phassapaññattiyā asati vedanāpaññattiṁ paññāpessatīti—netaṁ ṭhānaṁ vijjati.	▁phass a paññatti yā ▁asati ▁vedanā paññatti ṃ ▁paññāp e ssatīti net aṃ ▁ṭhānaṃ ▁vijjati
PA_mn_18:18.12	Vedanāpaññattiyā asati saññāpaññattiṁ paññāpessatīti—netaṁ ṭhānaṁ vijjati.	▁vedanā paññatti yā ▁asati ▁saññā paññatti ṃ ▁paññāp e ssatīti net aṃ ▁ṭhānaṃ ▁vijjati
PA_mn_18:18.13	Saññāpaññattiyā asati vitakkapaññattiṁ paññāpessatīti—netaṁ ṭhānaṁ vijjati.	▁saññā paññatti yā ▁asati ▁vitakk a paññatti ṃ ▁paññāp e ssatīti net aṃ ▁ṭhānaṃ ▁vijjati
PA_mn_18:18.14	Vitakkapaññattiyā asati papañcasaññāsaṅkhāsamudācaraṇapaññattiṁ paññāpessatīti—netaṁ ṭhānaṁ vijjati.	▁vitakk a paññatti yā ▁asati ▁pa pañc asaññā saṃ kh ā sa mud ā caraṇ a paññatti ṃ ▁paññāp e ssatīti net aṃ ▁ṭhānaṃ ▁vijjati
PA_mn_18:19.1	Yaṁ kho no, āvuso, bhagavā saṅkhittena uddesaṁ uddisitvā vitthārena atthaṁ avibhajitvā uṭṭhāyāsanā vihāraṁ paviṭṭho:	▁yaṃ ▁kho ▁no ▁āvuso ▁bhagavā ▁saṃkhitt ena ▁uddes aṃ ▁uddis itvā ▁vitthār ena ▁atthaṃ ▁avi bha j itvā ▁uṭṭhāyāsanā ▁vihār aṃ ▁paviṭṭh o
PA_mn_18:19.2	‘yatonidānaṁ, bhikkhu, purisaṁ papañcasaññāsaṅkhā samudācaranti ettha ce natthi abhinanditabbaṁ abhivaditabbaṁ ajjhositabbaṁ esevanto rāgānusayānaṁ …pe…	▁yato nidān aṃ ▁bhikkhu ▁puris aṃ ▁pa pañc asaññā saṃ kh ā ▁samu dā ca r anti ▁ettha ▁ce ▁natthi ▁abhinand itabbaṃ ▁abhi va d itabbaṃ ▁ajjh o s itabbaṃ ▁eseva nt o ▁rāg ānusay ānaṃ ▁pe
PA_mn_18:19.3_0	etthete pāpakā akusalā dhammā aparisesā nirujjhantī’ti, imassa kho ahaṁ, āvuso, bhagavatā	▁ e tth e te ▁pāpak ā ▁akusalā ▁dhammā ▁apari ses ā ▁ni ru jjh antīti ▁imassa ▁kho ▁ahaṃ ▁āvuso ▁bhagavatā
PA_mn_18:19.3_1	saṅkhittena uddesassa uddiṭṭhassa vitthārena atthaṁ avibhattassa evaṁ vitthārena atthaṁ ājānāmi.	▁saṃkhitt ena ▁uddes assa ▁ud diṭṭh assa ▁vitthār ena ▁atthaṃ ▁a vibhatt assa ▁evaṃ ▁vitthār ena ▁atthaṃ ▁ ā jān āmi
PA_mn_18:19.4	Ākaṅkhamānā ca pana tumhe āyasmanto bhagavantaṁyeva upasaṅkamitvā etamatthaṁ paṭipuccheyyātha.	▁ākaṃkh amānā ▁ca ▁pana ▁tumhe ▁āyasmant o ▁bhagavantaṃ yeva ▁upasaṃkamitvā ▁etamatthaṃ ▁paṭi pucch eyyātha
PA_mn_18:19.5	Yathā vo bhagavā byākaroti tathā naṁ dhāreyyāthā”ti.	▁yathā ▁vo ▁bhagavā ▁byākar oti ▁tathā ▁naṃ ▁dhār eyyā thāti
PA_mn_18:20.1_0	Atha kho te bhikkhū āyasmato mahākaccānassa bhāsitaṁ abhinanditvā anumoditvā uṭṭhāyāsanā	▁atha ▁kho ▁te ▁bhikkhū ▁āyasmato ▁mahā ka cc ān assa ▁bhāsitaṃ ▁abhinand itvā ▁anu mod itvā ▁uṭṭhāyāsanā
PA_mn_18:20.1_1	yena bhagavā tenupasaṅkamiṁsu; upasaṅkamitvā bhagavantaṁ abhivādetvā ekamantaṁ nisīdiṁsu.	▁yena ▁bhagavā ▁tenupasaṃkami ṃ su ▁upasaṃkamitvā ▁bhagavantaṃ ▁abhivādetvā ▁ekamantaṃ ▁nisīd iṃsu
PA_mn_18:20.1_2	Ekamantaṁ nisinnā kho te bhikkhū bhagavantaṁ etadavocuṁ:	▁ekamantaṃ ▁nisinn ā ▁kho ▁te ▁bhikkhū ▁bhagavantaṃ ▁et a da vo cu ṃ
PA_mn_18:20.2	“yaṁ kho no, bhante, bhagavā saṅkhittena uddesaṁ uddisitvā vitthārena atthaṁ avibhajitvā uṭṭhāyāsanā vihāraṁ paviṭṭho:	▁yaṃ ▁kho ▁no ▁bhante ▁bhagavā ▁saṃkhitt ena ▁uddes aṃ ▁uddis itvā ▁vitthār ena ▁atthaṃ ▁avi bha j itvā ▁uṭṭhāyāsanā ▁vihār aṃ ▁paviṭṭh o
PA_mn_18:20.3	‘yatonidānaṁ, bhikkhu, purisaṁ papañcasaññāsaṅkhā samudācaranti.	▁yato nidān aṃ ▁bhikkhu ▁puris aṃ ▁pa pañc asaññā saṃ kh ā ▁samu dā ca r anti
PA_mn_18:20.4	Ettha ce natthi abhinanditabbaṁ abhivaditabbaṁ ajjhositabbaṁ.	▁ettha ▁ce ▁natthi ▁abhinand itabbaṃ ▁abhi va d itabbaṃ ▁ajjh o s itabbaṃ
PA_mn_18:20.5	Esevanto rāgānusayānaṁ …pe…	▁eseva nt o ▁rāg ānusay ānaṃ ▁pe
PA_mn_18:20.6	etthete pāpakā akusalā dhammā aparisesā nirujjhantī’ti.	▁ e tth e te ▁pāpak ā ▁akusalā ▁dhammā ▁apari ses ā ▁ni ru jjh antīti
PA_mn_18:20.7	Tesaṁ no, bhante, amhākaṁ acirapakkantassa bhagavato etadahosi:	▁tesaṃ ▁no ▁bhante ▁amhākaṃ ▁acir a pakk antassa ▁bhagavato ▁etadahosi
PA_mn_18:20.8	‘idaṁ kho no, āvuso, bhagavā saṅkhittena uddesaṁ uddisitvā vitthārena atthaṁ avibhajitvā uṭṭhāyāsanā vihāraṁ paviṭṭho:	▁idaṃ ▁kho ▁no ▁āvuso ▁bhagavā ▁saṃkhitt ena ▁uddes aṃ ▁uddis itvā ▁vitthār ena ▁atthaṃ ▁avi bha j itvā ▁uṭṭhāyāsanā ▁vihār aṃ ▁paviṭṭh o
PA_mn_18:20.9	“yatonidānaṁ, bhikkhu, purisaṁ papañcasaññāsaṅkhā samudācaranti.	▁yato nidān aṃ ▁bhikkhu ▁puris aṃ ▁pa pañc asaññā saṃ kh ā ▁samu dā ca r anti
PA_mn_18:20.10	Ettha ce natthi abhinanditabbaṁ abhivaditabbaṁ ajjhositabbaṁ.	▁ettha ▁ce ▁natthi ▁abhinand itabbaṃ ▁abhi va d itabbaṃ ▁ajjh o s itabbaṃ
PA_mn_18:20.11_0	Esevanto rāgānusayānaṁ, esevanto paṭighānusayānaṁ, esevanto diṭṭhānusayānaṁ, esevanto	▁eseva nt o ▁rāg ānusay ānaṃ ▁eseva nt o ▁paṭighānusay ānaṃ ▁eseva nt o ▁diṭṭhānusay ānaṃ ▁eseva nt o
PA_mn_18:20.11_1	vicikicchānusayānaṁ, esevanto mānānusayānaṁ, esevanto bhavarāgānusayānaṁ, esevanto	▁vicikicchānusay ānaṃ ▁eseva nt o ▁mānānusay ānaṃ ▁eseva nt o ▁bhavarāgānusay ānaṃ ▁eseva nt o
PA_mn_18:20.11_2	avijjānusayānaṁ, esevanto daṇḍādānasatthādānakalahaviggahavivādatuvaṁtuvaṁpesuññamusāvādānaṁ.	▁avijjānusay ānaṃ ▁eseva nt o ▁daṇḍ ā dān a satth ā dān aka la ha viggah avi vād atu v aṃ tu v aṃ pe suññ amu sā vād ānaṃ
PA_mn_18:20.12	Etthete pāpakā akusalā dhammā aparisesā nirujjhantī”ti.	▁ e tth e te ▁pāpak ā ▁akusalā ▁dhammā ▁apari ses ā ▁ni ru jjh antīti
PA_mn_18:20.13	Ko nu kho imassa bhagavatā saṅkhittena uddesassa uddiṭṭhassa vitthārena atthaṁ avibhattassa vitthārena atthaṁ vibhajeyyā’ti?	▁ko ▁nu ▁kho ▁imassa ▁bhagavatā ▁saṃkhitt ena ▁uddes assa ▁ud diṭṭh assa ▁vitthār ena ▁atthaṃ ▁a vibhatt assa ▁vitthār ena ▁atthaṃ ▁vibhaj eyyāti
PA_mn_18:20.14	Tesaṁ no, bhante, amhākaṁ etadahosi:	▁tesaṃ ▁no ▁bhante ▁amhākaṃ ▁etadahosi
PA_mn_18:20.15_0	‘ayaṁ kho āyasmā mahākaccāno satthu ceva saṁvaṇṇito sambhāvito ca viññūnaṁ sabrahmacārīnaṁ,	▁ayaṃ ▁kho ▁āyasmā ▁mahā ka cc ā no ▁satthu ▁ceva ▁saṃ vaṇṇ ito ▁sam bhāv ito ▁ca ▁viññū naṃ ▁sabrahmacārī naṃ
PA_mn_18:20.15_1	pahoti cāyasmā mahākaccāno imassa bhagavatā saṅkhittena uddesassa uddiṭṭhassa vitthārena	▁pah oti ▁cā y asmā ▁mahā ka cc ā no ▁imassa ▁bhagavatā ▁saṃkhitt ena ▁uddes assa ▁ud diṭṭh assa ▁vitthār ena
PA_mn_18:20.15_2	atthaṁ avibhattassa vitthārena atthaṁ vibhajituṁ, yannūna mayaṁ yenāyasmā mahākaccāno	▁atthaṃ ▁a vibhatt assa ▁vitthār ena ▁atthaṃ ▁vibhaj ituṃ ▁ yan n ūn a ▁mayaṃ ▁ye nā y asmā ▁mahā ka cc ā no
PA_mn_18:20.15_3	tenupasaṅkameyyāma; upasaṅkamitvā āyasmantaṁ mahākaccānaṁ etamatthaṁ paṭipuccheyyāmā’ti.	▁te n upasaṃkam eyyā ma ▁upasaṃkamitvā ▁āyasmant aṃ ▁mahā ka cc ānaṃ ▁etamatthaṃ ▁paṭi pucch eyyā m āti
PA_mn_18:20.16	Atha kho mayaṁ, bhante, yenāyasmā mahākaccāno tenupasaṅkamimha; upasaṅkamitvā āyasmantaṁ mahākaccānaṁ etamatthaṁ paṭipucchimha.	▁atha ▁kho ▁mayaṃ ▁bhante ▁ye nā y asmā ▁mahā ka cc ā no ▁tenupasaṃkami mha ▁upasaṃkamitvā ▁āyasmant aṃ ▁mahā ka cc ānaṃ ▁etamatthaṃ ▁paṭi pucch i mha
PA_mn_18:20.17	Tesaṁ no, bhante, āyasmatā mahākaccānena imehi ākārehi imehi padehi imehi byañjanehi attho vibhatto”ti.	▁tesaṃ ▁no ▁bhante ▁ āya s mat ā ▁mahā ka cc ān ena ▁imehi ▁ ākār ehi ▁imehi ▁pad ehi ▁imehi ▁byañjan ehi ▁attho ▁vibhatt oti
PA_mn_18:21.1	“Paṇḍito, bhikkhave, mahākaccāno; mahāpañño, bhikkhave, mahākaccāno.	▁paṇḍit o ▁bhikkhave ▁mahā ka cc ā no ▁mahā pa ññ o ▁bhikkhave ▁mahā ka cc ā no
PA_mn_18:21.2	Mañcepi tumhe, bhikkhave, etamatthaṁ paṭipuccheyyātha, ahampi taṁ evamevaṁ byākareyyaṁ yathā taṁ mahākaccānena byākataṁ.	▁mañc epi ▁tumhe ▁bhikkhave ▁etamatthaṃ ▁paṭi pucch eyyātha ▁ah ampi ▁taṃ ▁evameva ṃ ▁byākar eyyaṃ ▁yathā ▁taṃ ▁mahā ka cc ān ena ▁ byākat aṃ
PA_mn_18:21.3	Eso cevetassa attho. Evañca naṁ dhārethā”ti.	▁eso ▁ce ve t assa ▁attho ▁evañca ▁naṃ ▁dhār e thāti
PA_mn_18:22.1	Evaṁ vutte, āyasmā ānando bhagavantaṁ etadavoca:	▁evaṃ ▁vutte ▁āyasmā ▁ānand o ▁bhagavantaṃ ▁etadavoca
PA_mn_18:22.2	“seyyathāpi, bhante, puriso jighacchādubbalyapareto madhupiṇḍikaṁ adhigaccheyya, so yato yato sāyeyya, labhetheva sādurasaṁ asecanakaṁ.	▁seyyathāpi ▁bhante ▁puriso ▁ ji gh a cchā dubbal ya par e to ▁madhu pi ṇḍ ikaṃ ▁adhi gacch eyya ▁so ▁yato ▁yato ▁sā y eyya ▁labh e t heva ▁sā du ras aṃ ▁as e c an akaṃ
PA_mn_18:22.3	Evameva kho, bhante, cetaso bhikkhu dabbajātiko, yato yato imassa dhammapariyāyassa paññāya atthaṁ upaparikkheyya, labhetheva attamanataṁ, labhetheva cetaso pasādaṁ.	▁evameva ▁kho ▁bhante ▁cetaso ▁bhikkhu ▁dabb ajāti ko ▁yato ▁yato ▁imassa ▁dhamma pariyāy assa ▁paññāya ▁atthaṃ ▁upa par ikkh eyya ▁labh e t heva ▁att aman ataṃ ▁labh e t heva ▁cetaso ▁pasād aṃ
PA_mn_18:22.4	Ko nāmo ayaṁ, bhante, dhammapariyāyo”ti?	▁ko ▁nām o ▁ayaṃ ▁bhante ▁dhamma pariyāy oti
PA_mn_18:22.5	“Tasmātiha tvaṁ, ānanda, imaṁ dhammapariyāyaṁ madhupiṇḍikapariyāyotveva naṁ dhārehī”ti.	▁tasmā ti ha ▁tvaṃ ▁ānanda ▁imaṃ ▁dhamma pariyāy aṃ ▁madhu pi ṇḍ ika pariyāy o tveva ▁naṃ ▁dhār ehīti
PA_mn_18:22.6	Idamavoca bhagavā.	▁idam a vo ca ▁bhagavā
PA_mn_18:22.7	Attamano āyasmā ānando bhagavato bhāsitaṁ abhinandīti.	▁att aman o ▁āyasmā ▁ānand o ▁bhagavato ▁bhāsitaṃ ▁abhinand īti
PA_mn_18:22.8	Madhupiṇḍikasuttaṁ niṭṭhitaṁ aṭṭhamaṁ.	▁madhu pi ṇḍ ika sutt aṃ ▁niṭṭhitaṃ ▁aṭṭham aṃ
