segmentnr	original	analyzed
PA_mn_28:24.3	Vuttaṁ kho panetaṁ bhagavatā kakacūpamovāde “ubhatodaṇḍakena cepi, bhikkhave, kakacena corā ocarakā aṅgamaṅgāni okanteyyuṁ. Tatrāpi yo mano padūseyya, na me so tena sāsanakaro”ti.	vuttam khaḥ pana itam bhagavatā kakaca upama uvāde ubhatodaṇḍakena ce ipi bhikkhave kakacena corāḥ ocarakāḥ aṅgam aṅgāni tatra api yaḥ manaḥ padūseyya na me saḥ tena sāsana karoti 
PA_mn_28:24.4	Āraddhaṁ kho pana me vīriyaṁ bhavissati asallīnaṁ, upaṭṭhitā sati asammuṭṭhā, passaddho kāyo asāraddho, samāhitaṁ cittaṁ ekaggaṁ.	āraddham kho pana me vīriyam bhavissati a sallīna upaṭṭhitā sati a sammuṭṭhā passaddhaḥ kāyaḥ a sāraddhaḥ samāhitam cittam ekagga 
PA_mn_28:24.5	Kāmaṁ dāni imasmiṁ kāye pāṇisamphassāpi kamantu, leḍḍusamphassāpi kamantu, daṇḍasamphassāpi kamantu, satthasamphassāpi kamantu. Karīyati hidaṁ buddhānaṁ sāsanan’ti.	kāmam dāni imasmin kāye pāṇi samphassā api kamantu leḍḍu samphassā api kamantu daṇḍa samphassā api kamantu sattha samphassā api kamantu karīyati hi dam buddhānam sāsanam ti 
PA_mn_28:25.1	Tassa ce, āvuso, bhikkhuno evaṁ buddhaṁ anussarato, evaṁ dhammaṁ anussarato, evaṁ saṅghaṁ anussarato upekkhā kusalanissitā na saṇṭhāti.	tassa ce āvuso bhikkhuno evam buddham anussarataḥ evam dhammam anussarataḥ evam saṅgham anussarataḥ upekkhā kusala nissitā na saṇṭhāti 
PA_mn_28:25.2	So tena saṁvijjati saṁvegaṁ āpajjati:	saḥ tena sa vijjati sa vegam āpajjati 
PA_mn_28:25.3	‘alābhā vata me, na vata me lābhā; dulladdhaṁ vata me, na vata me suladdhaṁ.	alābhāḥ vata me na vata me lābhāḥ dulladdham vata me na vata me su laddha 
PA_mn_28:25.4	Yassa me evaṁ buddhaṁ anussarato, evaṁ dhammaṁ anussarato, evaṁ saṅghaṁ anussarato upekkhā kusalanissitā na saṇṭhātī’ti.	yassa me evam buddham anussarataḥ evam dhammam anussarataḥ evam saṅgham anussarataḥ upekkhā kusala nissitā na saṇṭhāti iti 
PA_mn_28:25.5	Seyyathāpi, āvuso, suṇisā sasuraṁ disvā saṁvijjati saṁvegaṁ āpajjati;	sā iyyathā api āvuso su nisā sa suram disvā sa vijjati sa vegam āpajjati 
PA_mn_28:25.6	evameva kho, āvuso, tassa ce bhikkhuno evaṁ buddhaṁ anussarato, evaṁ dhammaṁ anussarato, evaṁ saṅghaṁ anussarato, upekkhā kusalanissitā na saṇṭhāti.	evam eva kho āvuso tassa ce bhikkhuno evam buddham anussarataḥ evam dhammam anussarataḥ evam saṅgham anussarataḥ upekkhā kusala nissitā na saṇṭhāti 
PA_mn_28:25.7	So tena saṁvijjati saṁvegaṁ āpajjati:	saḥ tena sa vijjati sa vegam āpajjati 
PA_mn_28:25.8	‘alābhā vata me, na vata me lābhā; dulladdhaṁ vata me, na vata me suladdhaṁ.	alābhāḥ vata me na vata me lābhāḥ dulladdham vata me na vata me su laddha 
PA_mn_28:25.9	Yassa me evaṁ buddhaṁ anussarato, evaṁ dhammaṁ anussarato, evaṁ saṅghaṁ anussarato, upekkhā kusalanissitā na saṇṭhātī’ti.	yassa me evam buddham anussarataḥ evam dhammam anussarataḥ evam saṅgham anussarataḥ upekkhā kusala nissitā na saṇṭhāti iti 
PA_mn_28:25.10	Tassa ce, āvuso, bhikkhuno evaṁ buddhaṁ anussarato, evaṁ dhammaṁ anussarato, evaṁ saṅghaṁ anussarato, upekkhā kusalanissitā saṇṭhāti, so tena attamano hoti.	tassa ce āvuso bhikkhuno evam buddham anussarataḥ evam dhammam anussarataḥ evam saṅgham anussarataḥ upekkhā kusala nissitā saṇṭhāti saḥ tena atta manaḥ hoti 
PA_mn_28:25.11	Ettāvatāpi kho, āvuso, bhikkhuno bahukataṁ hoti.	ettāvatā api kho āvuso bhikkhunaḥ bahu katam hoti 
PA_mn_28:26.1	Seyyathāpi, āvuso, kaṭṭhañca paṭicca valliñca paṭicca tiṇañca paṭicca mattikañca paṭicca ākāso parivārito agārantveva saṅkhaṁ gacchati;	seyyathā api āvuso kaṭṭham ca paṭicca valliñca paṭicca tiṇam ca paṭicca mattikam ca paṭicca ākāsaḥ parivāritaḥ saṅkham gacchati 
PA_mn_28:26.2	evameva kho, āvuso, aṭṭhiñca paṭicca nhāruñca paṭicca maṁsañca paṭicca cammañca paṭicca ākāso parivārito rūpantveva saṅkhaṁ gacchati.	evam eva kho āvuso aṭṭhiñca paṭicca nhāruñca paṭicca masañca paṭicca cammañca paṭicca ākāsaḥ parivāritaḥ rūpam tu eva saṅkham gacchati 
PA_mn_28:27.1	Ajjhattikañceva, āvuso, cakkhuṁ aparibhinnaṁ hoti, bāhirā ca rūpā na āpāthaṁ āgacchanti, no ca tajjo samannāhāro hoti, neva tāva tajjassa viññāṇabhāgassa pātubhāvo hoti.	ajjhattikam ca iva āvuso cakkhum a paribhinnam hoti bāhirā ca rūpā na āpātham āgacchanti no ca tajjaḥ samannāhāro hoti na iva tāva tajjassa viññāṇa bhāgassa pātubhāvaḥ hoti 
PA_mn_28:27.2	Ajjhattikañceva, āvuso, cakkhuṁ aparibhinnaṁ hoti bāhirā ca rūpā āpāthaṁ āgacchanti, no ca tajjo samannāhāro hoti, neva tāva tajjassa viññāṇabhāgassa pātubhāvo hoti.	ajjhattikam ca iva āvuso cakkhum a paribhinnam hoti bāhirā ca rūpā āpātham āgacchanti no ca tad jo samannāhāraḥ hoti na iva tāva tad jassa viññāṇa bhāgassa pātubhāvaḥ hoti 
PA_mn_28:27.3	Yato ca kho, āvuso, ajjhattikañceva cakkhuṁ aparibhinnaṁ hoti, bāhirā ca rūpā āpāthaṁ āgacchanti, tajjo ca samannāhāro hoti. Evaṁ tajjassa viññāṇabhāgassa pātubhāvo hoti.	yatas ca kho āvuso ajjhattikam ca iva cakkhum a paribhinnam hoti bāhirā ca rūpā āpātham āgacchanti tad jo ca samannāhāraḥ hoti evam tad jassa viññāṇa bhāgassa pātubhāvaḥ hoti 
PA_mn_28:28.1_0	Yaṁ tathābhūtassa rūpaṁ taṁ rūpupādānakkhandhe saṅgahaṁ gacchati, yā tathābhūtassa	yam tathābhūtassa rūpam tam rūpa upādāna kkhandhe saṅgaham gacchati yā tathābhūtassa 
PA_mn_28:28.1_1	vedanā sā vedanupādānakkhandhe saṅgahaṁ gacchati, yā tathābhūtassa saññā sā saññupādānakkhandhe	vedanā sā vedanā upādāna kkhandhe saṅgaham gacchati yā tathābhūtassa saññā sā saññā upādāna kkhandhe 
PA_mn_28:28.1_2	saṅgahaṁ gacchati, ye tathābhūtassa saṅkhārā te saṅkhārupādānakkhandhe saṅgahaṁ gacchanti,	saṅgaham gacchati ye tathābhūtassa saṅkhārā te saṅkhāra upādāna khandhe saṅgaham gacchanti 
PA_mn_28:28.1_3	yaṁ tathābhūtassa viññāṇaṁ taṁ viññāṇupādānakkhandhe saṅgahaṁ gacchati.	yam tathābhūtassa viññāṇam tam viññāṇa upādāna khandhe saṅgaham gacchati 
PA_mn_28:28.2	So evaṁ pajānāti:	saḥ evam pajānāti 
PA_mn_28:28.3	‘evañhi kira imesaṁ pañcannaṁ upādānakkhandhānaṁ saṅgaho sannipāto samavāyo hoti.	evam hi kira imesam pañcannam upādānakkhandhānam saṅgahaḥ sannipātaḥ samavāyaḥ hoti 
PA_mn_28:28.4	Vuttaṁ kho panetaṁ bhagavatā:	vuttam kho pana itam bhagavatā 
PA_mn_28:28.5	“yo paṭiccasamuppādaṁ passati so dhammaṁ passati;	yaḥ paṭiccasamuppādam passati so dhammam passati 
PA_mn_28:28.6	yo dhammaṁ passati so paṭiccasamuppādaṁ passatī”ti.	yaḥ dhammam passati so paṭiccasamuppādam passati iti 
PA_mn_28:28.7	Paṭiccasamuppannā kho panime yadidaṁ pañcupādānakkhandhā.	paṭicca samuppannā kho panime yat idam pañca upādāna khandhā 
PA_mn_28:28.8	Yo imesu pañcasu upādānakkhandhesu chando ālayo anunayo ajjhosānaṁ so dukkhasamudayo.	yaḥ imesu pañcasu upādānakkhandhesu chandaḥ ālayaḥ anunayaḥ ajjhosānam saḥ dukkha samudayo 
PA_mn_28:28.9	Yo imesu pañcasu upādānakkhandhesu chandarāgavinayo chandarāgappahānaṁ, so dukkhanirodho’ti.	yaḥ imesu pañcasu upādānakkhandhesu chanda rāga vinayaḥ chanda rāga ppahāna saḥ dukkha nirodho ti 
PA_mn_28:28.10	Ettāvatāpi kho, āvuso, bhikkhuno bahukataṁ hoti.	ettāvatā api kho āvuso bhikkhunaḥ bahu katam hoti 
PA_mn_28:29-30.1	Ajjhattikañceva, āvuso, sotaṁ aparibhinnaṁ hoti …pe…	ajjhattikam ca iva āvuso sotam a paribhinnam hoti pe 
PA_mn_28:31-32.1	ghānaṁ aparibhinnaṁ hoti …	ghānam a paribhinnam hoti 
PA_mn_28:33-34.1	jivhā aparibhinnā hoti …	jivhā a paribhinnā hoti 
PA_mn_28:35-36.1	kāyo aparibhinno hoti …	kāyaḥ a paribhinnaḥ hoti 
PA_mn_28:37.1	mano aparibhinno hoti, bāhirā ca dhammā na āpāthaṁ āgacchanti no ca tajjo samannāhāro hoti, neva tāva tajjassa viññāṇabhāgassa pātubhāvo hoti.	manaḥ a paribhinnaḥ hoti bāhirā ca dhammā na āpātham āgacchanti no ca tajjo samannāhāro hoti na iva tāva tajjassa viññāṇa bhāgassa pātubhāvaḥ hoti 
PA_mn_28:38.1	Ajjhattiko ceva, āvuso, mano aparibhinno hoti, bāhirā ca dhammā āpāthaṁ āgacchanti, no ca tajjo samannāhāro hoti, neva tāva tajjassa viññāṇabhāgassa pātubhāvo hoti.	ajjhattikaḥ ca iva āvuso manaḥ a paribhinnaḥ hoti bāhirā ca dhammā āpātham āgacchanti no ca tajjo samannāhāro hoti na iva tāva tajjassa viññāṇa bhāgassa pātubhāvaḥ hoti 
PA_mn_28:38.2	Yato ca kho, āvuso, ajjhattiko ceva mano aparibhinno hoti, bāhirā ca dhammā āpāthaṁ āgacchanti, tajjo ca samannāhāro hoti, evaṁ tajjassa viññāṇabhāgassa pātubhāvo hoti.	yatas ca kho āvuso ajjhattikaḥ ca iva manaḥ a paribhinnaḥ hoti bāhirā ca dhammā āpātham āgacchanti tad jo ca samannāhāraḥ hoti evam tad jassa viññāṇa bhāgassa pātubhāvaḥ hoti 
PA_mn_28:38.3_0	Yaṁ tathābhūtassa rūpaṁ taṁ rūpupādānakkhandhe saṅgahaṁ gacchati, yā tathābhūtassa	yam tathābhūtassa rūpam tam rūpa upādāna kkhandhe saṅgaham gacchati yā tathābhūtassa 
PA_mn_28:38.3_1	vedanā sā vedanupādānakkhandhe saṅgahaṁ gacchati, yā tathābhūtassa saññā sā saññupādānakkhandhe	vedanā sā vedanā upādāna kkhandhe saṅgaham gacchati yā tathābhūtassa saññā sā saññā upādāna kkhandhe 
PA_mn_28:38.3_2	saṅgahaṁ gacchati, ye tathābhūtassa saṅkhārā te saṅkhārupādānakkhandhe saṅgahaṁ gacchanti,	saṅgaham gacchati ye tathābhūtassa saṅkhārā te saṅkhāra upādāna khandhe saṅgaham gacchanti 
PA_mn_28:38.3_3	yaṁ tathābhūtassa viññāṇaṁ taṁ viññāṇupādānakkhandhe saṅgahaṁ gacchati.	yam tathābhūtassa viññāṇam tam viññāṇa upādāna khandhe saṅgaham gacchati 
PA_mn_28:38.4	So evaṁ pajānāti:	saḥ evam pajānāti 
PA_mn_28:38.5	‘evañhi kira imesaṁ pañcannaṁ upādānakkhandhānaṁ saṅgaho sannipāto samavāyo hoti.	evam hi kira imesam pañcannam upādānakkhandhānam saṅgahaḥ sannipātaḥ samavāyaḥ hoti 
PA_mn_28:38.6	Vuttaṁ kho panetaṁ bhagavatā:	vuttam kho pana itam bhagavatā 
PA_mn_28:38.7	“yo paṭiccasamuppādaṁ passati so dhammaṁ passati;	yaḥ paṭiccasamuppādam passati so dhammam passati 
PA_mn_28:38.8	yo dhammaṁ passati so paṭiccasamuppādaṁ passatī”ti.	yaḥ dhammam passati so paṭiccasamuppādam passati iti 
PA_mn_28:38.9	Paṭiccasamuppannā kho panime yadidaṁ pañcupādānakkhandhā.	paṭicca samuppannā kho panime yat idam pañca upādāna khandhā 
PA_mn_28:38.10	Yo imesu pañcasu upādānakkhandhesu chando ālayo anunayo ajjhosānaṁ so dukkhasamudayo.	yaḥ imesu pañcasu upādānakkhandhesu chandaḥ ālayaḥ anunayaḥ ajjhosānam saḥ dukkha samudayo 
PA_mn_28:38.11	Yo imesu pañcasu upādānakkhandhesu chandarāgavinayo chandarāgappahānaṁ so dukkhanirodho’ti.	yaḥ imesu pañcasu upādānakkhandhesu chanda rāga vinayaḥ chanda rāga ppahānam saḥ dukkha nirodho ti 
PA_mn_28:38.12	Ettāvatāpi kho, āvuso, bhikkhuno bahukataṁ hotī”ti.	ettāvatā api kho āvuso bhikkhunaḥ bahu katam hoti iti 
PA_mn_28:38.13	Idamavoca āyasmā sāriputto.	idam avocaḥ āyasmā sāriputto 
PA_mn_28:38.14	Attamanā te bhikkhū āyasmato sāriputtassa bhāsitaṁ abhinandunti.	attamanāḥ te bhikkhū āyasmataḥ sāriputtassa bhāsitam abhinandunti 
PA_mn_28:38.15	Mahāhatthipadopamasuttaṁ niṭṭhitaṁ aṭṭhamaṁ.	mahāhatthipadopama suttam niṭṭhitam aṭṭhama 
