segmentnr	original	analyzed
PA_mil_6.2.5:0.1	Milindapañha	▁mi l ind a pañh a
PA_mil_6.2.5:0.2	Anumānapañha	▁anu mān a pañh a
PA_mil_6.2.5:0.3	Nippapañcavagga	▁ni ppa pañc avagga
PA_mil_6.2.5:0.4	5. Akammajādipañha	▁ akamm a j ādi pañh a
PA_mil_6.2.5:1.1	“Bhante nāgasena, dissanti loke kammanibbattā, dissanti hetunibbattā, dissanti utunibbattā, yaṁ loke akammajaṁ ahetujaṁ anutujaṁ, taṁ me kathehī”ti.	▁bhante ▁nāgasena ▁d issanti ▁loke ▁kamma nibbatt ā ▁d issanti ▁hetu nibbatt ā ▁d issanti ▁utu nibbatt ā ▁yaṃ ▁loke ▁ akamm a j aṃ ▁ ahetu j aṃ ▁anu tu j aṃ ▁taṃ ▁me ▁kath ehīti
PA_mil_6.2.5:1.2	“Dveme, mahārāja, lokasmiṁ akammajā ahetujā anutujā.	▁dve me ▁mahārāja ▁lok asmiṃ ▁ akamm a j ā ▁ ahetu j ā ▁anu tu j ā
PA_mil_6.2.5:1.3	Katame dve?	▁katame ▁dve
PA_mil_6.2.5:1.4	Ākāso, mahārāja, akammajo ahetujo anutujo;	▁ākās o ▁mahārāja ▁ akamm a j o ▁ ahetu j o ▁anu tu j o
PA_mil_6.2.5:1.5	nibbānaṁ, mahārāja, akammajaṁ ahetujaṁ anutujaṁ.	▁nibbānaṃ ▁mahārāja ▁ akamm a j aṃ ▁ ahetu j aṃ ▁anu tu j aṃ
PA_mil_6.2.5:1.6	Ime kho, mahārāja, dve akammajā ahetujā anutujā”ti.	▁ime ▁kho ▁mahārāja ▁dve ▁ akamm a j ā ▁ ahetu j ā ▁anu tu j āti
PA_mil_6.2.5:2.1	“Mā, bhante nāgasena, jinavacanaṁ makkhehi, mā ajānitvā pañhaṁ byākarohī”ti.	▁mā ▁bhante ▁nāgasena ▁jin avacanaṃ ▁ makkh ehi ▁mā ▁a jān itvā ▁pañh aṃ ▁byākar o hīti
PA_mil_6.2.5:2.2	“Kiṁ kho, mahārāja, ahaṁ vadāmi, yaṁ maṁ tvaṁ evaṁ vadesi ‘mā, bhante nāgasena, jinavacanaṁ makkhehi, mā ajānitvā pañhaṁ byākarohī’”ti?	▁kiṃ ▁kho ▁mahārāja ▁ahaṃ ▁vadāmi ▁yaṃ ▁maṃ ▁tvaṃ ▁evaṃ ▁vad esi ▁mā ▁bhante ▁nāgasena ▁jin avacanaṃ ▁ makkh ehi ▁mā ▁a jān itvā ▁pañh aṃ ▁byākar o hīti
PA_mil_6.2.5:2.3	“Bhante nāgasena, yuttamidaṁ tāva vattuṁ ‘ākāso akammajo ahetujo anutujo’ti.	▁bhante ▁nāgasena ▁yutt amid aṃ ▁tāva ▁vattuṃ ▁ākās o ▁ akamm a j o ▁ ahetu j o ▁anu tu j oti
PA_mil_6.2.5:2.4	Anekasatehi pana, bhante nāgasena, kāraṇehi bhagavatā sāvakānaṁ nibbānassa sacchikiriyāya maggo akkhāto, atha ca pana tvaṁ evaṁ vadesi ‘ahetujaṁ nibbānan’”ti.	▁aneka sat ehi ▁pana ▁bhante ▁nāgasena ▁kāraṇ ehi ▁bhagavatā ▁ sāvak ānaṃ ▁nibbān assa ▁ sacchikiriy āya ▁maggo ▁akkh ā to ▁atha ▁ca ▁pana ▁tvaṃ ▁evaṃ ▁vad esi ▁ ahetu j aṃ ▁nibbān anti
PA_mil_6.2.5:2.5	“Saccaṁ, mahārāja, bhagavatā anekasatehi kāraṇehi sāvakānaṁ nibbānassa sacchikiriyāya maggo akkhāto, na ca pana nibbānassa uppādāya hetu akkhāto”ti.	▁saccaṃ ▁mahārāja ▁bhagavatā ▁aneka sat ehi ▁kāraṇ ehi ▁ sāvak ānaṃ ▁nibbān assa ▁ sacchikiriy āya ▁maggo ▁akkh ā to ▁na ▁ca ▁pana ▁nibbān assa ▁uppād āya ▁hetu ▁akkh ā to ti
PA_mil_6.2.5:3.1_0	“Ettha mayaṁ, bhante nāgasena, andhakārato andhakārataraṁ pavisāma, vanato vanataraṁ	▁ettha ▁mayaṃ ▁bhante ▁nāgasena ▁a ndhakār ato ▁a ndhakār atar aṃ ▁pavis āma ▁van ato ▁van atar aṃ
PA_mil_6.2.5:3.1_1	pavisāma, gahanato gahanataraṁ pavisāma, yatra hi nāma nibbānassa sacchikiriyāya	▁pavis āma ▁gah anato ▁gah an atar aṃ ▁pavis āma ▁yat ra ▁hi ▁nāma ▁nibbān assa ▁ sacchikiriy āya
PA_mil_6.2.5:3.1_2	hetu atthi, tassa pana dhammassa uppādāya hetu natthi.	▁hetu ▁atthi ▁tassa ▁pana ▁dhammassa ▁uppād āya ▁hetu ▁natthi
PA_mil_6.2.5:3.2	Yadi, bhante nāgasena, nibbānassa sacchikiriyāya hetu atthi, tena hi nibbānassa uppādāyapi hetu icchitabbo.	▁yadi ▁bhante ▁nāgasena ▁nibbān assa ▁ sacchikiriy āya ▁hetu ▁atthi ▁tena ▁hi ▁nibbān assa ▁uppād āya pi ▁hetu ▁icch itabbo
PA_mil_6.2.5:4.1	Yathā pana, bhante nāgasena, puttassa pitā atthi, tena kāraṇena pitunopi pitā icchitabbo.	▁yathā ▁pana ▁bhante ▁nāgasena ▁putt assa ▁pitā ▁atthi ▁tena ▁kāraṇena ▁pitu no pi ▁pitā ▁icch itabbo
PA_mil_6.2.5:4.2	Yathā antevāsikassa ācariyo atthi, tena kāraṇena ācariyassapi ācariyo icchitabbo.	▁yathā ▁antevāsik assa ▁ācariy o ▁atthi ▁tena ▁kāraṇena ▁ācariy assa pi ▁ācariy o ▁icch itabbo
PA_mil_6.2.5:4.3	Yathā aṅkurassa bījaṁ atthi, tena kāraṇena bījassapi bījaṁ icchitabbaṁ.	▁yathā ▁ aṃ ku r assa ▁bīj aṃ ▁atthi ▁tena ▁kāraṇena ▁bīj assa pi ▁bīj aṃ ▁icch itabbaṃ
PA_mil_6.2.5:4.4	Evameva kho, bhante nāgasena, yadi nibbānassa sacchikiriyāya hetu atthi, tena kāraṇena nibbānassa uppādāyapi hetu icchitabbo.	▁evameva ▁kho ▁bhante ▁nāgasena ▁yadi ▁nibbān assa ▁ sacchikiriy āya ▁hetu ▁atthi ▁tena ▁kāraṇena ▁nibbān assa ▁uppād āya pi ▁hetu ▁icch itabbo
PA_mil_6.2.5:5.1	Yathā rukkhassa vā latāya vā agge sati tena kāraṇena majjhampi atthi, mūlampi atthi.	▁yathā ▁rukkh assa ▁vā ▁ l atāya ▁vā ▁agg e ▁sati ▁tena ▁kāraṇena ▁ majjh ampi ▁atthi ▁mūl ampi ▁atthi
PA_mil_6.2.5:5.2	Evameva kho, bhante nāgasena, yadi nibbānassa sacchikiriyāya hetu atthi, tena kāraṇena nibbānassa uppādāyapi hetu icchitabbo”ti.	▁evameva ▁kho ▁bhante ▁nāgasena ▁yadi ▁nibbān assa ▁ sacchikiriy āya ▁hetu ▁atthi ▁tena ▁kāraṇena ▁nibbān assa ▁uppād āya pi ▁hetu ▁icch itabbo ti
PA_mil_6.2.5:6.1	“Anuppādanīyaṁ, mahārāja, nibbānaṁ, tasmā na nibbānassa uppādāya hetu akkhāto”ti.	▁anuppād anīy aṃ ▁mahārāja ▁nibbānaṃ ▁tasmā ▁na ▁nibbān assa ▁uppād āya ▁hetu ▁akkh ā to ti
PA_mil_6.2.5:6.2	“Iṅgha, bhante nāgasena, kāraṇaṁ dassetvā kāraṇena maṁ saññāpehi, yathāhaṁ jāneyyaṁ nibbānassa sacchikiriyāya hetu atthi, nibbānassa uppādāya hetu natthī”ti.	▁ iṃ gh a ▁bhante ▁nāgasena ▁kāraṇaṃ ▁dassetvā ▁kāraṇena ▁maṃ ▁saññā p ehi ▁yathā haṃ ▁jān eyyaṃ ▁nibbān assa ▁ sacchikiriy āya ▁hetu ▁atthi ▁nibbān assa ▁uppād āya ▁hetu ▁natthīti
PA_mil_6.2.5:7.1	“Tena hi, mahārāja, sakkaccaṁ sotaṁ odaha, sādhukaṁ suṇohi, vakkhāmi tattha kāraṇaṁ, sakkuṇeyya, mahārāja, puriso pākatikena balena ito himavantaṁ pabbatarājaṁ upagantun”ti?	▁tena ▁hi ▁mahārāja ▁sakkaccaṃ ▁so taṃ ▁ o dah a ▁sādhu kaṃ ▁suṇ o hi ▁vakkh āmi ▁tattha ▁kāraṇaṃ ▁sak ku ṇ eyya ▁mahārāja ▁puriso ▁ pāk ati k ena ▁bal ena ▁ito ▁himavant aṃ ▁pabbat arāja ṃ ▁upa gantu nti
PA_mil_6.2.5:7.2	“Āma, bhante”ti.	▁āma ▁bhanteti
PA_mil_6.2.5:7.3	“Sakkuṇeyya pana so, mahārāja, puriso pākatikena balena himavantaṁ pabbatarājaṁ idha āharitun”ti?	▁sak ku ṇ eyya ▁pana ▁so ▁mahārāja ▁puriso ▁ pāk ati k ena ▁bal ena ▁himavant aṃ ▁pabbat arāja ṃ ▁idha ▁āhar itunti
PA_mil_6.2.5:7.4	“Na hi, bhante”ti.	▁na ▁hi ▁bhanteti
PA_mil_6.2.5:7.5	“Evameva kho, mahārāja, sakkā nibbānassa sacchikiriyāya maggo akkhātuṁ, na sakkā nibbānassa uppādāya hetu dassetuṁ.	▁evameva ▁kho ▁mahārāja ▁sakkā ▁nibbān assa ▁ sacchikiriy āya ▁maggo ▁akkh ā tuṃ ▁na ▁sakkā ▁nibbān assa ▁uppād āya ▁hetu ▁dassetuṃ
PA_mil_6.2.5:8.1	Sakkuṇeyya, mahārāja, puriso pākatikena balena mahāsamuddaṁ nāvāya uttaritvā pārimatīraṁ gantun”ti?	▁sak ku ṇ eyya ▁mahārāja ▁puriso ▁ pāk ati k ena ▁bal ena ▁mahā samudd aṃ ▁nā v āya ▁uttar itvā ▁ pāri mat ī raṃ ▁ gantu nti
PA_mil_6.2.5:8.2	“Āma, bhante”ti?	▁āma ▁bhanteti
PA_mil_6.2.5:8.3	“Sakkuṇeyya pana so, mahārāja, puriso pākatikena balena mahāsamuddassa pārimatīraṁ idha āharitun”ti?	▁sak ku ṇ eyya ▁pana ▁so ▁mahārāja ▁puriso ▁ pāk ati k ena ▁bal ena ▁mahā samudd assa ▁ pāri mat ī raṃ ▁idha ▁āhar itunti
PA_mil_6.2.5:8.4	“Na hi, bhante”ti.	▁na ▁hi ▁bhanteti
PA_mil_6.2.5:8.5	“Evameva kho, mahārāja, sakkā nibbānassa sacchikiriyāya maggo akkhātuṁ, na sakkā nibbānassa uppādāya hetu dassetuṁ.	▁evameva ▁kho ▁mahārāja ▁sakkā ▁nibbān assa ▁ sacchikiriy āya ▁maggo ▁akkh ā tuṃ ▁na ▁sakkā ▁nibbān assa ▁uppād āya ▁hetu ▁dassetuṃ
PA_mil_6.2.5:8.6	Kiṁ kāraṇā?	▁kiṃ ▁kāraṇ ā
PA_mil_6.2.5:8.7	Asaṅkhatattā dhammassā”ti.	▁asaṃkhat attā ▁dhamm assāti
PA_mil_6.2.5:9.1	“Asaṅkhataṁ, bhante nāgasena, nibbānan”ti?	▁asaṃkhat aṃ ▁bhante ▁nāgasena ▁nibbān anti
PA_mil_6.2.5:9.2_0	“Āma, mahārāja, asaṅkhataṁ nibbānaṁ na kehici kataṁ, nibbānaṁ, mahārāja, na vattabbaṁ	▁āma ▁mahārāja ▁asaṃkhat aṃ ▁nibbānaṃ ▁na ▁kehici ▁kataṃ ▁nibbānaṃ ▁mahārāja ▁na ▁vattabbaṃ
PA_mil_6.2.5:9.2_1	uppannanti vā anuppannanti vā uppādanīyanti vā atītanti vā anāgatanti vā paccuppannanti	▁uppann anti ▁vā ▁anuppann anti ▁vā ▁uppād anīy anti ▁vā ▁atīt anti ▁vā ▁anāgat anti ▁vā ▁paccuppann anti
PA_mil_6.2.5:9.2_2	vā cakkhuviññeyyanti vā sotaviññeyyanti vā ghānaviññeyyanti vā jivhāviññeyyanti vā	▁vā ▁cakkhu viññeyy anti ▁vā ▁sota viññeyy anti ▁vā ▁ghān a viññeyy anti ▁vā ▁jivhā viññeyy anti ▁vā
PA_mil_6.2.5:9.2_3	kāyaviññeyyanti vā”ti.	▁kāya viññeyy anti ▁vāti
PA_mil_6.2.5:9.3_0	“Yadi, bhante nāgasena, nibbānaṁ na uppannaṁ na anuppannaṁ na uppādanīyaṁ na atītaṁ	▁yadi ▁bhante ▁nāgasena ▁nibbānaṃ ▁na ▁uppann aṃ ▁na ▁anuppann aṃ ▁na ▁uppād anīy aṃ ▁na ▁atīt aṃ
PA_mil_6.2.5:9.3_1	na anāgataṁ na paccuppannaṁ na cakkhuviññeyyaṁ na sotaviññeyyaṁ na ghānaviññeyyaṁ	▁na ▁anāgat aṃ ▁na ▁paccuppann aṃ ▁na ▁cakkhu viññeyy aṃ ▁na ▁sota viññeyy aṃ ▁na ▁ghān a viññeyy aṃ
PA_mil_6.2.5:9.3_2	na jivhāviññeyyaṁ na kāyaviññeyyaṁ, tena hi, bhante nāgasena, tumhe natthidhammaṁ	▁na ▁jivhā viññeyy aṃ ▁na ▁kāya viññeyy aṃ ▁tena ▁hi ▁bhante ▁nāgasena ▁tumhe ▁natthi dhamm aṃ
PA_mil_6.2.5:9.3_3	nibbānaṁ apadisatha ‘natthi nibbānan’”ti.	▁nibbānaṃ ▁apa dis atha ▁natthi ▁nibbān anti
PA_mil_6.2.5:9.4	“Atthi, mahārāja, nibbānaṁ, manoviññeyyaṁ nibbānaṁ, visuddhena mānasena paṇītena ujukena anāvaraṇena nirāmisena sammāpaṭipanno ariyasāvako nibbānaṁ passatī”ti.	▁atthi ▁mahārāja ▁nibbānaṃ ▁mano viññeyy aṃ ▁nibbānaṃ ▁ visuddh ena ▁mān as ena ▁paṇīt ena ▁uju k ena ▁an āvaraṇ ena ▁nir āmi s ena ▁sammā paṭipann o ▁ariyasāvak o ▁nibbānaṃ ▁pass atīti
PA_mil_6.2.5:10.1	“Kīdisaṁ pana taṁ, bhante, nibbānaṁ, yaṁ taṁ opammehi ādīpanīyaṁ kāraṇehi maṁ saññāpehi, yathā atthidhammaṁ opammehi ādīpanīyan”ti.	▁kīdis aṃ ▁pana ▁taṃ ▁bhante ▁nibbānaṃ ▁yaṃ ▁taṃ ▁ opam m ehi ▁ ā dīp anīy aṃ ▁kāraṇ ehi ▁maṃ ▁saññā p ehi ▁yathā ▁atthi dhamm aṃ ▁ opam m ehi ▁ ā dīp anīy anti
PA_mil_6.2.5:10.2	“Atthi, mahārāja, vāto nāmā”ti?	▁atthi ▁mahārāja ▁vā to ▁nāmāti
PA_mil_6.2.5:10.3	“Āma, bhante”ti.	▁āma ▁bhanteti
PA_mil_6.2.5:10.4	“Iṅgha, mahārāja, vātaṁ dassehi vaṇṇato vā saṇṭhānato vā aṇuṁ vā thūlaṁ vā dīghaṁ vā rassaṁ vā”ti.	▁ iṃ gh a ▁mahārāja ▁vā taṃ ▁dass ehi ▁vaṇṇ ato ▁vā ▁ saṇṭh ān ato ▁vā ▁a ṇu ṃ ▁vā ▁thūl aṃ ▁vā ▁dīgh aṃ ▁vā ▁rass aṃ ▁vāti
PA_mil_6.2.5:10.5	“Na sakkā, bhante nāgasena, vāto upadassayituṁ, na so vāto hatthaggahaṇaṁ vā nimmaddanaṁ vā upeti, api ca atthi so vāto”ti.	▁na ▁sakkā ▁bhante ▁nāgasena ▁vā to ▁upa d assa y ituṃ ▁na ▁so ▁vā to ▁hatth aggahaṇ aṃ ▁vā ▁ni m madd anaṃ ▁vā ▁up eti ▁api ▁ca ▁atthi ▁so ▁vā to ti
PA_mil_6.2.5:10.6	“Yadi, mahārāja, na sakkā vāto upadassayituṁ, tena hi natthi vāto”ti?	▁yadi ▁mahārāja ▁na ▁sakkā ▁vā to ▁upa d assa y ituṃ ▁tena ▁hi ▁natthi ▁vā to ti
PA_mil_6.2.5:10.7	“Jānāmahaṁ, bhante nāgasena, vāto atthīti me hadaye anupaviṭṭhaṁ, na cāhaṁ sakkomi vātaṁ upadassayitun”ti.	▁jān āma haṃ ▁bhante ▁nāgasena ▁vā to ▁atthīti ▁me ▁haday e ▁anupa vi ṭṭh aṃ ▁na ▁cā haṃ ▁sakko mi ▁vā taṃ ▁upa d assa y itunti
PA_mil_6.2.5:10.8	“Evameva kho, mahārāja, atthi nibbānaṁ, na ca sakkā nibbānaṁ upadassayituṁ vaṇṇena vā saṇṭhānena vā”ti.	▁evameva ▁kho ▁mahārāja ▁atthi ▁nibbānaṃ ▁na ▁ca ▁sakkā ▁nibbānaṃ ▁upa d assa y ituṃ ▁vaṇṇ ena ▁vā ▁ saṇṭh ān ena ▁vāti
PA_mil_6.2.5:10.9	“Sādhu, bhante nāgasena, sūpadassitaṁ opammaṁ, suniddiṭṭhaṁ kāraṇaṁ, evametaṁ tathā sampaṭicchāmi ‘atthi nibbānan’”ti.	▁sādhu ▁bhante ▁nāgasena ▁sū pad ass itaṃ ▁ opam maṃ ▁su ni d diṭṭh aṃ ▁kāraṇaṃ ▁evamet aṃ ▁tathā ▁sampaṭicch āmi ▁atthi ▁nibbān anti
PA_mil_6.2.5:11.1	Akammajādipañho pañcamo.	▁ akamm a j ādi pañh o ▁pañcam o
