segmentnr	original	analyzed
PA_mil_5.4.6:0.1	Milindapañha	milindapañha 
PA_mil_5.4.6:0.2	Meṇḍakapañha	meṇḍakapañha 
PA_mil_5.4.6:0.3	Sabbaññutañāṇavagga	sabbaññuta ñāṇa vagga 
PA_mil_5.4.6:0.4	6. Mettābhāvanānisaṁsapañha	      
PA_mil_5.4.6:1.1	“Bhante nāgasena, bhāsitampetaṁ bhagavatā—	bhante nāgasena bhāsitam petam bhagavatā 
PA_mil_5.4.6:1.2	‘mettāya, bhikkhave, cetovimuttiyā āsevitāya bhāvitāya bahulīkatāya yānīkatāya vatthukatāya anuṭṭhitāya paricitāya susamāraddhāya ekādasānisaṁsā pāṭikaṅkhā.	mettāya bhikkhave cetaḥ vimuttiyā āsevitāya bhāvitāya bahulīkatāya yānīkatāya vatthukatāya anuṭṭhitāya paricitāya su samāraddhāya ekādasa anisasā pāṭikaṅkhā 
PA_mil_5.4.6:1.3	Katame ekādasa?	katame ekādasa 
PA_mil_5.4.6:1.4_0	Sukhaṁ supati, sukhaṁ paṭibujjhati, na pāpakaṁ supinaṁ passati, manussānaṁ piyo hoti,	sukham supati sukham paṭibujjhati na pāpakam supinam passati manussānam piyaḥ hoti 
PA_mil_5.4.6:1.4_1	amanussānaṁ piyo hoti, devatā rakkhanti, nāssa aggi vā visaṁ vā satthaṁ vā kamati,	amanussānam piyaḥ hoti devatāḥ rakkhanti na assa aggi vā visam vā sattham vā kamati 
PA_mil_5.4.6:1.4_2	tuvaṭaṁ cittaṁ samādhiyati, mukhavaṇṇo vippasīdati, asammūḷho kālaṁ karoti, uttariṁ	tuvaṭam cittam samādhiyati mukha vaṇṇaḥ vippasīdati asammūḷhaḥ kālam karoti uttari 
PA_mil_5.4.6:1.4_3	appaṭivijjhanto brahmalokūpago hotī’ti.	a paṭivijjhantaḥ brahma loka upagaḥ hoti iti 
PA_mil_5.4.6:1.5	Puna ca tumhe bhaṇatha—	puna ca tumhe bhaṇatha 
PA_mil_5.4.6:1.6	‘sāmo kumāro mettāvihārī migasaṅghena parivuto pavane vicaranto pīḷiyakkhena raññā viddho visapītena sallena tattheva mucchito patito’ti.	sāmaḥ kumāraḥ mettā vihārī miga saṅghena parivutaḥ pavane vicarantaḥ pīḷiyakkhena raññā viddhaḥ visa pītena sallena tattha iva mucchito patito ti 
PA_mil_5.4.6:2.1	Yadi, bhante nāgasena, bhagavatā bhaṇitaṁ—	yadi bhante nāgasena bhagavatā bhaṇita 
PA_mil_5.4.6:2.2	‘mettāya bhikkhave …pe…	mettāya bhikkhave pe 
PA_mil_5.4.6:2.3_0	brahmalokūpago hotī’ti, tena hi ‘sāmo kumāro mettāvihārī migasaṅghena parivuto pavane	brahma loka upagaḥ hoti iti tena hi sāmaḥ kumāraḥ mettā vihārī miga saṅghena parivutaḥ pavane 
PA_mil_5.4.6:2.3_1	vicaranto pīḷiyakkhena raññā viddho visapītena sallena tattheva mucchito patito’ti	vicarantaḥ pīḷiyakkhena raññā viddhaḥ visa pītena sallena tattha iva mucchito patito ti 
PA_mil_5.4.6:2.3_2	yaṁ vacanaṁ, taṁ micchā.	yam tam micchā 
PA_mil_5.4.6:2.4	Yadi sāmo kumāro mettāvihārī migasaṅghena parivuto pavane vicaranto pīḷiyakkhena raññā viddho visapītena sallena tattheva mucchito patito, tena hi ‘mettāya, bhikkhave …pe…	yadi sāmaḥ kumāraḥ mettā vihārī miga saṅghena parivutaḥ pavane vicarantaḥ pīḷiyakkhena raññā viddhaḥ visa pītena sallena tattha iva mucchitaḥ patitaḥ tena hi mettāya bhikkhave pe
PA_mil_5.4.6:2.5	satthaṁ vā kamatī’ti tampi vacanaṁ micchā.	sattham vā kamati iti vacanam micchā 
PA_mil_5.4.6:2.6_0	Ayampi ubhato koṭiko pañho sunipuṇo parisaṇho sukhumo gambhīro, api sunipuṇānaṁ manujānaṁ	ayam pi ubhatas koṭikaḥ pañhaḥ su nipuṇaḥ parisaṇhaḥ sukhumaḥ gambhīraḥ api 
PA_mil_5.4.6:2.6_1	gatte sedaṁ moceyya, so tavānuppatto, vijaṭehi taṁ mahājaṭājaṭitaṁ, anāgatānaṁ jinaputtānaṁ	gatte sa idam moceyya saḥ tava anuppattaḥ vijaṭehi tam mahā jaṭā jaṭita anāgatānam jinaputtāna 
PA_mil_5.4.6:2.6_2	cakkhuṁ dehi nibbāhanāyā”ti.	cakkhum dehi nibbāhanāya ati 
PA_mil_5.4.6:3.1	“Bhāsitampetaṁ, mahārāja, bhagavatā—	mahā rāja bhagavatā 
PA_mil_5.4.6:3.2	‘mettāya bhikkhave …pe…	mettāya bhikkhave pe 
PA_mil_5.4.6:3.3	satthaṁ vā kamatī’ti.	sattham vā kamati iti 
PA_mil_5.4.6:3.4	Sāmo ca kumāro mettāvihārī migasaṅghena parivuto pavane vicaranto pīḷiyakkhena raññā viddho visapītena sallena tattheva mucchito patito, tattha pana, mahārāja, kāraṇaṁ atthi.	sāmaḥ ca kumāraḥ mettā vihārī miga saṅghena parivutaḥ pavane vicarantaḥ pīḷiyakkhena raññā viddhaḥ visa pītena sallena tattha iva mucchitaḥ patitaḥ tattha pana mahā rāja kāraṇam atthi 
PA_mil_5.4.6:3.5	Katamaṁ tattha kāraṇaṁ?	katamam tattha kāraṇa 
PA_mil_5.4.6:3.6	Nete, mahārāja, guṇā puggalassa, mettābhāvanāyete guṇā, sāmo, mahārāja, kumāro ghaṭaṁ ukkhipanto tasmiṁ khaṇe mettābhāvanāya pamatto ahosi.	na ite mahā rāja guṇā puggalassa mettā bhāvanāya ete guṇā sāmaḥ mahā rāja kumāraḥ ghaṭam ukkhipantaḥ tasmin khaṇe mettā bhāvanāya pamattaḥ ahosi 
PA_mil_5.4.6:4.1	Yasmiṁ, mahārāja, khaṇe puggalo mettaṁ samāpanno hoti, na tassa puggalassa tasmiṁ khaṇe aggi vā visaṁ vā satthaṁ vā kamati.	yasmi mahā rāja khaṇe puggalaḥ mettam samāpannaḥ hoti na tassa puggalassa tasmin khaṇe aggi vā visam vā sattham vā kamati 
PA_mil_5.4.6:4.2	Tassa ye keci ahitakāmā upagantvā taṁ na passanti, na tasmiṁ okāsaṁ labhanti.	tassa ye keci ahita kāmāḥ upagantvā tam na passanti na tasmin okāsam labhanti 
PA_mil_5.4.6:4.3	Nete, mahārāja, guṇā puggalassa, mettābhāvanāyete guṇā.	na ite mahā rāja guṇā puggalassa mettā bhāvanāya ite guṇā 
PA_mil_5.4.6:4.4_0	Idha, mahārāja, puriso saṅgāmasūro abhejjakavacajālikaṁ sannayhitvā saṅgāmaṁ otareyya,	mahā rāja purisaḥ saṅgāma sūraḥ abhejja kavaca jālikam sanna yhitvā saṅgāmam otareyya 
PA_mil_5.4.6:4.4_1	tassa sarā khittā upagantvā patanti vikiranti, na tasmiṁ okāsaṁ labhanti, neso, mahārāja,	tassa sarā khittāḥ upagantvā patanti vikiranti na tasmin okāsam labhanti na isaḥ mahā rāja 
PA_mil_5.4.6:4.4_2	guṇo saṅgāmasūrassa, abhejjakavacajālikāyeso guṇo, yassa sarā khittā upagantvā patanti vikiranti.	guṇo saṅgāmasūrassa guṇo yassa sarā khittāḥ upagantvā patanti vikiranti 
PA_mil_5.4.6:4.5	Evameva kho, mahārāja, nete guṇā puggalassa, mettābhāvanāyete guṇā.	evam eva kho mahā rāja na ite guṇā puggalassa mettā bhāvanāya ite guṇā 
PA_mil_5.4.6:5.1	Yasmiṁ, mahārāja, khaṇe puggalo mettaṁ samāpanno hoti, na tassa puggalassa tasmiṁ khaṇe aggi vā visaṁ vā satthaṁ vā kamati.	yasmi mahā rāja khaṇe puggalaḥ mettam samāpannaḥ hoti na tassa puggalassa tasmin khaṇe aggi vā visam vā sattham vā kamati 
PA_mil_5.4.6:5.2	Tassa ye keci ahitakāmā upagantvā taṁ na passanti, tasmiṁ okāsaṁ na labhanti, nete, mahārāja, guṇā puggalassa, mettābhāvanāyete guṇā.	tassa ye keci ahita kāmāḥ upagantvā tam na passanti tasmin okāsam na labhanti na ite mahā rāja guṇā puggalassa mettā bhāvanāya ete guṇā 
PA_mil_5.4.6:5.3	Idha pana, mahārāja, puriso dibbaṁ antaradhānaṁ mūlaṁ hatthe kareyya, yāva taṁ mūlaṁ tassa hatthagataṁ hoti, tāva na añño koci pakatimanusso taṁ purisaṁ passati.	idha pana mahā rāja purisaḥ dibbam antaradhānam mūlam hatthe kareyya yāva tam mūlam tassa hattha gatam hoti tāva na aññaḥ koci pakati manussaḥ tam purisam passati 
PA_mil_5.4.6:5.4	Neso, mahārāja, guṇo purisassa, mūlasseso guṇo antaradhānassa, yaṁ so pakatimanussānaṁ cakkhupathe na dissati.	na isaḥ mahā rāja guṇo purisassa mūlassa isaḥ guṇaḥ antaradhānassa yat so pakati manussānam cakkhu pathe na dissati 
PA_mil_5.4.6:5.5	Evameva kho, mahārāja, nete guṇā puggalassa, mettābhāvanāyete guṇā.	evam eva kho mahā rāja na ite guṇā puggalassa mettā bhāvanāya ite guṇā 
PA_mil_5.4.6:6.1	Yasmiṁ, mahārāja, khaṇe puggalo mettaṁ samāpanno hoti, na tassa puggalassa tasmiṁ khaṇe aggi vā visaṁ vā satthaṁ vā kamati.	yasmi mahā rāja khaṇe puggalaḥ mettam samāpannaḥ hoti na tassa puggalassa tasmin khaṇe aggi vā visam vā sattham vā kamati 
PA_mil_5.4.6:6.2	Tassa ye keci ahitakāmā upagantvā taṁ na passanti, na tasmiṁ okāsaṁ labhanti.	tassa ye keci ahita kāmāḥ upagantvā tam na passanti na tasmin okāsam labhanti 
PA_mil_5.4.6:6.3	Nete, mahārāja, guṇā puggalassa, mettābhāvanāyete guṇā.	na ite mahā rāja guṇā puggalassa mettā bhāvanāya ite guṇā 
PA_mil_5.4.6:6.4_0	Yathā vā pana, mahārāja, purisaṁ sukataṁ mahāleṇamanuppaviṭṭhaṁ mahatimahāmegho abhivassanto	yathā vā pana mahā rāja purisam su katam mahā leṇam anuppaviṭṭham mahati mahā meghaḥ abhivassantaḥ 
PA_mil_5.4.6:6.4_1	na sakkoti temayituṁ, neso, mahārāja, guṇo purisassa, mahāleṇasseso guṇo, yaṁ mahāmegho	na sakkoti temayitu na isaḥ mahā rāja guṇo purisassa mahā leṇassa isaḥ guṇaḥ yam mahā meghaḥ 
PA_mil_5.4.6:6.4_2	abhivassamāno na taṁ temeti.	abhivassamānaḥ na tam temeti 
PA_mil_5.4.6:6.5	Evameva kho, mahārāja, nete guṇā puggalassa, mettābhāvanāyete guṇā.	evam eva kho mahā rāja na ite guṇā puggalassa mettā bhāvanāya ite guṇā 
PA_mil_5.4.6:7.1	Yasmiṁ, mahārāja, khaṇe puggalo mettaṁ samāpanno hoti, na tassa puggalassa tasmiṁ khaṇe aggi vā visaṁ vā satthaṁ vā kamati.	yasmi mahā rāja khaṇe puggalaḥ mettam samāpannaḥ hoti na tassa puggalassa tasmin khaṇe aggi vā visam vā sattham vā kamati 
PA_mil_5.4.6:7.2	Tassa ye keci ahitakāmā upagantvā taṁ na passanti, na tassa sakkonti ahitaṁ kātuṁ, nete, mahārāja, guṇā puggalassa, mettābhāvanāyete guṇā”ti.	tassa ye keci ahita kāmāḥ upagantvā tam na passanti na tassa sakkonti ahitam kātu na ite mahā rāja guṇā puggalassa mettā bhāvanāya ete guṇā ati 
PA_mil_5.4.6:7.3	“Acchariyaṁ, bhante nāgasena, abbhutaṁ, bhante nāgasena, sabbapāpanivāraṇā mettābhāvanā”ti.	acchariya bhante nāgasena abbhuta bhante nāgasena sabba pāpa nivāraṇā mettā bhāvanā ati 
PA_mil_5.4.6:7.4	“Sabbakusalaguṇāvahā, mahārāja, mettābhāvanā hitānampi ahitānampi, ye te sattā viññāṇabaddhā, sabbesaṁ mahānisaṁsā mettābhāvanā saṁvibhajitabbā”ti.	sabba kusala guṇa āvahā mahā rāja mettā bhāvanā hitānam pi ahitānam pi ye te sattā viññāṇa baddhā sabbesam mahā nisasā mettā bhāvanā sa vibhajitabbā ati 
PA_mil_5.4.6:8.1	Mettābhāvanānisaṁsapañho chaṭṭho.	mettā bhāvanā nisasa pañho chaṭṭho 
