segmentnr	original	analyzed
PA_mn_15:7.84	‘thaddho khomhi atimānī’ti, tenāvuso, bhikkhunā tesaṁyeva pāpakānaṁ akusalānaṁ dhammānaṁ pahānāya vāyamitabbaṁ.	▁ tha ddh o ▁kho mhi ▁ati m ānīti ▁te n āvuso ▁bhikkhunā ▁tesaṃ yeva ▁pāpak ānaṃ ▁akusal ānaṃ ▁dhammānaṃ ▁pahān āya ▁vā yam itabbaṃ
PA_mn_15:7.85	Sace panāvuso, bhikkhu paccavekkhamāno evaṁ jānāti:	▁sace ▁panāvuso ▁bhikkhu ▁paccavekkh amāno ▁evaṃ ▁jānāti
PA_mn_15:7.86	‘atthaddho khomhi anatimānī’ti, tenāvuso, bhikkhunā teneva pītipāmojjena vihātabbaṁ ahorattānusikkhinā kusalesu dhammesu.	▁attha ddh o ▁kho mhi ▁an ati m ānīti ▁te n āvuso ▁bhikkhunā ▁teneva ▁pīti pā mo jj ena ▁vi hā tabbaṃ ▁ah o ratt ānu si kkhi nā ▁kusal esu ▁dhammesu
PA_mn_15:7.87	Puna caparaṁ, āvuso, bhikkhunā attanāva attānaṁ evaṁ paccavekkhitabbaṁ:	▁puna ▁caparaṃ ▁āvuso ▁bhikkhunā ▁attanā va ▁attānaṃ ▁evaṃ ▁paccavekkh itabbaṃ
PA_mn_15:7.88	‘kiṁ nu khomhi sandiṭṭhiparāmāsī ādhānaggāhī duppaṭinissaggī’ti?	▁kiṃ ▁nu ▁kho mhi ▁ san diṭṭhi parāmās ī ▁ ā dhān a ggāh ī ▁du p paṭinissagg īti
PA_mn_15:7.89	Sace, āvuso, bhikkhu paccavekkhamāno evaṁ jānāti:	▁sace ▁āvuso ▁bhikkhu ▁paccavekkh amāno ▁evaṃ ▁jānāti
PA_mn_15:7.90	‘sandiṭṭhiparāmāsī khomhi ādhānaggāhī duppaṭinissaggī’ti, tenāvuso, bhikkhunā tesaṁyeva pāpakānaṁ akusalānaṁ dhammānaṁ pahānāya vāyamitabbaṁ.	▁ san diṭṭhi parāmās ī ▁kho mhi ▁ ā dhān a ggāh ī ▁du p paṭinissagg īti ▁te n āvuso ▁bhikkhunā ▁tesaṃ yeva ▁pāpak ānaṃ ▁akusal ānaṃ ▁dhammānaṃ ▁pahān āya ▁vā yam itabbaṃ
PA_mn_15:7.91	Sace panāvuso, bhikkhu paccavekkhamāno evaṁ jānāti:	▁sace ▁panāvuso ▁bhikkhu ▁paccavekkh amāno ▁evaṃ ▁jānāti
PA_mn_15:7.92	‘asandiṭṭhiparāmāsī khomhi anādhānaggāhī suppaṭinissaggī’ti, tenāvuso, bhikkhunā teneva pītipāmojjena vihātabbaṁ ahorattānusikkhinā kusalesu dhammesu.	▁a san diṭṭhi parāmās ī ▁kho mhi ▁anā dhān a ggāh ī ▁su p paṭinissagg īti ▁te n āvuso ▁bhikkhunā ▁teneva ▁pīti pā mo jj ena ▁vi hā tabbaṃ ▁ah o ratt ānu si kkhi nā ▁kusal esu ▁dhammesu
PA_mn_15:8.1_0	Sace, āvuso, bhikkhu paccavekkhamāno sabbepime pāpake akusale dhamme appahīne attani	▁sace ▁āvuso ▁bhikkhu ▁paccavekkh amāno ▁sabbepi me ▁pāpak e ▁akusal e ▁dhamme ▁appahīn e ▁attani
PA_mn_15:8.1_1	samanupassati, tenāvuso, bhikkhunā sabbesaṁyeva imesaṁ pāpakānaṁ akusalānaṁ dhammānaṁ	▁samanupass ati ▁te n āvuso ▁bhikkhunā ▁sabbesaṃ yeva ▁imesaṃ ▁pāpak ānaṃ ▁akusal ānaṃ ▁dhammānaṃ
PA_mn_15:8.1_2	pahānāya vāyamitabbaṁ.	▁pahān āya ▁vā yam itabbaṃ
PA_mn_15:8.2_0	Sace panāvuso, bhikkhu paccavekkhamāno sabbepime pāpake akusale dhamme pahīne attani	▁sace ▁panāvuso ▁bhikkhu ▁paccavekkh amāno ▁sabbepi me ▁pāpak e ▁akusal e ▁dhamme ▁pahīn e ▁attani
PA_mn_15:8.2_1	samanupassati, tenāvuso, bhikkhunā teneva pītipāmojjena vihātabbaṁ, ahorattānusikkhinā kusalesu dhammesu.	▁samanupass ati ▁te n āvuso ▁bhikkhunā ▁teneva ▁pīti pā mo jj ena ▁vi hā tabbaṃ ▁ah o ratt ānu si kkhi nā ▁kusal esu ▁dhammesu
PA_mn_15:8.3_0	Seyyathāpi, āvuso, itthī vā puriso vā, daharo yuvā maṇḍanajātiko, ādāse vā parisuddhe	▁seyyathāpi ▁āvuso ▁itthī ▁vā ▁puriso ▁vā ▁dahar o ▁yuv ā ▁ maṇḍ ana jātik o ▁ ā dās e ▁vā ▁parisuddh e
PA_mn_15:8.3_1	pariyodāte, acche vā udakapatte, sakaṁ mukhanimittaṁ paccavekkhamāno, sace tattha	▁pari yo dā te ▁a cch e ▁vā ▁udak apatt e ▁sak aṃ ▁mukh animitt aṃ ▁paccavekkh amāno ▁sace ▁tattha
PA_mn_15:8.3_2	passati rajaṁ vā aṅgaṇaṁ vā, tasseva rajassa vā aṅgaṇassa vā pahānāya vāyamati;	▁passati ▁raj aṃ ▁vā ▁aṃg aṇaṃ ▁vā ▁tasseva ▁raj assa ▁vā ▁ aṃ gaṇ assa ▁vā ▁pahān āya ▁vā yam ati
PA_mn_15:8.4	no ce tattha passati rajaṁ vā aṅgaṇaṁ vā, teneva attamano hoti:	▁no ▁ce ▁tattha ▁passati ▁raj aṃ ▁vā ▁aṃg aṇaṃ ▁vā ▁teneva ▁att aman o ▁hoti
PA_mn_15:8.5	‘lābhā vata me, parisuddhaṁ vata me’ti.	▁lābh ā ▁vata ▁me ▁parisuddh aṃ ▁vata ▁me ti
PA_mn_15:8.6_0	Evameva kho, āvuso, sace bhikkhu paccavekkhamāno sabbepime pāpake akusale dhamme	▁evameva ▁kho ▁āvuso ▁sace ▁bhikkhu ▁paccavekkh amāno ▁sabbepi me ▁pāpak e ▁akusal e ▁dhamme
PA_mn_15:8.6_1	appahīne attani samanupassati, tenāvuso, bhikkhunā sabbesaṁyeva imesaṁ pāpakānaṁ	▁appahīn e ▁attani ▁samanupass ati ▁te n āvuso ▁bhikkhunā ▁sabbesaṃ yeva ▁imesaṃ ▁pāpak ānaṃ
PA_mn_15:8.6_2	akusalānaṁ dhammānaṁ pahānāya vāyamitabbaṁ.	▁akusal ānaṃ ▁dhammānaṃ ▁pahān āya ▁vā yam itabbaṃ
PA_mn_15:8.7_0	Sace panāvuso, bhikkhu paccavekkhamāno sabbepime pāpake akusale dhamme pahīne attani	▁sace ▁panāvuso ▁bhikkhu ▁paccavekkh amāno ▁sabbepi me ▁pāpak e ▁akusal e ▁dhamme ▁pahīn e ▁attani
PA_mn_15:8.7_1	samanupassati, tenāvuso, bhikkhunā teneva pītipāmojjena vihātabbaṁ, ahorattānusikkhinā	▁samanupass ati ▁te n āvuso ▁bhikkhunā ▁teneva ▁pīti pā mo jj ena ▁vi hā tabbaṃ ▁ah o ratt ānu si kkhi nā
PA_mn_15:8.7_2	kusalesu dhammesū”ti.	▁kusal esu ▁dhamm esūti
PA_mn_15:8.8	Idamavocāyasmā mahāmoggallāno.	▁idam a vo c ā y asmā ▁mahā moggallān o
PA_mn_15:8.9	Attamanā te bhikkhū āyasmato mahāmoggallānassa bhāsitaṁ abhinandunti.	▁att aman ā ▁te ▁bhikkhū ▁āyasmato ▁mahā moggallān assa ▁bhāsitaṃ ▁abhinand u nti
PA_mn_15:8.10	Anumānasuttaṁ niṭṭhitaṁ pañcamaṁ.	▁anu mān asuttaṃ ▁niṭṭhitaṃ ▁pañcam aṃ
