segmentnr	original	analyzed
PA_mil_5.2.4:0.1	Milindapañha	milindapañha 
PA_mil_5.2.4:0.2	Meṇḍakapañha	meṇḍakapañha 
PA_mil_5.2.4:0.3	Abhejjavagga	a bhejja vagga 
PA_mil_5.2.4:0.4	4. Maccupāsamuttipañha	      
PA_mil_5.2.4:1.1	“Bhante nāgasena, bhāsitampetaṁ bhagavatā—	bhante nāgasena bhāsitam petam bhagavatā 
PA_mil_5.2.4:2.1	‘Na antalikkhe na samuddamajjhe,	na antalikkhe na samudda majjhe 
PA_mil_5.2.4:2.2	Na pabbatānaṁ vivaraṁ pavissa;	na pabbatānam vivaram pavissa 
PA_mil_5.2.4:2.3	Na vijjatī so jagatippadeso,	na vijjati saḥ jagati padesaḥ 
PA_mil_5.2.4:2.4	Yatthaṭṭhito mucceyya maccupāsā’ti.	yatthaṭṭhitaḥ mucceyya maccu pāsā ati 
PA_mil_5.2.4:3.1	Puna bhagavatā parittā ca uddiṭṭhā.	puna bhagavatā parittā ca uddiṭṭhā 
PA_mil_5.2.4:3.2	Seyyathidaṁ—	seyyathida 
PA_mil_5.2.4:3.3	ratanasuttaṁ mettasuttaṁ khandhaparittaṁ moraparittaṁ dhajaggaparittaṁ āṭānāṭiyaparittaṁ aṅgulimālaparittaṁ.	ratana suttam metta suttam khandha parittam mora parittam dhajagga parittam āṭānāṭiya parittam aṅgulimāla paritta 
PA_mil_5.2.4:3.4	Yadi, bhante nāgasena, ākāsagatopi samuddamajjhagatopi pāsādakuṭileṇaguhāpabbhāradaribilagirivivarapabbatantaragatopi na muccati maccupāsā, tena hi parittakammaṁ micchā.	yadi bhante nāgasenaḥ ākāsa gataḥ api samudda majjha gataḥ api pāsāda kuṭileṇa guhā pabbhāra dari bila giri vivara pabbata antara gataḥ api na muccati maccu pāsā tena hi paritta kammam micchā 
PA_mil_5.2.4:3.5	Yadi parittakaraṇena maccupāsā parimutti bhavati, tena hi ‘na antalikkhe …pe…	yadi paritta karaṇena maccupāsā parimutti bhavati tena hi na antalikkhe pe 
PA_mil_5.2.4:3.6	maccupāsā’ti tampi vacanaṁ micchā.	vacanam micchā 
PA_mil_5.2.4:3.7	Ayampi ubhato koṭiko pañho gaṇṭhitopi gaṇṭhitaro tavānuppatto, so tayā nibbāhitabbo”ti.	ayam pi ubhatas koṭiko pañhaḥ gaṇṭhitaḥ api gaṇṭhitaro tava an uppatto saḥ tayā nibbāhitabbaḥ ti 
PA_mil_5.2.4:4.1	“Bhāsitampetaṁ, mahārāja, bhagavatā ‘na antalikkhe …pe…	mahā rāja bhagavatā na antalikkhe pe 
PA_mil_5.2.4:4.2	maccupāsā’ti, parittā ca bhagavatā uddiṭṭhā, tañca pana sāvasesāyukassa vayasampannassa apetakammāvaraṇassa, natthi, mahārāja, khīṇāyukassa ṭhitiyā kiriyā vā upakkamo vā.	maccupāsā ati parittā ca bhagavatā uddiṭṭhā tat ca pana sa avasesa āyukassa vaya sampannassa apeta kamma āvaraṇassa natthi mahā rāja khīṇa āyukassa ṭhitiyā kiriyā vā upakkamaḥ vā 
PA_mil_5.2.4:5.1_0	Yathā, mahārāja, matassa rukkhassa sukkhassa koḷāpassa nisnehassa uparuddhajīvitassa	yathā mahā rāja matassa rukkhassa sukkhassa koḷāpassa nisnehassa uparuddha jīvitassa 
PA_mil_5.2.4:5.1_1	gatāyusaṅkhārassa kumbhasahassenapi udake ākirante allattaṁ vā pallavitaharitabhāvo vā na bhaveyya;	gata āyu saṅkhārassa kumbha sahassena api udake ākirante allattam vā pallavita harita bhāvaḥ vā na bhaveyya 
PA_mil_5.2.4:5.2_0	evameva kho, mahārāja, bhesajjaparittakammena natthi khīṇāyukassa ṭhitiyā kiriyā	evam eva kho mahā rāja bhesajja paritta kammena na atthi khīṇa āyukassa ṭhitiyā kiriyā 
PA_mil_5.2.4:5.2_1	vā upakkamo vā, yāni tāni, mahārāja, mahiyā osadhāni bhesajjāni, tānipi khīṇāyukassa	vā upakkamaḥ vā yāni tāni mahā rāja mahiyāḥ osadhāni bhesajjāni tāni api khīṇāyukassa 
PA_mil_5.2.4:5.2_2	akiccakarāni bhavanti.	a kit ca karāni bhavanti 
PA_mil_5.2.4:5.3	Sāvasesāyukaṁ, mahārāja, vayasampannaṁ apetakammāvaraṇaṁ parittaṁ rakkhati gopeti, tassatthāya bhagavatā parittā uddiṭṭhā.	sāvasesa āyuka mahā rāja vaya sampannam apeta kamma āvaraṇam parittam rakkhati gopeti tassa atthāya bhagavatā parittā uddiṭṭhā 
PA_mil_5.2.4:6.1	Yathā, mahārāja, kassako paripakke dhaññe mate sassanāḷe udakappavesanaṁ vāreyya, yaṁ pana sassaṁ taruṇaṁ meghasannibhaṁ vayasampannaṁ, taṁ udakavaḍḍhiyā vaḍḍhati.	yathā mahā rāja kassakaḥ paripakke dhaññe mate sassa nāḷe udaka ppavesanam vāreyya yam pana sassam taruṇam megha sannibham tam udaka vaḍḍhiyā vaḍḍhati 
PA_mil_5.2.4:6.2_0	Evameva kho, mahārāja, khīṇāyukassa bhesajjaparittakiriyā ṭhapitā paṭikkhittā, ye	evam eva kho mahā rāja khīṇāyukassa bhesajja paritta kiriyā ṭhapitā paṭikkhittāḥ ye 
PA_mil_5.2.4:6.2_1	pana te manussā sāvasesāyukā vayasampannā, tesaṁ atthāya parittabhesajjāni bhaṇitāni,	pana te manussā sa avasesa āyukā vaya sampannā tesam atthāya paritta bhesajjāni bhaṇitāni 
PA_mil_5.2.4:6.2_2	te parittabhesajjehi vaḍḍhantī”ti.	te paritta bhesajjehi vaḍḍhanti iti 
PA_mil_5.2.4:7.1	“Yadi, bhante nāgasena, khīṇāyuko marati, sāvasesāyuko jīvati, tena hi parittabhesajjāni niratthakāni hontī”ti?	yadi bhante nāgasena khīṇa āyukaḥ marati sa avasesa āyukaḥ jīvati tena hi paritta bhesajjāni niratthakāni honti iti 
PA_mil_5.2.4:7.2	“Diṭṭhapubbo pana tayā, mahārāja, koci rogo bhesajjehi paṭinivattito”ti?	diṭṭha pubbaḥ pana tayā mahā rāja koci rogaḥ bhesajjehi paṭinivattito ti 
PA_mil_5.2.4:7.3	“Āma, bhante, anekasatāni diṭṭhānī”ti.	āma bhante aneka satāni diṭṭhāni iti 
PA_mil_5.2.4:7.4	“Tena hi, mahārāja, ‘parittabhesajjakiriyā niratthakā’ti yaṁ vacanaṁ, taṁ micchā bhavatī”ti.	tena hi mahā rāja paritta bhesajja kiriyā niratthakā ati yam tam micchā bhavati iti 
PA_mil_5.2.4:8.1	“Dissanti, bhante nāgasena, vejjānaṁ upakkamā bhesajjapānānulepā, tena tesaṁ upakkamena rogo paṭinivattatī”ti.	dissanti bhante nāgasena vejjānam upakkamāḥ bhesajja pāna anulepā tena tesam upakkamena rogaḥ paṭinivattati iti 
PA_mil_5.2.4:8.2	“Parittānampi, mahārāja, pavattīyamānānaṁ saddo suyyati, jivhā sukkhati, hadayaṁ byāvaṭṭati, kaṇṭho āturati.	parittānam pi mahā rāja pavattīyamānānam saddaḥ suyyati jivhā sukkhati hadayam byāvaṭṭati kaṇṭhaḥ āturati 
PA_mil_5.2.4:8.3	Tena tesaṁ pavattena sabbe byādhayo vūpasamanti, sabbā ītiyo apagacchantīti.	tena tesam pavattena sabbe byādhayaḥ vūpasamanti sabbāḥ ītiyaḥ apagacchanti iti 
PA_mil_5.2.4:9.1	Diṭṭhapubbo pana tayā, mahārāja, koci ahinā daṭṭho mantapadena visaṁ pātīyamāno visaṁ cikkhassanto uddhamadho ācamayamāno”ti?	diṭṭha pubbaḥ pana tayā mahā rāja koci ahinā daṭṭhaḥ manta padena visam pātīyamānaḥ visam cikkhassantaḥ uddham adhas ācamayamānaḥ iti 
PA_mil_5.2.4:9.2	“Āma, bhante, ajjetarahipi taṁ loke vattatī”ti.	āma bhante tam loke vattati iti 
PA_mil_5.2.4:9.3	“Tena hi, mahārāja, ‘parittabhesajjakiriyā niratthakā’ti yaṁ vacanaṁ, taṁ micchā bhavati.	tena hi mahā rāja paritta bhesajja kiriyā niratthakā ati yam tam micchā bhavati 
PA_mil_5.2.4:9.4_0	Kataparittañhi, mahārāja, purisaṁ ḍaṁsitukāmo ahi na ḍaṁsati, vivaṭaṁ mukhaṁ pidahati,	kata parittam hi mahā rāja purisam ḍasitu kāmaḥ ahi na ḍasati vivaṭam mukham pidahati 
PA_mil_5.2.4:9.4_1	corānaṁ ukkhittalaguḷampi na sambhavati, te laguḷaṁ muñcitvā pemaṁ karonti, kupitopi	ukkhitta laguḷam pi na sambhavati te laguḷam muñcitvā karonti kupitaḥ api 
PA_mil_5.2.4:9.4_2	hatthināgo samāgantvā uparamati, pajjalitamahāaggikkhandhopi upagantvā nibbāyati,	hatthi nāgaḥ samāgantvā uparamati pajjalita mahā aggi khandhaḥ api upagantvā nibbāyati 
PA_mil_5.2.4:9.4_3	visaṁ halāhalampi khāyitaṁ agadaṁ sampajjati, āhāratthaṁ vā pharati, vadhakā hantukāmā	visam halāhalampi khāyitam agadam sampajjati āhāra attham vā pharati vadhakā hantu kāmā 
PA_mil_5.2.4:9.4_4	upagantvā dāsabhūtā sampajjanti, akkantopi pāso na saṁvarati.	upagantvā dāsa bhūtā sampajjanti a kkantaḥ api pāsaḥ na savarati 
PA_mil_5.2.4:10.1	Sutapubbaṁ pana tayā, mahārāja, ‘morassa kataparittassa sattavassasatāni luddako nāsakkhi pāsaṁ upanetuṁ, akataparittassa taṁ yeva divasaṁ pāsaṁ upanesī’”ti?	suta pubbam pana tayā mahā rāja morassa kata parittassa satta vassa satāni luddakaḥ na asakkhi pāsam upanetu akata parittassa tam yeva divasam pāsam upanesi iti 
PA_mil_5.2.4:10.2	“Āma, bhante, suyyati, abbhuggato so saddo sadevake loke”ti.	āma bhante suyyati abbhuggataḥ so saddo sa devake loke iti 
PA_mil_5.2.4:10.3	“Tena hi, mahārāja ‘parittabhesajjakiriyā niratthakā’ti yaṁ vacanaṁ, taṁ micchā bhavati.	tena hi mahā rāja paritta bhesajja kiriyā niratthakā ati yam tam micchā bhavati 
PA_mil_5.2.4:11.1_0	Sutapubbaṁ pana tayā, mahārāja, ‘dānavo bhariyaṁ parirakkhanto samugge pakkhipitvā	suta pubbam pana tayā mahā rāja dānavaḥ bhariyam parirakkhantaḥ samugge pakkhipitvā 
PA_mil_5.2.4:11.1_1	gilitvā kucchinā pariharati, atheko vijjādharo tassa dānavassa mukhena pavisitvā	gilitvā kucchinā pariharati atha ekaḥ vijjādharaḥ tassa dānavassa mukhena pavisitvā 
PA_mil_5.2.4:11.1_2	tāya saddhiṁ abhiramati, yadā so dānavo aññāsi, atha samuggaṁ vamitvā vivari, saha	tāya saddhim abhiramati yadā saḥ dānavaḥ aññāsi atha samuggam vamitvā saha 
PA_mil_5.2.4:11.1_3	samugge vivaṭe vijjādharo yathākāmaṁ pakkāmī’”ti?	samugge vivaṭe vijjādharaḥ yathākāmam pakkāmi iti 
PA_mil_5.2.4:11.2	“Āma, bhante, suyyati, abbhuggato sopi saddo sadevake loke”ti.	āma bhante suyyati abbhuggataḥ saḥ api saddaḥ sa devake loke iti 
PA_mil_5.2.4:11.3	“Nanu so, mahārāja, vijjādharo parittabalena gahaṇā mutto”ti.	nanu saḥ mahā rāja vijjādharaḥ paritta balena gahaṇā muttaḥ iti 
PA_mil_5.2.4:11.4	“Āma, bhante”ti.	āma bhanta iti 
PA_mil_5.2.4:11.5	“Tena hi, mahārāja, atthi parittabalaṁ.	tena hi mahā rāja atthi paritta bala 
PA_mil_5.2.4:12.1	Sutapubbaṁ pana tayā, mahārāja, ‘aparopi vijjādharo bārāṇasirañño antepure mahesiyā saddhiṁ sampaduṭṭho gahaṇappatto samāno khaṇena adassanaṁ gato mantabalenā’”ti.	suta pubbam pana tayā mahā rāja aparaḥ api vijjādharaḥ bārāṇasi raññaḥ antepure mahesiyā saddhim sampaduṭṭhaḥ gahaṇa ppatto samānaḥ khaṇena adassanam gataḥ manta balena ati 
PA_mil_5.2.4:12.2	“Āma, bhante, suyyatī”ti.	āma bhante suyyati iti 
PA_mil_5.2.4:12.3	“Nanu so, mahārāja, vijjādharo parittabalena gahaṇā mutto”ti?	nanu saḥ mahā rāja vijjādharaḥ paritta balena gahaṇā muttaḥ iti 
PA_mil_5.2.4:12.4	“Āma, bhante”ti.	āma bhanta iti 
PA_mil_5.2.4:12.5	“Tena hi, mahārāja, atthi parittabalan”ti.	tena hi mahā rāja atthi paritta balanti 
PA_mil_5.2.4:13.1	“Bhante nāgasena, kiṁ sabbeyeva parittaṁ rakkhatī”ti?	bhante nāgasena kim sabbeyeva iva parittam rakkhati iti 
PA_mil_5.2.4:13.2	“Ekacce, mahārāja, rakkhati, ekacce na rakkhatī”ti.	ekacce mahā rāja rakkhati ekacce na rakkhati iti 
PA_mil_5.2.4:13.3	“Tena hi, bhante nāgasena, parittaṁ na sabbatthikan”ti?	tena hi bhante nāgasena parittam na sabbatthikam ti 
PA_mil_5.2.4:13.4	“Api nu kho, mahārāja, bhojanaṁ sabbesaṁ jīvitaṁ rakkhatī”ti?	api nu kho mahā rāja bhojanam sabbesam jīvitam rakkhati iti 
PA_mil_5.2.4:13.5	“Ekacce, bhante, rakkhati, ekacce na rakkhatī”ti.	ekacce bhante rakkhati ekacce na rakkhati iti 
PA_mil_5.2.4:13.6	“Kiṁ kāraṇā”ti.	kim 
PA_mil_5.2.4:13.7	“Yato, bhante, ekacce taṁyeva bhojanaṁ atibhuñjitvā visūcikāya marantī”ti.	yatas bhante ekacce tayā iva bhojanam atibhuñjitvā visūcikāya maranti iti 
PA_mil_5.2.4:13.8	“Tena hi, mahārāja, bhojanaṁ na sabbesaṁ jīvitaṁ rakkhatī”ti?	tena hi mahā rāja bhojanam na sabbesam jīvitam rakkhati iti 
PA_mil_5.2.4:13.9	“Dvīhi, bhante nāgasena, kāraṇehi bhojanaṁ jīvitaṁ harati atibhuttena vā usmādubbalatāya vā, āyudadaṁ, bhante nāgasena, bhojanaṁ durupacārena jīvitaṁ haratī”ti.	dvīhi bhante nāgasena kāraṇehi bhojanam jīvitam harati ati bhuttena vā usmā dubbala tāya vā āyudada bhante nāgasena bhojanam durupacārena jīvitam harati iti 
PA_mil_5.2.4:13.10	“Evameva kho, mahārāja, parittaṁ ekacce rakkhati, ekacce na rakkhati.	evam eva kho mahā rāja parittam ekacce rakkhati ekacce na rakkhati 
PA_mil_5.2.4:14.1	Tīhi, mahārāja, kāraṇehi parittaṁ na rakkhati kammāvaraṇena, kilesāvaraṇena, asaddahanatāya.	tīhi mahā rāja kāraṇehi parittam na rakkhati kamma āvaraṇena kilesa āvaraṇena asat dahana tāya 
PA_mil_5.2.4:14.2_0	Sattānurakkhaṇaṁ, mahārāja, parittaṁ attanā katena ārakkhaṁ jahati, yathā, mahārāja,	satta anurakkhaṇa mahā rāja parittam attanā katena ārakkham jahati yathā mahā rāja 
PA_mil_5.2.4:14.2_1	mātā puttaṁ kucchigataṁ poseti, hitena upacārena janeti, janayitvā asucimalasiṅghāṇikamapanetvā	mātā puttam kucchi gatam poseti hitena upacārena janeti janayitvā asuci mala siṅghāṇikam apanetvā 
PA_mil_5.2.4:14.2_2	uttamavarasugandhaṁ upalimpati, so aparena samayena paresaṁ putte akkosante vā paharante vā pahāraṁ deti.	uttama vara sugandham upalimpati saḥ aparena samayena paresam putte akkosante vā paharante vā pahāram deti 
PA_mil_5.2.4:14.3	Te tassa kujjhitvā parisāya ākaḍḍhitvā taṁ gahetvā sāmino upanenti, yadi pana tassā putto aparaddho hoti velātivatto.	te tassa kujjhitvā parisāya ākaḍḍhitvā tam gahetvā sāminaḥ upanenti yadi pana tassā puttaḥ aparaddhaḥ hoti velā ativatto 
PA_mil_5.2.4:14.4	Atha naṁ sāmino manussā ākaḍḍhayamānā daṇḍamuggarajāṇumuṭṭhīhi tāḷenti pothenti, api nu kho, mahārāja, tassa mātā labhati ākaḍḍhanaparikaḍḍhanaṁ gāhaṁ sāmino upanayanaṁ kātun”ti?	atha nam sāminaḥ manussāḥ ākaḍḍhayamānāḥ daṇḍa muggara jāṇu muṭṭhīhi tāḷenti pothenti api nu kho mahā rāja tassa mātā labhati ākaḍḍhana parikaḍḍhanam gāham sāminaḥ upanayanam kātunti 
PA_mil_5.2.4:14.5	“Na hi, bhante”ti.	na hi bhantā iti 
PA_mil_5.2.4:14.6	“Kena kāraṇena, mahārājā”ti.	kena kāraṇena mahā rājā ati 
PA_mil_5.2.4:14.7	“Attano, bhante, aparādhenā”ti.	attanaḥ bhante aparādhena ati 
PA_mil_5.2.4:14.8	“Evameva kho, mahārāja, sattānaṁ ārakkhaṁ parittaṁ attano aparādhena vañjhaṁ karotī”ti.	evam eva kho mahā rāja sattānam ārakkham parittam attanaḥ aparādhena vañjham karoti iti 
PA_mil_5.2.4:14.9	“Sādhu, bhante nāgasena, suvinicchito pañho, gahanaṁ agahanaṁ kataṁ, andhakāro āloko kato, viniveṭhitaṁ diṭṭhijālaṁ, tvaṁ gaṇivarapavaramāsajjā”ti.	sādhu bhante nāgasena su vinicchito pañhaḥ gahanam agahanam andhakāro āloko kataḥ viniveṭhitam diṭṭhi jāla tvam gaṇi vara pavaram āsajjāti 
PA_mil_5.2.4:15.1	Maccupāsamuttipañho catuttho.	maccu pāsamutti pañhaḥ catutthaḥ 
