segmentnr	original	analyzed
PA_mn_127:14.21_0	“Taṁ kiṁ maññasi, āvuso kaccāna, yvāyaṁ bhikkhu yāvatā ekaṁ mahārajjaṁ ‘mahaggatan’ti	▁taṃ ▁kiṃ ▁maññ asi ▁āvuso ▁ka cc āna ▁y vā yaṃ ▁bhikkhu ▁yāva tā ▁ekaṃ ▁mahā rajj aṃ ▁mahaggat anti
PA_mn_127:14.21_1	pharitvā adhimuccitvā viharati, yo cāyaṁ bhikkhu yāvatā dve vā tīṇi vā mahārajjāni	▁p haritvā ▁adhi mu cc itvā ▁viharati ▁yo ▁cā yaṃ ▁bhikkhu ▁yāva tā ▁dve ▁vā ▁tīṇi ▁vā ▁mahā rajj āni
PA_mn_127:14.21_2	‘mahaggatan’ti pharitvā adhimuccitvā viharati—	▁mahaggat anti ▁p haritvā ▁adhi mu cc itvā ▁viharati
PA_mn_127:14.22	imāsaṁ ubhinnaṁ cittabhāvanānaṁ katamā cittabhāvanā mahaggatatarā”ti?	▁imā saṃ ▁ubhinnaṃ ▁citta bhāvanā naṃ ▁katamā ▁citta bhāvanā ▁mahaggat atar āti
PA_mn_127:14.23	“Yvāyaṁ, bhante, bhikkhu yāvatā dve vā tīṇi vā mahārajjāni ‘mahaggatan’ti pharitvā adhimuccitvā viharati—	▁y vā yaṃ ▁bhante ▁bhikkhu ▁yāva tā ▁dve ▁vā ▁tīṇi ▁vā ▁mahā rajj āni ▁mahaggat anti ▁p haritvā ▁adhi mu cc itvā ▁viharati
PA_mn_127:14.24	ayaṁ imāsaṁ ubhinnaṁ cittabhāvanānaṁ mahaggatatarā”ti.	▁ayaṃ ▁imā saṃ ▁ubhinnaṃ ▁citta bhāvanā naṃ ▁mahaggat atar āti
PA_mn_127:14.25_0	“Taṁ kiṁ maññasi, āvuso kaccāna, yvāyaṁ bhikkhu yāvatā dve vā tīṇi vā mahārajjāni	▁taṃ ▁kiṃ ▁maññ asi ▁āvuso ▁ka cc āna ▁y vā yaṃ ▁bhikkhu ▁yāva tā ▁dve ▁vā ▁tīṇi ▁vā ▁mahā rajj āni
PA_mn_127:14.25_1	‘mahaggatan’ti pharitvā adhimuccitvā viharati, yo cāyaṁ bhikkhu yāvatā samuddapariyantaṁ	▁mahaggat anti ▁p haritvā ▁adhi mu cc itvā ▁viharati ▁yo ▁cā yaṃ ▁bhikkhu ▁yāva tā ▁ samudd a pariyant aṃ
PA_mn_127:14.25_2	pathaviṁ ‘mahaggatan’ti pharitvā adhimuccitvā viharati—	▁pathavi ṃ ▁mahaggat anti ▁p haritvā ▁adhi mu cc itvā ▁viharati
PA_mn_127:14.26	imāsaṁ ubhinnaṁ cittabhāvanānaṁ katamā cittabhāvanā mahaggatatarā”ti?	▁imā saṃ ▁ubhinnaṃ ▁citta bhāvanā naṃ ▁katamā ▁citta bhāvanā ▁mahaggat atar āti
PA_mn_127:14.27	“Yvāyaṁ, bhante, bhikkhu yāvatā samuddapariyantaṁ pathaviṁ ‘mahaggatan’ti pharitvā adhimuccitvā viharati—	▁y vā yaṃ ▁bhante ▁bhikkhu ▁yāva tā ▁ samudd a pariyant aṃ ▁pathavi ṃ ▁mahaggat anti ▁p haritvā ▁adhi mu cc itvā ▁viharati
PA_mn_127:14.28	ayaṁ imāsaṁ ubhinnaṁ cittabhāvanānaṁ mahaggatatarā”ti?	▁ayaṃ ▁imā saṃ ▁ubhinnaṃ ▁citta bhāvanā naṃ ▁mahaggat atar āti
PA_mn_127:14.29	“Ayaṁ kho, āvuso kaccāna, hetu ayaṁ paccayo, yena tāsaṁ devatānaṁ ekaṁ devanikāyaṁ upapannānaṁ santettha ekaccā devatā parittābhā, santi panettha ekaccā devatā appamāṇābhā”ti.	▁ayaṃ ▁kho ▁āvuso ▁ka cc āna ▁hetu ▁ayaṃ ▁paccayo ▁yena ▁tāsaṃ ▁devatā naṃ ▁ekaṃ ▁deva nikāy aṃ ▁upapann ānaṃ ▁sant ettha ▁ekacc ā ▁devatā ▁paritt ā bhā ▁santi ▁panettha ▁ekacc ā ▁devatā ▁ appamāṇ ā bhā ti
PA_mn_127:15.1	“Sādhu, bhante anuruddha.	▁sādhu ▁bhante ▁anuruddh a
PA_mn_127:15.2	Atthi ca me ettha uttariṁ paṭipucchitabbaṁ.	▁atthi ▁ca ▁me ▁ettha ▁uttari ṃ ▁paṭi pucch itabbaṃ
PA_mn_127:15.3	Yāvatā, bhante, devatā ābhā sabbā tā saṅkiliṭṭhābhā udāhu santettha ekaccā devatā parisuddhābhā”ti?	▁yāva tā ▁bhante ▁devatā ▁ ā bhā ▁sabbā ▁tā ▁ saṃkiliṭṭh ā bhā ▁udāhu ▁sant ettha ▁ekacc ā ▁devatā ▁parisuddh ā bhā ti
PA_mn_127:15.4	“Tadaṅgena kho, āvuso kaccāna, santettha ekaccā devatā saṅkiliṭṭhābhā, santi panettha ekaccā devatā parisuddhābhā”ti.	▁tada ṃg ena ▁kho ▁āvuso ▁ka cc āna ▁sant ettha ▁ekacc ā ▁devatā ▁ saṃkiliṭṭh ā bhā ▁santi ▁panettha ▁ekacc ā ▁devatā ▁parisuddh ā bhā ti
PA_mn_127:16.1_0	“Ko nu kho, bhante, anuruddha, hetu ko paccayo, yena tāsaṁ devatānaṁ ekaṁ devanikāyaṁ	▁ko ▁nu ▁kho ▁bhante ▁anuruddh a ▁hetu ▁ko ▁paccayo ▁yena ▁tāsaṃ ▁devatā naṃ ▁ekaṃ ▁deva nikāy aṃ
PA_mn_127:16.1_1	upapannānaṁ santettha ekaccā devatā saṅkiliṭṭhābhā, santi panettha ekaccā devatā parisuddhābhā”ti?	▁upapann ānaṃ ▁sant ettha ▁ekacc ā ▁devatā ▁ saṃkiliṭṭh ā bhā ▁santi ▁panettha ▁ekacc ā ▁devatā ▁parisuddh ā bhā ti
PA_mn_127:16.2	“Tena hāvuso kaccāna, upamaṁ te karissāmi.	▁tena ▁h āvuso ▁ka cc āna ▁upa maṃ ▁te ▁kar issāmi
PA_mn_127:16.3	Upamāyapidhekacce viññū purisā bhāsitassa atthaṁ ājānanti.	▁upamā ya pi dh eka cc e ▁viññū ▁puris ā ▁bhāsit assa ▁atthaṃ ▁ ā jān anti
PA_mn_127:16.4	Seyyathāpi, āvuso kaccāna, telappadīpassa jhāyato telampi aparisuddhaṁ vaṭṭipi aparisuddhā.	▁seyyathāpi ▁āvuso ▁ka cc āna ▁te l appa dīp assa ▁jhāy ato ▁te l ampi ▁a parisuddh aṃ ▁vaṭṭ i pi ▁a parisuddh ā
PA_mn_127:16.5	So telassapi aparisuddhattā vaṭṭiyāpi aparisuddhattā andhandhaṁ viya jhāyati;	▁so ▁te l assa pi ▁a parisuddh attā ▁vaṭṭ iyā pi ▁a parisuddh attā ▁andh an dh aṃ ▁viya ▁jhāy ati
PA_mn_127:16.6	evameva kho, āvuso kaccāna, idhekacco bhikkhu ‘saṅkiliṭṭhābhā’ti pharitvā adhimuccitvā viharati,	▁evameva ▁kho ▁āvuso ▁ka cc āna ▁idhekacco ▁bhikkhu ▁ saṃkiliṭṭh ā bhā ti ▁p haritvā ▁adhi mu cc itvā ▁viharati
PA_mn_127:16.7	tassa kāyaduṭṭhullampi na suppaṭippassaddhaṁ hoti, thinamiddhampi na susamūhataṁ hoti, uddhaccakukkuccampi na suppaṭivinītaṁ hoti.	▁tassa ▁kāya duṭṭh u ll ampi ▁na ▁su p paṭippassaddh aṃ ▁hoti ▁thinamiddh ampi ▁na ▁su samūh ataṃ ▁hoti ▁ uddh a cca kukku cc ampi ▁na ▁su ppaṭi vi nī taṃ ▁hoti
PA_mn_127:16.8	So kāyaduṭṭhullassapi na suppaṭippassaddhattā thinamiddhassapi na susamūhatattā uddhaccakukkuccassapi na suppaṭivinītattā andhandhaṁ viya jhāyati.	▁so ▁kāya duṭṭh u ll assa pi ▁na ▁su p paṭippassaddh attā ▁thinamiddh assa pi ▁na ▁su samūh at attā ▁ uddh a cca kukku cc assa pi ▁na ▁su ppaṭi vi nī t attā ▁andh an dh aṃ ▁viya ▁jhāy ati
PA_mn_127:16.9	So kāyassa bhedā paraṁ maraṇā saṅkiliṭṭhābhānaṁ devānaṁ sahabyataṁ upapajjati.	▁so ▁kāyassa ▁bhed ā ▁paraṃ ▁maraṇā ▁ saṃkiliṭṭh ā bh ānaṃ ▁dev ānaṃ ▁saha bya taṃ ▁upapajj ati
PA_mn_127:16.10	Seyyathāpi, āvuso kaccāna, telappadīpassa jhāyato telampi parisuddhaṁ vaṭṭipi parisuddhā.	▁seyyathāpi ▁āvuso ▁ka cc āna ▁te l appa dīp assa ▁jhāy ato ▁te l ampi ▁parisuddh aṃ ▁vaṭṭ i pi ▁parisuddh ā
PA_mn_127:16.11	So telassapi parisuddhattā vaṭṭiyāpi parisuddhattā na andhandhaṁ viya jhāyati;	▁so ▁te l assa pi ▁parisuddh attā ▁vaṭṭ iyā pi ▁parisuddh attā ▁na ▁andh an dh aṃ ▁viya ▁jhāy ati
PA_mn_127:16.12	evameva kho, āvuso kaccāna, idhekacco bhikkhu ‘parisuddhābhā’ti pharitvā adhimuccitvā viharati.	▁evameva ▁kho ▁āvuso ▁ka cc āna ▁idhekacco ▁bhikkhu ▁parisuddh ā bhā ti ▁p haritvā ▁adhi mu cc itvā ▁viharati
PA_mn_127:16.13	Tassa kāyaduṭṭhullampi suppaṭippassaddhaṁ hoti, thinamiddhampi susamūhataṁ hoti, uddhaccakukkuccampi suppaṭivinītaṁ hoti.	▁tassa ▁kāya duṭṭh u ll ampi ▁su p paṭippassaddh aṃ ▁hoti ▁thinamiddh ampi ▁su samūh ataṃ ▁hoti ▁ uddh a cca kukku cc ampi ▁su ppaṭi vi nī taṃ ▁hoti
PA_mn_127:16.14	So kāyaduṭṭhullassapi suppaṭippassaddhattā thinamiddhassapi susamūhatattā uddhaccakukkuccassapi suppaṭivinītattā na andhandhaṁ viya jhāyati.	▁so ▁kāya duṭṭh u ll assa pi ▁su p paṭippassaddh attā ▁thinamiddh assa pi ▁su samūh at attā ▁ uddh a cca kukku cc assa pi ▁su ppaṭi vi nī t attā ▁na ▁andh an dh aṃ ▁viya ▁jhāy ati
PA_mn_127:16.15	So kāyassa bhedā paraṁ maraṇā parisuddhābhānaṁ devānaṁ sahabyataṁ upapajjati.	▁so ▁kāyassa ▁bhed ā ▁paraṃ ▁maraṇā ▁parisuddh ā bh ānaṃ ▁dev ānaṃ ▁saha bya taṃ ▁upapajj ati
PA_mn_127:16.16	Ayaṁ kho, āvuso kaccāna, hetu ayaṁ paccayo yena tāsaṁ devatānaṁ ekaṁ devanikāyaṁ upapannānaṁ santettha ekaccā devatā saṅkiliṭṭhābhā, santi panettha ekaccā devatā parisuddhābhā”ti.	▁ayaṃ ▁kho ▁āvuso ▁ka cc āna ▁hetu ▁ayaṃ ▁paccayo ▁yena ▁tāsaṃ ▁devatā naṃ ▁ekaṃ ▁deva nikāy aṃ ▁upapann ānaṃ ▁sant ettha ▁ekacc ā ▁devatā ▁ saṃkiliṭṭh ā bhā ▁santi ▁panettha ▁ekacc ā ▁devatā ▁parisuddh ā bhā ti
PA_mn_127:17.1	Evaṁ vutte, āyasmā sabhiyo kaccāno āyasmantaṁ anuruddhaṁ etadavoca:	▁evaṃ ▁vutte ▁āyasmā ▁ sabh iyo ▁ka cc ā no ▁āyasmant aṃ ▁anuruddh aṃ ▁etadavoca
PA_mn_127:17.2	“sādhu, bhante anuruddha.	▁sādhu ▁bhante ▁anuruddh a
PA_mn_127:17.3	Na, bhante, āyasmā anuruddho evamāha:	▁na ▁bhante ▁āyasmā ▁anuruddh o ▁evamāha
PA_mn_127:17.4	‘evaṁ me sutan’ti vā ‘evaṁ arahati bhavitun’ti vā;	▁evaṃ ▁me ▁sut anti ▁vā ▁evaṃ ▁araha ti ▁bhav itunti ▁vā
PA_mn_127:17.5	atha ca pana, bhante, āyasmā anuruddho ‘evampi tā devatā, itipi tā devatā’tveva bhāsati.	▁atha ▁ca ▁pana ▁bhante ▁āyasmā ▁anuruddh o ▁evampi ▁tā ▁devatā ▁iti pi ▁tā ▁devatā tveva ▁bhāsa ti
PA_mn_127:17.6	Tassa mayhaṁ, bhante, evaṁ hoti:	▁tassa ▁mayhaṃ ▁bhante ▁evaṃ ▁hoti
PA_mn_127:17.7	‘addhā āyasmatā anuruddhena tāhi devatāhi saddhiṁ sannivutthapubbañceva sallapitapubbañca sākacchā ca samāpajjitapubbā’”ti.	▁addhā ▁ āya s mat ā ▁anuruddh ena ▁tā hi ▁devatā hi ▁saddhiṃ ▁sanni vutth a pubb añceva ▁ sall ap ita pubb añca ▁sā kacch ā ▁ca ▁samāpajji ta pubb āti
PA_mn_127:17.8	“Addhā kho ayaṁ, āvuso kaccāna, āsajja upanīya vācā bhāsitā,	▁addhā ▁kho ▁ayaṃ ▁āvuso ▁ka cc āna ▁ ā sajj a ▁up anīy a ▁vāc ā ▁bhāsit ā
PA_mn_127:17.9	api ca te ahaṁ byākarissāmi:	▁api ▁ca ▁te ▁ahaṃ ▁byākar issāmi
PA_mn_127:17.10	‘dīgharattaṁ kho me, āvuso kaccāna, tāhi devatāhi saddhiṁ sannivutthapubbañceva sallapitapubbañca sākacchā ca samāpajjitapubbā’”ti.	▁dīgharattaṃ ▁kho ▁me ▁āvuso ▁ka cc āna ▁tā hi ▁devatā hi ▁saddhiṃ ▁sanni vutth a pubb añceva ▁ sall ap ita pubb añca ▁sā kacch ā ▁ca ▁samāpajji ta pubb āti
PA_mn_127:18.1	Evaṁ vutte, āyasmā sabhiyo kaccāno pañcakaṅgaṁ thapatiṁ etadavoca:	▁evaṃ ▁vutte ▁āyasmā ▁ sabh iyo ▁ka cc ā no ▁pañca kaṃ g aṃ ▁ tha pati ṃ ▁etadavoca
PA_mn_127:18.2	“lābhā te, gahapati, suladdhaṁ te, gahapati,	▁lābh ā ▁te ▁gahapati ▁su laddh aṃ ▁te ▁gahapati
PA_mn_127:18.3	yaṁ tvañceva taṁ kaṅkhādhammaṁ pahāsi, mayañcimaṁ dhammapariyāyaṁ alatthamhā savanāyā”ti.	▁yaṃ ▁tv añceva ▁taṃ ▁kaṃkhā dhamm aṃ ▁pah āsi ▁ma ya ñc i maṃ ▁dhamma pariyāy aṃ ▁ala tth amhā ▁savan āyāti
PA_mn_127:18.4	Anuruddhasuttaṁ niṭṭhitaṁ sattamaṁ.	▁anuruddh asuttaṃ ▁niṭṭhitaṃ ▁sattam aṃ
