segmentnr	original	analyzed
PA_mn_48:12.10	‘yathārūpāya dhammatāya diṭṭhisampanno puggalo samannāgato, ahampi tathārūpāya dhammatāya samannāgato’ti.	▁yathā rūp āya ▁dhamm atāya ▁diṭṭhi sampann o ▁puggalo ▁samannāgato ▁ah ampi ▁tathārūp āya ▁dhamm atāya ▁samannāgato ti
PA_mn_48:12.11	Idamassa pañcamaṁ ñāṇaṁ adhigataṁ hoti ariyaṁ lokuttaraṁ asādhāraṇaṁ puthujjanehi.	▁idam assa ▁pañcam aṃ ▁ñāṇaṃ ▁adhigat aṃ ▁hoti ▁ariy aṃ ▁lokuttar aṃ ▁a sādhāraṇ aṃ ▁puthujjan ehi
PA_mn_48:13.1	Puna caparaṁ, bhikkhave, ariyasāvako iti paṭisañcikkhati:	▁puna ▁caparaṃ ▁bhikkhave ▁ariyasāvak o ▁iti ▁paṭi sa ñc ikkh ati
PA_mn_48:13.2	‘yathārūpāya balatāya diṭṭhisampanno puggalo samannāgato, ahampi tathārūpāya balatāya samannāgato’ti.	▁yathā rūp āya ▁bal atāya ▁diṭṭhi sampann o ▁puggalo ▁samannāgato ▁ah ampi ▁tathārūp āya ▁bal atāya ▁samannāgato ti
PA_mn_48:13.3	Kathaṁrūpāya ca, bhikkhave, balatāya diṭṭhisampanno puggalo samannāgato?	▁kathaṃ rūp āya ▁ca ▁bhikkhave ▁bal atāya ▁diṭṭhi sampann o ▁puggalo ▁samannāgato
PA_mn_48:13.4	Balatā esā, bhikkhave, diṭṭhisampannassa puggalassa yaṁ tathāgatappavedite dhammavinaye desiyamāne aṭṭhiṁ katvā manasikatvā sabbacetasā samannāharitvā ohitasoto dhammaṁ suṇāti.	▁bal atā ▁esā ▁bhikkhave ▁diṭṭhi sampann assa ▁puggalassa ▁yaṃ ▁tathāgat appa ved ite ▁dhammavinay e ▁des iyamāne ▁aṭṭh iṃ ▁katvā ▁manasi kat vā ▁sabba cet a sā ▁sam an nā haritvā ▁ o hita sot o ▁dhammaṃ ▁suṇ āti
PA_mn_48:13.5	So evaṁ pajānāti:	▁so ▁evaṃ ▁pajānāti
PA_mn_48:13.6	‘yathārūpāya balatāya diṭṭhisampanno puggalo samannāgato, ahampi tathārūpāya balatāya samannāgato’ti.	▁yathā rūp āya ▁bal atāya ▁diṭṭhi sampann o ▁puggalo ▁samannāgato ▁ah ampi ▁tathārūp āya ▁bal atāya ▁samannāgato ti
PA_mn_48:13.7	Idamassa chaṭṭhaṁ ñāṇaṁ adhigataṁ hoti ariyaṁ lokuttaraṁ asādhāraṇaṁ puthujjanehi.	▁idam assa ▁chaṭṭh aṃ ▁ñāṇaṃ ▁adhigat aṃ ▁hoti ▁ariy aṃ ▁lokuttar aṃ ▁a sādhāraṇ aṃ ▁puthujjan ehi
PA_mn_48:14.1	Puna caparaṁ, bhikkhave, ariyasāvako iti paṭisañcikkhati:	▁puna ▁caparaṃ ▁bhikkhave ▁ariyasāvak o ▁iti ▁paṭi sa ñc ikkh ati
PA_mn_48:14.2	‘yathārūpāya balatāya diṭṭhisampanno puggalo samannāgato, ahampi tathārūpāya balatāya samannāgato’ti.	▁yathā rūp āya ▁bal atāya ▁diṭṭhi sampann o ▁puggalo ▁samannāgato ▁ah ampi ▁tathārūp āya ▁bal atāya ▁samannāgato ti
PA_mn_48:14.3	Kathaṁrūpāya ca, bhikkhave, balatāya diṭṭhisampanno puggalo samannāgato?	▁kathaṃ rūp āya ▁ca ▁bhikkhave ▁bal atāya ▁diṭṭhi sampann o ▁puggalo ▁samannāgato
PA_mn_48:14.4	Balatā esā, bhikkhave, diṭṭhisampannassa puggalassa yaṁ tathāgatappavedite dhammavinaye desiyamāne labhati atthavedaṁ, labhati dhammavedaṁ, labhati dhammūpasaṁhitaṁ pāmojjaṁ.	▁bal atā ▁esā ▁bhikkhave ▁diṭṭhi sampann assa ▁puggalassa ▁yaṃ ▁tathāgat appa ved ite ▁dhammavinay e ▁des iyamāne ▁labhati ▁attha ved aṃ ▁labhati ▁dhamma ved aṃ ▁labhati ▁dhamm ūpa saṃ hitaṃ ▁pāmojj aṃ
PA_mn_48:14.5	So evaṁ pajānāti:	▁so ▁evaṃ ▁pajānāti
PA_mn_48:14.6	‘yathārūpāya balatāya diṭṭhisampanno puggalo samannāgato, ahampi tathārūpāya balatāya samannāgato’ti.	▁yathā rūp āya ▁bal atāya ▁diṭṭhi sampann o ▁puggalo ▁samannāgato ▁ah ampi ▁tathārūp āya ▁bal atāya ▁samannāgato ti
PA_mn_48:14.7	Idamassa sattamaṁ ñāṇaṁ adhigataṁ hoti ariyaṁ lokuttaraṁ asādhāraṇaṁ puthujjanehi.	▁idam assa ▁sattam aṃ ▁ñāṇaṃ ▁adhigat aṃ ▁hoti ▁ariy aṃ ▁lokuttar aṃ ▁a sādhāraṇ aṃ ▁puthujjan ehi
PA_mn_48:15.1	Evaṁ sattaṅgasamannāgatassa kho, bhikkhave, ariyasāvakassa dhammatā susamanniṭṭhā hoti sotāpattiphalasacchikiriyāya.	▁evaṃ ▁satta ṃg a samannāgat assa ▁kho ▁bhikkhave ▁ariyasāvak assa ▁dhamm atā ▁su sam an niṭṭh ā ▁hoti ▁sotāpattiphal a sacchikiriy āya
PA_mn_48:15.2	Evaṁ sattaṅgasamannāgato kho, bhikkhave, ariyasāvako sotāpattiphalasamannāgato hotī”ti.	▁evaṃ ▁satta ṃg a samannāgat o ▁kho ▁bhikkhave ▁ariyasāvak o ▁sotāpattiphal a samannāgat o ▁hotīti
PA_mn_48:15.3	Idamavoca bhagavā.	▁idam a vo ca ▁bhagavā
PA_mn_48:15.4	Attamanā te bhikkhū bhagavato bhāsitaṁ abhinandunti.	▁att aman ā ▁te ▁bhikkhū ▁bhagavato ▁bhāsitaṃ ▁abhinand u nti
PA_mn_48:15.5	Kosambiyasuttaṁ niṭṭhitaṁ aṭṭhamaṁ.	▁ko sa mb iy asuttaṃ ▁niṭṭhitaṃ ▁aṭṭham aṃ
