segmentnr	original	analyzed
PA_mn_58:0.1	Majjhima Nikāya 58	majjhima nikāya 
PA_mn_58:0.2	Abhayarājakumārasutta	abhaya rāja kumāra sutta 
PA_mn_58:1.1	Evaṁ me sutaṁ—	evam me suta 
PA_mn_58:1.2	ekaṁ samayaṁ bhagavā rājagahe viharati veḷuvane kalandakanivāpe.	ekam samayam bhagavā rājagahe viharati veḷuvane kalandakanivāpe 
PA_mn_58:2.1_0	Atha kho abhayo rājakumāro yena nigaṇṭho nāṭaputto tenupasaṅkami; upasaṅkamitvā nigaṇṭhaṁ	atha kho abhayaḥ rāja kumāraḥ yena nigaṇṭhaḥ nāṭa putto tena upasaṅkami upasaṅkamitvā nigaṇṭha 
PA_mn_58:2.1_1	nāṭaputtaṁ abhivādetvā ekamantaṁ nisīdi. Ekamantaṁ nisinnaṁ kho abhayaṁ rājakumāraṁ	nāṭa puttam abhivādetvā ekamantam nisīdi ekamantam nisinnam kho abhayam rāja kumāra 
PA_mn_58:2.1_2	nigaṇṭho nāṭaputto etadavoca:	nigaṇṭhaḥ nāṭa puttaḥ etat avoca 
PA_mn_58:3.1	“ehi tvaṁ, rājakumāra, samaṇassa gotamassa vādaṁ āropehi.	ehi tva rāja kumāra samaṇassa gotamassa vādam āropehi 
PA_mn_58:3.2	Evaṁ te kalyāṇo kittisaddo abbhuggacchissati:	evam te kalyāṇaḥ kitti saddaḥ abbhuggacchissati 
PA_mn_58:3.3	‘abhayena rājakumārena samaṇassa gotamassa evaṁ mahiddhikassa evaṁ mahānubhāvassa vādo āropito’”ti.	abhayena rāja kumārena samaṇassa gotamassa evam mahiddhikassa evam mahā anubhāvassa vādaḥ āropito ti 
PA_mn_58:3.4	“Yathā kathaṁ panāhaṁ, bhante, samaṇassa gotamassa evaṁ mahiddhikassa evaṁ mahānubhāvassa vādaṁ āropessāmī”ti?	yathā katham pana āha bhante samaṇassa gotamassa evam mahiddhikassa evam mahā anubhāvassa vādam āropessāmi iti 
PA_mn_58:3.5	“Ehi tvaṁ, rājakumāra, yena samaṇo gotamo tenupasaṅkama; upasaṅkamitvā samaṇaṁ gotamaṁ evaṁ vadehi:	ehi tva rāja kumāra yena samaṇaḥ gotamaḥ tena upasaṅkama upasaṅkamitvā samaṇam gotamam evam vadehi 
PA_mn_58:3.6	‘bhāseyya nu kho, bhante, tathāgato taṁ vācaṁ yā sā vācā paresaṁ appiyā amanāpā’ti?	bhāseyya nu kho bhante tathāgataḥ tam vācam yā sā vācā paresam appiyā amanāpā ati 
PA_mn_58:3.7	Sace te samaṇo gotamo evaṁ puṭṭho evaṁ byākaroti:	sace te samaṇaḥ gotamaḥ evam puṭṭhaḥ evam byākaroti 
PA_mn_58:3.8	‘bhāseyya, rājakumāra, tathāgato taṁ vācaṁ yā sā vācā paresaṁ appiyā amanāpā’ti, tamenaṁ tvaṁ evaṁ vadeyyāsi:	rāja kumāra tathāgataḥ tam vācam yā sā vācā paresam appiyā amanāpā ati tam enam tvam evam vadeyyāsi 
PA_mn_58:3.9	‘atha kiñcarahi te, bhante, puthujjanena nānākaraṇaṁ?	atha kiñcarahi te bhante puthujjanena nānākaraṇa 
PA_mn_58:3.10	Puthujjanopi hi taṁ vācaṁ bhāseyya yā sā vācā paresaṁ appiyā amanāpā’ti.	puthujjanaḥ api hi tam vācam bhāseyya yā sā vācā paresam appiyā amanāpā ati 
PA_mn_58:3.11	Sace pana te samaṇo gotamo evaṁ puṭṭho evaṁ byākaroti:	sace pana te samaṇaḥ gotamaḥ evam puṭṭhaḥ evam byākaroti 
PA_mn_58:3.12	‘na, rājakumāra, tathāgato taṁ vācaṁ bhāseyya yā sā vācā paresaṁ appiyā amanāpā’ti, tamenaṁ tvaṁ evaṁ vadeyyāsi:	na rāja kumāra tathāgataḥ tam vācam bhāseyya yā sā vācā paresam appiyā amanāpā ati tam enam tvam evam vadeyyāsi 
PA_mn_58:3.13	‘atha kiñcarahi te, bhante, devadatto byākato:	atha kiñcarahi te bhante devadattaḥ byākataḥ 
PA_mn_58:3.14	“āpāyiko devadatto, nerayiko devadatto, kappaṭṭho devadatto, atekiccho devadatto”ti?	āpāyikaḥ devadattaḥ nerayikaḥ devadatto kappaṭṭhaḥ devadatto atekicchaḥ devadatto ti 
PA_mn_58:3.15	Tāya ca pana te vācāya devadatto kupito ahosi anattamano’ti.	tāya ca pana te vācāya devadatto kupitaḥ ahosi 
PA_mn_58:3.16	Imaṁ kho te, rājakumāra, samaṇo gotamo ubhatokoṭikaṁ pañhaṁ puṭṭho samāno neva sakkhiti uggilituṁ na sakkhiti ogilituṁ.	imam kho te rāja kumāra samaṇaḥ gotamaḥ ubhatokoṭikam pañham puṭṭhaḥ samānaḥ na iva sakkhiti uggilitum na sakkhiti ogilitu 
PA_mn_58:3.17	Seyyathāpi nāma purisassa ayosiṅghāṭakaṁ kaṇṭhe vilaggaṁ, so neva sakkuṇeyya uggilituṁ na sakkuṇeyya ogilituṁ;	seyyathā api nāma purisassa ayaḥ siṅghāṭakam kaṇṭhe vilagga saḥ na iva sakkuṇeyya uggilitum na sakkuṇeyya ogilitu 
PA_mn_58:3.18	evameva kho te, rājakumāra, samaṇo gotamo imaṁ ubhatokoṭikaṁ pañhaṁ puṭṭho samāno neva sakkhiti uggilituṁ na sakkhiti ogilitun”ti.	evam eva kho te rāja kumāra samaṇaḥ gotamaḥ imam ubhatokoṭikam pañham puṭṭhaḥ samānaḥ na iva sakkhiti uggilitum na sakkhiti ogilitum ti 
PA_mn_58:4.1_0	“Evaṁ, bhante”ti kho abhayo rājakumāro nigaṇṭhassa nāṭaputtassa paṭissutvā uṭṭhāyāsanā	eva bhante iti kho abhayaḥ rāja kumāraḥ nigaṇṭhassa nāṭa puttassa paṭissutvā uṭṭhāya āsanā 
PA_mn_58:4.1_1	nigaṇṭhaṁ nāṭaputtaṁ abhivādetvā padakkhiṇaṁ katvā yena bhagavā tenupasaṅkami; upasaṅkamitvā	nigaṇṭham nāṭa puttam abhivādetvā padakkhiṇam katvā yena bhagavā tena upasaṅkami upasaṅkamitvā 
PA_mn_58:4.1_2	bhagavantaṁ abhivādetvā ekamantaṁ nisīdi.	bhagavantam abhivādetvā ekamantam nisīdi 
PA_mn_58:4.2	Ekamantaṁ nisinnassa kho abhayassa rājakumārassa sūriyaṁ ulloketvā etadahosi:	ekamantam nisinnassa kho abhayassa rāja kumārassa sūriyam ulloketvā etat ahosi 
PA_mn_58:4.3	“akālo kho ajja bhagavato vādaṁ āropetuṁ.	akālaḥ khalu ajja bhagavataḥ vādam āropetu 
PA_mn_58:4.4	Sve dānāhaṁ sake nivesane bhagavato vādaṁ āropessāmī”ti bhagavantaṁ etadavoca:	sve dāna aham sake nivesane bhagavataḥ vādam āropessāmi iti bhagavantam etat avoca 
PA_mn_58:4.5	“adhivāsetu me, bhante, bhagavā svātanāya attacatuttho bhattan”ti.	adhivāsetu me bhante bhagavā svātanāya atta catutthaḥ 
PA_mn_58:4.6	Adhivāsesi bhagavā tuṇhībhāvena.	adhivāsesi bhagavā tuṇhībhāvena 
PA_mn_58:5.1	Atha kho abhayo rājakumāro bhagavato adhivāsanaṁ viditvā uṭṭhāyāsanā bhagavantaṁ abhivādetvā padakkhiṇaṁ katvā pakkāmi.	atha kho abhayaḥ rāja kumāraḥ bhagavataḥ adhivāsanam viditvā uṭṭhāya āsanā bhagavantam abhivādetvā padakkhiṇam katvā pakkāmi 
PA_mn_58:5.2	Atha kho bhagavā tassā rattiyā accayena pubbaṇhasamayaṁ nivāsetvā pattacīvaramādāya yena abhayassa rājakumārassa nivesanaṁ tenupasaṅkami; upasaṅkamitvā paññatte āsane nisīdi.	atha kho bhagavā tassāḥ rattiyāḥ accayena pubbaṇhasamayam nivāsetvā patta cīvaram ādāya yena abhayassa rāja kumārassa nivesanam tena upasaṅkami upasaṅkamitvā paññatte āsane nisīdi 
PA_mn_58:5.3	Atha kho abhayo rājakumāro bhagavantaṁ paṇītena khādanīyena bhojanīyena sahatthā santappesi sampavāresi.	atha kho abhayaḥ rāja kumāraḥ bhagavantam paṇītena khādanīyena bhojanīyena sahatthā santappesi sampavāresi 
PA_mn_58:5.4	Atha kho abhayo rājakumāro bhagavantaṁ bhuttāviṁ onītapattapāṇiṁ aññataraṁ nīcaṁ āsanaṁ gahetvā ekamantaṁ nisīdi.	atha kho abhayaḥ rāja kumāraḥ bhagavantam bhuttāvim onīta patta pāṇim aññataram nīcam āsanam gahetvā ekamantam nisīdi 
PA_mn_58:6.1	Ekamantaṁ nisinno kho abhayo rājakumāro bhagavantaṁ etadavoca:	ekamantam nisinnaḥ khalu abhayaḥ rāja kumāraḥ bhagavantam etat avoca 
PA_mn_58:6.2	“bhāseyya nu kho, bhante, tathāgato taṁ vācaṁ yā sā vācā paresaṁ appiyā amanāpā”ti?	bhāseyya nu kho bhante tathāgataḥ tam vācam yā sā vācā paresam appiyā amanāpā ati 
PA_mn_58:6.3	“Na khvettha, rājakumāra, ekaṁsenā”ti.	na khvettha rāja kumāraḥ eka senā ati 
PA_mn_58:6.4	“Ettha, bhante, anassuṁ nigaṇṭhā”ti.	ettha bhante anassum nigaṇṭhāti 
PA_mn_58:6.5	“Kiṁ pana tvaṁ, rājakumāra, evaṁ vadesi:	kim pana tva rāja kumāra evam vadesi 
PA_mn_58:6.6	‘ettha, bhante, anassuṁ nigaṇṭhā’”ti?	ettha bhante anassum nigaṇṭhāti 
PA_mn_58:6.7_0	“Idhāhaṁ, bhante, yena nigaṇṭho nāṭaputto tenupasaṅkami; upasaṅkamitvā nigaṇṭhaṁ	idha āha bhante yena nigaṇṭhaḥ nāṭa putto tena upasaṅkami upasaṅkamitvā nigaṇṭha 
PA_mn_58:6.7_1	nāṭaputtaṁ abhivādetvā ekamantaṁ nisīdiṁ. Ekamantaṁ nisinnaṁ kho maṁ, bhante, nigaṇṭho	nāṭa puttam abhivādetvā ekamantam nisīdi ekamantam nisinnam kho ma bhante nigaṇṭhaḥ 
PA_mn_58:6.7_2	nāṭaputto etadavoca:	nāṭa puttaḥ etat avoca 
PA_mn_58:6.8	‘ehi tvaṁ, rājakumāra, samaṇassa gotamassa vādaṁ āropehi.	ehi tva rāja kumāra samaṇassa gotamassa vādam āropehi 
PA_mn_58:6.9	Evaṁ te kalyāṇo kittisaddo abbhuggacchissati—	evam te kalyāṇaḥ kitti saddaḥ abbhuggacchissati 
PA_mn_58:6.10	abhayena rājakumārena samaṇassa gotamassa evaṁ mahiddhikassa evaṁ mahānubhāvassa vādo āropito’ti.	abhayena rāja kumārena samaṇassa gotamassa evam mahiddhikassa evam mahā anubhāvassa vādaḥ āropito ti 
PA_mn_58:6.11	Evaṁ vutte, ahaṁ, bhante, nigaṇṭhaṁ nāṭaputtaṁ etadavocaṁ:	evam vutte aha bhante nigaṇṭham nāṭa puttam etat avoca 
PA_mn_58:6.12	‘yathā kathaṁ panāhaṁ, bhante, samaṇassa gotamassa evaṁ mahiddhikassa evaṁ mahānubhāvassa vādaṁ āropessāmī’ti?	yathā katham pana āha bhante samaṇassa gotamassa evam mahiddhikassa evam mahā anubhāvassa vādam āropessāmi iti 
PA_mn_58:6.13	‘Ehi tvaṁ, rājakumāra, yena samaṇo gotamo tenupasaṅkama; upasaṅkamitvā samaṇaṁ gotamaṁ evaṁ vadehi:	ehi tva rāja kumāra yena samaṇaḥ gotamaḥ tena upasaṅkama upasaṅkamitvā samaṇam gotamam evam vadehi 
PA_mn_58:6.14	“bhāseyya nu kho, bhante, tathāgato taṁ vācaṁ yā sā vācā paresaṁ appiyā amanāpā”ti?	bhāseyya nu kho bhante tathāgataḥ tam vācam yā sā vācā paresam appiyā amanāpā ati 
PA_mn_58:6.15	Sace te samaṇo gotamo evaṁ puṭṭho evaṁ byākaroti:	sace te samaṇaḥ gotamaḥ evam puṭṭhaḥ evam byākaroti 
PA_mn_58:6.16	“bhāseyya, rājakumāra, tathāgato taṁ vācaṁ yā sā vācā paresaṁ appiyā amanāpā”ti, tamenaṁ tvaṁ evaṁ vadeyyāsi:	rāja kumāra tathāgataḥ tam vācam yā sā vācā paresam appiyā amanāpā ati tam enam tvam evam vadeyyāsi 
PA_mn_58:6.17	“atha kiñcarahi te, bhante, puthujjanena nānākaraṇaṁ?	atha kiñcarahi te bhante puthujjanena nānākaraṇa 
PA_mn_58:6.18	Puthujjanopi hi taṁ vācaṁ bhāseyya yā sā vācā paresaṁ appiyā amanāpā”ti.	puthujjanaḥ api hi tam vācam bhāseyya yā sā vācā paresam appiyā amanāpā ati 
PA_mn_58:6.19	Sace pana te samaṇo gotamo evaṁ puṭṭho evaṁ byākaroti:	sace pana te samaṇaḥ gotamaḥ evam puṭṭhaḥ evam byākaroti 
PA_mn_58:6.20	“na, rājakumāra, tathāgato taṁ vācaṁ bhāseyya yā sā vācā paresaṁ appiyā amanāpā”ti, tamenaṁ tvaṁ evaṁ vadeyyāsi—	na rāja kumāra tathāgataḥ tam vācam bhāseyya yā sā vācā paresam appiyā amanāpā ati tam enam tvam evam vadeyyāsi 
PA_mn_58:6.21	atha kiñcarahi te, bhante, devadatto byākato:	atha kiñcarahi te bhante devadattaḥ byākataḥ 
PA_mn_58:6.22	“āpāyiko devadatto, nerayiko devadatto, kappaṭṭho devadatto, atekiccho devadatto”ti?	āpāyikaḥ devadattaḥ nerayikaḥ devadatto kappaṭṭhaḥ devadatto atekicchaḥ devadatto ti 
PA_mn_58:6.23	Tāya ca pana te vācāya devadatto kupito ahosi anattamano’ti.	tāya ca pana te vācāya devadatto kupitaḥ ahosi 
PA_mn_58:6.24	Imaṁ kho te, rājakumāra, samaṇo gotamo ubhatokoṭikaṁ pañhaṁ puṭṭho samāno neva sakkhiti uggilituṁ na sakkhiti ogilituṁ.	imam kho te rāja kumāra samaṇaḥ gotamaḥ ubhatokoṭikam pañham puṭṭhaḥ samānaḥ na iva sakkhiti uggilitum na sakkhiti ogilitu 
PA_mn_58:6.25	Seyyathāpi nāma purisassa ayosiṅghāṭakaṁ kaṇṭhe vilaggaṁ, so neva sakkuṇeyya uggilituṁ na sakkuṇeyya ogilituṁ;	seyyathā api nāma purisassa ayaḥ siṅghāṭakam kaṇṭhe vilagga saḥ na iva sakkuṇeyya uggilitum na sakkuṇeyya ogilitu 
PA_mn_58:6.26	evameva kho te, rājakumāra, samaṇo gotamo imaṁ ubhatokoṭikaṁ pañhaṁ puṭṭho samāno neva sakkhiti uggilituṁ na sakkhiti ogilitun”ti.	evam eva kho te rāja kumāra samaṇaḥ gotamaḥ imam ubhatokoṭikam pañham puṭṭhaḥ samānaḥ na iva sakkhiti uggilitum na sakkhiti ogilitum ti 
PA_mn_58:7.1	Tena kho pana samayena daharo kumāro mando uttānaseyyako abhayassa rājakumārassa aṅke nisinno hoti.	tena kho pana samayena daharaḥ kumāraḥ mandaḥ uttānaseyyakaḥ abhayassa rāja kumārassa aṅke nisinnaḥ hoti 
PA_mn_58:7.2	Atha kho bhagavā abhayaṁ rājakumāraṁ etadavoca:	atha khalu bhagavān abhayam rāja kumāram etat avoca 
PA_mn_58:7.3	“Taṁ kiṁ maññasi, rājakumāra,	tam kim maññasi rāja kumāra 
PA_mn_58:7.4	sacāyaṁ kumāro tuyhaṁ vā pamādamanvāya dhātiyā vā pamādamanvāya kaṭṭhaṁ vā kaṭhalaṁ vā mukhe āhareyya, kinti naṁ kareyyāsī”ti?	sacā ayam kumāraḥ tuyham vā pamādam anvāya dhātiyā vā pamādam anvāya kaṭṭham vā kaṭhalam vā mukhe āhareyya kinti nam kareyyāsi iti 
PA_mn_58:7.5	“Āhareyyassāhaṁ, bhante.	āhareyyassa āha bhante 
PA_mn_58:7.6	Sace, bhante, na sakkuṇeyyaṁ ādikeneva āhattuṁ, vāmena hatthena sīsaṁ pariggahetvā dakkhiṇena hatthena vaṅkaṅguliṁ karitvā salohitampi āhareyyaṁ.	sace bhante na sakkuṇeyyam ādikena iva āhattu vāmena hatthena sīsam pariggahetvā dakkhiṇena hatthena vaṅkaṅgulim karitvā sa lohitam pi āhareyya 
PA_mn_58:7.7	Taṁ kissa hetu?	tam kim sa hetu 
PA_mn_58:7.8	Atthi me, bhante, kumāre anukampā”ti.	atthi me bhante kumāre anukampā ati 
PA_mn_58:8.1	“Evameva kho, rājakumāra, yaṁ tathāgato vācaṁ jānāti abhūtaṁ atacchaṁ anatthasaṁhitaṁ sā ca paresaṁ appiyā amanāpā, na taṁ tathāgato vācaṁ bhāsati.	evam eva kho rāja kumāra yam tathāgataḥ vācam jānāti abhūtam ataccham anattha sahitam sā ca paresam appiyā amanāpā na tam tathāgataḥ vācam bhāsati 
PA_mn_58:8.2	Yampi tathāgato vācaṁ jānāti bhūtaṁ tacchaṁ anatthasaṁhitaṁ sā ca paresaṁ appiyā amanāpā, tampi tathāgato vācaṁ na bhāsati.	yam pi tathāgataḥ vācam jānāti bhūtam tat śam anattha sahitam sā ca paresam appiyā amanāpā tam pi tathāgataḥ vācam na bhāsati 
PA_mn_58:8.3	Yañca kho tathāgato vācaṁ jānāti bhūtaṁ tacchaṁ atthasaṁhitaṁ sā ca paresaṁ appiyā amanāpā, tatra kālaññū tathāgato hoti tassā vācāya veyyākaraṇāya.	yat ca kho tathāgataḥ vācam jānāti bhūtam taccham attha sahitam sā ca paresam appiyā amanāpā tatra kālaññū tathāgataḥ hoti tassāḥ vācāya veyyākaraṇāya 
PA_mn_58:8.4	Yaṁ tathāgato vācaṁ jānāti abhūtaṁ atacchaṁ anatthasaṁhitaṁ sā ca paresaṁ piyā manāpā, na taṁ tathāgato vācaṁ bhāsati.	yam tathāgataḥ vācam jānāti a bhūtam a taccham anattha sahitam sā ca paresam piyā manāpā na tam tathāgataḥ vācam bhāsati 
PA_mn_58:8.5	Yampi tathāgato vācaṁ jānāti bhūtaṁ tacchaṁ anatthasaṁhitaṁ sā ca paresaṁ piyā manāpā tampi tathāgato vācaṁ na bhāsati.	yam pi tathāgataḥ vācam jānāti bhūtam tat śam anattha sahitam sā ca paresam piyā manāpā tam pi tathāgataḥ vācam na bhāsati 
PA_mn_58:8.6	Yañca tathāgato vācaṁ jānāti bhūtaṁ tacchaṁ atthasaṁhitaṁ sā ca paresaṁ piyā manāpā, tatra kālaññū tathāgato hoti tassā vācāya veyyākaraṇāya.	yat ca tathāgataḥ vācam jānāti bhūtam taccham attha sahitam sā ca paresam piyā manāpā tatra kālaññū tathāgataḥ hoti tassāḥ vācāya veyyākaraṇāya 
PA_mn_58:8.7	Taṁ kissa hetu?	tam kim sa hetu 
PA_mn_58:8.8	Atthi, rājakumāra, tathāgatassa sattesu anukampā”ti.	atthi rāja kumāra tathāgatassa sattesu anukampā ati 
PA_mn_58:9.1	“Yeme, bhante, khattiyapaṇḍitāpi brāhmaṇapaṇḍitāpi gahapatipaṇḍitāpi samaṇapaṇḍitāpi pañhaṁ abhisaṅkharitvā tathāgataṁ upasaṅkamitvā pucchanti,	ye ime bhante khattiya paṇḍitā api brāhmaṇa paṇḍitā api gahapati paṇḍitā api samaṇa paṇḍitā api pañham abhisaṅkharitvā tathāgatam upasaṅkamitvā pucchanti 
PA_mn_58:9.2_0	pubbeva nu kho, etaṁ, bhante, bhagavato cetaso parivitakkitaṁ hoti ‘ye maṁ upasaṅkamitvā	pubbā iva nu kho eta bhante bhagavataḥ cetasaḥ parivitakkitam hoti ye mama upasaṅkamitvā 
PA_mn_58:9.2_1	evaṁ pucchissanti tesāhaṁ evaṁ puṭṭho evaṁ byākarissāmī’ti, udāhu ṭhānasovetaṁ tathāgataṁ paṭibhātī”ti?	evam pucchissanti evam puṭṭhaḥ evam byākarissāmi iti udāhu ṭhānasā uvā etam tathāgatam paṭibhāti iti 
PA_mn_58:10.1	“Tena hi, rājakumāra, taññevettha paṭipucchissāmi, yathā te khameyya tathā naṁ byākareyyāsi.	tena hi rāja kumāra tam na eva īttha paṭipucchissāmi yathā te khameyya tathā nam byākareyyāsi 
PA_mn_58:10.2	Taṁ kiṁ maññasi, rājakumāra,	tam kim maññasi rāja kumāra 
PA_mn_58:10.3	kusalo tvaṁ rathassa aṅgapaccaṅgānan”ti?	kusalaḥ tvam rathassa aṅga paccaṅga ananti 
PA_mn_58:10.4	“Evaṁ, bhante, kusalo ahaṁ rathassa aṅgapaccaṅgānan”ti.	eva bhante kusalaḥ aham rathassa aṅga paccaṅgānanti 
PA_mn_58:10.5	“Taṁ kiṁ maññasi, rājakumāra,	tam kim maññasi rāja kumāra 
PA_mn_58:10.6	ye taṁ upasaṅkamitvā evaṁ puccheyyuṁ:	ye tam upasaṅkamitvā evam puccheyyu 
PA_mn_58:10.7	‘kiṁ nāmidaṁ rathassa aṅgapaccaṅgan’ti?	kim nāma idam rathassa aṅga paccaṅganti 
PA_mn_58:10.8	Pubbeva nu kho te etaṁ cetaso parivitakkitaṁ assa ‘ye maṁ upasaṅkamitvā evaṁ pucchissanti tesāhaṁ evaṁ puṭṭho evaṁ byākarissāmī’ti, udāhu ṭhānasovetaṁ paṭibhāseyyā”ti?	pubbā iva nu kho te etam cetasaḥ parivitakkitam assa ye mama upasaṅkamitvā evam pucchissanti tesa aham evam puṭṭhaḥ evam byākarissāmi iti udāhu ṭhānasā uva etam paṭibhāseyya ati 
PA_mn_58:10.9	“Ahañhi, bhante, rathiko saññāto kusalo rathassa aṅgapaccaṅgānaṁ.	aham hi bhante rathiko saññātaḥ kusalaḥ rathassa aṅga paccaṅgāna 
PA_mn_58:10.10	Sabbāni me rathassa aṅgapaccaṅgāni suviditāni.	sabbāni me rathassa aṅga paccaṅgāni su viditāni 
PA_mn_58:10.11	Ṭhānasovetaṁ maṁ paṭibhāseyyā”ti.	ṭhānasā uvetam mam paṭibhāseyya ati 
PA_mn_58:11.1_0	“Evameva kho, rājakumāra, ye te khattiyapaṇḍitāpi brāhmaṇapaṇḍitāpi gahapatipaṇḍitāpi	evam eva kho rāja kumāra ye te khattiya paṇḍitā api brāhmaṇa paṇḍitā api gahapati paṇḍitā api 
PA_mn_58:11.1_1	samaṇapaṇḍitāpi pañhaṁ abhisaṅkharitvā tathāgataṁ upasaṅkamitvā pucchanti, ṭhānasovetaṁ	samaṇa paṇḍitāḥ api pañham abhisaṅkharitvā tathāgatam upasaṅkamitvā pucchanti 
PA_mn_58:11.1_2	tathāgataṁ paṭibhāti.	tathāgatam paṭibhāti 
PA_mn_58:11.2	Taṁ kissa hetu?	tam kim sa hetu 
PA_mn_58:11.3	Sā hi, rājakumāra, tathāgatassa dhammadhātu suppaṭividdhā yassā dhammadhātuyā suppaṭividdhattā ṭhānasovetaṁ tathāgataṁ paṭibhātī”ti.	sā hi rājakumāra tathāgatassa dhammadhātu su paṭividdhā yassā dhammadhātuyā su paṭividdha ttā ṭhānasā uvetam tathāgatam paṭibhāti iti 
PA_mn_58:12.1	Evaṁ vutte, abhayo rājakumāro bhagavantaṁ etadavoca:	evam vutte abhayaḥ rāja kumāraḥ bhagavantam etat avoca 
PA_mn_58:12.2	“abhikkantaṁ, bhante, abhikkantaṁ, bhante …pe…	abhikkanta bhante abhikkanta bhante pe 
PA_mn_58:12.3	ajjatagge pāṇupetaṁ saraṇaṁ gatan”ti.	ajjatagge pāṇupetam saraṇam gatanti 
PA_mn_58:12.4	Abhayarājakumārasuttaṁ niṭṭhitaṁ aṭṭhamaṁ.	abhayarājakumāra suttam niṭṭhitam aṭṭhama 
