segmentnr	original	analyzed
PA_mn_15:0.1	Majjhima Nikāya 15	▁majjhim a ▁nikāya
PA_mn_15:0.2	Anumānasutta	▁anu mān asutta
PA_mn_15:1.1	Evaṁ me sutaṁ—	▁evaṃ ▁me ▁sut aṃ
PA_mn_15:1.2	ekaṁ samayaṁ āyasmā mahāmoggallāno bhaggesu viharati susumāragire bhesakaḷāvane migadāye.	▁ekaṃ ▁samay aṃ ▁āyasmā ▁mahā moggallān o ▁bh agg esu ▁viharati ▁su su mār a g i re ▁bh e sak a ḷ ā vane ▁mig a dā ye
PA_mn_15:1.3	Tatra kho āyasmā mahāmoggallāno bhikkhū āmantesi:	▁tatra ▁kho ▁āyasmā ▁mahā moggallān o ▁bhikkhū ▁āmantesi
PA_mn_15:1.4	“āvuso bhikkhavo”ti.	▁āvuso ▁ bhikkh a v oti
PA_mn_15:1.5	“Āvuso”ti kho te bhikkhū āyasmato mahāmoggallānassa paccassosuṁ.	▁āvuso ti ▁kho ▁te ▁bhikkhū ▁āyasmato ▁mahā moggallān assa ▁pacc ass o su ṃ
PA_mn_15:1.6	Āyasmā mahāmoggallāno etadavoca:	▁āyasmā ▁mahā moggallān o ▁etadavoca
PA_mn_15:2.1	“Pavāreti cepi, āvuso, bhikkhu:	▁pavār eti ▁ce pi ▁āvuso ▁bhikkhu
PA_mn_15:2.2_0	‘vadantu maṁ āyasmanto, vacanīyomhi āyasmantehī’ti, so ca hoti dubbaco, dovacassakaraṇehi	▁vadant u ▁maṃ ▁āyasmant o ▁ vacanīy o mhi ▁āyasmant ehīti ▁so ▁ca ▁hoti ▁du bb a c o ▁d ova c assa karaṇ ehi
PA_mn_15:2.2_1	dhammehi samannāgato, akkhamo appadakkhiṇaggāhī anusāsaniṁ, atha kho naṁ sabrahmacārī	▁dhammehi ▁samannāgato ▁ akkham o ▁appa dakkhiṇ a ggāh ī ▁anusās an iṃ ▁atha ▁kho ▁naṃ ▁sabrahmacārī
PA_mn_15:2.2_2	na ceva vattabbaṁ maññanti, na ca anusāsitabbaṁ maññanti, na ca tasmiṁ puggale vissāsaṁ	▁na ▁ceva ▁vattabbaṃ ▁maññ anti ▁na ▁ca ▁anusās itabbaṃ ▁maññ anti ▁na ▁ca ▁tasmiṃ ▁puggal e ▁vissās aṃ
PA_mn_15:2.2_3	āpajjitabbaṁ maññanti.	▁āpajj itabbaṃ ▁maññ anti
PA_mn_15:3.1	Katame cāvuso, dovacassakaraṇā dhammā?	▁katame ▁ c āvuso ▁d ova c assa karaṇ ā ▁dhammā
PA_mn_15:3.2	Idhāvuso, bhikkhu pāpiccho hoti, pāpikānaṁ icchānaṁ vasaṁ gato.	▁idh āvuso ▁bhikkhu ▁pāp icch o ▁hoti ▁pāp ikānaṃ ▁icch ānaṃ ▁vas aṃ ▁gato
PA_mn_15:3.3	Yaṁpāvuso, bhikkhu pāpiccho hoti, pāpikānaṁ icchānaṁ vasaṁ gato—	▁yaṃ p āvuso ▁bhikkhu ▁pāp icch o ▁hoti ▁pāp ikānaṃ ▁icch ānaṃ ▁vas aṃ ▁gato
PA_mn_15:3.4	ayampi dhammo dovacassakaraṇo.	▁ayampi ▁dhammo ▁d ova c assa karaṇ o
PA_mn_15:3.5	Puna caparaṁ, āvuso, bhikkhu attukkaṁsako hoti paravambhī.	▁puna ▁caparaṃ ▁āvuso ▁bhikkhu ▁att ukkaṃs ako ▁hoti ▁para va mb hī
PA_mn_15:3.6	Yaṁpāvuso, bhikkhu attukkaṁsako hoti paravambhī—	▁yaṃ p āvuso ▁bhikkhu ▁att ukkaṃs ako ▁hoti ▁para va mb hī
PA_mn_15:3.7	ayampi dhammo dovacassakaraṇo.	▁ayampi ▁dhammo ▁d ova c assa karaṇ o
PA_mn_15:3.8	Puna caparaṁ, āvuso, bhikkhu kodhano hoti kodhābhibhūto.	▁puna ▁caparaṃ ▁āvuso ▁bhikkhu ▁kodh an o ▁hoti ▁kodh ābhi bhūt o
PA_mn_15:3.9	Yaṁpāvuso, bhikkhu kodhano hoti kodhābhibhūto—	▁yaṃ p āvuso ▁bhikkhu ▁kodh an o ▁hoti ▁kodh ābhi bhūt o
PA_mn_15:3.10	ayampi dhammo dovacassakaraṇo.	▁ayampi ▁dhammo ▁d ova c assa karaṇ o
PA_mn_15:3.11	Puna caparaṁ, āvuso, bhikkhu kodhano hoti kodhahetu upanāhī.	▁puna ▁caparaṃ ▁āvuso ▁bhikkhu ▁kodh an o ▁hoti ▁kodh ahetu ▁upa nā hī
PA_mn_15:3.12	Yaṁpāvuso, bhikkhu kodhano hoti kodhahetu upanāhī—	▁yaṃ p āvuso ▁bhikkhu ▁kodh an o ▁hoti ▁kodh ahetu ▁upa nā hī
PA_mn_15:3.13	ayampi dhammo dovacassakaraṇo.	▁ayampi ▁dhammo ▁d ova c assa karaṇ o
PA_mn_15:3.14	Puna caparaṁ, āvuso, bhikkhu kodhano hoti kodhahetu abhisaṅgī.	▁puna ▁caparaṃ ▁āvuso ▁bhikkhu ▁kodh an o ▁hoti ▁kodh ahetu ▁abhi saṃ g ī
PA_mn_15:3.15	Yaṁpāvuso, bhikkhu kodhano hoti kodhahetu abhisaṅgī—	▁yaṃ p āvuso ▁bhikkhu ▁kodh an o ▁hoti ▁kodh ahetu ▁abhi saṃ g ī
PA_mn_15:3.16	ayampi dhammo dovacassakaraṇo.	▁ayampi ▁dhammo ▁d ova c assa karaṇ o
PA_mn_15:3.17	Puna caparaṁ, āvuso, bhikkhu kodhano hoti kodhasāmantā vācaṁ nicchāretā.	▁puna ▁caparaṃ ▁āvuso ▁bhikkhu ▁kodh an o ▁hoti ▁kodh a sām antā ▁vāc aṃ ▁nicc hār e tā
PA_mn_15:3.18	Yaṁpāvuso, bhikkhu kodhano hoti kodhasāmantā vācaṁ nicchāretā—	▁yaṃ p āvuso ▁bhikkhu ▁kodh an o ▁hoti ▁kodh a sām antā ▁vāc aṃ ▁nicc hār e tā
PA_mn_15:3.19	ayampi dhammo dovacassakaraṇo.	▁ayampi ▁dhammo ▁d ova c assa karaṇ o
PA_mn_15:3.20	Puna caparaṁ, āvuso, bhikkhu codito codakena codakaṁ paṭippharati.	▁puna ▁caparaṃ ▁āvuso ▁bhikkhu ▁cod ito ▁cod akena ▁cod akaṃ ▁paṭi pp har ati
PA_mn_15:3.21	Yaṁpāvuso, bhikkhu codito codakena codakaṁ paṭippharati—	▁yaṃ p āvuso ▁bhikkhu ▁cod ito ▁cod akena ▁cod akaṃ ▁paṭi pp har ati
PA_mn_15:3.22	ayampi dhammo dovacassakaraṇo.	▁ayampi ▁dhammo ▁d ova c assa karaṇ o
PA_mn_15:3.23	Puna caparaṁ, āvuso, bhikkhu codito codakena codakaṁ apasādeti.	▁puna ▁caparaṃ ▁āvuso ▁bhikkhu ▁cod ito ▁cod akena ▁cod akaṃ ▁a pasād eti
PA_mn_15:3.24	Yaṁpāvuso, bhikkhu codito codakena codakaṁ apasādeti—	▁yaṃ p āvuso ▁bhikkhu ▁cod ito ▁cod akena ▁cod akaṃ ▁a pasād eti
PA_mn_15:3.25	ayampi dhammo dovacassakaraṇo.	▁ayampi ▁dhammo ▁d ova c assa karaṇ o
PA_mn_15:3.26	Puna caparaṁ, āvuso, bhikkhu codito codakena codakassa paccāropeti.	▁puna ▁caparaṃ ▁āvuso ▁bhikkhu ▁cod ito ▁cod akena ▁cod akassa ▁pacc ā rop eti
PA_mn_15:3.27	Yaṁpāvuso, bhikkhu codito codakena codakassa paccāropeti—	▁yaṃ p āvuso ▁bhikkhu ▁cod ito ▁cod akena ▁cod akassa ▁pacc ā rop eti
PA_mn_15:3.28	ayampi dhammo dovacassakaraṇo.	▁ayampi ▁dhammo ▁d ova c assa karaṇ o
PA_mn_15:3.29	Puna caparaṁ, āvuso, bhikkhu codito codakena aññenaññaṁ paṭicarati, bahiddhā kathaṁ apanāmeti, kopañca dosañca appaccayañca pātukaroti.	▁puna ▁caparaṃ ▁āvuso ▁bhikkhu ▁cod ito ▁cod akena ▁aññ ena ññaṃ ▁paṭi ca rati ▁bahiddhā ▁kathaṃ ▁apa nām eti ▁ko p añca ▁dos añca ▁a ppaccay añca ▁pātu karo ti
PA_mn_15:3.30	Yaṁpāvuso, bhikkhu codito codakena aññenaññaṁ paṭicarati, bahiddhā kathaṁ apanāmeti, kopañca dosañca appaccayañca pātukaroti—	▁yaṃ p āvuso ▁bhikkhu ▁cod ito ▁cod akena ▁aññ ena ññaṃ ▁paṭi ca rati ▁bahiddhā ▁kathaṃ ▁apa nām eti ▁ko p añca ▁dos añca ▁a ppaccay añca ▁pātu karo ti
PA_mn_15:3.31	ayampi dhammo dovacassakaraṇo.	▁ayampi ▁dhammo ▁d ova c assa karaṇ o
PA_mn_15:3.32	Puna caparaṁ, āvuso, bhikkhu codito codakena apadāne na sampāyati.	▁puna ▁caparaṃ ▁āvuso ▁bhikkhu ▁cod ito ▁cod akena ▁a padān e ▁na ▁sam pāy ati
PA_mn_15:3.33	Yaṁpāvuso, bhikkhu codito codakena apadāne na sampāyati—	▁yaṃ p āvuso ▁bhikkhu ▁cod ito ▁cod akena ▁a padān e ▁na ▁sam pāy ati
PA_mn_15:3.34	ayampi dhammo dovacassakaraṇo.	▁ayampi ▁dhammo ▁d ova c assa karaṇ o
PA_mn_15:3.35	Puna caparaṁ, āvuso, bhikkhu makkhī hoti paḷāsī.	▁puna ▁caparaṃ ▁āvuso ▁bhikkhu ▁ makkh ī ▁hoti ▁pa ḷ ā sī
PA_mn_15:3.36	Yaṁpāvuso, bhikkhu makkhī hoti paḷāsī—	▁yaṃ p āvuso ▁bhikkhu ▁ makkh ī ▁hoti ▁pa ḷ ā sī
PA_mn_15:3.37	ayampi dhammo dovacassakaraṇo.	▁ayampi ▁dhammo ▁d ova c assa karaṇ o
PA_mn_15:3.38	Puna caparaṁ, āvuso, bhikkhu issukī hoti maccharī.	▁puna ▁caparaṃ ▁āvuso ▁bhikkhu ▁i ssu k ī ▁hoti ▁macch a rī
PA_mn_15:3.39	Yaṁpāvuso, bhikkhu issukī hoti maccharī—	▁yaṃ p āvuso ▁bhikkhu ▁i ssu k ī ▁hoti ▁macch a rī
PA_mn_15:3.40	ayampi dhammo dovacassakaraṇo.	▁ayampi ▁dhammo ▁d ova c assa karaṇ o
PA_mn_15:3.41	Puna caparaṁ, āvuso, bhikkhu saṭho hoti māyāvī.	▁puna ▁caparaṃ ▁āvuso ▁bhikkhu ▁sa ṭ ho ▁hoti ▁mā yā vī
PA_mn_15:3.42	Yaṁpāvuso, bhikkhu saṭho hoti māyāvī—	▁yaṃ p āvuso ▁bhikkhu ▁sa ṭ ho ▁hoti ▁mā yā vī
PA_mn_15:3.43	ayampi dhammo dovacassakaraṇo.	▁ayampi ▁dhammo ▁d ova c assa karaṇ o
PA_mn_15:3.44	Puna caparaṁ, āvuso, bhikkhu thaddho hoti atimānī.	▁puna ▁caparaṃ ▁āvuso ▁bhikkhu ▁ tha ddh o ▁hoti ▁ati mān ī
PA_mn_15:3.45	Yaṁpāvuso, bhikkhu thaddho hoti atimānī—	▁yaṃ p āvuso ▁bhikkhu ▁ tha ddh o ▁hoti ▁ati mān ī
PA_mn_15:3.46	ayampi dhammo dovacassakaraṇo.	▁ayampi ▁dhammo ▁d ova c assa karaṇ o
PA_mn_15:3.47	Puna caparaṁ, āvuso, bhikkhu sandiṭṭhiparāmāsī hoti ādhānaggāhī duppaṭinissaggī.	▁puna ▁caparaṃ ▁āvuso ▁bhikkhu ▁ san diṭṭhi parāmās ī ▁hoti ▁ ā dhān a ggāh ī ▁du p paṭinissagg ī
PA_mn_15:3.48	Yaṁpāvuso, bhikkhu sandiṭṭhiparāmāsī hoti ādhānaggāhī duppaṭinissaggī—	▁yaṃ p āvuso ▁bhikkhu ▁ san diṭṭhi parāmās ī ▁hoti ▁ ā dhān a ggāh ī ▁du p paṭinissagg ī
PA_mn_15:3.49	ayampi dhammo dovacassakaraṇo.	▁ayampi ▁dhammo ▁d ova c assa karaṇ o
PA_mn_15:3.50	Ime vuccantāvuso, dovacassakaraṇā dhammā.	▁ime ▁ vu cca nt āvuso ▁d ova c assa karaṇ ā ▁dhammā
PA_mn_15:4.1	No cepi, āvuso, bhikkhu pavāreti:	▁no ▁ce pi ▁āvuso ▁bhikkhu ▁pavār eti
PA_mn_15:4.2_0	‘vadantu maṁ āyasmanto, vacanīyomhi āyasmantehī’ti, so ca hoti suvaco, sovacassakaraṇehi	▁vadant u ▁maṃ ▁āyasmant o ▁ vacanīy o mhi ▁āyasmant ehīti ▁so ▁ca ▁hoti ▁su va c o ▁so va c assa karaṇ ehi
PA_mn_15:4.2_1	dhammehi samannāgato, khamo padakkhiṇaggāhī anusāsaniṁ, atha kho naṁ sabrahmacārī	▁dhammehi ▁samannāgato ▁kham o ▁pa dakkhiṇ a ggāh ī ▁anusās an iṃ ▁atha ▁kho ▁naṃ ▁sabrahmacārī
PA_mn_15:4.2_2	vattabbañceva maññanti, anusāsitabbañca maññanti, tasmiñca puggale vissāsaṁ āpajjitabbaṁ maññanti.	▁vattabb añceva ▁maññ anti ▁anusās itabb añca ▁maññ anti ▁ta smi ñca ▁puggal e ▁vissās aṃ ▁āpajj itabbaṃ ▁maññ anti
PA_mn_15:5.1	Katame cāvuso, sovacassakaraṇā dhammā?	▁katame ▁ c āvuso ▁so va c assa karaṇ ā ▁dhammā
PA_mn_15:5.2	Idhāvuso, bhikkhu na pāpiccho hoti, na pāpikānaṁ icchānaṁ vasaṁ gato.	▁idh āvuso ▁bhikkhu ▁na ▁pāp icch o ▁hoti ▁na ▁pāp ikānaṃ ▁icch ānaṃ ▁vas aṃ ▁gato
PA_mn_15:5.3	Yaṁpāvuso, bhikkhu na pāpiccho hoti na pāpikānaṁ icchānaṁ vasaṁ gato—	▁yaṃ p āvuso ▁bhikkhu ▁na ▁pāp icch o ▁hoti ▁na ▁pāp ikānaṃ ▁icch ānaṃ ▁vas aṃ ▁gato
PA_mn_15:5.4	ayampi dhammo sovacassakaraṇo.	▁ayampi ▁dhammo ▁so va c assa karaṇ o
PA_mn_15:5.5	Puna caparaṁ, āvuso, bhikkhu anattukkaṁsako hoti aparavambhī.	▁puna ▁caparaṃ ▁āvuso ▁bhikkhu ▁anatt ukkaṃs ako ▁hoti ▁apar a va mb hī
PA_mn_15:5.6	Yaṁpāvuso, bhikkhu anattukkaṁsako hoti aparavambhī—	▁yaṃ p āvuso ▁bhikkhu ▁anatt ukkaṃs ako ▁hoti ▁apar a va mb hī
PA_mn_15:5.7	ayampi dhammo sovacassakaraṇo.	▁ayampi ▁dhammo ▁so va c assa karaṇ o
PA_mn_15:5.8	Puna caparaṁ, āvuso, bhikkhu na kodhano hoti na kodhābhibhūto.	▁puna ▁caparaṃ ▁āvuso ▁bhikkhu ▁na ▁kodh an o ▁hoti ▁na ▁kodh ābhi bhūt o
PA_mn_15:5.9	Yaṁpāvuso, bhikkhu na kodhano hoti na kodhābhibhūto—	▁yaṃ p āvuso ▁bhikkhu ▁na ▁kodh an o ▁hoti ▁na ▁kodh ābhi bhūt o
PA_mn_15:5.10	ayampi dhammo sovacassakaraṇo.	▁ayampi ▁dhammo ▁so va c assa karaṇ o
PA_mn_15:5.11	Puna caparaṁ, āvuso, bhikkhu na kodhano hoti na kodhahetu upanāhī.	▁puna ▁caparaṃ ▁āvuso ▁bhikkhu ▁na ▁kodh an o ▁hoti ▁na ▁kodh ahetu ▁upa nā hī
PA_mn_15:5.12	Yaṁpāvuso, bhikkhu na kodhano hoti na kodhahetu upanāhī—	▁yaṃ p āvuso ▁bhikkhu ▁na ▁kodh an o ▁hoti ▁na ▁kodh ahetu ▁upa nā hī
PA_mn_15:5.13	ayampi dhammo sovacassakaraṇo.	▁ayampi ▁dhammo ▁so va c assa karaṇ o
PA_mn_15:5.14	Puna caparaṁ, āvuso, bhikkhu na kodhano hoti na kodhahetu abhisaṅgī.	▁puna ▁caparaṃ ▁āvuso ▁bhikkhu ▁na ▁kodh an o ▁hoti ▁na ▁kodh ahetu ▁abhi saṃ g ī
PA_mn_15:5.15	Yaṁpāvuso, bhikkhu na kodhano hoti na kodhahetu abhisaṅgī—	▁yaṃ p āvuso ▁bhikkhu ▁na ▁kodh an o ▁hoti ▁na ▁kodh ahetu ▁abhi saṃ g ī
PA_mn_15:5.16	ayampi dhammo sovacassakaraṇo.	▁ayampi ▁dhammo ▁so va c assa karaṇ o
PA_mn_15:5.17	Puna caparaṁ, āvuso, bhikkhu na kodhano hoti na kodhasāmantā vācaṁ nicchāretā.	▁puna ▁caparaṃ ▁āvuso ▁bhikkhu ▁na ▁kodh an o ▁hoti ▁na ▁kodh a sām antā ▁vāc aṃ ▁nicc hār e tā
PA_mn_15:5.18	Yaṁpāvuso, bhikkhu na kodhano hoti na kodhasāmantā vācaṁ nicchāretā—	▁yaṃ p āvuso ▁bhikkhu ▁na ▁kodh an o ▁hoti ▁na ▁kodh a sām antā ▁vāc aṃ ▁nicc hār e tā
PA_mn_15:5.19	ayampi dhammo sovacassakaraṇo.	▁ayampi ▁dhammo ▁so va c assa karaṇ o
PA_mn_15:5.20	Puna caparaṁ, āvuso, bhikkhu codito codakena codakaṁ nappaṭippharati.	▁puna ▁caparaṃ ▁āvuso ▁bhikkhu ▁cod ito ▁cod akena ▁cod akaṃ ▁na ppaṭi pp har ati
PA_mn_15:5.21	Yaṁpāvuso, bhikkhu codito codakena codakaṁ nappaṭippharati—	▁yaṃ p āvuso ▁bhikkhu ▁cod ito ▁cod akena ▁cod akaṃ ▁na ppaṭi pp har ati
PA_mn_15:5.22	ayampi dhammo sovacassakaraṇo.	▁ayampi ▁dhammo ▁so va c assa karaṇ o
PA_mn_15:5.23	Puna caparaṁ, āvuso, bhikkhu codito codakena codakaṁ na apasādeti.	▁puna ▁caparaṃ ▁āvuso ▁bhikkhu ▁cod ito ▁cod akena ▁cod akaṃ ▁na ▁a pasād eti
PA_mn_15:5.24	Yaṁpāvuso, bhikkhu codito codakena codakaṁ na apasādeti—	▁yaṃ p āvuso ▁bhikkhu ▁cod ito ▁cod akena ▁cod akaṃ ▁na ▁a pasād eti
PA_mn_15:5.25	ayampi dhammo sovacassakaraṇo.	▁ayampi ▁dhammo ▁so va c assa karaṇ o
PA_mn_15:5.26	Puna caparaṁ, āvuso, bhikkhu codito codakena codakassa na paccāropeti.	▁puna ▁caparaṃ ▁āvuso ▁bhikkhu ▁cod ito ▁cod akena ▁cod akassa ▁na ▁pacc ā rop eti
PA_mn_15:5.27	Yaṁpāvuso, bhikkhu codito codakena codakassa na paccāropeti—	▁yaṃ p āvuso ▁bhikkhu ▁cod ito ▁cod akena ▁cod akassa ▁na ▁pacc ā rop eti
PA_mn_15:5.28	ayampi dhammo sovacassakaraṇo.	▁ayampi ▁dhammo ▁so va c assa karaṇ o
PA_mn_15:5.29	Puna caparaṁ, āvuso, bhikkhu codito codakena na aññenaññaṁ paṭicarati, na bahiddhā kathaṁ apanāmeti, na kopañca dosañca appaccayañca pātukaroti.	▁puna ▁caparaṃ ▁āvuso ▁bhikkhu ▁cod ito ▁cod akena ▁na ▁aññ ena ññaṃ ▁paṭi ca rati ▁na ▁bahiddhā ▁kathaṃ ▁apa nām eti ▁na ▁ko p añca ▁dos añca ▁a ppaccay añca ▁pātu karo ti
PA_mn_15:5.30	Yaṁpāvuso, bhikkhu codito codakena na aññenaññaṁ paṭicarati, na bahiddhā kathaṁ apanāmeti, na kopañca dosañca appaccayañca pātukaroti—	▁yaṃ p āvuso ▁bhikkhu ▁cod ito ▁cod akena ▁na ▁aññ ena ññaṃ ▁paṭi ca rati ▁na ▁bahiddhā ▁kathaṃ ▁apa nām eti ▁na ▁ko p añca ▁dos añca ▁a ppaccay añca ▁pātu karo ti
PA_mn_15:5.31	ayampi dhammo sovacassakaraṇo.	▁ayampi ▁dhammo ▁so va c assa karaṇ o
PA_mn_15:5.32	Puna caparaṁ, āvuso, bhikkhu codito codakena apadāne sampāyati.	▁puna ▁caparaṃ ▁āvuso ▁bhikkhu ▁cod ito ▁cod akena ▁a padān e ▁sam pāy ati
PA_mn_15:5.33	Yaṁpāvuso, bhikkhu codito codakena apadāne sampāyati—	▁yaṃ p āvuso ▁bhikkhu ▁cod ito ▁cod akena ▁a padān e ▁sam pāy ati
PA_mn_15:5.34	ayampi dhammo sovacassakaraṇo.	▁ayampi ▁dhammo ▁so va c assa karaṇ o
PA_mn_15:5.35	Puna caparaṁ, āvuso, bhikkhu amakkhī hoti apaḷāsī.	▁puna ▁caparaṃ ▁āvuso ▁bhikkhu ▁a makkh ī ▁hoti ▁apa ḷ ā sī
PA_mn_15:5.36	Yaṁpāvuso, bhikkhu amakkhī hoti apaḷāsī—	▁yaṃ p āvuso ▁bhikkhu ▁a makkh ī ▁hoti ▁apa ḷ ā sī
PA_mn_15:5.37	ayampi dhammo sovacassakaraṇo.	▁ayampi ▁dhammo ▁so va c assa karaṇ o
PA_mn_15:5.38	Puna caparaṁ, āvuso, bhikkhu anissukī hoti amaccharī.	▁puna ▁caparaṃ ▁āvuso ▁bhikkhu ▁a niss uk ī ▁hoti ▁amacc har ī
PA_mn_15:5.39	Yaṁpāvuso, bhikkhu anissukī hoti amaccharī—	▁yaṃ p āvuso ▁bhikkhu ▁a niss uk ī ▁hoti ▁amacc har ī
PA_mn_15:5.40	ayampi dhammo sovacassakaraṇo.	▁ayampi ▁dhammo ▁so va c assa karaṇ o
PA_mn_15:5.41	Puna caparaṁ, āvuso, bhikkhu asaṭho hoti amāyāvī.	▁puna ▁caparaṃ ▁āvuso ▁bhikkhu ▁as a ṭ ho ▁hoti ▁ amā yā vī
PA_mn_15:5.42	Yaṁpāvuso, bhikkhu asaṭho hoti amāyāvī—	▁yaṃ p āvuso ▁bhikkhu ▁as a ṭ ho ▁hoti ▁ amā yā vī
PA_mn_15:5.43	ayampi dhammo sovacassakaraṇo.	▁ayampi ▁dhammo ▁so va c assa karaṇ o
PA_mn_15:5.44	Puna caparaṁ, āvuso, bhikkhu atthaddho hoti anatimānī.	▁puna ▁caparaṃ ▁āvuso ▁bhikkhu ▁attha ddh o ▁hoti ▁an ati mān ī
PA_mn_15:5.45	Yaṁpāvuso, bhikkhu atthaddho hoti anatimānī—	▁yaṃ p āvuso ▁bhikkhu ▁attha ddh o ▁hoti ▁an ati mān ī
PA_mn_15:5.46	ayampi dhammo sovacassakaraṇo.	▁ayampi ▁dhammo ▁so va c assa karaṇ o
PA_mn_15:5.47	Puna caparaṁ, āvuso, bhikkhu asandiṭṭhiparāmāsī hoti anādhānaggāhī suppaṭinissaggī.	▁puna ▁caparaṃ ▁āvuso ▁bhikkhu ▁a san diṭṭhi parāmās ī ▁hoti ▁anā dhān a ggāh ī ▁su p paṭinissagg ī
PA_mn_15:5.48	Yaṁpāvuso, bhikkhu asandiṭṭhiparāmāsī hoti, anādhānaggāhī suppaṭinissaggī—	▁yaṃ p āvuso ▁bhikkhu ▁a san diṭṭhi parāmās ī ▁hoti ▁anā dhān a ggāh ī ▁su p paṭinissagg ī
PA_mn_15:5.49	ayampi dhammo sovacassakaraṇo.	▁ayampi ▁dhammo ▁so va c assa karaṇ o
PA_mn_15:5.50	Ime vuccantāvuso, sovacassakaraṇā dhammā.	▁ime ▁ vu cca nt āvuso ▁so va c assa karaṇ ā ▁dhammā
PA_mn_15:6.1	Tatrāvuso, bhikkhunā attanāva attānaṁ evaṁ anuminitabbaṁ:	▁tatr āvuso ▁bhikkhunā ▁attanā va ▁attānaṃ ▁evaṃ ▁anu mi n itabbaṃ
PA_mn_15:6.2	‘yo khvāyaṁ puggalo pāpiccho, pāpikānaṁ icchānaṁ vasaṁ gato, ayaṁ me puggalo appiyo amanāpo;	▁yo ▁kh vā yaṃ ▁puggalo ▁pāp icch o ▁pāp ikānaṃ ▁icch ānaṃ ▁vas aṃ ▁gato ▁ayaṃ ▁me ▁puggalo ▁app iyo ▁amanāp o
PA_mn_15:6.3	ahañceva kho panassaṁ pāpiccho pāpikānaṁ icchānaṁ vasaṁ gato, ahampāssaṁ paresaṁ appiyo amanāpo’ti.	▁ah añceva ▁kho ▁pana ssa ṃ ▁pāp icch o ▁pāp ikānaṃ ▁icch ānaṃ ▁vas aṃ ▁gato ▁ah am pās saṃ ▁paresaṃ ▁app iyo ▁amanāp oti
PA_mn_15:6.4	Evaṁ jānantenāvuso, bhikkhunā ‘na pāpiccho bhavissāmi, na pāpikānaṁ icchānaṁ vasaṁ gato’ti cittaṁ uppādetabbaṁ.	▁evaṃ ▁jānant e n āvuso ▁bhikkhunā ▁na ▁pāp icch o ▁bhav issāmi ▁na ▁pāp ikānaṃ ▁icch ānaṃ ▁vas aṃ ▁gato ti ▁cittaṃ ▁uppād etabbaṃ
PA_mn_15:6.5	‘Yo khvāyaṁ puggalo attukkaṁsako paravambhī, ayaṁ me puggalo appiyo amanāpo;	▁yo ▁kh vā yaṃ ▁puggalo ▁att ukkaṃs ako ▁para va mb hī ▁ayaṃ ▁me ▁puggalo ▁app iyo ▁amanāp o
PA_mn_15:6.6	ahañceva kho panassaṁ attukkaṁsako paravambhī, ahampāssaṁ paresaṁ appiyo amanāpo’ti.	▁ah añceva ▁kho ▁pana ssa ṃ ▁att ukkaṃs ako ▁para va mb hī ▁ah am pās saṃ ▁paresaṃ ▁app iyo ▁amanāp oti
PA_mn_15:6.7	Evaṁ jānantenāvuso, bhikkhunā ‘anattukkaṁsako bhavissāmi aparavambhī’ti cittaṁ uppādetabbaṁ.	▁evaṃ ▁jānant e n āvuso ▁bhikkhunā ▁anatt ukkaṃs ako ▁bhav issāmi ▁apar a va mb hīti ▁cittaṃ ▁uppād etabbaṃ
PA_mn_15:6.8	‘Yo khvāyaṁ puggalo kodhano kodhābhibhūto, ayaṁ me puggalo appiyo amanāpo.	▁yo ▁kh vā yaṃ ▁puggalo ▁kodh an o ▁kodh ābhi bhūt o ▁ayaṃ ▁me ▁puggalo ▁app iyo ▁amanāp o
PA_mn_15:6.9	Ahañceva kho panassaṁ kodhano kodhābhibhūto, ahampāssaṁ paresaṁ appiyo amanāpo’ti.	▁ah añceva ▁kho ▁pana ssa ṃ ▁kodh an o ▁kodh ābhi bhūt o ▁ah am pās saṃ ▁paresaṃ ▁app iyo ▁amanāp oti
PA_mn_15:6.10	Evaṁ jānantenāvuso, bhikkhunā ‘na kodhano bhavissāmi na kodhābhibhūto’ti cittaṁ uppādetabbaṁ.	▁evaṃ ▁jānant e n āvuso ▁bhikkhunā ▁na ▁kodh an o ▁bhav issāmi ▁na ▁kodh ābhi bhūt oti ▁cittaṃ ▁uppād etabbaṃ
PA_mn_15:6.11	‘Yo khvāyaṁ puggalo kodhano kodhahetu upanāhī, ayaṁ me puggalo appiyo amanāpo;	▁yo ▁kh vā yaṃ ▁puggalo ▁kodh an o ▁kodh ahetu ▁upa nā hī ▁ayaṃ ▁me ▁puggalo ▁app iyo ▁amanāp o
PA_mn_15:6.12	ahañceva kho panassaṁ kodhano kodhahetu upanāhī, ahampāssaṁ paresaṁ appiyo amanāpo’ti.	▁ah añceva ▁kho ▁pana ssa ṃ ▁kodh an o ▁kodh ahetu ▁upa nā hī ▁ah am pās saṃ ▁paresaṃ ▁app iyo ▁amanāp oti
PA_mn_15:6.13	Evaṁ jānantenāvuso, bhikkhunā ‘na kodhano bhavissāmi na kodhahetu upanāhī’ti cittaṁ uppādetabbaṁ.	▁evaṃ ▁jānant e n āvuso ▁bhikkhunā ▁na ▁kodh an o ▁bhav issāmi ▁na ▁kodh ahetu ▁upa nā hīti ▁cittaṃ ▁uppād etabbaṃ
PA_mn_15:6.14	‘Yo khvāyaṁ puggalo kodhano kodhahetu abhisaṅgī, ayaṁ me puggalo appiyo amanāpo;	▁yo ▁kh vā yaṃ ▁puggalo ▁kodh an o ▁kodh ahetu ▁abhi saṃ g ī ▁ayaṃ ▁me ▁puggalo ▁app iyo ▁amanāp o
PA_mn_15:6.15	ahañceva kho panassaṁ kodhano kodhahetu abhisaṅgī, ahampāssaṁ paresaṁ appiyo amanāpo’ti.	▁ah añceva ▁kho ▁pana ssa ṃ ▁kodh an o ▁kodh ahetu ▁abhi saṃ g ī ▁ah am pās saṃ ▁paresaṃ ▁app iyo ▁amanāp oti
PA_mn_15:6.16	Evaṁ jānantenāvuso, bhikkhunā ‘na kodhano bhavissāmi na kodhahetu abhisaṅgī’ti cittaṁ uppādetabbaṁ.	▁evaṃ ▁jānant e n āvuso ▁bhikkhunā ▁na ▁kodh an o ▁bhav issāmi ▁na ▁kodh ahetu ▁abhi saṃgīti ▁cittaṃ ▁uppād etabbaṃ
PA_mn_15:6.17	‘Yo khvāyaṁ puggalo kodhano kodhasāmantā vācaṁ nicchāretā, ayaṁ me puggalo appiyo amanāpo;	▁yo ▁kh vā yaṃ ▁puggalo ▁kodh an o ▁kodh a sām antā ▁vāc aṃ ▁nicc hār e tā ▁ayaṃ ▁me ▁puggalo ▁app iyo ▁amanāp o
PA_mn_15:6.18	ahañceva kho panassaṁ kodhano kodhasāmantā vācaṁ nicchāretā, ahampāssaṁ paresaṁ appiyo amanāpo’ti.	▁ah añceva ▁kho ▁pana ssa ṃ ▁kodh an o ▁kodh a sām antā ▁vāc aṃ ▁nicc hār e tā ▁ah am pās saṃ ▁paresaṃ ▁app iyo ▁amanāp oti
PA_mn_15:6.19	Evaṁ jānantenāvuso, bhikkhunā ‘na kodhano bhavissāmi na kodhasāmantā vācaṁ nicchāressāmī’ti cittaṁ uppādetabbaṁ.	▁evaṃ ▁jānant e n āvuso ▁bhikkhunā ▁na ▁kodh an o ▁bhav issāmi ▁na ▁kodh a sām antā ▁vāc aṃ ▁nicc hār essāmīti ▁cittaṃ ▁uppād etabbaṃ
PA_mn_15:6.20	‘Yo khvāyaṁ puggalo codito codakena codakaṁ paṭippharati, ayaṁ me puggalo appiyo amanāpo;	▁yo ▁kh vā yaṃ ▁puggalo ▁cod ito ▁cod akena ▁cod akaṃ ▁paṭi pp har ati ▁ayaṃ ▁me ▁puggalo ▁app iyo ▁amanāp o
PA_mn_15:6.21	ahañceva kho pana codito codakena codakaṁ paṭipphareyyaṁ, ahampāssaṁ paresaṁ appiyo amanāpo’ti.	▁ah añceva ▁kho ▁pana ▁cod ito ▁cod akena ▁cod akaṃ ▁paṭi pp har eyyaṃ ▁ah am pās saṃ ▁paresaṃ ▁app iyo ▁amanāp oti
PA_mn_15:6.22	Evaṁ jānantenāvuso, bhikkhunā ‘codito codakena codakaṁ nappaṭippharissāmī’ti cittaṁ uppādetabbaṁ.	▁evaṃ ▁jānant e n āvuso ▁bhikkhunā ▁cod ito ▁cod akena ▁cod akaṃ ▁na ppaṭi pp har issāmīti ▁cittaṃ ▁uppād etabbaṃ
PA_mn_15:6.23	‘Yo khvāyaṁ puggalo codito codakena codakaṁ apasādeti, ayaṁ me puggalo appiyo amanāpo;	▁yo ▁kh vā yaṃ ▁puggalo ▁cod ito ▁cod akena ▁cod akaṃ ▁a pasād eti ▁ayaṃ ▁me ▁puggalo ▁app iyo ▁amanāp o
PA_mn_15:6.24	ahañceva kho pana codito codakena codakaṁ apasādeyyaṁ, ahampāssaṁ paresaṁ appiyo amanāpo’ti.	▁ah añceva ▁kho ▁pana ▁cod ito ▁cod akena ▁cod akaṃ ▁a pasād eyyaṃ ▁ah am pās saṃ ▁paresaṃ ▁app iyo ▁amanāp oti
PA_mn_15:6.25	Evaṁ jānantenāvuso, bhikkhunā ‘codito codakena codakaṁ na apasādessāmī’ti cittaṁ uppādetabbaṁ.	▁evaṃ ▁jānant e n āvuso ▁bhikkhunā ▁cod ito ▁cod akena ▁cod akaṃ ▁na ▁a pasād essāmīti ▁cittaṃ ▁uppād etabbaṃ
PA_mn_15:6.26	‘Yo khvāyaṁ puggalo codito codakena codakassa paccāropeti, ayaṁ me puggalo appiyo amanāpo;	▁yo ▁kh vā yaṃ ▁puggalo ▁cod ito ▁cod akena ▁cod akassa ▁pacc ā rop eti ▁ayaṃ ▁me ▁puggalo ▁app iyo ▁amanāp o
PA_mn_15:6.27	ahañceva kho pana codito codakena codakassa paccāropeyyaṁ, ahampāssaṁ paresaṁ appiyo amanāpo’ti.	▁ah añceva ▁kho ▁pana ▁cod ito ▁cod akena ▁cod akassa ▁pacc ā rop eyyaṃ ▁ah am pās saṃ ▁paresaṃ ▁app iyo ▁amanāp oti
PA_mn_15:6.28	Evaṁ jānantenāvuso, bhikkhunā ‘codito codakena codakassa na paccāropessāmī’ti cittaṁ uppādetabbaṁ.	▁evaṃ ▁jānant e n āvuso ▁bhikkhunā ▁cod ito ▁cod akena ▁cod akassa ▁na ▁pacc ā rop essāmīti ▁cittaṃ ▁uppād etabbaṃ
PA_mn_15:6.29	‘Yo khvāyaṁ puggalo codito codakena aññenaññaṁ paṭicarati, bahiddhā kathaṁ apanāmeti, kopañca dosañca appaccayañca pātukaroti, ayaṁ me puggalo appiyo amanāpo;	▁yo ▁kh vā yaṃ ▁puggalo ▁cod ito ▁cod akena ▁aññ ena ññaṃ ▁paṭi ca rati ▁bahiddhā ▁kathaṃ ▁apa nām eti ▁ko p añca ▁dos añca ▁a ppaccay añca ▁pātu karo ti ▁ayaṃ ▁me ▁puggalo ▁app iyo ▁amanāp o
