segmentnr	original	analyzed
PA_mn_16:0.1	Majjhima Nikāya 16	majjhima nikāya 
PA_mn_16:0.2	Cetokhilasutta	cetokhilasutta 
PA_mn_16:1.1	Evaṁ me sutaṁ—	evam me suta 
PA_mn_16:1.2	ekaṁ samayaṁ bhagavā sāvatthiyaṁ viharati jetavane anāthapiṇḍikassa ārāme.	ekam samayam bhagavā sāvatthiyam viharati jetavane anāthapiṇḍikassa ārāme 
PA_mn_16:1.3	Tatra kho bhagavā bhikkhū āmantesi:	tatra kho bhagavā bhikkhū āmantesi 
PA_mn_16:1.4	“bhikkhavo”ti.	bhikkhavaḥ ti 
PA_mn_16:1.5	“Bhadante”ti te bhikkhū bhagavato paccassosuṁ.	bhadanta iti te bhikkhū bhagavataḥ 
PA_mn_16:1.6	Bhagavā etadavoca:	bhagavān etat avoca 
PA_mn_16:2.1_0	“Yassa kassaci, bhikkhave, bhikkhuno pañca cetokhilā appahīnā, pañca cetasovinibandhā	yassa kassaci bhikkhave bhikkhuno pañca cetasokhilāḥ appahīnāḥ pañca cetasovinibandhāḥ 
PA_mn_16:2.1_1	asamucchinnā, so vatimasmiṁ dhammavinaye vuddhiṁ virūḷhiṁ vepullaṁ āpajjissatīti—netaṁ ṭhānaṁ vijjati.	asamucchinnā saḥ vatimasmin dhamma vinaye vuddhim virūḷhim vepullam āpajjissati iti na etam ṭhānam vijjati 
PA_mn_16:3.1	Katamāssa pañca cetokhilā appahīnā honti?	katamāssa pañca cetokhilāḥ appahīnāḥ honti 
PA_mn_16:3.2	Idha, bhikkhave, bhikkhu satthari kaṅkhati vicikicchati nādhimuccati na sampasīdati.	idha bhikkhave bhikkhu satthari kaṅkhati vicikicchati na adhimuccati na sampasīdati 
PA_mn_16:3.3	Yo so, bhikkhave, bhikkhu satthari kaṅkhati vicikicchati nādhimuccati na sampasīdati tassa cittaṁ na namati ātappāya anuyogāya sātaccāya padhānāya.	yaḥ saḥ bhikkhave bhikkhu satthari kaṅkhati vicikicchati na adhimuccati na sampasīdati tassa cittam na namati ātappāya anuyogāya sātaccāya padhānāya 
PA_mn_16:3.4	Yassa cittaṁ na namati ātappāya anuyogāya sātaccāya padhānāya, evamassāyaṁ paṭhamo cetokhilo appahīno hoti.	yassa cittam na namati ātappāya anuyogāya sātaccāya padhānāya evam assa ayam paṭhamaḥ cetaḥ khilo appahīnaḥ hoti 
PA_mn_16:4.1	Puna caparaṁ, bhikkhave, bhikkhu dhamme kaṅkhati vicikicchati nādhimuccati na sampasīdati …pe…	puna capara bhikkhave bhikkhu dhamme kaṅkhati vicikicchati na adhimuccati na sampasīdati pe 
PA_mn_16:4.2	evamassāyaṁ dutiyo cetokhilo appahīno hoti.	evam assa ayam dutiyaḥ cetaḥ khilo appahīnaḥ hoti 
PA_mn_16:5.1	Puna caparaṁ, bhikkhave, bhikkhu saṅghe kaṅkhati vicikicchati nādhimuccati na sampasīdati …pe…	puna capara bhikkhave bhikkhu saṅghe kaṅkhati vicikicchati na adhimuccati na sampasīdati pe 
PA_mn_16:5.2	evamassāyaṁ tatiyo cetokhilo appahīno hoti.	evam assa ayam tatiyaḥ cetaḥ khilo appahīnaḥ hoti 
PA_mn_16:6.1	Puna caparaṁ, bhikkhave, bhikkhu sikkhāya kaṅkhati vicikicchati nādhimuccati na sampasīdati.	puna capara bhikkhave bhikkhu sikkhāya kaṅkhati vicikicchati na adhimuccati na sampasīdati 
PA_mn_16:6.2	Yo so, bhikkhave, bhikkhu sikkhāya kaṅkhati vicikicchati nādhimuccati na sampasīdati, tassa cittaṁ na namati ātappāya anuyogāya sātaccāya padhānāya.	yaḥ saḥ bhikkhave bhikkhu sikkhāya kaṅkhati vicikicchati na adhimuccati na sampasīdati tassa cittam na namati ātappāya anuyogāya sātaccāya padhānāya 
PA_mn_16:6.3	Yassa cittaṁ na namati ātappāya anuyogāya sātaccāya padhānāya, evamassāyaṁ catuttho cetokhilo appahīno hoti.	yassa cittam na namati ātappāya anuyogāya sātaccāya padhānāya evam assa ayam catuttho cetaḥ khilo appahīnaḥ hoti 
PA_mn_16:7.1	Puna caparaṁ, bhikkhave, bhikkhu sabrahmacārīsu kupito hoti anattamano āhatacitto khilajāto.	puna capara bhikkhave bhikkhu sabrahmacārīsu kupitaḥ hoti anatta manaḥ āhata cittaḥ khila jātaḥ 
PA_mn_16:7.2	Yo so, bhikkhave, bhikkhu sabrahmacārīsu kupito hoti anattamano āhatacitto khilajāto, tassa cittaṁ na namati ātappāya anuyogāya sātaccāya padhānāya.	yaḥ saḥ bhikkhave bhikkhu sabrahmacārīsu kupitaḥ hoti anatta manaḥ āhata citto khila jāto tassa cittam na namati ātappāya anuyogāya sātaccāya padhānāya 
PA_mn_16:7.3	Yassa cittaṁ na namati ātappāya anuyogāya sātaccāya padhānāya, evamassāyaṁ pañcamo cetokhilo appahīno hoti.	yassa cittam na namati ātappāya anuyogāya sātaccāya padhānāya evam assa ayam pañcamaḥ cetaḥ khilo appahīnaḥ hoti 
PA_mn_16:7.4	Imāssa pañca cetokhilā appahīnā honti.	imāssa pañca cetokhilā appahīnā honti 
PA_mn_16:8.1	Katamāssa pañca cetasovinibandhā asamucchinnā honti?	katamāḥ sa pañca cetasaḥ vinibandhāḥ asamucchinnāḥ honti 
PA_mn_16:8.2	Idha, bhikkhave, bhikkhu kāme avītarāgo hoti avigatacchando avigatapemo avigatapipāso avigatapariḷāho avigatataṇho.	idha bhikkhave bhikkhu kāme avīta rāgaḥ hoti avigata chandaḥ avigata pemaḥ avigata pipāsaḥ avigata pariḷāhaḥ avigata taṇhaḥ 
PA_mn_16:8.3	Yo so, bhikkhave, bhikkhu kāme avītarāgo hoti avigatacchando avigatapemo avigatapipāso avigatapariḷāho avigatataṇho, tassa cittaṁ na namati ātappāya anuyogāya sātaccāya padhānāya.	yaḥ saḥ bhikkhave bhikkhu kāme a vīta rāgaḥ hoti avigata chandaḥ avigata pemaḥ avigata pipāsaḥ avigata pariḷāhaḥ avigata taṇhaḥ tassa cittam na namati ātappāya anuyogāya sātaccāya padhānāya 
PA_mn_16:8.4	Yassa cittaṁ na namati ātappāya anuyogāya sātaccāya padhānāya, evamassāyaṁ paṭhamo cetasovinibandho asamucchinno hoti.	yassa cittam na namati ātappāya anuyogāya sātaccāya padhānāya evam assa ayam paṭhamaḥ cetasovinibandho asamucchinnaḥ hoti 
PA_mn_16:9.1	Puna caparaṁ, bhikkhave, bhikkhu kāye avītarāgo hoti …pe…	puna capara bhikkhave bhikkhu kāye a vīta rāgaḥ hoti pe
PA_mn_16:9.2	evamassāyaṁ dutiyo cetasovinibandho asamucchinno hoti.	evam assa ayam dutiyaḥ cetasaḥ vinibandhaḥ asamucchinnaḥ hoti 
PA_mn_16:10.1	Puna caparaṁ, bhikkhave, bhikkhu rūpe avītarāgo hoti …pe…	puna capara bhikkhave bhikkhu rūpe a vīta rāgaḥ hoti pe
PA_mn_16:10.2	evamassāyaṁ tatiyo cetasovinibandho asamucchinno hoti.	evam assa ayam tatiyaḥ cetasaḥ vinibandhaḥ asamucchinnaḥ hoti 
PA_mn_16:11.1	Puna caparaṁ, bhikkhave, bhikkhu yāvadatthaṁ udarāvadehakaṁ bhuñjitvā seyyasukhaṁ passasukhaṁ middhasukhaṁ anuyutto viharati.	puna capara bhikkhave bhikkhu yāvadattham udarāvadehakam bhuñjitvā seyya sukham passa sukham middha sukham anuyuttaḥ viharati 
PA_mn_16:11.2_0	Yo so, bhikkhave, bhikkhu yāvadatthaṁ udarāvadehakaṁ bhuñjitvā seyyasukhaṁ passasukhaṁ	yaḥ saḥ bhikkhave bhikkhu yāvadattham udarāvadehakam bhuñjitvā 
PA_mn_16:11.2_1	middhasukhaṁ anuyutto viharati, tassa cittaṁ na namati ātappāya anuyogāya sātaccāya padhānāya.	middha sukham anuyuttaḥ viharati tassa cittam na namati ātappāya anuyogāya sātaccāya padhānāya 
PA_mn_16:11.3	Yassa cittaṁ na namati ātappāya anuyogāya sātaccāya padhānāya, evamassāyaṁ catuttho cetasovinibandho asamucchinno hoti.	yassa cittam na namati ātappāya anuyogāya sātaccāya padhānāya evam assa ayam catuttho cetasovinibandho asamucchinnaḥ hoti 
PA_mn_16:12.1_0	Puna caparaṁ, bhikkhave, bhikkhu aññataraṁ devanikāyaṁ paṇidhāya brahmacariyaṁ carati:	puna capara bhikkhave bhikkhu aññataram devanikāyam paṇidhāya brahmacariyam carati 
PA_mn_16:12.1_1	‘imināhaṁ sīlena vā vatena vā tapena vā brahmacariyena vā devo vā bhavissāmi devaññataro vā’ti.	iminā aham sīlena vā vatena vā tapena vā brahmacariyena vā devaḥ vā bhavissāmi devaññataraḥ vā ati 
PA_mn_16:12.2_0	Yo so, bhikkhave, bhikkhu aññataraṁ devanikāyaṁ paṇidhāya brahmacariyaṁ carati: ‘imināhaṁ	yaḥ saḥ bhikkhave bhikkhu aññataram devanikāyam paṇidhāya brahmacariyam carati iminā āha 
PA_mn_16:12.2_1	sīlena vā vatena vā tapena vā brahmacariyena vā devo vā bhavissāmi devaññataro vā’ti,	sīlena vā vatena vā tapena vā brahmacariyena vā devaḥ vā bhavissāmi devaññataraḥ vā ati 
PA_mn_16:12.2_2	tassa cittaṁ na namati ātappāya anuyogāya sātaccāya padhānāya.	tassa cittam na namati ātappāya anuyogāya sātaccāya padhānāya 
PA_mn_16:12.3	Yassa cittaṁ na namati ātappāya anuyogāya sātaccāya padhānāya, evamassāyaṁ pañcamo cetasovinibandho asamucchinno hoti.	yassa cittam na namati ātappāya anuyogāya sātaccāya padhānāya evam assa ayam pañcamo cetasovinibandho asamucchinnaḥ hoti 
PA_mn_16:12.4	Imāssa pañca cetasovinibandhā asamucchinnā honti.	pañca cetasaḥ vinibandhāḥ asamucchinnāḥ honti 
PA_mn_16:13.1_0	Yassa kassaci, bhikkhave, bhikkhuno ime pañca cetokhilā appahīnā, ime pañca cetasovinibandhā	yassa kassaci bhikkhave bhikkhunaḥ ime pañca cetaḥ khilāḥ a pahīnāḥ ime pañca cetaso vinibandhā 
PA_mn_16:13.1_1	asamucchinnā, so vatimasmiṁ dhammavinaye vuddhiṁ virūḷhiṁ vepullaṁ āpajjissatīti—netaṁ ṭhānaṁ vijjati.	asamucchinnā saḥ vatimasmin dhamma vinaye vuddhim virūḷhim vepullam āpajjissati iti na etam ṭhānam vijjati 
PA_mn_16:14.1_0	Yassa kassaci, bhikkhave, bhikkhuno pañca cetokhilā pahīnā, pañca cetasovinibandhā	yassa kassaci bhikkhave bhikkhuno pañca cetaḥ khilā pahīnā pañca cetaso vinibandhā 
PA_mn_16:14.1_1	susamucchinnā, so vatimasmiṁ dhammavinaye vuddhiṁ virūḷhiṁ vepullaṁ āpajjissatīti—ṭhānametaṁ vijjati.	su samucchinnā saḥ vatimasmin dhamma vinaye vuddhim virūḷhim vepullam āpajjissati iti ṭhānam etat vijjati 
PA_mn_16:15.1	Katamāssa pañca cetokhilā pahīnā honti?	pañca pahīnāḥ honti 
PA_mn_16:15.2	Idha, bhikkhave, bhikkhu satthari na kaṅkhati na vicikicchati adhimuccati sampasīdati.	idha bhikkhave bhikkhu satthari na kaṅkhati na vicikicchati adhimuccati sampasīdati 
PA_mn_16:15.3	Yo so, bhikkhave, bhikkhu satthari na kaṅkhati na vicikicchati adhimuccati sampasīdati, tassa cittaṁ namati ātappāya anuyogāya sātaccāya padhānāya.	yaḥ saḥ bhikkhave bhikkhu satthari na kaṅkhati na vicikicchati adhimuccati sampasīdati tassa cittam namati ātappāya anuyogāya sātaccāya padhānāya 
PA_mn_16:15.4	Yassa cittaṁ namati ātappāya anuyogāya sātaccāya padhānāya, evamassāyaṁ paṭhamo cetokhilo pahīno hoti.	yassa cittam namati ātappāya anuyogāya sātaccāya padhānāya evam assa ayam paṭhamaḥ cetaḥ khilo pahīnaḥ hoti 
PA_mn_16:16.1	Puna caparaṁ, bhikkhave, bhikkhu dhamme na kaṅkhati na vicikicchati adhimuccati sampasīdati …pe…	puna capara bhikkhave bhikkhu dhamme na kaṅkhati na vicikicchati adhimuccati sampasīdati pe 
PA_mn_16:16.2	evamassāyaṁ dutiyo cetokhilo pahīno hoti.	evam assa ayam dutiyaḥ cetaḥ khilaḥ pahīnaḥ hoti 
PA_mn_16:17.1	Puna caparaṁ, bhikkhave, bhikkhu saṅghe na kaṅkhati na vicikicchati adhimuccati sampasīdati …pe…	puna capara bhikkhave bhikkhu saṅghe na kaṅkhati na vicikicchati adhimuccati sampasīdati pe 
PA_mn_16:17.2	evamassāyaṁ tatiyo cetokhilo pahīno hoti.	evam assa ayam tatiyaḥ cetaḥ khilaḥ pahīnaḥ hoti 
PA_mn_16:18.1	Puna caparaṁ, bhikkhave, bhikkhu sikkhāya na kaṅkhati na vicikicchati adhimuccati sampasīdati …pe…	puna capara bhikkhave bhikkhu sikkhāya na kaṅkhati na vicikicchati adhimuccati sampasīdati pe 
PA_mn_16:18.2	evamassāyaṁ catuttho cetokhilo pahīno hoti.	evam assa ayam catutthaḥ cetaḥ khilo pahīnaḥ hoti 
PA_mn_16:19.1	Puna caparaṁ, bhikkhave, bhikkhu sabrahmacārīsu na kupito hoti na anattamano anāhatacitto akhilajāto.	puna capara bhikkhave bhikkhu sabrahmacārīsu na kupitaḥ hoti na anatta manaḥ anāhata cittaḥ akhila jātaḥ 
PA_mn_16:19.2	Yo so, bhikkhave, bhikkhu sabrahmacārīsu na kupito hoti na anattamano anāhatacitto akhilajāto, tassa cittaṁ namati ātappāya anuyogāya sātaccāya padhānāya.	yaḥ saḥ bhikkhave bhikkhu sabrahmacārīsu na kupitaḥ hoti na anatta manaḥ anāhata cittaḥ akhila jātaḥ tassa cittam namati ātappāya anuyogāya sātaccāya padhānāya 
PA_mn_16:19.3	Yassa cittaṁ namati ātappāya anuyogāya sātaccāya padhānāya, evamassāyaṁ pañcamo cetokhilo pahīno hoti.	yassa cittam namati ātappāya anuyogāya sātaccāya padhānāya evam assa ayam pañcamaḥ cetaḥ khilo pahīnaḥ hoti 
PA_mn_16:19.4	Imāssa pañca cetokhilā pahīnā honti.	pañca cetaḥ khilā pahīnāḥ honti 
PA_mn_16:20.1	Katamāssa pañca cetasovinibandhā susamucchinnā honti?	pañca cetasaḥ vinibandhā su samucchinnāḥ honti 
PA_mn_16:20.2	Idha, bhikkhave, bhikkhu kāme vītarāgo hoti vigatacchando vigatapemo vigatapipāso vigatapariḷāho vigatataṇho.	idha bhikkhave bhikkhu kāme vīta rāgaḥ hoti vigata chandaḥ vigata pemaḥ vigata pipāsaḥ vigata pariḷāhaḥ vigata taṇhaḥ 
PA_mn_16:20.3	Yo so, bhikkhave, bhikkhu kāme vītarāgo hoti vigatacchando vigatapemo vigatapipāso vigatapariḷāho vigatataṇho, tassa cittaṁ namati ātappāya anuyogāya sātaccāya padhānāya.	yaḥ saḥ bhikkhave bhikkhu kāme vīta rāgaḥ hoti vigata chandaḥ vigata pemaḥ vigata pipāsaḥ vigata pariḷāhaḥ vigata taṇhaḥ tassa cittam namati ātappāya anuyogāya sātaccāya padhānāya 
PA_mn_16:20.4	Yassa cittaṁ namati ātappāya anuyogāya sātaccāya padhānāya, evamassāyaṁ paṭhamo cetasovinibandho susamucchinno hoti.	yassa cittam namati ātappāya anuyogāya sātaccāya padhānāya evam assa ayam paṭhamaḥ cetasovinibandho su samucchinno hoti 
PA_mn_16:21.1	Puna caparaṁ, bhikkhave, bhikkhu kāye vītarāgo hoti …pe…	puna capara bhikkhave bhikkhu kāye vīta rāgaḥ hoti pe
PA_mn_16:22.1	rūpe vītarāgo hoti …pe…	rūpe vīta rāgaḥ hoti pe 
PA_mn_16:23.1	na yāvadatthaṁ udarāvadehakaṁ bhuñjitvā seyyasukhaṁ passasukhaṁ middhasukhaṁ anuyutto viharati.	na yāvadattham udara avadehakam bhuñjitvā seyya sukham passa sukham middha sukham anuyuttaḥ viharati 
PA_mn_16:23.2_0	Yo so, bhikkhave, bhikkhu na yāvadatthaṁ udarāvadehakaṁ bhuñjitvā seyyasukhaṁ passasukhaṁ	yaḥ saḥ bhikkhave bhikkhu na yāvadattham udarāvadehakam bhuñjitvā 
PA_mn_16:23.2_1	middhasukhaṁ anuyutto viharati, tassa cittaṁ namati ātappāya anuyogāya sātaccāya padhānāya.	middha sukham anuyuttaḥ viharati tassa cittam namati ātappāya anuyogāya sātaccāya padhānāya 
PA_mn_16:23.3	Yassa cittaṁ namati ātappāya anuyogāya sātaccāya padhānāya, evamassāyaṁ catuttho cetasovinibandho susamucchinno hoti.	yassa cittam namati ātappāya anuyogāya sātaccāya padhānāya evam assa ayam catuttho cetasovinibandho su samucchinno hoti 
PA_mn_16:24.1_0	Puna caparaṁ, bhikkhave, bhikkhu na aññataraṁ devanikāyaṁ paṇidhāya brahmacariyaṁ	puna capara bhikkhave bhikkhu na aññataram devanikāyam paṇidhāya 
PA_mn_16:24.1_1	carati: ‘imināhaṁ sīlena vā vatena vā tapena vā brahmacariyena vā devo vā bhavissāmi devaññataro vā’ti.	carati iminā aham sīlena vā vatena vā tapena vā brahmacariyena vā devaḥ vā bhavissāmi devaññataraḥ vā ati 
PA_mn_16:24.2_0	Yo so, bhikkhave, bhikkhu na aññataraṁ devanikāyaṁ paṇidhāya brahmacariyaṁ carati:	yaḥ saḥ bhikkhave bhikkhu na aññataram devanikāyam paṇidhāya brahmacariyam carati 
PA_mn_16:24.2_1	‘imināhaṁ sīlena vā vatena vā tapena vā brahmacariyena vā devo vā bhavissāmi devaññataro	iminā aham sīlena vā vatena vā tapena vā brahmacariyena vā devaḥ vā bhavissāmi devaññataraḥ 
PA_mn_16:24.2_2	vā’ti, tassa cittaṁ namati ātappāya anuyogāya sātaccāya padhānāya.	vāti tassa cittam namati ātappāya anuyogāya sātaccāya padhānāya 
PA_mn_16:24.3	Yassa cittaṁ namati ātappāya anuyogāya sātaccāya padhānāya, evamassāyaṁ pañcamo cetasovinibandho susamucchinno hoti.	yassa cittam namati ātappāya anuyogāya sātaccāya padhānāya evam assa ayam pañcamaḥ cetasovinibandho su samucchinno hoti 
PA_mn_16:24.4	Imāssa pañca cetasovinibandhā susamucchinnā honti.	pañca su samucchinnāḥ honti 
PA_mn_16:25.1_0	Yassa kassaci, bhikkhave, bhikkhuno ime pañca cetokhilā pahīnā, ime pañca cetasovinibandhā	yassa kassaci bhikkhave bhikkhunaḥ ime pañca cetaḥ khilā pahīnāḥ ime pañca cetasaḥ vinibandhā 
PA_mn_16:25.1_1	susamucchinnā, so vatimasmiṁ dhammavinaye vuddhiṁ virūḷhiṁ vepullaṁ āpajjissatīti—ṭhānametaṁ vijjati.	su samucchinnā saḥ vatimasmin dhamma vinaye vuddhim virūḷhim vepullam āpajjissati iti ṭhānam etat vijjati 
PA_mn_16:26.1	So chandasamādhipadhānasaṅkhārasamannāgataṁ iddhipādaṁ bhāveti,	saḥ chanda samādhi padhāna saṅkhāra samannāgatam iddhipādam bhāva iti 
PA_mn_16:26.2	vīriyasamādhipadhānasaṅkhārasamannāgataṁ iddhipādaṁ bhāveti,	vīriya samādhi padhāna saṅkhāra samannāgatam iddhipādam bhāva iti 
PA_mn_16:26.3	cittasamādhipadhānasaṅkhārasamannāgataṁ iddhipādaṁ bhāveti,	citta samādhi padhāna saṅkhāra samannāgatam iddhipādam bhāva iti 
PA_mn_16:26.4	vīmaṁsāsamādhipadhānasaṅkhārasamannāgataṁ iddhipādaṁ bhāveti, ussoḷhīyeva pañcamī.	vīmasā samādhi padhāna saṅkhāra samannāgatam iddhipādam bhāva iti ussoḍhīya iva pañcamī 
PA_mn_16:27.1	Sa kho so, bhikkhave, evaṁ ussoḷhipannarasaṅgasamannāgato bhikkhu bhabbo abhinibbidāya, bhabbo sambodhāya, bhabbo anuttarassa yogakkhemassa adhigamāya.	sa kho saḥ bhikkhave evam ussoḷhi pannarasaṅga samannāgataḥ bhikkhu bhabbaḥ abhinibbidāya bhabbaḥ sambodhāya bhabbaḥ anuttarassa yogakkhemassa adhigamāya 
PA_mn_16:27.2	Seyyathāpi, bhikkhave, kukkuṭiyā aṇḍāni aṭṭha vā dasa vā dvādasa vā.	seyyathā api bhikkhave kukkuṭiyāḥ aṇḍāni aṭṭha vā dasa vā dvādasa vā 
PA_mn_16:27.3	Tānassu kukkuṭiyā sammā adhisayitāni sammā pariseditāni sammā paribhāvitāni.	kukkuṭiyā sammā adhisayitāni sammā pariseditāni sammā paribhāvitāni 
PA_mn_16:27.4	Kiñcāpi tassā kukkuṭiyā na evaṁ icchā uppajjeyya:	kiñca api tassā kukkuṭiyā na evam icchā uppajjeyya 
PA_mn_16:27.5	‘aho vatime kukkuṭapotakā pādanakhasikhāya vā mukhatuṇḍakena vā aṇḍakosaṁ padāletvā sotthinā abhinibbhijjeyyun’ti.	aho vati me kukkuṭa potakā pāda nakha sikhāya vā mukha tuṇḍakena vā aṇḍa kosam padāletvā sotthinā abhinibbhijjeyyunti 
PA_mn_16:27.6	Atha kho bhabbāva te kukkuṭapotakā pādanakhasikhāya vā mukhatuṇḍakena vā aṇḍakosaṁ padāletvā sotthinā abhinibbhijjituṁ.	atha kho bhabbāva te kukkuṭa potakā pāda nakha sikhāya vā mukha tuṇḍakena vā aṇḍa kosam padāletvā sotthinā abhinibbhijjitu 
PA_mn_16:27.7	Evameva kho, bhikkhave, evaṁ ussoḷhipannarasaṅgasamannāgato bhikkhu bhabbo abhinibbidāya, bhabbo sambodhāya, bhabbo anuttarassa yogakkhemassa adhigamāyā”ti.	evam eva kho bhikkhave evam ussoḷhi pannarasaṅga samannāgataḥ bhikkhu bhabbaḥ abhinibbidāya bhabbaḥ sambodhāya bhabbaḥ anuttarassa yogakkhemassa adhigamāya ati 
PA_mn_16:27.8	Idamavoca bhagavā.	idam avoca bhagavān 
PA_mn_16:27.9	Attamanā te bhikkhū bhagavato bhāsitaṁ abhinandunti.	attamanāḥ te bhikkhū bhagavataḥ bhāsitam abhinandunti 
PA_mn_16:27.10	Cetokhilasuttaṁ niṭṭhitaṁ chaṭṭhaṁ.	cetokhila suttam niṭṭhitam chaṭṭha 
