segmentnr	original	analyzed
PA_patthana_18.5:0.1	Paṭṭhānapakaraṇa	▁ paṭṭhānapakaraṇa
PA_patthana_18.5:0.2	Dhammānulomapaccanīya (3), Dukadukapaṭṭhānapāḷi (6)	▁dhammā nulomapaccanīya ▁duk aduk apaṭṭhānapāḷi
PA_patthana_18.5:0.3	18.5. Hetuduka, Āsavagocchaka	▁hetu du ka ▁āsav a go cch aka
PA_patthana_18.5:1.1	Hetuṁ āsavaṁ dhammaṁ paṭicca nahetu naāsavo dhammo uppajjati hetupaccayā. (Saṅkhittaṁ.) Hetuyā pañca …pe… avigate pañca.	▁hetu ṃ ▁āsav aṃ ▁dhammaṃ ▁paṭicca ▁nahetu ▁na āsav o ▁dhammo ▁uppajjati ▁hetupaccayā ▁saṃkhittaṃ ▁hetuyā ▁pañca ▁pe ▁avigate ▁pañca
PA_patthana_18.5:2.1	Hetuṁ noāsavaṁ dhammaṁ paṭicca nanahetu nanoāsavo dhammo uppajjati hetupaccayā. (Saṅkhittaṁ.) Hetuyā pañca …pe… avigate pañca.	▁hetu ṃ ▁no āsav aṃ ▁dhammaṃ ▁paṭicca ▁nan ahetu ▁na no āsav o ▁dhammo ▁uppajjati ▁hetupaccayā ▁saṃkhittaṃ ▁hetuyā ▁pañca ▁pe ▁avigate ▁pañca
PA_patthana_18.5:3.1	Nahetuṁ sāsavaṁ dhammaṁ paccayā nanahetu nasāsavo dhammo uppajjati hetupaccayā. (Saṅkhittaṁ.) Hetuyā tīṇi …pe… avigate tīṇi.	▁nahetu ṃ ▁s āsav aṃ ▁dhammaṃ ▁paccayā ▁nan ahetu ▁na s āsav o ▁dhammo ▁uppajjati ▁hetupaccayā ▁saṃkhittaṃ ▁hetuyā ▁tīṇi ▁pe ▁avigate ▁tīṇi
PA_patthana_18.5:4.1	Hetuṁ anāsavaṁ dhammaṁ paṭicca nahetu naanāsavo dhammo uppajjati hetupaccayā. (Saṅkhittaṁ.) Hetuyā tīṇi, adhipatiyā tīṇi …pe… avigate tīṇi.	▁hetu ṃ ▁an āsav aṃ ▁dhammaṃ ▁paṭicca ▁nahetu ▁na an āsav o ▁dhammo ▁uppajjati ▁hetupaccayā ▁saṃkhittaṃ ▁hetuyā ▁tīṇi ▁ adhipatiyā ▁tīṇi ▁pe ▁avigate ▁tīṇi
PA_patthana_18.5:5.1	Hetuṁ āsavasampayuttaṁ dhammaṁ paṭicca nahetu naāsavasampayutto dhammo uppajjati hetupaccayā. (Saṅkhittaṁ.) Hetuyā nava, ārammaṇe tīṇi …pe… avigate nava.	▁hetu ṃ ▁āsav asampayutt aṃ ▁dhammaṃ ▁paṭicca ▁nahetu ▁na āsav asampayutt o ▁dhammo ▁uppajjati ▁hetupaccayā ▁saṃkhittaṃ ▁hetuyā ▁nava ▁ārammaṇe ▁tīṇi ▁pe ▁avigate ▁nava
PA_patthana_18.5:6.1	Hetuṁ āsavavippayuttaṁ dhammaṁ paṭicca nahetu naāsavavippayutto dhammo uppajjati hetupaccayā. (Saṅkhittaṁ.) Hetuyā tīṇi …pe… avigate tīṇi.	▁hetu ṃ ▁āsav avippayutt aṃ ▁dhammaṃ ▁paṭicca ▁nahetu ▁na āsav avippayutt o ▁dhammo ▁uppajjati ▁hetupaccayā ▁saṃkhittaṃ ▁hetuyā ▁tīṇi ▁pe ▁avigate ▁tīṇi
PA_patthana_18.5:7.1	Hetuṁ āsavañceva sāsavañca dhammaṁ paṭicca nahetu naāsavo ceva naanāsavo ca dhammo uppajjati hetupaccayā. (Saṅkhittaṁ.) Hetuyā pañca …pe… avigate pañca.	▁hetu ṃ ▁āsav añceva ▁s āsav añca ▁dhammaṃ ▁paṭicca ▁nahetu ▁na āsav o ▁ceva ▁na an āsav o ▁ca ▁dhammo ▁uppajjati ▁hetupaccayā ▁saṃkhittaṃ ▁hetuyā ▁pañca ▁pe ▁avigate ▁pañca
PA_patthana_18.5:8.1	Hetuṁ sāsavañceva no ca āsavaṁ dhammaṁ paṭicca nanahetu naanāsavo ceva nano ca āsavo dhammo uppajjati hetupaccayā. (Saṅkhittaṁ.) Hetuyā pañca …pe… avigate pañca.	▁hetu ṃ ▁s āsav añceva ▁no ▁ca ▁āsav aṃ ▁dhammaṃ ▁paṭicca ▁nan ahetu ▁na an āsav o ▁ceva ▁na no ▁ca ▁āsav o ▁dhammo ▁uppajjati ▁hetupaccayā ▁saṃkhittaṃ ▁hetuyā ▁pañca ▁pe ▁avigate ▁pañca
PA_patthana_18.5:9.1	Hetuṁ āsavañceva āsavasampayuttañca dhammaṁ paṭicca nahetu naāsavo ceva naāsavavippayutto ca dhammo uppajjati hetupaccayā. (Saṅkhittaṁ.) Hetuyā tīṇi …pe… avigate tīṇi.	▁hetu ṃ ▁āsav añceva ▁āsav asampayutt añca ▁dhammaṃ ▁paṭicca ▁nahetu ▁na āsav o ▁ceva ▁na āsav avippayutt o ▁ca ▁dhammo ▁uppajjati ▁hetupaccayā ▁saṃkhittaṃ ▁hetuyā ▁tīṇi ▁pe ▁avigate ▁tīṇi
PA_patthana_18.5:10.1	Nahetuṁ āsavasampayuttañceva no ca āsavaṁ dhammaṁ paṭicca nanahetu naāsavavippayutto ceva nanoāsavo ca dhammo uppajjati hetupaccayā. (Saṅkhittaṁ.) Hetuyā tīṇi …pe… avigate tīṇi.	▁nahetu ṃ ▁āsav asampayutt añceva ▁no ▁ca ▁āsav aṃ ▁dhammaṃ ▁paṭicca ▁nan ahetu ▁na āsav avippayutt o ▁ceva ▁na no āsav o ▁ca ▁dhammo ▁uppajjati ▁hetupaccayā ▁saṃkhittaṃ ▁hetuyā ▁tīṇi ▁pe ▁avigate ▁tīṇi
PA_patthana_18.5:11.1	Nahetuṁ āsavavippayuttaṁ sāsavaṁ dhammaṁ paccayā nanahetu āsavavippayutto nasāsavo dhammo uppajjati hetupaccayā. (Lokiyasadisaṁ.)	▁nahetu ṃ ▁āsav avippayutt aṃ ▁s āsav aṃ ▁dhammaṃ ▁paccayā ▁nan ahetu ▁āsav avippayutt o ▁na s āsav o ▁dhammo ▁uppajjati ▁hetupaccayā ▁lokiy asadis aṃ
PA_patthana_18.5:12.1_0	Hetuṁ āsavavippayuttaṁ anāsavaṁ dhammaṁ paṭicca nahetu āsavavippayutto naanāsavo	▁hetu ṃ ▁āsav avippayutt aṃ ▁an āsav aṃ ▁dhammaṃ ▁paṭicca ▁nahetu ▁āsav avippayutt o ▁na an āsav o
PA_patthana_18.5:12.1_1	dhammo uppajjati hetupaccayā. Nahetuṁ āsavavippayuttaṁ anāsavaṁ dhammaṁ paṭicca nahetu	▁dhammo ▁uppajjati ▁hetupaccayā ▁nahetu ṃ ▁āsav avippayutt aṃ ▁an āsav aṃ ▁dhammaṃ ▁paṭicca ▁nahetu
PA_patthana_18.5:12.1_2	āsavavippayutto naanāsavo dhammo uppajjati hetupaccayā. Hetuṁ āsavavippayuttaṁ anāsavañca	▁āsav avippayutt o ▁na an āsav o ▁dhammo ▁uppajjati ▁hetupaccayā ▁hetu ṃ ▁āsav avippayutt aṃ ▁an āsav añca
PA_patthana_18.5:12.1_3	nahetuṁ āsavavippayuttaṁ anāsavañca dhammaṁ paṭicca nahetu āsavavippayutto naanāsavo	▁nahetu ṃ ▁āsav avippayutt aṃ ▁an āsav añca ▁dhammaṃ ▁paṭicca ▁nahetu ▁āsav avippayutt o ▁na an āsav o
PA_patthana_18.5:12.1_4	dhammo uppajjati hetupaccayā. (Saṅkhittaṁ.)	▁dhammo ▁uppajjati ▁hetupaccayā ▁saṃkhittaṃ
PA_patthana_18.5:13.1	Hetuyā tīṇi, adhipatiyā tīṇi …pe… avigate tīṇi.	▁hetuyā ▁tīṇi ▁ adhipatiyā ▁tīṇi ▁pe ▁avigate ▁tīṇi
