segmentnr	original	folio	analyzed
PA_patthana_8.50:0.1	Paṭṭhānapakaraṇa	0	
PA_patthana_8.50:0.2	Dhammapaccanīya (2), Dukapaṭṭhānapāḷi (2)	0	
PA_patthana_8.50:0.3	8.50. Saṅkilesikaduka	0	
PA_patthana_8.50:1.1_0	Nasaṅkilesikaṁ dhammaṁ paṭicca nasaṅkilesiko dhammo uppajjati hetupaccayā. Nasaṅkilesikaṁ	1	
PA_patthana_8.50:1.1_1	dhammaṁ paṭicca naasaṅkilesiko dhammo uppajjati hetupaccayā. Nasaṅkilesikaṁ dhammaṁ	1	
PA_patthana_8.50:1.1_2	paṭicca nasaṅkilesiko ca naasaṅkilesiko ca dhammā uppajjanti hetupaccayā.	1	
PA_patthana_8.50:2.1	Naasaṅkilesikaṁ dhammaṁ paṭicca naasaṅkilesiko dhammo uppajjati hetupaccayā.	2	
PA_patthana_8.50:3.1	Nasaṅkilesikañca naasaṅkilesikañca dhammaṁ paṭicca naasaṅkilesiko dhammo uppajjati hetupaccayā. (Saṅkhittaṁ.)	3	
PA_patthana_8.50:4.1	Hetuyā pañca, ārammaṇe dve …pe… avigate pañca. (Sabbattha vitthāro.)	4	
