segmentnr	original	analyzed
PA_patthana_20.8:0.1	Paṭṭhānapakaraṇa	paṭṭhāna pakaraṇa 
PA_patthana_20.8:0.2	Dhammapaccanīyānuloma (4), Dukapaṭṭhānapāḷi (2)	dhamma paccanīya anuloma 
PA_patthana_20.8:0.3	20.8. Piṭṭhiduka	piṭṭhiduka 
PA_patthana_20.8:1.1	Nadassanena pahātabbaṁ dhammaṁ paṭicca nadassanena pahātabbo dhammo uppajjati hetupaccayā … ekaṁ.	na dassanena pahātabbam dhammam paṭicca na dassanena pahātabbaḥ dhammaḥ uppajjati hetu paccayā eka 
PA_patthana_20.8:2.1_0	Nanadassanena pahātabbaṁ dhammaṁ paṭicca dassanena pahātabbo dhammo uppajjati hetupaccayā.	nana dassanena pahātabbam dhammam paṭicca dassanena pahātabbaḥ dhammaḥ uppajjati hetu paccayā 
PA_patthana_20.8:2.1_1	Nanadassanena pahātabbaṁ dhammaṁ paṭicca nadassanena pahātabbo dhammo uppajjati hetupaccayā.	na na dassanena pahātabbam dhammam paṭicca na dassanena pahātabbaḥ dhammaḥ uppajjati hetu paccayā 
PA_patthana_20.8:2.1_2	Nanadassanena pahātabbaṁ dhammaṁ paṭicca dassanena pahātabbo ca nadassanena pahātabbo	na na dassanena pahātabbam dhammam paṭicca dassanena pahātabbaḥ ca na dassanena pahātabbaḥ 
PA_patthana_20.8:2.1_3	ca dhammā uppajjanti hetupaccayā … tīṇi.	ca dhammā uppajjanti hetu paccayā tīṇi 
PA_patthana_20.8:3.1	Nadassanena pahātabbañca nanadassanena pahātabbañca dhammaṁ paṭicca nadassanena pahātabbo dhammo uppajjati hetupaccayā … ekaṁ. (Saṅkhittaṁ.)	na dassanena pahātabbañca na na dassanena pahātabbañca dhammam paṭicca na dassanena pahātabbaḥ dhammaḥ uppajjati hetu paccayā 
PA_patthana_20.8:4.1	Hetuyā pañca, ārammaṇe dve …pe… vipāke ekaṁ …pe… avigate pañca.	hetuyā pañca ārammaṇe dve pe vipāke ekam pe avigate pañca 
PA_patthana_20.8:5.1	Nabhāvanāya pahātabbaṁ dhammaṁ paṭicca nabhāvanāya pahātabbo dhammo uppajjati hetupaccayā. (Saṅkhittaṁ.)	na bhāvanāya pahātabbam dhammam paṭicca na bhāvanāya pahātabbaḥ dhammaḥ uppajjati hetu paccayā 
PA_patthana_20.8:6.1	Hetuyā pañca, ārammaṇe dve …pe… vipāke ekaṁ …pe… avigate pañca.	hetuyā pañca ārammaṇe dve pe vipāke ekam pe avigate pañca 
PA_patthana_20.8:7.1	Nadassanena pahātabbahetukaṁ dhammaṁ paṭicca dassanena pahātabbahetuko dhammo uppajjati hetupaccayā. (Saṅkhittaṁ.)	na dassanena pahātabba hetukam dhammam paṭicca dassanena pahātabba hetukaḥ dhammaḥ uppajjati hetu paccayā 
PA_patthana_20.8:8.1	Hetuyā nava, ārammaṇe cha, adhipatiyā pañca …pe… vipāke ekaṁ …pe… avigate nava.	hetuyā nava ārammaṇe cha adhipatiyā pañca pe vipāke ekam pe avigate nava 
PA_patthana_20.8:9.1	Nabhāvanāya pahātabbahetukaṁ dhammaṁ paṭicca bhāvanāya pahātabbahetuko dhammo uppajjati hetupaccayā. (Saṅkhittaṁ.)	na bhāvanāya pahātabba hetukam dhammam paṭicca bhāvanāya pahātabba hetukaḥ dhammaḥ uppajjati hetu paccayā 
PA_patthana_20.8:10.1	Hetuyā nava, ārammaṇe cha, adhipatiyā pañca …pe… vipāke ekaṁ …pe… avigate nava.	hetuyā nava ārammaṇe cha adhipatiyā pañca pe vipāke ekam pe avigate nava 
PA_patthana_20.8:11.1_0	Nasavitakkaṁ dhammaṁ paṭicca savitakko dhammo uppajjati hetupaccayā. Nasavitakkaṁ	na sa vitakkam dhammam paṭicca sa vitakkaḥ dhammaḥ uppajjati hetu paccayā na sa vitakka 
PA_patthana_20.8:11.1_1	dhammaṁ paṭicca avitakko dhammo uppajjati hetupaccayā. Nasavitakkaṁ dhammaṁ paṭicca	dhammam paṭicca avitakkaḥ dhammaḥ uppajjati hetu paccayā na sa vitakkam dhammam paṭicca 
PA_patthana_20.8:11.1_2	savitakko ca avitakko ca dhammā uppajjanti hetupaccayā … tīṇi.	sa vitakko ca avitakkaḥ ca dhammā uppajjanti hetu paccayā tīṇi 
PA_patthana_20.8:12.1_0	Naavitakkaṁ dhammaṁ paṭicca avitakko dhammo uppajjati hetupaccayā. Naavitakkaṁ dhammaṁ	na avitakkam dhammam paṭicca avitakkaḥ dhammaḥ uppajjati hetu paccayā na avitakkam dhamma 
PA_patthana_20.8:12.1_1	paṭicca savitakko dhammo uppajjati hetupaccayā. Naavitakkaṁ dhammaṁ paṭicca savitakko	paṭicca sa vitakkaḥ dhammaḥ uppajjati hetu paccayā na avitakkam dhammam paṭicca sa vitakkaḥ 
PA_patthana_20.8:12.1_2	ca avitakko ca dhammā uppajjanti hetupaccayā … tīṇi.	ca avitakko ca dhammā uppajjanti hetu paccayā tīṇi 
PA_patthana_20.8:13.1_0	Nasavitakkañca naavitakkañca dhammaṁ paṭicca savitakko dhammo uppajjati hetupaccayā.	na sa vitakkam ca na avitakkañca dhammam paṭicca sa vitakkaḥ dhammaḥ uppajjati hetu paccayā 
PA_patthana_20.8:13.1_1	Nasavitakkañca naavitakkañca dhammaṁ paṭicca avitakko dhammo uppajjati hetupaccayā.	na sa vitakkam ca na avitakkañca dhammam paṭicca avitakkaḥ dhammaḥ uppajjati hetu paccayā 
PA_patthana_20.8:13.1_2	Nasavitakkañca naavitakkañca dhammaṁ paṭicca savitakko ca avitakko ca dhammā uppajjanti	na sa vitakkam ca na avitakkam ca dhammam paṭicca sa vitakkaḥ ca avitakkaḥ ca dhammāḥ uppajjanti 
PA_patthana_20.8:13.1_3	hetupaccayā … tīṇi. (Saṅkhittaṁ.)	hetu paccayā tīṇi 
PA_patthana_20.8:14.1	Hetuyā nava, ārammaṇe nava …pe… purejāte āsevane cha …pe… avigate nava.	hetuyā nava ārammaṇe nava pe purejāte āsevane cha pe avigate nava 
PA_patthana_20.8:15.1	Nasavicāraṁ dhammaṁ paṭicca savicāro dhammo uppajjati hetupaccayā. (Saṅkhittaṁ.)	na sa vicāram dhammam paṭicca sa vicāraḥ dhammo uppajjati hetu paccayā 
PA_patthana_20.8:16.1	Hetuyā nava, ārammaṇe nava …pe… purejāte āsevane cha …pe… avigate nava.	hetuyā nava ārammaṇe nava pe purejāte āsevane cha pe avigate nava 
PA_patthana_20.8:17.1	Nasappītikaṁ dhammaṁ paṭicca sappītiko dhammo uppajjati hetupaccayā. (Saṅkhittaṁ.)	na sa ppītikam dhammam paṭicca sa ppītikaḥ dhammaḥ uppajjati hetu paccayā saṅkhitta 
PA_patthana_20.8:18.1	Hetuyā nava, ārammaṇe nava …pe… purejāte āsevane cha …pe… avigate nava.	hetuyā nava ārammaṇe nava pe purejāte āsevane cha pe avigate nava 
PA_patthana_20.8:19.1	Napītisahagataṁ dhammaṁ paṭicca pītisahagato dhammo uppajjati hetupaccayā. (Saṅkhittaṁ.)	na pīti sahagatam dhammam paṭicca pīti sahagataḥ dhammaḥ uppajjati hetu paccayā 
PA_patthana_20.8:20.1	Hetuyā nava, ārammaṇe nava …pe… purejāte āsevane cha …pe… avigate nava.	hetuyā nava ārammaṇe nava pe purejāte āsevane cha pe avigate nava 
PA_patthana_20.8:21.1	Nasukhasahagataṁ dhammaṁ paṭicca sukhasahagato dhammo uppajjati hetupaccayā. (Saṅkhittaṁ.)	na sukha sahagatam dhammam paṭicca sukha sahagataḥ dhammaḥ uppajjati hetu paccayā 
PA_patthana_20.8:22.1	Hetuyā nava, ārammaṇe nava …pe… purejāte āsevane cha …pe… avigate nava.	hetuyā nava ārammaṇe nava pe purejāte āsevane cha pe avigate nava 
PA_patthana_20.8:23.1_0	Naupekkhāsahagataṁ dhammaṁ paṭicca upekkhāsahagato dhammo uppajjati hetupaccayā.	na aupekkhā sahagatam dhammam paṭicca upekkhā sahagataḥ dhammaḥ uppajjati hetu paccayā 
PA_patthana_20.8:23.1_1	Naupekkhāsahagataṁ dhammaṁ paṭicca naupekkhāsahagato dhammo uppajjati hetupaccayā.	na aupekkhā sahagatam dhammam paṭicca na aupekkhā sahagataḥ dhammo uppajjati hetu paccayā 
PA_patthana_20.8:23.1_2	Naupekkhāsahagataṁ dhammaṁ paṭicca upekkhāsahagato ca naupekkhāsahagato ca dhammā	na aupekkhā sahagatam dhammam paṭicca upekkhā sahagataḥ ca na aupekkhā sahagataḥ ca dhammā 
PA_patthana_20.8:23.1_3	uppajjanti hetupaccayā … tīṇi.	uppajjanti hetu paccayā tīṇi 
PA_patthana_20.8:24.1	Nanaupekkhāsahagataṁ dhammaṁ paṭicca naupekkhāsahagato dhammo uppajjati hetupaccayā … tīṇi.	na na aupekkhā sahagatam dhammam paṭicca na aupekkhā sahagataḥ dhammaḥ uppajjati hetu paccayā tīṇi 
PA_patthana_20.8:25.1_0	Naupekkhāsahagatañca nanaupekkhāsahagatañca dhammaṁ paṭicca upekkhāsahagato dhammo	na aupekkhā sahagatam ca na na aupekkhā sahagatam ca dhammam paṭicca upekkhā sahagataḥ dhammo 
PA_patthana_20.8:25.1_1	uppajjati hetupaccayā. Naupekkhāsahagatañca nanaupekkhāsahagatañca dhammaṁ paṭicca	uppajjati hetu paccayā na aupekkhā sahagatam ca na na aupekkhā sahagatam ca dhammam paṭicca 
PA_patthana_20.8:25.1_2	naupekkhāsahagato dhammo uppajjati hetupaccayā. Naupekkhāsahagatañca nanaupekkhāsahagatañca	na aupekkhā sahagataḥ dhammaḥ uppajjati hetu paccayā na upekkhā sahagatañca na na aupekkhā sahagatañca 
PA_patthana_20.8:25.1_3	dhammaṁ paṭicca upekkhāsahagato ca naupekkhāsahagato ca dhammā uppajjanti hetupaccayā	dhammam paṭicca upekkhā sahagataḥ ca na aupekkhā sahagataḥ ca dhammā uppajjanti hetu paccayā 
PA_patthana_20.8:25.1_4	… tīṇi. (Saṅkhittaṁ.)	tīṇi 
PA_patthana_20.8:26.1	Hetuyā nava, ārammaṇe nava …pe… purejāte āsevane cha …pe… avigate nava.	hetuyā nava ārammaṇe nava pe purejāte āsevane cha pe avigate nava 
PA_patthana_20.8:27.1_0	Nakāmāvacaraṁ dhammaṁ paṭicca kāmāvacaro dhammo uppajjati hetupaccayā. Nakāmāvacaraṁ	na kāmāvacaram dhammam paṭicca kāmāvacaraḥ dhammo uppajjati hetu paccayā na kāmāvacara 
PA_patthana_20.8:27.1_1	dhammaṁ paṭicca nakāmāvacaro dhammo uppajjati hetupaccayā. Nakāmāvacaraṁ dhammaṁ	dhammam paṭicca na kāmāvacaraḥ dhammaḥ uppajjati hetu paccayā na kāmāvacaram dhamma 
PA_patthana_20.8:27.1_2	paṭicca kāmāvacaro ca nakāmāvacaro ca dhammā uppajjanti hetupaccayā … tīṇi.	paṭicca kāmāvacaraḥ ca na kāmāvacaraḥ ca dhammā uppajjanti hetu paccayā tīṇi 
PA_patthana_20.8:28.1	Nanakāmāvacaraṁ dhammaṁ paṭicca nakāmāvacaro dhammo uppajjati hetupaccayā … tīṇi.	na na kāmāvacaram dhammam paṭicca na kāmāvacaraḥ dhammo uppajjati hetu paccayā tīṇi 
PA_patthana_20.8:29.1	Nakāmāvacarañca nanakāmāvacarañca dhammaṁ paṭicca kāmāvacaro dhammo uppajjati hetupaccayā … tīṇi. (Saṅkhittaṁ.)	na kāmāvacaram ca na na kāmāvacaram ca dhammam paṭicca kāmāvacaraḥ dhammo uppajjati hetu paccayā tīṇi 
PA_patthana_20.8:30.1	Hetuyā nava, ārammaṇe cattāri, adhipatiyā pañca …pe… aññamaññe cha …pe… purejāte āsevane dve …pe… avigate nava.	hetuyā nava ārammaṇe cattāri adhipatiyā pañca pe aññamaññe cha pe purejāte āsevane dve pe avigate nava 
PA_patthana_20.8:31.1	Narūpāvacaraṁ dhammaṁ paṭicca rūpāvacaro dhammo uppajjati hetupaccayā. (Saṅkhittaṁ.)	na rūpāvacaram dhammam paṭicca rūpāvacaraḥ dhammo uppajjati hetu paccayā 
PA_patthana_20.8:32.1	Hetuyā nava, ārammaṇe cattāri, adhipatiyā pañca …pe… aññamaññe cha …pe… purejāte āsevane dve …pe… avigate nava.	hetuyā nava ārammaṇe cattāri adhipatiyā pañca pe aññamaññe cha pe purejāte āsevane dve pe avigate nava 
PA_patthana_20.8:33.1	Naarūpāvacaraṁ dhammaṁ paṭicca naarūpāvacaro dhammo uppajjati hetupaccayā. (Saṅkhittaṁ.)	na arūpāvacaram dhammam paṭicca na arūpāvacaraḥ dhammo uppajjati hetu paccayā 
PA_patthana_20.8:34.1	Hetuyā pañca, ārammaṇe dve …pe… vipāke dve …pe… avigate pañca.	hetuyā pañca ārammaṇe dve pe vipāke dve pe avigate pañca 
PA_patthana_20.8:35.1	Napariyāpannaṁ dhammaṁ paṭicca pariyāpanno dhammo uppajjati hetupaccayā … tīṇi.	na pariyāpannam dhammam paṭicca pariyāpannaḥ dhammaḥ uppajjati hetu paccayā tīṇi 
PA_patthana_20.8:36.1	Naapariyāpannaṁ dhammaṁ paṭicca pariyāpanno dhammo uppajjati hetupaccayā … ekaṁ.	na apariyāpannam dhammam paṭicca pariyāpannaḥ dhammaḥ uppajjati hetu paccayā eka 
PA_patthana_20.8:37.1	Napariyāpannañca naapariyāpannañca dhammaṁ paṭicca pariyāpanno dhammo uppajjati hetupaccayā … ekaṁ. (Saṅkhittaṁ.)	na pariyāpannam ca na apariyāpannam ca dhammam paṭicca pariyāpannaḥ dhammaḥ uppajjati hetu paccayā 
PA_patthana_20.8:38.1	Hetuyā pañca, ārammaṇe dve …pe… avigate pañca.	hetuyā pañca ārammaṇe dve pe avigate pañca 
PA_patthana_20.8:39.1	Naniyyānikaṁ dhammaṁ paṭicca aniyyāniko dhammo uppajjati hetupaccayā … ekaṁ.	na niyyānikam dhammam paṭicca aniyyānikaḥ dhammaḥ uppajjati hetu paccayā eka 
PA_patthana_20.8:40.1	Naaniyyānikaṁ dhammaṁ paṭicca aniyyāniko dhammo uppajjati hetupaccayā … tīṇi.	na aniyyānikam dhammam paṭicca aniyyānikaḥ dhammaḥ uppajjati hetu paccayā tīṇi 
PA_patthana_20.8:41.1	Naniyyānikañca naaniyyānikañca dhammaṁ paṭicca aniyyāniko dhammo uppajjati hetupaccayā … ekaṁ. (Saṅkhittaṁ.)	na niyyānikam ca na aniyyānikam ca dhammam paṭicca aniyyānikaḥ dhammaḥ uppajjati hetu paccayā eka 
PA_patthana_20.8:42.1	Hetuyā pañca, ārammaṇe ekaṁ …pe… vipāke ekaṁ …pe… avigate pañca.	hetuyā pañca ārammaṇe ekam pe vipāke ekam pe avigate pañca 
PA_patthana_20.8:43.1	Naniyataṁ dhammaṁ paṭicca aniyato dhammo uppajjati hetupaccayā … ekaṁ.	na niyatam dhammam paṭicca aniyataḥ dhammaḥ uppajjati hetu paccayā eka 
PA_patthana_20.8:44.1	Naaniyataṁ dhammaṁ paṭicca aniyato dhammo uppajjati hetupaccayā … tīṇi.	na aniyatam dhammam paṭicca aniyataḥ dhammaḥ uppajjati hetu paccayā tīṇi 
PA_patthana_20.8:45.1	Naniyatañca naaniyatañca dhammaṁ paṭicca aniyato dhammo uppajjati hetupaccayā … ekaṁ. (Saṅkhittaṁ.)	na niyatam ca na aniyatam ca dhammam paṭicca aniyataḥ dhammaḥ uppajjati hetu paccayā 
PA_patthana_20.8:46.1	Hetuyā pañca, ārammaṇe dve …pe… vipāke ekaṁ …pe… avigate pañca.	hetuyā pañca ārammaṇe dve pe vipāke ekam pe avigate pañca 
PA_patthana_20.8:47.1_0	Nasauttaraṁ dhammaṁ paṭicca sauttaro dhammo uppajjati hetupaccayā. Nasauttaraṁ dhammaṁ	na sauttaram dhammam paṭicca sauttaraḥ dhammaḥ uppajjati hetu paccayā na sauttaram dhamma 
PA_patthana_20.8:47.1_1	paṭicca anuttaro dhammo uppajjati hetupaccayā. Nasauttaraṁ dhammaṁ paṭicca sauttaro	paṭicca anuttaraḥ dhammaḥ uppajjati hetu paccayā na sa uttaram dhammam paṭicca sa uttaraḥ 
PA_patthana_20.8:47.1_2	ca anuttaro ca dhammā uppajjanti hetupaccayā … tīṇi.	ca anuttaro ca dhammā uppajjanti hetu paccayā tīṇi 
PA_patthana_20.8:48.1	Naanuttaraṁ dhammaṁ paṭicca sauttaro dhammo uppajjati hetupaccayā … ekaṁ.	na anuttaram dhammam paṭicca sauttaraḥ dhammo uppajjati hetu paccayā eka 
PA_patthana_20.8:49.1	Nasauttarañca naanuttarañca dhammaṁ paṭicca sauttaro dhammo uppajjati hetupaccayā. (Saṅkhittaṁ.)	na sauttaram ca na anuttarañca dhammam paṭicca sauttaraḥ dhammaḥ uppajjati hetu paccayā 
PA_patthana_20.8:50.1	Hetuyā pañca, ārammaṇe dve …pe… avigate pañca.	hetuyā pañca ārammaṇe dve pe avigate pañca 
