segmentnr	original	analyzed
PA_patthana_15.83:0.1	Paṭṭhānapakaraṇa	paṭṭhāna pakaraṇa 
PA_patthana_15.83:0.2	Dhammānulomapaccanīya (3), Dukatikapaṭṭhānapāḷi (3)	dhamma anuloma paccanīya 
PA_patthana_15.83:0.3	15.83. Saraṇaduka, Hīnattika	saraṇaduka 
PA_patthana_15.83:1.1	Saraṇaṁ hīnaṁ dhammaṁ paṭicca nasaraṇo nahīno dhammo uppajjati hetupaccayā. Hetuyā ekaṁ …pe… avigate ekaṁ.	saraṇam hīnam dhammam paṭicca na saraṇaḥ na hīnaḥ dhammaḥ uppajjati hetu paccayā hetuyā ekam pe avigate eka 
PA_patthana_15.83:2.1_0	Araṇaṁ majjhimaṁ dhammaṁ paccayā naaraṇo namajjhimo dhammo uppajjati hetupaccayā.	araṇam majjhimam dhammam paccayā na araṇaḥ na majjhimaḥ dhammo uppajjati hetu paccayā 
PA_patthana_15.83:2.1_1	Araṇaṁ majjhimaṁ dhammaṁ paccayā nasaraṇo namajjhimo dhammo uppajjati hetupaccayā.	araṇam majjhimam dhammam paccayā na saraṇaḥ na majjhimaḥ dhammaḥ uppajjati hetu paccayā 
PA_patthana_15.83:2.1_2	Hetuyā dve …pe… vipāke ekaṁ …pe… avigate dve.	dve pe vipāke ekam pe avigate dve 
PA_patthana_15.83:3.1	Araṇaṁ paṇītaṁ dhammaṁ paṭicca nasaraṇo napaṇīto dhammo uppajjati hetupaccayā. Hetuyā ekaṁ …pe… avigate ekaṁ.	araṇam paṇītam dhammam paṭicca na saraṇaḥ na paṇītaḥ dhammaḥ uppajjati hetu paccayā hetuyā ekam pe avigate eka 
