segmentnr	original	analyzed
PA_patthana_15.3:0.1	Paṭṭhānapakaraṇa	paṭṭhāna pakaraṇa 
PA_patthana_15.3:0.2	Dhammānulomapaccanīya (3), Dukatikapaṭṭhānapāḷi (3)	dhamma anuloma paccanīya 
PA_patthana_15.3:0.3	15.3. Hetuduka, Vipākattika	hetu duka vipāka ttika 
PA_patthana_15.3:1.1	Hetuṁ vipākaṁ dhammaṁ paṭicca nahetu navipāko dhammo uppajjati hetupaccayā. Hetuyā tīṇi …pe… avigate tīṇi.	hetum vipākam dhammam paṭicca na hetu na vipākaḥ dhammaḥ uppajjati hetu paccayā hetuyā tīṇi pe avigate tīṇi 
PA_patthana_15.3:2.1	Hetuṁ vipākadhammadhammaṁ paṭicca nahetu navipākadhammadhammo uppajjati hetupaccayā. Hetuyā tīṇi …pe… avigate tīṇi.	hetum vipāka dhamma dhammam paṭicca na hetu na vipāka dhamma dhammaḥ uppajjati hetu paccayā hetuyā tīṇi pe avigate tīṇi 
PA_patthana_15.3:3.1	Nahetuṁ nevavipākanavipākadhammadhammaṁ paṭicca nanahetu nanevavipākanavipākadhammadhammo uppajjati hetupaccayā. Hetuyā tīṇi …pe… avigate tīṇi.	na hetum neva vipāka na vipāka dhamma dhammam paṭicca na na hetu na neva vipāka na vipāka dhamma dhammaḥ uppajjati hetu paccayā hetuyā tīṇi pe avigate tīṇi 
