segmentnr	original	analyzed
PA_patthana_2.13:213.1	Bhāvanāya pahātabbahetuko dhammo bhāvanāya pahātabbahetukassa dhammassa hetupaccayena paccayo … cha …pe…. (Dassanena pahātabbahetukadukasadisā.)	bhāvanāya pahātabba hetukaḥ dhammaḥ bhāvanāya pahātabba hetukassa dhammassa hetu paccayena paccayaḥ cha pe dassanena pahātabba hetuka duka sadisā 
PA_patthana_2.13:214.0	Ārammaṇa	ārammaṇa 
PA_patthana_2.13:214.1	Bhāvanāya pahātabbahetuko dhammo bhāvanāya pahātabbahetukassa dhammassa ārammaṇapaccayena paccayo … tīṇi. (Ārabbha dassanena pahātabbahetukadukasadisā.)	bhāvanāya pahātabba hetukaḥ dhammaḥ bhāvanāya pahātabba hetukassa dhammassa ārammaṇa paccayena paccayaḥ tīṇi ārabbha dassanena pahātabba hetuka duka sadisā 
PA_patthana_2.13:215.1_0	Nabhāvanāya pahātabbahetuko dhammo nabhāvanāya pahātabbahetukassa dhammassa ārammaṇapaccayena	na bhāvanāya pahātabba hetukaḥ dhammaḥ na bhāvanāya pahātabba hetukassa dhammassa ārammaṇa paccayena 
PA_patthana_2.13:215.1_1	paccayo—dānaṁ …pe… sīlaṁ …pe… uposathakammaṁ katvā taṁ paccavekkhati assādeti abhinandati,	paccayodānam pe sīlam pe uposatha kammam katvā tam paccavekkhati assādeti abhinandati 
PA_patthana_2.13:215.1_2	taṁ ārabbha nabhāvanāya pahātabbahetuko rāgo uppajjati, diṭṭhi …pe… vicikicchā …pe…	tam ārabbha na bhāvanāya pahātabba hetukaḥ rāgaḥ uppajjati diṭṭhi pe vicikicchā pe 
PA_patthana_2.13:215.1_3	nabhāvanāya pahātabbahetukaṁ domanassaṁ uppajjati, pubbe suciṇṇāni …pe… jhānā …pe…	na bhāvanāya pahātabba hetukam domanassam uppajjati pubbe su ciṇṇāni pe jhānā pe 
PA_patthana_2.13:215.1_4	ariyā maggā …pe… phalassa, āvajjanāya ārammaṇapaccayena paccayo; ariyā nabhāvanāya	ariyāḥ maggāḥ pe phalassa āvajjanāya ārammaṇa paccayena paccayaḥ ariyāḥ na bhāvanāya 
PA_patthana_2.13:215.1_5	pahātabbahetuke pahīne kilese …pe… pubbe samudāciṇṇe …pe… cakkhuṁ …pe… vatthuṁ nabhāvanāya	pahātabba hetuke pahīne kilese pe pubbe samudāciṇṇe pe cakkhum pe vatthum na bhāvanāya 
PA_patthana_2.13:215.1_6	pahātabbahetuke khandhe ca mohañca aniccato …pe… vipassati assādeti abhinandati,	pahātabba hetuke khandhe ca mohañca aniccato pe vipassati assādeti abhinandati 
PA_patthana_2.13:215.1_7	taṁ ārabbha nabhāvanāya pahātabbahetuko rāgo uppajjati, diṭṭhi …pe… vicikicchā …pe…	tam ārabbha na bhāvanāya pahātabba hetukaḥ rāgaḥ uppajjati diṭṭhi pe vicikicchā pe 
PA_patthana_2.13:215.1_8	nabhāvanāya pahātabbahetukaṁ domanassaṁ uppajjati; dibbena cakkhunā rūpaṁ passati	na bhāvanāya pahātabba hetukam domanassam uppajjati dibbena cakkhunā rūpam passati 
PA_patthana_2.13:215.1_9	…pe… anāgataṁsañāṇassa, āvajjanāya, mohassa ca ārammaṇapaccayena paccayo.	pe anāgata sañāṇassa āvajjanāya mohassa ca ārammaṇa paccayena paccayo 
PA_patthana_2.13:216.1_0	Nabhāvanāya pahātabbahetuko dhammo bhāvanāya pahātabbahetukassa dhammassa ārammaṇapaccayena	na bhāvanāya pahātabba hetukaḥ dhammaḥ bhāvanāya pahātabba hetukassa dhammassa ārammaṇa paccayena 
PA_patthana_2.13:216.1_1	paccayo—dānaṁ …pe… sīlaṁ …pe… jhānaṁ …pe… cakkhuṁ …pe… vatthuṁ nabhāvanāya pahātabbahetuke	paccaya udānam pe sīlam pe jhānam pe cakkhum pe vatthum na bhāvanāya pahātabba hetuke 
PA_patthana_2.13:216.1_2	khandhe ca mohañca assādeti abhinandati, taṁ ārabbha bhāvanāya pahātabbahetuko rāgo	khandhe ca mohañca assādeti abhinandati tam ārabbha bhāvanāya pahātabba hetukaḥ rāgaḥ 
PA_patthana_2.13:216.1_3	uppajjati, uddhaccaṁ …pe… bhāvanāya pahātabbahetukaṁ domanassaṁ uppajjati.	uppajjati uddhaccam pe bhāvanāya pahātabba hetukam domanassam uppajjati 
PA_patthana_2.13:217.1_0	Nabhāvanāya pahātabbahetuko dhammo bhāvanāya pahātabbahetukassa ca nabhāvanāya pahātabbahetukassa	na bhāvanāya pahātabba hetukaḥ dhammaḥ bhāvanāya pahātabba hetukassa ca na bhāvanāya pahātabba hetukassa 
PA_patthana_2.13:217.1_1	ca dhammassa ārammaṇapaccayena paccayo—cakkhuṁ …pe… vatthuṁ nabhāvanāya pahātabbahetuke	ca dhammassa ārammaṇa paccayena paccayo cakkhum pe vatthum na bhāvanāya pahātabba hetuke 
PA_patthana_2.13:217.1_2	khandhe ca mohañca ārabbha uddhaccasahagatā khandhā ca moho ca uppajjanti. (Ghaṭanārammaṇā tīṇipi kātabbā.)	khandhe ca mohañca ārabbha uddhacca sahagatā khandhā ca moho ca uppajjanti ghaṭana ārammaṇā kātabbā 
PA_patthana_2.13:218.0	Adhipatyādi	adhipati ādi 
PA_patthana_2.13:218.1_0	Bhāvanāya pahātabbahetuko dhammo bhāvanāya pahātabbahetukassa dhammassa adhipatipaccayena	bhāvanāya pahātabba hetukaḥ dhammaḥ bhāvanāya pahātabba hetukassa dhammassa adhipati paccayena 
PA_patthana_2.13:218.1_1	paccayo—ārammaṇādhipati, sahajātādhipati. Ārammaṇādhipati—bhāvanāya pahātabbahetukaṁ	paccayaḥ ārammaṇa adhipati sahajāta adhipati ārammaṇa adhipati bhāvanāya pahātabba hetuka 
PA_patthana_2.13:218.1_2	rāgaṁ garuṁ katvā assādeti abhinandati, taṁ garuṁ katvā bhāvanāya pahātabbahetuko	rāgam garum katvā assādeti abhinandati tam garum katvā bhāvanāya pahātabba hetukaḥ 
PA_patthana_2.13:218.1_3	rāgo uppajjati. Sahajātādhipati—bhāvanāya pahātabbahetukādhipati sampayuttakānaṁ	rāgaḥ uppajjati sahajāta adhipati bhāvanāya pahātabba hetuka ādhipati sampayuttakāna 
PA_patthana_2.13:218.1_4	khandhānaṁ adhipatipaccayena paccayo.	khandhānam adhipati paccayena paccayaḥ 
PA_patthana_2.13:219.1_0	Bhāvanāya pahātabbahetuko dhammo nabhāvanāya pahātabbahetukassa dhammassa adhipatipaccayena	bhāvanāya pahātabba hetukaḥ dhammaḥ na bhāvanāya pahātabba hetukassa dhammassa adhipati paccayena 
PA_patthana_2.13:219.1_1	paccayo—ārammaṇādhipati, sahajātādhipati. Ārammaṇādhipati—bhāvanāya pahātabbahetukaṁ	paccayaḥ ārammaṇa adhipati sahajāta adhipati ārammaṇa adhipati bhāvanāya pahātabba hetuka 
PA_patthana_2.13:219.1_2	rāgaṁ garuṁ katvā assādeti abhinandati, taṁ garuṁ katvā nabhāvanāya pahātabbahetuko	rāgam garum katvā assādeti abhinandati tam garum katvā na bhāvanāya pahātabba hetukaḥ 
PA_patthana_2.13:219.1_3	rāgo uppajjati, diṭṭhi uppajjati. Sahajātādhipati—bhāvanāya pahātabbahetukādhipati	rāgaḥ uppajjati diṭṭhi uppajjati sahajāta adhipati bhāvanāya pahātabba hetuka adhipati 
PA_patthana_2.13:219.1_4	cittasamuṭṭhānānaṁ rūpānaṁ adhipatipaccayena paccayo.	citta samuṭṭhānānam rūpānam adhipati paccayena paccayaḥ 
PA_patthana_2.13:220.1_0	Bhāvanāya pahātabbahetuko dhammo bhāvanāya pahātabbahetukassa ca nabhāvanāya pahātabbahetukassa	bhāvanāya pahātabba hetukaḥ dhammaḥ bhāvanāya pahātabba hetukassa ca na bhāvanāya pahātabba hetukassa 
PA_patthana_2.13:220.1_1	ca dhammassa adhipatipaccayena paccayo. Sahajātādhipati—bhāvanāya pahātabbahetukādhipati	ca dhammassa adhipati paccayena paccayaḥ sahajāta adhipati bhāvanāya pahātabba hetuka adhipati 
PA_patthana_2.13:220.1_2	sampayuttakānaṁ khandhānaṁ cittasamuṭṭhānānañca rūpānaṁ adhipatipaccayena paccayo.	sampayuttakānam khandhānam citta samuṭṭhānānañca rūpānam adhipati paccayena paccayaḥ 
PA_patthana_2.13:221.1_0	Nabhāvanāya pahātabbahetuko dhammo nabhāvanāya pahātabbahetukassa dhammassa adhipatipaccayena	na bhāvanāya pahātabba hetukaḥ dhammaḥ na bhāvanāya pahātabba hetukassa dhammassa adhipati paccayena 
PA_patthana_2.13:221.1_1	paccayo—ārammaṇādhipati, sahajātādhipati. Ārammaṇādhipati—dānaṁ …pe… sīlaṁ …pe… uposathakammaṁ	paccayaḥ ārammaṇa adhipati sahajāta adhipati ārammaṇa adhipati dānam pe sīlam pe uposatha kamma 
PA_patthana_2.13:221.1_2	katvā taṁ garuṁ katvā paccavekkhati assādeti abhinandati, taṁ garuṁ katvā nabhāvanāya	katvā tam garum katvā paccavekkhati assādeti abhinandati tam garum katvā na bhāvanāya 
PA_patthana_2.13:221.1_3	pahātabbahetuko rāgo uppajjati, diṭṭhi uppajjati, pubbe …pe… jhānā …pe… ariyā maggā	pahātabba hetukaḥ rāgaḥ uppajjati diṭṭhi uppajjati pubbe pe jhānā pe ariyāḥ maggāḥ 
PA_patthana_2.13:221.1_4	vuṭṭhahitvā …pe… phalassa adhipatipaccayena paccayo; cakkhuṁ …pe… vatthuṁ nabhāvanāya	vuṭṭhahitvā pe phalassa adhipati paccayena paccayaḥ cakkhum pe vatthum na bhāvanāya 
PA_patthana_2.13:221.1_5	pahātabbahetuke khandhe garuṁ katvā assādeti abhinandati, taṁ garuṁ katvā nabhāvanāya	pahātabba hetuke khandhe garum katvā assādeti abhinandati tam garum katvā na bhāvanāya 
PA_patthana_2.13:221.1_6	pahātabbahetuko rāgo uppajjati, diṭṭhi uppajjati. Sahajātādhipati— nabhāvanāya pahātabbahetukādhipati	pahātabba hetukaḥ rāgaḥ uppajjati diṭṭhi uppajjati sahajāta adhipati na bhāvanāya pahātabba hetuka ādhipati 
PA_patthana_2.13:221.1_7	sampayuttakānaṁ khandhānaṁ cittasamuṭṭhānānañca rūpānaṁ adhipatipaccayena paccayo.	sampayuttakānam khandhānam citta samuṭṭhānānañca rūpānam adhipati paccayena paccayaḥ 
PA_patthana_2.13:222.1_0	Nabhāvanāya pahātabbahetuko dhammo bhāvanāya pahātabbahetukassa dhammassa adhipatipaccayena	na bhāvanāya pahātabba hetukaḥ dhammaḥ bhāvanāya pahātabba hetukassa dhammassa adhipati paccayena 
PA_patthana_2.13:222.1_1	paccayo— ārammaṇādhipati—dānaṁ …pe… jhānaṁ …pe… cakkhuṁ …pe… vatthuṁ nabhāvanāya	paccayaḥ ārammaṇa adhipati dānam pe jhānam pe cakkhum pe vatthum na bhāvanāya 
PA_patthana_2.13:222.1_2	pahātabbahetuke khandhe garuṁ katvā assādeti abhinandati, taṁ garuṁ katvā bhāvanāya	pahātabba hetuke khandhe garum katvā assādeti abhinandati tam garum katvā bhāvanāya 
PA_patthana_2.13:222.1_3	pahātabbahetuko rāgo uppajjati.	pahātabba hetukaḥ rāgaḥ uppajjati 
PA_patthana_2.13:223.1_0	(Anantarapaccaye nabhāvanāya pahātabbahetukakāraṇā vicikicchāsahagato moho na kātabbo,	anantara paccaye na bhāvanāya pahātabba hetuka kāraṇā vicikicchā sahagataḥ mohaḥ na kātabbaḥ 
PA_patthana_2.13:223.1_1	uddhaccasahagato moho kātabbo.) Samanantarapaccayena paccayo … sahajātapaccayena	uddhacca sahagataḥ mohaḥ kātabbaḥ samanantara paccayena paccayaḥ sahajāta paccayena 
PA_patthana_2.13:223.1_2	paccayo … nava … aññamaññapaccayena paccayo … cha … nissayapaccayena paccayo … nava.	paccayaḥ nava aññamañña paccayena paccayaḥ cha nissaya paccayena paccayaḥ nava 
PA_patthana_2.13:224.0	Upanissaya	upanissaya 
PA_patthana_2.13:224.1_0	Bhāvanāya pahātabbahetuko dhammo bhāvanāya pahātabbahetukassa dhammassa upanissayapaccayena	bhāvanāya pahātabba hetukaḥ dhammaḥ bhāvanāya pahātabba hetukassa dhammassa upanissaya paccayena 
PA_patthana_2.13:224.1_1	paccayo—ārammaṇūpanissayo, anantarūpanissayo, pakatūpanissayo …pe…. Pakatūpanissayo—bhāvanāya	paccayaḥ ārammaṇa upanissayaḥ anantara upanissayaḥ pakata upanissayaḥ pe pakata upanissayaḥ bhāvanāya 
PA_patthana_2.13:224.1_2	pahātabbahetukā khandhā bhāvanāya pahātabbahetukānaṁ khandhānaṁ upanissayapaccayena	pahātabba hetukāḥ khandhāḥ bhāvanāya pahātabba hetukānam khandhānam upanissaya paccayena 
PA_patthana_2.13:224.1_3	paccayo. (Mūlaṁ kātabbaṁ.) Bhāvanāya pahātabbahetukā khandhā nabhāvanāya pahātabbahetukānaṁ	paccayaḥ mūlam kātabba bhāvanāya pahātabba hetukāḥ khandhāḥ na bhāvanāya pahātabba hetukāna 
PA_patthana_2.13:224.1_4	khandhānaṁ mohassa ca upanissayapaccayena paccayo; sakabhaṇḍe chandarāgo parabhaṇḍe	khandhānam mohassa ca upanissaya paccayena paccayaḥ saka bhaṇḍe chanda rāgaḥ para bhaṇḍe 
PA_patthana_2.13:224.1_5	chandarāgassa upanissayapaccayena paccayo; sakapariggahe chandarāgo parapariggahe	chanda rāgassa upanissaya paccayena paccayaḥ saka pariggahe chanda rāgaḥ para pariggahe 
PA_patthana_2.13:224.1_6	chandarāgassa upanissayapaccayena paccayo. (Mūlaṁ kātabbaṁ.) Bhāvanāya pahātabbahetukā	chanda rāgassa upanissaya paccayena paccayaḥ mūlam kātabba bhāvanāya pahātabba hetukā 
PA_patthana_2.13:224.1_7	khandhā uddhaccasahagatānaṁ khandhānaṁ mohassa ca upanissayapaccayena paccayo.	khandhāḥ uddhacca sahagatānam khandhānam mohassa ca upanissaya paccayena paccayaḥ 
PA_patthana_2.13:225.1_0	Nabhāvanāya pahātabbahetuko dhammo nabhāvanāya pahātabbahetukassa dhammassa upanissayapaccayena	na bhāvanāya pahātabba hetukaḥ dhammaḥ na bhāvanāya pahātabba hetukassa dhammassa upanissaya paccayena 
PA_patthana_2.13:225.1_1	paccayo—ārammaṇūpanissayo, anantarūpanissayo, pakatūpanissayo …pe…. Pakatūpanissayo—saddhaṁ	paccayaḥ ārammaṇa upanissayaḥ anantara upanissayaḥ pakata upanissayaḥ 
PA_patthana_2.13:225.1_2	upanissāya dānaṁ deti …pe… samāpattiṁ uppādeti, diṭṭhiṁ gaṇhāti; sīlaṁ …pe… paññaṁ	upanissāya dānam deti pe samāpattim uppādeti diṭṭhim gaṇhāti sīlam pe pañña 
PA_patthana_2.13:225.1_3	… nabhāvanāya pahātabbahetukaṁ rāgaṁ … dosaṁ … mohaṁ … diṭṭhiṁ … patthanaṁ … kāyikaṁ	na bhāvanāya pahātabba hetukam rāgam dosam moham diṭṭhim patthanam kāyika 
PA_patthana_2.13:225.1_4	sukhaṁ … kāyikaṁ dukkhaṁ …pe… senāsanaṁ upanissāya dānaṁ deti …pe… pāṇaṁ hanati …pe…	sukham kāyikam dukkham pe senāsanam upanissāya dānam deti pe pāṇam hanati pe 
PA_patthana_2.13:225.1_5	saṅghaṁ bhindati; saddhā …pe… senāsanaṁ saddhāya …pe… paññāya … nabhāvanāya pahātabbahetukassa	saṅgham bhindati saddhā pe senāsanam saddhāya pe paññāya na bhāvanāya pahātabba hetukassa 
PA_patthana_2.13:225.1_6	rāgassa … dosassa … mohassa … diṭṭhiyā … patthanāya … kāyikassa sukhassa …pe… phalasamāpattiyā	rāgassa dosassa mohassa diṭṭhiyāḥ patthanāya kāyikassa sukhassa pe phala samāpattiyā 
PA_patthana_2.13:225.1_7	upanissayapaccayena paccayo.	upanissaya paccayena paccayaḥ 
PA_patthana_2.13:226.1_0	Nabhāvanāya pahātabbahetuko dhammo bhāvanāya pahātabbahetukassa dhammassa upanissayapaccayena	na bhāvanāya pahātabba hetukaḥ dhammaḥ bhāvanāya pahātabba hetukassa dhammassa upanissaya paccayena 
PA_patthana_2.13:226.1_1	paccayo—ārammaṇūpanissayo, anantarūpanissayo, pakatūpanissayo …pe…. Pakatūpanissayo—saddhaṁ	paccayaḥ ārammaṇa upanissayaḥ anantara upanissayaḥ pakata upanissayaḥ 
PA_patthana_2.13:226.1_2	upanissāya mānaṁ jappeti …pe… saddhā …pe… senāsanaṁ bhāvanāya pahātabbahetukassa	upanissāya mānam jappeti pe saddhā pe senāsanam bhāvanāya pahātabba hetukassa 
PA_patthana_2.13:226.1_3	rāgassa … dosassa … mohassa … mānassa … patthanāya upanissayapaccayena paccayo.	rāgassa dosassa mohassa mānassa patthanāya upanissaya paccayena paccayaḥ 
PA_patthana_2.13:227.1_0	Nabhāvanāya pahātabbahetuko dhammo bhāvanāya pahātabbahetukassa ca nabhāvanāya pahātabbahetukassa	na bhāvanāya pahātabba hetukaḥ dhammaḥ bhāvanāya pahātabba hetukassa ca na bhāvanāya pahātabba hetukassa 
PA_patthana_2.13:227.1_1	ca dhammassa upanissayapaccayena paccayo— ārammaṇūpanissayo, anantarūpanissayo, pakatūpanissayo	ca dhammassa upanissaya paccayena paccayaḥ ārammaṇa upanissayaḥ anantara upanissayaḥ pakata upanissayaḥ 
PA_patthana_2.13:227.1_2	…pe…. Pakatūpanissayo—saddhā …pe… paññā … kāyikaṁ sukhaṁ …pe… senāsanaṁ uddhaccasahagatānaṁ	pe pakata upanissaya usaddhā pe paññā kāyikam sukham pe senāsanam uddhacca sahagatāna 
PA_patthana_2.13:227.1_3	khandhānaṁ mohassa ca upanissayapaccayena paccayo. (Ghaṭanūpanissayāpi tīṇipi kātabbā.)	khandhānam mohassa ca upanissaya paccayena paccayaḥ ghaṭana upanissayā api kātabbā 
PA_patthana_2.13:228.0	Purejātādi	purejāta ādi 
PA_patthana_2.13:228.1_0	Nabhāvanāya pahātabbahetuko dhammo nabhāvanāya pahātabbahetukassa dhammassa purejātapaccayena	na bhāvanāya pahātabba hetukaḥ dhammaḥ na bhāvanāya pahātabba hetukassa dhammassa purejāta paccayena 
PA_patthana_2.13:228.1_1	paccayo … tīṇi … pacchājātapaccayena paccayo … tīṇi … āsevanapaccayena paccayo …	paccayaḥ tīṇi pacchājāta paccayena paccayaḥ tīṇi āsevana paccayena paccayaḥ 
PA_patthana_2.13:228.1_2	nava … kammapaccayena paccayo (nabhāvanāya pahātabbabhājanakāraṇe nānākkhaṇikā labbhati)	nava kamma paccayena paccayaḥ na bhāvanāya pahātabba bhājana kāraṇe nānā kkhaṇikā labbhati 
PA_patthana_2.13:228.1_3	…pe… novigatapaccayena paccayo.	pe no vigata paccayena paccayaḥ 
PA_patthana_2.13:229.1	Nadassanena pahātabbo dhammo nadassanena pahātabbassa dhammassa …pe…. (Parantena sakabhaṇḍachandarāgopi kātabbo.)	na dassanena pahātabbaḥ dhammaḥ na dassanena pahātabbassa dhammassa pe para antena saka bhaṇḍa chanda rāgaḥ api kātabbaḥ 
PA_patthana_2.13:230.1	Bhāvanāya pahātabbo dhammo nabhāvanāya pahātabbassa dhammassa …pe…. (Parantena “sakabhaṇḍachandarāgo”ti kātabbaṁ.)	bhāvanāya pahātabbaḥ dhammaḥ na bhāvanāya pahātabbassa dhammassa pe parantena saka bhaṇḍa chanda rāgaḥ ti kātabba 
PA_patthana_2.13:231.1	Bhāvanāyapahātabbahetukadukaṁ niṭṭhitaṁ.	bhāvanāya apahātabba hetuka dukam niṭṭhita 
PA_patthana_2.13:232.0.1	2.13.5. Savitakkaduka	sa vitakka duka 
PA_patthana_2.13:232.0.2	2.13.5.1. Paṭiccavāra	paṭiccavāra 
PA_patthana_2.13:232.0.3	2.13.5.1.1. Paccayānuloma	paccaya anuloma 
PA_patthana_2.13:232.0.4	Vibhaṅgavāra	vibhaṅgavāra 
PA_patthana_2.13:232.0.5	Hetu	hetu 
PA_patthana_2.13:232.1_0	Savitakkaṁ dhammaṁ paṭicca savitakko dhammo uppajjati hetupaccayā—savitakkaṁ ekaṁ	sa vitakkam dhammam paṭicca sa vitakkaḥ dhammaḥ uppajjati hetu paccayā a sa vitakkam eka 
PA_patthana_2.13:232.1_1	khandhaṁ paṭicca tayo khandhā …pe… dve khandhe …pe… paṭisandhikkhaṇe …pe…. Savitakkaṁ	khandham paṭicca tayaḥ khandhāḥ pe dve khandhe pe paṭisandhi khaṇe pe sa vitakka 
PA_patthana_2.13:232.1_2	dhammaṁ paṭicca avitakko dhammo uppajjati hetupaccayā—savitakke khandhe paṭicca vitakko	dhammam paṭicca avitakkaḥ dhammaḥ uppajjati hetu paccayā sa vitakke khandhe paṭicca vitakkaḥ 
PA_patthana_2.13:232.1_3	cittasamuṭṭhānañca rūpaṁ; paṭisandhikkhaṇe …pe…. Savitakkaṁ dhammaṁ paṭicca savitakko	citta samuṭṭhānam ca rūpa paṭisandhi khaṇe pe sa vitakkam dhammam paṭicca sa vitakkaḥ 
PA_patthana_2.13:232.1_4	ca avitakko ca dhammā uppajjanti hetupaccayā—savitakkaṁ ekaṁ khandhaṁ paṭicca tayo	ca avitakko ca dhammā uppajjanti hetu paccayā sa vitakkam ekam khandham paṭicca tayo 
PA_patthana_2.13:232.1_5	khandhā vitakko ca cittasamuṭṭhānañca rūpaṁ …pe… dve khandhe …pe… paṭisandhikkhaṇe …pe….	khandhāḥ vitakko ca citta samuṭṭhānam ca rūpam pe dve khandhe pe paṭisandhi khaṇe pe 
PA_patthana_2.13:233.1_0	Avitakkaṁ dhammaṁ paṭicca avitakko dhammo uppajjati hetupaccayā—avitakkaṁ ekaṁ khandhaṁ	avitakkam dhammam paṭicca avitakkaḥ dhammaḥ uppajjati hetu paccayā avitakkam ekam khandha 
PA_patthana_2.13:233.1_1	paṭicca tayo khandhā cittasamuṭṭhānañca rūpaṁ …pe… dve khandhe …pe… vitakkaṁ paṭicca	paṭicca tayaḥ khandhāḥ citta samuṭṭhānañca rūpam pe dve khandhe pe vitakkam paṭicca 
PA_patthana_2.13:233.1_2	cittasamuṭṭhānaṁ rūpaṁ; paṭisandhikkhaṇe avitakkaṁ ekaṁ khandhaṁ paṭicca tayo khandhā	citta samuṭṭhānam rūpa paṭisandhi kkhaṇe avitakkam ekam khandham paṭicca tayaḥ khandhāḥ 
PA_patthana_2.13:233.1_3	kaṭattā ca rūpaṁ …pe… dve khandhe …pe… vitakkaṁ paṭicca kaṭattārūpaṁ, khandhe paṭicca	kaṭattā ca rūpam pe dve khandhe pe vitakkam paṭicca kaṭattā rūpa khandhe paṭicca 
PA_patthana_2.13:233.1_4	vatthu, vatthuṁ paṭicca khandhā, vitakkaṁ paṭicca vatthu, vatthuṁ paṭicca vitakko,	vatthu vatthum paṭicca khandhāḥ vitakkam paṭicca vatthu vatthum paṭicca vitakkaḥ 
PA_patthana_2.13:233.1_5	ekaṁ mahābhūtaṁ …pe….	ekam mahābhūtam pe 
PA_patthana_2.13:234.1_0	Avitakkaṁ dhammaṁ paṭicca savitakko dhammo uppajjati hetupaccayā—vitakkaṁ paṭicca	avitakkam dhammam paṭicca sa vitakkaḥ dhammaḥ uppajjati hetu paccayā avitakkam paṭicca 
PA_patthana_2.13:234.1_1	sampayuttakā khandhā; paṭisandhikkhaṇe vitakkaṁ paṭicca sampayuttakā khandhā, paṭisandhikkhaṇe	sampayuttakāḥ khandhāḥ paṭisandhi khaṇe vitakkam paṭicca sampayuttakāḥ khandhāḥ paṭisandhi khaṇe 
PA_patthana_2.13:234.1_2	vatthuṁ paṭicca savitakkā khandhā.	vatthum paṭicca sa vitakkāḥ khandhāḥ 
PA_patthana_2.13:235.1_0	Avitakkaṁ dhammaṁ paṭicca savitakko ca avitakko ca dhammā uppajjanti hetupaccayā—vitakkaṁ	avitakkam dhammam paṭicca sa vitakko ca avitakko ca dhammā uppajjanti hetu paccayā avitakka 
PA_patthana_2.13:235.1_1	paṭicca sampayuttakā khandhā cittasamuṭṭhānañca rūpaṁ, vitakkaṁ paṭicca savitakkā	paṭicca sampayuttakā khandhā citta samuṭṭhānam ca rūpa vitakkam paṭicca sa vitakkā 
PA_patthana_2.13:235.1_2	khandhā, mahābhūte paṭicca cittasamuṭṭhānaṁ rūpaṁ; paṭisandhikkhaṇe vitakkaṁ paṭicca	khandhāḥ mahābhūte paṭicca citta samuṭṭhānam rūpa paṭisandhi khaṇe vitakkam paṭicca 
PA_patthana_2.13:235.1_3	sampayuttakā khandhā kaṭattā ca rūpaṁ, paṭisandhikkhaṇe vitakkaṁ paṭicca savitakkā	sampayuttakā khandhā kaṭattā ca rūpa paṭisandhi kkhaṇe vitakkam paṭicca sa vitakkā 
PA_patthana_2.13:235.1_4	khandhā, mahābhūte paṭicca kaṭattārūpaṁ, paṭisandhikkhaṇe vatthuṁ paṭicca savitakkā	khandhāḥ mahābhūte paṭicca kaṭattā rūpa paṭisandhi kkhaṇe vatthum paṭicca sa vitakkā 
PA_patthana_2.13:235.1_5	khandhā, mahābhūte paṭicca kaṭattārūpaṁ, paṭisandhikkhaṇe vatthuṁ paṭicca vitakko	khandhāḥ mahābhūte paṭicca kaṭattā rūpa paṭisandhi kkhaṇe vatthum paṭicca vitakko 
PA_patthana_2.13:235.1_6	sampayuttakā ca khandhā.	sampayuttakā ca khandhāḥ 
PA_patthana_2.13:236.1_0	Savitakkañca avitakkañca dhammaṁ paṭicca savitakko dhammo uppajjati hetupaccayā—savitakkaṁ	sa vitakkam ca avitakkam ca dhammam paṭicca sa vitakkaḥ dhammaḥ uppajjati hetu paccayā a sa vitakka 
PA_patthana_2.13:236.1_1	ekaṁ khandhañca vitakkañca paṭicca tayo khandhā …pe… dve khandhe …pe… paṭisandhikkhaṇe	ekam khandhañca vitakkañca paṭicca tayaḥ khandhāḥ pe dve khandhe pe paṭisandhi kkhaṇe 
PA_patthana_2.13:236.1_2	savitakkaṁ ekaṁ khandhañca vitakkañca paṭicca tayo khandhā …pe… dve khandhe …pe…	sa vitakkam ekam khandhañca vitakkañca paṭicca tayaḥ khandhāḥ pe dve khandhe pe 
PA_patthana_2.13:236.1_3	paṭisandhikkhaṇe savitakkaṁ ekaṁ khandhañca vatthuñca paṭicca tayo khandhā …pe… dve khandhe …pe….	paṭisandhi khaṇe sa vitakkam ekam khandhañca vatthuñca paṭicca tayaḥ khandhāḥ pe dve khandhe pe 
PA_patthana_2.13:237.1_0	Savitakkañca avitakkañca dhammaṁ paṭicca avitakko dhammo uppajjati hetupaccayā—savitakke	sa vitakkam ca avitakkañca dhammam paṭicca avitakkaḥ dhammaḥ uppajjati hetu paccayā a sa vitakke 
PA_patthana_2.13:237.1_1	khandhe ca vitakkañca mahābhūte ca paṭicca cittasamuṭṭhānaṁ rūpaṁ; paṭisandhikkhaṇe	khandhe ca vitakkam ca mahābhūte ca paṭicca citta samuṭṭhānam rūpa paṭisandhi kkhaṇe 
PA_patthana_2.13:237.1_2	savitakke khandhe ca vitakkañca mahābhūte ca paṭicca kaṭattārūpaṁ, paṭisandhikkhaṇe	sa vitakke khandhe ca vitakkam ca mahābhūte ca paṭicca kaṭattā rūpa paṭisandhi kkhaṇe 
PA_patthana_2.13:237.1_3	savitakke khandhe ca vatthuñca paṭicca vitakko.	sa vitakke khandhe ca vatthuñca paṭicca vitakko 
PA_patthana_2.13:238.1_0	Savitakkañca avitakkañca dhammaṁ paṭicca savitakko ca avitakko ca dhammā uppajjanti	sa vitakkam ca avitakkam ca dhammam paṭicca sa vitakkaḥ ca avitakkaḥ ca dhammāḥ uppajjanti 
PA_patthana_2.13:238.1_1	hetupaccayā—savitakkaṁ ekaṁ khandhañca vitakkañca paṭicca tayo khandhā cittasamuṭṭhānañca	hetu paccayā sa vitakkam ekam khandhañca vitakkañca paṭicca tayo khandhāḥ citta samuṭṭhānañca 
PA_patthana_2.13:238.1_2	rūpaṁ …pe… dve khandhe …pe… savitakkaṁ ekaṁ khandhañca vitakkañca paṭicca tayo khandhā	rūpam pe dve khandhe pe sa vitakkam ekam khandhañca vitakkañca paṭicca tayaḥ khandhāḥ 
PA_patthana_2.13:238.1_3	…pe… dve khandhe …pe… savitakke khandhe ca vitakkañca mahābhūte ca paṭicca cittasamuṭṭhānaṁ	pe dve khandhe pe sa vitakke khandhe ca vitakkam ca mahābhūte ca paṭicca citta samuṭṭhāna 
PA_patthana_2.13:238.1_4	rūpaṁ; paṭisandhikkhaṇe savitakkaṁ ekaṁ khandhañca vitakkañca paṭicca tayo khandhā	rūpa paṭisandhi kkhaṇe sa vitakkam ekam khandhañca vitakkañca paṭicca tayo khandhāḥ 
PA_patthana_2.13:238.1_5	kaṭattā ca rūpaṁ …pe… dve khandhe …pe… paṭisandhikkhaṇe savitakkaṁ ekaṁ khandhañca	kaṭattā ca rūpam pe dve khandhe pe paṭisandhi kkhaṇe sa vitakkam ekam khandhañca 
PA_patthana_2.13:238.1_6	vitakkañca paṭicca tayo khandhā …pe… dve khandhe …pe… savitakke khandhe ca vitakkañca	vitakkam ca paṭicca tayo khandhāḥ pe dve khandhe pe sa vitakke khandhe ca vitakkam ca 
