segmentnr	original	analyzed
PA_patthana_9.8:0.1	Paṭṭhānapakaraṇa	paṭṭhāna pakaraṇa 
PA_patthana_9.8:0.2	Dhammapaccanīya (2), Dukatikapaṭṭhānapāḷi (3)	dhamma paccanīya 
PA_patthana_9.8:0.3	9.8. Nahetusahetukaduka, Kusalattika	na hetu sa hetuka duka kusala ttika 
PA_patthana_9.8:1.1	Nahetuṁ nasahetukaṁ nakusalaṁ dhammaṁ paṭicca nahetu nasahetuko nakusalo dhammo uppajjati hetupaccayā. (Saṅkhittaṁ.)	na hetum na sa hetukam na kusalam dhammam paṭicca na hetu na sa hetukaḥ na kusalaḥ dhammo uppajjati hetu paccayā 
PA_patthana_9.8:2.1	Hetuyā nava, ārammaṇe cattāri, adhipatiyā pañca …pe… aññamaññe cha …pe… purejāte āsevane dve …pe… avigate nava.	hetuyā nava ārammaṇe cattāri adhipatiyā pañca pe aññamaññe cha pe purejāte āsevane dve pe avigate nava 
PA_patthana_9.8:3.1	Nahetuṁ nasahetukaṁ naakusalaṁ dhammaṁ paṭicca nahetu nasahetuko naakusalo dhammo uppajjati hetupaccayā. (Saṅkhittaṁ.)	na hetum na sa hetukam na akusalam dhammam paṭicca na hetu na sa hetukaḥ na akusalaḥ dhammo uppajjati hetu paccayā 
PA_patthana_9.8:4.1	Hetuyā nava, ārammaṇe cattāri, adhipatiyā pañca …pe… aññamaññe cha …pe… purejāte āsevane dve …pe… avigate nava.	hetuyā nava ārammaṇe cattāri adhipatiyā pañca pe aññamaññe cha pe purejāte āsevane dve pe avigate nava 
PA_patthana_9.8:5.1	Nahetuṁ naahetukaṁ naabyākataṁ dhammaṁ paṭicca nahetu naahetuko naabyākato dhammo uppajjati hetupaccayā.	na hetum na ahetukam na abyākatam dhammam paṭicca na hetu na ahetukaḥ na abyākataḥ dhammaḥ uppajjati hetu paccayā 
