segmentnr	original	analyzed
PA_patthana_2.13:381.1	(Paccanīyavibhaṅgagaṇanāpi savitakkadukasadisā. Yadipi na sameti imaṁ anulomaṁ paccavekkhitvā gaṇetabbaṁ, itare dve gaṇanā gaṇetabbā.)	paccanīya vibhaṅga gaṇanā api sa vitakka duka sadisā yadi api na sameti imam anulomam paccavekkhitvā gaṇetabbaḥ itare dve gaṇanā gaṇetabbā 
PA_patthana_2.13:382.1	Sappītikadukaṁ niṭṭhitaṁ.	sappītika dukam 
PA_patthana_2.13:383.0.1	2.13.8. Pītisahagataduka	pīti sahagata duka 
PA_patthana_2.13:383.0.2	2.13.8.1–7. Paṭiccādivāra	    
PA_patthana_2.13:383.1_0	Pītisahagataṁ dhammaṁ paṭicca pītisahagato dhammo uppajjati hetupaccayā— pītisahagataṁ	pīti sahagatam dhammam paṭicca pīti sahagataḥ dhammo uppajjati hetu paccayā pīti sahagata 
PA_patthana_2.13:383.1_1	ekaṁ khandhaṁ paṭicca tayo khandhā …pe… dve khandhe …pe… (evaṁ pītisahagatadukaṁ	ekam khandham paṭicca tayaḥ khandhāḥ pe dve khandhe pe evam pīti sahagata duka 
PA_patthana_2.13:383.1_2	vitthāretabbaṁ, sappītikadukasadisaṁ ninnānākaraṇaṁ, āmasanaṁ ninnānaṁ.)	vitthāretabba sappītika duka sadisam ninnānākaraṇe āmasanam 
PA_patthana_2.13:384.1	Pītisahagatadukaṁ niṭṭhitaṁ.	pīti sahagata dukam 
PA_patthana_2.13:385.0.1	2.13.9. Sukhasahagataduka	sukha sahagata duka 
PA_patthana_2.13:385.0.2	2.13.9.1–6. Paṭiccādivāra	    
PA_patthana_2.13:385.0.3	2.13.9.1–6.1–4. Paccayānulomādi	paccaya anuloma ādi 
PA_patthana_2.13:385.0.4	Hetu	hetu 
PA_patthana_2.13:385.1_0	Sukhasahagataṁ dhammaṁ paṭicca sukhasahagato dhammo uppajjati hetupaccayā— sukhasahagataṁ	sukha sahagatam dhammam paṭicca sukha sahagataḥ dhammo uppajjati hetu paccayā sukha sahagata 
PA_patthana_2.13:385.1_1	ekaṁ khandhaṁ paṭicca dve khandhā, dve khandhe paṭicca eko khandho; paṭisandhikkhaṇe	ekam khandham paṭicca dve khandhāḥ dve khandhe paṭicca ekaḥ khandho paṭisandhi kkhaṇe 
PA_patthana_2.13:385.1_2	…pe…. Sukhasahagataṁ dhammaṁ paṭicca nasukhasahagato dhammo uppajjati hetupaccayā—sukhasahagate	pe sukha sahagatam dhammam paṭicca na sukha sahagataḥ dhammaḥ uppajjati hetu paccayā sukha sahagate 
PA_patthana_2.13:385.1_3	khandhe paṭicca sukhaṁ cittasamuṭṭhānañca rūpaṁ. (Evaṁ sukhasahagatadukaṁ vitthāretabbaṁ,	khandhe paṭicca sukham citta samuṭṭhānam ca rūpe evam sukha sahagata dukam 
PA_patthana_2.13:385.1_4	yathā sappītikadukassa anulomapaṭiccavāro.)	yathā sappītika dukassa anuloma paṭiccavāro 
PA_patthana_2.13:386.1	Hetuyā nava, ārammaṇe nava …pe… purejāte cha, āsevane cha, kamme nava …pe… avigate nava.	hetuyā nava ārammaṇe nava pe purejāte cha āsevane cha kamme nava pe avigate nava 
PA_patthana_2.13:387.1	Anulomaṁ.	anuloma 
PA_patthana_2.13:388.1_0	Sukhasahagataṁ dhammaṁ paṭicca sukhasahagato dhammo uppajjati nahetupaccayā— ahetukaṁ	sukha sahagatam dhammam paṭicca sukha sahagataḥ dhammaḥ uppajjati na hetu paccayā ahetuka 
PA_patthana_2.13:388.1_1	sukhasahagataṁ ekaṁ khandhaṁ paṭicca dve khandhā, dve khandhe …pe… (mūlaṁ kātabbaṁ.)	sukha sahagatam ekam khandham paṭicca dve khandhāḥ dve khandhe pe mūlam kātabba 
PA_patthana_2.13:388.1_2	Ahetuke sukhasahagate khandhe paṭicca sukhañca cittasamuṭṭhānañca rūpaṁ. Sukhasahagataṁ	ahetuke sukha sahagate khandhe paṭicca sukham ca citta samuṭṭhānañca rūpa sukha sahagata 
PA_patthana_2.13:388.1_3	dhammaṁ paṭicca sukhasahagato ca nasukhasahagato ca dhammā uppajjanti nahetupaccayā—ahetukaṁ	dhammam paṭicca sukha sahagataḥ ca na sukha sahagataḥ ca dhammā uppajjanti na hetu paccayā ahetuka 
PA_patthana_2.13:388.1_4	sukhasahagataṁ ekaṁ khandhaṁ paṭicca dve khandhā sukhañca cittasamuṭṭhānañca rūpaṁ, dve khandhe …pe….	sukha sahagatam ekam khandham paṭicca dve khandhā sukham ca citta samuṭṭhānañca rūpa dve khandhe pe
PA_patthana_2.13:389.1_0	Nasukhasahagataṁ dhammaṁ paṭicca nasukhasahagato dhammo uppajjati nahetupaccayā—ahetukaṁ	na sukha sahagatam dhammam paṭicca na sukha sahagataḥ dhammaḥ uppajjati na hetu paccayā ahetuka 
PA_patthana_2.13:389.1_1	nasukhasahagataṁ ekaṁ khandhaṁ paṭicca tayo khandhā cittasamuṭṭhānañca rūpaṁ …pe…	na sukha sahagatam ekam khandham paṭicca tayo khandhāḥ citta samuṭṭhānam ca rūpam pe 
PA_patthana_2.13:389.1_2	dve khandhe …pe… ahetukaṁ sukhaṁ paṭicca cittasamuṭṭhānaṁ rūpaṁ; ahetukapaṭisandhikkhaṇe	dve khandhe pe ahetukam sukham paṭicca citta samuṭṭhānam rūpa ahetuka paṭisandhi kkhaṇe 
PA_patthana_2.13:389.1_3	nasukhasahagataṁ ekaṁ khandhaṁ paṭicca tayo khandhā kaṭattā ca rūpaṁ …pe… dve khandhe	na sukha sahagatam ekam khandham paṭicca tayo khandhā kaṭattā ca rūpam pe dve khandhe 
PA_patthana_2.13:389.1_4	…pe… khandhe paṭicca vatthu, vatthuṁ paṭicca khandhā, ekaṁ mahābhūtaṁ …pe…. (Yāva	pe khandhe paṭicca vatthu vatthum paṭicca khandhāḥ ekam mahābhūtam pe yāva 
PA_patthana_2.13:389.1_5	asaññasattā) Vicikicchāsahagate uddhaccasahagate khandhe paṭicca vicikicchāsahagato	asaññasattā vicikicchā sahagate uddhacca sahagate khandhe paṭicca vicikicchā sahagataḥ 
PA_patthana_2.13:389.1_6	uddhaccasahagato moho. (Yathā sappītike nahetupaccayasadisaṁ, ninnānaṁ sabbatthameva nava pañhā.)	uddhacca sahagataḥ mohaḥ yathā sappītike na hetu paccaya sadisa ninnānam sabbattham eva nava pañhā 
PA_patthana_2.13:390.1_0	Nahetuyā nava, naārammaṇe tīṇi …pe… naupanissaye tīṇi, napurejāte nava, napacchājāte	na hetuyā nava na ārammaṇe tīṇi pe na upanissaye tīṇi na purejāte nava na pacchājāte 
PA_patthana_2.13:390.1_1	nava, naāsevane nava, nakamme cattāri, navipāke nava, naāhāre ekaṁ, naindriye ekaṁ,	nava na āsevane nava na kamme cattāri na vipāke nava na āhāre eka na aindriye eka 
PA_patthana_2.13:390.1_2	najhāne cha, namagge nava, nasampayutte tīṇi, navippayutte cha, nonatthiyā tīṇi, novigate tīṇi.	na jhāne cha na magge nava na sampayutte tīṇi na vippayutte cha no natthiyā tīṇi no vigate tīṇi 
PA_patthana_2.13:391.1	Paccanīyaṁ.	paccanīya 
PA_patthana_2.13:392.1_0	(Evaṁ itare dve gaṇanāpi sahajātavāropi paṭiccavārasadisā. Paccayavāre pavattipi	evam itare dve gaṇanā api sahajāta vāraḥ api paṭicca vāra sadisā paccaya vāre pavatti pi 
PA_patthana_2.13:392.1_1	paṭisandhipi vitthāretabbā, yathā sappītikadukapaccayavārapaccanīyepi pavatte vatthu	paṭisandhi pi vitthāretabbā yathā sappītika duka paccaya vāra paccanīye pi pavatte vatthu 
PA_patthana_2.13:392.1_2	ca vitthāretabbaṁ, yathā sappītikaduke ekoyeva moho, evaṁ itare dve gaṇanāpi nissayavāropi	ca vitthāretabba yathā sappītika duke ekaḥ yā iva mohaḥ evam itare dve gaṇanā api nissaya vāropi 
PA_patthana_2.13:392.1_3	saṁsaṭṭhavāropi sampayuttavāropi yathā sappītikadukaṁ, evaṁ kātabbaṁ.)	sa saṭṭha vāro api sampayutta vāro api yathā sappītika duke evam kātabba 
PA_patthana_2.13:393.0.1	2.13.9.7. Pañhāvāra	pañhāvāra 
PA_patthana_2.13:393.0.2	2.13.9.7.1–4. Paccayānulomādi	paccaya anuloma ādi 
PA_patthana_2.13:393.0.3	Vibhaṅgavāra	vibhaṅgavāra 
PA_patthana_2.13:393.0.4	Hetu	hetu 
PA_patthana_2.13:393.1	Sukhasahagato dhammo sukhasahagatassa dhammassa hetupaccayena paccayo … cattāri. (Ārammaṇepi adhipatiyāpi sappītikadukasadisā, sukhanti nānākaraṇaṁ.)	sukha sahagataḥ dhammaḥ sukha sahagatassa dhammassa hetu paccayena paccayaḥ cattāri ārammaṇe pi adhipatiyā api sappītika duka sadisā sukhanti nānākaraṇa 
PA_patthana_2.13:394.0	Anantarādi	anantara ādi 
PA_patthana_2.13:394.1_0	Sukhasahagato dhammo sukhasahagatassa dhammassa anantarapaccayena paccayo— purimā	sukha sahagataḥ dhammaḥ sukha sahagatassa dhammassa anantara paccayena paccayaḥ purimā 
PA_patthana_2.13:394.1_1	purimā sukhasahagatā khandhā pacchimānaṁ pacchimānaṁ sukhasahagatānaṁ khandhānaṁ	purimā sukha sahagatā khandhā pacchimānam pacchimānam sukha sahagatānam khandhānam 
PA_patthana_2.13:394.1_2	anantarapaccayena paccayo. (Mūlaṁ kātabbaṁ.) Purimā purimā sukhasahagatā khandhā	anantara paccayena paccayaḥ mūlam purimāḥ purimāḥ sukha sahagatāḥ khandhāḥ 
PA_patthana_2.13:394.1_3	pacchimassa pacchimassa sukhassa anantarapaccayena paccayo. Sukhasahagataṁ cuticittaṁ	pacchimassa pacchimassa sukhassa anantara paccayena paccayaḥ sukha sahagatam cuti citta 
PA_patthana_2.13:394.1_4	nasukhasahagatassa upapatticittassa … sukhasahagataṁ bhavaṅgaṁ āvajjanāya … sukhasahagataṁ	na sukha sahagatassa upapatti cittassa sukha sahagatam bhavaṅgam āvajjanāya sukha sahagata 
PA_patthana_2.13:394.1_5	kāyaviññāṇaṁ vipākamanodhātuyā … sukhasahagatā vipākamanoviññāṇadhātu kiriyamanoviññāṇadhātuyā	kāya viññāṇam vipāka manaḥ dhātuyā sukha sahagatā vipāka manaḥ viññāṇa dhātu kiriya manaḥ viññāṇa dhātuyā 
PA_patthana_2.13:394.1_6	… sukhasahagataṁ bhavaṅgaṁ nasukhasahagatassa bhavaṅgassa … sukhasahagataṁ kusalākusalaṁ	sukha sahagatam bhavaṅgam na sukha sahagatassa bhavaṅgassa sukha sahagatam kusala akusala 
PA_patthana_2.13:394.1_7	nasukhasahagatassa vuṭṭhānassa … kiriyaṁ vuṭṭhānassa … phalaṁ vuṭṭhānassa anantarapaccayena	na sukha sahagatassa vuṭṭhānassa kiriyam vuṭṭhānassa phalam vuṭṭhānassa anantara paccayena 
PA_patthana_2.13:394.1_8	paccayo. (Mūlaṁ kātabbaṁ.) Purimā purimā sukhasahagatā khandhā pacchimānaṁ pacchimānaṁ	paccayaḥ mūlam purimā purimā sukha sahagatāḥ khandhāḥ 
PA_patthana_2.13:394.1_9	sukhasahagatānaṁ khandhānaṁ sukhassa ca anantarapaccayena paccayo.	sukha sahagatānam khandhānam sukhassa ca anantara paccayena paccayaḥ 
PA_patthana_2.13:395.1	Nasukhasahagato dhammo nasukhasahagatassa dhammassa anantarapaccayena paccayo— purimā purimā nasukhasahagatā …pe….	na sukha sahagataḥ dhammaḥ na sukha sahagatassa dhammassa anantara paccayena paccayo purimā purimā na sukha sahagatā pe
PA_patthana_2.13:396.1_0	Sukhasahagato ca nasukhasahagato ca dhammā sukhasahagatassa dhammassa anantarapaccayena	sukha sahagataḥ ca na sukha sahagataḥ ca dhammā sukha sahagatassa dhammassa anantara paccayena 
PA_patthana_2.13:396.1_1	paccayo—purimā purimā sukhasahagatā khandhā ca sukhañca pacchimānaṁ pacchimānaṁ sukhasahagatānaṁ	paccayopurimā purimā sukha sahagatā khandhāḥ ca sukham ca pacchimānam pacchimānam sukha sahagatāna 
PA_patthana_2.13:396.1_2	khandhānaṁ anantarapaccayena paccayo. (Mūlaṁ kātabbaṁ.) Purimā purimā sukhasahagatā	khandhānam anantara paccayena paccayaḥ mūlam purimā purimā sukha sahagatā 
PA_patthana_2.13:396.1_3	khandhā ca sukhañca pacchimassa pacchimassa sukhassa anantarapaccayena paccayo; sukhasahagataṁ	khandhā ca sukhañca pacchimassa pacchimassa sukhassa anantara paccayena paccayaḥ sukha sahagata 
PA_patthana_2.13:396.1_4	cuticittañca sukhañca nasukhasahagatassa upapatticittassa … sukhasahagataṁ bhavaṅgañca	cuti cittam ca sukham ca na sukha sahagatassa upapatti cittassa sukha sahagatam bhavaṅgam ca 
PA_patthana_2.13:396.1_5	sukhañca āvajjanāya … sukhasahagataṁ kāyaviññāṇañca sukhañca vipākamanodhātuyā …	sukham ca āvajjanāya sukha sahagatam kāya viññāṇañca sukham ca vipāka manaḥ dhātuyā 
PA_patthana_2.13:396.1_6	sukhasahagatā vipākamanoviññāṇadhātu ca sukhañca kiriyamanoviññāṇadhātuyā … sukhasahagataṁ	sukha sahagatā vipāka manaḥ viññāṇa dhātu ca sukham ca kiriya manaḥ viññāṇa dhātuyā sukha sahagata 
PA_patthana_2.13:396.1_7	bhavaṅgañca sukhañca nasukhasahagatassa bhavaṅgassa … sukhasahagataṁ kusalākusalañca	bhavaṅgam ca sukham ca na sukha sahagatassa bhavaṅgassa sukha sahagatam kusala akusalam ca 
PA_patthana_2.13:396.1_8	sukhañca nasukhasahagatassa vuṭṭhānassa … kiriyaṁ vuṭṭhānassa … phalaṁ vuṭṭhānassa	sukham ca na sukha sahagatassa vuṭṭhānassa kiriyam vuṭṭhānassa phalam vuṭṭhānassa 
PA_patthana_2.13:396.1_9	anantarapaccayena paccayo. (Mūlaṁ kātabbaṁ.) Purimā purimā sukhasahagatā khandhā	anantara paccayena paccayaḥ mūlam purimāḥ purimāḥ sukha sahagatāḥ khandhāḥ 
PA_patthana_2.13:396.1_10	ca sukhañca pacchimānaṁ pacchimānaṁ sukhasahagatānaṁ khandhānaṁ sukhassa ca anantarapaccayena paccayo.	ca sukham ca pacchimānam pacchimānam sukha sahagatānam khandhānam sukhassa ca anantara paccayena paccayaḥ 
PA_patthana_2.13:397.1	Samanantarapaccayena paccayo … sahajātapaccayena paccayo … aññamaññapaccayena paccayo … nissayapaccayena paccayo.	samanantara paccayena paccayaḥ sahajāta paccayena paccayaḥ aññamañña paccayena paccayaḥ nissaya paccayena paccayaḥ 
PA_patthana_2.13:398.0	Upanissaya	upanissaya 
PA_patthana_2.13:398.1	Sukhasahagato dhammo sukhasahagatassa dhammassa upanissayapaccayena paccayo … tīṇi.	sukha sahagataḥ dhammaḥ sukha sahagatassa dhammassa upanissaya paccayena paccayaḥ tīṇi 
PA_patthana_2.13:399.1_0	Nasukhasahagato dhammo nasukhasahagatassa dhammassa upanissayapaccayena paccayo—ārammaṇūpanissayo,	na sukha sahagataḥ dhammaḥ na sukha sahagatassa dhammassa upanissaya paccayena paccayaḥ ārammaṇa upanissayo 
PA_patthana_2.13:399.1_1	anantarūpanissayo, pakatūpanissayo …pe…. Pakatūpanissayo—nasukhasahagataṁ saddhaṁ	anantara upanissayaḥ pakata upanissayaḥ pe pakata upanissayaḥ na sukha sahagatam 
PA_patthana_2.13:399.1_2	upanissāya nasukhasahagatena cittena dānaṁ deti, sīlaṁ …pe… samāpattiṁ uppādeti,	upanissāya na sukha sahagatena cittena dānam deti sīlam pe samāpattim uppādeti 
PA_patthana_2.13:399.1_3	mānaṁ jappeti, diṭṭhiṁ gaṇhāti; nasukhasahagataṁ sīlaṁ …pe… paññaṁ … rāgaṁ …pe… patthanaṁ	mānam jappeti diṭṭhim gaṇhāti na sukha sahagatam sīlam pe paññam rāgam pe patthana 
PA_patthana_2.13:399.1_4	… kāyikaṁ sukhaṁ … kāyikaṁ dukkhaṁ … utuṁ … bhojanaṁ … senāsanaṁ sukhaṁ upanissāya	kāyikam sukham kāyikam dukkham utum bhojanam senāsanam sukham upanissāya 
PA_patthana_2.13:399.1_5	nasukhasahagatena cittena dānaṁ deti …pe… samāpattiṁ uppādeti, pāṇaṁ hanati …pe…	na sukha sahagatena cittena dānam deti pe samāpattim uppādeti pāṇam hanati pe 
PA_patthana_2.13:399.1_6	saṅghaṁ bhindati; nasukhasahagatā saddhā …pe… senāsanaṁ sukhañca nasukhasahagatāya	saṅgham bhindati na sukha sahagatā saddhā pe senāsanam sukham ca na sukha sahagatāya 
PA_patthana_2.13:399.1_7	saddhāya …pe… paññāya … rāgassa … dosassa …pe… patthanāya … kāyikassa sukhassa, kāyikassa	saddhāya pe paññāya rāgassa dosassa pe patthanāya kāyikassa sukhassa kāyikassa 
PA_patthana_2.13:399.1_8	dukkhassa, maggassa, phalasamāpattiyā sukhassa ca upanissayapaccayena paccayo.	dukkhassa maggassa phala samāpattiyā sukhassa ca upanissaya paccayena paccayaḥ 
PA_patthana_2.13:400.1_0	Nasukhasahagato dhammo sukhasahagatassa dhammassa upanissayapaccayena paccayo— ārammaṇūpanissayo,	na sukha sahagataḥ dhammaḥ sukha sahagatassa dhammassa upanissaya paccayena paccayaḥ ārammaṇa upanissayaḥ 
PA_patthana_2.13:400.1_1	anantarūpanissayo, pakatūpanissayo …pe…. Pakatūpanissayo—nasukhasahagataṁ saddhaṁ	anantara upanissayaḥ pakata upanissayaḥ pe pakata upanissayaḥ na sukha sahagatam 
PA_patthana_2.13:400.1_2	upanissāya sukhasahagatena cittena dānaṁ deti …pe… samāpattiṁ uppādeti, mānaṁ jappeti,	upanissāya sukha sahagatena cittena dānam deti pe samāpattim uppādeti mānam jappeti 
PA_patthana_2.13:400.1_3	diṭṭhiṁ gaṇhāti; nasukhasahagataṁ sīlaṁ …pe… paññaṁ … rāgaṁ …pe… patthanaṁ … kāyikaṁ	diṭṭhim gaṇhāti na sukha sahagatam sīlam pe paññam rāgam pe patthanam kāyika 
PA_patthana_2.13:400.1_4	sukhaṁ … kāyikaṁ dukkhaṁ … utuṁ … bhojanaṁ … senāsanaṁ sukhaṁ upanissāya sukhasahagatena	sukham kāyikam dukkham utum bhojanam senāsanam sukham upanissāya sukha sahagatena 
PA_patthana_2.13:400.1_5	cittena dānaṁ deti …pe… samāpattiṁ uppādeti; sukhasahagatena cittena adinnaṁ ādiyati;	cittena dānam deti pe samāpattim uppādeti sukha sahagatena cittena adinnam ādiyati 
PA_patthana_2.13:400.1_6	musā …pe… pisuṇaṁ …pe… samphaṁ …pe… sandhiṁ …pe… nillopaṁ …pe… ekāgārikaṁ …pe… paripanthe	musā pe pisuṇam pe sampham pe sandhim pe nillopam pe ekāgārikam pe paripanthe 
PA_patthana_2.13:400.1_7	…pe… paradāraṁ …pe… gāmaghātaṁ …pe… nigamaghātaṁ karoti; nasukhasahagatā saddhā …pe…	pe paradāram pe gāma ghātam pe nigama ghātam karoti na sukha sahagatā saddhā pe 
PA_patthana_2.13:400.1_8	senāsanaṁ sukhañca sukhasahagatāya saddhāya …pe… paññāya … rāgassa … mānassa … diṭṭhiyā	senāsanam sukham ca sukha sahagatāya saddhāya pe paññāya rāgassa mānassa diṭṭhiyā 
PA_patthana_2.13:400.1_9	… patthanāya … kāyikassa sukhassa … maggassa phalasamāpattiyā upanissayapaccayena paccayo.	patthanāya kāyikassa sukhassa maggassa phala samāpattiyāḥ upanissaya paccayena paccayaḥ 
PA_patthana_2.13:401.1_0	Nasukhasahagato dhammo sukhasahagatassa ca nasukhasahagatassa ca dhammassa upanissayapaccayena	na sukha sahagataḥ dhammaḥ sukha sahagatassa ca na sukha sahagatassa ca dhammassa upanissaya paccayena 
PA_patthana_2.13:401.1_1	paccayo—ārammaṇūpanissayo, anantarūpanissayo, pakatūpanissayo …pe…. Pakatūpanissayo—nasukhasahagataṁ	paccayaḥ ārammaṇa upanissayaḥ anantara upanissayaḥ pakata upanissayaḥ pe pakata upanissayaḥ na sukha sahagata 
PA_patthana_2.13:401.1_2	saddhaṁ upanissāya sukhasahagatena cittena dānaṁ deti …pe… (dutiyagamanasadisaṁ)	saddham upanissāya sukha sahagatena cittena dānam deti pe dutiya gamana sadisa 
PA_patthana_2.13:401.1_3	mānaṁ jappeti, diṭṭhiṁ gaṇhāti; nasukhasahagataṁ sīlaṁ …pe… senāsanaṁ sukhaṁ upanissāya	mānam jappeti diṭṭhim gaṇhāti na sukha sahagatam sīlam pe senāsanam sukham upanissāya 
PA_patthana_2.13:401.1_4	dānaṁ deti …pe… samāpattiṁ uppādeti, sukhasahagatena cittena adinnaṁ ādiyati …pe…	dānam deti pe samāpattim uppādeti sukha sahagatena cittena adinnam ādiyati pe 
PA_patthana_2.13:401.1_5	nasukhasahagatā saddhā …pe… senāsanaṁ sukhañca sukhasahagatāya … saddhāya …pe… patthanāya	na sukha sahagatā saddhā pe senāsanam sukham ca sukha sahagatāya saddhāya pe patthanāya 
PA_patthana_2.13:401.1_6	… kāyikassa sukhassa, maggassa, phalasamāpattiyā sukhassa ca upanissayapaccayena paccayo.	kāyikassa sukhassa maggassa phala samāpattiyā sukhassa ca upanissaya paccayena paccayaḥ 
PA_patthana_2.13:402.1	Sukhasahagato ca nasukhasahagato ca dhammā sukhasahagatassa dhammassa upanissayapaccayena paccayo … tīṇi.	sukha sahagataḥ ca na sukha sahagataḥ ca dhammā sukha sahagatassa dhammassa upanissaya paccayena paccayaḥ tīṇi 
PA_patthana_2.13:403.0	Purejātādi	purejāta ādi 
PA_patthana_2.13:403.1_0	Nasukhasahagato dhammo nasukhasahagatassa dhammassa purejātapaccayena paccayo— ārammaṇapurejātaṁ,	na sukha sahagataḥ dhammaḥ na sukha sahagatassa dhammassa purejāta paccayena paccayaḥ ārammaṇa purejāta 
PA_patthana_2.13:403.1_1	vatthupurejātaṁ. Ārammaṇapurejātaṁ—cakkhuṁ …pe… vatthuṁ nasukhasahagatena cittena	vatthu purejāte ārammaṇa purejāta cakkhum pe vatthum na sukha sahagatena cittena 
PA_patthana_2.13:403.1_2	aniccato …pe… vipassati assādeti abhinandati, taṁ ārabbha nasukhasahagato rāgo uppajjati	aniccataḥ pe vipassati assādeti abhinandati tam ārabbha na sukha sahagataḥ rāgaḥ uppajjati 
PA_patthana_2.13:403.1_3	…pe… domanassaṁ uppajjati, sukhaṁ uppajjati, dibbena cakkhunā rūpaṁ passati …pe…	pe domanassam uppajjati sukham uppajjati dibbena cakkhunā rūpam passati pe 
PA_patthana_2.13:403.1_4	phoṭṭhabbāyatanaṁ kāyaviññāṇassa …pe…. Vatthupurejātaṁ—cakkhāyatanaṁ cakkhuviññāṇassa	phoṭṭhabba āyatanam kāya viññāṇassa pe vatthu purejāta cakkhu āyatanam cakkhu viññāṇassa 
PA_patthana_2.13:403.1_5	…pe… kāyāyatanaṁ kāyaviññāṇassa …pe… vatthu nasukhasahagatānaṁ khandhānaṁ sukhassa	pe kāya āyatanam kāya viññāṇassa pe vatthu na sukha sahagatānam khandhānam sukhassa 
PA_patthana_2.13:403.1_6	ca purejātapaccayena paccayo.	ca purejāta paccayena paccayaḥ 
PA_patthana_2.13:404.1_0	Nasukhasahagato dhammo sukhasahagatassa dhammassa purejātapaccayena paccayo— ārammaṇapurejātaṁ,	na sukha sahagataḥ dhammaḥ sukha sahagatassa dhammassa purejāta paccayena paccayaḥ ārammaṇa purejāta 
PA_patthana_2.13:404.1_1	vatthupurejātaṁ. Ārammaṇapurejātaṁ—cakkhuṁ …pe… vatthuṁ sukhasahagatena cittena aniccato	vatthu purejāta ārammaṇa purejāta cakkhum pe vatthum sukha sahagatena cittena aniccato 
PA_patthana_2.13:404.1_2	…pe… vipassati, assādeti abhinandati, taṁ ārabbha sukhasahagato rāgo uppajjati, diṭṭhi	pe vipassati assādeti abhinandati tam ārabbha sukha sahagataḥ rāgaḥ uppajjati diṭṭhi 
PA_patthana_2.13:404.1_3	uppajjati. Vatthupurejātaṁ—vatthu sukhasahagatānaṁ khandhānaṁ purejātapaccayena paccayo.	uppajjati vatthu purejāta vatthu sukha sahagatānam khandhānam purejāta paccayena paccayaḥ 
PA_patthana_2.13:405.1_0	Nasukhasahagato dhammo sukhasahagatassa ca nasukhasahagatassa ca dhammassa purejātapaccayena	na sukha sahagataḥ dhammaḥ sukha sahagatassa ca na sukha sahagatassa ca dhammassa purejāta paccayena 
PA_patthana_2.13:405.1_1	paccayo—ārammaṇapurejātaṁ, vatthupurejātaṁ. Ārammaṇapurejātaṁ—cakkhuṁ …pe… vatthuṁ	paccayo ārammaṇa purejāta vatthu purejāta ārammaṇa purejāta cakkhum pe vatthu 
PA_patthana_2.13:405.1_2	sukhasahagatena cittena aniccato …pe… vipassati, assādeti abhinandati, taṁ ārabbha	sukha sahagatena cittena aniccataḥ pe vipassati assādeti abhinandati tam ārabbha 
PA_patthana_2.13:405.1_3	sukhañca sampayuttakā khandhā ca uppajjanti. Vatthupurejātaṁ—vatthu sukhasahagatānaṁ	sukham ca sampayuttakā khandhā ca uppajjanti vatthu purejāta vatthu 
PA_patthana_2.13:405.1_4	khandhānaṁ sukhassa ca purejātapaccayena paccayo.	khandhānam sukhassa ca purejāta paccayena paccayaḥ 
PA_patthana_2.13:406.1	Pacchājātapaccayena paccayo … tīṇi … āsevanapaccayena paccayo … nava.	pacchājāta paccayena paccayaḥ tīṇi āsevana paccayena paccayaḥ nava 
PA_patthana_2.13:407.0	Kammādi	kamma ādi 
PA_patthana_2.13:407.1_0	Sukhasahagato dhammo sukhasahagatassa dhammassa kammapaccayena paccayo— sahajātā,	sukha sahagataḥ dhammaḥ sukha sahagatassa dhammassa kamma paccayena paccayaḥ sahajātā 
PA_patthana_2.13:407.1_1	nānākkhaṇikā. (Cha kammāni cattāri sahajātāpi nānākkhaṇikāpi kātabbā, dve nānākkhaṇikā.)	nānākkhaṇikā cha kammāni cattāri sahajātā api nānākkhaṇikā api kātabbā dve nānākkhaṇikā 
PA_patthana_2.13:407.1_2	Vipākapaccayena paccayo … nava … āhārapaccayena paccayo … cattāri … indriyapaccayena	vipāka paccayena paccayaḥ nava āhāra paccayena paccayaḥ cattāri indriya paccayena 
PA_patthana_2.13:407.1_3	paccayo … nava … jhānapaccayena paccayo … nava … maggapaccayena paccayo … cattāri	paccayaḥ nava jhāna paccayena paccayaḥ nava magga paccayena paccayaḥ cattāri 
PA_patthana_2.13:407.1_4	… sampayuttapaccayena paccayo … cha … vippayuttapaccayena paccayo … pañca … atthipaccayena	sampayutta paccayena paccayaḥ cha vippayutta paccayena paccayaḥ pañca atthi paccayena 
PA_patthana_2.13:407.1_5	paccayo … nava … natthipaccayena paccayo … nava … vigatapaccayena paccayo … nava	paccayaḥ nava natthi paccayena paccayaḥ nava vigata paccayena paccayaḥ nava 
PA_patthana_2.13:407.1_6	… avigatapaccayena paccayo … nava.	avigata paccayena paccayaḥ nava 
PA_patthana_2.13:408.0.1	2.13.9.7.1. Paccayānulomādi	paccaya anuloma ādi 
PA_patthana_2.13:408.0.2	Saṅkhyāvāra	saṅkhyāvāra 
PA_patthana_2.13:408.0.3	Suddha	suddha 
PA_patthana_2.13:408.1_0	Hetuyā cattāri, ārammaṇe nava, adhipatiyā nava, anantare nava, samanantare nava,	hetuyā cattāri ārammaṇe nava adhipatiyā nava anantare nava samanantare nava 
PA_patthana_2.13:408.1_1	sahajāte nava, aññamaññe nava, nissaye nava, upanissaye nava, purejāte tīṇi, pacchājāte	sahajāte nava aññamaññe nava nissaye nava upanissaye nava purejāte tīṇi pacchājāte 
PA_patthana_2.13:408.1_2	tīṇi, āsevane nava, kamme cha, vipāke nava, āhāre cattāri, indriye nava, jhāne nava,	tīṇi āsevane nava kamme cha vipāke nava āhāre cattāri indriye nava jhāne nava 
PA_patthana_2.13:408.1_3	magge cattāri, sampayutte cha, vippayutte pañca, atthiyā nava, natthiyā nava, vigate nava, avigate nava.	magge cattāri sampayutte cha vippayutte pañca atthiyāḥ nava natthiyāḥ nava vigate nava avigate nava 
PA_patthana_2.13:409.1	(Evaṁ paccanīyavibhaṅgopi gaṇanāpi sappītikadukasadisaṁ kātabbaṁ, yadipi vimati atthi anulomaṁ passitvā gaṇetabbaṁ.)	evam paccanīya vibhaṅgaḥ api gaṇanā api sappītika duka sadisam yadi api atthi anulomam passitvā gaṇetabba 
PA_patthana_2.13:410.1	Sukhasahagatadukaṁ niṭṭhitaṁ.	sukha sahagata dukam 
PA_patthana_2.13:411.0.1	2.13.10. Upekkhāsahagataduka	upekkhā sahagata duka 
PA_patthana_2.13:411.0.2	2.13.10.1. Paṭiccavāra	paṭiccavāra 
PA_patthana_2.13:411.0.3	2.13.10.1.1. Paccayānuloma	paccaya anuloma 
