segmentnr	original	analyzed
PA_patthana_21.22:0.1	Paṭṭhānapakaraṇa	paṭṭhāna pakaraṇa 
PA_patthana_21.22:0.2	Dhammapaccanīyānuloma (4), Dukatikapaṭṭhānapāḷi (3)	dhamma paccanīya anuloma duka tika paṭṭhāna pāḷi 
PA_patthana_21.22:0.3	21.22. Hetuduka, Pītittika	hetuduka pītittika 
PA_patthana_21.22:1.1	Nahetuṁ napītisahagataṁ dhammaṁ paṭicca hetu pītisahagato dhammo uppajjati hetupaccayā. (Saṅkhittaṁ.) Hetuyā tīṇi …pe… avigate tīṇi.	na hetum na pīti sahagatam dhammam paṭicca hetu pīti sahagataḥ dhammaḥ uppajjati hetu paccayā saṅkhitta hetuyā tīṇi pe avigate tīṇi 
PA_patthana_21.22:2.1	Nahetuṁ nasukhasahagataṁ dhammaṁ paṭicca hetu sukhasahagato dhammo uppajjati hetupaccayā. (Saṅkhittaṁ.) Hetuyā tīṇi …pe… avigate tīṇi.	na hetum na sukha sahagatam dhammam paṭicca hetu sukha sahagataḥ dhammaḥ uppajjati hetu paccayā saṅkhitta hetuyā tīṇi pe avigate tīṇi 
PA_patthana_21.22:3.1	Nahetuṁ naupekkhāsahagataṁ dhammaṁ paṭicca hetu upekkhāsahagato dhammo uppajjati hetupaccayā. (Saṅkhittaṁ.) Hetuyā tīṇi …pe… avigate tīṇi.	na hetum na upekkhā sahagatam dhammam paṭicca hetu upekkhā sahagataḥ dhammaḥ uppajjati hetu paccayā saṅkhitta hetuyā tīṇi pe avigate tīṇi 
