segmentnr	original	analyzed
PA_patthana_22.33:0.1	Paṭṭhānapakaraṇa	paṭṭhāna pakaraṇa 
PA_patthana_22.33:0.2	Dhammapaccanīyānuloma (4), Tikadukapaṭṭhānapāḷi (4)	dhamma paccanīya anuloma tika duka paṭṭhāna pāḷi 
PA_patthana_22.33:0.3	22.33. Sanidassanattika, Upādānadukādi	sani dassana ttikaḥ upādāna duka ādi 
PA_patthana_22.33:1.1	Nasanidassanasappaṭighaṁ noupādānaṁ dhammaṁ paṭicca anidassanaappaṭigho upādāno dhammo uppajjati hetupaccayā. (Saṅkhittaṁ.)	na sa nidassana sa ppaṭigham no upādānam dhammam paṭicca anidassana appaṭighaḥ upādānaḥ dhammaḥ uppajjati hetu paccayā saṅkhitta 
PA_patthana_22.33:2.1	Hetuyā tīṇi …pe… avigate tīṇi.	hetuyā tīṇi pe avigate tīṇi 
