segmentnr	original	analyzed
PA_patthana_18.2:0.1	Paṭṭhānapakaraṇa	paṭṭhāna pakaraṇa 
PA_patthana_18.2:0.2	Dhammānulomapaccanīya (3), Dukadukapaṭṭhānapāḷi (6)	dhamma anuloma paccanīya 
PA_patthana_18.2:0.3	18.2. Hetuduka, Hetusampayuttaduka	hetu duka hetu sampayutta duka 
PA_patthana_18.2:1.1	Hetuṁ hetusampayuttaṁ dhammaṁ paṭicca nahetu nahetusampayutto dhammo uppajjati hetupaccayā … tīṇi. (Saṅkhittaṁ.)	hetum hetu sampayuttam dhammam paṭicca na hetu na hetu sampayuttaḥ dhammaḥ uppajjati hetu paccayā tīṇi 
PA_patthana_18.2:2.1	Hetuyā tīṇi, ārammaṇe ekaṁ, adhipatiyā tīṇi …pe… aññamaññe pañca, vipāke tīṇi …pe… avigate pañca. (Sahetukasadisaṁ.)	hetuyā tīṇi ārammaṇe eka adhipatiyā tīṇi pe aññamaññe pañca vipāke tīṇi pe avigate pañca sa hetuka sadisa 
PA_patthana_18.2:3.1	Hetuṁ hetuvippayuttaṁ dhammaṁ paṭicca nahetu nahetuvippayutto dhammo uppajjati hetupaccayā.	hetum hetu vippayuttam dhammam paṭicca na hetu na hetu vippayuttaḥ dhammaḥ uppajjati hetu paccayā 
PA_patthana_18.2:4.1	Nahetuṁ hetuvippayuttaṁ dhammaṁ paṭicca nanahetu nahetuvippayutto dhammo uppajjati hetupaccayā … tīṇi. (Saṅkhittaṁ.)	na hetum hetu vippayuttam dhammam paṭicca na na hetu na hetu vippayuttaḥ dhammaḥ uppajjati hetu paccayā tīṇi 
PA_patthana_18.2:5.1	Hetuyā cattāri, ārammaṇe cattāri …pe… purejāte āsevane ekaṁ …pe… vipāke tīṇi …pe… avigate cattāri.	hetuyā cattāri ārammaṇe cattāri pe purejāte āsevane ekam pe vipāke tīṇi pe avigate cattāri 
