segmentnr	original	folio	analyzed
PA_patthana_23.31:0.1	Paṭṭhānapakaraṇa	0	
PA_patthana_23.31:0.2	Dhammapaccanīyānuloma (4), Tikatikapaṭṭhānapāḷi (5)	0	
PA_patthana_23.31:0.3	23.31. Parittārammaṇattika, Kusalattika	0	
PA_patthana_23.31:1.1	Naparittārammaṇaṁ nakusalaṁ dhammaṁ paccayā parittārammaṇo kusalo dhammo uppajjati hetupaccayā. (Saṅkhittaṁ.) Hetuyā ekavīsa …pe… avigate ekavīsa.	1	
PA_patthana_23.31:2.1	Naparittārammaṇaṁ naakusalaṁ dhammaṁ paccayā parittārammaṇo akusalo dhammo uppajjati hetupaccayā. (Saṅkhittaṁ.) Hetuyā cuddasa …pe… avigate cuddasa.	2	
PA_patthana_23.31:3.1_0	Naparittārammaṇo naabyākato dhammo parittārammaṇassa abyākatassa dhammassa ārammaṇapaccayena	3	
PA_patthana_23.31:3.1_1	paccayo. (Saṅkhittaṁ.) … Ārammaṇe ekavīsa, adhipatiyā nava, anantare samanantare	3	
PA_patthana_23.31:3.1_2	ekavīsa, upanissaye ekavīsa, natthiyā vigate ekavīsa.	3	
