segmentnr	original	folio	analyzed
PA_patthana_8.12:0.1	Paṭṭhānapakaraṇa	0	
PA_patthana_8.12:0.2	Dhammapaccanīya (2), Dukapaṭṭhānapāḷi (2)	0	
PA_patthana_8.12:0.3	8.12. Lokiyaduka	0	
PA_patthana_8.12:1.1_0	Nalokiyaṁ dhammaṁ paṭicca nalokiyo dhammo uppajjati hetupaccayā. Nalokiyaṁ dhammaṁ	1	
PA_patthana_8.12:1.1_1	paṭicca nalokuttaro dhammo uppajjati hetupaccayā. Nalokiyaṁ dhammaṁ paṭicca nalokiyo	1	
PA_patthana_8.12:1.1_2	ca nalokuttaro ca dhammā uppajjanti hetupaccayā.	1	
PA_patthana_8.12:2.1	Nalokuttaraṁ dhammaṁ paṭicca nalokuttaro dhammo uppajjati hetupaccayā.	2	
PA_patthana_8.12:3.1	Nalokiyañca nalokuttarañca dhammaṁ paṭicca nalokuttaro dhammo uppajjati hetupaccayā. (Saṅkhittaṁ.)	3	
PA_patthana_8.12:4.1	Hetuyā pañca, ārammaṇe dve …pe… avigate pañca. (Sabbattha vitthāro.)	4	
