segmentnr	original	analyzed
PA_patthana_15.27:0.1	Paṭṭhānapakaraṇa	paṭṭhāna pakaraṇa 
PA_patthana_15.27:0.2	Dhammānulomapaccanīya (3), Dukatikapaṭṭhānapāḷi (3)	dhamma anuloma paccanīya 
PA_patthana_15.27:0.3	15.27. Sappaccayadukādi, Kusalattika	sa paccaya duka ādi kusala ttika 
PA_patthana_15.27:1.1	Sappaccayaṁ kusalaṁ dhammaṁ paṭicca naappaccayo nakusalo dhammo uppajjati hetupaccayā. Hetuyā ekaṁ …pe… avigate ekaṁ.	sappaccayam kusalam dhammam paṭicca na appaccayaḥ na kusalaḥ dhammaḥ uppajjati hetu paccayā hetuyā ekam pe avigate eka 
PA_patthana_15.27:2.1	Sappaccayaṁ akusalaṁ dhammaṁ paṭicca naappaccayo naakusalo dhammo uppajjati hetupaccayā. Hetuyā ekaṁ …pe… avigate ekaṁ.	sappaccayam akusalam dhammam paṭicca na appaccayaḥ na akusalaḥ dhammaḥ uppajjati hetu paccayā hetuyā ekam pe avigate eka 
PA_patthana_15.27:3.1	Sappaccayaṁ abyākataṁ dhammaṁ paccayā naappaccayo naabyākato dhammo uppajjati hetupaccayā. Hetuyā ekaṁ …pe… avigate ekaṁ. (Saṅkhittaṁ sappaccayasadisaṁ.)	sappaccayam abyākatam dhammam paccayā na appaccayaḥ na abyākataḥ dhammaḥ uppajjati hetu paccayā hetuyā ekam pe avigate eka saṅkhittam sappaccaya sadisa 
