segmentnr	original	analyzed
PA_pli-tv-bu-vb_pj4:0.1	Theravāda Vinaya	▁ther a vād a ▁vinay a
PA_pli-tv-bu-vb_pj4:0.2	Mahāvibhaṅga	▁mahā vibhaṃg a
PA_pli-tv-bu-vb_pj4:0.3	Pārājikakaṇḍa	▁pārājik akaṇḍ a
PA_pli-tv-bu-vb_pj4:0.4	4. Catutthapārājikasikkhāpada	▁catutth a pārājik asikkhāpad a
PA_pli-tv-bu-vb_pj4:1.1.1	Tena samayena buddho bhagavā vesāliyaṁ viharati mahāvane kūṭāgārasālāyaṁ.	▁tena ▁samayena ▁buddho ▁bhagavā ▁vesāli yaṃ ▁viharati ▁mahā vane ▁ kūṭ ā gār asālā yaṃ
PA_pli-tv-bu-vb_pj4:1.1.2	Tena kho pana samayena sambahulā sandiṭṭhā sambhattā bhikkhū vaggumudāya nadiyā tīre vassaṁ upagacchiṁsu.	▁tena ▁kho ▁pana ▁samayena ▁sambahulā ▁ san diṭṭh ā ▁sam bhatt ā ▁bhikkhū ▁ vagg u mud āya ▁na d iyā ▁ tī re ▁vass aṃ ▁upa gacch iṃsu
PA_pli-tv-bu-vb_pj4:1.1.3	Tena kho pana samayena vajjī dubbhikkhā hoti dvīhitikā setaṭṭhikā salākāvuttā,	▁tena ▁kho ▁pana ▁samayena ▁vajj ī ▁ dubbh ikkh ā ▁hoti ▁dvīhi ti kā ▁set aṭṭh ikā ▁ salāk ā vutt ā
PA_pli-tv-bu-vb_pj4:1.1.4	na sukarā uñchena paggahena yāpetuṁ.	▁na ▁su kar ā ▁u ñch ena ▁paggah ena ▁y āpetuṃ
PA_pli-tv-bu-vb_pj4:1.1.5	Atha kho tesaṁ bhikkhūnaṁ etadahosi—“etarahi kho vajjī dubbhikkhā dvīhitikā setaṭṭhikā salākāvuttā, na sukarā uñchena paggahena yāpetuṁ.	▁atha ▁kho ▁tesaṃ ▁bhikkhūnaṃ ▁etadahosi e tar a hi ▁kho ▁vajj ī ▁ dubbh ikkh ā ▁dvīhi ti kā ▁set aṭṭh ikā ▁ salāk ā vutt ā ▁na ▁su kar ā ▁u ñch ena ▁paggah ena ▁y āpetuṃ
PA_pli-tv-bu-vb_pj4:1.1.6	Kena nu kho mayaṁ upāyena samaggā sammodamānā avivadamānā phāsukaṁ vassaṁ vaseyyāma,	▁kena ▁nu ▁kho ▁mayaṃ ▁upāy ena ▁samagg ā ▁sam mod amānā ▁avi va d amānā ▁phāsu kaṃ ▁vass aṃ ▁vas eyyā ma
PA_pli-tv-bu-vb_pj4:1.1.7	na ca piṇḍakena kilameyyāmā”ti?	▁na ▁ca ▁ pi ṇḍ akena ▁kilam eyyā m āti
PA_pli-tv-bu-vb_pj4:1.1.8	Ekacce evamāhaṁsu—	▁ekacc e ▁evamāhaṃsu
PA_pli-tv-bu-vb_pj4:1.1.9	“handa mayaṁ, āvuso, gihīnaṁ kammantaṁ adhiṭṭhema,	▁ han da ▁mayaṃ ▁āvuso ▁gihī naṃ ▁kamm antaṃ ▁adhiṭṭh e ma
PA_pli-tv-bu-vb_pj4:1.1.10	evaṁ te amhākaṁ dātuṁ maññissanti.	▁evaṃ ▁te ▁amhākaṃ ▁dātuṃ ▁maññ issanti
PA_pli-tv-bu-vb_pj4:1.1.11	Evaṁ mayaṁ samaggā sammodamānā avivadamānā phāsukaṁ vassaṁ vasissāma,	▁evaṃ ▁mayaṃ ▁samagg ā ▁sam mod amānā ▁avi va d amānā ▁phāsu kaṃ ▁vass aṃ ▁vas issāma
PA_pli-tv-bu-vb_pj4:1.1.12	na ca piṇḍakena kilamissāmā”ti.	▁na ▁ca ▁ pi ṇḍ akena ▁kilam issāmāti
PA_pli-tv-bu-vb_pj4:1.1.13	Ekacce evamāhaṁsu—	▁ekacc e ▁evamāhaṃsu
PA_pli-tv-bu-vb_pj4:1.1.14	“alaṁ, āvuso, kiṁ gihīnaṁ kammantaṁ adhiṭṭhitena.	▁alaṃ ▁āvuso ▁kiṃ ▁gihī naṃ ▁kamm antaṃ ▁adhiṭṭh it ena
PA_pli-tv-bu-vb_pj4:1.1.15	Handa mayaṁ, āvuso, gihīnaṁ dūteyyaṁ harāma,	▁ han da ▁mayaṃ ▁āvuso ▁gihī naṃ ▁dūt eyyaṃ ▁har āma
PA_pli-tv-bu-vb_pj4:1.1.16	evaṁ te amhākaṁ dātuṁ maññissanti.	▁evaṃ ▁te ▁amhākaṃ ▁dātuṃ ▁maññ issanti
PA_pli-tv-bu-vb_pj4:1.1.17	Evaṁ mayaṁ samaggā sammodamānā avivadamānā phāsukaṁ vassaṁ vasissāma,	▁evaṃ ▁mayaṃ ▁samagg ā ▁sam mod amānā ▁avi va d amānā ▁phāsu kaṃ ▁vass aṃ ▁vas issāma
PA_pli-tv-bu-vb_pj4:1.1.18	na ca piṇḍakena kilamissāmā”ti.	▁na ▁ca ▁ pi ṇḍ akena ▁kilam issāmāti
PA_pli-tv-bu-vb_pj4:1.1.19	Ekacce evamāhaṁsu—	▁ekacc e ▁evamāhaṃsu
PA_pli-tv-bu-vb_pj4:1.1.20	“alaṁ, āvuso, kiṁ gihīnaṁ kammantaṁ adhiṭṭhitena.	▁alaṃ ▁āvuso ▁kiṃ ▁gihī naṃ ▁kamm antaṃ ▁adhiṭṭh it ena
PA_pli-tv-bu-vb_pj4:1.1.21	Kiṁ gihīnaṁ dūteyyaṁ haṭena.	▁kiṃ ▁gihī naṃ ▁dūt eyyaṃ ▁ ha ṭ ena
PA_pli-tv-bu-vb_pj4:1.1.22	Handa mayaṁ, āvuso, gihīnaṁ aññamaññassa uttarimanussadhammassa vaṇṇaṁ bhāsissāma—	▁ han da ▁mayaṃ ▁āvuso ▁gihī naṃ ▁aññamaññ assa ▁uttari manuss adhamm assa ▁vaṇṇ aṃ ▁ bhās issāma
PA_pli-tv-bu-vb_pj4:1.1.23	‘asuko bhikkhu paṭhamassa jhānassa lābhī,	▁asuk o ▁bhikkhu ▁paṭham assa ▁jhān assa ▁lābh ī
PA_pli-tv-bu-vb_pj4:1.1.24	asuko bhikkhu dutiyassa jhānassa lābhī,	▁asuk o ▁bhikkhu ▁dutiy assa ▁jhān assa ▁lābh ī
PA_pli-tv-bu-vb_pj4:1.1.25	asuko bhikkhu tatiyassa jhānassa lābhī,	▁asuk o ▁bhikkhu ▁tatiy assa ▁jhān assa ▁lābh ī
PA_pli-tv-bu-vb_pj4:1.1.26	asuko bhikkhu catutthassa jhānassa lābhī,	▁asuk o ▁bhikkhu ▁catutth assa ▁jhān assa ▁lābh ī
PA_pli-tv-bu-vb_pj4:1.1.27	asuko bhikkhu sotāpanno,	▁asuk o ▁bhikkhu ▁sotāpann o
PA_pli-tv-bu-vb_pj4:1.1.28	asuko bhikkhu sakadāgāmī,	▁asuk o ▁bhikkhu ▁sak a dā gāmī
PA_pli-tv-bu-vb_pj4:1.1.29	asuko bhikkhu anāgāmī,	▁asuk o ▁bhikkhu ▁anā gāmī
PA_pli-tv-bu-vb_pj4:1.1.30	asuko bhikkhu arahā,	▁asuk o ▁bhikkhu ▁arahā
PA_pli-tv-bu-vb_pj4:1.1.31	asuko bhikkhu tevijjo,	▁asuk o ▁bhikkhu ▁te vijj o
PA_pli-tv-bu-vb_pj4:1.1.32	asuko bhikkhu chaḷabhiñño’ti.	▁asuk o ▁bhikkhu ▁cha ḷ a bhi ññ oti
PA_pli-tv-bu-vb_pj4:1.1.33	Evaṁ te amhākaṁ dātuṁ maññissanti.	▁evaṃ ▁te ▁amhākaṃ ▁dātuṃ ▁maññ issanti
PA_pli-tv-bu-vb_pj4:1.1.34	Evaṁ mayaṁ samaggā sammodamānā avivadamānā phāsukaṁ vassaṁ vasissāma,	▁evaṃ ▁mayaṃ ▁samagg ā ▁sam mod amānā ▁avi va d amānā ▁phāsu kaṃ ▁vass aṃ ▁vas issāma
PA_pli-tv-bu-vb_pj4:1.1.35	na ca piṇḍakena kilamissāmā”ti.	▁na ▁ca ▁ pi ṇḍ akena ▁kilam issāmāti
PA_pli-tv-bu-vb_pj4:1.1.36	“Esoyeva kho, āvuso, seyyo yo amhākaṁ gihīnaṁ aññamaññassa uttarimanussadhammassa vaṇṇo bhāsito”ti.	▁eso yeva ▁kho ▁āvuso ▁seyy o ▁yo ▁amhākaṃ ▁gihī naṃ ▁aññamaññ assa ▁uttari manuss adhamm assa ▁vaṇṇ o ▁bhāsit oti
PA_pli-tv-bu-vb_pj4:1.1.37	Atha kho te bhikkhū gihīnaṁ aññamaññassa uttarimanussadhammassa vaṇṇaṁ bhāsiṁsu—	▁atha ▁kho ▁te ▁bhikkhū ▁gihī naṃ ▁aññamaññ assa ▁uttari manuss adhamm assa ▁vaṇṇ aṃ ▁ bhās iṃsu
PA_pli-tv-bu-vb_pj4:1.1.38	“asuko bhikkhu paṭhamassa jhānassa lābhī …pe…	▁asuk o ▁bhikkhu ▁paṭham assa ▁jhān assa ▁lābh ī ▁pe
PA_pli-tv-bu-vb_pj4:1.1.39	asuko bhikkhu chaḷabhiñño”ti.	▁asuk o ▁bhikkhu ▁cha ḷ a bhi ññ oti
PA_pli-tv-bu-vb_pj4:1.1.40	Atha kho te manussā—	▁atha ▁kho ▁te ▁manussā
PA_pli-tv-bu-vb_pj4:1.1.41	“lābhā vata no, suladdhaṁ vata no, yesaṁ no evarūpā bhikkhū vassaṁ upagatā;	▁lābh ā ▁vata ▁no ▁su laddh aṃ ▁vata ▁no ▁yesaṃ ▁no ▁evarūp ā ▁bhikkhū ▁vass aṃ ▁upa gat ā
PA_pli-tv-bu-vb_pj4:1.1.42	na vata no ito pubbe evarūpā bhikkhū vassaṁ upagatā yathayime bhikkhū sīlavanto kalyāṇadhammā”ti,	▁na ▁vata ▁no ▁ito ▁pubbe ▁evarūp ā ▁bhikkhū ▁vass aṃ ▁upa gat ā ▁yath ayi me ▁bhikkhū ▁sīl avant o ▁kalyāṇ adhamm āti
PA_pli-tv-bu-vb_pj4:1.1.43_0	te na tādisāni bhojanāni attanā paribhuñjanti mātāpitūnaṁ denti puttadārassa denti	▁te ▁na ▁tādis āni ▁bhojan āni ▁attanā ▁paribhuñj anti ▁ mātāpit ūn aṃ ▁d enti ▁putt a dā r assa ▁d enti
PA_pli-tv-bu-vb_pj4:1.1.43_1	dāsakammakaraporisassa denti mittāmaccānaṁ denti ñātisālohitānaṁ denti, yādisāni bhikkhūnaṁ denti.	▁dās akamm a kar ap o ri s assa ▁d enti ▁mitt āma cc ānaṃ ▁d enti ▁ñāti sā lohit ānaṃ ▁d enti ▁yā dis āni ▁bhikkhūnaṃ ▁d enti
PA_pli-tv-bu-vb_pj4:1.1.44_0	Te na tādisāni khādanīyāni sāyanīyāni pānāni attanā khādanti sāyanti pivanti mātāpitūnaṁ	▁te ▁na ▁tādis āni ▁ khādanīy āni ▁sā y anīy āni ▁ pān āni ▁attanā ▁khād anti ▁sā yanti ▁piv anti ▁ mātāpit ūn aṃ
PA_pli-tv-bu-vb_pj4:1.1.44_1	denti puttadārassa denti dāsakammakaraporisassa denti mittāmaccānaṁ denti ñātisālohitānaṁ	▁d enti ▁putt a dā r assa ▁d enti ▁dās akamm a kar ap o ri s assa ▁d enti ▁mitt āma cc ānaṃ ▁d enti ▁ñāti sā lohit ānaṃ
PA_pli-tv-bu-vb_pj4:1.1.44_2	denti, yādisāni bhikkhūnaṁ denti.	▁d enti ▁yā dis āni ▁bhikkhūnaṃ ▁d enti
PA_pli-tv-bu-vb_pj4:1.1.45	Atha kho te bhikkhū vaṇṇavā ahesuṁ pīṇindriyā pasannamukhavaṇṇā vippasannachavivaṇṇā.	▁atha ▁kho ▁te ▁bhikkhū ▁vaṇṇ avā ▁ahesuṃ ▁p ī ṇ indriy ā ▁pasann a mukh avaṇṇ ā ▁vippa sann a cha vi vaṇṇ ā
PA_pli-tv-bu-vb_pj4:1.2.1	Āciṇṇaṁ kho panetaṁ vassaṁvuṭṭhānaṁ bhikkhūnaṁ bhagavantaṁ dassanāya upasaṅkamituṁ.	▁ ā ciṇṇ aṃ ▁kho ▁pa net aṃ ▁vass aṃ vuṭṭh ānaṃ ▁bhikkhūnaṃ ▁bhagavantaṃ ▁dassan āya ▁ upasaṃkam ituṃ
PA_pli-tv-bu-vb_pj4:1.2.2	Atha kho te bhikkhū vassaṁvuṭṭhā temāsaccayena senāsanaṁ saṁsāmetvā pattacīvaraṁ ādāya yena vesālī tena pakkamiṁsu.	▁atha ▁kho ▁te ▁bhikkhū ▁vass aṃ vuṭṭh ā ▁te mās accay ena ▁senāsan aṃ ▁saṃ sām etvā ▁patt acīvar aṃ ▁ādāya ▁yena ▁ve sā lī ▁tena ▁pakkam iṃsu
PA_pli-tv-bu-vb_pj4:1.2.3	Anupubbena yena vesālī mahāvanaṁ kūṭāgārasālā yena bhagavā tenupasaṅkamiṁsu; upasaṅkamitvā bhagavantaṁ abhivādetvā ekamantaṁ nisīdiṁsu.	▁anupubb ena ▁yena ▁ve sā lī ▁mahāva naṃ ▁ kūṭ ā gār asālā ▁yena ▁bhagavā ▁tenupasaṃkami ṃ su ▁upasaṃkamitvā ▁bhagavantaṃ ▁abhivādetvā ▁ekamantaṃ ▁nisīd iṃsu
PA_pli-tv-bu-vb_pj4:1.2.4	Tena kho pana samayena disāsu vassaṁvuṭṭhā bhikkhū kisā honti lūkhā dubbaṇṇā uppaṇḍuppaṇḍukajātā dhamanisanthatagattā;	▁tena ▁kho ▁pana ▁samayena ▁disā su ▁vass aṃ vuṭṭh ā ▁bhikkhū ▁ki sā ▁honti ▁lūkh ā ▁du bb a ṇ ṇā ▁u ppa ṇḍ u ppa ṇḍ uk a jāt ā ▁dha ma ni santhat a g attā
PA_pli-tv-bu-vb_pj4:1.2.5	vaggumudātīriyā pana bhikkhū vaṇṇavā honti pīṇindriyā pasannamukhavaṇṇā vippasannachavivaṇṇā.	▁ vagg u mud ā tī riy ā ▁pana ▁bhikkhū ▁vaṇṇ avā ▁honti ▁p ī ṇ indriy ā ▁pasann a mukh avaṇṇ ā ▁vippa sann a cha vi vaṇṇ ā
PA_pli-tv-bu-vb_pj4:1.2.6	Āciṇṇaṁ kho panetaṁ buddhānaṁ bhagavantānaṁ āgantukehi bhikkhūhi saddhiṁ paṭisammodituṁ.	▁ ā ciṇṇ aṃ ▁kho ▁pa net aṃ ▁buddh ānaṃ ▁bha gav antānaṃ ▁āgantuk ehi ▁bhikkhūhi ▁saddhiṃ ▁paṭi sam mod ituṃ
PA_pli-tv-bu-vb_pj4:1.2.7	Atha kho bhagavā vaggumudātīriye bhikkhū etadavoca—	▁atha ▁kho ▁bhagavā ▁ vagg u mud ā tī riy e ▁bhikkhū ▁etadavoca
PA_pli-tv-bu-vb_pj4:1.2.8	“kacci, bhikkhave, khamanīyaṁ kacci yāpanīyaṁ	▁kacci ▁bhikkhave ▁kham anīy aṃ ▁kacci ▁yā p anīy aṃ
PA_pli-tv-bu-vb_pj4:1.2.9	kacci samaggā sammodamānā avivadamānā phāsukaṁ vassaṁ vasittha, na ca piṇḍakena kilamitthā”ti?	▁kacci ▁samagg ā ▁sam mod amānā ▁avi va d amānā ▁phāsu kaṃ ▁vass aṃ ▁vas ittha ▁na ▁ca ▁ pi ṇḍ akena ▁kilam itthāti
PA_pli-tv-bu-vb_pj4:1.2.10	“Khamanīyaṁ, bhagavā, yāpanīyaṁ, bhagavā.	▁kham anīy aṃ ▁bhagavā ▁yā p anīy aṃ ▁bhagavā
PA_pli-tv-bu-vb_pj4:1.2.11	Samaggā ca mayaṁ, bhante, sammodamānā avivadamānā phāsukaṁ vassaṁ vasimhā, na ca piṇḍakena kilamimhā”ti.	▁samagg ā ▁ca ▁mayaṃ ▁bhante ▁sam mod amānā ▁avi va d amānā ▁phāsu kaṃ ▁vass aṃ ▁vas i mhā ▁na ▁ca ▁ pi ṇḍ akena ▁kilam i mhā ti
PA_pli-tv-bu-vb_pj4:1.2.12	Jānantāpi tathāgatā pucchanti, jānantāpi na pucchanti …pe…	▁jānant āpi ▁tathāgat ā ▁pucch anti ▁jānant āpi ▁na ▁pucch anti ▁pe
PA_pli-tv-bu-vb_pj4:1.2.13	dvīhākārehi buddhā bhagavanto bhikkhū paṭipucchanti— “dhammaṁ vā desessāma, sāvakānaṁ vā sikkhāpadaṁ paññapessāmā”ti.	▁d vī hākārehi ▁buddh ā ▁bha gav anto ▁bhikkhū ▁paṭi pucch anti ▁dhammaṃ ▁vā ▁des e ssāma ▁ sāvak ānaṃ ▁vā ▁sikkhāpadaṃ ▁paññap e ssāmāti
PA_pli-tv-bu-vb_pj4:1.2.14	Atha kho bhagavā vaggumudātīriye bhikkhū etadavoca—	▁atha ▁kho ▁bhagavā ▁ vagg u mud ā tī riy e ▁bhikkhū ▁etadavoca
PA_pli-tv-bu-vb_pj4:1.2.15	“yathā kathaṁ pana tumhe, bhikkhave, samaggā sammodamānā avivadamānā phāsukaṁ vassaṁ vasittha na ca piṇḍakena kilamitthā”ti?	▁yathā ▁kathaṃ ▁pana ▁tumhe ▁bhikkhave ▁samagg ā ▁sam mod amānā ▁avi va d amānā ▁phāsu kaṃ ▁vass aṃ ▁vas ittha ▁na ▁ca ▁ pi ṇḍ akena ▁kilam itthāti
PA_pli-tv-bu-vb_pj4:1.2.16	Atha kho te bhikkhū bhagavato etamatthaṁ ārocesuṁ.	▁atha ▁kho ▁te ▁bhikkhū ▁bhagavato ▁etamatthaṃ ▁ārocesuṃ
PA_pli-tv-bu-vb_pj4:1.2.17	“Kacci pana vo, bhikkhave, bhūtan”ti?	▁kacci ▁pana ▁vo ▁bhikkhave ▁bhūt anti
PA_pli-tv-bu-vb_pj4:1.2.18	“Abhūtaṁ, bhagavā”ti.	▁ abhūtaṃ ▁bhagavā ti
PA_pli-tv-bu-vb_pj4:1.2.19	Vigarahi buddho bhagavā—	▁vi ga ra hi ▁buddho ▁bhagavā
PA_pli-tv-bu-vb_pj4:1.2.20	“ananucchavikaṁ, moghapurisā, ananulomikaṁ appatirūpaṁ assāmaṇakaṁ akappiyaṁ akaraṇīyaṁ.	▁ana nucchavik aṃ ▁mogh apuris ā ▁ananu lom ikaṃ ▁appa ti rūp aṃ ▁a ssāma ṇ akaṃ ▁akappiy aṃ ▁a karaṇīy aṃ
PA_pli-tv-bu-vb_pj4:1.2.21	Kathañhi nāma tumhe, moghapurisā, udarassa kāraṇā gihīnaṁ aññamaññassa uttarimanussadhammassa vaṇṇaṁ bhāsissatha.	▁kathañhi ▁nāma ▁tumhe ▁mogh apuris ā ▁ud a r assa ▁kāraṇ ā ▁gihī naṃ ▁aññamaññ assa ▁uttari manuss adhamm assa ▁vaṇṇ aṃ ▁ bhās issa tha
PA_pli-tv-bu-vb_pj4:1.2.22	Varaṁ tumhehi, moghapurisā, tiṇhena govikantanena kucchi parikanto, na tveva udarassa kāraṇā gihīnaṁ aññamaññassa uttarimanussadhammassa vaṇṇo bhāsito.	▁var aṃ ▁tumhe hi ▁mogh apuris ā ▁tiṇ h ena ▁go vik anta n ena ▁ku cch i ▁pari k anto ▁na ▁ tveva ▁ud a r assa ▁kāraṇ ā ▁gihī naṃ ▁aññamaññ assa ▁uttari manuss adhamm assa ▁vaṇṇ o ▁bhāsit o
PA_pli-tv-bu-vb_pj4:1.2.23	Taṁ kissa hetu?	▁taṃ ▁kissa ▁hetu
PA_pli-tv-bu-vb_pj4:1.2.24	Tatonidānañhi, moghapurisā, maraṇaṁ vā nigaccheyya maraṇamattaṁ vā dukkhaṁ,	▁tato nidān añhi ▁mogh apuris ā ▁maraṇ aṃ ▁vā ▁ni gacch eyya ▁maraṇ amattaṃ ▁vā ▁dukkhaṃ
PA_pli-tv-bu-vb_pj4:1.2.25	na tveva tappaccayā kāyassa bhedā paraṁ maraṇā apāyaṁ duggatiṁ vinipātaṁ nirayaṁ upapajjeyya.	▁na ▁ tveva ▁tap paccayā ▁kāyassa ▁bhed ā ▁paraṃ ▁maraṇā ▁apāy aṃ ▁duggatiṃ ▁vi nipāt aṃ ▁niray aṃ ▁upapajj eyya
PA_pli-tv-bu-vb_pj4:1.2.26	Itonidānañca kho, moghapurisā, kāyassa bhedā paraṁ maraṇā apāyaṁ duggatiṁ vinipātaṁ nirayaṁ upapajjeyya.	▁ito nidān añca ▁kho ▁mogh apuris ā ▁kāyassa ▁bhed ā ▁paraṃ ▁maraṇā ▁apāy aṃ ▁duggatiṃ ▁vi nipāt aṃ ▁niray aṃ ▁upapajj eyya
PA_pli-tv-bu-vb_pj4:1.2.27	Netaṁ, moghapurisā, appasannānaṁ vā pasādāya …pe…	▁netaṃ ▁mogh apuris ā ▁appa sann ānaṃ ▁vā ▁pasād āya ▁pe
PA_pli-tv-bu-vb_pj4:1.2.28	vigarahitvā dhammiṁ kathaṁ katvā bhikkhū āmantesi—	▁vi ga rah itvā ▁dhamm iṃ ▁kathaṃ ▁katvā ▁bhikkhū ▁āmantesi
PA_pli-tv-bu-vb_pj4:1.3.1	“Pañcime, bhikkhave, mahācorā santo saṁvijjamānā lokasmiṁ.	▁pañc i me ▁bhikkhave ▁mahā c o rā ▁sant o ▁saṃ vijj amānā ▁lok asmiṃ
PA_pli-tv-bu-vb_pj4:1.3.2	Katame pañca?	▁katame ▁pañca
PA_pli-tv-bu-vb_pj4:1.3.3	Idha, bhikkhave, ekaccassa mahācorassa evaṁ hoti—	▁idha ▁bhikkhave ▁ekacc assa ▁mahā c o r assa ▁evaṃ ▁hoti
PA_pli-tv-bu-vb_pj4:1.3.4	‘kudāssu nāmāhaṁ satena vā sahassena vā parivuto gāmanigamarājadhānīsu āhiṇḍissāmi	▁ku dā ssu ▁nām ā haṃ ▁sat ena ▁vā ▁ sahass ena ▁vā ▁pari vut o ▁gām ani gam arāja dhān īsu ▁ āhi ṇḍ issāmi
PA_pli-tv-bu-vb_pj4:1.3.5	hananto ghātento chindanto chedāpento pacanto pācento’ti.	▁ han anto ▁ ghāt ento ▁chind anto ▁ ched āpent o ▁pac anto ▁pā c ento ti
PA_pli-tv-bu-vb_pj4:1.3.6	So aparena samayena satena vā sahassena vā parivuto gāmanigamarājadhānīsu āhiṇḍati hananto ghātento chindanto chedāpento pacanto pācento.	▁so ▁apar ena ▁samayena ▁sat ena ▁vā ▁ sahass ena ▁vā ▁pari vut o ▁gām ani gam arāja dhān īsu ▁ āhi ṇḍ ati ▁ han anto ▁ ghāt ento ▁chind anto ▁ ched āpent o ▁pac anto ▁pā c ento
PA_pli-tv-bu-vb_pj4:1.3.7	Evameva kho, bhikkhave, idhekaccassa pāpabhikkhuno evaṁ hoti—	▁evameva ▁kho ▁bhikkhave ▁idh eka cc assa ▁pāp a bhikkh u no ▁evaṃ ▁hoti
PA_pli-tv-bu-vb_pj4:1.3.8	‘kudāssu nāmāhaṁ satena vā sahassena vā parivuto gāmanigamarājadhānīsu cārikaṁ carissāmi	▁ku dā ssu ▁nām ā haṃ ▁sat ena ▁vā ▁ sahass ena ▁vā ▁pari vut o ▁gām ani gam arāja dhān īsu ▁ cārik aṃ ▁ca r issāmi
PA_pli-tv-bu-vb_pj4:1.3.9	sakkato garukato mānito pūjito apacito gahaṭṭhānañceva pabbajitānañca, lābhī cīvarapiṇḍapātasenāsanagilānappaccayabhesajjaparikkhārānan’ti.	▁sakka to ▁garuk ato ▁mān ito ▁pūj ito ▁apa cit o ▁gah aṭṭhān añceva ▁pabbajit ānañca ▁lābh ī ▁cīvar apiṇḍ a pāt asenāsan a gilān a ppaccay a bh e sajj a parikkhār ānanti
PA_pli-tv-bu-vb_pj4:1.3.10_0	So aparena samayena satena vā sahassena vā parivuto gāmanigamarājadhānīsu cārikaṁ	▁so ▁apar ena ▁samayena ▁sat ena ▁vā ▁ sahass ena ▁vā ▁pari vut o ▁gām ani gam arāja dhān īsu ▁ cārik aṃ
PA_pli-tv-bu-vb_pj4:1.3.10_1	carati sakkato garukato mānito pūjito apacito gahaṭṭhānañceva pabbajitānañca, lābhī	▁ca rati ▁sakka to ▁garuk ato ▁mān ito ▁pūj ito ▁apa cit o ▁gah aṭṭhān añceva ▁pabbajit ānañca ▁lābh ī
PA_pli-tv-bu-vb_pj4:1.3.10_2	cīvarapiṇḍapātasenāsanagilānappaccayabhesajjaparikkhārānaṁ.	▁cīvar apiṇḍ a pāt asenāsan a gilān a ppaccay a bh e sajj a parikkhār ānaṃ
PA_pli-tv-bu-vb_pj4:1.3.11	Ayaṁ, bhikkhave, paṭhamo mahācoro santo saṁvijjamāno lokasmiṁ.	▁ayaṃ ▁bhikkhave ▁paṭham o ▁mahā c o ro ▁sant o ▁saṃ vijj amāno ▁lok asmiṃ
PA_pli-tv-bu-vb_pj4:1.3.12	Puna caparaṁ, bhikkhave, idhekacco pāpabhikkhu tathāgatappaveditaṁ dhammavinayaṁ pariyāpuṇitvā attano dahati.	▁puna ▁caparaṃ ▁bhikkhave ▁idhekacco ▁pāp a bhikkh u ▁tathāgat appa ved itaṃ ▁dhammavinay aṃ ▁pari yā pu ṇ itvā ▁attano ▁ dah ati
PA_pli-tv-bu-vb_pj4:1.3.13	Ayaṁ, bhikkhave, dutiyo mahācoro santo saṁvijjamāno lokasmiṁ.	▁ayaṃ ▁bhikkhave ▁dutiy o ▁mahā c o ro ▁sant o ▁saṃ vijj amāno ▁lok asmiṃ
PA_pli-tv-bu-vb_pj4:1.3.14	Puna caparaṁ, bhikkhave, idhekacco pāpabhikkhu suddhaṁ brahmacāriṁ parisuddhaṁ brahmacariyaṁ carantaṁ amūlakena abrahmacariyena anuddhaṁseti.	▁puna ▁caparaṃ ▁bhikkhave ▁idhekacco ▁pāp a bhikkh u ▁suddh aṃ ▁brahm acāri ṃ ▁parisuddh aṃ ▁brahmacariyaṃ ▁carant aṃ ▁ amūlak ena ▁a brahmacariy ena ▁anu ddh aṃ s eti
PA_pli-tv-bu-vb_pj4:1.3.15	Ayaṁ, bhikkhave, tatiyo mahācoro santo saṁvijjamāno lokasmiṁ.	▁ayaṃ ▁bhikkhave ▁tatiy o ▁mahā c o ro ▁sant o ▁saṃ vijj amāno ▁lok asmiṃ
PA_pli-tv-bu-vb_pj4:1.3.16	Puna caparaṁ, bhikkhave, idhekacco pāpabhikkhu yāni tāni saṅghassa garubhaṇḍāni garuparikkhārāni, seyyathidaṁ—	▁puna ▁caparaṃ ▁bhikkhave ▁idhekacco ▁pāp a bhikkh u ▁yāni ▁tāni ▁saṃghassa ▁garu bhaṇḍ āni ▁garu parikkhār āni ▁seyyathidaṃ
PA_pli-tv-bu-vb_pj4:1.3.17_0	ārāmo ārāmavatthu vihāro vihāravatthu mañco pīṭhaṁ bhisi bibbohanaṁ lohakumbhī lohabhāṇakaṁ	▁ārām o ▁ārām avatthu ▁vihār o ▁vihār avatthu ▁mañc o ▁ pīṭh aṃ ▁ bhi si ▁b i bb o han aṃ ▁loha kumbh ī ▁loha bhā ṇ akaṃ
PA_pli-tv-bu-vb_pj4:1.3.17_1	lohavārako lohakaṭāhaṁ vāsi parasu kuṭhārī kudālo nikhādanaṁ valli veḷu muñjaṁ pabbajaṁ	▁loha vā r ako ▁loha kaṭ ā haṃ ▁vā si ▁para su ▁ kuṭ hār ī ▁ku dā lo ▁ni kh ā dan aṃ ▁va ll i ▁veḷu ▁mu ñja ṃ ▁pabbaj aṃ
PA_pli-tv-bu-vb_pj4:1.3.17_2	tiṇaṁ mattikā dārubhaṇḍaṁ mattikābhaṇḍaṁ,	▁tiṇ aṃ ▁ matt ikā ▁dāru bhaṇḍ aṃ ▁ matt ikā bhaṇḍ aṃ
PA_pli-tv-bu-vb_pj4:1.3.18	tehi gihiṁ saṅgaṇhāti upalāpeti.	▁tehi ▁gihi ṃ ▁saṃgaṇhāti ▁upa l āpeti
PA_pli-tv-bu-vb_pj4:1.3.19	Ayaṁ, bhikkhave, catuttho mahācoro santo saṁvijjamāno lokasmiṁ.	▁ayaṃ ▁bhikkhave ▁catutth o ▁mahā c o ro ▁sant o ▁saṃ vijj amāno ▁lok asmiṃ
PA_pli-tv-bu-vb_pj4:1.3.20	Sadevake, bhikkhave, loke samārake sabrahmake sassamaṇabrāhmaṇiyā pajāya sadevamanussāya ayaṁ aggo mahācoro yo asantaṁ abhūtaṁ uttarimanussadhammaṁ ullapati.	▁sadevak e ▁bhikkhave ▁loke ▁samā r ake ▁sa brahm ake ▁sa s samaṇ a brāhmaṇ iyā ▁pajā ya ▁sa deva manuss āya ▁ayaṃ ▁agg o ▁mahā c o ro ▁yo ▁as antaṃ ▁ abhūtaṃ ▁uttari manuss adhamm aṃ ▁u ll a pati
PA_pli-tv-bu-vb_pj4:1.3.21	Taṁ kissa hetu?	▁taṃ ▁kissa ▁hetu
PA_pli-tv-bu-vb_pj4:1.3.22	Theyyāya vo, bhikkhave, raṭṭhapiṇḍo bhutto”ti.	▁theyy āya ▁vo ▁bhikkhave ▁ raṭṭh apiṇḍ o ▁bhutt oti
PA_pli-tv-bu-vb_pj4:1.3.23	Aññathā santamattānaṁ,	▁aññathā ▁sant amatt ānaṃ
PA_pli-tv-bu-vb_pj4:1.3.24	aññathā yo pavedaye;	▁aññathā ▁yo ▁pa ved aye
PA_pli-tv-bu-vb_pj4:1.3.25	Nikacca kitavasseva,	▁ni ka cca ▁ki ta v asseva
PA_pli-tv-bu-vb_pj4:1.3.26	bhuttaṁ theyyena tassa taṁ.	▁bhutt aṃ ▁theyy ena ▁tassa ▁taṃ
PA_pli-tv-bu-vb_pj4:1.3.27	Kāsāvakaṇṭhā bahavo,	▁kā sāvak a ṇṭh ā ▁b a ha vo
PA_pli-tv-bu-vb_pj4:1.3.28	pāpadhammā asaññatā;	▁pāp adhammā ▁a saññ atā
PA_pli-tv-bu-vb_pj4:1.3.29	Pāpā pāpehi kammehi,	▁pāp ā ▁pāp ehi ▁kamm ehi
PA_pli-tv-bu-vb_pj4:1.3.30	nirayaṁ te upapajjare.	▁niray aṃ ▁te ▁upapajj a re
PA_pli-tv-bu-vb_pj4:1.3.31	Seyyo ayoguḷo bhutto,	▁seyy o ▁a yo guḷ o ▁bhutt o
PA_pli-tv-bu-vb_pj4:1.3.32	tatto aggisikhūpamo;	▁ta tt o ▁aggi si kh ūpam o
PA_pli-tv-bu-vb_pj4:1.3.33	Yañce bhuñjeyya dussīlo,	▁y añce ▁ bhuñj eyya ▁dussīl o
PA_pli-tv-bu-vb_pj4:1.3.34	raṭṭhapiṇḍaṁ asaññatoti.	▁ raṭṭh apiṇḍ aṃ ▁a saññ atoti
PA_pli-tv-bu-vb_pj4:1.3.35	Atha kho bhagavā vaggumudātīriye bhikkhū anekapariyāyena vigarahitvā dubbharatāya dupposatāya …pe…	▁atha ▁kho ▁bhagavā ▁ vagg u mud ā tī riy e ▁bhikkhū ▁aneka pariyāy ena ▁vi ga rah itvā ▁du bb har atāya ▁du pp o s atāya ▁pe
PA_pli-tv-bu-vb_pj4:1.3.36	evañca pana, bhikkhave, imaṁ sikkhāpadaṁ uddiseyyātha—	▁evañca ▁pana ▁bhikkhave ▁imaṃ ▁sikkhāpadaṃ ▁uddis eyyātha
PA_pli-tv-bu-vb_pj4:1.3.37.1	“Yo pana bhikkhu anabhijānaṁ uttarimanussadhammaṁ attupanāyikaṁ alamariyañāṇadassanaṁ samudācareyya—‘iti jānāmi iti passāmī’ti,	▁yo ▁pana ▁bhikkhu ▁anabhi jān aṃ ▁uttari manuss adhamm aṃ ▁att upa nā y ikaṃ ▁ala ma riy añāṇ adassan aṃ ▁samu dā ca r eyya i ti ▁jānāmi ▁iti ▁pass āmīti
PA_pli-tv-bu-vb_pj4:1.3.38	tato aparena samayena samanuggāhīyamāno vā asamanuggāhīyamāno vā āpanno visuddhāpekkho evaṁ vadeyya—‘ajānamevaṁ, āvuso, avacaṁ jānāmi, apassaṁ passāmi. Tucchaṁ musā vilapin’ti,	▁tato ▁apar ena ▁samayena ▁samanu ggāh ī y amāno ▁vā ▁as amanu ggāh ī y amāno ▁vā ▁āpann o ▁ visuddh ā pekkh o ▁evaṃ ▁vadeyya a jān ameva ṃ ▁āvuso ▁ava c aṃ ▁jānāmi ▁a pass aṃ ▁pa ssāmi ▁tu cch aṃ ▁mu sā ▁vi la pi nti
PA_pli-tv-bu-vb_pj4:1.3.39	ayampi pārājiko hoti asaṁvāso”ti.	▁ayampi ▁pārājik o ▁hoti ▁as aṃ vās oti
PA_pli-tv-bu-vb_pj4:1.3.40	Evañcidaṁ bhagavatā bhikkhūnaṁ sikkhāpadaṁ paññattaṁ hoti.	▁eva ñc idaṃ ▁bhagavatā ▁bhikkhūnaṃ ▁sikkhāpadaṃ ▁paññattaṃ ▁hoti
PA_pli-tv-bu-vb_pj4:2.1	Tena kho pana samayena sambahulā bhikkhū adiṭṭhe diṭṭhasaññino apatte pattasaññino anadhigate adhigatasaññino asacchikate sacchikatasaññino adhimānena aññaṁ byākariṁsu.	▁tena ▁kho ▁pana ▁samayena ▁sambahulā ▁bhikkhū ▁a diṭṭh e ▁diṭṭh asaññino ▁ apatt e ▁patt asaññino ▁ana dhi gat e ▁adhigat asaññino ▁a sacc hi kat e ▁sacchikat asaññino ▁adhi mān ena ▁aññaṃ ▁byākar iṃsu
PA_pli-tv-bu-vb_pj4:2.2	Tesaṁ aparena samayena rāgāyapi cittaṁ namati dosāyapi cittaṁ namati mohāyapi cittaṁ namati.	▁tesaṃ ▁apar ena ▁samayena ▁rāg āya pi ▁cittaṃ ▁na mati ▁dos āya pi ▁cittaṃ ▁na mati ▁moh āya pi ▁cittaṃ ▁na mati
PA_pli-tv-bu-vb_pj4:2.3	Tesaṁ kukkuccaṁ ahosi—	▁tesaṃ ▁ kukku cc aṃ ▁ahosi
PA_pli-tv-bu-vb_pj4:2.4	“bhagavatā sikkhāpadaṁ paññattaṁ.	▁bhagavatā ▁sikkhāpadaṃ ▁paññattaṃ
