segmentnr	original	analyzed
PA_patthana_2.13:575.1_3	upanissāya rūpāvacaraṁ jhānaṁ …pe… abhiññaṁ …pe… samāpattiṁ uppādeti; narūpāvacarā	upanissāya rūpāvacaram jhānam pe abhiññam pe samāpattim uppādeti na rūpāvacarā 
PA_patthana_2.13:575.1_4	saddhā …pe… senāsanaṁ rūpāvacarāya saddhāya …pe… paññāya upanissayapaccayena paccayo,	saddhā pe senāsanam rūpāvacarāya saddhāya pe paññāya upanissaya paccayena paccayo 
PA_patthana_2.13:575.1_5	paṭhamassa jhānassa parikammaṁ paṭhamassa jhānassa upanissayapaccayena paccayo …pe…	paṭhamassa jhānassa parikammam paṭhamassa jhānassa upanissaya paccayena paccayaḥ pe 
PA_patthana_2.13:575.1_6	catutthassa jhānassa …pe… dibbassa cakkhussa parikammaṁ …pe… dibbāya sotadhātuyā	catutthassa jhānassa pe dibbassa cakkhussa parikammam pe dibbāya sotadhātuyā 
PA_patthana_2.13:575.1_7	…pe… iddhividhañāṇassa …pe… cetopariyañāṇassa …pe… pubbenivāsānussatiñāṇassa …pe…	pe iddhividha ñāṇassa pe cetas pariya ñāṇassa pe pubbenivāsa anussati ñāṇassa pe
PA_patthana_2.13:575.1_8	yathākammūpagañāṇassa …pe… anāgataṁsañāṇassa parikammaṁ anāgataṁsañāṇassa upanissayapaccayena paccayo.	yathākammūpaga ñāṇassa pe anāgata sañāṇassa parikammam anāgata sañāṇassa upanissaya paccayena paccayo 
PA_patthana_2.13:576.0	Purejātādi	purejāta ādi 
PA_patthana_2.13:576.1_0	Narūpāvacaro dhammo narūpāvacarassa dhammassa purejātapaccayena paccayo— ārammaṇapurejātaṁ,	na rūpāvacaraḥ dhammaḥ na rūpāvacarassa dhammassa purejāta paccayena paccayaḥ ārammaṇa purejāta 
PA_patthana_2.13:576.1_1	vatthupurejātaṁ. Ārammaṇapurejātaṁ—cakkhuṁ …pe… vatthuṁ aniccato …pe… domanassaṁ	vatthu purejāta ārammaṇa purejāta cakkhum pe vatthum aniccato pe domanassa 
PA_patthana_2.13:576.1_2	uppajjati, rūpāyatanaṁ cakkhuviññāṇassa …pe… phoṭṭhabbāyatanaṁ kāyaviññāṇassa purejātapaccayena	uppajjati rūpa āyatanam cakkhu viññāṇassa pe phoṭṭhabba āyatanam kāya viññāṇassa purejāta paccayena 
PA_patthana_2.13:576.1_3	paccayo. Vatthupurejātaṁ—cakkhāyatanaṁ cakkhuviññāṇassa …pe… kāyāyatanaṁ kāyaviññāṇassa	paccayaḥ vatthu purejāta cakkha āyatanam cakkhu viññāṇassa pe kāya āyatanam kāya viññāṇassa 
PA_patthana_2.13:576.1_4	purejātapaccayena paccayo; vatthu narūpāvacarānaṁ khandhānaṁ purejātapaccayena paccayo.	purejāta paccayena paccayaḥ vatthu na rūpāvacarānam khandhānam purejāta paccayena paccayaḥ 
PA_patthana_2.13:576.1_5	Narūpāvacaro dhammo rūpāvacarassa dhammassa purejātapaccayena paccayo—ārammaṇapurejātaṁ,	na rūpāvacaraḥ dhammaḥ rūpāvacarassa dhammassa purejāta paccayena paccayaḥ ārammaṇa purejāta 
PA_patthana_2.13:576.1_6	vatthupurejātaṁ. Ārammaṇapurejātaṁ—dibbena cakkhunā rūpaṁ passati, dibbāya sotadhātuyā	vatthu purejātaḥ ārammaṇa purejāta dibbena cakkhunā rūpam passati dibbāya sotadhātuyā 
PA_patthana_2.13:576.1_7	saddaṁ suṇāti. Vatthupurejātaṁ—vatthu rūpāvacarānaṁ khandhānaṁ purejātapaccayena paccayo.	saddam suṇāti vatthu purejāta vatthu rūpāvacarānam khandhānam purejāta paccayena paccayaḥ 
PA_patthana_2.13:577.1	Pacchājātapaccayena paccayo … dve … āsevanapaccayena paccayo … tīṇi.	pacchājāta paccayena paccayaḥ dve āsevana paccayena paccayaḥ tīṇi 
PA_patthana_2.13:578.0	Kammādi	kamma ādi 
PA_patthana_2.13:578.1_0	Rūpāvacaro dhammo rūpāvacarassa dhammassa kammapaccayena paccayo—sahajātā, nānākkhaṇikā.	rūpāvacaraḥ dhammaḥ rūpāvacarassa dhammassa kamma paccayena paccayo sahajātā nānākkhaṇikā 
PA_patthana_2.13:578.1_1	Sahajātā—rūpāvacarā cetanā sampayuttakānaṁ khandhānaṁ kammapaccayena paccayo; paṭisandhikkhaṇe	sahajāta arūpa avacarā cetanā sampayuttakānam khandhānam kamma paccayena paccayaḥ paṭisandhi khaṇe 
PA_patthana_2.13:578.1_2	…pe…. Nānākkhaṇikā—rūpāvacarā cetanā vipākānaṁ rūpāvacarānaṁ khandhānaṁ kammapaccayena	nānākkhaṇikā arūpāvacarā cetanā vipākānam rūpāvacarānam khandhānam kamma paccayena 
PA_patthana_2.13:578.1_3	paccayo. Rūpāvacaro dhammo narūpāvacarassa dhammassa kammapaccayena paccayo—sahajātā,	paccayaḥ rūpāvacaraḥ dhammaḥ na rūpāvacarassa dhammassa kamma paccayena paccayo sahajātā 
PA_patthana_2.13:578.1_4	nānākkhaṇikā. Sahajātā—rūpāvacarā cetanā cittasamuṭṭhānānaṁ rūpānaṁ kammapaccayena	nānā khaṇikā sahajātā arūpa avacarā cetanā citta samuṭṭhānānam rūpānam kamma paccayena 
PA_patthana_2.13:578.1_5	paccayo; paṭisandhikkhaṇe …pe…. Nānākkhaṇikā—rūpāvacarā cetanā kaṭattārūpānaṁ kammapaccayena	paccayo paṭisandhi kkhaṇe pe nānākkhaṇikā arūpāvacarā cetanā kaṭattā rūpānam kamma paccayena 
PA_patthana_2.13:578.1_6	paccayo. Rūpāvacaro dhammo rūpāvacarassa ca narūpāvacarassa ca dhammassa kammapaccayena	paccayaḥ rūpāvacaraḥ dhammaḥ rūpāvacarassa ca na rūpāvacarassa ca dhammassa kamma paccayena 
PA_patthana_2.13:578.1_7	paccayo— sahajātā, nānākkhaṇikā. Sahajātā—rūpāvacarā cetanā sampayuttakānaṁ khandhānaṁ	paccayaḥ sahajātā nānā kkhaṇikā sahajātā arūpa avacarā cetanā sampayuttakānam khandhānam 
PA_patthana_2.13:578.1_8	cittasamuṭṭhānānañca rūpānaṁ kammapaccayena paccayo; paṭisandhikkhaṇe …pe…. Nānākkhaṇikā—rūpāvacarā	citta samuṭṭhānānam ca rūpānam kamma paccayena paccayaḥ paṭisandhi khaṇe pe nānākkhaṇikā arūpāvacarā 
PA_patthana_2.13:578.1_9	cetanā vipākānaṁ rūpāvacarānaṁ khandhānaṁ kaṭattā ca rūpānaṁ kammapaccayena paccayo.	cetanā vipākānam rūpāvacarānam khandhānam kaṭattā ca rūpānam kamma paccayena paccayaḥ 
PA_patthana_2.13:579.1_0	Narūpāvacaro dhammo narūpāvacarassa dhammassa kammapaccayena paccayo— sahajātā, nānākkhaṇikā.	na rūpāvacaraḥ dhammaḥ na rūpāvacarassa dhammassa kamma paccayena paccayaḥ sahajātā nānākkhaṇikā 
PA_patthana_2.13:579.1_1	Sahajātā—narūpāvacarā cetanā sampayuttakānaṁ khandhānaṁ cittasamuṭṭhānānañca rūpānaṁ	sahajātā anarūpa avacarā cetanā sampayuttakānam khandhānam citta samuṭṭhānānañca rūpānaṃ 
PA_patthana_2.13:579.1_2	kammapaccayena paccayo; paṭisandhikkhaṇe …pe…. Nānākkhaṇikā—narūpāvacarā cetanā vipākānaṁ	kamma paccayena paccayo paṭisandhi khaṇe pe nānākkhaṇikā narūpāvacarā cetanā vipākāna 
PA_patthana_2.13:579.1_3	narūpāvacarānaṁ khandhānaṁ kaṭattā ca rūpānaṁ kammapaccayena paccayo ….	na rūpāvacarānam khandhānam kaṭattā ca rūpānam kamma paccayena paccayaḥ 
PA_patthana_2.13:580.1_0	Vipākapaccayena paccayo … cattāri … āhārapaccayena paccayo … cattāri … indriyapaccayena	vipāka paccayena paccayaḥ cattāri āhāra paccayena paccayaḥ cattāri indriya paccayena 
PA_patthana_2.13:580.1_1	paccayo … cattāri … jhānapaccayena paccayo … cattāri … maggapaccayena paccayo … cattāri	paccayaḥ cattāri jhāna paccayena paccayaḥ cattāri magga paccayena paccayaḥ cattāri 
PA_patthana_2.13:580.1_2	… sampayuttapaccayena paccayo … dve.	sampayutta paccayena paccayaḥ dve 
PA_patthana_2.13:581.0	Vippayutta	vippayutta 
PA_patthana_2.13:581.1	Rūpāvacaro dhammo narūpāvacarassa dhammassa vippayuttapaccayena paccayo— sahajātaṁ, pacchājātaṁ. (Saṅkhittaṁ.)	rūpāvacaraḥ dhammaḥ na rūpāvacarassa dhammassa vippayutta paccayena paccayaḥ sahajāta pacchājāta 
PA_patthana_2.13:582.1_0	Narūpāvacaro dhammo narūpāvacarassa dhammassa vippayuttapaccayena paccayo— sahajātaṁ,	na rūpāvacaraḥ dhammaḥ na rūpāvacarassa dhammassa vippayutta paccayena paccayaḥ sahajāta 
PA_patthana_2.13:582.1_1	purejātaṁ, pacchājātaṁ. (Saṅkhittaṁ.) Narūpāvacaro dhammo rūpāvacarassa dhammassa	purejāta pacchājāta saṅkhitta na rūpāvacaraḥ dhammaḥ rūpāvacarassa dhammassa 
PA_patthana_2.13:582.1_2	vippayuttapaccayena paccayo—sahajātaṁ, purejātaṁ. Sahajātaṁ—paṭisandhikkhaṇe vatthu	vippayutta paccayena paccayo sahajāta purejāta sahajāta paṭisandhi khaṇe vatthu 
PA_patthana_2.13:582.1_3	rūpāvacarānaṁ khandhānaṁ vippayuttapaccayena paccayo. Purejātaṁ—vatthu rūpāvacarānaṁ	rūpāvacarānam khandhānam vippayutta paccayena paccayaḥ purejāta vatthu 
PA_patthana_2.13:582.1_4	khandhānaṁ vippayuttapaccayena paccayo.	khandhānam vippayutta paccayena paccayaḥ 
PA_patthana_2.13:583.0	Atthyādi	atthi ādi 
PA_patthana_2.13:583.1_0	Rūpāvacaro dhammo rūpāvacarassa dhammassa atthipaccayena paccayo. (Paṭiccasadisaṁ.)	rūpāvacaraḥ dhammaḥ rūpāvacarassa dhammassa atthi paccayena paccayo paṭicca sadisa 
PA_patthana_2.13:583.1_1	Rūpāvacaro dhammo narūpāvacarassa dhammassa atthipaccayena paccayo—sahajātaṁ, purejātaṁ,	rūpāvacaraḥ dhammaḥ na rūpāvacarassa dhammassa atthi paccayena paccayo sahajāta purejāta 
PA_patthana_2.13:583.1_2	pacchājātaṁ. Rūpāvacaro dhammo rūpāvacarassa ca narūpāvacarassa ca dhammassa atthipaccayena	pacchājāta rūpāvacaraḥ dhammaḥ rūpāvacarassa ca na rūpāvacarassa ca dhammassa atthi paccayena 
PA_patthana_2.13:583.1_3	paccayo. (Paṭiccasadisaṁ.)	paccayaḥ paṭicca sadisa 
PA_patthana_2.13:584.1_0	Narūpāvacaro dhammo narūpāvacarassa dhammassa atthipaccayena paccayo— sahajātaṁ,	na rūpāvacaraḥ dhammaḥ na rūpāvacarassa dhammassa atthi paccayena paccayo sahajāta 
PA_patthana_2.13:584.1_1	purejātaṁ, pacchājātaṁ, āhāraṁ, indriyaṁ. (Saṅkhittaṁ.) Narūpāvacaro dhammo rūpāvacarassa	purejāta pacchājāta āhāraḥ indriya na rūpāvacaraḥ dhammaḥ rūpāvacarassa 
PA_patthana_2.13:584.1_2	dhammassa atthipaccayena paccayo—sahajātaṁ, purejātaṁ. Sahajātaṁ—paṭisandhikkhaṇe	dhammassa atthi paccayena paccayo sahajāta purejāta sahajāta paṭisandhi khaṇe 
PA_patthana_2.13:584.1_3	vatthu rūpāvacarānaṁ khandhānaṁ atthipaccayena paccayo. Purejātaṁ—dibbena cakkhunā	vatthu rūpāvacarānaṃ khandhānaṃ atthi paccayena paccayaḥ purejāta dibbena cakkhunā 
PA_patthana_2.13:584.1_4	rūpaṁ passati, dibbāya sotadhātuyā saddaṁ suṇāti, vatthu rūpāvacarānaṁ khandhānaṁ	rūpam passati dibbāya sotadhātuyā saddam suṇāti vatthu rūpāvacarānam khandhānam 
PA_patthana_2.13:584.1_5	atthipaccayena paccayo.	atthi paccayena paccayaḥ 
PA_patthana_2.13:585.1_0	Rūpāvacaro ca narūpāvacaro ca dhammā rūpāvacarassa dhammassa atthipaccayena paccayo—sahajātaṁ,	rūpāvacaro ca na rūpāvacaro ca dhammā rūpāvacarassa dhammassa atthi paccayena paccayo sahajāta 
PA_patthana_2.13:585.1_1	purejātaṁ. Sahajāto—rūpāvacaro eko khandho ca vatthu ca tiṇṇannaṁ khandhānaṁ atthipaccayena	purejāta sahajāta ūrūpa avacaraḥ ekaḥ khandho ca vatthu ca tiṇṇannam khandhānaṃ atthi paccayena 
PA_patthana_2.13:585.1_2	paccayo …pe… dve khandhā ca …pe… paṭisandhikkhaṇe …pe…. Rūpāvacaro ca narūpāvacaro	paccayaḥ pe dve khandhā ca pe paṭisandhi kkhaṇe pe rūpāvacaro ca na rūpāvacaro 
PA_patthana_2.13:585.1_3	ca dhammā narūpāvacarassa dhammassa atthipaccayena paccayo— sahajātaṁ, pacchājātaṁ,	ca dhammā na rūpāvacarassa dhammassa atthi paccayena paccayo sahajāta pacchājāta 
PA_patthana_2.13:585.1_4	āhāraṁ, indriyaṁ. Sahajātā—rūpāvacarā khandhā ca mahābhūtā ca cittasamuṭṭhānānaṁ	āhāra indriya sahajāta arūpa avacarā khandhā ca mahābhūtā ca 
PA_patthana_2.13:585.1_5	rūpānaṁ atthipaccayena paccayo; paṭisandhikkhaṇe …pe…. Pacchājātā—rūpāvacarā khandhā	rūpānaṃ atthi paccayena paccayo paṭisandhi kkhaṇe pe pacchājātā arūpāvacarā khandhā 
PA_patthana_2.13:585.1_6	ca kabaḷīkāro āhāro ca purejātassa imassa kāyassa atthipaccayena paccayo. Pacchājātā—rūpāvacarā	ca kabaḷīkāro āhāro ca purejātassa imassa kāyassa atthi paccayena paccayo pacchājātā rūpāvacarā 
PA_patthana_2.13:585.1_7	khandhā ca rūpajīvitindriyañca kaṭattārūpānaṁ atthipaccayena paccayo.	khandhā ca rūpa jīvita indriyam ca kaṭattā rūpānaṃ atthi paccayena paccayaḥ 
PA_patthana_2.13:586.1	Natthipaccayena paccayo … vigatapaccayena paccayo … avigatapaccayena paccayo.	natthi paccayena paccayaḥ vigata paccayena paccayaḥ avigata paccayena paccayaḥ 
PA_patthana_2.13:587.0.1	Saṅkhyāvāra	saṅkhyāvāra 
PA_patthana_2.13:587.0.2	Suddha	suddha 
PA_patthana_2.13:587.1_0	Hetuyā cattāri, ārammaṇe cattāri, adhipatiyā cattāri, anantare cattāri, samanantare	hetuyā cattāri ārammaṇe cattāri adhipatiyā cattāri anantare cattāri samanantare 
PA_patthana_2.13:587.1_1	cattāri, sahajāte satta, aññamaññe cha, nissaye satta, upanissaye cattāri, purejāte	cattāri sahajāte satta aññamaññe cha nissaye satta upanissaye cattāri purejāte 
PA_patthana_2.13:587.1_2	dve, pacchājāte dve, āsevane tīṇi, kamme cattāri, vipāke cattāri, āhāre cattāri,	dve pacchājāte dve āsevane tīṇi kamme cattāri vipāke cattāri āhāre cattāri 
PA_patthana_2.13:587.1_3	indriye cattāri, jhāne cattāri, magge cattāri, sampayutte dve, vippayutte tīṇi, atthiyā	indriye cattāri jhāne cattāri magge cattāri sampayutte dve vippayutte tīṇi atthiyā 
PA_patthana_2.13:587.1_4	satta, natthiyā cattāri, vigate cattāri, avigate satta.	satta natthiyā cattāri vigate cattāri avigate satta 
PA_patthana_2.13:588.0	Paccanīyuddhāra	paccanīya uddhāra 
PA_patthana_2.13:588.1_0	Rūpāvacaro dhammo rūpāvacarassa dhammassa ārammaṇapaccayena paccayo … sahajātapaccayena	rūpāvacaraḥ dhammaḥ rūpāvacarassa dhammassa ārammaṇa paccayena paccayaḥ sahajāta paccayena 
PA_patthana_2.13:588.1_1	paccayo … upanissayapaccayena paccayo … kammapaccayena paccayo. Rūpāvacaro dhammo	paccayaḥ upanissaya paccayena paccayaḥ kamma paccayena paccayaḥ rūpāvacaraḥ dhammo 
PA_patthana_2.13:588.1_2	narūpāvacarassa dhammassa ārammaṇapaccayena paccayo … sahajātapaccayena paccayo …	na rūpāvacarassa dhammassa ārammaṇa paccayena paccayaḥ sahajāta paccayena paccayaḥ 
PA_patthana_2.13:588.1_3	upanissayapaccayena paccayo … pacchājātapaccayena paccayo … kammapaccayena paccayo.	upanissaya paccayena paccayaḥ pacchājāta paccayena paccayaḥ kamma paccayena paccayaḥ 
PA_patthana_2.13:588.1_4	Rūpāvacaro dhammo rūpāvacarassa ca narūpāvacarassa ca dhammassa sahajātapaccayena	rūpāvacaraḥ dhammaḥ rūpāvacarassa ca na rūpāvacarassa ca dhammassa sahajāta paccayena 
PA_patthana_2.13:588.1_5	paccayo … kammapaccayena paccayo.	paccayaḥ kamma paccayena paccayaḥ 
PA_patthana_2.13:589.1_0	Narūpāvacaro dhammo narūpāvacarassa dhammassa ārammaṇapaccayena paccayo … sahajātapaccayena	na rūpāvacaraḥ dhammaḥ na rūpāvacarassa dhammassa ārammaṇa paccayena paccayaḥ sahajāta paccayena 
PA_patthana_2.13:589.1_1	paccayo … upanissayapaccayena paccayo … purejātapaccayena paccayo … pacchājātapaccayena	paccayo upanissaya paccayena paccayo purejāta paccayena paccayo pacchājāta paccayena 
PA_patthana_2.13:589.1_2	paccayo … kammapaccayena paccayo … āhārapaccayena paccayo … indriyapaccayena paccayo.	paccayaḥ kamma paccayena paccayaḥ āhāra paccayena paccayaḥ indriya paccayena paccayaḥ 
PA_patthana_2.13:589.1_3	Narūpāvacaro dhammo rūpāvacarassa dhammassa ārammaṇapaccayena paccayo … sahajātapaccayena	na rūpāvacaraḥ dhammaḥ rūpāvacarassa dhammassa ārammaṇa paccayena paccayaḥ sahajāta paccayena 
PA_patthana_2.13:589.1_4	paccayo … upanissayapaccayena paccayo … purejātapaccayena paccayo.	paccayaḥ upanissaya paccayena paccayaḥ purejāta paccayena paccayaḥ 
PA_patthana_2.13:590.1_0	Rūpāvacaro ca narūpāvacaro ca dhammā rūpāvacarassa dhammassa sahajātaṁ, purejātaṁ.	rūpāvacaro ca na rūpāvacaro ca dhammā rūpāvacarassa dhammassa sahajāta purejāta 
PA_patthana_2.13:590.1_1	Rūpāvacaro ca narūpāvacaro ca dhammā narūpāvacarassa dhammassa sahajātaṁ, pacchājātaṁ, āhāraṁ, indriyaṁ.	rūpāvacaro ca na rūpāvacaro ca dhammā na rūpāvacarassa dhammassa sahajāta pacchājāta āhāra indriya 
PA_patthana_2.13:591.0.1	2.13.12.7.2. Paccayapaccanīya	paccaya paccanīya 
PA_patthana_2.13:591.0.2	Saṅkhyāvāra	saṅkhyāvāra 
PA_patthana_2.13:591.0.3	Suddha	suddha 
PA_patthana_2.13:591.1_0	Nahetuyā satta, naārammaṇe satta, naadhipatiyā satta, naanantare satta, nasamanantare	na hetuyā satta na ārammaṇe satta na adhipatiyā satta na anantare satta na samanantare 
PA_patthana_2.13:591.1_1	satta, nasahajāte cha, naaññamaññe cha, nanissaye cha, naupanissaye satta, napurejāte	satta na sahajāte cha na aññamaññe cha na nissaye cha na upanissaye satta na purejāte 
PA_patthana_2.13:591.1_2	satta, napacchājāte satta …pe… nasampayutte cha, navippayutte pañca, noatthiyā pañca,	satta na pacchājāte satta pe na sampayutte cha na vippayutte pañca no atthiyā pañca 
PA_patthana_2.13:591.1_3	nonatthiyā satta, novigate satta, noavigate pañca.	nonatthiyā satta no vigate satta no avigate pañca 
PA_patthana_2.13:592.0	2.13.12.7.3. Paccayānulomapaccanīya	paccaya anuloma paccanīya 
PA_patthana_2.13:592.1_0	Hetupaccayā naārammaṇe cattāri, naadhipatiyā cattāri, naanantare nasamanantare cattāri,	hetu paccayāḥ na ārammaṇe cattāri na adhipatiyā cattāri na anantare na samanantare cattāri 
PA_patthana_2.13:592.1_1	naaññamaññe dve, naupanissaye cattāri …pe… nasampayutte dve, navippayutte dve, nonatthiyā	na aññamaññe dve na upanissaye cattāri pe na sampayutte dve na vippayutte dve no natthiyā 
PA_patthana_2.13:592.1_2	cattāri, novigate cattāri.	cattāri no vigate cattāri 
PA_patthana_2.13:593.0	2.13.12.7.4. Paccayapaccanīyānuloma	paccaya paccanīya anuloma 
PA_patthana_2.13:593.1	Nahetupaccayā ārammaṇe cattāri, adhipatiyā cattāri (anulomamātikā kātabbā) …pe… avigate satta.	na hetu paccayā ārammaṇe cattāri adhipatiyā cattāri anuloma mātikā kātabbā pe avigate satta 
PA_patthana_2.13:594.1	Rūpāvacaradukaṁ niṭṭhitaṁ.	rūpāvacara dukam niṭṭhita 
PA_patthana_2.13:595.0.1	2.13.13. Arūpāvacaraduka	a rūpa avacara duka 
PA_patthana_2.13:595.0.2	2.13.13.1. Paṭiccavāra	paṭiccavāra 
PA_patthana_2.13:595.0.3	2.13.13.1.1. Paccayānuloma	paccaya anuloma 
PA_patthana_2.13:595.0.4	Vibhaṅgavāra	vibhaṅgavāra 
PA_patthana_2.13:595.0.5	Hetu	hetu 
PA_patthana_2.13:595.1_0	Arūpāvacaraṁ dhammaṁ paṭicca arūpāvacaro dhammo uppajjati hetupaccayā— arūpāvacaraṁ	arūpāvacaram dhammam paṭicca arūpāvacaraḥ dhammo uppajjati hetu paccayā arūpāvacara 
PA_patthana_2.13:595.1_1	ekaṁ khandhaṁ paṭicca tayo khandhā …pe… dve khandhe …pe… paṭisandhikkhaṇe …pe…. Arūpāvacaraṁ	ekam khandham paṭicca tayaḥ khandhāḥ pe dve khandhe pe paṭisandhi khaṇe pe arūpāvacara 
PA_patthana_2.13:595.1_2	dhammaṁ paṭicca naarūpāvacaro dhammo uppajjati hetupaccayā—arūpāvacare khandhe paṭicca	dhammam paṭicca na arūpāvacaraḥ dhammaḥ uppajjati hetu paccayā arūpāvacare khandhe paṭicca 
PA_patthana_2.13:595.1_3	cittasamuṭṭhānaṁ rūpaṁ. Arūpāvacaraṁ dhammaṁ paṭicca arūpāvacaro ca naarūpāvacaro	citta samuṭṭhānam rūpa arūpāvacaram dhammam paṭicca arūpāvacaraḥ ca na arūpāvacaraḥ 
PA_patthana_2.13:595.1_4	ca dhammā uppajjanti hetupaccayā—arūpāvacaraṁ ekaṁ khandhaṁ paṭicca tayo khandhā	ca dhammā uppajjanti hetu paccayā arūpāvacaram ekam khandham paṭicca tayo khandhā 
PA_patthana_2.13:595.1_5	cittasamuṭṭhānañca rūpaṁ …pe… dve khandhe …pe….	citta samuṭṭhānam ca rūpam pe dve khandhe pe 
PA_patthana_2.13:596.1_0	Naarūpāvacaraṁ dhammaṁ paṭicca naarūpāvacaro dhammo uppajjati hetupaccayā— naarūpāvacaraṁ	na arūpāvacaram dhammam paṭicca na arūpāvacaraḥ dhammo uppajjati hetu paccayā na arūpāvacara 
PA_patthana_2.13:596.1_1	ekaṁ khandhaṁ paṭicca tayo khandhā cittasamuṭṭhānañca rūpaṁ …pe… dve khandhe …pe…	ekam khandham paṭicca tayaḥ khandhāḥ citta samuṭṭhānañca rūpam pe dve khandhe pe 
PA_patthana_2.13:596.1_2	paṭisandhikkhaṇe naarūpāvacaraṁ ekaṁ khandhaṁ paṭicca tayo khandhā kaṭattā ca rūpaṁ	paṭisandhi kkhaṇe na arūpa avacaram ekam khandham paṭicca tayo khandhā kaṭattā ca rūpa 
PA_patthana_2.13:596.1_3	…pe… dve khandhe …pe… khandhe paṭicca vatthu, vatthuṁ paṭicca khandhā, ekaṁ mahābhūtaṁ …pe….	pe dve khandhe pe khandhe paṭicca vatthu vatthum paṭicca khandhāḥ ekam mahābhūtam pe 
PA_patthana_2.13:597.1	Arūpāvacarañca naarūpāvacarañca dhammaṁ paṭicca naarūpāvacaro dhammo uppajjati hetupaccayā—arūpāvacare khandhe ca mahābhūte ca paṭicca cittasamuṭṭhānaṁ rūpaṁ. (Saṅkhittaṁ.)	arūpāvacaram ca na arūpāvacaram ca dhammam paṭicca na arūpāvacaraḥ dhammaḥ uppajjati hetu paccayā arūpāvacare khandhe ca mahābhūte ca paṭicca citta samuṭṭhānam rūpa 
PA_patthana_2.13:598.0.1	Saṅkhyāvāra	saṅkhyāvāra 
PA_patthana_2.13:598.0.2	Suddha	suddha 
PA_patthana_2.13:598.1_0	Hetuyā pañca, ārammaṇe dve, adhipatiyā pañca, anantare dve, samanantare dve, sahajāte	hetuyā pañca ārammaṇe dve adhipatiyā pañca anantare dve samanantare dve sahajāte 
PA_patthana_2.13:598.1_1	pañca, aññamaññe dve, nissaye pañca, upanissaye dve, purejāte dve, āsevane dve, kamme	pañca aññamaññe dve nissaye pañca upanissaye dve purejāte dve āsevane dve kamme 
PA_patthana_2.13:598.1_2	pañca, vipāke dve, āhāre pañca …pe… avigate pañca.	pañca vipāke dve āhāre pañca pe avigate pañca 
PA_patthana_2.13:599.0.1	2.13.13.1.2. Paccayapaccanīya	paccaya paccanīya 
PA_patthana_2.13:599.0.2	Vibhaṅgavāra	vibhaṅgavāra 
PA_patthana_2.13:599.0.3	Nahetu-naārammaṇa	na hetuna ārammaṇa 
PA_patthana_2.13:599.1_0	Naarūpāvacaraṁ dhammaṁ paṭicca naarūpāvacaro dhammo uppajjati nahetupaccayā— ahetukaṁ	na arūpāvacaram dhammam paṭicca na arūpāvacaraḥ dhammo uppajjati na hetu paccayā ahetuka 
PA_patthana_2.13:599.1_1	naarūpāvacaraṁ ekaṁ khandhaṁ paṭicca tayo khandhā cittasamuṭṭhānañca rūpaṁ …pe… dve	na arūpāvacaram ekam khandham paṭicca tayo khandhāḥ citta samuṭṭhānañca rūpam pe dve 
PA_patthana_2.13:599.1_2	khandhe …pe… ahetukapaṭisandhikkhaṇe …pe… (yāva asaññasattā) vicikicchāsahagate uddhaccasahagate	khandhe pe ahetuka paṭisandhi kkhaṇe pe yāva asaññasattā vicikicchā sahagate uddhacca sahagate 
PA_patthana_2.13:599.1_3	khandhe paṭicca vicikicchāsahagato uddhaccasahagato moho. Naārammaṇapaccayā … tīṇi.	khandhe paṭicca vicikicchā sahagataḥ uddhacca sahagataḥ mohaḥ na ārammaṇa paccayā tīṇi 
PA_patthana_2.13:600.0	Naadhipatyādi	na adhipati ādi 
PA_patthana_2.13:600.1_0	Arūpāvacaraṁ dhammaṁ paṭicca arūpāvacaro dhammo uppajjati naadhipatipaccayā— arūpāvacare	arūpāvacaram dhammam paṭicca arūpāvacaraḥ dhammo uppajjati na adhipati paccayā arūpāvacare 
PA_patthana_2.13:600.1_1	khandhe paṭicca arūpāvacarādhipati, vipākaṁ arūpāvacaraṁ ekaṁ khandhaṁ paṭicca tayo	khandhe paṭicca arūpāvacara adhipati vipākam arūpāvacaram ekam khandham paṭicca tayo 
PA_patthana_2.13:600.1_2	khandhā …pe… dve khandhe …pe… paṭisandhikkhaṇe …pe….	khandhā pe dve khandhe pe paṭisandhikkhaṇe pe 
PA_patthana_2.13:601.1_0	Naarūpāvacaraṁ dhammaṁ paṭicca naarūpāvacaro dhammo uppajjati naadhipatipaccayā—naarūpāvacaraṁ	na arūpāvacaram dhammam paṭicca na arūpāvacaraḥ dhammo uppajjati na adhipati paccayā na arūpāvacara 
PA_patthana_2.13:601.1_1	ekaṁ khandhaṁ paṭicca tayo khandhā cittasamuṭṭhānañca rūpaṁ …pe… dve khandhe …pe…	ekam khandham paṭicca tayaḥ khandhāḥ citta samuṭṭhānañca rūpam pe dve khandhe pe 
PA_patthana_2.13:601.1_2	paṭisandhikkhaṇe …pe…. (Yāva asaññasattā.) Naanantarapaccayā …pe… naupanissayapaccayā.	paṭisandhi kkhaṇe pe yāva asaññasattā na anantara paccayā pe na upanissaya paccayā 
PA_patthana_2.13:602.0	Napurejātādi	napurejāta ādi 
PA_patthana_2.13:602.1_0	Arūpāvacaraṁ dhammaṁ paṭicca arūpāvacaro dhammo uppajjati napurejātapaccayā— arūpe	arūpāvacaram dhammam paṭicca arūpāvacaraḥ dhammo uppajjati na purejāta paccayā arūpe 
PA_patthana_2.13:602.1_1	arūpāvacaraṁ ekaṁ khandhaṁ paṭicca tayo khandhā …pe… dve khandhe …pe…. (Mūlaṁ kātabbaṁ.)	arūpāvacaram ekam khandham paṭicca tayaḥ khandhāḥ pe dve khandhe pe mūlam kātabba 
PA_patthana_2.13:602.1_2	Arūpāvacare khandhe paṭicca cittasamuṭṭhānaṁ rūpaṁ.	arūpāvacare khandhe paṭicca citta samuṭṭhānam rūpa 
PA_patthana_2.13:603.1_0	Naarūpāvacaraṁ dhammaṁ paṭicca naarūpāvacaro dhammo uppajjati napurejātapaccayā—arūpe	na arūpāvacaram dhammam paṭicca na arūpāvacaraḥ dhammo uppajjati na purejāta paccayā arūpe 
PA_patthana_2.13:603.1_1	naarūpāvacaraṁ ekaṁ khandhaṁ paṭicca tayo khandhā …pe… dve khandhe …pe… paṭisandhikkhaṇe	na arūpāvacaram ekam khandham paṭicca tayaḥ khandhāḥ pe dve khandhe pe paṭisandhi kkhaṇe 
PA_patthana_2.13:603.1_2	…pe…. (Yāva asaññasattā.)	pe yāva asaññasattā 
