segmentnr	original	analyzed
PA_patthana_21.25:0.1	Paṭṭhānapakaraṇa	paṭṭhāna pakaraṇa 
PA_patthana_21.25:0.2	Dhammapaccanīyānuloma (4), Dukatikapaṭṭhānapāḷi (3)	dhamma paccanīya anuloma duka tika paṭṭhāna pāḷi 
PA_patthana_21.25:0.3	21.25. Hetuduka, Ācayagāmittika	hetu dukaḥ ācaya gāmittika 
PA_patthana_21.25:1.1	Nahetuṁ naācayagāmiṁ dhammaṁ paccayā hetu ācayagāmī dhammo uppajjati hetupaccayā. (Saṅkhittaṁ.) Hetuyā tīṇi …pe… avigate tīṇi.	na hetum na ācaya gāmim dhammam paccayā hetu ācaya gāmī dhammo uppajjati hetu paccayā saṅkhitta hetuyā tīṇi pe avigate tīṇi 
PA_patthana_21.25:2.1	Nahetuṁ naapacayagāmiṁ dhammaṁ paccayā hetu apacayagāmī dhammo uppajjati hetupaccayā. (Saṅkhittaṁ.) Hetuyā tīṇi …pe… avigate tīṇi.	na hetum na apacaya gāmim dhammam paccayā hetu apacaya gāmī dhammo uppajjati hetu paccayā saṅkhitta hetuyā tīṇi pe avigate tīṇi 
PA_patthana_21.25:3.1_0	Nahetuṁ nanevācayagāmināpacayagāmiṁ dhammaṁ paṭicca nahetu nevācayagāmināpacayagāmī	na hetum na neva ācayagāmi na apacayagāmim dhammam paṭicca na hetu neva ācayagāmi na apacayagāmī 
PA_patthana_21.25:3.1_1	dhammo uppajjati hetupaccayā. Nanahetuṁ nanevācayagāmināpacayagāmiṁ dhammaṁ paṭicca	dhammaḥ uppajjati hetu paccayā na na hetum nana iva ācaya gāminā apacaya gāmim dhammam paṭicca 
PA_patthana_21.25:3.1_2	nahetu nevācayagāmināpacayagāmī dhammo uppajjati hetupaccayā. (Saṅkhittaṁ.) Hetuyā	na hetu na iva ācaya gāmi na apacaya gāmī dhammo uppajjati hetu paccayā saṅkhitta hetuyā 
PA_patthana_21.25:3.1_3	tīṇi, adhipatiyā tīṇi …pe… avigate tīṇi.	tīṇi adhipatiyā tīṇi pe avigate tīṇi 
