segmentnr	original	analyzed
PA_patthana_15.24:0.1	Paṭṭhānapakaraṇa	paṭṭhāna pakaraṇa 
PA_patthana_15.24:0.2	Dhammānulomapaccanīya (3), Dukatikapaṭṭhānapāḷi (3)	dhamma anuloma paccanīya 
PA_patthana_15.24:0.3	15.24. Hetusampayuttaduka, Kusalattika	hetu sampayutta duka kusala ttika 
PA_patthana_15.24:1.1	Hetusampayuttaṁ kusalaṁ dhammaṁ paṭicca nahetusampayutto nakusalo dhammo uppajjati hetupaccayā. Hetuyā ekaṁ …pe… avigate ekaṁ.	hetu sampayuttam kusalam dhammam paṭicca na hetu sampayuttaḥ na kusalaḥ dhammaḥ uppajjati hetu paccayā hetuyā ekam pe avigate eka 
PA_patthana_15.24:2.1	Hetusampayuttaṁ akusalaṁ dhammaṁ paṭicca nahetusampayutto naakusalo dhammo uppajjati hetupaccayā …. Hetuyā tīṇi, adhipatiyā ekaṁ …pe… avigate tīṇi.	hetu sampayuttam akusalam dhammam paṭicca na hetu sampayuttaḥ na akusalaḥ dhammaḥ uppajjati hetu paccayā hetuyā tīṇi adhipatiyā ekam pe avigate tīṇi 
PA_patthana_15.24:3.1	Hetuvippayuttaṁ abyākataṁ dhammaṁ paccayā nahetuvippayutto naabyākato dhammo uppajjati hetupaccayā. Hetuyā ekaṁ, ārammaṇe tīṇi, adhipatiyā ekaṁ …pe… avigate tīṇi.	hetu vippayuttam abyākatam dhammam paccayā na hetu vippayuttaḥ na abyākataḥ dhammaḥ uppajjati hetu paccayā hetuyā eka ārammaṇe tīṇi adhipatiyā ekam pe avigate tīṇi 
