segmentnr	original	analyzed
PA_patthana_21.40:0.1	Paṭṭhānapakaraṇa	paṭṭhāna pakaraṇa 
PA_patthana_21.40:0.2	Dhammapaccanīyānuloma (4), Dukatikapaṭṭhānapāḷi (3)	dhamma paccanīya anuloma duka tika paṭṭhāna pāḷi 
PA_patthana_21.40:0.3	21.40. Sappaccayadukādi, Sanidassanattika	sat paccaya duka ādi sa ni dassana ttika 
PA_patthana_21.40:1.1	Naappaccayaṁ nasanidassanasappaṭighaṁ dhammaṁ paṭicca sappaccayo sanidassanasappaṭigho dhammo uppajjati hetupaccayā. (Saṅkhittaṁ.) Hetuyā ekaṁ, adhipatiyā ekaṁ …pe… avigate ekaṁ.	na appaccayam na sanidassana sappaṭigham dhammam paṭicca sappaccayaḥ sanidassana sappaṭighaḥ dhammaḥ uppajjati hetu paccayā saṅkhitta hetuyā eka adhipatiyā ekam pe avigate eka 
PA_patthana_21.40:2.1	Naappaccayaṁ naanidassanasappaṭighaṁ dhammaṁ paṭicca sappaccayo anidassanasappaṭigho dhammo uppajjati hetupaccayā. (Saṅkhittaṁ.) Hetuyā ekaṁ, adhipatiyā ekaṁ …pe… avigate ekaṁ.	na appaccayam na anidassana sappaṭigham dhammam paṭicca sa paccayaḥ anidassana sappaṭighaḥ dhammaḥ uppajjati hetu paccayā saṅkhitta hetuyā eka adhipatiyā ekam pe avigate eka 
PA_patthana_21.40:3.1	(Naappaccayanaanidassanaappaṭighamūlepi ekameva.) Hetuyā ekaṁ, adhipatiyā ekaṁ …pe… avigate ekaṁ.	ekam eva hetuyā adhipatiyā ekam pe avigate eka 
PA_patthana_21.40:4.1	(Nasaṅkhataṁ nasappaccayasadisaṁ.)	na saṅkhatam na sap paccaya sadisa 
