segmentnr	original	analyzed
PA_patthana_15.89:0.1	Paṭṭhānapakaraṇa	▁ paṭṭhānapakaraṇa
PA_patthana_15.89:0.2	Dhammānulomapaccanīya (3), Dukatikapaṭṭhānapāḷi (3)	▁dhammā nulomapaccanīya ▁duk ati k apaṭṭhānapāḷi
PA_patthana_15.89:0.3	15.89. Saraṇaduka, Ajjhattārammaṇattika	▁saraṇ aduk a ▁ ajjhatt ārammaṇ attika
PA_patthana_15.89:1.1_0	Saraṇaṁ ajjhattārammaṇaṁ dhammaṁ paṭicca nasaraṇo naajjhattārammaṇo dhammo uppajjati	▁saraṇ aṃ ▁ ajjhatt ārammaṇaṃ ▁dhammaṃ ▁paṭicca ▁n asaraṇ o ▁na ajjhatt ārammaṇ o ▁dhammo ▁uppajjati
PA_patthana_15.89:1.1_1	hetupaccayā. Araṇaṁ ajjhattārammaṇaṁ dhammaṁ paṭicca nasaraṇo naajjhattārammaṇo dhammo	▁hetupaccayā ▁araṇ aṃ ▁ ajjhatt ārammaṇaṃ ▁dhammaṃ ▁paṭicca ▁n asaraṇ o ▁na ajjhatt ārammaṇ o ▁dhammo
PA_patthana_15.89:1.1_2	uppajjati hetupaccayā. Hetuyā dve, aññamaññe ekaṁ …pe… vipāke ekaṁ …pe… avigate dve.	▁uppajjati ▁hetupaccayā ▁hetuyā ▁dve ▁aññamaññ e ▁ekaṃ ▁pe ▁vipāk e ▁ekaṃ ▁pe ▁avigate ▁dve
PA_patthana_15.89:2.1_0	Saraṇaṁ bahiddhārammaṇaṁ dhammaṁ paṭicca nasaraṇo nabahiddhārammaṇo dhammo uppajjati	▁saraṇ aṃ ▁bahi ddh ārammaṇaṃ ▁dhammaṃ ▁paṭicca ▁n asaraṇ o ▁na b a hi ddh ārammaṇ o ▁dhammo ▁uppajjati
PA_patthana_15.89:2.1_1	hetupaccayā. Araṇaṁ bahiddhārammaṇaṁ dhammaṁ paṭicca nasaraṇo nabahiddhārammaṇo dhammo	▁hetupaccayā ▁araṇ aṃ ▁bahi ddh ārammaṇaṃ ▁dhammaṃ ▁paṭicca ▁n asaraṇ o ▁na b a hi ddh ārammaṇ o ▁dhammo
PA_patthana_15.89:2.1_2	uppajjati hetupaccayā. Hetuyā dve, aññamaññe ekaṁ …pe… vipāke ekaṁ …pe… avigate dve.	▁uppajjati ▁hetupaccayā ▁hetuyā ▁dve ▁aññamaññ e ▁ekaṃ ▁pe ▁vipāk e ▁ekaṃ ▁pe ▁avigate ▁dve
