segmentnr	original	analyzed
PA_patthana_13.21:0.1	Paṭṭhānapakaraṇa	paṭṭhāna pakaraṇa 
PA_patthana_13.21:0.2	Dhammānulomapaccanīya (3), Tikapaṭṭhānapāḷi (1)	dhamma anuloma paccanīya tika paṭṭhāna pāḷi 
PA_patthana_13.21:0.3	13.21. Ajjhattārammaṇattika	      
PA_patthana_13.21:1.1	Ajjhattārammaṇaṁ dhammaṁ paṭicca naajjhattārammaṇo dhammo uppajjati hetupaccayā.	ajjhatta ārammaṇam dhammam paṭicca na ajjhatta ārammaṇaḥ dhammo uppajjati hetu paccayā 
PA_patthana_13.21:2.1	Hetuyā cha, ārammaṇe dve …pe… avigate cha.	hetuyā cha ārammaṇe dve pe avigate cha 
