segmentnr	original	analyzed
PA_patthana_2.13:0.1	Paṭṭhānapakaraṇa	paṭṭhāna pakaraṇa 
PA_patthana_2.13:0.2	Dhammānuloma (1), Dukapaṭṭhānapāḷi (2)	dhamma anuloma 
PA_patthana_2.13:0.3	2.13. Piṭṭhiduka	piṭṭhiduka 
PA_patthana_2.13:1.0.1	Vibhaṅgavāra	vibhaṅgavāra 
PA_patthana_2.13:1.0.2	Hetu	hetu 
PA_patthana_2.13:1.1	Dassanena pahātabbaṁ dhammaṁ paṭicca dassanena pahātabbo dhammo uppajjati hetupaccayā—dassanena pahātabbaṁ ekaṁ khandhaṁ paṭicca tayo khandhā …pe… dve khandhe …pe….	dassanena pahātabbam dhammam paṭicca dassanena pahātabbaḥ dhammaḥ uppajjati hetu paccayā dassanena pahātabbam ekam khandham paṭicca tayaḥ khandhāḥ pe dve khandhe pe 
PA_patthana_2.13:2.1	Dassanena pahātabbaṁ dhammaṁ paṭicca nadassanena pahātabbo dhammo uppajjati hetupaccayā—dassanena pahātabbe khandhe paṭicca cittasamuṭṭhānaṁ rūpaṁ.	dassanena pahātabbam dhammam paṭicca na dassanena pahātabbaḥ dhammaḥ uppajjati hetu paccayā dassanena pahātabbe khandhe paṭicca citta samuṭṭhānam rūpa 
PA_patthana_2.13:3.1_0	Dassanena pahātabbaṁ dhammaṁ paṭicca dassanena pahātabbo ca nadassanena pahātabbo	dassanena pahātabbam dhammam paṭicca dassanena pahātabbaḥ ca na dassanena pahātabbaḥ 
PA_patthana_2.13:3.1_1	ca dhammā uppajjanti hetupaccayā—dassanena pahātabbaṁ ekaṁ khandhaṁ paṭicca tayo	ca dhammā uppajjanti hetu paccayā dassanena pahātabbam ekam khandham paṭicca tayo 
PA_patthana_2.13:3.1_2	khandhā cittasamuṭṭhānañca …pe… dve khandhe …pe….	khandhā citta samuṭṭhānañca pe dve khandhe pe 
PA_patthana_2.13:4.1_0	Nadassanena pahātabbaṁ dhammaṁ paṭicca nadassanena pahātabbo dhammo uppajjati hetupaccayā—nadassanena	na dassanena pahātabbam dhammam paṭicca na dassanena pahātabbaḥ dhammaḥ uppajjati hetu paccayā na dassanena 
PA_patthana_2.13:4.1_1	pahātabbaṁ ekaṁ khandhaṁ paṭicca tayo khandhā cittasamuṭṭhānañca rūpaṁ …pe… dve khandhe	pahātabbam ekam khandham paṭicca tayaḥ khandhāḥ citta samuṭṭhānañca rūpam pe dve khandhe 
PA_patthana_2.13:4.1_2	…pe… paṭisandhikkhaṇe …pe… khandhe paṭicca vatthu, vatthuṁ paṭicca khandhā, ekaṁ mahābhūtaṁ …pe….	pe paṭisandhi kkhaṇe pe khandhe paṭicca vatthu vatthum paṭicca khandhāḥ ekam mahābhūtam pe 
PA_patthana_2.13:5.1_0	Dassanena pahātabbañca nadassanena pahātabbañca dhammaṁ paṭicca nadassanena pahātabbo	dassanena pahātabbañca na dassanena pahātabbañca dhammam paṭicca na dassanena pahātabbaḥ 
PA_patthana_2.13:5.1_1	dhammo uppajjati hetupaccayā—dassanena pahātabbe khandhe ca mahābhūte ca paṭicca	dhammaḥ uppajjati hetu paccayā dassanena pahātabbe khandhe ca mahābhūte ca paṭicca 
PA_patthana_2.13:5.1_2	cittasamuṭṭhānaṁ rūpaṁ. (Saṅkhittaṁ.)	citta samuṭṭhānam 
PA_patthana_2.13:6.0.1	Saṅkhyāvāra	saṅkhyāvāra 
PA_patthana_2.13:6.0.2	Suddha	suddha 
PA_patthana_2.13:6.1_0	Hetuyā pañca, ārammaṇe dve, adhipatiyā pañca, anantare dve, samanantare dve, sahajāte	hetuyā pañca ārammaṇe dve adhipatiyā pañca anantare dve samanantare dve sahajāte 
PA_patthana_2.13:6.1_1	pañca, aññamaññe dve, nissaye pañca, upanissaye dve, purejāte dve, āsevane dve, kamme	pañca aññamaññe dve nissaye pañca upanissaye dve purejāte dve āsevane dve kamme 
PA_patthana_2.13:6.1_2	pañca, vipāke ekaṁ, āhāre pañca …pe… avigate pañca.	pañca vipāke eka āhāre pañca pe avigate pañca 
PA_patthana_2.13:7.0.1	2.13.1.1.2. Paccayapaccanīya	paccaya paccanīya 
PA_patthana_2.13:7.0.2	Vibhaṅgavāra	vibhaṅgavāra 
PA_patthana_2.13:7.0.3	Nahetu	na hetu 
PA_patthana_2.13:7.1	Dassanena pahātabbaṁ dhammaṁ paṭicca dassanena pahātabbo dhammo uppajjati nahetupaccayā—vicikicchāsahagate khandhe paṭicca vicikicchāsahagato moho.	dassanena pahātabbam dhammam paṭicca dassanena pahātabbaḥ dhammaḥ uppajjati na hetu paccayā vicikicchā sahagate khandhe paṭicca vicikicchā sahagataḥ moho 
PA_patthana_2.13:8.1_0	Nadassanena pahātabbaṁ dhammaṁ paṭicca nadassanena pahātabbo dhammo uppajjati nahetupaccayā—ahetukaṁ	na dassanena pahātabbam dhammam paṭicca na dassanena pahātabbaḥ dhammaḥ uppajjati na hetu paccayā ahetuka 
PA_patthana_2.13:8.1_1	nadassanena pahātabbaṁ ekaṁ khandhaṁ …pe… ahetukapaṭisandhikkhaṇe …pe… (yāva asaññasattā)	na dassanena pahātabbam ekam khandham pe ahetuka paṭisandhi khaṇe pe yāva asaññasattā 
PA_patthana_2.13:8.1_2	uddhaccasahagate khandhe paṭicca uddhaccasahagato moho.	uddhacca sahagate khandhe paṭicca uddhacca sahagataḥ moho 
PA_patthana_2.13:9.0.1	Saṅkhyāvāra	saṅkhyāvāra 
PA_patthana_2.13:9.0.2	Suddha	suddha 
PA_patthana_2.13:9.1_0	Nahetuyā dve, naārammaṇe tīṇi, naadhipatiyā pañca, naanantare tīṇi, nasamanantare	na hetuyā dve na ārammaṇe tīṇi na adhipatiyā pañca na anantare tīṇi na samanantare 
PA_patthana_2.13:9.1_1	tīṇi, naaññamaññe tīṇi, naupanissaye tīṇi, napurejāte cattāri, napacchājāte pañca,	tīṇi na aññamaññe tīṇi na upanissaye tīṇi na purejāte cattāri na pacchājāte pañca 
PA_patthana_2.13:9.1_2	naāsevane pañca, nakamme dve, navipāke pañca, naāhāre ekaṁ, naindriye ekaṁ, najhāne	na āsevane pañca na kamme dve na vipāke pañca na āhāre eka na indriye eka na jhāne 
PA_patthana_2.13:9.1_3	ekaṁ, namagge ekaṁ, nasampayutte tīṇi, navippayutte dve, nonatthiyā tīṇi, novigate tīṇi.	na magge eka na sampayutte tīṇi na vippayutte dve no natthiyā tīṇi no vigate tīṇi 
PA_patthana_2.13:10.0	2.13.1.2. Sahajātavāra	sahajātavāra 
PA_patthana_2.13:10.1	Itare dve gaṇanāpi sahajātavāropi kātabbo.	itare dve gaṇanā api sahajāta vāraḥ api kātabbaḥ 
PA_patthana_2.13:11.0.1	2.13.1.3. Paccayavāra	paccaya vāra 
PA_patthana_2.13:11.0.2	2.13.1.3.1. Paccayānuloma	paccaya anuloma 
PA_patthana_2.13:11.0.3	Vibhaṅgavāra	vibhaṅgavāra 
PA_patthana_2.13:11.0.4	Hetu	hetu 
PA_patthana_2.13:11.1	Dassanena pahātabbaṁ dhammaṁ paccayā dassanena pahātabbo dhammo uppajjati hetupaccayā … tīṇi. (Paṭiccasadisā.)	dassanena pahātabbam dhammam paccayā dassanena pahātabbaḥ dhammaḥ uppajjati hetu paccayā tīṇi paṭicca sadisā 
PA_patthana_2.13:12.1_0	Nadassanena pahātabbaṁ dhammaṁ paccayā nadassanena pahātabbo dhammo uppajjati hetupaccayā—nadassanena	na dassanena pahātabbam dhammam paccayā na dassanena pahātabbaḥ dhammaḥ uppajjati hetu paccayā na dassanena 
PA_patthana_2.13:12.1_1	pahātabbaṁ ekaṁ khandhaṁ paccayā tayo khandhā cittasamuṭṭhānañca rūpaṁ …pe… dve khandhe	pahātabbam ekam khandham paccayā tayaḥ khandhāḥ citta samuṭṭhānañca rūpam pe dve khandhe 
PA_patthana_2.13:12.1_2	…pe… paṭisandhikkhaṇe …pe… (yāva ajjhattikā mahābhūtā) vatthuṁ paccayā nadassanena pahātabbā khandhā.	pe paṭisandhi khaṇe pe yāva ajjhattikāḥ mahābhūtāḥ vatthum paccayā na dassanena pahātabbā khandhāḥ 
PA_patthana_2.13:13.1	Nadassanena pahātabbaṁ dhammaṁ paccayā dassanena pahātabbo dhammo uppajjati hetupaccayā—vatthuṁ paccayā dassanena pahātabbā khandhā.	na dassanena pahātabbam dhammam paccayā dassanena pahātabbaḥ dhammaḥ uppajjati hetu paccayā vatthum paccayā dassanena pahātabbāḥ khandhāḥ 
PA_patthana_2.13:14.1_0	Nadassanena pahātabbaṁ dhammaṁ paccayā dassanena pahātabbo ca nadassanena pahātabbo	na dassanena pahātabbam dhammam paccayā dassanena pahātabbaḥ ca na dassanena pahātabbaḥ 
PA_patthana_2.13:14.1_1	ca dhammā uppajjanti hetupaccayā—vatthuṁ paccayā dassanena pahātabbā khandhā, mahābhūte	ca dhammā uppajjanti hetu paccayā vatthum paccayā dassanena pahātabbā khandhāḥ mahābhūte 
PA_patthana_2.13:14.1_2	paccayā cittasamuṭṭhānaṁ.	paccayā citta samuṭṭhāna 
PA_patthana_2.13:15.1_0	Dassanena pahātabbañca nadassanena pahātabbañca dhammaṁ paccayā dassanena pahātabbo	dassanena pahātabbañca na dassanena pahātabbañca dhammam paccayā dassanena pahātabbo 
PA_patthana_2.13:15.1_1	dhammo uppajjati hetupaccayā—dassanena pahātabbaṁ ekaṁ khandhañca vatthuñca paccayā	dhammaḥ uppajjati hetu paccayā dassanena pahātabbam ekam khandhañca vatthuñca paccayā 
PA_patthana_2.13:15.1_2	tayo khandhā …pe… dve khandhe ca …pe….	tayo khandhā pe dve khandhe ca pe 
PA_patthana_2.13:16.1_0	Dassanena pahātabbañca nadassanena pahātabbañca dhammaṁ paccayā nadassanena pahātabbo	dassanena pahātabbañca na dassanena pahātabbañca dhammam paccayā na dassanena pahātabbaḥ 
PA_patthana_2.13:16.1_1	dhammo uppajjati hetupaccayā—dassanena pahātabbe khandhe ca mahābhūte ca paccayā	dhammaḥ uppajjati hetu paccayā dassanena pahātabbe khandhe ca mahābhūte ca paccayā 
PA_patthana_2.13:16.1_2	cittasamuṭṭhānaṁ rūpaṁ.	citta samuṭṭhānam 
PA_patthana_2.13:17.1_0	Dassanena pahātabbañca nadassanena pahātabbañca dhammaṁ paccayā dassanena pahātabbo	dassanena pahātabbañca na dassanena pahātabbañca dhammam paccayā dassanena pahātabbo 
PA_patthana_2.13:17.1_1	ca nadassanena pahātabbo ca dhammā uppajjanti hetupaccayā—dassanena pahātabbaṁ ekaṁ	ca na dassanena pahātabbaḥ ca dhammā uppajjanti hetu paccayā dassanena pahātabbam eka 
PA_patthana_2.13:17.1_2	khandhañca vatthuñca paccayā tayo khandhā …pe… dve khandhe ca …pe… dassanena pahātabbe	khandhañca vatthuñca paccayā tayo khandhā pe dve khandhe ca pe dassanena pahātabbe 
PA_patthana_2.13:17.1_3	khandhe ca mahābhūte ca paccayā cittasamuṭṭhānaṁ rūpaṁ.	khandhe ca mahābhūte ca paccayā citta samuṭṭhānam rūpa 
PA_patthana_2.13:18.0.1	Saṅkhyāvāra	saṅkhyāvāra 
PA_patthana_2.13:18.0.2	Suddha	suddha 
PA_patthana_2.13:18.1	Hetuyā nava, ārammaṇe cattāri, adhipatiyā nava …pe… avigate nava.	hetuyā nava ārammaṇe cattāri adhipatiyā nava pe avigate nava 
PA_patthana_2.13:19.0.1	2.13.1.3.2. Paccayapaccanīya	paccaya paccanīya 
PA_patthana_2.13:19.0.2	Vibhaṅgavāra	vibhaṅgavāra 
PA_patthana_2.13:19.0.3	Nahetu	na hetu 
PA_patthana_2.13:19.1	Dassanena pahātabbaṁ dhammaṁ paccayā dassanena pahātabbo dhammo uppajjati nahetupaccayā—vicikicchāsahagate khandhe paccayā vicikicchāsahagato moho.	dassanena pahātabbam dhammam paccayā dassanena pahātabbaḥ dhammaḥ uppajjati na hetu paccayā vicikicchā sahagate khandhe paccayā vicikicchā sahagataḥ moho 
PA_patthana_2.13:20.1_0	Nadassanena pahātabbaṁ dhammaṁ paccayā nadassanena pahātabbo dhammo uppajjati nahetupaccayā—ahetukaṁ	na dassanena pahātabbam dhammam paccayā na dassanena pahātabbaḥ dhammaḥ uppajjati na hetu paccayā ahetuka 
PA_patthana_2.13:20.1_1	nadassanena pahātabbaṁ ekaṁ khandhaṁ paccayā tayo khandhā cittasamuṭṭhānañca rūpaṁ	na dassanena pahātabbam ekam khandham paccayā tayo khandhā citta samuṭṭhānañca rūpa 
PA_patthana_2.13:20.1_2	…pe… dve khandhe …pe… (yāva asaññasattā) cakkhāyatanaṁ paccayā cakkhuviññāṇaṁ …pe…	pe dve khandhe pe yāva asaññasattā cakkha āyatanam paccayā cakkhu viññāṇam pe
PA_patthana_2.13:20.1_3	kāyāyatanaṁ paccayā kāyaviññāṇaṁ; vatthuṁ paccayā ahetukā nadassanena pahātabbā khandhā,	kāya āyatanam paccayā kāya viññāṇa vatthum paccayā ahetukāḥ na dassanena pahātabbā khandhāḥ 
PA_patthana_2.13:20.1_4	uddhaccasahagate khandhe paccayā uddhaccasahagato moho, vatthuṁ paccayā uddhaccasahagato moho.	uddhacca sahagate khandhe paccayā uddhacca sahagataḥ mohaḥ vatthum paccayā uddhacca sahagataḥ mohaḥ 
PA_patthana_2.13:21.1	Nadassanena pahātabbaṁ dhammaṁ paccayā dassanena pahātabbo dhammo uppajjati nahetupaccayā—vatthuṁ paccayā vicikicchāsahagato moho.	na dassanena pahātabbam dhammam paccayā dassanena pahātabbaḥ dhammo uppajjati na hetu paccayā vatthum paccayā vicikicchā sahagataḥ moho 
PA_patthana_2.13:22.1_0	Dassanena pahātabbañca nadassanena pahātabbañca dhammaṁ paccayā dassanena pahātabbo	dassanena pahātabbañca na dassanena pahātabbañca dhammam paccayā dassanena pahātabbo 
PA_patthana_2.13:22.1_1	dhammo uppajjati nahetupaccayā—vicikicchāsahagate khandhe ca vatthuñca paccayā vicikicchāsahagato moho.	dhammaḥ uppajjati na hetu paccayā vicikicchā sahagate khandhe ca vatthuñca paccayā vicikicchā sahagataḥ moho 
PA_patthana_2.13:23.0.1	Saṅkhyāvāra	saṅkhyāvāra 
PA_patthana_2.13:23.0.2	Suddha	suddha 
PA_patthana_2.13:23.1_0	Nahetuyā cattāri, naārammaṇe tīṇi, naadhipatiyā nava, naanantare tīṇi, nasamanantare	na hetuyā cattāri na ārammaṇe tīṇi na adhipatiyā nava na anantare tīṇi na samanantare 
PA_patthana_2.13:23.1_1	tīṇi, naaññamaññe tīṇi, naupanissaye tīṇi, napurejāte cattāri, napacchājāte nava,	tīṇi na aññamaññe tīṇi na upanissaye tīṇi na purejāte cattāri na pacchājāte nava 
PA_patthana_2.13:23.1_2	naāsevane nava, nakamme cattāri, navipāke nava, naāhāre ekaṁ, naindriye ekaṁ, najhāne	na āsevane nava na kamme cattāri na vipāke nava na āhāre eka na indriye eka na jhāne 
PA_patthana_2.13:23.1_3	ekaṁ, namagge ekaṁ, nasampayutte tīṇi, navippayutte dve, nonatthiyā tīṇi, novigate tīṇi.	na magge eka na sampayutte tīṇi na vippayutte dve no natthiyā tīṇi no vigate tīṇi 
PA_patthana_2.13:24.0	2.13.1.4. Nissayavāra	nissaya vāra 
PA_patthana_2.13:24.1	Itare dve gaṇanāpi nissayavāropi kātabbo.	itare dve gaṇanā api nissaya vāro api kātabbo 
PA_patthana_2.13:25.0.1	2.13.1.5. Saṁsaṭṭhavāra	sa saṭṭhavāra 
PA_patthana_2.13:25.0.2	2.13.1.5.1–4 Paccayānulomādi	paccaya anuloma ādi 
PA_patthana_2.13:25.1	Dassanena pahātabbaṁ dhammaṁ saṁsaṭṭho dassanena pahātabbo dhammo uppajjati hetupaccayā. (Saṅkhittaṁ.)	dassanena pahātabbam dhammam sa saṭṭhaḥ dassanena pahātabbaḥ dhammo uppajjati hetu paccayā 
PA_patthana_2.13:26.1	Nadassanena pahātabbaṁ dhammaṁ saṁsaṭṭho nadassanena pahātabbo dhammo uppajjati hetupaccayā (Saṅkhittaṁ.)	na dassanena pahātabbam dhammam sa saṭṭhaḥ na dassanena pahātabbaḥ dhammaḥ uppajjati hetu paccayā 
PA_patthana_2.13:27.1	Hetuyā dve, ārammaṇe dve, adhipatiyā dve, (sabbattha dve) vipāke ekaṁ …pe… avigate dve.	hetuyā dve ārammaṇe dve adhipatiyā dve sabbattha dve vipāke ekam pe avigate dve 
PA_patthana_2.13:28.1	Anulomaṁ.	anuloma 
PA_patthana_2.13:29.1	Dassanena pahātabbaṁ dhammaṁ saṁsaṭṭho dassanena pahātabbo dhammo uppajjati nahetupaccayā—vicikicchāsahagate khandhe saṁsaṭṭho vicikicchāsahagato moho.	dassanena pahātabbam dhammam sa saṭṭhaḥ dassanena pahātabbaḥ dhammaḥ uppajjati na hetu paccayā vicikicchā sahagate khandhe sa saṭṭhaḥ vicikicchā sahagataḥ moho 
PA_patthana_2.13:30.1	Nadassanena pahātabbaṁ dhammaṁ saṁsaṭṭho nadassanena pahātabbo dhammo uppajjati nahetupaccayā. (Saṅkhittaṁ.)	na dassanena pahātabbam dhammam sa saṭṭhaḥ na dassanena pahātabbaḥ dhammaḥ uppajjati na hetu paccayā 
PA_patthana_2.13:31.1	Nahetuyā dve, naadhipatiyā dve, napurejāte dve, napacchājāte dve, naāsevane dve, nakamme dve, navipāke dve, najhāne ekaṁ, namagge ekaṁ, navippayutte dve.	na hetuyāḥ dve na adhipatiyāḥ dve na purejāte dve na pacchājāte dve na āsevane dve na kamme dve na vipāke dve na jhāne eka na magge eka na vippayutte dve 
PA_patthana_2.13:32.1	Paccanīyaṁ.	paccanīya 
PA_patthana_2.13:33.0	2.13.1.6. Sampayuttavāra	  
PA_patthana_2.13:33.1	Evaṁ itare dve gaṇanāpi sampayuttavāropi kātabbo.	evam itare dve gaṇanā api sampayutta vāraḥ api kātabbaḥ 
PA_patthana_2.13:34.0.1	2.13.1.7. Pañhāvāra	pañhāvāra 
PA_patthana_2.13:34.0.2	2.13.1.7.1. Paccayānuloma	paccaya anuloma 
PA_patthana_2.13:34.0.3	Vibhaṅgavāra	vibhaṅgavāra 
PA_patthana_2.13:34.0.4	Hetu	hetu 
PA_patthana_2.13:34.1	Dassanena pahātabbo dhammo dassanena pahātabbassa dhammassa hetupaccayena paccayo … tīṇi.	dassanena pahātabbaḥ dhammaḥ dassanena pahātabbassa dhammassa hetu paccayena paccayaḥ tīṇi 
PA_patthana_2.13:35.1_0	Nadassanena pahātabbo dhammo nadassanena pahātabbassa dhammassa hetupaccayena paccayo—nadassanena	na dassanena pahātabbaḥ dhammaḥ na dassanena pahātabbassa dhammassa hetu paccayena paccayaḥ na dassanena 
PA_patthana_2.13:35.1_1	pahātabbā hetū sampayuttakānaṁ khandhānaṁ cittasamuṭṭhānānañca rūpānaṁ hetupaccayena	pahātabbāḥ hetū sampayuttakānam khandhānam citta samuṭṭhānānam ca rūpānam hetu paccayena 
PA_patthana_2.13:35.1_2	paccayo; paṭisandhikkhaṇe …pe….	paccayaḥ paṭisandhi khaṇe pe 
PA_patthana_2.13:36.0	Ārammaṇa	ārammaṇa 
PA_patthana_2.13:36.1_0	Dassanena pahātabbo dhammo dassanena pahātabbassa dhammassa ārammaṇapaccayena paccayo—dassanena	dassanena pahātabbaḥ dhammaḥ dassanena pahātabbassa dhammassa ārammaṇa paccayena paccayodassanena 
PA_patthana_2.13:36.1_1	pahātabbaṁ rāgaṁ assādeti abhinandati, taṁ ārabbha dassanena pahātabbo rāgo uppajjati,	pahātabbam rāgam assādeti abhinandati tam ārabbha dassanena pahātabbaḥ rāgaḥ uppajjati 
PA_patthana_2.13:36.1_2	diṭṭhi …pe… vicikicchā uppajjati, dassanena pahātabbaṁ domanassaṁ uppajjati; dassanena	diṭṭhi pe vicikicchā uppajjati dassanena pahātabbam domanassam uppajjati dassanena 
PA_patthana_2.13:36.1_3	pahātabbaṁ diṭṭhiṁ assādeti abhinandati, taṁ ārabbha dassanena pahātabbo rāgo uppajjati,	pahātabbam diṭṭhim assādeti abhinandati tam ārabbha dassanena pahātabbaḥ rāgaḥ uppajjati 
PA_patthana_2.13:36.1_4	diṭṭhi …pe… vicikicchā …pe… domanassaṁ uppajjati; vicikicchaṁ ārabbha vicikicchā	diṭṭhi pe vicikicchā pe domanassam uppajjati vicikiccham ārabbha vicikicchā 
PA_patthana_2.13:36.1_5	uppajjati, diṭṭhi …pe… domanassaṁ uppajjati; dassanena pahātabbaṁ domanassaṁ ārabbha	uppajjati diṭṭhi pe domanassam uppajjati dassanena pahātabbam domanassam ārabbha 
PA_patthana_2.13:36.1_6	dassanena pahātabbaṁ domanassaṁ uppajjati, diṭṭhi uppajjati, vicikicchā uppajjati.	dassanena pahātabbam domanassam uppajjati diṭṭhi uppajjati vicikicchā uppajjati 
PA_patthana_2.13:37.1_0	Dassanena pahātabbo dhammo nadassanena pahātabbassa dhammassa ārammaṇapaccayena paccayo—ariyā	dassanena pahātabbaḥ dhammaḥ na dassanena pahātabbassa dhammassa ārammaṇa paccayena paccayo ariyā 
PA_patthana_2.13:37.1_1	dassanena pahātabbe pahīne kilese paccavekkhanti, pubbe samudāciṇṇe …pe… dassanena	dassanena pahātabbe pahīne kilese paccavekkhanti pubbe samudāciṇṇe pe dassanena 
PA_patthana_2.13:37.1_2	pahātabbe khandhe aniccato …pe… vipassati, cetopariyañāṇena dassanena pahātabbacittasamaṅgissa	pahātabbe khandhe aniccataḥ pe vipassati cetaḥ pariya ñāṇena dassanena pahātabba citta samaṅgissa 
PA_patthana_2.13:37.1_3	cittaṁ jānāti, dassanena pahātabbā khandhā cetopariyañāṇassa, pubbenivāsānussatiñāṇassa,	cittam jānāti dassanena pahātabbā khandhā cetas pariya ñāṇassa pubbenivāsa anussati ñāṇassa 
PA_patthana_2.13:37.1_4	yathākammūpagañāṇassa, anāgataṁsañāṇassa, āvajjanāya ārammaṇapaccayena paccayo.	yathā kammūpaga ñāṇassa anāgata sañāṇassa āvajjanāya ārammaṇa paccayena paccayaḥ 
PA_patthana_2.13:38.1_0	Nadassanena pahātabbo dhammo nadassanena pahātabbassa dhammassa ārammaṇapaccayena	na dassanena pahātabbaḥ dhammaḥ na dassanena pahātabbassa dhammassa ārammaṇa paccayena 
PA_patthana_2.13:38.1_1	paccayo—dānaṁ …pe… sīlaṁ …pe… uposathakammaṁ katvā taṁ paccavekkhati assādeti abhinandati,	paccayodānam pe sīlam pe uposatha kammam katvā tam paccavekkhati assādeti abhinandati 
PA_patthana_2.13:38.1_2	taṁ ārabbha nadassanena pahātabbo rāgo uppajjati; uddhaccaṁ …pe… nadassanena pahātabbaṁ	tam ārabbha na dassanena pahātabbaḥ rāgaḥ uppajjati uddhaccam pe na dassanena pahātabba 
PA_patthana_2.13:38.1_3	domanassaṁ uppajjati, pubbe suciṇṇāni …pe… jhānā …pe… ariyā maggā vuṭṭhahitvā maggaṁ	domanassam uppajjati pubbe su ciṇṇāni pe jhānā pe ariyāḥ maggāḥ vuṭṭhahitvā magga 
PA_patthana_2.13:38.1_4	paccavekkhanti …pe… phalassa āvajjanāya ārammaṇapaccayena paccayo; ariyā nadassanena	paccavekkhanti pe phalassa āvajjanāya ārammaṇa paccayena paccayaḥ ariyāḥ na dassanena 
PA_patthana_2.13:38.1_5	pahātabbe pahīne kilese paccavekkhanti, vikkhambhite kilese …pe… pubbe …pe… cakkhuṁ	pahātabbe pahīne kilese paccavekkhanti vikkhambhite kilese pe pubbe pe cakkhu 
PA_patthana_2.13:38.1_6	…pe… vatthuṁ nadassanena pahātabbe khandhe aniccato …pe… vipassati assādeti abhinandati,	pe vatthum na dassanena pahātabbe khandhe aniccato pe vipassati assādeti abhinandati 
PA_patthana_2.13:38.1_7	taṁ ārabbha nadassanena pahātabbo rāgo uppajjati, uddhaccaṁ …pe… nadassanena pahātabbaṁ	tam ārabbha na dassanena pahātabbaḥ rāgaḥ uppajjati uddhaccam pe na dassanena pahātabba 
PA_patthana_2.13:38.1_8	domanassaṁ uppajjati; dibbena cakkhunā rūpaṁ passati …pe… anāgataṁsañāṇassa, āvajjanāya	domanassam uppajjati dibbena cakkhunā rūpam passati pe anāgata sañāṇassa āvajjanāya 
PA_patthana_2.13:38.1_9	ārammaṇapaccayena paccayo.	ārammaṇa paccayena paccayaḥ 
PA_patthana_2.13:39.1_0	Nadassanena pahātabbo dhammo dassanena pahātabbassa dhammassa ārammaṇapaccayena paccayo—dānaṁ	na dassanena pahātabbaḥ dhammaḥ dassanena pahātabbassa dhammassa ārammaṇa paccayena paccaya udāna 
PA_patthana_2.13:39.1_1	…pe… sīlaṁ …pe… uposathakammaṁ …pe… pubbe …pe… jhānā …pe… cakkhuṁ …pe… vatthuṁ nadassanena	pe sīlam pe uposatha kammaṃ pe pubbe pe jhānā pe cakkhum pe vatthum na dassanena 
PA_patthana_2.13:39.1_2	pahātabbe khandhe assādeti abhinandati, taṁ ārabbha dassanena pahātabbo rāgo uppajjati,	pahātabbe khandhe assādeti abhinandati tam ārabbha dassanena pahātabbaḥ rāgaḥ uppajjati 
PA_patthana_2.13:39.1_3	diṭṭhi …pe… vicikicchā …pe… dassanena pahātabbaṁ domanassaṁ uppajjati.	diṭṭhi pe vicikicchā pe dassanena pahātabbam domanassam uppajjati 
PA_patthana_2.13:40.0	Adhipati	adhipati 
PA_patthana_2.13:40.1_0	Dassanena pahātabbo dhammo dassanena pahātabbassa dhammassa adhipatipaccayena paccayo—ārammaṇādhipati,	dassanena pahātabbaḥ dhammaḥ dassanena pahātabbassa dhammassa adhipati paccayena paccayaḥ ārammaṇa adhipati 
PA_patthana_2.13:40.1_1	sahajātādhipati. Ārammaṇādhipati—dassanena pahātabbaṁ rāgaṁ garuṁ katvā assādeti	sahajāta adhipati ārammaṇa adhipati dassanena pahātabbam rāgam garum katvā assādeti 
PA_patthana_2.13:40.1_2	abhinandati, taṁ garuṁ katvā dassanena pahātabbo rāgo uppajjati, diṭṭhi uppajjati,	abhinandati tam garum katvā dassanena pahātabbaḥ rāgaḥ uppajjati diṭṭhi uppajjati 
PA_patthana_2.13:40.1_3	diṭṭhiṁ garuṁ katvā …pe…. Sahajātādhipati—dassanena pahātabbādhipati sampayuttakānaṁ	diṭṭhim garum katvā pe sahajāta adhipati dassanena pahātabba adhipati sampayuttakāna 
PA_patthana_2.13:40.1_4	khandhānaṁ adhipatipaccayena paccayo.	khandhānam adhipati paccayena paccayaḥ 
PA_patthana_2.13:41.1_0	Dassanena pahātabbo dhammo nadassanena pahātabbassa dhammassa adhipatipaccayena paccayo.	dassanena pahātabbaḥ dhammaḥ na dassanena pahātabbassa dhammassa adhipati paccayena paccayaḥ 
PA_patthana_2.13:41.1_1	Sahajātādhipati—dassanena pahātabbādhipati cittasamuṭṭhānānaṁ rūpānaṁ adhipatipaccayena paccayo.	sahajāta adhipati dassanena pahātabba adhipati citta samuṭṭhānānam rūpānam adhipati paccayena paccayaḥ 
PA_patthana_2.13:42.1_0	Dassanena pahātabbo dhammo dassanena pahātabbassa ca nadassanena pahātabbassa ca	dassanena pahātabbaḥ dhammaḥ dassanena pahātabbassa ca na dassanena pahātabbassa ca 
PA_patthana_2.13:42.1_1	dhammassa adhipatipaccayena paccayo. Sahajātādhipati—dassanena pahātabbādhipati sampayuttakānaṁ	dhammassa adhipati paccayena paccayaḥ sahajāta adhipati dassanena pahātabba adhipati sampayuttakāna 
PA_patthana_2.13:42.1_2	khandhānaṁ cittasamuṭṭhānānañca rūpānaṁ adhipatipaccayena paccayo.	khandhānam citta samuṭṭhānānaṃ ca rūpānaṃ adhipati paccayena paccayaḥ 
PA_patthana_2.13:43.1_0	Nadassanena pahātabbo dhammo nadassanena pahātabbassa dhammassa adhipatipaccayena	na dassanena pahātabbaḥ dhammaḥ na dassanena pahātabbassa dhammassa adhipati paccayena 
PA_patthana_2.13:43.1_1	paccayo—ārammaṇādhipati, sahajātādhipati. Ārammaṇādhipati—dānaṁ …pe… sīlaṁ …pe… uposathakammaṁ	paccayaḥ ārammaṇa adhipati sahajāta adhipati ārammaṇa adhipati dānam pe sīlam pe uposatha kamma 
PA_patthana_2.13:43.1_2	…pe… pubbe …pe… jhānā vuṭṭhahitvā jhānaṁ garuṁ katvā paccavekkhati, assādeti abhinandati,	pe pubbe pe jhānā vuṭṭhahitvā jhānam garum katvā paccavekkhati assādeti abhinandati 
PA_patthana_2.13:43.1_3	taṁ garuṁ katvā nadassanena pahātabbo rāgo uppajjati, ariyā maggā vuṭṭhahitvā maggaṁ	tam garum katvā na dassanena pahātabbaḥ rāgaḥ uppajjati ariyāḥ maggāḥ vuṭṭhahitvā magga 
PA_patthana_2.13:43.1_4	garuṁ katvā …pe… phalassa adhipatipaccayena paccayo; cakkhuṁ …pe… vatthuṁ nadassanena	garum katvā pe phalassa adhipati paccayena paccayaḥ cakkhum pe vatthum na dassanena 
