segmentnr	original	analyzed
PA_patthana_15.58:0.1	Paṭṭhānapakaraṇa	paṭṭhāna pakaraṇa 
PA_patthana_15.58:0.2	Dhammānulomapaccanīya (3), Dukatikapaṭṭhānapāḷi (3)	dhamma anuloma paccanīya 
PA_patthana_15.58:0.3	15.58. Savicāraduka, Kusalattika	sa vicāra duka kusalattika 
PA_patthana_15.58:1.1	Savicāraṁ kusalaṁ dhammaṁ paṭicca nasavicāro nakusalo dhammo uppajjati hetupaccayā …. Hetuyā tīṇi …pe… avigate tīṇi.	sa vicāram kusalam dhammam paṭicca na sa vicāraḥ na kusalaḥ dhammaḥ uppajjati hetu paccayā hetuyā tīṇi pe avigate tīṇi 
PA_patthana_15.58:2.1	Savicāraṁ akusalaṁ dhammaṁ paṭicca nasavicāro naakusalo dhammo uppajjati hetupaccayā …. Hetuyā tīṇi …pe… avigate tīṇi. (Abyākatamūlaṁ tīṇiyeva paccayavasena.)	sa vicāram akusalam dhammam paṭicca na sa vicāraḥ na akusalaḥ dhammaḥ uppajjati hetu paccayā hetuyā tīṇi pe avigate tīṇi abyākata mūlam tīṇi eva paccaya vasena 
