segmentnr	original	analyzed
PA_ps_2.7:0.1	Paṭisambhidāmagga	paṭisambhidā magga 
PA_ps_2.7:0.2	2 Yuganaddhavagga	yuga naddha vagga 
PA_ps_2.7:0.3	2.7. Dhammacakkakathā	dhammacakka kathā 
PA_ps_2.7:1.0	2.7.1. Saccavāra	saccavāra 
PA_ps_2.7:1.1	Ekaṁ samayaṁ bhagavā bārāṇasiyaṁ viharati …pe…	ekam samayam bhagavā bārāṇasiyam viharati pe 
PA_ps_2.7:1.2	iti hidaṁ āyasmato koṇḍaññassa “aññāsikoṇḍañño” tveva nāmaṁ ahosi.	iti hi dam āyasmataḥ koṇḍaññassa tu eva nāmam ahosi 
PA_ps_2.7:2.1	“Idaṁ dukkhaṁ ariyasaccan”ti pubbe ananussutesu dhammesu cakkhuṁ udapādi, ñāṇaṁ udapādi, paññā udapādi, vijjā udapādi, āloko udapādi.	idam dukkham ariya saccanti pubbe an anussutesu dhammesu cakkhum udapādi ñāṇam udapādi paññā udapādi vijjā udapādi ālokaḥ udapādi 
PA_ps_2.7:3.1	Cakkhuṁ udapādīti—	cakkhum udapādi iti 
PA_ps_2.7:3.2	kenaṭṭhena?	kenaṭṭhena 
PA_ps_2.7:3.3	Ñāṇaṁ udapādīti—	ñāṇam udapādi iti 
PA_ps_2.7:3.4	kenaṭṭhena?	kenaṭṭhena 
PA_ps_2.7:3.5	Paññā udapādīti—	paññā udapādi iti 
PA_ps_2.7:3.6	kenaṭṭhena?	kenaṭṭhena 
PA_ps_2.7:3.7	Vijjā udapādīti—	vijjāḥ udapādi iti 
PA_ps_2.7:3.8	kenaṭṭhena?	kenaṭṭhena 
PA_ps_2.7:3.9	Āloko udapādīti—	ālokaḥ udapādi iti 
PA_ps_2.7:3.10	kenaṭṭhena?	kenaṭṭhena 
PA_ps_2.7:3.11	Cakkhuṁ udapādīti—	cakkhum udapādi iti 
PA_ps_2.7:3.12	dassanaṭṭhena.	dassana ṭṭhena 
PA_ps_2.7:3.13	Ñāṇaṁ udapādīti—	ñāṇam udapādi iti 
PA_ps_2.7:3.14	ñātaṭṭhena.	ñāta ṭṭhena 
PA_ps_2.7:3.15	Paññā udapādīti—	paññā udapādi iti 
PA_ps_2.7:3.16	pajānanaṭṭhena.	pajānana ṭṭhena 
PA_ps_2.7:3.17	Vijjā udapādīti—	vijjāḥ udapādi iti 
PA_ps_2.7:3.18	paṭivedhaṭṭhena.	paṭivedha ṭṭhena 
PA_ps_2.7:3.19	Āloko udapādīti—	ālokaḥ udapādi iti 
PA_ps_2.7:3.20	obhāsaṭṭhena.	obhā saṭṭhena 
PA_ps_2.7:4.1	Cakkhuṁ dhammo, dassanaṭṭho attho.	cakkhum dhammaḥ dassana aṭṭhaḥ attho 
PA_ps_2.7:4.2	Ñāṇaṁ dhammo, ñātaṭṭho attho.	ñāṇam dhammaḥ ñāta ṭṭhaḥ atthaḥ 
PA_ps_2.7:4.3	Paññā dhammo, pajānanaṭṭho attho.	paññā dhammaḥ pajānanaṭṭhaḥ attho 
PA_ps_2.7:4.4	Vijjā dhammo, paṭivedhaṭṭho attho.	vijjā dhammo paṭivedha aṭṭhaḥ attho 
PA_ps_2.7:4.5	Āloko dhammo, obhāsaṭṭho attho.	ālokaḥ dhammaḥ obhā saṭṭhaḥ attho 
PA_ps_2.7:4.6	Ime pañca dhammā pañca atthā dukkhavatthukā saccavatthukā saccārammaṇā saccagocarā saccasaṅgahitā saccapariyāpannā sacce samudāgatā sacce ṭhitā sacce patiṭṭhitā.	ime pañca dhammā pañca atthā dukkha vatthukā sacca vatthukā sacca ārammaṇā sacca gocarā sacca saṅgahitā sacca pariyāpannā sacce samudāgatā sacce ṭhitā sacce patiṭṭhitā 
PA_ps_2.7:5.1	Dhammacakkanti kenaṭṭhena dhammacakkaṁ?	dhammacakkanti kenaṭṭhena dhammacakka 
PA_ps_2.7:5.2	Dhammañca pavatteti cakkañcāti—dhammacakkaṁ.	dhammañca pavatta iti cakkañca ati dhamma cakka 
PA_ps_2.7:5.3	Cakkañca pavatteti dhammañcāti—dhammacakkaṁ.	cakkañca pavatta iti 
PA_ps_2.7:5.4	Dhammena pavattetīti—dhammacakkaṁ.	dhammena pavatteti iti dhammacakka 
PA_ps_2.7:5.5	Dhammacariyāya pavattetīti—dhammacakkaṁ.	dhamma cariyāya pavatteti iti dhammacakka 
PA_ps_2.7:5.6	Dhamme ṭhito pavattetīti—dhammacakkaṁ.	dhamme ṭhitaḥ pavatteti iti dhammacakka 
PA_ps_2.7:5.7	Dhamme patiṭṭhito pavattetīti—dhammacakkaṁ.	dhamme patiṭṭhitaḥ pavatteti iti dhammacakka 
PA_ps_2.7:5.8	Dhamme patiṭṭhāpento pavattetīti—dhammacakkaṁ.	dhamme patiṭṭhāpento pavatteti iti dhammacakka 
PA_ps_2.7:5.9	Dhamme vasippatto pavattetīti—dhammacakkaṁ.	dhamme vasi patto 
PA_ps_2.7:5.10	Dhamme vasiṁ pāpento pavattetīti—dhammacakkaṁ.	dhamme vasim pāpentaḥ pavatteti iti dhammacakka 
PA_ps_2.7:5.11	Dhamme pāramippatto pavattetīti—dhammacakkaṁ.	dhamme pārami patto pavatteti iti dhammacakka 
PA_ps_2.7:5.12	Dhamme pāramiṁ pāpento pavattetīti—dhammacakkaṁ.	dhamme pāramim pāpentaḥ pavatteti iti dhammacakka 
PA_ps_2.7:5.13	Dhamme vesārajjappatto pavattetīti—dhammacakkaṁ.	dhamme vesārajja ppatto pavatteti iti dhammacakka 
PA_ps_2.7:5.14	Dhamme vesārajjaṁ pāpento pavattetīti—dhammacakkaṁ.	dhamme vesārajjam pāpentaḥ pavatteti iti dhammacakka 
PA_ps_2.7:5.15	Dhammaṁ sakkaronto pavattetīti—dhammacakkaṁ.	dhammam sakkaronto pavatteti iti dhammacakka 
PA_ps_2.7:5.16	Dhammaṁ garuṁ karonto pavattetīti—dhammacakkaṁ.	dhammam garum karontaḥ pavatteti iti dhammacakka 
PA_ps_2.7:5.17	Dhammaṁ mānento pavattetīti—dhammacakkaṁ.	dhammam mānentaḥ pavatteti iti dhammacakka 
PA_ps_2.7:5.18	Dhammaṁ pūjento pavattetīti—dhammacakkaṁ.	dhammam pūjento pavatteti iti dhammacakka 
PA_ps_2.7:5.19	Dhammaṁ apacāyamāno pavattetīti—dhammacakkaṁ.	dhammam apacāyamānaḥ pavatteti iti dhammacakka 
PA_ps_2.7:5.20	Dhammaddhajo pavattetīti—dhammacakkaṁ.	dhamma ddhajaḥ pavatteti iti dhammacakka 
PA_ps_2.7:5.21	Dhammaketu pavattetīti—dhammacakkaṁ.	dhamma ketu pavatteti iti dhammacakka 
PA_ps_2.7:5.22	Dhammādhipateyyo pavattetīti—dhammacakkaṁ.	dhamma ādhipateyyo pavatteti iti dhammacakka 
PA_ps_2.7:5.23	Taṁ kho pana dhammacakkaṁ appaṭivattiyaṁ samaṇena vā brāhmaṇena vā devena vā mārena vā brahmunā vā kenaci vā lokasminti—dhammacakkaṁ.	tam kho pana dhamma cakkam appaṭivattiyam samaṇena vā brāhmaṇena vā devena vā mārena vā brahmunā vā kenacid vā lokasmin ti dhammacakka 
PA_ps_2.7:6.1	Saddhindriyaṁ dhammo taṁ dhammaṁ pavattetīti—dhammacakkaṁ.	saddhi indriyam tam dhammam pavatteti iti dhammacakka 
PA_ps_2.7:6.2	Vīriyindriyaṁ dhammo taṁ dhammaṁ pavattetīti—dhammacakkaṁ.	vīriya indriyam tam dhammam pavatteti iti dhammacakka 
PA_ps_2.7:6.3	Satindriyaṁ dhammo taṁ dhammaṁ pavattetīti—dhammacakkaṁ.	sati indriyam tam dhammam pavatteti iti dhammacakka 
PA_ps_2.7:6.4	Samādhindriyaṁ dhammo taṁ dhammaṁ pavattetīti—dhammacakkaṁ.	samādhi indriyam tam dhammam pavatteti iti dhammacakka 
PA_ps_2.7:6.5	Paññindriyaṁ dhammo taṁ dhammaṁ pavattetīti—dhammacakkaṁ.	paññindriyam tam dhammam pavatteti iti dhammacakka 
PA_ps_2.7:6.6	Saddhābalaṁ dhammo taṁ dhammaṁ pavattetīti—dhammacakkaṁ.	saddhā balam tam dhammam pavatteti iti dhammacakka 
PA_ps_2.7:6.7	Vīriyabalaṁ dhammo taṁ dhammaṁ pavattetīti—dhammacakkaṁ.	vīriya balam dhammaḥ tam dhammam pavatteti iti dhammacakka 
PA_ps_2.7:6.8	Satibalaṁ dhammo taṁ dhammaṁ pavattetīti—dhammacakkaṁ.	sati balam tam dhammam pavatteti iti dhammacakka 
PA_ps_2.7:6.9	Samādhibalaṁ dhammo taṁ dhammaṁ pavattetīti—dhammacakkaṁ.	samādhi balam tam dhammam pavatteti iti dhammacakka 
PA_ps_2.7:6.10	Paññābalaṁ dhammo taṁ dhammaṁ pavattetīti—dhammacakkaṁ.	paññā balam dhammo tam dhammam pavatteti iti dhammacakka 
PA_ps_2.7:6.11	Satisambojjhaṅgo dhammo taṁ dhammaṁ pavattetīti—dhammacakkaṁ.	sati sambojjhaṅgaḥ dhammaḥ tam dhammam pavatteti iti dhammacakka 
PA_ps_2.7:6.12	Dhammavicayasambojjhaṅgo dhammo taṁ dhammaṁ pavattetīti—dhammacakkaṁ.	dhamma vicaya sambojjhaṅgaḥ dhammo tam dhammam pavatteti iti dhammacakka 
PA_ps_2.7:6.13	Vīriyasambojjhaṅgo dhammo taṁ dhammaṁ pavattetīti—dhammacakkaṁ.	vīriya sambojjhaṅgaḥ dhammaḥ tam dhammam pavatteti iti dhammacakka 
PA_ps_2.7:6.14	Pītisambojjhaṅgo dhammo taṁ dhammaṁ pavattetīti—dhammacakkaṁ.	pīti sambojjhaṅgaḥ dhammaḥ tam dhammam pavatteti iti dhammacakka 
PA_ps_2.7:6.15	Passaddhisambojjhaṅgo dhammo taṁ dhammaṁ pavattetīti—dhammacakkaṁ.	passaddhi sambojjhaṅgaḥ dhammo tam dhammam pavatteti iti dhammacakka 
PA_ps_2.7:6.16	Samādhisambojjhaṅgo dhammo taṁ dhammaṁ pavattetīti—dhammacakkaṁ.	samādhi sambojjhaṅgaḥ dhammaḥ tam dhammam pavatteti iti dhammacakka 
PA_ps_2.7:6.17	Upekkhāsambojjhaṅgo dhammo taṁ dhammaṁ pavattetīti—dhammacakkaṁ.	upekkhā sambojjhaṅgaḥ dhammaḥ tam dhammam pavatteti iti dhammacakka 
PA_ps_2.7:6.18	Sammādiṭṭhi dhammo taṁ dhammaṁ pavattetīti—dhammacakkaṁ.	sammā diṭṭhi dhammo tam dhammam pavatteti iti dhammacakka 
PA_ps_2.7:6.19	Sammāsaṅkappo dhammo taṁ dhammaṁ pavattetīti—dhammacakkaṁ.	sammā saṅkappaḥ dhammaḥ tam dhammam pavatteti iti dhammacakka 
PA_ps_2.7:6.20	Sammāvācā dhammo taṁ dhammaṁ pavattetīti—dhammacakkaṁ.	sammā vācā tam dhammam pavatteti iti dhammacakka 
PA_ps_2.7:6.21	Sammākammanto dhammo taṁ dhammaṁ pavattetīti—dhammacakkaṁ.	sammā kammantaḥ dhammaḥ tam dhammam pavatteti iti dhammacakka 
PA_ps_2.7:6.22	Sammāājīvo dhammo taṁ dhammaṁ pavattetīti—dhammacakkaṁ.	sammāājīvaḥ dhammo tam dhammam pavatteti iti dhammacakka 
PA_ps_2.7:6.23	Sammāvāyāmo dhammo taṁ dhammaṁ pavattetīti—dhammacakkaṁ.	sammā avāyāmaḥ dhammo tam dhammam pavatteti iti dhammacakka 
PA_ps_2.7:6.24	Sammāsati dhammo taṁ dhammaṁ pavattetīti—dhammacakkaṁ.	sammā sati dhammaḥ tam dhammam pavatteti iti dhammacakka 
PA_ps_2.7:6.25	Sammāsamādhi dhammo taṁ dhammaṁ pavattetīti—dhammacakkaṁ.	sammāsamādhi dhammo tam dhammam pavatteti iti dhammacakka 
PA_ps_2.7:7.1	Ādhipateyyaṭṭhena indriyaṁ dhammo taṁ dhammaṁ pavattetīti—dhammacakkaṁ.	ādhipateyya ṭṭhena indriyam tam dhammam pavatteti iti dhammacakka 
PA_ps_2.7:7.2	Akampiyaṭṭhena balaṁ dhammo taṁ dhammaṁ pavattetīti—dhammacakkaṁ.	a kampiya ṭṭhena balam dhammo tam dhammam pavatteti iti dhammacakka 
PA_ps_2.7:7.3	Niyyānikaṭṭhena bojjhaṅgo dhammo taṁ dhammaṁ pavattetīti—dhammacakkaṁ.	niyyānika ṭṭhena bojjhaṅgaḥ dhammo tam dhammam pavatteti iti dhammacakka 
PA_ps_2.7:7.4	Hetuṭṭhena maggo dhammo taṁ dhammaṁ pavattetīti—dhammacakkaṁ.	hetu ṭṭhena maggaḥ dhammo tam dhammam pavatteti iti dhammacakka 
PA_ps_2.7:7.5	Upaṭṭhānaṭṭhena satipaṭṭhānā dhammo taṁ dhammaṁ pavattetīti—dhammacakkaṁ.	upaṭṭhāna ṭṭhena sati paṭṭhānā dhammo tam dhammam pavatteti iti dhammacakka 
PA_ps_2.7:7.6	Padahanaṭṭhena sammappadhānā dhammo taṁ dhammaṁ pavattetīti—dhammacakkaṁ.	padahana ṭṭhena sammappadhānāḥ dhammo tam dhammam pavatteti iti dhammacakka 
PA_ps_2.7:7.7	Ijjhanaṭṭhena iddhipādā dhammo taṁ dhammaṁ pavattetīti—dhammacakkaṁ.	iddhipādāḥ tam dhammam pavatteti iti dhammacakka 
PA_ps_2.7:7.8	Tathaṭṭhena saccā dhammo taṁ dhammaṁ pavattetīti—dhammacakkaṁ.	tathaṭṭhena saccā dhammo tam dhammam pavatteti iti dhammacakka 
PA_ps_2.7:7.9	Avikkhepaṭṭhena samatho dhammo taṁ dhammaṁ pavattetīti—dhammacakkaṁ.	avikkhepa ṭṭhena samathaḥ dhammo tam dhammam pavatteti iti dhammacakka 
PA_ps_2.7:7.10	Anupassanaṭṭhena vipassanā dhammo taṁ dhammaṁ pavattetīti—dhammacakkaṁ.	anupassana ṭṭhena vipassanā dhammo tam dhammam pavatteti iti dhammacakka 
PA_ps_2.7:7.11	Ekarasaṭṭhena samathavipassanā dhammo taṁ dhammaṁ pavattetīti—dhammacakkaṁ.	ekarasa ṭṭhena samatha vipassanā dhammo tam dhammam pavatteti iti dhammacakka 
PA_ps_2.7:7.12	Anativattanaṭṭhena yuganaddhaṁ dhammo taṁ dhammaṁ pavattetīti—dhammacakkaṁ.	an ativattana ṭṭhena yuga naddham dhammo tam dhammam pavatteti iti dhammacakka 
PA_ps_2.7:7.13	Saṁvaraṭṭhena sīlavisuddhi dhammo taṁ dhammaṁ pavattetīti—dhammacakkaṁ.	savaraṭṭhena sīla visuddhi dhammo tam dhammam pavatteti iti dhammacakka 
PA_ps_2.7:7.14	Avikkhepaṭṭhena cittavisuddhi dhammo taṁ dhammaṁ pavattetīti—dhammacakkaṁ.	avikkhepa ṭṭhena citta visuddhi dhammo tam dhammam pavatteti iti dhammacakka 
PA_ps_2.7:7.15	Dassanaṭṭhena diṭṭhivisuddhi dhammo taṁ dhammaṁ pavattetīti—dhammacakkaṁ.	dassana ṭṭhena diṭṭhi visuddhi dhammo tam dhammam pavatteti iti dhammacakka 
PA_ps_2.7:7.16	Muttaṭṭhena vimokkho dhammo taṁ dhammaṁ pavattetīti—dhammacakkaṁ.	mutta ṭṭhena vimokkhaḥ dhammo tam dhammam pavatteti iti dhammacakka 
PA_ps_2.7:7.17	Paṭivedhaṭṭhena vijjā dhammo taṁ dhammaṁ pavattetīti—dhammacakkaṁ.	paṭivedha ṭṭhena vijjā dhammo tam dhammam pavatteti iti dhammacakka 
PA_ps_2.7:7.18	Pariccāgaṭṭhena vimutti dhammo taṁ dhammaṁ pavattetīti—dhammacakkaṁ.	pariccāga ṭṭhena vimutti dhammo tam dhammam pavatteti iti dhammacakka 
PA_ps_2.7:7.19	Samucchedaṭṭhena khaye ñāṇaṁ dhammo taṁ dhammaṁ pavattetīti—dhammacakkaṁ.	samuccheda ṭṭhena khaye ñāṇam tam dhammam pavatteti iti dhammacakka 
PA_ps_2.7:7.20	Paṭippassaddhaṭṭhena anuppāde ñāṇaṁ dhammo taṁ dhammaṁ pavattetīti—dhammacakkaṁ.	paṭippassaddha ṭṭhena anuppāde ñāṇam dhammo tam dhammam pavatteti iti dhammacakka 
PA_ps_2.7:7.21	Chando mūlaṭṭhena dhammo taṁ dhammaṁ pavattetīti—dhammacakkaṁ.	chandaḥ mūla ṭṭhena dhammo tam dhammam pavatteti iti dhammacakka 
PA_ps_2.7:7.22	Manasikāro samuṭṭhānaṭṭhena dhammo taṁ dhammaṁ pavattetīti—dhammacakkaṁ.	manasikāraḥ samuṭṭhāna ṭṭhena dhammo tam dhammam pavatteti iti dhammacakka 
PA_ps_2.7:7.23	Phasso samodhānaṭṭhena dhammo taṁ dhammaṁ pavattetīti—dhammacakkaṁ.	phassaḥ samodhāna ṭṭhena dhammo tam dhammam pavatteti iti dhammacakka 
PA_ps_2.7:7.24	Vedanā samosaraṇaṭṭhena dhammo taṁ dhammaṁ pavattetīti—dhammacakkaṁ.	vedanā samosaraṇa ṭṭhena dhammo tam dhammam pavatteti iti dhammacakka 
PA_ps_2.7:7.25	Samādhi pamukhaṭṭhena dhammo taṁ dhammaṁ pavattetīti—dhammacakkaṁ.	samādhi tam dhammam pavatteti iti dhammacakka 
PA_ps_2.7:7.26	Sati ādhipateyyaṭṭhena dhammo taṁ dhammaṁ pavattetīti—dhammacakkaṁ.	sati ādhipateyya ṭṭhena dhammo tam dhammam pavatteti iti dhammacakka 
PA_ps_2.7:7.27	Paññā taduttaraṭṭhena dhammo taṁ dhammaṁ pavattetīti—dhammacakkaṁ.	paññā tad uttara ṭṭhena dhammo tam dhammam pavatteti iti dhammacakka 
PA_ps_2.7:7.28	Vimutti sāraṭṭhena dhammo taṁ dhammaṁ pavattetīti—dhammacakkaṁ.	vimutti sāraṭṭhena dhammo tam dhammam pavatteti iti dhammacakka 
PA_ps_2.7:7.29	Amatogadhaṁ nibbānaṁ pariyosānaṭṭhena dhammo taṁ dhammaṁ pavattetīti—dhammacakkaṁ.	amatogadham nibbānam pariyosāna ṭṭhena dhammo tam dhammam pavatteti iti dhammacakka 
PA_ps_2.7:8.1	“Taṁ kho panidaṁ dukkhaṁ ariyasaccaṁ pariññeyyan”ti …pe…	tam kho panidam dukkham ariya saccam pariññeyyanti pe 
PA_ps_2.7:8.2	pariññātanti pubbe ananussutesu dhammesu cakkhuṁ udapādi …pe…	pariññātanti pubbe an anussutesu dhammesu cakkhum udapādi pe 
PA_ps_2.7:8.3	āloko udapādi.	ālokaḥ udapādi 
PA_ps_2.7:9.1	Cakkhuṁ udapādīti—	cakkhum udapādi iti 
PA_ps_2.7:9.2	kenaṭṭhena …pe…	kenaṭṭhena pe 
PA_ps_2.7:9.3	āloko udapādīti—	ālokaḥ udapādi iti 
PA_ps_2.7:9.4	kenaṭṭhena?	kenaṭṭhena 
PA_ps_2.7:9.5	Cakkhuṁ udapādīti—	cakkhum udapādi iti 
PA_ps_2.7:9.6	dassanaṭṭhena …pe…	dassana ṭṭhena pe 
PA_ps_2.7:9.7	āloko udapādīti—	ālokaḥ udapādi iti 
PA_ps_2.7:9.8	obhāsaṭṭhena.	obhā saṭṭhena 
PA_ps_2.7:9.9	Cakkhuṁ dhammo, dassanaṭṭho attho …pe…	cakkhum dhammaḥ dassana aṭṭhaḥ attho pe 
PA_ps_2.7:9.10	āloko dhammo, obhāsaṭṭho attho.	ālokaḥ dhammaḥ obhā saṭṭhaḥ attho 
PA_ps_2.7:9.11	Ime pañca dhammā pañca atthā dukkhavatthukā saccavatthukā saccārammaṇā saccagocarā saccasaṅgahitā saccapariyāpannā sacce samudāgatā sacce ṭhitā sacce patiṭṭhitā.	ime pañca dhammā pañca atthā dukkha vatthukā sacca vatthukā sacca ārammaṇā sacca gocarā sacca saṅgahitā sacca pariyāpannā sacce samudāgatā sacce ṭhitā sacce patiṭṭhitā 
PA_ps_2.7:10.1	Dhammacakkanti kenaṭṭhena dhammacakkaṁ?	dhammacakkanti kenaṭṭhena dhammacakka 
PA_ps_2.7:10.2	Dhammañca pavatteti cakkañcāti—dhammacakkaṁ.	dhammañca pavatta iti cakkañca ati dhamma cakka 
PA_ps_2.7:10.3	Cakkañca pavatteti dhammañcāti—dhammacakkaṁ.	cakkañca pavatta iti 
PA_ps_2.7:10.4	Dhammena pavattetīti—dhammacakkaṁ.	dhammena pavatteti iti dhammacakka 
PA_ps_2.7:10.5	Dhammacariyāya pavattetīti—dhammacakkaṁ.	dhamma cariyāya pavatteti iti dhammacakka 
PA_ps_2.7:10.6	Dhamme ṭhito pavattetīti—dhammacakkaṁ.	dhamme ṭhitaḥ pavatteti iti dhammacakka 
PA_ps_2.7:10.7	Dhamme patiṭṭhito pavattetīti—dhammacakkaṁ …pe…	dhamme patiṭṭhitaḥ pavatteti iti dhammacakkam pe 
PA_ps_2.7:10.8	amatogadhaṁ nibbānaṁ pariyosānaṭṭhena dhammo taṁ dhammaṁ pavattetīti—dhammacakkaṁ.	amatogadham nibbānam pariyosāna ṭṭhena dhammo tam dhammam pavatteti iti dhammacakka 
PA_ps_2.7:11.1	“Idaṁ dukkhasamudayaṁ ariyasaccan”ti pubbe ananussutesu dhammesu cakkhuṁ udapādi …pe…	idam dukkha samudayam ariya saccanti pubbe an anussutesu dhammesu cakkhum udapādi pe 
PA_ps_2.7:11.2	āloko udapādi …pe…	ālokaḥ udapādi pe 
PA_ps_2.7:11.3	“taṁ kho panidaṁ dukkhasamudayaṁ ariyasaccaṁ pahātabban”ti …pe…	tam kho panidam dukkha samudayam ariya saccam pahātabbanti pe 
PA_ps_2.7:11.4	“pahīnan”ti pubbe ananussutesu dhammesu cakkhuṁ udapādi …pe…	pahīnam ti pubbe ananussutesu dhammesu cakkhum udapādi pe 
PA_ps_2.7:11.5	āloko udapādi.	ālokaḥ udapādi 
PA_ps_2.7:12.1	Cakkhuṁ udapādīti—	cakkhum udapādi iti 
PA_ps_2.7:12.2	kenaṭṭhena …pe…	kenaṭṭhena pe 
PA_ps_2.7:12.3	āloko udapādīti—	ālokaḥ udapādi iti 
PA_ps_2.7:12.4	kenaṭṭhena?	kenaṭṭhena 
PA_ps_2.7:12.5	Cakkhuṁ udapādīti—	cakkhum udapādi iti 
PA_ps_2.7:12.6	dassanaṭṭhena …pe…	dassana ṭṭhena pe 
PA_ps_2.7:12.7	āloko udapādīti—	ālokaḥ udapādi iti 
PA_ps_2.7:12.8	obhāsaṭṭhena.	obhā saṭṭhena 
PA_ps_2.7:13.1	Cakkhuṁ dhammo, dassanaṭṭho attho …pe…	cakkhum dhammaḥ dassana aṭṭhaḥ attho pe 
PA_ps_2.7:13.2	āloko dhammo, obhāsaṭṭho attho.	ālokaḥ dhammaḥ obhā saṭṭhaḥ attho 
PA_ps_2.7:13.3	Ime pañca dhammā pañca atthā samudayavatthukā saccavatthukā …pe…	ime pañca dhammā pañca atthā samudaya vatthukā sacca vatthukā pe 
PA_ps_2.7:13.4	nirodhavatthukā saccavatthukā …pe…	nirodha vatthukā sacca vatthukā pe 
PA_ps_2.7:13.5	maggavatthukā saccavatthukā saccārammaṇā saccagocarā saccasaṅgahitā saccapariyāpannā sacce samudāgatā sacce ṭhitā sacce patiṭṭhitā.	magga vatthukā sacca vatthukā sacca ārammaṇā sacca gocarā sacca saṅgahitā sacca pariyāpannā sacce samudāgatā sacce ṭhitā sacce patiṭṭhitā 
PA_ps_2.7:14.1	Dhammacakkanti kenaṭṭhena dhammacakkaṁ?	dhammacakkanti kenaṭṭhena dhammacakka 
PA_ps_2.7:14.2	Dhammañca pavatteti cakkañcāti—dhammacakkaṁ.	dhammañca pavatta iti cakkañca ati dhamma cakka 
PA_ps_2.7:14.3	Cakkañca pavatteti dhammañcāti—dhammacakkaṁ.	cakkañca pavatta iti 
PA_ps_2.7:14.4	Dhammena pavattetīti—dhammacakkaṁ.	dhammena pavatteti iti dhammacakka 
PA_ps_2.7:14.5	Dhammacariyāya pavattetīti—dhammacakkaṁ.	dhamma cariyāya pavatteti iti dhammacakka 
PA_ps_2.7:14.6	Dhamme ṭhito pavattetīti—dhammacakkaṁ.	dhamme ṭhitaḥ pavatteti iti dhammacakka 
PA_ps_2.7:14.7	Dhamme patiṭṭhito pavattetīti—dhammacakkaṁ …pe…	dhamme patiṭṭhitaḥ pavatteti iti dhammacakkam pe 
PA_ps_2.7:14.8	amatogadhaṁ nibbānaṁ pariyosānaṭṭhena dhammo taṁ dhammaṁ pavattetīti—dhammacakkaṁ.	amatogadham nibbānam pariyosāna ṭṭhena dhammo tam dhammam pavatteti iti dhammacakka 
PA_ps_2.7:15.0	2.7.2. Satipaṭṭhānavāra	sati paṭṭhāna vāra 
PA_ps_2.7:15.1	“‘Ayaṁ kāye kāyānupassanā’ti me, bhikkhave, pubbe ananussutesu dhammesu cakkhuṁ udapādi …pe…	ayam kāye kāya anupassanā ti me bhikkhave pubbe an anussutesu dhammesu cakkhum udapādi pe 
PA_ps_2.7:15.2	āloko udapādi.	ālokaḥ udapādi 
PA_ps_2.7:15.3	Sā kho panāyaṁ kāye kāyānupassanā bhāvetabbāti me, bhikkhave …pe…	sā kho pana ayam kāye kāya anupassanā bhāvetabbā ati me bhikkhave pe 
PA_ps_2.7:15.4	bhāvitāti me, bhikkhave, pubbe ananussutesu dhammesu cakkhuṁ udapādi …pe…	bhāvitā ati me bhikkhave pubbe an anussutesu dhammesu cakkhum udapādi pe 
PA_ps_2.7:15.5	āloko udapādi.	ālokaḥ udapādi 
PA_ps_2.7:16.1	Ayaṁ vedanāsu …pe…	ayam vedanāsu pe 
PA_ps_2.7:16.2	ayaṁ citte …	ayam citte 
PA_ps_2.7:16.3	ayaṁ dhammesu dhammānupassanāti me, bhikkhave, pubbe ananussutesu dhammesu cakkhuṁ udapādi …pe…	ayam dhammesu dhamma anupassanā ti me bhikkhave pubbe an anussutesu dhammesu cakkhum udapādi pe 
PA_ps_2.7:16.4	āloko udapādi.	ālokaḥ udapādi 
PA_ps_2.7:16.5	Sā kho panāyaṁ dhammesu dhammānupassanā bhāvetabbāti me, bhikkhave …pe…	sā kho pana ayam dhammesu dhamma anupassanā bhāvetabbā ati me bhikkhave pe 
PA_ps_2.7:16.6	bhāvitāti me, bhikkhave, pubbe ananussutesu dhammesu cakkhuṁ udapādi …pe…	bhāvitā ati me bhikkhave pubbe an anussutesu dhammesu cakkhum udapādi pe 
PA_ps_2.7:16.7	āloko udapādi”.	ālokaḥ udapādi 
PA_ps_2.7:17.1	“Ayaṁ kāye kāyānupassanā”ti pubbe ananussutesu dhammesu cakkhuṁ udapādi …pe…	ayam kāye kāya anupassanā ti pubbe ananussutesu dhammesu cakkhum udapādi pe 
PA_ps_2.7:17.2	āloko udapādi …pe…	ālokaḥ udapādi pe 
PA_ps_2.7:17.3	sā kho panāyaṁ kāye kāyānupassanā bhāvetabbāti …pe…	sā kho pana ayam kāye kāya anupassanā bhāvetabbā ati pe 
PA_ps_2.7:17.4	bhāvitāti pubbe ananussutesu dhammesu cakkhuṁ udapādi …pe…	bhāvitā ati pubbe ananussutesu dhammesu cakkhum udapādi pe 
PA_ps_2.7:17.5	āloko udapādi.	ālokaḥ udapādi 
PA_ps_2.7:18.1	Cakkhuṁ udapādīti—	cakkhum udapādi iti 
PA_ps_2.7:18.2	kenaṭṭhena …pe…	kenaṭṭhena pe 
PA_ps_2.7:18.3	āloko udapādīti—	ālokaḥ udapādi iti 
PA_ps_2.7:18.4	kenaṭṭhena?	kenaṭṭhena 
PA_ps_2.7:18.5	Cakkhuṁ udapādīti—	cakkhum udapādi iti 
PA_ps_2.7:18.6	dassanaṭṭhena …pe…	dassana ṭṭhena pe 
PA_ps_2.7:18.7	āloko udapādīti—	ālokaḥ udapādi iti 
PA_ps_2.7:18.8	obhāsaṭṭhena.	obhā saṭṭhena 
PA_ps_2.7:19.1	Cakkhuṁ dhammo, dassanaṭṭho attho …pe…	cakkhum dhammaḥ dassana aṭṭhaḥ attho pe 
PA_ps_2.7:19.2	āloko dhammo, obhāsaṭṭho attho.	ālokaḥ dhammaḥ obhā saṭṭhaḥ attho 
PA_ps_2.7:19.3	Ime pañca dhammā pañca atthā kāyavatthukā satipaṭṭhānavatthukā …pe…	ime pañca dhammā pañca atthā kāya vatthukā sati paṭṭhāna vatthukā pe 
PA_ps_2.7:19.4	vedanāvatthukā satipaṭṭhānavatthukā …	vedanā vatthukā sati paṭṭhāna vatthukā 
PA_ps_2.7:19.5	cittavatthukā satipaṭṭhānavatthukā …	citta vatthukā sati paṭṭhāna vatthukā 
PA_ps_2.7:19.6_0	dhammavatthukā satipaṭṭhānavatthukā satipaṭṭhānārammaṇā satipaṭṭhānagocarā satipaṭṭhānasaṅgahitā	dhamma vatthukā sati paṭṭhāna vatthukā sati paṭṭhāna ārammaṇā sati paṭṭhāna gocarā sati paṭṭhāna saṅgahitā 
PA_ps_2.7:19.6_1	satipaṭṭhānapariyāpannā satipaṭṭhāne samudāgatā satipaṭṭhāne ṭhitā satipaṭṭhāne patiṭṭhitā.	sati paṭṭhāna pariyāpannā sati paṭṭhāne samudāgatā sati paṭṭhāne ṭhitā sati paṭṭhāne patiṭṭhitā 
PA_ps_2.7:20.1	Dhammacakkanti kenaṭṭhena dhammacakkaṁ?	dhammacakkanti kenaṭṭhena dhammacakka 
PA_ps_2.7:20.2	Dhammañca pavatteti cakkañcāti—dhammacakkaṁ.	dhammañca pavatta iti cakkañca ati dhamma cakka 
PA_ps_2.7:20.3	Cakkañca pavatteti dhammañcāti—dhammacakkaṁ.	cakkañca pavatta iti 
PA_ps_2.7:20.4	Dhammena pavattetīti—dhammacakkaṁ.	dhammena pavatteti iti dhammacakka 
PA_ps_2.7:20.5	Dhammacariyāya pavattetīti—dhammacakkaṁ.	dhamma cariyāya pavatteti iti dhammacakka 
PA_ps_2.7:20.6	Dhamme ṭhito pavattetīti—dhammacakkaṁ.	dhamme ṭhitaḥ pavatteti iti dhammacakka 
PA_ps_2.7:20.7	Dhamme patiṭṭhito pavattetīti—dhammacakkaṁ …pe…	dhamme patiṭṭhitaḥ pavatteti iti dhammacakkam pe 
PA_ps_2.7:20.8	amatogadhaṁ nibbānaṁ pariyosānaṭṭhena dhammo taṁ dhammaṁ pavattetīti—dhammacakkaṁ.	amatogadham nibbānam pariyosāna ṭṭhena dhammo tam dhammam pavatteti iti dhammacakka 
PA_ps_2.7:21.0	2.7.3. Iddhipādavāra	iddhipāda vāra 
PA_ps_2.7:21.1	“‘Ayaṁ chandasamādhipadhānasaṅkhārasamannāgato iddhipādo’ti me, bhikkhave pubbe ananussutesu dhammesu cakkhuṁ udapādi …pe…	ayam chanda samādhi padhāna saṅkhāra samannāgataḥ iddhipādaḥ ti me bhikkhave pubbe ananussutesu dhammesu cakkhum udapādi pe 
PA_ps_2.7:21.2	āloko udapādi.	ālokaḥ udapādi 
PA_ps_2.7:21.3	‘So kho panāyaṁ chandasamādhipadhānasaṅkhārasamannāgato iddhipādo bhāvetabbo’ti me, bhikkhave …pe…	saḥ kho pana ayam chanda samādhi padhāna saṅkhāra samannāgataḥ iddhipādaḥ bhāvetabbaḥ iti me bhikkhave pe 
PA_ps_2.7:21.4	bhāvitoti me, bhikkhave, pubbe ananussutesu dhammesu cakkhuṁ udapādi …pe…	bhāvito ti me bhikkhave pubbe an anussutesu dhammesu cakkhum udapādi pe 
PA_ps_2.7:21.5	āloko udapādi.	ālokaḥ udapādi 
PA_ps_2.7:22.1	Ayaṁ vīriyasamādhi …pe…	ayam 
PA_ps_2.7:22.2	ayaṁ cittasamādhi …pe…	ayam citta samādhi pe 
PA_ps_2.7:22.3	ayaṁ vīmaṁsāsamādhipadhānasaṅkhārasamannāgato iddhipādoti me, bhikkhave, pubbe ananussutesu dhammesu cakkhuṁ udapādi …pe…	ayam vīmasā samādhi padhāna saṅkhāra samannāgataḥ iddhipādaḥ ti me bhikkhave pubbe ananussutesu dhammesu cakkhum udapādi pe 
PA_ps_2.7:22.4	āloko udapādi.	ālokaḥ udapādi 
