segmentnr	original	analyzed
PA_patthana_16.68:0.1	Paṭṭhānapakaraṇa	▁ paṭṭhānapakaraṇa
PA_patthana_16.68:0.2	Dhammānulomapaccanīya (3), Tikadukapaṭṭhānapāḷi (4)	▁dhammā nulomapaccanīya ▁tik aduk apaṭṭhānapāḷi
PA_patthana_16.68:0.3	16.68. Sanidassanattika, Cittasampayuttaduka	▁sa nidassan attika ▁citt asampayutt aduk a
PA_patthana_16.68:1.1_0	Anidassanaappaṭighaṁ cittasampayuttaṁ dhammaṁ paṭicca naanidassanaappaṭigho nacittasampayutto	▁an idassanaappaṭigh aṃ ▁citt asampayutt aṃ ▁dhammaṃ ▁paṭicca ▁na an idassanaappaṭigh o ▁na citt asampayutt o
PA_patthana_16.68:1.1_1	dhammo uppajjati hetupaccayā. Anidassanaappaṭighaṁ cittasampayuttaṁ dhammaṁ paṭicca	▁dhammo ▁uppajjati ▁hetupaccayā ▁an idassanaappaṭigh aṃ ▁citt asampayutt aṃ ▁dhammaṃ ▁paṭicca
PA_patthana_16.68:1.1_2	nasanidassanasappaṭigho nacittasampayutto dhammo uppajjati hetupaccayā …pe… anidassanaappaṭighaṁ	▁nasanidassanas a ppaṭi gh o ▁na citt asampayutt o ▁dhammo ▁uppajjati ▁hetupaccayā ▁pe ▁an idassanaappaṭigh aṃ
PA_patthana_16.68:1.1_3	cittasampayuttaṁ dhammaṁ paṭicca nasanidassanasappaṭigho nacittasampayutto ca naanidassanasappaṭigho	▁citt asampayutt aṃ ▁dhammaṃ ▁paṭicca ▁nasanidassanas a ppaṭi gh o ▁na citt asampayutt o ▁ca ▁na a nidassan a sappaṭigh o
PA_patthana_16.68:1.1_4	nacittasampayutto ca dhammā uppajjanti hetupaccayā. (Saṅkhittaṁ.)	▁na citt asampayutt o ▁ca ▁dhammā ▁uppajjanti ▁hetupaccayā ▁saṃkhittaṃ
PA_patthana_16.68:2.1	Hetuyā cha, adhipatiyā cha …pe… aññamaññe tīṇi …pe… avigate cha.	▁hetuyā ▁cha ▁ adhipatiyā ▁cha ▁pe ▁aññamaññ e ▁tīṇi ▁pe ▁avigate ▁cha
