segmentnr	original	analyzed
PA_pvr_1.16:0.1	Parivāra	parivāra 
PA_pvr_1.16:0.2	Bhikkhuvibhaṅga	bhikkhu vibhaṅga 
PA_pvr_1.16:0.3	Dutiyabhāga	dutiya bhāga 
PA_pvr_1.16:0.4	1.6 Samuccayavāra	samuccayavāra 
PA_pvr_1.16:1.1	Methunaṁ dhammaṁ paṭisevanapaccayā kati āpattiyo āpajjati?	methunam dhammam paṭisevana paccayā kati āpattiyaḥ āpajjati 
PA_pvr_1.16:1.2	Methunaṁ dhammaṁ paṭisevanapaccayā catasso āpattiyo āpajjati.	methunam dhammam paṭisevana paccayā catassaḥ āpattiyaḥ āpajjati 
PA_pvr_1.16:1.3	Akkhāyite sarīre methunaṁ dhammaṁ paṭisevati, āpatti pārājikassa;	akkhāyite sarīre methunam dhammam paṭisevati āpatti pārājikassa 
PA_pvr_1.16:1.4	yebhuyyena khāyite sarīre methunaṁ dhammaṁ paṭisevati, āpatti thullaccayassa;	yebhuyyena khāyite sarīre methunam dhammam paṭisevati āpatti thullaccayassa 
PA_pvr_1.16:1.5	vaṭṭakate mukhe acchupantaṁ aṅgajātaṁ paveseti, āpatti dukkaṭassa;	mukhe acchupantam aṅga jātam paveseti āpatti dukkaṭassa 
PA_pvr_1.16:1.6	jatumaṭṭhake pācittiyaṁ—	jatumaṭṭhake pācittiya 
PA_pvr_1.16:1.7	methunaṁ dhammaṁ paṭisevanapaccayā imā catasso āpattiyo āpajjati.	methunam dhammam paṭisevana paccayā imā catasso āpattiyaḥ āpajjati 
PA_pvr_1.16:1.8	Tā āpattiyo catunnaṁ vipattīnaṁ kati vipattiyo bhajanti?	tāḥ āpattiyaḥ catunnam vipattīnam kati vipattiyaḥ bhajanti 
PA_pvr_1.16:1.9	Sattannaṁ āpattikkhandhānaṁ katihi āpattikkhandhehi saṅgahitā?	sattannam āpatti kkhandhānam katihi āpatti kkhandhehi saṅgahitā 
PA_pvr_1.16:1.10	Channaṁ āpattisamuṭṭhānānaṁ katihi samuṭṭhānehi samuṭṭhanti?	channam āpatti samuṭṭhānānam katihi samuṭṭhānehi samuṭṭhanti 
PA_pvr_1.16:1.11	Catunnaṁ adhikaraṇānaṁ katamaṁ adhikaraṇaṁ?	catunnam adhikaraṇānam katamam 
PA_pvr_1.16:1.12	Sattannaṁ samathānaṁ katihi samathehi sammanti?	sattannam samathānam katihi samathehi 
PA_pvr_1.16:1.13	Tā āpattiyo catunnaṁ vipattīnaṁ dve vipattiyo bhajanti—	tāḥ āpattiyaḥ catunnam vipattīnam dve vipattiyaḥ bhajanti 
PA_pvr_1.16:1.14	siyā sīlavipattiṁ siyā ācāravipattiṁ.	siyā sīla vipattim siyā ācāra vipatti 
PA_pvr_1.16:1.15	Sattannaṁ āpattikkhandhānaṁ catūhi āpattikkhandhehi saṅgahitā—	sattannam āpatti kkhandhānam catūhi āpatti kkhandhehi saṅgahitā 
PA_pvr_1.16:1.16	siyā pārājikāpattikkhandhena, siyā thullaccayāpattikkhandhena, siyā pācittiyāpattikkhandhena, siyā dukkaṭāpattikkhandhena.	siyā pārājika āpatti kkhandhena siyā thullaccaya āpatti kkhandhena siyā pācittiya āpatti kkhandhena siyā dukkaṭa āpatti kkhandhena 
PA_pvr_1.16:1.17	Channaṁ āpattisamuṭṭhānānaṁ ekena samuṭṭhānena samuṭṭhanti—	channam āpatti samuṭṭhānānam ekena samuṭṭhānena samuṭṭhanti 
PA_pvr_1.16:1.18	kāyato ca cittato ca samuṭṭhanti, na vācato.	kāyataḥ ca cittataḥ ca samuṭṭhanti na vācataḥ 
PA_pvr_1.16:1.19	Catunnaṁ adhikaraṇānaṁ, āpattādhikaraṇaṁ.	āpattādhikaraṇa 
PA_pvr_1.16:1.20	Sattannaṁ samathānaṁ, tīhi samathehi sammanti—	sattannam samathāna tīhi samathehi 
PA_pvr_1.16:1.21	siyā sammukhāvinayena ca, paṭiññātakaraṇena ca, siyā sammukhāvinayena ca tiṇavatthārakena ca …pe….	siyā sammukhā vinayena ca paṭiññāta karaṇena ca siyā sammukhā vinayena ca tiṇavatthārakena ca pe 
PA_pvr_1.16:2.1	Anādariyaṁ paṭicca udake uccāraṁ vā passāvaṁ vā kheḷaṁ vā karaṇapaccayā kati āpattiyo āpajjati?	anādariyam paṭicca udake uccāram vā passāvam vā kheḷam vā karaṇa paccayā kati āpattiyaḥ āpajjati 
PA_pvr_1.16:2.2	Anādariyaṁ paṭicca udake uccāraṁ vā passāvaṁ vā kheḷaṁ vā karaṇapaccayā ekaṁ āpattiṁ āpajjati.	anādariyam paṭicca udake uccāram vā passāvam vā kheḷam vā karaṇa paccayā ekam āpattim āpajjati 
PA_pvr_1.16:2.3	Dukkaṭaṁ—	dukkaṭa 
PA_pvr_1.16:2.4	anādariyaṁ paṭicca udake uccāraṁ vā passāvaṁ vā kheḷaṁ vā karaṇapaccayā imaṁ ekaṁ āpattiṁ āpajjati.	anādariyam paṭicca udake uccāram vā passāvam vā kheḷam vā karaṇa paccayā imam ekam āpattim āpajjati 
PA_pvr_1.16:2.5	Sā āpatti catunnaṁ vipattīnaṁ kati vipattiyo bhajati?	sā āpatti catunnam vipattīnam kati vipattiyaḥ bhajati 
PA_pvr_1.16:2.6	Sattannaṁ āpattikkhandhānaṁ katihi āpattikkhandhehi saṅgahitā?	sattannam āpatti kkhandhānam katihi āpatti kkhandhehi saṅgahitā 
PA_pvr_1.16:2.7	Channaṁ āpattisamuṭṭhānānaṁ katihi samuṭṭhānehi samuṭṭhāti?	channam āpatti samuṭṭhānānam katihi samuṭṭhānehi samuṭṭhāti 
PA_pvr_1.16:2.8	Catunnaṁ adhikaraṇānaṁ katamaṁ adhikaraṇaṁ?	catunnam adhikaraṇānam katamam 
PA_pvr_1.16:2.9	Sattannaṁ samathānaṁ katihi samathehi sammati?	sattannam samathānam katihi samathehi sammati 
PA_pvr_1.16:2.10	Sā āpatti catunnaṁ vipattīnaṁ ekaṁ vipattiṁ bhajati—	sā āpatti catunnam vipattīnam ekam vipattim bhajati 
PA_pvr_1.16:2.11	ācāravipattiṁ.	ācāra vipatti 
PA_pvr_1.16:2.12	Sattannaṁ āpattikkhandhānaṁ ekena āpattikkhandhena saṅgahitā—	sattannam āpatti kkhandhānam ekena āpatti kkhandhena saṅgahitā 
PA_pvr_1.16:2.13	dukkaṭāpattikkhandhena.	dukkaṭa āpatti kkhandhena 
PA_pvr_1.16:2.14	Channaṁ āpattisamuṭṭhānānaṁ ekena samuṭṭhānena samuṭṭhāti—	channam āpatti samuṭṭhānānam ekena samuṭṭhānena samuṭṭhāti 
PA_pvr_1.16:2.15	kāyato ca cittato ca samuṭṭhāti, na vācato.	kāyataḥ ca cittataḥ ca samuṭṭhāti na vācataḥ 
PA_pvr_1.16:2.16	Catunnaṁ adhikaraṇānaṁ, āpattādhikaraṇaṁ.	āpattādhikaraṇa 
PA_pvr_1.16:2.17	Sattannaṁ samathānaṁ tīhi samathehi sammati—	sattannam samathānam tīhi samathehi sammati 
PA_pvr_1.16:2.18	siyā sammukhāvinayena ca paṭiññātakaraṇena ca, siyā sammukhāvinayena ca tiṇavatthārakena cāti.	siyā sammukhā vinayena ca paṭiññāta karaṇena ca siyā sammukhā vinayena ca tiṇavatthārakena ca ati 
PA_pvr_1.16:3.1	Samuccayavāro niṭṭhito aṭṭhamo.	samuccaya vāraḥ niṭṭhitaḥ aṭṭhamaḥ 
PA_pvr_1.16:3.2	Aṭṭhapaccayavārā niṭṭhitā.	aṭṭha paccaya vārā niṭṭhitā 
PA_pvr_1.16:3.3	Mahāvibhaṅge soḷasamahāvārā niṭṭhitā.	mahāvibhaṅge soḷasa mahāvārā niṭṭhitā 
PA_pvr_1.16:4.1	Bhikkhuvibhaṅgamahāvāro niṭṭhito.	bhikkhu vibhaṅga mahāvāro niṭṭhito 
