segmentnr	original	analyzed
PA_patthana_1.6:98.1_4	khandhā ca rūpajīvitindriyañca kaṭattārūpānaṁ atthipaccayena paccayo.	khandhā ca rūpa jīvita indriyam ca kaṭattā rūpānaṃ atthi paccayena paccayaḥ 
PA_patthana_1.6:99.1_0	Asaṅkiliṭṭhasaṅkilesiko ca asaṅkiliṭṭhaasaṅkilesiko ca dhammā asaṅkiliṭṭhaasaṅkilesikassa	asaṅkiliṭṭha saṅkilesiko ca asaṅkiliṭṭha asaṅkilesiko ca dhammā asaṅkiliṭṭha asaṅkilesikassa 
PA_patthana_1.6:99.1_1	dhammassa atthipaccayena paccayo—sahajātaṁ, purejātaṁ. Sahajāto—asaṅkiliṭṭhaasaṅkilesiko	dhammassa atthi paccayena paccayaḥ sahajāta purejāta sahajātaḥ asaṅkiliṭṭha asaṅkilesikaḥ 
PA_patthana_1.6:99.1_2	eko khandho ca vatthu ca tiṇṇannaṁ khandhānaṁ atthipaccayena paccayo …pe….	ekaḥ khandho ca vatthu ca tiṇṇannam khandhānam atthi paccayena paccayaḥ pe 
PA_patthana_1.6:100.1_0	Saṅkiliṭṭhasaṅkilesiko ca asaṅkiliṭṭhasaṅkilesiko ca dhammā saṅkiliṭṭhasaṅkilesikassa	saṅkiliṭṭha saṅkilesiko ca asaṅkiliṭṭha saṅkilesiko ca dhammā saṅkiliṭṭha saṅkilesikassa 
PA_patthana_1.6:100.1_1	dhammassa atthipaccayena paccayo—sahajātaṁ, purejātaṁ. Sahajāto—saṅkiliṭṭhasaṅkilesiko	dhammassa atthi paccayena paccayaḥ usahajāta purejāta sahajātaḥ usaṅkiliṭṭha saṅkilesiko 
PA_patthana_1.6:100.1_2	eko khandho ca vatthu ca tiṇṇannaṁ khandhānaṁ atthipaccayena paccayo … dve khandhā …pe….	ekaḥ khandhaḥ ca vatthu ca tiṇṇannam khandhānam atthi paccayena paccayaḥ dve khandhāḥ pe 
PA_patthana_1.6:101.1_0	Saṅkiliṭṭhasaṅkilesiko ca asaṅkiliṭṭhasaṅkilesiko ca dhammā asaṅkiliṭṭhasaṅkilesikassa	saṅkiliṭṭha saṅkilesiko ca a saṅkiliṭṭha saṅkilesiko ca dhammā a saṅkiliṭṭha saṅkilesikassa 
PA_patthana_1.6:101.1_1	dhammassa atthipaccayena paccayo—sahajātaṁ, pacchājātaṁ, āhāraṁ, indriyaṁ. Sahajātā—saṅkiliṭṭhasaṅkilesikā	dhammassa atthi paccayena paccayo sahajāta pacchājāta āhāra indriya sahajāta asaṅkiliṭṭha saṅkilesikā 
PA_patthana_1.6:101.1_2	khandhā ca mahābhūtā ca cittasamuṭṭhānānaṁ rūpānaṁ atthipaccayena paccayo. Pacchājātā—saṅkiliṭṭhasaṅkilesikā	khandhā ca mahābhūtā ca citta samuṭṭhānānam rūpānam atthi paccayena paccayaḥ pacchājātā a saṅkiliṭṭha saṅkilesikā 
PA_patthana_1.6:101.1_3	khandhā ca kabaḷīkāro āhāro ca purejātassa imassa kāyassa atthipaccayena paccayo.	khandhā ca kabaḷīkāro āhāro ca purejātassa imassa kāyassa atthi paccayena paccayo 
PA_patthana_1.6:101.1_4	Pacchājātā—saṅkiliṭṭhasaṅkilesikā khandhā ca rūpajīvitindriyañca kaṭattārūpānaṁ atthipaccayena paccayo.	pacchājātā asaṅkiliṭṭha saṅkilesikā khandhā ca rūpa jīvita indriyañca kaṭattā rūpānam atthi paccayena paccayaḥ 
PA_patthana_1.6:102.0	Natthi-vigatāvigata	natthi vigata a vigata 
PA_patthana_1.6:102.1	Saṅkiliṭṭhasaṅkilesiko dhammo saṅkiliṭṭhasaṅkilesikassa dhammassa natthipaccayena paccayo … vigatapaccayena paccayo … avigatapaccayena paccayo.	saṅkiliṭṭha saṅkilesikaḥ dhammaḥ saṅkiliṭṭha saṅkilesikassa dhammassa natthi paccayena paccayaḥ vigata paccayena paccayaḥ avigata paccayena paccayaḥ 
PA_patthana_1.6:103.0.1	Saṅkhyāvāra	saṅkhyāvāra 
PA_patthana_1.6:103.0.2	Suddha	suddha 
PA_patthana_1.6:103.1_0	Hetuyā satta, ārammaṇe cha, adhipatiyā aṭṭha, anantare satta, samanantare satta,	hetuyā satta ārammaṇe cha adhipatiyā aṭṭha anantare satta samanantare satta 
PA_patthana_1.6:103.1_1	sahajāte nava, aññamaññe tīṇi, nissaye terasa, upanissaye aṭṭha, purejāte tīṇi, pacchājāte	sahajāte nava aññamaññe tīṇi nissaye terasa upanissaye aṭṭha purejāte tīṇi pacchājāte 
PA_patthana_1.6:103.1_2	tīṇi, āsevane tīṇi, kamme satta, vipāke cattāri, āhāre satta, indriye satta, jhāne	tīṇi āsevane tīṇi kamme satta vipāke cattāri āhāre satta indriye satta jhāne 
PA_patthana_1.6:103.1_3	satta, magge satta, sampayutte tīṇi, vippayutte pañca, atthiyā terasa, natthiyā satta,	satta magge satta sampayutte tīṇi vippayutte pañca atthiyā terasa natthiyā satta 
PA_patthana_1.6:103.1_4	vigate satta, avigate terasa.	vigate satta avigate terasa 
PA_patthana_1.6:104.0	Hetusabhāga	hetu sabhāga 
PA_patthana_1.6:104.1_0	Hetupaccayā adhipatiyā cattāri, sahajāte satta, aññamaññe tīṇi, nissaye satta, vipāke	hetu paccayāḥ adhipatiyā cattāri sahajāte satta aññamaññe tīṇi nissaye satta vipāke 
PA_patthana_1.6:104.1_1	cattāri, indriye cattāri, magge cattāri, sampayutte tīṇi, vippayutte tīṇi, atthiyā	cattāri indriye cattāri magge cattāri sampayutte tīṇi vippayutte tīṇi atthiyā 
PA_patthana_1.6:104.1_2	satta, avigate satta.	satta avigate satta 
PA_patthana_1.6:105.0	Hetusāmaññaghaṭanā	hetu sāmañña ghaṭanā 
PA_patthana_1.6:105.1_0	Hetu sahajāta nissaya atthi avigatanti satta. Hetu sahajāta aññamañña nissaya atthi	hetu sahajāta nissaya atthi avigatanti satta hetu sahajāta aññamañña nissaya atthi 
PA_patthana_1.6:105.1_1	avigatanti tīṇi. Hetu sahajāta aññamañña nissaya sampayutta atthi avigatanti tīṇi.	avigatanti tīṇi hetu sahajāta aññamañña nissaya sampayutta atthi avigatanti tīṇi 
PA_patthana_1.6:105.1_2	Hetu sahajāta nissaya vippayutta atthi avigatanti tīṇi. [Avipāka—4]	hetu sahajāta nissaya vippayutta atthi avigatanti tīṇi 
PA_patthana_1.6:106.1_0	Hetu sahajāta nissaya vipāka atthi avigatanti cattāri. Hetu sahajāta aññamañña nissaya	hetu sahajāta nissaya vipāka atthi avigatanti cattāri hetu sahajāta aññamañña nissaya 
PA_patthana_1.6:106.1_1	vipāka atthi avigatanti dve. Hetu sahajāta aññamañña nissaya vipāka sampayutta atthi	vipāka atthi avigatanti dve hetu sahajāta aññamañña nissaya vipāka sampayutta atthi 
PA_patthana_1.6:106.1_2	avigatanti dve. Hetu sahajāta nissaya vipāka vippayutta atthi avigatanti dve. Hetu	avigatanti dve hetu sahajāta nissaya vipāka vippayutta atthi avigatanti dve hetu 
PA_patthana_1.6:106.1_3	sahajāta aññamañña nissaya vipāka vippayutta atthi avigatanti ekaṁ. [Savipāka—5] (Saṅkhittaṁ.)	sahajāta aññamañña nissaya vipāka vippayutta atthi avigatanti eka saṅkhitta 
PA_patthana_1.6:107.1	Yathā kusalattike, evaṁ vitthāretabbaṁ.	yathā kusala ttike evam 
PA_patthana_1.6:107.2	Anulomaṁ.	anuloma 
PA_patthana_1.6:108.0	Paccanīyuddhāra	paccanīya uddhāra 
PA_patthana_1.6:108.1	Saṅkiliṭṭhasaṅkilesiko dhammo saṅkiliṭṭhasaṅkilesikassa dhammassa ārammaṇapaccayena paccayo … sahajātapaccayena paccayo … upanissayapaccayena paccayo.	saṅkiliṭṭha saṅkilesikaḥ dhammaḥ saṅkiliṭṭha saṅkilesikassa dhammassa ārammaṇa paccayena paccayaḥ sahajāta paccayena paccayaḥ  / upanissaya paccayena paccayaḥ 
PA_patthana_1.6:109.1_0	Saṅkiliṭṭhasaṅkilesiko dhammo asaṅkiliṭṭhasaṅkilesikassa dhammassa ārammaṇapaccayena	saṅkiliṭṭha saṅkilesikaḥ dhammaḥ a saṅkiliṭṭha saṅkilesikassa dhammassa ārammaṇa paccayena 
PA_patthana_1.6:109.1_1	paccayo … sahajātapaccayena paccayo … upanissayapaccayena paccayo … pacchājātapaccayena	paccayo sahajāta paccayena paccayo upanissaya paccayena paccayo pacchājāta paccayena 
PA_patthana_1.6:109.1_2	paccayo … kammapaccayena paccayo.	paccayaḥ kamma paccayena paccayaḥ 
PA_patthana_1.6:110.1	Saṅkiliṭṭhasaṅkilesiko dhammo asaṅkiliṭṭhaasaṅkilesikassa dhammassa upanissayapaccayena paccayo.	saṅkiliṭṭha saṅkilesikaḥ dhammaḥ asaṅkiliṭṭha asaṅkilesikassa dhammassa upanissaya paccayena paccayaḥ 
PA_patthana_1.6:111.1	Saṅkiliṭṭhasaṅkilesiko dhammo saṅkiliṭṭhasaṅkilesikassa ca asaṅkiliṭṭhasaṅkilesikassa ca dhammassa sahajātapaccayena paccayo.	saṅkiliṭṭha saṅkilesikaḥ dhammaḥ saṅkiliṭṭha saṅkilesikassa ca asaṅkiliṭṭha saṅkilesikassa ca dhammassa sahajāta paccayena paccayaḥ 
PA_patthana_1.6:112.1_0	Asaṅkiliṭṭhasaṅkilesiko dhammo asaṅkiliṭṭhasaṅkilesikassa dhammassa ārammaṇapaccayena	asaṅkiliṭṭha saṅkilesikaḥ dhammaḥ asaṅkiliṭṭha saṅkilesikassa dhammassa ārammaṇa paccayena 
PA_patthana_1.6:112.1_1	paccayo … sahajātapaccayena paccayo … upanissayapaccayena paccayo … purejātapaccayena	paccayo sahajāta paccayena paccayo  upanissaya paccayena paccayo  purejāta paccayena 
PA_patthana_1.6:112.1_2	paccayo … pacchājātapaccayena paccayo … kammapaccayena paccayo … āhārapaccayena paccayo	paccayaḥ pacchājāta paccayena paccayaḥ kamma paccayena paccayaḥ āhāra paccayena paccayaḥ 
PA_patthana_1.6:112.1_3	… indriyapaccayena paccayo.	indriya paccayena paccayaḥ 
PA_patthana_1.6:113.1	Asaṅkiliṭṭhasaṅkilesiko dhammo saṅkiliṭṭhasaṅkilesikassa dhammassa ārammaṇapaccayena paccayo … upanissayapaccayena paccayo … purejātapaccayena paccayo.	asaṅkiliṭṭha saṅkilesikaḥ dhammaḥ saṅkiliṭṭha saṅkilesikassa dhammassa ārammaṇa paccayena paccayaḥ upanissaya paccayena paccayaḥ purejāta paccayena paccayaḥ 
PA_patthana_1.6:114.1	Asaṅkiliṭṭhasaṅkilesiko dhammo asaṅkiliṭṭhaasaṅkilesikassa dhammassa upanissayapaccayena paccayo … purejātapaccayena paccayo.	asaṅkiliṭṭha saṅkilesikaḥ dhammaḥ asaṅkiliṭṭha asaṅkilesikassa dhammassa upanissaya paccayena paccayaḥ purejāta paccayena paccayaḥ 
PA_patthana_1.6:115.1	Asaṅkiliṭṭhaasaṅkilesiko dhammo asaṅkiliṭṭhaasaṅkilesikassa dhammassa sahajātapaccayena paccayo … upanissayapaccayena paccayo.	asaṅkiliṭṭha asaṅkilesikaḥ dhammaḥ asaṅkiliṭṭha asaṅkilesikassa dhammassa sahajāta paccayena paccayaḥ upanissaya paccayena paccayaḥ 
PA_patthana_1.6:116.1_0	Asaṅkiliṭṭhaasaṅkilesiko dhammo asaṅkiliṭṭhasaṅkilesikassa dhammassa ārammaṇapaccayena	asaṅkiliṭṭha asaṅkilesikaḥ dhammaḥ asaṅkiliṭṭha saṅkilesikassa dhammassa ārammaṇa paccayena 
PA_patthana_1.6:116.1_1	paccayo … sahajātapaccayena paccayo … upanissayapaccayena paccayo … pacchājātapaccayena paccayo.	paccayo sahajāta paccayena paccayaḥ upanissaya paccayena paccayaḥ pacchājāta paccayena paccayaḥ 
PA_patthana_1.6:117.1	Asaṅkiliṭṭhaasaṅkilesiko dhammo asaṅkiliṭṭhasaṅkilesikassa ca asaṅkiliṭṭhaasaṅkilesikassa ca dhammassa sahajātapaccayena paccayo.	asaṅkiliṭṭha asaṅkilesikaḥ dhammaḥ asaṅkiliṭṭha saṅkilesikassa ca asaṅkiliṭṭha asaṅkilesikassa ca dhammassa sahajāta paccayena paccayaḥ 
PA_patthana_1.6:118.1	Asaṅkiliṭṭhasaṅkilesiko ca asaṅkiliṭṭhaasaṅkilesiko ca dhammā asaṅkiliṭṭhasaṅkilesikassa dhammassa sahajātaṁ, pacchājātaṁ, āhāraṁ, indriyaṁ.	asaṅkiliṭṭha saṅkilesiko ca asaṅkiliṭṭha asaṅkilesiko ca dhammā asaṅkiliṭṭha saṅkilesikassa dhammassa sahajāta pacchājāta āhāra indriya 
PA_patthana_1.6:119.1	Asaṅkiliṭṭhasaṅkilesiko ca asaṅkiliṭṭhaasaṅkilesiko ca dhammā asaṅkiliṭṭhaasaṅkilesikassa dhammassa sahajātaṁ, purejātaṁ.	asaṅkiliṭṭha saṅkilesiko ca asaṅkiliṭṭha asaṅkilesiko ca dhammā asaṅkiliṭṭha asaṅkilesikassa dhammassa sahajāta purejāta 
PA_patthana_1.6:120.1	Saṅkiliṭṭhasaṅkilesiko ca asaṅkiliṭṭhasaṅkilesiko ca dhammā saṅkiliṭṭhasaṅkilesikassa dhammassa sahajātaṁ, purejātaṁ.	saṅkiliṭṭha saṅkilesiko ca a saṅkiliṭṭha saṅkilesiko ca dhammā saṅkiliṭṭha saṅkilesikassa dhammassa sahajāta purejāta 
PA_patthana_1.6:121.1	Saṅkiliṭṭhasaṅkilesiko ca asaṅkiliṭṭhasaṅkilesiko ca dhammā asaṅkiliṭṭhasaṅkilesikassa dhammassa sahajātaṁ, pacchājātaṁ, āhāraṁ, indriyaṁ.	saṅkiliṭṭha saṅkilesiko ca a saṅkiliṭṭha saṅkilesiko ca dhammā a saṅkiliṭṭha saṅkilesikassa dhammassa sahajāta pacchājāta āhāra indriya 
PA_patthana_1.6:122.0.1	1.6.7.2. Paccayapaccanīya	paccaya paccanīya 
PA_patthana_1.6:122.0.2	Suddha	suddha 
PA_patthana_1.6:122.1_0	Nahetuyā cuddasa, naārammaṇe cuddasa, naadhipatiyā cuddasa, naanantare cuddasa, nasamanantare	na hetuyā cuddasa na ārammaṇe cuddasa na adhipatiyā cuddasa na anantare cuddasa na samanantare 
PA_patthana_1.6:122.1_1	cuddasa, nasahajāte dasa, naaññamaññe dasa, nanissaye dasa, naupanissaye terasa,	na sahajāte dasa na aññamaññe dasa na nissaye dasa na upanissaye terasa 
PA_patthana_1.6:122.1_2	napurejāte dvādasa, napacchājāte cuddasa, naāsevane cuddasa, nakamme cuddasa, navipāke	na purejāte dvādasa na pacchājāte cuddasa na āsevane cuddasa na kamme cuddasa na vipāke 
PA_patthana_1.6:122.1_3	cuddasa, naāhāre cuddasa, naindriye cuddasa, najhāne cuddasa, namagge cuddasa, nasampayutte	na āhāre cuddasa na aindriye cuddasa na jhāne cuddasa na magge cuddasa na sampayutte 
PA_patthana_1.6:122.1_4	dasa, navippayutte aṭṭha, noatthiyā aṭṭha, nonatthiyā cuddasa, novigate cuddasa, noavigate aṭṭha.	dasa na vippayutte aṭṭha no atthiyā aṭṭha no natthiyā cuddasa no vigate cuddasa no avigate aṭṭha 
PA_patthana_1.6:123.0	Duka	duka 
PA_patthana_1.6:123.1	Nahetupaccayā naārammaṇe cuddasa. (Saṅkhittaṁ.)	na hetu paccayāḥ na ārammaṇe cuddasa 
PA_patthana_1.6:124.1	Yathā kusalattike paccanīyagaṇanā, evaṁ gaṇetabbaṁ.	yathā kusala ttike paccanīya gaṇanā evam 
PA_patthana_1.6:124.2	Paccanīyaṁ.	paccanīya 
PA_patthana_1.6:125.0.1	1.6.7.3. Paccayānulomapaccanīya	paccaya anuloma paccanīya 
PA_patthana_1.6:125.0.2	Hetuduka	hetu duka 
PA_patthana_1.6:125.1_0	Hetupaccayā naārammaṇe satta, naadhipatiyā satta, naanantare satta, nasamanantare	hetu paccayāḥ na ārammaṇe satta na adhipatiyā satta na anantare satta na samanantare 
PA_patthana_1.6:125.1_1	satta, naaññamaññe tīṇi, naupanissaye satta, napurejāte satta, napacchājāte satta,	satta na aññamaññe tīṇi na upanissaye satta na purejāte satta na pacchājāte satta 
PA_patthana_1.6:125.1_2	naāsevane satta, nakamme satta, navipāke satta, naāhāre satta, naindriye satta, najhāne	na āsevane satta na kamme satta na vipāke satta na āhāre satta na indriye satta na jhāne 
PA_patthana_1.6:125.1_3	satta, namagge satta, nasampayutte tīṇi, navippayutte tīṇi, nonatthiyā satta, novigate satta.	satta na magge satta na sampayutte tīṇi na vippayutte tīṇi no natthiyā satta no vigate satta 
PA_patthana_1.6:126.0	Ghaṭanā	ghaṭanā 
PA_patthana_1.6:126.1	Hetu sahajāta nissaya atthi avigatanti naārammaṇe satta …pe… naaññamaññe tīṇi …pe… nasampayutte tīṇi, navippayutte tīṇi …pe… novigate satta. (Saṅkhittaṁ.)	hetu sahajāta nissaya atthi avigatanti na ārammaṇe satta pe na aññamaññe tīṇi pe na sampayutte tīṇi na vippayutte tīṇi pe no vigate satta saṅkhitta 
PA_patthana_1.6:127.1	(Yathā kusalattike anulomapaccanīyagaṇanā vibhattā, evaṁ vibhajitabbaṁ.)	yathā kusala ttike anuloma paccanīya gaṇanā vibhattā evam 
PA_patthana_1.6:128.1	Anulomapaccanīyaṁ.	anuloma paccanīya 
PA_patthana_1.6:129.0.1	1.6.7.4. Paccayapaccanīyānuloma	paccaya paccanīya anuloma 
PA_patthana_1.6:129.0.2	Nahetuduka	na hetu duka 
PA_patthana_1.6:129.1_0	Nahetupaccayā ārammaṇe cha, adhipatiyā aṭṭha, anantare satta, samanantare satta,	na hetu paccayā ārammaṇe cha adhipatiyā aṭṭha anantare satta samanantare satta 
PA_patthana_1.6:129.1_1	sahajāte nava, aññamaññe tīṇi, nissaye terasa, upanissaye aṭṭha, purejāte tīṇi, pacchājāte	sahajāte nava aññamaññe tīṇi nissaye terasa upanissaye aṭṭha purejāte tīṇi pacchājāte 
PA_patthana_1.6:129.1_2	tīṇi, āsevane tīṇi, kamme satta, vipāke cattāri, āhāre satta, indriye satta, jhāne	tīṇi āsevane tīṇi kamme satta vipāke cattāri āhāre satta indriye satta jhāne 
PA_patthana_1.6:129.1_3	satta, magge satta, sampayutte tīṇi, vippayutte pañca, atthiyā terasa, natthiyā satta,	satta magge satta sampayutte tīṇi vippayutte pañca atthiyā terasa natthiyā satta 
PA_patthana_1.6:129.1_4	vigate satta, avigate terasa.	vigate satta avigate terasa 
PA_patthana_1.6:130.0	Tika	tika 
PA_patthana_1.6:130.1	Nahetupaccayā naārammaṇapaccayā adhipatiyā satta. (Saṅkhittaṁ.)	na hetu paccayāḥ na ārammaṇa paccayāḥ adhipatiyā satta 
PA_patthana_1.6:131.1	(Yathā kusalattike paccanīyānulomagaṇanā vibhattā, evaṁ vibhajitabbaṁ.)	yathā kusala ttike paccanīya anuloma gaṇanā vibhattā evam 
PA_patthana_1.6:132.1	Paccanīyānulomaṁ.	paccanīya anuloma 
PA_patthana_1.6:133.1	Saṅkiliṭṭhattikaṁ niṭṭhitaṁ.	niṭṭhita 
