segmentnr	original	folio	analyzed
PA_patthana_21.27:0.1	Paṭṭhānapakaraṇa	0	
PA_patthana_21.27:0.2	Dhammapaccanīyānuloma (4), Dukatikapaṭṭhānapāḷi (3)	0	
PA_patthana_21.27:0.3	21.27. Hetuduka, Parittattika	0	
PA_patthana_21.27:1.1_0	Nahetuṁ naparittaṁ dhammaṁ paṭicca nahetu paritto dhammo uppajjati hetupaccayā. Nanahetuṁ	1	
PA_patthana_21.27:1.1_1	naparittaṁ dhammaṁ paṭicca nahetu paritto dhammo uppajjati hetupaccayā. (Saṅkhittaṁ.)	1	
PA_patthana_21.27:1.1_2	Hetuyā tīṇi, adhipatiyā tīṇi …pe… avigate tīṇi.	1	
PA_patthana_21.27:2.1	Nahetuṁ namahaggataṁ dhammaṁ paṭicca hetu mahaggato dhammo uppajjati hetupaccayā. (Saṅkhittaṁ.) Hetuyā tīṇi …pe… avigate tīṇi.	2	
PA_patthana_21.27:3.1	Nahetuṁ naappamāṇaṁ dhammaṁ paccayā hetu appamāṇo dhammo uppajjati hetupaccayā. (Saṅkhittaṁ.) Hetuyā tīṇi …pe… avigate tīṇi.	3	
