segmentnr	original	analyzed
PA_patthana_13.5:0.1	Paṭṭhānapakaraṇa	paṭṭhāna pakaraṇa 
PA_patthana_13.5:0.2	Dhammānulomapaccanīya (3), Tikapaṭṭhānapāḷi (1)	dhamma anuloma paccanīya tika paṭṭhāna pāḷi 
PA_patthana_13.5:0.3	13.5. Saṅkiliṭṭhattika	saṅkiliṭṭhattika 
PA_patthana_13.5:1.0	Hetu	hetu 
PA_patthana_13.5:1.1_0	Saṅkiliṭṭhasaṅkilesikaṁ dhammaṁ paṭicca nasaṅkiliṭṭhasaṅkilesiko dhammo uppajjati	saṅkiliṭṭha saṅkilesikam dhammam paṭicca na saṅkiliṭṭha saṅkilesikaḥ dhammaḥ uppajjati 
PA_patthana_13.5:1.1_1	hetupaccayā. Saṅkiliṭṭhasaṅkilesikaṁ dhammaṁ paṭicca naasaṅkiliṭṭhasaṅkilesiko dhammo	hetu paccayā saṅkiliṭṭha saṅkilesikam dhammam paṭicca na a saṅkiliṭṭha saṅkilesikaḥ dhammaḥ 
PA_patthana_13.5:1.1_2	uppajjati hetupaccayā. Saṅkiliṭṭhasaṅkilesikaṁ dhammaṁ paṭicca naasaṅkiliṭṭhaasaṅkilesiko	uppajjati hetu paccayā saṅkiliṭṭha saṅkilesikam dhammam paṭicca na a saṅkiliṭṭha a saṅkilesikaḥ 
PA_patthana_13.5:1.1_3	dhammo uppajjati hetupaccayā. Saṅkiliṭṭhasaṅkilesikaṁ dhammaṁ paṭicca nasaṅkiliṭṭhasaṅkilesiko	dhammaḥ uppajjati hetu paccayā saṅkiliṭṭha saṅkilesikam dhammam paṭicca na saṅkiliṭṭha saṅkilesikaḥ 
PA_patthana_13.5:1.1_4	ca naasaṅkiliṭṭhaasaṅkilesiko ca dhammā uppajjanti hetupaccayā. Saṅkiliṭṭhasaṅkilesikaṁ	ca na asaṅkiliṭṭha asaṅkilesiko ca dhammā uppajjanti hetu paccayā saṅkiliṭṭha saṅkilesika 
PA_patthana_13.5:1.1_5	dhammaṁ paṭicca naasaṅkiliṭṭhasaṅkilesiko ca naasaṅkiliṭṭhaasaṅkilesiko ca dhammā	dhammam paṭicca na a saṅkiliṭṭha saṅkilesikaḥ ca na a saṅkiliṭṭha a saṅkilesikaḥ ca dhammā 
PA_patthana_13.5:1.1_6	uppajjanti hetupaccayā.	uppajjanti hetu paccayā 
PA_patthana_13.5:2.1_0	Asaṅkiliṭṭhasaṅkilesikaṁ dhammaṁ paṭicca nasaṅkiliṭṭhasaṅkilesiko dhammo uppajjati	a saṅkiliṭṭha saṅkilesikam dhammam paṭicca na saṅkiliṭṭha saṅkilesikaḥ dhammaḥ uppajjati 
PA_patthana_13.5:2.1_1	hetupaccayā. Asaṅkiliṭṭhasaṅkilesikaṁ dhammaṁ paṭicca naasaṅkiliṭṭhaasaṅkilesiko	hetu paccayā asaṅkiliṭṭha saṅkilesikam dhammam paṭicca na asaṅkiliṭṭha asaṅkilesikaḥ 
PA_patthana_13.5:2.1_2	dhammo uppajjati hetupaccayā. Asaṅkiliṭṭhasaṅkilesikaṁ dhammaṁ paṭicca nasaṅkiliṭṭhasaṅkilesiko	dhammaḥ uppajjati hetu paccayā a saṅkiliṭṭha saṅkilesikam dhammam paṭicca na saṅkiliṭṭha saṅkilesikaḥ 
PA_patthana_13.5:2.1_3	ca naasaṅkiliṭṭhaasaṅkilesiko ca dhammā uppajjanti hetupaccayā.	ca na asaṅkiliṭṭha asaṅkilesiko ca dhammā uppajjanti hetu paccayā 
PA_patthana_13.5:3.1_0	Asaṅkiliṭṭhaasaṅkilesikaṁ dhammaṁ paṭicca naasaṅkiliṭṭhaasaṅkilesiko dhammo uppajjati	asaṅkiliṭṭha asaṅkilesikam dhammam paṭicca na asaṅkiliṭṭha asaṅkilesikaḥ dhammaḥ uppajjati 
PA_patthana_13.5:3.1_1	hetupaccayā. Asaṅkiliṭṭhaasaṅkilesikaṁ dhammaṁ paṭicca nasaṅkiliṭṭhasaṅkilesiko dhammo	hetu paccayā asaṅkiliṭṭha asaṅkilesikam dhammam paṭicca na saṅkiliṭṭha saṅkilesikaḥ dhammaḥ 
PA_patthana_13.5:3.1_2	uppajjati hetupaccayā. Asaṅkiliṭṭhaasaṅkilesikaṁ dhammaṁ paṭicca naasaṅkiliṭṭhasaṅkilesiko	uppajjati hetu paccayā asaṅkiliṭṭha asaṅkilesikam dhammam paṭicca na asaṅkiliṭṭha saṅkilesikaḥ 
PA_patthana_13.5:3.1_3	dhammo uppajjati hetupaccayā. Asaṅkiliṭṭhaasaṅkilesikaṁ dhammaṁ paṭicca nasaṅkiliṭṭhasaṅkilesiko	dhammaḥ uppajjati hetu paccayā asaṅkiliṭṭha asaṅkilesikam dhammam paṭicca na saṅkiliṭṭha saṅkilesikaḥ 
PA_patthana_13.5:3.1_4	ca naasaṅkiliṭṭhaasaṅkilesiko ca dhammā uppajjanti hetupaccayā. Asaṅkiliṭṭhaasaṅkilesikaṁ	ca na asaṅkiliṭṭha asaṅkilesiko ca dhammā uppajjanti hetu paccayā asaṅkiliṭṭha asaṅkilesika 
PA_patthana_13.5:3.1_5	dhammaṁ paṭicca nasaṅkiliṭṭhasaṅkilesiko ca naasaṅkiliṭṭhasaṅkilesiko ca dhammā uppajjanti hetupaccayā.	dhammam paṭicca na saṅkiliṭṭha saṅkilesiko ca na asaṅkiliṭṭha saṅkilesiko ca dhammā uppajjanti hetu paccayā 
PA_patthana_13.5:4.1	Asaṅkiliṭṭhasaṅkilesikañca asaṅkiliṭṭhaasaṅkilesikañca dhammaṁ paṭicca nasaṅkiliṭṭhasaṅkilesiko dhammo uppajjati hetupaccayā … tīṇi.	asaṅkiliṭṭha saṅkilesikam ca asaṅkiliṭṭha asaṅkilesikam ca dhammam paṭicca na saṅkiliṭṭha saṅkilesikaḥ dhammaḥ uppajjati hetu paccayā tīṇi 
PA_patthana_13.5:5.1	Saṅkiliṭṭhasaṅkilesikañca asaṅkiliṭṭhasaṅkilesikañca dhammaṁ paṭicca nasaṅkiliṭṭhasaṅkilesiko dhammo uppajjati hetupaccayā …pe… tīṇi. (Saṅkhittaṁ.)	saṅkiliṭṭha saṅkilesikañca a saṅkiliṭṭha saṅkilesikañca dhammam paṭicca na saṅkiliṭṭha saṅkilesikaḥ dhammaḥ uppajjati hetu paccayā pe tīṇi 
PA_patthana_13.5:6.1_0	Hetuyā ekūnavīsa, ārammaṇe nava …pe… vipāke ekādasa …pe… avigate ekūnavīsa. (Sahajātavārampi	hetuyā ekūnavīsa ārammaṇe nava pe vipāke ekādasa pe avigate ekūnavīsa sahajāta vārampi 
PA_patthana_13.5:6.1_1	paccayavārampi nissayavārampi saṁsaṭṭhavārampi sampayuttavārampi vitthāretabbaṁ.	paccaya vāram pi nissaya vāram pi sa saṭṭha vāram pi sampayutta vāram pi 
PA_patthana_13.5:6.1_2	Pañhāvāre na sadisaṁ.)	pañhāvāre na sadisa 
PA_patthana_13.5:7.1_0	Hetuyā terasa, ārammaṇe pannarasa, adhipatiyā pannarasa, anantare soḷasa …pe… sahajāte	hetuyā terasa ārammaṇe pannarasa adhipatiyā pannarasa anantare soḷasa pe sahajāte 
PA_patthana_13.5:7.1_1	ekūnavīsa, aññamaññe nava, nissaye chabbīsa, upanissaye sattarasa, purejāte cha,	ekūnavīsa aññamaññe nava nissaye chabbīsa upanissaye sattarasa purejāte cha 
PA_patthana_13.5:7.1_2	pacchājāte nava, āsevane aṭṭha, kamme terasa, vipāke aṭṭha, āhāre terasa …pe… magge	pacchājāte nava āsevane aṭṭha kamme terasa vipāke aṭṭha āhāre terasa pe magge 
PA_patthana_13.5:7.1_3	terasa, sampayutte nava, vippayutte dvādasa …pe… avigate chabbīsa.	terasa sampayutte nava vippayutte dvādasa pe avigate chabbīsa 
