segmentnr	original	analyzed
PA_patthana_4.2:0.1	Paṭṭhānapakaraṇa	paṭṭhāna pakaraṇa 
PA_patthana_4.2:0.2	Dhammānuloma (1), Tikadukapaṭṭhānapāḷi (4)	dhamma anuloma tika duka paṭṭhāna pāḷi 
PA_patthana_4.2:0.3	4.2. Kusalattika, Hetugocchaka	kusalattika hetu gocchaka 
PA_patthana_4.2:1.0.1	4.2.2. Kusalattika, Sahetukaduka	kusala ttika sa hetuka duka 
PA_patthana_4.2:1.0.2	Hetu	hetu 
PA_patthana_4.2:1.1	Kusalaṁ sahetukaṁ dhammaṁ paṭicca kusalo sahetuko dhammo uppajjati hetupaccayā.	kusalam sa hetukam dhammam paṭicca kusalaḥ sa hetukaḥ dhammaḥ uppajjati hetu paccayā 
PA_patthana_4.2:2.1	Akusalaṁ sahetukaṁ dhammaṁ paṭicca akusalo sahetuko dhammo uppajjati hetupaccayā.	akusalam sa hetukam dhammam paṭicca akusalaḥ sa hetukaḥ dhammo uppajjati hetu paccayā 
PA_patthana_4.2:3.1	Abyākataṁ sahetukaṁ dhammaṁ paṭicca abyākato sahetuko dhammo uppajjati hetupaccayā. (Saṅkhittaṁ.)	abyākatam sa hetukam dhammam paṭicca abyākataḥ sa hetukaḥ dhammaḥ uppajjati hetu paccayā 
PA_patthana_4.2:4.1	Hetuyā tīṇi …pe… vipāke ekaṁ …pe… avigate tīṇi. (Saṅkhittaṁ.)	hetuyā tīṇi pe vipāke ekam pe avigate tīṇi 
PA_patthana_4.2:5.1	Naadhipatiyā tīṇi, napurejāte tīṇi, napacchājāte tīṇi, naāsevane tīṇi, nakamme tīṇi, navipāke tīṇi, navippayutte tīṇi.	na adhipatiyā tīṇi na purejāte tīṇi na pacchājāte tīṇi na āsevane tīṇi na kamme tīṇi na vipāke tīṇi na vippayutte tīṇi 
PA_patthana_4.2:6.1	Hetupaccayā naadhipatiyā tīṇi. (Saṅkhittaṁ.)	hetu paccayāḥ na adhipatiyā tīṇi 
PA_patthana_4.2:7.1	Naadhipatipaccayā hetuyā tīṇi. (Saṅkhittaṁ.)	na adhipati paccayā hetuyā tīṇi 
PA_patthana_4.2:8.1	(Sahajātavārampi …pe… sampayuttavārampi paṭiccavārasadisaṁ.)	sahajāta vārampi pe sampayutta vārampi paṭicca vāra sadisa 
PA_patthana_4.2:9.0	Hetu-ārammaṇa	hetu ārammaṇa 
PA_patthana_4.2:9.1	Kusalo sahetuko dhammo kusalassa sahetukassa dhammassa hetupaccayena paccayo.	kusalaḥ sa hetukaḥ dhammaḥ kusalassa sa hetukassa dhammassa hetu paccayena paccayaḥ 
PA_patthana_4.2:10.1	Akusalo sahetuko dhammo akusalassa sahetukassa dhammassa hetupaccayena paccayo.	akusalaḥ sa hetukaḥ dhammaḥ akusalassa sa hetukassa dhammassa hetu paccayena paccayaḥ 
PA_patthana_4.2:11.1	Abyākato sahetuko dhammo abyākatassa sahetukassa dhammassa hetupaccayena paccayo.	abyākataḥ sa hetukaḥ dhammaḥ abyākatassa sa hetukassa dhammassa hetu paccayena paccayaḥ 
PA_patthana_4.2:12.1_0	Kusalo sahetuko dhammo kusalassa sahetukassa dhammassa ārammaṇapaccayena paccayo.	kusalaḥ sa hetukaḥ dhammaḥ kusalassa sa hetukassa dhammassa ārammaṇa paccayena paccayaḥ 
PA_patthana_4.2:12.1_1	Kusalo sahetuko dhammo akusalassa sahetukassa dhammassa ārammaṇapaccayena paccayo.	kusalaḥ sa hetukaḥ dhammaḥ akusalassa sa hetukassa dhammassa ārammaṇa paccayena paccayaḥ 
PA_patthana_4.2:12.1_2	Kusalo sahetuko dhammo abyākatassa sahetukassa dhammassa ārammaṇapaccayena paccayo.	kusalaḥ sa hetukaḥ dhammaḥ abyākatassa sa hetukassa dhammassa ārammaṇa paccayena paccayaḥ 
PA_patthana_4.2:13.1	Akusalo sahetuko dhammo akusalassa sahetukassa dhammassa ārammaṇapaccayena paccayo … tīṇi.	akusalaḥ sa hetukaḥ dhammaḥ akusalassa sa hetukassa dhammassa ārammaṇa paccayena paccayaḥ tīṇi 
PA_patthana_4.2:14.1	Abyākato sahetuko dhammo abyākatassa sahetukassa dhammassa ārammaṇapaccayena paccayo … tīṇi.	abyākataḥ sa hetukaḥ dhammaḥ abyākatassa sa hetukassa dhammassa ārammaṇa paccayena paccayaḥ tīṇi 
PA_patthana_4.2:15.1	Kusalo sahetuko dhammo kusalassa sahetukassa dhammassa adhipatipaccayena paccayo. (Saṅkhittaṁ.)	kusalaḥ sa hetukaḥ dhammaḥ kusalassa sa hetukassa dhammassa adhipati paccayena paccayaḥ saṅkhitta 
PA_patthana_4.2:16.1_0	Hetuyā tīṇi, ārammaṇe nava, adhipatiyā satta, anantare pañca, samanantare pañca,	hetuyā tīṇi ārammaṇe nava adhipatiyā satta anantare pañca samanantare pañca 
PA_patthana_4.2:16.1_1	sahajāte tīṇi, aññamaññe tīṇi, nissaye tīṇi, upanissaye nava, āsevane tīṇi, kamme	sahajāte tīṇi aññamaññe tīṇi nissaye tīṇi upanissaye nava āsevane tīṇi kamme 
PA_patthana_4.2:16.1_2	pañca, vipāke ekaṁ, āhāre …pe… sampayutte tīṇi …pe… avigate tīṇi. (Saṅkhittaṁ.)	pañca vipāke eka āhāre pe sampayutte tīṇi pe avigate tīṇi saṅkhitta 
PA_patthana_4.2:17.1	Nahetuyā nava, naārammaṇe nava. (Saṅkhittaṁ.)	na hetuyā nava na ārammaṇe nava saṅkhitta 
PA_patthana_4.2:18.1	Hetupaccayā naārammaṇe tīṇi. (Saṅkhittaṁ.)	hetu paccayāḥ na ārammaṇe tīṇi 
PA_patthana_4.2:19.1	Nahetupaccayā ārammaṇe nava. (Saṅkhittaṁ.)	na hetu paccayā ārammaṇe nava saṅkhitta 
PA_patthana_4.2:20.1	Yathā kusalattike pañhāvāraṁ, evaṁ vitthāretabbaṁ.	yathā kusala attike pañhāvāraḥ evam 
PA_patthana_4.2:21.0.1	4.2.2.2. Ahetukapada	ahetuka pada 
PA_patthana_4.2:21.0.2	Hetu-ārammaṇa	hetu ārammaṇa 
PA_patthana_4.2:21.1	Akusalaṁ ahetukaṁ dhammaṁ paṭicca abyākato ahetuko dhammo uppajjati hetupaccayā.	akusalam ahetukam dhammam paṭicca abyākataḥ ahetukaḥ dhammo uppajjati hetu paccayā 
PA_patthana_4.2:22.1	Abyākataṁ ahetukaṁ dhammaṁ paṭicca abyākato ahetuko dhammo uppajjati hetupaccayā.	abyākatam ahetukam dhammam paṭicca abyākataḥ ahetukaḥ dhammo uppajjati hetu paccayā 
PA_patthana_4.2:23.1	Akusalaṁ ahetukañca abyākataṁ ahetukañca dhammaṁ paṭicca abyākato ahetuko dhammo uppajjati hetupaccayā.	akusalam ahetukam ca abyākatam ahetukañca dhammam paṭicca abyākataḥ ahetukaḥ dhammaḥ uppajjati hetu paccayā 
PA_patthana_4.2:24.1	Abyākataṁ ahetukaṁ dhammaṁ paṭicca abyākato ahetuko dhammo uppajjati ārammaṇapaccayā. (Saṅkhittaṁ.)	abyākatam ahetukam dhammam paṭicca abyākataḥ ahetukaḥ dhammaḥ uppajjati ārammaṇa paccayā 
PA_patthana_4.2:25.1	Hetuyā tīṇi, ārammaṇe ekaṁ, adhipatiyā ekaṁ …pe… avigate tīṇi. (Saṅkhittaṁ.)	hetuyā tīṇi ārammaṇe eka adhipatiyā ekam pe avigate tīṇi 
PA_patthana_4.2:25.2	Paccanīya	paccanīya 
PA_patthana_4.2:26.0	Nahetu-naārammaṇa	na hetuna ārammaṇa 
PA_patthana_4.2:26.1	Abyākataṁ ahetukaṁ dhammaṁ paṭicca abyākato ahetuko dhammo uppajjati nahetupaccayā.	abyākatam ahetukam dhammam paṭicca abyākataḥ ahetukaḥ dhammo uppajjati na hetu paccayā 
PA_patthana_4.2:27.1	Akusalaṁ ahetukaṁ dhammaṁ paṭicca abyākato ahetuko dhammo uppajjati naārammaṇapaccayā.	akusalam ahetukam dhammam paṭicca abyākataḥ ahetukaḥ dhammaḥ uppajjati na ārammaṇa paccayā 
PA_patthana_4.2:28.1	Abyākataṁ ahetukaṁ dhammaṁ paṭicca abyākato ahetuko dhammo uppajjati naārammaṇapaccayā.	abyākatam ahetukam dhammam paṭicca abyākataḥ ahetukaḥ dhammaḥ uppajjati na ārammaṇa paccayā 
PA_patthana_4.2:29.1	Akusalaṁ ahetukañca abyākataṁ ahetukañca dhammaṁ paṭicca abyākato ahetuko dhammo uppajjati naārammaṇapaccayā. (Saṅkhittaṁ.)	akusalam ahetukam ca abyākatam ahetukañca dhammam paṭicca abyākataḥ ahetukaḥ dhammaḥ uppajjati na ārammaṇa paccayā 
PA_patthana_4.2:30.1	Nahetuyā ekaṁ, naārammaṇe tīṇi, naadhipatiyā tīṇi …pe… novigate tīṇi. (Saṅkhittaṁ.)	na hetuyā eka na ārammaṇe tīṇi na adhipatiyā tīṇi pe no vigate tīṇi 
PA_patthana_4.2:31.1	Hetupaccayā naārammaṇe tīṇi. (Saṅkhittaṁ.)	hetu paccayāḥ na ārammaṇe tīṇi 
PA_patthana_4.2:32.1	Nahetupaccayā ārammaṇe ekaṁ. (Saṅkhittaṁ.)	na hetu paccayā ārammaṇe eka saṅkhitta 
PA_patthana_4.2:33.1	(Sahajātavārampi …pe… sampayuttavārampi paṭiccavārasadisaṁ.)	sahajāta vārampi pe sampayutta vārampi paṭicca vāra sadisa 
PA_patthana_4.2:34.0	Hetu-ārammaṇādi	hetu ārammaṇa ādi 
PA_patthana_4.2:34.1	Akusalo ahetuko dhammo abyākatassa ahetukassa dhammassa hetupaccayena paccayo.	akusalaḥ ahetukaḥ dhammaḥ abyākatassa ahetukassa dhammassa hetu paccayena paccayaḥ 
PA_patthana_4.2:35.1	Akusalo ahetuko dhammo akusalassa ahetukassa dhammassa ārammaṇapaccayena paccayo. Akusalo ahetuko dhammo abyākatassa ahetukassa dhammassa ārammaṇapaccayena paccayo.	akusalaḥ ahetukaḥ dhammaḥ akusalassa ahetukassa dhammassa ārammaṇa paccayena paccayaḥ akusalaḥ ahetukaḥ dhammaḥ abyākatassa ahetukassa dhammassa ārammaṇa paccayena paccayaḥ 
PA_patthana_4.2:36.1	Abyākato ahetuko dhammo abyākatassa ahetukassa dhammassa ārammaṇapaccayena paccayo. Abyākato ahetuko dhammo akusalassa ahetukassa dhammassa ārammaṇapaccayena paccayo.	abyākataḥ ahetukaḥ dhammaḥ abyākatassa ahetukassa dhammassa ārammaṇa paccayena paccayaḥ abyākataḥ ahetukaḥ dhammo akusalassa ahetukassa dhammassa ārammaṇa paccayena paccayaḥ 
PA_patthana_4.2:37.1	Akusalo ahetuko dhammo akusalassa ahetukassa dhammassa anantarapaccayena paccayo. Akusalo ahetuko dhammo abyākatassa ahetukassa dhammassa anantarapaccayena paccayo.	akusalaḥ ahetukaḥ dhammaḥ akusalassa ahetukassa dhammassa anantara paccayena paccayaḥ akusalaḥ ahetukaḥ dhammaḥ abyākatassa ahetukassa dhammassa anantara paccayena paccayaḥ 
PA_patthana_4.2:38.1	Abyākato ahetuko dhammo abyākatassa ahetukassa dhammassa anantarapaccayena paccayo. Abyākato ahetuko dhammo akusalassa ahetukassa dhammassa anantarapaccayena paccayo …pe….	abyākataḥ ahetukaḥ dhammaḥ abyākatassa ahetukassa dhammassa anantara paccayena paccayaḥ abyākataḥ ahetukaḥ dhammo akusalassa ahetukassa dhammassa anantara paccayena paccayaḥ pe
PA_patthana_4.2:39.1	Akusalo ahetuko dhammo akusalassa ahetukassa dhammassa upanissayapaccayena paccayo. (Saṅkhittaṁ.)	akusalaḥ ahetukaḥ dhammaḥ akusalassa ahetukassa dhammassa upanissaya paccayena paccayaḥ saṅkhitta 
PA_patthana_4.2:40.1_0	Hetuyā ekaṁ, ārammaṇe cattāri, anantare cattāri, samanantare cattāri, sahajāte tīṇi,	hetuyā eka ārammaṇe cattāri anantare cattāri samanantare cattāri sahajāte tīṇi 
PA_patthana_4.2:40.1_1	aññamaññe ekaṁ, nissaye cattāri, upanissaye cattāri, purejāte pacchājāte āsevane	aññamaññe eka nissaye cattāri upanissaye cattāri purejāte pacchājāte āsevane 
PA_patthana_4.2:40.1_2	dve, kamme vipāke āhāre indriye jhāne ekaṁ, sampayutte ekaṁ, vippayutte tīṇi …pe…	dve kamme vipāke āhāre indriye jhāne eka sampayutte eka vippayutte tīṇi pe 
PA_patthana_4.2:40.1_3	avigate cattāri. (Saṅkhittaṁ.)	avigate cattāri 
PA_patthana_4.2:41.1	Nahetuyā pañca, naārammaṇe pañca, naadhipatiyā pañca. (Saṅkhittaṁ.)	na hetuyā pañca na ārammaṇe pañca na adhipatiyā pañca 
PA_patthana_4.2:42.1	Hetupaccayā naārammaṇe ekaṁ. (Saṅkhittaṁ.)	hetu paccayāḥ na ārammaṇe eka saṅkhitta 
PA_patthana_4.2:43.1	Nahetupaccayā ārammaṇe cattāri. (Saṅkhittaṁ.)	na hetu paccayā ārammaṇe cattāri 
PA_patthana_4.2:44.1	(Yathā kusalattike pañhāvāraṁ, evaṁ vitthāretabbaṁ.)	yathā kusala attike pañhāvāraḥ evam 
PA_patthana_4.2:45.0.1	4.2.3. Kusalattika, Hetusampayuttaduka	kusala ttika hetu sampayutta duka 
PA_patthana_4.2:45.0.2	Hetu	hetu 
PA_patthana_4.2:45.1	Kusalaṁ hetusampayuttaṁ dhammaṁ paṭicca kusalo hetusampayutto dhammo uppajjati hetupaccayā.	kusalam hetu sampayuttam dhammam paṭicca kusalaḥ hetu sampayuttaḥ dhammaḥ uppajjati hetu paccayā 
PA_patthana_4.2:46.1	Akusalaṁ hetusampayuttaṁ dhammaṁ paṭicca akusalo hetusampayutto dhammo uppajjati hetupaccayā.	akusalam hetu sampayuttam dhammam paṭicca akusalaḥ hetu sampayuttaḥ dhammaḥ uppajjati hetu paccayā 
PA_patthana_4.2:47.1	Abyākataṁ hetusampayuttaṁ dhammaṁ paṭicca abyākato hetusampayutto dhammo uppajjati hetupaccayā. (Saṅkhittaṁ.)	abyākatam hetu sampayuttam dhammam paṭicca abyākataḥ hetu sampayuttaḥ dhammaḥ uppajjati hetu paccayā 
PA_patthana_4.2:48.1	Hetuyā tīṇi, ārammaṇe tīṇi …pe… vipāke ekaṁ …pe… avigate tīṇi. (Saṅkhittaṁ.)	hetuyā tīṇi ārammaṇe tīṇi pe vipāke ekam pe avigate tīṇi 
PA_patthana_4.2:49.1	Naadhipatiyā tīṇi …pe… navippayutte tīṇi. (Saṅkhittaṁ.)	na adhipatiyā tīṇi pe na vippayutte tīṇi 
PA_patthana_4.2:50.1	(Sahajātavārampi …pe… sampayuttavārampi paṭiccavārasadisaṁ.)	sahajāta vārampi pe sampayutta vārampi paṭicca vāra sadisa 
PA_patthana_4.2:51.0	Hetu-ārammaṇa	hetu ārammaṇa 
PA_patthana_4.2:51.1	Kusalo hetusampayutto dhammo kusalassa hetusampayuttassa dhammassa hetupaccayena paccayo.	kusalaḥ hetu sampayuttaḥ dhammaḥ kusalassa hetu sampayuttassa dhammassa hetu paccayena paccayaḥ 
PA_patthana_4.2:52.1	Akusalo hetusampayutto dhammo akusalassa hetusampayuttassa dhammassa hetupaccayena paccayo.	akusalaḥ hetu sampayuttaḥ dhammaḥ akusalassa hetu sampayuttassa dhammassa hetu paccayena paccayaḥ 
PA_patthana_4.2:53.1	Abyākato hetusampayutto dhammo abyākatassa hetusampayuttassa dhammassa hetupaccayena paccayo.	abyākataḥ hetu sampayuttaḥ dhammaḥ abyākatassa hetu sampayuttassa dhammassa hetu paccayena paccayaḥ 
PA_patthana_4.2:54.1	Kusalo hetusampayutto dhammo kusalassa hetusampayuttassa dhammassa ārammaṇapaccayena paccayo … tīṇi.	kusalaḥ hetu sampayuttaḥ dhammaḥ kusalassa hetu sampayuttassa dhammassa ārammaṇa paccayena paccayaḥ tīṇi 
PA_patthana_4.2:55.1	Akusalo hetusampayutto dhammo akusalassa hetusampayuttassa dhammassa ārammaṇapaccayena paccayo … tīṇi.	akusalaḥ hetu sampayuttaḥ dhammaḥ akusalassa hetu sampayuttassa dhammassa ārammaṇa paccayena paccayaḥ tīṇi 
PA_patthana_4.2:56.1	Abyākato hetusampayutto dhammo abyākatassa hetusampayuttassa dhammassa ārammaṇapaccayena paccayo … tīṇi (Saṅkhittaṁ.)	abyākataḥ hetu sampayuttaḥ dhammaḥ abyākatassa hetu sampayuttassa dhammassa ārammaṇa paccayena paccayaḥ tīṇi 
PA_patthana_4.2:57.1_0	Hetuyā tīṇi, ārammaṇe nava, adhipatiyā satta, anantare pañca, samanantare pañca,	hetuyā tīṇi ārammaṇe nava adhipatiyā satta anantare pañca samanantare pañca 
PA_patthana_4.2:57.1_1	sahajāte tīṇi, aññamaññe nissaye tīṇi, upanissaye nava, āsevane tīṇi, kamme pañca,	sahajāte tīṇi aññamaññe nissaye tīṇi upanissaye nava āsevane tīṇi kamme pañca 
PA_patthana_4.2:57.1_2	vipāke ekaṁ, āhāre …pe… sampayutte tīṇi …pe… avigate tīṇi. (Saṅkhittaṁ.)	vipāke eka āhāre pe sampayutte tīṇi pe avigate tīṇi 
PA_patthana_4.2:58.1	Nahetuyā nava, naārammaṇe nava. (Saṅkhittaṁ.)	na hetuyā nava na ārammaṇe nava saṅkhitta 
PA_patthana_4.2:59.1	Hetupaccayā naārammaṇe tīṇi. (Saṅkhittaṁ.)	hetu paccayāḥ na ārammaṇe tīṇi 
PA_patthana_4.2:60.1	Nahetupaccayā ārammaṇe nava. (Saṅkhittaṁ.)	na hetu paccayā ārammaṇe nava saṅkhitta 
PA_patthana_4.2:61.1	(Yathā kusalattike pañhāvāraṁ, evaṁ vitthāretabbaṁ.)	yathā kusala attike pañhāvāraḥ evam 
PA_patthana_4.2:62.0.1	4.2.3.2. Hetuvippayuttapada	hetu vippayutta pada 
PA_patthana_4.2:62.0.2	Hetu-ārammaṇa	hetu ārammaṇa 
PA_patthana_4.2:62.1	Akusalaṁ hetuvippayuttaṁ dhammaṁ paṭicca abyākato hetuvippayutto dhammo uppajjati hetupaccayā.	akusalam hetu vippayuttam dhammam paṭicca abyākataḥ hetu vippayuttaḥ dhammaḥ uppajjati hetu paccayā 
PA_patthana_4.2:63.1	Abyākataṁ hetuvippayuttaṁ dhammaṁ paṭicca abyākato hetuvippayutto dhammo uppajjati hetupaccayā.	abyākatam hetu vippayuttam dhammam paṭicca abyākataḥ hetu vippayuttaḥ dhammaḥ uppajjati hetu paccayā 
PA_patthana_4.2:64.1	Akusalaṁ hetuvippayuttañca abyākataṁ hetuvippayuttañca dhammaṁ paṭicca abyākato hetuvippayutto dhammo uppajjati hetupaccayā.	akusalam hetu vippayuttañca abyākatam hetu vippayuttañca dhammam paṭicca abyākataḥ hetu vippayuttaḥ dhammaḥ uppajjati hetu paccayā 
PA_patthana_4.2:65.1	Abyākataṁ hetuvippayuttaṁ dhammaṁ paṭicca abyākato hetuvippayutto dhammo uppajjati ārammaṇapaccayā. (Saṅkhittaṁ.)	abyākatam hetu vippayuttam dhammam paṭicca abyākataḥ hetu vippayuttaḥ dhammaḥ uppajjati ārammaṇa paccayā 
PA_patthana_4.2:66.1	Hetuyā tīṇi, ārammaṇe ekaṁ, adhipatiyā ekaṁ …pe… avigate tīṇi. (Saṅkhittaṁ.)	hetuyā tīṇi ārammaṇe eka adhipatiyā ekam pe avigate tīṇi 
PA_patthana_4.2:67.0	Nahetu-naārammaṇa	na hetuna ārammaṇa 
PA_patthana_4.2:67.1	Abyākataṁ hetuvippayuttaṁ dhammaṁ paṭicca abyākato hetuvippayutto dhammo uppajjati nahetupaccayā.	abyākatam hetu vippayuttam dhammam paṭicca abyākataḥ hetu vippayuttaḥ dhammaḥ uppajjati na hetu paccayā 
PA_patthana_4.2:68.1	Akusalaṁ hetuvippayuttaṁ dhammaṁ paṭicca abyākato hetuvippayutto dhammo uppajjati naārammaṇapaccayā.	akusalam hetu vippayuttam dhammam paṭicca abyākataḥ hetu vippayuttaḥ dhammaḥ uppajjati na ārammaṇa paccayā 
PA_patthana_4.2:69.1	Abyākataṁ hetuvippayuttaṁ dhammaṁ paṭicca abyākato hetuvippayutto dhammo uppajjati naārammaṇapaccayā.	abyākatam hetu vippayuttam dhammam paṭicca abyākataḥ hetu vippayuttaḥ dhammaḥ uppajjati na ārammaṇa paccayā 
PA_patthana_4.2:70.1	Akusalaṁ hetuvippayuttañca abyākataṁ hetuvippayuttañca dhammaṁ paṭicca abyākato hetuvippayutto dhammo uppajjati naārammaṇapaccayā. (Saṅkhittaṁ.)	akusalam hetu vippayuttam ca abyākatam hetu vippayuttañca dhammam paṭicca abyākataḥ hetu vippayuttaḥ dhammaḥ uppajjati na ārammaṇa paccayā 
PA_patthana_4.2:71.1	Nahetuyā ekaṁ, naārammaṇe tīṇi, naadhipatiyā tīṇi …pe… novigate tīṇi. (Saṅkhittaṁ.)	na hetuyā eka na ārammaṇe tīṇi na adhipatiyā tīṇi pe no vigate tīṇi 
PA_patthana_4.2:72.1	(Sahajātavārampi …pe… sampayuttavārampi paṭiccavārasadisaṁ.)	sahajāta vārampi pe sampayutta vārampi paṭicca vāra sadisa 
PA_patthana_4.2:73.0	Hetu-ārammaṇa-anantara	hetu ārammaṇa anantara 
PA_patthana_4.2:73.1	Akusalo hetuvippayutto dhammo abyākatassa hetuvippayuttassa dhammassa hetupaccayena paccayo.	akusalaḥ hetu vippayuttaḥ dhammaḥ abyākatassa hetu vippayuttassa dhammassa hetu paccayena paccayaḥ 
PA_patthana_4.2:74.1_0	Akusalo hetuvippayutto dhammo akusalassa hetuvippayuttassa dhammassa ārammaṇapaccayena	akusalaḥ hetu vippayuttaḥ dhammaḥ akusalassa hetu vippayuttassa dhammassa ārammaṇa paccayena 
PA_patthana_4.2:74.1_1	paccayo. Akusalo hetuvippayutto dhammo abyākatassa hetuvippayuttassa dhammassa ārammaṇapaccayena paccayo.	paccayaḥ akusalaḥ hetu vippayuttaḥ dhammaḥ abyākatassa hetu vippayuttassa dhammassa ārammaṇa paccayena paccayaḥ 
PA_patthana_4.2:75.1_0	Abyākato hetuvippayutto dhammo abyākatassa hetuvippayuttassa dhammassa ārammaṇapaccayena	abyākataḥ hetu vippayuttaḥ dhammaḥ abyākatassa hetu vippayuttassa dhammassa ārammaṇa paccayena 
PA_patthana_4.2:75.1_1	paccayo. Abyākato hetuvippayutto dhammo akusalassa hetuvippayuttassa dhammassa ārammaṇapaccayena paccayo.	paccayaḥ abyākataḥ hetu vippayuttaḥ dhammaḥ akusalassa hetu vippayuttassa dhammassa ārammaṇa paccayena paccayaḥ 
PA_patthana_4.2:76.1_0	Akusalo hetuvippayutto dhammo akusalassa hetuvippayuttassa dhammassa anantarapaccayena	akusalaḥ hetu vippayuttaḥ dhammaḥ akusalassa hetu vippayuttassa dhammassa anantara paccayena 
PA_patthana_4.2:76.1_1	paccayo. Akusalo hetuvippayutto dhammo abyākatassa hetuvippayuttassa dhammassa anantarapaccayena paccayo.	paccayaḥ akusalaḥ hetu vippayuttaḥ dhammaḥ abyākatassa hetu vippayuttassa dhammassa anantara paccayena paccayaḥ 
PA_patthana_4.2:77.1_0	Abyākato hetuvippayutto dhammo abyākatassa hetuvippayuttassa dhammassa anantarapaccayena	abyākataḥ hetu vippayuttaḥ dhammaḥ abyākatassa hetu vippayuttassa dhammassa anantara paccayena 
PA_patthana_4.2:77.1_1	paccayo. Abyākato hetuvippayutto dhammo akusalassa hetuvippayuttassa dhammassa anantarapaccayena	paccayaḥ abyākataḥ hetu vippayuttaḥ dhammaḥ akusalassa hetu vippayuttassa dhammassa anantara paccayena 
PA_patthana_4.2:77.1_2	paccayo. (Saṅkhittaṁ.)	paccayaḥ saṅkhitta 
PA_patthana_4.2:78.1_0	Hetuyā ekaṁ, ārammaṇe cattāri, anantare cattāri, samanantare cattāri, sahajāte tīṇi,	hetuyā eka ārammaṇe cattāri anantare cattāri samanantare cattāri sahajāte tīṇi 
PA_patthana_4.2:78.1_1	aññamaññe ekaṁ, nissaye cattāri, upanissaye cattāri, purejāte pacchājāte āsevane	aññamaññe eka nissaye cattāri upanissaye cattāri purejāte pacchājāte āsevane 
PA_patthana_4.2:78.1_2	dve, kamme …pe… jhāne ekaṁ, sampayutte ekaṁ, vippayutte tīṇi …pe… avigate cattāri. (Saṅkhittaṁ.)	dve kamme pe jhāne eka sampayutte eka vippayutte tīṇi pe avigate cattāri saṅkhitta 
PA_patthana_4.2:79.1	Nahetuyā pañca, naārammaṇe pañca. (Saṅkhittaṁ.)	na hetuyā pañca na ārammaṇe pañca saṅkhitta 
PA_patthana_4.2:80.1	Hetupaccayā naārammaṇe ekaṁ. (Saṅkhittaṁ.)	hetu paccayāḥ na ārammaṇe eka saṅkhitta 
PA_patthana_4.2:81.1	Nahetupaccayā ārammaṇe cattāri. (Saṅkhittaṁ.)	na hetu paccayā ārammaṇe cattāri 
PA_patthana_4.2:82.1	(Yathā kusalattike pañhāvāraṁ, evaṁ vitthāretabbaṁ.)	yathā kusala attike pañhāvāraḥ evam 
PA_patthana_4.2:83.0.1	4.2.4. Kusalattika, Hetusahetukaduka	kusala ttika hetu sa hetuka duka 
PA_patthana_4.2:83.0.2	Hetu	hetu 
PA_patthana_4.2:83.1	Kusalaṁ hetuñceva sahetukañca dhammaṁ paṭicca kusalo hetu ceva sahetuko ca dhammo uppajjati hetupaccayā.	kusalam hetuñca iva sa hetukañca dhammam paṭicca kusalaḥ hetu ca iva sa hetukaḥ ca dhammo uppajjati hetu paccayā 
PA_patthana_4.2:84.1	Akusalaṁ hetuñceva sahetukañca dhammaṁ paṭicca akusalo hetu ceva sahetuko ca dhammo uppajjati hetupaccayā.	akusalam hetuñca iva sa hetukañca dhammam paṭicca akusalaḥ hetu ca iva sa hetukaḥ ca dhammo uppajjati hetu paccayā 
PA_patthana_4.2:85.1	Abyākataṁ hetuñceva sahetukañca dhammaṁ paṭicca abyākato hetu ceva sahetuko ca dhammo uppajjati hetupaccayā. (Saṅkhittaṁ.)	abyākatam hetuñca iva sa hetukañca dhammam paṭicca abyākataḥ hetu ca iva sa hetukaḥ ca dhammo uppajjati hetu paccayā 
PA_patthana_4.2:86.1	Hetuyā tīṇi, ārammaṇe tīṇi …pe… vipāke ekaṁ …pe… avigate tīṇi. (Saṅkhittaṁ.)	hetuyā tīṇi ārammaṇe tīṇi pe vipāke ekam pe avigate tīṇi 
PA_patthana_4.2:87.1	Naadhipatiyā tīṇi, napurejāte tīṇi, napacchājāte tīṇi, naāsevane tīṇi, navipāke tīṇi, navippayutte tīṇi. (Saṅkhittaṁ.)	na adhipatiyā tīṇi na purejāte tīṇi na pacchājāte tīṇi na āsevane tīṇi na vipāke tīṇi na vippayutte tīṇi 
PA_patthana_4.2:88.1	(Sahajātavārampi …pe… sampayuttavārampi paṭiccavārasadisaṁ.)	sahajāta vārampi pe sampayutta vārampi paṭicca vāra sadisa 
PA_patthana_4.2:89.0	Hetu-ārammaṇa-adhipati	hetu ārammaṇa adhipati 
PA_patthana_4.2:89.1	Kusalo hetu ceva sahetuko ca dhammo kusalassa hetussa ceva sahetukassa ca dhammassa hetupaccayena paccayo.	kusalaḥ hetu ca iva sa hetukaḥ ca dhammaḥ kusalassa hetussa ca iva sa hetukassa ca dhammassa hetu paccayena paccayaḥ 
PA_patthana_4.2:90.1	Akusalo hetu ceva sahetuko ca dhammo akusalassa hetussa ceva sahetukassa ca dhammassa hetupaccayena paccayo.	akusalaḥ hetu ca iva sa hetukaḥ ca dhammaḥ akusalassa hetussa ca iva sa hetukassa ca dhammassa hetu paccayena paccayaḥ 
PA_patthana_4.2:91.1	Abyākato hetu ceva sahetuko ca dhammo abyākatassa hetussa ceva sahetukassa ca dhammassa hetupaccayena paccayo.	abyākataḥ hetu ca iva sa hetukaḥ ca dhammaḥ abyākatassa hetussa ca iva sa hetukassa ca dhammassa hetu paccayena paccayaḥ 
PA_patthana_4.2:92.1_0	Kusalo hetu ceva sahetuko ca dhammo kusalassa hetussa ceva sahetukassa ca dhammassa	kusalaḥ hetu ca iva sa hetukaḥ ca dhammaḥ kusalassa hetussa ca iva sa hetukassa ca dhammassa 
PA_patthana_4.2:92.1_1	ārammaṇapaccayena paccayo. Kusalo hetu ceva sahetuko ca dhammo akusalassa hetussa	ārammaṇa paccayena paccayaḥ kusalaḥ hetu ca iva sa hetukaḥ ca dhammaḥ akusalassa hetussa 
PA_patthana_4.2:92.1_2	ceva sahetukassa ca dhammassa ārammaṇapaccayena paccayo. Kusalo hetu ceva sahetuko	ca iva sa hetukassa ca dhammassa ārammaṇa paccayena paccayaḥ kusalaḥ hetu ca iva sa hetukaḥ 
PA_patthana_4.2:92.1_3	ca dhammo abyākatassa hetussa ceva sahetukassa ca dhammassa ārammaṇapaccayena paccayo.	ca dhammaḥ abyākatassa hetussa ca iva sa hetukassa ca dhammassa ārammaṇa paccayena paccayo 
PA_patthana_4.2:93.1	Akusalo hetu ceva sahetuko ca dhammo akusalassa hetussa ceva sahetukassa ca dhammassa ārammaṇapaccayena paccayo … tīṇi.	akusalaḥ hetu ca iva sa hetukaḥ ca dhammaḥ akusalassa hetussa ca iva sa hetukassa ca dhammassa ārammaṇa paccayena paccayaḥ tīṇi 
PA_patthana_4.2:94.1	Abyākato hetu ceva sahetuko ca dhammo abyākatassa hetussa ceva sahetukassa ca dhammassa ārammaṇapaccayena paccayo … tīṇi.	abyākataḥ hetu ca iva sa hetukaḥ ca dhammaḥ abyākatassa hetussa ca iva sa hetukassa ca dhammassa ārammaṇa paccayena paccayaḥ tīṇi 
PA_patthana_4.2:95.1	Kusalo hetu ceva sahetuko ca dhammo kusalassa hetussa ceva sahetukassa ca dhammassa adhipatipaccayena paccayo … tīṇi.	kusalaḥ hetu ca iva sa hetukaḥ ca dhammaḥ kusalassa hetussa ca iva sa hetukassa ca dhammassa adhipati paccayena paccayaḥ tīṇi 
PA_patthana_4.2:96.1	Akusalo hetu ceva sahetuko ca dhammo akusalassa hetussa ceva sahetukassa ca dhammassa adhipatipaccayena paccayo.	akusalaḥ hetu ca iva sa hetukaḥ ca dhammaḥ akusalassa hetussa ca iva sa hetukassa ca dhammassa adhipati paccayena paccayaḥ 
