segmentnr	original	analyzed
PA_patthana_15.55:0.1	Paṭṭhānapakaraṇa	paṭṭhāna pakaraṇa 
PA_patthana_15.55:0.2	Dhammānulomapaccanīya (3), Dukatikapaṭṭhānapāḷi (3)	dhamma anuloma paccanīya 
PA_patthana_15.55:0.3	15.55. Dassanenapahātabbahetukaduka, Kusalattika	dassanena apahātabba hetuka duka kusala ttika 
PA_patthana_15.55:1.1	Nadassanena pahātabbahetukaṁ kusalaṁ dhammaṁ paṭicca nadassanena pahātabbahetuko nakusalo dhammo uppajjati hetupaccayā. Hetuyā ekaṁ …pe… avigate ekaṁ.	na dassanena pahātabba hetukam kusalam dhammam paṭicca na dassanena pahātabba hetukaḥ na kusalaḥ dhammaḥ uppajjati hetu paccayā hetuyā ekam pe avigate eka 
PA_patthana_15.55:2.1	Dassanena pahātabbahetukaṁ akusalaṁ dhammaṁ paṭicca nadassanena pahātabbahetuko naakusalo dhammo uppajjati hetupaccayā …. Hetuyā tīṇi …pe… avigate tīṇi.	dassanena pahātabba hetukam akusalam dhammam paṭicca na dassanena pahātabba hetukaḥ na akusalaḥ dhammaḥ uppajjati hetu paccayā hetuyā tīṇi pe avigate tīṇi 
PA_patthana_15.55:3.1_0	Nadassanena pahātabbahetukaṁ abyākataṁ dhammaṁ paccayā nanadassanena pahātabbahetuko	na dassanena pahātabba hetukam abyākatam dhammam paccayā nana dassanena pahātabba hetukaḥ 
PA_patthana_15.55:3.1_1	naabyākato dhammo uppajjati hetupaccayā …. Hetuyā dve, ārammaṇe tīṇi …pe… avigate	na abyākataḥ dhammaḥ uppajjati hetu paccayā hetuyā dve ārammaṇe tīṇi pe avigate 
PA_patthana_15.55:3.1_2	tīṇi. (Abyākatavāre sabbattha paccayavasena gaṇetabbaṁ.)	tīṇi abyākata vāre sabbattha paccaya vasena gaṇetabba 
