segmentnr	original	analyzed
PA_patthana_1.6:63.1_2	khandhānaṁ āsevanapaccayena paccayo.	khandhānaṃ āsevana paccayena paccayaḥ 
PA_patthana_1.6:64.1	Asaṅkiliṭṭhasaṅkilesiko dhammo asaṅkiliṭṭhasaṅkilesikassa dhammassa āsevanapaccayena paccayo—purimā purimā …pe… anulomaṁ gotrabhussa … anulomaṁ vodānassa āsevanapaccayena paccayo.	asaṅkiliṭṭha saṅkilesikaḥ dhammaḥ asaṅkiliṭṭha saṅkilesikassa dhammassa āsevana paccayena paccayo purimā purimā pe anulomam gotrabhussa anulomam vodānassa āsevana paccayena paccayo 
PA_patthana_1.6:65.1	Asaṅkiliṭṭhasaṅkilesiko dhammo asaṅkiliṭṭhaasaṅkilesikassa dhammassa āsevanapaccayena paccayo—gotrabhu maggassa … vodānaṁ maggassa āsevanapaccayena paccayo.	asaṅkiliṭṭha saṅkilesikaḥ dhammaḥ asaṅkiliṭṭha asaṅkilesikassa dhammassa āsevana paccayena paccayo gotrabhu maggassa vodānam maggassa āsevana paccayena paccayo 
PA_patthana_1.6:66.0	Kamma	kamma 
PA_patthana_1.6:66.1	Saṅkiliṭṭhasaṅkilesiko dhammo saṅkiliṭṭhasaṅkilesikassa dhammassa kammapaccayena paccayo—saṅkiliṭṭhasaṅkilesikā cetanā sampayuttakānaṁ khandhānaṁ kammapaccayena paccayo.	saṅkiliṭṭha saṅkilesikaḥ dhammaḥ saṅkiliṭṭha saṅkilesikassa dhammassa kamma paccayena paccayaḥ saṅkiliṭṭha saṅkilesikā cetanā sampayuttakānam khandhānam kamma paccayena paccayaḥ 
PA_patthana_1.6:67.1_0	Saṅkiliṭṭhasaṅkilesiko dhammo asaṅkiliṭṭhasaṅkilesikassa dhammassa kammapaccayena	saṅkiliṭṭha saṅkilesikaḥ dhammaḥ a saṅkiliṭṭha saṅkilesikassa dhammassa kamma paccayena 
PA_patthana_1.6:67.1_1	paccayo—sahajātā, nānākkhaṇikā. Sahajātā—saṅkiliṭṭhasaṅkilesikā cetanā cittasamuṭṭhānānaṁ	paccayaḥ u sahajātā nānā kkhaṇikā sahajātā a saṅkiliṭṭha saṅkilesikā cetanā 
PA_patthana_1.6:67.1_2	rūpānaṁ kammapaccayena paccayo. Nānākkhaṇikā—saṅkiliṭṭhasaṅkilesikā cetanā vipākānaṁ	rūpānam kamma paccayena paccayaḥ nānā kkhaṇikā a saṅkiliṭṭha saṅkilesikā cetanā vipākānaṃ 
PA_patthana_1.6:67.1_3	khandhānaṁ kaṭattā ca rūpānaṁ kammapaccayena paccayo.	khandhānam kaṭattā ca rūpānam kamma paccayena paccayaḥ 
PA_patthana_1.6:68.1_0	Saṅkiliṭṭhasaṅkilesiko dhammo saṅkiliṭṭhasaṅkilesikassa ca asaṅkiliṭṭhasaṅkilesikassa	saṅkiliṭṭha saṅkilesikaḥ dhammaḥ saṅkiliṭṭha saṅkilesikassa ca a saṅkiliṭṭha saṅkilesikassa 
PA_patthana_1.6:68.1_1	ca dhammassa kammapaccayena paccayo—saṅkiliṭṭhasaṅkilesikā cetanā sampayuttakānaṁ	ca dhammassa kamma paccayena paccayo saṅkiliṭṭha saṅkilesikā cetanā sampayuttakāna 
PA_patthana_1.6:68.1_2	khandhānaṁ cittasamuṭṭhānānañca rūpānaṁ kammapaccayena paccayo.	khandhānam citta samuṭṭhānānam ca rūpānam kamma paccayena paccayaḥ 
PA_patthana_1.6:69.1_0	Asaṅkiliṭṭhasaṅkilesiko dhammo asaṅkiliṭṭhasaṅkilesikassa dhammassa kammapaccayena	asaṅkiliṭṭha saṅkilesikaḥ dhammaḥ asaṅkiliṭṭha saṅkilesikassa dhammassa kamma paccayena 
PA_patthana_1.6:69.1_1	paccayo—sahajātā, nānākkhaṇikā. Sahajātā—asaṅkiliṭṭhasaṅkilesikā cetanā sampayuttakānaṁ	paccayaḥ sahajātā nānā kkhaṇikā sahajātā asaṅkiliṭṭha saṅkilesikā cetanā 
PA_patthana_1.6:69.1_2	khandhānaṁ cittasamuṭṭhānānañca rūpānaṁ kammapaccayena paccayo. Paṭisandhikkhaṇe	khandhānam citta samuṭṭhānānaṃ ca rūpānam kamma paccayena paccayaḥ paṭisandhi kkhaṇe 
PA_patthana_1.6:69.1_3	…pe…. Nānākkhaṇikā—asaṅkiliṭṭhasaṅkilesikā cetanā vipākānaṁ khandhānaṁ kaṭattā ca	pe nānā kkhaṇikā asaṅkiliṭṭha saṅkilesikā cetanā vipākānam khandhānam kaṭattā ca 
PA_patthana_1.6:69.1_4	rūpānaṁ kammapaccayena paccayo.	rūpānam kamma paccayena paccayaḥ 
PA_patthana_1.6:70.1_0	Asaṅkiliṭṭhaasaṅkilesiko dhammo asaṅkiliṭṭhaasaṅkilesikassa dhammassa kammapaccayena	asaṅkiliṭṭha asaṅkilesikaḥ dhammaḥ asaṅkiliṭṭha asaṅkilesikassa dhammassa kamma paccayena 
PA_patthana_1.6:70.1_1	paccayo—sahajātā, nānākkhaṇikā. Sahajātā—asaṅkiliṭṭhaasaṅkilesikā cetanā sampayuttakānaṁ	paccayaḥ sahajātā nānā kkhaṇikā sahajātā asaṅkiliṭṭha asaṅkilesikā cetanā sampayuttakāna 
PA_patthana_1.6:70.1_2	khandhānaṁ kammapaccayena paccayo. Nānākkhaṇikā—asaṅkiliṭṭhaasaṅkilesikā kusalā cetanā	khandhānam kamma paccayena paccayaḥ nānākkhaṇikā asaṅkiliṭṭha asaṅkilesikā kusalā cetanā 
PA_patthana_1.6:70.1_3	vipākānaṁ asaṅkiliṭṭhaasaṅkilesikānaṁ khandhānaṁ kammapaccayena paccayo.	vipākānam asaṅkiliṭṭha asaṅkilesikānam khandhānam kamma paccayena paccayaḥ 
PA_patthana_1.6:71.1_0	Asaṅkiliṭṭhaasaṅkilesiko dhammo asaṅkiliṭṭhasaṅkilesikassa dhammassa kammapaccayena	asaṅkiliṭṭha asaṅkilesikaḥ dhammaḥ asaṅkiliṭṭha saṅkilesikassa dhammassa kamma paccayena 
PA_patthana_1.6:71.1_1	paccayo—sahajātā asaṅkiliṭṭhaasaṅkilesikā cetanā cittasamuṭṭhānānaṁ rūpānaṁ kammapaccayena paccayo.	paccaya sahajātā asaṅkiliṭṭha asaṅkilesikā cetanā citta samuṭṭhānānam rūpānam kamma paccayena paccayaḥ 
PA_patthana_1.6:72.1_0	Asaṅkiliṭṭhaasaṅkilesiko dhammo asaṅkiliṭṭhasaṅkilesikassa ca asaṅkiliṭṭhaasaṅkilesikassa	asaṅkiliṭṭha asaṅkilesikaḥ dhammaḥ asaṅkiliṭṭha saṅkilesikassa ca asaṅkiliṭṭha asaṅkilesikassa 
PA_patthana_1.6:72.1_1	ca dhammassa kammapaccayena paccayo—sahajātā asaṅkiliṭṭhaasaṅkilesikā cetanā sampayuttakānaṁ	ca dhammassa kamma paccayena paccayo sahajātā asaṅkiliṭṭha asaṅkilesikā cetanā sampayuttakāna 
PA_patthana_1.6:72.1_2	khandhānaṁ cittasamuṭṭhānānañca rūpānaṁ kammapaccayena paccayo.	khandhānam citta samuṭṭhānānam ca rūpānam kamma paccayena paccayaḥ 
PA_patthana_1.6:73.0	Vipāka	vipāka 
PA_patthana_1.6:73.1_0	Asaṅkiliṭṭhasaṅkilesiko dhammo asaṅkiliṭṭhasaṅkilesikassa dhammassa vipākapaccayena	asaṅkiliṭṭha saṅkilesikaḥ dhammaḥ asaṅkiliṭṭha saṅkilesikassa dhammassa vipāka paccayena 
PA_patthana_1.6:73.1_1	paccayo—vipāko asaṅkiliṭṭhasaṅkilesiko eko khandho tiṇṇannaṁ khandhānaṁ cittasamuṭṭhānānañca	paccayaḥ vipākaḥ asaṅkiliṭṭha saṅkilesikaḥ ekaḥ khandho tiṇṇannam khandhānam citta samuṭṭhānānam ca 
PA_patthana_1.6:73.1_2	rūpānaṁ vipākapaccayena paccayo …pe… dve khandhā dvinnaṁ khandhānaṁ …pe… paṭisandhikkhaṇe	rūpānam vipāka paccayena paccayaḥ pe dve khandhāḥ dvinnam khandhānam pe paṭisandhi kkhaṇe 
PA_patthana_1.6:73.1_3	asaṅkiliṭṭhasaṅkilesiko eko khandho tiṇṇannaṁ khandhānaṁ kaṭattā ca rūpānaṁ vipākapaccayena	asaṅkiliṭṭha saṅkilesikaḥ ekaḥ khandhaḥ tiṇṇannam khandhānam kaṭattā ca rūpānam vipāka paccayena 
PA_patthana_1.6:73.1_4	paccayo …pe… dve khandhā dvinnaṁ khandhānaṁ …pe… khandhā vatthussa vipākapaccayena paccayo.	paccayaḥ pe dve khandhā dvinnam khandhānam pe khandhāḥ vatthussa vipāka paccayena paccayaḥ 
PA_patthana_1.6:74.1_0	Asaṅkiliṭṭhaasaṅkilesiko dhammo asaṅkiliṭṭhaasaṅkilesikassa dhammassa vipākapaccayena	asaṅkiliṭṭha asaṅkilesikaḥ dhammaḥ asaṅkiliṭṭha asaṅkilesikassa dhammassa vipāka paccayena 
PA_patthana_1.6:74.1_1	paccayo—vipāko asaṅkiliṭṭhaasaṅkilesiko eko khandho tiṇṇannaṁ khandhānaṁ vipākapaccayena	paccayaḥ vipākaḥ asaṅkiliṭṭha asaṅkilesikaḥ ekaḥ khandho tiṇṇannam khandhānam vipāka paccayena 
PA_patthana_1.6:74.1_2	paccayo …pe… dve khandhā dvinnaṁ khandhānaṁ …pe….	paccayaḥ pe dve khandhāḥ dvinnam khandhānam pe 
PA_patthana_1.6:75.1_0	Asaṅkiliṭṭhaasaṅkilesiko dhammo asaṅkiliṭṭhasaṅkilesikassa dhammassa vipākapaccayena	asaṅkiliṭṭha asaṅkilesikaḥ dhammaḥ asaṅkiliṭṭha saṅkilesikassa dhammassa vipāka paccayena 
PA_patthana_1.6:75.1_1	paccayo—vipākā asaṅkiliṭṭhaasaṅkilesikā khandhā cittasamuṭṭhānānaṁ rūpānaṁ vipākapaccayena paccayo.	paccaya vipākāḥ asaṅkiliṭṭha asaṅkilesikā khandhāḥ citta samuṭṭhānānam rūpānam vipāka paccayena paccayaḥ 
PA_patthana_1.6:76.1_0	Asaṅkiliṭṭhaasaṅkilesiko dhammo asaṅkiliṭṭhasaṅkilesikassa ca asaṅkiliṭṭhaasaṅkilesikassa	asaṅkiliṭṭha asaṅkilesikaḥ dhammaḥ asaṅkiliṭṭha saṅkilesikassa ca asaṅkiliṭṭha asaṅkilesikassa 
PA_patthana_1.6:76.1_1	ca dhammassa vipākapaccayena paccayo—vipāko asaṅkiliṭṭhaasaṅkilesiko eko khandho	ca dhammassa vipāka paccayena paccayaḥ vipākaḥ asaṅkiliṭṭha asaṅkilesikaḥ ekaḥ khandho 
PA_patthana_1.6:76.1_2	tiṇṇannaṁ khandhānaṁ cittasamuṭṭhānānañca rūpānaṁ vipākapaccayena paccayo …pe… dve khandhā …pe….	tiṇṇannam khandhānam citta samuṭṭhānānañca rūpānam vipāka paccayena paccayaḥ pe dve khandhāḥ pe 
PA_patthana_1.6:77.0	Āhāra	āhāra 
PA_patthana_1.6:77.1	Saṅkiliṭṭhasaṅkilesiko dhammo saṅkiliṭṭhasaṅkilesikassa dhammassa āhārapaccayena paccayo … tīṇi.	saṅkiliṭṭha saṅkilesikaḥ dhammaḥ saṅkiliṭṭha saṅkilesikassa dhammassa āhāra paccayena paccayaḥ tīṇi 
PA_patthana_1.6:78.1_0	Asaṅkiliṭṭhasaṅkilesiko dhammo asaṅkiliṭṭhasaṅkilesikassa dhammassa āhārapaccayena	asaṅkiliṭṭha saṅkilesikaḥ dhammaḥ asaṅkiliṭṭha saṅkilesikassa dhammassa āhāra paccayena 
PA_patthana_1.6:78.1_1	paccayo—asaṅkiliṭṭhasaṅkilesikā āhārā sampayuttakānaṁ khandhānaṁ cittasamuṭṭhānānañca	paccayo asaṅkiliṭṭha saṅkilesikāḥ āhārāḥ sampayuttakānam khandhānam citta samuṭṭhānānam ca 
PA_patthana_1.6:78.1_2	rūpānaṁ āhārapaccayena paccayo. Paṭisandhikkhaṇe …pe… kabaḷīkāro āhāro imassa kāyassa	rūpānaṃ āhāra paccayena paccayaḥ paṭisandhi khaṇe pe kabaḷīkāraḥ āhāraḥ imassa kāyassa 
PA_patthana_1.6:78.1_3	āhārapaccayena paccayo.	āhāra paccayena paccayaḥ 
PA_patthana_1.6:79.1	Asaṅkiliṭṭhaasaṅkilesiko dhammo asaṅkiliṭṭhaasaṅkilesikassa dhammassa āhārapaccayena paccayo … tīṇi.	asaṅkiliṭṭha asaṅkilesikaḥ dhammaḥ asaṅkiliṭṭha asaṅkilesikassa dhammassa āhāra paccayena paccayaḥ tīṇi 
PA_patthana_1.6:80.0	Indriya	indriya 
PA_patthana_1.6:80.1	Saṅkiliṭṭhasaṅkilesiko dhammo saṅkiliṭṭhasaṅkilesikassa dhammassa indriyapaccayena paccayo … tīṇi.	saṅkiliṭṭha saṅkilesikaḥ dhammaḥ saṅkiliṭṭha saṅkilesikassa dhammassa indriya paccayena paccayaḥ tīṇi 
PA_patthana_1.6:81.1_0	Asaṅkiliṭṭhasaṅkilesiko dhammo asaṅkiliṭṭhasaṅkilesikassa dhammassa indriyapaccayena	asaṅkiliṭṭha saṅkilesikaḥ dhammaḥ asaṅkiliṭṭha saṅkilesikassa dhammassa indriya paccayena 
PA_patthana_1.6:81.1_1	paccayo—asaṅkiliṭṭhasaṅkilesikā indriyā sampayuttakānaṁ khandhānaṁ cittasamuṭṭhānānañca	paccayaḥ asaṅkiliṭṭha saṅkilesikāḥ indriyāḥ sampayuttakānam khandhānam citta samuṭṭhānānam ca 
PA_patthana_1.6:81.1_2	rūpānaṁ indriyapaccayena paccayo; paṭisandhikkhaṇe …pe… cakkhundriyaṁ cakkhuviññāṇassa	rūpānaṃ indriya paccayena paccayaḥ paṭisandhi kkhaṇe pe cakkhu indriyam cakkhu viññāṇassa 
PA_patthana_1.6:81.1_3	…pe… kāyindriyaṁ kāyaviññāṇassa indriyapaccayena paccayo. Rūpajīvitindriyaṁ—kaṭattārūpānaṁ	pe kāya indriyam kāya viññāṇassa indriya paccayena paccayaḥ 
PA_patthana_1.6:81.1_4	indriyapaccayena paccayo.	indriya paccayena paccayaḥ 
PA_patthana_1.6:82.1	Asaṅkiliṭṭhaasaṅkilesiko dhammo … tīṇi.	asaṅkiliṭṭha asaṅkilesikaḥ dhammo tīṇi 
PA_patthana_1.6:83.0	Jhānādi	jhāna ādi 
PA_patthana_1.6:83.1	Saṅkiliṭṭhasaṅkilesiko dhammo saṅkiliṭṭhasaṅkilesikassa dhammassa jhānapaccayena paccayo … maggapaccayena paccayo … sampayuttapaccayena paccayo.	saṅkiliṭṭha saṅkilesikaḥ dhammaḥ saṅkiliṭṭha saṅkilesikassa dhammassa jhāna paccayena paccayaḥ magga paccayena paccayaḥ sampayutta paccayena paccayaḥ 
PA_patthana_1.6:84.0	Vippayutta	vippayutta 
PA_patthana_1.6:84.1_0	Saṅkiliṭṭhasaṅkilesiko dhammo asaṅkiliṭṭhasaṅkilesikassa dhammassa vippayuttapaccayena	saṅkiliṭṭha saṅkilesikaḥ dhammaḥ asaṅkiliṭṭha saṅkilesikassa dhammassa vippayutta paccayena 
PA_patthana_1.6:84.1_1	paccayo—sahajātaṁ, pacchājātaṁ. Sahajātā—saṅkiliṭṭhasaṅkilesikā khandhā cittasamuṭṭhānānaṁ	paccaya usahajāta pacchājāta sahajāta asaṅkiliṭṭha saṅkilesikā khandhā 
PA_patthana_1.6:84.1_2	rūpānaṁ vippayuttapaccayena paccayo. Pacchājātā—saṅkiliṭṭhasaṅkilesikā khandhā purejātassa	rūpānam vippayutta paccayena paccayaḥ pacchājātā a saṅkiliṭṭha saṅkilesikā khandhā purejātassa 
PA_patthana_1.6:84.1_3	imassa kāyassa vippayuttapaccayena paccayo.	imassa kāyassa vippayutta paccayena paccayaḥ 
PA_patthana_1.6:85.1_0	Asaṅkiliṭṭhasaṅkilesiko dhammo asaṅkiliṭṭhasaṅkilesikassa dhammassa vippayuttapaccayena	asaṅkiliṭṭha saṅkilesikaḥ dhammaḥ asaṅkiliṭṭha saṅkilesikassa dhammassa vippayutta paccayena 
PA_patthana_1.6:85.1_1	paccayo—sahajātaṁ, purejātaṁ, pacchājātaṁ. Sahajātā—asaṅkiliṭṭhasaṅkilesikā khandhā	paccaya usahajāta purejāta pacchājāta sahajātā asaṅkiliṭṭha saṅkilesikā khandhā 
PA_patthana_1.6:85.1_2	cittasamuṭṭhānānaṁ rūpānaṁ vippayuttapaccayena paccayo; paṭisandhikkhaṇe asaṅkiliṭṭhasaṅkilesikā	citta samuṭṭhānānam rūpānam vippayutta paccayena paccayaḥ paṭisandhi khaṇe asaṅkiliṭṭha saṅkilesikā 
PA_patthana_1.6:85.1_3	khandhā kaṭattārūpānaṁ vippayuttapaccayena paccayo. Khandhā vatthussa …pe… vatthu	khandhā kaṭattā rūpānam vippayutta paccayena paccayaḥ khandhā vatthussa pe vatthu 
PA_patthana_1.6:85.1_4	khandhānaṁ vippayuttapaccayena paccayo. Purejātaṁ—cakkhāyatanaṁ cakkhuviññāṇassa	khandhānam vippayutta paccayena paccayaḥ purejāta cakkhu āyatanam cakkhu viññāṇassa 
PA_patthana_1.6:85.1_5	…pe… kāyāyatanaṁ kāyaviññāṇassa vippayuttapaccayena paccayo. Vatthu asaṅkiliṭṭhasaṅkilesikānaṁ	pe kāya āyatanam kāya viññāṇassa vippayutta paccayena paccayaḥ vatthu 
PA_patthana_1.6:85.1_6	khandhānaṁ vippayuttapaccayena paccayo. Pacchājātā—asaṅkiliṭṭhasaṅkilesikā khandhā	khandhānam vippayutta paccayena paccayaḥ pacchājātā asaṅkiliṭṭha saṅkilesikā khandhā 
PA_patthana_1.6:85.1_7	purejātassa imassa kāyassa vippayuttapaccayena paccayo.	purejātassa imassa kāyassa vippayutta paccayena paccayo 
PA_patthana_1.6:86.1	Asaṅkiliṭṭhasaṅkilesiko dhammo saṅkiliṭṭhasaṅkilesikassa dhammassa vippayuttapaccayena paccayo. Purejātaṁ—vatthu saṅkiliṭṭhasaṅkilesikānaṁ khandhānaṁ vippayuttapaccayena paccayo.	asaṅkiliṭṭha saṅkilesikaḥ dhammaḥ saṅkiliṭṭha saṅkilesikassa dhammassa vippayutta paccayena paccayaḥ purejāta vatthu saṅkiliṭṭha saṅkilesikānam khandhānam vippayutta paccayena paccayaḥ 
PA_patthana_1.6:87.1_0	Asaṅkiliṭṭhasaṅkilesiko dhammo asaṅkiliṭṭhaasaṅkilesikassa dhammassa vippayuttapaccayena	asaṅkiliṭṭha saṅkilesikaḥ dhammaḥ asaṅkiliṭṭha asaṅkilesikassa dhammassa vippayutta paccayena 
PA_patthana_1.6:87.1_1	paccayo. Purejātaṁ—vatthu asaṅkiliṭṭhaasaṅkilesikānaṁ khandhānaṁ vippayuttapaccayena paccayo.	paccayaḥ purejāta vatthu asaṅkiliṭṭha asaṅkilesikānam khandhānam vippayutta paccayena paccayaḥ 
PA_patthana_1.6:88.1_0	Asaṅkiliṭṭhaasaṅkilesiko dhammo asaṅkiliṭṭhasaṅkilesikassa dhammassa vippayuttapaccayena	asaṅkiliṭṭha asaṅkilesikaḥ dhammaḥ asaṅkiliṭṭha saṅkilesikassa dhammassa vippayutta paccayena 
PA_patthana_1.6:88.1_1	paccayo—sahajātaṁ, pacchājātaṁ. Sahajātā—asaṅkiliṭṭhaasaṅkilesikā khandhā cittasamuṭṭhānānaṁ	paccaya usahajāta pacchājāta sahajātā asaṅkiliṭṭha asaṅkilesikā khandhā 
PA_patthana_1.6:88.1_2	rūpānaṁ vippayuttapaccayena paccayo. Pacchājātā—asaṅkiliṭṭhaasaṅkilesikā khandhā	rūpānam vippayutta paccayena paccayaḥ pacchājātā asaṅkiliṭṭha asaṅkilesikā khandhā 
PA_patthana_1.6:88.1_3	purejātassa imassa kāyassa vippayuttapaccayena paccayo.	purejātassa imassa kāyassa vippayutta paccayena paccayo 
PA_patthana_1.6:89.0	Atthi	atthi 
PA_patthana_1.6:89.1	Saṅkiliṭṭhasaṅkilesiko dhammo saṅkiliṭṭhasaṅkilesikassa dhammassa atthipaccayena paccayo—saṅkiliṭṭhasaṅkilesiko eko khandho tiṇṇannaṁ khandhānaṁ atthipaccayena paccayo.	saṅkiliṭṭha saṅkilesikaḥ dhammaḥ saṅkiliṭṭha saṅkilesikassa dhammassa atthi paccayena paccayaḥ saṅkiliṭṭha saṅkilesikaḥ ekaḥ khandhaḥ tiṇṇannam khandhānam atthi paccayena paccayaḥ 
PA_patthana_1.6:90.1_0	Saṅkiliṭṭhasaṅkilesiko dhammo asaṅkiliṭṭhasaṅkilesikassa dhammassa atthipaccayena	saṅkiliṭṭha saṅkilesikaḥ dhammaḥ asaṅkiliṭṭha saṅkilesikassa dhammassa atthi paccayena 
PA_patthana_1.6:90.1_1	paccayo—sahajātaṁ, pacchājātaṁ. Sahajātā—saṅkiliṭṭhasaṅkilesikā khandhā cittasamuṭṭhānānaṁ	paccaya usahajāta pacchājāta sahajāta asaṅkiliṭṭha saṅkilesikā khandhā 
PA_patthana_1.6:90.1_2	rūpānaṁ atthipaccayena paccayo. Pacchājātā—saṅkiliṭṭhasaṅkilesikā khandhā purejātassa	rūpānaṃ atthi paccayena paccayaḥ pacchājātā a saṅkiliṭṭha saṅkilesikā khandhā purejātassa 
PA_patthana_1.6:90.1_3	imassa kāyassa atthipaccayena paccayo.	imassa kāyassa atthi paccayena paccayaḥ 
PA_patthana_1.6:91.1_0	Saṅkiliṭṭhasaṅkilesiko dhammo saṅkiliṭṭhasaṅkilesikassa ca asaṅkiliṭṭhasaṅkilesikassa	saṅkiliṭṭha saṅkilesikaḥ dhammaḥ saṅkiliṭṭha saṅkilesikassa ca a saṅkiliṭṭha saṅkilesikassa 
PA_patthana_1.6:91.1_1	ca dhammassa atthipaccayena paccayo—saṅkiliṭṭhasaṅkilesiko eko khandho tiṇṇannaṁ	ca dhammassa atthi paccayena paccayo saṅkiliṭṭha saṅkilesikaḥ ekaḥ khandho 
PA_patthana_1.6:91.1_2	khandhānaṁ cittasamuṭṭhānānañca rūpānaṁ atthipaccayena paccayo …pe… dve khandhā …pe….	khandhānam citta samuṭṭhānānaṃ ca rūpānaṃ atthi paccayena paccayaḥ pe dve khandhā pe 
PA_patthana_1.6:92.1_0	Asaṅkiliṭṭhasaṅkilesiko dhammo asaṅkiliṭṭhasaṅkilesikassa dhammassa atthipaccayena	asaṅkiliṭṭha saṅkilesikaḥ dhammaḥ asaṅkiliṭṭha saṅkilesikassa dhammassa atthi paccayena 
PA_patthana_1.6:92.1_1	paccayo—sahajātaṁ, purejātaṁ, pacchājātaṁ, āhāraṁ, indriyaṁ. Sahajāto—asaṅkiliṭṭhasaṅkilesiko	paccayo sahajāta purejāta pacchājāta āhāra indriya sahajātaḥ asaṅkiliṭṭha saṅkilesiko 
PA_patthana_1.6:92.1_2	eko khandho tiṇṇannaṁ khandhānaṁ cittasamuṭṭhānānañca rūpānaṁ atthipaccayena paccayo	ekaḥ khandhaḥ tiṇṇannam khandhānam citta samuṭṭhānānañca rūpānaṃ atthi paccayena paccayaḥ 
PA_patthana_1.6:92.1_3	…pe… paṭisandhikkhaṇe …pe… asaññasattānaṁ ekaṁ mahābhūtaṁ tiṇṇannaṁ mahābhūtānaṁ	pe paṭisandhi khaṇe pe asaññasattānam ekam mahābhūtam tiṇṇannam mahābhūtānam 
PA_patthana_1.6:92.1_4	atthipaccayena paccayo …pe… purejātaṁ—cakkhuṁ aniccato dukkhato anattato vipassati.	atthi paccayena paccayaḥ pe purejāta cakkhum aniccataḥ dukkhataḥ anattataḥ vipassati 
PA_patthana_1.6:92.1_5	Sotaṁ …pe… kāyaṁ … rūpe …pe… phoṭṭhabbe … vatthuṁ aniccato dukkhato anattato vipassati,	sotam pe kāyam rūpe pe phoṭṭhabbe vatthum aniccataḥ dukkhataḥ anattataḥ vipassati 
PA_patthana_1.6:92.1_6	dibbena cakkhunā rūpaṁ passati, dibbāya sotadhātuyā saddaṁ suṇāti. Rūpāyatanaṁ cakkhuviññāṇassa	dibbena cakkhunā rūpam passati dibbāya sotadhātuyā saddam suṇāti rūpa āyatanam cakkhu viññāṇassa 
PA_patthana_1.6:92.1_7	…pe… phoṭṭhabbāyatanaṁ kāyaviññāṇassa atthipaccayena paccayo. Cakkhāyatanaṁ cakkhuviññāṇassa	pe phoṭṭhabba āyatanam kāya viññāṇassa atthi paccayena paccayaḥ cakkhu āyatanam cakkhu viññāṇassa 
PA_patthana_1.6:92.1_8	…pe… kāyāyatanaṁ kāyaviññāṇassa …pe… vatthu asaṅkiliṭṭhasaṅkilesikānaṁ khandhānaṁ	pe kāya āyatanam kāya viññāṇassa pe vatthu asaṅkiliṭṭha saṅkilesikānam khandhānam 
PA_patthana_1.6:92.1_9	atthipaccayena paccayo. Pacchājātā—asaṅkiliṭṭhasaṅkilesikā khandhā purejātassa imassa	atthi paccayena paccayaḥ pacchājātā a saṅkiliṭṭha saṅkilesikā khandhā purejātassa imassa 
PA_patthana_1.6:92.1_10	kāyassa atthipaccayena paccayo. Kabaḷīkāro āhāro—imassa kāyassa …pe…. Rūpajīvitindriyaṁ—kaṭattārūpānaṁ	kāyassa atthi paccayena paccayaḥ kabaḷīkāraḥ āhāro imassa kāyassa pe
PA_patthana_1.6:92.1_11	atthipaccayena paccayo.	atthi paccayena paccayaḥ 
PA_patthana_1.6:93.1_0	Asaṅkiliṭṭhasaṅkilesiko dhammo saṅkiliṭṭhasaṅkilesikassa dhammassa atthipaccayena	asaṅkiliṭṭha saṅkilesikaḥ dhammaḥ saṅkiliṭṭha saṅkilesikassa dhammassa atthi paccayena 
PA_patthana_1.6:93.1_1	paccayo. Purejātaṁ—cakkhuṁ assādeti abhinandati; taṁ ārabbha rāgo uppajjati …pe…	paccayaḥ purejāta cakkhuṃ assādeti abhinandati tam ārabbha rāgaḥ uppajjati pe 
PA_patthana_1.6:93.1_2	domanassaṁ uppajjati; vatthuṁ assādeti …pe… vatthu saṅkiliṭṭhasaṅkilesikānaṁ khandhānaṁ	domanassam uppajjati vatthum assādeti pe vatthu saṅkiliṭṭha saṅkilesikānaṃ khandhānaṃ 
PA_patthana_1.6:93.1_3	atthipaccayena paccayo.	atthi paccayena paccayaḥ 
PA_patthana_1.6:94.1	Asaṅkiliṭṭhasaṅkilesiko dhammo asaṅkiliṭṭhaasaṅkilesikassa dhammassa atthipaccayena paccayo. Purejātaṁ—vatthu asaṅkiliṭṭhaasaṅkilesikānaṁ khandhānaṁ atthipaccayena paccayo.	asaṅkiliṭṭha saṅkilesikaḥ dhammaḥ asaṅkiliṭṭha asaṅkilesikassa dhammassa atthi paccayena paccayaḥ purejāta vatthu asaṅkiliṭṭha asaṅkilesikānam khandhānam atthi paccayena paccayaḥ 
PA_patthana_1.6:95.1	Asaṅkiliṭṭhaasaṅkilesiko dhammo asaṅkiliṭṭhaasaṅkilesikassa dhammassa atthipaccayena paccayo—asaṅkiliṭṭhaasaṅkilesiko eko khandho tiṇṇannaṁ khandhānaṁ atthipaccayena paccayo ….	asaṅkiliṭṭha asaṅkilesikaḥ dhammaḥ asaṅkiliṭṭha asaṅkilesikassa dhammassa atthi paccayena paccayo asaṅkiliṭṭha asaṅkilesikaḥ ekaḥ khandho tiṇṇannam khandhānam atthi paccayena paccayaḥ 
PA_patthana_1.6:96.1_0	Asaṅkiliṭṭhaasaṅkilesiko dhammo asaṅkiliṭṭhasaṅkilesikassa dhammassa atthipaccayena	asaṅkiliṭṭha asaṅkilesikaḥ dhammaḥ asaṅkiliṭṭha saṅkilesikassa dhammassa atthi paccayena 
PA_patthana_1.6:96.1_1	paccayo—sahajātaṁ, pacchājātaṁ. Sahajātā—asaṅkiliṭṭhaasaṅkilesikā khandhā cittasamuṭṭhānānaṁ	paccaya usahajāta pacchājāta sahajātā asaṅkiliṭṭha asaṅkilesikā khandhā 
PA_patthana_1.6:96.1_2	rūpānaṁ atthipaccayena paccayo. Pacchājātā—asaṅkiliṭṭhaasaṅkilesikā khandhā purejātassa	rūpānaṃ atthi paccayena paccayaḥ pacchājātā asaṅkiliṭṭha asaṅkilesikā khandhā purejātassa 
PA_patthana_1.6:96.1_3	imassa kāyassa atthipaccayena paccayo.	imassa kāyassa atthi paccayena paccayaḥ 
PA_patthana_1.6:97.1_0	Asaṅkiliṭṭhaasaṅkilesiko dhammo asaṅkiliṭṭhasaṅkilesikassa ca asaṅkiliṭṭhaasaṅkilesikassa	asaṅkiliṭṭha asaṅkilesikaḥ dhammaḥ asaṅkiliṭṭha saṅkilesikassa ca asaṅkiliṭṭha asaṅkilesikassa 
PA_patthana_1.6:97.1_1	ca dhammassa atthipaccayena paccayo— asaṅkiliṭṭhaasaṅkilesiko eko khandho tiṇṇannaṁ	ca dhammassa atthi paccayena paccayaḥ asaṅkiliṭṭha asaṅkilesikaḥ ekaḥ khandho 
PA_patthana_1.6:97.1_2	khandhānaṁ cittasamuṭṭhānānañca rūpānaṁ atthipaccayena paccayo ….	khandhānam citta samuṭṭhānānaṃ ca rūpānaṃ atthi paccayena paccayaḥ 
PA_patthana_1.6:98.1_0	Asaṅkiliṭṭhasaṅkilesiko ca asaṅkiliṭṭhaasaṅkilesiko ca dhammā asaṅkiliṭṭhasaṅkilesikassa	asaṅkiliṭṭha saṅkilesiko ca asaṅkiliṭṭha asaṅkilesiko ca dhammā asaṅkiliṭṭha saṅkilesikassa 
PA_patthana_1.6:98.1_1	dhammassa atthipaccayena paccayo—sahajātaṁ, pacchājātaṁ, āhāraṁ, indriyaṁ. Sahajātā—asaṅkiliṭṭhaasaṅkilesikā	dhammassa atthi paccayena paccayo sahajāta pacchājāta āhāra indriya sahajātā asaṅkiliṭṭha asaṅkilesikā 
PA_patthana_1.6:98.1_2	khandhā ca mahābhūtā ca cittasamuṭṭhānānaṁ rūpānaṁ atthipaccayena paccayo. Pacchājātā—asaṅkiliṭṭhaasaṅkilesikā	khandhā ca mahābhūtā ca citta samuṭṭhānānam rūpānaṃ atthi paccayena paccayaḥ pacchājātā asaṅkiliṭṭha asaṅkilesikā 
PA_patthana_1.6:98.1_3	khandhā ca kabaḷīkāro āhāro ca imassa kāyassa atthipaccayena paccayo. Pacchājātā—asaṅkiliṭṭhasaṅkilesikā	khandhā ca kabaḷīkāro āhāro ca imassa kāyassa atthi paccayena paccayo pacchājātā a saṅkiliṭṭha saṅkilesikā 
