segmentnr	original	analyzed
PA_ps_1.0:0.1	Paṭisambhidāmagga	paṭisambhidā magga 
PA_ps_1.0:0.2	1 Mahāvagga	mahāvagga 
PA_ps_1.0:0.3	1.0 Mātikā	mātikā 
PA_ps_1.0:0.4	Namo tassa Bhagavato Arahato Sammāsambuddhassa.	namaḥ tassa bhagavataḥ arahataḥ sammāsambuddhassa 
PA_ps_1.0:1.1	Sotāvadhāne paññā sutamaye ñāṇaṁ.	sota avadhāne paññā suta maye ñāṇa 
PA_ps_1.0:2.1	Sutvāna saṁvare paññā sīlamaye ñāṇaṁ.	sutvāna savare paññā sīla maye ñāṇa 
PA_ps_1.0:3.1	Saṁvaritvā samādahane paññā samādhibhāvanāmaye ñāṇaṁ.	samādahane paññā samādhi bhāvanā āmaye ñāṇa 
PA_ps_1.0:4.1	Paccayapariggahe paññā dhammaṭṭhitiñāṇaṁ.	paccaya pariggahe paññā dhamma ṭṭhiti ñāṇa 
PA_ps_1.0:5.1	Atītānāgatapaccuppannānaṁ dhammānaṁ saṅkhipitvā vavatthāne paññā sammasane ñāṇaṁ.	atīta anāgata paccuppannānam dhammānam saṅkhipitvā vavatthāne paññā sammasane ñāṇa 
PA_ps_1.0:6.1	Paccuppannānaṁ dhammānaṁ vipariṇāmānupassane paññā udayabbayānupassane ñāṇaṁ.	paccuppannānam dhammānam vipariṇāma anupassane paññā udaya bbaya anupassane ñāṇa 
PA_ps_1.0:7.1	Ārammaṇaṁ paṭisaṅkhā bhaṅgānupassane paññā vipassane ñāṇaṁ.	ārammaṇam paṭisaṅkhā bhaṅga anupassane paññā vipassane ñāṇa 
PA_ps_1.0:8.1	Bhayatupaṭṭhāne paññā ādīnave ñāṇaṁ.	paññā ādīnave ñāṇa 
PA_ps_1.0:9.1	Muñcitukamyatāpaṭisaṅkhāsantiṭṭhanā paññā saṅkhārupekkhāsu ñāṇaṁ.	muñcitu kamya tā paṭisaṅkhā santiṭṭhanā paññā saṅkhāra upekkhāsu ñāṇa 
PA_ps_1.0:10.1	Bahiddhā vuṭṭhānavivaṭṭane paññā gotrabhuñāṇaṁ.	bahiddhā vuṭṭhāna vivaṭṭane paññā gotra bhuñāṇa 
PA_ps_1.0:11.1	Dubhato vuṭṭhānavivaṭṭane paññā magge ñāṇaṁ.	dubhataḥ vuṭṭhāna vivaṭṭane paññā magge ñāṇa 
PA_ps_1.0:12.1	Payogappaṭippassaddhi paññā phale ñāṇaṁ.	payoga paṭippassaddhi paññā phale ñāṇa 
PA_ps_1.0:13.1	Chinnavaṭumānupassane paññā vimuttiñāṇaṁ.	chinna vaṭuma anupassane paññā vimutti ñāṇa 
PA_ps_1.0:14.1	Tadā samudāgate dhamme passane paññā paccavekkhaṇe ñāṇaṁ.	tadā samudāgate dhamme passane paññā paccavekkhaṇe ñāṇa 
PA_ps_1.0:15.1	Ajjhattavavatthāne paññā vatthunānatte ñāṇaṁ.	ajjhatta vavatthāne paññā vatthu nānatte ñāṇa 
PA_ps_1.0:16.1	Bahiddhāvavatthāne paññā gocaranānatte ñāṇaṁ.	bahiddhā avatthāne paññā gocara nānatte ñāṇa 
PA_ps_1.0:17.1	Cariyāvavatthāne paññā cariyānānatte ñāṇaṁ.	cariyā vavatthāne paññā cariyā anānatte ñāṇa 
PA_ps_1.0:18.1	Catudhammavavatthāne paññā bhūminānatte ñāṇaṁ.	catu dhamma vavatthāne paññā bhūmi nānatte 
PA_ps_1.0:19.1	Navadhammavavatthāne paññā dhammanānatte ñāṇaṁ.	nava dhamma vavatthāne paññā dhamma nānatte ñāṇa 
PA_ps_1.0:20.1	Abhiññāpaññā ñātaṭṭhe ñāṇaṁ.	abhiññā paññā ñāta ṭṭhe ñāṇa 
PA_ps_1.0:21.1	Pariññāpaññā tīraṇaṭṭhe ñāṇaṁ.	pariññā paññā tīraṇa ṭṭhe ñāṇa 
PA_ps_1.0:22.1	Pahāne paññā pariccāgaṭṭhe ñāṇaṁ.	pahāne paññā pariccāgaṭṭhe ñāṇa 
PA_ps_1.0:23.1	Bhāvanāpaññā ekarasaṭṭhe ñāṇaṁ.	bhāvanā paññā ekarasaṭṭhe ñāṇa 
PA_ps_1.0:24.1	Sacchikiriyāpaññā phassanaṭṭhe ñāṇaṁ.	sacchikiriyā paññā phassana ṭṭhe ñāṇa 
PA_ps_1.0:25.1	Atthanānatte paññā atthapaṭisambhide ñāṇaṁ.	attha nānatte paññā attha paṭisambhide ñāṇa 
PA_ps_1.0:26.1	Dhammanānatte paññā dhammapaṭisambhide ñāṇaṁ.	dhamma nānatte paññā dhamma paṭisambhide ñāṇa 
PA_ps_1.0:27.1	Niruttinānatte paññā niruttipaṭisambhide ñāṇaṁ.	nirutti nānatte paññā nirutti paṭisambhide ñāṇa 
PA_ps_1.0:28.1	Paṭibhānanānatte paññā paṭibhānapaṭisambhide ñāṇaṁ.	paṭibhāna nānatte paññā paṭibhāna paṭisambhide ñāṇa 
PA_ps_1.0:29.1	Vihāranānatte paññā vihāraṭṭhe ñāṇaṁ.	vihāra nānatte paññā vihāra aṭṭhe ñāṇa 
PA_ps_1.0:30.1	Samāpattinānatte paññā samāpattaṭṭhe ñāṇaṁ.	samāpatti nānatte paññā samāpatta ṭṭhe ñāṇa 
PA_ps_1.0:31.1	Vihārasamāpattinānatte paññā vihārasamāpattaṭṭhe ñāṇaṁ.	vihāra samāpatti nānatte paññā vihāra samāpatta ṭṭhe ñāṇa 
PA_ps_1.0:32.1	Avikkhepaparisuddhattā āsavasamucchede paññā ānantarikasamādhimhi ñāṇaṁ.	avikkhepa parisuddha ttā āsava samucchede paññā ānantarika samādhimhi 
PA_ps_1.0:33.1	Dassanādhipateyyaṁ santo ca vihārādhigamo paṇītādhimuttatā paññā araṇavihāre ñāṇaṁ.	dassana ādhipateyyam santaḥ ca vihāra adhigamaḥ paṇīta adhimutta tā paññā araṇa vihāre ñāṇa 
PA_ps_1.0:34.1	Dvīhi balehi samannāgatattā tayo ca saṅkhārānaṁ paṭippassaddhiyā soḷasahi ñāṇacariyāhi navahi samādhicariyāhi vasibhāvatā paññā nirodhasamāpattiyā ñāṇaṁ.	dvīhi balehi samannāgata ttā tayo ca saṅkhārānaṃ paṭippassaddhiyā soḷasahi ñāṇa cariyāhi navahi samādhi cariyāhi vasi bhāva tā paññā nirodha samāpattiyā ñāṇa 
PA_ps_1.0:35.1	Sampajānassa pavattapariyādāne paññā parinibbāne ñāṇaṁ.	sampajānassa pavatta pariyādāne paññā parinibbāne ñāṇa 
PA_ps_1.0:36.1	Sabbadhammānaṁ sammā samucchede nirodhe ca anupaṭṭhānatā paññā samasīsaṭṭhe ñāṇaṁ.	sabba dhammānam sammā samucchede nirodhe ca an upaṭṭhāna tā paññā sama sīsa ṭṭhe ñāṇa 
PA_ps_1.0:37.1	Puthunānattatejapariyādāne paññā sallekhaṭṭhe ñāṇaṁ.	puthu na ānatta teja pariyādāne paññā sallekha ṭṭhe ñāṇa 
PA_ps_1.0:38.1	Asallīnattapahitattapaggahaṭṭhe paññā vīriyārambhe ñāṇaṁ.	paññā vīriya ārambhe ñāṇa 
PA_ps_1.0:39.1	Nānādhammappakāsanatā paññā atthasandassane ñāṇaṁ.	nānā dhamma ppakāsana tā paññā attha sandassane ñāṇa 
PA_ps_1.0:40.1	Sabbadhammānaṁ ekasaṅgahatānānattekattapaṭivedhe paññā dassanavisuddhiñāṇaṁ.	sabba dhammānam eka saṅgaha tā anānatta ekatta paṭivedhe paññā dassana visuddhi ñāṇa 
PA_ps_1.0:41.1	Viditattā paññā khantiñāṇaṁ.	vidita ttā paññā khanti ñāṇa 
PA_ps_1.0:42.1	Phuṭṭhattā paññā pariyogāhaṇe ñāṇaṁ.	phuṭṭha tā paññā pariyogāhaṇe ñāṇa 
PA_ps_1.0:43.1	Samodahane paññā padesavihāre ñāṇaṁ.	samodahane paññā padesa vihāre ñāṇa 
PA_ps_1.0:44.1	Adhipatattā paññā saññāvivaṭṭe ñāṇaṁ.	adhipatattā paññā saññā vivaṭṭe ñāṇa 
PA_ps_1.0:45.1	Nānatte paññā cetovivaṭṭe ñāṇaṁ.	nānatte paññā cetaḥ vivaṭṭe ñāṇa 
PA_ps_1.0:46.1	Adhiṭṭhāne paññā cittavivaṭṭe ñāṇaṁ.	adhiṭṭhāne paññā citta vivaṭṭe ñāṇa 
PA_ps_1.0:47.1	Suññate paññā ñāṇavivaṭṭe ñāṇaṁ.	paññā ñāṇa vivaṭṭe ñāṇa 
PA_ps_1.0:48.1	Vosagge paññā vimokkhavivaṭṭe ñāṇaṁ.	vosagge paññā vimokkha vivaṭṭe ñāṇa 
PA_ps_1.0:49.1	Tathaṭṭhe paññā saccavivaṭṭe ñāṇaṁ.	tathaṭṭhe paññā sacca vivaṭṭe ñāṇa 
PA_ps_1.0:50.1	Kāyampi cittampi ekavavatthānatā sukhasaññañca lahusaññañca adhiṭṭhānavasena ijjhanaṭṭhe paññā iddhividhe ñāṇaṁ.	kāyampi cittampi eka vavatthāna tā sukha saññañca lahu saññañca adhiṭṭhāna vasena ijjhanaṭṭhe paññā iddhi vidhe ñāṇa 
PA_ps_1.0:51.1	Vitakkavipphāravasena nānattekattasaddanimittānaṁ pariyogāhaṇe paññā sotadhātuvisuddhiñāṇaṁ.	vitakka vipphāra vasena nānatta ekatta sadda nimittānam pariyogāhaṇe paññā sota dhātu visuddhi ñāṇa 
PA_ps_1.0:52.1	Tiṇṇannaṁ cittānaṁ vipphārattā indriyānaṁ pasādavasena nānattekattaviññāṇacariyā pariyogāhaṇe paññā cetopariyañāṇaṁ.	tiṇṇannam cittānam vipphāra ttā indriyānam pasāda vasena nānatta ekatta viññāṇa cariyā pariyogāhaṇe paññā cetas pariya ñāṇa 
PA_ps_1.0:53.1	Paccayappavattānaṁ dhammānaṁ nānattekattakammavipphāravasena pariyogāhaṇe paññā pubbenivāsānussatiñāṇaṁ.	paccaya ppavattānam dhammānam nānatta ekatta kamma vipphāra vasena pariyogāhaṇe paññā pubbenivāsa anussati ñāṇa 
PA_ps_1.0:54.1	Obhāsavasena nānattekattarūpanimittānaṁ dassanaṭṭhe paññā dibbacakkhuñāṇaṁ.	obhāsa vasena nānatta ekatta rūpa nimittānam dassana aṭṭhe paññā dibba cakkhu ñāṇa 
PA_ps_1.0:55.1	Catusaṭṭhiyā ākārehi tiṇṇannaṁ indriyānaṁ vasibhāvatā paññā āsavānaṁ khaye ñāṇaṁ.	ākārehi tiṇṇannam indriyānam vasibhāvatā paññā āsavānam khaye ñāṇa 
PA_ps_1.0:56.1	Pariññaṭṭhe paññā dukkhe ñāṇaṁ.	pariññaṭṭhe paññā dukkhe ñāṇa 
PA_ps_1.0:57.1	Pahānaṭṭhe paññā samudaye ñāṇaṁ.	pahāna aṭṭhe paññā samudaye ñāṇa 
PA_ps_1.0:58.1	Sacchikiriyaṭṭhe paññā nirodhe ñāṇaṁ.	sacchikiriya ṭṭhe paññā nirodhe ñāṇa 
PA_ps_1.0:59.1	Bhāvanaṭṭhe paññā magge ñāṇaṁ.	bhāvanā aṭṭhe paññā magge ñāṇa 
PA_ps_1.0:60.1	Dukkhe ñāṇaṁ.	dukkhe ñāṇa 
PA_ps_1.0:61.1	Dukkhasamudaye ñāṇaṁ.	dukkha samudaye ñāṇa 
PA_ps_1.0:62.1	Dukkhanirodhe ñāṇaṁ.	dukkha nirodhe 
PA_ps_1.0:63.1	Dukkhanirodhagāminiyā paṭipadāya ñāṇaṁ.	dukkha nirodha gāminiyā paṭipadāya ñāṇa 
PA_ps_1.0:64.1	Atthapaṭisambhide ñāṇaṁ.	attha paṭisambhide ñāṇa 
PA_ps_1.0:65.1	Dhammapaṭisambhide ñāṇaṁ.	dhamma paṭisambhide ñāṇa 
PA_ps_1.0:66.1	Niruttipaṭisambhide ñāṇaṁ.	nirutti paṭisambhide ñāṇa 
PA_ps_1.0:67.1	Paṭibhānapaṭisambhide ñāṇaṁ.	paṭibhāna paṭisambhide ñāṇa 
PA_ps_1.0:68.1	Indriyaparopariyattañāṇaṁ.	indriya para upari yat ta ñāṇa 
PA_ps_1.0:69.1	Sattānaṁ āsayānusaye ñāṇaṁ.	sattānam āsaya anusaye ñāṇa 
PA_ps_1.0:70.1	Yamakapāṭihīre ñāṇaṁ.	yamaka pāṭi hīre ñāṇa 
PA_ps_1.0:71.1	Mahākaruṇāsamāpattiyā ñāṇaṁ.	mahā karuṇā samāpattiyā 
PA_ps_1.0:72.1	Sabbaññutaññāṇaṁ.	sabbaññuta ññāṇa 
PA_ps_1.0:73.1	Anāvaraṇañāṇaṁ.	an āvaraṇa ñāṇa 
PA_ps_1.0:74.1	Imāni tesattati ñāṇāni.	imāni tesattati ñāṇāni 
PA_ps_1.0:74.2	Imesaṁ tesattatiyā ñāṇānaṁ sattasaṭṭhi ñāṇāni sāvakasādhāraṇāni;	imesam tesattatiyāḥ ñāṇānam sattasaṭṭhi ñāṇāni sāvaka sādhāraṇāni 
PA_ps_1.0:74.3	cha ñāṇāni asādhāraṇāni sāvakehi.	cha ñāṇāni asādhāraṇāni sāvakehi 
PA_ps_1.0:74.4	Mātikā niṭṭhitā.	mātikā niṭṭhitā 
