segmentnr	original	analyzed
PA_patthana_14.30:0.1	Paṭṭhānapakaraṇa	paṭṭhāna pakaraṇa 
PA_patthana_14.30:0.2	Dhammānulomapaccanīya (3), Dukapaṭṭhānapāḷi (2)	dhamma anuloma paccanīya 
PA_patthana_14.30:0.3	14.30. Savitakkadukādi	sa vitakka duka ādi 
PA_patthana_14.30:1.1	Savitakkaṁ dhammaṁ paṭicca nasavitakko dhammo uppajjati hetupaccayā … tīṇi.	sa vitakkam dhammam paṭicca na sa vitakkaḥ dhammaḥ uppajjati hetu paccayā tīṇi 
PA_patthana_14.30:2.1	Avitakkaṁ dhammaṁ paṭicca naavitakko dhammo uppajjati hetupaccayā. (Saṅkhittaṁ.)	avitakkam dhammam paṭicca na avitakkaḥ dhammaḥ uppajjati hetu paccayā 
PA_patthana_14.30:3.1	Hetuyā nava …pe… purejāte āsevane cha …pe… avigate nava.	hetuyā nava pe purejāte āsevane cha pe avigate nava 
PA_patthana_14.30:4.1	Savicāraṁ dhammaṁ paṭicca nasavicāro dhammo uppajjati hetupaccayā … tīṇi.	sa vicāram dhammam paṭicca na sa vicāraḥ dhammaḥ uppajjati hetu paccayā tīṇi 
PA_patthana_14.30:5.1	Avicāraṁ dhammaṁ paṭicca naavicāro dhammo uppajjati hetupaccayā. (Saṅkhittaṁ.)	avicāram dhammam paṭicca na avicāraḥ dhammo uppajjati hetu paccayā 
PA_patthana_14.30:6.1	Hetuyā nava …pe… purejāte āsevane cha …pe… avigate nava.	hetuyā nava pe purejāte āsevane cha pe avigate nava 
