segmentnr	original	analyzed
PA_patthana_4.2:97.1	Abyākato hetu ceva sahetuko ca dhammo abyākatassa hetussa ceva sahetukassa ca dhammassa adhipatipaccayena paccayo … tīṇi. (Saṅkhittaṁ.)	abyākataḥ hetu ca iva sa hetukaḥ ca dhammaḥ abyākatassa hetussa ca iva sa hetukassa ca dhammassa adhipati paccayena paccayaḥ tīṇi 
PA_patthana_4.2:98.1_0	Hetuyā tīṇi, ārammaṇe nava, adhipatiyā satta, anantare pañca, samanantare pañca,	hetuyā tīṇi ārammaṇe nava adhipatiyā satta anantare pañca samanantare pañca 
PA_patthana_4.2:98.1_1	sahajāte tīṇi …pe… upanissaye nava, āsevane tīṇi, vipāke ekaṁ, indriye magge dve,	sahajāte tīṇi pe upanissaye nava āsevane tīṇi vipāke eka indriye magge dve 
PA_patthana_4.2:98.1_2	sampayutte tīṇi …pe… avigate tīṇi. (Saṅkhittaṁ.)	sampayutte tīṇi pe avigate tīṇi 
PA_patthana_4.2:99.1	Nahetuyā nava, naārammaṇe nava. (Saṅkhittaṁ.)	na hetuyā nava na ārammaṇe nava saṅkhitta 
PA_patthana_4.2:100.1	Hetupaccayā naārammaṇe tīṇi. (Saṅkhittaṁ.)	hetu paccayāḥ na ārammaṇe tīṇi 
PA_patthana_4.2:101.1	Nahetupaccayā ārammaṇe nava. (Saṅkhittaṁ.)	na hetu paccayā ārammaṇe nava saṅkhitta 
PA_patthana_4.2:102.1	Yathā kusalattike pañhāvāraṁ, evaṁ vitthāretabbaṁ.	yathā kusala attike pañhāvāraḥ evam 
PA_patthana_4.2:103.0.1	4.2.4.2. Sahetukanahetupada	sa hetuka na hetu pada 
PA_patthana_4.2:103.0.2	Hetu	hetu 
PA_patthana_4.2:103.1	Kusalaṁ sahetukañceva na ca hetuṁ dhammaṁ paṭicca kusalo sahetuko ceva na ca hetu dhammo uppajjati hetupaccayā.	kusalam sa hetukam ca iva na ca hetum dhammam paṭicca kusalaḥ sa hetukaḥ ca iva na ca hetu dhammo uppajjati hetu paccayā 
PA_patthana_4.2:104.1	Akusalaṁ sahetukañceva na ca hetuṁ dhammaṁ paṭicca akusalo sahetuko ceva na ca hetu dhammo uppajjati hetupaccayā.	akusalam sa hetukam ca iva na ca hetum dhammam paṭicca akusalaḥ sa hetukaḥ ca iva na ca hetu dhammo uppajjati hetu paccayā 
PA_patthana_4.2:105.1	Abyākataṁ sahetukañceva na ca hetuṁ dhammaṁ paṭicca abyākato sahetuko ceva na ca hetu dhammo uppajjati hetupaccayā. (Saṅkhittaṁ.)	abyākatam sa hetukam ca iva na ca hetum dhammam paṭicca abyākataḥ sa hetukaḥ ca iva na ca hetu dhammo uppajjati hetu paccayā 
PA_patthana_4.2:106.1	Hetuyā tīṇi, ārammaṇe tīṇi …pe… vipāke ekaṁ …pe… avigate tīṇi. (Saṅkhittaṁ.)	hetuyā tīṇi ārammaṇe tīṇi pe vipāke ekam pe avigate tīṇi 
PA_patthana_4.2:107.1	Naadhipatiyā tīṇi …pe… navippayutte tīṇi. (Saṅkhittaṁ.)	na adhipatiyā tīṇi pe na vippayutte tīṇi 
PA_patthana_4.2:108.1	(Sahajātavārampi …pe… sampayuttavārampi paṭiccavārasadisaṁ.)	sahajāta vārampi pe sampayutta vārampi paṭicca vāra sadisa 
PA_patthana_4.2:109.0	Ārammaṇa	ārammaṇa 
PA_patthana_4.2:109.1	Kusalo sahetuko ceva na ca hetu dhammo kusalassa sahetukassa ceva na ca hetussa dhammassa ārammaṇapaccayena paccayo … tīṇi.	kusalaḥ sa hetukaḥ ca iva na ca hetu dhammaḥ kusalassa sa hetukassa ca iva na ca hetussa dhammassa ārammaṇa paccayena paccayaḥ tīṇi 
PA_patthana_4.2:110.1	Akusalo sahetuko ceva na ca hetu dhammo akusalassa sahetukassa ceva na ca hetussa dhammassa ārammaṇapaccayena paccayo … tīṇi.	akusalaḥ sa hetukaḥ ca iva na ca hetu dhammaḥ akusalassa sa hetukassa ca iva na ca hetussa dhammassa ārammaṇa paccayena paccayaḥ tīṇi 
PA_patthana_4.2:111.1	Abyākato sahetuko ceva na ca hetu dhammo abyākatassa sahetukassa ceva na ca hetussa dhammassa ārammaṇapaccayena paccayo … tīṇi. (Saṅkhittaṁ.)	abyākataḥ sa hetukaḥ ca iva na ca hetu dhammaḥ abyākatassa sa hetukassa ca iva na ca hetussa dhammassa ārammaṇa paccayena paccayaḥ tīṇi saṅkhitta 
PA_patthana_4.2:112.1_0	Ārammaṇe nava, adhipatiyā satta, anantare pañca …pe… sahajāte tīṇi …pe… upanissaye	ārammaṇe nava adhipatiyā satta anantare pañca pe sahajāte tīṇi pe upanissaye 
PA_patthana_4.2:112.1_1	nava, āsevane tīṇi, kamme pañca, vipāke ekaṁ, āhāre …pe… sampayutte tīṇi …pe… avigate tīṇi. (Saṅkhittaṁ.)	nava āsevane tīṇi kamme pañca vipāke eka āhāre pe sampayutte tīṇi pe avigate tīṇi saṅkhitta 
PA_patthana_4.2:113.1	Nahetuyā nava, naārammaṇe nava. (Saṅkhittaṁ.)	na hetuyā nava na ārammaṇe nava saṅkhitta 
PA_patthana_4.2:114.1	Ārammaṇapaccayā nahetuyā nava. (Saṅkhittaṁ.)	ārammaṇa paccayā na hetuyā nava 
PA_patthana_4.2:115.1	Nahetupaccayā ārammaṇe nava. (Saṅkhittaṁ.)	na hetu paccayā ārammaṇe nava saṅkhitta 
PA_patthana_4.2:116.1	Yathā kusalattike pañhāvāraṁ, evaṁ vitthāretabbaṁ.	yathā kusala attike pañhāvāraḥ evam 
PA_patthana_4.2:117.0.1	4.2.5. Kusalattika, Hetuhetusampayuttaduka	kusala ttika hetu hetu sampayutta duka 
PA_patthana_4.2:117.0.2	Hetu	hetu 
PA_patthana_4.2:117.1	Kusalaṁ hetuñceva hetusampayuttañca dhammaṁ paṭicca kusalo hetu ceva hetusampayutto ca dhammo uppajjati hetupaccayā.	kusalam hetuñca iva hetu sampayuttañca dhammam paṭicca kusalaḥ hetu ca iva hetu sampayuttaḥ ca dhammo uppajjati hetu paccayā 
PA_patthana_4.2:118.1	Akusalaṁ hetuñceva hetusampayuttañca dhammaṁ paṭicca akusalo hetu ceva hetusampayutto ca dhammo uppajjati hetupaccayā.	akusalam hetuñca iva hetu sampayuttañca dhammam paṭicca akusalaḥ hetu ca iva hetu sampayuttaḥ ca dhammo uppajjati hetu paccayā 
PA_patthana_4.2:119.1	Abyākataṁ hetuñceva hetusampayuttañca dhammaṁ paṭicca abyākato hetu ceva hetusampayutto ca dhammo uppajjati hetupaccayā. (Saṅkhittaṁ.)	abyākatam hetuñca iva hetu sampayuttañca dhammam paṭicca abyākataḥ hetu ca iva hetu sampayuttaḥ ca dhammo uppajjati hetu paccayā 
PA_patthana_4.2:120.1	Hetuyā tīṇi …pe… vipāke ekaṁ …pe… avigate tīṇi. (Saṅkhittaṁ.)	hetuyā tīṇi pe vipāke ekam pe avigate tīṇi 
PA_patthana_4.2:121.1	Naadhipatiyā tīṇi …pe… navippayutte tīṇi. (Saṅkhittaṁ.)	na adhipatiyā tīṇi pe na vippayutte tīṇi 
PA_patthana_4.2:122.1	Hetupaccayā naadhipatiyā tīṇi. (Saṅkhittaṁ.)	hetu paccayāḥ na adhipatiyā tīṇi 
PA_patthana_4.2:123.1	Naadhipatipaccayā hetuyā tīṇi. (Saṅkhittaṁ.)	na adhipati paccayā hetuyā tīṇi 
PA_patthana_4.2:124.1	(Sahajātavārampi …pe… sampayuttavārampi paṭiccavārasadisaṁ.)	sahajāta vārampi pe sampayutta vārampi paṭicca vāra sadisa 
PA_patthana_4.2:125.0	Hetu-ārammaṇa	hetu ārammaṇa 
PA_patthana_4.2:125.1	Kusalo hetu ceva hetusampayutto ca dhammo kusalassa hetussa ceva hetusampayuttassa ca dhammassa hetupaccayena paccayo.	kusalaḥ hetu ca iva hetu sampayuttaḥ ca dhammaḥ kusalassa hetussa ca iva hetu sampayuttassa ca dhammassa hetu paccayena paccayaḥ 
PA_patthana_4.2:126.1	Akusalo hetu ceva hetusampayutto ca dhammo akusalassa hetussa ceva hetusampayuttassa ca dhammassa hetupaccayena paccayo.	akusalaḥ hetu ca iva hetu sampayuttaḥ ca dhammaḥ akusalassa hetussa ca iva hetu sampayuttassa ca dhammassa hetu paccayena paccayaḥ 
PA_patthana_4.2:127.1	Abyākato hetu ceva hetusampayutto ca dhammo abyākatassa hetussa ceva hetusampayuttassa ca dhammassa hetupaccayena paccayo.	abyākataḥ hetu ca iva hetu sampayuttaḥ ca dhammaḥ abyākatassa hetussa ca iva hetu sampayuttassa ca dhammassa hetu paccayena paccayaḥ 
PA_patthana_4.2:128.1	Kusalo hetu ceva hetusampayutto ca dhammo kusalassa hetussa ceva hetusampayuttassa ca dhammassa ārammaṇapaccayena paccayo. (Saṅkhittaṁ.)	kusalaḥ hetu ca iva hetu sampayutto ca dhammo kusalassa hetussa ca iva hetu sampayuttassa ca dhammassa ārammaṇa paccayena paccayaḥ saṅkhitta 
PA_patthana_4.2:129.1_0	Hetuyā tīṇi, ārammaṇe nava, adhipatiyā satta, anantare pañca …pe… sahajāte aññamaññe	hetuyā tīṇi ārammaṇe nava adhipatiyā satta anantare pañca pe sahajāte aññamaññe 
PA_patthana_4.2:129.1_1	nissaye tīṇi, upanissaye nava, āsevane tīṇi, vipāke ekaṁ, indriye magge dve, sampayutte	nissaye tīṇi upanissaye nava āsevane tīṇi vipāke eka indriye magge dve sampayutte 
PA_patthana_4.2:129.1_2	tīṇi …pe… avigate tīṇi. (Saṅkhittaṁ.)	tīṇi pe avigate tīṇi 
PA_patthana_4.2:130.1	Nahetuyā nava, naārammaṇe nava. (Saṅkhittaṁ.)	na hetuyā nava na ārammaṇe nava saṅkhitta 
PA_patthana_4.2:131.1	Hetupaccayā naārammaṇe tīṇi. (Saṅkhittaṁ.)	hetu paccayāḥ na ārammaṇe tīṇi 
PA_patthana_4.2:132.1	Nahetupaccayā ārammaṇe nava. (Saṅkhittaṁ.)	na hetu paccayā ārammaṇe nava saṅkhitta 
PA_patthana_4.2:133.1	Yathā kusalattike pañhāvāraṁ, evaṁ vitthāretabbaṁ.	yathā kusala attike pañhāvāraḥ evam 
PA_patthana_4.2:134.0.1	4.2.5.2. Hetusampayuttanahetupada	     
PA_patthana_4.2:134.0.2	Hetu	hetu 
PA_patthana_4.2:134.1	Kusalaṁ hetusampayuttañceva na ca hetuṁ dhammaṁ paṭicca kusalo hetusampayutto ceva na ca hetu dhammo uppajjati hetupaccayā.	kusalam hetu sampayuttam ca iva na ca hetum dhammam paṭicca kusalaḥ hetu sampayuttaḥ ca iva na ca hetu dhammo uppajjati hetu paccayā 
PA_patthana_4.2:135.1	Akusalaṁ hetusampayuttañceva na ca hetuṁ dhammaṁ paṭicca akusalo hetusampayutto ceva na ca hetu dhammo uppajjati hetupaccayā.	akusalam hetu sampayuttam ca iva na ca hetum dhammam paṭicca akusalaḥ hetu sampayuttaḥ ca iva na ca hetu dhammo uppajjati hetu paccayā 
PA_patthana_4.2:136.1	Abyākataṁ hetusampayuttañceva na ca hetuṁ dhammaṁ paṭicca abyākato hetusampayutto ceva na ca hetu dhammo uppajjati hetupaccayā. (Saṅkhittaṁ.)	abyākatam hetu sampayuttam ca iva na ca hetum dhammam paṭicca abyākataḥ hetu sampayuttaḥ ca iva na ca hetu dhammo uppajjati hetu paccayā 
PA_patthana_4.2:137.1	Hetuyā tīṇi, ārammaṇe tīṇi …pe… vipāke ekaṁ …pe… avigate tīṇi.	hetuyā tīṇi ārammaṇe tīṇi pe vipāke ekam pe avigate tīṇi 
PA_patthana_4.2:138.1	Naadhipatiyā tīṇi …pe… navippayutte tīṇi. (Saṅkhittaṁ.)	na adhipatiyā tīṇi pe na vippayutte tīṇi 
PA_patthana_4.2:139.1	(Sahajātavārampi …pe… sampayuttavārampi paṭiccavārasadisaṁ.)	sahajāta vārampi pe sampayutta vārampi paṭicca vāra sadisa 
PA_patthana_4.2:140.0	Ārammaṇa	ārammaṇa 
PA_patthana_4.2:140.1	Kusalo hetusampayutto ceva na ca hetu dhammo kusalassa hetusampayuttassa ceva na ca hetussa dhammassa ārammaṇapaccayena paccayo … tīṇi.	kusalaḥ hetu sampayuttaḥ ca iva na ca hetu dhammo kusalassa hetu sampayuttassa ca iva na ca hetussa dhammassa ārammaṇa paccayena paccayaḥ tīṇi 
PA_patthana_4.2:141.1	Akusalo hetusampayutto ceva na ca hetu dhammo akusalassa hetusampayuttassa ceva na ca hetussa dhammassa ārammaṇapaccayena paccayo … tīṇi.	akusalaḥ hetu sampayuttaḥ ca iva na ca hetu dhammaḥ akusalassa hetu sampayuttassa ca iva na ca hetussa dhammassa ārammaṇa paccayena paccayaḥ tīṇi 
PA_patthana_4.2:142.1	Abyākato hetusampayutto ceva na ca hetu dhammo abyākatassa hetusampayuttassa ceva na ca hetussa dhammassa ārammaṇapaccayena paccayo … tīṇi. (Saṅkhittaṁ.)	abyākataḥ hetu sampayuttaḥ ca iva na ca hetu dhammo abyākatassa hetu sampayuttassa ca iva na ca hetussa dhammassa ārammaṇa paccayena paccayaḥ tīṇi saṅkhitta 
PA_patthana_4.2:143.1_0	Ārammaṇe nava, adhipatiyā satta, anantare pañca …pe… sahajāte tīṇi …pe… upanissaye	ārammaṇe nava adhipatiyā satta anantare pañca pe sahajāte tīṇi pe upanissaye 
PA_patthana_4.2:143.1_1	nava …pe… āsevane tīṇi, kamme pañca, vipāke ekaṁ, āhāre …pe… sampayutte tīṇi …pe…	nava pe āsevane tīṇi kamme pañca vipāke eka āhāre pe sampayutte tīṇi pe 
PA_patthana_4.2:143.1_2	avigate tīṇi. (Saṅkhittaṁ.)	a vigate tīṇi 
PA_patthana_4.2:144.1	Nahetuyā nava, naārammaṇe nava. (Saṅkhittaṁ.)	na hetuyā nava na ārammaṇe nava saṅkhitta 
PA_patthana_4.2:145.1	Ārammaṇapaccayā nahetuyā nava. (Saṅkhittaṁ.)	ārammaṇa paccayā na hetuyā nava 
PA_patthana_4.2:146.1	Nahetupaccayā ārammaṇe nava. (Saṅkhittaṁ.)	na hetu paccayā ārammaṇe nava saṅkhitta 
PA_patthana_4.2:147.1	Yathā kusalattike pañhāvāraṁ, evaṁ vitthāretabbaṁ.	yathā kusala attike pañhāvāraḥ evam 
PA_patthana_4.2:148.0.1	4.2.6. Kusalattika, Nahetusahetukaduka	kusala ttika na hetu sa hetuka duka 
PA_patthana_4.2:148.0.2	Hetu	hetu 
PA_patthana_4.2:148.1	Kusalaṁ nahetuṁ sahetukaṁ dhammaṁ paṭicca kusalo nahetu sahetuko dhammo uppajjati hetupaccayā.	kusalam na hetum sa hetukam dhammam paṭicca kusalaḥ na hetu sa hetukaḥ dhammaḥ uppajjati hetu paccayā 
PA_patthana_4.2:149.1	Akusalaṁ nahetuṁ sahetukaṁ dhammaṁ paṭicca akusalo nahetu sahetuko dhammo uppajjati hetupaccayā.	akusalam na hetum sa hetukam dhammam paṭicca akusalaḥ na hetu sa hetukaḥ dhammaḥ uppajjati hetu paccayā 
PA_patthana_4.2:150.1	Abyākataṁ nahetuṁ sahetukaṁ dhammaṁ paṭicca abyākato nahetu sahetuko dhammo uppajjati hetupaccayā. (Saṅkhittaṁ.)	abyākatam na hetum sa hetukam dhammam paṭicca abyākataḥ na hetu sa hetukaḥ dhammaḥ uppajjati hetu paccayā 
PA_patthana_4.2:151.1	Hetuyā tīṇi, ārammaṇe tīṇi …pe… vipāke ekaṁ …pe… avigate tīṇi. (Saṅkhittaṁ.)	hetuyā tīṇi ārammaṇe tīṇi pe vipāke ekam pe avigate tīṇi 
PA_patthana_4.2:152.1	Naadhipatiyā tīṇi …pe… navippayutte tīṇi. (Saṅkhittaṁ.)	na adhipatiyā tīṇi pe na vippayutte tīṇi 
PA_patthana_4.2:153.1	(Sahajātavārampi …pe… sampayuttavārampi paṭiccavārasadisaṁ.)	sahajāta vārampi pe sampayutta vārampi paṭicca vāra sadisa 
PA_patthana_4.2:154.0	Ārammaṇa	ārammaṇa 
PA_patthana_4.2:154.1	Kusalo nahetu sahetuko dhammo kusalassa nahetussa sahetukassa dhammassa ārammaṇapaccayena paccayo … tīṇi.	kusalaḥ na hetu sa hetukaḥ dhammaḥ kusalassa na hetussa sa hetukassa dhammassa ārammaṇa paccayena paccayaḥ tīṇi 
PA_patthana_4.2:155.1	Akusalo nahetu sahetuko dhammo akusalassa nahetussa sahetukassa dhammassa ārammaṇapaccayena paccayo … tīṇi.	akusalaḥ na hetu sa hetukaḥ dhammaḥ akusalassa na hetussa sa hetukassa dhammassa ārammaṇa paccayena paccayaḥ tīṇi 
PA_patthana_4.2:156.1	Abyākato nahetu sahetuko dhammo abyākatassa nahetussa sahetukassa dhammassa ārammaṇapaccayena paccayo … tīṇi. (Saṅkhittaṁ.)	abyākataḥ na hetu sa hetukaḥ dhammaḥ abyākatassa na hetussa sa hetukassa dhammassa ārammaṇa paccayena paccayaḥ tīṇi 
PA_patthana_4.2:157.1_0	Ārammaṇe nava, adhipatiyā satta, anantare pañca …pe… sahajāte aññamaññe nissaye tīṇi,	ārammaṇe nava adhipatiyā satta anantare pañca pe sahajāte aññamaññe nissaye tīṇi 
PA_patthana_4.2:157.1_1	upanissaye nava, āsevane tīṇi, kamme pañca, vipāke ekaṁ, āhāre …pe… sampayutte tīṇi	upanissaye nava āsevane tīṇi kamme pañca vipāke eka āhāre pe sampayutte tīṇi 
PA_patthana_4.2:157.1_2	…pe… avigate tīṇi. (Saṅkhittaṁ.)	pe a vigate tīṇi saṅkhitta 
PA_patthana_4.2:158.1	Nahetuyā nava, naārammaṇe nava. (Saṅkhittaṁ.)	na hetuyā nava na ārammaṇe nava saṅkhitta 
PA_patthana_4.2:159.1	Ārammaṇapaccayā nahetuyā nava. (Saṅkhittaṁ.)	ārammaṇa paccayā na hetuyā nava 
PA_patthana_4.2:160.1	Nahetupaccayā ārammaṇe nava. (Saṅkhittaṁ.)	na hetu paccayā ārammaṇe nava saṅkhitta 
PA_patthana_4.2:161.1	Yathā kusalattike pañhāvāraṁ, evaṁ vitthāretabbaṁ.	yathā kusala attike pañhāvāraḥ evam 
PA_patthana_4.2:162.0.1	4.2.6.2. Nahetuahetukapada	na hetu ahetuka pada 
PA_patthana_4.2:162.0.2	Hetu	hetu 
PA_patthana_4.2:162.1	Abyākataṁ nahetuṁ ahetukaṁ dhammaṁ paṭicca abyākato nahetu ahetuko dhammo uppajjati hetupaccayā. (Saṅkhittaṁ.)	abyākatam na hetum ahetukam dhammam paṭicca abyākataḥ na hetu ahetukaḥ dhammaḥ uppajjati hetu paccayā 
PA_patthana_4.2:163.1	Hetuyā ekaṁ, ārammaṇe ekaṁ …pe… avigate ekaṁ. (Saṅkhittaṁ.)	hetuyā eka ārammaṇe ekaṃ pe avigate eka saṅkhitta 
PA_patthana_4.2:164.1	Nahetuyā ekaṁ …pe… novigate ekaṁ. (Saṅkhittaṁ.)	na hetuyāḥ ekam pe na u vigate eka saṅkhitta 
PA_patthana_4.2:165.1	(Sahajātavārampi …pe… sampayuttavārampi paṭiccavārasadisaṁ.)	sahajāta vārampi pe sampayutta vārampi paṭicca vāra sadisa 
PA_patthana_4.2:166.1	Abyākato nahetu ahetuko dhammo abyākatassa nahetussa ahetukassa dhammassa ārammaṇapaccayena paccayo. (Saṅkhittaṁ.)	abyākataḥ na hetu ahetukaḥ dhammaḥ abyākatassa na hetussa ahetukassa dhammassa ārammaṇa paccayena paccayaḥ saṅkhitta 
PA_patthana_4.2:167.1	Ārammaṇe ekaṁ, adhipatiyā ekaṁ …pe… avigate ekaṁ. (Saṅkhittaṁ.)	ārammaṇe eka adhipatiyā ekaṃ pe avigate eka saṅkhitta 
PA_patthana_4.2:168.1	(Yathā kusalattike pañhāvāraṁ, evaṁ vitthāretabbaṁ.)	yathā kusala attike pañhāvāraḥ evam 
PA_patthana_4.2:169.1	Hetugocchakaṁ niṭṭhitaṁ.	hetu gocchakam niṭṭhita 
