segmentnr	original	analyzed
PA_patthana_17.22:0.1	Paṭṭhānapakaraṇa	paṭṭhāna pakaraṇa 
PA_patthana_17.22:0.2	Dhammānulomapaccanīya (3), Tikatikapaṭṭhānapāḷi (5)	dhamma anuloma paccanīya 
PA_patthana_17.22:0.3	17.22. Vipākattika, Kusalattika	vipāka attika kusala attika 
PA_patthana_17.22:1.1	Vipākadhammadhammaṁ kusalaṁ dhammaṁ paṭicca navipākadhammadhammo nakusalo dhammo uppajjati hetupaccayā. (Saṅkhittaṁ.) Hetuyā tīṇi, adhipatiyā tīṇi …pe… avigate tīṇi.	vipāka dhamma dhammam kusalam dhammam paṭicca na vipāka dhamma dhammaḥ na kusalaḥ dhammaḥ uppajjati hetu paccayā saṅkhitta hetuyā tīṇi adhipatiyā tīṇi pe avigate tīṇi 
PA_patthana_17.22:2.1	Vipākadhammadhammaṁ akusalaṁ dhammaṁ paṭicca navipākadhammadhammo naakusalo dhammo uppajjati hetupaccayā. (Saṅkhittaṁ.) Hetuyā tīṇi, adhipatiyā tīṇi …pe… avigate tīṇi.	vipāka dhamma dhammam akusalam dhammam paṭicca na vipāka dhamma dhammaḥ na akusalaḥ dhammaḥ uppajjati hetu paccayā saṅkhitta hetuyā tīṇi adhipatiyā tīṇi pe avigate tīṇi 
PA_patthana_17.22:3.1	Nevavipākanavipākadhammadhammaṁ abyākataṁ dhammaṁ paccayā nanevavipākanavipākadhammadhammo naabyākato dhammo uppajjati hetupaccayā. (Saṅkhittaṁ.) Hetuyā tīṇi …pe… avigate tīṇi.	neva vipāka na vipāka dhamma dhammam abyākatam dhammam paccayā na neva vipāka na vipāka dhamma dhammaḥ na abyākataḥ dhammaḥ uppajjati hetu paccayā saṅkhitta hetuyā tīṇi pe avigate tīṇi 
