segmentnr	original	analyzed
PA_patthana_17.24:0.1	Paṭṭhānapakaraṇa	paṭṭhāna pakaraṇa 
PA_patthana_17.24:0.2	Dhammānulomapaccanīya (3), Tikatikapaṭṭhānapāḷi (5)	dhamma anuloma paccanīya 
PA_patthana_17.24:0.3	17.24. Saṅkiliṭṭhattika, Kusalattika	saṅkiliṭṭhattika kusalattika 
PA_patthana_17.24:1.1	Asaṅkiliṭṭhasaṅkilesikaṁ kusalaṁ dhammaṁ paṭicca nasaṅkiliṭṭhasaṅkilesiko nakusalo dhammo uppajjati hetupaccayā … tīṇi.	a saṅkiliṭṭha saṅkilesikam kusalam dhammam paṭicca na saṅkiliṭṭha saṅkilesikaḥ na kusalaḥ dhammaḥ uppajjati hetu paccayā tīṇi 
PA_patthana_17.24:2.1_0	Asaṅkiliṭṭhaasaṅkilesikaṁ kusalaṁ dhammaṁ paṭicca naasaṅkiliṭṭhaasaṅkilesiko nakusalo	asaṅkiliṭṭha asaṅkilesikam kusalam dhammam paṭicca na asaṅkiliṭṭha asaṅkilesikaḥ na kusalaḥ 
PA_patthana_17.24:2.1_1	dhammo uppajjati hetupaccayā … tīṇi. (Saṅkhittaṁ.) Hetuyā cha, adhipatiyā cha …pe… avigate cha.	dhammaḥ uppajjati hetu paccayā tīṇi saṅkhitta hetuyā cha adhipatiyā cha pe avigate cha 
PA_patthana_17.24:3.1	Saṅkiliṭṭhasaṅkilesikaṁ akusalaṁ dhammaṁ paṭicca nasaṅkiliṭṭhasaṅkilesiko naakusalo dhammo uppajjati hetupaccayā … tīṇi. (Saṅkhittaṁ.) Hetuyā adhipatiyā tīṇi …pe… avigate tīṇi.	saṅkiliṭṭha saṅkilesikam akusalam dhammam paṭicca na saṅkiliṭṭha saṅkilesikaḥ na akusalaḥ dhammaḥ uppajjati hetu paccayā tīṇi saṅkhitta hetuyā adhipatiyā tīṇi pe avigate tīṇi 
PA_patthana_17.24:4.1	Asaṅkiliṭṭhasaṅkilesikaṁ abyākataṁ dhammaṁ paccayā naasaṅkiliṭṭhasaṅkilesiko naabyākato dhammo uppajjati hetupaccayā. (Saṅkhittaṁ.) Hetuyā cha …pe… avigate cha.	asaṅkiliṭṭha saṅkilesikam abyākatam dhammam paccayā na asaṅkiliṭṭha saṅkilesikaḥ na abyākataḥ dhammaḥ uppajjati hetu paccayā saṅkhitta hetuyā cha pe avigate cha 
