segmentnr	original	analyzed
PA_patthana_14.14:0.1	Paṭṭhānapakaraṇa	paṭṭhāna pakaraṇa 
PA_patthana_14.14:0.2	Dhammānulomapaccanīya (3), Dukapaṭṭhānapāḷi (2)	dhamma anuloma paccanīya 
PA_patthana_14.14:0.3	14.14. Sāsavaduka	sāsavaduka 
PA_patthana_14.14:1.1	Sāsavaṁ dhammaṁ paṭicca naanāsavo dhammo uppajjati hetupaccayā.	sa āsavam dhammam paṭicca na anāsavaḥ dhammo uppajjati hetu paccayā 
PA_patthana_14.14:2.1_0	Anāsavaṁ dhammaṁ paṭicca naanāsavo dhammo uppajjati hetupaccayā. Anāsavaṁ dhammaṁ	anāsavam dhammam paṭicca na anāsavaḥ dhammaḥ uppajjati hetu paccayā anāsavam dhamma 
PA_patthana_14.14:2.1_1	paṭicca nasāsavo dhammo uppajjati hetupaccayā. Anāsavaṁ dhammaṁ paṭicca nasāsavo	paṭicca na sa āsavaḥ dhammaḥ uppajjati hetu paccayā anāsavam dhammam paṭicca na sa āsavaḥ 
PA_patthana_14.14:2.1_2	ca naanāsavo ca dhammā uppajjanti hetupaccayā.	ca na anāsavaḥ ca dhammā uppajjanti hetu paccayā 
PA_patthana_14.14:3.1	Sāsavañca anāsavañca dhammaṁ paṭicca naanāsavo dhammo uppajjati hetupaccayā. (Saṅkhittaṁ.)	sa āsavam ca anāsavam ca dhammam paṭicca na anāsavaḥ dhammaḥ uppajjati hetu paccayā 
PA_patthana_14.14:4.1	Hetuyā pañca, ārammaṇe dve …pe… avigate pañca. (Sabbattha vitthāro.)	hetuyā pañca ārammaṇe dve pe avigate pañca sabbattha vitthāro 
