segmentnr	original	analyzed
PA_patthana_1.6:36.1_0	Saṅkiliṭṭhasaṅkilesiko dhammo saṅkiliṭṭhasaṅkilesikassa ca asaṅkiliṭṭhasaṅkilesikassa	saṅkiliṭṭha saṅkilesikaḥ dhammaḥ saṅkiliṭṭha saṅkilesikassa ca a saṅkiliṭṭha saṅkilesikassa 
PA_patthana_1.6:36.1_1	ca dhammassa adhipatipaccayena paccayo. Sahajātādhipati—saṅkiliṭṭhasaṅkilesikādhipati	ca dhammassa adhipati paccayena paccayaḥ sahajāta adhipati saṅkiliṭṭha saṅkilesika adhipati 
PA_patthana_1.6:36.1_2	sampayuttakānaṁ khandhānaṁ cittasamuṭṭhānānañca rūpānaṁ adhipatipaccayena paccayo.	sampayuttakānam khandhānam citta samuṭṭhānānañca rūpānam adhipati paccayena paccayaḥ 
PA_patthana_1.6:37.1_0	Asaṅkiliṭṭhasaṅkilesiko dhammo asaṅkiliṭṭhasaṅkilesikassa dhammassa adhipatipaccayena	asaṅkiliṭṭha saṅkilesikaḥ dhammaḥ asaṅkiliṭṭha saṅkilesikassa dhammassa adhipati paccayena 
PA_patthana_1.6:37.1_1	paccayo—ārammaṇādhipati, sahajātādhipati. Ārammaṇādhipati—dānaṁ datvā, sīlaṁ samādiyitvā,	paccayaḥ ārammaṇa adhipati sahajāta adhipati ārammaṇa adhipati dānam da tvā sīlam samādiyitvā 
PA_patthana_1.6:37.1_2	uposathakammaṁ katvā taṁ garuṁ katvā paccavekkhati, pubbe suciṇṇāni garuṁ katvā paccavekkhati,	uposatha kammam katvā tam garum katvā paccavekkhati pubbe su ciṇṇāni garum katvā paccavekkhati 
PA_patthana_1.6:37.1_3	jhānā vuṭṭhahitvā jhānaṁ garuṁ katvā paccavekkhati, sekkhā gotrabhuṁ garuṁ katvā	jhānā vuṭṭhahitvā jhānam garum katvā paccavekkhati sekkhā gotrabhum garum katvā 
PA_patthana_1.6:37.1_4	paccavekkhanti, vodānaṁ garuṁ katvā paccavekkhanti. Sahajātādhipati—asaṅkiliṭṭhasaṅkilesikādhipati	paccavekkhanti vodānam garum katvā paccavekkhanti sahajāta adhipati a saṅkiliṭṭha saṅkilesika adhipati 
PA_patthana_1.6:37.1_5	sampayuttakānaṁ khandhānaṁ cittasamuṭṭhānānañca rūpānaṁ adhipatipaccayena paccayo.	sampayuttakānam khandhānam citta samuṭṭhānānañca rūpānam adhipati paccayena paccayaḥ 
PA_patthana_1.6:38.1_0	Asaṅkiliṭṭhasaṅkilesiko dhammo saṅkiliṭṭhasaṅkilesikassa dhammassa adhipatipaccayena	asaṅkiliṭṭha saṅkilesikaḥ dhammaḥ saṅkiliṭṭha saṅkilesikassa dhammassa adhipati paccayena 
PA_patthana_1.6:38.1_1	paccayo. Ārammaṇādhipati—dānaṁ datvā, sīlaṁ samādiyitvā, uposathakammaṁ katvā taṁ	paccayaḥ ārammaṇa adhipati dānam da tvā sīlam samādiyitvā uposatha kammam katvā 
PA_patthana_1.6:38.1_2	garuṁ katvā assādeti abhinandati, taṁ garuṁ katvā rāgo uppajjati, diṭṭhi uppajjati,	garum katvā assādeti abhinandati tam garum katvā rāgaḥ uppajjati diṭṭhi uppajjati 
PA_patthana_1.6:38.1_3	pubbe suciṇṇāni garuṁ katvā assādeti abhinandati …pe… jhānā vuṭṭhahitvā jhānaṁ garuṁ	pubbe su ciṇṇāni garum katvā assādeti abhinandati pe jhānā vuṭṭhahitvā jhānam garu 
PA_patthana_1.6:38.1_4	katvā assādeti abhinandati …pe… cakkhuṁ garuṁ katvā assādeti abhinandati …pe… phoṭṭhabbe	katvā assādeti abhinandati pe cakkhum garum katvā assādeti abhinandati pe phoṭṭhabbe 
PA_patthana_1.6:38.1_5	…pe… vatthuṁ asaṅkiliṭṭhasaṅkilesike khandhe garuṁ katvā assādeti abhinandati, taṁ	vatthum a saṅkiliṭṭha saṅkilesike khandhe garum katvā assādeti abhinandati 
PA_patthana_1.6:38.1_6	garuṁ katvā rāgo uppajjati, diṭṭhi uppajjati.	garum katvā rāgaḥ uppajjati diṭṭhi uppajjati 
PA_patthana_1.6:39.1_0	Asaṅkiliṭṭhaasaṅkilesiko dhammo asaṅkiliṭṭhaasaṅkilesikassa dhammassa adhipatipaccayena	asaṅkiliṭṭha asaṅkilesikaḥ dhammaḥ asaṅkiliṭṭha asaṅkilesikassa dhammassa adhipati paccayena 
PA_patthana_1.6:39.1_1	paccayo—ārammaṇādhipati, sahajātādhipati. Ārammaṇādhipati—nibbānaṁ maggassa, phalassa	paccayaḥ ārammaṇa adhipati sahajāta adhipati ārammaṇa adhipati nibbānam maggassa phalassa 
PA_patthana_1.6:39.1_2	adhipatipaccayena paccayo. Sahajātādhipati—asaṅkiliṭṭhaasaṅkilesikādhipati sampayuttakānaṁ	adhipati paccayena paccayaḥ sahajāta adhipati asaṅkiliṭṭha asaṅkilesika adhipati sampayuttakāna 
PA_patthana_1.6:39.1_3	khandhānaṁ adhipatipaccayena paccayo.	khandhānam adhipati paccayena paccayaḥ 
PA_patthana_1.6:40.1_0	Asaṅkiliṭṭhaasaṅkilesiko dhammo asaṅkiliṭṭhasaṅkilesikassa dhammassa adhipatipaccayena	asaṅkiliṭṭha asaṅkilesikaḥ dhammaḥ asaṅkiliṭṭha saṅkilesikassa dhammassa adhipati paccayena 
PA_patthana_1.6:40.1_1	paccayo—ārammaṇādhipati, sahajātādhipati. Ārammaṇādhipati—ariyā maggā vuṭṭhahitvā	paccayaḥ ārammaṇa adhipati sahajāta adhipati ārammaṇa adhipati ariyāḥ maggāḥ vuṭṭhahitvā 
PA_patthana_1.6:40.1_2	maggaṁ garuṁ katvā paccavekkhanti, phalaṁ garuṁ katvā paccavekkhanti, nibbānaṁ garuṁ	maggam garum katvā paccavekkhanti phalam garum katvā paccavekkhanti nibbānam garu 
PA_patthana_1.6:40.1_3	katvā paccavekkhanti, nibbānaṁ gotrabhussa, vodānassa adhipatipaccayena paccayo.	katvā paccavekkhanti nibbānam gotrabhussa vodānassa adhipati paccayena paccayaḥ 
PA_patthana_1.6:40.1_4	Sahajātādhipati—asaṅkiliṭṭhaasaṅkilesikādhipati cittasamuṭṭhānānaṁ rūpānaṁ adhipatipaccayena paccayo.	sahajāta adhipati asaṅkiliṭṭha asaṅkilesika adhipati citta samuṭṭhānānam rūpānam adhipati paccayena paccayaḥ 
PA_patthana_1.6:41.1_0	Asaṅkiliṭṭhaasaṅkilesiko dhammo asaṅkiliṭṭhasaṅkilesikassa ca asaṅkiliṭṭhaasaṅkilesikassa	asaṅkiliṭṭha asaṅkilesikaḥ dhammaḥ asaṅkiliṭṭha saṅkilesikassa ca asaṅkiliṭṭha asaṅkilesikassa 
PA_patthana_1.6:41.1_1	ca dhammassa adhipatipaccayena paccayo. Sahajātādhipati—asaṅkiliṭṭhaasaṅkilesikādhipati	ca dhammassa adhipati paccayena paccayaḥ sahajāta adhipati asaṅkiliṭṭha asaṅkilesika adhipati 
PA_patthana_1.6:41.1_2	sampayuttakānaṁ khandhānaṁ cittasamuṭṭhānānañca rūpānaṁ adhipatipaccayena paccayo.	sampayuttakānam khandhānam citta samuṭṭhānānañca rūpānam adhipati paccayena paccayaḥ 
PA_patthana_1.6:42.0	Anantara	anantara 
PA_patthana_1.6:42.1_0	Saṅkiliṭṭhasaṅkilesiko dhammo saṅkiliṭṭhasaṅkilesikassa dhammassa anantarapaccayena	saṅkiliṭṭha saṅkilesikaḥ dhammaḥ saṅkiliṭṭha saṅkilesikassa dhammassa anantara paccayena 
PA_patthana_1.6:42.1_1	paccayo—purimā purimā saṅkiliṭṭhasaṅkilesikā khandhā pacchimānaṁ pacchimānaṁ saṅkiliṭṭhasaṅkilesikānaṁ	paccayo purimā purimā saṅkiliṭṭha saṅkilesikā khandhā pacchimānam pacchimānam 
PA_patthana_1.6:42.1_2	khandhānaṁ anantarapaccayena paccayo.	khandhānam anantara paccayena paccayaḥ 
PA_patthana_1.6:43.1	Saṅkiliṭṭhasaṅkilesiko dhammo asaṅkiliṭṭhasaṅkilesikassa dhammassa anantarapaccayena paccayo—saṅkiliṭṭhasaṅkilesikā khandhā vuṭṭhānassa anantarapaccayena paccayo.	saṅkiliṭṭha saṅkilesikaḥ dhammaḥ a saṅkiliṭṭha saṅkilesikassa dhammassa anantara paccayena paccayo saṅkiliṭṭha saṅkilesikāḥ khandhāḥ vuṭṭhānassa anantara paccayena paccayo 
PA_patthana_1.6:44.1_0	Asaṅkiliṭṭhasaṅkilesiko dhammo asaṅkiliṭṭhasaṅkilesikassa dhammassa anantarapaccayena	asaṅkiliṭṭha saṅkilesikaḥ dhammaḥ asaṅkiliṭṭha saṅkilesikassa dhammassa anantara paccayena 
PA_patthana_1.6:44.1_1	paccayo—purimā purimā asaṅkiliṭṭhasaṅkilesikā khandhā pacchimānaṁ pacchimānaṁ asaṅkiliṭṭhasaṅkilesikānaṁ	paccayopurimā purimāḥ asaṅkiliṭṭha saṅkilesikāḥ khandhāḥ pacchimānam pacchimānam asaṅkiliṭṭha saṅkilesikānaṃ 
PA_patthana_1.6:44.1_2	khandhānaṁ anantarapaccayena paccayo. Anulomaṁ gotrabhussa … anulomaṁ vodānassa …	khandhānam anantara paccayena paccayaḥ anulomam gotrabhussa anulomam vodānassa 
PA_patthana_1.6:44.1_3	āvajjanā asaṅkiliṭṭhasaṅkilesikānaṁ khandhānaṁ anantarapaccayena paccayo.	āvajjanā asaṅkiliṭṭha saṅkilesikānaṃ khandhānaṃ anantara paccayena paccayaḥ 
PA_patthana_1.6:45.1	Asaṅkiliṭṭhasaṅkilesiko dhammo saṅkiliṭṭhasaṅkilesikassa dhammassa anantarapaccayena paccayo—āvajjanā saṅkiliṭṭhasaṅkilesikānaṁ khandhānaṁ anantarapaccayena paccayo.	asaṅkiliṭṭha saṅkilesikaḥ dhammaḥ saṅkiliṭṭha saṅkilesikassa dhammassa anantara paccayena paccayaḥ āvajjanā saṅkiliṭṭha saṅkilesikānaṃ khandhānaṃ anantara paccayena paccayaḥ 
PA_patthana_1.6:46.1_0	Asaṅkiliṭṭhasaṅkilesiko dhammo asaṅkiliṭṭhaasaṅkilesikassa dhammassa anantarapaccayena	asaṅkiliṭṭha saṅkilesikaḥ dhammaḥ asaṅkiliṭṭha asaṅkilesikassa dhammassa anantara paccayena 
PA_patthana_1.6:46.1_1	paccayo—gotrabhu maggassa … vodānaṁ maggassa … anulomaṁ phalasamāpattiyā … nirodhā	paccayo gotrabhu maggassa vodānam maggassa anulomam phala samāpattiyāḥ nirodhā 
PA_patthana_1.6:46.1_2	vuṭṭhahantassa nevasaññānāsaññāyatanaṁ phalasamāpattiyā anantarapaccayena paccayo.	vuṭṭhahantassa nevasaññānāsaññāyatanam phala samāpattiyāḥ anantara paccayena paccayo 
PA_patthana_1.6:47.1_0	Asaṅkiliṭṭhaasaṅkilesiko dhammo asaṅkiliṭṭhaasaṅkilesikassa dhammassa anantarapaccayena	asaṅkiliṭṭha asaṅkilesikaḥ dhammaḥ asaṅkiliṭṭha asaṅkilesikassa dhammassa anantara paccayena 
PA_patthana_1.6:47.1_1	paccayo—purimā purimā asaṅkiliṭṭhaasaṅkilesikā khandhā pacchimānaṁ pacchimānaṁ asaṅkiliṭṭhaasaṅkilesikānaṁ	paccayopurimā purimāḥ asaṅkiliṭṭha asaṅkilesikāḥ khandhāḥ pacchimānam pacchimānam asaṅkiliṭṭha asaṅkilesikānaṃ 
PA_patthana_1.6:47.1_2	khandhānaṁ anantarapaccayena paccayo. Maggo phalassa … phalaṁ phalassa anantarapaccayena paccayo.	khandhānam anantara paccayena paccayaḥ maggaḥ phalassa phalam phalassa anantara paccayena paccayaḥ 
PA_patthana_1.6:48.1	Asaṅkiliṭṭhaasaṅkilesiko dhammo asaṅkiliṭṭhasaṅkilesikassa dhammassa anantarapaccayena paccayo—phalaṁ vuṭṭhānassa anantarapaccayena paccayo.	asaṅkiliṭṭha asaṅkilesikaḥ dhammaḥ asaṅkiliṭṭha saṅkilesikassa dhammassa anantara paccayena paccayo phalam vuṭṭhānassa anantara paccayena paccayo 
PA_patthana_1.6:49.0	Samanantarādi	samanantara ādi 
PA_patthana_1.6:49.1_0	Saṅkiliṭṭhasaṅkilesiko dhammo saṅkiliṭṭhasaṅkilesikassa dhammassa samanantarapaccayena	saṅkiliṭṭha saṅkilesikaḥ dhammaḥ saṅkiliṭṭha saṅkilesikassa dhammassa samanantara paccayena 
PA_patthana_1.6:49.1_1	paccayo …pe… sahajātapaccayena paccayo … aññamaññapaccayena paccayo … nissayapaccayena	paccayaḥ pe sahajāta paccayena paccayaḥ aññamañña paccayena paccayaḥ nissaya paccayena 
PA_patthana_1.6:49.1_2	paccayo … upanissayapaccayena paccayo—ārammaṇūpanissayo, anantarūpanissayo, pakatūpanissayo	paccayo upanissaya paccayena paccayo ārammaṇa upanissayaḥ anantara upanissayaḥ pakata upanissayaḥ 
PA_patthana_1.6:49.1_3	…pe…. Pakatūpanissayo—rāgaṁ upanissāya pāṇaṁ hanati …pe… saṅghaṁ bhindati …pe… dosaṁ	pe pakata upanissaya rāgam upanissāya pāṇam hanati pe saṅgham bhindati pe dosa 
PA_patthana_1.6:49.1_4	upanissāya pāṇaṁ hanati …pe… saṅghaṁ bhindati. Rāgo …pe… patthanā rāgassa …pe… patthanāya	upanissāya pāṇam hanati pe saṅgham bhindati rāgaḥ pe patthanā rāgassa pe patthanāya 
PA_patthana_1.6:49.1_5	upanissayapaccayena paccayo. Pāṇātipāto pāṇātipātassa upanissayapaccayena paccayo	upanissaya paccayena paccayaḥ pāṇātipātaḥ pāṇātipātassa upanissaya paccayena paccayaḥ 
PA_patthana_1.6:49.1_6	…pe… niyatamicchādiṭṭhi niyatamicchādiṭṭhiyā upanissayapaccayena paccayo …pe….	pe niyatam icchādiṭṭhi niyatam icchādiṭṭhiyāḥ upanissaya paccayena paccayaḥ pe 
PA_patthana_1.6:50.1_0	Saṅkiliṭṭhasaṅkilesiko dhammo asaṅkiliṭṭhasaṅkilesikassa dhammassa upanissayapaccayena	saṅkiliṭṭha saṅkilesikaḥ dhammaḥ a saṅkiliṭṭha saṅkilesikassa dhammassa upanissaya paccayena 
PA_patthana_1.6:50.1_1	paccayo—anantarūpanissayo, pakatūpanissayo …pe…. Pakatūpanissayo—rāgaṁ upanissāya	paccayaḥ anantara upanissayaḥ pakata upanissayaḥ pe pakata upanissayaḥ rāgam upanissāya 
PA_patthana_1.6:50.1_2	dānaṁ deti, sīlaṁ samādiyati, uposathakammaṁ karoti, jhānaṁ … vipassanaṁ … abhiññaṁ	dānam deti sīlam samādiyati uposatha kammam karoti jhānam vipassanam 
PA_patthana_1.6:50.1_3	uppādeti, samāpattiṁ uppādeti …pe… patthanaṁ upanissāya dānaṁ deti …pe… samāpattiṁ	uppādeti samāpattim uppādeti pe patthanam upanissāya dānam deti pe samāpatti 
PA_patthana_1.6:50.1_4	uppādeti. Rāgo …pe… patthanā. Saddhāya …pe… kāyikassa sukhassa, kāyikassa dukkhassa	uppādeti rāgaḥ pe patthanā saddhāya pe kāyikassa sukhassa kāyikassa dukkhassa 
PA_patthana_1.6:50.1_5	upanissayapaccayena paccayo. Pāṇaṁ hantvā tassa paṭighātatthāya dānaṁ deti, sīlaṁ	upanissaya paccayena paccayaḥ pāṇam hantvā tassa paṭighāta atthāya dānam deti sīla 
PA_patthana_1.6:50.1_6	samādiyati, uposathakammaṁ karoti, jhānaṁ uppādeti, vipassanaṁ uppādeti, abhiññaṁ	samādiyati uposatha kammam karoti jhānam uppādeti vipassanam uppādeti abhiñña 
PA_patthana_1.6:50.1_7	uppādeti, samāpattiṁ uppādeti …pe… saṅghaṁ bhinditvā tassa paṭighātatthāya dānaṁ	uppādeti samāpattim uppādeti pe saṅgham bhinditvā tassa paṭighāta atthāya dāna 
PA_patthana_1.6:50.1_8	deti, sīlaṁ samādiyati, uposathakammaṁ karoti. Akusalaṁ kammaṁ vipākassa upanissayapaccayena paccayo.	deti sīlam samādiyati uposatha kammam karoti akusalam kammam vipākassa upanissaya paccayena paccayaḥ 
PA_patthana_1.6:51.1_0	Saṅkiliṭṭhasaṅkilesiko dhammo asaṅkiliṭṭhaasaṅkilesikassa dhammassa upanissayapaccayena	saṅkiliṭṭha saṅkilesikaḥ dhammaḥ asaṅkiliṭṭha asaṅkilesikassa dhammassa upanissaya paccayena 
PA_patthana_1.6:51.1_1	paccayo. Pakatūpanissayo—rāgaṁ upanissāya maggaṁ uppādeti, phalasamāpattiṁ samāpajjati.	paccayaḥ pakata upanissayaḥ rāgam upanissāya maggam uppādeti phala samāpattim samāpajjati 
PA_patthana_1.6:51.1_2	Dosaṁ …pe… patthanaṁ upanissāya maggaṁ uppādeti, phalasamāpattiṁ samāpajjati. Rāgo	dosam pe patthanam upanissāya maggam uppādeti phala samāpattim samāpajjati rāgaḥ 
PA_patthana_1.6:51.1_3	…pe… patthanā maggassa … phalasamāpattiyā upanissayapaccayena paccayo.	pe patthanā maggassa phala samāpattiyāḥ upanissaya paccayena paccayo 
PA_patthana_1.6:52.1_0	Asaṅkiliṭṭhasaṅkilesiko dhammo asaṅkiliṭṭhasaṅkilesikassa dhammassa upanissayapaccayena	asaṅkiliṭṭha saṅkilesikaḥ dhammaḥ asaṅkiliṭṭha saṅkilesikassa dhammassa upanissaya paccayena 
PA_patthana_1.6:52.1_1	paccayo—ārammaṇūpanissayo, anantarūpanissayo, pakatūpanissayo …pe…. Pakatūpanissayo—saddhaṁ	paccayaḥ ārammaṇa upanissayaḥ anantara upanissayaḥ pakata upanissayaḥ 
PA_patthana_1.6:52.1_2	upanissāya dānaṁ deti …pe… samāpattiṁ uppādeti. Sīlaṁ … sutaṁ … cāgaṁ … paññaṁ …	upanissāya dānam deti pe samāpattim uppādeti sīlam sutam cāgam paññam 
PA_patthana_1.6:52.1_3	kāyikaṁ sukhaṁ … kāyikaṁ dukkhaṁ … utuṁ … bhojanaṁ … senāsanaṁ upanissāya dānaṁ deti	kāyikam sukham kāyikam dukkham utum bhojanam senāsanam upanissāya dānam deti 
PA_patthana_1.6:52.1_4	…pe… samāpattiṁ uppādeti. Saddhā …pe… senāsanaṁ saddhāya …pe… kāyikassa sukhassa,	pe samāpattim uppādeti saddhā pe senāsanam saddhāya pe kāyikassa sukhassa 
PA_patthana_1.6:52.1_5	kāyikassa dukkhassa upanissayapaccayena paccayo. Kusalaṁ kammaṁ vipākassa upanissayapaccayena	kāyikassa dukkhassa upanissaya paccayena paccayaḥ kusalam kammam vipākassa upanissaya paccayena 
PA_patthana_1.6:52.1_6	paccayo. Paṭhamassa jhānassa parikammaṁ paṭhamassa jhānassa …pe… ākiñcaññāyatanaṁ	paccayaḥ paṭhamassa jhānassa parikammam paṭhamassa jhānassa pe ākiñcaññāyatana 
PA_patthana_1.6:52.1_7	nevasaññānāsaññāyatanassa …pe….	nevasaññā nāsañña āyatanassa pe 
PA_patthana_1.6:53.1_0	Asaṅkiliṭṭhasaṅkilesiko dhammo saṅkiliṭṭhasaṅkilesikassa dhammassa upanissayapaccayena	asaṅkiliṭṭha saṅkilesikaḥ dhammaḥ saṅkiliṭṭha saṅkilesikassa dhammassa upanissaya paccayena 
PA_patthana_1.6:53.1_1	paccayo—ārammaṇūpanissayo, anantarūpanissayo, pakatūpanissayo …pe…. Pakatūpanissayo—saddhaṁ	paccayaḥ ārammaṇa upanissayaḥ anantara upanissayaḥ pakata upanissayaḥ 
PA_patthana_1.6:53.1_2	upanissāya mānaṁ jappeti, diṭṭhiṁ gaṇhāti; sīlaṁ …pe… senāsanaṁ upanissāya pāṇaṁ	upanissāya mānam jappeti diṭṭhim gaṇhāti sīlam pe senāsanam upanissāya pāṇa 
PA_patthana_1.6:53.1_3	hanati …pe… saṅghaṁ bhindati, saddhā …pe… senāsanaṁ rāgassa …pe… patthanāya upanissayapaccayena paccayo.	hanati pe saṅgham bhindati saddhā pe senāsanam rāgassa pe patthanāya upanissaya paccayena paccayaḥ 
PA_patthana_1.6:54.1_0	Asaṅkiliṭṭhasaṅkilesiko dhammo asaṅkiliṭṭhaasaṅkilesikassa dhammassa upanissayapaccayena	asaṅkiliṭṭha saṅkilesikaḥ dhammaḥ asaṅkiliṭṭha asaṅkilesikassa dhammassa upanissaya paccayena 
PA_patthana_1.6:54.1_1	paccayo—anantarūpanissayo, pakatūpanissayo …pe…. Pakatūpanissayo—paṭhamassa maggassa	paccayaḥ anantara upanissayaḥ pakata upanissayaḥ pe pakata upanissayaḥ paṭhamassa maggassa 
PA_patthana_1.6:54.1_2	parikammaṁ paṭhamassa maggassa …pe… dutiyassa maggassa …pe… tatiyassa maggassa …pe…	parikammam paṭhamassa maggassa pe dutiyassa maggassa pe tatiyassa maggassa pe 
PA_patthana_1.6:54.1_3	catutthassa maggassa upanissayapaccayena paccayo.	catutthassa maggassa upanissaya paccayena paccayaḥ 
PA_patthana_1.6:55.1_0	Asaṅkiliṭṭhaasaṅkilesiko dhammo asaṅkiliṭṭhaasaṅkilesikassa dhammassa upanissayapaccayena	asaṅkiliṭṭha asaṅkilesikaḥ dhammaḥ asaṅkiliṭṭha asaṅkilesikassa dhammassa upanissaya paccayena 
PA_patthana_1.6:55.1_1	paccayo—ārammaṇūpanissayo, anantarūpanissayo, pakatūpanissayo …pe…. Pakatūpanissayo—paṭhamo	paccayaḥ ārammaṇa upanissayaḥ anantara upanissayaḥ pakata upanissayaḥ pe pakata upanissayo paṭhamaḥ 
PA_patthana_1.6:55.1_2	maggo dutiyassa maggassa …pe… dutiyo maggo tatiyassa maggassa …pe… tatiyo maggo catutthassa	maggo dutiyassa maggassa pe dutiyaḥ maggo tatiyassa maggassa pe tatiyaḥ maggo catutthassa 
PA_patthana_1.6:55.1_3	maggassa …pe… maggo phalasamāpattiyā upanissayapaccayena paccayo.	maggassa pe maggaḥ phala samāpattiyāḥ upanissaya paccayena paccayo 
PA_patthana_1.6:56.1_0	Asaṅkiliṭṭhaasaṅkilesiko dhammo asaṅkiliṭṭhasaṅkilesikassa dhammassa upanissayapaccayena	asaṅkiliṭṭha asaṅkilesikaḥ dhammaḥ asaṅkiliṭṭha saṅkilesikassa dhammassa upanissaya paccayena 
PA_patthana_1.6:56.1_1	paccayo—ārammaṇūpanissayo, anantarūpanissayo, pakatūpanissayo …pe…. Pakatūpanissayo—ariyā	paccayaḥ ārammaṇa upanissayaḥ anantara upanissayaḥ pakata upanissayaḥ pe pakata upanissayaḥ ariyā 
PA_patthana_1.6:56.1_2	maggaṁ upanissāya anuppannaṁ samāpattiṁ uppādenti, uppannaṁ samāpattiṁ samāpajjanti,	maggam upanissāya anuppannam samāpattim uppādenti uppannam samāpattim samāpajjanti 
PA_patthana_1.6:56.1_3	saṅkhāre aniccato dukkhato anattato vipassanti. Maggo ariyānaṁ atthappaṭisambhidāya	saṅkhāre aniccataḥ dukkhataḥ anattataḥ vipassanti maggaḥ ariyānam attha ppaṭisambhidāya 
PA_patthana_1.6:56.1_4	…pe… ṭhānāṭṭhānakosallassa upanissayapaccayena paccayo. Phalasamāpatti kāyikassa	pe ṭhānāṭṭhānakosallassa upanissaya paccayena paccayaḥ phala samāpatti kāyikassa 
PA_patthana_1.6:56.1_5	sukhassa upanissayapaccayena paccayo.	sukhassa upanissaya paccayena paccayaḥ 
PA_patthana_1.6:57.0	Purejāta	purā jāta 
PA_patthana_1.6:57.1_0	Asaṅkiliṭṭhasaṅkilesiko dhammo asaṅkiliṭṭhasaṅkilesikassa dhammassa purejātapaccayena	asaṅkiliṭṭha saṅkilesikaḥ dhammaḥ asaṅkiliṭṭha saṅkilesikassa dhammassa purejāta paccayena 
PA_patthana_1.6:57.1_1	paccayo—ārammaṇapurejātaṁ, vatthupurejātaṁ. Ārammaṇapurejātaṁ—cakkhuṁ aniccato dukkhato	paccayo ārammaṇa purejāta vatthu purejāta ārammaṇa purejāta cakkhuṃ aniccataḥ dukkhataḥ 
PA_patthana_1.6:57.1_2	anattato vipassati; sotaṁ … ghānaṁ … jivhaṁ … kāyaṁ … rūpe … sadde … gandhe … rase	anattataḥ vipassati sotam ghānam jivham kāyam rūpe sadde gandhe rase 
PA_patthana_1.6:57.1_3	… phoṭṭhabbe … vatthuṁ aniccato dukkhato anattato vipassati, dibbena cakkhunā rūpaṁ	phoṭṭhabbe vatthum aniccataḥ dukkhataḥ anattataḥ vipassati dibbena cakkhunā rūpa 
PA_patthana_1.6:57.1_4	passati, dibbāya sotadhātuyā saddaṁ suṇāti. Rūpāyatanaṁ cakkhuviññāṇassa …pe… phoṭṭhabbāyatanaṁ	passati dibbāya sotadhātuyā saddam suṇāti rūpa āyatanam cakkhu viññāṇassa pe phoṭṭhabba āyatana 
PA_patthana_1.6:57.1_5	kāyaviññāṇassa purejātapaccayena paccayo. Vatthupurejātaṁ—cakkhāyatanaṁ cakkhuviññāṇassa	kāya viññāṇassa purejāta paccayena paccayaḥ vatthu purejāta cakkhu āyatanam cakkhu viññāṇassa 
PA_patthana_1.6:57.1_6	…pe… kāyāyatanaṁ kāyaviññāṇassa purejātapaccayena paccayo. Vatthu asaṅkiliṭṭhasaṅkilesikānaṁ	pe kāya āyatanam kāya viññāṇassa purejāta paccayena paccayaḥ vatthu 
PA_patthana_1.6:57.1_7	khandhānaṁ purejātapaccayena paccayo.	khandhānam purejāta paccayena paccayaḥ 
PA_patthana_1.6:58.1_0	Asaṅkiliṭṭhasaṅkilesiko dhammo saṅkiliṭṭhasaṅkilesikassa dhammassa purejātapaccayena	asaṅkiliṭṭha saṅkilesikaḥ dhammaḥ saṅkiliṭṭha saṅkilesikassa dhammassa purejāta paccayena 
PA_patthana_1.6:58.1_1	paccayo—ārammaṇapurejātaṁ, vatthupurejātaṁ. Ārammaṇapurejātaṁ—cakkhuṁ assādeti abhinandati;	paccayo ārammaṇa purejāta vatthu purejāta ārammaṇa purejāta cakkhuṃ assādeti abhinandati 
PA_patthana_1.6:58.1_2	taṁ ārabbha rāgo uppajjati …pe… domanassaṁ uppajjati. Sotaṁ …pe… phoṭṭhabbe … vatthuṁ	tam ārabbha rāgaḥ uppajjati pe domanassam uppajjati sotam pe phoṭṭhabbe vatthu 
PA_patthana_1.6:58.1_3	assādeti abhinandati; taṁ ārabbha rāgo uppajjati …pe… domanassaṁ uppajjati. Vatthupurejātaṁ—vatthu	assādeti abhinandati tam ārabbha rāgaḥ uppajjati pe domanassam uppajjati vatthu purejāta vatthu 
PA_patthana_1.6:58.1_4	saṅkiliṭṭhasaṅkilesikānaṁ khandhānaṁ purejātapaccayena paccayo.	saṅkiliṭṭha saṅkilesikānam khandhānam purejāta paccayena paccayaḥ 
PA_patthana_1.6:59.1	Asaṅkiliṭṭhasaṅkilesiko dhammo asaṅkiliṭṭhaasaṅkilesikassa dhammassa purejātapaccayena paccayo—vatthu asaṅkiliṭṭhaasaṅkilesikānaṁ khandhānaṁ purejātapaccayena paccayo.	asaṅkiliṭṭha saṅkilesikaḥ dhammaḥ asaṅkiliṭṭha asaṅkilesikassa dhammassa purejāta paccayena paccayaḥ vatthu asaṅkiliṭṭha asaṅkilesikānam khandhānam purejāta paccayena paccayaḥ 
PA_patthana_1.6:60.0	Pacchājāta	pacchājāta 
PA_patthana_1.6:60.1_0	Saṅkiliṭṭhasaṅkilesiko dhammo asaṅkiliṭṭhasaṅkilesikassa dhammassa pacchājātapaccayena	saṅkiliṭṭha saṅkilesikaḥ dhammaḥ a saṅkiliṭṭha saṅkilesikassa dhammassa pacchājāta paccayena 
PA_patthana_1.6:60.1_1	paccayo—pacchājātā saṅkiliṭṭhasaṅkilesikā khandhā purejātassa imassa kāyassa pacchājātapaccayena paccayo.	paccaya upacchājātā saṅkiliṭṭha saṅkilesikā khandhā purejātassa imassa kāyassa pacchājāta paccayena paccayo 
PA_patthana_1.6:61.1_0	Asaṅkiliṭṭhasaṅkilesiko dhammo asaṅkiliṭṭhasaṅkilesikassa dhammassa pacchājātapaccayena	asaṅkiliṭṭha saṅkilesikaḥ dhammaḥ asaṅkiliṭṭha saṅkilesikassa dhammassa pacchājāta paccayena 
PA_patthana_1.6:61.1_1	paccayo—pacchājātā asaṅkiliṭṭhasaṅkilesikā khandhā purejātassa imassa kāyassa pacchājātapaccayena paccayo.	paccaya upacchājātāḥ asaṅkiliṭṭha saṅkilesikāḥ khandhāḥ purejātassa imassa kāyassa pacchājāta paccayena paccayo 
PA_patthana_1.6:62.1_0	Asaṅkiliṭṭhaasaṅkilesiko dhammo asaṅkiliṭṭhasaṅkilesikassa dhammassa pacchājātapaccayena	asaṅkiliṭṭha asaṅkilesikaḥ dhammaḥ asaṅkiliṭṭha saṅkilesikassa dhammassa pacchājāta paccayena 
PA_patthana_1.6:62.1_1	paccayo—pacchājātā asaṅkiliṭṭhaasaṅkilesikā khandhā purejātassa imassa kāyassa pacchājātapaccayena paccayo.	paccaya upacchājātāḥ asaṅkiliṭṭha asaṅkilesikāḥ khandhāḥ purejātassa imassa kāyassa pacchājāta paccayena paccayo 
PA_patthana_1.6:63.0	Āsevana	āsevana 
PA_patthana_1.6:63.1_0	Saṅkiliṭṭhasaṅkilesiko dhammo saṅkiliṭṭhasaṅkilesikassa dhammassa āsevanapaccayena	saṅkiliṭṭha saṅkilesikaḥ dhammaḥ saṅkiliṭṭha saṅkilesikassa dhammassa āsevana paccayena 
PA_patthana_1.6:63.1_1	paccayo—purimā purimā saṅkiliṭṭhasaṅkilesikā khandhā pacchimānaṁ pacchimānaṁ saṅkiliṭṭhasaṅkilesikānaṁ	paccayo purimā purimā saṅkiliṭṭha saṅkilesikā khandhā pacchimānam pacchimānam 
