segmentnr	original	analyzed
PA_patthana_23.31:0.1	Paṭṭhānapakaraṇa	▁ paṭṭhānapakaraṇa
PA_patthana_23.31:0.2	Dhammapaccanīyānuloma (4), Tikatikapaṭṭhānapāḷi (5)	▁dhamma pacc anīy ānulom a ▁tik ati k apaṭṭhānapāḷi
PA_patthana_23.31:0.3	23.31. Parittārammaṇattika, Kusalattika	▁paritt ārammaṇ attika ▁kusal attika
PA_patthana_23.31:1.1	Naparittārammaṇaṁ nakusalaṁ dhammaṁ paccayā parittārammaṇo kusalo dhammo uppajjati hetupaccayā. (Saṅkhittaṁ.) Hetuyā ekavīsa …pe… avigate ekavīsa.	▁na pari tt ārammaṇaṃ ▁na kusal aṃ ▁dhammaṃ ▁paccayā ▁paritt ārammaṇ o ▁kusal o ▁dhammo ▁uppajjati ▁hetupaccayā ▁saṃkhittaṃ ▁hetuyā ▁eka vī sa ▁pe ▁avigate ▁eka vī sa
PA_patthana_23.31:2.1	Naparittārammaṇaṁ naakusalaṁ dhammaṁ paccayā parittārammaṇo akusalo dhammo uppajjati hetupaccayā. (Saṅkhittaṁ.) Hetuyā cuddasa …pe… avigate cuddasa.	▁na pari tt ārammaṇaṃ ▁na akusal aṃ ▁dhammaṃ ▁paccayā ▁paritt ārammaṇ o ▁akusal o ▁dhammo ▁uppajjati ▁hetupaccayā ▁saṃkhittaṃ ▁hetuyā ▁cuddasa ▁pe ▁avigate ▁cuddasa
PA_patthana_23.31:3.1_0	Naparittārammaṇo naabyākato dhammo parittārammaṇassa abyākatassa dhammassa ārammaṇapaccayena	▁na pari tt ārammaṇ o ▁na a byākat o ▁dhammo ▁paritt ārammaṇ assa ▁abyākat assa ▁dhammassa ▁ārammaṇapaccay ena
PA_patthana_23.31:3.1_1	paccayo. (Saṅkhittaṁ.) … Ārammaṇe ekavīsa, adhipatiyā nava, anantare samanantare	▁paccayo ▁saṃkhittaṃ ▁ārammaṇe ▁eka vī sa ▁ adhipatiyā ▁nava ▁anantar e ▁sam an antare
PA_patthana_23.31:3.1_2	ekavīsa, upanissaye ekavīsa, natthiyā vigate ekavīsa.	▁eka vī sa ▁upanissaye ▁eka vī sa ▁natthi yā ▁vigat e ▁eka vī sa
