segmentnr	original	analyzed
PA_thag_19.1:0.1	Theragāthā 19.1	theragāthā 
PA_thag_19.1:0.2	Paññāsanipāta	paññā asanipāta 
PA_thag_19.1:0.3	Paṭhamavagga	paṭhama vagga 
PA_thag_19.1:0.4	Tālapuṭattheragāthā	tālapuṭattheragāthā 
PA_thag_19.1:1.1	“Kadā nuhaṁ pabbatakandarāsu,	kadā nuham pabbata kandarāsu 
PA_thag_19.1:1.2	Ekākiyo addutiyo vihassaṁ;	ekākiyaḥ addutiyaḥ vihassa 
PA_thag_19.1:1.3	Aniccato sabbabhavaṁ vipassaṁ,	aniccataḥ sabba bhavam vipassa 
PA_thag_19.1:1.4	Taṁ me idaṁ taṁ nu kadā bhavissati.	tat me idam tam nu kadā bhavissati 
PA_thag_19.1:2.1	Kadā nuhaṁ bhinnapaṭandharo muni,	kadā bhinna paṭandharaḥ muni 
PA_thag_19.1:2.2	Kāsāvavattho amamo nirāso;	amamaḥ nirāsaḥ 
PA_thag_19.1:2.3	Rāgañca dosañca tatheva mohaṁ,	rāgan ca dosan ca tathā iva moha 
PA_thag_19.1:2.4	Hantvā sukhī pavanagato vihassaṁ.	hantvā sukhī pavana gataḥ vihassa 
PA_thag_19.1:3.1	Kadā aniccaṁ vadharoganīḷaṁ,	kadā aniccam vadha roga nīḍa 
PA_thag_19.1:3.2	Kāyaṁ imaṁ maccujarāyupaddutaṁ;	kāyam imam maccu jarāyu padduta 
PA_thag_19.1:3.3	Vipassamāno vītabhayo vihassaṁ,	vipassamānaḥ vīta bhayaḥ vihassa 
PA_thag_19.1:3.4	Eko vane taṁ nu kadā bhavissati.	ekaḥ vane tam nu kadā bhavissati 
PA_thag_19.1:4.1	Kadā nuhaṁ bhayajananiṁ dukhāvahaṁ,	kadā nuham bhaya jananim dukha āvaha 
PA_thag_19.1:4.2	Taṇhālataṁ bahuvidhānuvattaniṁ;	taṇhālatam 
PA_thag_19.1:4.3	Paññāmayaṁ tikhiṇamasiṁ gahetvā,	paññā mayam tikhiṇam asim gahetvā 
PA_thag_19.1:4.4	Chetvā vase tampi kadā bhavissati.	chetvā vase tam pi kadā bhavissati 
PA_thag_19.1:5.1	Kadā nu paññāmayamuggatejaṁ,	kadā nu paññā maya mugga teja 
PA_thag_19.1:5.2	Satthaṁ isīnaṁ sahasādiyitvā;	sattham isīnam sahasā ādiyitvā 
PA_thag_19.1:5.3	Māraṁ sasenaṁ sahasā bhañjissaṁ,	mā aram sa senam sahasā bhañjissa 
PA_thag_19.1:5.4	Sīhāsane taṁ nu kadā bhavissati.	sīhāsane tat nu kadā bhavissati 
PA_thag_19.1:6.1	Kadā nuhaṁ sabbhi samāgamesu,	kadā nuham sabbhi samāgamesu 
PA_thag_19.1:6.2	Diṭṭho bhave dhammagarūhi tādibhi;	diṭṭhaḥ bhave dhamma garūhi 
PA_thag_19.1:6.3	Yāthāvadassīhi jitindriyehi,	yāthāvadassīhi jiti indriyehi 
PA_thag_19.1:6.4	Padhāniyo taṁ nu kadā bhavissati.	padhāniyaḥ tat nu kadā bhavissati 
PA_thag_19.1:7.1	Kadā nu maṁ tandi khudā pipāsā,	kadā nu mama khudā pipāsā 
PA_thag_19.1:7.2	Vātātapā kīṭasarīsapā vā;	vāta ātapā kīṭa sarīsapā vā 
PA_thag_19.1:7.3	Na bādhayissanti na taṁ giribbaje,	na bādhayissanti na tam giribbaje 
PA_thag_19.1:7.4	Atthatthiyaṁ taṁ nu kadā bhavissati.	atthatthiyam tat nu kadā bhavissati 
PA_thag_19.1:8.1	Kadā nu kho yaṁ viditaṁ mahesinā,	kadā nu khalu yam viditam mahā isinā 
PA_thag_19.1:8.2	Cattāri saccāni sududdasāni;	cattāri saccāni su duddasāni 
PA_thag_19.1:8.3	Samāhitatto satimā agacchaṁ,	samāhitattaḥ satimāḥ agaccha 
PA_thag_19.1:8.4	Paññāya taṁ taṁ nu kadā bhavissati.	paññāya tam tam nu kadā bhavissati 
PA_thag_19.1:9.1	Kadā nu rūpe amite ca sadde,	kadā nu rūpe amite ca sadde 
PA_thag_19.1:9.2	Gandhe rase phusitabbe ca dhamme;	gandhe rase phusitabbe ca dhamme 
PA_thag_19.1:9.3	Ādittatohaṁ samathehi yutto,	samathehi yuttaḥ 
PA_thag_19.1:9.4	Paññāya dacchaṁ tadidaṁ kadā me.	paññāya daccham tat idam kadā me 
PA_thag_19.1:10.1	Kadā nuhaṁ dubbacanena vutto,	kadā nuham dubbacanena vuttaḥ 
PA_thag_19.1:10.2	Tato nimittaṁ vimano na hessaṁ;	tatas nimittam vimanaḥ na 
PA_thag_19.1:10.3	Atho pasatthopi tato nimittaṁ,	atho pasatthaḥ pi 
PA_thag_19.1:10.4	Tuṭṭho na hessaṁ tadidaṁ kadā me.	tuṭṭhaḥ na hessam tat idam kadā me 
PA_thag_19.1:11.1	Kadā nu kaṭṭhe ca tiṇe latā ca,	kadā nu kaṭṭhe ca tiṇe latā ca 
PA_thag_19.1:11.2	Khandhe imehaṁ amite ca dhamme;	khandhe amite ca dhamme 
PA_thag_19.1:11.3	Ajjhattikāneva ca bāhirāni ca,	ajjhattikāni eva ca bāhirāni ca 
PA_thag_19.1:11.4	Samaṁ tuleyyaṁ tadidaṁ kadā me.	samam tuleyyam tat idam kadā me 
PA_thag_19.1:12.1	Kadā nu maṁ pāvusakālamegho,	kadā nu mama pāvusa kāla meghaḥ 
PA_thag_19.1:12.2	Navena toyena sacīvaraṁ vane;	navena toyena sa cīvaram vane 
PA_thag_19.1:12.3	Isippayātamhi pathe vajantaṁ,	isippayātamhi pathe vajanta 
PA_thag_19.1:12.4	Ovassate taṁ nu kadā bhavissati.	ovassate tam nu kadā bhavissati 
PA_thag_19.1:13.1	Kadā mayūrassa sikhaṇḍino vane,	kadā mayūrassa sikhaṇḍinaḥ vane 
PA_thag_19.1:13.2	Dijassa sutvā girigabbhare rutaṁ;	dijassa sutvā giri gabbhare ruta 
PA_thag_19.1:13.3	Paccuṭṭhahitvā amatassa pattiyā,	paccuṭṭhahitvā amatassa pattiyā 
PA_thag_19.1:13.4	Sañcintaye taṁ nu kadā bhavissati.	sañcintaye tam nu kadā bhavissati 
PA_thag_19.1:14.1	Kadā nu gaṅgaṁ yamunaṁ sarassatiṁ,	kadā nu gaṅgam yamunam saraḥ sati 
PA_thag_19.1:14.2	Pātālakhittaṁ vaḷavāmukhañca;	pātālakhittam vaḷavāmukham ca 
PA_thag_19.1:14.3	Asajjamāno patareyyamiddhiyā,	a sajjamānaḥ patareyyam iddhiyā 
PA_thag_19.1:14.4	Vibhiṁsanaṁ taṁ nu kadā bhavissati.	vibhisanam tat nu kadā bhavissati 
PA_thag_19.1:15.1	Kadā nu nāgova asaṅgacārī,	kadā nu nāgā uva asaṅga cārī 
PA_thag_19.1:15.2	Padālaye kāmaguṇesu chandaṁ;	pada ālaye kāmaguṇesu chanda 
PA_thag_19.1:15.3	Nibbajjayaṁ sabbasubhaṁ nimittaṁ,	sabba subham 
PA_thag_19.1:15.4	Jhāne yuto taṁ nu kadā bhavissati.	jhāne yutaḥ tam nu kadā bhavissati 
PA_thag_19.1:16.1	Kadā iṇaṭṭova daliddako nidhiṁ,	kadā daliddakaḥ 
PA_thag_19.1:16.2	Ārādhayitvā dhanikehi pīḷito;	ārādhayitvā dhanikehi pīḍitaḥ 
PA_thag_19.1:16.3	Tuṭṭho bhavissaṁ adhigamma sāsanaṁ,	tuṭṭhaḥ bhavissam adhigamma sāsana 
PA_thag_19.1:16.4	Mahesino taṁ nu kadā bhavissati.	mahesinaḥ tat nu kadā bhavissati 
PA_thag_19.1:17.1	Bahūni vassāni tayāmhi yācito,	bahūni vassāni tayā amhi yācitaḥ 
PA_thag_19.1:17.2	‘Agāravāsena alaṁ nu te idaṁ’;	agāra vāsena alam nu te idam 
PA_thag_19.1:17.3	Taṁ dāni maṁ pabbajitaṁ samānaṁ,	tam dāni mam pabbajitam samāna 
PA_thag_19.1:17.4	Kiṅkāraṇā citta tuvaṁ na yuñjasi.	kiṅkāraṇā citta tuvam na yuñjasi 
PA_thag_19.1:18.1	Nanu ahaṁ citta tayāmhi yācito,	nanu aham citta tayā amhi yācitaḥ 
PA_thag_19.1:18.2	‘Giribbaje citrachadā vihaṅgamā’;	giribbaje citrachadā vihaṅgamā 
PA_thag_19.1:18.3	Mahindaghosatthanitābhigajjino,	mahinda ghosa tthanita abhigajjinaḥ 
PA_thag_19.1:18.4	Te taṁ ramessanti vanamhi jhāyinaṁ.	te tam ramessanti vanamhi jhāyina 
PA_thag_19.1:19.1	Kulamhi mitte ca piye ca ñātake,	kulamhi mitte ca piye ca ñātake 
PA_thag_19.1:19.2	Khiḍḍāratiṁ kāmaguṇañca loke;	khiḍḍa aratim kāma guṇam ca loke 
PA_thag_19.1:19.3	Sabbaṁ pahāya imamajjhupāgato,	sabbam pahāya imam ajjhupāgataḥ 
PA_thag_19.1:19.4	Athopi tvaṁ citta na mayha tussasi.	tvam citta na tussasi 
PA_thag_19.1:20.1	Mameva etaṁ na hi tvaṁ paresaṁ,	mama iva etam na hi tvam paresa 
PA_thag_19.1:20.2	Sannāhakāle paridevitena kiṁ;	sannāha kāle paridevitena ki 
PA_thag_19.1:20.3	Sabbaṁ idaṁ calamiti pekkhamāno,	sabbam idam calam iti pekkhamāno 
PA_thag_19.1:20.4	Abhinikkhamiṁ amatapadaṁ jigīsaṁ.	abhinikkhamim amata padam jigīsa 
PA_thag_19.1:21.1	Suyuttavādī dvipadānamuttamo,	su yutta vādī 
PA_thag_19.1:21.2	Mahābhisakko naradammasārathi;	mahā abhisakkaḥ nara damma sārathi 
PA_thag_19.1:21.3	‘Cittaṁ calaṁ makkaṭasannibhaṁ iti,	cittam calam makkaṭa sannibham iti 
PA_thag_19.1:21.4	Avītarāgena sudunnivārayaṁ’.	a vīta rāgena 
PA_thag_19.1:22.1	Kāmā hi citrā madhurā manoramā,	kāmā hi citrā madhurā manoramā 
PA_thag_19.1:22.2	Aviddasū yattha sitā puthujjanā;	aviddasū yattha sitā puthujjanā 
PA_thag_19.1:22.3	Te dukkhamicchanti punabbhavesino,	te dukkham icchanti punabbhavesinaḥ 
PA_thag_19.1:22.4	Cittena nītā niraye nirākatā.	cittena nītā niraye nirākatā 
PA_thag_19.1:23.1	‘Mayūrakoñcābhirutamhi kānane,	kānane 
PA_thag_19.1:23.2	Dīpīhi byagghehi purakkhato vasaṁ;	dīpīhi byagghehi purakkhataḥ vasa 
PA_thag_19.1:23.3	Kāye apekkhaṁ jaha mā virādhaya’,	kāye apekkham jaha mā virādhaya 
PA_thag_19.1:23.4	Itissu maṁ citta pure niyuñjasi.	itissu mam citta pure niyuñjasi 
PA_thag_19.1:24.1	‘Bhāvehi jhānāni ca indriyāni ca,	bhāvehi jhānāni ca indriyāni ca 
PA_thag_19.1:24.2	Balāni bojjhaṅgasamādhibhāvanā;	balāni 
PA_thag_19.1:24.3	Tisso ca vijjā phusa buddhasāsane’,	tissaḥ ca vijjā phusa buddha sāsane 
PA_thag_19.1:24.4	Itissu maṁ citta pure niyuñjasi.	itissu mam citta pure niyuñjasi 
PA_thag_19.1:25.1	‘Bhāvehi maggaṁ amatassa pattiyā,	bhāvehi maggam amatassa pattiyā 
PA_thag_19.1:25.2	Niyyānikaṁ sabbadukhakkhayogadhaṁ;	niyyānikam 
PA_thag_19.1:25.3	Aṭṭhaṅgikaṁ sabbakilesasodhanaṁ’,	aṭṭhaṅgikam sabba kilesa sodhana 
PA_thag_19.1:25.4	Itissu maṁ citta pure niyuñjasi.	itissu mam citta pure niyuñjasi 
PA_thag_19.1:26.1	‘Dukkhanti khandhe paṭipassa yoniso,	dukkhanti khandhe paṭipassa yoniso 
PA_thag_19.1:26.2	Yato ca dukkhaṁ samudeti taṁ jaha;	yatas ca dukkham samudeti tam jaha 
PA_thag_19.1:26.3	Idheva dukkhassa karohi antaṁ’,	idhā iva dukkhassa karohi anta 
PA_thag_19.1:26.4	Itissu maṁ citta pure niyuñjasi.	itissu mam citta pure niyuñjasi 
PA_thag_19.1:27.1	‘Aniccaṁ dukkhanti vipassa yoniso,	aniccam dukkhanti vipassa yonisaḥ 
PA_thag_19.1:27.2	Suññaṁ anattāti aghaṁ vadhanti ca;	suññam anattā ati agham vadhanti ca 
PA_thag_19.1:27.3	Manovicāre uparundha cetaso’,	manaḥ vicāre uparundha cetasaḥ 
PA_thag_19.1:27.4	Itissu maṁ citta pure niyuñjasi.	itissu mam citta pure niyuñjasi 
PA_thag_19.1:28.1	‘Muṇḍo virūpo abhisāpamāgato,	muṇḍaḥ virūpaḥ 
PA_thag_19.1:28.2	Kapālahatthova kulesu bhikkhasu;	kapāla hatthaḥ uva kulesu bhikkhasu 
PA_thag_19.1:28.3	Yuñjassu satthuvacane mahesino’,	yuñjassu satthuvacane mahesinaḥ 
PA_thag_19.1:28.4	Itissu maṁ citta pure niyuñjasi.	itissu mam citta pure niyuñjasi 
PA_thag_19.1:29.1	‘Susaṁvutatto visikhantare caraṁ,	susavutattaḥ visikhantare cara 
PA_thag_19.1:29.2	Kulesu kāmesu asaṅgamānaso;	kulesu kāmesu asaṅga mānasaḥ 
PA_thag_19.1:29.3	Cando yathā dosinapuṇṇamāsiyā’,	candaḥ yathā dosinapuṇṇamāsiyā 
PA_thag_19.1:29.4	Itissu maṁ citta pure niyuñjasi.	itissu mam citta pure niyuñjasi 
PA_thag_19.1:30.1	‘Āraññiko hohi ca piṇḍapātiko,	āraññikaḥ ca piṇḍapātikaḥ 
PA_thag_19.1:30.2	Sosāniko hohi ca paṁsukūliko;	sosānikaḥ hohi ca pasukūlikaḥ 
PA_thag_19.1:30.3	Nesajjiko hohi sadā dhute rato’,	nesajjikaḥ hohi sadā dhute rataḥ 
PA_thag_19.1:30.4	Itissu maṁ citta pure niyuñjasi.	itissu mam citta pure niyuñjasi 
PA_thag_19.1:31.1	Ropetva rukkhāni yathā phalesī,	ropetvā rukkhāni yathā phalesī 
PA_thag_19.1:31.2	Mūle taruṁ chettu tameva icchasi;	mūle tarum chettu tam eva icchasi 
PA_thag_19.1:31.3	Tathūpamaṁ cittamidaṁ karosi,	tathā upamam cittam idam karosi 
PA_thag_19.1:31.4	Yaṁ maṁ aniccamhi cale niyuñjasi.	yam mam aniccamhi cale niyuñjasi 
PA_thag_19.1:32.1	Arūpa dūraṅgama ekacāri,	arūpa dūraṅgama ekacāri 
PA_thag_19.1:32.2	Na te karissaṁ vacanaṁ idānihaṁ;	na te karissam vacanam idān iha 
PA_thag_19.1:32.3	Dukkhā hi kāmā kaṭukā mahabbhayā,	dukkhā hi kāmā kaṭukā mahat bhayā 
PA_thag_19.1:32.4	Nibbānamevābhimano carissaṁ.	nibbānam eva abhimanaḥ carissa 
PA_thag_19.1:33.1	Nāhaṁ alakkhyā ahirikkatāya vā,	na aham alakkhyā ahirikkatāya vā 
PA_thag_19.1:33.2	Na cittahetū na ca dūrakantanā;	na citta hetū na ca dūra kantanā 
PA_thag_19.1:33.3	Ājīvahetū ca ahaṁ na nikkhamiṁ,	ājīva hetū ca aham na nikkhami 
PA_thag_19.1:33.4	Kato ca te citta paṭissavo mayā.	kataḥ ca te citta paṭissavaḥ mayā 
PA_thag_19.1:34.1	‘Appicchatā sappurisehi vaṇṇitā,	appiccha tā sappurisehi vaṇṇitā 
PA_thag_19.1:34.2	Makkhappahānaṁ vupasamo dukhassa’;	makkha ppahānam vupasamaḥ dukhassa 
PA_thag_19.1:34.3	Itissu maṁ citta tadā niyuñjasi,	itissu mam citta tadā niyuñjasi 
PA_thag_19.1:34.4	Idāni tvaṁ gacchasi pubbaciṇṇaṁ.	idāni tvam gacchasi pubbaciṇṇa 
PA_thag_19.1:35.1	Taṇhā avijjā ca piyāpiyañca,	taṇhā avijjā ca piya apiyam ca 
PA_thag_19.1:35.2	Subhāni rūpāni sukhā ca vedanā;	subhāni rūpāni sukhā ca vedanā 
PA_thag_19.1:35.3	Manāpiyā kāmaguṇā ca vantā,	manāpiyā kāma guṇā ca vantā 
PA_thag_19.1:35.4	Vante ahaṁ āvamituṁ na ussahe.	vante aham āvamitum na ussahe 
PA_thag_19.1:36.1	Sabbattha te citta vaco kataṁ mayā,	sabbattha te citta vaco katam mayā 
PA_thag_19.1:36.2	Bahūsu jātīsu na mesi kopito;	bahūsu jātīsu na mesi kopitaḥ 
PA_thag_19.1:36.3	Ajjhattasambhavo kataññutāya te,	ajjhatta sambhavaḥ kataññutāya te 
PA_thag_19.1:36.4	Dukkhe ciraṁ saṁsaritaṁ tayā kate.	dukkhe ciram sa saritam tayā kate 
PA_thag_19.1:37.1	Tvaññeva no citta karosi brāhmaṇo,	tvañc eva naḥ citta karosi brāhmaṇaḥ 
PA_thag_19.1:37.2	Tvaṁ khattiyo rājadasī karosi;	tvam khattiyaḥ rājadasī karosi 
PA_thag_19.1:37.3	Vessā ca suddā ca bhavāma ekadā,	vessā ca suddā ca bhavāmaḥ ekadā 
PA_thag_19.1:37.4	Devattanaṁ vāpi taveva vāhasā.	devattanam vā api tava iva vāhasā 
PA_thag_19.1:38.1	Taveva hetū asurā bhavāmase,	tava iva hetū asurāḥ bhavāmase 
PA_thag_19.1:38.2	Tvaṁmūlakaṁ nerayikā bhavāmase;	tva mūlakam na īrayikāḥ bhavāmase 
PA_thag_19.1:38.3	Atho tiracchānagatāpi ekadā,	atho tiracchāna gatā api ekadā 
PA_thag_19.1:38.4	Petattanaṁ vāpi taveva vāhasā.	vā api tava iva vāhasā 
PA_thag_19.1:39.1	Nanu dubbhissasi maṁ punappunaṁ,	nanu mama punar puna 
PA_thag_19.1:39.2	Muhuṁ muhuṁ cāraṇikaṁva dassayaṁ;	muhum muhum dassaya 
PA_thag_19.1:39.3	Ummattakeneva mayā palobhasi,	ummattakena iva mayā palobhasi 
PA_thag_19.1:39.4	Kiñcāpi te citta virādhitaṁ mayā.	kiñca api te citta virādhitam mayā 
PA_thag_19.1:40.1	Idaṁ pure cittamacāri cārikaṁ,	idam pure cittam acāri cārika 
PA_thag_19.1:40.2	Yenicchakaṁ yatthakāmaṁ yathāsukhaṁ;	yenicchakam yatthakāmam yathāsukha 
PA_thag_19.1:40.3	Tadajjahaṁ niggahessāmi yoniso,	tat ajja aham niggahessāmi yonisaḥ 
PA_thag_19.1:40.4	Hatthippabhinnaṁ viya aṅkusaggaho.	hatthi ppabhinnam viya aṅkusa gahaḥ 
PA_thag_19.1:41.1	Satthā ca me lokamimaṁ adhiṭṭhahi,	satthā ca me lokam imam adhiṭṭhahi 
PA_thag_19.1:41.2	Aniccato addhuvato asārato;	aniccataḥ a ddhuvataḥ a sārataḥ 
PA_thag_19.1:41.3	Pakkhanda maṁ citta jinassa sāsane,	pakkhanda mama citta jinassa sāsane 
PA_thag_19.1:41.4	Tārehi oghā mahatā suduttarā.	tārehi oghā mahatā su duttarā 
PA_thag_19.1:42.1	Na te idaṁ citta yathā purāṇakaṁ,	na te idam citta yathā purāṇaka 
PA_thag_19.1:42.2	Nāhaṁ alaṁ tuyha vase nivattituṁ;	na aham alam vase 
PA_thag_19.1:42.3	Mahesino pabbajitomhi sāsane,	mahesino pabbajitomhi sāsane 
PA_thag_19.1:42.4	Na mādisā honti vināsadhārino.	na mādisāḥ honti vināsa dhārinaḥ 
PA_thag_19.1:43.1	Nagā samuddā saritā vasundharā,	nagā samuddā saritā vasundharā 
PA_thag_19.1:43.2	Disā catasso vidisā adho divā;	disā catassaḥ vidisāḥ adhas divā 
PA_thag_19.1:43.3	Sabbe aniccā tibhavā upaddutā,	sabbe aniccā ti bhavā upaddutā 
PA_thag_19.1:43.4	Kuhiṁ gato citta sukhaṁ ramissasi.	kuhim gataḥ citta sukham ramissasi 
PA_thag_19.1:44.1	Dhitipparaṁ kiṁ mama citta kāhisi,	kim mama citta kāhisi 
PA_thag_19.1:44.2	Na te alaṁ citta vasānuvattako;	na te alam citta 
PA_thag_19.1:44.3	Na jātu bhastaṁ ubhatomukhaṁ chupe,	na jātu bhastam ubhatomukham chupe 
PA_thag_19.1:44.4	Dhiratthu pūraṁ nava sotasandaniṁ.	dhiratthu pūram nava sota sandani 
PA_thag_19.1:45.1	Varāhaeṇeyyavigāḷhasevite,	varāha eṇeyya vigāḍha sevite 
PA_thag_19.1:45.2	Pabbhārakuṭṭe pakateva sundare;	pabbhāra kuṭṭe pakatā iva sundare 
PA_thag_19.1:45.3	Navambunā pāvusasitthakānane,	navambunā pāvusa sittha kānane 
PA_thag_19.1:45.4	Tahiṁ guhāgehagato ramissasi.	tahim guhā geha gataḥ ramissasi 
PA_thag_19.1:46.1	Sunīlagīvā susikhā supekhunā,	su nīla gīvā su sikhā su pekhunā 
PA_thag_19.1:46.2	Sucittapattacchadanā vihaṅgamā;	su citta patta chadanā vihaṅgamā 
PA_thag_19.1:46.3	Sumañjughosatthanitābhigajjino,	       
PA_thag_19.1:46.4	Te taṁ ramessanti vanamhi jhāyinaṁ.	te tam ramessanti vanamhi jhāyina 
PA_thag_19.1:47.1	Vuṭṭhamhi deve caturaṅgule tiṇe,	deve catur aṅgule tiṇe 
PA_thag_19.1:47.2	Sampupphite meghanibhamhi kānane;	sampupphite megha nibhamhi kānane 
PA_thag_19.1:47.3	Nagantare viṭapisamo sayissaṁ,	na ga antare viṭapi samaḥ sayissa 
PA_thag_19.1:47.4	Taṁ me mudū hehiti tūlasannibhaṁ.	tam me mudū tūla sannibha 
PA_thag_19.1:48.1	Tathā tu kassāmi yathāpi issaro,	tathā tu kassāmi yathā api issaro 
PA_thag_19.1:48.2	Yaṁ labbhati tenapi hotu me alaṁ;	yam labbhati tena api hotu me ala 
PA_thag_19.1:48.3	Na tāhaṁ kassāmi yathā atandito,	na tāham kassāmi yathā a tanditaḥ 
PA_thag_19.1:48.4	Biḷārabhastaṁva yathā sumadditaṁ.	biḷārabhaḥ tava yathā sumaddita 
PA_thag_19.1:49.1	Tathā tu kassāmi yathāpi issaro,	tathā tu kassāmi yathā api issaro 
PA_thag_19.1:49.2	Yaṁ labbhati tenapi hotu me alaṁ;	yam labbhati tena api hotu me ala 
PA_thag_19.1:49.3	Viriyena taṁ mayha vasānayissaṁ,	viriyena tam mayha vasa ānayissa 
PA_thag_19.1:49.4	Gajaṁva mattaṁ kusalaṅkusaggaho.	mattam 
PA_thag_19.1:50.1	Tayā sudantena avaṭṭhitena hi,	tayā su dantena avaṭṭhitena hi 
PA_thag_19.1:50.2	Hayena yoggācariyova ujjunā;	hayena ujjunā 
PA_thag_19.1:50.3	Pahomi maggaṁ paṭipajjituṁ sivaṁ,	pahomi maggam paṭipajjitum siva 
PA_thag_19.1:50.4	Cittānurakkhīhi sadā nisevitaṁ.	citta anurakkhīhi sadā nisevita 
PA_thag_19.1:51.1	Ārammaṇe taṁ balasā nibandhisaṁ,	ārammaṇe tam balasā 
PA_thag_19.1:51.2	Nāgaṁva thambhamhi daḷhāya rajjuyā;	nāgava thambhamhi daḷhāya rajjuyā 
PA_thag_19.1:51.3	Taṁ me suguttaṁ satiyā subhāvitaṁ,	tam me su guttam satiyā su bhāvita 
PA_thag_19.1:51.4	Anissitaṁ sabbabhavesu hehisi.	a nissitam sabba bhavesu hehisi 
PA_thag_19.1:52.1	Paññāya chetvā vipathānusārinaṁ,	paññāya chetvā vipatha anusārina 
PA_thag_19.1:52.2	Yogena niggayha pathe nivesiya;	yogena niggayha pathe nivesiya 
PA_thag_19.1:52.3	Disvā samudayaṁ vibhavañca sambhavaṁ,	disvā samudayam vibhavam ca sambhava 
PA_thag_19.1:52.4	Dāyādako hehisi aggavādino.	dāyādakaḥ hehisi agga vādinaḥ 
PA_thag_19.1:53.1	Catubbipallāsavasaṁ adhiṭṭhitaṁ,	catur bipallāsa vasam 
PA_thag_19.1:53.2	Gāmaṇḍalaṁva parinesi citta maṁ;	parinesi citta ma 
PA_thag_19.1:53.3	Nanu saṁyojanabandhanacchidaṁ,	nanu sayojana bandhana chidaḥ 
PA_thag_19.1:53.4	Saṁsevase kāruṇikaṁ mahāmuniṁ.	sasevase kāruṇikam mahā muni 
PA_thag_19.1:54.1	Migo yathā seri sucittakānane,	migaḥ yathā su citta kānane 
PA_thag_19.1:54.2	Rammaṁ giriṁ pāvusaabbhamāliniṁ;	rammam girim pāvusa abbha mālini 
PA_thag_19.1:54.3	Anākule tattha nage ramissaṁ,	an ākule tattha nage ramissa 
PA_thag_19.1:54.4	Asaṁsayaṁ citta parā bhavissasi.	a sa sayam citta parā bhavissasi 
PA_thag_19.1:55.1	Ye tuyha chandena vasena vattino,	ye tuyha chandena vasena vattino 
PA_thag_19.1:55.2	Narā ca nārī ca anubhonti yaṁ sukhaṁ;	narā ca nārī ca anubhonti yam sukha 
PA_thag_19.1:55.3	Aviddasū māravasānuvattino,	aviddasū māra vasā anuvattinaḥ 
PA_thag_19.1:55.4	Bhavābhinandī tava citta sāvakā”ti.	bhava abhinandī tava 
PA_thag_19.1:55.5	… Tālapuṭo thero …	tālapuṭaḥ theraḥ 
PA_thag_19.1:55.6	Paññāsanipāto niṭṭhito.	paññāsa nipātaḥ niṭṭhitaḥ 
PA_thag_19.1:56.0	Tatruddānaṁ	tatra uddāna 
PA_thag_19.1:56.1	Paññāsamhi nipātamhi,	paññāsamhi nipātamhi 
PA_thag_19.1:56.2	eko tālapuṭo suci;	ekaḥ tālapuṭaḥ suci 
PA_thag_19.1:56.3	Gāthāyo tattha paññāsa,	gāthāyaḥ tattha paññāsa 
PA_thag_19.1:56.4	puna pañca ca uttarīti.	puna pañca ca uttarī iti 
