segmentnr	original	folio	analyzed
PA_tika-abh01_t:294_1	evamādayo paññāvisesā nānākāle labbhamānāpi ekasmiṃ citte labbhanti. Ekasmiñca visese	294	
PA_tika-abh01_t:294_2	itarepi anugatā hontīti dassetuṃ tathā vibhatti atthato vibhatti hoti atthanānattena	294	
PA_tika-abh01_t:294_3	katattā. Atha vā yathā “kodho kujjhanā kujjhitatta”nti sabhāvākārabhāvaniddesehi	294	
PA_tika-abh01_t:294_4	kodhoti evamākārova attho vutto, na evamidha, idha pana paṇḍitādibhāvākārabhinno	294	
PA_tika-abh01_t:294_5	attho vuttoti idaṃ vibhattigamanaṃ atthavasena hoti. Samphusitattanti etthāpi na	294	
PA_tika-abh01_t:294_6	“phasso”ti evamākārova attho vutto. Samphassoti evamākāro pana vuttoti atthato vibhattigamananti vuttaṃ.	294	
PA_tika-abh01_t:295_0	Doso byāpādoti uddesepi nāmanānattena nānābhūto uddiṭṭho. Niddesepi teneva nānattena	295	
PA_tika-abh01_t:295_1	niddiṭṭho. Ekova khandho hotīti ekena khandhasaddena vattabbataṃ sandhāyāha. Cetanāti	295	
PA_tika-abh01_t:295_2	saṅkhārakkhandhaṃ dasseti tappamukhattā. Asaddhammāti asataṃ, asanto vā dhammā, na	295	
PA_tika-abh01_t:295_3	vā saddhammāti asaddhammāti asaddhammavacanīyabhāvena ekībhūtopi asaddhammo kodhagarutādivisiṭṭhena	295	
PA_tika-abh01_t:295_4	saddhammagarutāpaṭikkhepanānattena nānattaṃ gatoti “cattāro”ti vuttaṃ. Na saddhammagarutāti	295	
PA_tika-abh01_t:295_5	vuccamānā vā asaddhammagarutā asaddhammagarutābhāvena ekībhūtāpi kodhādivisiṭṭhapaṭikkhepanānattena	295	
PA_tika-abh01_t:295_6	nānattaṃ gatā. Paṭipakkho vā paṭikkhipīyati tena, sayaṃ vā paṭikkhipatīti paṭikkhepoti	295	
PA_tika-abh01_t:295_7	vuccatīti saddhammagarutāpaṭikkhepanānattena asaddhammagarutā asaddhammā vā nānattaṃ	295	
PA_tika-abh01_t:295_8	gatā. Alobhotiādīnaṃ phassādīhi nānattaṃ lobhādivisiṭṭhena paṭikkhepena lobhādipaṭipakkhena	295	
PA_tika-abh01_t:295_9	vā veditabbaṃ. Alobhādosāmohānaṃ aññamaññanānattaṃ yathāvuttena paṭikkhepanānattena	295	
PA_tika-abh01_t:295_10	yojetabbaṃ. Padatthassa padantarena vibhāvanaṃ padatthuti. Tena hi taṃ padaṃ mahatthanti	2951	
PA_tika-abh01_t:295_11	dīpitaṃ hoti alaṅkatañcāti. Atthavisesābhāvepi ābharaṇavasena ca ādaravasena ca puna	2951	
PA_tika-abh01_t:295_12	vacanaṃ daḷhīkammaṃ.	2951	
PA_tika-abh01_t:296_0	3. Tajjanti tassa phalassa anucchavikaṃ. Na kevalaṃ niddisiyamānaṃ sātameva adhikataṃ,	296	
PA_tika-abh01_t:296_1	atha kho yathāniddiṭṭhāni ārammaṇānipīti “tehi vā”tiādi vuttaṃ. Tassa vā jātā kāraṇabhāvena	296	
PA_tika-abh01_t:296_2	phassatthaṃ pavattāti tajjā. Taṃsamaṅgīpuggalaṃ, sampayuttadhamme vā attani sādayatīti	296	
PA_tika-abh01_t:296_3	sātaṃ da-kārassa ta-kāraṃ katvā. Suṭṭhu khādati, khaṇati vā dukkhanti sukhaṃ.	296	
PA_tika-abh01_t:297_0	5. Pāsoti rāgapāso. So hi nirāvaraṇattā antalikkhacaro. Akusalampi paṇḍaranti vuttaṃ,	297	
PA_tika-abh01_t:297_1	ko pana vādo kusalanti adhippāyo. Tañhi paṇḍarato nikkhantaṃ sayañca paṇḍaranti.	297	
PA_tika-abh01_t:297_2	Atha vā sabbampi cittaṃ sabhāvato paṇḍarameva, āgantukopakkilesavodānehi pana sāvajjānavajjānaṃ	297	
PA_tika-abh01_t:297_3	upakkiliṭṭhavisuddhataratā hontīti. Dāruppamāṇesu silādīsu khandhapaññattiyā abhāvā	297	
PA_tika-abh01_t:297_4	kiñci nimittaṃ anapekkhitvā dārumhi pavattā khandhapaññattīti “paṇṇattimattaṭṭhenā”ti	297	
PA_tika-abh01_t:297_5	vuttaṃ. Taṃ-saddena manoviññāṇadhātuyeva vucceyya niddisitabbattāti na tassā tajjatā.	297	
PA_tika-abh01_t:297_6	Tehi ārammaṇehi jātā tajjāti ca vuccamāne samphassajatā na vattabbā. Na hi so ārammaṇaṃ,	297	
PA_tika-abh01_t:297_7	nāpi visesapaccayo. “Tiṇṇaṃ saṅgati phasso”ti viññāṇameva phassassa visesapaccayoti	297	
PA_tika-abh01_t:297_8	vuttoti tasmā na viññāṇaṃ visesapaccayabhūtaṃ samphassajatāya tajjāmanoviññāṇadhātusamphassajāpaññattiṃ	297	
PA_tika-abh01_t:297_9	labhati, na ca tadeva tassa kāraṇabhāvena phalabhāvena ca vuccamānaṃ suviññeyyaṃ	297	
PA_tika-abh01_t:297_10	hotīti. Kiṃ vā etena, yathā bhagavatā vuttā taṃsabhāvāyeva te dhammāti na evaṃvidhesu	2971	
PA_tika-abh01_t:297_11	kāraṇaṃ maggitabbaṃ.	2971	
PA_tika-abh01_t:298	7. Evaṃ takkanavasena lokasiddhenāti adhippāyo. Evañcevañca bhavitabbanti vividhaṃ takkanaṃ kūpe viya udakassa ārammaṇassa ākaḍḍhanaṃ vitakkanaṃ.	29	
PA_tika-abh01_t:299	8. Samantato caraṇaṃ vicaraṇaṃ.	29	
PA_tika-abh01_t:300_0	9. Attamanatāti ettha atta-saddena na cittaṃ vuttaṃ. Na hi cittassa mano atthīti.	300	
PA_tika-abh01_t:300_1	Attamanassa pana puggalassa bhāvo attamanatāti vatvā puna puggaladiṭṭhinisedhanatthaṃ	300	
PA_tika-abh01_t:300_2	“cittassā”ti vuttaṃ.	300	
PA_tika-abh01_t:301_0	11. Na balavatī, kasmā avaṭṭhiti vuttāti? Ekaggacittena pāṇavadhādikaraṇe tathā avaṭṭhānamattabhāvato.	301	
PA_tika-abh01_t:301_1	Virūpaṃ, vividhaṃ vā saṃharaṇaṃ vikiraṇaṃ visāhāro, saṃharaṇaṃ vā sampiṇḍanaṃ, tadabhāvo visāhāro.	301	
PA_tika-abh01_t:302	12. Aññasmiṃ pariyāyeti aññasmiṃ kāraṇe. Samānādhikaraṇabhāvo dvinnaṃ bahūnaṃ vā padānaṃ ekasmiṃ atthe pavatti.	30	
PA_tika-abh01_t:303	13. Ārambhati cāti āpajjati ca. Uddhaṃ yamanaṃ uyyāmo. Dhuranti nipphādetuṃ āraddhaṃ kusalaṃ, paṭiññaṃ vā.	30	
PA_tika-abh01_t:304	14. Tiṇṇanti buddhādīnaṃ. Citte ārammaṇassa upaṭṭhānaṃ jotanañca satiyevāti tassā etaṃ lakkhaṇaṃ.	30	
PA_tika-abh01_t:305	16. Pāsāṇasakkharavālikādirahitā bhūmi saṇhāti “saṇhaṭṭhenā”ti vuttaṃ.	30	
PA_tika-abh01_t:306_0	19. Ayantīti ekakammanibbattamanussādisantatiavicchedavasena pavattanti. Kusalākusalesupi	306	
PA_tika-abh01_t:306_1	hi jīvitaṃ indriyapaccayabhāvena sampayutte pavattayamānameva tadavicchedassa paccayo hoti.	306	
PA_tika-abh01_t:307	30. Yaṃ hirīyatīti hirīyati-saddena vutto bhāvo yaṃ-saddena vuccatīti yanti bhāvanapuṃsakaṃ vā etaṃ daṭṭhabbaṃ. Hiriyitabbenāti ca hetuatthe karaṇavacanaṃ yujjati.	30	
PA_tika-abh01_t:308	32. Alubbhanakavasenāti ettha alubbhanameva alubbhanakanti bhāvaniddeso daṭṭhabbo.	30	
PA_tika-abh01_t:309	33. Abyāpajjoti byāpādena dukkhena domanassasaṅkhātena dosena viya na byāpādetabbotipi attho yujjati.	30	
PA_tika-abh01_t:310_0	42-43. Thinamiddhādipaṭipakkhabhāvena kusaladhamme aniccādimanasikāre ca sīghaṃ sīghaṃ	310	
PA_tika-abh01_t:310_1	parivattanasamatthatā lahupariṇāmatā, avijjānīvaraṇānañhi taṇhāsaṃyojanānaṃ sattānaṃ	310	
PA_tika-abh01_t:310_2	akusalappavatti pakatibhūtāti na tattha lahupariṇāmatāya attho. Tesañca bhāvo garutāyevāti	310	
PA_tika-abh01_t:310_3	tabbidhurasabhāvānaṃ lahutā daṭṭhabbā. Sā hi pavattamānā sīghaṃ bhavaṅgavuṭṭhānassa paccayo hoti.	310	
PA_tika-abh01_t:311	44-45. Ye ca dhammā mohasampayuttā viya avipannalahutā, tesañca kusalakaraṇe appaṭighāto mudutā. Appaṭighātena mudutādirūpasadisatāya arūpadhammānampi mudutā maddavatātiādi vuttaṃ.	31	
PA_tika-abh01_t:312_0	46-47. Sinehavasena kilinnaṃ atimudukaṃ cittaṃ akammaññaṃ hoti vilīnaṃ viya suvaṇṇaṃ,	312	
PA_tika-abh01_t:312_1	mānādivasena atithaddhañca atāpitaṃ viya suvaṇṇaṃ, yaṃ panānurūpamudutāyuttaṃ, taṃ	312	
PA_tika-abh01_t:312_2	kammaññaṃ hoti yuttamaddavaṃ viya suvaṇṇaṃ. Tasseva mudukassa yo kammaññākāro, sā	312	
PA_tika-abh01_t:312_3	kammaññatāti mudutāvisiṭṭhā kammaññatā veditabbā.	312	
PA_tika-abh01_t:313_0	50-51. Paccosakkanabhāvena pavattaṃ akusalameva paccosakkanaṃ. Ekavīsati anesanā	313	
PA_tika-abh01_t:313_1	nāma vejjakammaṃ karoti, dūtakammaṃ karoti, pahiṇakammaṃ karoti, gaṇḍaṃ phāleti,	313	
PA_tika-abh01_t:313_2	arumakkhanaṃ deti, uddhaṃvirecanaṃ deti, adhovirecanaṃ deti, natthutelaṃ pacati,	313	
PA_tika-abh01_t:313_3	cakkhutelaṃ pacati, veḷudānaṃ deti, paṇṇadānaṃ deti, pupphadānaṃ deti, phaladānaṃ	313	
PA_tika-abh01_t:313_4	deti, sinānadānaṃ deti, dantakaṭṭhadānaṃ deti, mukhodakadānaṃ deti, cuṇṇadānaṃ deti,	313	
PA_tika-abh01_t:313_5	mattikādānaṃ deti, cāṭukakammaṃ karoti, muggasūpiyaṃ, pāribhaṭyaṃ, jaṅghapesaniyaṃ	313	
PA_tika-abh01_t:313_6	dvāvīsatimaṃ dūtakammena sadisaṃ, tasmā ekavīsati. Cha agocarā vesiyāgocaro, vidhavā,	313	
PA_tika-abh01_t:313_7	thullakumārī, paṇḍaka, pānāgāra, bhikkhunīagocaroti. Saṅkhepatoti sarūpena anuddiṭṭhattā	313	
PA_tika-abh01_t:313_8	“tattha katamo chando”tiādi na sakkā vattunti “yo chando chandikatā”tiādiniddesaṃ	313	
PA_tika-abh01_t:313_9	saṅkhipitvā “ye vā panā”ti niddeso katoti attho.	313	
PA_tika-abh01_t:314	Niddesavārakathāvaṇṇanā niṭṭhitā.	31	
PA_tika-abh01_t:315	Koṭṭhāsavāravaṇṇanā	31	
PA_tika-abh01_t:316_0	58-120. Niddesavāre pucchādīnaṃ paccekaṃ anekattepi pucchādibhāvena ekattaṃ upanetvā	316	
PA_tika-abh01_t:316_1	catuparicchedatā vuttā. Cattāro dveti evamādikaṃ saṅkhipitvā saha vā gahaṇaṃ saṅgaho.	316	
PA_tika-abh01_t:316_2	Ṭhapetvā yevāpanaketi saṅgahetabbe sandhāya vuttaṃ. Te hi visuṃ visuṃ uddiṭṭhattā	316	
PA_tika-abh01_t:316_3	niddiṭṭhattā ca vippakiṇṇāti saṅgahetabbā honti, na yevāpanakā saṅgahagamaneneva	316	
PA_tika-abh01_t:316_4	tathā avippakiṇṇattā. Yasmā pana saṅkhārakkhandhapariyāpannā honti, tasmā taṃniddese	316	
PA_tika-abh01_t:316_5	akhandhabhāvanivāraṇatthaṃ yevāpanātveva vuttāti na yevāpanakā ṭhapetabbāti. Paccayasaṅkhātenāti	316	
PA_tika-abh01_t:316_6	āhārapaccayasaṅkhātenāti vuttaṃ hoti. Atha vā “hetu paccayo”ti etesu dvīsu janako	316	
PA_tika-abh01_t:316_7	hetu upatthambhako paccayoti evaṃ visesavantesu paccayasaṅkhātena. Yathā hi kabaḷīkārāhāro	316	
PA_tika-abh01_t:316_8	ojaṭṭhamakarūpāharaṇena rūpakāyaṃ upatthambheti, evamimepi vedanādiāharaṇena nāmakāyanti.	316	
PA_tika-abh01_t:316_9	Tathā ca hontīti sādhāraṇe sahajātādipaccaye sandhāyāha. Aññathā cāti aññena ca ekenākārena	316	
PA_tika-abh01_t:316_10	paccayā hontiyevāti āhārāti vuccantīti attho. Tasmā āharaṇakiccarahitānaṃ hetuadhipatiādīnaṃ	3161	
PA_tika-abh01_t:316_11	natthi āhārabhāvappasaṅgo. Tisso ca vedanā āharatītiādi yathāsambhavavasena vuttaṃ,	3161	
PA_tika-abh01_t:316_12	na imasmiṃyeva citte phassādivasena. Tayo ca bhaveti kāmādibhavabhūtaṃ viññāṇaṃ visesena,	3161	
PA_tika-abh01_t:316_13	avisesena ca pañcupādānakkhandhe.	3161	
PA_tika-abh01_t:317_0	Ārammaṇaṃ upagantvā nijjhāyanaṃ cintanaṃ upanijjhāyanaṃ. Hetvaṭṭhenāti upāyatthena,	317	
PA_tika-abh01_t:317_1	na mūlatthena. Pubbabhāge gato paṭipanno nānākkhaṇiko aṭṭhaṅgiko maggo lokuttarakkhaṇeva	317	
PA_tika-abh01_t:317_2	saha pavatto yathāgatamaggoti vutto. Vipassanākkhaṇato pubbeva kāyakammādīnaṃ suparisuddhatāya	317	
PA_tika-abh01_t:317_3	aṭṭhaṅgikamaggupanissayassa “ariyo aṭṭhaṅgiko maggo bhāvanāpāripūriṃ gacchatī”ti	317	
PA_tika-abh01_t:317_4	evaṃ vuttena pariyāyena pubbabhāgamaggassa aṭṭhaṅgikatā yathāgatavacanena dīpitā,	317	
PA_tika-abh01_t:317_5	na ekakkhaṇe aṭṭhannaṃ aṅgānaṃ sabbhāvāti evamassapi pariyāyadesanatā veditabbā.	317	
PA_tika-abh01_t:317_6	Vijānanameva cittavicittatāti “cittavicittaṭṭhena ekova dhammo viññāṇakkhandho”ti	317	
PA_tika-abh01_t:317_7	āha. Cattāro khandhā hontītiādīsu vedanākkhandhādīnaṃ saṅgahe katepi puna “eko vedanākkhandho	317	
PA_tika-abh01_t:317_8	hotī”tiādivacanaṃ na aneke vedanākkhandhādayo jātiniddesena idha vuttāti dassanatthaṃ.	317	
PA_tika-abh01_t:317_9	Indriyesu ca ekassa jātiniddesabhāve paṭikkhitte aññesaṃ indriyānaṃ āhārādīnañca	317	
PA_tika-abh01_t:317_10	tappaṭikkhepo kato hotīti pubbaṅgamassa manindriyasseva katoti daṭṭhabbo.	3171	
PA_tika-abh01_t:318	Koṭṭhāsavāravaṇṇanā niṭṭhitā.	31	
PA_tika-abh01_t:319	Suññatavāravaṇṇanā	31	
PA_tika-abh01_t:320	121-145. Etthāti etasmiṃ yathāvutte samaye, etesu vā dhammesu. Bhāvoti satto, yo koci vā attho.	32	
PA_tika-abh01_t:321	Dutiyacittādivaṇṇanā	32	
PA_tika-abh01_t:322	146. Sappayogenāti līnassa cittassa ussāhanapayogasahitena. Saupāyenāti kusalassa karaṇākaraṇesu ādīnavānisaṃsapaccavekkhaṇaṃ parehi ussāhananti evamādiupāyasahitena.	32	
PA_tika-abh01_t:323	156-159. Mahāaṭṭhakathāyaṃ anuññātā nātisamāhitāya bhāvanāyāti yevāpanakehipi nibbisesataṃ dasseti.	32	
PA_tika-abh01_t:324	Puññakiriyavatthādikathāvaṇṇanā	32	
PA_tika-abh01_t:325_0	Apaciti eva apacitisahagataṃ puññakiriyāvatthu yathā “nandirāgasahagatā”ti. Apaciti	325	
PA_tika-abh01_t:325_1	vā cetanāsampayuttakadhammā kāyavacīkiriyā vā, taṃsahitā cetanā apacitisahagataṃ.	325	
PA_tika-abh01_t:325_2	Hitapharaṇenāti desake mettāpharaṇena, “evaṃ me hitaṃ bhavissatī”ti pavattena hitacittena	325	
PA_tika-abh01_t:325_3	vā. Kammassakatāñāṇaṃ diṭṭhijukammaṃ. Niyamalakkhaṇanti mahapphalatāniyamassa lakkhaṇaṃ.	325	
PA_tika-abh01_t:325_4	Sīlamaye saṅgahaṃ gacchanti cārittavasena. Anavajjavatthuṃ pariccajanto viya abbhanumodamānopi	325	
PA_tika-abh01_t:325_5	parassa sampattiyā modatīti abbhanumodanā dānamaye saṅgahitā. Bhāventopīti asamattabhāvanaṃ	325	
PA_tika-abh01_t:325_6	sandhāyāha. Samattā hi appanā hotīti. Aṭṭheva koṭṭhāse katvāti ekassa sattassa ekasmiṃ	325	
PA_tika-abh01_t:325_7	khaṇe uppannamekaṃ paṭhamacittaṃ dassetvā aññāni tādisāni adassentena sabbāni tāni	325	
PA_tika-abh01_t:325_8	sarikkhaṭṭhena ekīkatāni honti, tathā sesānipīti evaṃ aṭṭha katvā.	325	
PA_tika-abh01_t:326	Kāmāvacarakusalavaṇṇanā niṭṭhitā.	32	
PA_tika-abh01_t:327	Rūpāvacarakusalaṃ	32	
PA_tika-abh01_t:328	Catukkanayo	32	
PA_tika-abh01_t:329	Paṭhamajjhānakathāvaṇṇanā	32	
PA_tika-abh01_t:330_0	160. Uttarapadalopaṃ katvā rūpabhavo rūpanti vutto. Jhānassa amaggabhāvepi sati maggavacanaṃ	330	
PA_tika-abh01_t:330_1	aññamaggabhāvanivāraṇatthanti imasmiṃ atthe maggaggahaṇassa payojanaṃ vuttaṃ, na	330	
PA_tika-abh01_t:330_2	sabbassa kusalajjhānassa maggabhāvoti. Tattha maggassa bhāvanāya samayavavatthānassa	330	
PA_tika-abh01_t:330_3	katattā amaggabhāvanāsamaye pavattānaṃ phassādīnaṃ kusalabhāvo na dassito siyā, tasmā	330	
PA_tika-abh01_t:330_4	sabbassa maggabhāvo dassetabboti. Ito añño maggo natthīti evaṃ aññabhūmikavidhuro	330	
PA_tika-abh01_t:330_5	sati paccayantare rūpūpapattijanakasabhāvo vipākadhammasabhāvo viya vipākadhammavasena	330	
PA_tika-abh01_t:330_6	sabbasamāno maggasaddena vuttoti dassetīti veditabbaṃ. Kusalaṃ dānanti alobho daṭṭhabbo.	330	
PA_tika-abh01_t:330_7	Atha vā cetanā dānaṃ, taṃ vajjetvā itare dve cetanāsampayuttakāti vuttā. Vaṭṭantīti	330	
PA_tika-abh01_t:330_8	maggabhāvato jhānavacanena saṅgahetvā maggoti vattuṃ vaṭṭantīti attho. Okappanāti	330	
PA_tika-abh01_t:330_9	saddahanā. Aññattha diṭṭhaṃ atthaṃ pariccajitvā “janeti vaḍḍhetī”ti ayamattho kasmā	330	
PA_tika-abh01_t:330_10	vuttoti nirupasaggassa aññattha evamatthasseva diṭṭhattāti imamatthaṃ vibhāvetuṃ	3301	
PA_tika-abh01_t:330_11	“puna caparaṃ udāyī”ti suttamāhaṭaṃ. Kesañci ariyānaṃ ariyamaggena siddhāni aññāni	3301	
PA_tika-abh01_t:330_12	ca jhānāni bhāvanāsabhāvānevāti tesupi bhāventena samayavavatthānaṃ ijjhatīti.	3301	
PA_tika-abh01_t:331_0	Nissaranti niggacchanti etena, ettha vāti nissaraṇaṃ. Ke niggacchanti? Kāmā. Tesaṃ	331	
PA_tika-abh01_t:331_1	kāmānaṃ nissaraṇaṃ pahānanti attho. Evañhi “kāmāna”nti kattari sāmivacanaṃ yujjati.	331	
PA_tika-abh01_t:331_2	Vatthukāmehipīti vatthukāmehi viviccevātipi attho yujjatīti evaṃ yujjamānatthantarasamuccayattho	331	
PA_tika-abh01_t:331_3	pi-saddo, na kilesakāmasamuccayattho. Kasmā? Imasmiṃ atthe kilesakāmānaṃ dutiyapadena	331	
PA_tika-abh01_t:331_4	vivekassa vuttattā. Akusalasaddena yadipi kilesakāmā, athāpi sabbākusalā gahitā,	331	
PA_tika-abh01_t:331_5	sabbathā pana kilesakāmehi viveko vuttoti āha “dutiyena kilesakāmehi vivekavacanato”ti.	331	
PA_tika-abh01_t:331_6	Kāmaguṇādhigamahetupi pāṇātipātādiasuddhappayogo hotīti tabbivekena payogasuddhi	331	
PA_tika-abh01_t:331_7	vibhāvitā. Taṇhāsaṃkilesasodhanena āsayaposanaṃ.	331	
PA_tika-abh01_t:332_0	Aññesampi cāti diṭṭhimānādīnaṃ phassādīnañca. Upari vuccamānāni jhānaṅgāni uparijjhānaṅgāni,	332	
PA_tika-abh01_t:332_1	tesaṃ attano vipaccanīkānaṃ paṭipakkhabhāvadassanatthaṃ tappaccanīkanīvaraṇavacanaṃ.	332	
PA_tika-abh01_t:332_2	Byāpādavivekavacanena “anatthaṃ me acarī”tiādiāghātavatthubhedavisayassa dosassa	332	
PA_tika-abh01_t:332_3	mohādhikānaṃ thinamiddhādīnaṃ vivekavacanena paṭicchādanavasena dukkhādipubbantādibhedavisayassa	332	
PA_tika-abh01_t:332_4	mohassa vikkhambhanaviveko vutto. Kāmarāgabyāpādatadekaṭṭhathinamiddhādivikkhambhanakañcedaṃ	332	
PA_tika-abh01_t:332_5	sabbākusalapaṭipakkhasabhāvattā sabbakusalānaṃ tena sabhāvena sabbākusalānaṃ pahānaṃ	332	
PA_tika-abh01_t:332_6	hontampi kāmarāgādivikkhambhanasabhāvamevāti taṃsabhāvattā avisesetvā nīvaraṇākusalamūlādīnaṃ	332	
PA_tika-abh01_t:332_7	vikkhambhanaviveko vutto hotīti āha.	332	
PA_tika-abh01_t:333_0	Vitakkassa kiccavisesena thirabhāvappatte paṭhamajjhānasamādhimhi paccanīkadūrībhāvakatena	333	
PA_tika-abh01_t:333_1	thirabhāvena taṃsadisesu vitakkarahitesu dutiyajjhānādisamādhīsu ca appanāti aṭṭhakathāvohāroti	333	
PA_tika-abh01_t:333_2	vitakkassa appanāyogo vutto, aññathā vitakkova appanāti tassa taṃsampayogo na siyāti.	333	
PA_tika-abh01_t:333_3	Attho…pe… daṭṭhabbo jhānasamaṅgino vitakkavicārasamaṅgitādassanena jhānasseva savitakkasavicārabhāvassa vuttattā.	333	
PA_tika-abh01_t:334_0	Vivekajaṃ pītisukhanti ettha purimasmiṃ atthe vivekajanti jhānaṃ. Pītisukhasaddato	334	
PA_tika-abh01_t:334_1	ca atthiatthavisesavato assa, asmiṃ vāti ettha a-kāro vutto. Dutiye pītisukhameva	334	
PA_tika-abh01_t:334_2	vivekajaṃ. Vivekajaṃpītisukhanti ca aññapadatthe samāso paccattaniddesassa ca alopo	334	
PA_tika-abh01_t:334_3	kato, lope vā sati “vivekajapītisukha”nti pāṭhoti ayaṃ viseso. Gaṇanānupubbatāti	334	
PA_tika-abh01_t:334_4	gaṇanānupubbatāya, gaṇanānupubbatāmattaṃ vā paṭhamanti vacananti attho. Niccādivipallāsappahānena	334	
PA_tika-abh01_t:334_5	maggo asammohato aniccādilakkhaṇāni paṭivijjhatīti lakkhaṇūpanijjhānaṃ. Asammosadhammaṃ	334	
PA_tika-abh01_t:334_6	nibbānaṃ aviparītalakkhaṇattā anaññathābhāvato tathalakkhaṇaṃ.	334	
PA_tika-abh01_t:335	Dutiyajjhānakathāvaṇṇanā	33	
PA_tika-abh01_t:336_0	161-2. Vitakkavicārānaṃ vūpasamāti etena yehi vitakkavicārehi paṭhamajjhānassa oḷārikatā,	336	
PA_tika-abh01_t:336_1	tesaṃ samatikkamā dutiyajjhānassa samadhigamo, na sabhāvato anoḷārikānaṃ phassādīnaṃ	336	
PA_tika-abh01_t:336_2	samatikkamāti ayamattho dīpito hoti. Evaṃ “pītiyā ca virāgā”tiādīsu nayo. Tasmā vitakkavicārapītisukhasamatikkamavacanāni	336	
PA_tika-abh01_t:336_3	oḷārikoḷārikaṅgasamatikkamā dutiyādiadhigamaparidīpakānīti tesaṃ ekadesabhūtaṃ vitakkavicārasamatikkamavacanaṃ	336	
PA_tika-abh01_t:336_4	taṃdīpakanti vuttaṃ. Atha vā vitakkavicāravūpasamavacaneneva taṃsamatikkamā dutiyādhigamadīpakena	336	
PA_tika-abh01_t:336_5	pītivirāgādivacanānaṃ pītiyādisamatikkamā tatiyādiadhigamadīpakatā hotīti tassa taṃdīpakatā vuttā.	336	
PA_tika-abh01_t:337_0	Nīlavaṇṇayogato nīlavatthaṃ viyāti nīlayogato vatthaṃ nīlaṃ viyāti adhippāyo. Yena	337	
PA_tika-abh01_t:337_1	sampasādanena yogā jhānaṃ sampasādanaṃ, tasmiṃ dassite “sampasādanaṃ jhāna”nti samānādhikaraṇaniddeseneva	337	
PA_tika-abh01_t:337_2	taṃyogā jhāne taṃsaddappavatti dassitāti avirodho yutto. Ekodibhāve kathanti ekodimhi	337	
PA_tika-abh01_t:337_3	dassite “ekodibhāvaṃ jhāna”nti samānādhikaraṇaniddeseneva jhānassa ekodivaḍḍhanatā	337	
PA_tika-abh01_t:337_4	vuttā hotīti. Ekodibhāvanti panidaṃ uddharitvā ekodissa niddeso na kattabbo siyāti	337	
PA_tika-abh01_t:337_5	ekodibhāvasaddo eva samādhimhi pavatto sampasādanasaddo viya jhānamhi pavattatīti yuttaṃ.	337	
PA_tika-abh01_t:338_0	Appitāti gamitā vināsaṃ. Dutiyajjhānādiadhigamupāyadīpakena ajjhattasampasādanatāya	338	
PA_tika-abh01_t:338_1	cetaso ekodibhāvatāya ca hetudīpakena avitakkāvicārabhāvahetudīpakena ca vitakkavicāravūpasamavacaneneva	338	
PA_tika-abh01_t:338_2	vitakkavicārābhāvo dīpitoti kiṃ puna avitakkaavicāravacanena katenāti? Na, adīpitattā.	338	
PA_tika-abh01_t:338_3	Na hi vitakkavicāravūpasamavacanena vitakkavicārānaṃ appavatti vuttā hoti. Vitakkavicāresu	338	
PA_tika-abh01_t:338_4	hi taṇhāpahānañca etesaṃ vūpasamanaṃ. Ye ca saṅkhāresu taṇhāpahānaṃ karonti, tesu	338	
PA_tika-abh01_t:338_5	maggesu pahīnataṇhesu phalesu ca saṅkhārappavatti hoti, evamidhāpi vikkhambhitavitakkavicārataṇhassa	338	
PA_tika-abh01_t:338_6	dutiyajjhānassa vitakkavicārasampayogo purimena na nivārito siyāti taṃnivāraṇatthaṃ	338	
PA_tika-abh01_t:338_7	āvajjitukāmatādiatikkamova tesaṃ vūpasamoti dassanatthañca “avitakkaṃ avicāra”nti vuttaṃ.	338	
PA_tika-abh01_t:339	Tatiyajjhānakathāvaṇṇanā	33	
PA_tika-abh01_t:340_0	163. Parisuddhapakati khīṇāsavapakati nikkilesatā. Upekkhānimittanti ettha līnuddhaccapakkhapātarahitaṃ	340	
PA_tika-abh01_t:340_1	majjhattaṃ vīriyaṃ “upekkhā”ti vuttaṃ, tadeva taṃ ākāraṃ gahetvā pavattetabbassa	340	
PA_tika-abh01_t:340_2	tādisassa vīriyassa nimittabhāvato upekkhānimittaṃ. Paṭhamajjhānappaṭilābhatthāya	340	
PA_tika-abh01_t:340_3	nīvaraṇe…pe… nevasaññānāsaññāyatanasamāpattipaṭilābhatthāya ākiñcaññāyatanasaññaṃ	340	
PA_tika-abh01_t:340_4	paṭisaṅkhāsantiṭṭhanāpaññāsaṅkhārupekkhāsu ñāṇanti imā aṭṭha samāpattivasena uppajjanti.	340	
PA_tika-abh01_t:340_5	Sotāpattimaggapaṭilābhatthāya uppādaṃ pavattaṃ nimittaṃ āyūhanaṃ paṭisandhiṃ gatiṃ	340	
PA_tika-abh01_t:340_6	nibbattiṃ upapattiṃ jātiṃ jarāmaraṇasokaparidevadukkhadomanassaupāyāse. Sotāpattiphalasamāpattatthāya	340	
PA_tika-abh01_t:340_7	uppādaṃ…pe… upāyāse…pe… arahattamaggapaṭilābhatthāya uppādaṃ…pe… upāyāse. Arahattaphalasamāpattatthāya…pe…	340	
PA_tika-abh01_t:340_8	suññatavihārasamāpattatthāya…pe… animittavihārasamāpattatthāya uppādaṃ pavattaṃ āyūhanaṃ	340	
PA_tika-abh01_t:340_9	paṭisandhiṃ…pe… paṭisaṅkhāsantiṭṭhanā paññā saṅkhārupekkhāsu ñāṇanti imā dasa vipassanāvasena uppajjanti.	340	
PA_tika-abh01_t:341_0	Yadatthi yaṃ bhūtanti khandhapañcakaṃ, taṃ muñcitukamyatāñāṇena pajahati. Diṭṭhasovatthikattayassa	341	
PA_tika-abh01_t:341_1	sappalakkhaṇavicinane viya diṭṭhalakkhaṇattayassa bhūtassa saṅkhāralakkhaṇavicinane	341	
PA_tika-abh01_t:341_2	upekkhaṃ paṭilabhati. Anābhogarasāti paṇītasukhepi tasmiṃ avanati paṭipakkhakiccāti	341	
PA_tika-abh01_t:341_3	attho. Nāmakāyena cetasikasukhaṃ kāyikasukhahetu rūpasamuṭṭhāpanena kāyikasukhañca	341	
PA_tika-abh01_t:341_4	jhānasamaṅgī paṭisaṃvedetīti vuccati. Phuṭattā byāpitattā. Yathā hi udakena phuṭasarīrassa	341	
PA_tika-abh01_t:341_5	tādise nātipaccanīke vātādike phoṭṭhabbe phuṭṭhe sukhaṃ uppajjati, evaṃ etehi phuṭasarīrassapi.	341	
PA_tika-abh01_t:342	Catutthajjhānakathāvaṇṇanā	34	
PA_tika-abh01_t:343	165. Avibhūtapaccupaṭṭhānāti sukhadukkhāni viya avibhūtākārā piṭṭhipāsāṇagatamigamaggo viya tadanumātabbāvibhūtākāropaṭṭhānā.	34	
PA_tika-abh01_t:344	Catukkanayavaṇṇanā niṭṭhitā.	34	
PA_tika-abh01_t:345	Pañcakanayavaṇṇanā	34	
PA_tika-abh01_t:346_0	167. Yassā pana dhammadhātuyāti sabbaññutaññāṇassa. Tena hi dhammānaṃ ākārabhedaṃ	346	
PA_tika-abh01_t:346_1	ñatvā tadanurūpaṃ desanaṃ niyāmetīti. Ettha ca pañcakanaye dutiyajjhānaṃ catukkanaye	346	
PA_tika-abh01_t:346_2	dutiyajjhānapakkhikaṃ katvā vibhattaṃ “yasmiṃ…pe… maggaṃ bhāveti avitakkaṃ vicāramattaṃ	346	
PA_tika-abh01_t:346_3	samādhijaṃ pītisukhaṃ dutiyajjhānaṃ upasampajja viharatī”ti. Kasmā? Ekattakāyanānattasaññīsattāvāsaphalatāya	346	
PA_tika-abh01_t:346_4	dutiyajjhānena samānaphalattā paṭhamajjhānasamādhito jātattā ca. Paṭhamajjhānameva	346	
PA_tika-abh01_t:346_5	hi kāmehi akusalehi ca vivittanti tadabhāvā na idha “vivicceva kāmehi vivicca akusalehī”ti	346	
PA_tika-abh01_t:346_6	sakkā vattuṃ, nāpi “vivekaja”nti. Suttantadesanāsu ca pañcakanaye dutiyatatiyajjhānāni	346	
PA_tika-abh01_t:346_7	dutiyajjhānameva bhajanti vitakkavūpasamā vicāravūpasamā avitakkattā avicārattā cāti.	346	
PA_tika-abh01_t:347	Paṭipadācatukkavaṇṇanā	34	
PA_tika-abh01_t:348_0	176-180. Tassa tassa jhānassa upacāranti nīvaraṇavitakkavicāranikantiyādīnaṃ vūpasamā	348	
