segmentnr	original	folio	analyzed
PA_tika-abh01_t:545_3	ācayena taṃpakatikāni āyatanāni kathitāni. Lakkhaṇañhi uppādo, na rūparūpanti. Tenevādhippāyenāha	545	
PA_tika-abh01_t:545_4	“āyatanameva kathita”nti. Ācayañhi lakkhaṇaṃ kathayantena taṃlakkhaṇāni āyatanāneva	545	
PA_tika-abh01_t:545_5	kathitāni hontīti. Evampi kiṃ kathitaṃ hotīti āyatanācayehi ācayāyatanehi ācayameva	545	
PA_tika-abh01_t:545_6	āyatanameva kathentena uddese niddese ca ācayoti idameva avatvā upacayasantatiyo	545	
PA_tika-abh01_t:545_7	uddisitvā tesaṃ vibhajanavasena āyatanena ācayakathanādinā kiṃ kathitaṃ hotīti adhippāyo.	545	
PA_tika-abh01_t:545_8	Ācayoti upacayamāha, upacayoti ca santatiṃ. Tadevubhayaṃ yathākkamaṃ vivaranto “nibbatti	545	
PA_tika-abh01_t:545_9	vaḍḍhi kathitā”ti āha. Upacayasantatiyo hi atthato ekattā ācayovāti taduddesavibhajanavasena	545	
PA_tika-abh01_t:545_10	āyatanena ācayakathanādinā nibbattivaḍḍhiākāranānattaṃ ācayassa kathitanti attho.	5451	
PA_tika-abh01_t:545_11	Imamevatthaṃ vibhāvetuṃ “atthato hī”tiādimāha. Yasmā ca ubhayampi etaṃ jātirūpassevādhivacanaṃ,	5451	
PA_tika-abh01_t:545_12	tasmā jātirūpassa lakkhaṇādivisesesu ācayādīsu pavattiādīsu ca ācayādilakkhaṇādiko	5451	
PA_tika-abh01_t:545_13	upacayo, pavattiādilakkhaṇādikā santatīti veditabbāti attho.	5451	
PA_tika-abh01_t:546_0	643. Pakatiniddesāti phalavipaccanapakatiyā niddesā, jarāya pāpuṇitabbaṃ phalameva	546	
PA_tika-abh01_t:546_1	vā pakati. Na ca khaṇḍiccādīneva jarāti kalalakālato pabhuti purimarūpānaṃ jarāpattakkhaṇe	546	
PA_tika-abh01_t:546_2	uppajjamānāni pacchimarūpāni paripakkarūpānurūpāni pariṇatapariṇatāni uppajjantīti	546	
PA_tika-abh01_t:546_3	anukkamena supariṇatarūpaparipākakāle uppajjamānāni khaṇḍiccādisabhāvāni uppajjanti.	546	
PA_tika-abh01_t:546_4	Tāni udakādimaggesu tiṇarukkhasaṃbhaggatādayo viya paripākagatamaggasaṅkhātesu paripakkarūpesu	546	
PA_tika-abh01_t:546_5	uppannāni jarāya gatamaggoicceva vuttāni, na jarāti. Aviññāyamānantarajarā avīcijarā.	546	
PA_tika-abh01_t:546_6	Maraṇe upanayanarasā.	546	
PA_tika-abh01_t:547_0	644. Taṃ patvāti taṃ attano eva khayavayasaṅkhātaṃ sabhāvaṃ patvā rūpaṃ khīyati veti	547	
PA_tika-abh01_t:547_1	bhijjati. Pothetvā pātitassa dubbalatā parādhīnatā sayanaparāyaṇatā ca hoti, tathā	547	
PA_tika-abh01_t:547_2	jarābhibhūtassāti pothakasadisī jarā.	547	
PA_tika-abh01_t:548_0	645. Kattabbatoti kattabbasabhāvato. Visāṇādīnaṃ taracchakheḷatemitānaṃ pāsāṇānaṃ	548	
PA_tika-abh01_t:548_1	viya thaddhabhāvābhāvato ahivicchikānaṃ viya savisattābhāvato ca sukhumatā vuttā.	548	
PA_tika-abh01_t:548_2	Ojālakkhaṇoti ettha aṅgamaṅgānusārino rasassa sāro upatthambhabalakāro bhūtanissito eko viseso ojāti.	548	
PA_tika-abh01_t:549	Upādābhājanīyakathāvaṇṇanā niṭṭhitā.	54	
PA_tika-abh01_t:550	Noupādābhājanīyakathāvaṇṇanā	55	
PA_tika-abh01_t:551	646. Na upādiyatevāti na nissayati eva, kintu nissayati ca nissīyati cāti attho.	55	
PA_tika-abh01_t:552_0	647. Purimā panāti pañcavidhasaṅgahe pathavīdhātuāpodhātutejodhātuvāyodhātūnaṃ purimuddesavasena	552	
PA_tika-abh01_t:552_1	vuttaṃ. Phoṭṭhabbāyatananiddese vā vuttānaṃ pathavīdhātuādīnaṃ purimā uddese vuttā	552	
PA_tika-abh01_t:552_2	āpodhātūti adhippāyo, vuttassa vā phoṭṭhabbāyatanassa atītatāya pacchimatā, anāgatatāya	552	
PA_tika-abh01_t:552_3	ca āpodhātuyā purimatā vuttāti daṭṭhabbā. Āyūti jīvitindriyaṃ. Kammajatejaṃ usmā.	552	
PA_tika-abh01_t:552_4	Yaṃ kiñci dhātuṃ…pe… ekappahārena nuppajjatīti ekasmiṃ khaṇe anekāsu pathavīsu āpāthagatāsu	552	
PA_tika-abh01_t:552_5	tāsu tāsu saha nuppajjati, tathā tejavāyūsu cāti attho. Anekesu ārammaṇesu sannipatitesu	552	
PA_tika-abh01_t:552_6	ābhujitavasena ārammaṇapasādādhimattatāvasena ca paṭhamaṃ katthaci uppatti dassitā,	552	
PA_tika-abh01_t:552_7	aññattha ca pana uppatti atthi eva. Sāyaṃ ārammaṇato ārammaṇantarasaṅkanti yena upāyena	552	
PA_tika-abh01_t:552_8	hoti, tassa vijānanatthaṃ pucchati “kathaṃ pana cittassa ārammaṇato saṅkanti hotī”ti.	552	
PA_tika-abh01_t:553_0	651. Ayapiṇḍiādīsu pathavīdhātu tādisāya āpodhātuyā anābaddhā santī visareyya, tasmā	553	
PA_tika-abh01_t:553_1	“tāni āpodhātu ābandhitvā baddhāni karotī”ti vuttaṃ. Yathā hi yuttappamāṇaṃ udakaṃ	553	
PA_tika-abh01_t:553_2	paṃsucuṇṇāni ābandhitvā mattikāpiṇḍaṃ katvā ṭhapeti, evaṃ ayopiṇḍiādīsupi tadanurūpapaccayehi	553	
PA_tika-abh01_t:553_3	tattheva uppannā āpodhātu tathā ābandhitvā ṭhapetīti daṭṭhabbā.	553	
PA_tika-abh01_t:554_0	Aphusitvā patiṭṭhā hotīti āpodhātuyā aphoṭṭhabbabhāvato vuttaṃ, tathā “aphusitvāva	554	
PA_tika-abh01_t:554_1	ābandhatī”ti. Na hi yathā phoṭṭhabbadhātūnaṃ phoṭṭhabbabhāvena aññamaññanissayatā,	554	
PA_tika-abh01_t:554_2	evaṃ phoṭṭhabbāphoṭṭhabbadhātūnaṃ hotīti adhippāyo veditabbo. Avinibbhogavuttīsu	554	
PA_tika-abh01_t:554_3	hi bhūtesu aññamaññanissayatā aññamaññapaccayabhūtesu na sakkā nivāretuṃ, nāpi sahajātesu	554	
PA_tika-abh01_t:554_4	avinibbhogatāya ekībhūtesu phusanāphusanāni vicāretuṃ yuttānīti. Na uṇhā hutvā jhāyatīti	554	
PA_tika-abh01_t:554_5	tejosabhāvataṃyeva paṭikkhipati, na sītattaṃ anujānāti, tejosabhāvapaṭikkhepeneva	554	
PA_tika-abh01_t:554_6	ca sītattañca paṭikkhittaṃ hoti. Tejo eva hi sītaṃ himapātasamayādīsu sītassa paripācakatādassanato,	554	
PA_tika-abh01_t:554_7	sītuṇhānañca aññamaññapaṭipakkhabhāvato uṇhena saha na sītaṃ bhūtantaraṃ pavattatīti	554	
PA_tika-abh01_t:554_8	yujjati. Uṇhakalāpe pana sītassa appavatti sītakalāpe ca uṇhassa dvinnaṃ aññamaññapaṭipakkhattā	554	
PA_tika-abh01_t:554_9	tejovisesabhāve yujjatīti. Bhāvaññathattanti kharānaṃ guḷādīnaṃ davatā mudutā rasādīnañca	554	
PA_tika-abh01_t:554_10	davānaṃ kharatā paccayavisesehi omattādhimattapathavīdhātuādikānaṃ uppatti. Lakkhaṇaññathattaṃ	5541	
PA_tika-abh01_t:554_11	kakkhaḷādilakkhaṇavijahanaṃ, taṃ etesaṃ na hoti, omattādhimattatāsaṅkhātaṃ bhāvaññathattaṃyeva hotīti attho.	5541	
PA_tika-abh01_t:555_0	652. Anupādinnādīnaṃyevāti ekantaanupādinnaekantanacittasamuṭṭhānādīnaṃ niddesesu	555	
PA_tika-abh01_t:555_1	gahaṇesu gahitāti attho. Yaṃ vā panaññampīti pana vacanena purimānampi nakammassakatattābhāvādikaṃ	555	
PA_tika-abh01_t:555_2	dīpeti. Tā hi anupādinnādinakammassakatattādivacanānaṃ samānatthattā ekena avattabbatte	555	
PA_tika-abh01_t:555_3	itarenapi avattabbā siyuṃ, vattabbatte vā vattabbā. Tasmā ekantākammajādīsveva gahetabbattā	555	
PA_tika-abh01_t:555_4	tā anekantesu na gahitāti daṭṭhabbā.	555	
PA_tika-abh01_t:556	666. Ekanta …pe… paññāyati tesaṃ vikārattā, anipphannattā pana tassa uppādo na kenaci sakkā vattunti adhippāyo.	55	
PA_tika-abh01_t:557	Dukaniddesavaṇṇanā niṭṭhitā.	55	
PA_tika-abh01_t:558	Catukkaniddesavaṇṇanā	55	
PA_tika-abh01_t:559_0	966. Pacchimapadassāti viññātapadassa. Sabbameva hi rūpaṃ viññātanti tassa abhinditabbattā	559	
PA_tika-abh01_t:559_1	viññātato aññaṃ diṭṭhaṃ sutaṃ mutañca na hotīti pucchaṃ akatvāva vissajjitaṃ. Na	559	
PA_tika-abh01_t:559_2	hi sakkā viññātato aññaṃ “katamaṃ rūpaṃ diṭṭha”nti pucchitunti adhippāyo. Yathā hi	559	
PA_tika-abh01_t:559_3	dvīsu uddiṭṭhesu nopādato aññattaṃ sandhāya “katamaṃ taṃ rūpaṃ upādā”ti pucchitaṃ,	559	
PA_tika-abh01_t:559_4	evaṃ diṭṭhādīsu catūsu uddiṭṭhesu sutādīhi tīhipi aññattaṃ sandhāya “katamaṃ taṃ	559	
PA_tika-abh01_t:559_5	rūpaṃ diṭṭha”nti pucchitabbaṃ siyā, tadabhāvo na pucchitaṃ, evaṃ sutādīsupīti. Dassanādiggahaṇavisesato	559	
PA_tika-abh01_t:559_6	pana diṭṭhādīhi aññassa viññātassa sabbhāvato ca catukko vutto.	559	
PA_tika-abh01_t:560	Pañcakaniddesavaṇṇanā	56	
PA_tika-abh01_t:561_0	969. Tejobhāvaṃ gatanti sabhāveneva tejobhāvaṃ pattanti attho. Vuttassapi aññena	561	
PA_tika-abh01_t:561_1	pakārena saṅgahārahassa saṅgaṇhanaṃ nayakaraṇaṃ idha daṭṭhabbaṃ, tayidaṃ “viññāta”nti	561	
PA_tika-abh01_t:561_2	catukkapadepi yojetabbaṃ. Phoṭṭhabbassa bhedasabbhāvo aṭṭhake nayo.	561	
PA_tika-abh01_t:562	Pakiṇṇakakathāvaṇṇanā	56	
PA_tika-abh01_t:563_0	975. Natthi nīvaraṇāti vacanena middhassapi nīvaraṇassa pahānaṃ vuttaṃ, na ca rūpaṃ	563	
PA_tika-abh01_t:563_1	pahātabbaṃ, na ca rūpakāyagelaññaṃ munino natthīti sakkā vattuṃ “piṭṭhi me āgilāyati,	563	
PA_tika-abh01_t:563_2	tamahaṃ āyamissāmī”ti vacanato. Saviññāṇakasaddoti viññāṇena pavattito vacīghosādisaddo.	563	
PA_tika-abh01_t:563_3	Na hi etāni jāyantīti paripaccamānassa rūpassa paripaccanaṃ jarā, khīyamānassa khayo	563	
PA_tika-abh01_t:563_4	aniccatāti rūpabhāvamattāni etāni, na sayaṃ sabhāvavantānīti sandhāya vuttaṃ. Tathā	563	
PA_tika-abh01_t:563_5	jāyamānassa jananaṃ jāti, sā ca rūpabhāvova, na sayaṃ sabhāvavatīti “na pana paramatthato	563	
PA_tika-abh01_t:563_6	jāti jāyatī”ti vuttaṃ.	563	
PA_tika-abh01_t:564_0	Tesaṃ paccayo etissāti tappaccayā, tappaccayāya bhāvo tappaccayabhāvo, tappaccayabhāvena	564	
PA_tika-abh01_t:564_1	pavatto vohāro tappaccayabhāvavohāro, taṃ labhati. Abhinibbattitadhammakkhaṇasminti	564	
PA_tika-abh01_t:564_2	abhinibbattiyamānadhammakkhaṇasminti adhippāyo. Na hi tadā te dhammā na jāyantīti	564	
PA_tika-abh01_t:564_3	jāyamānabhāvova jātīti yuttā tassā kammādisamuṭṭhānatā taṃnibbattatā ca, na pana	564	
PA_tika-abh01_t:564_4	tadā te dhammā jīyanti khīyanti ca, tasmā na tesaṃ te jīraṇabhijjanabhāvā cittādisamuṭṭhānā	564	
PA_tika-abh01_t:564_5	taṃnibbattā cāti vacanaṃ arahanti. Evamapi upādinna-saddo upetena kammunā ādinnataṃ	564	
PA_tika-abh01_t:564_6	vadati, na nibbattinti upādinnapākabhedānaṃ upādinnatā tesaṃ vattabbāti ce? Na, ādinna-saddassa	564	
PA_tika-abh01_t:564_7	nibbattivācakattā. Upetena nibbattañhi upādinnanti paccayānubhāvakkhaṇañca nibbattiñca	564	
PA_tika-abh01_t:564_8	gahetvāva pavatto ayaṃ vohāro tadā abhāvā jarāmaraṇe na pavattatīti. Paṭiccasamuppannānaṃ	564	
PA_tika-abh01_t:564_9	dhammānaṃ jarāmaraṇattā tesaṃ uppāde sati jarāmaraṇaṃ hoti, asati na hoti. Na hi	564	
PA_tika-abh01_t:564_10	ajātaṃ paripaccati bhijjati vā, tasmā jātipaccayataṃ sandhāya “jarāmaraṇaṃ paṭiccasamuppanna”nti vuttaṃ.	5641	
PA_tika-abh01_t:565_0	Nissayapaṭibaddhavuttitoti jāyamānaparipaccamānabhijjamānānaṃ jāyamānādibhāvamattattā	565	
PA_tika-abh01_t:565_1	jāyamānādinissayapaṭibaddhavuttikā jātiādayoti vuttaṃ hoti. Yadi evaṃ upādāyarūpānañca	565	
PA_tika-abh01_t:565_2	cakkhāyatanādīnaṃ uppādādisabhāvabhūtā jātiādayo taṃnissitā hontīti bhūtanissitānaṃ	565	
PA_tika-abh01_t:565_3	tesaṃ lakkhaṇānaṃ upādāyabhāvo viya upādāyarūpanissitānaṃ upādāyupādāyabhāvo āpajjatīti	565	
PA_tika-abh01_t:565_4	ce? Na, bhūtapaṭibaddhaupādāyarūpalakkhaṇānañca bhūtapaṭibaddhabhāvassa avinivattanato.	565	
PA_tika-abh01_t:565_5	Apica ekakalāpapariyāpannānaṃ rūpānaṃ saheva uppādādippavattito ekassa kalāpassa	565	
PA_tika-abh01_t:565_6	uppādādayo ekekāva hontīti yathā ekekassa kalāpassa jīvitindriyaṃ kalāpānupālakaṃ	565	
PA_tika-abh01_t:565_7	“upādāyarūpa”nti vuccati, evaṃ kalāpuppādādisabhāvā jātiādayo “upādāyarūpāni”cceva	565	
PA_tika-abh01_t:565_8	vuccanti. Evaṃ vikāraparicchedarūpāni ca yojetabbāni.	565	
PA_tika-abh01_t:566_0	Kammasamuṭṭhānasambandhaṃ utusamuṭṭhānaṃ kammavisesena suvaṇṇadubbaṇṇasusaṇṭhitadussaṇṭhitādivisesaṃ	566	
PA_tika-abh01_t:566_1	hotīti “kammapaccaya”nti vuttaṃ. Kammavipākānubhavanassa kāraṇabhūtaṃ bāhirautusamuṭṭhānaṃ	566	
PA_tika-abh01_t:566_2	kammapaccayautusamuṭṭhānaṃ. Kammasahāyo paccayo, kammassa vā sahāyabhūto paccayo	566	
PA_tika-abh01_t:566_3	kammapaccayo, sova utu kammapaccayautu, so samuṭṭhānaṃ etassāti kammapaccayautusamuṭṭhānanti	566	
PA_tika-abh01_t:566_4	vacanattho. Sīte uṇhe vā kismiñci utumhi samāgate tato suddhaṭṭhakaṃ uppajjati, tassa	566	
PA_tika-abh01_t:566_5	so utu samuṭṭhānaṃ. Dutiyassa suddhaṭṭhakassa utusamuṭṭhānikapaṭibandhakassa so eva	566	
PA_tika-abh01_t:566_6	purimo utu paccayo. Tatiyaṃ pana suddhaṭṭhakaṃ purimautusahāyena utunā nibbattattā	566	
PA_tika-abh01_t:566_7	pubbe vuttanayeneva “utupaccayautusamuṭṭhāna”nti vuttaṃ. Evamayaṃ purimo utu tisso	566	
PA_tika-abh01_t:566_8	santatiyo ghaṭṭeti, tato paraṃ aññautusamāgame aññasantatittayaṃ, tato ca aññena	566	
PA_tika-abh01_t:566_9	aññanti evaṃ pavatti daṭṭhabbā. Tadetaṃ sītuṇhānaṃ appabahubhāve taṃsamphassassa	566	
PA_tika-abh01_t:566_10	acirappavattiyā cirappavattiyā ca veditabbaṃ, anupādinnena dīpanā na santatittayavasena,	5661	
PA_tika-abh01_t:566_11	atha kho meghasamuṭṭhāpakamūlautuvasena pakārantarena daṭṭhabbā, taṃ dassetuṃ “utusamuṭṭhāno	5661	
PA_tika-abh01_t:566_12	nāma valāhako”tiādimāha. Rūparūpānaṃ vikārādimattabhāvato aparinipphannatā vuttā.	5661	
PA_tika-abh01_t:566_13	Tesañhi rūpavikārādibhāvato rūpatāti adhippāyo. Rūpavikārādibhāvato eva pana rūpe	5661	
PA_tika-abh01_t:566_14	sati santi, asati na santīti asaṅkhatabhāvanivāraṇatthaṃ parinipphannatā vuttāti.	5661	
PA_tika-abh01_t:567	Rūpakaṇḍavaṇṇanā niṭṭhitā.	56	
PA_tika-abh01_t:568	3. Nikkhepakaṇḍaṃ	56	
PA_tika-abh01_t:569	Tikanikkhepakathāvaṇṇanā	56	
PA_tika-abh01_t:570_0	985. Sabbesanti cittuppādavasena rūpāsaṅkhatavasena ca bhinnānaṃ sabbesaṃ phassādicakkhādipadabhājananayena	570	
PA_tika-abh01_t:570_1	vitthārito. Tattha pana asaṅkhatassa bhedābhāvato asaṅkhatā dhātūtveva padabhājanaṃ	570	
PA_tika-abh01_t:570_2	daṭṭhabbaṃ. Yevāpanakānaṃ pana sukhumupādāyarūpassa ca indriyavikāraparicchedalakkhaṇarūpupatthambhakabhāvarahitassa	570	
PA_tika-abh01_t:570_3	hadayavatthussa paduddhārena idha niddesānarahattā niddeso na katoti daṭṭhabbo. Na	570	
PA_tika-abh01_t:570_4	hi tathāgatassa dhammesu ācariyamuṭṭhi atthīti. Nikkhipitvāti vitthāradesanaṃ ṭhapetvā,	570	
PA_tika-abh01_t:570_5	apanetvāti attho, vitthāradesanaṃ antogadhaṃ katvāti vā. Gāthāttho nidāne vutto eva.	570	
PA_tika-abh01_t:571_0	Mūlavasena paccayabhāvo hetupaccayattho. Pabhavati etasmāti pabhavo, so eva “janako”ti	571	
PA_tika-abh01_t:571_1	visesito. Samuṭṭhāti etenāti samuṭṭhānaṃ, tassa visesanaṃ nibbattakanti. Sabbāni	571	
PA_tika-abh01_t:571_2	vā etāni pariyāyavacanāni. Atthavasenāti kasmā vuttaṃ, nanu kusalamūlānaṃ hetubhāvato	571	
PA_tika-abh01_t:571_3	dhammavasenāti yuttanti? Saccametaṃ, alobhādīnaṃ pana tiṇṇaṃ samānassa mūlaṭṭhassa	571	
PA_tika-abh01_t:571_4	vasena dassitataṃ sandhāya “atthavasenā”ti vuttaṃ. Iminā dhammoti bhāvo, atthoti	571	
PA_tika-abh01_t:571_5	dhammakiccaṃ adhippetanti viññāyati. “Alobho nidānaṃ kammānaṃ samudayāyā”tiādivacanato	571	
PA_tika-abh01_t:571_6	tāni kusalamūlāni samuṭṭhānaṃ etassātipi taṃsamuṭṭhānaṃ. Taṃ pana tehi samuṭṭhitaṃ	571	
PA_tika-abh01_t:571_7	hotīti “alobhādīhi samuṭṭhita”nti āha. Te kusalamūlataṃsampayuttā samuṭṭhānaṃ etassātipi	571	
PA_tika-abh01_t:571_8	attho sambhavati. Ettha pana cetanaṃ ṭhapetvā aññe “taṃsampayuttā”ti samuṭṭhānabhāve	571	
PA_tika-abh01_t:571_9	vattabbā. Tattha mūlehi attano paccayato kusale pariyādiyati, khandhehi sabhāvato,	571	
PA_tika-abh01_t:571_10	kammehi aññassa nibbattanakiccato. Mūlehi ca kusalānaṃ anavajjatāya hetuṃ dasseti,	5711	
PA_tika-abh01_t:571_11	khandhehi taṃsampayogakataṃ anavajjasabhāvaṃ, kammehi sukhavipākataṃ. Mūlehi vā nidānasampattiyā	5711	
PA_tika-abh01_t:571_12	ādikalyāṇataṃ, khandhehi sabhāvasampattiyā majjhekalyāṇataṃ, kammehi nibbattisampattiyā	5711	
PA_tika-abh01_t:571_13	pariyosānakalyāṇataṃ.	5711	
PA_tika-abh01_t:572_0	986. Taṃ …pe… uddhaṃ akusalaṃ nāma natthīti kasmā vuttaṃ, nanu vicikicchuddhaccasahagatamoho	572	
PA_tika-abh01_t:572_1	atthīti? Saccametaṃ, tena pana vinā taṃsampayuttatā natthīti taṃsampayuttesu gahitesu	572	
PA_tika-abh01_t:572_2	moho gahito evāti katvā “tato uddhaṃ natthī”ti vuttaṃ aññattha abhāvā. Ekasmiṃ ṭhitaṃ	572	
PA_tika-abh01_t:572_3	ekaṭṭhaṃ, sahajabhāvena ekaṭṭhaṃ sahajekaṭṭhaṃ. Pahātabbanti pahānaṃ, pahānabhāvena	572	
PA_tika-abh01_t:572_4	ekaṭṭhaṃ pahānekaṭṭhaṃ. Yena hi yaṃ saha pahātabbaṃ, tena taṃ ekasmiṃ puggale ṭhitaṃ	572	
PA_tika-abh01_t:572_5	hoti, ekasmiṃ samucchinne asamucchinne ca itarassa samucchinnatāya asamucchinnatāya	572	
PA_tika-abh01_t:572_6	ca vasena aññamaññāvirahitato.	572	
PA_tika-abh01_t:573_0	987. Tīṇi lakkhaṇānīti aniccadukkhaanattatā. Nāmakasiṇasattapaññattiyo tisso paññattiyo.	573	
PA_tika-abh01_t:573_1	Paramatthe amuñcitvā vohariyamānā vihāramañcādikā upādāpaññatti sattapaññattiggahaṇena	573	
PA_tika-abh01_t:573_2	gahitāti veditabbā, etāni ca lakkhaṇādīni heṭṭhā dvīsu kaṇḍesu viññattiādīni viya	573	
PA_tika-abh01_t:573_3	na vuttāni, na ca sabhāvadhammāti katvā na labbhantīti vuttāni. Na hi koci sabhāvo	573	
PA_tika-abh01_t:573_4	kusalattikāsaṅgahitoti vattuṃ yuttanti.	573	
PA_tika-abh01_t:574_0	988. Sukhabhūmīti kāmāvacarādayopi yujjanti. Sukhasahagatā hi kāmāvacarādibhūmi sukhabhūmi.	574	
PA_tika-abh01_t:574_1	Kāmāvacarādibhūmīti ca kāmāvacarāditāya dhammā eva vuccantīti kāmāvacarādicittuppādesūti	574	
PA_tika-abh01_t:574_2	atthato viññāyati. Evañca katvā “sukhabhūmiya”nti vatvā tassā eva vibhāgadassanatthaṃ	574	
PA_tika-abh01_t:574_3	“kāmāvacare”tiādi vuttaṃ. Bhūmi-saddo ca abhidhamme kāmāvacarādīsu niruḷhoti “catūsu	574	
PA_tika-abh01_t:574_4	bhūmīsu kusala”ntiādīsu aññabhūmiggahaṇaṃ na hotīti. Pāḷito cāti “visiṭṭhānaṃ pākāti	574	
PA_tika-abh01_t:574_5	vipākā”tiādivacanatthavibhāvanena pāḷito. “Vipakkabhāvamāpannānaṃ arūpadhammānametaṃ	574	
PA_tika-abh01_t:574_6	adhivacana”ntiādinā bhāsitatthavibhāvanena atthato ca. Nāmaparicchedādīhi tikadukānaṃ	574	
PA_tika-abh01_t:574_7	vavatthānadassanena vā pāḷito, tadatthaviññāpanena atthato.	574	
PA_tika-abh01_t:575	991. Sāliphalanti sālipākamāha.	57	
PA_tika-abh01_t:576	994. Amhākaṃ mātulattheroti puggalārammaṇassapi upādānassa upādānakkhandhā eva paccayo, na lokuttarā, ko pana vādo khandhārammaṇassa. Tenāha “aggahitānī”ti.	57	
PA_tika-abh01_t:577	998. Yathā upādānehi aggahetabbā anupādāniyā, evaṃ saṃkilesehi aggahetabbā asaṃkilesikāti katvā “asaṃ…pe… eseva nayo”ti āha.	57	
PA_tika-abh01_t:578_0	1006. Diṭṭhiyā gahito attā na vijjati. Yesu pana vipallatthagāho, te upādānakkhandhāva	578	
PA_tika-abh01_t:578_1	vijjanti. Tasmā yasmiṃ avijjamānaniccādivipariyāsākāragahaṇaṃ atthi, sova upādānakkhandhapañcakasaṅkhāto	578	
PA_tika-abh01_t:578_2	kāyo. Tattha niccādiākārassa avijjamānatādassanatthaṃ ruppanādisabhāvasseva ca vijjamānatādassanatthaṃ	578	
PA_tika-abh01_t:578_3	vijjamāno kāyoti visesetvā vutto, lokuttarā pana na kadāci avijjamānākārena gayhantīti	578	
PA_tika-abh01_t:578_4	na idaṃ visesanaṃ arahanti. Sakkāye diṭṭhi, satī vā kāye diṭṭhi sakkāyadiṭṭhi. Attanā	578	
PA_tika-abh01_t:578_5	gahitākārassa avijjamānatāya sayameva satī, na tāya gahito attā attaniyaṃ vāti attho.	578	
PA_tika-abh01_t:578_6	Ayaṃ panattho sambhavatīti katvā vutto, purimo eva pana padhāno. Dutiye hi diṭṭhiyā	578	
PA_tika-abh01_t:578_7	vatthu avisesitaṃ hoti. Kāyoti hi khandhapañcake vuccamāne lokuttarāpanayanaṃ natthi.	578	
PA_tika-abh01_t:578_8	Na hi lokuttaresu kāya-saddo na vattati. Kāyapassaddhiādīsu hi lokuttaresu kāya-saddopi	578	
PA_tika-abh01_t:578_9	lokuttarakkhandhavācakoti. Sīlenāti suddhiyā ahetubhūtena sīlena. Gahitasamādānanti	578	
PA_tika-abh01_t:578_10	uppāditaparāmāsova. So hi samādiyanti etena kukkurasīlavatādīnīti “samādāna”nti vutto.	5781	
PA_tika-abh01_t:578_11	Tattha avītikkamanīyatāya sīlaṃ, bhattivasena satataṃ caritabbatāya vataṃ daṭṭhabbaṃ.	5781	
PA_tika-abh01_t:579_0	1007. Idheva tiṭṭhamānassāti imissāyeva indasālaguhāyaṃ tiṭṭhamānassa. Vācuggatakaraṇaṃ	579	
PA_tika-abh01_t:579_1	uggaho. Atthaparipucchanaṃ paripucchā. Kusalehi saha codanāpariharaṇavasena vinicchayakaraṇaṃ	579	
PA_tika-abh01_t:579_2	vinicchayo. Bahūnaṃ nānappakārānaṃ sakkāyadiṭṭhīnaṃ avihatattā tā janenti, tāhi janitāti	579	
PA_tika-abh01_t:579_3	vā puthujjanā. Avighātameva vā jana-saddo vadati. Puthu satthārānaṃ mukhullokikāti	579	
PA_tika-abh01_t:579_4	ettha puthū janā etesanti puthujjanāti vacanattho. Puthu…pe… avuṭṭhitāti ettha janetabbā,	579	
PA_tika-abh01_t:579_5	jāyanti vā etthāti janā, gatiyo. Puthū janā etesanti puthujjanā. Ito pare jāyanti	579	
PA_tika-abh01_t:579_6	etehīti janā, abhisaṅkhārādayo. Te etesaṃ puthū vijjantīti puthujjanā. Abhisaṅkharaṇādiattho	579	
PA_tika-abh01_t:579_7	eva vā jana-saddo daṭṭhabbo. Rāgaggiādayo santāpā. Te eva sabbepi vā kilesā pariḷāhā.	579	
PA_tika-abh01_t:579_8	Puthu pañcasu kāmaguṇesūti ettha jāyatīti jano, “rāgo gedho”ti evamādiko. Puthu jano	579	
PA_tika-abh01_t:579_9	etesanti puthujjanā. Puthūsu vā janā jātā rattāti evaṃ rāgādiattho eva jana-saddo	579	
PA_tika-abh01_t:579_10	daṭṭhabbo. Palibuddhāti sambaddhā upaddutā vā. Assutavāti etena andhatā vuttāti “andhaputhujjano vutto”ti āha.	5791	
PA_tika-abh01_t:580_0	Anayeti avaḍḍhiyaṃ. Sabbattha niruttilakkhaṇena padasiddhi veditabbā. Anekesu ca	580	
PA_tika-abh01_t:580_1	kappasatasahassesu kataṃ jānanti, pākaṭañca karonti upakāraṃ satijananaāmisapaṭiggahaṇādinā	580	
PA_tika-abh01_t:580_2	paccekasambuddhā, tatheva dukkhitassa sakkaccaṃ kātabbaṃ karonti. Sammāsambuddho	580	
PA_tika-abh01_t:580_3	pana asaṅkhyeyyaappameyyesupi kataṃ upakāraṃ maggaphalānaṃ upanissayañca jānāti,	580	
PA_tika-abh01_t:580_4	pākaṭañca karoti, sīho viya ca javaṃ sabbattha sakkaccameva dhammadesanaṃ karoti.	580	
PA_tika-abh01_t:580_5	Ariyabhāvoti yehi yogato ariyā vuccanti, te maggaphaladhammā daṭṭhabbā. Ariyakaradhammā	580	
PA_tika-abh01_t:580_6	aniccadassanādayo, vipassiyamānā vā aniccādayo.	580	
PA_tika-abh01_t:581_0	Sotānīti taṇhādiṭṭhikilesaduccaritaavijjāsotāni. “Sotānaṃ saṃvaraṃ brūmī”ti vatvā	581	
PA_tika-abh01_t:581_1	“paññāyete pidhīyare”ti vacanena sotānaṃ saṃvaro pidahanaṃ samucchedañāṇanti viññāyati.	581	
PA_tika-abh01_t:581_2	Khantīti adhivāsanā, sā ca tathāpavattā khandhā. Paññāti eke, adoso eva vā. Kāyaduccaritādīnanti	581	
PA_tika-abh01_t:581_3	dussīlyasaṅkhātānaṃ kāyavacīduccaritānaṃ muṭṭhassaccasaṅkhātassa pamādassa abhijjhādomanassānaṃ	581	
PA_tika-abh01_t:581_4	pāpakānaṃ akkhantiaññāṇakosajjānañca. Anupekkhā saṅkhārehi avivaṭṭanaṃ, sālayatāti	581	
PA_tika-abh01_t:581_5	attho. Dhammaṭṭhitiyaṃ paṭiccasamuppāde paṭilomabhāvo sassatucchedagāho, tappaṭicchādakamoho	581	
PA_tika-abh01_t:581_6	vā. Nibbāne paṭilomabhāvo saṅkhāresu rati, nibbānapaṭicchādako moho vā. Saṅkhāranimittaggāhoti	581	
PA_tika-abh01_t:581_7	yādisassa kilesassa appahīnattā vipassanā saṅkhāranimittaṃ na muñcati, so kileso	581	
PA_tika-abh01_t:581_8	daṭṭhabbo. Saṅkhāranimittaggahaṇassa atikkamanaṃ vā pahānaṃ.	581	
PA_tika-abh01_t:582_0	Catunnaṃ ariyamaggānaṃ bhāvitattā accantaṃ appavattibhāvena yaṃ pahānanti yojanā	582	
PA_tika-abh01_t:582_1	veditabbā. Kena pana pahānanti? Ariyamaggehevāti viññāyamāno ayamattho tesaṃ bhāvitattā	582	
PA_tika-abh01_t:582_2	appavattivacanena. Samudayapakkhikassāti ettha cattāropi maggā catusaccābhisamayāti	582	
PA_tika-abh01_t:582_3	katvā tehi pahātabbena tena tena samudayena saha pahātabbattā samudayasabhāgattā	582	
PA_tika-abh01_t:582_4	ca saccavibhaṅge ca sabbakilesānaṃ samudayabhāvassa vuttattā “samudayapakkhikā”ti	582	
PA_tika-abh01_t:582_5	diṭṭhiādayo vuccanti. Kāyavācācittānaṃ virūpappavattiyā nayanaṃ apayāpanaṃ, kāyaduccaritādīnaṃ	582	
PA_tika-abh01_t:582_6	vināsanayanaṃ vā vinayo, tesaṃ vā jimhappavattiṃ vicchinditvā ujukanayanaṃ vinayanaṃ.	582	
PA_tika-abh01_t:582_7	Eseseti eso so eva, atthato anaññoti attho. Tajjāteti atthato taṃsabhāvova. Sappuriso	582	
PA_tika-abh01_t:582_8	ariyasabhāvo, ariyo ca sappurisabhāvoti attho.	582	
PA_tika-abh01_t:583_0	Advayanti dvayatārahitaṃ, vaṇṇameva “accī”ti gahetvā acciṃ vā “vaṇṇo evā”ti tesaṃ	583	
PA_tika-abh01_t:583_1	ekattaṃ passanto viya yathātakkitaṃ attānaṃ “rūpa”nti, yathādiṭṭhaṃ vā rūpaṃ “attā”ti	583	
