segmentnr	original	folio	analyzed
PA_tika-abh01_t:134_4	bahiddhābāhira-saddānaṃ viya viseso. Ajjhattikasaddo hi saparasantānikesu sabbesu	134	
PA_tika-abh01_t:134_5	cakkhādīsu rūpādīsu bāhira-saddo viya pavattati, ajjhatta-saddo pana sakasantānikesveva	134	
PA_tika-abh01_t:134_6	cakkhurūpādīsu tato aññesveva bahiddhā-saddo viya pavattatīti tasmā saddato atthato	134	
PA_tika-abh01_t:134_7	ca asamānattā na idamettha udāharaṇaṃ yuttanti. Ayaṃ panettha adhippāyo daṭṭhabbo	134	
PA_tika-abh01_t:134_8	– ajjhatte bhavā ajjhattikāti ayañhi vacanattho. Yañca ajjhatte bhavaṃ, tena ajjhatteneva	134	
PA_tika-abh01_t:134_9	bhavitabbaṃ, tena taṃvācakassa ajjhatta-saddassa ajjhattika-saddassa ca samānatthatā.	134	
PA_tika-abh01_t:134_10	Ubhinnampi saddānaṃ samānatthabhāvato ajjhattajjhatte pavattamāne ajjhattika-sadde	1341	
PA_tika-abh01_t:134_11	ajjhatta-saddo tattha pavattoti sakkā vattunti.	1341	
PA_tika-abh01_t:135_0	Ayaṃ kho panānanda, vihāroti vihārasuññatāsutte saṅgaṇikārāmatāya rūpādiratiyā ca	135	
PA_tika-abh01_t:135_1	ādīnavaṃ vatvā tappaṭipakkhavihāradassanatthaṃ vuttaṃ. Ajjhattaṃ suññatanti visayabhūtaṃ	135	
PA_tika-abh01_t:135_2	issariyaṭṭhānabhūtaṃ suññataṃ, suññatāphalasamāpattinti attho. Cittissarā hi buddhā	135	
PA_tika-abh01_t:135_3	bhagavanto dhammaṃ desentāpi yaṃ muhuttaṃ tuṇhī bhavitabbaṃ hoti, taṃ muhuttaṃ phalasamāpattiṃ	135	
PA_tika-abh01_t:135_4	samāpajjanti, pageva aññasmiṃ kāle, tasmā sabbatthāpi issariyānaṃ bahulaṃ phalasamāpattiyaṃ	135	
PA_tika-abh01_t:135_5	issariyassa pavattanato phalasamāpatti “issariyaṭṭhāna”nti vuttā. Arahattaphalādhigamena	135	
PA_tika-abh01_t:135_6	vā tathāgatānaṃ issariyaṃ nibbattaṃ taṃjanakeneva maggenāti taṃ tesaṃ issariyaṭṭhānaṃ.	135	
PA_tika-abh01_t:135_7	Visayo ca anaññatthabhāvova yathā “ākāse sakuṇā udake macchā”ti, buddhā ca aññattha	135	
PA_tika-abh01_t:135_8	dissamānāpi vivekapabbhāratāya phalasamāpattininnāva, tena tassā tassā kiriyāya anantaraṃ	135	
PA_tika-abh01_t:135_9	phalasamāpattiyaṃyeva bhavantīti sā tesaṃ visayo, tabbisayatā ca saccakasuttena dīpetabbā.	135	
PA_tika-abh01_t:136_0	22. Yesaṃ daṭṭhabbabhāvo atthi, te sanidassanā. Cakkhuviññāṇagocarabhāvova daṭṭhabbabhāvo,	136	
PA_tika-abh01_t:136_1	tassa rūpāyatanā anaññattepi aññehi dhammehi rūpāyatanaṃ visesetuṃ aññaṃ viya katvā	136	
PA_tika-abh01_t:136_2	“saha nidassanenāti sanidassanā”ti vuttaṃ. Dhammasabhāvasāmaññena hi ekībhūtesu dhammesu	136	
PA_tika-abh01_t:136_3	yo nānattakaro sabhāvo, so añño viya katvā upacarituṃ yutto. Evañhi atthavisesāvabodho	136	
PA_tika-abh01_t:136_4	hotīti. Sayañca nissayavasena ca sampattānaṃ asampattānañca paṭimukhabhāvo aññamaññapatanaṃ	136	
PA_tika-abh01_t:136_5	paṭihananabhāvo, yena byāpārādivikārapaccayantarasahitesu cakkhādīnaṃ visayesu vikāruppatti.	136	
PA_tika-abh01_t:137	Tikamātikāpadavaṇṇanā niṭṭhitā.	13	
PA_tika-abh01_t:138	Dukamātikāpadavaṇṇanā	13	
PA_tika-abh01_t:139_0	1-6. Mūlaṭṭhenāti suppatiṭṭhitabhāvasādhanena mūlabhāvena, na paccayamattaṭṭhena	139	
PA_tika-abh01_t:139_1	hetudhammā hetū dhammāti samāsāsamāsaniddesabhāvo dvinnaṃ pāṭhānaṃ viseso. Tathevāti	139	
PA_tika-abh01_t:139_2	sampayogatova. Sahetukānaṃ hetusampayuttabhāvato “sampayogato”ti vuttanti veditabbaṃ,	139	
PA_tika-abh01_t:139_3	na sahasaddassa sampayogatthattā. Saha-saddo pana ekapuñje uppādato yāva bhaṅgā sahetukānaṃ	139	
PA_tika-abh01_t:139_4	hetūhi samānadesagahaṇānaṃ hetuādisabbhāvaṃ dīpeti, sampayutta-saddo ekuppādādivasena	139	
PA_tika-abh01_t:139_5	saha hetūhi ekībhāvupagamanaṃ, tato eva ca dvinnaṃ dukānaṃ nānattaṃ veditabbaṃ. Dhammanānattābhāvepi	139	
PA_tika-abh01_t:139_6	hi padatthanānattena dukantaraṃ vuccati. Na hi hetudukasaṅgahitehi dhammehi aññe	139	
PA_tika-abh01_t:139_7	sahetukadukādīhi vuccanti, te eva pana sahetukāhetukādibhāvato sahetukadukādīhi vuttā.	139	
PA_tika-abh01_t:139_8	Evaṃ sahetukadukasaṅgahitā eva hetusampayuttavippayuttabhāvato hetusampayuttadukena	139	
PA_tika-abh01_t:139_9	vuttā. Na hi dhammānaṃ avuttatāpekkhaṃ dukantaravacananti natthi punaruttidoso. Desetabbappakārajānanañhi	139	
PA_tika-abh01_t:139_10	desanāvilāso tathā desanāñāṇañcāti. Tena dhammānaṃ tappakāratā vuttā hoti. Sakalekadesavasena	1391	
PA_tika-abh01_t:139_11	paṭhamadukaṃ dutiyatatiyehi saddhiṃ yojetvā catutthādayo tayo dukā vuttā. Sakalañhi	1391	
PA_tika-abh01_t:139_12	paṭhamadukaṃ dutiyadukekadesena sahetukapadena tatiyadukekadesena hetusampayuttapadena	1391	
PA_tika-abh01_t:139_13	ca yojetvā yathākkamaṃ catutthapañcamadukā vuttā, tathā paṭhamadukekadesaṃ nahetupadaṃ	1391	
PA_tika-abh01_t:139_14	sakalena dutiyadukena yojetvā chaṭṭhaduko vutto. Idampi sambhavatīti etena avuttampi	1391	
PA_tika-abh01_t:139_15	sambhavavasena dīpitanti dasseti. Sambhavo hi gahaṇassa kāraṇanti. Yathā hetusahetukāti	1391	
PA_tika-abh01_t:139_16	idaṃ sambhavatīti katvā gahitaṃ, evaṃ hetuahetukāti idampi sambhavatīti katvā gahetabbamevāti	1391	
PA_tika-abh01_t:139_17	evaṃ aññatthāpi yojetabbaṃ.	1391	
PA_tika-abh01_t:140_0	Evaṃ paṭhamadukaṃ dutiyatatiyadukesu dutiyapadehi yojetvā “hetū ceva dhammā ahetukā	140	
PA_tika-abh01_t:140_1	ca, ahetukā ceva dhammā na ca hetū, hetū ceva dhammā hetuvippayuttā ca, hetuvippayuttā	140	
PA_tika-abh01_t:140_2	ceva dhammā na ca hetū”ti ye dve dukā kātabbā, tesaṃ sambhavavaseneva saṅgahaṃ dassetvā	140	
PA_tika-abh01_t:140_3	kho pana-padena aparesampi dukānaṃ saṅgahaṃ dassetuṃ “tatra yadeta”ntiādimāha. Tatrāti	140	
PA_tika-abh01_t:140_4	pāḷiyaṃ. Ayaṃ atirekatthoti idāni yaṃ vakkhati, tamatthamāha. Tattha pana aññepi	140	
PA_tika-abh01_t:140_5	aññathāpīti etesaṃ visuṃ pavattiyā dve dukā dassitā, saha pavattiyā pana ayampi duko	140	
PA_tika-abh01_t:140_6	veditabbo “hetū ceva dhammā hetusampayuttāpi hetuvippayuttāpī”ti, etesu pana pañcasu	140	
PA_tika-abh01_t:140_7	dukesu dutiyadukena tatiyaduko viya, catutthadukena pañcamaduko viya ca chaṭṭhadukena	140	
PA_tika-abh01_t:140_8	ninnānatthattā “na hetu kho pana dhammā hetusampayuttāpi hetuvippayuttāpī”ti ayaṃ	140	
PA_tika-abh01_t:140_9	duko na vutto. Dassitaninnānatthanayo hi so purimadukehīti. Itaresu catūsu hetū ceva	140	
PA_tika-abh01_t:140_10	ahetukadukena samānatthattā hetū ceva hetuvippayuttaduko, hetusahetukadukena samānatthattā	1401	
PA_tika-abh01_t:140_11	hetuhetusampayuttaduko ca nahetuhetusampayuttaduko viya na vattabbo. Tesu pana dvīsu	1401	
PA_tika-abh01_t:140_12	pacchimaduke “hetū kho pana dhammā sahetukā”ti padaṃ catutthaduke paṭhamapadena ninnānākaraṇattā	1401	
PA_tika-abh01_t:140_13	na vattabbaṃ, “hetū kho pana dhammā ahetukā”ti padaṃ “hetū ceva dhammā ahetukā”ti	1401	
PA_tika-abh01_t:140_14	etena ninnānattā na vattabbaṃ. Avasiṭṭhe pana ekasmiṃ duke “ahetukā ceva dhammā na	1401	
PA_tika-abh01_t:140_15	ca hetū”ti padaṃ chaṭṭhaduke dutiyapadena ekatthattā na vattabbaṃ. Idāni “hetū ceva	1401	
PA_tika-abh01_t:140_16	dhammā ahetukā cā”ti idamevekaṃ padaṃ avasiṭṭhaṃ, na ca ekena padena duko hotīti	1401	
PA_tika-abh01_t:140_17	tañca na vuttanti. Catutthaduke dutiyapadena pana samānatthassa chaṭṭhaduke paṭhamapadassa	1401	
PA_tika-abh01_t:140_18	vacanaṃ dukapūraṇatthaṃ, etena vā gatidassanena sabbassa sambhavantassa saṅgaho katoti	1401	
PA_tika-abh01_t:140_19	daṭṭhabbo. Tathā hi sabbo sambhavaduko paṭhamaduke dutiyatatiyadukapakkhepena dassito,	1401	
PA_tika-abh01_t:140_20	tesu ca paṭhamadukapakkhepenāti.	1402	
PA_tika-abh01_t:141_0	7-13. Samānakālena asamānakālena kālavimuttena ca paccayena nipphannānaṃ paccayāyattānaṃ	141	
PA_tika-abh01_t:141_1	paccayabhāvamattena tesaṃ paccayānaṃ atthitaṃ dīpetuṃ sappaccayavacanaṃ, na sahetukavacanaṃ	141	
PA_tika-abh01_t:141_2	viya samānakālānameva, nāpi sanidassanaṃ viya taṃsabhāvassa anatthantarabhūtassa.	141	
PA_tika-abh01_t:141_3	Saṅkhata-saddo pana sametehi nipphāditabhāvaṃ dīpetīti ayametesaṃ viseso dukantaravacane	141	
PA_tika-abh01_t:141_4	kāraṇaṃ. Ettha ca appaccayā asaṅkhatāti bahuvacananiddeso avinicchitatthaparicchedadassanavasena	141	
PA_tika-abh01_t:141_5	mātikāṭhapanato katoti veditabbo. Uddesena hi kusalādisabhāvānaṃ dhammānaṃ atthitāmattaṃ	141	
PA_tika-abh01_t:141_6	vuccati, na paricchedoti aparicchedena bahuvacanena uddeso vuttoti. Rūpanti rūpāyatanaṃ	141	
PA_tika-abh01_t:141_7	pathaviyādi vā. Purimasmiṃ atthavikappe rūpāyatanassa asaṅgahitatā āpajjatīti ruppanalakkhaṇaṃ	141	
PA_tika-abh01_t:141_8	vā rūpanti ayaṃ atthanayo vutto. Tattha rūpanti ruppanasabhāvo. Na lujjati na palujjatīti	141	
PA_tika-abh01_t:141_9	yo gahito tathā na hoti, so lokoti taṃgahaṇarahitānaṃ lokuttarānaṃ natthi lokatā.	141	
PA_tika-abh01_t:141_10	Dukkhasaccaṃ vā loko, tattha teneva lokasabhāvena viditāti lokiyā.	1411	
PA_tika-abh01_t:142_0	Evaṃ sante cakkhuviññāṇena vijānitabbassa rūpāyatanassa teneva navijānitabbassa saddāyatanādikassa	142	
PA_tika-abh01_t:142_1	ca nānattā dvinnampi padānaṃ atthanānattato duko hoti. Evaṃ pana duke vuccamāne dukabahutā	142	
PA_tika-abh01_t:142_2	āpajjati, yattakāni viññāṇāni, tattakā dukā vuttā samattā ṭhapetvā sabbadhammārammaṇāni	142	
PA_tika-abh01_t:142_3	viññāṇāni. Tesu ca dukassa pacchedo āpajjati, tathā ca sati “kenacī”ti padaṃ sabbaviññāṇasaṅgāhakaṃ	142	
PA_tika-abh01_t:142_4	na siyā, niddesena ca viruddhaṃ idaṃ vacanaṃ. Yo ca tattha “ye te dhammā cakkhuviññeyyā,	142	
PA_tika-abh01_t:142_5	na te dhammā sotaviññeyyāti ayaṃ duko na hotī”ti paṭisedho kato, so ca kathaṃ yujjeyya.	142	
PA_tika-abh01_t:142_6	Na hi samatthā aṭṭhakathā pāḷiṃ paṭisedhetunti, na ca kenaci-saddassa tenevāti ayaṃ	142	
PA_tika-abh01_t:142_7	padattho sambhavati, “kenacī”ti etassa ādipadassa aniyamitaṃ yaṃ kiñci ekaṃ padattho,	142	
PA_tika-abh01_t:142_8	taṃ vatvā vuccamānassa “kenacī”ti dutiyapadassa yaṃ kiñci aparaṃ aniyamitaṃ padatthoti	142	
PA_tika-abh01_t:142_9	lokasiddhametaṃ, tatheva ca niddeso pavatto, na cettha viññātabbadhammabhedena dukabhedo	142	
PA_tika-abh01_t:142_10	samatto āpajjati yattakā viññātabbā, tattakā dukāti, tasmā natthi dukabahutā. Na	1421	
PA_tika-abh01_t:142_11	hi ekaṃyeva viññātabbaṃ kenaci viññeyyaṃ kenaci na viññeyyañca, kintu aparampi aparampīti	1421	
PA_tika-abh01_t:142_12	sabbaviññātabbasaṅgahe duko samatto hoti, evañca sati “kenacī”ti padaṃ aniyamena	1421	
PA_tika-abh01_t:142_13	sabbaviññāṇasaṅgāhakanti siddhaṃ hoti, viññāṇanānattena ca viññātabbaṃ bhinditvā	1421	
PA_tika-abh01_t:142_14	ayaṃ duko vutto, na viññātabbānaṃ atthantaratāyāti. Etassa pana dukassa nikkheparāsiniddeso	1421	
PA_tika-abh01_t:142_15	dukasaṅgahitadhammekadesesu dukapadadvayappavattidassanavasena pavatto. Atthuddhāraniddeso	1421	
PA_tika-abh01_t:142_16	niravasesadukasaṅgahitadhammadassanavasenāti veditabbo.	1421	
PA_tika-abh01_t:143_0	14-19. Cakkhutopi…pe… manatopīti cakkhuviññāṇādivīthīsu tadanugatamanoviññāṇavīthīsu	143	
PA_tika-abh01_t:143_1	ca kiñcāpi kusalādīnampi pavatti atthi, kāmāsavādayo eva pana vaṇato yūsaṃ viya paggharaṇakaasucibhāvena	143	
PA_tika-abh01_t:143_2	sandanti, tasmā te eva “āsavā”ti vuccanti. Tattha hi paggharaṇakaasucimhi niruḷho	143	
PA_tika-abh01_t:143_3	āsavasaddoti. Dhammato yāva gotrabhunti tato paraṃ maggaphalesu appavattito vuttaṃ.	143	
PA_tika-abh01_t:143_4	Ete hi ārammaṇakaraṇavasena dhamme gacchantā tato paraṃ na gacchantīti. Nanu tato	143	
PA_tika-abh01_t:143_5	paraṃ bhavaṅgādīnipi gacchantīti ce? Na, tesampi pubbe ālambitesu lokiyadhammesu	143	
PA_tika-abh01_t:143_6	sāsavabhāvena antogadhattā tato paratābhāvato. Ettha ca gotrabhuvacanena gotrabhuvodānaphalasamāpattipurecārikaparikammāni	143	
PA_tika-abh01_t:143_7	vuttānīti veditabbāni, paṭhamamaggapurecārikameva vā gotrabhu avadhinidassanabhāvena	143	
PA_tika-abh01_t:143_8	gahitaṃ, tato paraṃ maggaphalasamānatāya pana aññesu maggesu maggavīthiyaṃ phalasamāpattivīthiyaṃ	143	
PA_tika-abh01_t:143_9	nirodhānantarañca pavattamānesu phalesu nibbāne ca pavatti nivāritā āsavānanti veditabbā.	143	
PA_tika-abh01_t:143_10	Savantīti gacchanti. Duvidho hi avadhi abhividhivisayo anabhividhivisayo ca. Abhividhivisayaṃ	1431	
PA_tika-abh01_t:143_11	kiriyā byāpetvā pavattati “ābhavaggā bhagavato yaso gato”ti, itaraṃ bahi katvā “āpāṭaliputtā	1431	
PA_tika-abh01_t:143_12	vuṭṭho devo”ti. Ayañca ā-kāro abhividhiattho idha gahitoti “antokaraṇattho”ti vuttaṃ.	1431	
PA_tika-abh01_t:144_0	Cirapārivāsiyaṭṭho ciraparivutthatā purāṇabhāvo. Ādi-saddena “purimā, bhikkhave,	144	
PA_tika-abh01_t:144_1	koṭi na paññāyati bhavataṇhāyā”ti idaṃ suttaṃ saṅgahitaṃ. Avijjāsavabhavāsavānañca	144	
PA_tika-abh01_t:144_2	ciraparivutthatāya dassitāya tabbhāvabhāvīnaṃ kāmāsavadiṭṭhāsavānañca ciraparivutthatā	144	
PA_tika-abh01_t:144_3	dassitā hoti. Aññesupi yathāvutte dhamme okāsañca ārammaṇaṃ katvā pavattamānesu mānādīsu	144	
PA_tika-abh01_t:144_4	vijjamānesu attattaniyādiggāhavasena abhibyāpanaṃ madakaraṇavasena āsavasadisatā	144	
PA_tika-abh01_t:144_5	ca etesaṃyeva, nāññesanti etesveva āsavasaddo niruḷho daṭṭhabbo. Āyataṃ vā savanti	144	
PA_tika-abh01_t:144_6	phalantīti āsavā. Na hi kiñci saṃsāradukkhaṃ āsavehi vinā uppajjamānaṃ atthīti. Ārammaṇabhāvena	144	
PA_tika-abh01_t:144_7	ye dhammā vaṇo viya āsave paggharanti, te asampayoge atabbhāvepi saha āsavehīti sāsavā, āsavavantoti attho.	144	
PA_tika-abh01_t:145_0	Osānaduke “no āsavā kho panā”ti avatvā “āsavavippayuttā kho panā”ti vacanaṃ sāsavānaṃ	145	
PA_tika-abh01_t:145_1	sahetukānaṃ viya sampayuttehi taṃsahitatā na hotīti dassanatthaṃ. Evaṃ sesagocchakesupi	145	
PA_tika-abh01_t:145_2	yathāsambhavaṃ vippayuttaggahaṇe payojanaṃ daṭṭhabbaṃ. Apica “no āsavā kho pana dhammā	145	
PA_tika-abh01_t:145_3	sāsavā”ti idaṃ padaṃ catutthaduke dutiyapadena ninnānaṃ, na ca ekena duko hoti, tasmā	145	
PA_tika-abh01_t:145_4	āsavavippayuttapadameva gahetvā osānadukayojanā ñāyāgatāti katā. Hetugocchake pana	145	
PA_tika-abh01_t:145_5	hetuvippayuttānaṃ sahetukatā natthīti te gahetvā dukayojanāya asakkuṇeyyattā nahetupadaṃ	145	
PA_tika-abh01_t:145_6	gahetvā osānadukayojanā katā. Ye vā pana paṭhame duke dutiyassa pakkhepe eko, tatiyassa	145	
PA_tika-abh01_t:145_7	dve, paṭhamassa dutiye eko, tatiye dve, dutiyassa tatiye eko, dutiye ca tatiyassa	145	
PA_tika-abh01_t:145_8	ekoti aṭṭha dukā labbhanti, tesu tīhi itare ca nayato dassitāti veditabbā. Esa nayo sesagocchakesupi.	145	
PA_tika-abh01_t:146_0	20-25. Kilesakammavipākavaṭṭānaṃ paccayabhāvena tattha saṃyojenti, satipi aññesaṃ	146	
PA_tika-abh01_t:146_1	tappaccayabhāve na vinā saṃyojanāni tesaṃ tappaccayabhāvo atthi, orambhāgiyuddhambhāgiyasaṅgahitehi	146	
PA_tika-abh01_t:146_2	ca taṃtaṃbhavanibbattakakammaniyamo bhavaniyamo ca hoti, na ca upacchinnasaṃyojanassa	146	
PA_tika-abh01_t:146_3	katānipi kammāni bhavaṃ nibbattentīti. Saṃyojetabbāti vā saṃyojaniyā, saṃyojane niyuttāti	146	
PA_tika-abh01_t:146_4	vā. Dūragatassapi ākaḍḍhanato nissarituṃ appadānavasena bandhanaṃ saṃyojanaṃ, ganthakaraṇaṃ	146	
PA_tika-abh01_t:146_5	saṅkhalikacakkalakānaṃ viya paṭibaddhatākaraṇaṃ vā ganthanaṃ gantho, saṃsilisakaraṇaṃ	146	
PA_tika-abh01_t:146_6	yojanaṃ yogoti ayametesaṃ visesoti veditabbo. Dhammānaṃ sabhāvakiccavisesaññunā pana	146	
PA_tika-abh01_t:146_7	bhagavatā sampayuttesu ārammaṇesu tappaccayesu ca tehi tehi nipphādiyamānaṃ taṃ taṃ	146	
PA_tika-abh01_t:146_8	kiccavisesaṃ passantena te te dhammā tathā tathā āsavasaṃyojanaganthādivasena vuttāti	146	
PA_tika-abh01_t:146_9	“kimatthaṃ eteyeva dhammā evaṃ vuttā, kasmā ca vuttā eva puna vuttā”ti na codetabbametaṃ.	146	
PA_tika-abh01_t:147_0	26-37. Ganthaniyāti ettha ayamañño attho “ganthakaraṇaṃ ganthanaṃ, ganthane niyuttāti	147	
PA_tika-abh01_t:147_1	ganthaniyā, ganthayituṃ sakkuṇeyyā, ganthayituṃ arahantīti vā ganthaniyā”ti. Evaṃ	147	
PA_tika-abh01_t:147_2	oghaniyādīsupi daṭṭhabbaṃ. Tenātikkamatīti etaṃ dhātvatthaṃ gahetvā oghaniyāti padasiddhi katā.	147	
PA_tika-abh01_t:148	50-54. Dhammasabhāvaṃ aggahetvā parato āmasantīti parāmāsā. Paratoti niccādito. Āmasantīti sabhāvapaṭisedhena parimajjanti.	14	
PA_tika-abh01_t:149_0	55-68. Sabhāvato vijjamānaṃ avijjamānaṃ vā vicittasaññāya saññitaṃ ārammaṇaṃ aggahetvā	149	
PA_tika-abh01_t:149_1	appavattito ālambamānā dhammā sārammaṇā. Cintanaṃ gahaṇaṃ ārammaṇūpaladdhi. Cetasi	149	
PA_tika-abh01_t:149_2	niyuttā, cetasā saṃsaṭṭhā vā cetasikā. Dubbiññeyyanānattatāya ekībhāvamivupagamanaṃ	149	
PA_tika-abh01_t:149_3	nirantarabhāvupagamanaṃ. Yesaṃ rūpānaṃ cittaṃ sahajātapaccayo hoti, tesaṃ cittassa	149	
PA_tika-abh01_t:149_4	ca suviññeyyanānattanti nirantarabhāvānupagamanaṃ veditabbaṃ. Ekato vattamānāpīti	149	
PA_tika-abh01_t:149_5	api-saddo ko pana vādo ekato avattamānāti etamatthaṃ dīpeti. Idamettha vicāretabbaṃ	149	
PA_tika-abh01_t:149_6	– avinibbhogarūpānaṃ kiṃ aññamaññaṃ saṃsaṭṭhatā, udāhu visaṃsaṭṭhatāti? Visuṃ ārammaṇabhāvena	149	
PA_tika-abh01_t:149_7	suviññeyyanānattattā na saṃsaṭṭhatā, nāpi visaṃsaṭṭhatā saṃsaṭṭhāti anāsaṅkanīyasabhāvattā.	149	
PA_tika-abh01_t:149_8	Catunnañhi khandhānaṃ aññamaññaṃ saṃsaṭṭhasabhāvattā rūpanibbānehipi so saṃsaṭṭhabhāvo	149	
PA_tika-abh01_t:149_9	atthi natthīti siyā āsaṅkā, tasmā tesaṃ itarehi, itaresañca tehi visaṃsaṭṭhasabhāvatā	149	
PA_tika-abh01_t:149_10	vuccati, na pana rūpānaṃ rūpehi katthaci saṃsaṭṭhatā atthīti tadāsaṅkābhāvato visaṃsaṭṭhatā	1491	
PA_tika-abh01_t:149_11	ca rūpānaṃ rūpehi na vuccatīti. Esa hi tesaṃ sabhāvoti. Cittasaṃsaṭṭhasamuṭṭhānādipadesu	1491	
PA_tika-abh01_t:149_12	saṃsaṭṭhasamuṭṭhānādisaddā cittasaddāpekkhāti paccekaṃ cittasaddasambandhattā cittasaṃsaṭṭhā	1491	
PA_tika-abh01_t:149_13	ca te cittasamuṭṭhānā cāti paccekaṃ yojetvā attho vutto. Upādiyantevāti bhūtāni gaṇhanti	1491	
PA_tika-abh01_t:149_14	eva, nissayanti evāti attho. Yathā bhūtāni upādiyanti gayhanti nissīyanti, na tathā	1491	
PA_tika-abh01_t:149_15	etāni gayhanti nissīyanti, tasmā upādā. Atha vā bhūtāni amuñcitvā tesaṃ vaṇṇanibhādibhāvena gahetabbato upādā.	1491	
PA_tika-abh01_t:150	75-82. Saṃkiliṭṭhattike vuttanayenāti saṃ-saddaṃ apanetvā kilisantīti kilesātiādinā nayena.	15	
PA_tika-abh01_t:151_0	83-100. Kāmāvacarādīsu ayamaparo attho – kāmataṇhā kāmo, evaṃ rūpārūpataṇhā rūpaṃ	151	
PA_tika-abh01_t:151_1	arūpañca. Ārammaṇakaraṇavasena tāni yattha avacaranti, te kāmāvacarādayoti. Evañhi	151	
PA_tika-abh01_t:151_2	sati aññabhūmīsu uppajjamānānaṃ akāmāvacarāditā kāmāvacarāditā ca nāpajjatīti siddhaṃ	151	
PA_tika-abh01_t:151_3	hoti. Nikkhepakaṇḍepi “etthāvacarā”ti vacanaṃ avīciparanimmitaparicchinnokāsāya kāmataṇhāya	151	
PA_tika-abh01_t:151_4	ārammaṇabhāvaṃ sandhāya vuttanti veditabbaṃ, tadokāsatā ca taṇhāya tanninnatāya veditabbā.	151	
PA_tika-abh01_t:151_5	Yadi pariyāpannasaddassa antogadhāti ayamattho, maggādidhammānañca lokuttarantogadhattā	151	
PA_tika-abh01_t:151_6	pariyāpannatā āpajjati. Na hi “pariyāpannā”ti ettha tebhūmakagahaṇaṃ atthīti? Nāpajjati	151	
PA_tika-abh01_t:151_7	sabbadā pavattamānassa paccakkhassa lokassa vasena pariyāpannanicchayato. Atha vā	151	
PA_tika-abh01_t:151_8	paricchedakārikāya taṇhāya paricchinditvā āpannā paṭipannā gahitāti pariyāpannā.	151	
PA_tika-abh01_t:152_0	Anīya-saddo bahulā kattuabhidhāyakoti vaṭṭacārakato niyyantīti niyyānīyā, nī-kārassa	152	
PA_tika-abh01_t:152_1	rassattaṃ ya-kārassa ca ka-kārattaṃ katvā “niyyānikā”ti vuttaṃ, niyyānakaraṇasīlā	152	
PA_tika-abh01_t:152_2	vā niyyānikā. Uttaritabbassa aññassa niddiṭṭhassa abhāvā niddisiyamānā sauttarā dhammāva	152	
PA_tika-abh01_t:152_3	uttaritabbāti “attāna”nti āha. Rāgādīnanti rāgādīnaṃ dasannaṃ kilesānaṃ sabbaniyatākusalānaṃ	152	
PA_tika-abh01_t:152_4	vā. Tehi nānappakāradukkhanibbattakehi abhibhūtā sattā kandanti akandantāpi kandanakāraṇabhāvato.	152	
PA_tika-abh01_t:152_5	Yasmā pana pahānekaṭṭhatāvasena ca “saraṇā”ti āha, tasmā “rāgādīna”nti vacanena rāgadosamohāva	152	
PA_tika-abh01_t:152_6	gahitāti ñāyati. Raṇa-saddo vā rāgādireṇūsu niruḷho daṭṭhabbo, raṇaṃ vā yuddhaṃ,	152	
PA_tika-abh01_t:152_7	“kāmā te paṭhamā senā”ti evamādikā ca akusalā senā ariyamaggayuddhena jetabbattā	152	
PA_tika-abh01_t:152_8	sayuddhattā “saraṇā”ti vuccantīti. Araṇavibhaṅgasutte pana sadukkhā saupaghātā saupāyāsā	152	
PA_tika-abh01_t:152_9	sapariḷāhā micchāpaṭipadābhūtā kāmasukhānuyogādayo “saraṇā”ti vuttāti dukkhādīnaṃ	152	
PA_tika-abh01_t:152_10	raṇabhāvo tannibbattakasabhāvānaṃ akusalānaṃ saraṇatā ca veditabbā.	1521	
PA_tika-abh01_t:153	Piṭṭhidukā samattā.	15	
PA_tika-abh01_t:154	Suttantikadukamātikāpadavaṇṇanā	15	
PA_tika-abh01_t:155_0	101-108. Vijjārāsantogadhadhammā vijjāsabhāgatāya tadekadese vijjākoṭṭhāse vattantīti	155	
PA_tika-abh01_t:155_1	vuttā. Vajirassa yattha taṃ patati, tattha abhejjaṃ nāma kiñci maṇipāsāṇādi natthi,	155	
PA_tika-abh01_t:155_2	na ca tena gamanamaggo viruhati, evameva arahattamaggena yattha so uppajjati, tasmiṃ	155	
PA_tika-abh01_t:155_3	santāne abhejjo kileso nāma natthi, na ca bhinno puna viruhatīti vajirupamatā veditabbā.	155	
PA_tika-abh01_t:155_4	Tadupacārena bālā yathā “mañcā ghosantī”ti. Kaṇhābhijātīti apāyā vuccanti manussesu	155	
PA_tika-abh01_t:155_5	ca dobhaggiyaṃ. Tapanassa vā dukkhassa hitāti tapaniyā.	155	
PA_tika-abh01_t:156_0	Dāsādīsupi sirivaḍḍhakādisaddā viya atathattā vacanamattameva adhikāraṃ katvā pavattā	156	
PA_tika-abh01_t:156_1	adhivacanā. Yasmā pana adhivacananiruttipaññattipadāni samānatthāni, sabbañca vacanaṃ	156	
PA_tika-abh01_t:156_2	adhivacanādibhāvaṃ bhajati, tasmā tesupi vacanavisesesu visesena pavattehi adhivacanādisaddehi	156	
PA_tika-abh01_t:156_3	sabbāni vacanāni atthappakāsanasāmaññena vuttānīti etenādhippāyena ayaṃ atthayojanā	156	
PA_tika-abh01_t:156_4	katāti veditabbā. Atha vā adhi-saddo uparibhāge, upari vacanaṃ adhivacanaṃ. Kassa	156	
PA_tika-abh01_t:156_5	upari? Pakāsetabbassa atthassāti viditovāyamattho. Adhīnaṃ vā vacanaṃ adhivacanaṃ.	156	
PA_tika-abh01_t:156_6	Kena adhīnaṃ? Atthena. Tathā taṃtaṃatthappakāsane nicchitaṃ, niyataṃ vā vacanaṃ nirutti.	156	
PA_tika-abh01_t:156_7	Pathavīdhātupurisāditaṃtaṃpakārena ñāpanato paññattīti evaṃ adhivacanādipadānaṃ sabbavacanesu	156	
PA_tika-abh01_t:156_8	pavatti veditabbā. Aññathā sirivaḍḍhakadhanavaḍḍhakappakārānameva abhilāpānaṃ adhivacanatā,	156	
PA_tika-abh01_t:156_9	abhisaṅkharontīti evaṃpakārānameva niddhāraṇavacanānaṃ niruttitā, takko vitakkoti	156	
PA_tika-abh01_t:156_10	evaṃpakārānameva ekamevatthaṃ tena tena pakārena ñāpentānaṃ paññattitā ca āpajjeyyāti.	1561	
PA_tika-abh01_t:157_0	109-118. Phasso vedanāti sabbadāpi arūpadhammānaṃ phassādināmakattā pathaviyādīnaṃ	157	
PA_tika-abh01_t:157_1	kesakumbhādināmantarāpatti viya nāmantarānāpajjanato ca sadā attanāva katanāmatāya	157	
PA_tika-abh01_t:157_2	catukkhandhanibbānāni nāmakaraṇaṭṭhena nāmaṃ. Namanaṃ avinābhāvato ārammaṇābhimukhatā,	157	
PA_tika-abh01_t:157_3	namanahetubhūtatā nāmanaṃ. Atha vā adhivacanasamphasso viya adhivacanaṃ nāmamantarena	157	
PA_tika-abh01_t:157_4	ye anupacitabodhisambhārānaṃ gahaṇaṃ na gacchanti, te nāmāyattaggahaṇā nāmaṃ. Rūpaṃ	157	
PA_tika-abh01_t:157_5	pana vināpi nāmasādhanaṃ attano ruppanasabhāvena gahaṇaṃ upayātīti rūpaṃ.	157	
PA_tika-abh01_t:158_0	119-123. Ito pubbe parikammaṃ pavattaṃ, ito paraṃ bhavaṅgaṃ, majjhe samāpattīti evaṃ	158	
PA_tika-abh01_t:158_1	samāpattīnaṃ appanāparicchedapaññā samāpattikusalatā. Vuṭṭhāne kusalabhāvo pubbe	158	
PA_tika-abh01_t:158_2	vuṭṭhāne paricchedakaraṇañāṇaṃ. Lakkhaṇādivasena aniccādivasena ca manasi karaṇaṃ manasikāro.	158	
PA_tika-abh01_t:159_0	124-134. Sucisīlatā soraccaṃ. Sā hi sobhanakammaratatāti. Sammodakassa, sammodako	159	
PA_tika-abh01_t:159_1	vā mudubhāvo sammodakamudubhāvo, saṇhavācatā. “Aguttadvāratā”ti vutte kesu dvāresūti	159	
PA_tika-abh01_t:159_2	na paññāyatīti “indriyesū”ti vuttaṃ. Sampajānātīti sampajāno, tassa bhāvo sampajaññaṃ.	159	
