segmentnr	original	analyzed
PA_ud_7.9:0.1	Udāna 7.9	udāna 
PA_ud_7.9:0.2	Udapānasutta	udapāna sutta 
PA_ud_7.9:1.1	Evaṁ me sutaṁ—	evam me suta 
PA_ud_7.9:1.2	ekaṁ samayaṁ bhagavā mallesu cārikaṁ caramāno mahatā bhikkhusaṅghena saddhiṁ yena thūṇaṁ nāma mallānaṁ brāhmaṇagāmo tadavasari.	ekam samayam bhagavā mallesu cārikam caramānaḥ mahatā bhikkhu saṅghena saddhim yena thūṇam nāma mallānam brāhmaṇa gāmaḥ tat avasari 
PA_ud_7.9:1.3	Assosuṁ kho thūṇeyyakā brāhmaṇagahapatikā:	assosum kho thūṇeyyakā brāhmaṇa gahapatikā 
PA_ud_7.9:1.4	“samaṇo khalu, bho, gotamo sakyaputto sakyakulā pabbajito mallesu cārikaṁ caramāno mahatā bhikkhusaṅghena saddhiṁ thūṇaṁ anuppatto”ti.	samaṇaḥ khalu bho gotamaḥ sakya putto sakya kulā pabbajitaḥ mallesu cārikam caramānaḥ mahatā bhikkhu saṅghena saddhim thūṇam anuppatto ti 
PA_ud_7.9:1.5	(…) Udapānaṁ tiṇassa ca bhusassa ca yāva mukhato pūresuṁ:	udapānam tiṇassa ca bhusassa ca yāva mukhataḥ pūresu 
PA_ud_7.9:1.6	“mā te muṇḍakā samaṇakā pānīyaṁ apaṁsū”ti.	mā te muṇḍakā samaṇakā pānīyam 
PA_ud_7.9:2.1	Atha kho bhagavā maggā okkamma yena rukkhamūlaṁ tenupasaṅkami; upasaṅkamitvā paññatte āsane nisīdi.	atha kho bhagavā maggā okkamma yena rukkha mūlam tena upasaṅkami upasaṅkamitvā paññatte āsane nisīdi 
PA_ud_7.9:2.2	Nisajja kho bhagavā āyasmantaṁ ānandaṁ āmantesi:	nisajja khalu bhagavān āyasmantam ānandam āmantesi 
PA_ud_7.9:2.3	“iṅgha me tvaṁ, ānanda, etamhā udapānā pānīyaṁ āharā”ti.	me tvaḥ ānandaḥ etamhai udapānā pānīyam āharāti 
PA_ud_7.9:3.1	Evaṁ vutte, āyasmā ānando bhagavantaṁ etadavoca:	evam vutte āyasmai ānandaḥ bhagavantam etat avoca 
PA_ud_7.9:3.2	“idāni so, bhante, udapāno thūṇeyyakehi brāhmaṇagahapatikehi tiṇassa ca bhusassa ca yāva mukhato pūrito:	idāni saḥ bhante udapānaḥ thūṇeyyakehi brāhmaṇa gahapatikehi tiṇassa ca bhusassa ca yāva mukhataḥ pūritaḥ 
PA_ud_7.9:3.3	‘mā te muṇḍakā samaṇakā pānīyaṁ apaṁsū’”ti.	mā te muṇḍakā samaṇakā pānīyam 
PA_ud_7.9:4.1	Dutiyampi kho …pe…	dutiyam pi kho pe 
PA_ud_7.9:4.2	tatiyampi kho bhagavā āyasmantaṁ ānandaṁ āmantesi:	tatiyam pi khalu bhagavān āyasmantam ānandam āmantesi 
PA_ud_7.9:4.3	“iṅgha me tvaṁ, ānanda, etamhā udapānā pānīyaṁ āharā”ti.	me tvaḥ ānandaḥ etamhai udapānā pānīyam āharāti 
PA_ud_7.9:4.4	“Evaṁ, bhante”ti kho āyasmā ānando bhagavato paṭissutvā pattaṁ gahetvā yena so udapāno tenupasaṅkami.	eva bhanta iti kho āyasmai ānandaḥ bhagavataḥ paṭissutvā pattam gahetvā yena saḥ udapānaḥ tena upasaṅkami 
PA_ud_7.9:4.5_0	Atha kho so udapāno āyasmante ānande upasaṅkamante sabbaṁ taṁ tiṇañca bhusañca mukhato	atha kho saḥ udapānaḥ āyasmante ānande upasaṅkamante sabbam tam tiṇam ca bhusam ca mukhataḥ 
PA_ud_7.9:4.5_1	ovamitvā acchassa udakassa anāvilassa vippasannassa yāva mukhato pūrito vissandanto maññe aṭṭhāsi.	ovamitvā acchassa udakassa anāvilassa vippasannassa yāva mukhataḥ pūritaḥ vissandantaḥ maññe aṭṭhāsi 
PA_ud_7.9:5.1	Atha kho āyasmato ānandassa etadahosi:	atha kho āyasmataḥ ānandassa etat ahosi 
PA_ud_7.9:5.2	“acchariyaṁ vata bho, abbhutaṁ vata bho, tathāgatassa mahiddhikatā mahānubhāvatā.	acchariyam vata bho abbhutam vata bho tathāgatassa mahiddhika tā mahā anubhāva tā 
PA_ud_7.9:5.3	Ayañhi so udapāno mayi upasaṅkamante sabbaṁ taṁ tiṇañca bhusañca mukhato ovamitvā acchassa udakassa anāvilassa vippasannassa yāva mukhato pūrito vissandanto maññe ṭhito”ti.	ayan hi saḥ udapānaḥ mayi upasaṅkamante sabbam tam tiṇam ca bhusam ca mukhataḥ ovamitvā acchassa udakassa anāvilassa vippasannassa yāva mukhataḥ pūritaḥ vissandantaḥ maññe ṭhito ti 
PA_ud_7.9:5.4	Pattena pānīyaṁ ādāya yena bhagavā tenupasaṅkami; upasaṅkamitvā bhagavantaṁ etadavoca:	pattena pānīyam ādāya yena bhagavā tena upasaṅkami upasaṅkamitvā bhagavantam etat avoca 
PA_ud_7.9:5.5	“acchariyaṁ, bhante, abbhutaṁ, bhante, tathāgatassa mahiddhikatā mahānubhāvatā.	acchariya bhante abbhuta bhante tathāgatassa mahiddhika tā mahā anubhāva tā 
PA_ud_7.9:5.6	Ayañhi so, bhante, udapāno mayi upasaṅkamante sabbaṁ taṁ tiṇañca bhusañca mukhato ovamitvā acchassa udakassa anāvilassa vippasannassa yāva mukhato pūrito vissandanto maññe aṭṭhāsi.	ayam hi saḥ bhante udapānaḥ mayi upasaṅkamante sabbam tam tiṇam ca bhusam ca mukhataḥ ovamitvā acchassa udakassa anāvilassa vippasannassa yāva mukhataḥ pūritaḥ vissandantaḥ maññe aṭṭhāsi 
PA_ud_7.9:5.7	Pivatu bhagavā pānīyaṁ, pivatu sugato pānīyan”ti.	pivatu bhagavā pānīya pivatu sugataḥ 
PA_ud_7.9:6.1	Atha kho bhagavā etamatthaṁ viditvā tāyaṁ velāyaṁ imaṁ udānaṁ udānesi:	atha kho bhagavā etam attham viditvā tāyam velāyam imam udānam udānesi 
PA_ud_7.9:7.1	“Kiṁ kayirā udapānena,	kim kayirāḥ udapānena 
PA_ud_7.9:7.2	Āpā ce sabbadā siyuṁ;	āpā ce sabbadā siyu 
PA_ud_7.9:7.3	Taṇhāya mūlato chetvā,	taṇhāya mūlataḥ chetvā 
PA_ud_7.9:7.4	Kissa pariyesanaṁ care”ti.	kissa pariyesanam cara iti 
PA_ud_7.9:7.5	Navamaṁ.	navama 
