segmentnr	original	analyzed
PA_ya_5.2.1:78.1_2	samudayasaccañca nuppajjittha dukkhasaccañca nuppajjittha.	▁samuday a sacc añca ▁nuppajj ittha ▁dukkhasacc añca ▁nuppajj ittha
PA_ya_5.2.1:79.1	Yassa yattha dukkhasaccaṁ nuppajjittha tassa tattha maggasaccaṁ nuppajjitthāti? Āmantā.	▁yassa ▁yattha ▁dukkhasacc aṃ ▁nuppajj ittha ▁tassa ▁tattha ▁maggasaccaṃ ▁nuppajj itthāti ▁āmantā
PA_ya_5.2.1:80.1	Yassa vā pana yattha maggasaccaṁ nuppajjittha tassa tattha dukkhasaccaṁ nuppajjitthāti?	▁yassa ▁vā ▁pana ▁yattha ▁maggasaccaṃ ▁nuppajj ittha ▁tassa ▁tattha ▁dukkhasacc aṃ ▁nuppajj itthāti
PA_ya_5.2.1:81.1_0	Suddhāvāsānaṁ dutiye citte vattamāne anabhisametāvīnaṁ asaññasattānaṁ tesaṁ tattha	▁suddhāvās ānaṃ ▁dutiy e ▁citt e ▁vattamān e ▁anabhi sam e tā vī naṃ ▁asaññasattānaṃ ▁tesaṃ ▁tattha
PA_ya_5.2.1:81.1_1	maggasaccaṁ nuppajjittha, no ca tesaṁ tattha dukkhasaccaṁ nuppajjittha. Suddhāvāsaṁ	▁maggasaccaṃ ▁nuppajj ittha ▁no ▁ca ▁tesaṃ ▁tattha ▁dukkhasacc aṃ ▁nuppajj ittha ▁suddhāvās aṃ
PA_ya_5.2.1:81.1_2	upapajjantānaṁ tesaṁ tattha maggasaccañca nuppajjittha dukkhasaccañca nuppajjittha.	▁upapajjantānaṃ ▁tesaṃ ▁tattha ▁magg a sacc añca ▁nuppajj ittha ▁dukkhasacc añca ▁nuppajj ittha
PA_ya_5.2.1:82.1	Yassa yattha samudayasaccaṁ nuppajjittha tassa tattha maggasaccaṁ nuppajjitthāti? Āmantā.	▁yassa ▁yattha ▁samudayasaccaṃ ▁nuppajj ittha ▁tassa ▁tattha ▁maggasaccaṃ ▁nuppajj itthāti ▁āmantā
PA_ya_5.2.1:83.1	Yassa vā pana yattha maggasaccaṁ nuppajjittha tassa tattha samudayasaccaṁ nuppajjitthāti?	▁yassa ▁vā ▁pana ▁yattha ▁maggasaccaṃ ▁nuppajj ittha ▁tassa ▁tattha ▁samudayasaccaṃ ▁nuppajj itthāti
PA_ya_5.2.1:84.1_0	Suddhāvāsānaṁ dutiye akusale citte vattamāne anabhisametāvīnaṁ tesaṁ tattha maggasaccaṁ	▁suddhāvās ānaṃ ▁dutiy e ▁akusal e ▁citt e ▁vattamān e ▁anabhi sam e tā vī naṃ ▁tesaṃ ▁tattha ▁maggasaccaṃ
PA_ya_5.2.1:84.1_1	nuppajjittha, no ca tesaṁ tattha samudayasaccaṁ nuppajjittha. Suddhāvāsānaṁ dutiye	▁nuppajj ittha ▁no ▁ca ▁tesaṃ ▁tattha ▁samudayasaccaṃ ▁nuppajj ittha ▁suddhāvās ānaṃ ▁dutiy e
PA_ya_5.2.1:84.1_2	citte vattamāne asaññasattānaṁ tesaṁ tattha maggasaccañca nuppajjittha samudayasaccañca nuppajjittha.	▁citt e ▁vattamān e ▁asaññasattānaṃ ▁tesaṃ ▁tattha ▁magg a sacc añca ▁nuppajj ittha ▁samuday a sacc añca ▁nuppajj ittha
PA_ya_5.2.1:85.0.1	5.2.1.3. Anāgatavāra	▁anāgat avāra
PA_ya_5.2.1:85.0.2	5.2.1.3.1. Anulomapuggala	▁anulom apuggal a
PA_ya_5.2.1:85.1	Yassa dukkhasaccaṁ uppajjissati tassa samudayasaccaṁ uppajjissatīti?	▁yassa ▁dukkhasacc aṃ ▁uppajjissati ▁tassa ▁samudayasaccaṃ ▁uppajjissatīti
PA_ya_5.2.1:86.1_0	Aggamaggasamaṅgīnaṁ arahantānaṁ yassa cittassa anantarā aggamaggaṁ paṭilabhissanti	▁aggamagg a samaṃgī naṃ ▁arahant ānaṃ ▁yassa ▁cittassa ▁anantar ā ▁aggamagg aṃ ▁paṭilabhi ssa nti
PA_ya_5.2.1:86.1_1	tesaṁ dukkhasaccaṁ uppajjissati, no ca tesaṁ samudayasaccaṁ uppajjissati. Itaresaṁ	▁tesaṃ ▁dukkhasacc aṃ ▁uppajjissati ▁no ▁ca ▁tesaṃ ▁samudayasaccaṃ ▁uppajjissati ▁itaresaṃ
PA_ya_5.2.1:86.1_2	tesaṁ dukkhasaccañca uppajjissati samudayasaccañca uppajjissati.	▁tesaṃ ▁dukkhasacc añca ▁uppajjissati ▁samuday a sacc añca ▁uppajjissati
PA_ya_5.2.1:87.1	Yassa vā pana …pe… ? Āmantā.	▁yassa ▁vā ▁pana ▁pe ▁āmantā
PA_ya_5.2.1:88.1	Yassa dukkhasaccaṁ uppajjissati tassa maggasaccaṁ uppajjissatīti?	▁yassa ▁dukkhasacc aṃ ▁uppajjissati ▁tassa ▁maggasaccaṃ ▁uppajjissatīti
PA_ya_5.2.1:89.1_0	Aggamaggasamaṅgīnaṁ arahantānaṁ ye ca puthujjanā maggaṁ na paṭilabhissanti tesaṁ	▁aggamagg a samaṃgī naṃ ▁arahant ānaṃ ▁ye ▁ca ▁puthujjan ā ▁maggaṃ ▁na ▁paṭilabhi ssa nti ▁tesaṃ
PA_ya_5.2.1:89.1_1	dukkhasaccaṁ uppajjissati, no ca tesaṁ maggasaccaṁ uppajjissati. Yassa cittassa anantarā	▁dukkhasacc aṃ ▁uppajjissati ▁no ▁ca ▁tesaṃ ▁maggasaccaṃ ▁uppajjissati ▁yassa ▁cittassa ▁anantar ā
PA_ya_5.2.1:89.1_2	aggamaggaṁ paṭilabhissanti ye caññe maggaṁ paṭilabhissanti tesaṁ dukkhasaccañca uppajjissati	▁aggamagg aṃ ▁paṭilabhi ssa nti ▁ye ▁ca ññ e ▁maggaṃ ▁paṭilabhi ssa nti ▁tesaṃ ▁dukkhasacc añca ▁uppajjissati
PA_ya_5.2.1:89.1_3	maggasaccañca uppajjissati.	▁magg a sacc añca ▁uppajjissati
PA_ya_5.2.1:90.1	Yassa vā pana …pe… uppajjissatīti? Āmantā.	▁yassa ▁vā ▁pana ▁pe ▁uppajjissatīti ▁āmantā
PA_ya_5.2.1:91.1	Yassa samudayasaccaṁ uppajjissati tassa maggasaccaṁ uppajjissatīti?	▁yassa ▁samudayasaccaṃ ▁uppajjissati ▁tassa ▁maggasaccaṃ ▁uppajjissatīti
PA_ya_5.2.1:92.1_0	Ye puthujjanā maggaṁ na paṭilabhissanti tesaṁ samudayasaccaṁ uppajjissati, no ca	▁ye ▁puthujjan ā ▁maggaṃ ▁na ▁paṭilabhi ssa nti ▁tesaṃ ▁samudayasaccaṃ ▁uppajjissati ▁no ▁ca
PA_ya_5.2.1:92.1_1	tesaṁ maggasaccaṁ uppajjissati. Ye maggaṁ paṭilabhissanti tesaṁ samudayasaccañca	▁tesaṃ ▁maggasaccaṃ ▁uppajjissati ▁ye ▁maggaṃ ▁paṭilabhi ssa nti ▁tesaṃ ▁samuday a sacc añca
PA_ya_5.2.1:92.1_2	uppajjissati maggasaccañca uppajjissati.	▁uppajjissati ▁magg a sacc añca ▁uppajjissati
PA_ya_5.2.1:93.1	Yassa vā pana maggasaccaṁ uppajjissati tassa samudayasaccaṁ uppajjissatīti?	▁yassa ▁vā ▁pana ▁maggasaccaṃ ▁uppajjissati ▁tassa ▁samudayasaccaṃ ▁uppajjissatīti
PA_ya_5.2.1:94.1_0	Yassa cittassa anantarā aggamaggaṁ paṭilabhissanti tesaṁ maggasaccaṁ uppajjissati,	▁yassa ▁cittassa ▁anantar ā ▁aggamagg aṃ ▁paṭilabhi ssa nti ▁tesaṃ ▁maggasaccaṃ ▁uppajjissati
PA_ya_5.2.1:94.1_1	no ca tesaṁ samudayasaccaṁ uppajjissati. Ye maggaṁ paṭilabhissanti tesaṁ maggasaccañca	▁no ▁ca ▁tesaṃ ▁samudayasaccaṃ ▁uppajjissati ▁ye ▁maggaṃ ▁paṭilabhi ssa nti ▁tesaṃ ▁magg a sacc añca
PA_ya_5.2.1:94.1_2	uppajjissati samudayasaccañca uppajjissati.	▁uppajjissati ▁samuday a sacc añca ▁uppajjissati
PA_ya_5.2.1:95.0	5.2.1.3.2. Anulomaokāsa	▁anulom a okāsa
PA_ya_5.2.1:95.1	Yattha dukkhasaccaṁ uppajjissati …pe….	▁yattha ▁dukkhasacc aṃ ▁uppajjissati ▁pe
PA_ya_5.2.1:96.0	5.2.1.3.3. Anulomapuggalokāsa	▁anulom apuggal okāsa
PA_ya_5.2.1:96.1	Yassa yattha dukkhasaccaṁ uppajjissati tassa tattha samudayasaccaṁ uppajjissatīti?	▁yassa ▁yattha ▁dukkhasacc aṃ ▁uppajjissati ▁tassa ▁tattha ▁samudayasaccaṃ ▁uppajjissatīti
PA_ya_5.2.1:97.1_0	Aggamaggasamaṅgīnaṁ arahantānaṁ yassa cittassa anantarā aggamaggaṁ paṭilabhissanti	▁aggamagg a samaṃgī naṃ ▁arahant ānaṃ ▁yassa ▁cittassa ▁anantar ā ▁aggamagg aṃ ▁paṭilabhi ssa nti
PA_ya_5.2.1:97.1_1	asaññasattānaṁ tesaṁ tattha dukkhasaccaṁ uppajjissati, no ca tesaṁ tattha samudayasaccaṁ	▁asaññasattānaṃ ▁tesaṃ ▁tattha ▁dukkhasacc aṃ ▁uppajjissati ▁no ▁ca ▁tesaṃ ▁tattha ▁samudayasaccaṃ
PA_ya_5.2.1:97.1_2	uppajjissati. Itaresaṁ catuvokārānaṁ pañcavokārānaṁ tesaṁ tattha dukkhasaccañca uppajjissati	▁uppajjissati ▁itaresaṃ ▁catu vo kār ānaṃ ▁pañcavokār ānaṃ ▁tesaṃ ▁tattha ▁dukkhasacc añca ▁uppajjissati
PA_ya_5.2.1:97.1_3	samudayasaccañca uppajjissati.	▁samuday a sacc añca ▁uppajjissati
PA_ya_5.2.1:98.1	Yassa vā pana yattha samudayasaccaṁ uppajjissati …pe… uppajjissatīti? Āmantā.	▁yassa ▁vā ▁pana ▁yattha ▁samudayasaccaṃ ▁uppajjissati ▁pe ▁uppajjissatīti ▁āmantā
PA_ya_5.2.1:99.1	Yassa yattha dukkhasaccaṁ uppajjissati tassa tattha maggasaccaṁ uppajjissatīti?	▁yassa ▁yattha ▁dukkhasacc aṃ ▁uppajjissati ▁tassa ▁tattha ▁maggasaccaṃ ▁uppajjissatīti
PA_ya_5.2.1:100.1_0	Aggamaggasamaṅgīnaṁ arahantānaṁ ye ca puthujjanā maggaṁ na paṭilabhissanti āpāyikānaṁ	▁aggamagg a samaṃgī naṃ ▁arahant ānaṃ ▁ye ▁ca ▁puthujjan ā ▁maggaṃ ▁na ▁paṭilabhi ssa nti ▁ ā pāy ikānaṃ
PA_ya_5.2.1:100.1_1	asaññasattānaṁ tesaṁ tattha dukkhasaccaṁ uppajjissati, no ca tesaṁ tattha maggasaccaṁ	▁asaññasattānaṃ ▁tesaṃ ▁tattha ▁dukkhasacc aṃ ▁uppajjissati ▁no ▁ca ▁tesaṃ ▁tattha ▁maggasaccaṃ
PA_ya_5.2.1:100.1_2	uppajjissati. Yassa cittassa anantarā aggamaggaṁ paṭilabhissanti, ye caññe maggaṁ	▁uppajjissati ▁yassa ▁cittassa ▁anantar ā ▁aggamagg aṃ ▁paṭilabhi ssa nti ▁ye ▁ca ññ e ▁maggaṃ
PA_ya_5.2.1:100.1_3	paṭilabhissanti tesaṁ tattha dukkhasaccañca uppajjissati maggasaccañca uppajjissati.	▁paṭilabhi ssa nti ▁tesaṃ ▁tattha ▁dukkhasacc añca ▁uppajjissati ▁magg a sacc añca ▁uppajjissati
PA_ya_5.2.1:101.1	Yassa vā pana yattha maggasaccaṁ uppajjissati tassa tattha dukkhasaccaṁ uppajjissatīti? Āmantā.	▁yassa ▁vā ▁pana ▁yattha ▁maggasaccaṃ ▁uppajjissati ▁tassa ▁tattha ▁dukkhasacc aṃ ▁uppajjissatīti ▁āmantā
PA_ya_5.2.1:102.1	Yassa yattha samudayasaccaṁ uppajjissati tassa tattha maggasaccaṁ uppajjissatīti?	▁yassa ▁yattha ▁samudayasaccaṃ ▁uppajjissati ▁tassa ▁tattha ▁maggasaccaṃ ▁uppajjissatīti
PA_ya_5.2.1:103.1_0	Āpāyikānaṁ ye ca puthujjanā maggaṁ na paṭilabhissanti tesaṁ tattha samudayasaccaṁ	▁ ā pāy ikānaṃ ▁ye ▁ca ▁puthujjan ā ▁maggaṃ ▁na ▁paṭilabhi ssa nti ▁tesaṃ ▁tattha ▁samudayasaccaṃ
PA_ya_5.2.1:103.1_1	uppajjissati, no ca tesaṁ tattha maggasaccaṁ uppajjissati. Ye maggaṁ paṭilabhissanti	▁uppajjissati ▁no ▁ca ▁tesaṃ ▁tattha ▁maggasaccaṃ ▁uppajjissati ▁ye ▁maggaṃ ▁paṭilabhi ssa nti
PA_ya_5.2.1:103.1_2	tesaṁ tattha samudayasaccañca uppajjissati maggasaccañca uppajjissati.	▁tesaṃ ▁tattha ▁samuday a sacc añca ▁uppajjissati ▁magg a sacc añca ▁uppajjissati
PA_ya_5.2.1:104.1	Yassa vā pana yattha maggasaccaṁ uppajjissati tassa tattha samudayasaccaṁ uppajjissatīti?	▁yassa ▁vā ▁pana ▁yattha ▁maggasaccaṃ ▁uppajjissati ▁tassa ▁tattha ▁samudayasaccaṃ ▁uppajjissatīti
PA_ya_5.2.1:105.1_0	Yassa cittassa anantarā aggamaggaṁ paṭilabhissanti tesaṁ tattha maggasaccaṁ uppajjissati,	▁yassa ▁cittassa ▁anantar ā ▁aggamagg aṃ ▁paṭilabhi ssa nti ▁tesaṃ ▁tattha ▁maggasaccaṃ ▁uppajjissati
PA_ya_5.2.1:105.1_1	no ca tesaṁ tattha samudayasaccaṁ uppajjissati. Ye maggaṁ paṭilabhissanti tesaṁ tattha	▁no ▁ca ▁tesaṃ ▁tattha ▁samudayasaccaṃ ▁uppajjissati ▁ye ▁maggaṃ ▁paṭilabhi ssa nti ▁tesaṃ ▁tattha
PA_ya_5.2.1:105.1_2	maggasaccañca uppajjissati samudayasaccañca uppajjissati.	▁magg a sacc añca ▁uppajjissati ▁samuday a sacc añca ▁uppajjissati
PA_ya_5.2.1:106.0	5.2.1.3.4. Paccanīkapuggala	▁ paccanīk apuggal a
PA_ya_5.2.1:106.1	Yassa dukkhasaccaṁ nuppajjissati tassa samudayasaccaṁ nuppajjissatīti? Āmantā.	▁yassa ▁dukkhasacc aṃ ▁nuppajj issati ▁tassa ▁samudayasaccaṃ ▁nuppajj issatīti ▁āmantā
PA_ya_5.2.1:107.1	Yassa vā pana samudayasaccaṁ nuppajjissati tassa dukkhasaccaṁ nuppajjissatīti?	▁yassa ▁vā ▁pana ▁samudayasaccaṃ ▁nuppajj issati ▁tassa ▁dukkhasacc aṃ ▁nuppajj issatīti
PA_ya_5.2.1:108.1_0	Aggamaggasamaṅgīnaṁ arahantānaṁ yassa cittassa anantarā aggamaggaṁ paṭilabhissanti	▁aggamagg a samaṃgī naṃ ▁arahant ānaṃ ▁yassa ▁cittassa ▁anantar ā ▁aggamagg aṃ ▁paṭilabhi ssa nti
PA_ya_5.2.1:108.1_1	tesaṁ samudayasaccaṁ nuppajjissati, no ca tesaṁ dukkhasaccaṁ nuppajjissati. Pacchimacittasamaṅgīnaṁ	▁tesaṃ ▁samudayasaccaṃ ▁nuppajj issati ▁no ▁ca ▁tesaṃ ▁dukkhasacc aṃ ▁nuppajj issati ▁pacchim acitt a samaṃgī naṃ
PA_ya_5.2.1:108.1_2	tesaṁ samudayasaccañca nuppajjissati dukkhasaccañca nuppajjissati.	▁tesaṃ ▁samuday a sacc añca ▁nuppajj issati ▁dukkhasacc añca ▁nuppajj issati
PA_ya_5.2.1:109.1	Yassa dukkhasaccaṁ nuppajjissati tassa maggasaccaṁ nuppajjissatīti? Āmantā.	▁yassa ▁dukkhasacc aṃ ▁nuppajj issati ▁tassa ▁maggasaccaṃ ▁nuppajj issatīti ▁āmantā
PA_ya_5.2.1:110.1	Yassa vā pana maggasaccaṁ nuppajjissati tassa dukkhasaccaṁ nuppajjissatīti?	▁yassa ▁vā ▁pana ▁maggasaccaṃ ▁nuppajj issati ▁tassa ▁dukkhasacc aṃ ▁nuppajj issatīti
PA_ya_5.2.1:111.1_0	Aggamaggasamaṅgīnaṁ arahantānaṁ ye ca puthujjanā maggaṁ na paṭilabhissanti tesaṁ	▁aggamagg a samaṃgī naṃ ▁arahant ānaṃ ▁ye ▁ca ▁puthujjan ā ▁maggaṃ ▁na ▁paṭilabhi ssa nti ▁tesaṃ
PA_ya_5.2.1:111.1_1	maggasaccaṁ nuppajjissati, no ca tesaṁ dukkhasaccaṁ nuppajjissati. Pacchimacittasamaṅgīnaṁ	▁maggasaccaṃ ▁nuppajj issati ▁no ▁ca ▁tesaṃ ▁dukkhasacc aṃ ▁nuppajj issati ▁pacchim acitt a samaṃgī naṃ
PA_ya_5.2.1:111.1_2	tesaṁ maggasaccañca nuppajjissati dukkhasaccañca nuppajjissati.	▁tesaṃ ▁magg a sacc añca ▁nuppajj issati ▁dukkhasacc añca ▁nuppajj issati
PA_ya_5.2.1:112.1	Yassa samudayasaccaṁ nuppajjissati tassa maggasaccaṁ nuppajjissatīti?	▁yassa ▁samudayasaccaṃ ▁nuppajj issati ▁tassa ▁maggasaccaṃ ▁nuppajj issatīti
PA_ya_5.2.1:113.1_0	Yassa cittassa anantarā aggamaggaṁ paṭilabhissanti tesaṁ samudayasaccaṁ nuppajjissati,	▁yassa ▁cittassa ▁anantar ā ▁aggamagg aṃ ▁paṭilabhi ssa nti ▁tesaṃ ▁samudayasaccaṃ ▁nuppajj issati
PA_ya_5.2.1:113.1_1	no ca tesaṁ maggasaccaṁ nuppajjissati. Aggamaggasamaṅgīnaṁ arahantānaṁ tesaṁ samudayasaccañca	▁no ▁ca ▁tesaṃ ▁maggasaccaṃ ▁nuppajj issati ▁aggamagg a samaṃgī naṃ ▁arahant ānaṃ ▁tesaṃ ▁samuday a sacc añca
PA_ya_5.2.1:113.1_2	nuppajjissati maggasaccañca nuppajjissati.	▁nuppajj issati ▁magg a sacc añca ▁nuppajj issati
PA_ya_5.2.1:114.1	Yassa vā pana maggasaccaṁ nuppajjissati tassa samudayasaccaṁ nuppajjissatīti?	▁yassa ▁vā ▁pana ▁maggasaccaṃ ▁nuppajj issati ▁tassa ▁samudayasaccaṃ ▁nuppajj issatīti
PA_ya_5.2.1:115.1_0	Ye puthujjanā maggaṁ na paṭilabhissanti tesaṁ maggasaccaṁ nuppajjissati, no ca tesaṁ	▁ye ▁puthujjan ā ▁maggaṃ ▁na ▁paṭilabhi ssa nti ▁tesaṃ ▁maggasaccaṃ ▁nuppajj issati ▁no ▁ca ▁tesaṃ
PA_ya_5.2.1:115.1_1	samudayasaccaṁ nuppajjissati. Aggamaggasamaṅgīnaṁ arahantānaṁ tesaṁ maggasaccañca	▁samudayasaccaṃ ▁nuppajj issati ▁aggamagg a samaṃgī naṃ ▁arahant ānaṃ ▁tesaṃ ▁magg a sacc añca
PA_ya_5.2.1:115.1_2	nuppajjissati samudayasaccañca nuppajjissati.	▁nuppajj issati ▁samuday a sacc añca ▁nuppajj issati
PA_ya_5.2.1:116.0	5.2.1.3.5. Paccanīkaokāsa	▁ paccanīk a okāsa
PA_ya_5.2.1:116.1	Yattha dukkhasaccaṁ nuppajjissati …pe….	▁yattha ▁dukkhasacc aṃ ▁nuppajj issati ▁pe
PA_ya_5.2.1:117.0	5.2.1.3.6. Paccanīkapuggalokāsa	▁ paccanīk apuggal okāsa
PA_ya_5.2.1:117.1	Yassa yattha dukkhasaccaṁ nuppajjissati tassa tattha samudayasaccaṁ nuppajjissatīti? Āmantā.	▁yassa ▁yattha ▁dukkhasacc aṃ ▁nuppajj issati ▁tassa ▁tattha ▁samudayasaccaṃ ▁nuppajj issatīti ▁āmantā
PA_ya_5.2.1:118.1	Yassa vā pana yattha samudayasaccaṁ nuppajjissati tassa tattha dukkhasaccaṁ nuppajjissatīti?	▁yassa ▁vā ▁pana ▁yattha ▁samudayasaccaṃ ▁nuppajj issati ▁tassa ▁tattha ▁dukkhasacc aṃ ▁nuppajj issatīti
PA_ya_5.2.1:119.1_0	Aggamaggasamaṅgīnaṁ arahantānaṁ yassa cittassa anantarā aggamaggaṁ paṭilabhissanti	▁aggamagg a samaṃgī naṃ ▁arahant ānaṃ ▁yassa ▁cittassa ▁anantar ā ▁aggamagg aṃ ▁paṭilabhi ssa nti
PA_ya_5.2.1:119.1_1	asaññasattānaṁ tesaṁ tattha samudayasaccaṁ nuppajjissati, no ca tesaṁ tattha dukkhasaccaṁ	▁asaññasattānaṃ ▁tesaṃ ▁tattha ▁samudayasaccaṃ ▁nuppajj issati ▁no ▁ca ▁tesaṃ ▁tattha ▁dukkhasacc aṃ
PA_ya_5.2.1:119.1_2	nuppajjissati. Pacchimacittasamaṅgīnaṁ tesaṁ tattha samudayasaccañca nuppajjissati	▁nuppajj issati ▁pacchim acitt a samaṃgī naṃ ▁tesaṃ ▁tattha ▁samuday a sacc añca ▁nuppajj issati
PA_ya_5.2.1:119.1_3	dukkhasaccañca nuppajjissati.	▁dukkhasacc añca ▁nuppajj issati
PA_ya_5.2.1:120.1	Yassa yattha dukkhasaccaṁ nuppajjissati tassa tattha maggasaccaṁ nuppajjissatīti? Āmantā.	▁yassa ▁yattha ▁dukkhasacc aṃ ▁nuppajj issati ▁tassa ▁tattha ▁maggasaccaṃ ▁nuppajj issatīti ▁āmantā
PA_ya_5.2.1:121.1	Yassa vā pana yattha maggasaccaṁ nuppajjissati tassa tattha dukkhasaccaṁ nuppajjissatīti?	▁yassa ▁vā ▁pana ▁yattha ▁maggasaccaṃ ▁nuppajj issati ▁tassa ▁tattha ▁dukkhasacc aṃ ▁nuppajj issatīti
PA_ya_5.2.1:122.1_0	Aggamaggasamaṅgīnaṁ arahantānaṁ ye ca puthujjanā maggaṁ na paṭilabhissanti āpāyikānaṁ	▁aggamagg a samaṃgī naṃ ▁arahant ānaṃ ▁ye ▁ca ▁puthujjan ā ▁maggaṃ ▁na ▁paṭilabhi ssa nti ▁ ā pāy ikānaṃ
PA_ya_5.2.1:122.1_1	asaññasattānaṁ tesaṁ tattha maggasaccaṁ nuppajjissati, no ca tesaṁ tattha dukkhasaccaṁ	▁asaññasattānaṃ ▁tesaṃ ▁tattha ▁maggasaccaṃ ▁nuppajj issati ▁no ▁ca ▁tesaṃ ▁tattha ▁dukkhasacc aṃ
PA_ya_5.2.1:122.1_2	nuppajjissati. Pacchimacittasamaṅgīnaṁ tesaṁ tattha maggasaccañca nuppajjissati dukkhasaccañca nuppajjissati.	▁nuppajj issati ▁pacchim acitt a samaṃgī naṃ ▁tesaṃ ▁tattha ▁magg a sacc añca ▁nuppajj issati ▁dukkhasacc añca ▁nuppajj issati
PA_ya_5.2.1:123.1	Yassa yattha samudayasaccaṁ nuppajjissati tassa tattha maggasaccaṁ nuppajjissatīti?	▁yassa ▁yattha ▁samudayasaccaṃ ▁nuppajj issati ▁tassa ▁tattha ▁maggasaccaṃ ▁nuppajj issatīti
PA_ya_5.2.1:124.1_0	Yassa cittassa anantarā aggamaggaṁ paṭilabhissanti tesaṁ tattha samudayasaccaṁ nuppajjissati,	▁yassa ▁cittassa ▁anantar ā ▁aggamagg aṃ ▁paṭilabhi ssa nti ▁tesaṃ ▁tattha ▁samudayasaccaṃ ▁nuppajj issati
PA_ya_5.2.1:124.1_1	no ca tesaṁ tattha maggasaccaṁ nuppajjissati. Aggamaggasamaṅgīnaṁ arahantānaṁ asaññasattānaṁ	▁no ▁ca ▁tesaṃ ▁tattha ▁maggasaccaṃ ▁nuppajj issati ▁aggamagg a samaṃgī naṃ ▁arahant ānaṃ ▁asaññasattānaṃ
PA_ya_5.2.1:124.1_2	tesaṁ tattha samudayasaccañca nuppajjissati maggasaccañca nuppajjissati.	▁tesaṃ ▁tattha ▁samuday a sacc añca ▁nuppajj issati ▁magg a sacc añca ▁nuppajj issati
PA_ya_5.2.1:125.1	Yassa vā pana yattha maggasaccaṁ nuppajjissati tassa tattha samudayasaccaṁ nuppajjissatīti?	▁yassa ▁vā ▁pana ▁yattha ▁maggasaccaṃ ▁nuppajj issati ▁tassa ▁tattha ▁samudayasaccaṃ ▁nuppajj issatīti
PA_ya_5.2.1:126.1_0	Āpāyikānaṁ ye ca puthujjanā maggaṁ na paṭilabhissanti tesaṁ tattha maggasaccaṁ nuppajjissati,	▁ ā pāy ikānaṃ ▁ye ▁ca ▁puthujjan ā ▁maggaṃ ▁na ▁paṭilabhi ssa nti ▁tesaṃ ▁tattha ▁maggasaccaṃ ▁nuppajj issati
PA_ya_5.2.1:126.1_1	no ca tesaṁ tattha samudayasaccaṁ nuppajjissati. Aggamaggasamaṅgīnaṁ arahantānaṁ	▁no ▁ca ▁tesaṃ ▁tattha ▁samudayasaccaṃ ▁nuppajj issati ▁aggamagg a samaṃgī naṃ ▁arahant ānaṃ
PA_ya_5.2.1:126.1_2	asaññasattānaṁ tesaṁ tattha maggasaccañca nuppajjissati samudayasaccañca nuppajjissati.	▁asaññasattānaṃ ▁tesaṃ ▁tattha ▁magg a sacc añca ▁nuppajj issati ▁samuday a sacc añca ▁nuppajj issati
PA_ya_5.2.1:127.0.1	5.2.1.4. Paccuppannātītavāra	▁paccuppann ā tīt avāra
PA_ya_5.2.1:127.0.2	5.2.1.4.1. Anulomapuggala	▁anulom apuggal a
PA_ya_5.2.1:127.1	Yassa dukkhasaccaṁ uppajjati tassa samudayasaccaṁ uppajjitthāti? Āmantā.	▁yassa ▁dukkhasacc aṃ ▁uppajjati ▁tassa ▁samudayasaccaṃ ▁uppajj itthāti ▁āmantā
PA_ya_5.2.1:128.1	Yassa vā pana samudayasaccaṁ uppajjittha tassa dukkhasaccaṁ uppajjatīti?	▁yassa ▁vā ▁pana ▁samudayasaccaṃ ▁uppajjittha ▁tassa ▁dukkhasacc aṃ ▁uppajjatīti
PA_ya_5.2.1:129.1_0	Sabbesaṁ cavantānaṁ pavatte cittassa bhaṅgakkhaṇe arūpe maggassa ca phalassa ca uppādakkhaṇe	▁sabbesaṃ ▁cavantānaṃ ▁pavatt e ▁cittassa ▁bhaṃgakkhaṇe ▁arūp e ▁magg assa ▁ca ▁phal assa ▁ca ▁uppādakkhaṇe
PA_ya_5.2.1:129.1_1	tesaṁ samudayasaccaṁ uppajjittha, no ca tesaṁ dukkhasaccaṁ uppajjati. Sabbesaṁ upapajjantānaṁ	▁tesaṃ ▁samudayasaccaṃ ▁uppajjittha ▁no ▁ca ▁tesaṃ ▁dukkhasacc aṃ ▁uppajjati ▁sabbesaṃ ▁upapajjantānaṃ
PA_ya_5.2.1:129.1_2	pavatte cittassa uppādakkhaṇe tesaṁ samudayasaccañca uppajjittha dukkhasaccañca uppajjati.	▁pavatt e ▁cittassa ▁uppādakkhaṇe ▁tesaṃ ▁samuday a sacc añca ▁uppajjittha ▁dukkhasacc añca ▁uppajjati
PA_ya_5.2.1:130.1_0	Yassa dukkhasaccaṁ uppajjati tassa maggasaccaṁ uppajjitthāti? Anabhisametāvīnaṁ upapajjantānaṁ	▁yassa ▁dukkhasacc aṃ ▁uppajjati ▁tassa ▁maggasaccaṃ ▁uppajj itthāti ▁anabhi sam e tā vī naṃ ▁upapajjantānaṃ
PA_ya_5.2.1:130.1_1	pavatte cittassa uppādakkhaṇe tesaṁ dukkhasaccaṁ uppajjati, no ca tesaṁ maggasaccaṁ	▁pavatt e ▁cittassa ▁uppādakkhaṇe ▁tesaṃ ▁dukkhasacc aṃ ▁uppajjati ▁no ▁ca ▁tesaṃ ▁maggasaccaṃ
PA_ya_5.2.1:130.1_2	uppajjittha. Abhisametāvīnaṁ upapajjantānaṁ pavatte cittassa uppādakkhaṇe tesaṁ dukkhasaccañca	▁uppajjittha ▁abhi sam e tā vī naṃ ▁upapajjantānaṃ ▁pavatt e ▁cittassa ▁uppādakkhaṇe ▁tesaṃ ▁dukkhasacc añca
PA_ya_5.2.1:130.1_3	uppajjati maggasaccañca uppajjittha.	▁uppajjati ▁magg a sacc añca ▁uppajjittha
PA_ya_5.2.1:131.1	Yassa vā pana maggasaccaṁ uppajjittha tassa dukkhasaccaṁ uppajjatīti?	▁yassa ▁vā ▁pana ▁maggasaccaṃ ▁uppajjittha ▁tassa ▁dukkhasacc aṃ ▁uppajjatīti
PA_ya_5.2.1:132.1_0	Abhisametāvīnaṁ cavantānaṁ pavatte cittassa bhaṅgakkhaṇe arūpe maggassa ca phalassa	▁abhi sam e tā vī naṃ ▁cavantānaṃ ▁pavatt e ▁cittassa ▁bhaṃgakkhaṇe ▁arūp e ▁magg assa ▁ca ▁phal assa
PA_ya_5.2.1:132.1_1	ca uppādakkhaṇe tesaṁ maggasaccaṁ uppajjittha, no ca tesaṁ dukkhasaccaṁ uppajjati.	▁ca ▁uppādakkhaṇe ▁tesaṃ ▁maggasaccaṃ ▁uppajjittha ▁no ▁ca ▁tesaṃ ▁dukkhasacc aṃ ▁uppajjati
PA_ya_5.2.1:132.1_2	Abhisametāvīnaṁ upapajjantānaṁ pavatte cittassa uppādakkhaṇe tesaṁ maggasaccañca	▁abhi sam e tā vī naṃ ▁upapajjantānaṃ ▁pavatt e ▁cittassa ▁uppādakkhaṇe ▁tesaṃ ▁magg a sacc añca
PA_ya_5.2.1:132.1_3	uppajjittha dukkhasaccañca uppajjati.	▁uppajjittha ▁dukkhasacc añca ▁uppajjati
PA_ya_5.2.1:133.1	Yassa samudayasaccaṁ uppajjati tassa maggasaccaṁ uppajjitthāti?	▁yassa ▁samudayasaccaṃ ▁uppajjati ▁tassa ▁maggasaccaṃ ▁uppajj itthāti
PA_ya_5.2.1:134.1_0	Anabhisametāvīnaṁ taṇhāya uppādakkhaṇe tesaṁ samudayasaccaṁ uppajjati, no ca tesaṁ	▁anabhi sam e tā vī naṃ ▁taṇhā ya ▁uppādakkhaṇe ▁tesaṃ ▁samudayasaccaṃ ▁uppajjati ▁no ▁ca ▁tesaṃ
PA_ya_5.2.1:134.1_1	maggasaccaṁ uppajjittha. Abhisametāvīnaṁ taṇhāya uppādakkhaṇe tesaṁ samudayasaccañca	▁maggasaccaṃ ▁uppajjittha ▁abhi sam e tā vī naṃ ▁taṇhā ya ▁uppādakkhaṇe ▁tesaṃ ▁samuday a sacc añca
PA_ya_5.2.1:134.1_2	uppajjati maggasaccañca uppajjittha.	▁uppajjati ▁magg a sacc añca ▁uppajjittha
PA_ya_5.2.1:135.1	Yassa vā pana maggasaccaṁ uppajjittha tassa samudayasaccaṁ uppajjatīti?	▁yassa ▁vā ▁pana ▁maggasaccaṃ ▁uppajjittha ▁tassa ▁samudayasaccaṃ ▁uppajjatīti
PA_ya_5.2.1:136.1_0	Abhisametāvīnaṁ taṇhāya bhaṅgakkhaṇe taṇhāvippayuttacitte vattamāne nirodhasamāpannānaṁ	▁abhi sam e tā vī naṃ ▁taṇhā ya ▁bhaṃgakkhaṇe ▁taṇhā vippayutt acitt e ▁vattamān e ▁nirodh a samāpann ānaṃ
PA_ya_5.2.1:136.1_1	tesaṁ maggasaccaṁ uppajjittha, no ca tesaṁ samudayasaccaṁ uppajjati. Abhisametāvīnaṁ	▁tesaṃ ▁maggasaccaṃ ▁uppajjittha ▁no ▁ca ▁tesaṃ ▁samudayasaccaṃ ▁uppajjati ▁abhi sam e tā vī naṃ
PA_ya_5.2.1:136.1_2	taṇhāya uppādakkhaṇe tesaṁ maggasaccañca uppajjittha samudayasaccañca uppajjati.	▁taṇhā ya ▁uppādakkhaṇe ▁tesaṃ ▁magg a sacc añca ▁uppajjittha ▁samuday a sacc añca ▁uppajjati
PA_ya_5.2.1:137.0	5.2.1.4.2. Anulomaokāsa	▁anulom a okāsa
PA_ya_5.2.1:137.1	Yattha dukkhasaccaṁ uppajjati …pe… (yatthakā sadisā sabbe.)	▁yattha ▁dukkhasacc aṃ ▁uppajjati ▁pe ▁yattha kā ▁sadis ā ▁sabbe
PA_ya_5.2.1:138.0	5.2.1.4.3. Anulomapuggalokāsa	▁anulom apuggal okāsa
PA_ya_5.2.1:138.1	Yassa yattha dukkhasaccaṁ uppajjati tassa tattha samudayasaccaṁ uppajjitthāti?	▁yassa ▁yattha ▁dukkhasacc aṃ ▁uppajjati ▁tassa ▁tattha ▁samudayasaccaṃ ▁uppajj itthāti
PA_ya_5.2.1:139.1_0	Suddhāvāsānaṁ upapatticittassa uppādakkhaṇe asaññasattaṁ upapajjantānaṁ tesaṁ tattha	▁suddhāvās ānaṃ ▁upapatti citt assa ▁uppādakkhaṇe ▁as añña satt aṃ ▁upapajjantānaṃ ▁tesaṃ ▁tattha
PA_ya_5.2.1:139.1_1	dukkhasaccaṁ uppajjati, no ca tesaṁ tattha samudayasaccaṁ uppajjittha. Itaresaṁ catuvokāraṁ	▁dukkhasacc aṃ ▁uppajjati ▁no ▁ca ▁tesaṃ ▁tattha ▁samudayasaccaṃ ▁uppajjittha ▁itaresaṃ ▁catu vo kār aṃ
