segmentnr	original	analyzed
PA_ya_5.2.1:0.1	5 Saccayamaka	▁sacc ayamak a
PA_ya_5.2.1:0.2	5.2 Pavattivāra	▁pavatti vā ra
PA_ya_5.2.1:0.3	5.2.1. Uppādavāra	▁uppād avāra
PA_ya_5.2.1:1.0.1	5.2.1.1. Paccuppannavāra	▁paccuppann avāra
PA_ya_5.2.1:1.0.2	5.2.1.1.1. Anulomapuggala	▁anulom apuggal a
PA_ya_5.2.1:1.1	Yassa dukkhasaccaṁ uppajjati tassa samudayasaccaṁ uppajjatīti?	▁yassa ▁dukkhasacc aṃ ▁uppajjati ▁tassa ▁samudayasaccaṃ ▁uppajjatīti
PA_ya_5.2.1:2.1_0	Sabbesaṁ upapajjantānaṁ pavatte taṇhāvippayuttacittassa uppādakkhaṇe tesaṁ dukkhasaccaṁ	▁sabbesaṃ ▁upapajjantānaṃ ▁pavatt e ▁taṇhā vippayutt acitt assa ▁uppādakkhaṇe ▁tesaṃ ▁dukkhasacc aṃ
PA_ya_5.2.1:2.1_1	uppajjati, no ca tesaṁ samudayasaccaṁ uppajjati. Taṇhāya uppādakkhaṇe tesaṁ dukkhasaccañca	▁uppajjati ▁no ▁ca ▁tesaṃ ▁samudayasaccaṃ ▁uppajjati ▁taṇhā ya ▁uppādakkhaṇe ▁tesaṃ ▁dukkhasacc añca
PA_ya_5.2.1:2.1_2	uppajjati samudayasaccañca uppajjati.	▁uppajjati ▁samuday a sacc añca ▁uppajjati
PA_ya_5.2.1:3.1	Yassa vā pana samudayasaccaṁ uppajjati tassa dukkhasaccaṁ uppajjatīti? Āmantā.	▁yassa ▁vā ▁pana ▁samudayasaccaṃ ▁uppajjati ▁tassa ▁dukkhasacc aṃ ▁uppajjatīti ▁āmantā
PA_ya_5.2.1:4.1	Yassa dukkhasaccaṁ uppajjati tassa maggasaccaṁ uppajjatīti?	▁yassa ▁dukkhasacc aṃ ▁uppajjati ▁tassa ▁maggasaccaṃ ▁uppajjatīti
PA_ya_5.2.1:5.1_0	Sabbesaṁ upapajjantānaṁ pavatte maggavippayuttacittassa uppādakkhaṇe tesaṁ dukkhasaccaṁ	▁sabbesaṃ ▁upapajjantānaṃ ▁pavatt e ▁magg avippayutt acitt assa ▁uppādakkhaṇe ▁tesaṃ ▁dukkhasacc aṃ
PA_ya_5.2.1:5.1_1	uppajjati, no ca tesaṁ maggasaccaṁ uppajjati. Pañcavokāre maggassa uppādakkhaṇe tesaṁ	▁uppajjati ▁no ▁ca ▁tesaṃ ▁maggasaccaṃ ▁uppajjati ▁pañcavokār e ▁magg assa ▁uppādakkhaṇe ▁tesaṃ
PA_ya_5.2.1:5.1_2	dukkhasaccañca uppajjati maggasaccañca uppajjati.	▁dukkhasacc añca ▁uppajjati ▁magg a sacc añca ▁uppajjati
PA_ya_5.2.1:6.1	Yassa vā pana maggasaccaṁ uppajjati tassa dukkhasaccaṁ uppajjatīti?	▁yassa ▁vā ▁pana ▁maggasaccaṃ ▁uppajjati ▁tassa ▁dukkhasacc aṃ ▁uppajjatīti
PA_ya_5.2.1:7.1_0	Arūpe maggassa uppādakkhaṇe tesaṁ maggasaccaṁ uppajjati, no ca tesaṁ dukkhasaccaṁ	▁arūp e ▁magg assa ▁uppādakkhaṇe ▁tesaṃ ▁maggasaccaṃ ▁uppajjati ▁no ▁ca ▁tesaṃ ▁dukkhasacc aṃ
PA_ya_5.2.1:7.1_1	uppajjati. Pañcavokāre maggassa uppādakkhaṇe tesaṁ maggasaccañca uppajjati dukkhasaccañca uppajjati.	▁uppajjati ▁pañcavokār e ▁magg assa ▁uppādakkhaṇe ▁tesaṃ ▁magg a sacc añca ▁uppajjati ▁dukkhasacc añca ▁uppajjati
PA_ya_5.2.1:8.1	Yassa samudayasaccaṁ uppajjati tassa maggasaccaṁ uppajjatīti? No.	▁yassa ▁samudayasaccaṃ ▁uppajjati ▁tassa ▁maggasaccaṃ ▁uppajjatīti ▁no
PA_ya_5.2.1:9.1	Yassa vā pana maggasaccaṁ uppajjati tassa samudayasaccaṁ uppajjatīti? No.	▁yassa ▁vā ▁pana ▁maggasaccaṃ ▁uppajjati ▁tassa ▁samudayasaccaṃ ▁uppajjatīti ▁no
PA_ya_5.2.1:10.0	5.2.1.1.2. Anulomaokāsa	▁anulom a okāsa
PA_ya_5.2.1:10.1	Yattha dukkhasaccaṁ uppajjati tattha samudayasaccaṁ uppajjatīti?	▁yattha ▁dukkhasacc aṃ ▁uppajjati ▁tattha ▁samudayasaccaṃ ▁uppajjatīti
PA_ya_5.2.1:11.1	Asaññasatte tattha dukkhasaccaṁ uppajjati, no ca tattha samudayasaccaṁ uppajjati. Catuvokāre pañcavokāre tattha dukkhasaccañca uppajjati samudayasaccañca uppajjati.	▁as añña satt e ▁tattha ▁dukkhasacc aṃ ▁uppajjati ▁no ▁ca ▁tattha ▁samudayasaccaṃ ▁uppajjati ▁catu vo kār e ▁pañcavokār e ▁tattha ▁dukkhasacc añca ▁uppajjati ▁samuday a sacc añca ▁uppajjati
PA_ya_5.2.1:12.1	Yattha vā pana …pe… ? Āmantā.	▁yattha ▁vā ▁pana ▁pe ▁āmantā
PA_ya_5.2.1:13.1	Yattha dukkhasaccaṁ uppajjati tattha maggasaccaṁ uppajjatīti?	▁yattha ▁dukkhasacc aṃ ▁uppajjati ▁tattha ▁maggasaccaṃ ▁uppajjatīti
PA_ya_5.2.1:14.1	Apāye asaññasatte tattha dukkhasaccaṁ uppajjati, no ca tattha maggasaccaṁ uppajjati. Avasese catuvokāre pañcavokāre tattha dukkhasaccañca uppajjati maggasaccañca uppajjati.	▁apāy e ▁as añña satt e ▁tattha ▁dukkhasacc aṃ ▁uppajjati ▁no ▁ca ▁tattha ▁maggasaccaṃ ▁uppajjati ▁avases e ▁catu vo kār e ▁pañcavokār e ▁tattha ▁dukkhasacc añca ▁uppajjati ▁magg a sacc añca ▁uppajjati
PA_ya_5.2.1:15.1	Yattha vā pana maggasaccaṁ uppajjati tattha dukkhasaccaṁ uppajjatīti? Āmantā.	▁yattha ▁vā ▁pana ▁maggasaccaṃ ▁uppajjati ▁tattha ▁dukkhasacc aṃ ▁uppajjatīti ▁āmantā
PA_ya_5.2.1:16.1	Yattha samudayasaccaṁ uppajjati tattha maggasaccaṁ uppajjatīti?	▁yattha ▁samudayasaccaṃ ▁uppajjati ▁tattha ▁maggasaccaṃ ▁uppajjatīti
PA_ya_5.2.1:17.1	Apāye tattha samudayasaccaṁ uppajjati, no ca tattha maggasaccaṁ uppajjati. Avasese catuvokāre pañcavokāre tattha samudayasaccañca uppajjati maggasaccañca uppajjati.	▁apāy e ▁tattha ▁samudayasaccaṃ ▁uppajjati ▁no ▁ca ▁tattha ▁maggasaccaṃ ▁uppajjati ▁avases e ▁catu vo kār e ▁pañcavokār e ▁tattha ▁samuday a sacc añca ▁uppajjati ▁magg a sacc añca ▁uppajjati
PA_ya_5.2.1:18.1	Yattha vā pana …pe… ? Āmantā.	▁yattha ▁vā ▁pana ▁pe ▁āmantā
PA_ya_5.2.1:19.0	5.2.1.1.3. Anulomapuggalokāsa	▁anulom apuggal okāsa
PA_ya_5.2.1:19.1	Yassa yattha dukkhasaccaṁ uppajjati tassa tattha samudayasaccaṁ uppajjatīti? …pe….	▁yassa ▁yattha ▁dukkhasacc aṃ ▁uppajjati ▁tassa ▁tattha ▁samudayasaccaṃ ▁uppajjatīti ▁pe
PA_ya_5.2.1:20.1	(Yassakampi yassayatthakampi sadisaṁ vitthāretabbaṁ.)	▁yassa kampi ▁yassa ya ttha kampi ▁sadis aṃ ▁vitthār etabbaṃ
PA_ya_5.2.1:21.0	5.2.1.1.4. Paccanīkapuggala	▁ paccanīk apuggal a
PA_ya_5.2.1:21.1	Yassa dukkhasaccaṁ nuppajjati tassa samudayasaccaṁ nuppajjatīti? Āmantā.	▁yassa ▁dukkhasacc aṃ ▁nuppajj ati ▁tassa ▁samudayasaccaṃ ▁nuppajj atīti ▁āmantā
PA_ya_5.2.1:22.1	Yassa vā pana samudayasaccaṁ nuppajjati tassa dukkhasaccaṁ nuppajjatīti?	▁yassa ▁vā ▁pana ▁samudayasaccaṃ ▁nuppajj ati ▁tassa ▁dukkhasacc aṃ ▁nuppajj atīti
PA_ya_5.2.1:23.1_0	Sabbesaṁ upapajjantānaṁ pavatte taṇhāvippayuttacittassa uppādakkhaṇe tesaṁ samudayasaccaṁ	▁sabbesaṃ ▁upapajjantānaṃ ▁pavatt e ▁taṇhā vippayutt acitt assa ▁uppādakkhaṇe ▁tesaṃ ▁samudayasaccaṃ
PA_ya_5.2.1:23.1_1	nuppajjati, no ca tesaṁ dukkhasaccaṁ nuppajjati. Sabbesaṁ cavantānaṁ pavatte cittassa	▁nuppajj ati ▁no ▁ca ▁tesaṃ ▁dukkhasacc aṃ ▁nuppajj ati ▁sabbesaṃ ▁cavantānaṃ ▁pavatt e ▁cittassa
PA_ya_5.2.1:23.1_2	bhaṅgakkhaṇe arūpe maggassa ca phalassa ca uppādakkhaṇe tesaṁ samudayasaccañca nuppajjati	▁bhaṃgakkhaṇe ▁arūp e ▁magg assa ▁ca ▁phal assa ▁ca ▁uppādakkhaṇe ▁tesaṃ ▁samuday a sacc añca ▁nuppajj ati
PA_ya_5.2.1:23.1_3	dukkhasaccañca nuppajjati.	▁dukkhasacc añca ▁nuppajj ati
PA_ya_5.2.1:24.1	Yassa dukkhasaccaṁ nuppajjati tassa maggasaccaṁ nuppajjatīti?	▁yassa ▁dukkhasacc aṃ ▁nuppajj ati ▁tassa ▁maggasaccaṃ ▁nuppajj atīti
PA_ya_5.2.1:25.1_0	Arūpe maggassa uppādakkhaṇe tesaṁ dukkhasaccaṁ nuppajjati, no ca tesaṁ maggasaccaṁ	▁arūp e ▁magg assa ▁uppādakkhaṇe ▁tesaṃ ▁dukkhasacc aṃ ▁nuppajj ati ▁no ▁ca ▁tesaṃ ▁maggasaccaṃ
PA_ya_5.2.1:25.1_1	nuppajjati. Sabbesaṁ cavantānaṁ pavatte cittassa bhaṅgakkhaṇe arūpe phalassa uppādakkhaṇe	▁nuppajj ati ▁sabbesaṃ ▁cavantānaṃ ▁pavatt e ▁cittassa ▁bhaṃgakkhaṇe ▁arūp e ▁phal assa ▁uppādakkhaṇe
PA_ya_5.2.1:25.1_2	tesaṁ dukkhasaccañca nuppajjati maggasaccañca nuppajjati.	▁tesaṃ ▁dukkhasacc añca ▁nuppajj ati ▁magg a sacc añca ▁nuppajj ati
PA_ya_5.2.1:26.1	Yassa vā pana maggasaccaṁ nuppajjati tassa dukkhasaccaṁ nuppajjatīti?	▁yassa ▁vā ▁pana ▁maggasaccaṃ ▁nuppajj ati ▁tassa ▁dukkhasacc aṃ ▁nuppajj atīti
PA_ya_5.2.1:27.1_0	Sabbesaṁ upapajjantānaṁ pavatte maggavippayuttacittassa uppādakkhaṇe tesaṁ maggasaccaṁ	▁sabbesaṃ ▁upapajjantānaṃ ▁pavatt e ▁magg avippayutt acitt assa ▁uppādakkhaṇe ▁tesaṃ ▁maggasaccaṃ
PA_ya_5.2.1:27.1_1	nuppajjati, no ca tesaṁ dukkhasaccaṁ nuppajjati. Sabbesaṁ cavantānaṁ pavatte cittassa	▁nuppajj ati ▁no ▁ca ▁tesaṃ ▁dukkhasacc aṃ ▁nuppajj ati ▁sabbesaṃ ▁cavantānaṃ ▁pavatt e ▁cittassa
PA_ya_5.2.1:27.1_2	bhaṅgakkhaṇe arūpe phalassa uppādakkhaṇe tesaṁ maggasaccañca nuppajjati dukkhasaccañca nuppajjati.	▁bhaṃgakkhaṇe ▁arūp e ▁phal assa ▁uppādakkhaṇe ▁tesaṃ ▁magg a sacc añca ▁nuppajj ati ▁dukkhasacc añca ▁nuppajj ati
PA_ya_5.2.1:28.1	Yassa samudayasaccaṁ nuppajjati tassa maggasaccaṁ nuppajjatīti?	▁yassa ▁samudayasaccaṃ ▁nuppajj ati ▁tassa ▁maggasaccaṃ ▁nuppajj atīti
PA_ya_5.2.1:29.1_0	Maggassa uppādakkhaṇe tesaṁ samudayasaccaṁ nuppajjati, no ca tesaṁ maggasaccaṁ nuppajjati.	▁magg assa ▁uppādakkhaṇe ▁tesaṃ ▁samudayasaccaṃ ▁nuppajj ati ▁no ▁ca ▁tesaṃ ▁maggasaccaṃ ▁nuppajj ati
PA_ya_5.2.1:29.1_1	Sabbesaṁ cittassa bhaṅgakkhaṇe taṇhāvippayuttamaggavippayuttacittassa uppādakkhaṇe	▁sabbesaṃ ▁cittassa ▁bhaṃgakkhaṇe ▁taṇhā vippayutt amagga vippayutt acitt assa ▁uppādakkhaṇe
PA_ya_5.2.1:29.1_2	nirodhasamāpannānaṁ asaññasattānaṁ tesaṁ samudayasaccañca nuppajjati maggasaccañca nuppajjati.	▁nirodh a samāpann ānaṃ ▁asaññasattānaṃ ▁tesaṃ ▁samuday a sacc añca ▁nuppajj ati ▁magg a sacc añca ▁nuppajj ati
PA_ya_5.2.1:30.1	Yassa vā pana maggasaccaṁ nuppajjati tassa samudayasaccaṁ nuppajjatīti?	▁yassa ▁vā ▁pana ▁maggasaccaṃ ▁nuppajj ati ▁tassa ▁samudayasaccaṃ ▁nuppajj atīti
PA_ya_5.2.1:31.1_0	Taṇhāya uppādakkhaṇe tesaṁ maggasaccaṁ nuppajjati, no ca tesaṁ samudayasaccaṁ nuppajjati.	▁taṇhā ya ▁uppādakkhaṇe ▁tesaṃ ▁maggasaccaṃ ▁nuppajj ati ▁no ▁ca ▁tesaṃ ▁samudayasaccaṃ ▁nuppajj ati
PA_ya_5.2.1:31.1_1	Sabbesaṁ cittassa bhaṅgakkhaṇe maggavippayuttataṇhāvippayuttacittassa uppādakkhaṇe	▁sabbesaṃ ▁cittassa ▁bhaṃgakkhaṇe ▁magg avippayutt ataṇhā vippayutt acitt assa ▁uppādakkhaṇe
PA_ya_5.2.1:31.1_2	nirodhasamāpannānaṁ asaññasattānaṁ tesaṁ maggasaccañca nuppajjati samudayasaccañca nuppajjati.	▁nirodh a samāpann ānaṃ ▁asaññasattānaṃ ▁tesaṃ ▁magg a sacc añca ▁nuppajj ati ▁samuday a sacc añca ▁nuppajj ati
PA_ya_5.2.1:32.0	5.2.1.1.5. Paccanīkaokāsa	▁ paccanīk a okāsa
PA_ya_5.2.1:32.1	Yattha dukkhasaccaṁ nuppajjati tattha samudayasaccaṁ nuppajjatīti? Natthi.	▁yattha ▁dukkhasacc aṃ ▁nuppajj ati ▁tattha ▁samudayasaccaṃ ▁nuppajj atīti ▁natthi
PA_ya_5.2.1:33.1	Yattha vā pana samudayasaccaṁ nuppajjati tattha dukkhasaccaṁ nuppajjatīti? Uppajjati.	▁yattha ▁vā ▁pana ▁samudayasaccaṃ ▁nuppajj ati ▁tattha ▁dukkhasacc aṃ ▁nuppajj atīti ▁uppajjati
PA_ya_5.2.1:34.1	Yattha dukkhasaccaṁ nuppajjati tattha maggasaccaṁ nuppajjatīti? Natthi.	▁yattha ▁dukkhasacc aṃ ▁nuppajj ati ▁tattha ▁maggasaccaṃ ▁nuppajj atīti ▁natthi
PA_ya_5.2.1:35.1	Yattha vā pana maggasaccaṁ nuppajjati tattha dukkhasaccaṁ nuppajjatīti? Uppajjati.	▁yattha ▁vā ▁pana ▁maggasaccaṃ ▁nuppajj ati ▁tattha ▁dukkhasacc aṃ ▁nuppajj atīti ▁uppajjati
PA_ya_5.2.1:36.1	Yattha samudayasaccaṁ nuppajjati tattha maggasaccaṁ nuppajjatīti? Āmantā.	▁yattha ▁samudayasaccaṃ ▁nuppajj ati ▁tattha ▁maggasaccaṃ ▁nuppajj atīti ▁āmantā
PA_ya_5.2.1:37.1	Yattha vā pana maggasaccaṁ nuppajjati tattha samudayasaccaṁ nuppajjatīti?	▁yattha ▁vā ▁pana ▁maggasaccaṃ ▁nuppajj ati ▁tattha ▁samudayasaccaṃ ▁nuppajj atīti
PA_ya_5.2.1:38.1	Apāye tattha maggasaccaṁ nuppajjati, no ca tattha samudayasaccaṁ nuppajjati. Asaññasatte tattha maggasaccañca nuppajjati samudayasaccañca nuppajjati.	▁apāy e ▁tattha ▁maggasaccaṃ ▁nuppajj ati ▁no ▁ca ▁tattha ▁samudayasaccaṃ ▁nuppajj ati ▁as añña satt e ▁tattha ▁magg a sacc añca ▁nuppajj ati ▁samuday a sacc añca ▁nuppajj ati
PA_ya_5.2.1:39.0	5.2.1.1.6. Paccanīkapuggalokāsa	▁ paccanīk apuggal okāsa
PA_ya_5.2.1:39.1	Yassa yattha dukkhasaccaṁ nuppajjati tassa tattha samudayasaccaṁ nuppajjatīti? Āmantā.	▁yassa ▁yattha ▁dukkhasacc aṃ ▁nuppajj ati ▁tassa ▁tattha ▁samudayasaccaṃ ▁nuppajj atīti ▁āmantā
PA_ya_5.2.1:40.1	Yassa vā pana yattha samudayasaccaṁ nuppajjati tassa tattha dukkhasaccaṁ nuppajjatīti?	▁yassa ▁vā ▁pana ▁yattha ▁samudayasaccaṃ ▁nuppajj ati ▁tassa ▁tattha ▁dukkhasacc aṃ ▁nuppajj atīti
PA_ya_5.2.1:41.1_0	Sabbesaṁ upapajjantānaṁ pavatte taṇhāvippayuttacittassa uppādakkhaṇe tesaṁ tattha	▁sabbesaṃ ▁upapajjantānaṃ ▁pavatt e ▁taṇhā vippayutt acitt assa ▁uppādakkhaṇe ▁tesaṃ ▁tattha
PA_ya_5.2.1:41.1_1	samudayasaccaṁ nuppajjati, no ca tesaṁ tattha dukkhasaccaṁ nuppajjati. Sabbesaṁ cavantānaṁ	▁samudayasaccaṃ ▁nuppajj ati ▁no ▁ca ▁tesaṃ ▁tattha ▁dukkhasacc aṃ ▁nuppajj ati ▁sabbesaṃ ▁cavantānaṃ
PA_ya_5.2.1:41.1_2	pavatte cittassa bhaṅgakkhaṇe arūpe maggassa ca phalassa ca uppādakkhaṇe tesaṁ tattha	▁pavatt e ▁cittassa ▁bhaṃgakkhaṇe ▁arūp e ▁magg assa ▁ca ▁phal assa ▁ca ▁uppādakkhaṇe ▁tesaṃ ▁tattha
PA_ya_5.2.1:41.1_3	samudayasaccañca nuppajjati dukkhasaccañca nuppajjati.	▁samuday a sacc añca ▁nuppajj ati ▁dukkhasacc añca ▁nuppajj ati
PA_ya_5.2.1:42.1	Yassa yattha dukkhasaccaṁ nuppajjati tassa tattha maggasaccaṁ nuppajjatīti?	▁yassa ▁yattha ▁dukkhasacc aṃ ▁nuppajj ati ▁tassa ▁tattha ▁maggasaccaṃ ▁nuppajj atīti
PA_ya_5.2.1:43.1_0	Arūpe maggassa uppādakkhaṇe tesaṁ tattha dukkhasaccaṁ nuppajjati, no ca tesaṁ tattha	▁arūp e ▁magg assa ▁uppādakkhaṇe ▁tesaṃ ▁tattha ▁dukkhasacc aṃ ▁nuppajj ati ▁no ▁ca ▁tesaṃ ▁tattha
PA_ya_5.2.1:43.1_1	maggasaccaṁ nuppajjati. Sabbesaṁ cavantānaṁ pavatte cittassa bhaṅgakkhaṇe arūpe phalassa	▁maggasaccaṃ ▁nuppajj ati ▁sabbesaṃ ▁cavantānaṃ ▁pavatt e ▁cittassa ▁bhaṃgakkhaṇe ▁arūp e ▁phal assa
PA_ya_5.2.1:43.1_2	uppādakkhaṇe tesaṁ tattha dukkhasaccañca nuppajjati maggasaccañca nuppajjati.	▁uppādakkhaṇe ▁tesaṃ ▁tattha ▁dukkhasacc añca ▁nuppajj ati ▁magg a sacc añca ▁nuppajj ati
PA_ya_5.2.1:44.1	Yassa vā pana yattha maggasaccaṁ nuppajjati tassa tattha dukkhasaccaṁ nuppajjatīti?	▁yassa ▁vā ▁pana ▁yattha ▁maggasaccaṃ ▁nuppajj ati ▁tassa ▁tattha ▁dukkhasacc aṃ ▁nuppajj atīti
PA_ya_5.2.1:45.1_0	Sabbesaṁ upapajjantānaṁ pavatte maggavippayuttacittassa uppādakkhaṇe tesaṁ tattha	▁sabbesaṃ ▁upapajjantānaṃ ▁pavatt e ▁magg avippayutt acitt assa ▁uppādakkhaṇe ▁tesaṃ ▁tattha
PA_ya_5.2.1:45.1_1	maggasaccaṁ nuppajjati, no ca tesaṁ tattha dukkhasaccaṁ nuppajjati. Sabbesaṁ cavantānaṁ	▁maggasaccaṃ ▁nuppajj ati ▁no ▁ca ▁tesaṃ ▁tattha ▁dukkhasacc aṃ ▁nuppajj ati ▁sabbesaṃ ▁cavantānaṃ
PA_ya_5.2.1:45.1_2	pavatte cittassa bhaṅgakkhaṇe arūpe phalassa uppādakkhaṇe tesaṁ tattha maggasaccañca	▁pavatt e ▁cittassa ▁bhaṃgakkhaṇe ▁arūp e ▁phal assa ▁uppādakkhaṇe ▁tesaṃ ▁tattha ▁magg a sacc añca
PA_ya_5.2.1:45.1_3	nuppajjati dukkhasaccañca nuppajjati.	▁nuppajj ati ▁dukkhasacc añca ▁nuppajj ati
PA_ya_5.2.1:46.1	Yassa yattha samudayasaccaṁ nuppajjati tassa tattha maggasaccaṁ nuppajjatīti?	▁yassa ▁yattha ▁samudayasaccaṃ ▁nuppajj ati ▁tassa ▁tattha ▁maggasaccaṃ ▁nuppajj atīti
PA_ya_5.2.1:47.1_0	Maggassa uppādakkhaṇe tesaṁ tattha samudayasaccaṁ nuppajjati, no ca tesaṁ tattha	▁magg assa ▁uppādakkhaṇe ▁tesaṃ ▁tattha ▁samudayasaccaṃ ▁nuppajj ati ▁no ▁ca ▁tesaṃ ▁tattha
PA_ya_5.2.1:47.1_1	maggasaccaṁ nuppajjati. Sabbesaṁ cittassa bhaṅgakkhaṇe taṇhāvippayuttamaggavippayuttacittassa	▁maggasaccaṃ ▁nuppajj ati ▁sabbesaṃ ▁cittassa ▁bhaṃgakkhaṇe ▁taṇhā vippayutt amagga vippayutt acitt assa
PA_ya_5.2.1:47.1_2	uppādakkhaṇe asaññasattānaṁ tesaṁ tattha samudayasaccañca nuppajjati maggasaccañca nuppajjati.	▁uppādakkhaṇe ▁asaññasattānaṃ ▁tesaṃ ▁tattha ▁samuday a sacc añca ▁nuppajj ati ▁magg a sacc añca ▁nuppajj ati
PA_ya_5.2.1:48.1	Yassa vā pana yattha maggasaccaṁ nuppajjati tassa tattha samudayasaccaṁ nuppajjatīti?	▁yassa ▁vā ▁pana ▁yattha ▁maggasaccaṃ ▁nuppajj ati ▁tassa ▁tattha ▁samudayasaccaṃ ▁nuppajj atīti
PA_ya_5.2.1:49.1_0	Taṇhāya uppādakkhaṇe tesaṁ tattha maggasaccaṁ nuppajjati, no ca tesaṁ tattha samudayasaccaṁ	▁taṇhā ya ▁uppādakkhaṇe ▁tesaṃ ▁tattha ▁maggasaccaṃ ▁nuppajj ati ▁no ▁ca ▁tesaṃ ▁tattha ▁samudayasaccaṃ
PA_ya_5.2.1:49.1_1	nuppajjati. Sabbesaṁ cittassa bhaṅgakkhaṇe maggavippayuttataṇhāvippayuttacittassa	▁nuppajj ati ▁sabbesaṃ ▁cittassa ▁bhaṃgakkhaṇe ▁magg avippayutt ataṇhā vippayutt acitt assa
PA_ya_5.2.1:49.1_2	uppādakkhaṇe asaññasattānaṁ tesaṁ tattha maggasaccañca nuppajjati samudayasaccañca nuppajjati.	▁uppādakkhaṇe ▁asaññasattānaṃ ▁tesaṃ ▁tattha ▁magg a sacc añca ▁nuppajj ati ▁samuday a sacc añca ▁nuppajj ati
PA_ya_5.2.1:50.0.1	5.2.1.2. Atītavāra	▁atīt avāra
PA_ya_5.2.1:50.0.2	5.2.1.2.1. Anulomapuggala	▁anulom apuggal a
PA_ya_5.2.1:50.1	Yassa dukkhasaccaṁ uppajjittha tassa samudayasaccaṁ uppajjitthāti? Āmantā.	▁yassa ▁dukkhasacc aṃ ▁uppajjittha ▁tassa ▁samudayasaccaṃ ▁uppajj itthāti ▁āmantā
PA_ya_5.2.1:51.1	Yassa vā pana samudayasaccaṁ uppajjittha tassa dukkhasaccaṁ uppajjitthāti? Āmantā.	▁yassa ▁vā ▁pana ▁samudayasaccaṃ ▁uppajjittha ▁tassa ▁dukkhasacc aṃ ▁uppajj itthāti ▁āmantā
PA_ya_5.2.1:52.1	Yassa dukkhasaccaṁ uppajjittha tassa maggasaccaṁ uppajjitthāti?	▁yassa ▁dukkhasacc aṃ ▁uppajjittha ▁tassa ▁maggasaccaṃ ▁uppajj itthāti
PA_ya_5.2.1:53.1	Anabhisametāvīnaṁ tesaṁ dukkhasaccaṁ uppajjittha, no ca tesaṁ maggasaccaṁ uppajjittha. Abhisametāvīnaṁ tesaṁ dukkhasaccañca uppajjittha maggasaccañca uppajjittha.	▁anabhi sam e tā vī naṃ ▁tesaṃ ▁dukkhasacc aṃ ▁uppajjittha ▁no ▁ca ▁tesaṃ ▁maggasaccaṃ ▁uppajjittha ▁abhi sam e tā vī naṃ ▁tesaṃ ▁dukkhasacc añca ▁uppajjittha ▁magg a sacc añca ▁uppajjittha
PA_ya_5.2.1:54.1	Yassa vā pana …pe… uppajjitthāti? Āmantā.	▁yassa ▁vā ▁pana ▁pe ▁uppajj itthāti ▁āmantā
PA_ya_5.2.1:55.1	Yassa samudayasaccaṁ uppajjittha tassa maggasaccaṁ uppajjitthāti?	▁yassa ▁samudayasaccaṃ ▁uppajjittha ▁tassa ▁maggasaccaṃ ▁uppajj itthāti
PA_ya_5.2.1:56.1	Anabhisametāvīnaṁ tesaṁ samudayasaccaṁ uppajjittha, no ca tesaṁ maggasaccaṁ uppajjittha. Abhisametāvīnaṁ tesaṁ samudayasaccañca uppajjittha maggasaccañca uppajjittha.	▁anabhi sam e tā vī naṃ ▁tesaṃ ▁samudayasaccaṃ ▁uppajjittha ▁no ▁ca ▁tesaṃ ▁maggasaccaṃ ▁uppajjittha ▁abhi sam e tā vī naṃ ▁tesaṃ ▁samuday a sacc añca ▁uppajjittha ▁magg a sacc añca ▁uppajjittha
PA_ya_5.2.1:57.1	Yassa vā pana …pe… uppajjitthāti? Āmantā.	▁yassa ▁vā ▁pana ▁pe ▁uppajj itthāti ▁āmantā
PA_ya_5.2.1:58.0	5.2.1.2.2. Anulomaokāsa	▁anulom a okāsa
PA_ya_5.2.1:58.1	Yattha dukkhasaccaṁ uppajjittha …pe….	▁yattha ▁dukkhasacc aṃ ▁uppajjittha ▁pe
PA_ya_5.2.1:59.1	(Yatthakampi sabbattha sadisaṁ. Tantinānākaraṇaṁ heṭṭhā yatthakasadisaṁ.)	▁yattha kampi ▁sabbattha ▁sadis aṃ ▁ tanti nā nā karaṇ aṃ ▁heṭṭhā ▁yattha k asadis aṃ
PA_ya_5.2.1:60.0	5.2.1.2.3. Anulomapuggalokāsa	▁anulom apuggal okāsa
PA_ya_5.2.1:60.1	Yassa yattha dukkhasaccaṁ uppajjittha tassa tattha samudayasaccaṁ uppajjitthāti?	▁yassa ▁yattha ▁dukkhasacc aṃ ▁uppajjittha ▁tassa ▁tattha ▁samudayasaccaṃ ▁uppajj itthāti
PA_ya_5.2.1:61.1_0	Suddhāvāsānaṁ dutiye citte vattamāne asaññasattānaṁ tesaṁ tattha dukkhasaccaṁ uppajjittha,	▁suddhāvās ānaṃ ▁dutiy e ▁citt e ▁vattamān e ▁asaññasattānaṃ ▁tesaṃ ▁tattha ▁dukkhasacc aṃ ▁uppajjittha
PA_ya_5.2.1:61.1_1	no ca tesaṁ tattha samudayasaccaṁ uppajjittha. Itaresaṁ catuvokārānaṁ pañcavokārānaṁ	▁no ▁ca ▁tesaṃ ▁tattha ▁samudayasaccaṃ ▁uppajjittha ▁itaresaṃ ▁catu vo kār ānaṃ ▁pañcavokār ānaṃ
PA_ya_5.2.1:61.1_2	tesaṁ tattha dukkhasaccañca uppajjittha samudayasaccañca uppajjittha.	▁tesaṃ ▁tattha ▁dukkhasacc añca ▁uppajjittha ▁samuday a sacc añca ▁uppajjittha
PA_ya_5.2.1:62.1	Yassa vā pana yattha …pe… uppajjitthāti? Āmantā.	▁yassa ▁vā ▁pana ▁yattha ▁pe ▁uppajj itthāti ▁āmantā
PA_ya_5.2.1:63.1	Yassa yattha dukkhasaccaṁ uppajjittha tassa tattha maggasaccaṁ uppajjitthāti?	▁yassa ▁yattha ▁dukkhasacc aṃ ▁uppajjittha ▁tassa ▁tattha ▁maggasaccaṃ ▁uppajj itthāti
PA_ya_5.2.1:64.1_0	Suddhāvāsānaṁ dutiye citte vattamāne anabhisametāvīnaṁ asaññasattānaṁ tesaṁ tattha	▁suddhāvās ānaṃ ▁dutiy e ▁citt e ▁vattamān e ▁anabhi sam e tā vī naṃ ▁asaññasattānaṃ ▁tesaṃ ▁tattha
PA_ya_5.2.1:64.1_1	dukkhasaccaṁ uppajjittha, no ca tesaṁ tattha maggasaccaṁ uppajjittha. Abhisametāvīnaṁ	▁dukkhasacc aṃ ▁uppajjittha ▁no ▁ca ▁tesaṃ ▁tattha ▁maggasaccaṃ ▁uppajjittha ▁abhi sam e tā vī naṃ
PA_ya_5.2.1:64.1_2	tesaṁ tattha dukkhasaccañca uppajjittha maggasaccañca uppajjittha.	▁tesaṃ ▁tattha ▁dukkhasacc añca ▁uppajjittha ▁magg a sacc añca ▁uppajjittha
PA_ya_5.2.1:65.1	Yassa vā pana yattha …pe… uppajjitthāti? Āmantā.	▁yassa ▁vā ▁pana ▁yattha ▁pe ▁uppajj itthāti ▁āmantā
PA_ya_5.2.1:66.1	Yassa yattha samudayasaccaṁ uppajjittha tassa tattha maggasaccaṁ uppajjitthāti?	▁yassa ▁yattha ▁samudayasaccaṃ ▁uppajjittha ▁tassa ▁tattha ▁maggasaccaṃ ▁uppajj itthāti
PA_ya_5.2.1:67.1_0	Suddhāvāsānaṁ dutiye akusale citte vattamāne anabhisametāvīnaṁ tesaṁ tattha samudayasaccaṁ	▁suddhāvās ānaṃ ▁dutiy e ▁akusal e ▁citt e ▁vattamān e ▁anabhi sam e tā vī naṃ ▁tesaṃ ▁tattha ▁samudayasaccaṃ
PA_ya_5.2.1:67.1_1	uppajjittha, no ca tesaṁ tattha maggasaccaṁ uppajjittha. Abhisametāvīnaṁ tesaṁ tattha	▁uppajjittha ▁no ▁ca ▁tesaṃ ▁tattha ▁maggasaccaṃ ▁uppajjittha ▁abhi sam e tā vī naṃ ▁tesaṃ ▁tattha
PA_ya_5.2.1:67.1_2	samudayasaccañca uppajjittha maggasaccañca uppajjittha.	▁samuday a sacc añca ▁uppajjittha ▁magg a sacc añca ▁uppajjittha
PA_ya_5.2.1:68.1	Yassa vā pana yattha …pe… uppajjitthāti? Āmantā.	▁yassa ▁vā ▁pana ▁yattha ▁pe ▁uppajj itthāti ▁āmantā
PA_ya_5.2.1:69.0	5.2.1.2.4. Paccanīkapuggala	▁ paccanīk apuggal a
PA_ya_5.2.1:69.1	Yassa dukkhasaccaṁ nuppajjittha tassa samudayasaccaṁ nuppajjitthāti? Natthi.	▁yassa ▁dukkhasacc aṃ ▁nuppajj ittha ▁tassa ▁samudayasaccaṃ ▁nuppajj itthāti ▁natthi
PA_ya_5.2.1:70.1	Yassa vā pana …pe… nuppajjitthāti? Natthi.	▁yassa ▁vā ▁pana ▁pe ▁nuppajj itthāti ▁natthi
PA_ya_5.2.1:71.1	Yassa dukkhasaccaṁ nuppajjittha tassa maggasaccaṁ nuppajjitthāti? Natthi.	▁yassa ▁dukkhasacc aṃ ▁nuppajj ittha ▁tassa ▁maggasaccaṃ ▁nuppajj itthāti ▁natthi
PA_ya_5.2.1:72.1	Yassa vā pana maggasaccaṁ nuppajjittha tassa dukkhasaccaṁ nuppajjitthāti? Uppajjittha.	▁yassa ▁vā ▁pana ▁maggasaccaṃ ▁nuppajj ittha ▁tassa ▁dukkhasacc aṃ ▁nuppajj itthāti ▁uppajjittha
PA_ya_5.2.1:73.1	Yassa samudayasaccaṁ nuppajjittha tassa maggasaccaṁ nuppajjitthāti? Natthi.	▁yassa ▁samudayasaccaṃ ▁nuppajj ittha ▁tassa ▁maggasaccaṃ ▁nuppajj itthāti ▁natthi
PA_ya_5.2.1:74.1	Yassa vā pana …pe… nuppajjitthāti? Uppajjittha.	▁yassa ▁vā ▁pana ▁pe ▁nuppajj itthāti ▁uppajjittha
PA_ya_5.2.1:75.0	5.2.1.2.5. Paccanīkaokāsa	▁ paccanīk a okāsa
PA_ya_5.2.1:75.1	Yattha dukkhasaccaṁ nuppajjittha …pe….	▁yattha ▁dukkhasacc aṃ ▁nuppajj ittha ▁pe
PA_ya_5.2.1:76.0	5.2.1.2.6. Paccanīkapuggalokāsa	▁ paccanīk apuggal okāsa
PA_ya_5.2.1:76.1	Yassa yattha dukkhasaccaṁ nuppajjittha tassa tattha samudayasaccaṁ nuppajjitthāti? Āmantā.	▁yassa ▁yattha ▁dukkhasacc aṃ ▁nuppajj ittha ▁tassa ▁tattha ▁samudayasaccaṃ ▁nuppajj itthāti ▁āmantā
PA_ya_5.2.1:77.1	Yassa vā pana yattha samudayasaccaṁ nuppajjittha tassa tattha dukkhasaccaṁ nuppajjitthāti?	▁yassa ▁vā ▁pana ▁yattha ▁samudayasaccaṃ ▁nuppajj ittha ▁tassa ▁tattha ▁dukkhasacc aṃ ▁nuppajj itthāti
PA_ya_5.2.1:78.1_0	Suddhāvāsānaṁ dutiye citte vattamāne asaññasattānaṁ tesaṁ tattha samudayasaccaṁ nuppajjittha,	▁suddhāvās ānaṃ ▁dutiy e ▁citt e ▁vattamān e ▁asaññasattānaṃ ▁tesaṃ ▁tattha ▁samudayasaccaṃ ▁nuppajj ittha
PA_ya_5.2.1:78.1_1	no ca tesaṁ tattha dukkhasaccaṁ nuppajjittha. Suddhāvāsaṁ upapajjantānaṁ tesaṁ tattha	▁no ▁ca ▁tesaṃ ▁tattha ▁dukkhasacc aṃ ▁nuppajj ittha ▁suddhāvās aṃ ▁upapajjantānaṃ ▁tesaṃ ▁tattha
