segmentnr	original	analyzed
PA_ya_5.2.1:139.1_2	pañcavokāraṁ upapajjantānaṁ pavatte cittassa uppādakkhaṇe tesaṁ tattha dukkhasaccañca	▁pañcavokār aṃ ▁upapajjantānaṃ ▁pavatt e ▁cittassa ▁uppādakkhaṇe ▁tesaṃ ▁tattha ▁dukkhasacc añca
PA_ya_5.2.1:139.1_3	uppajjati samudayasaccañca uppajjittha.	▁uppajjati ▁samuday a sacc añca ▁uppajjittha
PA_ya_5.2.1:140.1	Yassa vā pana yattha samudayasaccaṁ uppajjittha tassa tattha dukkhasaccaṁ uppajjatīti?	▁yassa ▁vā ▁pana ▁yattha ▁samudayasaccaṃ ▁uppajjittha ▁tassa ▁tattha ▁dukkhasacc aṃ ▁uppajjatīti
PA_ya_5.2.1:141.1_0	Catuvokārā pañcavokārā cavantānaṁ pavatte cittassa bhaṅgakkhaṇe arūpe maggassa ca	▁catu vo kār ā ▁pañcavokār ā ▁cavantānaṃ ▁pavatt e ▁cittassa ▁bhaṃgakkhaṇe ▁arūp e ▁magg assa ▁ca
PA_ya_5.2.1:141.1_1	phalassa ca uppādakkhaṇe tesaṁ tattha samudayasaccaṁ uppajjittha, no ca tesaṁ tattha	▁phal assa ▁ca ▁uppādakkhaṇe ▁tesaṃ ▁tattha ▁samudayasaccaṃ ▁uppajjittha ▁no ▁ca ▁tesaṃ ▁tattha
PA_ya_5.2.1:141.1_2	dukkhasaccaṁ uppajjati. Catuvokāraṁ pañcavokāraṁ upapajjantānaṁ pavatte cittassa	▁dukkhasacc aṃ ▁uppajjati ▁catu vo kār aṃ ▁pañcavokār aṃ ▁upapajjantānaṃ ▁pavatt e ▁cittassa
PA_ya_5.2.1:141.1_3	uppādakkhaṇe tesaṁ tattha samudayasaccañca uppajjittha dukkhasaccañca uppajjati.	▁uppādakkhaṇe ▁tesaṃ ▁tattha ▁samuday a sacc añca ▁uppajjittha ▁dukkhasacc añca ▁uppajjati
PA_ya_5.2.1:142.1	Yassa yattha dukkhasaccaṁ uppajjati tassa tattha maggasaccaṁ uppajjitthāti?	▁yassa ▁yattha ▁dukkhasacc aṃ ▁uppajjati ▁tassa ▁tattha ▁maggasaccaṃ ▁uppajj itthāti
PA_ya_5.2.1:143.1_0	Suddhāvāsānaṁ upapatticittassa uppādakkhaṇe anabhisametāvīnaṁ upapajjantānaṁ pavatte	▁suddhāvās ānaṃ ▁upapatti citt assa ▁uppādakkhaṇe ▁anabhi sam e tā vī naṃ ▁upapajjantānaṃ ▁pavatt e
PA_ya_5.2.1:143.1_1	cittassa uppādakkhaṇe asaññasattaṁ upapajjantānaṁ tesaṁ tattha dukkhasaccaṁ uppajjati,	▁cittassa ▁uppādakkhaṇe ▁as añña satt aṃ ▁upapajjantānaṃ ▁tesaṃ ▁tattha ▁dukkhasacc aṃ ▁uppajjati
PA_ya_5.2.1:143.1_2	no ca tesaṁ tattha maggasaccaṁ uppajjittha. Abhisametāvīnaṁ upapajjantānaṁ pavatte	▁no ▁ca ▁tesaṃ ▁tattha ▁maggasaccaṃ ▁uppajjittha ▁abhi sam e tā vī naṃ ▁upapajjantānaṃ ▁pavatt e
PA_ya_5.2.1:143.1_3	cittassa uppādakkhaṇe tesaṁ tattha dukkhasaccañca uppajjati maggasaccañca uppajjittha.	▁cittassa ▁uppādakkhaṇe ▁tesaṃ ▁tattha ▁dukkhasacc añca ▁uppajjati ▁magg a sacc añca ▁uppajjittha
PA_ya_5.2.1:144.1	Yassa vā pana yattha maggasaccaṁ uppajjittha tassa tattha dukkhasaccaṁ uppajjatīti?	▁yassa ▁vā ▁pana ▁yattha ▁maggasaccaṃ ▁uppajjittha ▁tassa ▁tattha ▁dukkhasacc aṃ ▁uppajjatīti
PA_ya_5.2.1:145.1_0	Abhisametāvīnaṁ cavantānaṁ pavatte cittassa bhaṅgakkhaṇe arūpe maggassa ca phalassa	▁abhi sam e tā vī naṃ ▁cavantānaṃ ▁pavatt e ▁cittassa ▁bhaṃgakkhaṇe ▁arūp e ▁magg assa ▁ca ▁phal assa
PA_ya_5.2.1:145.1_1	ca uppādakkhaṇe tesaṁ tattha maggasaccaṁ uppajjittha, no ca tesaṁ tattha dukkhasaccaṁ	▁ca ▁uppādakkhaṇe ▁tesaṃ ▁tattha ▁maggasaccaṃ ▁uppajjittha ▁no ▁ca ▁tesaṃ ▁tattha ▁dukkhasacc aṃ
PA_ya_5.2.1:145.1_2	uppajjati. Abhisametāvīnaṁ upapajjantānaṁ pavatte cittassa uppādakkhaṇe tesaṁ tattha	▁uppajjati ▁abhi sam e tā vī naṃ ▁upapajjantānaṃ ▁pavatt e ▁cittassa ▁uppādakkhaṇe ▁tesaṃ ▁tattha
PA_ya_5.2.1:145.1_3	maggasaccañca uppajjittha dukkhasaccañca uppajjati.	▁magg a sacc añca ▁uppajjittha ▁dukkhasacc añca ▁uppajjati
PA_ya_5.2.1:146.1	Yassa yattha samudayasaccaṁ uppajjati tassa tattha maggasaccaṁ uppajjitthāti?	▁yassa ▁yattha ▁samudayasaccaṃ ▁uppajjati ▁tassa ▁tattha ▁maggasaccaṃ ▁uppajj itthāti
PA_ya_5.2.1:147.1_0	Anabhisametāvīnaṁ taṇhāya uppādakkhaṇe tesaṁ tattha samudayasaccaṁ uppajjati, no	▁anabhi sam e tā vī naṃ ▁taṇhā ya ▁uppādakkhaṇe ▁tesaṃ ▁tattha ▁samudayasaccaṃ ▁uppajjati ▁no
PA_ya_5.2.1:147.1_1	ca tesaṁ tattha maggasaccaṁ uppajjittha. Abhisametāvīnaṁ taṇhāya uppādakkhaṇe tesaṁ	▁ca ▁tesaṃ ▁tattha ▁maggasaccaṃ ▁uppajjittha ▁abhi sam e tā vī naṃ ▁taṇhā ya ▁uppādakkhaṇe ▁tesaṃ
PA_ya_5.2.1:147.1_2	tattha samudayasaccañca uppajjati maggasaccañca uppajjittha.	▁tattha ▁samuday a sacc añca ▁uppajjati ▁magg a sacc añca ▁uppajjittha
PA_ya_5.2.1:148.1	Yassa vā pana yattha maggasaccaṁ uppajjittha tassa tattha samudayasaccaṁ uppajjatīti?	▁yassa ▁vā ▁pana ▁yattha ▁maggasaccaṃ ▁uppajjittha ▁tassa ▁tattha ▁samudayasaccaṃ ▁uppajjatīti
PA_ya_5.2.1:149.1_0	Abhisametāvīnaṁ taṇhāya bhaṅgakkhaṇe taṇhāvippayuttacitte vattamāne tesaṁ tattha	▁abhi sam e tā vī naṃ ▁taṇhā ya ▁bhaṃgakkhaṇe ▁taṇhā vippayutt acitt e ▁vattamān e ▁tesaṃ ▁tattha
PA_ya_5.2.1:149.1_1	maggasaccaṁ uppajjittha, no ca tesaṁ tattha samudayasaccaṁ uppajjati. Abhisametāvīnaṁ	▁maggasaccaṃ ▁uppajjittha ▁no ▁ca ▁tesaṃ ▁tattha ▁samudayasaccaṃ ▁uppajjati ▁abhi sam e tā vī naṃ
PA_ya_5.2.1:149.1_2	taṇhāya uppādakkhaṇe tesaṁ tattha maggasaccañca uppajjittha samudayasaccañca uppajjati.	▁taṇhā ya ▁uppādakkhaṇe ▁tesaṃ ▁tattha ▁magg a sacc añca ▁uppajjittha ▁samuday a sacc añca ▁uppajjati
PA_ya_5.2.1:150.0	5.2.1.4.4. Paccanīkapuggala	▁ paccanīk apuggal a
PA_ya_5.2.1:150.1	Yassa dukkhasaccaṁ nuppajjati tassa samudayasaccaṁ nuppajjitthāti?	▁yassa ▁dukkhasacc aṃ ▁nuppajj ati ▁tassa ▁samudayasaccaṃ ▁nuppajj itthāti
PA_ya_5.2.1:151.1	Uppajjittha.	▁uppajjittha
PA_ya_5.2.1:152.1	Yassa vā pana samudayasaccaṁ nuppajjittha tassa dukkhasaccaṁ nuppajjatīti? Natthi.	▁yassa ▁vā ▁pana ▁samudayasaccaṃ ▁nuppajj ittha ▁tassa ▁dukkhasacc aṃ ▁nuppajj atīti ▁natthi
PA_ya_5.2.1:153.1	Yassa dukkhasaccaṁ nuppajjati tassa maggasaccaṁ nuppajjitthāti?	▁yassa ▁dukkhasacc aṃ ▁nuppajj ati ▁tassa ▁maggasaccaṃ ▁nuppajj itthāti
PA_ya_5.2.1:154.1_0	Abhisametāvīnaṁ cavantānaṁ pavatte cittassa bhaṅgakkhaṇe arūpe maggassa ca phalassa	▁abhi sam e tā vī naṃ ▁cavantānaṃ ▁pavatt e ▁cittassa ▁bhaṃgakkhaṇe ▁arūp e ▁magg assa ▁ca ▁phal assa
PA_ya_5.2.1:154.1_1	ca uppādakkhaṇe tesaṁ dukkhasaccaṁ nuppajjati, no ca tesaṁ maggasaccaṁ nuppajjittha.	▁ca ▁uppādakkhaṇe ▁tesaṃ ▁dukkhasacc aṃ ▁nuppajj ati ▁no ▁ca ▁tesaṃ ▁maggasaccaṃ ▁nuppajj ittha
PA_ya_5.2.1:154.1_2	Anabhisametāvīnaṁ cavantānaṁ pavatte cittassa bhaṅgakkhaṇe tesaṁ dukkhasaccañca nuppajjati	▁anabhi sam e tā vī naṃ ▁cavantānaṃ ▁pavatt e ▁cittassa ▁bhaṃgakkhaṇe ▁tesaṃ ▁dukkhasacc añca ▁nuppajj ati
PA_ya_5.2.1:154.1_3	maggasaccañca nuppajjittha.	▁magg a sacc añca ▁nuppajj ittha
PA_ya_5.2.1:155.1	Yassa vā pana maggasaccaṁ nuppajjittha tassa dukkhasaccaṁ nuppajjatīti?	▁yassa ▁vā ▁pana ▁maggasaccaṃ ▁nuppajj ittha ▁tassa ▁dukkhasacc aṃ ▁nuppajj atīti
PA_ya_5.2.1:156.1_0	Anabhisametāvīnaṁ upapajjantānaṁ pavatte cittassa uppādakkhaṇe tesaṁ maggasaccaṁ	▁anabhi sam e tā vī naṃ ▁upapajjantānaṃ ▁pavatt e ▁cittassa ▁uppādakkhaṇe ▁tesaṃ ▁maggasaccaṃ
PA_ya_5.2.1:156.1_1	nuppajjittha, no ca tesaṁ dukkhasaccaṁ nuppajjati. Anabhisametāvīnaṁ cavantānaṁ pavatte	▁nuppajj ittha ▁no ▁ca ▁tesaṃ ▁dukkhasacc aṃ ▁nuppajj ati ▁anabhi sam e tā vī naṃ ▁cavantānaṃ ▁pavatt e
PA_ya_5.2.1:156.1_2	cittassa bhaṅgakkhaṇe tesaṁ maggasaccañca nuppajjittha dukkhasaccañca nuppajjati.	▁cittassa ▁bhaṃgakkhaṇe ▁tesaṃ ▁magg a sacc añca ▁nuppajj ittha ▁dukkhasacc añca ▁nuppajj ati
PA_ya_5.2.1:157.1	Yassa samudayasaccaṁ nuppajjati tassa maggasaccaṁ nuppajjitthāti?	▁yassa ▁samudayasaccaṃ ▁nuppajj ati ▁tassa ▁maggasaccaṃ ▁nuppajj itthāti
PA_ya_5.2.1:158.1_0	Abhisametāvīnaṁ taṇhāya bhaṅgakkhaṇe taṇhāvippayuttacitte vattamāne nirodhasamāpannānaṁ	▁abhi sam e tā vī naṃ ▁taṇhā ya ▁bhaṃgakkhaṇe ▁taṇhā vippayutt acitt e ▁vattamān e ▁nirodh a samāpann ānaṃ
PA_ya_5.2.1:158.1_1	tesaṁ samudayasaccaṁ nuppajjati, no ca tesaṁ maggasaccaṁ nuppajjittha. Anabhisametāvīnaṁ	▁tesaṃ ▁samudayasaccaṃ ▁nuppajj ati ▁no ▁ca ▁tesaṃ ▁maggasaccaṃ ▁nuppajj ittha ▁anabhi sam e tā vī naṃ
PA_ya_5.2.1:158.1_2	taṇhāya bhaṅgakkhaṇe taṇhāvippayuttacitte vattamāne asaññasattānaṁ tesaṁ samudayasaccañca	▁taṇhā ya ▁bhaṃgakkhaṇe ▁taṇhā vippayutt acitt e ▁vattamān e ▁asaññasattānaṃ ▁tesaṃ ▁samuday a sacc añca
PA_ya_5.2.1:158.1_3	nuppajjati maggasaccañca nuppajjittha.	▁nuppajj ati ▁magg a sacc añca ▁nuppajj ittha
PA_ya_5.2.1:159.1	Yassa vā pana maggasaccaṁ nuppajjittha tassa samudayasaccaṁ nuppajjatīti?	▁yassa ▁vā ▁pana ▁maggasaccaṃ ▁nuppajj ittha ▁tassa ▁samudayasaccaṃ ▁nuppajj atīti
PA_ya_5.2.1:160.1_0	Anabhisametāvīnaṁ taṇhāya uppādakkhaṇe tesaṁ maggasaccaṁ nuppajjittha, no ca tesaṁ	▁anabhi sam e tā vī naṃ ▁taṇhā ya ▁uppādakkhaṇe ▁tesaṃ ▁maggasaccaṃ ▁nuppajj ittha ▁no ▁ca ▁tesaṃ
PA_ya_5.2.1:160.1_1	samudayasaccaṁ nuppajjati. Anabhisametāvīnaṁ taṇhāya bhaṅgakkhaṇe taṇhāvippayuttacitte	▁samudayasaccaṃ ▁nuppajj ati ▁anabhi sam e tā vī naṃ ▁taṇhā ya ▁bhaṃgakkhaṇe ▁taṇhā vippayutt acitt e
PA_ya_5.2.1:160.1_2	vattamāne asaññasattānaṁ tesaṁ maggasaccañca nuppajjittha samudayasaccañca nuppajjati.	▁vattamān e ▁asaññasattānaṃ ▁tesaṃ ▁magg a sacc añca ▁nuppajj ittha ▁samuday a sacc añca ▁nuppajj ati
PA_ya_5.2.1:161.0	5.2.1.4.5. Paccanīkaokāsa	▁ paccanīk a okāsa
PA_ya_5.2.1:161.1	Yattha dukkhasaccaṁ nuppajjati …pe….	▁yattha ▁dukkhasacc aṃ ▁nuppajj ati ▁pe
PA_ya_5.2.1:162.0	5.2.1.4.6. Paccanīkapuggalokāsa	▁ paccanīk apuggal okāsa
PA_ya_5.2.1:162.1	Yassa yattha dukkhasaccaṁ nuppajjati tassa tattha samudayasaccaṁ nuppajjitthāti?	▁yassa ▁yattha ▁dukkhasacc aṃ ▁nuppajj ati ▁tassa ▁tattha ▁samudayasaccaṃ ▁nuppajj itthāti
PA_ya_5.2.1:163.1_0	Catuvokārā pañcavokārā cavantānaṁ pavatte cittassa bhaṅgakkhaṇe arūpe maggassa ca	▁catu vo kār ā ▁pañcavokār ā ▁cavantānaṃ ▁pavatt e ▁cittassa ▁bhaṃgakkhaṇe ▁arūp e ▁magg assa ▁ca
PA_ya_5.2.1:163.1_1	phalassa ca uppādakkhaṇe tesaṁ tattha dukkhasaccaṁ nuppajjati, no ca tesaṁ tattha	▁phal assa ▁ca ▁uppādakkhaṇe ▁tesaṃ ▁tattha ▁dukkhasacc aṃ ▁nuppajj ati ▁no ▁ca ▁tesaṃ ▁tattha
PA_ya_5.2.1:163.1_2	samudayasaccaṁ nuppajjittha. Suddhāvāsānaṁ upapatticittassa bhaṅgakkhaṇe asaññasattā	▁samudayasaccaṃ ▁nuppajj ittha ▁suddhāvās ānaṃ ▁upapatti citt assa ▁bhaṃgakkhaṇe ▁a saññ as attā
PA_ya_5.2.1:163.1_3	cavantānaṁ tesaṁ tattha dukkhasaccañca nuppajjati samudayasaccañca nuppajjittha.	▁cavantānaṃ ▁tesaṃ ▁tattha ▁dukkhasacc añca ▁nuppajj ati ▁samuday a sacc añca ▁nuppajj ittha
PA_ya_5.2.1:164.1	Yassa vā pana yattha samudayasaccaṁ nuppajjittha tassa tattha dukkhasaccaṁ nuppajjatīti?	▁yassa ▁vā ▁pana ▁yattha ▁samudayasaccaṃ ▁nuppajj ittha ▁tassa ▁tattha ▁dukkhasacc aṃ ▁nuppajj atīti
PA_ya_5.2.1:165.1_0	Suddhāvāsānaṁ upapatticittassa uppādakkhaṇe asaññasattaṁ upapajjantānaṁ tesaṁ tattha	▁suddhāvās ānaṃ ▁upapatti citt assa ▁uppādakkhaṇe ▁as añña satt aṃ ▁upapajjantānaṃ ▁tesaṃ ▁tattha
PA_ya_5.2.1:165.1_1	samudayasaccaṁ nuppajjittha, no ca tesaṁ tattha dukkhasaccaṁ nuppajjati. Suddhāvāsānaṁ	▁samudayasaccaṃ ▁nuppajj ittha ▁no ▁ca ▁tesaṃ ▁tattha ▁dukkhasacc aṃ ▁nuppajj ati ▁suddhāvās ānaṃ
PA_ya_5.2.1:165.1_2	upapatticittassa bhaṅgakkhaṇe asaññasattā cavantānaṁ tesaṁ tattha samudayasaccañca	▁upapatti citt assa ▁bhaṃgakkhaṇe ▁a saññ as attā ▁cavantānaṃ ▁tesaṃ ▁tattha ▁samuday a sacc añca
PA_ya_5.2.1:165.1_3	nuppajjittha dukkhasaccañca nuppajjati.	▁nuppajj ittha ▁dukkhasacc añca ▁nuppajj ati
PA_ya_5.2.1:166.1	Yassa yattha dukkhasaccaṁ nuppajjati tassa tattha maggasaccaṁ nuppajjitthāti?	▁yassa ▁yattha ▁dukkhasacc aṃ ▁nuppajj ati ▁tassa ▁tattha ▁maggasaccaṃ ▁nuppajj itthāti
PA_ya_5.2.1:167.1_0	Abhisametāvīnaṁ cavantānaṁ pavatte cittassa bhaṅgakkhaṇe arūpe maggassa ca phalassa	▁abhi sam e tā vī naṃ ▁cavantānaṃ ▁pavatt e ▁cittassa ▁bhaṃgakkhaṇe ▁arūp e ▁magg assa ▁ca ▁phal assa
PA_ya_5.2.1:167.1_1	ca uppādakkhaṇe tesaṁ tattha dukkhasaccaṁ nuppajjati, no ca tesaṁ tattha maggasaccaṁ	▁ca ▁uppādakkhaṇe ▁tesaṃ ▁tattha ▁dukkhasacc aṃ ▁nuppajj ati ▁no ▁ca ▁tesaṃ ▁tattha ▁maggasaccaṃ
PA_ya_5.2.1:167.1_2	nuppajjittha. Suddhāvāsānaṁ upapatticittassa bhaṅgakkhaṇe anabhisametāvīnaṁ cavantānaṁ	▁nuppajj ittha ▁suddhāvās ānaṃ ▁upapatti citt assa ▁bhaṃgakkhaṇe ▁anabhi sam e tā vī naṃ ▁cavantānaṃ
PA_ya_5.2.1:167.1_3	pavatte cittassa bhaṅgakkhaṇe asaññasattā cavantānaṁ tesaṁ tattha dukkhasaccañca	▁pavatt e ▁cittassa ▁bhaṃgakkhaṇe ▁a saññ as attā ▁cavantānaṃ ▁tesaṃ ▁tattha ▁dukkhasacc añca
PA_ya_5.2.1:167.1_4	nuppajjati maggasaccañca nuppajjittha.	▁nuppajj ati ▁magg a sacc añca ▁nuppajj ittha
PA_ya_5.2.1:168.1	Yassa vā pana yattha maggasaccaṁ nuppajjittha tassa tattha dukkhasaccaṁ nuppajjatīti?	▁yassa ▁vā ▁pana ▁yattha ▁maggasaccaṃ ▁nuppajj ittha ▁tassa ▁tattha ▁dukkhasacc aṃ ▁nuppajj atīti
PA_ya_5.2.1:169.1_0	Suddhāvāsānaṁ upapatticittassa uppādakkhaṇe anabhisametāvīnaṁ upapajjantānaṁ pavatte	▁suddhāvās ānaṃ ▁upapatti citt assa ▁uppādakkhaṇe ▁anabhi sam e tā vī naṃ ▁upapajjantānaṃ ▁pavatt e
PA_ya_5.2.1:169.1_1	cittassa uppādakkhaṇe asaññasattaṁ upapajjantānaṁ tesaṁ tattha maggasaccaṁ nuppajjittha,	▁cittassa ▁uppādakkhaṇe ▁as añña satt aṃ ▁upapajjantānaṃ ▁tesaṃ ▁tattha ▁maggasaccaṃ ▁nuppajj ittha
PA_ya_5.2.1:169.1_2	no ca tesaṁ tattha dukkhasaccaṁ nuppajjati. Suddhāvāsānaṁ upapatticittassa bhaṅgakkhaṇe	▁no ▁ca ▁tesaṃ ▁tattha ▁dukkhasacc aṃ ▁nuppajj ati ▁suddhāvās ānaṃ ▁upapatti citt assa ▁bhaṃgakkhaṇe
PA_ya_5.2.1:169.1_3	anabhisametāvīnaṁ cavantānaṁ pavatte cittassa bhaṅgakkhaṇe asaññasattā cavantānaṁ	▁anabhi sam e tā vī naṃ ▁cavantānaṃ ▁pavatt e ▁cittassa ▁bhaṃgakkhaṇe ▁a saññ as attā ▁cavantānaṃ
PA_ya_5.2.1:169.1_4	tesaṁ tattha maggasaccañca nuppajjittha dukkhasaccañca nuppajjati.	▁tesaṃ ▁tattha ▁magg a sacc añca ▁nuppajj ittha ▁dukkhasacc añca ▁nuppajj ati
PA_ya_5.2.1:170.1	Yassa yattha samudayasaccaṁ nuppajjati tassa tattha maggasaccaṁ nuppajjitthāti?	▁yassa ▁yattha ▁samudayasaccaṃ ▁nuppajj ati ▁tassa ▁tattha ▁maggasaccaṃ ▁nuppajj itthāti
PA_ya_5.2.1:171.1_0	Abhisametāvīnaṁ taṇhāya bhaṅgakkhaṇe taṇhāvippayuttacitte vattamāne tesaṁ tattha	▁abhi sam e tā vī naṃ ▁taṇhā ya ▁bhaṃgakkhaṇe ▁taṇhā vippayutt acitt e ▁vattamān e ▁tesaṃ ▁tattha
PA_ya_5.2.1:171.1_1	samudayasaccaṁ nuppajjati, no ca tesaṁ tattha maggasaccaṁ nuppajjittha. Suddhāvāsānaṁ	▁samudayasaccaṃ ▁nuppajj ati ▁no ▁ca ▁tesaṃ ▁tattha ▁maggasaccaṃ ▁nuppajj ittha ▁suddhāvās ānaṃ
PA_ya_5.2.1:171.1_2	dutiye citte vattamāne anabhisametāvīnaṁ taṇhāya bhaṅgakkhaṇe taṇhāvippayuttacitte	▁dutiy e ▁citt e ▁vattamān e ▁anabhi sam e tā vī naṃ ▁taṇhā ya ▁bhaṃgakkhaṇe ▁taṇhā vippayutt acitt e
PA_ya_5.2.1:171.1_3	vattamāne asaññasattānaṁ tesaṁ tattha samudayasaccañca nuppajjati maggasaccañca nuppajjittha.	▁vattamān e ▁asaññasattānaṃ ▁tesaṃ ▁tattha ▁samuday a sacc añca ▁nuppajj ati ▁magg a sacc añca ▁nuppajj ittha
PA_ya_5.2.1:172.1	Yassa vā pana yattha maggasaccaṁ nuppajjittha tassa tattha samudayasaccaṁ nuppajjatīti?	▁yassa ▁vā ▁pana ▁yattha ▁maggasaccaṃ ▁nuppajj ittha ▁tassa ▁tattha ▁samudayasaccaṃ ▁nuppajj atīti
PA_ya_5.2.1:173.1_0	Anabhisametāvīnaṁ taṇhāya uppādakkhaṇe tesaṁ tattha maggasaccaṁ nuppajjittha, no	▁anabhi sam e tā vī naṃ ▁taṇhā ya ▁uppādakkhaṇe ▁tesaṃ ▁tattha ▁maggasaccaṃ ▁nuppajj ittha ▁no
PA_ya_5.2.1:173.1_1	ca tesaṁ tattha samudayasaccaṁ nuppajjati. Suddhāvāsānaṁ dutiye citte vattamāne anabhisametāvīnaṁ	▁ca ▁tesaṃ ▁tattha ▁samudayasaccaṃ ▁nuppajj ati ▁suddhāvās ānaṃ ▁dutiy e ▁citt e ▁vattamān e ▁anabhi sam e tā vī naṃ
PA_ya_5.2.1:173.1_2	taṇhāya bhaṅgakkhaṇe taṇhāvippayuttacitte vattamāne asaññasattānaṁ tesaṁ tattha maggasaccañca	▁taṇhā ya ▁bhaṃgakkhaṇe ▁taṇhā vippayutt acitt e ▁vattamān e ▁asaññasattānaṃ ▁tesaṃ ▁tattha ▁magg a sacc añca
PA_ya_5.2.1:173.1_3	nuppajjittha samudayasaccañca nuppajjati.	▁nuppajj ittha ▁samuday a sacc añca ▁nuppajj ati
PA_ya_5.2.1:174.0.1	5.2.1.5. Paccuppannānāgatavāra	▁paccuppann ā nā gat avāra
PA_ya_5.2.1:174.0.2	5.2.1.5.1. Anulomapuggala	▁anulom apuggal a
PA_ya_5.2.1:174.1	Yassa dukkhasaccaṁ uppajjati tassa samudayasaccaṁ uppajjissatīti?	▁yassa ▁dukkhasacc aṃ ▁uppajjati ▁tassa ▁samudayasaccaṃ ▁uppajjissatīti
PA_ya_5.2.1:175.1_0	Aggamaggassa uppādakkhaṇe arahantānaṁ cittassa uppādakkhaṇe yassa cittassa anantarā	▁aggamagg assa ▁uppādakkhaṇe ▁arahant ānaṃ ▁cittassa ▁uppādakkhaṇe ▁yassa ▁cittassa ▁anantar ā
PA_ya_5.2.1:175.1_1	aggamaggaṁ paṭilabhissanti tassa cittassa uppādakkhaṇe tesaṁ dukkhasaccaṁ uppajjati,	▁aggamagg aṃ ▁paṭilabhi ssa nti ▁tassa ▁cittassa ▁uppādakkhaṇe ▁tesaṃ ▁dukkhasacc aṃ ▁uppajjati
PA_ya_5.2.1:175.1_2	no ca tesaṁ samudayasaccaṁ uppajjissati. Itaresaṁ upapajjantānaṁ pavatte cittassa	▁no ▁ca ▁tesaṃ ▁samudayasaccaṃ ▁uppajjissati ▁itaresaṃ ▁upapajjantānaṃ ▁pavatt e ▁cittassa
PA_ya_5.2.1:175.1_3	uppādakkhaṇe tesaṁ dukkhasaccañca uppajjati samudayasaccañca uppajjissati.	▁uppādakkhaṇe ▁tesaṃ ▁dukkhasacc añca ▁uppajjati ▁samuday a sacc añca ▁uppajjissati
PA_ya_5.2.1:176.1	Yassa vā pana samudayasaccaṁ uppajjissati tassa dukkhasaccaṁ uppajjatīti?	▁yassa ▁vā ▁pana ▁samudayasaccaṃ ▁uppajjissati ▁tassa ▁dukkhasacc aṃ ▁uppajjatīti
PA_ya_5.2.1:177.1_0	Sabbesaṁ cavantānaṁ pavatte cittassa bhaṅgakkhaṇe arūpe maggassa ca phalassa ca uppādakkhaṇe	▁sabbesaṃ ▁cavantānaṃ ▁pavatt e ▁cittassa ▁bhaṃgakkhaṇe ▁arūp e ▁magg assa ▁ca ▁phal assa ▁ca ▁uppādakkhaṇe
PA_ya_5.2.1:177.1_1	tesaṁ samudayasaccaṁ uppajjissati, no ca tesaṁ dukkhasaccaṁ uppajjati. Sabbesaṁ upapajjantānaṁ	▁tesaṃ ▁samudayasaccaṃ ▁uppajjissati ▁no ▁ca ▁tesaṃ ▁dukkhasacc aṃ ▁uppajjati ▁sabbesaṃ ▁upapajjantānaṃ
PA_ya_5.2.1:177.1_2	pavatte cittassa uppādakkhaṇe tesaṁ samudayasaccañca uppajjissati dukkhasaccañca uppajjati.	▁pavatt e ▁cittassa ▁uppādakkhaṇe ▁tesaṃ ▁samuday a sacc añca ▁uppajjissati ▁dukkhasacc añca ▁uppajjati
PA_ya_5.2.1:178.1	Yassa dukkhasaccaṁ uppajjati tassa maggasaccaṁ uppajjissatīti?	▁yassa ▁dukkhasacc aṃ ▁uppajjati ▁tassa ▁maggasaccaṃ ▁uppajjissatīti
PA_ya_5.2.1:179.1_0	Aggamaggassa uppādakkhaṇe arahantānaṁ cittassa uppādakkhaṇe ye ca puthujjanā maggaṁ	▁aggamagg assa ▁uppādakkhaṇe ▁arahant ānaṃ ▁cittassa ▁uppādakkhaṇe ▁ye ▁ca ▁puthujjan ā ▁maggaṃ
PA_ya_5.2.1:179.1_1	na paṭilabhissanti tesaṁ upapajjantānaṁ pavatte cittassa uppādakkhaṇe tesaṁ dukkhasaccaṁ	▁na ▁paṭilabhi ssa nti ▁tesaṃ ▁upapajjantānaṃ ▁pavatt e ▁cittassa ▁uppādakkhaṇe ▁tesaṃ ▁dukkhasacc aṃ
PA_ya_5.2.1:179.1_2	uppajjati, no ca tesaṁ maggasaccaṁ uppajjissati. Yassa cittassa anantarā aggamaggaṁ	▁uppajjati ▁no ▁ca ▁tesaṃ ▁maggasaccaṃ ▁uppajjissati ▁yassa ▁cittassa ▁anantar ā ▁aggamagg aṃ
PA_ya_5.2.1:179.1_3	paṭilabhissanti tassa cittassa uppādakkhaṇe ye caññe maggaṁ paṭilabhissanti tesaṁ	▁paṭilabhi ssa nti ▁tassa ▁cittassa ▁uppādakkhaṇe ▁ye ▁ca ññ e ▁maggaṃ ▁paṭilabhi ssa nti ▁tesaṃ
PA_ya_5.2.1:179.1_4	upapajjantānaṁ pavatte cittassa uppādakkhaṇe tesaṁ dukkhasaccañca uppajjati maggasaccañca uppajjissati.	▁upapajjantānaṃ ▁pavatt e ▁cittassa ▁uppādakkhaṇe ▁tesaṃ ▁dukkhasacc añca ▁uppajjati ▁magg a sacc añca ▁uppajjissati
PA_ya_5.2.1:180.1	Yassa vā pana maggasaccaṁ uppajjissati tassa dukkhasaccaṁ uppajjatīti?	▁yassa ▁vā ▁pana ▁maggasaccaṃ ▁uppajjissati ▁tassa ▁dukkhasacc aṃ ▁uppajjatīti
PA_ya_5.2.1:181.1_0	Yassa cittassa anantarā aggamaggaṁ paṭilabhissanti tassa cittassa bhaṅgakkhaṇe ye	▁yassa ▁cittassa ▁anantar ā ▁aggamagg aṃ ▁paṭilabhi ssa nti ▁tassa ▁cittassa ▁bhaṃgakkhaṇe ▁ye
PA_ya_5.2.1:181.1_1	caññe maggaṁ paṭilabhissanti tesaṁ cavantānaṁ pavatte cittassa bhaṅgakkhaṇe arūpe	▁ca ññ e ▁maggaṃ ▁paṭilabhi ssa nti ▁tesaṃ ▁cavantānaṃ ▁pavatt e ▁cittassa ▁bhaṃgakkhaṇe ▁arūp e
PA_ya_5.2.1:181.1_2	maggassa ca phalassa ca uppādakkhaṇe tesaṁ maggasaccaṁ uppajjissati, no ca tesaṁ	▁magg assa ▁ca ▁phal assa ▁ca ▁uppādakkhaṇe ▁tesaṃ ▁maggasaccaṃ ▁uppajjissati ▁no ▁ca ▁tesaṃ
PA_ya_5.2.1:181.1_3	dukkhasaccaṁ uppajjati. Yassa cittassa anantarā aggamaggaṁ paṭilabhissanti tassa	▁dukkhasacc aṃ ▁uppajjati ▁yassa ▁cittassa ▁anantar ā ▁aggamagg aṃ ▁paṭilabhi ssa nti ▁tassa
PA_ya_5.2.1:181.1_4	cittassa uppādakkhaṇe ye caññe maggaṁ paṭilabhissanti tesaṁ upapajjantānaṁ pavatte	▁cittassa ▁uppādakkhaṇe ▁ye ▁ca ññ e ▁maggaṃ ▁paṭilabhi ssa nti ▁tesaṃ ▁upapajjantānaṃ ▁pavatt e
PA_ya_5.2.1:181.1_5	cittassa uppādakkhaṇe tesaṁ maggasaccañca uppajjissati dukkhasaccañca uppajjati.	▁cittassa ▁uppādakkhaṇe ▁tesaṃ ▁magg a sacc añca ▁uppajjissati ▁dukkhasacc añca ▁uppajjati
PA_ya_5.2.1:182.1	Yassa samudayasaccaṁ uppajjati tassa maggasaccaṁ uppajjissatīti?	▁yassa ▁samudayasaccaṃ ▁uppajjati ▁tassa ▁maggasaccaṃ ▁uppajjissatīti
PA_ya_5.2.1:183.1_0	Ye puthujjanā maggaṁ na paṭilabhissanti tesaṁ taṇhāya uppādakkhaṇe tesaṁ samudayasaccaṁ	▁ye ▁puthujjan ā ▁maggaṃ ▁na ▁paṭilabhi ssa nti ▁tesaṃ ▁taṇhā ya ▁uppādakkhaṇe ▁tesaṃ ▁samudayasaccaṃ
PA_ya_5.2.1:183.1_1	uppajjati, no ca tesaṁ maggasaccaṁ uppajjissati. Ye maggaṁ paṭilabhissanti tesaṁ	▁uppajjati ▁no ▁ca ▁tesaṃ ▁maggasaccaṃ ▁uppajjissati ▁ye ▁maggaṃ ▁paṭilabhi ssa nti ▁tesaṃ
PA_ya_5.2.1:183.1_2	taṇhāya uppādakkhaṇe tesaṁ samudayasaccañca uppajjati maggasaccañca uppajjissati.	▁taṇhā ya ▁uppādakkhaṇe ▁tesaṃ ▁samuday a sacc añca ▁uppajjati ▁magg a sacc añca ▁uppajjissati
PA_ya_5.2.1:184.1	Yassa vā pana maggasaccaṁ uppajjissati tassa samudayasaccaṁ uppajjatīti?	▁yassa ▁vā ▁pana ▁maggasaccaṃ ▁uppajjissati ▁tassa ▁samudayasaccaṃ ▁uppajjatīti
PA_ya_5.2.1:185.1_0	Yassa cittassa anantarā aggamaggaṁ paṭilabhissanti ye caññe maggaṁ paṭilabhissanti	▁yassa ▁cittassa ▁anantar ā ▁aggamagg aṃ ▁paṭilabhi ssa nti ▁ye ▁ca ññ e ▁maggaṃ ▁paṭilabhi ssa nti
PA_ya_5.2.1:185.1_1	tesaṁ taṇhāya bhaṅgakkhaṇe taṇhāvippayuttacitte vattamāne nirodhasamāpannānaṁ asaññasattānaṁ	▁tesaṃ ▁taṇhā ya ▁bhaṃgakkhaṇe ▁taṇhā vippayutt acitt e ▁vattamān e ▁nirodh a samāpann ānaṃ ▁asaññasattānaṃ
PA_ya_5.2.1:185.1_2	tesaṁ maggasaccaṁ uppajjissati, no ca tesaṁ samudayasaccaṁ uppajjati. Ye maggaṁ paṭilabhissanti	▁tesaṃ ▁maggasaccaṃ ▁uppajjissati ▁no ▁ca ▁tesaṃ ▁samudayasaccaṃ ▁uppajjati ▁ye ▁maggaṃ ▁paṭilabhi ssa nti
PA_ya_5.2.1:185.1_3	tesaṁ taṇhāya uppādakkhaṇe tesaṁ maggasaccañca uppajjissati samudayasaccañca uppajjati.	▁tesaṃ ▁taṇhā ya ▁uppādakkhaṇe ▁tesaṃ ▁magg a sacc añca ▁uppajjissati ▁samuday a sacc añca ▁uppajjati
PA_ya_5.2.1:186.0	5.2.1.5.2. Anulomaokāsa	▁anulom a okāsa
PA_ya_5.2.1:186.1	Yattha dukkhasaccaṁ uppajjati …pe…	▁yattha ▁dukkhasacc aṃ ▁uppajjati ▁pe
PA_ya_5.2.1:187.1	(Yatthakampi yassayatthakasadisaṁ kātabbaṁ.)	▁yattha kampi ▁yassa y atth ak asadis aṃ ▁kātabbaṃ
PA_ya_5.2.1:188.0	5.2.1.5.3. Anulomapuggalokāsa	▁anulom apuggal okāsa
PA_ya_5.2.1:188.1	Yassa yattha dukkhasaccaṁ uppajjati tassa tattha samudayasaccaṁ uppajjissatīti?	▁yassa ▁yattha ▁dukkhasacc aṃ ▁uppajjati ▁tassa ▁tattha ▁samudayasaccaṃ ▁uppajjissatīti
PA_ya_5.2.1:189.1_0	Aggamaggassa uppādakkhaṇe arahantānaṁ cittassa uppādakkhaṇe yassa cittassa anantarā	▁aggamagg assa ▁uppādakkhaṇe ▁arahant ānaṃ ▁cittassa ▁uppādakkhaṇe ▁yassa ▁cittassa ▁anantar ā
