segmentnr	original	analyzed
PA_ya_5.2.1:189.1_1	aggamaggaṁ paṭilabhissanti tassa cittassa uppādakkhaṇe asaññasattaṁ upapajjantānaṁ	▁aggamagg aṃ ▁paṭilabhi ssa nti ▁tassa ▁cittassa ▁uppādakkhaṇe ▁as añña satt aṃ ▁upapajjantānaṃ
PA_ya_5.2.1:189.1_2	tesaṁ tattha dukkhasaccaṁ uppajjati, no ca tesaṁ tattha samudayasaccaṁ uppajjissati.	▁tesaṃ ▁tattha ▁dukkhasacc aṃ ▁uppajjati ▁no ▁ca ▁tesaṃ ▁tattha ▁samudayasaccaṃ ▁uppajjissati
PA_ya_5.2.1:189.1_3	Itaresaṁ catuvokāraṁ pañcavokāraṁ upapajjantānaṁ pavatte cittassa uppādakkhaṇe tesaṁ	▁itaresaṃ ▁catu vo kār aṃ ▁pañcavokār aṃ ▁upapajjantānaṃ ▁pavatt e ▁cittassa ▁uppādakkhaṇe ▁tesaṃ
PA_ya_5.2.1:189.1_4	tattha dukkhasaccañca uppajjati samudayasaccañca uppajjissati.	▁tattha ▁dukkhasacc añca ▁uppajjati ▁samuday a sacc añca ▁uppajjissati
PA_ya_5.2.1:190.1	Yassa vā pana yattha samudayasaccaṁ uppajjissati tassa tattha dukkhasaccaṁ uppajjatīti?	▁yassa ▁vā ▁pana ▁yattha ▁samudayasaccaṃ ▁uppajjissati ▁tassa ▁tattha ▁dukkhasacc aṃ ▁uppajjatīti
PA_ya_5.2.1:191.1_0	Catuvokārā pañcavokārā cavantānaṁ pavatte cittassa bhaṅgakkhaṇe arūpe maggassa ca	▁catu vo kār ā ▁pañcavokār ā ▁cavantānaṃ ▁pavatt e ▁cittassa ▁bhaṃgakkhaṇe ▁arūp e ▁magg assa ▁ca
PA_ya_5.2.1:191.1_1	phalassa ca uppādakkhaṇe tesaṁ tattha samudayasaccaṁ uppajjissati, no ca tesaṁ tattha	▁phal assa ▁ca ▁uppādakkhaṇe ▁tesaṃ ▁tattha ▁samudayasaccaṃ ▁uppajjissati ▁no ▁ca ▁tesaṃ ▁tattha
PA_ya_5.2.1:191.1_2	dukkhasaccaṁ uppajjati. Catuvokāraṁ pañcavokāraṁ upapajjantānaṁ pavatte cittassa	▁dukkhasacc aṃ ▁uppajjati ▁catu vo kār aṃ ▁pañcavokār aṃ ▁upapajjantānaṃ ▁pavatt e ▁cittassa
PA_ya_5.2.1:191.1_3	uppādakkhaṇe tesaṁ tattha samudayasaccañca uppajjissati dukkhasaccañca uppajjati.	▁uppādakkhaṇe ▁tesaṃ ▁tattha ▁samuday a sacc añca ▁uppajjissati ▁dukkhasacc añca ▁uppajjati
PA_ya_5.2.1:192.1	Yassa yattha dukkhasaccaṁ uppajjati tassa tattha maggasaccaṁ uppajjissatīti?	▁yassa ▁yattha ▁dukkhasacc aṃ ▁uppajjati ▁tassa ▁tattha ▁maggasaccaṃ ▁uppajjissatīti
PA_ya_5.2.1:193.1_0	Aggamaggassa uppādakkhaṇe arahantānaṁ cittassa uppādakkhaṇe āpāyikānaṁ ye ca puthujjanā	▁aggamagg assa ▁uppādakkhaṇe ▁arahant ānaṃ ▁cittassa ▁uppādakkhaṇe ▁ ā pāy ikānaṃ ▁ye ▁ca ▁puthujjan ā
PA_ya_5.2.1:193.1_1	maggaṁ na paṭilabhissanti tesaṁ upapajjantānaṁ pavatte cittassa uppādakkhaṇe asaññasattaṁ	▁maggaṃ ▁na ▁paṭilabhi ssa nti ▁tesaṃ ▁upapajjantānaṃ ▁pavatt e ▁cittassa ▁uppādakkhaṇe ▁as añña satt aṃ
PA_ya_5.2.1:193.1_2	upapajjantānaṁ tesaṁ tattha dukkhasaccaṁ uppajjati, no ca tesaṁ tattha maggasaccaṁ	▁upapajjantānaṃ ▁tesaṃ ▁tattha ▁dukkhasacc aṃ ▁uppajjati ▁no ▁ca ▁tesaṃ ▁tattha ▁maggasaccaṃ
PA_ya_5.2.1:193.1_3	uppajjissati. Yassa cittassa anantarā aggamaggaṁ paṭilabhissanti tassa cittassa uppādakkhaṇe	▁uppajjissati ▁yassa ▁cittassa ▁anantar ā ▁aggamagg aṃ ▁paṭilabhi ssa nti ▁tassa ▁cittassa ▁uppādakkhaṇe
PA_ya_5.2.1:193.1_4	ye caññe maggaṁ paṭilabhissanti tesaṁ upapajjantānaṁ pavatte cittassa uppādakkhaṇe	▁ye ▁ca ññ e ▁maggaṃ ▁paṭilabhi ssa nti ▁tesaṃ ▁upapajjantānaṃ ▁pavatt e ▁cittassa ▁uppādakkhaṇe
PA_ya_5.2.1:193.1_5	tesaṁ tattha dukkhasaccañca uppajjati maggasaccañca uppajjissati.	▁tesaṃ ▁tattha ▁dukkhasacc añca ▁uppajjati ▁magg a sacc añca ▁uppajjissati
PA_ya_5.2.1:194.1	Yassa vā pana yattha maggasaccaṁ uppajjissati tassa tattha dukkhasaccaṁ uppajjatīti?	▁yassa ▁vā ▁pana ▁yattha ▁maggasaccaṃ ▁uppajjissati ▁tassa ▁tattha ▁dukkhasacc aṃ ▁uppajjatīti
PA_ya_5.2.1:195.1_0	Yassa cittassa anantarā aggamaggaṁ paṭilabhissanti tassa cittassa bhaṅgakkhaṇe ye	▁yassa ▁cittassa ▁anantar ā ▁aggamagg aṃ ▁paṭilabhi ssa nti ▁tassa ▁cittassa ▁bhaṃgakkhaṇe ▁ye
PA_ya_5.2.1:195.1_1	caññe maggaṁ paṭilabhissanti tesaṁ cavantānaṁ pavatte cittassa bhaṅgakkhaṇe arūpe	▁ca ññ e ▁maggaṃ ▁paṭilabhi ssa nti ▁tesaṃ ▁cavantānaṃ ▁pavatt e ▁cittassa ▁bhaṃgakkhaṇe ▁arūp e
PA_ya_5.2.1:195.1_2	maggassa ca phalassa ca uppādakkhaṇe tesaṁ tattha maggasaccaṁ uppajjissati, no ca	▁magg assa ▁ca ▁phal assa ▁ca ▁uppādakkhaṇe ▁tesaṃ ▁tattha ▁maggasaccaṃ ▁uppajjissati ▁no ▁ca
PA_ya_5.2.1:195.1_3	tesaṁ tattha dukkhasaccaṁ uppajjati. Yassa cittassa anantarā aggamaggaṁ paṭilabhissanti	▁tesaṃ ▁tattha ▁dukkhasacc aṃ ▁uppajjati ▁yassa ▁cittassa ▁anantar ā ▁aggamagg aṃ ▁paṭilabhi ssa nti
PA_ya_5.2.1:195.1_4	tassa cittassa uppādakkhaṇe ye caññe maggaṁ paṭilabhissanti tesaṁ upapajjantānaṁ	▁tassa ▁cittassa ▁uppādakkhaṇe ▁ye ▁ca ññ e ▁maggaṃ ▁paṭilabhi ssa nti ▁tesaṃ ▁upapajjantānaṃ
PA_ya_5.2.1:195.1_5	pavatte cittassa uppādakkhaṇe tesaṁ tattha maggasaccañca uppajjissati dukkhasaccañca uppajjati.	▁pavatt e ▁cittassa ▁uppādakkhaṇe ▁tesaṃ ▁tattha ▁magg a sacc añca ▁uppajjissati ▁dukkhasacc añca ▁uppajjati
PA_ya_5.2.1:196.1	Yassa yattha samudayasaccaṁ uppajjati tassa tattha maggasaccaṁ uppajjissatīti?	▁yassa ▁yattha ▁samudayasaccaṃ ▁uppajjati ▁tassa ▁tattha ▁maggasaccaṃ ▁uppajjissatīti
PA_ya_5.2.1:197.1_0	Āpāyikānaṁ ye ca puthujjanā maggaṁ na paṭilabhissanti tesaṁ taṇhāya uppādakkhaṇe	▁ ā pāy ikānaṃ ▁ye ▁ca ▁puthujjan ā ▁maggaṃ ▁na ▁paṭilabhi ssa nti ▁tesaṃ ▁taṇhā ya ▁uppādakkhaṇe
PA_ya_5.2.1:197.1_1	tesaṁ tattha samudayasaccaṁ uppajjati, no ca tesaṁ tattha maggasaccaṁ uppajjissati.	▁tesaṃ ▁tattha ▁samudayasaccaṃ ▁uppajjati ▁no ▁ca ▁tesaṃ ▁tattha ▁maggasaccaṃ ▁uppajjissati
PA_ya_5.2.1:197.1_2	Ye maggaṁ paṭilabhissanti tesaṁ taṇhāya uppādakkhaṇe tesaṁ tattha samudayasaccañca	▁ye ▁maggaṃ ▁paṭilabhi ssa nti ▁tesaṃ ▁taṇhā ya ▁uppādakkhaṇe ▁tesaṃ ▁tattha ▁samuday a sacc añca
PA_ya_5.2.1:197.1_3	uppajjati maggasaccañca uppajjissati.	▁uppajjati ▁magg a sacc añca ▁uppajjissati
PA_ya_5.2.1:198.1	Yassa vā pana yattha maggasaccaṁ uppajjissati tassa tattha samudayasaccaṁ uppajjatīti?	▁yassa ▁vā ▁pana ▁yattha ▁maggasaccaṃ ▁uppajjissati ▁tassa ▁tattha ▁samudayasaccaṃ ▁uppajjatīti
PA_ya_5.2.1:199.1_0	Yassa cittassa anantarā aggamaggaṁ paṭilabhissanti ye caññe maggaṁ paṭilabhissanti	▁yassa ▁cittassa ▁anantar ā ▁aggamagg aṃ ▁paṭilabhi ssa nti ▁ye ▁ca ññ e ▁maggaṃ ▁paṭilabhi ssa nti
PA_ya_5.2.1:199.1_1	tesaṁ taṇhāya bhaṅgakkhaṇe taṇhāvippayuttacitte vattamāne tesaṁ tattha maggasaccaṁ	▁tesaṃ ▁taṇhā ya ▁bhaṃgakkhaṇe ▁taṇhā vippayutt acitt e ▁vattamān e ▁tesaṃ ▁tattha ▁maggasaccaṃ
PA_ya_5.2.1:199.1_2	uppajjissati, no ca tesaṁ tattha samudayasaccaṁ uppajjati. Ye maggaṁ paṭilabhissanti	▁uppajjissati ▁no ▁ca ▁tesaṃ ▁tattha ▁samudayasaccaṃ ▁uppajjati ▁ye ▁maggaṃ ▁paṭilabhi ssa nti
PA_ya_5.2.1:199.1_3	tesaṁ taṇhāya uppādakkhaṇe tesaṁ tattha maggasaccañca uppajjissati samudayasaccañca uppajjati.	▁tesaṃ ▁taṇhā ya ▁uppādakkhaṇe ▁tesaṃ ▁tattha ▁magg a sacc añca ▁uppajjissati ▁samuday a sacc añca ▁uppajjati
PA_ya_5.2.1:200.0	5.2.1.5.4. Paccanīkapuggala	▁ paccanīk apuggal a
PA_ya_5.2.1:200.1	Yassa dukkhasaccaṁ nuppajjati tassa samudayasaccaṁ nuppajjissatīti?	▁yassa ▁dukkhasacc aṃ ▁nuppajj ati ▁tassa ▁samudayasaccaṃ ▁nuppajj issatīti
PA_ya_5.2.1:201.1_0	Sabbesaṁ cavantānaṁ pavatte cittassa bhaṅgakkhaṇe arūpe maggassa ca phalassa ca uppādakkhaṇe	▁sabbesaṃ ▁cavantānaṃ ▁pavatt e ▁cittassa ▁bhaṃgakkhaṇe ▁arūp e ▁magg assa ▁ca ▁phal assa ▁ca ▁uppādakkhaṇe
PA_ya_5.2.1:201.1_1	tesaṁ dukkhasaccaṁ nuppajjati, no ca tesaṁ samudayasaccaṁ nuppajjissati. Aggamaggassa	▁tesaṃ ▁dukkhasacc aṃ ▁nuppajj ati ▁no ▁ca ▁tesaṃ ▁samudayasaccaṃ ▁nuppajj issati ▁aggamagg assa
PA_ya_5.2.1:201.1_2	bhaṅgakkhaṇe arahantānaṁ cittassa bhaṅgakkhaṇe yassa cittassa anantarā aggamaggaṁ	▁bhaṃgakkhaṇe ▁arahant ānaṃ ▁cittassa ▁bhaṃgakkhaṇe ▁yassa ▁cittassa ▁anantar ā ▁aggamagg aṃ
PA_ya_5.2.1:201.1_3	paṭilabhissanti tassa cittassa bhaṅgakkhaṇe arūpe aggamaggassa ca phalassa ca uppādakkhaṇe	▁paṭilabhi ssa nti ▁tassa ▁cittassa ▁bhaṃgakkhaṇe ▁arūp e ▁aggamagg assa ▁ca ▁phal assa ▁ca ▁uppādakkhaṇe
PA_ya_5.2.1:201.1_4	tesaṁ dukkhasaccañca nuppajjati samudayasaccañca nuppajjissati.	▁tesaṃ ▁dukkhasacc añca ▁nuppajj ati ▁samuday a sacc añca ▁nuppajj issati
PA_ya_5.2.1:202.1	Yassa vā pana samudayasaccaṁ nuppajjissati tassa dukkhasaccaṁ nuppajjatīti?	▁yassa ▁vā ▁pana ▁samudayasaccaṃ ▁nuppajj issati ▁tassa ▁dukkhasacc aṃ ▁nuppajj atīti
PA_ya_5.2.1:203.1_0	Aggamaggassa uppādakkhaṇe arahantānaṁ cittassa uppādakkhaṇe yassa cittassa anantarā	▁aggamagg assa ▁uppādakkhaṇe ▁arahant ānaṃ ▁cittassa ▁uppādakkhaṇe ▁yassa ▁cittassa ▁anantar ā
PA_ya_5.2.1:203.1_1	aggamaggaṁ paṭilabhissanti tassa cittassa uppādakkhaṇe tesaṁ samudayasaccaṁ nuppajjissati,	▁aggamagg aṃ ▁paṭilabhi ssa nti ▁tassa ▁cittassa ▁uppādakkhaṇe ▁tesaṃ ▁samudayasaccaṃ ▁nuppajj issati
PA_ya_5.2.1:203.1_2	no ca tesaṁ dukkhasaccaṁ nuppajjati. Aggamaggassa bhaṅgakkhaṇe arahantānaṁ cittassa	▁no ▁ca ▁tesaṃ ▁dukkhasacc aṃ ▁nuppajj ati ▁aggamagg assa ▁bhaṃgakkhaṇe ▁arahant ānaṃ ▁cittassa
PA_ya_5.2.1:203.1_3	bhaṅgakkhaṇe yassa cittassa anantarā aggamaggaṁ paṭilabhissanti tassa cittassa bhaṅgakkhaṇe	▁bhaṃgakkhaṇe ▁yassa ▁cittassa ▁anantar ā ▁aggamagg aṃ ▁paṭilabhi ssa nti ▁tassa ▁cittassa ▁bhaṃgakkhaṇe
PA_ya_5.2.1:203.1_4	arūpe aggamaggassa ca phalassa ca uppādakkhaṇe tesaṁ samudayasaccañca nuppajjissati	▁arūp e ▁aggamagg assa ▁ca ▁phal assa ▁ca ▁uppādakkhaṇe ▁tesaṃ ▁samuday a sacc añca ▁nuppajj issati
PA_ya_5.2.1:203.1_5	dukkhasaccañca nuppajjati.	▁dukkhasacc añca ▁nuppajj ati
PA_ya_5.2.1:204.1	Yassa dukkhasaccaṁ nuppajjati tassa maggasaccaṁ nuppajjissatīti?	▁yassa ▁dukkhasacc aṃ ▁nuppajj ati ▁tassa ▁maggasaccaṃ ▁nuppajj issatīti
PA_ya_5.2.1:205.1_0	Yassa cittassa anantarā aggamaggaṁ paṭilabhissanti tassa cittassa bhaṅgakkhaṇe ye	▁yassa ▁cittassa ▁anantar ā ▁aggamagg aṃ ▁paṭilabhi ssa nti ▁tassa ▁cittassa ▁bhaṃgakkhaṇe ▁ye
PA_ya_5.2.1:205.1_1	caññe maggaṁ paṭilabhissanti tesaṁ cavantānaṁ pavatte cittassa bhaṅgakkhaṇe arūpe	▁ca ññ e ▁maggaṃ ▁paṭilabhi ssa nti ▁tesaṃ ▁cavantānaṃ ▁pavatt e ▁cittassa ▁bhaṃgakkhaṇe ▁arūp e
PA_ya_5.2.1:205.1_2	maggassa ca phalassa ca uppādakkhaṇe tesaṁ dukkhasaccaṁ nuppajjati, no ca tesaṁ maggasaccaṁ	▁magg assa ▁ca ▁phal assa ▁ca ▁uppādakkhaṇe ▁tesaṃ ▁dukkhasacc aṃ ▁nuppajj ati ▁no ▁ca ▁tesaṃ ▁maggasaccaṃ
PA_ya_5.2.1:205.1_3	nuppajjissati. Aggamaggassa bhaṅgakkhaṇe arahantānaṁ cittassa bhaṅgakkhaṇe ye ca	▁nuppajj issati ▁aggamagg assa ▁bhaṃgakkhaṇe ▁arahant ānaṃ ▁cittassa ▁bhaṃgakkhaṇe ▁ye ▁ca
PA_ya_5.2.1:205.1_4	puthujjanā maggaṁ na paṭilabhissanti tesaṁ cavantānaṁ pavatte cittassa bhaṅgakkhaṇe	▁puthujjan ā ▁maggaṃ ▁na ▁paṭilabhi ssa nti ▁tesaṃ ▁cavantānaṃ ▁pavatt e ▁cittassa ▁bhaṃgakkhaṇe
PA_ya_5.2.1:205.1_5	arūpe aggamaggassa ca phalassa ca uppādakkhaṇe tesaṁ dukkhasaccañca nuppajjati maggasaccañca nuppajjissati.	▁arūp e ▁aggamagg assa ▁ca ▁phal assa ▁ca ▁uppādakkhaṇe ▁tesaṃ ▁dukkhasacc añca ▁nuppajj ati ▁magg a sacc añca ▁nuppajj issati
PA_ya_5.2.1:206.1	Yassa vā pana maggasaccaṁ nuppajjissati tassa dukkhasaccaṁ nuppajjatīti?	▁yassa ▁vā ▁pana ▁maggasaccaṃ ▁nuppajj issati ▁tassa ▁dukkhasacc aṃ ▁nuppajj atīti
PA_ya_5.2.1:207.1_0	Aggamaggassa uppādakkhaṇe arahantānaṁ cittassa uppādakkhaṇe ye ca puthujjanā maggaṁ	▁aggamagg assa ▁uppādakkhaṇe ▁arahant ānaṃ ▁cittassa ▁uppādakkhaṇe ▁ye ▁ca ▁puthujjan ā ▁maggaṃ
PA_ya_5.2.1:207.1_1	na paṭilabhissanti tesaṁ upapajjantānaṁ pavatte cittassa uppādakkhaṇe tesaṁ maggasaccaṁ	▁na ▁paṭilabhi ssa nti ▁tesaṃ ▁upapajjantānaṃ ▁pavatt e ▁cittassa ▁uppādakkhaṇe ▁tesaṃ ▁maggasaccaṃ
PA_ya_5.2.1:207.1_2	nuppajjissati, no ca tesaṁ dukkhasaccaṁ nuppajjati. Aggamaggassa bhaṅgakkhaṇe arahantānaṁ	▁nuppajj issati ▁no ▁ca ▁tesaṃ ▁dukkhasacc aṃ ▁nuppajj ati ▁aggamagg assa ▁bhaṃgakkhaṇe ▁arahant ānaṃ
PA_ya_5.2.1:207.1_3	cittassa bhaṅgakkhaṇe ye ca puthujjanā maggaṁ na paṭilabhissanti tesaṁ cavantānaṁ	▁cittassa ▁bhaṃgakkhaṇe ▁ye ▁ca ▁puthujjan ā ▁maggaṃ ▁na ▁paṭilabhi ssa nti ▁tesaṃ ▁cavantānaṃ
PA_ya_5.2.1:207.1_4	pavatte cittassa bhaṅgakkhaṇe arūpe aggamaggassa ca phalassa ca uppādakkhaṇe tesaṁ	▁pavatt e ▁cittassa ▁bhaṃgakkhaṇe ▁arūp e ▁aggamagg assa ▁ca ▁phal assa ▁ca ▁uppādakkhaṇe ▁tesaṃ
PA_ya_5.2.1:207.1_5	maggasaccañca nuppajjissati dukkhasaccañca nuppajjati.	▁magg a sacc añca ▁nuppajj issati ▁dukkhasacc añca ▁nuppajj ati
PA_ya_5.2.1:208.1	Yassa samudayasaccaṁ nuppajjati tassa maggasaccaṁ nuppajjissatīti?	▁yassa ▁samudayasaccaṃ ▁nuppajj ati ▁tassa ▁maggasaccaṃ ▁nuppajj issatīti
PA_ya_5.2.1:209.1_0	Yassa cittassa anantarā aggamaggaṁ paṭilabhissanti ye caññe maggaṁ paṭilabhissanti	▁yassa ▁cittassa ▁anantar ā ▁aggamagg aṃ ▁paṭilabhi ssa nti ▁ye ▁ca ññ e ▁maggaṃ ▁paṭilabhi ssa nti
PA_ya_5.2.1:209.1_1	tesaṁ taṇhāya bhaṅgakkhaṇe taṇhāvippayuttacitte vattamāne nirodhasamāpannānaṁ asaññasattānaṁ	▁tesaṃ ▁taṇhā ya ▁bhaṃgakkhaṇe ▁taṇhā vippayutt acitt e ▁vattamān e ▁nirodh a samāpann ānaṃ ▁asaññasattānaṃ
PA_ya_5.2.1:209.1_2	tesaṁ samudayasaccaṁ nuppajjati, no ca tesaṁ maggasaccaṁ nuppajjissati. Aggamaggasamaṅgīnaṁ	▁tesaṃ ▁samudayasaccaṃ ▁nuppajj ati ▁no ▁ca ▁tesaṃ ▁maggasaccaṃ ▁nuppajj issati ▁aggamagg a samaṃgī naṃ
PA_ya_5.2.1:209.1_3	arahantānaṁ ye ca puthujjanā maggaṁ na paṭilabhissanti tesaṁ taṇhāya bhaṅgakkhaṇe	▁arahant ānaṃ ▁ye ▁ca ▁puthujjan ā ▁maggaṃ ▁na ▁paṭilabhi ssa nti ▁tesaṃ ▁taṇhā ya ▁bhaṃgakkhaṇe
PA_ya_5.2.1:209.1_4	taṇhāvippayuttacitte vattamāne tesaṁ samudayasaccañca nuppajjati maggasaccañca nuppajjissati.	▁taṇhā vippayutt acitt e ▁vattamān e ▁tesaṃ ▁samuday a sacc añca ▁nuppajj ati ▁magg a sacc añca ▁nuppajj issati
PA_ya_5.2.1:210.1	Yassa vā pana maggasaccaṁ nuppajjissati tassa samudayasaccaṁ nuppajjatīti?	▁yassa ▁vā ▁pana ▁maggasaccaṃ ▁nuppajj issati ▁tassa ▁samudayasaccaṃ ▁nuppajj atīti
PA_ya_5.2.1:211.1_0	Ye puthujjanā maggaṁ na paṭilabhissanti tesaṁ taṇhāya uppādakkhaṇe tesaṁ maggasaccaṁ	▁ye ▁puthujjan ā ▁maggaṃ ▁na ▁paṭilabhi ssa nti ▁tesaṃ ▁taṇhā ya ▁uppādakkhaṇe ▁tesaṃ ▁maggasaccaṃ
PA_ya_5.2.1:211.1_1	nuppajjissati, no ca tesaṁ samudayasaccaṁ nuppajjati. Aggamaggasamaṅgīnaṁ arahantānaṁ	▁nuppajj issati ▁no ▁ca ▁tesaṃ ▁samudayasaccaṃ ▁nuppajj ati ▁aggamagg a samaṃgī naṃ ▁arahant ānaṃ
PA_ya_5.2.1:211.1_2	ye ca puthujjanā maggaṁ na paṭilabhissanti tesaṁ taṇhāya bhaṅgakkhaṇe taṇhāvippayuttacitte	▁ye ▁ca ▁puthujjan ā ▁maggaṃ ▁na ▁paṭilabhi ssa nti ▁tesaṃ ▁taṇhā ya ▁bhaṃgakkhaṇe ▁taṇhā vippayutt acitt e
PA_ya_5.2.1:211.1_3	vattamāne tesaṁ maggasaccañca nuppajjissati samudayasaccañca nuppajjati.	▁vattamān e ▁tesaṃ ▁magg a sacc añca ▁nuppajj issati ▁samuday a sacc añca ▁nuppajj ati
PA_ya_5.2.1:212.0	5.2.1.5.5. Paccanīkaokāsa	▁ paccanīk a okāsa
PA_ya_5.2.1:212.1	Yattha dukkhasaccaṁ nuppajjati …pe….	▁yattha ▁dukkhasacc aṃ ▁nuppajj ati ▁pe
PA_ya_5.2.1:213.0	5.2.1.5.6. Paccanīkapuggalokāsa	▁ paccanīk apuggal okāsa
PA_ya_5.2.1:213.1	Yassa yattha dukkhasaccaṁ nuppajjati tassa tattha samudayasaccaṁ nuppajjissatīti?	▁yassa ▁yattha ▁dukkhasacc aṃ ▁nuppajj ati ▁tassa ▁tattha ▁samudayasaccaṃ ▁nuppajj issatīti
PA_ya_5.2.1:214.1_0	Catuvokārā pañcavokārā cavantānaṁ pavatte cittassa bhaṅgakkhaṇe arūpe maggassa ca	▁catu vo kār ā ▁pañcavokār ā ▁cavantānaṃ ▁pavatt e ▁cittassa ▁bhaṃgakkhaṇe ▁arūp e ▁magg assa ▁ca
PA_ya_5.2.1:214.1_1	phalassa ca uppādakkhaṇe tesaṁ tattha dukkhasaccaṁ nuppajjati, no ca tesaṁ tattha	▁phal assa ▁ca ▁uppādakkhaṇe ▁tesaṃ ▁tattha ▁dukkhasacc aṃ ▁nuppajj ati ▁no ▁ca ▁tesaṃ ▁tattha
PA_ya_5.2.1:214.1_2	samudayasaccaṁ nuppajjissati. Aggamaggassa bhaṅgakkhaṇe arahantānaṁ cittassa bhaṅgakkhaṇe	▁samudayasaccaṃ ▁nuppajj issati ▁aggamagg assa ▁bhaṃgakkhaṇe ▁arahant ānaṃ ▁cittassa ▁bhaṃgakkhaṇe
PA_ya_5.2.1:214.1_3	yassa cittassa anantarā aggamaggaṁ paṭilabhissanti tassa cittassa bhaṅgakkhaṇe asaññasattā	▁yassa ▁cittassa ▁anantar ā ▁aggamagg aṃ ▁paṭilabhi ssa nti ▁tassa ▁cittassa ▁bhaṃgakkhaṇe ▁a saññ as attā
PA_ya_5.2.1:214.1_4	cavantānaṁ arūpe aggamaggassa ca phalassa ca uppādakkhaṇe tesaṁ tattha dukkhasaccañca	▁cavantānaṃ ▁arūp e ▁aggamagg assa ▁ca ▁phal assa ▁ca ▁uppādakkhaṇe ▁tesaṃ ▁tattha ▁dukkhasacc añca
PA_ya_5.2.1:214.1_5	nuppajjati samudayasaccañca nuppajjissati.	▁nuppajj ati ▁samuday a sacc añca ▁nuppajj issati
PA_ya_5.2.1:215.1	Yassa vā pana yattha samudayasaccaṁ nuppajjissati tassa tattha dukkhasaccaṁ nuppajjatīti?	▁yassa ▁vā ▁pana ▁yattha ▁samudayasaccaṃ ▁nuppajj issati ▁tassa ▁tattha ▁dukkhasacc aṃ ▁nuppajj atīti
PA_ya_5.2.1:216.1_0	Aggamaggassa uppādakkhaṇe arahantānaṁ cittassa uppādakkhaṇe yassa cittassa anantarā	▁aggamagg assa ▁uppādakkhaṇe ▁arahant ānaṃ ▁cittassa ▁uppādakkhaṇe ▁yassa ▁cittassa ▁anantar ā
PA_ya_5.2.1:216.1_1	aggamaggaṁ paṭilabhissanti tassa cittassa uppādakkhaṇe asaññasattaṁ upapajjantānaṁ	▁aggamagg aṃ ▁paṭilabhi ssa nti ▁tassa ▁cittassa ▁uppādakkhaṇe ▁as añña satt aṃ ▁upapajjantānaṃ
PA_ya_5.2.1:216.1_2	tesaṁ tattha samudayasaccaṁ nuppajjissati, no ca tesaṁ tattha dukkhasaccaṁ nuppajjati.	▁tesaṃ ▁tattha ▁samudayasaccaṃ ▁nuppajj issati ▁no ▁ca ▁tesaṃ ▁tattha ▁dukkhasacc aṃ ▁nuppajj ati
PA_ya_5.2.1:216.1_3	Aggamaggassa bhaṅgakkhaṇe arahantānaṁ cittassa bhaṅgakkhaṇe yassa cittassa anantarā	▁aggamagg assa ▁bhaṃgakkhaṇe ▁arahant ānaṃ ▁cittassa ▁bhaṃgakkhaṇe ▁yassa ▁cittassa ▁anantar ā
PA_ya_5.2.1:216.1_4	aggamaggaṁ paṭilabhissanti tassa cittassa bhaṅgakkhaṇe arūpe aggamaggassa ca phalassa	▁aggamagg aṃ ▁paṭilabhi ssa nti ▁tassa ▁cittassa ▁bhaṃgakkhaṇe ▁arūp e ▁aggamagg assa ▁ca ▁phal assa
PA_ya_5.2.1:216.1_5	ca uppādakkhaṇe asaññasattā cavantānaṁ tesaṁ tattha samudayasaccañca nuppajjissati	▁ca ▁uppādakkhaṇe ▁a saññ as attā ▁cavantānaṃ ▁tesaṃ ▁tattha ▁samuday a sacc añca ▁nuppajj issati
PA_ya_5.2.1:216.1_6	dukkhasaccañca nuppajjati.	▁dukkhasacc añca ▁nuppajj ati
PA_ya_5.2.1:217.1	Yassa yattha dukkhasaccaṁ nuppajjati tassa tattha maggasaccaṁ nuppajjissatīti?	▁yassa ▁yattha ▁dukkhasacc aṃ ▁nuppajj ati ▁tassa ▁tattha ▁maggasaccaṃ ▁nuppajj issatīti
PA_ya_5.2.1:218.1_0	Yassa cittassa anantarā aggamaggaṁ paṭilabhissanti tassa cittassa bhaṅgakkhaṇe ye	▁yassa ▁cittassa ▁anantar ā ▁aggamagg aṃ ▁paṭilabhi ssa nti ▁tassa ▁cittassa ▁bhaṃgakkhaṇe ▁ye
PA_ya_5.2.1:218.1_1	caññe maggaṁ paṭilabhissanti tesaṁ cavantānaṁ pavatte cittassa bhaṅgakkhaṇe arūpe	▁ca ññ e ▁maggaṃ ▁paṭilabhi ssa nti ▁tesaṃ ▁cavantānaṃ ▁pavatt e ▁cittassa ▁bhaṃgakkhaṇe ▁arūp e
PA_ya_5.2.1:218.1_2	maggassa ca phalassa ca uppādakkhaṇe tesaṁ tattha dukkhasaccaṁ nuppajjati, no ca	▁magg assa ▁ca ▁phal assa ▁ca ▁uppādakkhaṇe ▁tesaṃ ▁tattha ▁dukkhasacc aṃ ▁nuppajj ati ▁no ▁ca
PA_ya_5.2.1:218.1_3	tesaṁ tattha maggasaccaṁ nuppajjissati. Aggamaggassa bhaṅgakkhaṇe arahantānaṁ cittassa	▁tesaṃ ▁tattha ▁maggasaccaṃ ▁nuppajj issati ▁aggamagg assa ▁bhaṃgakkhaṇe ▁arahant ānaṃ ▁cittassa
PA_ya_5.2.1:218.1_4	bhaṅgakkhaṇe āpāyikānaṁ ye ca puthujjanā maggaṁ na paṭilabhissanti tesaṁ cavantānaṁ	▁bhaṃgakkhaṇe ▁ ā pāy ikānaṃ ▁ye ▁ca ▁puthujjan ā ▁maggaṃ ▁na ▁paṭilabhi ssa nti ▁tesaṃ ▁cavantānaṃ
PA_ya_5.2.1:218.1_5	pavatte cittassa bhaṅgakkhaṇe asaññasattā cavantānaṁ arūpe aggamaggassa ca phalassa	▁pavatt e ▁cittassa ▁bhaṃgakkhaṇe ▁a saññ as attā ▁cavantānaṃ ▁arūp e ▁aggamagg assa ▁ca ▁phal assa
PA_ya_5.2.1:218.1_6	ca uppādakkhaṇe tesaṁ tattha dukkhasaccañca nuppajjati maggasaccañca nuppajjissati.	▁ca ▁uppādakkhaṇe ▁tesaṃ ▁tattha ▁dukkhasacc añca ▁nuppajj ati ▁magg a sacc añca ▁nuppajj issati
PA_ya_5.2.1:219.1	Yassa vā pana yattha maggasaccaṁ nuppajjissati tassa tattha dukkhasaccaṁ nuppajjatīti?	▁yassa ▁vā ▁pana ▁yattha ▁maggasaccaṃ ▁nuppajj issati ▁tassa ▁tattha ▁dukkhasacc aṃ ▁nuppajj atīti
PA_ya_5.2.1:220.1_0	Aggamaggassa uppādakkhaṇe arahantānaṁ cittassa uppādakkhaṇe āpāyikānaṁ ye ca puthujjanā	▁aggamagg assa ▁uppādakkhaṇe ▁arahant ānaṃ ▁cittassa ▁uppādakkhaṇe ▁ ā pāy ikānaṃ ▁ye ▁ca ▁puthujjan ā
PA_ya_5.2.1:220.1_1	maggaṁ na paṭilabhissanti tesaṁ upapajjantānaṁ pavatte cittassa uppādakkhaṇe asaññasattaṁ	▁maggaṃ ▁na ▁paṭilabhi ssa nti ▁tesaṃ ▁upapajjantānaṃ ▁pavatt e ▁cittassa ▁uppādakkhaṇe ▁as añña satt aṃ
PA_ya_5.2.1:220.1_2	upapajjantānaṁ tesaṁ tattha maggasaccaṁ nuppajjissati, no ca tesaṁ tattha dukkhasaccaṁ	▁upapajjantānaṃ ▁tesaṃ ▁tattha ▁maggasaccaṃ ▁nuppajj issati ▁no ▁ca ▁tesaṃ ▁tattha ▁dukkhasacc aṃ
PA_ya_5.2.1:220.1_3	nuppajjati. Aggamaggassa bhaṅgakkhaṇe arahantānaṁ cittassa bhaṅgakkhaṇe āpāyikānaṁ	▁nuppajj ati ▁aggamagg assa ▁bhaṃgakkhaṇe ▁arahant ānaṃ ▁cittassa ▁bhaṃgakkhaṇe ▁ ā pāy ikānaṃ
PA_ya_5.2.1:220.1_4	ye ca puthujjanā maggaṁ na paṭilabhissanti tesaṁ cavantānaṁ pavatte cittassa bhaṅgakkhaṇe	▁ye ▁ca ▁puthujjan ā ▁maggaṃ ▁na ▁paṭilabhi ssa nti ▁tesaṃ ▁cavantānaṃ ▁pavatt e ▁cittassa ▁bhaṃgakkhaṇe
PA_ya_5.2.1:220.1_5	arūpe aggamaggassa ca phalassa ca uppādakkhaṇe asaññasattā cavantānaṁ tesaṁ tattha	▁arūp e ▁aggamagg assa ▁ca ▁phal assa ▁ca ▁uppādakkhaṇe ▁a saññ as attā ▁cavantānaṃ ▁tesaṃ ▁tattha
PA_ya_5.2.1:220.1_6	maggasaccañca nuppajjissati dukkhasaccañca nuppajjati.	▁magg a sacc añca ▁nuppajj issati ▁dukkhasacc añca ▁nuppajj ati
PA_ya_5.2.1:221.1	Yassa yattha samudayasaccaṁ nuppajjati tassa tattha maggasaccaṁ nuppajjissatīti?	▁yassa ▁yattha ▁samudayasaccaṃ ▁nuppajj ati ▁tassa ▁tattha ▁maggasaccaṃ ▁nuppajj issatīti
PA_ya_5.2.1:222.1_0	Yassa cittassa anantarā aggamaggaṁ paṭilabhissanti ye caññe maggaṁ paṭilabhissanti	▁yassa ▁cittassa ▁anantar ā ▁aggamagg aṃ ▁paṭilabhi ssa nti ▁ye ▁ca ññ e ▁maggaṃ ▁paṭilabhi ssa nti
PA_ya_5.2.1:222.1_1	tesaṁ taṇhāya bhaṅgakkhaṇe taṇhāvippayuttacitte vattamāne tesaṁ tattha samudayasaccaṁ	▁tesaṃ ▁taṇhā ya ▁bhaṃgakkhaṇe ▁taṇhā vippayutt acitt e ▁vattamān e ▁tesaṃ ▁tattha ▁samudayasaccaṃ
PA_ya_5.2.1:222.1_2	nuppajjati, no ca tesaṁ tattha maggasaccaṁ nuppajjissati. Aggamaggasamaṅgīnaṁ arahantānaṁ,	▁nuppajj ati ▁no ▁ca ▁tesaṃ ▁tattha ▁maggasaccaṃ ▁nuppajj issati ▁aggamagg a samaṃgī naṃ ▁arahant ānaṃ
PA_ya_5.2.1:222.1_3	āpāyikānaṁ ye ca puthujjanā maggaṁ na paṭilabhissanti tesaṁ taṇhāya bhaṅgakkhaṇe	▁ ā pāy ikānaṃ ▁ye ▁ca ▁puthujjan ā ▁maggaṃ ▁na ▁paṭilabhi ssa nti ▁tesaṃ ▁taṇhā ya ▁bhaṃgakkhaṇe
PA_ya_5.2.1:222.1_4	taṇhāvippayuttacitte vattamāne asaññasattānaṁ tesaṁ tattha samudayasaccañca nuppajjati	▁taṇhā vippayutt acitt e ▁vattamān e ▁asaññasattānaṃ ▁tesaṃ ▁tattha ▁samuday a sacc añca ▁nuppajj ati
PA_ya_5.2.1:222.1_5	maggasaccañca nuppajjissati.	▁magg a sacc añca ▁nuppajj issati
PA_ya_5.2.1:223.1	Yassa vā pana yattha maggasaccaṁ nuppajjissati tassa tattha samudayasaccaṁ nuppajjatīti?	▁yassa ▁vā ▁pana ▁yattha ▁maggasaccaṃ ▁nuppajj issati ▁tassa ▁tattha ▁samudayasaccaṃ ▁nuppajj atīti
